input_text,target_text
6 April 2007,2007-04-06
30 tháng 8 năm 1997,1997-08-30
18/10-2021,2021-05-18
2025-02-12T07:39:26.577Z,2025-02-12
31 8 1995,1995-08-31
The system recorded 20190715081850,2019-07-15
2014_03_01T11_11_59-05:00,2014-03-01
16-7-2014,2014-07-16
30/20-1999,1999-10-30
1348592400000,2012-09-26
9 March 2003,2003-03-09
2031-06-15T19:26:11,2031-06-15
19980721090008415606,1998-07-21
20171007145401378,2017-10-07
21.10.2003,2003-10-21
11/18-2007,2007-09-11
3 tháng 10 năm 2032,2032-10-03
29.1.2031T8-4-29,2031-01-29
2016-07-28T23:45:44.619Z,2016-07-28
1889542800,2029-11-17
4 Feb 1997,1997-02-04
29.3.2006T9-6-44,2006-03-29
15 January 2035,2035-01-15
9/2/2023 giờ 23:38:34,2023-02-09
2026-12-06T09:01:37Z+3,2026-12-06
Event at 1992-06-15T11:54:31,1992-06-15
Ngày 6-5-2009,2009-05-06
20211221134815708754,2021-12-21
17.8.2005T14-46-4,2005-08-17
05-06-2000,2000-05-06
Sự kiện diễn ra vào 22/5/2028 7:26,2028-05-22
20020702100029336305248,2002-07-02
23/10-1995,1995-05-23
4 tháng 4 năm 1994,1994-04-04
2012-10-27T14:14:58.329778Z,2012-10-27
24.3.2010T21-31-56,2010-03-24
18 November 2008,2008-11-18
2025-08-26T23:55:01,2025-08-26
20061123180103547000217,2006-11-23
2023_12_28T3_29_20+2500,2023-12-28
1995-11-14T02:49:23,1995-11-14
The system recorded 20190527204043,2019-05-27
1164646800000000,2006-11-28
"May 21, 1998",1998-05-21
959533200,2000-05-29
"June 20, 2035",2035-06-20
2004-12-24T06:15:01.120273Z,2004-12-24
920307600000000,1999-03-02
15/16-2008,2008-08-15
ngày 9 tháng 6 năm 1993,1993-06-09
08_28_1990,1990-08-28
1995/5/8T03246,1995-05-08
2028/9/4T142027,2028-09-04
Ngày 7-1-2003,2003-01-07
2004-12-11T22:28:13.571566657Z,2004-12-11
17_11_2000,2000-11-17
6-6-2023,2023-06-06
10/28/2001,2001-10-28
6-1-2012,2012-01-03
2035-02-19T03:08:55,2035-02-19
2027-01-17T17:19:14.435Z,2027-01-17
2032-07-27T12:04:32+2500,2032-07-27
1597770000000000,2020-08-19
1573664400000000,2019-11-14
8 October 2028,2028-10-08
36-3-2026,2026-03-18
20140120204521,2014-01-20
Sự kiện diễn ra vào 16/8/1997 0:3,1997-08-16
28 11 03,2003-11-28
21.9.1993T13-30-44,1993-09-21
Event at 2000-12-14T18:57:19,2000-12-14
"19th of November, 2003",2003-11-19
20060503135620766669,2006-05-03
698864400000,1992-02-24
2007/06/23,2007-06-23
07/22/2034,2034-07-22
20090626165823,2009-06-26
19 March 1991,1991-03-19
882378000000000,1997-12-18
Sự kiện diễn ra vào 15/8/2016 20:20,2016-08-15
1994-05-17T15:50:03.495Z,1994-05-17
1994-01-21T06:22:56,1994-01-21
20220401003523094,2022-04-01
20 tháng 7 năm 2004,2004-07-20
The system recorded 20120326001657,2012-03-26
31/24-2014,2014-12-31
24.7.2030,2030-07-24
Event at 2030-09-05T6:21:59,2030-09-05
ngày 9 tháng 2 năm 2002,2002-02-09
20171102165321,2017-11-02
15/20-2030,2030-10-15
6-7-1999,1999-07-06
Event at 2009-06-22T13:10:3,2009-06-22
Sự kiện diễn ra vào 18/5/1997 3:2,1997-05-18
19 February 1991,1991-02-19
4 2 2026,2026-02-04
2019/9/23T13044,2019-09-23
42-10-2003,2003-10-21
20050719043627532,2005-07-19
2011-12-10T12:27:48Z+3,2011-12-10
2030-07-31,2030-07-31
21-1-2033,2033-01-21
2071328400,2035-08-22
12-06-09,2009-06-12
2003_10_09T8_30_16+07:00,2003-10-09
60-8-2024,2024-08-30
2014/3/22T8310,2014-03-22
10|06|2031,2031-10-06
2000/4/18T14445,2000-04-18
2005_11_09T22_53_35Z+3,2005-11-09
1859907600000000,2028-12-09
12 Mar 2007,2007-03-12
Event at 2025-05-17T3:5:9,2025-05-17
01|04|1995,1995-01-04
38-1-2017,2017-01-19
2022-08-01T17:27:41.276720473Z,2022-08-01
20130524053211838996166,2013-05-24
19930704091956,1993-07-04
20060731042000138327,2006-07-31
20250517180942,2025-05-17
19.1.2029T14-57-27,2029-01-19
2017_11_11T1_6_2-05:00,2017-11-11
10/12-2026,2026-06-10
12.09.30,2030-09-12
29|4|2018,2018-04-29
05/01/10,2010-01-05
2001-08-29T14:05:16Z+3,2001-08-29
02 02 34,2034-02-02
8-6-2015,2015-06-04
2005-07-25T00:23:32+2500,2005-07-25
15/03/06,2006-03-15
09_06_21,2021-06-09
1182877200000,2007-06-27
02.16.2001,2001-02-16
"7th of November, 1998",1998-11-07
20090521053808227,2009-05-21
1992-07-09T09:07:31Z+3,1992-07-09
2026/3/13T182742,2026-03-13
19/4-2027,2027-02-19
26-5-2019,2019-05-13
1999-08-19T06:45:56.609082372Z,1999-08-19
1 August 2004,2004-08-01
2000-04-03T04:37:51+2500,2000-04-03
2021_11_23T4_29_3+00:00,2021-11-23
The system recorded 20250526031856,2025-05-26
19970807054340817561677,1997-08-07
20140320135405,2014-03-20
2010-08-29T14:43:37Z+3,2010-08-29
"March 14, 2001",2001-03-14
20000329112934643411278,2000-03-29
16/8/2026 giờ 2:53:11,2026-08-16
The system recorded 19921020012948,1992-10-20
2032-11-25T02:14:50+0500,2032-11-25
20320824105308828421246,2032-08-24
30 Mar 1990,1990-03-30
2030-04-27T10:25:20,2030-04-27
1991/10/25T153824,1991-10-25
7|5|2033,2033-05-07
Ngày 2-4-2000,2000-04-02
23.10.2019T21-13-41,2019-10-23
Ngày 15-8-1993,1993-08-15
2008-10-30T15:06:44.921355851Z,2008-10-30
16-11-2014,2014-11-16
2011-03-23T22:46:36.046680697Z,2011-03-23
"February 5, 2021",2021-02-05
Event at 2013-06-17T3:9:21,2013-06-17
6/10/1990 giờ 17:34:22,1990-10-06
20190326091921,2019-03-26
2018-07-15T22:36:44+2500,2018-07-15
25/07/91,1991-07-25
Event at 1996-06-23T2:56:27,1996-06-23
5 tháng 9 năm 1991,1991-09-05
2021_03_22T11_58_27Z,2021-03-22
2005-12-13T01:38:18-05:00,2005-12-13
2018-10-01T15:43:58+2500,2018-10-01
20100722154634280,2010-07-22
"January 7, 1999",1999-01-07
20140518224632419765849,2014-05-18
17 tháng 10 năm 2024,2024-10-17
2002-08-02T14:30:23,2002-08-02
Ngày 16-12-2025,2025-12-16
2027_12_01,2027-12-01
16-4-2022,2022-04-16
2023-03-06T09:45:49,2023-03-06
ngày 13 tháng 4 năm 2012,2012-04-13
19960628150420577571,1996-06-28
9 tháng 2 năm 2010,2010-02-09
2006-03-30T16:35:28.538248682Z,2006-03-30
1249578000000000,2009-08-07
20110728200228083383555,2011-07-28
Sự kiện diễn ra vào 25/6/1993 8:39,1993-06-25
01_04_05,2005-04-01
2010-04-23T13:54:32-05:00,2010-04-23
12.03.2020,2020-12-03
1469034000000,2016-07-21
06|10|2032,2032-06-10
"August 25, 1998",1998-08-25
1577120400000000,2019-12-24
20090825020124623,2009-08-25
2012576400000,2033-10-11
2004/10/6T22321,2004-10-06
23 tháng 12 năm 2035,2035-12-23
The system recorded 19960529013838,1996-05-29
891882000,1998-04-07
24 tháng 3 năm 1993,1993-03-24
18/7/2019 giờ 11:34:25,2019-07-18
2034-01-29T01:16:39+07:00,2034-01-29
ngày 2 tháng 10 năm 2022,2022-10-02
1-8-2021,2021-08-01
1995901200,2033-04-01
2025-03-08T00:33:43Z,2025-03-08
Ngày 3-12-2004,2004-12-03
Event at 2015-06-30T3:50:5,2015-06-30
ngày 6 tháng 11 năm 2027,2027-11-06
1997-05-13T23:20:53.457Z,1997-05-13
05_18_2008,2008-05-18
2021/9/8T10219,2021-09-08
1998-07-13,1998-07-13
The system recorded 20250123115623,2025-01-23
2024-02-18T10:27:41.754Z,2024-02-18
2026-04-28T12:52:17,2026-04-28
13/7/2006 giờ 2:4:59,2006-07-13
20140212181815239,2014-02-12
2009/12/16T18284,2009-12-16
2028-12-06T05:49:51.335766Z,2028-12-06
1991-05-28T03:10:09Z+3,1991-05-28
14 Apr 2023,2023-04-14
2012-10-13T20:01:15.543448Z,2012-10-13
2026-06-06T21:51:04.369Z,2026-06-06
20040118011740837,2004-01-18
19920724121135602133118,1992-07-24
38-10-2009,2009-10-19
20050909002143951,2005-09-09
1992-01-10T17:16:25-0300,1992-01-10
17 January 1997,1997-01-17
2013-10-25T10:11:49Z+3,2013-10-25
20150915015151445288665,2015-09-15
20080723215138852280,2008-07-23
1554397200,2019-04-05
Ngày 31-1-2019,2019-01-31
The system recorded 20080517021316,2008-05-17
16.10.2017T7-41-35,2017-10-16
24-5-2033,2033-05-24
25 tháng 2 năm 2022,2022-02-25
Event at 1991-11-25T8:1:5,1991-11-25
29 April 1997,1997-04-29
12-6-2001,2001-06-06
17.12.2022T13-30-37,2022-12-17
Event at 2029-02-22T15:28:33,2029-02-22
2007-11-15T01:05:52Z+3,2007-11-15
Event at 2021-11-12T16:36:4,2021-11-12
1340298000000000,2012-06-22
31 tháng 3 năm 2032,2032-03-31
20280804074339355909,2028-08-04
16/04/08,2008-04-16
2001_06_22T2_17_17+00:00,2001-06-22
18/11/2034,2034-11-18
2002-06-21T23:20:04.157341424Z,2002-06-21
2032-01-19T10:33:26+00:00,2032-01-19
2024-06-10T14:14:27.315524Z,2024-06-10
"8th of March, 2030",2030-03-08
1621789200000000,2021-05-24
2032-10-26T07:03:35.858485770Z,2032-10-26
20.9.2032,2032-09-20
20150331113405811670900,2015-03-31
14 June 2018,2018-06-14
20 May 2033,2033-05-20
2005-12-26T02:40:59.427181Z,2005-12-26
19980306211620778867141,1998-03-06
"5th of April, 2021",2021-04-05
09.08.07,2007-08-09
28 Dec 2035,2035-12-28
Ngày 4-3-1995,1995-03-04
28/4/1996 giờ 5:3:26,1996-04-28
2/3/2028 giờ 22:13:27,2028-03-02
1991/5/2T10333,1991-05-02
"June 19, 1993",1993-06-19
1991-07-27T14:54:44+0500,1991-07-27
2014-03-28T05:25:36,2014-03-28
2004-10-10T02:32:31,2004-10-10
27/4/2006 giờ 1:47:39,2006-04-27
1034355600000000000,2002-10-12
18-1-2030,2030-01-09
2023-07-20T15:40:27+2500,2023-07-20
03 15 2028,2028-03-15
21/18-1992,1992-09-21
791571600000000000,1995-02-01
2018_08_28,2018-08-28
18.12.2016T16-38-49,2016-12-18
"July 20, 2027",2027-07-20
2024-09-23T15:28:29+2500,2024-09-23
ngày 20 tháng 3 năm 1994,1994-03-20
7/12-2007,2007-06-07
1997-05-02T11:06:56,1997-05-02
19980330014002267,1998-03-30
ngày 5 tháng 10 năm 1993,1993-10-05
Ngày 3-7-2018,2018-07-03
20030330065923462489119,2003-03-30
1990/3/2T17043,1990-03-02
1993 05 21,1993-05-21
2002-03-18T16:12:48+2500,2002-03-18
20200312181126,2020-03-12
2033-11-23T04:00:27Z+3,2033-11-23
8/12/2020 giờ 4:14:51,2020-12-08
20020814023009986773304,2002-08-14
1090170000,2004-07-19
20160402011501740,2016-04-02
1-5-1996,1996-05-01
The system recorded 20190529075802,2019-05-29
20/6-2030,2030-03-20
2027-07-31T15:39:47.504951172Z,2027-07-31
1998-11-03T17:56:45Z+3,1998-11-03
1090083600,2004-07-18
28-8-1991,1991-08-28
2027_02_14T23_34_37-05:00,2027-02-14
Event at 2014-09-23T15:33:42,2014-09-23
20280306003154378,2028-03-06
"June 13, 2033",2033-06-13
1888074000,2029-10-31
ngày 27 tháng 6 năm 2021,2021-06-27
2019-03-05T23:48:20Z+3,2019-03-05
Event at 1999-10-14T23:59:28,1999-10-14
Ngày 28-4-2008,2008-04-28
Sự kiện diễn ra vào 11/3/2013 22:39,2013-03-11
20030401234218579,2003-04-01
12 May 1994,1994-05-12
20260802051621424079,2026-08-02
ngày 28 tháng 6 năm 1991,1991-06-28
"15th of January, 2007",2007-01-15
19930407152804,1993-04-07
15 tháng 12 năm 2012,2012-12-15
760640400000000,1994-02-08
05_11_26,2026-11-05
20050301163228300715,2005-03-01
09 09 2003,2003-09-09
20 June 2015,2015-06-20
09/29/2011,2011-09-29
"December 31, 2006",2006-12-31
Event at 2007-05-23T7:59:23,2007-05-23
2075130000,2035-10-05
1999/3/20T5529,1999-03-20
28-3-2028,2028-03-28
1544893200,2018-12-16
27/1/2025 giờ 19:36:29,2025-01-27
"27th of April, 2030",2030-04-27
1562605200000,2019-07-09
2001_04_23T3_40_23+00:00,2001-04-23
The system recorded 20151102055447,2015-11-02
2013-08-19T02:23:34+2500,2013-08-19
2009-10-10T08:05:38.077988657Z,2009-10-10
20200502055640761546539,2020-05-02
22.1.2005T1-43-54,2005-01-22
2028-06-18T09:49:14.448351Z,2028-06-18
19 tháng 7 năm 2016,2016-07-19
22-12-2029,2029-12-11
2017_11_24T9_56_26+08,2017-11-24
2000/08/15,2000-08-15
19931124161353450,1993-11-24
13 tháng 7 năm 2009,2009-07-13
ngày 27 tháng 6 năm 1994,1994-06-27
The system recorded 19961102050825,1996-11-02
Ngày 19-7-1992,1992-07-19
Ngày 26-4-2024,2024-04-26
2012-11-25T13:14:55.530557Z,2012-11-25
The system recorded 20350213015307,2035-02-13
20090320120932,2009-03-20
2000/6/18T135957,2000-06-18
25 Jan 2009,2009-01-25
2008/8/1T18428,2008-08-01
2005-09-06T21:34:09,2005-09-06
20040303012231571,2004-03-03
The system recorded 20281007064830,2028-10-07
2026-09-18T22:23:33.106450987Z,2026-09-18
"December 13, 1992",1992-12-13
Event at 2007-03-07T17:46:6,2007-03-07
25/18-2011,2011-09-25
1333990800,2012-04-10
Ngày 24-6-2034,2034-06-24
1788973200000000000,2026-09-10
2002-07-15T17:56:05-0300,2002-07-15
Event at 1990-02-05T9:5:32,1990-02-05
"April 9, 2031",2031-04-09
1128445200,2005-10-05
20340522111833821177535,2034-05-22
30/8/2032,2032-08-30
2032-11-08T06:01:43Z+3,2032-11-08
25/14-2026,2026-07-25
2027-02-08T20:05:24.629Z,2027-02-08
1071334800,2003-12-14
22_6_1994,1994-06-22
2011-05-14T02:12:24Z+3,2011-05-14
ngày 12 tháng 1 năm 2012,2012-01-12
ngày 10 tháng 1 năm 2018,2018-01-10
ngày 5 tháng 2 năm 2001,2001-02-05
2001-11-13,2001-11-13
2029-06-19T00:42:10.472404Z,2029-06-19
24 11 2015,2015-11-24
2/1/1998 giờ 23:22:39,1998-01-02
20080715174646,2008-07-15
1556730000,2019-05-02
27.7.2013T16-38-23,2013-07-27
922294800000000,1999-03-25
18.11.2019T5-51-41,2019-11-18
6-6-1990,1990-06-03
2033-01-23T02:31:15.897001207Z,2033-01-23
2018365200000000,2033-12-17
Event at 2020-08-14T5:24:19,2020-08-14
1996 12 04,1996-12-04
1994-01-30T19:47:21.250Z,1994-01-30
20/8/2022 giờ 18:27:20,2022-08-20
20120406151626185,2012-04-06
Sự kiện diễn ra vào 27/9/2007 15:51,2007-09-27
10_03_2024,2024-10-03
"3rd of March, 1996",1996-03-03
8 June 2029,2029-06-08
2012 07 15,2012-07-15
2025|11|08,2025-11-08
20120607074437,2012-06-07
2018-09-18T06:20:48+2500,2018-09-18
"14th of November, 2030",2030-11-14
2030-09-16T08:08:35Z+3,2030-09-16
1306256400,2011-05-25
20001022030134004820,2000-10-22
2033-04-06T20:25:38.494154Z,2033-04-06
642618000000000000,1990-05-14
ngày 30 tháng 4 năm 2016,2016-04-30
"September 16, 2001",2001-09-16
2022-01-31T05:20:02.971207Z,2022-01-31
1058806800000,2003-07-22
ngày 22 tháng 10 năm 1999,1999-10-22
Sự kiện diễn ra vào 3/12/2020 7:43,2020-12-03
2014-07-04T01:18:36.594680680Z,2014-07-04
14/20-2029,2029-10-14
2011-02-21,2011-02-21
737571600000000000,1993-05-17
"July 26, 1997",1997-07-26
ngày 30 tháng 8 năm 2021,2021-08-30
2015-05-30T20:53:50.474730290Z,2015-05-30
2015-11-16T00:55:01,2015-11-16
2003/1/28T14577,2003-01-28
2006-07-19T02:27:13Z+3,2006-07-19
13 tháng 10 năm 2020,2020-10-13
20010620203040,2001-06-20
1036774800000,2002-11-09
2014-11-19T04:31:27+2500,2014-11-19
2031-07-17T00:45:50+00:00,2031-07-17
28-4-2021,2021-04-28
"October 8, 2005",2005-10-08
Event at 2008-03-19T3:38:46,2008-03-19
2016-12-16T19:55:19.006789Z,2016-12-16
1223571600,2008-10-10
893523600000000000,1998-04-26
2021-06-29,2021-06-29
20280905024110,2028-09-05
20330411181301584829,2033-04-11
2012-10-31T15:51:52+2500,2012-10-31
18/2-2034,2034-01-18
Ngày 8-8-2024,2024-08-08
"May 5, 2035",2035-05-05
1027530000,2002-07-25
1289926800000000000,2010-11-17
03.21.2035,2035-03-21
19990222134716027239,1999-02-22
ngày 23 tháng 12 năm 2033,2033-12-23
1998-09-27T08:25:02,1998-09-27
2033-11-19T13:02:13.893Z,2033-11-19
The system recorded 20120108075344,2012-01-08
The system recorded 20080203104606,2008-02-03
22 07 91,1991-07-22
4 9 2019,2019-09-04
"6th of November, 2010",2010-11-06
2024-07-19T16:29:00.829Z,2024-07-19
2025/2/15T71038,2025-02-15
25-8-1990,1990-08-25
"June 13, 2035",2035-06-13
2013-04-28T03:22:12+2500,2013-04-28
ngày 21 tháng 8 năm 1990,1990-08-21
28.12.00,2000-12-28
09|19|2017,2017-09-19
4 Sep 2025,2025-09-04
1997|09|09,1997-09-09
Ngày 13-8-1994,1994-08-13
11.10.2029T20-34-19,2029-10-11
20040918162104629269650,2004-09-18
2031-09-24T09:24:02.961020164Z,2031-09-24
2011/2/22T81042,2011-02-22
1-1-1995,1995-01-01
2021-07-08T16:01:10-05:00,2021-07-08
2018-11-11T00:22:44+2500,2018-11-11
20_11_92,1992-11-20
Event at 2012-11-25T13:18:31,2012-11-25
Sự kiện diễn ra vào 4/7/2010 22:22,2010-07-04
12.12.2009,2009-12-12
1675357200000000,2023-02-03
ngày 5 tháng 3 năm 2022,2022-03-05
12/10/2016 giờ 0:37:33,2016-10-12
2023-03-02T18:47:20.378160974Z,2023-03-02
1173718800000,2007-03-13
22.11.2001,2001-11-22
15/2/2014 giờ 19:55:7,2014-02-15
6/12-2034,2034-06-06
1854550800000,2028-10-08
9.1.2010T18-44-23,2010-01-09
1587315600,2020-04-20
2021/06/28,2021-06-28
2010-06-03T12:46:17,2010-06-03
21 05 28,2028-05-21
23-9-2020,2020-09-23
20200821164109072,2020-08-21
686422800000,1991-10-03
The system recorded 20240621215216,2024-06-21
2011-01-13T02:43:05,2011-01-13
6-9-2021,2021-09-06
20190909084955571375714,2019-09-09
10-20-2012,2012-10-20
699123600000000000,1992-02-27
Ngày 23-3-1998,1998-03-23
19940510015745753890399,1994-05-10
1993-07-30T19:46:57,1993-07-30
2021-12-30T01:09:18,2021-12-30
2020-11-10T16:50:27+2500,2020-11-10
2012-06-28T06:44:42+0500,2012-06-28
06/16/2023,2023-06-16
1276966800,2010-06-20
1994-06-11T17:47:35Z+3,1994-06-11
19940110051724468068009,1994-01-10
1991|09|22,1991-09-22
6/22-2027,2027-11-06
2013-02-25T00:47:10,2013-02-25
7-2-2002,2002-02-07
"9th of September, 2005",2005-09-09
01.02.05,2005-02-01
22.12.2022T4-59-8,2022-12-22
2001/11/30T151555,2001-11-30
2015-01-02T10:45:43Z+3,2015-01-02
1610989200000000,2021-01-19
Event at 2017-03-13T13:39:19,2017-03-13
2020/11/11T161651,2020-11-11
2000-01-23T17:40:47,2000-01-23
"July 17, 2014",2014-07-17
2023_07_09T4_5_27+08,2023-07-09
1664902800000000,2022-10-05
The system recorded 20030501083513,2003-05-01
15-12-2006,2006-12-15
Ngày 28-3-2001,2001-03-28
Event at 2021-11-14T13:50:19,2021-11-14
Event at 1998-10-07T15:32:4,1998-10-07
22 tháng 9 năm 2023,2023-09-22
2010-02-20T17:01:49.060Z,2010-02-20
18-10-1993,1993-10-09
20150311125225812895268,2015-03-11
1993-11-26T04:57:19.103462757Z,1993-11-26
10 January 2029,2029-01-10
The system recorded 20180228205013,2018-02-28
19/20-1991,1991-10-19
1276880400,2010-06-19
12 tháng 1 năm 2005,2005-01-12
2029-07-03T15:58:25.705953028Z,2029-07-03
2019-05-10T22:40:42Z+3,2019-05-10
1402506000,2014-06-12
2006-09-14T11:10:48Z+3,2006-09-14
"24th of March, 2022",2022-03-24
Sự kiện diễn ra vào 31/3/2002 4:16,2002-03-31
2008_08_07T20_46_5-0300,2008-08-07
2019_09_16T9_4_22Z+3,2019-09-16
22 tháng 4 năm 1999,1999-04-22
"September 16, 2029",2029-09-16
2019-10-18T09:09:57.985810Z,2019-10-18
1608138000000000000,2020-12-17
2018-03-01T00:03:23.843623583Z,2018-03-01
5 tháng 5 năm 2011,2011-05-05
1992-01-01T19:19:33Z+3,1992-01-01
16/22-2001,2001-11-16
20321229040415553998,2032-12-29
637779600000,1990-03-19
19930709080416733095,1993-07-09
20261124203824965,2026-11-24
2023-04-17T12:13:59.278Z,2023-04-17
14-3-2029,2029-03-14
2062342800000000000,2035-05-10
874947600000,1997-09-23
2004-07-15T01:46:37.851Z,2004-07-15
"6th of February, 1992",1992-02-06
15/10/2004 giờ 1:39:12,2004-10-15
2028-07-08T15:53:18.354Z,2028-07-08
20320512105226453,2032-05-12
"October 13, 1999",1999-10-13
"25th of December, 2032",2032-12-25
"13th of January, 2032",2032-01-13
1991-08-06T12:22:36+0500,1991-08-06
23.8.2016T8-24-42,2016-08-23
30.9.2032,2032-09-30
Event at 1993-09-10T18:10:18,1993-09-10
16/2/2001 giờ 21:22:43,2001-02-16
2031-05-26T17:20:22,2031-05-26
1992-12-26T23:07:54.909831Z,1992-12-26
1902416400000,2030-04-15
2013|06|05,2013-06-05
31/5/2035 giờ 1:22:20,2035-05-31
18 Aug 2008,2008-08-18
19970625012238594241658,1997-06-25
21 tháng 9 năm 2006,2006-09-21
1829149200000,2027-12-19
20320929204708638833923,2032-09-29
846262800000000000,1996-10-26
2003_11_04,2003-11-04
12 tháng 2 năm 1992,1992-02-12
2079450000,2035-11-24
1181235600000000000,2007-06-08
8-2-2017,2017-02-08
2005-12-25T03:00:23Z+3,2005-12-25
2027-11-01T22:22:42,2027-11-01
2022-10-25T14:37:35.475099887Z,2022-10-25
ngày 23 tháng 11 năm 2022,2022-11-23
2020-10-02T01:42:19+2500,2020-10-02
669834000000,1991-03-25
1993_04_12,1993-04-12
"October 25, 2030",2030-10-25
2030-04-12T22:18:49,2030-04-12
2024 09 30,2024-09-30
2029-12-14T08:24:52Z+3,2029-12-14
2028/12/02,2028-12-02
Sự kiện diễn ra vào 13/12/2011 14:25,2011-12-13
20051219162241293906,2005-12-19
2001-05-19T02:15:35+2500,2001-05-19
2016-04-06T12:49:19+2500,2016-04-06
30 November 2034,2034-11-30
2032-02-12T17:46:29.481289179Z,2032-02-12
2005-12-22T13:28:28.237495006Z,2005-12-22
28_10_2019,2019-10-28
24/9/2010 giờ 3:3:28,2010-09-24
1990/1/14T62041,1990-01-14
2-11-2005,2005-11-02
13 May 2005,2005-05-13
20210204152929502,2021-02-04
Event at 2026-03-31T9:37:18,2026-03-31
1819040400,2027-08-24
2031-07-21T16:16:17Z+3,2031-07-21
11-30-1993,1993-11-30
2017-10-16T16:10:10.117824Z,2017-10-16
20130214021808119151257,2013-02-14
20220228022823131,2022-02-28
12 tháng 11 năm 2006,2006-11-12
15/6/1994 giờ 22:44:11,1994-06-15
2010-06-20T01:56:18,2010-06-20
21 April 1992,1992-04-21
"18th of March, 2000",2000-03-18
20240624130643074058098,2024-06-24
Event at 2001-10-04T1:42:27,2001-10-04
15 Apr 1993,1993-04-15
2027/2/28T53231,2027-02-28
2020_06_10T7_47_15-0330,2020-06-10
10 December 2017,2017-12-10
The system recorded 20040824082539,2004-08-24
05|23|2026,2026-05-23
"8th of August, 2025",2025-08-08
1992-06-09T12:13:17+2500,1992-06-09
20080709035714,2008-07-09
19990317101819421616,1999-03-17
"January 20, 2007",2007-01-20
20250515092127043365,2025-05-15
2030/6/16T11512,2030-06-16
1181235600000000,2007-06-08
20050201213939,2005-02-01
Event at 2034-08-29T8:39:21,2034-08-29
"April 3, 2016",2016-04-03
20160713132232614227093,2016-07-13
23/12/1999 giờ 0:23:27,1999-12-23
03_24_1992,1992-03-24
19930916095112104884,1993-09-16
15 Mar 2027,2027-03-15
20351217003156,2035-12-17
18 February 1999,1999-02-18
2033-05-10T23:16:02.075Z,2033-05-10
2029-08-04,2029-08-04
20 December 2034,2034-12-20
"May 31, 1992",1992-05-31
29.9.2030,2030-09-29
25.10.2000T10-5-10,2000-10-25
"February 7, 2015",2015-02-07
1583773200000,2020-03-10
12.17.1998,1998-12-17
20011016060957,2001-10-16
Event at 1995-07-15T22:51:37,1995-07-15
2027-09-28T22:21:29.179429989Z,2027-09-28
ngày 21 tháng 8 năm 2018,2018-08-21
1965574800000,2032-04-15
2016_06_03T20_55_9-0330,2016-06-03
1997-10-04T20:26:36-05:00,1997-10-04
ngày 20 tháng 6 năm 2011,2011-06-20
1/18-1996,1996-09-01
"26th of May, 1994",1994-05-26
2021-01-15T06:42:51.282Z,2021-01-15
20350708200952157,2035-07-08
"September 10, 1999",1999-09-10
26/5/1990 giờ 4:26:9,1990-05-26
58-11-2033,2033-11-29
19920627000015,1992-06-27
2004-08-19T15:04:05+07:00,2004-08-19
18/2/2028 giờ 3:23:59,2028-02-18
21-4-2003,2003-04-21
1 tháng 4 năm 2014,2014-04-01
29 June 2027,2027-06-29
2002-02-18T04:10:18.645893Z,2002-02-18
32-8-2005,2005-08-16
1993-06-10T02:43:40.275649772Z,1993-06-10
1999-03-31T18:27:42Z+3,1999-03-31
16.7.2006T21-46-36,2006-07-16
1377709200000,2013-08-29
23 tháng 6 năm 1993,1993-06-23
20281211204831582899,2028-12-11
2/2/2024 giờ 11:6:7,2024-02-02
2014-04-07T03:28:31.252533Z,2014-04-07
30-3-2009,2009-03-15
13-5-2026,2026-05-13
26/16-2014,2014-08-26
1995-03-10T14:40:58Z+3,1995-03-10
ngày 28 tháng 9 năm 2023,2023-09-28
2022 09 16,2022-09-16
Ngày 10-1-2021,2021-01-10
6.9.2034T5-54-41,2034-09-06
27/7/2009 giờ 0:49:41,2009-07-27
5 12 2012,2012-12-05
Sự kiện diễn ra vào 18/12/1998 18:31,1998-12-18
22 tháng 11 năm 2033,2033-11-22
2020-05-13T22:41:52.673015838Z,2020-05-13
"7th of February, 2015",2015-02-07
2.10.2018T22-10-48,2018-10-02
15 11 94,1994-11-15
Sự kiện diễn ra vào 13/12/2008 16:51,2008-12-13
2007-05-20T12:14:17+00:00,2007-05-20
28.2.2014T8-43-32,2014-02-28
20211212041213,2021-12-12
13 tháng 7 năm 2010,2010-07-13
2022_06_15T3_11_14+00:00,2022-06-15
11_10_27,2027-10-11
1230310800000000000,2008-12-27
Event at 2005-09-24T9:31:24,2005-09-24
The system recorded 19900101155845,1990-01-01
20261010100615885,2026-10-10
Ngày 25-10-1994,1994-10-25
1-2-1999,1999-02-01
2008-01-16T11:39:11Z+3,2008-01-16
The system recorded 20170615035032,2017-06-15
03-28-2034,2034-03-28
1993_01_26T13_27_33+0500,1993-01-26
2024-05-10T02:45:28.432802Z,2024-05-10
2024/10/6T14167,2024-10-06
ngày 28 tháng 5 năm 2003,2003-05-28
11/17/2015,2015-11-17
11 January 2001,2001-01-11
Event at 2021-12-02T4:7:12,2021-12-02
2 tháng 9 năm 2030,2030-09-02
2024-05-11T04:43:06,2024-05-11
28.6.2031T23-47-40,2031-06-28
19911116003350,1991-11-16
12/05/92,1992-05-12
1707498000000000000,2024-02-10
Ngày 21-4-1990,1990-04-21
2004/12/17,2004-12-17
2014-11-15T05:43:59-05:00,2014-11-15
10 tháng 12 năm 2026,2026-12-10
9 Sep 1992,1992-09-09
2028-08-12T14:26:05+2500,2028-08-12
1994-03-14T22:06:11+00:00,1994-03-14
1996-05-24T18:58:35+2500,1996-05-24
Ngày 17-6-2034,2034-06-17
1996-04-01T21:14:08.193917Z,1996-04-01
ngày 9 tháng 8 năm 2001,2001-08-09
20100430193949411569033,2010-04-30
2010-11-20T20:32:45Z+3,2010-11-20
2016-02-11T22:41:43-05:00,2016-02-11
"September 6, 1999",1999-09-06
2030-10-23T15:16:37.886393931Z,2030-10-23
2007-11-25T03:07:23.652875Z,2007-11-25
Event at 1994-07-11T14:50:39,1994-07-11
ngày 6 tháng 4 năm 1992,1992-04-06
"April 22, 2027",2027-04-22
2025-04-18T15:10:13+2500,2025-04-18
5.2.2013T4-29-48,2013-02-05
3.2.2019T8-39-46,2019-02-03
"December 17, 2019",2019-12-17
The system recorded 20261205071201,2026-12-05
2012_07_17,2012-07-17
The system recorded 20231113183438,2023-11-13
The system recorded 20101204223030,2010-12-04
2019-02-20T18:11:21.911624Z,2019-02-20
2033|12|16,2033-12-16
1798736400000000000,2027-01-01
2003-06-11T22:03:09.711598Z,2003-06-11
20140927022245662,2014-09-27
2018_02_18T20_57_17+00:00,2018-02-18
1995-01-14T15:38:48,1995-01-14
2032-06-17T14:55:37.498277Z,2032-06-17
1992-01-12,1992-01-12
28-6-1992,1992-06-28
ngày 27 tháng 3 năm 2016,2016-03-27
"January 7, 2028",2028-01-07
20331212105006164664477,2033-12-12
2011-07-07T16:35:13.353Z,2011-07-07
2029-04-16T13:26:21.961053Z,2029-04-16
30.7.2035T5-49-31,2035-07-30
1996_03_06T13_5_2+2500,1996-03-06
2019-09-21T13:38:17Z+3,2019-09-21
1292173200000,2010-12-13
1765040400000000000,2025-12-07
1990-10-06T10:30:02Z+3,1990-10-06
2005_10_02T9_18_47-0300,2005-10-02
11 tháng 1 năm 2022,2022-01-11
752000400000,1993-10-31
2022-02-19T12:09:01,2022-02-19
4 tháng 7 năm 2013,2013-07-04
2016-06-21T06:35:24Z+3,2016-06-21
2018-02-05T16:00:21.303Z,2018-02-05
Sự kiện diễn ra vào 9/6/2011 16:25,2011-06-09
1068483600000000000,2003-11-11
15.12.05,2005-12-15
Ngày 31-3-2021,2021-03-31
2012-05-12T16:20:20,2012-05-12
2030-01-27,2030-01-27
"January 29, 2002",2002-01-29
02|17|2027,2027-02-17
"5th of August, 2024",2024-08-05
2015-02-21T21:30:37Z+3,2015-02-21
31|8|2020,2020-08-31
12/01/33,2033-01-12
12-3-2027,2027-03-12
The system recorded 20051212033358,2005-12-12
11.18.2016,2016-11-18
2002.10.16,2002-10-16
2/2/2003 giờ 0:4:17,2003-02-02
1999_08_05T8_34_10Z+3,1999-08-05
ngày 21 tháng 5 năm 1992,1992-05-21
ngày 30 tháng 1 năm 2026,2026-01-30
2-1-2027,2027-01-02
2005-04-09T11:22:12.311891710Z,2005-04-09
"April 3, 2003",2003-04-03
Ngày 10-6-2028,2028-06-10
2030-02-04T13:15:47.773103479Z,2030-02-04
The system recorded 20330714103555,2033-07-14
1991-01-24T00:38:08,1991-01-24
6 Jun 2032,2032-06-06
The system recorded 20111201230652,2011-12-01
05 27 2032,2032-05-27
880131600000,1997-11-22
29.05.90,1990-05-29
ngày 27 tháng 3 năm 2011,2011-03-27
38-5-2023,2023-05-19
1-1-2032,2032-01-01
"April 1, 2009",2009-04-01
9/14-2023,2023-07-09
1992-10-12T00:37:04.068336Z,1992-10-12
2026-07-12T20:34:03.432383776Z,2026-07-12
2001-03-19T03:22:44,2001-03-19
1021482000000,2002-05-16
04-10-2035,2035-04-10
10|11|98,1998-11-10
The system recorded 20010818144117,2001-08-18
Ngày 24-1-2013,2013-01-24
Event at 2019-11-05T10:41:58,2019-11-05
ngày 23 tháng 7 năm 1997,1997-07-23
2017.09.26,2017-09-26
1374944400,2013-07-28
"15th of December, 1999",1999-12-15
11-03-24,2024-03-11
21|04|34,2034-04-21
20160129145717304587,2016-01-29
9|2|2021,2021-02-09
1990-08-24T13:00:07.300575376Z,1990-08-24
2011|03|12,2011-03-12
2028_07_15T11_8_48-0300,2028-07-15
12/16-1993,1993-08-12
The system recorded 20111216113135,2011-12-16
2004-07-10T12:09:28.440Z,2004-07-10
1996-11-06T01:44:43.422Z,1996-11-06
Ngày 24-3-2019,2019-03-24
6 tháng 1 năm 2011,2011-01-06
2032/7/13T22557,2032-07-13
2034-02-20T13:22:13.885542656Z,2034-02-20
20000214113407957787907,2000-02-14
"26th of January, 2033",2033-01-26
2024-08-17T12:00:17+2500,2024-08-17
The system recorded 20030909105205,2003-09-09
28-7-1996,1996-07-14
20181228150100156135,2018-12-28
20220312101951067,2022-03-12
9/22-2027,2027-11-09
1996_06_03T15_33_18+07:00,1996-06-03
05_11_30,2030-11-05
27.5.2018T4-11-45,2018-05-27
2034 07 01,2034-07-01
1991-02-13T12:44:45+2500,1991-02-13
2022-07-07T19:44:22+2500,2022-07-07
12/07/2025,2025-12-07
The system recorded 20320223155709,2032-02-23
863370000000,1997-05-12
13.06.25,2025-06-13
02-07-1999,1999-02-07
18 August 2026,2026-08-18
2035-01-12T11:08:13.827Z,2035-01-12
The system recorded 20160423095656,2016-04-23
23/12/2024 giờ 12:8:34,2024-12-23
Event at 1994-10-03T10:14:50,1994-10-03
10/5/2000,2000-05-10
Sự kiện diễn ra vào 4/11/1993 15:21,1993-11-04
Event at 2026-04-15T23:55:35,2026-04-15
20181208153623518,2018-12-08
2007/05/11,2007-05-11
1994-09-23T17:44:00+2500,1994-09-23
2017-01-24T23:57:24+2500,2017-01-24
Sự kiện diễn ra vào 9/5/1992 19:31,1992-05-09
"February 19, 2003",2003-02-19
Sự kiện diễn ra vào 7/12/2024 2:45,2024-12-07
2028-03-06T01:05:38.298555Z,2028-03-06
27/4-1997,1997-02-27
"January 19, 2015",2015-01-19
10|12|2021,2021-12-10
12 October 2032,2032-10-12
2010/9/19T14230,2010-09-19
"August 20, 2011",2011-08-20
13 Jan 2023,2023-01-13
2.5.2035T23-21-45,2035-05-02
Event at 2035-07-14T15:14:47,2035-07-14
Event at 1990-03-05T23:55:14,1990-03-05
2010-02-03T20:28:50.098990Z,2010-02-03
"18th of February, 2029",2029-02-18
Sự kiện diễn ra vào 25/5/2013 11:58,2013-05-25
12.9.2032T15-2-31,2032-09-12
13 Aug 2032,2032-08-13
40-8-2023,2023-08-20
ngày 14 tháng 2 năm 2020,2020-02-14
23 Nov 1991,1991-11-23
The system recorded 19960506224839,1996-05-06
1829235600000,2027-12-20
ngày 30 tháng 9 năm 2031,2031-09-30
The system recorded 20091219002638,2009-12-19
23-3-2027,2027-03-23
1999-06-01T09:53:48Z+3,1999-06-01
17/14-2018,2018-07-17
19990104163749,1999-01-04
2020-06-10T05:02:18,2020-06-10
02_13_2006,2006-02-13
2009-12-18T19:11:27Z+3,2009-12-18
17_07_19,2019-07-17
10-9-1997,1997-09-10
18/11/2002 giờ 16:17:29,2002-11-18
2026-12-13T13:55:25.165408Z,2026-12-13
1211562000000000,2008-05-24
The system recorded 20291220093539,2029-12-20
22_1_1991,1991-01-22
1235926800000000,2009-03-02
25-06-25,2025-06-25
06-07-24,2024-07-06
22-8-2025,2025-08-22
2056381200000000,2035-03-02
ngày 4 tháng 10 năm 2030,2030-10-04
2007-03-15T21:07:08.474440Z,2007-03-15
1998-12-11T00:10:51.766771500Z,1998-12-11
853088400000,1997-01-13
2010-06-07T16:07:04+2500,2010-06-07
2004/3/7T112048,2004-03-07
ngày 20 tháng 1 năm 2010,2010-01-20
ngày 21 tháng 6 năm 2000,2000-06-21
2019-05-07T12:02:58.622Z,2019-05-07
13/12/2027 giờ 11:37:25,2027-12-13
17-9-1991,1991-09-17
36-12-2016,2016-12-18
2028-07-30T06:40:16.282548Z,2028-07-30
2019_12_31T5_53_59+3,2019-12-31
2011_12_30T5_1_21-05:00,2011-12-30
50-2-2027,2027-02-25
Sự kiện diễn ra vào 12/7/2004 12:25,2004-07-12
ngày 28 tháng 1 năm 2016,2016-01-28
10-1-1998,1998-01-05
The system recorded 20310906163253,2031-09-06
26.08.97,1997-08-26
15 tháng 2 năm 2007,2007-02-15
6 tháng 12 năm 2007,2007-12-06
20270928221233559087,2027-09-28
12 August 2030,2030-08-12
743101200000,1993-07-20
44-9-2015,2015-09-22
The system recorded 19970710151328,1997-07-10
Ngày 4-2-1996,1996-02-04
20221009112117152,2022-10-09
1993/2/26T5496,1993-02-26
7 Jan 2025,2025-01-07
1999-01-23T06:19:46.272623247Z,1999-01-23
31.12.2005T15-29-28,2005-12-31
2013/1/3T11951,2013-01-03
1741453200000000,2025-03-09
1172941200000,2007-03-04
20080708111130218647,2008-07-08
4-12-1996,1996-12-04
2004-04-01T17:56:48.601980704Z,2004-04-01
1055696400000000000,2003-06-16
2010-02-06T01:03:47,2010-02-06
2002-05-20T17:18:15+2500,2002-05-20
2025-07-22T04:58:29+2500,2025-07-22
15/10/2029 giờ 22:17:11,2029-10-15
1991-05-13T21:56:47+2500,1991-05-13
1995 11 26,1995-11-26
6|11|2025,2025-11-06
"8th of December, 2030",2030-12-08
2027-08-27T20:44:46.718691Z,2027-08-27
2035-10-04T12:22:32Z+3,2035-10-04
27-8-2031,2031-08-27
20120203172427312409,2012-02-03
05-17-1991,1991-05-17
20041115162601035,2004-11-15
29 August 2034,2034-08-29
"5th of May, 2007",2007-05-05
1998-07-29T16:58:49.115Z,1998-07-29
14 tháng 1 năm 2011,2011-01-14
1999-11-11T09:41:42.393269805Z,1999-11-11
1573750800000000,2019-11-15
17|01|26,2026-01-17
"September 6, 2027",2027-09-06
2024-12-23T17:24:36.124Z,2024-12-23
2009 06 05,2009-06-05
13 6 2013,2013-06-13
The system recorded 20050122085015,2005-01-22
Sự kiện diễn ra vào 5/8/2008 6:6,2008-08-05
19931116040015070501,1993-11-16
26.6.1994,1994-06-26
26.1.2029T0-41-50,2029-01-26
"June 24, 2002",2002-06-24
2030/05/06,2030-05-06
2-3-2002,2002-03-02
"June 10, 2016",2016-06-10
28/08/96,1996-08-28
1993-05-01T08:47:01+2500,1993-05-01
23.3.2023T20-57-44,2023-03-23
38-9-1996,1996-09-19
31 tháng 10 năm 1999,1999-10-31
1990_06_19,1990-06-19
2.2.2024,2024-02-02
1447693200000000000,2015-11-17
20310501100253300,2031-05-01
1/14-1999,1999-07-01
3/3/2002 giờ 17:51:50,2002-03-03
16|09|20,2020-09-16
20181227163518,2018-12-27
1990-07-12T04:01:00Z+3,1990-07-12
1994_08_10T8_55_22-0330,1994-08-10
5-9-2010,2010-09-05
29/7/1991 giờ 7:22:51,1991-07-29
20251005114126859522458,2025-10-05
2051024400,2034-12-30
20340904044216218903081,2034-09-04
11 Dec 1994,1994-12-11
27 tháng 5 năm 2026,2026-05-27
1990-05-17T23:47:30+2500,1990-05-17
2.12.1992T9-43-38,1992-12-02
2003-04-01T01:04:24,2003-04-01
The system recorded 20100326080312,2010-03-26
20131005214933909885,2013-10-05
The system recorded 20070901105509,2007-09-01
20350928023912187670285,2035-09-28
7.9.2033T7-45-30,2033-09-07
2031-01-26T23:52:09.588519Z,2031-01-26
2014-06-02T23:20:15.728Z,2014-06-02
2005-05-05T10:29:25Z+3,2005-05-05
20010315210502998666,2001-03-15
3 Oct 2025,2025-10-03
28-4-1999,1999-04-28
20280130113535118,2028-01-30
The system recorded 20031204030431,2003-12-04
27_2_2007,2007-02-27
2000 12 17,2000-12-17
"July 1, 2020",2020-07-01
1996-05-16T23:35:36.355572168Z,1996-05-16
20330115132224355,2033-01-15
20160730174956,2016-07-30
1 tháng 1 năm 1993,1993-01-01
2002/8/31T2345,2002-08-31
2017_01_12T18_53_4+0500,2017-01-12
"February 14, 1991",1991-02-14
2010-11-08T00:01:13Z+3,2010-11-08
23/16-2019,2019-08-23
11-8-2022,2022-08-11
2026_03_23T7_6_41+2500,2026-03-23
30 December 1998,1998-12-30
16/20-2035,2035-10-16
20201002035209058682124,2020-10-02
ngày 27 tháng 3 năm 2008,2008-03-27
The system recorded 19981219101004,1998-12-19
5-10-2009,2009-10-05
2035/3/9T235140,2035-03-09
779994000000000000,1994-09-20
15 Mar 2023,2023-03-15
4 Nov 2007,2007-11-04
30 tháng 4 năm 2010,2010-04-30
20 December 2029,2029-12-20
Sự kiện diễn ra vào 27/4/1991 1:8,1991-04-27
08.15.2006,2006-08-15
1930582800000000,2031-03-07
Ngày 13-5-1996,1996-05-13
"May 3, 2007",2007-05-03
"10th of July, 2008",2008-07-10
21 tháng 9 năm 2032,2032-09-21
21|7|1993,1993-07-21
25 Dec 2020,2020-12-25
1796144400,2026-12-02
20151111162731,2015-11-11
1961686800000000,2032-03-01
"June 18, 2000",2000-06-18
The system recorded 20041021235220,2004-10-21
6/2/2029 giờ 8:22:53,2029-02-06
2028733200000000000,2034-04-16
20120905075658,2012-09-05
1966438800000,2032-04-25
"14th of April, 2027",2027-04-14
2024-03-04T01:32:11,2024-03-04
19970918202448721680626,1997-09-18
1393952400,2014-03-05
"5th of September, 1997",1997-09-05
Event at 2031-07-19T8:15:42,2031-07-19
Event at 2015-12-21T13:10:15,2015-12-21
ngày 9 tháng 10 năm 2016,2016-10-09
Sự kiện diễn ra vào 27/12/2026 13:55,2026-12-27
23 11 91,1991-11-23
1994-02-09T18:44:36.286261139Z,1994-02-09
1998-07-07T23:55:00,1998-07-07
"11th of February, 2027",2027-02-11
2000-04-26T21:42:38.477Z,2000-04-26
2005-12-22T16:26:15,2005-12-22
22/14-2008,2008-07-22
2027/08/17,2027-08-17
Ngày 11-1-2003,2003-01-11
2023-12-15T23:18:56,2023-12-15
1090429200000000000,2004-07-22
The system recorded 20131108115939,2013-11-08
"June 16, 2011",2011-06-16
09_16_2010,2010-09-16
5-2-2013,2013-02-05
20180216033602914209882,2018-02-16
2002/3/24T15955,2002-03-24
21/09/31,2031-09-21
20070305021336902399606,2007-03-05
20030805223718478,2003-08-05
"31th of March, 2002",2002-03-31
2006_03_17,2006-03-17
2.2.2033T6-15-59,2033-02-02
2032-12-18,2032-12-18
Event at 2022-08-31T23:28:15,2022-08-31
20021029224114498,2002-10-29
1230570000000000000,2008-12-30
1475600400,2016-10-05
30 Mar 2027,2027-03-30
54-1-1990,1990-01-27
17-6-2017,2017-06-17
5.9.2030T20-56-49,2030-09-05
Event at 1997-03-02T23:58:31,1997-03-02
6 tháng 9 năm 2022,2022-09-06
Ngày 14-5-2023,2023-05-14
17 Mar 1996,1996-03-17
1992-02-10T13:15:53.568934017Z,1992-02-10
17 August 2026,2026-08-17
1933693200,2031-04-12
"21th of September, 1995",1995-09-21
2025-02-10T14:05:51.874912290Z,2025-02-10
2035/10/30T191221,2035-10-30
10 tháng 6 năm 2033,2033-06-10
2009-05-12T14:55:13,2009-05-12
1/4-2024,2024-02-01
2017-02-03T17:26:41.171747Z,2017-02-03
1168966800,2007-01-17
05-04-2004,2004-05-04
Ngày 16-8-2033,2033-08-16
1992-04-20T17:26:21-0330,1992-04-20
2002-06-06T05:07:44.171524Z,2002-06-06
20090802092414,2009-08-02
2021-06-09T18:47:11Z+3,2021-06-09
Sự kiện diễn ra vào 11/12/1997 13:37,1997-12-11
20260109013827123537,2026-01-09
17.1.1998T15-39-3,1998-01-17
20221110030036,2022-11-10
11/25/2003,2003-11-25
1142269200,2006-03-14
20301119222039773,2030-11-19
1992-01-18T01:13:57-0300,1992-01-18
20180409160410335,2018-04-09
2006-12-02T09:05:06+2500,2006-12-02
23/12/1995 giờ 0:43:14,1995-12-23
05.09.11,2011-09-05
07_04_26,2026-04-07
1992-07-15T11:23:36.218655Z,1992-07-15
2034-01-13T04:24:16.624Z,2034-01-13
Sự kiện diễn ra vào 17/12/1999 19:17,1999-12-17
2020_10_12T1_47_42Z,2020-10-12
2005-04-10T12:52:03.156127475Z,2005-04-10
2028-02-05T01:56:28Z+3,2028-02-05
1706979600000000000,2024-02-04
1203354000000,2008-02-19
28/8/2024 giờ 19:2:29,2024-08-28
6-1-2027,2027-01-06
2033-09-03T08:57:13.731Z,2033-09-03
771354000,1994-06-12
30-3-2008,2008-03-30
8-1-2031,2031-01-04
2001-02-22T22:07:32.596484Z,2001-02-22
2020-05-28T18:03:08Z+3,2020-05-28
812480400,1995-10-01
1089824400,2004-07-15
20171014043240339084,2017-10-14
1048006800000,2003-03-19
1994-08-24T22:43:01+00:00,1994-08-24
2001/1/5T7122,2001-01-05
6.1.1998T13-6-9,1998-01-06
14/10-2029,2029-05-14
1992-11-13T02:08:46.961202Z,1992-11-13
8_3_2032,2032-03-08
2031-04-15T18:07:36.007966750Z,2031-04-15
1 tháng 2 năm 2018,2018-02-01
2031-04-11T23:53:23Z+3,2031-04-11
25.4.2018T10-51-52,2018-04-25
1906995600000000,2030-06-07
The system recorded 20300714101422,2030-07-14
1992-01-02T23:37:04Z+3,1992-01-02
"27th of February, 2025",2025-02-27
The system recorded 20220221193533,2022-02-21
10 tháng 10 năm 2009,2009-10-10
2007_08_03T20_21_13-0330,2007-08-03
26-11-1999,1999-11-13
ngày 30 tháng 5 năm 2034,2034-05-30
1995-06-22T16:26:59.503Z,1995-06-22
"October 20, 2021",2021-10-20
01/31/2022,2022-01-31
8 September 2013,2013-09-08
31-8-1997,1997-08-31
1956934800000000000,2032-01-06
2014|01|21,2014-01-21
20080409151159491,2008-04-09
09|13|2015,2015-09-13
22.1.2027,2027-01-22
2034-09-29T14:53:15,2034-09-29
1673370000,2023-01-11
9-1-1999,1999-01-09
27 Jan 2011,2011-01-27
20330622021851,2033-06-22
12/4/2034,2034-04-12
24 tháng 1 năm 1998,1998-01-24
ngày 26 tháng 1 năm 1995,1995-01-26
2023-09-12T00:06:59.561Z,2023-09-12
ngày 12 tháng 10 năm 2023,2023-10-12
16.3.2035T1-19-6,2035-03-16
Event at 2012-08-09T6:33:32,2012-08-09
25 tháng 11 năm 2031,2031-11-25
1649782800000,2022-04-13
10.12.2005T1-7-36,2005-12-10
Sự kiện diễn ra vào 1/3/1992 14:54,1992-03-01
10.4.2033T7-52-33,2033-04-10
1429203600000000,2015-04-17
1-1-2017,2017-01-01
19930921211622833,1993-09-21
20180206094122,2018-02-06
17 April 2029,2029-04-17
"July 15, 2011",2011-07-15
Event at 2013-09-23T10:20:13,2013-09-23
30 Dec 2000,2000-12-30
6 tháng 11 năm 2004,2004-11-06
24-07-35,2035-07-24
1/4/2027 giờ 3:25:36,2027-04-01
Ngày 3-3-1991,1991-03-03
ngày 7 tháng 8 năm 1994,1994-08-07
36-4-1998,1998-04-18
2000-11-24T02:44:15+2500,2000-11-24
2005-06-13T10:42:55Z+3,2005-06-13
17 Oct 2008,2008-10-17
3/1/2013 giờ 22:5:51,2013-01-03
44-9-2015,2015-09-22
27 Apr 2033,2033-04-27
Sự kiện diễn ra vào 19/8/2006 21:35,2006-08-19
23/4/1991 giờ 13:14:21,1991-04-23
36-12-2011,2011-12-18
Event at 1990-09-06T1:1:22,1990-09-06
648061200000,1990-07-16
20310303202314835279,2031-03-03
2024-01-20T10:39:54.873637Z,2024-01-20
20230417171518,2023-04-17
799261200000,1995-05-01
19970524170226260584711,1997-05-24
34-10-2010,2010-10-17
9/6/2012 giờ 4:32:24,2012-06-09
16 Apr 1991,1991-04-16
"July 3, 2015",2015-07-03
1290272400000000000,2010-11-21
2023_07_16T12_50_28-0300,2023-07-16
19991028055417325771,1999-10-28
Event at 2001-07-12T7:36:0,2001-07-12
5-4-2024,2024-04-05
1466787600000,2016-06-25
04|01|2028,2028-04-01
12.8.2007T10-14-37,2007-08-12
ngày 6 tháng 10 năm 2012,2012-10-06
20260401230748676973,2026-04-01
ngày 15 tháng 11 năm 2033,2033-11-15
Sự kiện diễn ra vào 30/11/2008 11:13,2008-11-30
10-1-2023,2023-01-05
716662800000,1992-09-17
Ngày 20-11-2010,2010-11-20
22-12-1990,1990-12-11
2005_03_18T11_21_9+07:00,2005-03-18
2022-03-09T17:32:46.036234Z,2022-03-09
2028-02-03T10:30:40Z+3,2028-02-03
Ngày 12-8-1996,1996-08-12
12 tháng 1 năm 2000,2000-01-12
1990_01_23T3_10_0-0330,1990-01-23
20300611041425956892,2030-06-11
ngày 10 tháng 1 năm 2027,2027-01-10
2012-06-25T20:59:47-0330,2012-06-25
20300804000841893,2030-08-04
2014-03-09,2014-03-09
The system recorded 20241201195536,2024-12-01
2008-05-08T14:10:48.846Z,2008-05-08
2012-07-14T20:39:24Z+3,2012-07-14
12-10-2030,2030-10-12
1356022800,2012-12-21
20320502052233206,2032-05-02
1480784400000000,2016-12-04
20140619233059674311,2014-06-19
19-09-16,2016-09-19
18 September 2028,2028-09-18
1451062800000000000,2015-12-26
ngày 13 tháng 8 năm 2035,2035-08-13
2016/8/16T232447,2016-08-16
1991-12-01T22:44:43.450Z,1991-12-01
Event at 1996-01-24T19:19:41,1996-01-24
1918314000,2030-10-16
25 Jun 2006,2006-06-25
2016-06-20T04:26:52+3,2016-06-20
1998_12_22T15_39_2+0500,1998-12-22
20050225063410821,2005-02-25
2008-07-03T20:16:02,2008-07-03
2005-03-31T05:19:20,2005-03-31
ngày 28 tháng 11 năm 2013,2013-11-28
21 tháng 5 năm 2021,2021-05-21
1 tháng 2 năm 2006,2006-02-01
Event at 2003-10-01T16:16:43,2003-10-01
27 10 33,2033-10-27
9-4-2017,2017-04-09
2018-05-28T15:47:50.977305Z,2018-05-28
1990-12-08T08:23:45Z+3,1990-12-08
ngày 10 tháng 12 năm 2033,2033-12-10
2058627600000000,2035-03-28
26/12/2023 giờ 15:0:15,2023-12-26
2018-11-15T21:31:09-05:00,2018-11-15
1/1/2024 giờ 4:17:46,2024-01-01
08_21_2018,2018-08-21
1391446800000000000,2014-02-04
ngày 21 tháng 10 năm 2021,2021-10-21
5-7-2007,2007-07-05
2004-02-10T23:34:34Z+3,2004-02-10
20351123012620,2035-11-23
15 tháng 10 năm 2003,2003-10-15
20091102170919781791056,2009-11-02
ngày 6 tháng 7 năm 2019,2019-07-06
10.19.1997,1997-10-19
2003-09-14T04:16:17,2003-09-14
2013/10/20T10285,2013-10-20
19960830033107667,1996-08-30
14 tháng 8 năm 2032,2032-08-14
"July 21, 2019",2019-07-21
1473613200000,2016-09-12
ngày 18 tháng 8 năm 2028,2028-08-18
16-10-2028,2028-10-16
2035-03-12T11:39:33,2035-03-12
16 tháng 11 năm 1998,1998-11-16
2011-11-04,2011-11-04
25/18-1994,1994-09-25
Ngày 21-5-2021,2021-05-21
2005_06_28T17_20_51+00:00,2005-06-28
16 1 2010,2010-01-16
2019/3/26T153041,2019-03-26
1993-05-08T00:06:50.794Z,1993-05-08
20060704105300,2006-07-04
941302800000000,1999-10-31
1662829200000000000,2022-09-11
"August 21, 1990",1990-08-21
1206032400,2008-03-21
05|09|2034,2034-05-09
995562000000000,2001-07-20
2019-05-11T18:38:58Z+3,2019-05-11
36-3-2011,2011-03-18
"December 7, 1994",1994-12-07
2029-06-14T04:26:25+0500,2029-06-14
20190424103237282244,2019-04-24
17-9-2001,2001-09-17
2018-02-21T06:44:49Z+3,2018-02-21
2014-01-19T14:53:39+08,2014-01-19
08 12 08,2008-12-08
2006-03-25T18:52:36.406596337Z,2006-03-25
2029/10/11,2029-10-11
1615482000,2021-03-12
Ngày 29-2-2016,2016-02-29
5 tháng 7 năm 1992,1992-07-05
22|06|06,2006-06-22
5/12/2006 giờ 0:37:18,2006-12-05
2024_08_27T10_52_53+0500,2024-08-27
22.2.2021T15-48-26,2021-02-22
20070823140123,2007-08-23
02|22|2009,2009-02-22
2034_06_16,2034-06-16
Ngày 5-10-2026,2026-10-05
20220827103315274949669,2022-08-27
20270823030723538538222,2027-08-23
1558803600,2019-05-26
"16th of January, 2023",2023-01-16
24 tháng 7 năm 1996,1996-07-24
1998-03-14T12:51:14.671254Z,1998-03-14
2035-04-10T00:33:58+2500,2035-04-10
10-13-2005,2005-10-13
8 Jul 2023,2023-07-08
Event at 2016-08-13T12:56:14,2016-08-13
"16th of September, 1990",1990-09-16
8-11-1995,1995-11-04
2005-06-25T22:54:46.312687Z,2005-06-25
30 11 2027,2027-11-30
20170801193830444727332,2017-08-01
26|2|1999,1999-02-26
1770915600,2026-02-13
2007-12-14T21:41:27.703411Z,2007-12-14
19/4-2013,2013-02-19
2017-10-04T20:42:39+2500,2017-10-04
1945443600000000000,2031-08-26
54-1-1999,1999-01-27
"December 6, 1993",1993-12-06
1999-02-09T04:52:56.982569702Z,1999-02-09
2004-08-05T03:48:50.104Z,2004-08-05
Sự kiện diễn ra vào 7/6/2024 18:57,2024-06-07
20010220090906435487,2001-02-20
1994/4/1T113333,1994-04-01
1991-07-18T03:12:29.403Z,1991-07-18
14 Oct 2012,2012-10-14
The system recorded 20020509205833,2002-05-09
1730048400,2024-10-28
24/24-2005,2005-12-24
23|06|18,2018-06-23
2014/10/23T45437,2014-10-23
1182358800000000000,2007-06-21
10-11-2009,2009-11-05
The system recorded 20340104115306,2034-01-04
17/8-2016,2016-04-17
26 04 05,2005-04-26
"December 4, 1994",1994-12-04
1.6.2013T20-31-12,2013-06-01
1982336400000000000,2032-10-26
Sự kiện diễn ra vào 12/10/2030 13:44,2030-10-12
1924621200000000,2030-12-28
1192208400000000000,2007-10-13
1994_12_22T13_25_40+0500,1994-12-22
1990-09-13T17:56:35.028252Z,1990-09-13
20061127150637411,2006-11-27
2011-04-03T00:15:11Z+3,2011-04-03
ngày 26 tháng 11 năm 2014,2014-11-26
1418230800000,2014-12-11
20070217101159349,2007-02-17
2028/8/12T112752,2028-08-12
Event at 2011-08-24T19:16:54,2011-08-24
24-5-2016,2016-05-12
29 tháng 9 năm 2035,2035-09-29
2031-02-18T06:56:18Z+3,2031-02-18
20320306192601317231,2032-03-06
1004374800000000000,2001-10-30
"August 31, 1997",1997-08-31
1823619600000000,2027-10-16
18 December 2020,2020-12-18
Sự kiện diễn ra vào 30/4/2024 13:42,2024-04-30
2032-03-07T02:49:58Z,2032-03-07
2-3-2015,2015-03-01
14/14-1995,1995-07-14
2019-11-26T04:35:21Z+3,2019-11-26
21 8 2029,2029-08-21
2027_10_21T22_55_35+3,2027-10-21
The system recorded 20220725040533,2022-07-25
26-3-2017,2017-03-13
2030/7/30T105348,2030-07-30
28.09.17,2017-09-28
2013-03-05T07:31:00+2500,2013-03-05
2008947600000000000,2033-08-30
2031-05-24T06:34:31.187425109Z,2031-05-24
2031-04-26T20:19:16.667748Z,2031-04-26
25-2-2016,2016-02-25
2031/1/9T13105,2031-01-09
1079456400000000,2004-03-17
2029-08-04T23:40:09.502Z,2029-08-04
1998-07-09T15:39:37.616659Z,1998-07-09
2040829200000000000,2034-09-03
1991-09-14T05:18:51.965157231Z,1991-09-14
1998_09_11T16_53_43-05:00,1998-09-11
1760893200000000000,2025-10-20
11 May 2010,2010-05-11
14|11|2004,2004-11-14
28-7-2030,2030-07-28
"March 2, 2001",2001-03-02
1375722000,2013-08-06
30/4/2021 giờ 20:3:8,2021-04-30
19990530183939191,1999-05-30
2034-05-23T18:37:15.748Z,2034-05-23
10/22-2001,2001-11-10
Event at 2006-03-05T4:4:23,2006-03-05
18 January 2015,2015-01-18
2008-08-17T13:09:27+2500,2008-08-17
2000-08-22T06:54:46.232288Z,2000-08-22
693421200,1991-12-23
20240220064946,2024-02-20
02|07|32,2032-07-02
20321129195941396007,2032-11-29
12 tháng 9 năm 2027,2027-09-12
18 Oct 2001,2001-10-18
2009/11/21T145224,2009-11-21
ngày 29 tháng 3 năm 2025,2025-03-29
1997-01-22T18:36:06,1997-01-22
1995-03-21T16:43:51+3,1995-03-21
1580144400000,2020-01-28
2023-12-29T09:10:21Z+3,2023-12-29
2019-09-06T11:45:31+2500,2019-09-06
29 tháng 7 năm 2033,2033-07-29
The system recorded 20310825220136,2031-08-25
1992-11-16T05:35:09,1992-11-16
2029/09/02,2029-09-02
"January 20, 2029",2029-01-20
2025-11-10T00:40:03.120670997Z,2025-11-10
2034-02-09T03:43:24+0500,2034-02-09
17.2.1991T16-13-1,1991-02-17
Event at 2017-11-01T19:10:39,2017-11-01
1229965200,2008-12-23
8/10-2011,2011-05-08
The system recorded 19941014164229,1994-10-14
2031-04-10T13:15:35.933Z,2031-04-10
17_02_16,2016-02-17
Sự kiện diễn ra vào 29/5/1998 15:30,1998-05-29
863974800000,1997-05-19
1992_09_26T14_36_40+07:00,1992-09-26
14/4-2016,2016-02-14
13 October 1995,1995-10-13
20140802015807,2014-08-02
731523600000000,1993-03-08
60-11-2010,2010-11-30
2003-02-12T16:42:00.809315Z,2003-02-12
20300319055857769,2030-03-19
15/03/29,2029-03-15
2033-10-18T20:05:05.163654Z,2033-10-18
1386176400000,2013-12-05
09|30|2009,2009-09-30
20031002105211976,2003-10-02
21-5-2017,2017-05-21
Event at 2022-03-28T10:10:57,2022-03-28
17-4-2014,2014-04-17
1030554000000000000,2002-08-29
10.15.2030,2030-10-15
2001-09-15T15:12:21.893516Z,2001-09-15
Sự kiện diễn ra vào 8/10/1992 0:22,1992-10-08
2006/11/29T5241,2006-11-29
29 February 2004,2004-02-29
6 1 2008,2008-01-06
1993-02-13T15:37:42.577176Z,1993-02-13
2033-08-22T08:40:42.972887920Z,2033-08-22
31 tháng 10 năm 2029,2029-10-31
30.12.2004T6-31-28,2004-12-30
2003-04-13T05:26:27,2003-04-13
Event at 2026-12-07T15:46:16,2026-12-07
1993-01-07T19:34:08.093054466Z,1993-01-07
8-8-2034,2034-08-08
8/6/2004 giờ 21:14:48,2004-06-08
"13th of December, 1996",1996-12-13
2028-04-28T11:35:37.446076495Z,2028-04-28
20070501220738488,2007-05-01
ngày 1 tháng 6 năm 2033,2033-06-01
2019-09-06T07:02:55,2019-09-06
21.9.2016T22-43-31,2016-09-21
2023-03-22T23:38:11Z+3,2023-03-22
7.4.2025T22-35-54,2025-04-07
1237395600,2009-03-19
20-05-20,2020-05-20
Ngày 17-4-2012,2012-04-17
29/4/2014 giờ 21:48:50,2014-04-29
15 April 2008,2008-04-15
1 July 2032,2032-07-01
6 tháng 1 năm 2014,2014-01-06
27.9.2019T14-9-43,2019-09-27
20070415174318980548,2007-04-15
21/12-2034,2034-06-21
14 Jan 1996,1996-01-14
2012/8/31T23425,2012-08-31
16|7|2012,2012-07-16
07 14 2003,2003-07-14
15 Sep 2006,2006-09-15
1990-09-09T09:09:59.216935Z,1990-09-09
1996-05-02T06:53:31Z+3,1996-05-02
20211102214905876071,2021-11-02
The system recorded 20261222190259,2026-12-22
2003/9/11T22112,2003-09-11
3 September 2031,2031-09-03
2000-06-30T11:37:08.747346888Z,2000-06-30
25/6/2007 giờ 1:25:36,2007-06-25
9 Jun 2021,2021-06-09
Sự kiện diễn ra vào 10/4/1997 10:33,1997-04-10
20/4/2028 giờ 16:36:20,2028-04-20
2020525200000000,2034-01-11
20 3 1992,1992-03-20
1420909200,2015-01-11
21/24-2027,2027-12-21
2001/10/24T13189,2001-10-24
1752512400000,2025-07-15
20131017005128628,2013-10-17
20191127042037181254005,2019-11-27
The system recorded 20100101080318,2010-01-01
20180406045752,2018-04-06
19970629152542267,1997-06-29
06.06.20,2020-06-06
10/6-1992,1992-03-10
60-1-1994,1994-01-30
19950527213807780,1995-05-27
"August 23, 2006",2006-08-23
4/10-2019,2019-05-04
1664298000,2022-09-28
20000812045913796290,2000-08-12
8-8-2024,2024-08-04
1998/8/25T181821,1998-08-25
The system recorded 19900919071924,1990-09-19
17/5/2022,2022-05-17
1207328400000000000,2008-04-05
3-12-1993,1993-12-03
20291214100020503188,2029-12-14
6/24-1995,1995-12-06
Sự kiện diễn ra vào 17/6/1992 7:56,1992-06-17
26-5-2009,2009-05-26
30 September 2016,2016-09-30
2011-07-12T18:48:10+07:00,2011-07-12
"December 5, 2013",2013-12-05
27-6-2020,2020-06-27
10-10-1991,1991-10-10
"November 26, 2005",2005-11-26
1994-01-28T21:01:41.372121Z,1994-01-28
1998/9/18T183348,1998-09-18
29-9-1991,1991-09-29
8 tháng 10 năm 2027,2027-10-08
Sự kiện diễn ra vào 8/8/2005 2:52,2005-08-08
810493200000,1995-09-08
20150202161257246954137,2015-02-02
19950224092735183,1995-02-24
04-06-94,1994-06-04
1563210000000000000,2019-07-16
28-11-2024,2024-11-28
2016/9/13T61446,2016-09-13
ngày 25 tháng 3 năm 1996,1996-03-25
2009-04-27T16:06:29,2009-04-27
2005-07-24T02:10:24,2005-07-24
20290201113052539,2029-02-01
24|10|29,2029-10-24
2013-11-20T09:55:25.577Z,2013-11-20
1990-04-19T23:34:24+2500,1990-04-19
1124125200000000000,2005-08-16
23.3.2010T0-53-1,2010-03-23
1991-06-12T07:14:32Z+3,1991-06-12
The system recorded 20220716093415,2022-07-16
The system recorded 20350717055047,2035-07-17
06|19|1995,1995-06-19
20010722182659515393,2001-07-22
1999-08-23T11:02:54.674Z,1999-08-23
20170119180301823,2017-01-19
9 April 2000,2000-04-09
"6th of September, 2019",2019-09-06
2021/4/11T32615,2021-04-11
1997-08-28T15:02:13-0300,1997-08-28
689101200000000000,1991-11-03
1205686800000,2008-03-17
5 Oct 2019,2019-10-05
20050411221210554485635,2005-04-11
Event at 2021-08-15T21:5:20,2021-08-15
Sự kiện diễn ra vào 3/9/2003 6:17,2003-09-03
20350904124456045832904,2035-09-04
2001-11-13T04:53:53+07:00,2001-11-13
11-2-1993,1993-02-11
2007-01-31T06:01:13.568224446Z,2007-01-31
2001_11_11T5_48_42Z+3,2001-11-11
Sự kiện diễn ra vào 5/9/2009 9:27,2009-09-05
1724518800,2024-08-25
2012-11-09T21:04:23+3,2012-11-09
20181022011928725205,2018-10-22
9/16-2035,2035-08-09
2003-11-23T17:39:05,2003-11-23
4 tháng 2 năm 2000,2000-02-04
Ngày 15-1-2001,2001-01-15
30/10-2016,2016-05-30
2020-01-05T07:31:24.692Z,2020-01-05
20280324165301880,2028-03-24
1953565200000000000,2031-11-28
2034-12-03T19:56:02+2500,2034-12-03
18.2.2020T15-28-33,2020-02-18
23/3/2005 giờ 18:50:38,2005-03-23
05_31_1999,1999-05-31
2005-03-28T04:31:09Z+3,2005-03-28
1991-01-27T21:29:22+00:00,1991-01-27
1035392400,2002-10-24
2020/1/8T181557,2020-01-08
1486486800000,2017-02-08
27/11/2000,2000-11-27
21/12-2019,2019-06-21
15-7-1999,1999-07-15
"22th of May, 1995",1995-05-22
24.1.1996T1-31-20,1996-01-24
2014/7/16T17342,2014-07-16
12 Nov 1996,1996-11-12
"April 29, 2013",2013-04-29
2011-11-08T04:01:51.107405Z,2011-11-08
2026-03-28T15:46:57Z+3,2026-03-28
2010_03_16T18_27_51Z,2010-03-16
20320802071544,2032-08-02
27-2-1997,1997-02-27
2003/4/2T32910,2003-04-02
2002-04-17T12:39:14+2500,2002-04-17
2014-11-28T02:16:43,2014-11-28
1994-11-02T15:10:15.995634442Z,1994-11-02
Event at 1997-05-04T3:15:57,1997-05-04
2029-05-10T19:44:30.978710575Z,2029-05-10
2041434000000000,2034-09-10
2035/01/09,2035-01-09
20280418233005246,2028-04-18
02|03|1990,1990-02-03
"April 17, 1993",1993-04-17
20180223185708853019,2018-02-23
2020-04-01T06:24:40.491Z,2020-04-01
20351230182947893313230,2035-12-30
2016_12_23,2016-12-23
ngày 6 tháng 10 năm 1993,1993-10-06
Sự kiện diễn ra vào 12/12/2004 10:29,2004-12-12
20021129131501562740131,2002-11-29
2033-07-23T09:30:24Z+3,2033-07-23
20010910030811430212937,2001-09-10
2032-04-05T09:15:25,2032-04-05
14 December 2029,2029-12-14
Ngày 25-5-1993,1993-05-25
1993-04-02T14:20:18Z,1993-04-02
30.1.2006T21-19-45,2006-01-30
1044810000,2003-02-10
1992/07/29,1992-07-29
19950904021218952704829,1995-09-04
2030-12-11T01:33:13.611Z,2030-12-11
20230917194009,2023-09-17
5-12-2004,2004-12-05
ngày 28 tháng 9 năm 2018,2018-09-28
999882000000,2001-09-08
20011224091825,2001-12-24
26.1.2001T0-29-17,2001-01-26
2018_02_12T4_29_58Z+3,2018-02-12
20100222165534,2010-02-22
52-5-2015,2015-05-26
2011-02-19T15:26:03Z+3,2011-02-19
1478710800,2016-11-10
2004-04-25T12:54:32+2500,2004-04-25
15 December 2022,2022-12-15
4 tháng 12 năm 2020,2020-12-04
2018-04-06,2018-04-06
2007-09-03T01:53:53Z+3,2007-09-03
6 Apr 2027,2027-04-06
2013-01-23T22:45:34+00:00,2013-01-23
Ngày 26-9-2008,2008-09-26
2012_08_10,2012-08-10
"14th of December, 2032",2032-12-14
29-01-04,2004-01-29
2008/2/4T95653,2008-02-04
18/6/2016 giờ 12:26:27,2016-06-18
19/6-2030,2030-03-19
20051019043200967258,2005-10-19
20200414171155893406,2020-04-14
ngày 19 tháng 4 năm 2031,2031-04-19
2025-12-25T04:15:07Z+3,2025-12-25
10 8 2028,2028-08-10
797965200000,1995-04-16
1991-01-17,1991-01-17
11 6 2019,2019-06-11
6 October 2024,2024-10-06
"3rd of August, 2017",2017-08-03
26_5_2025,2025-05-26
1559667600000,2019-06-05
20340702112420605595006,2034-07-02
24|7|2030,2030-07-24
19.4.2017T2-59-10,2017-04-19
7 7 2027,2027-07-07
04 25 2024,2024-04-25
Sự kiện diễn ra vào 11/11/1991 16:7,1991-11-11
2032-12-09T17:53:07+08,2032-12-09
18/6-1998,1998-03-18
2027-12-16T20:17:36.772326Z,2027-12-16
11.20.2020,2020-11-20
716317200000000000,1992-09-13
"October 1, 1998",1998-10-01
1993-10-19T06:33:44+2500,1993-10-19
19910922085107279093,1991-09-22
20261004195034358740229,2026-10-04
2016/1/21T24430,2016-01-21
27 tháng 9 năm 2008,2008-09-27
16-11-2003,2003-11-16
2018-02-16T02:28:04.360919Z,2018-02-16
14/4-2031,2031-02-14
1996-02-12T23:05:53Z+3,1996-02-12
2032-02-20T01:12:06,2032-02-20
2045149200000,2034-10-23
2027-04-05T09:44:00.500482Z,2027-04-05
19/4-2027,2027-02-19
2004-01-04T08:40:39+2500,2004-01-04
Sự kiện diễn ra vào 2/4/2033 16:13,2033-04-02
1749402000000,2025-06-09
The system recorded 20051022010129,2005-10-22
2013-12-31T07:56:54,2013-12-31
Ngày 10-8-2008,2008-08-10
11/2/2015 giờ 14:10:23,2015-02-11
2033-04-22T03:23:45+2500,2033-04-22
776970000000000,1994-08-16
2025/1/4T19318,2025-01-04
2002-05-26T20:42:38.336Z,2002-05-26
19 May 1992,1992-05-19
1993_04_26T20_19_23+0500,1993-04-26
25/20-1998,1998-10-25
"20th of March, 2007",2007-03-20
"August 28, 2002",2002-08-28
2027-06-03T04:42:59-05:00,2027-06-03
2023/3/14T5422,2023-03-14
19900716040421874,1990-07-16
21 Jan 2028,2028-01-21
"June 23, 1994",1994-06-23
Ngày 11-5-2032,2032-05-11
ngày 7 tháng 9 năm 2016,2016-09-07
Ngày 19-6-1997,1997-06-19
20220302180340197179,2022-03-02
1148317200000000000,2006-05-23
Ngày 13-9-1998,1998-09-13
1995/9/9T1458,1995-09-09
16-3-2012,2012-03-16
2031-04-25T11:15:29,2031-04-25
19980118160355643218701,1998-01-18
Sự kiện diễn ra vào 7/10/2024 13:43,2024-10-07
643654800000000000,1990-05-26
20270905191754,2027-09-05
38-12-2006,2006-12-19
1274547600000000000,2010-05-23
Event at 2031-05-30T1:2:54,2031-05-30
19911201095428740,1991-12-01
20200325171615245513,2020-03-25
2020-05-25T12:03:06Z,2020-05-25
1994/2/14T194553,1994-02-14
15|8|2021,2021-08-15
Sự kiện diễn ra vào 5/12/2013 19:14,2013-12-05
2002/4/9T15733,2002-04-09
11.11.2025,2025-11-11
11 May 2007,2007-05-11
08/13/2031,2031-08-13
1993-12-31T22:51:52Z+3,1993-12-31
10.03.00,2000-03-10
2013-12-03T07:56:28+2500,2013-12-03
1812214800000000000,2027-06-06
02/18/1994,1994-02-18
851360400000,1996-12-24
Sự kiện diễn ra vào 28/8/2005 6:23,2005-08-28
1559926800000000000,2019-06-08
26 December 2022,2022-12-26
1998-11-15T16:20:11.864Z,1998-11-15
40-5-2017,2017-05-20
20190418122342502672188,2019-04-18
2004-10-25T13:24:20Z+3,2004-10-25
2013 11 04,2013-11-04
985885200,2001-03-30
20230405163425665,2023-04-05
2002 09 10,2002-09-10
29 Aug 2021,2021-08-29
2027-09-03T23:23:16Z+3,2027-09-03
The system recorded 19960213232304,1996-02-13
2024-06-07T03:33:52,2024-06-07
18 Oct 2014,2014-10-18
1236618000,2009-03-10
29 tháng 10 năm 2023,2023-10-29
2022-05-13T19:57:55,2022-05-13
20140129082104,2014-01-29
19960712173306370261,1996-07-12
2003-12-26T01:20:27+07:00,2003-12-26
54-9-1990,1990-09-27
20310215072905,2031-02-15
20100602190924363,2010-06-02
23 July 2017,2017-07-23
ngày 25 tháng 9 năm 2014,2014-09-25
22 Mar 2035,2035-03-22
2001-05-30T01:06:05.235666005Z,2001-05-30
2022/02/28,2022-02-28
11-8-2010,2010-08-11
767206800,1994-04-25
Sự kiện diễn ra vào 23/2/2022 16:48,2022-02-23
9.2.2008T4-49-18,2008-02-09
ngày 23 tháng 1 năm 2024,2024-01-23
1411837200000000000,2014-09-28
11/14-2024,2024-07-11
"September 27, 2002",2002-09-27
1991-11-23T12:10:05,1991-11-23
20201112160222670423711,2020-11-12
"29th of July, 2018",2018-07-29
2011.05.05,2011-05-05
2032-12-11T03:21:22Z+3,2032-12-11
Ngày 26-10-1990,1990-10-26
2012-01-17T08:43:04.240241Z,2012-01-17
2023_02_20T22_56_10Z+3,2023-02-20
4 tháng 11 năm 2032,2032-11-04
711824400,1992-07-23
44-3-2011,2011-03-22
30_05_35,2035-05-30
20170610151133568364723,2017-06-10
2035-09-09T03:35:37.883736533Z,2035-09-09
19920608000449093,1992-06-08
Ngày 6-3-2028,2028-03-06
16 Mar 1993,1993-03-16
ngày 19 tháng 7 năm 1999,1999-07-19
ngày 9 tháng 1 năm 2008,2008-01-09
"28th of November, 1990",1990-11-28
Ngày 20-5-2000,2000-05-20
30 May 2031,2031-05-30
2013-04-02T05:52:10.311799Z,2013-04-02
12/11/2016 giờ 2:40:47,2016-11-12
2043507600000000,2034-10-04
2022|12|05,2022-12-05
2009-08-08T02:55:19+2500,2009-08-08
2007-01-19T05:31:40+2500,2007-01-19
29 tháng 10 năm 1990,1990-10-29
3 June 2019,2019-06-03
23 February 2001,2001-02-23
7.9.1992T14-34-3,1992-09-07
1990-01-06T14:34:47+2500,1990-01-06
25 tháng 9 năm 1998,1998-09-25
2005-07-19T23:23:02.284Z,2005-07-19
Event at 2032-08-21T4:57:9,2032-08-21
1991-11-16T23:47:07+2500,1991-11-16
1499187600000000,2017-07-05
1991.08.29,1991-08-29
25 September 2006,2006-09-25
2018_10_30T9_14_29Z,2018-10-30
Ngày 27-9-2032,2032-09-27
16.12.91,1991-12-16
1994_04_02T8_3_25+3,1994-04-02
Sự kiện diễn ra vào 8/12/2032 19:57,2032-12-08
"January 1, 2002",2002-01-01
1992-10-07T12:28:18Z+3,1992-10-07
01/21/1997,1997-01-21
2012-02-24T12:22:09.186967761Z,2012-02-24
19 Oct 2014,2014-10-19
Event at 2026-11-30T7:2:54,2026-11-30
20140927040432528,2014-09-27
1992-10-24T22:37:21Z+3,1992-10-24
1306774800000000000,2011-05-31
Ngày 23-10-1997,1997-10-23
970851600,2000-10-07
"27th of December, 2023",2023-12-27
"June 22, 2013",2013-06-22
2010.05.21,2010-05-21
6.9.2021,2021-09-06
2005-05-18T18:42:59.420032Z,2005-05-18
Event at 2029-03-16T5:4:18,2029-03-16
2001/2/16T225326,2001-02-16
1994-01-23T15:10:21-0300,1994-01-23
"July 7, 2013",2013-07-07
1992-06-13T09:14:42,1992-06-13
2015-03-07T09:20:57+2500,2015-03-07
2032/1/1T15640,2032-01-01
20251031194450928,2025-10-31
52-11-2017,2017-11-26
1997-05-29T03:41:56+2500,1997-05-29
20290905162550510075,2029-09-05
16/8/2000 giờ 13:50:50,2000-08-16
"January 26, 2013",2013-01-26
"24th of July, 2000",2000-07-24
"March 8, 2004",2004-03-08
21 tháng 4 năm 2018,2018-04-21
7-8-2005,2005-08-07
1687539600000000000,2023-06-24
2015-07-01T08:37:07.916879987Z,2015-07-01
20010730024052572,2001-07-30
04/14/2024,2024-04-14
1997_03_18T4_49_51+3,1997-03-18
2000-12-10T17:40:54.863Z,2000-12-10
20321227205211,2032-12-27
19 December 1994,1994-12-19
1993_04_20T1_46_22Z,1993-04-20
2023-11-24T16:29:13.332Z,2023-11-24
2011-05-12T21:22:22+2500,2011-05-12
11/12-2022,2022-06-11
34-10-1994,1994-10-17
Ngày 23-12-2035,2035-12-23
The system recorded 20130909180058,2013-09-09
2006/7/13T221047,2006-07-13
23/1/2013 giờ 23:52:5,2013-01-23
20050424224102102293189,2005-04-24
20 Feb 1991,1991-02-20
Ngày 8-10-2032,2032-10-08
1/12-2010,2010-06-01
Event at 1992-08-12T6:15:45,1992-08-12
2007_09_24,2007-09-24
19 11 2008,2008-11-19
Ngày 17-8-1997,1997-08-17
"June 23, 2025",2025-06-23
20021110004304406363,2002-11-10
1380733200000000000,2013-10-03
20_10_1994,1994-10-20
10 11 01,2001-11-10
2011-02-06T05:46:23.495Z,2011-02-06
17 December 2012,2012-12-17
25/20-1994,1994-10-25
2019-01-30T05:01:44.344Z,2019-01-30
917629200000000000,1999-01-30
48-12-2020,2020-12-24
20150210165204877536,2015-02-10
16 January 1995,1995-01-16
20061214175204451730,2006-12-14
15 tháng 10 năm 2026,2026-10-15
Ngày 1-10-2021,2021-10-01
2015/9/3T52658,2015-09-03
687546000000,1991-10-16
1457802000000,2016-03-13
20 tháng 8 năm 2012,2012-08-20
3/12/2002 giờ 4:19:32,2002-12-03
21/16-2015,2015-08-21
23.8.1994,1994-08-23
The system recorded 19920509134702,1992-05-09
2008_06_10T2_32_32+0500,2008-06-10
2017_04_23T9_1_51+00:00,2017-04-23
23 tháng 10 năm 2004,2004-10-23
2009/4/10T20616,2009-04-10
20061025115508978,2006-10-25
2016-03-12T23:38:47.895551Z,2016-03-12
1995.05.09,1995-05-09
22 tháng 6 năm 2024,2024-06-22
28 February 2020,2020-02-28
5/2-2031,2031-01-05
16_2_2034,2034-02-16
1895590800,2030-01-26
20131116162018268095,2013-11-16
48-6-2029,2029-06-24
2025-04-30T19:16:55.775217Z,2025-04-30
2021-02-14T16:54:06+2500,2021-02-14
20160910141051934565363,2016-09-10
1995/07/03,1995-07-03
21-09-34,2034-09-21
2005-12-07T09:27:03.622461449Z,2005-12-07
1991/05/21,1991-05-21
"October 28, 2034",2034-10-28
24 Jun 2004,2004-06-24
ngày 8 tháng 10 năm 2012,2012-10-08
Ngày 30-9-2023,2023-09-30
1999-09-25T12:05:56,1999-09-25
The system recorded 19991220213545,1999-12-20
5 Mar 2003,2003-03-05
1400173200,2014-05-16
11 Oct 2026,2026-10-11
29/12-2009,2009-06-29
18/4-2013,2013-02-18
1992-11-24T02:13:34.617320Z,1992-11-24
20070408165029401,2007-04-08
"January 29, 2008",2008-01-29
2012-03-06T05:42:05,2012-03-06
20111023070028162485,2011-10-23
22 tháng 8 năm 2027,2027-08-22
24-1-2028,2028-01-24
12 Jan 2005,2005-01-12
20030929170916151,2003-09-29
"July 21, 2005",2005-07-21
17/12-2013,2013-06-17
11 November 2028,2028-11-11
Ngày 11-2-2026,2026-02-11
769885200000,1994-05-26
2031/10/31T113314,2031-10-31
25-4-1994,1994-04-25
Ngày 26-5-2011,2011-05-26
13/6/1992 giờ 16:49:59,1992-06-13
46-10-2027,2027-10-23
19 Dec 2032,2032-12-19
1761757200,2025-10-30
1296838800000,2011-02-05
1997_11_23T21_6_3+08,1997-11-23
The system recorded 20290808085324,2029-08-08
16-1-2019,2019-01-16
7-12-1991,1991-12-07
26-3-1991,1991-03-26
19930609215706,1993-06-09
1998-05-17T09:44:12,1998-05-17
13-3-2026,2026-03-13
"13th of October, 2002",2002-10-13
28.8.2002T15-0-41,2002-08-28
2033-08-12T19:45:26.126545416Z,2033-08-12
801507600000,1995-05-27
16.12.2004T11-52-22,2004-12-16
10 tháng 5 năm 1999,1999-05-10
Ngày 23-3-2010,2010-03-23
20290831042138801739,2029-08-31
30-8-2028,2028-08-30
ngày 6 tháng 2 năm 2005,2005-02-06
36-12-2027,2027-12-18
687286800000000000,1991-10-13
2007-03-18T22:38:36.320684124Z,2007-03-18
20141016233258146725,2014-10-16
715712400000,1992-09-06
20/01/03,2003-01-20
1875546000000000,2029-06-08
10 Feb 1995,1995-02-10
19|1|2026,2026-01-19
2024/5/20T74526,2024-05-20
ngày 26 tháng 5 năm 2026,2026-05-26
1997_07_27T17_58_5Z+3,1997-07-27
19960701035558,1996-07-01
01|21|2008,2008-01-21
20 tháng 10 năm 2000,2000-10-20
The system recorded 20060807111731,2006-08-07
2001-01-26T13:51:50+2500,2001-01-26
"January 3, 1997",1997-01-03
15.6.1995T3-18-14,1995-06-15
2001/2/18T163959,2001-02-18
2013/3/5T185225,2013-03-05
20260208181030208542484,2026-02-08
1990/11/6T10455,1990-11-06
Sự kiện diễn ra vào 4/11/2003 14:47,2003-11-04
2029_05_11T19_2_50Z+3,2029-05-11
2022-05-04T21:24:56.634Z,2022-05-04
20220524142116725185124,2022-05-24
7 tháng 9 năm 1993,1993-09-07
6 Oct 2030,2030-10-06
2033744400000,2034-06-13
9 Nov 2023,2023-11-09
8 February 2013,2013-02-08
9/22-2031,2031-11-09
Event at 2002-02-04T8:33:44,2002-02-04
1227459600000000,2008-11-24
23 September 1997,1997-09-23
2019-12-18T06:51:53.670912Z,2019-12-18
2007_03_30T15_0_55+07:00,2007-03-30
ngày 27 tháng 10 năm 2011,2011-10-27
2029/2/12T33658,2029-02-12
Sự kiện diễn ra vào 20/3/2016 10:9,2016-03-20
Event at 2011-10-13T16:25:20,2011-10-13
20230412214027,2023-04-12
Ngày 22-9-2021,2021-09-22
6/6/2035,2035-06-06
20250922004708,2025-09-22
20321001201710622,2032-10-01
1998-03-23T11:41:07.296685Z,1998-03-23
20291008032004770143173,2029-10-08
21.1.2007T8-34-7,2007-01-21
20020901164733711,2002-09-01
"15th of November, 2004",2004-11-15
29/3/2013,2013-03-29
24-6-2020,2020-06-24
19991112052158000163724,1999-11-12
Event at 2013-06-02T15:38:30,2013-06-02
2009-10-26T02:01:54+2500,2009-10-26
1993-06-12T00:38:29.627141Z,1993-06-12
06.22.2034,2034-06-22
2004_05_05T2_33_17+08,2004-05-05
40-6-2028,2028-06-20
2017_01_05,2017-01-05
ngày 6 tháng 4 năm 1994,1994-04-06
24|03|26,2026-03-24
"December 9, 2022",2022-12-09
18-3-2003,2003-03-09
"12th of January, 2021",2021-01-12
19/9/2032 giờ 9:18:43,2032-09-19
2024-11-03T10:55:18+2500,2024-11-03
Event at 2019-08-11T14:24:12,2019-08-11
Sự kiện diễn ra vào 12/1/2001 20:33,2001-01-12
2035-11-11,2035-11-11
26 tháng 10 năm 2029,2029-10-26
10/7/2034 giờ 20:52:36,2034-07-10
20300323072704957,2030-03-23
ngày 14 tháng 6 năm 1993,1993-06-14
2017_01_28T15_25_24+3,2017-01-28
Ngày 2-1-2004,2004-01-02
19990401072525183590,1999-04-01
20/04/12,2012-04-20
2013-06-30T15:04:22.336359737Z,2013-06-30
03 31 1997,1997-03-31
"19th of December, 2028",2028-12-19
1999-03-23T09:34:34.590137Z,1999-03-23
1/16-1991,1991-08-01
2006-10-18T18:01:50Z+3,2006-10-18
2022_08_09T17_28_53Z+3,2022-08-09
2007-12-17T21:23:00+2500,2007-12-17
15_10_2013,2013-10-15
2001/08/15,2001-08-15
"11th of August, 2018",2018-08-11
The system recorded 20241023192345,2024-10-23
5 11 2002,2002-11-05
28/24-2007,2007-12-28
1347987600,2012-09-19
2000_07_02T21_12_48-05:00,2000-07-02
1851008400000,2028-08-28
22 tháng 11 năm 2015,2015-11-22
1158080400000000000,2006-09-13
Sự kiện diễn ra vào 22/12/2035 8:54,2035-12-22
2/7/2014 giờ 12:58:45,2014-07-02
1687194000000000000,2023-06-20
Ngày 8-12-2018,2018-12-08
2031-01-17T05:34:54.974161547Z,2031-01-17
2035-05-01T22:38:14.366Z,2035-05-01
988563600000000000,2001-04-30
1992-05-18T03:47:54.798Z,1992-05-18
20000624191607,2000-06-24
2025-03-31,2025-03-31
2013-01-30T00:45:02.215790Z,2013-01-30
Sự kiện diễn ra vào 3/7/1990 12:21,1990-07-03
1998|11|29,1998-11-29
The system recorded 20240619172906,2024-06-19
18|12|17,2017-12-18
20331231020918,2033-12-31
16/3/2013 giờ 0:44:10,2013-03-16
Ngày 7-7-2016,2016-07-07
1.6.2028T17-46-27,2028-06-01
25.12.2022T22-46-18,2022-12-25
27/3/1993 giờ 12:11:41,1993-03-27
The system recorded 20180318093849,2018-03-18
42-6-2022,2022-06-21
1467392400000000,2016-07-02
10-08-2011,2011-10-08
Sự kiện diễn ra vào 14/5/1991 15:12,1991-05-14
12.04.96,1996-04-12
10.6.2009T3-17-41,2009-06-10
2008-01-22T15:00:12,2008-01-22
2007-09-12T12:07:12Z+3,2007-09-12
2004-12-27T11:54:57.874Z,2004-12-27
21-11-1991,1991-11-21
21 Dec 2020,2020-12-21
2006-11-22T22:49:09+2500,2006-11-22
1435597200000,2015-06-30
934909200,1999-08-18
1995-11-22T03:17:18.896Z,1995-11-22
2013-12-09T20:30:25Z+3,2013-12-09
20180330193637256290772,2018-03-30
20060213203048,2006-02-13
20100603145732734,2010-06-03
2005 03 20,2005-03-20
2025.10.25,2025-10-25
Sự kiện diễn ra vào 20/11/2029 11:2,2029-11-20
825094800000000,1996-02-24
"4th of December, 1994",1994-12-04
"6th of October, 1998",1998-10-06
1219770000000,2008-08-27
2035-01-16T17:02:58.695849654Z,2035-01-16
The system recorded 20021118185030,2002-11-18
ngày 29 tháng 4 năm 2008,2008-04-29
2010-01-13T09:57:02Z+3,2010-01-13
20141120072233182553,2014-11-20
The system recorded 19991103175245,1999-11-03
34-1-2018,2018-01-17
03|07|2010,2010-03-07
Event at 2002-02-07T14:34:25,2002-02-07
15-05-09,2009-05-15
24-12-2017,2017-12-24
2022-01-12T03:26:43.898430077Z,2022-01-12
Event at 1990-10-03T2:3:52,1990-10-03
18 tháng 7 năm 2034,2034-07-18
2031-06-13T21:25:21.568281Z,2031-06-13
2002_02_09T9_30_54-05:00,2002-02-09
1991_03_28T3_51_32+00:00,1991-03-28
2023-03-04T20:25:08,2023-03-04
2029-08-07T12:35:01Z+3,2029-08-07
The system recorded 19901004120101,1990-10-04
20110302132708831171,2011-03-02
25/2/2026 giờ 18:21:9,2026-02-25
1198947600000000,2007-12-30
29.6.2023T2-13-3,2023-06-29
2011-12-31T10:56:19+2500,2011-12-31
2032-04-05T11:20:22.437Z,2032-04-05
2007-11-18T03:38:22.141940485Z,2007-11-18
20271214212524132217,2027-12-14
1999/4/2T32251,1999-04-02
The system recorded 20161216211136,2016-12-16
Sự kiện diễn ra vào 13/5/2004 5:25,2004-05-13
2009-01-01T15:22:30.059845151Z,2009-01-01
1893862800000000000,2030-01-06
Event at 1994-08-14T23:11:0,1994-08-14
20001227035519090161018,2000-12-27
6 Aug 2022,2022-08-06
1317661200000,2011-10-04
04/06/33,2033-06-04
20|12|2020,2020-12-20
2032-10-13T19:29:33Z+3,2032-10-13
Sự kiện diễn ra vào 11/2/2003 14:31,2003-02-11
20270118174202,2027-01-18
1534179600000000,2018-08-14
Event at 2026-10-14T21:2:34,2026-10-14
2026_09_14,2026-09-14
1459184400000000,2016-03-29
876675600,1997-10-13
1991-06-04T02:53:38.047Z,1991-06-04
21 tháng 1 năm 2004,2004-01-21
20131027135413144,2013-10-27
20131106130445036,2013-11-06
20270207091138745,2027-02-07
15.2.2022T21-47-26,2022-02-15
2027-12-15T02:50:49.668673Z,2027-12-15
2006-09-09T18:30:49.501Z,2006-09-09
1993-11-12T11:35:25Z+3,1993-11-12
11.8.2030T11-15-21,2030-08-11
2026|05|15,2026-05-15
2007-05-02T19:12:44.339941357Z,2007-05-02
Ngày 18-2-1994,1994-02-18
20 tháng 10 năm 2012,2012-10-20
20290110113931650851768,2029-01-10
09_11_07,2007-11-09
21.9.2011,2011-09-21
22 tháng 11 năm 1991,1991-11-22
Event at 2031-06-22T1:2:57,2031-06-22
18/5/1999 giờ 17:26:19,1999-05-18
The system recorded 20100104184616,2010-01-04
19930630075028080,1993-06-30
20280309081811463,2028-03-09
1001523600,2001-09-27
ngày 4 tháng 11 năm 2003,2003-11-04
"April 6, 2015",2015-04-06
1995-05-02T02:32:25.366Z,1995-05-02
17/4-2024,2024-02-17
2000 11 04,2000-11-04
9-5-2026,2026-05-09
12.11.1992T4-52-21,1992-11-12
21-3-2012,2012-03-21
Sự kiện diễn ra vào 29/8/2006 2:11,2006-08-29
"December 12, 2020",2020-12-12
Sự kiện diễn ra vào 6/3/2003 7:0,2003-03-06
1994-08-08T13:19:08.430351094Z,1994-08-08
2003-12-13T22:18:03Z+3,2003-12-13
13|11|1995,1995-11-13
2/8-2023,2023-04-02
2024-09-09T03:54:42+07:00,2024-09-09
19901107175045325832,1990-11-07
20120908200332456336,2012-09-08
2003_07_15T1_17_47-0330,2003-07-15
"17th of August, 2004",2004-08-17
2004-03-21T02:00:25.188453Z,2004-03-21
20260807123520,2026-08-07
Sự kiện diễn ra vào 2/5/2013 23:36,2013-05-02
2016-04-03T14:23:14.358657419Z,2016-04-03
16/14-2030,2030-07-16
998326800000000000,2001-08-21
ngày 10 tháng 5 năm 2015,2015-05-10
2033-07-14T11:09:10.606504527Z,2033-07-14
2027-05-30T15:37:16Z+3,2027-05-30
1585760400000000000,2020-04-02
"June 21, 2006",2006-06-21
20261223195743,2026-12-23
8/2-1997,1997-01-08
2024-01-18T13:02:01Z+3,2024-01-18
26/5/2003 giờ 11:53:23,2003-05-26
2023_05_13T9_9_32+0500,2023-05-13
The system recorded 20331020032815,2033-10-20
5-6-2018,2018-06-05
5 5 2002,2002-05-05
5 Sep 2013,2013-09-05
1194368400,2007-11-07
Event at 2012-12-09T2:11:3,2012-12-09
2006-11-04T08:56:25,2006-11-04
Event at 2026-06-30T10:46:10,2026-06-30
08|25|2011,2011-08-25
27 Apr 2033,2033-04-27
12 July 1993,1993-07-12
1702054800000,2023-12-09
19910314182950,1991-03-14
1998-01-09T23:26:28.986Z,1998-01-09
Ngày 29-7-2018,2018-07-29
16-10-2011,2011-10-16
1994-08-13T23:33:19.594896Z,1994-08-13
08 10 2033,2033-08-10
2026_05_28T17_1_55+00:00,2026-05-28
44-6-2017,2017-06-22
1990-06-13T20:39:07+3,1990-06-13
20.8.2018T19-44-33,2018-08-20
1343754000000000,2012-08-01
Event at 2006-06-24T4:33:45,2006-06-24
20010408165950068492,2001-04-08
19901028233352668165787,1990-10-28
20251214081017197951112,2025-12-14
13 Mar 1994,1994-03-13
2025-11-29T01:12:19.672Z,2025-11-29
Sự kiện diễn ra vào 30/9/2024 17:25,2024-09-30
2034-05-06T01:59:00+08,2034-05-06
2016-07-05T22:51:33.630Z,2016-07-05
2009_10_15T15_51_22+08,2009-10-15
1990-10-15T09:58:42,1990-10-15
2014-04-27T23:01:04.412253Z,2014-04-27
17 tháng 3 năm 2024,2024-03-17
2030-10-29T11:42:55.909Z,2030-10-29
ngày 20 tháng 7 năm 2033,2033-07-20
The system recorded 20311129061434,2031-11-29
20300520150118,2030-05-20
9 March 2031,2031-03-09
The system recorded 19920520094829,1992-05-20
2023-06-18T00:11:59+2500,2023-06-18
2019-01-15T06:48:54+2500,2019-01-15
1991-09-27T16:40:24Z+3,1991-09-27
2003-09-22T13:29:11+2500,2003-09-22
"October 28, 2027",2027-10-28
2012-09-11T08:27:03.145747Z,2012-09-11
7/8/1998 giờ 15:34:24,1998-08-07
2024-07-10T08:48:09Z+3,2024-07-10
ngày 3 tháng 2 năm 2014,2014-02-03
11/03/31,2031-03-11
2007-07-25T11:27:56,2007-07-25
1907254800,2030-06-10
"1st of February, 2000",2000-02-01
1113670800,2005-04-17
4/4/2009 giờ 12:14:53,2009-04-04
1996-03-20T22:31:36-0300,1996-03-20
12 Jul 2033,2033-07-12
Sự kiện diễn ra vào 14/11/2017 3:26,2017-11-14
08_12_24,2024-12-08
1595091600000,2020-07-19
2004 12 12,2004-12-12
20060505183943,2006-05-05
2001-06-21T06:31:27+2500,2001-06-21
1998-08-06T16:25:46,1998-08-06
20340403063821393049,2034-04-03
20280116164333986333,2028-01-16
1991-11-29T10:48:56.722188551Z,1991-11-29
20260128022219256488145,2026-01-28
17 Jun 1990,1990-06-17
15/8/2016 giờ 5:10:6,2016-08-15
Sự kiện diễn ra vào 12/8/1996 11:59,1996-08-12
Event at 2028-04-01T18:31:33,2028-04-01
2019/3/4T135256,2019-03-04
19-7-1991,1991-07-19
894646800,1998-05-09
The system recorded 20080815165709,2008-08-15
20190601193936476,2019-06-01
2029-01-29T18:57:41.913680078Z,2029-01-29
1996/2/18T05644,1996-02-18
12 Sep 2028,2028-09-12
7/20-2018,2018-10-07
1995-07-01T16:57:13Z+3,1995-07-01
1238778000000,2009-04-04
20050121113137,2005-01-21
2027-01-13T08:08:21.816Z,2027-01-13
20151022194247997291,2015-10-22
6-11-2018,2018-11-03
6-8-2030,2030-08-06
2069859600000,2035-08-05
2022-09-19T16:52:20,2022-09-19
54-1-1996,1996-01-27
4 Jun 2005,2005-06-04
2017-11-27T05:32:15Z+3,2017-11-27
2030-03-09T10:45:02Z+3,2030-03-09
2032-03-04T01:42:20.359842954Z,2032-03-04
2-2-2034,2034-02-01
23.5.2035T8-36-16,2035-05-23
2026/11/19T115210,2026-11-19
914346000000000,1998-12-23
20270315032328227530,2027-03-15
ngày 24 tháng 7 năm 2035,2035-07-24
1999_11_15T6_21_23-05:00,1999-11-15
"November 6, 1994",1994-11-06
20100910090416075934,2010-09-10
20040727083310539,2004-07-27
21/4/2028 giờ 20:31:41,2028-04-21
The system recorded 20300525111220,2030-05-25
1439744400000000000,2015-08-17
2016-10-07T05:08:13.459447Z,2016-10-07
2020-07-27T05:39:08.498Z,2020-07-27
2024-10-12T13:12:55+2500,2024-10-12
2023-09-02T09:52:52,2023-09-02
11.11.1990T6-34-44,1990-11-11
20030219182414938079847,2003-02-19
7 Dec 2022,2022-12-07
2010-01-30,2010-01-30
60-9-2003,2003-09-30
4.4.1997T23-59-55,1997-04-04
20070801171324,2007-08-01
2070723600000000,2035-08-15
2009-09-10T10:36:42.032432Z,2009-09-10
27.12.2030T5-48-22,2030-12-27
Sự kiện diễn ra vào 8/6/1990 11:59,1990-06-08
"17th of June, 2007",2007-06-17
25-11-1998,1998-11-25
1755277200,2025-08-16
07 29 2028,2028-07-29
2015-01-12T19:32:48,2015-01-12
2028-07-23T19:19:26.834886Z,2028-07-23
Sự kiện diễn ra vào 31/1/2016 2:8,2016-01-31
9/8/2030 giờ 18:20:17,2030-08-09
18 Nov 2008,2008-11-18
Sự kiện diễn ra vào 9/5/1999 9:55,1999-05-09
1610298000000000000,2021-01-11
ngày 14 tháng 9 năm 2001,2001-09-14
20030927010859099,2003-09-27
1295370000000000,2011-01-19
19910824232911246359659,1991-08-24
6-10-2004,2004-10-03
20130225073108,2013-02-25
2012-07-23T01:17:22Z+3,2012-07-23
15 June 2029,2029-06-15
Ngày 25-5-2022,2022-05-25
25.07.12,2012-07-25
15-3-1993,1993-03-15
"7th of August, 2012",2012-08-07
25 12 28,2028-12-25
3 Dec 1998,1998-12-03
"12th of April, 2001",2001-04-12
2011/12/23T6148,2011-12-23
8-6-2000,2000-06-04
The system recorded 20200902152441,2020-09-02
20071103200323,2007-11-03
2021-03-10T12:57:43Z+3,2021-03-10
1995-07-03T06:06:58-05:00,1995-07-03
1997_04_17T19_41_49+0500,1997-04-17
9 tháng 8 năm 2025,2025-08-09
20070923084627516,2007-09-23
2-12-2024,2024-12-02
20311008213932501,2031-10-08
2017-01-02T17:06:59+07:00,2017-01-02
1994-04-06T09:23:27Z+3,1994-04-06
30 October 2012,2012-10-30
20330621003225739,2033-06-21
46-3-1998,1998-03-23
"29th of June, 2014",2014-06-29
2019/6/13T8171,2019-06-13
21-2-2012,2012-02-21
40-10-2015,2015-10-20
2024-05-03T08:48:37.564206Z,2024-05-03
681584400,1991-08-08
2025-08-31T09:58:32.621921Z,2025-08-31
16.11.2022T15-5-28,2022-11-16
2000_12_09T1_26_1+2500,2000-12-09
05/05/1995,1995-05-05
4-1-2010,2010-01-02
2012-04-15T04:50:07+2500,2012-04-15
1995|02|25,1995-02-25
19970528220500197,1997-05-28
31/8/2034 giờ 11:52:24,2034-08-31
36-3-2017,2017-03-18
18-10-2029,2029-10-09
2034_08_26T4_26_37+3,2034-08-26
19 August 1994,1994-08-19
The system recorded 20110414135119,2011-04-14
2027-07-11T14:31:11,2027-07-11
2010-12-20T16:57:31+2500,2010-12-20
20211112004815,2021-11-12
2032/5/29T195243,2032-05-29
1990-03-08T16:39:14+08,1990-03-08
2032-11-16T01:28:29+00:00,2032-11-16
2009-09-27T13:23:50+2500,2009-09-27
2011-02-20T18:53:35.829694Z,2011-02-20
26/24-2020,2020-12-26
Ngày 8-6-2010,2010-06-08
16/4-2023,2023-02-16
2017-01-28T01:30:35.753884746Z,2017-01-28
5/9/2004 giờ 5:55:30,2004-09-05
20001205211523584565084,2000-12-05
2011-11-28T23:21:52.838Z,2011-11-28
13-06-91,1991-06-13
2006-07-05T01:13:26,2006-07-05
21/22-2015,2015-11-21
19920423001733084897,1992-04-23
29/18-2016,2016-09-29
19910129054237635813,1991-01-29
Event at 2016-04-27T22:8:9,2016-04-27
995734800000000000,2001-07-22
1432573200000000,2015-05-26
2011-07-09T13:57:47Z,2011-07-09
25-5-2012,2012-05-25
2020_10_11T6_51_10+2500,2020-10-11
8 Aug 2015,2015-08-08
18/2/2032 giờ 4:16:29,2032-02-18
06/18/1999,1999-06-18
1991-07-07T21:59:47Z+3,1991-07-07
2030/4/21T34437,2030-04-21
Ngày 12-11-2032,2032-11-12
Sự kiện diễn ra vào 5/8/2023 14:55,2023-08-05
2035-03-15T07:27:06.709Z,2035-03-15
778870800000,1994-09-07
1937494800000000000,2031-05-26
1670605200,2022-12-10
2020/10/15T234225,2020-10-15
2021|10|02,2021-10-02
Event at 2005-01-29T23:51:11,2005-01-29
Ngày 12-8-2020,2020-08-12
19980529235033990288303,1998-05-29
951152400000000,2000-02-22
2028-12-31T17:26:05Z+3,2028-12-31
1.2.2020T13-50-12,2020-02-01
1990-05-12T09:59:52.343Z,1990-05-12
Ngày 25-7-2002,2002-07-25
ngày 16 tháng 4 năm 2023,2023-04-16
25/12-2003,2003-06-25
"February 17, 1996",1996-02-17
2035-10-31T02:11:15.067Z,2035-10-31
16 January 2003,2003-01-16
30/8-2008,2008-04-30
"16th of March, 2017",2017-03-16
20000121080924893710508,2000-01-21
2015-01-06T02:38:11+3,2015-01-06
20050816231418160240,2005-08-16
2030-06-08T16:27:55.375978191Z,2030-06-08
The system recorded 20300701165226,2030-07-01
2010|02|08,2010-02-08
"April 1, 2014",2014-04-01
Event at 2006-10-22T9:8:44,2006-10-22
950806800000000,2000-02-18
2031_01_09T11_56_34+0500,2031-01-09
5 June 2018,2018-06-05
2017-06-03T13:22:55.843165881Z,2017-06-03
1994-01-05T00:02:57.376Z,1994-01-05
2019-04-26T14:50:23.427Z,2019-04-26
06-29-2021,2021-06-29
2024-10-09T12:49:51,2024-10-09
20180216235753772229,2018-02-16
"October 26, 2000",2000-10-26
"31th of December, 2005",2005-12-31
28 tháng 6 năm 1990,1990-06-28
1994/11/1T52829,1994-11-01
2018-06-14T12:02:43.499Z,2018-06-14
20150814013758,2015-08-14
22-3-2025,2025-03-22
20081103005809,2008-11-03
20181229045100272337380,2018-12-29
14.12.1995T14-32-54,1995-12-14
18/3/1996,1996-03-18
30 Mar 2006,2006-03-30
"9th of May, 1996",1996-05-09
19990524183353569,1999-05-24
757530000000000000,1994-01-03
07/06/1999,1999-07-06
2011-09-28T20:28:52.435577Z,2011-09-28
Ngày 25-11-2001,2001-11-25
1783789200,2026-07-12
1997-08-05T10:57:15.938100Z,1997-08-05
09|24|2020,2020-09-24
2034/4/24T14326,2034-04-24
"10th of May, 2005",2005-05-10
8-12-2021,2021-12-04
Sự kiện diễn ra vào 15/9/1999 2:6,1999-09-15
1161709200000000000,2006-10-25
2023_11_20,2023-11-20
The system recorded 20041003020219,2004-10-03
11_8_2008,2008-08-11
ngày 4 tháng 3 năm 2026,2026-03-04
2029-09-18T08:07:40.339145512Z,2029-09-18
20220302011815,2022-03-02
2034-01-16T08:37:28.907226Z,2034-01-16
2022-04-20T06:20:06.646120Z,2022-04-20
2017-03-28T12:09:17.001366729Z,2017-03-28
2016-05-23T10:27:11.896033Z,2016-05-23
25 tháng 5 năm 2035,2035-05-25
20270407142851568046,2027-04-07
"12th of May, 1997",1997-05-12
2028-12-04T01:16:27,2028-12-04
03/23/2007,2007-03-23
19910526013147578,1991-05-26
Ngày 30-3-1991,1991-03-30
20050501131646,2005-05-01
Event at 2014-02-27T15:30:47,2014-02-27
Ngày 22-11-2008,2008-11-22
1192899600000000000,2007-10-21
1582563600,2020-02-25
Sự kiện diễn ra vào 2/11/2026 11:5,2026-11-02
1990-08-23T04:49:09.258Z,1990-08-23
20170908190010759,2017-09-08
1091638800000000,2004-08-05
The system recorded 20001209233403,2000-12-09
1114534800,2005-04-27
25/1/2018 giờ 18:49:21,2018-01-25
"October 7, 1995",1995-10-07
12-21-1999,1999-12-21
2024-12-03T17:36:15Z+3,2024-12-03
15|11|99,1999-11-15
15 tháng 3 năm 2028,2028-03-15
5 5 2013,2013-05-05
2025-12-10T18:26:16.975065126Z,2025-12-10
9-7-2001,2001-07-09
15 7 2015,2015-07-15
28/4-1993,1993-02-28
24-11-1994,1994-11-24
30 tháng 5 năm 2003,2003-05-30
1939482000000,2031-06-18
Event at 1990-02-27T1:57:43,1990-02-27
21 Jan 1996,1996-01-21
2013 11 16,2013-11-16
07_04_06,2006-04-07
1583686800,2020-03-09
29.4.1995T6-12-33,1995-04-29
"10th of December, 2032",2032-12-10
2008-08-18T09:02:17.767901Z,2008-08-18
2014_06_17T15_40_53+08,2014-06-17
19 tháng 10 năm 2021,2021-10-19
20320525100337571226,2032-05-25
2016-03-01T06:56:25+2500,2016-03-01
20351014120623065748,2035-10-14
2014-08-15T07:40:28.405Z,2014-08-15
"August 5, 2026",2026-08-05
10/23/2005,2005-10-23
1997-12-04T19:07:27.557818828Z,1997-12-04
1341680400000,2012-07-08
2011-02-15T13:05:45.000183482Z,2011-02-15
2012/11/25T172944,2012-11-25
ngày 22 tháng 6 năm 1994,1994-06-22
Event at 2020-11-04T1:8:29,2020-11-04
8 tháng 11 năm 2009,2009-11-08
2034-11-03T07:12:55,2034-11-03
19950422220834634,1995-04-22
21_09_29,2029-09-21
"April 15, 2023",2023-04-15
1994-05-10T13:15:07.390446365Z,1994-05-10
Ngày 11-4-2031,2031-04-11
2012-11-14T23:09:46,2012-11-14
1996-08-04T09:40:13Z+3,1996-08-04
2016/12/17T34311,2016-12-17
20260526055206,2026-05-26
2016-03-03T13:19:28.130515068Z,2016-03-03
28 11 29,2029-11-28
2033_10_02T18_59_44+0500,2033-10-02
1993-04-29T15:23:42+08,1993-04-29
27/4-2000,2000-02-27
839091600000000000,1996-08-04
1995-03-04T05:08:25+2500,1995-03-04
The system recorded 20320420165318,2032-04-20
"10th of September, 2008",2008-09-10
1990-07-24T13:56:58+08,1990-07-24
1999/1/3T9946,1999-01-03
3 July 1990,1990-07-03
20210217095524246008751,2021-02-17
27/5/2029 giờ 13:26:52,2029-05-27
Ngày 10-11-2007,2007-11-10
2/6-2035,2035-03-02
28 tháng 6 năm 2004,2004-06-28
1606928400,2020-12-03
2020-03-31T00:35:59+2500,2020-03-31
Ngày 13-12-2035,2035-12-13
19921111170142582,1992-11-11
08_26_2007,2007-08-26
1990-09-30T21:41:13.453Z,1990-09-30
646938000000000000,1990-07-03
1553274000,2019-03-23
20.7.2033T0-25-44,2033-07-20
3 November 2009,2009-11-03
The system recorded 20190221231345,2019-02-21
3/20-2002,2002-10-03
2028/10/12T64122,2028-10-12
6/4-1991,1991-02-06
Ngày 25-12-2008,2008-12-25
2026/8/16T15030,2026-08-16
14_9_2030,2030-09-14
01 08 2010,2010-01-08
25 9 1998,1998-09-25
1998-02-04T05:15:42Z+3,1998-02-04
799088400000000,1995-04-29
42-12-2005,2005-12-21
20-2-2009,2009-02-10
Sự kiện diễn ra vào 7/7/1991 20:57,1991-07-07
"4th of June, 1998",1998-06-04
2009-12-13T00:36:03Z+3,2009-12-13
20011121064246221,2001-11-21
3-12-2006,2006-12-03
2004-01-26T16:11:39+2500,2004-01-26
20280824202947577624716,2028-08-24
1.7.2018T22-16-49,2018-07-01
30 June 2003,2003-06-30
1235926800000000,2009-03-02
4 tháng 3 năm 1993,1993-03-04
20171208064318871,2017-12-08
"July 24, 2025",2025-07-24
20330806163656127105094,2033-08-06
20310406001604528646,2031-04-06
1997|08|21,1997-08-21
2005/5/16T21103,2005-05-16
1698253200000,2023-10-26
18-05-13,2013-05-18
1576342800000,2019-12-15
Sự kiện diễn ra vào 14/1/2018 3:21,2018-01-14
1526835600000000000,2018-05-21
941734800000000000,1999-11-05
2007-08-19T01:25:28+2500,2007-08-19
1625418000,2021-07-05
5 Jun 2022,2022-06-05
32-11-2017,2017-11-16
1994-05-10T18:26:23.645578733Z,1994-05-10
Ngày 29-12-2032,2032-12-29
2025-10-04T02:06:47.715Z,2025-10-04
15 September 2008,2008-09-15
2026-12-15T23:01:21.983290Z,2026-12-15
4/4/2002 giờ 22:51:33,2002-04-04
4 tháng 7 năm 2025,2025-07-04
28 April 2003,2003-04-28
20010622114633717,2001-06-22
30/7/2022 giờ 16:32:54,2022-07-30
50-9-2007,2007-09-25
ngày 11 tháng 1 năm 2029,2029-01-11
2001-12-13T04:33:12,2001-12-13
20-8-2026,2026-08-10
1738429200000000,2025-02-02
2017_03_08T3_52_17+0500,2017-03-08
The system recorded 20351215192111,2035-12-15
13/10-2014,2014-05-13
1990285200000,2033-01-26
07/18/2028,2028-07-18
20130319011020,2013-03-19
8/6/2008 giờ 12:32:16,2008-06-08
19970213021100942276552,1997-02-13
1319562000000000,2011-10-26
18-05-32,2032-05-18
845830800,1996-10-21
ngày 11 tháng 12 năm 2033,2033-12-11
13/18-1991,1991-09-13
19980705113823575,1998-07-05
1993_02_13T4_52_25+2500,1993-02-13
28-12-2007,2007-12-14
2021/1/14T44718,2021-01-14
"August 16, 2011",2011-08-16
19911001031020070818533,1991-10-01
14-8-2032,2032-08-07
"23th of June, 1995",1995-06-23
1994-01-17T02:01:29+00:00,1994-01-17
1732294800000,2024-11-23
ngày 3 tháng 3 năm 2021,2021-03-03
2021|09|18,2021-09-18
"February 22, 2001",2001-02-22
2024_01_19T17_9_2+07:00,2024-01-19
16-10-2028,2028-10-08
1994-07-24T01:59:02.258684Z,1994-07-24
The system recorded 20320221023601,2032-02-21
9 Feb 2010,2010-02-09
20000918081029,2000-09-18
Ngày 28-5-2022,2022-05-28
2004/04/15,2004-04-15
Ngày 9-2-2002,2002-02-09
26 tháng 2 năm 2033,2033-02-26
6/7/2005 giờ 14:47:57,2005-07-06
1997-09-07T11:46:22+00:00,1997-09-07
21.7.2029T19-30-14,2029-07-21
Event at 2006-11-11T23:32:16,2006-11-11
20090924023911284535,2009-09-24
The system recorded 20270417090806,2027-04-17
13-5-1997,1997-05-13
1996-06-16T07:12:44+2500,1996-06-16
15-9-2035,2035-09-15
2013-11-29T19:57:16,2013-11-29
5.3.2011T13-8-12,2011-03-05
ngày 3 tháng 9 năm 1997,1997-09-03
"25th of January, 2022",2022-01-25
20230720014228,2023-07-20
2002-04-03T03:34:39.598922Z,2002-04-03
Ngày 18-2-2035,2035-02-18
48-5-2014,2014-05-24
1388941200000000000,2014-01-06
1994-07-05T21:08:42Z+3,1994-07-05
20260804121548087,2026-08-04
1990-11-18T02:35:12Z+3,1990-11-18
"18th of July, 2012",2012-07-18
"23th of November, 2010",2010-11-23
"22th of February, 2020",2020-02-22
20060421142006970,2006-04-21
Event at 2022-04-15T0:8:27,2022-04-15
20160319214625199117,2016-03-19
2030-05-28T22:50:38.508746Z,2030-05-28
2034-01-19T23:42:26.992368Z,2034-01-19
52-3-1997,1997-03-26
2034-09-28T19:52:26+0500,2034-09-28
18/12-1999,1999-06-18
"May 12, 1992",1992-05-12
1993-01-21T08:48:41.661Z,1993-01-21
"January 13, 1993",1993-01-13
2001-07-17T02:04:54Z+3,2001-07-17
2052925200000,2035-01-21
"12th of May, 2006",2006-05-12
20040322215122532146,2004-03-22
14 March 2014,2014-03-14
3 Aug 2004,2004-08-03
1774803600000,2026-03-30
ngày 4 tháng 7 năm 1993,1993-07-04
20 Jul 2032,2032-07-20
1563382800000000,2019-07-18
2003-11-08T01:16:56Z+3,2003-11-08
1534611600,2018-08-19
1997_01_10,1997-01-10
9/11/2006 giờ 19:35:12,2006-11-09
2027-12-30T06:12:59.680Z,2027-12-30
2016-03-14T02:37:15+08,2016-03-14
03/22/2018,2018-03-22
2032 10 03,2032-10-03
1996-01-27T19:23:04.096Z,1996-01-27
1997-02-13T02:29:30.197Z,1997-02-13
2033-07-25T20:49:33.893873090Z,2033-07-25
6 January 2025,2025-01-06
2003-03-02T01:20:57,2003-03-02
1992-06-16T04:36:00.309Z,1992-06-16
04 09 2017,2017-04-09
2004_04_07T2_20_55+0500,2004-04-07
1586883600,2020-04-15
ngày 9 tháng 9 năm 2015,2015-09-09
Sự kiện diễn ra vào 28/7/1998 2:42,1998-07-28
785782800000,1994-11-26
1650042000000000000,2022-04-16
1996-04-27T05:14:46Z+3,1996-04-27
Sự kiện diễn ra vào 12/11/1995 18:0,1995-11-12
776451600000,1994-08-10
10-2-2003,2003-02-10
1763658000000000,2025-11-21
Ngày 12-12-2021,2021-12-12
2004627600,2033-07-11
2019-05-03T05:24:20Z+3,2019-05-03
26 tháng 9 năm 2024,2024-09-26
2057331600000000,2035-03-13
7 tháng 5 năm 1992,1992-05-07
1995_02_13T17_6_13Z,1995-02-13
The system recorded 20240405181553,2024-04-05
The system recorded 20230210044152,2023-02-10
2011/10/11T163733,2011-10-11
2024-06-28T08:04:08.772627739Z,2024-06-28
4 tháng 11 năm 2033,2033-11-04
ngày 16 tháng 3 năm 1990,1990-03-16
20141207144338017,2014-12-07
2034-10-30T14:24:37.185Z,2034-10-30
1631120400000000000,2021-09-09
2070032400,2035-08-07
2021562000000,2034-01-23
"30th of July, 1994",1994-07-30
1382115600000000,2013-10-19
25.03.28,2028-03-25
20210310011351433113734,2021-03-10
1042995600000000,2003-01-20
24/07/25,2025-07-24
19980220173502515,1998-02-20
15.01.22,2022-01-15
16/1/1992 giờ 22:42:0,1992-01-16
06 16 2009,2009-06-16
2020-08-15T05:03:53+2500,2020-08-15
2012-05-13T17:51:22Z+3,2012-05-13
20241126073648319555073,2024-11-26
"19th of October, 2002",2002-10-19
12-3-2025,2025-03-06
1997-03-25,1997-03-25
24/12-1991,1991-06-24
Ngày 21-2-2002,2002-02-21
ngày 19 tháng 10 năm 1994,1994-10-19
15 05 08,2008-05-15
"December 27, 2002",2002-12-27
2008-06-27T18:10:42.149Z,2008-06-27
6_1_2031,2031-01-06
2029-05-11T10:28:54+2500,2029-05-11
1408208400000,2014-08-17
ngày 6 tháng 6 năm 2022,2022-06-06
Ngày 16-2-2010,2010-02-16
"July 21, 2027",2027-07-21
24 tháng 8 năm 2028,2028-08-24
2033-07-04T22:55:30.973462Z,2033-07-04
Event at 2002-08-04T2:40:59,2002-08-04
2011-08-26T23:22:11Z+3,2011-08-26
12 Feb 2032,2032-02-12
10 Jul 2027,2027-07-10
Event at 2022-05-05T5:12:12,2022-05-05
2009-07-12T10:04:00.363Z,2009-07-12
Sự kiện diễn ra vào 26/8/2001 0:21,2001-08-26
19.7.1992T1-52-39,1992-07-19
20151129052822413,2015-11-29
2016-10-24T13:12:57Z+3,2016-10-24
ngày 27 tháng 5 năm 2011,2011-05-27
19990202151425916261,1999-02-02
12/08/1990,1990-12-08
20160804062310,2016-08-04
"18th of August, 1999",1999-08-18
2027-02-13T10:43:35+2500,2027-02-13
20050531125923373626401,2005-05-31
747853200000000000,1993-09-13
30 September 2023,2023-09-30
07.12.2011,2011-07-12
2023-01-24T19:05:12.250Z,2023-01-24
8/6/1991 giờ 11:15:26,1991-06-08
25.1.2005,2005-01-25
2002-04-06T02:23:17.864Z,2002-04-06
2001/5/9T05748,2001-05-09
2012-06-04T23:05:37Z+3,2012-06-04
"18th of January, 2017",2017-01-18
Ngày 28-1-2002,2002-01-28
21.02.18,2018-02-21
1589302800000,2020-05-13
2009-01-29T13:53:31,2009-01-29
Sự kiện diễn ra vào 27/6/1993 21:44,1993-06-27
4.6.2012T2-59-45,2012-06-04
Sự kiện diễn ra vào 19/4/2004 7:58,2004-04-19
2020-01-30T23:19:06+0500,2020-01-30
2001-01-29T10:59:39.459Z,2001-01-29
22-2-2033,2033-02-22
17-8-2013,2013-08-17
The system recorded 20050720125556,2005-07-20
08|07|2000,2000-08-07
2014-03-25T23:38:46.183399Z,2014-03-25
1992-12-04T12:48:32,1992-12-04
The system recorded 20150414172729,2015-04-14
654454800000000000,1990-09-28
2006-01-20T21:49:57-05:00,2006-01-20
Event at 2016-05-29T6:2:19,2016-05-29
2004-03-10T20:15:13.670422Z,2004-03-10
The system recorded 20340902020217,2034-09-02
29.5.1993T16-10-9,1993-05-29
24 May 1992,1992-05-24
ngày 18 tháng 4 năm 2010,2010-04-18
20000401085819117314672,2000-04-01
02|01|2008,2008-02-01
2012_12_23,2012-12-23
713466000000000000,1992-08-11
Sự kiện diễn ra vào 25/8/2022 18:10,2022-08-25
17-12-93,1993-12-17
9 Dec 2032,2032-12-09
748890000000000000,1993-09-25
16 09 99,1999-09-16
Sự kiện diễn ra vào 19/5/2004 7:19,2004-05-19
20300830060317865859,2030-08-30
24-11-26,2026-11-24
7 Jul 1995,1995-07-07
1993-01-12T03:34:15.672977Z,1993-01-12
660243600,1990-12-04
2014390800000000000,2033-11-01
Event at 2023-05-22T16:38:9,2023-05-22
20171113060813878290,2017-11-13
Ngày 17-1-2007,2007-01-17
20340327083230910,2034-03-27
5 Jun 1993,1993-06-05
1996-08-15T13:35:55.589611090Z,1996-08-15
19980615181739755859,1998-06-15
The system recorded 20100109081718,2010-01-09
3 tháng 8 năm 2018,2018-08-03
15.6.2008T13-44-4,2008-06-15
"22th of August, 1995",1995-08-22
20190605031008346,2019-06-05
2029-11-27T02:21:32.928Z,2029-11-27
1129741200000,2005-10-20
"15th of September, 2030",2030-09-15
1998-12-14T06:41:22.671Z,1998-12-14
19980718134839,1998-07-18
694717200000,1992-01-07
1375549200000000,2013-08-04
25-5-2019,2019-05-25
1 Feb 2002,2002-02-01
52-8-2005,2005-08-26
29 Apr 2004,2004-04-29
1092934800000,2004-08-20
20090927102234,2009-09-27
19971107053736,1997-11-07
23.12.2016T5-57-21,2016-12-23
6/22-2034,2034-11-06
23/14-2035,2035-07-23
32-8-1994,1994-08-16
31/3/2000 giờ 15:38:38,2000-03-31
2026-09-16T04:38:58.836669075Z,2026-09-16
The system recorded 20070614202918,2007-06-14
24-1-2023,2023-01-24
20300312062016105807366,2030-03-12
09|12|2013,2013-09-12
1995-08-06T08:58:02+00:00,1995-08-06
2013-10-03T06:21:21+2500,2013-10-03
2028_06_26T2_36_47+00:00,2028-06-26
13 May 1990,1990-05-13
Sự kiện diễn ra vào 17/4/2005 8:13,2005-04-17
21.5.2014,2014-05-21
ngày 18 tháng 11 năm 1995,1995-11-18
7.7.1991T17-19-49,1991-07-07
11/6/1993 giờ 17:30:34,1993-06-11
18.7.2021T10-27-11,2021-07-18
2001-03-03T02:57:39,2001-03-03
5.10.2017,2017-10-05
6-7-2030,2030-07-03
1998-09-30T04:06:14-0330,1998-09-30
Sự kiện diễn ra vào 14/10/2012 16:17,2012-10-14
2032-01-06T19:56:56.073950025Z,2032-01-06
1847811600000,2028-07-22
Sự kiện diễn ra vào 18/5/2003 0:3,2003-05-18
1997-03-21T06:12:13.727766348Z,1997-03-21
Sự kiện diễn ra vào 8/6/2012 17:37,2012-06-08
3 May 2027,2027-05-03
Sự kiện diễn ra vào 25/1/2007 15:33,2007-01-25
2018-05-19T08:45:51Z+3,2018-05-19
Ngày 3-10-2031,2031-10-03
20150625120206749,2015-06-25
21|06|04,2004-06-21
20021009054106957,2002-10-09
3/24-2025,2025-12-03
1/8-1995,1995-04-01
807037200,1995-07-30
50-6-1995,1995-06-25
2019_08_08,2019-08-08
24.3.2010T7-28-14,2010-03-24
15/2/2026,2026-02-15
29/12-2013,2013-06-29
2007-08-05T08:22:30+2500,2007-08-05
Sự kiện diễn ra vào 15/5/2022 9:2,2022-05-15
19941030150652,1994-10-30
2026-05-25T23:50:59.061Z,2026-05-25
25-9-2021,2021-09-25
Ngày 19-1-2002,2002-01-19
10-23-2031,2031-10-23
17.5.2004T8-36-1,2004-05-17
Sự kiện diễn ra vào 2/1/2023 2:27,2023-01-02
Ngày 2-1-1992,1992-01-02
13/18-1993,1993-09-13
680634000000,1991-07-28
26 June 2024,2024-06-26
2026-07-12T10:07:51.349819Z,2026-07-12
6/6/2031 giờ 22:0:13,2031-06-06
2008-02-11T13:05:38-0330,2008-02-11
Event at 1991-02-06T2:53:45,1991-02-06
20011119200650219711503,2001-11-19
"25th of June, 1990",1990-06-25
2026-07-20T10:37:23.377727801Z,2026-07-20
16.9.2021T11-6-13,2021-09-16
"August 30, 2035",2035-08-30
Event at 2001-03-12T23:38:58,2001-03-12
10 Feb 2029,2029-02-10
2013_08_09T18_55_38+07:00,2013-08-09
"26th of December, 1995",1995-12-26
2008-07-17T00:59:32.013713Z,2008-07-17
03.30.2019,2019-03-30
28/6-2021,2021-03-28
23/2/2027 giờ 23:36:32,2027-02-23
20021112062235699974,2002-11-12
Ngày 14-11-2028,2028-11-14
13 tháng 2 năm 2033,2033-02-13
2020-02-08T22:21:55+2500,2020-02-08
20040202080924358369610,2004-02-02
1249923600,2009-08-11
The system recorded 20170429012522,2017-04-29
12|28|2026,2026-12-28
2064243600000000000,2035-06-01
20030626102345,2003-06-26
13.1.2013T9-36-51,2013-01-13
2000-05-25T09:13:49.781Z,2000-05-25
16/2/2028 giờ 23:20:17,2028-02-16
20210616211537432168315,2021-06-16
20220819021247225,2022-08-19
14/9/2027 giờ 12:33:28,2027-09-14
2000_08_05T11_57_15Z,2000-08-05
The system recorded 20351007143605,2035-10-07
1999_10_26T9_58_5-05:00,1999-10-26
2005.11.16,2005-11-16
38-9-2021,2021-09-19
"February 5, 1999",1999-02-05
7/4-2032,2032-02-07
2030-12-14T12:18:50,2030-12-14
5/2/1999 giờ 4:52:15,1999-02-05
Ngày 9-11-2021,2021-11-09
21.2.2023T6-31-51,2023-02-21
1|3|2002,2002-03-01
11.25.2015,2015-11-25
30.10.1995T4-6-23,1995-10-30
661280400000000,1990-12-16
1843232400,2028-05-30
1999_04_12T21_37_23-05:00,1999-04-12
19900113081946,1990-01-13
20041205095041694058415,2004-12-05
20300404231505007876294,2030-04-04
8-2-2033,2033-02-04
1346950800000000000,2012-09-07
20251021153226453332,2025-10-21
2028-02-04T16:19:02.749925383Z,2028-02-04
3-12-2000,2000-12-03
20020307190017,2002-03-07
1722358800000,2024-07-31
979837200000000,2001-01-19
Ngày 25-7-2033,2033-07-25
980874000,2001-01-31
2030-05-18T06:32:45,2030-05-18
Ngày 21-12-2006,2006-12-21
Sự kiện diễn ra vào 15/9/2028 3:21,2028-09-15
1999-05-29T06:59:13.228Z,1999-05-29
2011 04 14,2011-04-14
"9th of June, 2006",2006-06-09
16 tháng 2 năm 2019,2019-02-16
2015-08-10T20:12:23,2015-08-10
30 tháng 8 năm 2027,2027-08-30
26.9.2001T8-0-3,2001-09-26
2015_04_22T1_35_12-05:00,2015-04-22
12-07-03,2003-07-12
2004-02-19T21:31:44+2500,2004-02-19
2000-07-24T18:58:23Z+3,2000-07-24
2007651600000000,2033-08-15
Event at 2023-12-16T20:51:8,2023-12-16
8 May 2017,2017-05-08
40-2-2034,2034-02-20
20-1-1996,1996-01-10
ngày 2 tháng 12 năm 2000,2000-12-02
"5th of July, 1997",1997-07-05
"8th of March, 2010",2010-03-08
2044285200000000,2034-10-13
20010523211210650,2001-05-23
"28th of July, 2009",2009-07-28
1997.07.27,1997-07-27
7/12/2016 giờ 22:40:16,2016-12-07
2068477200000,2035-07-20
2007-10-23T16:30:00,2007-10-23
50-10-2024,2024-10-25
2004-02-17T12:38:23.977708Z,2004-02-17
The system recorded 20031026040212,2003-10-26
1650387600000000,2022-04-20
24-9-2019,2019-09-24
2010-06-26T04:30:16+0500,2010-06-26
31/7/2009 giờ 17:18:4,2009-07-31
1994-12-12T06:23:52Z+3,1994-12-12
2014/7/28T374,2014-07-28
1995-12-28T22:10:34Z+3,1995-12-28
2023-03-22T10:53:06.966538122Z,2023-03-22
2034-01-05T00:32:00,2034-01-05
2032-06-30T17:12:56-0300,2032-06-30
16 Nov 2011,2011-11-16
"June 7, 2033",2033-06-07
31.8.2012T10-38-34,2012-08-31
1993-03-04T21:17:46.567432Z,1993-03-04
1997-03-25T01:52:57.210141Z,1997-03-25
01-03-23,2023-03-01
7 9 2001,2001-09-07
Sự kiện diễn ra vào 29/4/2018 6:9,2018-04-29
9 Jun 2015,2015-06-09
1998-04-26T20:29:12Z+3,1998-04-26
6 Nov 1998,1998-11-06
14-7-2028,2028-07-14
1842627600000000,2028-05-23
6 January 2003,2003-01-06
20220503000820769751132,2022-05-03
2009_11_08T2_11_5+2500,2009-11-08
2007_04_13T12_11_2Z,2007-04-13
2023-06-11T18:35:37,2023-06-11
13.10.2027T16-20-38,2027-10-13
20220305161410514755,2022-03-05
1736010000,2025-01-05
27.8.2008T5-20-47,2008-08-27
22 Jan 2030,2030-01-22
1732554000,2024-11-26
23 July 2022,2022-07-23
20280807121058948460,2028-08-07
20/05/99,1999-05-20
20041011184907474093392,2004-10-11
"February 10, 1996",1996-02-10
20300320041542295283,2030-03-20
"3rd of April, 2002",2002-04-03
2023-07-10T13:31:26Z+3,2023-07-10
06.07.28,2028-07-06
"29th of November, 1998",1998-11-29
Event at 1994-12-21T16:8:40,1994-12-21
"November 7, 2000",2000-11-07
24.4.2003T20-47-31,2003-04-24
20151001212239,2015-10-01
2009|08|12,2009-08-12
20240609015758678913301,2024-06-09
27/10/2000 giờ 8:16:1,2000-10-27
900176400000000000,1998-07-12
2012-12-22T19:43:57Z+3,2012-12-22
28-5-1993,1993-05-14
6/12/2010 giờ 7:24:37,2010-12-06
"18th of December, 2018",2018-12-18
25-06-00,2000-06-25
23|02|09,2009-02-23
Event at 2022-12-25T7:24:17,2022-12-25
9 tháng 1 năm 1995,1995-01-09
2033-10-12T15:30:54.585Z,2033-10-12
2003_03_24T3_9_49Z+3,2003-03-24
20190319163047565,2019-03-19
26 August 2004,2004-08-26
1992-06-28T10:59:48Z,1992-06-28
20020627024142293352,2002-06-27
1047488400000000,2003-03-13
1990-03-13T23:18:15.103Z,1990-03-13
2027-05-24T11:06:11.267539Z,2027-05-24
1993-10-10T22:01:24.691869092Z,1993-10-10
21/08/01,2001-08-21
2021-10-13T13:55:47,2021-10-13
2/11/2017 giờ 3:14:54,2017-11-02
2001/9/9T73130,2001-09-09
Ngày 6-10-2005,2005-10-06
14|09|16,2016-09-14
Event at 2001-01-06T19:23:31,2001-01-06
20120823045411632992,2012-08-23
Sự kiện diễn ra vào 26/12/2030 12:52,2030-12-26
2035-10-02T02:35:03.696023835Z,2035-10-02
40-3-2018,2018-03-20
2003-07-28T17:31:16Z+3,2003-07-28
2004-12-14T06:52:20Z+3,2004-12-14
13.8.2012,2012-08-13
"11th of December, 2019",2019-12-11
20080404001717910471044,2008-04-04
25/16-2007,2007-08-25
22-11-2014,2014-11-11
Sự kiện diễn ra vào 27/8/2028 10:26,2028-08-27
2033-08-13T03:44:44.625545167Z,2033-08-13
20/2-1991,1991-01-20
Event at 2010-03-11T0:39:47,2010-03-11
28 February 1992,1992-02-28
12-2-2018,2018-02-12
20160414084056574,2016-04-14
1943370000,2031-08-02
20.8.2001T16-23-3,2001-08-20
18/6-2025,2025-03-18
1992-03-04T22:40:01.810161Z,1992-03-04
The system recorded 20210526071203,2021-05-26
2000566800,2033-05-25
20190207054032,2019-02-07
891795600000,1998-04-06
19960730045420,1996-07-30
2018/7/8T155717,2018-07-08
40-10-1991,1991-10-20
2011-07-23T09:44:06Z+3,2011-07-23
1991-06-24T20:38:27+2500,1991-06-24
"February 11, 2029",2029-02-11
Sự kiện diễn ra vào 24/11/2035 17:38,2035-11-24
13 tháng 3 năm 2027,2027-03-13
1992-06-30T10:31:08.551143Z,1992-06-30
"August 22, 2004",2004-08-22
2014-08-21T06:18:15,2014-08-21
Event at 1992-12-31T17:59:28,1992-12-31
2010_08_11T15_5_14-0330,2010-08-11
20340602232324467,2034-06-02
1177088400,2007-04-21
1290445200,2010-11-23
52-4-2019,2019-04-26
1895331600000000,2030-01-23
2012-10-19T11:00:25,2012-10-19
2015_03_27T6_17_11-0300,2015-03-27
1187542800000000000,2007-08-20
2008-07-12T07:40:15.476Z,2008-07-12
2034/4/4T222345,2034-04-04
2033/5/5T102642,2033-05-05
2004-05-09T13:26:46,2004-05-09
1991-11-12T20:17:02,1991-11-12
2021-10-25T06:58:39Z+3,2021-10-25
2028-07-16T02:17:43.089944Z,2028-07-16
10/22-2026,2026-11-10
12 12 2019,2019-12-12
31 Mar 1993,1993-03-31
"5th of October, 2009",2009-10-05
24-3-2011,2011-03-12
The system recorded 20061128115941,2006-11-28
6 March 2003,2003-03-06
ngày 12 tháng 1 năm 2014,2014-01-12
03_07_06,2006-07-03
The system recorded 20110131024829,2011-01-31
ngày 16 tháng 1 năm 1990,1990-01-16
868381200000000,1997-07-09
03|10|92,1992-10-03
"September 15, 2019",2019-09-15
1444842000,2015-10-15
"31th of March, 2023",2023-03-31
"July 14, 1999",1999-07-14
2013-04-23T10:55:26.816370Z,2013-04-23
1198170000000,2007-12-21
19950722073216,1995-07-22
1996-07-13T14:59:45+2500,1996-07-13
Sự kiện diễn ra vào 14/1/2027 0:0,2027-01-14
1997-07-11,1997-07-11
2007/11/18T23850,2007-11-18
2019-07-23T13:02:11-0300,2019-07-23
14-3-2033,2033-03-14
2003.09.30,2003-09-30
941130000000000,1999-10-29
ngày 7 tháng 9 năm 1995,1995-09-07
01|06|02,2002-06-01
19940314170753,1994-03-14
2018-10-28T21:40:07+3,2018-10-28
20280827192725815149,2028-08-27
14_9_2027,2027-09-14
30|09|31,2031-09-30
13/4-2023,2023-02-13
20020901124412372248,2002-09-01
10/02/2015,2015-10-02
20110518210626149893,2011-05-18
15/14-2013,2013-07-15
1991-03-20T00:57:45.230235Z,1991-03-20
2011/4/21T21953,2011-04-21
22 8 2019,2019-08-22
13_8_1996,1996-08-13
20090425120636,2009-04-25
20180514120917,2018-05-14
Ngày 7-1-2029,2029-01-07
2025-10-18T02:00:48,2025-10-18
2.8.2005T16-2-53,2005-08-02
29 June 2020,2020-06-29
19950703174254436147,1995-07-03
20200427084356550829,2020-04-27
20140113045923654203825,2014-01-13
The system recorded 20100928101455,2010-09-28
2046618000000,2034-11-09
1814029200,2027-06-27
20310122101346887059181,2031-01-22
The system recorded 20050327000318,2005-03-27
20110827152752008421624,2011-08-27
832525200,1996-05-20
14.10.1995,1995-10-14
20171129035805754764395,2017-11-29
1998-01-17T09:59:10.265614Z,1998-01-17
20240627104020438815,2024-06-27
1990-02-09T19:31:07.800Z,1990-02-09
1996-02-15T16:24:45-0300,1996-02-15
Ngày 12-2-2003,2003-02-12
"February 9, 2010",2010-02-09
ngày 4 tháng 4 năm 2032,2032-04-04
25.8.1998T0-51-1,1998-08-25
2028-07-29T21:46:34.361828Z,2028-07-29
The system recorded 20051126123204,2005-11-26
"July 25, 1995",1995-07-25
25.1.2034T12-39-35,2034-01-25
1991-08-30T20:01:03.992927540Z,1991-08-30
28/3/2017 giờ 7:55:26,2017-03-28
The system recorded 20020923063705,2002-09-23
2/5/1997 giờ 2:51:16,1997-05-02
1994-01-03T12:19:46+2500,1994-01-03
2004-09-09T05:03:57.633059833Z,2004-09-09
Sự kiện diễn ra vào 31/7/1997 18:13,1997-07-31
2003-12-10T20:01:48.962982Z,2003-12-10
4 tháng 4 năm 1998,1998-04-04
"7th of June, 1991",1991-06-07
2017-08-19T09:25:36+2500,2017-08-19
2025_10_20T3_11_24Z,2025-10-20
2/20-1990,1990-10-02
29 Sep 2001,2001-09-29
1292000400000000000,2010-12-11
2022-12-22T06:27:23.659993453Z,2022-12-22
2021_05_12T14_33_38Z,2021-05-12
24-1-2019,2019-01-24
1/16-2011,2011-08-01
The system recorded 20190712155147,2019-07-12
"3rd of March, 1991",1991-03-03
18 4 1993,1993-04-18
ngày 13 tháng 1 năm 2008,2008-01-13
2009-03-09T23:09:26Z+3,2009-03-09
Ngày 16-2-2016,2016-02-16
2007-01-30T22:29:30Z+3,2007-01-30
07 21 2006,2006-07-21
22 April 2020,2020-04-22
20071201210054,2007-12-01
1293123600000000000,2010-12-24
5-6-2015,2015-06-05
1783616400000000,2026-07-10
1997|10|15,1997-10-15
20340623163011804304,2034-06-23
ngày 21 tháng 6 năm 2032,2032-06-21
1994-07-09T17:04:32.792758Z,1994-07-09
25 tháng 1 năm 2014,2014-01-25
The system recorded 20051116103835,2005-11-16
25 tháng 11 năm 2015,2015-11-25
19/5/2001,2001-05-19
6-6-1992,1992-06-03
3 tháng 4 năm 2021,2021-04-03
2003-02-14T05:32:21-05:00,2003-02-14
31/3/1996 giờ 22:4:25,1996-03-31
2067786000000000000,2035-07-12
Ngày 2-1-1992,1992-01-02
1707670800,2024-02-12
2013-04-29T09:53:13Z+3,2013-04-29
10/2/2000 giờ 21:31:45,2000-02-10
2020-10-01T06:41:01.714827Z,2020-10-01
1834074000000000000,2028-02-14
20120806091721665,2012-08-06
20130929212450,2013-09-29
23.3.2002T12-35-4,2002-03-23
8.2.2021T21-27-7,2021-02-08
2026-11-23T14:39:14Z+3,2026-11-23
2023-04-17T01:12:32Z+3,2023-04-17
2011-11-11T20:40:31.686009Z,2011-11-11
2000-09-19T01:37:50.605710227Z,2000-09-19
2034_09_10T1_27_3-0330,2034-09-10
1543683600000000,2018-12-02
2031930000000000,2034-05-23
11 tháng 10 năm 2002,2002-10-11
The system recorded 20340108015708,2034-01-08
15 tháng 3 năm 1992,1992-03-15
"3rd of December, 2005",2005-12-03
01-16-2011,2011-01-16
09|04|95,1995-04-09
22/06/29,2029-06-22
9-5-2010,2010-05-09
2010-07-15T00:13:10+2500,2010-07-15
ngày 21 tháng 2 năm 1998,1998-02-21
"June 13, 2012",2012-06-13
20050603201408,2005-06-03
2013-12-21T18:37:00+2500,2013-12-21
1995-06-23T04:13:40.532Z,1995-06-23
13-6-2008,2008-06-13
1991-01-19T12:36:06.351624058Z,1991-01-19
22-10-1994,1994-10-11
19911231151020737,1991-12-31
Event at 2032-09-09T3:38:1,2032-09-09
Ngày 25-5-2019,2019-05-25
20191105112917727657,2019-11-05
1991-01-16T02:20:29.780286Z,1991-01-16
2011-05-04T01:40:24Z+3,2011-05-04
Ngày 24-2-2015,2015-02-24
29-2-2028,2028-02-29
ngày 18 tháng 11 năm 2028,2028-11-18
3/3/2031 giờ 4:5:59,2031-03-03
36-2-2019,2019-02-18
15/3/1992 giờ 0:19:19,1992-03-15
20201013052601808609139,2020-10-13
Event at 2003-04-30T8:36:39,2003-04-30
Ngày 19-11-2023,2023-11-19
20060326091807802738251,2006-03-26
29/12/2030 giờ 18:9:38,2030-12-29
"19th of December, 2009",2009-12-19
Ngày 17-3-2000,2000-03-17
Sự kiện diễn ra vào 24/10/2000 18:7,2000-10-24
13_4_2034,2034-04-13
2 tháng 8 năm 2006,2006-08-02
2 tháng 3 năm 2012,2012-03-02
Event at 2025-04-19T15:19:33,2025-04-19
17.1.1996T5-54-59,1996-01-17
2027-11-03T21:56:55Z+3,2027-11-03
14 02 15,2015-02-14
30 June 2033,2033-06-30
2015-11-22T01:54:56Z+3,2015-11-22
6 Aug 2003,2003-08-06
"28th of July, 2017",2017-07-28
20.10.2014,2014-10-20
2007-02-21T20:35:53.494357Z,2007-02-21
1115830800000000,2005-05-12
36-12-2034,2034-12-18
ngày 26 tháng 1 năm 2027,2027-01-26
2016-08-18T12:39:53,2016-08-18
20060615055804,2006-06-15
"June 23, 2012",2012-06-23
2024-07-02T13:22:05.381Z,2024-07-02
26 Jun 1993,1993-06-26
Sự kiện diễn ra vào 2/10/1993 2:35,1993-10-02
19 May 2004,2004-05-19
1540141200000,2018-10-22
1441645200000,2015-09-08
2015-11-13T10:47:07.820900835Z,2015-11-13
Ngày 21-1-2031,2031-01-21
The system recorded 20020617105352,2002-06-17
1996-02-07T17:07:29.895218543Z,1996-02-07
"January 15, 2021",2021-01-15
1532538000000,2018-07-26
22/8-2017,2017-04-22
3/3/2032 giờ 16:48:55,2032-03-03
1994-01-12T02:20:00,1994-01-12
20180111174852843086,2018-01-11
2012-03-30T15:56:50.098541Z,2012-03-30
The system recorded 20291103110423,2029-11-03
16/3/1999 giờ 21:22:28,1999-03-16
Sự kiện diễn ra vào 4/11/2030 0:52,2030-11-04
19941207183249783,1994-12-07
24.8.2000T18-44-37,2000-08-24
1992/1/30T163523,1992-01-30
30.1.1996T1-25-50,1996-01-30
917715600,1999-01-31
20020224090709124927,2002-02-24
1992-03-01T15:14:06.192923Z,1992-03-01
2029-05-26T14:48:15.232452849Z,2029-05-26
21 Sep 2005,2005-09-21
2027_05_19T22_50_57Z,2027-05-19
ngày 11 tháng 3 năm 2013,2013-03-11
20250704093312900789265,2025-07-04
20/6/2012 giờ 11:2:5,2012-06-20
30-9-2021,2021-09-30
08/01/99,1999-01-08
56-3-2035,2035-03-28
16-6-2033,2033-06-08
7 May 2006,2006-05-07
09/07/26,2026-07-09
13|2|2034,2034-02-13
20351226175733139862,2035-12-26
3-11-2034,2034-11-03
1897923600,2030-02-22
2014_06_24T0_15_46Z+3,2014-06-24
1996-03-15T17:20:42,1996-03-15
ngày 15 tháng 4 năm 1999,1999-04-15
20240303102935654734,2024-03-03
2016-10-28T01:47:53.117832220Z,2016-10-28
03_12_98,1998-12-03
20050204151134886887686,2005-02-04
2000_04_30T23_29_35+3,2000-04-30
24|07|15,2015-07-24
2020-07-02T00:31:47+3,2020-07-02
20320803023838344019,2032-08-03
17-10-2035,2035-10-17
"February 8, 2029",2029-02-08
20081101081827042058,2008-11-01
31-3-2012,2012-03-31
2001-05-16,2001-05-16
19910802185143473,1991-08-02
1998-09-10T18:27:19.727401Z,1998-09-10
The system recorded 19960909221324,1996-09-09
27.11.2005T5-43-58,2005-11-27
2030-04-22T21:07:46Z,2030-04-22
Ngày 14-8-2003,2003-08-14
2020-11-28T01:13:12+07:00,2020-11-28
2023-05-30T12:54:19+2500,2023-05-30
1994_04_13T9_20_2+3,1994-04-13
2-12-1996,1996-12-02
2033_08_14T3_14_35+3,2033-08-14
20141213003324697,2014-12-13
2018_09_01T9_59_24+2500,2018-09-01
26.2.1997T9-58-25,1997-02-26
"May 28, 2013",2013-05-28
2011-12-02T20:12:57.257066Z,2011-12-02
20 Sep 2029,2029-09-20
ngày 22 tháng 8 năm 2011,2011-08-22
1886605200000000,2029-10-14
20201015034957207216,2020-10-15
1307293200000000000,2011-06-06
58-8-1997,1997-08-29
Ngày 25-9-2024,2024-09-25
3/6/2012 giờ 11:44:28,2012-06-03
2015-12-21T08:47:40+08,2015-12-21
1994-07-13T10:42:41+2500,1994-07-13
Ngày 8-5-2016,2016-05-08
Sự kiện diễn ra vào 26/7/2019 5:55,2019-07-26
19970618061027791020149,1997-06-18
2025-10-23T08:28:01+2500,2025-10-23
2024.08.28,2024-08-28
20230601171113921877646,2023-06-01
2040656400000000000,2034-09-01
2011/10/10T1353,2011-10-10
30 tháng 12 năm 2001,2001-12-30
20020723000636793080031,2002-07-23
2026-09-10T00:53:36+2500,2026-09-10
1995/4/25T17156,1995-04-25
2020-04-22T14:06:08Z+3,2020-04-22
20060419094839,2006-04-19
10 Feb 1991,1991-02-10
ngày 2 tháng 12 năm 1993,1993-12-02
ngày 21 tháng 2 năm 2030,2030-02-21
2002_01_02T5_30_1Z+3,2002-01-02
30/1/1994 giờ 6:25:9,1994-01-30
2009-10-16T05:07:48Z,2009-10-16
1864054800000000000,2029-01-26
Sự kiện diễn ra vào 9/3/2032 0:0,2032-03-09
19970602055558,1997-06-02
29.10.2002T6-0-17,2002-10-29
14/2/2014 giờ 6:18:4,2014-02-14
2035-05-28T13:33:26+2500,2035-05-28
2061651600,2035-05-02
"24th of February, 2021",2021-02-24
21.9.2003,2003-09-21
20171101020132737888574,2017-11-01
2010|01|08,2010-01-08
1990-09-28T05:49:09,1990-09-28
Event at 2016-04-26T18:51:33,2016-04-26
2015.02.28,2015-02-28
7.3.2023T21-28-37,2023-03-07
2027/9/21T17599,2027-09-21
Sự kiện diễn ra vào 8/10/2027 20:42,2027-10-08
04-18-1995,1995-04-18
2016_09_03T15_0_6Z+3,2016-09-03
19951017021115071,1995-10-17
988304400,2001-04-27
20350621175758521,2035-06-21
20170514042055939531,2017-05-14
20110910143752610260,2011-09-10
4.10.2029,2029-10-04
1993-07-31T04:26:10.452459Z,1993-07-31
13-3-1998,1998-03-13
2026-12-27T13:26:16+2500,2026-12-27
ngày 9 tháng 12 năm 2027,2027-12-09
1894208400000,2030-01-10
20000327023453962,2000-03-27
2001517200000000,2033-06-05
2026-09-03T21:48:23,2026-09-03
2024-02-05T12:20:07Z+3,2024-02-05
24 tháng 9 năm 2018,2018-09-24
1996-01-07T23:06:15.162748Z,1996-01-07
"19th of October, 2026",2026-10-19
23 July 2016,2016-07-23
9-8-1994,1994-08-09
2007/10/19T134522,2007-10-19
04.01.2026,2026-04-01
1700758800,2023-11-24
"6th of August, 1995",1995-08-06
2029-07-04T22:40:40,2029-07-04
21/4-2018,2018-02-21
19 Jan 2029,2029-01-19
23/8/2028 giờ 17:0:32,2028-08-23
31_1_2003,2003-01-31
2035-10-08T18:12:01Z+3,2035-10-08
38-10-2018,2018-10-19
24_02_20,2020-02-24
10.14.2004,2004-10-14
19-03-30,2030-03-19
Ngày 19-6-1998,1998-06-19
20080909201752,2008-09-09
2024-05-24T12:57:02,2024-05-24
1996-01-14T17:51:17+2500,1996-01-14
4.9.1995T9-57-14,1995-09-04
48-1-2002,2002-01-24
2030-09-16T06:32:16,2030-09-16
28-3-2010,2010-03-14
1953997200000000,2031-12-03
1 Nov 1997,1997-11-01
2047222800000000000,2034-11-16
3-5-2015,2015-05-03
10/15/2016,2016-10-15
30/18-1997,1997-09-30
8/18-2008,2008-09-08
"9th of July, 2034",2034-07-09
14/11/2004 giờ 4:45:25,2004-11-14
2031-08-26T11:15:54.803Z,2031-08-26
2008|11|10,2008-11-10
The system recorded 19920628051002,1992-06-28
"December 30, 1994",1994-12-30
2000-05-23T23:24:47,2000-05-23
1044291600000000,2003-02-04
2006-06-22T09:01:43.107Z,2006-06-22
1989075600000000,2033-01-12
24-6-2017,2017-06-24
19910228121821200,1991-02-28
"January 26, 2000",2000-01-26
2006_04_03T8_29_54+08,2006-04-03
20041027102301224,2004-10-27
1993/1/9T201114,1993-01-09
2032_04_12T21_2_30+08,2032-04-12
20100114103835,2010-01-14
19960131043420318402567,1996-01-31
17.11.1992T22-52-32,1992-11-17
19951003110359142035,1995-10-03
2001-07-22T00:05:59.302925Z,2001-07-22
19990921193059787757164,1999-09-21
1933434000,2031-04-09
19960209071927,1996-02-09
06_05_00,2000-05-06
2035-12-08T22:38:25.654Z,2035-12-08
2011-10-03T20:56:54.298605918Z,2011-10-03
5 tháng 1 năm 2034,2034-01-05
2009-06-29T19:05:37.715Z,2009-06-29
21 April 1999,1999-04-21
ngày 11 tháng 5 năm 2023,2023-05-11
31-7-2006,2006-07-31
1 Nov 2019,2019-11-01
Sự kiện diễn ra vào 25/7/2001 3:27,2001-07-25
20240826214422316,2024-08-26
2000-06-21T20:25:39Z+3,2000-06-21
2031/04/05,2031-04-05
1993.07.29,1993-07-29
2034-01-14T21:01:31,2034-01-14
2001-04-13T18:07:57.569Z,2001-04-13
1315242000000,2011-09-06
2026-11-02T04:21:42Z,2026-11-02
Event at 2018-06-21T20:33:20,2018-06-21
2031-02-20T07:36:28,2031-02-20
20240321133849104938688,2024-03-21
"December 21, 2030",2030-12-21
2015-05-19T07:55:19.605807Z,2015-05-19
26_1_2025,2025-01-26
1998-05-11T01:55:43,1998-05-11
3.8.2021T0-29-27,2021-08-03
18 Nov 1993,1993-11-18
The system recorded 20150325053517,2015-03-25
16-7-2001,2001-07-16
2001_05_22T21_6_53+08,2001-05-22
1016211600000000,2002-03-16
ngày 5 tháng 1 năm 2018,2018-01-05
2034/6/10T22013,2034-06-10
3 Nov 2003,2003-11-03
23/4-2001,2001-02-23
2007-11-10T05:38:14+2500,2007-11-10
22 Jul 2019,2019-07-22
3_3_2003,2003-03-03
4 Apr 1990,1990-04-04
16 Mar 2009,2009-03-16
The system recorded 20220902072849,2022-09-02
1/20-2016,2016-10-01
2034-06-03T10:43:14.882222298Z,2034-06-03
Sự kiện diễn ra vào 8/11/2011 11:30,2011-11-08
20041007215906,2004-10-07
16-4-2009,2009-04-16
19/8-1991,1991-04-19
2011-07-20T05:04:17+2500,2011-07-20
8/4-1997,1997-02-08
"March 24, 2021",2021-03-24
20150621181450,2015-06-21
20210301215850799,2021-03-01
1097946000000000000,2004-10-17
20050622080420281082,2005-06-22
20201018030340,2020-10-18
Ngày 22-9-2008,2008-09-22
2006-08-16T07:57:53.420Z,2006-08-16
1591635600000,2020-06-09
660157200000000,1990-12-03
2003504400000,2033-06-28
15-5-1990,1990-05-15
26/18-1991,1991-09-26
2026-12-27T05:45:44+07:00,2026-12-27
20000823011131,2000-08-23
2007-10-19T04:04:01.791377379Z,2007-10-19
2028-08-09T10:11:28-0300,2028-08-09
20001013013912667,2000-10-13
2009-03-05T18:27:54.064092483Z,2009-03-05
2028-06-18T08:35:06.083517354Z,2028-06-18
14 October 2012,2012-10-14
2004-05-25T16:59:56.016Z,2004-05-25
28 August 2017,2017-08-28
29 tháng 1 năm 2001,2001-01-29
1996-01-27T16:21:38,1996-01-27
19/18-2033,2033-09-19
2021-08-19T15:42:52,2021-08-19
22.7.2010,2010-07-22
Event at 2031-11-03T8:21:58,2031-11-03
12-5-2028,2028-05-06
ngày 22 tháng 12 năm 1996,1996-12-22
"9th of April, 2013",2013-04-09
Event at 2005-09-10T6:23:46,2005-09-10
Event at 2016-02-03T0:9:33,2016-02-03
2013-04-23T19:23:57,2013-04-23
20050509123021,2005-05-09
2024-11-27T12:16:31Z+3,2024-11-27
ngày 31 tháng 10 năm 2002,2002-10-31
2032-02-12T16:24:50.723679515Z,2032-02-12
Event at 1995-05-10T16:53:39,1995-05-10
"December 9, 2005",2005-12-09
2012|09|16,2012-09-16
25 2 2007,2007-02-25
22/14-2028,2028-07-22
2008-11-28T02:07:11,2008-11-28
2033-11-07T05:52:44.664163038Z,2033-11-07
2030-11-12T22:41:53+2500,2030-11-12
19930423191657,1993-04-23
20341115181037879938420,2034-11-15
20170913123044178,2017-09-13
09.11.2027,2027-09-11
8 June 2032,2032-06-08
1137603600,2006-01-19
20180820212406010315,2018-08-20
2030-07-24T16:25:54,2030-07-24
2025-08-17T01:57:22,2025-08-17
Event at 2021-11-17T21:44:13,2021-11-17
The system recorded 20041004030208,2004-10-04
21 tháng 4 năm 2029,2029-04-21
ngày 15 tháng 6 năm 2028,2028-06-15
26/12-2022,2022-06-26
2008-10-23T07:35:56Z+3,2008-10-23
756666000000000000,1993-12-24
20220502013010361,2022-05-02
ngày 14 tháng 3 năm 2010,2010-03-14
12/9/2004 giờ 3:22:50,2004-09-12
24.9.2026,2026-09-24
20341022085950590102352,2034-10-22
1377104400,2013-08-22
8-2-2007,2007-02-08
11.20.2003,2003-11-20
20070628130932164403865,2007-06-28
"July 19, 2027",2027-07-19
19 July 2002,2002-07-19
2022-10-12T04:12:44.056622655Z,2022-10-12
Event at 1993-01-27T15:44:51,1993-01-27
"November 14, 2032",2032-11-14
17.08.91,1991-08-17
2017_03_09,2017-03-09
22/12-2023,2023-06-22
1994-08-06T19:02:30+3,1994-08-06
2001-05-17T16:17:52+2500,2001-05-17
1992_06_05T8_37_29+08,1992-06-05
08 13 2029,2029-08-13
19900629185208626,1990-06-29
5/6/2011 giờ 9:23:28,2011-06-05
Event at 2031-10-28T23:5:57,2031-10-28
20040319202454,2004-03-19
"15th of October, 1994",1994-10-15
27/7/2004 giờ 14:59:1,2004-07-27
19990628043445733,1999-06-28
1274979600,2010-05-28
2005-04-02T18:00:20-0300,2005-04-02
"April 17, 2012",2012-04-17
19910521084006867,1991-05-21
1603299600000000000,2020-10-22
16-4-2025,2025-04-16
2020-07-07T04:45:44.996476Z,2020-07-07
22-1-2033,2033-01-11
20210103004804225,2021-01-03
2/3/1992 giờ 6:57:38,1992-03-02
1337533200,2012-05-21
ngày 19 tháng 11 năm 1999,1999-11-19
1999-09-12T04:37:11-0330,1999-09-12
20130705041207256,2013-07-05
"December 24, 2005",2005-12-24
"10th of October, 2023",2023-10-10
2017-01-22T20:04:46Z+3,2017-01-22
Event at 1992-04-30T1:14:58,1992-04-30
1.8.2001T0-15-31,2001-08-01
Ngày 3-1-1998,1998-01-03
15 June 2008,2008-06-15
9 December 2018,2018-12-09
12-9-2021,2021-09-06
2010-08-18T08:14:58,2010-08-18
The system recorded 19921223024235,1992-12-23
1678554000,2023-03-12
747162000000000000,1993-09-05
894214800,1998-05-04
2008_12_24T16_2_19+08,2008-12-24
16/10/2033 giờ 14:22:7,2033-10-16
1991-11-23T18:35:23.923Z,1991-11-23
18-4-2011,2011-04-09
2029-06-22T01:18:06Z+3,2029-06-22
2072710800000000000,2035-09-07
1.8.2027T19-36-12,2027-08-01
ngày 16 tháng 7 năm 2022,2022-07-16
Sự kiện diễn ra vào 5/6/1998 2:44,1998-06-05
28/16-2001,2001-08-28
2025/5/2T204340,2025-05-02
8 Dec 2019,2019-12-08
14 tháng 5 năm 2004,2004-05-14
26 Jun 2011,2011-06-26
16 Dec 2032,2032-12-16
24/12-2016,2016-06-24
"December 26, 2004",2004-12-26
17 February 2003,2003-02-17
1610902800,2021-01-18
2007-04-23T10:37:19.207Z,2007-04-23
"18th of December, 2028",2028-12-18
2011-03-18T23:30:29.017948Z,2011-03-18
19960622143635239431,1996-06-22
The system recorded 19900416125004,1990-04-16
The system recorded 20190212073032,2019-02-12
25/12/2027 giờ 10:26:18,2027-12-25
27.10.1996T5-5-32,1996-10-27
2010-08-15T00:23:41.086Z,2010-08-15
20221127133306429,2022-11-27
20280815034926970827495,2028-08-15
1994-08-06T04:18:02+2500,1994-08-06
2035-12-03T08:34:20.733Z,2035-12-03
19910418132425817079602,1991-04-18
14 tháng 5 năm 2022,2022-05-14
"21th of December, 1997",1997-12-21
The system recorded 19940626150940,1994-06-26
11|16|2009,2009-11-16
1341939600000,2012-07-11
1994-12-16T02:37:32.813544210Z,1994-12-16
1998_05_07T3_39_52+07:00,1998-05-07
The system recorded 20010224184328,2001-02-24
21/02/97,1997-02-21
2010|03|22,2010-03-22
20051012052108825092065,2005-10-12
1836838800000000,2028-03-17
2016-09-07T05:21:57.166588Z,2016-09-07
"2nd of April, 2010",2010-04-02
1991/7/1T11348,1991-07-01
10-10-2008,2008-10-05
20250503195435713369,2025-05-03
2029_09_11T21_27_45+00:00,2029-09-11
"December 31, 1998",1998-12-31
2008-07-16T19:07:17.213760Z,2008-07-16
"12th of November, 1994",1994-11-12
"18th of January, 2022",2022-01-18
22-6-2001,2001-06-11
The system recorded 20230913162216,2023-09-13
"March 31, 2026",2026-03-31
Ngày 23-10-1996,1996-10-23
"24th of February, 1995",1995-02-24
12-2-2012,2012-02-06
1358787600000000000,2013-01-22
Ngày 5-2-2016,2016-02-05
1 tháng 9 năm 1996,1996-09-01
1078592400000000000,2004-03-07
1995-07-10T20:37:21Z+3,1995-07-10
1092502800,2004-08-15
21/14-2022,2022-07-21
26 August 2010,2010-08-26
1257958800,2009-11-12
20310917183737693,2031-09-17
20070211152708441926,2007-02-11
17/6/2030 giờ 17:41:53,2030-06-17
27_12_2007,2007-12-27
1993-10-11T01:47:31+07:00,1993-10-11
20270221085235,2027-02-21
19901124073604072349,1990-11-24
29/5/2000 giờ 3:57:14,2000-05-29
23 tháng 5 năm 2031,2031-05-23
1264698000000000000,2010-01-29
1/14-1999,1999-07-01
2024-06-16T09:03:56.070524768Z,2024-06-16
1858438800000,2028-11-22
5/2-2016,2016-01-05
14-9-2013,2013-09-14
1994-07-07T15:03:45.739740Z,1994-07-07
32-9-2007,2007-09-16
Event at 2007-03-03T5:41:32,2007-03-03
1991-02-19T23:36:25+3,1991-02-19
19900608112408234947210,1990-06-08
21-12-2034,2034-12-21
2035/3/1T15342,2035-03-01
20290514140859,2029-05-14
1824138000000,2027-10-22
03.22.2005,2005-03-22
20001205060704122,2000-12-05
20141224110515496351682,2014-12-24
1632330000,2021-09-23
2011_11_05T22_17_8Z,2011-11-05
Sự kiện diễn ra vào 26/8/2032 4:20,2032-08-26
30/2-1995,1995-01-30
2068218000000000,2035-07-17
Sự kiện diễn ra vào 2/4/2035 17:23,2035-04-02
22 tháng 5 năm 2007,2007-05-22
"January 7, 1992",1992-01-07
12-9-2015,2015-09-06
Event at 2003-08-08T11:18:9,2003-08-08
The system recorded 20210105062321,2021-01-05
Event at 1991-08-30T11:28:9,1991-08-30
2006355600000000,2033-07-31
26 Mar 2024,2024-03-26
20070609053823946,2007-06-09
2033-11-24T17:44:48.901Z,2033-11-24
The system recorded 19921012112305,1992-10-12
2027-04-19T05:32:39+2500,2027-04-19
52-5-2020,2020-05-26
2032-05-03T20:34:04.964523Z,2032-05-03
1079542800000,2004-03-18
34-6-2006,2006-06-17
19941206130953389,1994-12-06
2026-03-25T20:59:56+2500,2026-03-25
11_6_2021,2021-06-11
15 tháng 3 năm 2017,2017-03-15
54-1-2000,2000-01-27
1640106000000,2021-12-22
2034_01_05T10_25_7-0330,2034-01-05
1788368400,2026-09-03
ngày 4 tháng 8 năm 2001,2001-08-04
790448400000,1995-01-19
Sự kiện diễn ra vào 27/5/2016 12:58,2016-05-27
17-7-2022,2022-07-17
Sự kiện diễn ra vào 12/6/2013 5:50,2013-06-12
ngày 25 tháng 7 năm 2030,2030-07-25
20040601120224096276333,2004-06-01
"27th of September, 1993",1993-09-27
1440090000000000000,2015-08-21
19960117172840,1996-01-17
1998|10|02,1998-10-02
14_3_2006,2006-03-14
2024-07-17T10:19:15.307285Z,2024-07-17
2017-11-03T22:27:39.688095740Z,2017-11-03
The system recorded 20250215124323,2025-02-15
971974800000,2000-10-20
20220220123541,2022-02-20
9 tháng 8 năm 2006,2006-08-09
1100797200,2004-11-19
"August 6, 2034",2034-08-06
1994-05-19T14:16:09+2500,1994-05-19
984157200000000,2001-03-10
19981205155336186523,1998-12-05
1999-09-20T13:27:04+2500,1999-09-20
23 Sep 2031,2031-09-23
"August 22, 2025",2025-08-22
2027/7/8T153818,2027-07-08
1993|05|29,1993-05-29
"24th of July, 2013",2013-07-24
ngày 6 tháng 6 năm 1994,1994-06-06
2017-08-24T02:37:00.557930Z,2017-08-24
4 10 2015,2015-10-04
Sự kiện diễn ra vào 28/7/2012 20:25,2012-07-28
Event at 2022-09-09T22:32:39,2022-09-09
"23th of January, 2007",2007-01-23
4-9-2033,2033-09-02
1997-06-18T08:17:33Z+3,1997-06-18
28 tháng 8 năm 1991,1991-08-28
3 tháng 3 năm 1993,1993-03-03
2014_05_21,2014-05-21
2004.08.12,2004-08-12
Ngày 15-7-1998,1998-07-15
13-11-2010,2010-11-13
2026.05.24,2026-05-24
22-7-2023,2023-07-22
2027_10_09T10_7_22+2500,2027-10-09
1997-12-20T04:13:44.684724Z,1997-12-20
20010813094845249796052,2001-08-13
22.10.03,2003-10-22
1991-02-12T21:35:35+2500,1991-02-12
2000-09-13T15:40:48+2500,2000-09-13
1105376400000000000,2005-01-11
634842000000000000,1990-02-13
659984400,1990-12-01
20040104050032374270,2004-01-04
ngày 6 tháng 8 năm 2022,2022-08-06
1947862800,2031-09-23
2010-03-06T21:04:10.481591Z,2010-03-06
29 tháng 7 năm 1990,1990-07-29
"3rd of October, 2006",2006-10-03
The system recorded 20310910002410,2031-09-10
1994-11-02T21:39:35+08,1994-11-02
23 06 11,2011-06-23
20160403155620505865,2016-04-03
1.4.2000T13-20-22,2000-04-01
20051222214826750902564,2005-12-22
11.10.2006T22-34-56,2006-10-11
2000_05_25T23_56_34+3,2000-05-25
20130131100258618988,2013-01-31
"August 15, 2034",2034-08-15
745261200,1993-08-14
20160321131000655,2016-03-21
34-2-2025,2025-02-17
"November 17, 2005",2005-11-17
"March 29, 1996",1996-03-29
1203267600000000,2008-02-18
4/12/2030 giờ 3:0:23,2030-12-04
20 02 03,2003-02-20
1992-05-11T16:26:16.303Z,1992-05-11
16.5.2008T4-20-40,2008-05-16
6/11/1992 giờ 4:47:24,1992-11-06
20280814233657201671,2028-08-14
2000-03-23T19:47:49,2000-03-23
2058109200000000,2035-03-22
Sự kiện diễn ra vào 4/9/2023 13:20,2023-09-04
27_5_2001,2001-05-27
2026-05-18T09:31:46.706802231Z,2026-05-18
670179600,1991-03-29
ngày 19 tháng 2 năm 1994,1994-02-19
ngày 28 tháng 4 năm 2028,2028-04-28
19951006074539457303336,1995-10-06
Event at 2026-04-20T6:59:43,2026-04-20
2020/10/17T63428,2020-10-17
Event at 2032-04-01T9:11:42,2032-04-01
1067792400000,2003-11-03
2032_11_27T4_32_48+07:00,2032-11-27
07/28/2033,2033-07-28
2014-09-21T01:31:06+2500,2014-09-21
1539709200000,2018-10-17
1992/6/6T20848,1992-06-06
1998/2/8T54645,1998-02-08
2003-06-06T11:43:17+2500,2003-06-06
2021_10_06T8_34_6-0330,2021-10-06
The system recorded 20230216082653,2023-02-16
20270621061501655893227,2027-06-21
863715600000,1997-05-16
07-14-2005,2005-07-14
30/11/2023 giờ 7:9:43,2023-11-30
9/22-2001,2001-11-09
13 tháng 4 năm 2009,2009-04-13
15/11/1993 giờ 15:22:39,1993-11-15
1705338000000000000,2024-01-16
2035-10-13T11:34:55+2500,2035-10-13
14-11-35,2035-11-14
2018-08-29T18:41:02.951Z,2018-08-29
1762189200000000000,2025-11-04
2027/5/26T03448,2027-05-26
2019-09-02T00:08:08+00:00,2019-09-02
08.14.2022,2022-08-14
4.4.2034T4-54-18,2034-04-04
"5th of December, 2007",2007-12-05
20120603165153688861,2012-06-03
2001-02-16T22:20:42.939Z,2001-02-16
01-18-2001,2001-01-18
1990/1/19T223531,1990-01-19
"29th of August, 2017",2017-08-29
9-4-2013,2013-04-09
2022-07-24T05:03:04Z+3,2022-07-24
1024419600000,2002-06-19
9.2.1991T19-49-32,1991-02-09
12-12-1994,1994-12-12
10/18-2035,2035-09-10
20050320180520067944,2005-03-20
2035-11-01T05:22:49Z+3,2035-11-01
1696438800000000000,2023-10-05
13-11-2011,2011-11-13
16-11-2002,2002-11-08
2017/1/16T1195,2017-01-16
Sự kiện diễn ra vào 18/4/2017 15:31,2017-04-18
2005-11-26T02:18:25.015Z,2005-11-26
2034-11-22T11:28:26.431Z,2034-11-22
Ngày 19-2-2030,2030-02-19
1992-06-08T08:39:47.811804Z,1992-06-08
19921102211140,1992-11-02
23.2.1996,1996-02-23
21/2-2010,2010-01-21
16-6-2028,2028-06-08
The system recorded 19950107070621,1995-01-07
The system recorded 20050712222938,2005-07-12
"July 23, 2012",2012-07-23
2021-10-26T06:10:16.337841347Z,2021-10-26
2011|03|21,2011-03-21
1990-10-06T18:09:11.956Z,1990-10-06
1991-06-06T14:36:14+00:00,1991-06-06
07|10|04,2004-10-07
19941124001952402,1994-11-24
8 September 1990,1990-09-08
Sự kiện diễn ra vào 16/2/2025 11:29,2025-02-16
1998-07-09T18:32:13.941909895Z,1998-07-09
"16th of August, 2014",2014-08-16
24/8/2012 giờ 6:30:27,2012-08-24
"10th of February, 2002",2002-02-10
1361725200000,2013-02-25
1437325200000000000,2015-07-20
26 Dec 2010,2010-12-26
24|6|2021,2021-06-24
2014-06-24T04:22:38+2500,2014-06-24
Event at 2003-04-06T17:48:10,2003-04-06
20190720074714,2019-07-20
20331117183320,2033-11-17
2004|10|02,2004-10-02
Sự kiện diễn ra vào 1/6/2021 8:44,2021-06-01
11-5-2021,2021-05-11
2007 11 04,2007-11-04
20330715003139990407,2033-07-15
ngày 23 tháng 6 năm 2009,2009-06-23
17/14-2024,2024-07-17
The system recorded 20011225233542,2001-12-25
2033/7/2T42427,2033-07-02
2033-08-08T11:17:59+07:00,2033-08-08
2002-07-25T04:21:45.113675Z,2002-07-25
1999/5/3T221257,1999-05-03
ngày 8 tháng 5 năm 2024,2024-05-08
1995-10-22T07:20:43Z+3,1995-10-22
2026/10/05,2026-10-05
20050530043852,2005-05-30
1997_10_31T17_52_46-0300,1997-10-31
1996-12-23T01:17:39+2500,1996-12-23
1175101200,2007-03-29
2012/4/4T11357,2012-04-04
2008-10-15T16:15:20.029999646Z,2008-10-15
Sự kiện diễn ra vào 1/6/2032 17:32,2032-06-01
1995-11-21T06:20:16+0500,1995-11-21
1994259600,2033-03-13
28.7.2010T0-37-47,2010-07-28
"December 26, 2016",2016-12-26
21/2-2015,2015-01-21
4.2.2026T14-7-56,2026-02-04
2018-01-08T09:55:52.676318Z,2018-01-08
2026-03-18T19:46:02.207670084Z,2026-03-18
31-1-2001,2001-01-31
2029-10-11T18:33:34,2029-10-11
03/25/2022,2022-03-25
4.8.2000T14-8-38,2000-08-04
2030-10-27T21:02:04+07:00,2030-10-27
2005-07-08T10:14:47.423990Z,2005-07-08
Ngày 2-11-2027,2027-11-02
30 tháng 7 năm 2025,2025-07-30
"June 19, 2018",2018-06-19
ngày 2 tháng 11 năm 2031,2031-11-02
42-6-2012,2012-06-21
The system recorded 20100107032453,2010-01-07
993142800000,2001-06-22
2002-03-03T13:36:49.796158Z,2002-03-03
"2nd of January, 2033",2033-01-02
1554310800,2019-04-04
2010-06-08T02:21:04,2010-06-08
ngày 3 tháng 5 năm 2028,2028-05-03
2030/1/20T20719,2030-01-20
ngày 28 tháng 1 năm 2009,2009-01-28
7.5.2030T11-19-30,2030-05-07
1975510800000,2032-08-08
19980620122552385,1998-06-20
ngày 1 tháng 9 năm 2033,2033-09-01
ngày 7 tháng 4 năm 2035,2035-04-07
1994/1/4T71514,1994-01-04
"9th of November, 2034",2034-11-09
2032-06-29T06:50:04+2500,2032-06-29
22.7.2027T4-25-16,2027-07-22
1726246800,2024-09-14
13-10-1998,1998-10-13
20270219094452085547184,2027-02-19
09-04-1990,1990-09-04
10/07/2029,2029-10-07
"July 8, 1992",1992-07-08
2017/11/19T15938,2017-11-19
20-11-2009,2009-11-20
1653843600000000,2022-05-30
2011-08-04T22:04:30.831781675Z,2011-08-04
Event at 2034-02-28T14:27:36,2034-02-28
1505840400000000000,2017-09-20
20271022180921220,2027-10-22
ngày 29 tháng 4 năm 2028,2028-04-29
1320858000000000,2011-11-10
10 Apr 2010,2010-04-10
ngày 15 tháng 10 năm 2006,2006-10-15
2013-01-21T05:35:48-0300,2013-01-21
694198800000000000,1992-01-01
The system recorded 20101011041903,2010-10-11
8-10-2000,2000-10-08
2015/10/27T10917,2015-10-27
17|2|1998,1998-02-17
2027-07-02T04:06:39.141Z,2027-07-02
The system recorded 20311104202500,2031-11-04
2032_04_30T19_38_23+00:00,2032-04-30
2023-12-07T14:43:03,2023-12-07
21.2.2028T8-52-39,2028-02-21
The system recorded 20040203084315,2004-02-03
27 June 1998,1998-06-27
2019-12-22T06:38:27.596191Z,2019-12-22
2008/9/2T83723,2008-09-02
"September 17, 2015",2015-09-17
20310619080332208777258,2031-06-19
"September 21, 2009",2009-09-21
11.29.2012,2012-11-29
1995-05-30T10:07:02,1995-05-30
01-10-20,2020-10-01
2019-03-04T20:57:15+0500,2019-03-04
20291215200053186,2029-12-15
2027-05-07T16:41:29.642568Z,2027-05-07
20350108165922950768,2035-01-08
1 October 2023,2023-10-01
8-12-2012,2012-12-04
1997-10-06T05:26:58,1997-10-06
20100925002501806,2010-09-25
6-5-2013,2013-05-06
ngày 6 tháng 6 năm 2025,2025-06-06
"January 3, 1990",1990-01-03
20150920062236112,2015-09-20
2013-05-23T03:06:17,2013-05-23
1788886800000000,2026-09-09
20170915192023492960182,2017-09-15
20200724033519599753132,2020-07-24
Event at 2016-07-05T2:39:34,2016-07-05
1998-04-12T04:50:14.455Z,1998-04-12
3 tháng 8 năm 2022,2022-08-03
14 Oct 2027,2027-10-14
20010713155708427,2001-07-13
643222800000,1990-05-21
2017-11-15T20:11:00+07:00,2017-11-15
"December 28, 2032",2032-12-28
20/5/1998 giờ 11:24:43,1998-05-20
11-10-2028,2028-10-11
2032-02-07T08:36:27+2500,2032-02-07
2 tháng 1 năm 2021,2021-01-02
2030_04_16T16_28_55Z+3,2030-04-16
3 tháng 5 năm 1992,1992-05-03
21.3.2021T16-25-32,2021-03-21
Event at 2034-07-08T6:15:12,2034-07-08
2020-02-28T03:14:10+3,2020-02-28
Ngày 28-8-2011,2011-08-28
29 tháng 7 năm 2008,2008-07-29
21 January 2006,2006-01-21
915123600000,1999-01-01
01.26.2018,2018-01-26
28 tháng 3 năm 2008,2008-03-28
1-2-2013,2013-02-01
9 Jul 2024,2024-07-09
Event at 2033-04-25T11:34:15,2033-04-25
1345741200000,2012-08-24
46-5-2001,2001-05-23
Event at 2005-07-02T1:23:34,2005-07-02
1118682000000000000,2005-06-14
1779987600000000,2026-05-29
2029-02-04T23:20:37Z+3,2029-02-04
52-6-1995,1995-06-26
1996-01-21T12:59:28.919Z,1996-01-21
2026-11-12T11:35:38.382119Z,2026-11-12
16|3|1999,1999-03-16
Ngày 14-6-2029,2029-06-14
19 Dec 2005,2005-12-19
4/11/2009 giờ 11:27:52,2009-11-04
Sự kiện diễn ra vào 27/9/2004 10:38,2004-09-27
29/10/2028 giờ 19:0:40,2028-10-29
"April 17, 2017",2017-04-17
9 tháng 2 năm 2001,2001-02-09
20190514102954887169,2019-05-14
8.10.1997T11-55-41,1997-10-08
12 3 2005,2005-03-12
26 October 2034,2034-10-26
2026/6/1T151849,2026-06-01
20260529040156955789,2026-05-29
13 Apr 2000,2000-04-13
17-12-1993,1993-12-17
20180503045357200974,2018-05-03
1993-12-24T03:41:29Z,1993-12-24
2006-08-17T19:54:34+2500,2006-08-17
19940522173456,1994-05-22
ngày 4 tháng 12 năm 2005,2005-12-04
15-5-2015,2015-05-15
2027/9/1T17476,2027-09-01
4/8/2026 giờ 3:1:27,2026-08-04
19930517055221,1993-05-17
27 01 92,1992-01-27
"September 10, 2027",2027-09-10
2027_09_17T11_54_58+0500,2027-09-17
888426000000,1998-02-26
8 4 1995,1995-04-08
24 Apr 1993,1993-04-24
16-5-1992,1992-05-08
"29th of October, 2024",2024-10-29
ngày 24 tháng 2 năm 2021,2021-02-24
9 8 2004,2004-08-09
11|09|2026,2026-11-09
22/4/2009 giờ 6:14:29,2009-04-22
10/12/2020 giờ 20:50:43,2020-12-10
Sự kiện diễn ra vào 1/10/2009 12:28,2009-10-01
1395939600000,2014-03-28
2017/3/30T52526,2017-03-30
16/14-1997,1997-07-16
2024-08-29T22:28:11+2500,2024-08-29
1621616400000000,2021-05-22
1997-07-19T01:53:38.150927Z,1997-07-19
20200924071105337,2020-09-24
26/10-2027,2027-05-26
ngày 6 tháng 6 năm 2027,2027-06-06
1991-08-02T17:40:22Z+3,1991-08-02
2010.04.13,2010-04-13
Ngày 19-1-2013,2013-01-19
Sự kiện diễn ra vào 17/1/2020 14:38,2020-01-17
Sự kiện diễn ra vào 18/1/1999 10:10,1999-01-18
14.10.2031T15-35-32,2031-10-14
11 Jul 1997,1997-07-11
1454346000,2016-02-02
20110523211804516,2011-05-23
"19th of September, 2035",2035-09-19
58-8-2025,2025-08-29
Event at 2033-09-01T13:46:5,2033-09-01
1625072400000000,2021-07-01
Sự kiện diễn ra vào 22/11/2033 10:27,2033-11-22
"13th of June, 2003",2003-06-13
6/16-2034,2034-08-06
1974387600000,2032-07-26
1687021200000,2023-06-18
1109696400,2005-03-02
1356886800,2012-12-31
10/10-2023,2023-05-10
28 tháng 4 năm 2002,2002-04-28
Sự kiện diễn ra vào 10/7/2001 6:35,2001-07-10
The system recorded 19980811095826,1998-08-11
4.8.2010T8-6-38,2010-08-04
1676912400000,2023-02-21
20040419220120255159,2004-04-19
1993-12-18T13:37:45+2500,1993-12-18
19900715122000721583,1990-07-15
20220417075609,2022-04-17
2031-08-29T02:54:20-0300,2031-08-29
1999-12-18T11:51:52.156342420Z,1999-12-18
Sự kiện diễn ra vào 21/6/2014 9:10,2014-06-21
19990228080552763464,1999-02-28
2017_04_08T18_4_18-05:00,2017-04-08
20131231114516888,2013-12-31
1546794000000000,2019-01-07
20000717231214,2000-07-17
15/16-2014,2014-08-15
23 tháng 10 năm 2011,2011-10-23
The system recorded 19930628025828,1993-06-28
2002-12-08T07:38:36.785631887Z,2002-12-08
20 Mar 2031,2031-03-20
1944838800000000000,2031-08-19
19940115133515,1994-01-15
07/08/1999,1999-07-08
19991215155612190,1999-12-15
2011_02_12T18_28_15+00:00,2011-02-12
29 May 2026,2026-05-29
Ngày 12-12-2012,2012-12-12
20 tháng 10 năm 1996,1996-10-20
15 Sep 2019,2019-09-15
31 May 1991,1991-05-31
4 Jul 1998,1998-07-04
2034-03-06T15:33:31+2500,2034-03-06
2028/1/7T233134,2028-01-07
2008-05-28T11:18:38.997931Z,2008-05-28
26 5 2007,2007-05-26
ngày 3 tháng 5 năm 2026,2026-05-03
"15th of May, 2028",2028-05-15
20290320061355362,2029-03-20
28.12.2033T23-35-48,2033-12-28
21.10.2007,2007-10-21
867603600,1997-06-30
The system recorded 19910213072600,1991-02-13
30-4-2033,2033-04-30
1990_11_06T16_27_52+07:00,1990-11-06
05-15-2025,2025-05-15
1992790800000000000,2033-02-24
09|06|2027,2027-09-06
11 Apr 2008,2008-04-11
4-1-1993,1993-01-02
Ngày 10-5-2023,2023-05-10
05.31.2000,2000-05-31
19/2/2013 giờ 22:5:9,2013-02-19
Ngày 8-9-2028,2028-09-08
19940806070335101984,1994-08-06
2034-01-15T02:16:25.348732Z,2034-01-15
Ngày 10-12-2035,2035-12-10
1992/9/24T105432,1992-09-24
1997-07-09T07:37:51.783Z,1997-07-09
"May 14, 1995",1995-05-14
7 November 2020,2020-11-07
2027-05-05T17:29:55+08,2027-05-05
2017/2/23T85949,2017-02-23
20110521225919474360435,2011-05-21
2022-10-24T17:56:25+07:00,2022-10-24
2026 12 28,2026-12-28
30/20-2000,2000-10-30
2033-09-27T17:48:27.267178207Z,2033-09-27
1195750800000,2007-11-23
ngày 30 tháng 1 năm 1993,1993-01-30
20191207051518891,2019-12-07
"August 21, 2024",2024-08-21
14/20-1996,1996-10-14
20350408092520674,2035-04-08
2010-09-19T18:13:26+2500,2010-09-19
1633971600,2021-10-12
2016-07-06T17:35:49.014777771Z,2016-07-06
1-5-2001,2001-05-01
1997-11-18T19:14:36Z+3,1997-11-18
996771600,2001-08-03
2013/5/11T153754,2013-05-11
The system recorded 20050306034809,2005-03-06
10/8/2018 giờ 16:20:51,2018-08-10
Ngày 9-12-2029,2029-12-09
Ngày 15-10-2003,2003-10-15
20170606035606865014,2017-06-06
48-11-2030,2030-11-24
24 tháng 7 năm 2025,2025-07-24
1999-09-24T16:36:23.512766491Z,1999-09-24
2006-11-03T05:50:04+2500,2006-11-03
60-4-1999,1999-04-30
2019-03-10T11:23:45.932Z,2019-03-10
"September 19, 2013",2013-09-19
Ngày 21-7-1999,1999-07-21
2028-11-02T06:12:27,2028-11-02
23.9.2018T5-22-11,2018-09-23
12 tháng 9 năm 2027,2027-09-12
2006-07-15T06:05:44.986Z,2006-07-15
16.12.2020T13-40-1,2020-12-16
"12th of October, 2008",2008-10-12
2034-01-14T09:25:27.060235000Z,2034-01-14
2082387600000000000,2035-12-28
1574701200000000,2019-11-26
2007/4/29T21470,2007-04-29
9 December 2012,2012-12-09
1067101200000000,2003-10-26
17.11.2025T19-16-1,2025-11-17
Sự kiện diễn ra vào 22/1/2019 13:18,2019-01-22
1994-04-24T08:39:16+2500,1994-04-24
1032973200000000,2002-09-26
"8th of April, 2001",2001-04-08
ngày 5 tháng 10 năm 1998,1998-10-05
ngày 19 tháng 6 năm 1993,1993-06-19
1997_06_04T9_17_5+08,1997-06-04
4-2-2024,2024-02-04
2031-09-08T17:02:18,2031-09-08
20/06/96,1996-06-20
1998-07-08T04:50:05+2500,1998-07-08
3/3/2001,2001-03-03
2007_12_06T13_1_1+07:00,2007-12-06
2034-10-20T14:13:58.037064Z,2034-10-20
19920516164229981579444,1992-05-16
5 tháng 10 năm 2014,2014-10-05
2005/10/24T125420,2005-10-24
2023-10-22T00:54:10.994019574Z,2023-10-22
13_02_34,2034-02-13
2019/6/23T184544,2019-06-23
1789837200000000000,2026-09-20
1 October 2011,2011-10-01
7.7.1992,1992-07-07
19_01_95,1995-01-19
19/16-1997,1997-08-19
2000-09-17T01:42:15+2500,2000-09-17
Event at 2015-06-06T15:8:3,2015-06-06
746902800000000000,1993-09-02
Sự kiện diễn ra vào 18/9/1999 13:12,1999-09-18
20150622151415274703697,2015-06-22
19970310022356748,1997-03-10
2002-08-06T05:01:23Z+3,2002-08-06
2005_01_10,2005-01-10
1995_03_01T14_6_31-05:00,1995-03-01
20311224001046,2031-12-24
819997200000000000,1995-12-27
1994-11-20T03:38:07,1994-11-20
20241016094845788942489,2024-10-16
2001-10-27T02:29:41.275096Z,2001-10-27
28-10-2011,2011-10-28
1999-10-13T08:31:37,1999-10-13
1200848400000000000,2008-01-21
1117126800000,2005-05-27
28 tháng 2 năm 2016,2016-02-28
Sự kiện diễn ra vào 19/10/2012 22:41,2012-10-19
2/14-1991,1991-07-02
6.5.2033T9-28-33,2033-05-06
The system recorded 20271218180146,2027-12-18
"November 3, 1992",1992-11-03
20290512170431428,2029-05-12
17.4.2009T18-46-20,2009-04-17
Sự kiện diễn ra vào 31/1/1999 1:20,1999-01-31
1999789200000000,2033-05-16
2034-12-04T14:55:45.181Z,2034-12-04
20290503113119347390,2029-05-03
17/7/2025 giờ 17:0:44,2025-07-17
8/2/2034 giờ 7:7:23,2034-02-08
2006_06_14T14_42_53Z+3,2006-06-14
907002000,1998-09-29
1|1|2010,2010-01-01
Ngày 3-5-2006,2006-05-03
2004-09-08T21:51:33.441919119Z,2004-09-08
6/2/2023 giờ 9:3:42,2023-02-06
Ngày 13-3-2029,2029-03-13
2039619600000000000,2034-08-20
"December 31, 2007",2007-12-31
2009-06-02T01:37:12Z+3,2009-06-02
867171600000000,1997-06-25
20310408211622704927,2031-04-08
31/2-1996,1996-01-31
4/5/2010 giờ 18:0:1,2010-05-04
20340830104001955,2034-08-30
16 May 2033,2033-05-16
2011_05_04T22_52_23-0300,2011-05-04
1996-02-16T00:57:04+2500,1996-02-16
20090101050046808512,2009-01-01
Event at 1993-11-20T4:45:46,1993-11-20
"August 27, 2035",2035-08-27
20121227124640,2012-12-27
1990-04-21T01:59:05,1990-04-21
22 tháng 8 năm 2025,2025-08-22
4/6-2027,2027-03-04
1992/3/2T94933,1992-03-02
2010-04-11T00:41:49Z+3,2010-04-11
20221208052243,2022-12-08
2025-02-13T06:18:12+2500,2025-02-13
06|08|2035,2035-06-08
20341116093125,2034-11-16
The system recorded 19970810072206,1997-08-10
1366131600,2013-04-17
36-7-2008,2008-07-18
1214240400000000,2008-06-24
08_13_2010,2010-08-13
2011-03-14T09:35:03.133336155Z,2011-03-14
2026/2/15T161121,2026-02-15
6/18-2011,2011-09-06
19970902231948041094595,1997-09-02
13-7-2031,2031-07-13
2021/3/27T75534,2021-03-27
2026-07-11T15:40:04Z+3,2026-07-11
Sự kiện diễn ra vào 18/4/1991 7:26,1991-04-18
20050522064919794,2005-05-22
20340821043518,2034-08-21
27 Jun 1996,1996-06-27
19980928065150317251376,1998-09-28
2022-08-09T04:00:56.474Z,2022-08-09
46-4-1995,1995-04-23
Sự kiện diễn ra vào 14/7/2014 23:14,2014-07-14
1 Nov 1990,1990-11-01
20241201200705715,2024-12-01
12.11.2030T6-17-28,2030-11-12
20_2_2021,2021-02-20
2009/9/15T9454,2009-09-15
"July 27, 1999",1999-07-27
The system recorded 19930403193007,1993-04-03
2028-05-24T09:52:46.213Z,2028-05-24
19930329135804,1993-03-29
16/08/94,1994-08-16
11/7/2015 giờ 17:46:27,2015-07-11
2029-12-08T09:38:53+2500,2029-12-08
2.4.2031T22-29-1,2031-04-02
2020/7/9T35159,2020-07-09
19911003010634547728677,1991-10-03
2-3-2003,2003-03-02
1998 07 16,1998-07-16
1993-11-15T16:53:31Z+3,1993-11-15
The system recorded 20020530054641,2002-05-30
2031-07-05T00:12:21+2500,2031-07-05
Event at 2028-06-10T23:6:46,2028-06-10
12/3/2028 giờ 14:0:26,2028-03-12
20/24-2019,2019-12-20
2017_09_22T2_25_42+2500,2017-09-22
834858000000000000,1996-06-16
20-10-2021,2021-10-10
1862931600000000000,2029-01-13
Event at 2008-05-13T9:58:2,2008-05-13
4-3-1999,1999-03-04
20150501214428250363422,2015-05-01
30/20-2014,2014-10-30
2024-01-07T01:29:04-0330,2024-01-07
19970810064253225420707,1997-08-10
650134800000,1990-08-09
26 tháng 8 năm 2033,2033-08-26
1992-03-21T18:03:41.998702452Z,1992-03-21
9-3-2012,2012-03-09
2025_05_21T17_30_20-0330,2025-05-21
20270824091335898200645,2027-08-24
20321014064158660966594,2032-10-14
19950505151829395040,1995-05-05
16/01/32,2032-01-16
The system recorded 19950321105249,1995-03-21
2004-12-04T22:29:44Z+3,2004-12-04
28 April 2004,2004-04-28
2031_09_23,2031-09-23
1894122000000,2030-01-09
23 August 2001,2001-08-23
Ngày 26-7-2026,2026-07-26
06.12.2031,2031-06-12
09-12-10,2010-12-09
11 Apr 2021,2021-04-11
750963600000,1993-10-19
42-9-1997,1997-09-21
2027/8/21T18319,2027-08-21
1992-09-23T23:14:38,1992-09-23
28 tháng 3 năm 1990,1990-03-28
"January 21, 2035",2035-01-21
20-8-1990,1990-08-20
4/12-2005,2005-06-04
"March 21, 2009",2009-03-21
8 tháng 3 năm 2025,2025-03-08
17.1.2032T8-35-50,2032-01-17
2005-04-28T16:01:59+2500,2005-04-28
13 May 2014,2014-05-13
2 tháng 5 năm 2000,2000-05-02
22 tháng 7 năm 1990,1990-07-22
2024/6/2T54028,2024-06-02
1292000400,2010-12-11
18 Sep 2002,2002-09-18
24-10-2031,2031-10-24
Sự kiện diễn ra vào 1/3/2003 19:20,2003-03-01
04|14|2012,2012-04-14
"10th of June, 2033",2033-06-10
ngày 10 tháng 8 năm 2017,2017-08-10
19/22-2003,2003-11-19
8-5-2027,2027-05-04
Ngày 15-1-2019,2019-01-15
20011226192223,2001-12-26
"September 20, 1998",1998-09-20
Ngày 19-4-2019,2019-04-19
23_1_2029,2029-01-23
23.5.2009,2009-05-23
ngày 14 tháng 5 năm 2021,2021-05-14
20161213000646782817377,2016-12-13
5 Aug 2012,2012-08-05
16.05.21,2021-05-16
12 tháng 12 năm 2014,2014-12-12
2009/5/3T185745,2009-05-03
1695920400000000,2023-09-29
701802000000000,1992-03-29
02_15_2035,2035-02-15
12-1-2003,2003-01-06
19910514065745955083176,1991-05-14
Sự kiện diễn ra vào 20/5/1999 23:12,1999-05-20
2014-01-22T07:28:05.692258819Z,2014-01-22
28.10.2028T18-1-55,2028-10-28
20110801123415,2011-08-01
2022-12-26T13:41:51.410781992Z,2022-12-26
4.11.1998T19-31-39,1998-11-04
2000-08-30T01:28:51.836830Z,2000-08-30
2010-05-13T03:10:37Z+3,2010-05-13
20320926003038,2032-09-26
25 tháng 5 năm 2031,2031-05-25
1996-08-27T08:32:57-0300,1996-08-27
The system recorded 19990704124344,1999-07-04
3.11.2013T16-30-44,2013-11-03
ngày 9 tháng 6 năm 2001,2001-06-09
2032_11_26T20_42_21Z,2032-11-26
1992-11-19T08:39:01.760527Z,1992-11-19
25/12/2016 giờ 13:30:30,2016-12-25
2000/9/12T181150,2000-09-12
20181218043017547112293,2018-12-18
19/11/2014 giờ 7:7:40,2014-11-19
28/12-2018,2018-06-28
2023-07-24T12:48:04Z+3,2023-07-24
01 13 2000,2000-01-13
ngày 1 tháng 4 năm 1992,1992-04-01
2033917200000000000,2034-06-15
"June 30, 1992",1992-06-30
6-6-1993,1993-06-03
19960617151050900191521,1996-06-17
32-6-2025,2025-06-16
20201017032459360,2020-10-17
ngày 16 tháng 11 năm 2021,2021-11-16
10 April 2015,2015-04-10
1729616400000,2024-10-23
653504400,1990-09-17
2003-05-20T18:24:04+2500,2003-05-20
Ngày 5-1-1995,1995-01-05
06.06.2013,2013-06-06
10-7-2015,2015-07-10
2010-03-13T15:42:54,2010-03-13
ngày 12 tháng 9 năm 2015,2015-09-12
2015/10/1T151428,2015-10-01
976035600000000000,2000-12-06
ngày 10 tháng 5 năm 1997,1997-05-10
"November 28, 2022",2022-11-28
"August 16, 1992",1992-08-16
04-30-2013,2013-04-30
Ngày 21-7-2000,2000-07-21
ngày 8 tháng 6 năm 1992,1992-06-08
2010-11-08T23:07:51.778899970Z,2010-11-08
2006-03-02T13:07:29.595777Z,2006-03-02
694112400000,1991-12-31
19/4-2020,2020-02-19
2034-06-21T21:10:22+0500,2034-06-21
"13th of May, 2022",2022-05-13
The system recorded 20100501113357,2010-05-01
19980626193354489,1998-06-26
10 tháng 7 năm 2033,2033-07-10
2013-05-28T03:15:56+2500,2013-05-28
Event at 2021-09-22T13:34:9,2021-09-22
11-5-1999,1999-05-11
22.12.2006T16-20-58,2006-12-22
5 Apr 1995,1995-04-05
"17th of September, 1991",1991-09-17
The system recorded 20140927234910,2014-09-27
"27th of April, 2007",2007-04-27
2008/10/20T25658,2008-10-20
Ngày 10-1-2019,2019-01-10
6/12/2004,2004-12-06
"January 29, 1998",1998-01-29
ngày 11 tháng 1 năm 2033,2033-01-11
20221112213556931393,2022-11-12
23 tháng 8 năm 1990,1990-08-23
ngày 25 tháng 9 năm 2031,2031-09-25
Event at 2032-07-04T0:45:38,2032-07-04
2027 01 29,2027-01-29
1998-05-17T16:41:24Z+3,1998-05-17
10_25_1996,1996-10-25
20320125214250877037648,2032-01-25
19920129045101064910,1992-01-29
2034_06_21T18_11_37Z,2034-06-21
782758800,1994-10-22
20270815161305547,2027-08-15
Sự kiện diễn ra vào 13/3/2018 10:58,2018-03-13
29/4/2023 giờ 16:29:39,2023-04-29
807728400000,1995-08-07
2028-07-28T06:11:29Z+3,2028-07-28
ngày 17 tháng 10 năm 2004,2004-10-17
20200206062353,2020-02-06
The system recorded 20230426123811,2023-04-26
30/12/2026 giờ 0:25:53,2026-12-30
2030|05|29,2030-05-29
20250505130732565187780,2025-05-05
Ngày 17-4-1993,1993-04-17
ngày 19 tháng 1 năm 2031,2031-01-19
2028-04-01T23:58:54-0300,2028-04-01
2028-07-04T18:59:04,2028-07-04
2019_08_10T15_30_8+3,2019-08-10
20090630082312718639814,2009-06-30
20280124224723,2028-01-24
20210522184115690289594,2021-05-22
2002-07-20T18:57:34.855335Z,2002-07-20
2029|05|21,2029-05-21
8 tháng 2 năm 2031,2031-02-08
"6th of September, 1994",1994-09-06
2019-11-29T22:19:32.650Z,2019-11-29
20140606155347134916287,2014-06-06
20110529153933,2011-05-29
3 tháng 8 năm 2022,2022-08-03
9-10-2011,2011-10-09
1999-03-04T05:07:01+2500,1999-03-04
The system recorded 20051028171833,2005-10-28
24_7_2002,2002-07-24
4-9-1995,1995-09-04
1485190800,2017-01-24
779302800000,1994-09-12
21 Jan 2003,2003-01-21
2017-10-24T22:56:40Z+3,2017-10-24
The system recorded 20220303032526,2022-03-03
20160422025554,2016-04-22
20151128081834438074231,2015-11-28
Ngày 29-9-1997,1997-09-29
2031-10-08T16:02:01+2500,2031-10-08
1672678800000,2023-01-03
2034-06-10T20:08:22+2500,2034-06-10
1999-12-10T21:07:18.948Z,1999-12-10
Ngày 4-9-2022,2022-09-04
20190203154659345321,2019-02-03
20280916010927,2028-09-16
20120717101453175850,2012-07-17
2020-10-01T16:35:23,2020-10-01
54-4-2017,2017-04-27
760726800000,1994-02-09
58-1-1990,1990-01-29
19930625173307703370856,1993-06-25
5.7.2028T0-22-20,2028-07-05
18 December 2034,2034-12-18
6.7.2019T7-16-7,2019-07-06
1999_12_04T0_1_40+08,1999-12-04
12.06.2030,2030-12-06
1997-05-13T07:08:23.664218Z,1997-05-13
Event at 1995-07-01T3:16:18,1995-07-01
1990-10-12T07:58:29.829886412Z,1990-10-12
9 Jun 2001,2001-06-09
1997-09-01T05:34:14.044691912Z,1997-09-01
10/05/2034,2034-10-05
2032-11-07T20:19:57,2032-11-07
2031/6/5T213957,2031-06-05
1993-09-23T18:42:20Z+3,1993-09-23
The system recorded 20130605191900,2013-06-05
18-11-2022,2022-11-09
20240924212727050,2024-09-24
1766768400000000,2025-12-27
9 Jul 2020,2020-07-09
10-9-2023,2023-09-05
1329757200000,2012-02-21
25 Mar 2023,2023-03-25
2018 07 19,2018-07-19
2034-07-18T02:40:25.117963Z,2034-07-18
917715600000,1999-01-31
"January 7, 2017",2017-01-07
27 tháng 3 năm 2019,2019-03-27
14/09/08,2008-09-14
2012_02_05T2_46_8Z,2012-02-05
2014-09-14T05:45:41.807831286Z,2014-09-14
1910710800,2030-07-20
2014-01-27T23:00:56+2500,2014-01-27
Ngày 18-6-2020,2020-06-18
3-6-1990,1990-06-03
1994-06-07T17:06:16Z+3,1994-06-07
29 Jul 2015,2015-07-29
2/6-2008,2008-03-02
9_11_2020,2020-11-09
2010-06-26T13:13:23+2500,2010-06-26
1277571600000,2010-06-27
2031/5/4T142737,2031-05-04
20141031211909842,2014-10-31
2034-06-18T23:28:43Z+3,2034-06-18
30/5/2005 giờ 10:4:8,2005-05-30
26 tháng 12 năm 2016,2016-12-26
ngày 22 tháng 10 năm 2029,2029-10-22
1433264400000000,2015-06-03
1992-05-11T00:54:14.834168751Z,1992-05-11
2027-12-27T05:34:56Z+3,2027-12-27
9-8-2003,2003-08-09
14-12-2007,2007-12-07
22-4-2002,2002-04-22
Sự kiện diễn ra vào 10/3/2032 13:15,2032-03-10
22-4-2014,2014-04-22
17 November 2013,2013-11-17
1625331600000000,2021-07-04
25/2/2022 giờ 13:52:58,2022-02-25
"15th of November, 1991",1991-11-15
13/7/2018 giờ 17:44:25,2018-07-13
2003-03-01T18:55:58-0330,2003-03-01
1079802000,2004-03-21
ngày 18 tháng 6 năm 2031,2031-06-18
28 September 1999,1999-09-28
6.1.2030T15-25-2,2030-01-06
2015_11_16T15_40_19+00:00,2015-11-16
Event at 1998-07-26T18:29:43,1998-07-26
"July 11, 2027",2027-07-11
2026/4/1T215810,2026-04-01
20270704004916,2027-07-04
12/7/1994 giờ 20:12:49,1994-07-12
1017594000,2002-04-01
6/2-2011,2011-01-06
1993_02_04T23_30_53Z,1993-02-04
16-3-2034,2034-03-08
2032-04-02T10:39:41+2500,2032-04-02
2011-08-12T15:19:52+2500,2011-08-12
Ngày 10-5-1993,1993-05-10
Ngày 8-6-2032,2032-06-08
20200121043551346229489,2020-01-21
2008-04-27T13:01:12.555Z,2008-04-27
Event at 2002-03-05T19:29:31,2002-03-05
11 Sep 2005,2005-09-11
3 Aug 2022,2022-08-03
2025-01-23T08:28:39+2500,2025-01-23
19-8-2030,2030-08-19
ngày 13 tháng 9 năm 2021,2021-09-13
13 Dec 2025,2025-12-13
20-10-05,2005-10-20
1271696400000,2010-04-20
15/2/2031 giờ 4:24:27,2031-02-15
08.06.2028,2028-08-06
20.9.2027T15-42-57,2027-09-20
2013-01-29T16:54:24Z+3,2013-01-29
27 tháng 3 năm 2034,2034-03-27
Ngày 17-1-2005,2005-01-17
Event at 2031-04-25T16:45:6,2031-04-25
1990-07-10T00:22:22.568659859Z,1990-07-10
26 January 2028,2028-01-26
26.1.2026T1-56-39,2026-01-26
1048525200,2003-03-25
29-12-1994,1994-12-29
3-4-2006,2006-04-03
2001-07-24T12:53:20,2001-07-24
Ngày 2-1-2002,2002-01-02
14 tháng 5 năm 2024,2024-05-14
9 tháng 9 năm 2015,2015-09-09
2005-12-23T20:48:15.226273Z,2005-12-23
12_01_25,2025-01-12
ngày 17 tháng 12 năm 2020,2020-12-17
20270203190311161539,2027-02-03
20280805214633635548,2028-08-05
8-10-2005,2005-10-04
2008-02-13T14:34:46.882209671Z,2008-02-13
8-6-2011,2011-06-08
2032-08-07T01:08:23.738886Z,2032-08-07
2029-02-09T02:54:55.770Z,2029-02-09
815072400000000,1995-10-31
2003-08-29T15:57:07,2003-08-29
8/10/1999 giờ 15:12:43,1999-10-08
2081782800000000000,2035-12-21
1405270800000000000,2014-07-14
1590080400000,2020-05-22
2013-11-18T00:05:48.147461Z,2013-11-18
3/10/1996 giờ 23:56:35,1996-10-03
1966525200000,2032-04-26
Event at 2023-08-13T22:27:37,2023-08-13
ngày 6 tháng 11 năm 2025,2025-11-06
Sự kiện diễn ra vào 17/6/1999 1:38,1999-06-17
2 tháng 6 năm 2015,2015-06-02
ngày 28 tháng 7 năm 2011,2011-07-28
2005-11-26T18:07:11-0300,2005-11-26
734374800,1993-04-10
19900410112649401358977,1990-04-10
10 Feb 2012,2012-02-10
2026-08-02T19:31:08,2026-08-02
2003-04-20T12:23:18.972328054Z,2003-04-20
The system recorded 20160406094343,2016-04-06
1851958800000,2028-09-08
"November 4, 2013",2013-11-04
22/2/2019 giờ 3:46:3,2019-02-22
20340313074348,2034-03-13
11/6-2011,2011-03-11
2033-09-01T01:02:45Z+3,2033-09-01
22/10-2000,2000-05-22
20200127154714118976312,2020-01-27
20-12-2001,2001-12-10
2011-06-23T07:08:01+2500,2011-06-23
2021.04.26,2021-04-26
1997/4/10T234822,1997-04-10
"21th of June, 2011",2011-06-21
Event at 2007-06-29T6:13:39,2007-06-29
19951018202009996977,1995-10-18
26-12-2013,2013-12-13
1994-02-06T02:15:44.017141099Z,1994-02-06
6-9-2033,2033-09-06
2032/6/30T52052,2032-06-30
2004_01_19T17_7_40-05:00,2004-01-19
1017334800,2002-03-29
Event at 2019-07-16T8:31:15,2019-07-16
680720400000,1991-07-29
Event at 2015-09-19T3:2:3,2015-09-19
2017-10-03T00:35:02+2500,2017-10-03
Ngày 8-4-1999,1999-04-08
20-12-2033,2033-12-20
20191021150811,2019-10-21
19980811071358276516751,1998-08-11
2033-12-06T20:50:59.866Z,2033-12-06
2010_06_25T10_29_40+3,2010-06-25
ngày 12 tháng 9 năm 2011,2011-09-12
08|13|2025,2025-08-13
1365699600,2013-04-12
30-7-2016,2016-07-30
19-7-1999,1999-07-19
906051600000000,1998-09-18
2013_03_13T6_28_39-0300,2013-03-13
11 06 2022,2022-11-06
2028-09-26T20:25:56Z+3,2028-09-26
7.3.2006T0-34-54,2006-03-07
10/4/2007 giờ 13:41:21,2007-04-10
9/12/2015 giờ 13:33:22,2015-12-09
20200815171731244089,2020-08-15
1991/05/24,1991-05-24
5 Dec 1998,1998-12-05
16 tháng 9 năm 2015,2015-09-16
6 May 2005,2005-05-06
"August 16, 2008",2008-08-16
Ngày 19-11-2017,2017-11-19
938019600000,1999-09-23
ngày 29 tháng 6 năm 1995,1995-06-29
10/09/00,2000-09-10
The system recorded 20290810172204,2029-08-10
20120609151247,2012-06-09
20260617045801988290231,2026-06-17
24-7-2028,2028-07-24
04-21-2017,2017-04-21
ngày 17 tháng 1 năm 2019,2019-01-17
2007-09-28T16:35:56Z+3,2007-09-28
02/07/26,2026-07-02
ngày 30 tháng 8 năm 1993,1993-08-30
The system recorded 19950529224343,1995-05-29
32-11-2030,2030-11-16
2012-12-24T15:01:43.180588425Z,2012-12-24
03.12.2006,2006-03-12
16/1/2019 giờ 5:35:49,2019-01-16
1562950800,2019-07-13
08-18-2020,2020-08-18
30 Jul 2022,2022-07-30
2022-06-25,2022-06-25
20141013112216796822,2014-10-13
749149200000000,1993-09-28
ngày 28 tháng 2 năm 2033,2033-02-28
Event at 2001-07-11T15:34:17,2001-07-11
1998-08-17T15:42:08.760219374Z,1998-08-17
2000/1/28T232747,2000-01-28
1998/6/10T21352,1998-06-10
03.24.2019,2019-03-24
20171119104631,2017-11-19
28 Apr 2032,2032-04-28
1526403600000000,2018-05-16
840819600000000000,1996-08-24
ngày 31 tháng 10 năm 2019,2019-10-31
1993-08-16T03:58:47.137167Z,1993-08-16
6/8/1996 giờ 11:4:24,1996-08-06
2018-06-11T15:41:36.756882694Z,2018-06-11
2027-12-06T23:08:57Z+3,2027-12-06
07.03.2010,2010-07-03
1992/10/27,1992-10-27
1991-08-12T20:48:49.076Z,1991-08-12
The system recorded 20320218070327,2032-02-18
2015-07-16T00:56:33.913987Z,2015-07-16
25 tháng 11 năm 2000,2000-11-25
2000-07-30T06:47:48.383Z,2000-07-30
30 August 2023,2023-08-30
22-7-2032,2032-07-22
19910223134459321,1991-02-23
"October 6, 2013",2013-10-06
20250415065152493311,2025-04-15
2019-06-24,2019-06-24
1999-11-17T15:21:17.353819196Z,1999-11-17
26-07-92,1992-07-26
21 1 2025,2025-01-21
2028-05-07T03:24:41.686Z,2028-05-07
Ngày 18-4-2031,2031-04-18
21 November 2024,2024-11-21
02-09-2013,2013-02-09
26 Apr 2001,2001-04-26
20070210191944795,2007-02-10
"28th of June, 2025",2025-06-28
1204995600,2008-03-09
20070611032726628129,2007-06-11
2005-01-10T01:40:18Z+3,2005-01-10
Sự kiện diễn ra vào 20/4/2034 19:43,2034-04-20
Sự kiện diễn ra vào 3/8/2014 5:44,2014-08-03
2002-05-14,2002-05-14
930502800,1999-06-28
2014-03-29T17:23:44,2014-03-29
Sự kiện diễn ra vào 9/2/2028 17:55,2028-02-09
9.9.2022T1-22-45,2022-09-09
20010324092335127959245,2001-03-24
Sự kiện diễn ra vào 10/2/1990 11:45,1990-02-10
25 tháng 6 năm 2007,2007-06-25
19990316184938711301,1999-03-16
20181028121016581726,2018-10-28
20150108213743930461,2015-01-08
2018-08-15T21:11:51,2018-08-15
20010130091552803,2001-01-30
1729702800000,2024-10-24
20050420181659223521224,2005-04-20
"20th of May, 1992",1992-05-20
2009-01-25T16:26:39Z+3,2009-01-25
2021-04-24T17:30:57,2021-04-24
837968400000000,1996-07-22
06/25/2017,2017-06-25
ngày 24 tháng 1 năm 2006,2006-01-24
2032/02/09,2032-02-09
692470800,1991-12-12
2031_03_08T11_19_16+08,2031-03-08
12-10-2005,2005-10-06
19910113092906918078063,1991-01-13
2031-10-13T06:22:46.950276994Z,2031-10-13
1991-04-23T23:14:32.122156796Z,1991-04-23
1787245200000000000,2026-08-21
2019|08|31,2019-08-31
1950195600000,2031-10-20
2010-03-25T21:01:21,2010-03-25
2000-06-05T04:21:59,2000-06-05
14/9/2015 giờ 19:40:23,2015-09-14
20/8/2019 giờ 1:54:8,2019-08-20
2013-10-19T11:21:46+2500,2013-10-19
5-4-2009,2009-04-05
20220529114720272,2022-05-29
06_07_1993,1993-06-07
2009-03-18T10:53:13.431073864Z,2009-03-18
15/4/2031 giờ 7:33:11,2031-04-15
2016-08-21T12:10:05.225Z,2016-08-21
20/18-2003,2003-09-20
648666000000000000,1990-07-23
20301017031037895,2030-10-17
1996-10-22T22:42:43,1996-10-22
ngày 25 tháng 8 năm 1997,1997-08-25
20190102010436990,2019-01-02
2020-01-27T09:49:03.671Z,2020-01-27
The system recorded 19990904164045,1999-09-04
1-5-2016,2016-05-01
13/4/1993 giờ 8:33:9,1993-04-13
999104400,2001-08-30
2024-03-24T20:17:58+2500,2024-03-24
13/11/2023,2023-11-13
ngày 17 tháng 5 năm 2034,2034-05-17
2003-11-02T15:54:59.561768569Z,2003-11-02
ngày 18 tháng 2 năm 1999,1999-02-18
1993_01_31T9_9_51-0330,1993-01-31
1998/7/13T18512,1998-07-13
30 June 2026,2026-06-30
1522688400,2018-04-03
975344400000,2000-11-28
10 Jun 1996,1996-06-10
14 tháng 9 năm 2028,2028-09-14
2007-03-05T09:43:49Z+3,2007-03-05
Ngày 11-6-2004,2004-06-11
7-6-2019,2019-06-07
16.11.2015T12-10-32,2015-11-16
11.6.2013T19-25-45,2013-06-11
"May 26, 2016",2016-05-26
"July 26, 2013",2013-07-26
1728320400,2024-10-08
2027-12-16T19:45:14.083021Z,2027-12-16
19950919130031185469,1995-09-19
06/28/2018,2018-06-28
19 tháng 7 năm 1991,1991-07-19
1746118800000,2025-05-02
20061004052726651110,2006-10-04
1822842000,2027-10-07
2025_06_30,2025-06-30
20150613001724,2015-06-13
1659546000000000000,2022-08-04
873738000,1997-09-09
26 Nov 2005,2005-11-26
2032/11/06,2032-11-06
26 May 2011,2011-05-26
703357200000,1992-04-16
Event at 2027-05-06T16:53:30,2027-05-06
10/7/2030 giờ 21:24:16,2030-07-10
1993-12-31T12:44:17+07:00,1993-12-31
29 July 1993,1993-07-29
The system recorded 20221006195537,2022-10-06
1998-03-28T03:54:54,1998-03-28
2031-10-31,2031-10-31
The system recorded 20040708004118,2004-07-08
The system recorded 20190627145001,2019-06-27
2007-07-23T11:36:17,2007-07-23
19950907130819514,1995-09-07
06.05.31,2031-05-06
2010-04-23T02:58:11Z+3,2010-04-23
2025-11-08T17:52:41,2025-11-08
20 Feb 1995,1995-02-20
877280400,1997-10-20
2027/03/30,2027-03-30
2016-11-07T14:13:51Z+3,2016-11-07
1992_05_15T16_45_23+08,1992-05-15
2011-09-18T18:01:28.031929452Z,2011-09-18
1688490000000,2023-07-05
"December 3, 2018",2018-12-03
ngày 22 tháng 1 năm 2001,2001-01-22
18 tháng 6 năm 2006,2006-06-18
19900206090437,1990-02-06
26 September 1990,1990-09-26
12.31.2018,2018-12-31
2021-04-16T09:11:55+2500,2021-04-16
1080406800000,2004-03-28
2035-05-17T19:13:21+2500,2035-05-17
20040618061927153676,2004-06-18
2023 04 29,2023-04-29
1640970000,2022-01-01
11 22 2023,2023-11-22
The system recorded 20351005180230,2035-10-05
23/24-2009,2009-12-23
1979485200000,2032-09-23
2025-07-17T19:45:35.918529329Z,2025-07-17
964890000000000,2000-07-30
2023.07.15,2023-07-15
28 March 2021,2021-03-28
21-6-2021,2021-06-21
ngày 15 tháng 5 năm 2000,2000-05-15
27 tháng 12 năm 2030,2030-12-27
Event at 2028-09-12T18:50:5,2028-09-12
1424106000000,2015-02-17
22/4/2001 giờ 11:10:27,2001-04-22
2011/5/26T213533,2011-05-26
24 Mar 2010,2010-03-24
18/6-2006,2006-03-18
20231104040026004847,2023-11-04
20/11/2031 giờ 3:6:58,2031-11-20
2034954000000,2034-06-27
21/11/1999 giờ 0:26:43,1999-11-21
Sự kiện diễn ra vào 22/10/2035 2:31,2035-10-22
2 tháng 10 năm 2007,2007-10-02
46-7-2023,2023-07-23
"May 25, 2002",2002-05-25
1998_02_17,1998-02-17
48-6-2012,2012-06-24
2020.07.31,2020-07-31
The system recorded 20251013050016,2025-10-13
20300912221909333036,2030-09-12
4.5.2001T19-32-2,2001-05-04
20350829101229730,2035-08-29
ngày 15 tháng 7 năm 1992,1992-07-15
1209142800000000000,2008-04-26
872096400,1997-08-21
2013-04-13T06:40:23.737Z,2013-04-13
2016/11/22T181931,2016-11-22
2030-02-02T13:26:23.388Z,2030-02-02
2022/6/22T143612,2022-06-22
2016-06-18T04:06:07.832437227Z,2016-06-18
28 tháng 2 năm 2022,2022-02-28
2011-01-10T04:52:23Z+3,2011-01-10
2018-05-02T09:40:00.436791Z,2018-05-02
1522774800000000000,2018-04-04
38-2-1990,1990-02-19
1132592400000000,2005-11-22
25 8 2011,2011-08-25
2010_08_03T5_58_11+08,2010-08-03
"December 14, 2016",2016-12-14
2023-07-27T08:22:19-0300,2023-07-27
20190325224443374,2019-03-25
2014-02-20T09:17:30.506275179Z,2014-02-20
20061016130550,2006-10-16
1995/9/20T02032,1995-09-20
26 tháng 8 năm 2015,2015-08-26
18-9-2026,2026-09-09
The system recorded 20160325005940,2016-03-25
1996-08-10T02:36:16.797Z,1996-08-10
2030_03_08,2030-03-08
2010-08-14T06:25:29.303142161Z,2010-08-14
22-2-2006,2006-02-11
Sự kiện diễn ra vào 23/2/1997 1:6,1997-02-23
1740330000,2025-02-24
2023-06-05T11:16:50.559Z,2023-06-05
19940818150551003974379,1994-08-18
12/4/2023 giờ 11:36:4,2023-04-12
2/10/2022 giờ 19:6:18,2022-10-02
20030429023341703,2003-04-29
Event at 2008-03-08T23:40:21,2008-03-08
1993-05-29T15:13:44-0300,1993-05-29
19990404073039734957221,1999-04-04
ngày 24 tháng 7 năm 2006,2006-07-24
20140810024917287,2014-08-10
1430931600000,2015-05-07
2017-08-11T18:20:43-0300,2017-08-11
2035-10-21T09:01:19+2500,2035-10-21
2 8 1991,1991-08-02
19.04.04,2004-04-19
20321101192919124861,2032-11-01
1997/11/22T5618,1997-11-22
8 tháng 7 năm 2010,2010-07-08
7-1-1993,1993-01-07
22 September 2011,2011-09-22
2017-01-04T12:51:18.401419105Z,2017-01-04
24 June 2019,2019-06-24
2029-06-15T10:16:41+0500,2029-06-15
840128400000000000,1996-08-16
2007/11/23T31718,2007-11-23
1067446800000000000,2003-10-30
19930130035707204,1993-01-30
19921005075223605237113,1992-10-05
5/10-2024,2024-05-05
2029/6/18T0471,2029-06-18
2000-10-09T04:45:10.246Z,2000-10-09
"7th of May, 2001",2001-05-07
2023-11-29T02:52:11.325614338Z,2023-11-29
2017/4/23T046,2017-04-23
"January 9, 2005",2005-01-09
917197200000,1999-01-25
2030-11-23T23:23:03-05:00,2030-11-23
2017-06-11T08:59:09Z+3,2017-06-11
30-12-2006,2006-12-30
1992-10-25T11:05:16+2500,1992-10-25
2017-10-14T17:42:26,2017-10-14
"September 17, 2015",2015-09-17
Sự kiện diễn ra vào 7/7/2003 15:25,2003-07-07
1999-12-15T23:46:24Z+3,1999-12-15
29/10-2033,2033-05-29
20310504151539,2031-05-04
11 Mar 2033,2033-03-11
"February 13, 2009",2009-02-13
1896714000000000,2030-02-08
24 August 2033,2033-08-24
2004-10-23T07:41:20+2500,2004-10-23
20040430080629729417559,2004-04-30
15 Nov 2034,2034-11-15
870022800000000,1997-07-28
2028_06_28T1_30_16+07:00,2028-06-28
1457110800000,2016-03-05
1345741200,2012-08-24
"15th of January, 2023",2023-01-15
1241456400,2009-05-05
"7th of April, 2009",2009-04-07
20181109034026631027,2018-11-09
23/12/2008,2008-12-23
8.6.2002T11-20-4,2002-06-08
10_11_96,1996-11-10
19 September 2031,2031-09-19
"10th of October, 2016",2016-10-10
2050506000,2034-12-24
12/4/2018 giờ 20:55:29,2018-04-12
5 October 2034,2034-10-05
2 8 2021,2021-08-02
2032-04-09T01:54:37.718436Z,2032-04-09
Sự kiện diễn ra vào 14/2/1998 0:8,1998-02-14
20111127200819216514,2011-11-27
The system recorded 20020511022525,2002-05-11
"March 15, 1993",1993-03-15
14.08.00,2000-08-14
ngày 22 tháng 1 năm 1999,1999-01-22
The system recorded 20120731233138,2012-07-31
20200515095452967,2020-05-15
20201229125933004190,2020-12-29
1206723600,2008-03-29
22 Apr 1998,1998-04-22
2005-11-25T10:36:20+0500,2005-11-25
2000_05_20T11_27_53-0300,2000-05-20
1874768400,2029-05-30
9/2-2026,2026-01-09
1261414800000000,2009-12-22
20160716135436540,2016-07-16
"14th of August, 1990",1990-08-14
13 November 2021,2021-11-13
48-11-2000,2000-11-24
"16th of May, 2018",2018-05-16
58-7-2011,2011-07-29
Sự kiện diễn ra vào 8/10/2005 20:1,2005-10-08
30 3 2020,2020-03-30
1499187600000000000,2017-07-05
828378000000000000,1996-04-02
1995-11-14T19:15:21+2500,1995-11-14
2032-07-09T01:10:42,2032-07-09
6 tháng 5 năm 2017,2017-05-06
1994-09-12T14:57:40.129231Z,1994-09-12
01/14/2009,2009-01-14
2007-06-14T23:26:18+2500,2007-06-14
2001-06-14T12:06:53Z+3,2001-06-14
10 September 2013,2013-09-10
1133110800,2005-11-28
2017-04-04T10:36:14+2500,2017-04-04
19961201053053,1996-12-01
809110800000000,1995-08-23
24-5-2027,2027-05-12
1996-01-02T12:41:27.612629007Z,1996-01-02
09 26 2001,2001-09-26
2022-10-26T18:43:51.082Z,2022-10-26
1998_10_03T19_40_40-0330,1998-10-03
54-4-2027,2027-04-27
2021_06_07T23_33_43+08,2021-06-07
19980322145826121072428,1998-03-22
1997/10/13T94947,1997-10-13
791917200,1995-02-05
2000-08-08T15:33:02+00:00,2000-08-08
2034-07-24T15:38:38+07:00,2034-07-24
1992_05_18,1992-05-18
"6th of December, 2033",2033-12-06
2021.09.13,2021-09-13
1991-06-07T08:00:11.997277999Z,1991-06-07
20171106150008445,2017-11-06
20180922053409109,2018-09-22
Ngày 7-8-1995,1995-08-07
963334800000000,2000-07-12
03-29-2013,2013-03-29
1991-11-11T02:23:39.676457895Z,1991-11-11
17-11-2017,2017-11-17
1484845200000,2017-01-20
12-8-2028,2028-08-06
2033-09-08T00:33:04.486Z,2033-09-08
04 08 2011,2011-04-08
Event at 1991-05-06T12:10:32,1991-05-06
5/16-2000,2000-08-05
20280115122709,2028-01-15
20 tháng 8 năm 2005,2005-08-20
1993/2/4T105436,1993-02-04
"30th of April, 2032",2032-04-30
22/22-2031,2031-11-22
2006-11-14T12:28:53,2006-11-14
19970628152300,1997-06-28
1990-02-23T12:12:59Z+3,1990-02-23
2007-03-07T18:18:22.624880Z,2007-03-07
2018-03-11T14:21:04+2500,2018-03-11
10|08|1992,1992-10-08
"March 4, 2028",2028-03-04
16/12/2003 giờ 0:3:52,2003-12-16
28-2-2015,2015-02-28
30 tháng 9 năm 2014,2014-09-30
22/3/1998 giờ 15:34:10,1998-03-22
2014-04-02T04:03:09Z+3,2014-04-02
07/29/2030,2030-07-29
"26th of September, 2015",2015-09-26
30.1.2017T3-42-56,2017-01-30
Event at 2017-04-27T16:35:36,2017-04-27
21/22-1992,1992-11-21
Event at 2000-11-15T19:24:14,2000-11-15
1357578000000000000,2013-01-08
20|6|2016,2016-06-20
25 June 2000,2000-06-25
2007/7/20T154540,2007-07-20
901299600000000000,1998-07-25
2033-06-27T10:12:14.273Z,2033-06-27
1613149200000,2021-02-13
Ngày 10-4-2011,2011-04-10
20211208105038588132,2021-12-08
5_3_2024,2024-03-05
1193331600000000000,2007-10-26
2016-03-09T06:51:26.962504486Z,2016-03-09
20141231033226007204,2014-12-31
Sự kiện diễn ra vào 23/2/2024 13:50,2024-02-23
2006/8/18T3109,2006-08-18
16.7.2023T19-43-56,2023-07-16
2028/11/17,2028-11-17
10 tháng 1 năm 2026,2026-01-10
19920923130811615,1992-09-23
1990_01_10T0_1_50-0330,1990-01-10
2022-08-24T15:03:49.960799Z,2022-08-24
46-8-2010,2010-08-23
7 tháng 7 năm 2013,2013-07-07
20-5-1990,1990-05-20
Sự kiện diễn ra vào 9/4/2026 20:7,2026-04-09
"December 24, 2002",2002-12-24
22/6/2018 giờ 18:51:2,2018-06-22
20270501012212451882,2027-05-01
1993-09-19T14:29:09+2500,1993-09-19
"9th of April, 2028",2028-04-09
19950421211732387,1995-04-21
2025-09-24T01:56:52,2025-09-24
2004-06-15T08:19:43+2500,2004-06-15
1121965200000000,2005-07-22
2031-05-20T20:55:26+07:00,2031-05-20
Event at 1997-05-14T17:59:5,1997-05-14
1992-05-14T05:33:53+2500,1992-05-14
2025-05-13T23:27:06-0330,2025-05-13
1994-08-27T19:04:03+00:00,1994-08-27
2009 04 04,2009-04-04
2019-01-04T19:41:55+2500,2019-01-04
1996-03-25T13:43:20+2500,1996-03-25
27 October 2035,2035-10-27
2033-05-15T01:30:19,2033-05-15
1000314000000,2001-09-13
20110722171910649724,2011-07-22
2031_04_10T5_30_6-05:00,2031-04-10
The system recorded 20280210052402,2028-02-10
13 tháng 4 năm 2004,2004-04-13
1999 09 23,1999-09-23
1102870800000000,2004-12-13
16-1-2008,2008-01-08
06|27|2027,2027-06-27
2025-05-11T09:37:17.563685466Z,2025-05-11
20070305013506147,2007-03-05
14/4-2007,2007-02-14
ngày 17 tháng 9 năm 2031,2031-09-17
1998-07-23T12:03:19Z+3,1998-07-23
2028-05-15T23:49:01,2028-05-15
Sự kiện diễn ra vào 29/5/1996 18:36,1996-05-29
2030-05-13T00:40:21.628397Z,2030-05-13
Event at 2014-06-12T13:42:14,2014-06-12
Event at 1994-08-19T3:41:46,1994-08-19
11-4-2019,2019-04-11
Event at 2015-04-27T23:54:2,2015-04-27
2014-06-17T05:59:18,2014-06-17
The system recorded 20220117161154,2022-01-17
1659373200000000,2022-08-02
30|4|2000,2000-04-30
19 Feb 2019,2019-02-19
23-2-2027,2027-02-23
20161029045103134666,2016-10-29
04.09.26,2026-09-04
2033_03_04T14_34_29Z,2033-03-04
2011/11/12,2011-11-12
1996/2/10T193932,1996-02-10
2016-10-19T06:26:15.192870684Z,2016-10-19
1994-01-12T19:10:56.197037Z,1994-01-12
8-8-2007,2007-08-04
"20th of September, 2031",2031-09-20
10 Jan 2032,2032-01-10
2018-11-29T19:26:04Z+3,2018-11-29
ngày 10 tháng 9 năm 2034,2034-09-10
ngày 7 tháng 1 năm 2024,2024-01-07
Event at 1994-03-10T23:6:1,1994-03-10
1945789200000,2031-08-30
Sự kiện diễn ra vào 5/12/2023 7:55,2023-12-05
18 Jan 1997,1997-01-18
Ngày 4-9-2027,2027-09-04
ngày 13 tháng 6 năm 1991,1991-06-13
16/8-2000,2000-04-16
06_10_32,2032-10-06
1167152400,2006-12-27
ngày 22 tháng 3 năm 2030,2030-03-22
24 Apr 2010,2010-04-24
2029-01-11T14:33:42-05:00,2029-01-11
12/6-1995,1995-03-12
"27th of May, 2014",2014-05-27
The system recorded 20350515163859,2035-05-15
30/10/1993 giờ 10:49:32,1993-10-30
Event at 2028-06-24T23:27:16,2028-06-24
1607792400000000,2020-12-13
1878138000000000,2029-07-08
1/4/2003 giờ 10:8:30,2003-04-01
20 Apr 2020,2020-04-20
Sự kiện diễn ra vào 30/5/2018 18:11,2018-05-30
29-10-1993,1993-10-29
20040531211947,2004-05-31
1997_09_28T17_19_54+08,1997-09-28
9 Sep 2003,2003-09-09
20231130145100324270,2023-11-30
Event at 1999-04-12T14:1:33,1999-04-12
29-4-2018,2018-04-29
20270114052533460640580,2027-01-14
1993-07-31T05:04:14+2500,1993-07-31
5 Oct 1994,1994-10-05
1999-03-29T05:58:28.142053177Z,1999-03-29
16.2.2023T10-2-53,2023-02-16
12.3.1995T7-35-12,1995-03-12
"24th of January, 1991",1991-01-24
2024-05-26T22:59:43.011171614Z,2024-05-26
1994-06-04T14:36:40Z+3,1994-06-04
07_08_92,1992-08-07
20.3.2029T16-52-14,2029-03-20
2013/8/23T20597,2013-08-23
20|01|99,1999-01-20
2019-12-05T14:55:58.326Z,2019-12-05
1 Oct 2022,2022-10-01
21.6.1990,1990-06-21
2004-11-28T21:19:25.386Z,2004-11-28
20140222183937,2014-02-22
Event at 2002-11-01T19:16:58,2002-11-01
"18th of June, 1990",1990-06-18
2025-08-23T22:03:58.255645440Z,2025-08-23
1992-07-31T05:21:34.969138854Z,1992-07-31
07-24-2006,2006-07-24
12/10/2020,2020-10-12
23/3/2000 giờ 3:16:44,2000-03-23
23|3|1992,1992-03-23
2006/7/24T114322,2006-07-24
ngày 11 tháng 2 năm 2017,2017-02-11
ngày 8 tháng 4 năm 2025,2025-04-08
3/1/2005 giờ 15:15:45,2005-01-03
2016-06-14T22:11:59,2016-06-14
1992-07-30T23:57:20Z+3,1992-07-30
2021-04-15T01:17:10,2021-04-15
2011/8/10T74944,2011-08-10
The system recorded 19950125073708,1995-01-25
20340825232312392532882,2034-08-25
19960522002301057077997,1996-05-22
Event at 2002-07-30T1:59:57,2002-07-30
19961121121809,1996-11-21
09-29-2010,2010-09-29
Sự kiện diễn ra vào 5/3/2002 16:23,2002-03-05
ngày 13 tháng 4 năm 2013,2013-04-13
ngày 19 tháng 1 năm 2024,2024-01-19
1991-09-26T12:26:14,1991-09-26
14 11 2023,2023-11-14
20210705055405741,2021-07-05
2019-11-01T12:52:21.836254197Z,2019-11-01
12 May 1996,1996-05-12
2015-04-09T18:59:39Z+3,2015-04-09
2003/7/17T14518,2003-07-17
20031116224900326065,2003-11-16
"May 26, 2006",2006-05-26
2032-12-20T03:22:57+0500,2032-12-20
13/12-2007,2007-06-13
2022/12/10,2022-12-10
20331030121544464754992,2033-10-30
1999-02-08T23:59:17+2500,1999-02-08
1991/5/14T205616,1991-05-14
1996-02-28T01:44:39.318Z,1996-02-28
The system recorded 20310728161417,2031-07-28
4/6/1999,1999-06-04
15 tháng 1 năm 2011,2011-01-15
Ngày 14-2-2012,2012-02-14
2007/12/21T154531,2007-12-21
17 tháng 5 năm 2013,2013-05-17
20-3-2025,2025-03-10
30.5.2006T4-6-15,2006-05-30
2029-10-15T00:02:48.174313792Z,2029-10-15
962902800000000,2000-07-07
1568998800,2019-09-21
2020.12.25,2020-12-25
2006-11-13T22:01:12Z+3,2006-11-13
20221101121758712,2022-11-01
20161218083909,2016-12-18
Sự kiện diễn ra vào 2/1/2003 4:16,2003-01-02
20010424124923,2001-04-24
1116176400000000,2005-05-16
16.12.1991T6-31-29,1991-12-16
ngày 17 tháng 11 năm 1993,1993-11-17
ngày 14 tháng 1 năm 2031,2031-01-14
20280629142151585457,2028-06-29
7-7-2027,2027-07-07
9/8-2031,2031-04-09
9-7-2008,2008-07-09
2016|05|17,2016-05-17
1999-11-06T05:43:14Z+3,1999-11-06
1411318800000,2014-09-22
1990/6/8T201143,1990-06-08
17/11/2018 giờ 19:56:19,2018-11-17
16 08 13,2013-08-16
17/8/2008 giờ 3:26:43,2008-08-17
2005-07-17T01:55:58.176Z,2005-07-17
20340119062029512961725,2034-01-19
8 tháng 2 năm 2029,2029-02-08
22.1.2006T14-52-51,2006-01-22
1789318800,2026-09-14
"6th of October, 2014",2014-10-06
10|12|1997,1997-10-12
2020-06-20T12:29:06.716Z,2020-06-20
ngày 8 tháng 8 năm 2023,2023-08-08
ngày 12 tháng 2 năm 2021,2021-02-12
"July 13, 2009",2009-07-13
747766800000000,1993-09-12
27/3/2018 giờ 5:2:27,2018-03-27
The system recorded 19961115035259,1996-11-15
2028_02_04T5_6_6-0330,2028-02-04
1996-01-06T11:23:50Z+3,1996-01-06
"April 28, 1992",1992-04-28
20330627190021481090229,2033-06-27
1994-01-31T14:44:30,1994-01-31
1995-07-15T23:05:07.482561Z,1995-07-15
18 Jan 2028,2028-01-18
"December 31, 2029",2029-12-31
Event at 2031-05-04T8:18:31,2031-05-04
19910708145400218,1991-07-08
1992-06-20T05:53:31.870Z,1992-06-20
4.3.2029T21-19-36,2029-03-04
2004_09_08T9_24_25-05:00,2004-09-08
19.5.2024T2-19-52,2024-05-19
2027-06-13T00:32:40.962927988Z,2027-06-13
2001 09 22,2001-09-22
16 Sep 2030,2030-09-16
ngày 29 tháng 8 năm 1993,1993-08-29
27 Oct 2027,2027-10-27
1846602000,2028-07-08
847990800,1996-11-15
2008-12-24T20:42:23.641541Z,2008-12-24
748803600000000,1993-09-24
05_12_30,2030-12-05
2002_03_11T1_53_32Z+3,2002-03-11
16 October 2006,2006-10-16
20140802000315251954643,2014-08-02
2011-07-03T07:06:28.495727123Z,2011-07-03
The system recorded 19921004152128,1992-10-04
ngày 2 tháng 3 năm 2007,2007-03-02
2082301200000000,2035-12-27
1691859600,2023-08-13
20080316193239532652769,2008-03-16
2000-04-23T09:48:56-0300,2000-04-23
2022-12-18T07:59:37.776750Z,2022-12-18
Event at 2013-11-01T3:42:53,2013-11-01
2001-03-07T00:19:11.184Z,2001-03-07
1745946000,2025-04-30
52-3-2029,2029-03-26
28/11/2003 giờ 5:31:57,2003-11-28
Event at 1990-10-17T1:30:40,1990-10-17
20341213151231556,2034-12-13
3 tháng 8 năm 2002,2002-08-03
20101202194319,2010-12-02
1995_05_22T6_59_23Z,1995-05-22
1997_09_24,1997-09-24
1660842000000,2022-08-19
20001122160433140,2000-11-22
20/6-2025,2025-03-20
18 Sep 2017,2017-09-18
2032/10/6T125313,2032-10-06
14.5.2025T2-25-26,2025-05-14
Event at 1998-06-14T13:44:27,1998-06-14
20320406041246517615274,2032-04-06
19910121142532155871,1991-01-21
1987088400000,2032-12-20
20301111025905825147469,2030-11-11
ngày 3 tháng 8 năm 2021,2021-08-03
The system recorded 20040209021558,2004-02-09
1991-08-05T19:46:06Z+3,1991-08-05
18/6/2013 giờ 2:32:31,2013-06-18
20230413063626684,2023-04-13
20330523065206,2033-05-23
2025_01_05T19_20_31+08,2025-01-05
14/10-1998,1998-05-14
11-10-2011,2011-10-11
2011-10-06T23:29:02-0300,2011-10-06
2003-11-30T14:20:45Z+3,2003-11-30
12.7.2027,2027-07-12
Event at 2005-12-29T0:25:1,2005-12-29
16.10.1990T22-22-50,1990-10-16
1896627600000000000,2030-02-07
2001-07-30T22:52:25+2500,2001-07-30
2020-05-15T22:12:17,2020-05-15
1498064400000,2017-06-22
09_23_2018,2018-09-23
ngày 21 tháng 12 năm 2026,2026-12-21
2-8-2019,2019-08-01
ngày 21 tháng 2 năm 2033,2033-02-21
2008-01-25T01:58:30Z+3,2008-01-25
15.10.2016T3-4-59,2016-10-15
27.7.2008T6-38-36,2008-07-27
2004-09-09T05:14:49.727453191Z,2004-09-09
04_07_25,2025-07-04
20050807013230,2005-08-07
"January 26, 2016",2016-01-26
"15th of December, 2005",2005-12-15
1046883600000000,2003-03-06
723574800000000,1992-12-06
13/6/2008 giờ 20:43:38,2008-06-13
"19th of January, 2009",2009-01-19
1990-12-26T21:38:22.584364Z,1990-12-26
ngày 8 tháng 12 năm 2015,2015-12-08
ngày 12 tháng 4 năm 2021,2021-04-12
Sự kiện diễn ra vào 11/4/2000 19:49,2000-04-11
2003_12_11T15_32_20Z+3,2003-12-11
20150602191104,2015-06-02
The system recorded 20121009234605,2012-10-09
15/11/2032 giờ 4:50:5,2032-11-15
884192400000000000,1998-01-08
2034_06_15T20_23_3+2500,2034-06-15
1993-11-10T04:57:07+2500,1993-11-10
1994-12-05T07:11:19.118584015Z,1994-12-05
2001-12-26T21:10:09-05:00,2001-12-26
2014-05-25T16:35:07Z+3,2014-05-25
ngày 27 tháng 3 năm 2004,2004-03-27
2012-04-19T08:30:59.780Z,2012-04-19
ngày 2 tháng 9 năm 2013,2013-09-02
Ngày 24-12-2008,2008-12-24
"November 26, 1996",1996-11-26
7/10-2024,2024-05-07
1669222800000000000,2022-11-24
20250507210559471975357,2025-05-07
2010_12_14T21_6_55+00:00,2010-12-14
815504400,1995-11-05
20.1.2012T0-28-43,2012-01-20
54-7-2017,2017-07-27
4 Dec 2029,2029-12-04
Ngày 28-7-2004,2004-07-28
5.10.2000T23-51-6,2000-10-05
828291600000,1996-04-01
2028-05-21T20:20:29+2500,2028-05-21
836845200000000000,1996-07-09
2005-11-29T16:37:14,2005-11-29
1119805200000000000,2005-06-27
Sự kiện diễn ra vào 14/8/2001 10:43,2001-08-14
Ngày 26-11-2011,2011-11-26
1996-04-11T21:29:23Z+3,1996-04-11
2033/7/21T8266,2033-07-21
890326800,1998-03-20
2022-06-01T10:52:14Z+3,2022-06-01
2032/1/3T23217,2032-01-03
26-7-1994,1994-07-26
Ngày 9-11-2019,2019-11-09
Ngày 9-11-2020,2020-11-09
ngày 8 tháng 11 năm 1996,1996-11-08
1377277200000000000,2013-08-24
20080829032843,2008-08-29
ngày 14 tháng 4 năm 2016,2016-04-14
2002-07-03T19:42:11.270096Z,2002-07-03
1997.12.18,1997-12-18
2032-08-22T08:57:46.719Z,2032-08-22
12.2.2027T1-46-33,2027-02-12
17 11 90,1990-11-17
728758800000000,1993-02-04
978973200000,2001-01-09
27 Jan 2012,2012-01-27
2035-04-20T22:47:10.944180350Z,2035-04-20
ngày 22 tháng 7 năm 2023,2023-07-22
28-12-2009,2009-12-14
2020-09-09T05:24:15+2500,2020-09-09
1997-03-07T15:04:33.651738Z,1997-03-07
Event at 2024-10-20T9:53:5,2024-10-20
5/8-2014,2014-04-05
1928768400000000000,2031-02-14
2014_01_14T2_31_38+0500,2014-01-14
15/16-1993,1993-08-15
25/5/1991 giờ 22:25:40,1991-05-25
Ngày 10-5-2005,2005-05-10
Ngày 6-12-2001,2001-12-06
7.1.2001T8-43-55,2001-01-07
"20th of March, 2021",2021-03-20
19980924134339566,1998-09-24
2010_05_04T9_38_37+08,2010-05-04
9 tháng 10 năm 1998,1998-10-09
"15th of October, 2017",2017-10-15
1217091600000,2008-07-27
20300305105740928,2030-03-05
07-29-2010,2010-07-29
3.5.2008,2008-05-03
24_07_23,2023-07-24
Ngày 23-9-1993,1993-09-23
2006-06-19T08:04:46Z+3,2006-06-19
2033-05-13T23:00:41+2500,2033-05-13
953658000000,2000-03-22
1222362000000000,2008-09-26
1992-02-04T06:20:47+07:00,1992-02-04
16 February 2002,2002-02-16
"15th of January, 2012",2012-01-15
1119805200000000000,2005-06-27
24 tháng 9 năm 2032,2032-09-24
1647622800,2022-03-19
Ngày 15-1-2034,2034-01-15
1055869200,2003-06-18
ngày 25 tháng 10 năm 2025,2025-10-25
1991-10-30T01:46:29.161Z,1991-10-30
2028-08-22T03:59:07+0500,2028-08-22
The system recorded 20081207141230,2008-12-07
2028_10_23T3_54_27Z,2028-10-23
19910106180157,1991-01-06
9 tháng 8 năm 2003,2003-08-09
02-04-2006,2006-02-04
ngày 28 tháng 6 năm 1997,1997-06-28
09_15_2009,2009-09-15
7_2_2019,2019-02-07
6.4.2013T16-32-32,2013-04-06
19900810052450,1990-08-10
27|3|1993,1993-03-27
12|27|2030,2030-12-27
The system recorded 20111115213416,2011-11-15
2032-09-20T07:45:22-05:00,2032-09-20
2016-06-18T09:45:38.122948Z,2016-06-18
1776272400000000000,2026-04-16
2001-08-20T19:46:54+2500,2001-08-20
2028-11-24T12:49:35.289Z,2028-11-24
18-2-2026,2026-02-18
Sự kiện diễn ra vào 10/4/2001 18:59,2001-04-10
20/16-2033,2033-08-20
"23th of March, 2029",2029-03-23
2010-03-03T22:46:47.568Z,2010-03-03
2 Jun 2008,2008-06-02
743619600000,1993-07-26
1240592400,2009-04-25
50-7-2018,2018-07-25
03-06-2004,2004-03-06
1432314000,2015-05-23
8/4-1998,1998-02-08
20050423234701551,2005-04-23
20261001085215381,2026-10-01
"June 25, 2016",2016-06-25
The system recorded 19970916031451,1997-09-16
30_9_2027,2027-09-30
2034/9/13T22651,2034-09-13
30 Aug 1999,1999-08-30
15 February 2011,2011-02-15
18-11-1998,1998-11-18
20101022232504783,2010-10-22
"March 3, 2007",2007-03-03
Ngày 9-7-2033,2033-07-09
11/11/2028 giờ 19:41:34,2028-11-11
The system recorded 20240302104018,2024-03-02
19921004224059,1992-10-04
20.8.2014T22-0-2,2014-08-20
2008-09-19T03:32:13.626Z,2008-09-19
1154278800,2006-07-31
703875600000000000,1992-04-22
6.11.1997T6-5-17,1997-11-06
23/7/1992 giờ 21:38:44,1992-07-23
20/8/2025 giờ 8:10:21,2025-08-20
771526800,1994-06-14
31/7/1993 giờ 22:44:32,1993-07-31
20270531204359142,2027-05-31
"July 15, 2000",2000-07-15
2030|12|02,2030-12-02
996512400000000,2001-07-31
2-10-2001,2001-10-01
20180602023855227794,2018-06-02
20340210090115066586658,2034-02-10
11 tháng 4 năm 2011,2011-04-11
3/9/2028 giờ 18:45:0,2028-09-03
09/09/2029,2029-09-09
"19th of September, 2031",2031-09-19
"10th of March, 2030",2030-03-10
15 Dec 1999,1999-12-15
20140722033532302541,2014-07-22
"26th of January, 1998",1998-01-26
20341128140909176,2034-11-28
20240612110742610758893,2024-06-12
2013|03|07,2013-03-07
2010-04-03T04:45:05,2010-04-03
Event at 2000-02-17T21:10:8,2000-02-17
1840381200000000000,2028-04-27
Ngày 7-10-2031,2031-10-07
2020_10_25T12_2_22+00:00,2020-10-25
19900405125020505677198,1990-04-05
27/3/2026 giờ 10:2:40,2026-03-27
13 Dec 2020,2020-12-13
Ngày 25-1-2016,2016-01-25
05 10 1992,1992-05-10
1996_09_17T15_55_54Z+3,1996-09-17
1775754000000,2026-04-10
Ngày 26-6-2035,2035-06-26
ngày 8 tháng 11 năm 2001,2001-11-08
Sự kiện diễn ra vào 2/1/2022 1:12,2022-01-02
08/12/93,1993-12-08
"27th of August, 1998",1998-08-27
2011-07-18T14:17:19.557175Z,2011-07-18
2026/4/10T122548,2026-04-10
2015-08-01T03:03:15.400351752Z,2015-08-01
1994-02-04T07:28:49.721875497Z,1994-02-04
1917190800000000,2030-10-03
964976400000000,2000-07-31
2029-08-11T23:19:43.964224011Z,2029-08-11
11 Aug 2021,2021-08-11
44-7-2010,2010-07-22
Sự kiện diễn ra vào 3/12/1991 11:33,1991-12-03
2016-04-18T03:54:06.690859Z,2016-04-18
24/12/2034 giờ 18:19:57,2034-12-24
20150519162100157,2015-05-19
04.02.95,1995-02-04
9/14-1998,1998-07-09
ngày 1 tháng 10 năm 2030,2030-10-01
ngày 24 tháng 8 năm 2022,2022-08-24
"January 31, 1994",1994-01-31
2034-10-28T06:00:30+2500,2034-10-28
2034-04-29T07:57:19.882632Z,2034-04-29
19921212004830335,1992-12-12
"5th of February, 1998",1998-02-05
20050917155037421216728,2005-09-17
2014-01-11T01:40:26Z+3,2014-01-11
3 Aug 2003,2003-08-03
3 tháng 11 năm 2021,2021-11-03
2033-09-25T06:39:04.801Z,2033-09-25
4/8/2020 giờ 13:50:18,2020-08-04
2009-10-02T06:07:34.700Z,2009-10-02
1710090000000000,2024-03-11
2016-08-24T05:23:10-0300,2016-08-24
4/2/2017 giờ 23:11:27,2017-02-04
2019-09-14T20:41:54.714Z,2019-09-14
2002-09-08T19:52:23+0500,2002-09-08
12.03.2031,2031-12-03
2012/03/30,2012-03-30
2025-02-21T15:09:16,2025-02-21
19940404222301939298580,1994-04-04
2022-12-28T03:54:32.881943Z,2022-12-28
2019|05|11,2019-05-11
19930302030148007448,1993-03-02
20190524045414,2019-05-24
Ngày 5-6-2010,2010-06-05
2031-02-11T12:58:40.027Z,2031-02-11
17 January 2006,2006-01-17
2002-08-13T14:51:11,2002-08-13
12-05-25,2025-05-12
20310606143028688532,2031-06-06
ngày 8 tháng 1 năm 2024,2024-01-08
21/20-2020,2020-10-21
Sự kiện diễn ra vào 13/4/2012 10:23,2012-04-13
20350606114203903,2035-06-06
ngày 25 tháng 7 năm 2004,2004-07-25
2031-02-10T06:27:59.002648Z,2031-02-10
Event at 2030-12-25T2:49:25,2030-12-25
20290721062412684923,2029-07-21
07.09.16,2016-09-07
2022-12-21,2022-12-21
20211002002546012657,2021-10-02
20141109033523446022,2014-11-09
888598800000000000,1998-02-28
1776963600,2026-04-24
2022 07 15,2022-07-15
ngày 6 tháng 4 năm 2024,2024-04-06
2035-02-05T02:22:03.139Z,2035-02-05
24/6/2026,2026-06-24
7/6/2017,2017-06-07
1992/11/5T13659,1992-11-05
2003-11-17T16:10:10+2500,2003-11-17
2009-07-27T19:08:09,2009-07-27
The system recorded 19900708134626,1990-07-08
24.08.28,2028-08-24
The system recorded 20030829063411,2003-08-29
20040529225115,2004-05-29
20310513101347642011508,2031-05-13
Ngày 30-9-2030,2030-09-30
The system recorded 20000725182302,2000-07-25
3/7/2002 giờ 23:27:23,2002-07-03
23-06-92,1992-06-23
2008_08_12T20_46_12+2500,2008-08-12
20340409200839997419481,2034-04-09
18 September 2017,2017-09-18
23/22-1995,1995-11-23
1576602000000000000,2019-12-18
22-4-2009,2009-04-11
"March 14, 2003",2003-03-14
1946826000000000,2031-09-11
17/12/2029 giờ 3:5:56,2029-12-17
20 Mar 2009,2009-03-20
17 tháng 2 năm 2024,2024-02-17
20000728004859635988,2000-07-28
2018278800000,2033-12-16
25 10 22,2022-10-25
31.7.1998,1998-07-31
The system recorded 20051229231039,2005-12-29
4/14-2014,2014-07-04
"June 23, 2011",2011-06-23
25/22-2028,2028-11-25
09 04 29,2029-04-09
29.05.26,2026-05-29
2014_10_01T20_54_16-05:00,2014-10-01
2014/2/15T173146,2014-02-15
14 07 93,1993-07-14
Ngày 7-11-1990,1990-11-07
ngày 8 tháng 5 năm 2003,2003-05-08
"2nd of May, 2011",2011-05-02
The system recorded 20091101073342,2009-11-01
16-2-2020,2020-02-16
9 Nov 2022,2022-11-09
1737824400,2025-01-26
1996-06-27T14:59:01Z+3,1996-06-27
Event at 2031-08-29T20:12:16,2031-08-29
32-8-1995,1995-08-16
757098000000000000,1993-12-29
24 Jul 2015,2015-07-24
2022-03-09T02:58:15Z+3,2022-03-09
1004029200,2001-10-26
20130420045013703,2013-04-20
09_20_1998,1998-09-20
27-3-2006,2006-03-27
Sự kiện diễn ra vào 16/4/2018 21:9,2018-04-16
2028-03-05T08:39:54+2500,2028-03-05
26-3-1993,1993-03-13
2026_01_07T0_32_17-0300,2026-01-07
2029-11-19T01:03:44.168Z,2029-11-19
"January 25, 2031",2031-01-25
8/8/2007 giờ 18:25:3,2007-08-08
2006_09_18T19_25_43Z+3,2006-09-18
1692291600000,2023-08-18
18 tháng 2 năm 2009,2009-02-18
7.9.2015T6-23-9,2015-09-07
1747587600000000000,2025-05-19
20271029033540295,2027-10-29
"8th of October, 2009",2009-10-08
"October 25, 1994",1994-10-25
Ngày 24-3-2012,2012-03-24
"9th of October, 2014",2014-10-09
2027/7/14T164914,2027-07-14
2014-02-04T16:40:49Z+3,2014-02-04
ngày 28 tháng 3 năm 2018,2018-03-28
13.7.2011T9-32-32,2011-07-13
20320517085903269093,2032-05-17
2001_04_25T9_32_40+00:00,2001-04-25
Event at 2008-07-04T19:18:51,2008-07-04
The system recorded 20030910023627,2003-09-10
29 May 2004,2004-05-29
2031-01-25T16:58:24.614038Z,2031-01-25
27-11-2017,2017-11-27
26.8.2007T22-33-53,2007-08-26
2010/4/25T112156,2010-04-25
12 tháng 2 năm 2008,2008-02-12
14-4-1990,1990-04-14
The system recorded 20281001032750,2028-10-01
26/11/2021 giờ 19:12:42,2021-11-26
2005-12-05T10:01:06+00:00,2005-12-05
"November 9, 1992",1992-11-09
2017-02-15T00:42:05+07:00,2017-02-15
19910628184455620,1991-06-28
2002-06-19T20:44:23.313Z,2002-06-19
20 May 2009,2009-05-20
Event at 1990-05-03T20:21:52,1990-05-03
1233766800000,2009-02-05
2018-09-01T09:38:32.024Z,2018-09-01
1937062800000000,2031-05-21
30 tháng 6 năm 1999,1999-06-30
1996-08-17T11:10:11Z+3,1996-08-17
"19th of March, 2007",2007-03-19
7/16-2011,2011-08-07
2022-06-11T07:30:19Z+3,2022-06-11
30 12 2017,2017-12-30
19901109123930423151,1990-11-09
11_18_1995,1995-11-18
2015-03-16T11:19:17.339Z,2015-03-16
15/12/2018,2018-12-15
6 tháng 11 năm 1999,1999-11-06
"12th of February, 2000",2000-02-12
26.2.1990T5-56-15,1990-02-26
28.10.2012T5-48-57,2012-10-28
"October 28, 2002",2002-10-28
2010|02|16,2010-02-16
2023-11-29T20:01:35Z+3,2023-11-29
3/16-2004,2004-08-03
12/8/1994 giờ 12:50:40,1994-08-12
11-6-1991,1991-06-11
Ngày 12-1-2027,2027-01-12
948387600,2000-01-21
14|12|2002,2002-12-14
08/22/2025,2025-08-22
1991/8/27T112521,1991-08-27
24/8-1995,1995-04-24
"5th of June, 2007",2007-06-05
1991-05-04T19:29:59-05:00,1991-05-04
"21th of December, 2023",2023-12-21
11 7 1998,1998-07-11
1625331600000000000,2021-07-04
5-11-2028,2028-11-05
"October 11, 2015",2015-10-11
"November 3, 1999",1999-11-03
23/3/2024 giờ 14:16:58,2024-03-23
2031/05/11,2031-05-11
19940710053614654783,1994-07-10
2022 08 28,2022-08-28
20061023125932839855644,2006-10-23
"August 23, 2003",2003-08-23
26 10 1998,1998-10-26
27/24-2004,2004-12-27
Event at 2033-02-26T22:31:6,2033-02-26
16-1-2018,2018-01-08
20071225190556162643437,2007-12-25
2010-01-16T07:46:25,2010-01-16
10|12|2010,2010-12-10
02-24-2034,2034-02-24
2028|08|20,2028-08-20
1995-02-28T11:58:27.361498Z,1995-02-28
03|14|2010,2010-03-14
662749200000000000,1991-01-02
20291028112055087213,2029-10-28
1994-05-03T17:35:56.363088905Z,1994-05-03
06_07_2011,2011-06-07
6-12-2002,2002-12-03
21/4/2028 giờ 1:27:58,2028-04-21
7.10.1999T2-55-53,1999-10-07
Ngày 3-9-2020,2020-09-03
The system recorded 20310422060130,2031-04-22
12-10-2009,2009-10-06
01|02|02,2002-02-01
ngày 30 tháng 11 năm 1994,1994-11-30
2033-02-14T18:02:24Z+3,2033-02-14
ngày 5 tháng 10 năm 1999,1999-10-05
1406912400000,2014-08-02
859136400000000000,1997-03-24
22 October 2020,2020-10-22
2010_10_12T7_34_33+3,2010-10-12
01 10 2000,2000-01-10
23 tháng 7 năm 2026,2026-07-23
1995-04-01T10:13:04Z+3,1995-04-01
2012.08.03,2012-08-03
ngày 3 tháng 7 năm 2019,2019-07-03
30/5/1993 giờ 2:26:0,1993-05-30
Ngày 17-4-2011,2011-04-17
"9th of October, 2015",2015-10-09
Ngày 21-5-2021,2021-05-21
848336400000000000,1996-11-19
Event at 2032-08-27T10:33:19,2032-08-27
1922374800,2030-12-02
2022/11/14T20394,2022-11-14
20281119015825438,2028-11-19
20250928061350271,2025-09-28
28-05-90,1990-05-28
20170918102902923611018,2017-09-18
2025_01_12,2025-01-12
1996-07-30T13:05:15Z+3,1996-07-30
2003-12-14T11:51:29Z+3,2003-12-14
2012-12-23T17:19:19.035Z,2012-12-23
20140508224955,2014-05-08
20/12/1990 giờ 0:14:16,1990-12-20
10 December 2005,2005-12-10
20110225174341,2011-02-25
2 Jul 2023,2023-07-02
8/10/2021 giờ 1:53:24,2021-10-08
20050613055730869,2005-06-13
Sự kiện diễn ra vào 19/3/2014 23:59,2014-03-19
2033-08-07T13:10:57.529365656Z,2033-08-07
2011/1/29T74045,2011-01-29
735152400000000000,1993-04-19
5-9-2014,2014-09-05
20060901041027019978,2006-09-01
20220908091152102197002,2022-09-08
1998-04-22T19:37:24+2500,1998-04-22
20120802113608733,2012-08-02
829933200,1996-04-20
15|4|1993,1993-04-15
896720400000000,1998-06-02
9/10/2029 giờ 15:26:5,2029-10-09
1832864400000,2028-01-31
"June 27, 2020",2020-06-27
2026-09-29T10:30:46.479597017Z,2026-09-29
Event at 2034-02-10T0:41:39,2034-02-10
09/09/33,2033-09-09
The system recorded 20310822063356,2031-08-22
1993-09-05T16:17:03.774484Z,1993-09-05
30-7-2008,2008-07-30
2017-03-23T02:18:09.405749Z,2017-03-23
20120101093945247,2012-01-01
2014/07/09,2014-07-09
906656400000000,1998-09-25
10.04.2001,2001-10-04
19921126084132,1992-11-26
2032-07-07T04:04:33Z+3,2032-07-07
01/30/2008,2008-01-30
2022-04-30T21:43:33.430Z,2022-04-30
30-11-2030,2030-11-15
2014-10-09T19:58:40.484049393Z,2014-10-09
20101125210450708402667,2010-11-25
20260908150457005422421,2026-09-08
4.4.1990T1-37-8,1990-04-04
20231031011456837739613,2023-10-31
9.7.2031T17-20-43,2031-07-09
14-12-2012,2012-12-07
09 06 2011,2011-09-06
Sự kiện diễn ra vào 1/10/1999 0:35,1999-10-01
1242147600000,2009-05-13
18-9-1995,1995-09-18
1996-08-07T04:11:42,1996-08-07
4 Jun 2020,2020-06-04
2019-05-10T07:51:27,2019-05-10
13-8-2013,2013-08-13
1415379600000000000,2014-11-08
984502800,2001-03-14
13-9-2022,2022-09-13
26-12-1998,1998-12-26
31 January 2018,2018-01-31
"19th of October, 1995",1995-10-19
2013-05-28T10:05:14+2500,2013-05-28
1951837200000000000,2031-11-08
28-4-2011,2011-04-28
21/18-2003,2003-09-21
"September 18, 1996",1996-09-18
16 Apr 2011,2011-04-16
2024-02-01T00:37:46.728Z,2024-02-01
2005-04-11T00:19:52+2500,2005-04-11
Sự kiện diễn ra vào 20/6/1997 16:27,1997-06-20
24-1-2005,2005-01-24
ngày 1 tháng 12 năm 1999,1999-12-01
29 January 2011,2011-01-29
Sự kiện diễn ra vào 24/12/1996 14:7,1996-12-24
20240229220904415,2024-02-29
20040219102425188,2004-02-19
3-8-2012,2012-08-03
20120911132042844789,2012-09-11
20031209053743539,2003-12-09
1992-04-20T19:21:01.572217591Z,1992-04-20
08_26_2020,2020-08-26
1906131600000000,2030-05-28
28_07_30,2030-07-28
20200731051846549,2020-07-31
1339952400,2012-06-18
Ngày 31-10-1997,1997-10-31
1598547600000000,2020-08-28
1996-12-11T03:02:39Z+3,1996-12-11
Ngày 29-11-1990,1990-11-29
13-11-2010,2010-11-13
758048400000,1994-01-09
29 tháng 8 năm 2015,2015-08-29
2030-04-07T21:56:02+0500,2030-04-07
2031-06-01T17:10:29+2500,2031-06-01
1525107600000,2018-05-01
The system recorded 20210421023821,2021-04-21
20300210031116892103,2030-02-10
The system recorded 20320317213206,2032-03-17
"30th of January, 2004",2004-01-30
1481734800000,2016-12-15
2008-02-16T07:24:41,2008-02-16
19970409052251859,1997-04-09
2012-04-03T05:19:51Z+3,2012-04-03
2017/7/25T19139,2017-07-25
1180544400000,2007-05-31
20161231065859607349,2016-12-31
"August 3, 2026",2026-08-03
Ngày 9-8-2016,2016-08-09
"May 19, 2030",2030-05-19
1992_01_05T14_32_53-0330,1992-01-05
1832778000000,2028-01-30
The system recorded 20020514062105,2002-05-14
Event at 2017-06-05T2:33:13,2017-06-05
1995-05-02T19:04:53+3,1995-05-02
20030427211430,2003-04-27
"June 17, 2029",2029-06-17
2032/2/10T152031,2032-02-10
24/7/2006 giờ 6:57:40,2006-07-24
20281104111859932481800,2028-11-04
2007-03-08T13:58:46+2500,2007-03-08
The system recorded 20220719073137,2022-07-19
19940429014316,1994-04-29
913654800,1998-12-15
10-12-2019,2019-12-05
2001-03-09T18:43:34Z+3,2001-03-09
2.9.2032T12-52-53,2032-09-02
Ngày 7-1-2015,2015-01-07
841165200000,1996-08-28
1370970000000000000,2013-06-12
13 3 1993,1993-03-13
20 Nov 2025,2025-11-20
ngày 30 tháng 6 năm 2006,2006-06-30
23|7|1999,1999-07-23
1860426000000000000,2028-12-15
20021212072444201403,2002-12-12
18 tháng 2 năm 2033,2033-02-18
1997-07-16T15:51:01,1997-07-16
1 tháng 9 năm 2030,2030-09-01
2006-06-08T23:40:36.723Z,2006-06-08
8 May 2011,2011-05-08
2010934800000,2033-09-22
2015-02-10T04:41:41Z+3,2015-02-10
Ngày 7-5-1994,1994-05-07
20030131024859042341974,2003-01-31
Sự kiện diễn ra vào 14/3/2035 7:2,2035-03-14
19910114065818998112922,1991-01-14
Ngày 26-7-1995,1995-07-26
19971214154903,1997-12-14
30/18-1993,1993-09-30
"May 30, 1993",1993-05-30
The system recorded 20330304194907,2033-03-04
2011-11-23T21:53:21+2500,2011-11-23
30-10-2030,2030-10-15
Sự kiện diễn ra vào 17/10/2011 21:31,2011-10-17
1652029200000000000,2022-05-09
19990624181138,1999-06-24
Event at 1992-03-30T21:22:3,1992-03-30
1991-08-02T10:00:00.585Z,1991-08-02
857235600000000,1997-03-02
2034-03-28T09:46:14+2500,2034-03-28
"January 27, 2018",2018-01-27
2-5-2019,2019-05-02
1994-04-03T19:04:07.830936603Z,1994-04-03
2032_03_04T5_50_34+3,2032-03-04
Ngày 12-12-2015,2015-12-12
1994-06-29T07:11:36.247Z,1994-06-29
23 September 2025,2025-09-23
2019/7/16T2336,2019-07-16
19961122200539732597,1996-11-22
The system recorded 20331212181808,2033-12-12
25 Apr 2016,2016-04-25
19970910075353075785,1997-09-10
1305910800000000,2011-05-21
1762362000000000000,2025-11-06
"15th of May, 1994",1994-05-15
20330101184418,2033-01-01
5_9_2027,2027-09-05
Ngày 24-6-2005,2005-06-24
13/08/20,2020-08-13
6 Oct 2006,2006-10-06
08/23/2006,2006-08-23
4 Jan 2019,2019-01-04
50-2-2009,2009-02-25
1764608400000,2025-12-02
20261007053820195370,2026-10-07
20110201225117808885476,2011-02-01
Ngày 29-9-2002,2002-09-29
10.29.1998,1998-10-29
"19th of August, 2011",2011-08-19
03-19-2019,2019-03-19
Sự kiện diễn ra vào 31/5/2020 8:43,2020-05-31
18-4-2008,2008-04-09
2027_01_23T0_0_6+00:00,2027-01-23
2019/12/22T2398,2019-12-22
20/22-2027,2027-11-20
8.5.2034T20-35-24,2034-05-08
The system recorded 19970918100515,1997-09-18
22-2-2021,2021-02-22
ngày 1 tháng 9 năm 2010,2010-09-01
"May 11, 2026",2026-05-11
ngày 31 tháng 10 năm 2027,2027-10-31
20051024035745,2005-10-24
664909200000000000,1991-01-27
11-11-2004,2004-11-11
21 October 2032,2032-10-21
2019-08-22T09:24:08,2019-08-22
ngày 4 tháng 9 năm 2006,2006-09-04
7 tháng 5 năm 1997,1997-05-07
06|11|2015,2015-06-11
The system recorded 20301019072223,2030-10-19
12.5.1996T23-15-36,1996-05-12
2020/10/13T0514,2020-10-13
32-12-2028,2028-12-16
1995-10-17T07:14:01.729893Z,1995-10-17
20350414001541787272950,2035-04-14
17 Jul 2005,2005-07-17
2030-11-05T14:18:40.808385Z,2030-11-05
28/3/2001 giờ 4:15:24,2001-03-28
1996-01-15T11:26:17.485153Z,1996-01-15
2028_10_01T0_11_1Z+3,2028-10-01
931280400000000,1999-07-07
1816362000,2027-07-24
4-11-2011,2011-11-04
2020-06-19T06:21:50+2500,2020-06-19
1009299600,2001-12-26
2.3.1996T1-35-2,1996-03-02
1212080400000,2008-05-30
"14th of June, 2030",2030-06-14
2026/8/14T192215,2026-08-14
30/6-1993,1993-03-30
"10th of October, 2019",2019-10-10
2007-12-10T21:53:34+3,2007-12-10
The system recorded 19930202091010,1993-02-02
3 Jul 2001,2001-07-03
04/16/2004,2004-04-16
4/12/2012 giờ 17:2:46,2012-12-04
2029_01_10T20_0_21+08,2029-01-10
2026-11-16T08:13:33-05:00,2026-11-16
743101200000000000,1993-07-20
29.5.1995,1995-05-29
The system recorded 20240828155840,2024-08-28
02|07|1995,1995-02-07
1998_09_07T17_44_46+0500,1998-09-07
Event at 2024-11-23T13:46:47,2024-11-23
12 tháng 10 năm 2008,2008-10-12
2028-01-22T08:42:38Z+3,2028-01-22
27/1/1993 giờ 21:58:54,1993-01-27
25 Feb 2010,2010-02-25
14/2/2026 giờ 18:11:38,2026-02-14
20190608221810716160,2019-06-08
2 Oct 2020,2020-10-02
The system recorded 20120507224148,2012-05-07
2030/6/21T51352,2030-06-21
19 March 2002,2002-03-19
2013-04-27T18:56:54+2500,2013-04-27
2011-05-27T20:23:40Z+3,2011-05-27
25-9-2013,2013-09-25
8-8-2030,2030-08-08
28 tháng 7 năm 2035,2035-07-28
1497978000000000,2017-06-21
20260907125456974980,2026-09-07
1992-02-11T04:32:13,1992-02-11
19-3-2031,2031-03-19
20010413102320,2001-04-13
19921120155427390315,1992-11-20
2029-10-02T23:21:58.419Z,2029-10-02
13-12-2026,2026-12-13
4 Dec 1996,1996-12-04
Sự kiện diễn ra vào 28/3/2012 11:37,2012-03-28
"19th of September, 2033",2033-09-19
5 Feb 2031,2031-02-05
716403600000,1992-09-14
20 Oct 2005,2005-10-20
13/2-2011,2011-01-13
19940221085901,1994-02-21
6 February 2020,2020-02-06
1992-04-03T07:56:13.679680Z,1992-04-03
Ngày 13-7-2005,2005-07-13
ngày 10 tháng 4 năm 2021,2021-04-10
ngày 11 tháng 1 năm 2034,2034-01-11
20251203210025,2025-12-03
54-9-1992,1992-09-27
2002-02-24T01:23:46.058Z,2002-02-24
36-8-2005,2005-08-18
"29th of March, 2016",2016-03-29
05-09-2034,2034-05-09
20280324205212,2028-03-24
7 May 2025,2025-05-07
2020-10-31T15:25:03Z+3,2020-10-31
2032-10-12T14:59:39+2500,2032-10-12
20280817145710,2028-08-17
2001-01-13T07:45:15,2001-01-13
1861808400000000,2028-12-31
10-6-1992,1992-06-05
2020_02_09T19_22_56Z,2020-02-09
2024/5/5T14252,2024-05-05
20/6/2002 giờ 7:29:52,2002-06-20
1993_01_29T4_23_43-0330,1993-01-29
Ngày 4-2-2011,2011-02-04
9-2-2024,2024-02-09
The system recorded 19900320162529,1990-03-20
"8th of September, 2018",2018-09-08
The system recorded 19981112200416,1998-11-12
19920301153843776,1992-03-01
1998/11/2T17516,1998-11-02
"July 29, 2026",2026-07-29
2016_04_11T13_25_42+08,2016-04-11
2009_01_19T11_33_40Z+3,2009-01-19
20210920165835168420,2021-09-20
696358800000000000,1992-01-26
1652720400000000,2022-05-17
20061230084309235591027,2006-12-30
1991-09-18T06:05:58.918Z,1991-09-18
2026918800000000,2034-03-26
2025_01_27T21_8_5+2500,2025-01-27
2019315600000000000,2033-12-28
20201104033849507,2020-11-04
2026-03-14T14:55:41.984Z,2026-03-14
ngày 25 tháng 5 năm 2012,2012-05-25
12/10/03,2003-10-12
ngày 16 tháng 8 năm 2026,2026-08-16
30/10/2010 giờ 5:17:46,2010-10-30
1560963600000,2019-06-20
2003-01-13T22:51:00Z+3,2003-01-13
7|11|2033,2033-11-07
44-11-1995,1995-11-22
29/03/98,1998-03-29
2003-12-19T20:41:51.943Z,2003-12-19
1113411600,2005-04-14
03|22|2005,2005-03-22
2029-10-25T04:38:34.185056Z,2029-10-25
Sự kiện diễn ra vào 24/8/1993 19:49,1993-08-24
1790442000000,2026-09-27
2008_02_18,2008-02-18
12-12-2005,2005-12-12
9/5/2006 giờ 2:10:5,2006-05-09
1991-07-07T11:37:04Z+3,1991-07-07
20 Jun 2026,2026-06-20
"11th of February, 2000",2000-02-11
Ngày 8-1-2015,2015-01-08
1/11/2031 giờ 2:1:32,2031-11-01
844794000000000000,1996-10-09
13/20-2018,2018-10-13
5 tháng 1 năm 2018,2018-01-05
2010/2/13T21347,2010-02-13
2013_09_12T2_19_6+00:00,2013-09-12
2015-09-17T13:11:58Z+3,2015-09-17
694026000000000,1991-12-30
2013-09-07T21:26:36+2500,2013-09-07
26-08-06,2006-08-26
1618333200000,2021-04-14
1996/11/26T171214,1996-11-26
20010417100836,2001-04-17
2029-01-22T06:15:15Z+3,2029-01-22
1119718800000000000,2005-06-26
07-09-22,2022-09-07
10-05-11,2011-05-10
1994-11-19T18:00:37+00:00,1994-11-19
2032-04-02T02:05:38.033118913Z,2032-04-02
23 August 1996,1996-08-23
1995_09_01T12_10_22+0500,1995-09-01
20110810040905,2011-08-10
16/2/2016 giờ 17:15:12,2016-02-16
2002.06.25,2002-06-25
783104400000000,1994-10-26
20280730111026,2028-07-30
1995/08/19,1995-08-19
1329066000,2012-02-13
15/12-2013,2013-06-15
20330705185930130844,2033-07-05
2017-08-30T07:37:43.580439Z,2017-08-30
847558800000000,1996-11-10
"28th of September, 2006",2006-09-28
"20th of July, 2028",2028-07-20
20200830200745566,2020-08-30
2030-12-18T05:30:26.191822Z,2030-12-18
2035/10/3T1436,2035-10-03
1992/2/12T155012,1992-02-12
24-12-2007,2007-12-12
2001_09_16T19_21_13+2500,2001-09-16
5.1.2020T18-37-14,2020-01-05
20160707064438109934,2016-07-07
727030800000,1993-01-15
"May 27, 1999",1999-05-27
Event at 2022-02-25T14:42:46,2022-02-25
4 October 2025,2025-10-04
"August 22, 2017",2017-08-22
17 September 1993,1993-09-17
1995-03-23T05:52:01Z+3,1995-03-23
2|7|2010,2010-07-02
15 06 98,1998-06-15
1686070800000,2023-06-07
1332867600,2012-03-28
30/5/2034 giờ 6:47:8,2034-05-30
2025 05 24,2025-05-24
25.12.2023T10-29-0,2023-12-25
11_6_2016,2016-06-11
2002-02-01T10:05:45+00:00,2002-02-01
1766682000000000000,2025-12-26
2018_10_02T18_55_54+08,2018-10-02
29 May 2007,2007-05-29
20180609051534435,2018-06-09
ngày 28 tháng 5 năm 2010,2010-05-28
Sự kiện diễn ra vào 23/10/2001 5:6,2001-10-23
ngày 9 tháng 3 năm 2022,2022-03-09
20251216085131302323549,2025-12-16
2025-05-17T15:06:19+07:00,2025-05-17
1133542800000000000,2005-12-03
1996-07-16T17:56:23+2500,1996-07-16
20330518124730620,2033-05-18
1594227600000000000,2020-07-09
27_8_2025,2025-08-27
56-5-2005,2005-05-28
05-28-2024,2024-05-28
16-10-2029,2029-10-16
2030-09-24T05:53:57.240Z,2030-09-24
5 tháng 3 năm 1994,1994-03-05
12_03_02,2002-03-12
16-3-2027,2027-03-08
1463245200000000000,2016-05-15
1990-12-06T02:06:37+2500,1990-12-06
Ngày 19-5-2012,2012-05-19
19 tháng 9 năm 2033,2033-09-19
12.09.93,1993-09-12
2019-01-01T18:21:08+2500,2019-01-01
20240531222523101444,2024-05-31
Sự kiện diễn ra vào 12/4/1999 18:4,1999-04-12
20 Jan 2003,2003-01-20
02-07-08,2008-07-02
9/12/2027 giờ 11:21:31,2027-12-09
ngày 17 tháng 4 năm 2013,2013-04-17
1497718800000000000,2017-06-18
1029690000000,2002-08-19
2011-02-27T11:45:11,2011-02-27
The system recorded 20291103081704,2029-11-03
13-4-1991,1991-04-13
"9th of March, 1993",1993-03-09
25 tháng 8 năm 2019,2019-08-25
1992-06-17T19:03:10.195Z,1992-06-17
19970509075513611134,1997-05-09
20250217174222860,2025-02-17
2005-08-20,2005-08-20
1993/7/26T23418,1993-07-26
1992-10-23T20:22:18,1992-10-23
ngày 23 tháng 10 năm 2007,2007-10-23
15 August 2034,2034-08-15
646592400000000,1990-06-29
2012.01.24,2012-01-24
Sự kiện diễn ra vào 18/1/2000 17:53,2000-01-18
20140305090432218,2014-03-05
Sự kiện diễn ra vào 11/1/1991 5:37,1991-01-11
The system recorded 19970409201553,1997-04-09
2033-01-25T05:47:58.396410405Z,2033-01-25
1 tháng 7 năm 2026,2026-07-01
19930705081350,1993-07-05
07-10-1998,1998-07-10
2002-10-21T16:11:03Z+3,2002-10-21
2022_12_04T18_22_41+07:00,2022-12-04
19900219171349630432,1990-02-19
20170412030227418570417,2017-04-12
20020607022555,2002-06-07
14/22-2023,2023-11-14
2001/12/21,2001-12-21
6-1-2024,2024-01-03
3.6.2029,2029-06-03
2015/3/6T184016,2015-03-06
30-5-1992,1992-05-15
20170521085732671,2017-05-21
03.11.2023,2023-03-11
11 Aug 2033,2033-08-11
21 Jan 2024,2024-01-21
29 tháng 6 năm 1993,1993-06-29
1/3/2017 giờ 8:37:1,2017-03-01
6-11-1993,1993-11-06
Sự kiện diễn ra vào 28/11/2024 1:34,2024-11-28
"3rd of August, 2015",2015-08-03
2026-07-26T11:02:14Z+3,2026-07-26
2012/08/29,2012-08-29
882118800000000,1997-12-15
2010-04-01T05:23:40.450609Z,2010-04-01
Event at 2022-03-13T11:53:49,2022-03-13
21/11/2001 giờ 3:17:36,2001-11-21
20170910071945486643,2017-09-10
2042125200000000,2034-09-18
20160115030748,2016-01-15
2031-10-04T21:14:03,2031-10-04
1666285200,2022-10-21
"27th of November, 1991",1991-11-27
2012-11-14T18:14:28-0300,2012-11-14
2023-03-15T07:13:38.096060Z,2023-03-15
2030-08-31T06:17:21+2500,2030-08-31
The system recorded 19970106220957,1997-01-06
Sự kiện diễn ra vào 8/3/2033 17:32,2033-03-08
23-4-2017,2017-04-23
2034-10-18T01:39:22-05:00,2034-10-18
28-1-2005,2005-01-14
Sự kiện diễn ra vào 17/5/2010 5:8,2010-05-17
2032_08_20,2032-08-20
668624400000000,1991-03-11
2016-07-16T08:41:26Z+3,2016-07-16
22-11-2016,2016-11-22
20331021073923859,2033-10-21
ngày 17 tháng 2 năm 2019,2019-02-17
2021-12-04T22:56:18.037030Z,2021-12-04
The system recorded 20140217165728,2014-02-17
"15th of November, 2025",2025-11-15
2028-02-05T04:36:01+2500,2028-02-05
5 7 2034,2034-07-05
20_2_2012,2012-02-20
1380042000000000000,2013-09-25
20.9.1993,1993-09-20
The system recorded 20350815184542,2035-08-15
1.3.2024,2024-03-01
2010-01-14T15:20:32Z+3,2010-01-14
Event at 2017-04-19T17:41:2,2017-04-19
The system recorded 20300702145255,2030-07-02
20051217173229154420973,2005-12-17
19950110055604304608250,1995-01-10
7.7.2021,2021-07-07
20040208210643881,2004-02-08
28-11-1994,1994-11-28
01-18-1997,1997-01-18
22-12-1990,1990-12-11
22 Jun 2024,2024-06-22
888166800000,1998-02-23
2002|11|07,2002-11-07
861987600000000,1997-04-26
1345222800,2012-08-18
Event at 2032-03-09T5:32:25,2032-03-09
"October 21, 2006",2006-10-21
1675530000000000,2023-02-05
1483203600000,2017-01-01
20170209013218527291700,2017-02-09
20150131183200,2015-01-31
1360774800000,2013-02-14
Event at 2012-02-21T3:2:15,2012-02-21
Ngày 29-5-2007,2007-05-29
1991/4/8T103439,1991-04-08
"October 18, 1999",1999-10-18
994352400,2001-07-06
2014/1/6T15490,2014-01-06
14 tháng 3 năm 2025,2025-03-14
2003072400000,2033-06-23
The system recorded 20080121173145,2008-01-21
11.02.2001,2001-11-02
1909674000000000,2030-07-08
1973437200000,2032-07-15
692989200,1991-12-18
25/9/2021 giờ 15:17:50,2021-09-25
26-10-28,2028-10-26
2006/2/3T19532,2006-02-03
2027/1/1T7715,2027-01-01
948128400000000,2000-01-18
08/02/31,2031-02-08
20190321135143647,2019-03-21
991933200000000,2001-06-08
08-05-2003,2003-08-05
08 09 2008,2008-08-09
12/10/2021 giờ 20:26:4,2021-10-12
Event at 2005-01-06T20:10:22,2005-01-06
20230524135655,2023-05-24
Sự kiện diễn ra vào 28/8/2016 16:6,2016-08-28
2026-07-09T11:10:18,2026-07-09
2013-09-30T01:40:03Z+3,2013-09-30
2031/7/8T9928,2031-07-08
19910624140727,1991-06-24
8/11/2010 giờ 22:53:49,2010-11-08
5 tháng 7 năm 2008,2008-07-05
20340826075511406882391,2034-08-26
Ngày 6-1-2034,2034-01-06
1931706000,2031-03-20
2020-05-13T00:11:06Z+3,2020-05-13
4 January 2029,2029-01-04
12 tháng 2 năm 2016,2016-02-12
"October 4, 2016",2016-10-04
"April 8, 2002",2002-04-08
Sự kiện diễn ra vào 5/2/2025 12:33,2025-02-05
2031-07-05T06:17:36.446288437Z,2031-07-05
1 March 2021,2021-03-01
24-08-00,2000-08-24
ngày 11 tháng 4 năm 2033,2033-04-11
1248368400000000000,2009-07-24
Sự kiện diễn ra vào 9/9/2003 5:4,2003-09-09
Event at 2021-11-11T15:46:57,2021-11-11
1876237200000000,2029-06-16
3/10-1996,1996-05-03
6 January 1990,1990-01-06
1611162000000000000,2021-01-21
2022-12-30T04:59:16.252Z,2022-12-30
14.11.2013,2013-11-14
2003-02-20T06:01:11+08,2003-02-20
7-3-2009,2009-03-07
Sự kiện diễn ra vào 1/12/2007 9:11,2007-12-01
2027-03-07T08:10:35.788395Z,2027-03-07
2004-01-03T21:48:51,2004-01-03
1656867600000000000,2022-07-04
2011-11-01T22:42:58.945755Z,2011-11-01
2006/6/14T152638,2006-06-14
1297875600000000,2011-02-17
2027_10_06T8_37_13+00:00,2027-10-06
1868374800000000,2029-03-17
Ngày 16-8-2021,2021-08-16
1019754000000000000,2002-04-26
7-3-2001,2001-03-07
05_03_2022,2022-05-03
The system recorded 20090928150457,2009-09-28
20320120152620312675059,2032-01-20
2020-02-04T11:31:00.716Z,2020-02-04
1993-04-18T13:34:54Z+3,1993-04-18
1867424400,2029-03-06
1996-04-23T08:35:55.933Z,1996-04-23
1999_02_06T20_34_5+0500,1999-02-06
36-8-1992,1992-08-18
2020-08-17T18:38:39.466345Z,2020-08-17
20060225094444238934388,2006-02-25
2004-03-01T04:32:31Z+3,2004-03-01
1991-10-08T14:43:34+08,1991-10-08
11 Mar 2020,2020-03-11
19940624234126288,1994-06-24
20/08/00,2000-08-20
2021-04-07T13:22:54.093611Z,2021-04-07
16-3-2021,2021-03-08
2004.06.26,2004-06-26
20|5|2023,2023-05-20
10 October 2022,2022-10-10
1990_12_10,1990-12-10
20290512165147236112,2029-05-12
8 1 1997,1997-01-08
20/12/2009 giờ 6:55:39,2009-12-20
2031|01|08,2031-01-08
26/12-1999,1999-06-26
2004/5/1T232442,2004-05-01
1690390800000,2023-07-27
02|10|2032,2032-02-10
2015-07-09T20:45:29Z+3,2015-07-09
2032|12|11,2032-12-11
760035600000000,1994-02-01
08.15.2022,2022-08-15
1368810000000,2013-05-18
2-2-2020,2020-02-01
1748970000000000,2025-06-04
2015-11-14T15:02:27+08,2015-11-14
13 Nov 1993,1993-11-13
2006-09-28T03:42:40,2006-09-28
36-5-2016,2016-05-18
20241221200328118805,2024-12-21
20130505210730544823135,2013-05-05
31/14-1992,1992-07-31
20261229113322233711,2026-12-29
1-5-2009,2009-05-01
1993-10-23T05:46:20,1993-10-23
Event at 2012-03-02T16:35:21,2012-03-02
769194000000000,1994-05-18
15/22-1995,1995-11-15
Sự kiện diễn ra vào 13/12/2004 23:21,2004-12-13
1459530000000,2016-04-02
Event at 2013-05-16T4:39:43,2013-05-16
2021-08-19T18:21:02,2021-08-19
24 November 2030,2030-11-24
20190703231303865,2019-07-03
7.7.2015T14-18-42,2015-07-07
2010-11-05T20:16:51.482529838Z,2010-11-05
12/6-1990,1990-03-12
6-12-2025,2025-12-06
2016-09-02T01:44:08.328408Z,2016-09-02
2008-07-11T00:31:57.351563Z,2008-07-11
2031-09-07T21:48:15,2031-09-07
18-3-2030,2030-03-18
2000-07-14T20:11:08+2500,2000-07-14
2028-02-04T05:26:45+2500,2028-02-04
2032_12_05T14_18_40+3,2032-12-05
1074013200,2004-01-14
28/11/1991,1991-11-28
23/9/2026 giờ 2:34:17,2026-09-23
2002-03-26T11:58:08+2500,2002-03-26
2025-11-25T11:34:16.537812843Z,2025-11-25
1424970000000000,2015-02-27
20090905173826,2009-09-05
1997_04_22,1997-04-22
1222102800000,2008-09-23
2005-08-10T15:30:42.560097Z,2005-08-10
2008-04-21T15:06:35+3,2008-04-21
21-9-1991,1991-09-21
"May 4, 2022",2022-05-04
1697216400000,2023-10-14
The system recorded 20330422231358,2033-04-22
2018-05-21T14:34:18.793553Z,2018-05-21
24-6-2014,2014-06-12
735757200000000000,1993-04-26
Sự kiện diễn ra vào 16/10/2033 6:27,2033-10-16
The system recorded 20021215121506,2002-12-15
2024-02-28T16:43:10.060594Z,2024-02-28
27-11-2004,2004-11-27
56-8-2029,2029-08-28
03-08-2008,2008-03-08
2 Feb 2010,2010-02-02
28 March 1997,1997-03-28
17 9 2010,2010-09-17
20210306054040762,2021-03-06
14 Nov 2032,2032-11-14
Sự kiện diễn ra vào 4/9/2030 18:18,2030-09-04
2005-12-07T13:11:14.288Z,2005-12-07
ngày 26 tháng 11 năm 1992,1992-11-26
The system recorded 20350202224128,2035-02-02
2032-11-08,2032-11-08
1308243600,2011-06-17
19970815194527,1997-08-15
20150125001056052,2015-01-25
23.6.2033,2033-06-23
2009-11-29T07:49:08-05:00,2009-11-29
1992-01-25T08:20:17+2500,1992-01-25
20340609092708555972626,2034-06-09
2023-04-10T03:12:18.971Z,2023-04-10
797101200,1995-04-06
6/12/1996 giờ 15:14:53,1996-12-06
2021-08-03T11:17:12-0330,2021-08-03
4.8.1996T1-35-35,1996-08-04
Ngày 8-9-2002,2002-09-08
ngày 7 tháng 7 năm 2005,2005-07-07
2028-11-03T19:45:18,2028-11-03
2010-11-15T05:59:02.919996Z,2010-11-15
29/6-1993,1993-03-29
7/4-1990,1990-02-07
17 tháng 4 năm 2016,2016-04-17
2017-03-02T20:48:07.659480289Z,2017-03-02
2026-10-21T14:59:43,2026-10-21
27 Feb 1998,1998-02-27
"August 8, 2030",2030-08-08
19990711113100283962,1999-07-11
12-03-2010,2010-12-03
2029338000,2034-04-23
"10th of February, 2012",2012-02-10
"October 24, 1998",1998-10-24
2010-01-06T15:10:07,2010-01-06
14/12-2028,2028-06-14
20021107065306,2002-11-07
21_12_2030,2030-12-21
24-8-1997,1997-08-24
2/24-2024,2024-12-02
2022-05-14T06:04:37Z+3,2022-05-14
5|7|2034,2034-07-05
48-6-2005,2005-06-24
1994-09-17T05:22:02Z+3,1994-09-17
13 4 2022,2022-04-13
"January 8, 1996",1996-01-08
2010-02-01T06:16:57Z+3,2010-02-01
The system recorded 20180319233208,2018-03-19
Sự kiện diễn ra vào 21/3/2006 2:59,2006-03-21
2022-09-26,2022-09-26
2029.07.02,2029-07-02
823280400000,1996-02-03
2015-07-19T22:46:02.128125Z,2015-07-19
1996-11-22T02:21:40+2500,1996-11-22
The system recorded 20280921071331,2028-09-21
4/8/2028,2028-08-04
Ngày 2-9-2033,2033-09-02
2008-12-19T12:37:15.706Z,2008-12-19
ngày 14 tháng 9 năm 2022,2022-09-14
The system recorded 20050924141441,2005-09-24
2025-09-14T03:21:42.137144Z,2025-09-14
1543856400000,2018-12-04
10/8-2002,2002-04-10
19970118000737130341415,1997-01-18
2002-04-21T17:16:39-05:00,2002-04-21
1991/1/27T17150,1991-01-27
Event at 2032-03-08T18:12:15,2032-03-08
The system recorded 20171016052835,2017-10-16
28 tháng 12 năm 1994,1994-12-28
1361552400000000,2013-02-23
19 May 2015,2015-05-19
20060302230535,2006-03-02
2014/3/7T145618,2014-03-07
730400400000000,1993-02-23
The system recorded 19970425065603,1997-04-25
1787245200,2026-08-21
2034-06-04T15:41:14,2034-06-04
1301504400000000000,2011-03-31
1510506000000000000,2017-11-13
The system recorded 19960720195925,1996-07-20
The system recorded 20100706180641,2010-07-06
1994-07-26T08:53:39Z+3,1994-07-26
2010-05-02T12:47:12+2500,2010-05-02
22/5/2000 giờ 1:2:29,2000-05-22
2020_01_29,2020-01-29
Event at 2021-03-21T17:53:25,2021-03-21
2016-08-03T01:00:21+2500,2016-08-03
2034-09-17T22:06:14+2500,2034-09-17
2010-11-13T07:03:09Z+3,2010-11-13
1127408400000000,2005-09-23
2025-06-03T14:53:24+2500,2025-06-03
2009-08-25T14:06:54+2500,2009-08-25
19951127020327568921,1995-11-27
2019/6/1T131827,2019-06-01
11 February 2020,2020-02-11
1997-06-29T01:29:52.249Z,1997-06-29
2009_11_01T9_40_43-0300,2009-11-01
1992-01-29T18:55:55.306425210Z,1992-01-29
40-8-2015,2015-08-20
1268845200000000,2010-03-18
709232400,1992-06-23
Sự kiện diễn ra vào 18/5/1995 13:29,1995-05-18
"May 7, 2034",2034-05-07
05-07-2032,2032-05-07
1680368400000000000,2023-04-02
2022-10-08T23:33:22.273785345Z,2022-10-08
Event at 2032-10-08T20:22:2,2032-10-08
1897491600000000,2030-02-17
22 tháng 9 năm 1998,1998-09-22
2014-02-26T13:13:53Z+3,2014-02-26
28/6/2008 giờ 12:14:7,2008-06-28
1990-06-16T15:50:27.174348220Z,1990-06-16
16-6-1999,1999-06-08
6/3/2008 giờ 0:13:28,2008-03-06
10/6-2005,2005-03-10
2026-01-28T18:07:11,2026-01-28
2012-06-29T11:46:44.656187Z,2012-06-29
970419600,2000-10-02
2030-12-04T21:00:47+2500,2030-12-04
18/3/2015 giờ 10:45:51,2015-03-18
2032-02-24T18:45:49.878Z,2032-02-24
Event at 2034-01-07T16:23:37,2034-01-07
11_12_1997,1997-12-11
18-12-2026,2026-12-18
Event at 2023-07-02T20:20:55,2023-07-02
19960706150216451278,1996-07-06
11_1_1993,1993-01-11
2031-08-08T12:06:44+00:00,2031-08-08
2008-03-13T01:48:41Z+3,2008-03-13
2001-10-18T05:43:35.629Z,2001-10-18
1137603600000000,2006-01-19
1990/2/4T11342,1990-02-04
1995-02-15T23:35:29.557Z,1995-02-15
2001-10-01T20:44:50Z+3,2001-10-01
2013-12-22T19:55:16.738923165Z,2013-12-22
2014-12-03T22:15:44.283Z,2014-12-03
2023-08-27T16:34:09-0330,2023-08-27
08_10_97,1997-10-08
03-12-2035,2035-03-12
19970507083336227962,1997-05-07
15 tháng 9 năm 2027,2027-09-15
13-10-2019,2019-10-13
09 04 06,2006-04-09
Ngày 5-1-2011,2011-01-05
1767373200000,2026-01-03
Event at 2016-01-26T13:34:54,2016-01-26
2035-04-30,2035-04-30
2030/5/13T18480,2030-05-13
1999616400000000,2033-05-14
27-11-91,1991-11-27
1992-12-09T19:49:11.944Z,1992-12-09
2018-05-13T01:21:58.154519638Z,2018-05-13
6-6-2028,2028-06-03
26-6-2002,2002-06-26
The system recorded 20160421210516,2016-04-21
27.9.2022,2022-09-27
Ngày 30-5-2008,2008-05-30
1517504400000,2018-02-02
12/8-2010,2010-04-12
20001216144128220,2000-12-16
09.11.22,2022-11-09
1996-05-28T01:28:36.944Z,1996-05-28
08|25|2035,2035-08-25
Event at 2008-01-02T22:56:36,2008-01-02
2007-08-31T03:41:40Z+3,2007-08-31
The system recorded 20031029092213,2003-10-29
2009-11-13T16:11:40,2009-11-13
1 7 1994,1994-07-01
Event at 2001-08-03T12:47:47,2001-08-03
20110607020143023230,2011-06-07
11-6-1990,1990-06-11
20130722145107594134063,2013-07-22
1548867600000000,2019-01-31
2012_06_18,2012-06-18
23 tháng 3 năm 2000,2000-03-23
"October 8, 2017",2017-10-08
2035/3/31T214526,2035-03-31
Ngày 13-3-1997,1997-03-13
32-10-1996,1996-10-16
2029|10|08,2029-10-08
23 November 2026,2026-11-23
1997-01-29T18:02:32.960525Z,1997-01-29
2030-05-24T09:17:26,2030-05-24
08_13_1993,1993-08-13
1993-01-19T13:00:25.490042Z,1993-01-19
20011020071115512971014,2001-10-20
2022-07-20T05:54:38+2500,2022-07-20
1334682000000000000,2012-04-18
20200224143145,2020-02-24
The system recorded 20080627072234,2008-06-27
Ngày 29-12-2003,2003-12-29
ngày 9 tháng 11 năm 2031,2031-11-09
1090429200,2004-07-22
20291217154536620061,2029-12-17
20110815085609181008,2011-08-15
24-5-2006,2006-05-24
10 tháng 6 năm 2015,2015-06-10
20020326194427681404338,2002-03-26
ngày 9 tháng 7 năm 2026,2026-07-09
2005/1/10T72227,2005-01-10
20010505095306969,2001-05-05
Ngày 5-10-2000,2000-10-05
The system recorded 20241016032626,2024-10-16
20301116195446131733,2030-11-16
The system recorded 20050823032703,2005-08-23
2032-07-16T14:43:31.468Z,2032-07-16
42-12-1999,1999-12-21
2001-04-17T14:04:14,2001-04-17
2017-10-26,2017-10-26
20180303065742,2018-03-03
"20th of November, 2011",2011-11-20
19980724014606890,1998-07-24
20121125085855589400448,2012-11-25
6/6/2021 giờ 22:28:3,2021-06-06
14 April 2004,2004-04-14
31 Oct 2030,2030-10-31
20020312050244949057956,2002-03-12
19950407020440867373,1995-04-07
8-7-1992,1992-07-08
30 Oct 2027,2027-10-30
Ngày 18-3-1996,1996-03-18
2024/7/13T25811,2024-07-13
1341421200000000,2012-07-05
2027/01/22,2027-01-22
2028-09-29T20:46:42.449Z,2028-09-29
3|10|2023,2023-10-03
2029-05-19T11:27:04,2029-05-19
The system recorded 20100326222259,2010-03-26
25.12.2023T13-27-15,2023-12-25
Event at 2024-02-03T8:4:52,2024-02-03
3 Feb 2023,2023-02-03
ngày 28 tháng 2 năm 2022,2022-02-28
"28th of November, 2021",2021-11-28
7-11-2000,2000-11-07
1664125200,2022-09-26
2021-11-15T23:50:20Z,2021-11-15
"30th of June, 2031",2031-06-30
1 1 2035,2035-01-01
17 tháng 11 năm 2018,2018-11-17
8|9|2022,2022-09-08
"October 31, 1990",1990-10-31
Event at 2035-03-06T9:58:17,2035-03-06
The system recorded 20170820081841,2017-08-20
Ngày 11-12-2015,2015-12-11
1 October 2031,2031-10-01
1994-08-02T11:16:04.900Z,1994-08-02
1682182800000,2023-04-23
29/12/2025 giờ 21:41:21,2025-12-29
11_12_2002,2002-12-11
Event at 2024-03-17T8:17:9,2024-03-17
20060916120913911,2006-09-16
28/11/2002 giờ 4:53:58,2002-11-28
Sự kiện diễn ra vào 25/4/2006 6:51,2006-04-25
2024-03-09T05:38:11+08,2024-03-09
20180901170828213,2018-09-01
28 tháng 6 năm 2017,2017-06-28
20270221192138333646435,2027-02-21
1994-12-28T16:28:17,1994-12-28
20110111044825585,2011-01-11
2033-07-06T23:34:20.812Z,2033-07-06
"April 9, 2006",2006-04-09
1294419600000000000,2011-01-08
19.3.2005,2005-03-19
8-2-2004,2004-02-04
2003-08-26T20:59:43.072Z,2003-08-26
20020508121849,2002-05-08
"22th of January, 2002",2002-01-22
1991-12-04T08:08:23.500460Z,1991-12-04
The system recorded 20331018100325,2033-10-18
2024-02-27T11:49:42+08,2024-02-27
2032 06 02,2032-06-02
07/08/1998,1998-07-08
2/20-2016,2016-10-02
2027_04_20T15_41_40-0330,2027-04-20
27/1/2032 giờ 5:42:19,2032-01-27
1234630800000,2009-02-15
10-6-2025,2025-06-10
20170510160651,2017-05-10
Event at 2024-08-02T2:59:28,2024-08-02
25 tháng 1 năm 2023,2023-01-25
Event at 1992-11-28T4:23:31,1992-11-28
2008-07-19T04:41:12+2500,2008-07-19
2033-04-07T08:09:04,2033-04-07
2013 03 22,2013-03-22
25-10-2025,2025-10-25
2016-09-12T17:04:56,2016-09-12
2024-07-23T17:00:52Z+3,2024-07-23
2028/2/5T234527,2028-02-05
1137517200000000000,2006-01-18
1599325200,2020-09-06
19980629115010720127,1998-06-29
1986829200,2032-12-17
2030-09-18T08:17:20-0300,2030-09-18
18 May 2001,2001-05-18
20280922112311882,2028-09-22
1996-05-23T06:42:07+2500,1996-05-23
2022.08.13,2022-08-13
2011-06-12T13:42:09,2011-06-12
07-21-2007,2007-07-21
1135789200000000,2005-12-29
1995-03-02T04:53:09Z,1995-03-02
Ngày 26-7-1999,1999-07-26
ngày 25 tháng 5 năm 2017,2017-05-25
20221116063640,2022-11-16
Sự kiện diễn ra vào 10/12/2033 16:43,2033-12-10
"4th of July, 1995",1995-07-04
1999-10-29T07:30:36Z+3,1999-10-29
20341028025807961713170,2034-10-28
2000-05-15T03:25:53+2500,2000-05-15
Ngày 14-12-2022,2022-12-14
1568566800,2019-09-16
2030-01-15T17:46:40+2500,2030-01-15
1138122000000000000,2006-01-25
1996-05-16T17:44:20,1996-05-16
Sự kiện diễn ra vào 8/2/2017 4:53,2017-02-08
20310320180009,2031-03-20
14 tháng 2 năm 2031,2031-02-14
1745427600,2025-04-24
03 17 2029,2029-03-17
19940511035542,1994-05-11
20120507110242742,2012-05-07
20-1-2024,2024-01-20
06_09_1994,1994-06-09
Event at 2014-11-28T8:7:41,2014-11-28
Sự kiện diễn ra vào 30/6/2030 1:19,2030-06-30
2013.05.09,2013-05-09
7/9/2029 giờ 10:17:18,2029-09-07
"April 27, 2020",2020-04-27
Sự kiện diễn ra vào 15/6/2025 4:9,2025-06-15
12-6-1992,1992-06-06
2005-04-14T13:05:02Z,2005-04-14
22-3-1993,1993-03-22
28 tháng 11 năm 2024,2024-11-28
14.09.09,2009-09-14
1998-08-03T15:30:13.748034006Z,1998-08-03
20050118025645746535320,2005-01-18
19980811080104173885,1998-08-11
27.2.1999T10-19-3,1999-02-27
"10th of March, 2016",2016-03-10
991674000000000000,2001-06-05
Sự kiện diễn ra vào 9/5/2032 14:39,2032-05-09
2/8-2026,2026-04-02
2017-06-29T11:29:52.656Z,2017-06-29
18/16-2014,2014-08-18
22 09 98,1998-09-22
21.6.2027T1-24-56,2027-06-21
Ngày 4-2-2014,2014-02-04
2009-01-14T23:09:31Z+3,2009-01-14
22-1-1992,1992-01-11
1071507600000000000,2003-12-16
1728579600000,2024-10-11
19/9/2004 giờ 6:22:47,2004-09-19
20-3-2028,2028-03-20
768934800000,1994-05-15
2005-06-23T02:12:30Z+3,2005-06-23
2032-07-12T22:35:18.595175Z,2032-07-12
4/6-2021,2021-03-04
Sự kiện diễn ra vào 5/12/1991 14:46,1991-12-05
2/2/2024 giờ 3:41:40,2024-02-02
19900117063657628123,1990-01-17
"24th of December, 1991",1991-12-24
30/2-1997,1997-01-30
"August 13, 2003",2003-08-13
19940602092501725671306,1994-06-02
1171472400000000000,2007-02-15
02/20/2023,2023-02-20
2011-04-02T01:11:04+2500,2011-04-02
1992-03-15T05:59:22+07:00,1992-03-15
62-5-2010,2010-05-31
"29th of May, 1990",1990-05-29
2025/2/25T142458,2025-02-25
2030/4/6T83655,2030-04-06
Sự kiện diễn ra vào 26/10/1995 10:33,1995-10-26
1997-09-14T04:56:53Z+3,1997-09-14
1993-04-29T16:33:19.780995Z,1993-04-29
2000-04-07T16:47:49.566797315Z,2000-04-07
01-04-1990,1990-01-04
The system recorded 19950218220216,1995-02-18
2032-02-21T09:09:03+2500,2032-02-21
2035.06.14,2035-06-14
Event at 2032-10-01T19:42:51,2032-10-01
1455901200,2016-02-20
4-5-2016,2016-05-04
1997-02-10T03:38:25+2500,1997-02-10
"February 24, 2008",2008-02-24
19920905155143381,1992-09-05
2014-04-17T14:20:36.491152Z,2014-04-17
Sự kiện diễn ra vào 28/8/2025 14:46,2025-08-28
15-06-02,2002-06-15
1576602000000000000,2019-12-18
2004 10 11,2004-10-11
1002387600,2001-10-07
Event at 2003-11-06T12:15:55,2003-11-06
2019-04-25T23:57:23.788807091Z,2019-04-25
3-1-1991,1991-01-03
2012-07-30T19:51:08.435177361Z,2012-07-30
2003-10-07T12:26:56.503Z,2003-10-07
62-8-2006,2006-08-31
09_21_2008,2008-09-21
22_10_24,2024-10-22
2011-09-03T13:30:08.650631566Z,2011-09-03
17 tháng 10 năm 2030,2030-10-17
1510419600000,2017-11-12
1266598800,2010-02-20
"October 27, 2019",2019-10-27
1568480400000000,2019-09-15
1460739600000,2016-04-16
20 tháng 6 năm 2005,2005-06-20
1456765200000000,2016-03-01
22/24-2031,2031-12-22
1998-09-20,1998-09-20
12 July 2033,2033-07-12
19990304025405156457883,1999-03-04
26_02_93,1993-02-26
Event at 2028-04-15T8:54:37,2028-04-15
ngày 18 tháng 12 năm 2010,2010-12-18
28-7-2028,2028-07-28
28 Jun 2033,2033-06-28
27 September 2035,2035-09-27
Ngày 7-8-2006,2006-08-07
22 July 2016,2016-07-22
1685638800000000000,2023-06-02
"September 1, 2035",2035-09-01
The system recorded 20100124002258,2010-01-24
Sự kiện diễn ra vào 28/5/2018 12:0,2018-05-28
Sự kiện diễn ra vào 26/12/2023 11:52,2023-12-26
1769101200,2026-01-23
20060203235031885,2006-02-03
4-6-1995,1995-06-02
ngày 30 tháng 4 năm 1990,1990-04-30
4-11-1994,1994-11-04
6-2-2021,2021-02-06
1586365200000000,2020-04-09
1636736400000,2021-11-13
"4th of September, 2021",2021-09-04
13-01-27,2027-01-13
20200222013346,2020-02-22
13/10-2031,2031-05-13
"January 1, 2004",2004-01-01
"May 7, 2018",2018-05-07
24.12.2015T15-28-26,2015-12-24
The system recorded 20060717075853,2006-07-17
19950112050110413,1995-01-12
Sự kiện diễn ra vào 17/7/2015 1:9,2015-07-17
2011_08_22T16_34_47+08,2011-08-22
25/24-2028,2028-12-25
"April 25, 2014",2014-04-25
2023_05_09T22_14_57-0330,2023-05-09
06/08/2025,2025-06-08
14.5.2029T22-15-19,2029-05-14
"June 8, 2026",2026-06-08
20070620230159,2007-06-20
2007-02-09T15:24:10,2007-02-09
Ngày 6-11-2019,2019-11-06
2022.12.21,2022-12-21
1722099600000000000,2024-07-28
2022-07-25T04:37:55,2022-07-25
19 tháng 6 năm 1997,1997-06-19
1277485200,2010-06-26
Sự kiện diễn ra vào 30/11/1995 20:41,1995-11-30
2011-11-21T16:20:51.895611Z,2011-11-21
1995-11-08T03:33:26.586Z,1995-11-08
27/12-1991,1991-06-27
19 12 31,2031-12-19
2011-01-13T22:17:12.195926891Z,2011-01-13
1489078800000000000,2017-03-10
2004-10-24,2004-10-24
2018-01-09,2018-01-09
"April 22, 2033",2033-04-22
20190917145555166622,2019-09-17
Event at 2006-05-03T1:2:40,2006-05-03
11/12-2025,2025-06-11
15 tháng 9 năm 2017,2017-09-15
Event at 2003-07-25T10:37:45,2003-07-25
1997-04-29T07:35:35,1997-04-29
2016-10-21T05:05:12+2500,2016-10-21
01.19.1995,1995-01-19
2032-12-05T18:15:25+2500,2032-12-05
20240826095743194,2024-08-26
20/01/90,1990-01-20
694458000000000000,1992-01-04
20|2|2021,2021-02-20
23/5/2001 giờ 5:18:52,2001-05-23
1998-03-14T04:42:34,1998-03-14
20-11-2024,2024-11-20
20000610124152607014218,2000-06-10
2015-06-19T01:07:12.350Z,2015-06-19
20170408084505446765,2017-04-08
988477200000000,2001-04-29
14 Dec 2002,2002-12-14
2026-01-30T08:54:19.636Z,2026-01-30
The system recorded 20180227185805,2018-02-27
The system recorded 20100703091059,2010-07-03
1702573200,2023-12-15
2011-10-16T20:07:58,2011-10-16
2009/4/20T202753,2009-04-20
1|3|2003,2003-03-01
Sự kiện diễn ra vào 18/8/2018 3:25,2018-08-18
8 tháng 3 năm 2004,2004-03-08
2019-07-26T11:40:47Z+3,2019-07-26
11 29 2027,2027-11-29
1270486800000000000,2010-04-06
20070511123733971402,2007-05-11
"21th of January, 2030",2030-01-21
2007 07 25,2007-07-25
2031|01|20,2031-01-20
31.07.25,2025-07-31
2028-09-24T20:23:23,2028-09-24
14 tháng 2 năm 2017,2017-02-14
2014-03-07T09:08:58-0300,2014-03-07
800557200000,1995-05-16
1997_05_04T3_56_3-05:00,1997-05-04
The system recorded 20131014115559,2013-10-14
19980227015646,1998-02-27
The system recorded 20251022214528,2025-10-22
"13th of November, 2033",2033-11-13
2064070800,2035-05-30
Ngày 4-2-2013,2013-02-04
2030-10-07T15:10:40Z+3,2030-10-07
1997-01-26T10:33:52+2500,1997-01-26
1995-07-14T22:43:33+3,1995-07-14
2011-04-22T19:42:25Z+3,2011-04-22
1996-05-01T15:06:32.896699Z,1996-05-01
12/20-2009,2009-10-12
2005/8/30T18224,2005-08-30
20080521143720902,2008-05-21
1993-03-04T19:31:49,1993-03-04
2004-08-03T03:40:27Z+3,2004-08-03
03-07-33,2033-07-03
1163610000000000000,2006-11-16
2001-03-08T03:28:29.244651215Z,2001-03-08
"23th of October, 2004",2004-10-23
2-2-2026,2026-02-01
2012-07-31T01:53:17Z+3,2012-07-31
11 November 2018,2018-11-11
20320921062004483532,2032-09-21
58-11-1993,1993-11-29
2018-07-25T04:01:37Z+3,2018-07-25
1992-12-25T20:39:27.736330Z,1992-12-25
17 tháng 11 năm 2032,2032-11-17
2013_11_04,2013-11-04
26.05.13,2013-05-26
1991-01-11T20:09:49.674142Z,1991-01-11
2029-08-16T23:29:36+2500,2029-08-16
20211027215204658,2021-10-27
28/1/2035 giờ 14:2:26,2035-01-28
Sự kiện diễn ra vào 3/5/2028 19:3,2028-05-03
15-8-1992,1992-08-15
19961128051616350536504,1996-11-28
2032-10-30T12:38:26+00:00,2032-10-30
2022-12-08T15:12:58+08,2022-12-08
825440400000000,1996-02-28
Event at 2008-08-14T1:38:30,2008-08-14
ngày 24 tháng 3 năm 2024,2024-03-24
21|8|1995,1995-08-21
18 tháng 6 năm 2004,2004-06-18
26_9_2006,2006-09-26
7-11-2007,2007-11-07
2031-12-17T22:52:26Z+3,2031-12-17
19920331063630322837,1992-03-31
2005-04-19T12:07:36,2005-04-19
2012-05-09T03:41:21-0300,2012-05-09
1.11.2005T0-16-9,2005-11-01
10/2-2002,2002-01-10
2009-03-04T12:39:44.604240961Z,2009-03-04
12 August 2002,2002-08-12
20.6.2006T22-5-15,2006-06-20
1904230800000000000,2030-05-06
8-8-2030,2030-08-08
"17th of June, 2025",2025-06-17
The system recorded 20300505172313,2030-05-05
20180423222831417695966,2018-04-23
1653411600000000000,2022-05-25
20030905190841405,2003-09-05
2006-10-03T19:44:09Z,2006-10-03
2018-06-26T13:24:41.751923Z,2018-06-26
1152550800,2006-07-11
2002-05-09,2002-05-09
23/10/12,2012-10-23
ngày 29 tháng 9 năm 2016,2016-09-29
2032-02-05T07:14:00,2032-02-05
8.8.2023T5-28-24,2023-08-08
2027-08-14T14:49:06,2027-08-14
26 January 2004,2004-01-26
2002/7/8T44554,2002-07-08
1990-03-11T12:42:27.306782440Z,1990-03-11
"November 7, 2032",2032-11-07
1109091600000,2005-02-23
The system recorded 20080907200831,2008-09-07
56-2-2019,2019-02-28
1992/11/1T14534,1992-11-01
20200815171405916899029,2020-08-15
2029-07-08T20:11:55.709Z,2029-07-08
1023123600000000,2002-06-04
873651600000,1997-09-08
04.02.08,2008-02-04
2005-06-08T06:01:53+2500,2005-06-08
28-1-2027,2027-01-14
20150213134941,2015-02-13
2035|03|18,2035-03-18
Sự kiện diễn ra vào 15/5/2009 4:25,2009-05-15
19900815121141,1990-08-15
1845046800,2028-06-20
38-12-2022,2022-12-19
ngày 23 tháng 9 năm 2017,2017-09-23
1513875600000000000,2017-12-22
1563469200000000,2019-07-19
671994000000000000,1991-04-19
ngày 23 tháng 3 năm 2031,2031-03-23
9 tháng 9 năm 2029,2029-09-09
2025-10-22T11:56:56.251948363Z,2025-10-22
The system recorded 20190316095910,2019-03-16
22 7 2021,2021-07-22
2013-06-09T00:05:34.334836Z,2013-06-09
"1st of April, 2011",2011-04-01
2017-11-24T00:14:42,2017-11-24
2030-11-27T07:52:24+2500,2030-11-27
786042000,1994-11-29
24/10/1997 giờ 3:40:5,1997-10-24
1501779600000000,2017-08-04
2021-03-27T12:35:44.342650Z,2021-03-27
1048179600000000000,2003-03-21
2023/12/26T233859,2023-12-26
2022_11_23,2022-11-23
Sự kiện diễn ra vào 12/7/2014 2:19,2014-07-12
ngày 22 tháng 9 năm 2011,2011-09-22
2026-05-13T13:59:04Z,2026-05-13
6-6-2014,2014-06-06
ngày 18 tháng 7 năm 1996,1996-07-18
26 tháng 6 năm 2006,2006-06-26
01.12.2002,2002-01-12
867085200,1997-06-24
The system recorded 20310401021617,2031-04-01
2045754000000000,2034-10-30
ngày 2 tháng 3 năm 2030,2030-03-02
2033-03-03,2033-03-03
"11th of June, 2007",2007-06-11
ngày 30 tháng 1 năm 1990,1990-01-30
05_22_1998,1998-05-22
20280218034619862298969,2028-02-18
1992-08-23T00:47:46.000590976Z,1992-08-23
5/4-2010,2010-02-05
11/12-1994,1994-06-11
07|04|09,2009-04-07
14-7-2023,2023-07-07
2031-07-23T01:09:23,2031-07-23
2035-02-23T06:43:10.652093Z,2035-02-23
20.07.20,2020-07-20
2031-07-31T13:45:52+2500,2031-07-31
28 May 2009,2009-05-28
8 September 2026,2026-09-08
1449853200,2015-12-12
24 March 2005,2005-03-24
4/20-2026,2026-10-04
Event at 2012-03-19T22:29:7,2012-03-19
20140818091139161025321,2014-08-18
40-1-2011,2011-01-20
2008-07-31T16:26:09,2008-07-31
1993-01-16T21:46:17+3,1993-01-16
1387904400000000000,2013-12-25
Ngày 15-5-2025,2025-05-15
2006/8/5T35159,2006-08-05
1992-12-05T21:28:18+2500,1992-12-05
889808400000000,1998-03-14
1650906000000000000,2022-04-26
"15th of November, 1990",1990-11-15
1785171600000,2026-07-28
30 tháng 4 năm 2001,2001-04-30
1990-10-31T09:00:51+2500,1990-10-31
8 October 2002,2002-10-08
1994-08-29T05:20:02.528990778Z,1994-08-29
1629651600000000,2021-08-23
24-5-2011,2011-05-24
2/3/2015 giờ 23:50:8,2015-03-02
2026-12-21T01:38:39.915982Z,2026-12-21
17 tháng 8 năm 2025,2025-08-17
1992-09-23T14:19:01.201604469Z,1992-09-23
20200301042754346805,2020-03-01
30 October 2000,2000-10-30
06.11.2009,2009-06-11
"22th of May, 1999",1999-05-22
20081126085123,2008-11-26
2017-05-08T16:15:52+2500,2017-05-08
1999-09-05T21:29:00,1999-09-05
6 August 1993,1993-08-06
2024|01|24,2024-01-24
02.11.2016,2016-02-11
"October 14, 2016",2016-10-14
2026-11-10T07:52:25,2026-11-10
The system recorded 20020422011205,2002-04-22
20111230153019554,2011-12-30
29 tháng 12 năm 1991,1991-12-29
2009-05-02T02:06:55,2009-05-02
7.4.2000T21-5-10,2000-04-07
2026/8/19T215224,2026-08-19
1863968400000000000,2029-01-25
2004-08-24T23:47:37,2004-08-24
2011-04-14T14:25:11+00:00,2011-04-14
6 Jun 2033,2033-06-06
2027|12|27,2027-12-27
60-11-2004,2004-11-30
Event at 2034-02-03T22:40:49,2034-02-03
1584032400000000,2020-03-13
16/10-2000,2000-05-16
Ngày 13-1-1997,1997-01-13
"May 25, 2002",2002-05-25
Ngày 5-2-2000,2000-02-05
11-6-2020,2020-06-11
2001-09-29T03:31:02+2500,2001-09-29
1990-07-14T05:33:25,1990-07-14
19901221152937660707281,1990-12-21
The system recorded 20330315061709,2033-03-15
The system recorded 20111125075544,2011-11-25
Sự kiện diễn ra vào 9/1/1991 1:4,1991-01-09
"January 10, 1993",1993-01-10
1853427600000000000,2028-09-25
22-5-1999,1999-05-22
46-4-2016,2016-04-23
20090802143425013857,2009-08-02
2015-06-21T04:44:17+00:00,2015-06-21
1569776400000,2019-09-30
1325437200000,2012-01-02
18-12-1992,1992-12-09
17/4/1997 giờ 16:33:37,1997-04-17
20|01|28,2028-01-20
Event at 2030-11-26T19:27:37,2030-11-26
19930910131536260,1993-09-10
Sự kiện diễn ra vào 2/7/1999 16:19,1999-07-02
2013-04-24T02:16:14+08,2013-04-24
24/1/2012 giờ 17:57:42,2012-01-24
20010131170036322,2001-01-31
09_18_1993,1993-09-18
2019-08-01T03:43:02.091Z,2019-08-01
30/2-2020,2020-01-30
1546966800000000,2019-01-09
The system recorded 20260419023711,2026-04-19
2011-08-13T17:14:25.910671887Z,2011-08-13
"14th of May, 2027",2027-05-14
2031-12-13T06:52:54.826953894Z,2031-12-13
2000-07-09T15:45:08.970Z,2000-07-09
"March 15, 2019",2019-03-15
ngày 11 tháng 2 năm 2014,2014-02-11
2007-11-23T04:58:56Z+3,2007-11-23
Sự kiện diễn ra vào 10/4/2028 3:38,2028-04-10
1129136400000,2005-10-13
The system recorded 20271213063407,2027-12-13
27-1-2031,2031-01-27
The system recorded 20190104042304,2019-01-04
Event at 1997-02-25T17:38:34,1997-02-25
16.12.2018,2018-12-16
19900618042643328212136,1990-06-18
20280114172145634,2028-01-14
07|14|2005,2005-07-14
2016-07-25T08:08:12,2016-07-25
Sự kiện diễn ra vào 18/1/2008 17:2,2008-01-18
20250206071256,2025-02-06
2006.05.08,2006-05-08
The system recorded 20301205230921,2030-12-05
08_01_28,2028-01-08
06-11-94,1994-11-06
11 13 2021,2021-11-13
2025-02-17T09:29:20.284425980Z,2025-02-17
1611939600000,2021-01-30
10 tháng 7 năm 1997,1997-07-10
1499360400,2017-07-07
1964278800000000000,2032-03-31
20191204102210545295,2019-12-04
2029-10-22T09:34:18Z+3,2029-10-22
The system recorded 20060830141317,2006-08-30
20020519132020222,2002-05-19
2032-03-09T02:12:28,2032-03-09
2024/3/12T05123,2024-03-12
2012-09-26T05:49:05.621168184Z,2012-09-26
Ngày 3-11-2035,2035-11-03
19901216020759735709310,1990-12-16
10 tháng 8 năm 1998,1998-08-10
Ngày 24-10-2014,2014-10-24
14-4-2013,2013-04-14
Sự kiện diễn ra vào 23/5/2022 6:40,2022-05-23
1994-07-11T21:00:31.705Z,1994-07-11
2030/8/7T73322,2030-08-07
20280424045509018,2028-04-24
1990-01-17T17:14:13.292149616Z,1990-01-17
4 June 1992,1992-06-04
30-12-11,2011-12-30
20020122031758212085,2002-01-22
30.1.2025T0-30-16,2025-01-30
5-6-2032,2032-06-05
20 tháng 3 năm 2023,2023-03-20
2024_10_10T9_55_48+2500,2024-10-10
Sự kiện diễn ra vào 30/11/2032 13:44,2032-11-30
20040729101625474501,2004-07-29
Ngày 22-12-2026,2026-12-22
2029-09-08T02:10:34.817Z,2029-09-08
24-4-2012,2012-04-12
2021-04-14T13:51:41.021223Z,2021-04-14
Event at 2023-07-06T10:56:56,2023-07-06
1993/5/18T11534,1993-05-18
2025-05-04T19:08:11,2025-05-04
803149200,1995-06-15
1998-07-07T12:43:54,1998-07-07
54-1-2020,2020-01-27
20230122071441643,2023-01-22
ngày 12 tháng 5 năm 2034,2034-05-12
2027-08-05T12:42:53.283699Z,2027-08-05
Ngày 2-11-1992,1992-11-02
42-5-2017,2017-05-21
653072400000000,1990-09-12
Ngày 25-3-2025,2025-03-25
2027-08-13T17:04:53,2027-08-13
05|19|1998,1998-05-19
1 February 2026,2026-02-01
19960124145814286,1996-01-24
2007-07-04T18:13:17.934Z,2007-07-04
Ngày 19-1-2003,2003-01-19
2033/2/6T203118,2033-02-06
34-5-2024,2024-05-17
20240618112939929179,2024-06-18
27.9.2005T12-58-52,2005-09-27
16 May 1991,1991-05-16
15 Nov 2025,2025-11-15
20250621143830735,2025-06-21
2029/03/17,2029-03-17
1992-10-09T08:57:59Z+3,1992-10-09
Event at 2017-11-15T7:30:57,2017-11-15
2012-09-23T01:02:40-0300,2012-09-23
1930582800000000,2031-03-07
2007_06_12,2007-06-12
20331002100600189242035,2033-10-02
2006-08-15T08:17:11,2006-08-15
36-3-1997,1997-03-18
19 Nov 1990,1990-11-19
06_24_2003,2003-06-24
2030_02_19T13_51_6-0300,2030-02-19
Ngày 11-11-2008,2008-11-11
1996-07-13T17:46:48,1996-07-13
2025-09-17T11:28:20.165Z,2025-09-17
1999-07-15T20:45:36Z,1999-07-15
20320725234850104,2032-07-25
1992.08.17,1992-08-17
6-1-2000,2000-01-06
7_10_2013,2013-10-07
The system recorded 19900428165550,1990-04-28
2031-09-12T00:45:10.785411094Z,2031-09-12
20310121023528763652,2031-01-21
1996_07_11T15_4_48+3,1996-07-11
Event at 2023-05-26T6:22:14,2023-05-26
The system recorded 20121223055949,2012-12-23
30-7-2033,2033-07-15
20080606020514709263,2008-06-06
Event at 2027-07-12T3:36:56,2027-07-12
1428598800000000000,2015-04-10
20171028005130,2017-10-28
"3rd of August, 2032",2032-08-03
2026-12-20T20:42:53+2500,2026-12-20
25.12.2005,2005-12-25
2002-02-02T02:01:12Z+3,2002-02-02
1541782800000000,2018-11-10
20200525122756917633,2020-05-25
27/22-2031,2031-11-27
The system recorded 20240627234903,2024-06-27
20000825231024291211596,2000-08-25
"December 23, 1995",1995-12-23
Ngày 12-4-2024,2024-04-12
"29th of December, 1992",1992-12-29
"6th of November, 2031",2031-11-06
18-12-2013,2013-12-09
ngày 8 tháng 4 năm 2024,2024-04-08
ngày 2 tháng 4 năm 2005,2005-04-02
2016-12-13T22:52:06Z+3,2016-12-13
Event at 2003-01-01T10:32:29,2003-01-01
1991/06/27,1991-06-27
2000_12_06T20_35_23-0330,2000-12-06
Event at 2019-03-07T21:32:17,2019-03-07
48-2-2004,2004-02-24
01.20.2005,2005-01-20
1558630800000,2019-05-24
20110604162620815621,2011-06-04
2023-02-09T16:10:26Z+3,2023-02-09
2023-09-23T21:26:04.898Z,2023-09-23
2019/5/24T134011,2019-05-24
Event at 1996-12-15T19:50:13,1996-12-15
3 Jan 2003,2003-01-03
"2nd of March, 2013",2013-03-02
25 August 2028,2028-08-25
20191030041754,2019-10-30
20140728001946,2014-07-28
2010/1/18T152031,2010-01-18
2022-04-20T03:50:45.266992Z,2022-04-20
28-07-28,2028-07-28
20331006080923172,2033-10-06
19931221185458869,1993-12-21
"January 23, 1997",1997-01-23
2025/10/21,2025-10-21
Sự kiện diễn ra vào 10/3/2022 4:49,2022-03-10
ngày 29 tháng 6 năm 2018,2018-06-29
19 tháng 11 năm 2021,2021-11-19
The system recorded 20330922013823,2033-09-22
2030/6/22T194627,2030-06-22
Sự kiện diễn ra vào 26/1/1993 11:31,1993-01-26
"22th of August, 1996",1996-08-22
15-1-1998,1998-01-15
2011-03-18T15:23:34.323Z,2011-03-18
19950124082022033,1995-01-24
2025-08-08T05:59:14+2500,2025-08-08
1452790800000000,2016-01-15
2011-03-10T04:40:08+2500,2011-03-10
20250521233001081636,2025-05-21
"October 25, 2030",2030-10-25
ngày 11 tháng 4 năm 2008,2008-04-11
1229360400000000,2008-12-16
2028-09-13T11:43:59.183065297Z,2028-09-13
2-10-2028,2028-10-02
20070829222946,2007-08-29
1997-01-21T22:03:52.850800255Z,1997-01-21
20000629184037,2000-06-29
Event at 2030-07-22T2:49:52,2030-07-22
6-7-2030,2030-07-03
27-10-2022,2022-10-27
2025/2/23T142611,2025-02-23
The system recorded 20061002074320,2006-10-02
2017-10-01T11:35:03Z+3,2017-10-01
20160512143224050462850,2016-05-12
2005-11-21T11:09:19+2500,2005-11-21
20020223064457,2002-02-23
20120706042053,2012-07-06
1990-02-20T14:38:05.773356340Z,1990-02-20
2025-07-21T17:50:49+00:00,2025-07-21
20-4-2019,2019-04-20
The system recorded 20060903233655,2006-09-03
17/2-2027,2027-01-17
2059837200,2035-04-11
20001209163510545,2000-12-09
20.8.2012T18-0-28,2012-08-20
Sự kiện diễn ra vào 10/12/2004 2:43,2004-12-10
ngày 8 tháng 11 năm 1990,1990-11-08
14-9-2018,2018-09-07
2014-05-31T17:10:31Z+3,2014-05-31
Ngày 14-4-2031,2031-04-14
1997|04|01,1997-04-01
19980720012921820038008,1998-07-20
22/10/2005 giờ 0:10:3,2005-10-22
1770224400,2026-02-05
1096131600000,2004-09-26
15_5_2007,2007-05-15
2006-07-31T21:44:05Z+3,2006-07-31
8/10/2016 giờ 1:40:47,2016-10-08
23.3.2011T18-23-19,2011-03-23
2033-02-26T22:35:30,2033-02-26
22/12-2002,2002-06-22
Ngày 11-2-2004,2004-02-11
2015-02-03T23:27:12.604491Z,2015-02-03
2/18-2024,2024-09-02
20211207063420,2021-12-07
2005-10-30T05:16:50.750212757Z,2005-10-30
19900525060600,1990-05-25
2002-02-05T07:29:28,2002-02-05
22 Jun 1993,1993-06-22
1000659600000000000,2001-09-17
20270606112322292459794,2027-06-06
8/4/2020 giờ 4:43:30,2020-04-08
Event at 1997-04-05T16:11:39,1997-04-05
20030718044625541135,2003-07-18
1393520400000000000,2014-02-28
9 Jun 2024,2024-06-09
04-10-1990,1990-04-10
2018.04.18,2018-04-18
1366909200000,2013-04-26
820688400,1996-01-04
04-26-2025,2025-04-26
1999-08-09T06:42:19.456505Z,1999-08-09
"September 14, 2012",2012-09-14
2015-11-16T07:45:29Z+3,2015-11-16
29/6-2023,2023-03-29
2004_06_15T4_10_5+00:00,2004-06-15
17 May 2015,2015-05-17
1995/08/11,1995-08-11
"31th of December, 2002",2002-12-31
20031029160424668,2003-10-29
14 July 2013,2013-07-14
2028-03-07T22:15:25.134191Z,2028-03-07
The system recorded 20260517051648,2026-05-17
2011-10-10T01:59:48,2011-10-10
20310330003157630,2031-03-30
20-7-2020,2020-07-20
25 Mar 1997,1997-03-25
2014-03-13T13:11:05+2500,2014-03-13
7-10-2023,2023-10-07
23_12_93,1993-12-23
1316624400000,2011-09-22
1003942800000000,2001-10-25
29/7/2031 giờ 16:26:20,2031-07-29
12 tháng 3 năm 2021,2021-03-12
19960702033602,1996-07-02
Event at 2031-06-19T8:17:44,2031-06-19
19981029154559,1998-10-29
ngày 5 tháng 7 năm 1997,1997-07-05
23/11/2022,2022-11-23
"27th of May, 1990",1990-05-27
2019-04-21T23:37:24+2500,2019-04-21
Sự kiện diễn ra vào 17/9/2022 13:7,2022-09-17
31.12.2013,2013-12-31
42-11-2008,2008-11-21
1575824400000000,2019-12-09
2015-04-24T18:59:22.693Z,2015-04-24
19920212110907973690,1992-02-12
2021-08-07T19:12:16.276792Z,2021-08-07
2018.07.21,2018-07-21
"28th of May, 2027",2027-05-28
1231952400000,2009-01-15
2020-05-28T22:56:39.720164832Z,2020-05-28
20120202221923996818346,2012-02-02
2019-05-03T07:36:12.772140560Z,2019-05-03
2034-08-26T12:07:05,2034-08-26
Sự kiện diễn ra vào 20/5/2031 16:25,2031-05-20
"March 29, 1992",1992-03-29
2016.02.20,2016-02-20
3 October 2010,2010-10-03
6-2-2013,2013-02-06
17 tháng 2 năm 2022,2022-02-17
"19th of November, 2000",2000-11-19
1/10/1997 giờ 20:42:29,1997-10-01
2024-09-30T08:11:27-0300,2024-09-30
2021-11-29T22:54:07Z,2021-11-29
14.4.2006T16-13-47,2006-04-14
27-11-20,2020-11-27
2023_06_14T5_21_33+00:00,2023-06-14
2016-03-30T03:09:43,2016-03-30
20220302172005243,2022-03-02
2004-11-17T08:43:53+2500,2004-11-17
20001222025045714868816,2000-12-22
20290517024111655591,2029-05-17
The system recorded 20161011173319,2016-10-11
2003/6/19T192950,2003-06-19
The system recorded 20160321070023,2016-03-21
The system recorded 20130820014154,2013-08-20
Sự kiện diễn ra vào 23/1/2017 3:9,2017-01-23
12|2|2033,2033-02-12
20191229094559996,2019-12-29
1992-12-27T21:55:34,1992-12-27
2016_05_27,2016-05-27
1991-01-07T16:58:36.515327Z,1991-01-07
10/6/2007,2007-06-10
Ngày 16-8-2003,2003-08-16
21 February 2017,2017-02-21
2023/07/22,2023-07-22
1992-02-08T16:13:11,1992-02-08
Event at 2014-06-15T19:30:28,2014-06-15
05 19 2005,2005-05-19
20131219094222021,2013-12-19
7-12-2000,2000-12-07
20310302091429,2031-03-02
6 2 2027,2027-02-06
05/06/11,2011-06-05
2025-02-11T11:23:35.893273Z,2025-02-11
2026-11-27T15:57:58Z+3,2026-11-27
28-6-1998,1998-06-14
1997-06-23T21:40:50+2500,1997-06-23
20240217010220222,2024-02-17
ngày 17 tháng 12 năm 2031,2031-12-17
The system recorded 20100904131022,2010-09-04
2031-01-02T14:19:17.423010240Z,2031-01-02
2013-08-29T04:55:32,2013-08-29
1316019600000,2011-09-15
7/12/2031 giờ 3:12:57,2031-12-07
2024-07-18T23:58:04.797505Z,2024-07-18
25/24-2003,2003-12-25
10.24.2024,2024-10-24
22.6.1992,1992-06-22
2030-02-02T16:07:39.870Z,2030-02-02
645382800000000000,1990-06-15
1415725200000000000,2014-11-12
2015-08-01T03:45:47.149Z,2015-08-01
2034-12-21T02:22:59,2034-12-21
19910610113249924,1991-06-10
1027789200000000,2002-07-28
09|08|98,1998-08-09
The system recorded 20081101051616,2008-11-01
28-4-2033,2033-04-14
Event at 2031-06-04T0:49:3,2031-06-04
Ngày 31-8-1999,1999-08-31
1998/06/05,1998-06-05
2005-05-15T04:38:38+2500,2005-05-15
30 November 2004,2004-11-30
1425402000000000000,2015-03-04
2015/2/17T34539,2015-02-17
20060501155430737143,2006-05-01
28 tháng 7 năm 2021,2021-07-28
2031-07-04T17:27:44+2500,2031-07-04
2028 04 04,2028-04-04
1999-06-09T04:09:56+3,1999-06-09
The system recorded 20200306165910,2020-03-06
2031-06-14T01:16:32+2500,2031-06-14
2031/11/25T82417,2031-11-25
Event at 2019-06-13T16:43:55,2019-06-13
ngày 24 tháng 3 năm 1993,1993-03-24
2032-09-28T23:58:29+2500,2032-09-28
"December 21, 2034",2034-12-21
02.28.1994,1994-02-28
1/9/1997 giờ 9:55:24,1997-09-01
1997-06-14T00:47:17.739578898Z,1997-06-14
25.1.2014T1-52-32,2014-01-25
21/14-1992,1992-07-21
Ngày 14-12-1997,1997-12-14
19951127051341491234,1995-11-27
6-7-1999,1999-07-06
15/1/2032 giờ 7:57:4,2032-01-15
2077549200,2035-11-02
2001-07-02T03:46:57.169Z,2001-07-02
1991-09-02T01:31:56.589076Z,1991-09-02
25 Oct 2028,2028-10-25
1623690000000,2021-06-15
974394000,2000-11-17
"13th of March, 2022",2022-03-13
1918659600000000,2030-10-20
2022-01-25T09:13:58.143383211Z,2022-01-25
20.7.1990T20-46-16,1990-07-20
17 Oct 2032,2032-10-17
2033-03-20T14:31:03.199Z,2033-03-20
1993-06-01T03:07:51,1993-06-01
2012_05_25,2012-05-25
Sự kiện diễn ra vào 31/8/2004 18:8,2004-08-31
"19th of February, 2006",2006-02-19
2034_08_12T23_9_18-05:00,2034-08-12
20181002005814,2018-10-02
ngày 14 tháng 11 năm 1990,1990-11-14
1990-06-18T04:15:14.796175Z,1990-06-18
8-4-2006,2006-04-04
2000-06-29T15:17:33+2500,2000-06-29
2030-07-12T06:08:59Z+3,2030-07-12
14 Oct 2023,2023-10-14
21-02-04,2004-02-21
28-3-1998,1998-03-28
24 Nov 2035,2035-11-24
1999/2/25T12825,1999-02-25
20090628183310551,2009-06-28
Sự kiện diễn ra vào 10/8/2032 18:38,2032-08-10
2001/01/02,2001-01-02
4 tháng 10 năm 1997,1997-10-04
1-1-2015,2015-01-01
Sự kiện diễn ra vào 6/2/2016 7:29,2016-02-06
Ngày 19-7-2024,2024-07-19
28 Oct 2022,2022-10-28
The system recorded 20220213210831,2022-02-13
The system recorded 20321016064037,2032-10-16
28/09/16,2016-09-28
2014-02-24T06:01:47+3,2014-02-24
1892048400000,2029-12-16
2023|05|04,2023-05-04
1443459600000000,2015-09-29
Sự kiện diễn ra vào 23/5/2028 3:0,2028-05-23
2007/03/02,2007-03-02
1942160400000000,2031-07-19
27.02.94,1994-02-27
29/11/1996 giờ 0:26:49,1996-11-29
1997-11-18,1997-11-18
2034-04-04T17:31:48.157294Z,2034-04-04
20350319223618785640,2035-03-19
20260218044047,2026-02-18
19951012132328,1995-10-12
28 Nov 2016,2016-11-28
1016384400000000000,2002-03-18
18 Nov 1993,1993-11-18
ngày 9 tháng 12 năm 2021,2021-12-09
The system recorded 20340316031150,2034-03-16
19900519194913907,1990-05-19
8/1/2020 giờ 19:27:12,2020-01-08
14/10-1993,1993-05-14
"December 13, 2017",2017-12-13
14 Jan 2022,2022-01-14
2003-04-01T21:26:07+07:00,2003-04-01
1231088400000000000,2009-01-05
2006/09/19,2006-09-19
2008_03_13T18_14_55+2500,2008-03-13
19991110113137,1999-11-10
2015-12-28T19:07:05,2015-12-28
ngày 17 tháng 9 năm 2031,2031-09-17
23.03.99,1999-03-23
11-5-2028,2028-05-11
18-4-1992,1992-04-09
1433869200,2015-06-10
2026-02-20T04:39:57Z+3,2026-02-20
ngày 17 tháng 10 năm 2026,2026-10-17
15/3/1992,1992-03-15
2018_09_09T5_55_24-05:00,2018-09-09
16 tháng 10 năm 2011,2011-10-16
9|11|2019,2019-11-09
28-10-2006,2006-10-28
24 December 2019,2019-12-24
1992-08-13T09:11:09Z+3,1992-08-13
"May 26, 2015",2015-05-26
2018 01 15,2018-01-15
8.8.2009T8-7-30,2009-08-08
2002-12-17T12:24:50.269966629Z,2002-12-17
1752598800000,2025-07-16
20310518135957442897008,2031-05-18
20061203130844964096,2006-12-03
1584032400000,2020-03-13
06 16 2007,2007-06-16
2015-01-05T21:47:35Z+3,2015-01-05
26 tháng 11 năm 2006,2006-11-26
1707757200,2024-02-13
19960720221732696101,1996-07-20
18/9/2009 giờ 9:23:12,2009-09-18
"August 17, 2020",2020-08-17
Sự kiện diễn ra vào 9/1/2022 16:55,2022-01-09
14 tháng 9 năm 2011,2011-09-14
1999-08-25T02:21:39.754Z,1999-08-25
12-4-1997,1997-04-12
662058000000,1990-12-25
1/7/2028 giờ 12:45:24,2028-07-01
3.3.2018T15-19-22,2018-03-03
1150995600000000000,2006-06-23
19/24-2022,2022-12-19
7.11.2034T15-39-6,2034-11-07
794336400,1995-03-05
2000/11/23T33957,2000-11-23
1365094800000000,2013-04-05
30 April 2000,2000-04-30
13 Dec 1993,1993-12-13
2019-10-18T05:47:24.861Z,2019-10-18
"October 19, 1993",1993-10-19
31 3 1996,1996-03-31
2016-04-17T08:32:16Z+3,2016-04-17
2027-12-09T21:13:30,2027-12-09
18/8/2006 giờ 11:2:55,2006-08-18
7.6.1996T0-32-10,1996-06-07
Event at 2023-02-12T2:0:55,2023-02-12
20210115190000,2021-01-15
The system recorded 20181003165329,2018-10-03
The system recorded 20020919110304,2002-09-19
2023-02-12T22:36:41.593553872Z,2023-02-12
799606800000,1995-05-05
06_06_1993,1993-06-06
20190405103657002,2019-04-05
26 May 2034,2034-05-26
2004-01-22,2004-01-22
24-3-2027,2027-03-24
"May 9, 2004",2004-05-09
22-12-2002,2002-12-22
9-11-2032,2032-11-09
ngày 17 tháng 12 năm 2004,2004-12-17
1992-10-07T23:51:54+00:00,1992-10-07
2017-04-05T22:07:35.489Z,2017-04-05
19980715035013624,1998-07-15
2019-05-12T10:04:09.718716564Z,2019-05-12
20170218034427,2017-02-18
2001-05-19T07:47:32+2500,2001-05-19
800557200000000000,1995-05-16
"13th of October, 2019",2019-10-13
2 September 1995,1995-09-02
03/15/2021,2021-03-15
2008-03-06T06:33:34,2008-03-06
760726800,1994-02-09
23/3/2010 giờ 21:10:19,2010-03-23
15 tháng 1 năm 2004,2004-01-15
The system recorded 20310117061930,2031-01-17
The system recorded 19900805101239,1990-08-05
The system recorded 20080414031804,2008-04-14
28|05|32,2032-05-28
11 25 1997,1997-11-25
19980304155632911418,1998-03-04
1430672400,2015-05-04
"March 31, 2023",2023-03-31
10.9.2017T16-19-42,2017-09-10
2002-08-27T05:08:03Z+3,2002-08-27
"26th of June, 2032",2032-06-26
17 07 17,2017-07-17
30 Mar 2016,2016-03-30
6-9-2019,2019-09-06
19900512222932579175776,1990-05-12
28/7/2009 giờ 15:29:21,2009-07-28
963594000000000,2000-07-15
2031_09_28T0_13_18+0500,2031-09-28
2024-10-26T14:19:51.308201567Z,2024-10-26
2016_10_12T11_53_53Z+3,2016-10-12
29-11-2009,2009-11-29
11/24-1991,1991-12-11
1 tháng 6 năm 2012,2012-06-01
2017242000000,2033-12-04
20250129023952125,2025-01-29
Event at 2024-11-24T21:2:56,2024-11-24
2011-01-31T10:35:44.936239894Z,2011-01-31
15/7/1999 giờ 8:14:17,1999-07-15
20070402172755,2007-04-02
16 Feb 2011,2011-02-16
1171558800,2007-02-16
2012_12_09T11_20_8Z,2012-12-09
26/20-2013,2013-10-26
2004-09-16T14:37:11.303Z,2004-09-16
20060214122954209267,2006-02-14
2024-02-23T12:16:09,2024-02-23
2 March 2018,2018-03-02
Event at 2015-09-03T0:30:24,2015-09-03
27.12.2022T19-55-0,2022-12-27
1363194000,2013-03-14
2031/10/24T19440,2031-10-24
2 Apr 1990,1990-04-02
14/12-2009,2009-06-14
2007-07-22T01:11:38Z+3,2007-07-22
20160102204211643866741,2016-01-02
20090228161034711541234,2009-02-28
1-10-2030,2030-10-01
2020-03-16,2020-03-16
The system recorded 20010425010941,2001-04-25
20150930182318,2015-09-30
19.11.2004T21-19-33,2004-11-19
Sự kiện diễn ra vào 10/4/2012 20:40,2012-04-10
"27th of May, 2027",2027-05-27
20060424192302,2006-04-24
1993-04-15T21:23:50Z+3,1993-04-15
2014-07-06T00:06:00+2500,2014-07-06
06/04/98,1998-04-06
1789837200000000,2026-09-20
Event at 2028-12-31T22:37:57,2028-12-31
2021-05-05T13:21:35.492Z,2021-05-05
2011_09_07T8_12_57Z,2011-09-07
1992_04_26T16_28_33+2500,1992-04-26
825094800000000,1996-02-24
25 tháng 1 năm 2024,2024-01-25
742150800000000000,1993-07-09
ngày 20 tháng 4 năm 1993,1993-04-20
20000603163918,2000-06-03
2003-02-06T20:27:45.592813673Z,2003-02-06
29-5-2015,2015-05-29
1974733200,2032-07-30
Ngày 19-1-2011,2011-01-19
20340705053116,2034-07-05
31 tháng 8 năm 2031,2031-08-31
Event at 2031-01-13T1:18:15,2031-01-13
1952096400000000000,2031-11-11
3.9.2027T9-3-59,2027-09-03
28 tháng 9 năm 2020,2020-09-28
Ngày 22-2-1998,1998-02-22
2000-03-05T08:03:47.787Z,2000-03-05
12-2-2034,2034-02-06
24 tháng 4 năm 2035,2035-04-24
"24th of July, 2025",2025-07-24
2029-06-17T05:25:53.990336347Z,2029-06-17
3|3|1991,1991-03-03
20.7.2002T6-28-8,2002-07-20
1993/7/20T33940,1993-07-20
2041088400000000000,2034-09-06
3/10/2020 giờ 10:0:11,2020-10-03
2014/9/7T132446,2014-09-07
1823619600000000,2027-10-16
1994-08-01T20:28:54.860806Z,1994-08-01
"8th of October, 2030",2030-10-08
2000/10/08,2000-10-08
30.12.2001T13-0-7,2001-12-30
1404925200000,2014-07-10
2005-12-11T00:37:31.881201Z,2005-12-11
2017/7/23T231939,2017-07-23
"6th of May, 1991",1991-05-06
The system recorded 20130924034317,2013-09-24
853261200000,1997-01-15
1846688400000,2028-07-09
31 Dec 1994,1994-12-31
2000-02-16T21:17:15Z+3,2000-02-16
2002-11-12T03:40:34.563312Z,2002-11-12
15.11.2016T14-16-9,2016-11-15
2004-06-25T23:11:31.441Z,2004-06-25
1996-10-06T11:21:36.900Z,1996-10-06
11 July 2029,2029-07-11
25/3/2009 giờ 23:58:36,2009-03-25
2019-12-04T03:09:31.121934273Z,2019-12-04
766083600000000000,1994-04-12
60-6-2018,2018-06-30
"December 5, 2025",2025-12-05
2001-05-21T06:48:04,2001-05-21
13.5.2025T1-23-56,2025-05-13
1996/7/10T2097,1996-07-10
2004-04-18T11:41:18.493Z,2004-04-18
1990-01-30T11:33:51-0300,1990-01-30
3/2/1997 giờ 11:24:2,1997-02-03
21.11.2008T18-9-33,2008-11-21
31 tháng 1 năm 2007,2007-01-31
ngày 17 tháng 5 năm 2002,2002-05-17
17/4/1999 giờ 14:25:0,1999-04-17
28-8-2003,2003-08-28
ngày 4 tháng 5 năm 2003,2003-05-04
2020-02-04T07:15:06.162Z,2020-02-04
20110929123223792,2011-09-29
22 Feb 2023,2023-02-22
19910329080121097888681,1991-03-29
20290121023809760392797,2029-01-21
2002 03 28,2002-03-28
24 October 2017,2017-10-24
16|11|98,1998-11-16
24 Apr 2030,2030-04-24
15 October 2012,2012-10-15
Sự kiện diễn ra vào 27/3/1999 10:45,1999-03-27
2024-02-25T07:51:54Z+3,2024-02-25
23-2-1992,1992-02-23
1427043600000000,2015-03-23
909766800000000,1998-10-31
1-4-2013,2013-04-01
7-5-2032,2032-05-07
"20th of May, 1997",1997-05-20
2026-12-27T17:15:56,2026-12-27
16/6/2019 giờ 4:2:11,2019-06-16
1998-08-09T05:03:46,1998-08-09
Event at 2012-05-10T8:12:26,2012-05-10
16/8/2019 giờ 3:36:57,2019-08-16
6/16-2014,2014-08-06
19-11-2020,2020-11-19
1.3.2003T17-23-37,2003-03-01
20180216040457,2018-02-16
8 Nov 2007,2007-11-08
24-12-2016,2016-12-12
1027962000000000000,2002-07-30
"7th of August, 1998",1998-08-07
20030818092047,2003-08-18
1693501200000000,2023-09-01
1092762000000000,2004-08-18
07|03|07,2007-03-07
1994-03-02T15:36:12.392Z,1994-03-02
"May 3, 2018",2018-05-03
20070824223007,2007-08-24
ngày 18 tháng 8 năm 2010,2010-08-18
"31th of October, 2033",2033-10-31
2014-10-28T03:33:26.339Z,2014-10-28
Ngày 14-9-2011,2011-09-14
2013-10-09T02:58:37,2013-10-09
Ngày 24-7-2012,2012-07-24
01/03/00,2000-03-01
1358010000,2013-01-13
The system recorded 20000731221846,2000-07-31
Sự kiện diễn ra vào 4/6/1991 17:58,1991-06-04
20320925095532483,2032-09-25
28/4/2019,2019-04-28
7.12.1993T20-14-57,1993-12-07
2023-07-23T05:49:52-05:00,2023-07-23
746643600000,1993-08-30
2009-10-29T02:21:34Z,2009-10-29
1813165200000000,2027-06-17
2005_11_23T19_2_49+0500,2005-11-23
2032/9/15T125958,2032-09-15
"31th of October, 2030",2030-10-31
25|05|20,2020-05-25
951584400,2000-02-27
2027-02-13T11:31:54Z+3,2027-02-13
17/6-2022,2022-03-17
1468515600000000,2016-07-15
1520096400000000,2018-03-04
21-10-2032,2032-10-21
2024-05-28T19:19:03,2024-05-28
8/11/2001 giờ 22:46:18,2001-11-08
1331053200,2012-03-07
20050920213709419079325,2005-09-20
03.06.93,1993-06-03
20230325191817589375,2023-03-25
13|01|25,2025-01-13
2007_01_04T13_41_1-0330,2007-01-04
747766800,1993-09-12
23_10_06,2006-10-23
16 November 2027,2027-11-16
2009206800000000000,2033-09-02
3/6/2031 giờ 18:17:36,2031-06-03
26.10.2015T15-38-55,2015-10-26
20250918222017898,2025-09-18
20271216174328250,2027-12-16
1241974800000000,2009-05-11
20210916104136693,2021-09-16
2019/6/5T45842,2019-06-05
20180905144545787263,2018-09-05
ngày 19 tháng 9 năm 2001,2001-09-19
The system recorded 19991118160943,1999-11-18
The system recorded 19971121131715,1997-11-21
04_03_2000,2000-04-03
Event at 2025-04-24T18:47:52,2025-04-24
2034_10_26T18_41_53-0330,2034-10-26
1997-06-23T10:39:10Z+3,1997-06-23
1930323600000000,2031-03-04
1 Apr 2035,2035-04-01
1249405200000000000,2009-08-05
2021-06-18T07:21:09.402Z,2021-06-18
10/1/2027 giờ 2:56:58,2027-01-10
Ngày 10-9-2018,2018-09-10
14 November 2025,2025-11-14
11 January 2020,2020-01-11
13-3-1990,1990-03-13
Ngày 13-8-2021,2021-08-13
1924362000000000000,2030-12-25
"September 10, 2031",2031-09-10
20031115211147,2003-11-15
ngày 3 tháng 8 năm 2016,2016-08-03
1991-03-09T18:11:28,1991-03-09
1488474000000,2017-03-03
Sự kiện diễn ra vào 27/7/2010 12:22,2010-07-27
"January 16, 1994",1994-01-16
1659805200000,2022-08-07
01.01.2003,2003-01-01
3 Oct 2005,2005-10-03
11 December 2034,2034-12-11
Ngày 5-2-2000,2000-02-05
20291025230113762481,2029-10-25
1512579600000000,2017-12-07
2021-05-07T12:05:29.299514102Z,2021-05-07
1995-05-23T15:15:43+2500,1995-05-23
32-12-2030,2030-12-16
"October 29, 2035",2035-10-29
2012-01-03T02:39:56.130Z,2012-01-03
20000401171445446351,2000-04-01
29|5|1991,1991-05-29
Event at 2028-03-22T16:14:15,2028-03-22
16.3.1998T2-10-2,1998-03-16
2005-12-22T03:20:35.109532Z,2005-12-22
9.1.1996T5-13-31,1996-01-09
38-3-2023,2023-03-19
11 tháng 5 năm 2005,2005-05-11
04 24 2006,2006-04-24
704134800000000,1992-04-25
2-1-2035,2035-01-01
19/9/2029 giờ 11:37:36,2029-09-19
7 August 2014,2014-08-07
1999-03-18T04:57:49Z+3,1999-03-18
ngày 27 tháng 6 năm 2011,2011-06-27
20 tháng 7 năm 2018,2018-07-20
Event at 1997-03-05T6:35:6,1997-03-05
17-5-2032,2032-05-17
16 Apr 2010,2010-04-16
29.6.2008T4-40-20,2008-06-29
20000803162635492532,2000-08-03
16 June 2026,2026-06-16
22.6.1991T3-23-23,1991-06-22
20011110095904730,2001-11-10
878662800000000000,1997-11-05
997549200000000000,2001-08-12
20351109030707554,2035-11-09
20070223074357217739,2007-02-23
4.8.2017,2017-08-04
13-10-2009,2009-10-13
1993/10/1T6510,1993-10-01
20130629014426,2013-06-29
1998-01-08T14:34:36.619Z,1998-01-08
Event at 2022-05-23T21:25:15,2022-05-23
2007-03-24T20:30:47,2007-03-24
08/09/2009,2009-08-09
9/4/1990,1990-04-09
911494800000,1998-11-20
The system recorded 19960730124038,1996-07-30
"5th of October, 2030",2030-10-05
2002-06-18T04:24:18,2002-06-18
5/9/2009 giờ 18:29:37,2009-09-05
1412874000000000,2014-10-10
7 December 2011,2011-12-07
9.8.2018T19-53-11,2018-08-09
20 tháng 2 năm 2023,2023-02-20
30 Jun 2023,2023-06-30
30 tháng 4 năm 2003,2003-04-30
2029-05-09T13:28:16.875Z,2029-05-09
Sự kiện diễn ra vào 10/1/2009 12:56,2009-01-10
1993-10-20T21:52:49.919516Z,1993-10-20
2000-05-21T18:07:27+2500,2000-05-21
20060916201459,2006-09-16
Sự kiện diễn ra vào 27/5/2012 3:12,2012-05-27
2006-10-07T14:14:58.914374383Z,2006-10-07
12/8-2030,2030-04-12
2006-06-20T17:11:24.014923Z,2006-06-20
17 tháng 9 năm 2004,2004-09-17
2020-11-12T08:52:59,2020-11-12
19910610140323644313932,1991-06-10
10 September 2021,2021-09-10
Ngày 9-5-2014,2014-05-09
2023-03-17T04:27:36,2023-03-17
2000_01_18T22_16_0+0500,2000-01-18
1993-05-15T22:48:49+08,1993-05-15
2001/08/13,2001-08-13
1502902800000000,2017-08-17
20221127112552530285891,2022-11-27
1504026000000,2017-08-30
2002-06-21T09:49:25-0330,2002-06-21
2002/1/12T15212,2002-01-12
1231174800000000,2009-01-06
29 December 2010,2010-12-29
2000-03-05T19:57:16,2000-03-05
20330730010750382281822,2033-07-30
19930304025020265448,1993-03-04
6/10-2014,2014-05-06
27|05|12,2012-05-27
"6th of August, 2004",2004-08-06
1547053200000,2019-01-10
1994-01-22T01:40:04,1994-01-22
2065885200,2035-06-20
2034-12-05T08:22:22.551Z,2034-12-05
2029.07.19,2029-07-19
2026-03-18T07:40:55.898Z,2026-03-18
ngày 16 tháng 5 năm 2017,2017-05-16
729018000000,1993-02-07
1993-12-09T02:00:32.003Z,1993-12-09
20280125023924582338,2028-01-25
"May 1, 1998",1998-05-01
1426525200000000,2015-03-17
29/14-2028,2028-07-29
2021-07-16T11:47:45Z+3,2021-07-16
2 February 2035,2035-02-02
2007-07-01T04:37:05,2007-07-01
13 Jan 1991,1991-01-13
2032-11-05T06:23:21.324Z,2032-11-05
25-3-1998,1998-03-25
8.10.2023T18-0-17,2023-10-08
"21th of January, 1997",1997-01-21
1202490000,2008-02-09
1990-04-09T15:00:39.484Z,1990-04-09
1014051600,2002-02-19
5/11/2035 giờ 21:39:55,2035-11-05
675622800,1991-05-31
21.4.2031T22-14-6,2031-04-21
Event at 1990-09-10T15:37:12,1990-09-10
1956589200000000000,2032-01-02
1997-08-15T08:42:55.666038Z,1997-08-15
2012-04-24T11:07:40+2500,2012-04-24
2006-01-17T10:05:15+2500,2006-01-17
6/8/1993 giờ 22:52:29,1993-08-06
Ngày 22-10-2029,2029-10-22
Event at 1995-12-13T11:3:21,1995-12-13
1-2-2012,2012-02-01
16/16-2032,2032-08-16
2024 07 14,2024-07-14
"15th of May, 2023",2023-05-15
30 Sep 2021,2021-09-30
20200605143515916,2020-06-05
2025/2/12T34251,2025-02-12
1933261200000000,2031-04-07
2011-05-01T12:44:42,2011-05-01
5/22-2022,2022-11-05
2 tháng 3 năm 2020,2020-03-02
Ngày 17-5-1998,1998-05-17
24.05.96,1996-05-24
2033-06-06T18:39:21.931Z,2033-06-06
1269450000000,2010-03-25
28-04-15,2015-04-28
12/7/1991 giờ 21:7:43,1991-07-12
Event at 2006-06-29T7:40:49,2006-06-29
21-9-2002,2002-09-21
46-1-1992,1992-01-23
903286800000000,1998-08-17
706899600000000000,1992-05-27
20201227231309,2020-12-27
7.1.2035T11-57-42,2035-01-07
2003-11-07T15:40:43.961015Z,2003-11-07
20331106223001176947,2033-11-06
ngày 14 tháng 5 năm 2000,2000-05-14
Ngày 4-4-2009,2009-04-04
1248454800000,2009-07-25
29 tháng 10 năm 2004,2004-10-29
"5th of September, 2030",2030-09-05
2005-04-14T14:10:50Z,2005-04-14
04 15 2012,2012-04-15
20030430131719150704,2003-04-30
25/2/2015 giờ 13:46:42,2015-02-25
2028-07-08T23:01:51,2028-07-08
24.4.1992T5-45-48,1992-04-24
04|10|90,1990-10-04
Event at 2002-10-15T12:6:6,2002-10-15
2002208400,2033-06-13
6-3-2015,2015-03-06
20/1/2013 giờ 15:40:5,2013-01-20
715280400,1992-09-01
1996-10-29T11:57:31+2500,1996-10-29
2018106000000000000,2033-12-14
07-09-2001,2001-07-09
2-12-2010,2010-12-02
20171119163523649152672,2017-11-19
24-3-2034,2034-03-12
2016-04-26T07:26:08,2016-04-26
20000225011439234695832,2000-02-25
08|09|02,2002-09-08
2018/10/27T05459,2018-10-27
18 Aug 2012,2012-08-18
26/12/24,2024-12-26
6-11-2014,2014-11-03
2032-01-13T11:57:53+2500,2032-01-13
1999-04-23T15:55:36.624211259Z,1999-04-23
20200304020224767837,2020-03-04
702320400,1992-04-04
17/18-2000,2000-09-17
20140513094251071419965,2014-05-13
2034-02-19T15:49:25.650Z,2034-02-19
54-8-2035,2035-08-27
10.11.1996,1996-10-11
1997-03-28T23:55:53+2500,1997-03-28
Sự kiện diễn ra vào 24/2/2022 5:10,2022-02-24
7/10/2032 giờ 21:58:29,2032-10-07
5/5/2015,2015-05-05
03|10|2027,2027-03-10
2003/2/20T151918,2003-02-20
2020-06-09T13:25:32,2020-06-09
2008-07-27T03:04:56Z+3,2008-07-27
09.09.2008,2008-09-09
"October 19, 2035",2035-10-19
22 Jun 1994,1994-06-22
20/24-2020,2020-12-20
20070626094013,2007-06-26
"17th of May, 1990",1990-05-17
11 Feb 2035,2035-02-11
2007-08-31T19:00:52+3,2007-08-31
2030_08_25,2030-08-25
1592672400000,2020-06-21
20280518050143,2028-05-18
12 December 2031,2031-12-12
2018-03-25T06:11:06+2500,2018-03-25
7/3/2010 giờ 2:51:13,2010-03-07
"February 14, 1996",1996-02-14
2024|08|06,2024-08-06
20091027035557963,2009-10-27
865962000000000,1997-06-11
1879174800000,2029-07-20
1997-07-26T15:24:06.392Z,1997-07-26
Ngày 7-4-2027,2027-04-07
20140417033141,2014-04-17
1411923600000000,2014-09-29
24/1/2033 giờ 18:17:17,2033-01-24
20070821142312211929633,2007-08-21
2018-08-26T03:41:41+2500,2018-08-26
764787600000000000,1994-03-28
The system recorded 20160207034833,2016-02-07
1898701200,2030-03-03
7 March 2033,2033-03-07
2004-12-16T19:20:58,2004-12-16
1993-10-21T05:27:17.672Z,1993-10-21
728931600,1993-02-06
"July 29, 2030",2030-07-29
2022-12-13T01:26:29.297147581Z,2022-12-13
The system recorded 20320912123654,2032-09-12
14/8-2021,2021-04-14
19/5/1997 giờ 7:15:20,1997-05-19
1897578000,2030-02-18
Event at 2010-09-12T7:5:53,2010-09-12
8 Jan 2027,2027-01-08
17.3.2022T20-13-28,2022-03-17
1241024400000000,2009-04-30
ngày 22 tháng 9 năm 2017,2017-09-22
Event at 2025-07-16T17:52:40,2025-07-16
2025/2/3T23630,2025-02-03
2009-10-27T22:33:55.051751294Z,2009-10-27
Ngày 10-7-2020,2020-07-10
2015-09-03T07:03:05.134Z,2015-09-03
1485018000,2017-01-22
2006/2/23T83458,2006-02-23
1/20-1998,1998-10-01
"October 19, 2001",2001-10-19
2031/9/26T135220,2031-09-26
2032-10-05T22:36:57.572738Z,2032-10-05
22 tháng 2 năm 1998,1998-02-22
11/2-2015,2015-01-11
2005-08-16T10:43:08Z+3,2005-08-16
Ngày 28-2-1998,1998-02-28
23/20-2013,2013-10-23
23/11/1991 giờ 11:52:52,1991-11-23
25/2-1999,1999-01-25
2022-03-06T11:08:00.653Z,2022-03-06
20140924054055,2014-09-24
ngày 13 tháng 7 năm 2020,2020-07-13
1993-07-01T01:10:37Z+3,1993-07-01
"September 8, 1995",1995-09-08
1997-06-07T11:26:38.166631939Z,1997-06-07
2006-01-16T13:16:58+3,2006-01-16
26/12/2018 giờ 12:39:21,2018-12-26
2018-04-05T05:10:13.731278145Z,2018-04-05
15 December 2031,2031-12-15
1999-01-27T09:16:32,1999-01-27
38-7-2005,2005-07-19
10.12.14,2014-12-10
Ngày 4-3-1990,1990-03-04
13 3 2002,2002-03-13
1820941200000000,2027-09-15
1763658000000000000,2025-11-21
8.2.2005T3-15-57,2005-02-08
2012_05_12T9_35_32+07:00,2012-05-12
24 tháng 4 năm 2022,2022-04-24
2004/3/24T103131,2004-03-24
11 January 1990,1990-01-11
20350223150604304322021,2035-02-23
Sự kiện diễn ra vào 17/2/2010 17:39,2010-02-17
The system recorded 20290518091600,2029-05-18
20.04.32,2032-04-20
23 August 2005,2005-08-23
2023-01-17T22:30:35-05:00,2023-01-17
13/6-2005,2005-03-13
20110211072031074509366,2011-02-11
29/4/2009 giờ 23:27:13,2009-04-29
20280701145057,2028-07-01
20150428211827,2015-04-28
20100421134024033689620,2010-04-21
ngày 15 tháng 4 năm 2011,2011-04-15
1992/04/20,1992-04-20
20030428211616,2003-04-28
19|12|2009,2009-12-19
Event at 1991-01-23T6:25:50,1991-01-23
The system recorded 20050120230823,2005-01-20
2012 12 30,2012-12-30
2002-07-24T01:12:30.371Z,2002-07-24
948128400000000000,2000-01-18
Ngày 27-10-1991,1991-10-27
09_02_2002,2002-09-02
08 20 1999,1999-08-20
1998-06-06T00:21:51+07:00,1998-06-06
17 Sep 2023,2023-09-17
1691341200000,2023-08-07
20050408210438054,2005-04-08
1980954000,2032-10-10
2001-11-03T15:35:26.861709140Z,2001-11-03
2/12/2004 giờ 2:58:39,2004-12-02
1995-07-17T12:52:33.994400Z,1995-07-17
11 March 2030,2030-03-11
2001-02-20T06:01:27,2001-02-20
20240701091122721048462,2024-07-01
20271221161600665465345,2027-12-21
19900207135628962899,1990-02-07
07/13/2016,2016-07-13
1848157200,2028-07-26
1004806800,2001-11-04
20220630235722565,2022-06-30
Event at 1992-04-11T13:7:0,1992-04-11
06|10|2021,2021-06-10
20071120223120350140400,2007-11-20
Sự kiện diễn ra vào 15/11/2005 18:31,2005-11-15
19900503221500196903947,1990-05-03
20.4.2014T11-50-2,2014-04-20
2030-08-18T22:30:44+00:00,2030-08-18
ngày 26 tháng 10 năm 2033,2033-10-26
ngày 17 tháng 2 năm 1991,1991-02-17
2013-10-29,2013-10-29
2000-06-11T13:57:42,2000-06-11
2007-05-12T20:26:21.510199210Z,2007-05-12
2026-10-25T22:43:51+07:00,2026-10-25
"October 31, 1995",1995-10-31
1125162000000,2005-08-28
23 tháng 11 năm 2013,2013-11-23
19.6.2012,2012-06-19
2023-07-06T05:42:31Z+3,2023-07-06
1995-11-29,1995-11-29
811443600000000,1995-09-19
The system recorded 20260304221328,2026-03-04
1990-10-19T20:28:31+07:00,1990-10-19
2031/5/22T75216,2031-05-22
16 October 2010,2010-10-16
26-9-2020,2020-09-26
2004-05-09T08:21:16.660744411Z,2004-05-09
Event at 2028-09-02T15:51:8,2028-09-02
2000_09_23T0_0_1+0500,2000-09-23
06_29_2010,2010-06-29
Ngày 13-8-2030,2030-08-13
2014-10-27,2014-10-27
Event at 2020-05-30T2:39:49,2020-05-30
2 September 2029,2029-09-02
"April 4, 2000",2000-04-04
Sự kiện diễn ra vào 11/5/2012 15:0,2012-05-11
2022-07-05T01:05:15,2022-07-05
1991-12-21T11:09:25.371Z,1991-12-21
1 tháng 7 năm 2026,2026-07-01
19981018182632227,1998-10-18
2020-05-22T20:27:01.744672550Z,2020-05-22
16 October 2033,2033-10-16
19970225063718,1997-02-25
752173200000000,1993-11-02
2010/11/2T75435,2010-11-02
ngày 21 tháng 8 năm 1993,1993-08-21
19900211001647,1990-02-11
644346000000000,1990-06-03
2003-04-10T12:30:44.831850248Z,2003-04-10
19900430090111,1990-04-30
1991/1/8T23359,1991-01-08
20021014043948779337,2002-10-14
10 Jul 2013,2013-07-10
1671296400000000000,2022-12-18
2002-10-28T17:35:29.481929Z,2002-10-28
2022-12-28T21:27:15+3,2022-12-28
52-1-2008,2008-01-26
Sự kiện diễn ra vào 30/6/2006 21:23,2006-06-30
2023-12-23T18:01:39.306621573Z,2023-12-23
20 Jun 2022,2022-06-20
2 August 2027,2027-08-02
1353603600,2012-11-23
19 May 2017,2017-05-19
7/12/2007 giờ 22:13:5,2007-12-07
12/8-2003,2003-04-12
2001_07_26,2001-07-26
1390582800,2014-01-25
15 tháng 7 năm 1998,1998-07-15
2030-11-10T04:48:37+2500,2030-11-10
"March 19, 1990",1990-03-19
20140629100617021,2014-06-29
17.2.2028,2028-02-17
2025/1/2T161939,2025-01-02
2015-11-20T19:05:32,2015-11-20
54-2-2002,2002-02-27
2006-12-30T09:05:42.983Z,2006-12-30
Event at 1999-06-15T5:54:43,1999-06-15
24-10-2029,2029-10-24
4 tháng 4 năm 2027,2027-04-04
2026-11-20T13:05:19+2500,2026-11-20
20230714085046745396,2023-07-14
2014-09-07T07:16:16,2014-09-07
14 February 2000,2000-02-14
2023-12-16T01:27:28,2023-12-16
2004-03-01T07:14:00-0330,2004-03-01
3-5-2013,2013-05-03
08.01.29,2029-01-08
10 Aug 1997,1997-08-10
6_5_2001,2001-05-06
ngày 27 tháng 3 năm 2013,2013-03-27
799261200,1995-05-01
20170116040726938,2017-01-16
723142800000,1992-12-01
1852304400,2028-09-12
9 tháng 5 năm 1994,1994-05-09
2032-06-08T10:16:18.029155Z,2032-06-08
10 April 2018,2018-04-10
20091010095211492409,2009-10-10
739904400,1993-06-13
20261212105939827254819,2026-12-12
2004-12-12T02:37:40Z+3,2004-12-12
1/2/2021 giờ 8:25:48,2021-02-01
Event at 1997-11-13T3:0:42,1997-11-13
The system recorded 20330602005212,2033-06-02
21/4-1994,1994-02-21
19/9/2012 giờ 5:59:23,2012-09-19
2002-06-16T12:15:48Z+3,2002-06-16
07.08.2008,2008-07-08
25|05|01,2001-05-25
2028-04-07T02:23:00Z+3,2028-04-07
1990-08-29T11:26:57.082Z,1990-08-29
10.7.1995T23-16-31,1995-07-10
1999-04-19T17:55:35.107878163Z,1999-04-19
2035-08-11T03:06:42.145291Z,2035-08-11
06/27/2002,2002-06-27
Sự kiện diễn ra vào 27/8/2007 22:12,2007-08-27
2023722000000000000,2034-02-17
19921007001035,1992-10-07
8 Jul 2005,2005-07-08
24/4/2012 giờ 10:17:34,2012-04-24
Sự kiện diễn ra vào 20/7/1997 18:30,1997-07-20
1231952400000,2009-01-15
18-7-2010,2010-07-18
The system recorded 19990308060542,1999-03-08
Event at 2031-04-14T17:30:10,2031-04-14
"September 15, 2031",2031-09-15
1994-01-06T16:35:19.955396799Z,1994-01-06
14/18-2033,2033-09-14
1994-08-15T02:51:10.078598Z,1994-08-15
1417021200000000000,2014-11-27
20060429223458132,2006-04-29
2025-10-04T21:20:08.221138574Z,2025-10-04
"4th of February, 2000",2000-02-04
15-7-1998,1998-07-15
Event at 2005-09-17T16:58:9,2005-09-17
Ngày 16-6-2029,2029-06-16
1942678800,2031-07-25
831661200000000000,1996-05-10
808160400000000000,1995-08-12
15 February 2026,2026-02-15
2032275600000,2034-05-27
Ngày 1-7-2015,2015-07-01
26 June 2006,2006-06-26
11 December 2010,2010-12-11
2018-02-01T19:55:49.811Z,2018-02-01
20141031051312,2014-10-31
19990911001012404653,1999-09-11
1854378000000000000,2028-10-06
1090861200,2004-07-27
"October 25, 2015",2015-10-25
2028-02-28T18:44:03.722964Z,2028-02-28
Event at 2011-02-05T2:6:0,2011-02-05
19960303000259019744114,1996-03-03
20181122042352813773924,2018-11-22
30 Apr 2003,2003-04-30
1881075600000000000,2029-08-11
2006-05-08,2006-05-08
ngày 18 tháng 9 năm 2002,2002-09-18
19920425085045030,1992-04-25
20130220064548626,2013-02-20
4-5-2020,2020-05-04
28.7.2014T5-30-30,2014-07-28
11.2.2027T19-20-40,2027-02-11
2009-06-17T07:46:26.648805Z,2009-06-17
1994-10-31T23:17:21+0500,1994-10-31
22.12.93,1993-12-22
639334800,1990-04-06
03.12.1992,1992-03-12
1745773200000000,2025-04-28
Sự kiện diễn ra vào 31/7/2033 18:45,2033-07-31
1763830800000000000,2025-11-23
"9th of September, 2029",2029-09-09
11/4/2008 giờ 4:54:17,2008-04-11
1991-11-28T05:03:07.270Z,1991-11-28
5/1/2024 giờ 2:25:27,2024-01-05
1274029200000000,2010-05-17
10-12-2021,2021-12-05
2023-08-08T09:07:28.586790561Z,2023-08-08
"16th of August, 2019",2019-08-16
17 tháng 10 năm 2020,2020-10-17
"12th of March, 2011",2011-03-12
20320215203532083,2032-02-15
13 tháng 7 năm 2029,2029-07-13
15 4 2022,2022-04-15
6-10-2018,2018-10-06
2024_05_07T7_39_11+2500,2024-05-07
12/31/2010,2010-12-31
Sự kiện diễn ra vào 31/3/2003 8:26,2003-03-31
12-24-1997,1997-12-24
1/1/1995 giờ 8:14:24,1995-01-01
2023-12-22T03:53:28Z+3,2023-12-22
13 Oct 1990,1990-10-13
23/8-2009,2009-04-23
14-8-2032,2032-08-14
3/7/2034 giờ 8:50:24,2034-07-03
20110522084923383,2011-05-22
25/18-2029,2029-09-25
2016-02-17,2016-02-17
4 May 1992,1992-05-04
23/5/2027 giờ 6:10:53,2027-05-23
"December 28, 2035",2035-12-28
07|10|1995,1995-07-10
2012_12_31T2_7_14+00:00,2012-12-31
1387386000000000000,2013-12-19
26.8.2011T16-11-28,2011-08-26
20020914005746423358,2002-09-14
1997-06-14T23:18:06+2500,1997-06-14
ngày 30 tháng 5 năm 1996,1996-05-30
2009-06-02T22:56:10.164Z,2009-06-02
14-12-2003,2003-12-14
5 May 1994,1994-05-05
20220406195658118088392,2022-04-06
2012-02-16T15:38:29.962331463Z,2012-02-16
1060362000000,2003-08-09
1899738000000000,2030-03-15
42-10-2022,2022-10-21
24/11/2008 giờ 6:35:23,2008-11-24
875552400000000,1997-09-30
22.6.2027T6-12-21,2027-06-22
19 10 13,2013-10-19
23.4.2015T20-22-33,2015-04-23
1694797200000000,2023-09-16
11.5.2000T22-12-0,2000-05-11
Ngày 5-3-2008,2008-03-05
2008-04-04T23:10:48+3,2008-04-04
10 Jul 2015,2015-07-10
20050627100628,2005-06-27
2004_06_13T9_23_26-0330,2004-06-13
Ngày 20-8-1991,1991-08-20
31 October 2032,2032-10-31
1808154000000000000,2027-04-20
24.3.2019T19-46-52,2019-03-24
Sự kiện diễn ra vào 2/8/2013 0:28,2013-08-02
19970610203816866021,1997-06-10
20110807133130471,2011-08-07
Sự kiện diễn ra vào 25/6/2019 6:13,2019-06-25
20240522070212238588,2024-05-22
20130203205758446733597,2013-02-03
685558800000,1991-09-23
2003_06_13T1_44_32-05:00,2003-06-13
1030640400000,2002-08-30
2014|07|09,2014-07-09
10/10-2032,2032-05-10
ngày 24 tháng 8 năm 2030,2030-08-24
19.3.2025T11-42-30,2025-03-19
1994_03_23T5_22_49-0330,1994-03-23
20250720193334,2025-07-20
Sự kiện diễn ra vào 14/1/1996 17:57,1996-01-14
20221018004738105172,2022-10-18
1031850000000000000,2002-09-13
20071116022401,2007-11-16
5 Jul 2005,2005-07-05
The system recorded 20010422124656,2001-04-22
13_12_16,2016-12-13
2 Oct 2012,2012-10-02
1992-05-21T05:17:40+2500,1992-05-21
20221112152532,2022-11-12
22_6_1997,1997-06-22
1071939600000,2003-12-21
6 April 2025,2025-04-06
Ngày 16-4-2019,2019-04-16
20251220001350780,2025-12-20
2023-02-26T22:08:46,2023-02-26
Ngày 10-8-1999,1999-08-10
1 Jul 1992,1992-07-01
3-3-1996,1996-03-03
9/10/2026 giờ 9:50:59,2026-10-09
20340826034427648,2034-08-26
"9th of December, 1993",1993-12-09
The system recorded 20221004013738,2022-10-04
24-08-12,2012-08-24
2010-06-30T19:22:19,2010-06-30
20 May 2021,2021-05-20
Event at 1996-01-16T23:17:46,1996-01-16
20040323015302408,2004-03-23
10-6-2005,2005-06-05
20020905213018,2002-09-05
20011016093405,2001-10-16
3 7 2007,2007-07-03
07|14|1992,1992-07-14
1597597200000000,2020-08-17
2004-06-09T06:23:06.180580533Z,2004-06-09
31/8/2029 giờ 12:48:8,2029-08-31
1341766800000,2012-07-09
1998-07-30T22:48:46Z+3,1998-07-30
20120907133407650,2012-09-07
1711731600,2024-03-30
2013_06_19T16_1_35+07:00,2013-06-19
"July 16, 2034",2034-07-16
1198861200000000,2007-12-29
2002-02-03T02:49:42Z+3,2002-02-03
2002_05_25T22_1_16-0330,2002-05-25
08.19.2006,2006-08-19
20090628045400261275,2009-06-28
Ngày 16-1-1997,1997-01-16
Event at 2034-03-20T1:45:6,2034-03-20
"September 3, 2004",2004-09-03
2032/3/22T12280,2032-03-22
15_12_2023,2023-12-15
1725037200,2024-08-31
Ngày 8-9-2011,2011-09-08
The system recorded 20170104152830,2017-01-04
1993-11-27T22:57:04+00:00,1993-11-27
20320503001641,2032-05-03
2006-04-10T16:05:00.516Z,2006-04-10
Sự kiện diễn ra vào 8/12/2016 13:14,2016-12-08
Ngày 13-12-2031,2031-12-13
20350213194702411,2035-02-13
20201203010421286022734,2020-12-03
2018/10/1T75451,2018-10-01
2008-02-15T20:06:43+2500,2008-02-15
1995-08-14T00:18:00.072Z,1995-08-14
30 Jul 1993,1993-07-30
The system recorded 20000304181624,2000-03-04
2023-07-10T10:36:44Z+3,2023-07-10
856717200000000,1997-02-24
"December 21, 2011",2011-12-21
762282000000000,1994-02-27
17.12.2028T20-29-46,2028-12-17
2016-06-14T01:00:30,2016-06-14
2025536400000000000,2034-03-10
19.3.1991,1991-03-19
1796490000000,2026-12-06
50-5-2019,2019-05-25
698778000000000000,1992-02-23
1948813200000,2031-10-04
9/12/2009 giờ 22:35:49,2009-12-09
2010-05-26T09:35:09+2500,2010-05-26
Ngày 1-5-2025,2025-05-01
7-10-2034,2034-10-07
20150404060113431,2015-04-04
30 Apr 2025,2025-04-30
1548522000,2019-01-27
25 August 1997,1997-08-25
Sự kiện diễn ra vào 14/11/2032 8:27,2032-11-14
62-7-1993,1993-07-31
Sự kiện diễn ra vào 2/6/2022 21:48,2022-06-02
2007/1/8T152931,2007-01-08
2026/4/6T64150,2026-04-06
28.1.2004T16-2-48,2004-01-28
2008-06-10T15:09:10+2500,2008-06-10
04.01.15,2015-01-04
1806685200000000,2027-04-03
19931120141319570445193,1993-11-20
The system recorded 20190415161252,2019-04-15
2017_08_22T14_0_4-0300,2017-08-22
20020702044512059520881,2002-07-02
Ngày 10-7-2013,2013-07-10
Sự kiện diễn ra vào 12/8/2026 22:1,2026-08-12
2022-02-10T22:23:43+0500,2022-02-10
1 tháng 10 năm 2003,2003-10-01
2013.11.18,2013-11-18
Ngày 13-6-2023,2023-06-13
26/12/1990 giờ 13:17:15,1990-12-26
30 August 2014,2014-08-30
2025-03-04T19:48:27+2500,2025-03-04
28/12/1997 giờ 21:38:57,1997-12-28
16-3-2021,2021-03-16
2015_05_18T22_43_13+00:00,2015-05-18
20130723211317245,2013-07-23
2026-05-10T06:54:56.357Z,2026-05-10
19960229015858560624,1996-02-29
4 tháng 1 năm 2029,2029-01-04
"June 17, 2027",2027-06-17
1590858000000000,2020-05-31
1 Oct 2011,2011-10-01
Event at 2022-02-14T10:54:21,2022-02-14
19900606191041694590,1990-06-06
Sự kiện diễn ra vào 13/1/2020 19:6,2020-01-13
2014_08_01T11_57_41+3,2014-08-01
920048400000,1999-02-27
ngày 15 tháng 6 năm 2031,2031-06-15
2011-01-29T07:31:00.105608094Z,2011-01-29
28 tháng 3 năm 2006,2006-03-28
23/6/2019 giờ 6:21:39,2019-06-23
969642000,2000-09-23
2009-01-13T00:13:39+2500,2009-01-13
2002-08-13T11:27:59.763080Z,2002-08-13
2011/6/26T174514,2011-06-26
16-9-2011,2011-09-08
Event at 1996-04-13T17:14:3,1996-04-13
ngày 30 tháng 9 năm 2029,2029-09-30
1282669200000,2010-08-25
19900918061224233273380,1990-09-18
20000802091350712,2000-08-02
1841245200,2028-05-07
Sự kiện diễn ra vào 4/10/2004 16:46,2004-10-04
2/1/2022 giờ 21:57:45,2022-01-02
ngày 3 tháng 8 năm 1998,1998-08-03
"July 29, 2017",2017-07-29
16/6-1990,1990-03-16
Sự kiện diễn ra vào 17/1/2010 0:36,2010-01-17
19 Jun 1997,1997-06-19
The system recorded 20011027111937,2001-10-27
The system recorded 20001026132900,2000-10-26
"July 28, 2030",2030-07-28
2014_07_29T21_10_22Z+3,2014-07-29
Event at 2031-06-29T3:57:2,2031-06-29
20030621213104,2003-06-21
2009-06-28T07:19:42.100151Z,2009-06-28
2016-06-26T03:50:23+2500,2016-06-26
1999/11/13T4123,1999-11-13
The system recorded 20100124043214,2010-01-24
ngày 13 tháng 2 năm 1998,1998-02-13
1 December 1998,1998-12-01
20330208235952627756,2033-02-08
2034-02-25T21:42:03.492Z,2034-02-25
20101125030642086166,2010-11-25
20051219221655,2005-12-19
Event at 2025-03-17T17:28:20,2025-03-17
2029-05-25T02:44:25,2029-05-25
Ngày 28-10-2001,2001-10-28
9/1/2012 giờ 11:25:31,2012-01-09
06.01.2010,2010-06-01
1993_10_30T7_54_31+07:00,1993-10-30
10.7.1991T4-52-2,1991-07-10
736707600000000,1993-05-07
20081021235343,2008-10-21
Sự kiện diễn ra vào 24/5/2026 4:38,2026-05-24
2023-07-27T18:39:35Z+3,2023-07-27
5/2-2024,2024-01-05
"21th of July, 2031",2031-07-21
23 Mar 1992,1992-03-23
1.9.1993,1993-09-01
Ngày 10-8-2028,2028-08-10
"23th of September, 2016",2016-09-23
Ngày 13-1-2034,2034-01-13
1419613200000000000,2014-12-27
ngày 21 tháng 7 năm 2029,2029-07-21
2008-02-14T07:11:56.799107Z,2008-02-14
27/2/1995 giờ 5:29:36,1995-02-27
2005-05-13T02:22:36.073973884Z,2005-05-13
967482000,2000-08-29
1995-05-31T11:38:59.543674249Z,1995-05-31
2019/12/5T135242,2019-12-05
7-7-2030,2030-07-07
09/30/1992,1992-09-30
04 03 2016,2016-04-03
4/10/2017 giờ 6:32:4,2017-10-04
17-1-2011,2011-01-17
Event at 2010-07-15T3:54:32,2010-07-15
2017-08-12T02:37:28,2017-08-12
4 April 1993,1993-04-04
20130206095441116,2013-02-06
Event at 2016-10-20T3:33:16,2016-10-20
1536858000000000,2018-09-14
20340807010243062977648,2034-08-07
Event at 2000-09-07T10:19:51,2000-09-07
20321125201222616294,2032-11-25
"June 23, 2017",2017-06-23
Sự kiện diễn ra vào 25/11/2026 6:52,2026-11-25
1994-02-27T22:54:09.984138030Z,1994-02-27
2031-07-15T05:44:22.624Z,2031-07-15
54-8-2013,2013-08-27
15 Apr 2035,2035-04-15
2025-07-24T10:02:32Z+3,2025-07-24
20200302143222391949010,2020-03-02
08 23 1991,1991-08-23
15/10-2001,2001-05-15
20/10/2021 giờ 20:41:50,2021-10-20
2027-08-26T03:40:37,2027-08-26
10/2/2005 giờ 6:9:46,2005-02-10
20350629100130093914490,2035-06-29
"29th of March, 1990",1990-03-29
"8th of December, 2035",2035-12-08
Sự kiện diễn ra vào 4/4/2023 8:50,2023-04-04
Event at 1990-10-07T12:32:59,1990-10-07
659811600,1990-11-29
38-8-2002,2002-08-19
20 July 2007,2007-07-20
21.2.2034T11-50-19,2034-02-21
2029-09-09T17:30:05+2500,2029-09-09
1282150800000,2010-08-19
29 tháng 9 năm 1999,1999-09-29
19990311204407267555441,1999-03-11
58-9-2003,2003-09-29
7 tháng 1 năm 1998,1998-01-07
2027-01-16T15:18:32.882750Z,2027-01-16
2015-09-29T21:02:16.417Z,2015-09-29
18 Oct 2016,2016-10-18
1017680400000000,2002-04-02
"January 14, 2004",2004-01-14
2007-10-26T10:19:32Z+3,2007-10-26
17/10/2002 giờ 13:53:54,2002-10-17
14_12_24,2024-12-14
20240922052434289509611,2024-09-22
20070905085744,2007-09-05
Ngày 27-2-2023,2023-02-27
2028-03-14T17:31:16.443662Z,2028-03-14
26|02|16,2016-02-26
Ngày 20-1-2027,2027-01-20
34-11-2013,2013-11-17
20200120041607,2020-01-20
24|12|32,2032-12-24
2023_01_23T18_6_11-0330,2023-01-23
15.12.2034T16-17-12,2034-12-15
6/3/1993 giờ 22:10:59,1993-03-06
18/8/2029 giờ 15:52:11,2029-08-18
19930912073513981114066,1993-09-12
1576342800,2019-12-15
The system recorded 20220403142423,2022-04-03
17|02|34,2034-02-17
Ngày 23-8-2025,2025-08-23
"March 30, 2024",2024-03-30
5/24-2035,2035-12-05
2010-05-26T23:41:34.777Z,2010-05-26
17 7 2022,2022-07-17
19980319163846,1998-03-19
2010-12-10T06:03:05+2500,2010-12-10
9 Apr 2008,2008-04-09
1236704400,2009-03-11
Ngày 16-12-1999,1999-12-16
25 tháng 2 năm 2016,2016-02-25
6 Nov 2021,2021-11-06
21 Jan 1990,1990-01-21
ngày 31 tháng 7 năm 2003,2003-07-31
1788541200000000000,2026-09-05
2017_08_29T16_18_7-0330,2017-08-29
2017-12-09T07:24:57.863215516Z,2017-12-09
2023-08-15T12:17:25Z+3,2023-08-15
"1st of February, 2006",2006-02-01
2030-05-30T01:09:52.005418Z,2030-05-30
24 March 2035,2035-03-24
1035392400,2002-10-24
2004_02_03T20_19_52+3,2004-02-03
1819299600000000,2027-08-27
3 July 1992,1992-07-03
Ngày 14-1-2025,2025-01-14
25/8-2029,2029-04-25
1671382800000000000,2022-12-19
Sự kiện diễn ra vào 4/11/1999 2:54,1999-11-04
9.9.2017T23-59-52,2017-09-09
Sự kiện diễn ra vào 29/5/1999 2:5,1999-05-29
20210101124518,2021-01-01
ngày 1 tháng 6 năm 2015,2015-06-01
1990-02-12T22:43:30,1990-02-12
"May 2, 2023",2023-05-02
58-12-2013,2013-12-29
17/10/2004 giờ 4:26:19,2004-10-17
25-7-2024,2024-07-25
"April 24, 2007",2007-04-24
21 07 22,2022-07-21
19900430080717271,1990-04-30
2023/11/20T85154,2023-11-20
1994_08_27T18_10_24+00:00,1994-08-27
03_07_2035,2035-03-07
1994-05-23T04:43:00+2500,1994-05-23
Event at 2024-02-09T6:35:50,2024-02-09
697827600000000,1992-02-12
56-7-2008,2008-07-28
14-08-97,1997-08-14
Event at 1994-04-04T22:25:28,1994-04-04
2015 01 18,2015-01-18
20181010171447,2018-10-10
2021-08-01T16:23:40Z,2021-08-01
24-2-2007,2007-02-12
2003_04_21T0_20_39+0500,2003-04-21
3 January 2014,2014-01-03
9/14-1998,1998-07-09
ngày 4 tháng 9 năm 2033,2033-09-04
"December 21, 1999",1999-12-21
2035-11-25T09:14:12Z+3,2035-11-25
20001108111633305187,2000-11-08
1996-07-14T23:30:45.249142542Z,1996-07-14
2003_09_08T0_15_38-0330,2003-09-08
18 tháng 5 năm 2001,2001-05-18
2029/2/8T202954,2029-02-08
2035-07-25T11:10:22,2035-07-25
21 June 1998,1998-06-21
11|26|2002,2002-11-26
2024/3/20T1741,2024-03-20
20140829154839268282,2014-08-29
1068742800000000,2003-11-14
30 01 15,2015-01-30
Sự kiện diễn ra vào 24/6/2016 6:7,2016-06-24
03.03.91,1991-03-03
14 tháng 6 năm 2025,2025-06-14
2028-08-04T15:15:18-05:00,2028-08-04
2027-10-17T11:50:02+2500,2027-10-17
19 tháng 7 năm 2008,2008-07-19
13-12-2015,2015-12-13
2014-10-23T05:29:41.246681Z,2014-10-23
20220120121023445954014,2022-01-20
"November 9, 2026",2026-11-09
4 tháng 11 năm 1995,1995-11-04
Event at 1994-01-17T16:18:8,1994-01-17
1194368400000000,2007-11-07
2035-04-30T02:09:33.057Z,2035-04-30
16|01|19,2019-01-16
"February 26, 2008",2008-02-26
Sự kiện diễn ra vào 19/11/2013 14:40,2013-11-19
28/18-2017,2017-09-28
2014-09-03T20:41:58.148855933Z,2014-09-03
729622800000,1993-02-14
23-04-17,2017-04-23
2032-11-13T17:49:12+00:00,2032-11-13
"September 15, 2021",2021-09-15
17/20-1994,1994-10-17
Event at 1993-01-19T9:57:53,1993-01-19
21-5-2031,2031-05-21
2010-03-26T18:38:11-0300,2010-03-26
5/12/1999 giờ 4:57:55,1999-12-05
5/8/2026 giờ 2:53:0,2026-08-05
12_08_2035,2035-12-08
19940308162046871497,1994-03-08
The system recorded 20290920080551,2029-09-20
20270402072654913770216,2027-04-02
28/22-2015,2015-11-28
2015/07/24,2015-07-24
02 01 2030,2030-02-01
ngày 28 tháng 2 năm 2006,2006-02-28
2032_03_20T4_31_41Z+3,2032-03-20
4/16-2035,2035-08-04
Ngày 27-11-2001,2001-11-27
"September 12, 2020",2020-09-12
18/18-1998,1998-09-18
19900704165446703,1990-07-04
10/24/2013,2013-10-24
24-10-09,2009-10-24
14/20-2023,2023-10-14
24.11.1993T8-0-0,1993-11-24
13/22-2002,2002-11-13
Event at 2010-07-06T9:9:35,2010-07-06
29 11 15,2015-11-29
1025110800000,2002-06-27
1457370000000,2016-03-08
20100910111212,2010-09-10
2025 03 24,2025-03-24
803408400000000,1995-06-18
Sự kiện diễn ra vào 27/5/2027 21:59,2027-05-27
5/2-2006,2006-01-05
20180506151500886505,2018-05-06
2002-12-10T14:51:55,2002-12-10
19970108151712262866084,1997-01-08
16/8/2010 giờ 15:4:29,2010-08-16
1684515600000000,2023-05-20
Sự kiện diễn ra vào 7/9/2009 18:0,2009-09-07
Event at 2024-04-20T5:19:18,2024-04-20
795114000000000,1995-03-14
"July 9, 2017",2017-07-09
2009-03-11T19:45:14-0330,2009-03-11
"July 28, 1996",1996-07-28
ngày 7 tháng 5 năm 2005,2005-05-07
2024-01-10T16:04:00.177955845Z,2024-01-10
Sự kiện diễn ra vào 23/2/2032 16:48,2032-02-23
"19th of March, 2025",2025-03-19
1993222800,2033-03-01
Sự kiện diễn ra vào 1/3/1999 23:50,1999-03-01
2006-02-03T01:23:29,2006-02-03
1620838800000000,2021-05-13
15 tháng 2 năm 1996,1996-02-15
19901219200946745656,1990-12-19
23/6-2017,2017-03-23
"May 15, 1993",1993-05-15
12 25 1994,1994-12-25
12/1/2015 giờ 18:28:7,2015-01-12
"June 24, 2020",2020-06-24
2010-01-24,2010-01-24
2014_07_23T0_34_59Z,2014-07-23
2035/04/20,2035-04-20
18.01.26,2026-01-18
2 December 2005,2005-12-02
"4th of May, 2010",2010-05-04
17_6_2028,2028-06-17
20180515112545388,2018-05-15
5 February 2026,2026-02-05
15-6-2019,2019-06-15
13 tháng 6 năm 2033,2033-06-13
809629200000000,1995-08-29
2023 11 22,2023-11-22
29-5-2006,2006-05-29
818182800,1995-12-06
16 tháng 12 năm 2008,2008-12-16
Ngày 2-3-2017,2017-03-02
2032_01_08,2032-01-08
The system recorded 20040426132428,2004-04-26
2022/7/1T135124,2022-07-01
Ngày 11-6-2006,2006-06-11
4-12-2025,2025-12-02
2008-04-22T08:42:30.407Z,2008-04-22
20050130203234,2005-01-30
Sự kiện diễn ra vào 30/3/2011 14:3,2011-03-30
Event at 2005-10-03T9:53:23,2005-10-03
The system recorded 19980514062409,1998-05-14
"21th of October, 2003",2003-10-21
2009/2/12T192159,2009-02-12
20100817052551704562636,2010-08-17
2034-10-04T09:33:23+0500,2034-10-04
20/10/94,1994-10-20
12-10-2027,2027-10-12
20-8-2030,2030-08-20
1155574800000000000,2006-08-15
972925200000000000,2000-10-31
916765200000000000,1999-01-20
20050506033441573521,2005-05-06
1421686800,2015-01-20
1997-02-01T13:36:50.770625704Z,1997-02-01
19 July 2006,2006-07-19
2032_09_13T11_31_29+2500,2032-09-13
20110904200432,2011-09-04
The system recorded 19970120100556,1997-01-20
16/14-2012,2012-07-16
The system recorded 19940104154030,1994-01-04
27|03|01,2001-03-27
19930104105254,1993-01-04
The system recorded 20290819095755,2029-08-19
20090203003548289625318,2009-02-03
Ngày 23-4-1994,1994-04-23
11-6-2009,2009-06-11
647888400000000,1990-07-14
Event at 1996-12-19T14:37:42,1996-12-19
2020-03-06T06:49:40Z+3,2020-03-06
Ngày 16-8-1993,1993-08-16
The system recorded 20010316053452,2001-03-16
663786000,1991-01-14
The system recorded 19940113204237,1994-01-13
"August 26, 1990",1990-08-26
2035-05-18T04:08:25.309407Z,2035-05-18
54-12-1999,1999-12-27
50-1-1991,1991-01-25
2007-07-08T06:50:22.966753Z,2007-07-08
60-6-2006,2006-06-30
21-12-1994,1994-12-21
12|02|29,2029-02-12
2010-08-27T22:48:21.967781462Z,2010-08-27
2030-05-23T00:09:46.567330760Z,2030-05-23
Sự kiện diễn ra vào 7/5/1990 2:14,1990-05-07
2046531600000000,2034-11-08
31 Jan 2033,2033-01-31
20270213064833572,2027-02-13
22|03|31,2031-03-22
Sự kiện diễn ra vào 7/3/1998 2:4,1998-03-07
1791133200,2026-10-05
The system recorded 20340318112255,2034-03-18
1996-02-20T16:21:00.333173Z,1996-02-20
2016-05-02T11:44:24.291Z,2016-05-02
15-12-2015,2015-12-15
1236358800000,2009-03-07
1918054800,2030-10-13
Sự kiện diễn ra vào 13/6/2013 19:51,2013-06-13
1214413200,2008-06-26
20330324125413801,2033-03-24
9/14-2009,2009-07-09
2021-05-11T17:39:52Z+3,2021-05-11
2002/11/14T23010,2002-11-14
1492880400000000000,2017-04-23
1679850000000,2023-03-27
25 Oct 2008,2008-10-25
2002-04-02T23:16:55+2500,2002-04-02
19-7-2001,2001-07-19
The system recorded 20130515230417,2013-05-15
2021/6/23T6652,2021-06-23
2021-07-04T08:37:05.480244790Z,2021-07-04
30-11-2009,2009-11-15
Sự kiện diễn ra vào 3/2/2006 7:37,2006-02-03
22 tháng 11 năm 2034,2034-11-22
1784307600000000,2026-07-18
3/2-1994,1994-01-03
2033-06-13T04:17:07,2033-06-13
20090630213752218188,2009-06-30
Sự kiện diễn ra vào 26/9/2034 22:35,2034-09-26
ngày 22 tháng 2 năm 1995,1995-02-22
4|9|2009,2009-09-04
1764867600000000,2025-12-05
06_28_2025,2025-06-28
2-11-2016,2016-11-02
Event at 2008-12-20T22:21:36,2008-12-20
The system recorded 20220910134045,2022-09-10
780166800,1994-09-22
20170812122150382794333,2017-08-12
1246035600000000,2009-06-27
02.05.2028,2028-02-05
12.8.2023T13-53-17,2023-08-12
12/18-2012,2012-09-12
2055690000000,2035-02-22
ngày 13 tháng 10 năm 2012,2012-10-13
30/12/2007,2007-12-30
14 Oct 2032,2032-10-14
28|04|97,1997-04-28
26.07.14,2014-07-26
2020-06-20T02:29:30.249802552Z,2020-06-20
Event at 2011-01-23T5:42:11,2011-01-23
20231113101958740026,2023-11-13
931107600000000000,1999-07-05
"October 28, 1997",1997-10-28
01.10.2019,2019-01-10
2010_12_24T8_29_17+3,2010-12-24
1289926800000000,2010-11-17
21 tháng 1 năm 1996,1996-01-21
14-10-1998,1998-10-07
20140621070952,2014-06-21
Sự kiện diễn ra vào 27/4/2006 20:25,2006-04-27
4 April 2009,2009-04-04
23.10.2031T11-18-3,2031-10-23
2|8|2016,2016-08-02
34-9-2032,2032-09-17
The system recorded 20080415191256,2008-04-15
Event at 2014-08-12T21:0:31,2014-08-12
1996-04-09T10:02:38.949Z,1996-04-09
2023-01-17T09:43:27+2500,2023-01-17
05 11 31,2031-11-05
2022-01-06T20:41:25Z+3,2022-01-06
19920824122927,1992-08-24
2019-10-05T16:56:01-0330,2019-10-05
20-2-2011,2011-02-20
1929114000000000000,2031-02-18
"25th of December, 1992",1992-12-25
2003-02-12T11:22:48+2500,2003-02-12
16 11 04,2004-11-16
1430586000000000000,2015-05-03
2011-05-30,2011-05-30
6 September 2032,2032-09-06
Ngày 29-7-2035,2035-07-29
19990212203308356,1999-02-12
2030-07-15T07:45:33.148Z,2030-07-15
2023/1/12T51330,2023-01-12
2023-12-24T07:29:34.587Z,2023-12-24
1315587600,2011-09-10
24 tháng 7 năm 2001,2001-07-24
2024-05-02T06:49:42Z,2024-05-02
2010-03-08T12:30:07.641Z,2010-03-08
6 11 2000,2000-11-06
"5th of July, 2014",2014-07-05
03-02-12,2012-02-03
2023-07-29T17:19:17+07:00,2023-07-29
Event at 2012-05-07T12:47:1,2012-05-07
Sự kiện diễn ra vào 7/6/2024 15:5,2024-06-07
5_12_2011,2011-12-05
24 tháng 12 năm 2024,2024-12-24
16 tháng 3 năm 2005,2005-03-16
03|05|2014,2014-03-05
Sự kiện diễn ra vào 27/8/1994 5:35,1994-08-27
2014|11|14,2014-11-14
26/1/2016 giờ 2:51:42,2016-01-26
Event at 2010-05-13T4:32:12,2010-05-13
30-4-1992,1992-04-15
1957280400,2032-01-10
2004-08-10T21:39:21.239Z,2004-08-10
"26th of November, 2022",2022-11-26
7 August 1991,1991-08-07
2011/1/25T73932,2011-01-25
20350819140955,2035-08-19
20020503141035653692664,2002-05-03
19 March 2033,2033-03-19
Ngày 30-7-2031,2031-07-30
12.3.2013T6-1-38,2013-03-12
23 Mar 2018,2018-03-23
19910124184926,1991-01-24
20060627092131521424346,2006-06-27
"10th of March, 2014",2014-03-10
1652634000000000,2022-05-16
19980514033418719,1998-05-14
2033-04-01T17:51:06Z+3,2033-04-01
3/24-1999,1999-12-03
1993-11-04T04:46:43+3,1993-11-04
Ngày 30-12-2017,2017-12-30
25.4.2018,2018-04-25
"January 19, 2021",2021-01-19
1226163600000,2008-11-09
26/10-2016,2016-05-26
2027-04-20T18:19:57.534310966Z,2027-04-20
902682000000,1998-08-10
2026-04-13T12:02:35+08,2026-04-13
27-5-1993,1993-05-27
20060101114433622977,2006-01-01
Ngày 20-10-1992,1992-10-20
19900826000640,1990-08-26
50-2-2013,2013-02-25
60-5-2027,2027-05-30
24-7-1997,1997-07-12
9 tháng 12 năm 2008,2008-12-09
1818608400000000,2027-08-19
2032-09-24T22:47:04,2032-09-24
1891443600,2029-12-09
2038496400000,2034-08-07
2010_09_02T12_23_40+0500,2010-09-02
2018-11-30T05:38:36.719845Z,2018-11-30
12-7-2029,2029-07-12
20210721213000,2021-07-21
19950712082144,1995-07-12
Event at 2028-10-03T16:21:55,2028-10-03
Sự kiện diễn ra vào 26/4/2025 22:58,2025-04-26
1991-04-08T09:33:31.955811Z,1991-04-08
2025-08-07T08:13:32.415Z,2025-08-07
"March 23, 2011",2011-03-23
ngày 22 tháng 10 năm 2016,2016-10-22
2018-12-18T04:06:51.337742Z,2018-12-18
19970129012401162,1997-01-29
10.06.1999,1999-10-06
20200903135512,2020-09-03
20230707232525602,2023-07-07
04|08|2006,2006-04-08
9 tháng 5 năm 2002,2002-05-09
"January 15, 2021",2021-01-15
7 tháng 7 năm 2026,2026-07-07
06.26.2005,2005-06-26
16-8-2022,2022-08-16
20120821032807,2012-08-21
07_30_2027,2027-07-30
Ngày 17-3-2029,2029-03-17
21_8_1995,1995-08-21
2033/4/2T2280,2033-04-02
2013-10-04T05:12:52+0500,2013-10-04
2000-01-05T18:58:33.380244Z,2000-01-05
9-9-2034,2034-09-09
2017-09-06T04:11:15.924Z,2017-09-06
1994-10-29T16:23:48.473Z,1994-10-29
2028_03_23T11_19_51-0330,2028-03-23
20161228041017281,2016-12-28
"February 8, 2035",2035-02-08
30 tháng 3 năm 2028,2028-03-30
19900622150138730,1990-06-22
2035-07-09T06:04:45+07:00,2035-07-09
Sự kiện diễn ra vào 10/6/2021 15:33,2021-06-10
16-6-2021,2021-06-16
"10th of September, 2020",2020-09-10
1584205200000,2020-03-15
The system recorded 20170916080608,2017-09-16
19/10/1992 giờ 21:38:7,1992-10-19
1051981200000000,2003-05-04
ngày 14 tháng 3 năm 2021,2021-03-14
1519405200000,2018-02-24
Ngày 6-9-2021,2021-09-06
Sự kiện diễn ra vào 1/9/1995 6:39,1995-09-01
1999-11-20T18:19:37+2500,1999-11-20
4/8/2023,2023-08-04
2027/9/14T82234,2027-09-14
8 August 2016,2016-08-08
Ngày 5-1-1996,1996-01-05
17 Jul 1999,1999-07-17
2023-12-04T18:13:32Z+3,2023-12-04
Ngày 7-5-2033,2033-05-07
Ngày 21-3-2028,2028-03-21
"22th of May, 2018",2018-05-22
1027875600000,2002-07-29
ngày 25 tháng 4 năm 2010,2010-04-25
20260206110721,2026-02-06
19920206063237,1992-02-06
ngày 9 tháng 6 năm 1997,1997-06-09
Sự kiện diễn ra vào 22/4/2007 10:51,2007-04-22
10/14-2017,2017-07-10
01 03 2002,2002-01-03
20120928171657510646480,2012-09-28
2014-06-05T04:28:52,2014-06-05
Sự kiện diễn ra vào 10/2/2035 13:47,2035-02-10
2024-06-19T03:17:52,2024-06-19
52-4-1996,1996-04-26
Ngày 20-3-2012,2012-03-20
1860858000000000,2028-12-20
19980204050838579,1998-02-04
ngày 25 tháng 9 năm 2029,2029-09-25
29-9-2023,2023-09-29
12 Aug 2017,2017-08-12
2001-07-28T22:06:52Z+3,2001-07-28
Event at 2018-03-30T18:54:3,2018-03-30
12 March 2023,2023-03-12
718822800000,1992-10-12
1472662800000000000,2016-09-01
06_01_10,2010-01-06
24 May 1993,1993-05-24
20/11/93,1993-11-20
1911315600,2030-07-27
Ngày 13-11-2002,2002-11-13
"August 17, 2013",2013-08-17
19-9-2020,2020-09-19
Sự kiện diễn ra vào 24/5/2020 6:53,2020-05-24
2024-09-13T08:09:24.430291288Z,2024-09-13
2020-12-13T11:27:48-0330,2020-12-13
1995_06_14T20_38_52+08,1995-06-14
1994-05-21T09:06:00,1994-05-21
2016-06-22T03:51:34,2016-06-22
1827507600,2027-11-30
23 tháng 6 năm 2020,2020-06-23
2008-08-18T03:24:54+2500,2008-08-18
1993-02-03T22:13:22+0500,1993-02-03
2000_04_20T7_13_1+2500,2000-04-20
The system recorded 20271029153435,2027-10-29
17/4/2014 giờ 5:27:17,2014-04-17
12/2/2007 giờ 11:41:50,2007-02-12
2001_04_19,2001-04-19
44-2-2020,2020-02-22
25.4.1999,1999-04-25
2027-12-03T17:36:05.329127030Z,2027-12-03
20070206165201258358,2007-02-06
20200407151515604304177,2020-04-07
The system recorded 19950524154118,1995-05-24
2004-04-22T23:09:08.487356940Z,2004-04-22
2017_05_02T17_5_45+3,2017-05-02
2028-05-27T18:48:03,2028-05-27
2034-08-26T03:00:36-0330,2034-08-26
2033/3/9T132452,2033-03-09
1528131600000,2018-06-05
19910420175014753,1991-04-20
1994-04-16T04:52:40+0500,1994-04-16
2033_08_29T10_22_2-05:00,2033-08-29
The system recorded 19920524071751,1992-05-24
4 tháng 8 năm 2013,2013-08-04
1990-06-01T04:11:24.858Z,1990-06-01
1994-11-21T10:28:53Z+3,1994-11-21
ngày 12 tháng 5 năm 1993,1993-05-12
1328634000000000000,2012-02-08
17|10|2006,2006-10-17
09_15_2008,2008-09-15
19961228022813148135456,1996-12-28
Sự kiện diễn ra vào 16/10/1994 12:23,1994-10-16
2032/11/21T63217,2032-11-21
2007-11-20T23:27:16+0500,2007-11-20
1996|07|24,1996-07-24
2002-11-25T23:44:58.494851Z,2002-11-25
10-6-2031,2031-06-10
"14th of May, 2015",2015-05-14
2011-07-23T14:10:55+2500,2011-07-23
20270129115340884224,2027-01-29
17/4-2023,2023-02-17
18.2.2016,2016-02-18
Event at 2006-11-24T22:51:52,2006-11-24
1286038800000000000,2010-10-03
04 05 93,1993-05-04
Event at 2001-08-31T20:55:1,2001-08-31
2 tháng 6 năm 1999,1999-06-02
20310419180520194910664,2031-04-19
ngày 18 tháng 2 năm 2003,2003-02-18
"June 10, 1994",1994-06-10
1312390800000000,2011-08-04
Ngày 27-11-2028,2028-11-27
1277571600,2010-06-27
19990505210611791,1999-05-05
2007/9/4T111649,2007-09-04
1198256400000000000,2007-12-22
Sự kiện diễn ra vào 24/11/2001 23:26,2001-11-24
2033-02-05T02:41:52.892Z,2033-02-05
1968858000,2032-05-23
17-7-2011,2011-07-17
2032-06-17T03:36:39.609Z,2032-06-17
1993/12/1T103627,1993-12-01
20171028084654686,2017-10-28
Event at 2003-11-29T10:17:37,2003-11-29
11-6-2000,2000-06-11
2033-04-04T15:57:52+2500,2033-04-04
58-4-2000,2000-04-29
1994-07-31T12:14:23.799556Z,1994-07-31
22 tháng 11 năm 2006,2006-11-22
20341113124630483954,2034-11-13
Event at 2018-05-21T7:3:28,2018-05-21
2026-03-05T05:15:37.442044Z,2026-03-05
Event at 2018-09-22T6:48:55,2018-09-22
"25th of December, 1992",1992-12-25
13.7.2004T18-28-10,2004-07-13
2028-05-24T15:56:37Z+3,2028-05-24
710442000000000,1992-07-07
9/14-2016,2016-07-09
Sự kiện diễn ra vào 14/12/1995 12:18,1995-12-14
2024_11_08T14_49_15-0330,2024-11-08
1834592400000000000,2028-02-20
20091204113037,2009-12-04
1406134800000000000,2014-07-24
4 October 2000,2000-10-04
2016_06_27T2_48_13-0330,2016-06-27
1995.03.31,1995-03-31
1996-09-20T16:36:53.042Z,1996-09-20
2001-06-20T03:05:43+08,2001-06-20
19900114162301362,1990-01-14
1686330000,2023-06-10
16/7/2022 giờ 13:24:50,2022-07-16
20.11.2017T10-6-12,2017-11-20
20180312101417166943,2018-03-12
"1st of February, 2018",2018-02-01
1697994000000000000,2023-10-23
2019/6/12T145954,2019-06-12
2007-02-21T09:19:31-0330,2007-02-21
"1st of September, 2026",2026-09-01
26/3/2009,2009-03-26
20260926043718415362454,2026-09-26
2034|09|01,2034-09-01
9-8-2009,2009-08-09
20210823211126610476058,2021-08-23
2004-07-07T09:13:44+2500,2004-07-07
27/4-2016,2016-02-27
20-11-2008,2008-11-10
20101030041131534454343,2010-10-30
2006-04-13T14:16:09.699Z,2006-04-13
20080128191445759508107,2008-01-28
Sự kiện diễn ra vào 17/3/2021 21:3,2021-03-17
13.10.2035T10-23-11,2035-10-13
1771347600,2026-02-18
Event at 2000-10-18T11:24:5,2000-10-18
20020304162146289822,2002-03-04
1926349200000000000,2031-01-17
2069514000000,2035-08-01
Event at 2016-08-07T21:3:14,2016-08-07
2035-12-27T22:04:36+2500,2035-12-27
2003-12-28T02:44:41+2500,2003-12-28
16-10-2035,2035-10-08
28 Feb 2003,2003-02-28
2008-12-31T12:24:23.648014Z,2008-12-31
1190998800000000,2007-09-29
2-1-2033,2033-01-02
20101019113214544861,2010-10-19
The system recorded 20270422112957,2027-04-22
20330924165850,2033-09-24
01-05-94,1994-05-01
1054227600000,2003-05-30
21.7.2014T5-30-37,2014-07-21
25/3/2008 giờ 3:15:3,2008-03-25
10.2.2001,2001-02-10
20051122152616,2005-11-22
12_4_2001,2001-04-12
The system recorded 19941205191228,1994-12-05
ngày 16 tháng 5 năm 1992,1992-05-16
Sự kiện diễn ra vào 18/5/2003 0:22,2003-05-18
2010-04-21T06:25:05+00:00,2010-04-21
697309200000000,1992-02-06
28-7-2035,2035-07-14
1366822800000000,2013-04-25
30-7-2014,2014-07-15
18-4-2031,2031-04-09
Sự kiện diễn ra vào 10/10/1996 11:49,1996-10-10
13/12-1992,1992-06-13
1990-03-22T01:19:13.327882Z,1990-03-22
2027-02-04T08:58:55.532Z,2027-02-04
Event at 2004-10-07T21:44:10,2004-10-07
18 July 1993,1993-07-18
2009-02-18T01:41:10.486426Z,2009-02-18
2020 10 28,2020-10-28
3 Nov 2006,2006-11-03
The system recorded 20091210145550,2009-12-10
2001-03-26T16:14:24,2001-03-26
ngày 8 tháng 7 năm 2001,2001-07-08
25|11|1993,1993-11-25
Ngày 6-5-2002,2002-05-06
1317056400000000,2011-09-27
Ngày 21-1-2033,2033-01-21
Event at 2005-06-07T13:5:21,2005-06-07
7.7.2034T9-10-43,2034-07-07
19970421225330753,1997-04-21
5 Aug 2020,2020-08-05
14-11-2017,2017-11-14
2004/3/30T12816,2004-03-30
1993-06-25T03:00:08.308702629Z,1993-06-25
707850000,1992-06-07
"August 20, 1996",1996-08-20
19960520043039794172266,1996-05-20
62-5-1996,1996-05-31
Event at 2004-06-03T17:16:4,2004-06-03
2004-09-07T05:19:54Z+3,2004-09-07
14.10.2022T3-47-46,2022-10-14
20330621090218099585,2033-06-21
Ngày 10-2-2029,2029-02-10
04_01_1990,1990-04-01
2007-01-07T12:56:26.511453690Z,2007-01-07
1983546000000000,2032-11-09
2011-08-31T02:38:20+00:00,2011-08-31
20030301010103472715287,2003-03-01
1991-09-17T09:04:41.137725374Z,1991-09-17
44-9-2031,2031-09-22
1589821200000000000,2020-05-19
20041208154135924,2004-12-08
2035-05-24T18:03:52+2500,2035-05-24
ngày 2 tháng 5 năm 1991,1991-05-02
2034-09-27T12:35:34.006504Z,2034-09-27
ngày 20 tháng 6 năm 1998,1998-06-20
2008_03_10T16_12_13-0330,2008-03-10
1049130000000,2003-04-01
2035-12-02T18:41:36.201329929Z,2035-12-02
20320718150918765,2032-07-18
20030909034755,2003-09-09
"24th of May, 2019",2019-05-24
02.27.2006,2006-02-27
Sự kiện diễn ra vào 5/1/2030 19:10,2030-01-05
20051002090723,2005-10-02
12|12|01,2001-12-12
20231107201345343,2023-11-07
06/13/2021,2021-06-13
"7th of April, 2035",2035-04-07
2025/2/3T10136,2025-02-03
03|01|2027,2027-03-01
2026-08-14T11:03:40,2026-08-14
ngày 5 tháng 1 năm 2005,2005-01-05
2032-11-04T06:22:29+2500,2032-11-04
2007/9/1T94127,2007-09-01
2011-03-12T10:37:09.790Z,2011-03-12
2001-11-05T18:30:04,2001-11-05
27 Jul 2030,2030-07-27
25/7/1991 giờ 3:48:27,1991-07-25
20080414050616,2008-04-14
10/16-2032,2032-08-10
2034-08-02T15:18:49+2500,2034-08-02
Ngày 5-7-1990,1990-07-05
10-1-1994,1994-01-10
"21th of September, 1991",1991-09-21
5/18-2007,2007-09-05
2012-01-19T20:54:35,2012-01-19
1996-10-02T22:39:17+2500,1996-10-02
20310501195244238826085,2031-05-01
2019.09.21,2019-09-21
1998-09-02T00:17:11,1998-09-02
1 12 2014,2014-12-01
2019-03-24,2019-03-24
20040815023602015732883,2004-08-15
26.7.1992T6-57-21,1992-07-26
1995-12-17T21:25:53.711293Z,1995-12-17
1-9-2014,2014-09-01
2035-03-01T02:33:43.127890Z,2035-03-01
1-6-2007,2007-06-01
1214154000000000000,2008-06-23
2007/09/26,2007-09-26
"April 28, 2019",2019-04-28
1616346000000,2021-03-22
804618000000000,1995-07-02
19921128172701494,1992-11-28
"28th of November, 2012",2012-11-28
1791392400,2026-10-08
20010510102436,2001-05-10
1228669200000,2008-12-08
20131206184531802142,2013-12-06
2 tháng 7 năm 2016,2016-07-02
2018-09-26T15:43:31Z+3,2018-09-26
Sự kiện diễn ra vào 7/7/2032 1:29,2032-07-07
20060703195652,2006-07-03
"10th of June, 2035",2035-06-10
19970602033101,1997-06-02
9 Feb 2002,2002-02-09
1650301200000,2022-04-19
1574182800000000,2019-11-20
11 April 1993,1993-04-11
2030-12-27T14:31:58,2030-12-27
20050529150909039,2005-05-29
2012_05_19,2012-05-19
ngày 8 tháng 3 năm 2033,2033-03-08
Ngày 21-9-2019,2019-09-21
20110201102256706842212,2011-02-01
884797200000,1998-01-15
26.11.2004T23-37-38,2004-11-26
1993-12-04T17:01:41-05:00,1993-12-04
4/20-1995,1995-10-04
26|11|19,2019-11-26
1999-06-30T22:38:38+2500,1999-06-30
2012/3/31T165539,2012-03-31
1285002000000000,2010-09-21
8-8-2008,2008-08-08
2026-03-27T06:55:52.661031Z,2026-03-27
30 Mar 2032,2032-03-30
25 Jun 2002,2002-06-25
20020526054737640820665,2002-05-26
20300812183705,2030-08-12
2015-08-24T09:19:25Z+3,2015-08-24
18.6.2025T8-58-16,2025-06-18
2015-04-24T01:41:56,2015-04-24
11 tháng 7 năm 2007,2007-07-11
20130711015115,2013-07-11
Event at 2020-08-19T7:55:26,2020-08-19
24 tháng 11 năm 2023,2023-11-24
20140520075317,2014-05-20
21 June 2025,2025-06-21
Sự kiện diễn ra vào 30/5/2002 21:33,2002-05-30
1357232400000000000,2013-01-04
03.08.23,2023-08-03
"11th of September, 2011",2011-09-11
16/5/2011,2011-05-16
20211002205903,2021-10-02
2033-03-05T01:33:10Z+3,2033-03-05
Sự kiện diễn ra vào 25/9/2000 7:29,2000-09-25
Sự kiện diễn ra vào 26/7/1996 12:17,1996-07-26
The system recorded 19950430165722,1995-04-30
2014-10-11T03:32:54.358Z,2014-10-11
2008-08-02T10:20:21.872Z,2008-08-02
4/18-2021,2021-09-04
1990-05-14T14:59:41+0500,1990-05-14
20020727073935167168,2002-07-27
2003-08-22T16:36:15Z+3,2003-08-22
1690650000000,2023-07-30
"30th of May, 2025",2025-05-30
1999-06-10T04:47:14,1999-06-10
2023-07-20T04:59:18.617Z,2023-07-20
20010606182948286167834,2001-06-06
20311128025023165420,2031-11-28
1454086800000,2016-01-30
Sự kiện diễn ra vào 11/8/2020 12:11,2020-08-11
2009-02-14T20:14:54+2500,2009-02-14
ngày 8 tháng 7 năm 2004,2004-07-08
2007-05-26T10:57:36.881Z,2007-05-26
Event at 2007-12-06T8:54:23,2007-12-06
12|04|2028,2028-12-04
20000101073547817,2000-01-01
7.9.2005T4-20-31,2005-09-07
27_11_1995,1995-11-27
2024-12-04T11:54:00Z+3,2024-12-04
09|13|2029,2029-09-13
28-2-2031,2031-02-28
Event at 1993-01-06T13:34:12,1993-01-06
Event at 2034-11-08T16:7:43,2034-11-08
22 May 2015,2015-05-22
8 December 1999,1999-12-08
2010/1/7T121357,2010-01-07
The system recorded 20130624053745,2013-06-24
1999.04.13,1999-04-13
2010-11-14T18:50:31,2010-11-14
Sự kiện diễn ra vào 14/1/2022 18:0,2022-01-14
17/20-2012,2012-10-17
1586278800000000000,2020-04-08
20060328024020661,2006-03-28
2016-06-09T03:26:17.459641Z,2016-06-09
04/21/2013,2013-04-21
30/3/2013,2013-03-30
10.12.07,2007-12-10
27-4-1992,1992-04-27
944326800000000000,1999-12-05
1 Oct 2004,2004-10-01
2025-09-20T17:23:15+2500,2025-09-20
2017-08-31T14:39:16+2500,2017-08-31
2005-09-18T02:45:19.300203136Z,2005-09-18
The system recorded 20131004135949,2013-10-04
1931446800,2031-03-17
29.11.2028T2-51-10,2028-11-29
1998-07-28T17:14:09.899901Z,1998-07-28
1061226000000000000,2003-08-19
26-06-98,1998-06-26
2027-04-11T05:03:03+2500,2027-04-11
21-8-1997,1997-08-21
19980918155855833552,1998-09-18
Event at 2004-01-25T8:9:14,2004-01-25
2001-06-09T20:57:34-0300,2001-06-09
10/20-2002,2002-10-10
19990201140743343,1999-02-01
"9th of July, 2027",2027-07-09
1801760400000,2027-02-05
1 12 1998,1998-12-01
2029-03-22T13:35:22.984Z,2029-03-22
1996-03-29T15:15:03+2500,1996-03-29
7/7/1992 giờ 11:29:17,1992-07-07
2004-11-24T10:24:56.101564974Z,2004-11-24
2030/5/18T103617,2030-05-18
Event at 2006-12-04T17:37:42,2006-12-04
"April 11, 2001",2001-04-11
"28th of April, 2025",2025-04-28
2022_12_12,2022-12-12
ngày 6 tháng 2 năm 2033,2033-02-06
16.6.1995T0-54-56,1995-06-16
07|12|96,1996-12-07
26.10.1997,1997-10-26
1999-03-03T01:56:17Z+3,1999-03-03
Sự kiện diễn ra vào 20/1/2025 13:43,2025-01-20
2006-03-06T07:59:55,2006-03-06
The system recorded 19940912235808,1994-09-12
19930826033802589932,1993-08-26
44-10-2001,2001-10-22
Sự kiện diễn ra vào 21/9/2031 6:30,2031-09-21
20 March 1995,1995-03-20
30 August 2024,2024-08-30
2009|04|11,2009-04-11
26-2-2023,2023-02-26
2008_05_14T9_48_16Z,2008-05-14
885661200000000000,1998-01-25
Event at 2010-04-12T15:3:52,2010-04-12
6.5.2033T6-19-27,2033-05-06
1388509200,2014-01-01
755456400000000000,1993-12-10
54-7-2013,2013-07-27
25/1/2011,2011-01-25
Ngày 20-7-1996,1996-07-20
2003-04-23T21:48:45,2003-04-23
19911108040920876,1991-11-08
07 02 29,2029-02-07
The system recorded 20160830005717,2016-08-30
15 tháng 12 năm 2007,2007-12-15
08/26/2008,2008-08-26
19970525134253928425294,1997-05-25
2 July 2034,2034-07-02
1995-11-19T15:12:04Z+3,1995-11-19
650826000000000000,1990-08-17
12 tháng 11 năm 2032,2032-11-12
2065971600000,2035-06-21
13/12-1991,1991-06-13
Ngày 7-1-2006,2006-01-07
2034-12-14T14:52:10.941694Z,2034-12-14
2/4/2005 giờ 12:56:20,2005-04-02
20 tháng 6 năm 2010,2010-06-20
641408400000000,1990-04-30
2032_07_03T23_16_21+08,2032-07-03
20340104075841,2034-01-04
20060513182819687,2006-05-13
1657731600000000000,2022-07-14
2029-07-05T21:40:59-05:00,2029-07-05
1992-04-19T16:47:56,1992-04-19
19.7.2012,2012-07-19
08/14/2028,2028-08-14
17 Aug 2007,2007-08-17
20171010021226858976,2017-10-10
09_30_1991,1991-09-30
2067181200000000,2035-07-05
21|12|2035,2035-12-21
2016-02-03T05:37:56+08,2016-02-03
03_03_2009,2009-03-03
923331600000000,1999-04-06
908816400000,1998-10-20
20051128092009,2005-11-28
762627600000,1994-03-03
25 tháng 11 năm 2027,2027-11-25
6-5-2018,2018-05-03
Ngày 8-10-2033,2033-10-08
2034-10-14T18:37:29.348Z,2034-10-14
2007-01-18T21:23:43.520Z,2007-01-18
28|03|99,1999-03-28
30-9-1993,1993-09-15
22-06-06,2006-06-22
The system recorded 20270513144803,2027-05-13
1276102800000000,2010-06-10
Ngày 5-3-2005,2005-03-05
2017-10-31T10:04:46Z+3,2017-10-31
15 December 2030,2030-12-15
2010-04-14T19:18:26+2500,2010-04-14
2000_01_21T2_1_49+3,2000-01-21
27 tháng 5 năm 2030,2030-05-27
3/12-2023,2023-06-03
2006-09-18T03:09:19.410264Z,2006-09-18
12 Feb 2019,2019-02-12
36-12-2000,2000-12-18
1828198800000000,2027-12-08
996253200000000,2001-07-28
2000|04|27,2000-04-27
2000-08-12T13:44:30Z+3,2000-08-12
15.8.1990T8-42-56,1990-08-15
2003-01-05T03:02:57+2500,2003-01-05
Event at 2017-01-15T14:18:40,2017-01-15
20171019183128741036,2017-10-19
19910918200518715,1991-09-18
The system recorded 20061009183719,2006-10-09
"9th of December, 2015",2015-12-09
24/18-1997,1997-09-24
15/24-2005,2005-12-15
20340911202409220474281,2034-09-11
"April 6, 1990",1990-04-06
1676998800,2023-02-22
1733590800000000,2024-12-08
2031/8/10T42829,2031-08-10
42-9-2008,2008-09-21
2003-02-21T01:08:30.142Z,2003-02-21
1845651600000000,2028-06-27
2007-05-05T09:26:28Z+3,2007-05-05
2032-08-24T03:49:42.899787803Z,2032-08-24
2028-06-18T08:58:00+2500,2028-06-18
13 May 2002,2002-05-13
2035-05-08T09:28:00.211487640Z,2035-05-08
1990-08-25T05:45:16.932Z,1990-08-25
ngày 21 tháng 6 năm 2034,2034-06-21
1995-10-29T08:20:35Z+3,1995-10-29
Event at 2024-04-27T13:4:38,2024-04-27
3 1 1990,1990-01-03
2031_03_18T23_9_26+2500,2031-03-18
Ngày 6-8-2003,2003-08-06
2023-02-01T17:02:06.837377212Z,2023-02-01
9/12-2003,2003-06-09
4 Jan 2005,2005-01-04
939661200000000000,1999-10-12
2031-12-27T19:37:05.551952045Z,2031-12-27
1995-12-01T19:01:39Z+3,1995-12-01
22-6-2018,2018-06-11
20170615031007,2017-06-15
2017_01_16T18_12_58-05:00,2017-01-16
10.10.2009T21-45-21,2009-10-10
2034-03-25T22:13:20.227577Z,2034-03-25
Ngày 5-12-2028,2028-12-05
1992-06-17T17:56:59-0330,1992-06-17
23 tháng 8 năm 2008,2008-08-23
Event at 2017-09-23T7:48:57,2017-09-23
2067181200,2035-07-05
4-9-2002,2002-09-02
2005-12-04T05:16:22+2500,2005-12-04
2025/4/30T22261,2025-04-30
2003/8/29T172626,2003-08-29
Ngày 21-11-1996,1996-11-21
2035-02-26T16:34:46Z+3,2035-02-26
1724778000000,2024-08-28
907088400,1998-09-30
2029-06-20T22:39:46,2029-06-20
20150827221444,2015-08-27
2023-03-21T16:00:27,2023-03-21
2020/08/27,2020-08-27
30 Nov 2030,2030-11-30
2035-04-11T00:25:59.604709Z,2035-04-11
1 tháng 9 năm 2020,2020-09-01
2035-11-13T00:10:25+2500,2035-11-13
1998-12-06T22:50:19+2500,1998-12-06
1994-07-11T02:16:12,1994-07-11
11 Apr 2013,2013-04-11
21-1-2028,2028-01-21
"March 6, 1997",1997-03-06
1997-06-21T20:37:36.736Z,1997-06-21
27 8 2001,2001-08-27
2021.02.22,2021-02-22
2019-08-14T19:07:57+2500,2019-08-14
19940926090757191675179,1994-09-26
2013-10-30T23:35:15,2013-10-30
2027-11-18T18:03:49.323422359Z,2027-11-18
28-4-2002,2002-04-28
4.4.2027T4-11-36,2027-04-04
01.08.2030,2030-01-08
2018-09-15T20:28:15+2500,2018-09-15
2015-10-02T01:04:38.815083014Z,2015-10-02
Event at 2022-05-06T22:45:6,2022-05-06
Event at 2011-07-08T19:39:20,2011-07-08
23/8/2030,2030-08-23
7/9/2009 giờ 16:4:14,2009-09-07
2020-06-03T03:38:38Z+3,2020-06-03
27.1.2017,2017-01-27
1999-01-19T03:50:52,1999-01-19
"October 21, 2016",2016-10-21
The system recorded 20090519000651,2009-05-19
9-10-2015,2015-10-09
1821459600,2027-09-21
31 Aug 2025,2025-08-31
20341126063350197922440,2034-11-26
1056819600000000000,2003-06-29
1998-01-28T00:00:29+2500,1998-01-28
976467600,2000-12-11
The system recorded 20020216001735,2002-02-16
8-8-2011,2011-08-04
The system recorded 20111005235832,2011-10-05
20100727222633154,2010-07-27
2020-11-12T17:34:30.806559812Z,2020-11-12
ngày 17 tháng 5 năm 2000,2000-05-17
The system recorded 20230113163049,2023-01-13
1997-09-03T23:43:10+08,1997-09-03
"February 8, 2029",2029-02-08
2019-09-14T02:03:44+00:00,2019-09-14
2017-09-01T10:35:48Z+3,2017-09-01
2.8.2001T23-47-20,2001-08-02
19921012023009384223,1992-10-12
2034-12-03T23:57:08,2034-12-03
20211022070009167471,2021-10-22
15 1 2023,2023-01-15
ngày 25 tháng 4 năm 2020,2020-04-25
23 Sep 2003,2003-09-23
2011/10/30T61637,2011-10-30
11 18 2033,2033-11-18
11.9.2014T22-29-57,2014-09-11
1988298000000,2033-01-03
1185469200000000,2007-07-27
2001-08-28T22:22:53.145524630Z,2001-08-28
1998_07_09T6_53_35Z,1998-07-09
20300608214613451299853,2030-06-08
1912352400,2030-08-08
20241031141459,2024-10-31
1638205200000,2021-11-30
2028-12-20T09:07:47.635Z,2028-12-20
1640710800,2021-12-29
20.12.02,2002-12-20
19910607051757,1991-06-07
Event at 2014-08-31T8:15:12,2014-08-31
Event at 1994-10-25T11:47:22,1994-10-25
14/22-2035,2035-11-14
Event at 2012-05-27T2:43:23,2012-05-27
21 Apr 2018,2018-04-21
1992_04_29T22_22_29+2500,1992-04-29
1336582800000,2012-05-10
50-1-1990,1990-01-25
3 Jul 2020,2020-07-03
2016/5/2T21216,2016-05-02
31 August 2000,2000-08-31
2023/11/28T7479,2023-11-28
2004|04|21,2004-04-21
17/3/2013 giờ 19:43:3,2013-03-17
The system recorded 20220503180835,2022-05-03
Event at 2013-05-27T14:13:46,2013-05-27
ngày 12 tháng 4 năm 2026,2026-04-12
16.4.2032,2032-04-16
834166800000,1996-06-08
Ngày 5-5-2014,2014-05-05
2027.09.08,2027-09-08
18/9/2001 giờ 2:12:33,2001-09-18
30.08.24,2024-08-30
Sự kiện diễn ra vào 17/10/2016 16:6,2016-10-17
24 tháng 1 năm 1992,1992-01-24
2007-12-26T06:24:33.265458Z,2007-12-26
ngày 19 tháng 3 năm 2024,2024-03-19
ngày 25 tháng 8 năm 2026,2026-08-25
1897318800,2030-02-15
1671728400,2022-12-23
"21th of September, 2004",2004-09-21
7 6 1994,1994-06-07
2028-12-27,2028-12-27
16 11 15,2015-11-16
2024-03-01T12:22:59.856020802Z,2024-03-01
20121003153030379010,2012-10-03
The system recorded 20071231063312,2007-12-31
Sự kiện diễn ra vào 11/6/2003 1:4,2003-06-11
26_07_31,2031-07-26
3 November 2021,2021-11-03
1992-03-25T09:40:19,1992-03-25
11/13/1998,1998-11-13
20301112232437271267830,2030-11-12
1632243600000000000,2021-09-22
1271696400000000000,2010-04-20
19981228020747557010,1998-12-28
5/20-2025,2025-10-05
20020913203128,2002-09-13
2010934800000,2033-09-22
1996-02-09T18:07:39.575Z,1996-02-09
2030-04-14T21:23:05-05:00,2030-04-14
1956675600,2032-01-03
2031-06-27T12:53:24.857310633Z,2031-06-27
Event at 2023-07-03T12:12:45,2023-07-03
11|05|1995,1995-11-05
6.3.1990T20-39-23,1990-03-06
1953824400,2031-12-01
Event at 2035-09-08T11:48:9,2035-09-08
6/12/2026 giờ 0:8:6,2026-12-06
1994|03|29,1994-03-29
Sự kiện diễn ra vào 6/9/2034 21:42,2034-09-06
20271023153657843076,2027-10-23
1992-05-28T15:15:19.540060Z,1992-05-28
The system recorded 20051026092944,2005-10-26
Sự kiện diễn ra vào 20/9/1991 0:50,1991-09-20
10 tháng 9 năm 1997,1997-09-10
2024-10-03T03:32:50.174879Z,2024-10-03
23 Dec 2018,2018-12-23
1996-03-29T14:15:01Z+3,1996-03-29
1997-01-20T22:42:35.041387Z,1997-01-20
2016-04-01T09:30:02.630Z,2016-04-01
2016-06-28T18:56:29-05:00,2016-06-28
20270805003105392033930,2027-08-05
"October 13, 1992",1992-10-13
22 October 2022,2022-10-22
Ngày 15-5-2006,2006-05-15
2013.04.04,2013-04-04
1513270800000000000,2017-12-15
770058000000000,1994-05-28
Sự kiện diễn ra vào 25/12/1995 8:52,1995-12-25
20110109012227,2011-01-09
2024-11-29T15:44:58Z+3,2024-11-29
1990-01-03T02:42:41.880104Z,1990-01-03
670266000000000,1991-03-30
1994-04-02T05:40:49+2500,1994-04-02
2031/10/5T193033,2031-10-05
Sự kiện diễn ra vào 19/1/2009 15:27,2009-01-19
19970115093725077688,1997-01-15
2079882000,2035-11-29
1696352400,2023-10-04
40-7-2030,2030-07-20
1533574800000000000,2018-08-07
23 February 2006,2006-02-23
14-1-2004,2004-01-07
Sự kiện diễn ra vào 19/3/1995 20:18,1995-03-19
20160824214735690,2016-08-24
20210717102205616,2021-07-17
2010.08.03,2010-08-03
2014_07_13,2014-07-13
2027.06.03,2027-06-03
"4th of November, 2021",2021-11-04
The system recorded 20320705073145,2032-07-05
1993-03-27T23:43:31.136562844Z,1993-03-27
2004-04-06T23:16:19+2500,2004-04-06
1462035600000,2016-05-01
Event at 2017-08-14T15:59:59,2017-08-14
The system recorded 20240625114848,2024-06-25
1018285200000000000,2002-04-09
20-8-2013,2013-08-10
825008400,1996-02-23
"September 10, 2003",2003-09-10
22 October 1997,1997-10-22
20050205092804564921,2005-02-05
"16th of January, 2029",2029-01-16
1052845200000000,2003-05-14
17-9-2019,2019-09-17
2017-02-10T01:53:48.625583Z,2017-02-10
Event at 1999-10-14T2:47:27,1999-10-14
31 October 2008,2008-10-31
23_2_2010,2010-02-23
22 tháng 3 năm 2033,2033-03-22
Event at 2018-05-25T17:29:22,2018-05-25
Event at 2028-04-07T13:43:52,2028-04-07
2025-02-14T08:50:56.009Z,2025-02-14
2014/10/28T73627,2014-10-28
2024_03_26T22_57_38-0300,2024-03-26
21 tháng 2 năm 2016,2016-02-21
46-6-2030,2030-06-23
1997-06-23T12:17:52Z,1997-06-23
2020-04-04T18:05:11.467835Z,2020-04-04
2012_08_22T11_43_22+07:00,2012-08-22
2035-09-01T00:05:13,2035-09-01
"March 20, 2022",2022-03-20
1038675600,2002-12-01
1631206800000000,2021-09-10
20 August 1993,1993-08-20
03|31|2026,2026-03-31
20100918065214403,2010-09-18
20041113222643,2004-11-13
"May 27, 2013",2013-05-27
2010/3/23T114345,2010-03-23
2010-07-06T21:14:00.264Z,2010-07-06
"February 27, 2014",2014-02-27
29/14-2026,2026-07-29
2-11-2029,2029-11-02
13/12-2022,2022-06-13
40-9-2025,2025-09-20
1360342800000000000,2013-02-09
26.11.2017T3-1-51,2017-11-26
23.11.2001T2-45-52,2001-11-23
959187600000000000,2000-05-25
2020-10-29T11:17:57+2500,2020-10-29
20261207082900789555,2026-12-07
2013-06-03T06:26:27.130585560Z,2013-06-03
5/3/2017 giờ 8:13:23,2017-03-05
1996-02-09T21:51:59+2500,1996-02-09
1981818000000000000,2032-10-20
2007-10-13T05:07:21-0330,2007-10-13
Ngày 26-5-2003,2003-05-26
1990-01-12T01:18:43+2500,1990-01-12
20.10.1995T11-16-32,1995-10-20
"24th of December, 2015",2015-12-24
2027-10-11T18:29:56,2027-10-11
670611600000000,1991-04-03
02-14-2022,2022-02-14
8-2-2003,2003-02-04
27.2.2026T14-11-5,2026-02-27
8/12-2004,2004-06-08
"April 10, 2002",2002-04-10
19|9|2013,2013-09-19
Sự kiện diễn ra vào 23/3/1993 16:47,1993-03-23
2002/8/20T64426,2002-08-20
20331207201802181260993,2033-12-07
882205200000000000,1997-12-16
Ngày 6-8-2004,2004-08-06
20230411201638244,2023-04-11
1369069200000,2013-05-21
2010_09_27,2010-09-27
716749200000000000,1992-09-18
2002/9/1T63510,2002-09-01
Event at 2001-12-14T16:51:56,2001-12-14
4 8 1993,1993-08-04
1990_12_05,1990-12-05
6/6-2000,2000-03-06
2024_08_21,2024-08-21
24 February 2031,2031-02-24
2009-07-14T18:49:22.764Z,2009-07-14
2001-04-07T13:18:01,2001-04-07
1995/3/19T424,1995-03-19
"10th of January, 2034",2034-01-10
20170106040657797,2017-01-06
2015-03-20,2015-03-20
2031-09-25T18:53:01,2031-09-25
2020_04_17T20_36_50Z,2020-04-17
2015-12-20T17:51:26.031197Z,2015-12-20
7/6/2031,2031-06-07
19960728175216772281,1996-07-28
4 tháng 6 năm 2029,2029-06-04
28_07_29,2029-07-28
1997/02/25,1997-02-25
10/14-2011,2011-07-10
2030-04-10T14:23:57+2500,2030-04-10
2033-12-25T16:23:24.331Z,2033-12-25
2026/3/12T193350,2026-03-12
17-1-2023,2023-01-17
827946000000000000,1996-03-28
32-12-2012,2012-12-16
11 tháng 11 năm 2000,2000-11-11
4 tháng 5 năm 2029,2029-05-04
13 August 2004,2004-08-13
5 January 2000,2000-01-05
"11th of March, 2034",2034-03-11
5 tháng 9 năm 2007,2007-09-05
1687712400,2023-06-26
7 9 2005,2005-09-07
31|07|32,2032-07-31
20330103211137139,2033-01-03
2007-05-22T15:02:24+08,2007-05-22
28/2/2004 giờ 17:40:36,2004-02-28
20170623031232,2017-06-23
Sự kiện diễn ra vào 28/6/2032 20:32,2032-06-28
Ngày 22-3-2028,2028-03-22
1997-01-18T06:39:59,1997-01-18
2023_03_01T3_31_12Z,2023-03-01
20130226043813901938,2013-02-26
The system recorded 20240921223642,2024-09-21
"21th of October, 2006",2006-10-21
20140525162448,2014-05-25
ngày 27 tháng 5 năm 2014,2014-05-27
16_09_12,2012-09-16
"18th of April, 2035",2035-04-18
2006-03-15T16:06:35.341401Z,2006-03-15
11|19|2009,2009-11-19
20340326221623742511418,2034-03-26
07_18_2026,2026-07-18
16-11-2002,2002-11-16
2027_09_08T17_18_5-0300,2027-09-08
"August 12, 2004",2004-08-12
1993_02_02T21_32_55+07:00,1993-02-02
11-3-1998,1998-03-11
24.5.2022,2022-05-24
1991 03 19,1991-03-19
2003-03-10T15:05:03+2500,2003-03-10
1345050000000000,2012-08-16
14.7.2016,2016-07-14
1552755600,2019-03-17
ngày 4 tháng 10 năm 2032,2032-10-04
24 tháng 9 năm 2012,2012-09-24
2010-03-07T07:49:10,2010-03-07
ngày 21 tháng 8 năm 2024,2024-08-21
Ngày 13-8-2025,2025-08-13
Sự kiện diễn ra vào 21/10/2003 4:16,2003-10-21
1816275600,2027-07-23
2034_12_04T0_34_33+3,2034-12-04
18 February 2002,2002-02-18
1720803600,2024-07-13
2005|05|28,2005-05-28
20000213054906,2000-02-13
"30th of October, 2016",2016-10-30
1854118800000000000,2028-10-03
1999_10_03T7_7_48-0330,1999-10-03
The system recorded 19921103132845,1992-11-03
21 December 1992,1992-12-21
24 December 2026,2026-12-24
2003-08-22T09:46:41Z+3,2003-08-22
20321126045732793006,2032-11-26
2003-05-06T14:47:15,2003-05-06
29 Oct 2014,2014-10-29
27.4.2031T7-46-16,2031-04-27
18 04 25,2025-04-18
17/6/2018,2018-06-17
20051002052046647908,2005-10-02
20.5.1994T0-51-8,1994-05-20
Ngày 9-5-2034,2034-05-09
20221110223441679290,2022-11-10
3 Jul 2026,2026-07-03
672080400,1991-04-20
"March 20, 2014",2014-03-20
8 March 2032,2032-03-08
20130914015933908,2013-09-14
1497200400000,2017-06-12
2019-01-18T05:19:24Z+3,2019-01-18
2007-05-25T11:44:31,2007-05-25
19950609192859774802,1995-06-09
2037286800000,2034-07-24
1997-07-29T21:55:21.481Z,1997-07-29
19941109180047415,1994-11-09
20150317201211704,2015-03-17
06 08 30,2030-08-06
2002_04_20T20_43_19-0300,2002-04-20
1993-05-05T01:55:49Z+3,1993-05-05
1992 01 16,1992-01-16
2021 02 17,2021-02-17
1224522000000,2008-10-21
17/1/2009 giờ 14:25:0,2009-01-17
6-6-2032,2032-06-06
14 May 2022,2022-05-14
20110203010221117166,2011-02-03
28-1-2000,2000-01-14
2003_01_05T13_24_22Z,2003-01-05
2018/11/14T234327,2018-11-14
19961223233755277,1996-12-23
Ngày 19-9-2001,2001-09-19
11-7-2032,2032-07-11
30-1-1999,1999-01-15
19960311184732900472453,1996-03-11
19-1-1996,1996-01-19
1997_02_14T23_16_38-05:00,1997-02-14
50-4-2021,2021-04-25
20261215212111161154183,2026-12-15
2021-03-25T03:17:52Z+3,2021-03-25
2008-09-20T04:44:36,2008-09-20
31 July 2001,2001-07-31
Sự kiện diễn ra vào 23/5/2013 14:44,2013-05-23
10 Feb 1995,1995-02-10
2035-01-26T07:18:39Z+3,2035-01-26
20191227095707280,2019-12-27
1307898000000000,2011-06-13
30/24-2033,2033-12-30
Sự kiện diễn ra vào 3/7/2019 21:24,2019-07-03
1990-01-15T10:45:58.223035061Z,1990-01-15
31/12/2009 giờ 22:52:10,2009-12-31
Event at 2000-02-12T21:56:24,2000-02-12
1991/5/11T193247,1991-05-11
Event at 1997-10-06T5:52:43,1997-10-06
1152378000000000000,2006-07-09
12.23.2009,2009-12-23
7-10-2033,2033-10-07
1/18-2001,2001-09-01
The system recorded 20180318083152,2018-03-18
The system recorded 20130530004606,2013-05-30
18/06/13,2013-06-18
ngày 18 tháng 9 năm 2026,2026-09-18
46-8-2006,2006-08-23
2011.11.09,2011-11-09
2028-01-19T02:07:54+2500,2028-01-19
2006-05-21T10:10:18.175Z,2006-05-21
1052586000000000,2003-05-11
2 Dec 2002,2002-12-02
20040805075005,2004-08-05
Event at 2010-09-29T5:56:48,2010-09-29
Sự kiện diễn ra vào 11/8/1991 9:45,1991-08-11
20310516225021719684,2031-05-16
The system recorded 20250210211121,2025-02-10
08/11/1996,1996-08-11
1997-09-17T09:44:06,1997-09-17
20271228020819775010,2027-12-28
1569949200,2019-10-02
Ngày 1-11-2005,2005-11-01
797446800000,1995-04-10
2029.10.11,2029-10-11
Sự kiện diễn ra vào 5/3/2022 7:27,2022-03-05
1836320400000000,2028-03-11
Ngày 13-1-1990,1990-01-13
50-6-2016,2016-06-25
20080701040839993,2008-07-01
12-1-2023,2023-01-06
4/2/2013 giờ 19:12:33,2013-02-04
22-8-2025,2025-08-22
27 Oct 2026,2026-10-27
17 3 2013,2013-03-17
"28th of May, 2019",2019-05-28
1639674000,2021-12-17
13 Oct 2033,2033-10-13
2020-11-16T12:41:59,2020-11-16
1224522000,2008-10-21
1668013200000000000,2022-11-10
1912352400000000,2030-08-08
Ngày 7-3-2029,2029-03-07
2012_05_05T21_34_33-0330,2012-05-05
15/6/2035 giờ 1:53:7,2035-06-15
2027_09_11T23_44_22Z,2027-09-11
2033 06 06,2033-06-06
Sự kiện diễn ra vào 7/1/2035 23:22,2035-01-07
2002.07.02,2002-07-02
20300802024746950155,2030-08-02
The system recorded 19900729220045,1990-07-29
2031-01-28T22:04:53.469655Z,2031-01-28
The system recorded 20051008190705,2005-10-08
8/1/2002 giờ 6:9:15,2002-01-08
Event at 2019-12-23T1:17:26,2019-12-23
17/14-1993,1993-07-17
7|11|1997,1997-11-07
1083603600000000000,2004-05-04
Sự kiện diễn ra vào 21/12/2021 13:58,2021-12-21
1447693200,2015-11-17
2014-10-18T02:35:36,2014-10-18
1473354000,2016-09-09
"9th of May, 1993",1993-05-09
20060911011216343972,2006-09-11
Event at 2027-04-29T20:49:25,2027-04-29
740422800000,1993-06-19
Sự kiện diễn ra vào 6/6/2022 22:41,2022-06-06
Ngày 5-8-2023,2023-08-05
Sự kiện diễn ra vào 25/3/1993 11:3,1993-03-25
29 Mar 1991,1991-03-29
"April 12, 2013",2013-04-12
19910510212733709611,1991-05-10
1995/10/18T115626,1995-10-18
20291102150125361,2029-11-02
26 October 2021,2021-10-26
1997-06-02T11:20:48.819869425Z,1997-06-02
The system recorded 19930205203451,1993-02-05
20 February 2012,2012-02-20
772477200000000,1994-06-25
ngày 9 tháng 2 năm 2005,2005-02-09
2008/02/19,2008-02-19
03|12|1990,1990-03-12
1663693200,2022-09-21
28/22-2031,2031-11-28
"May 2, 1992",1992-05-02
2011-03-19T08:34:30.943211Z,2011-03-19
20201109102351163040,2020-11-09
16 Nov 2022,2022-11-16
Ngày 12-6-2005,2005-06-12
"19th of April, 2030",2030-04-19
Ngày 24-2-2031,2031-02-24
1998-01-30T19:29:51Z,1998-01-30
ngày 2 tháng 4 năm 2015,2015-04-02
Event at 2002-09-14T2:7:36,2002-09-14
"10th of May, 1996",1996-05-10
2030-12-31T14:36:56-0300,2030-12-31
The system recorded 19980502140559,1998-05-02
2018_08_26T17_2_19+3,2018-08-26
2003-02-22T00:09:27+2500,2003-02-22
15_1_2035,2035-01-15
1448384400000000,2015-11-25
12-2-1995,1995-02-12
1498323600000000,2017-06-25
24-7-2014,2014-07-24
The system recorded 19910126113707,1991-01-26
2019 09 01,2019-09-01
Ngày 16-10-2004,2004-10-16
20150216065844,2015-02-16
2031/9/14T112223,2031-09-14
6.2.2025T2-30-11,2025-02-06
14/1/2022 giờ 10:51:55,2022-01-14
15 tháng 9 năm 2013,2013-09-15
1963760400,2032-03-25
"29th of December, 2026",2026-12-29
08_01_34,2034-01-08
Ngày 18-12-2005,2005-12-18
1965142800000000,2032-04-10
10-7-2010,2010-07-10
1783270800,2026-07-06
05 13 2010,2010-05-13
2027-06-08T22:10:15.071625565Z,2027-06-08
2007-01-17T16:27:43+2500,2007-01-17
2021-09-10T18:27:54+2500,2021-09-10
2017/9/29T1524,2017-09-29
20291219131149111499653,2029-12-19
8/6-2011,2011-03-08
The system recorded 20110723143832,2011-07-23
2012/6/27T182713,2012-06-27
The system recorded 20121203160307,2012-12-03
4|5|2013,2013-05-04
1230742800,2009-01-01
1 tháng 2 năm 2023,2023-02-01
The system recorded 19981112033030,1998-11-12
1165251600000000,2006-12-05
2014/7/18T154933,2014-07-18
12-12-2014,2014-12-12
"27th of April, 2031",2031-04-27
24.5.2008T3-14-1,2008-05-24
892659600000000000,1998-04-16
2035/3/8T65610,2035-03-08
1882544400,2029-08-28
36-4-2003,2003-04-18
9 Jun 2027,2027-06-09
01_24_1999,1999-01-24
"2nd of September, 2009",2009-09-02
18/8/2002 giờ 5:50:9,2002-08-18
1998-08-12T17:06:06Z+3,1998-08-12
2010/9/18T103910,2010-09-18
2005/1/18T3179,2005-01-18
The system recorded 20120716133940,2012-07-16
10 Mar 2032,2032-03-10
19940625054230621,1994-06-25
6.2.2000T2-19-44,2000-02-06
23/2/1991 giờ 0:32:9,1991-02-23
2000-09-21T04:33:18.659147785Z,2000-09-21
1/5/2013 giờ 14:5:17,2013-05-01
9/6-2016,2016-03-09
"January 8, 2028",2028-01-08
06 27 2009,2009-06-27
Ngày 30-7-2012,2012-07-30
1899910800000,2030-03-17
1788800400000,2026-09-08
1327770000,2012-01-29
34-4-2031,2031-04-17
13 Apr 1998,1998-04-13
Event at 2006-12-16T16:32:29,2006-12-16
25.10.2008T12-17-28,2008-10-25
2012-07-01T23:34:54.647Z,2012-07-01
1668963600000000000,2022-11-21
40-11-1991,1991-11-20
7 Dec 2014,2014-12-07
2021-06-22T23:56:28+2500,2021-06-22
Ngày 26-11-2011,2011-11-26
2028-10-31T15:25:24+2500,2028-10-31
1987347600,2032-12-23
2023-05-28T22:09:21.012Z,2023-05-28
20070518223314210341711,2007-05-18
2020-05-05T04:39:21-0300,2020-05-05
2000-06-12T04:36:04Z+3,2000-06-12
1993|12|07,1993-12-07
1325696400000000000,2012-01-05
2 Sep 1997,1997-09-02
1415293200000000,2014-11-07
1374253200000000000,2013-07-20
1995-01-15T22:11:02Z+3,1995-01-15
"18th of March, 2000",2000-03-18
2030-05-10T21:47:38+2500,2030-05-10
20|10|1997,1997-10-20
"March 22, 2027",2027-03-22
7 tháng 2 năm 2024,2024-02-07
18-1-2025,2025-01-18
25 May 1995,1995-05-25
2033_12_18,2033-12-18
2035-03-06T00:52:07.083241Z,2035-03-06
02.02.2003,2003-02-02
ngày 25 tháng 6 năm 2024,2024-06-25
13/11/1997 giờ 20:22:22,1997-11-13
"January 25, 2014",2014-01-25
The system recorded 20310526020609,2031-05-26
2000-11-11T05:18:37.936Z,2000-11-11
Event at 1994-05-14T10:54:44,1994-05-14
06_14_1994,1994-06-14
1111251600,2005-03-20
14.2.1991T2-57-32,1991-02-14
1341939600000000,2012-07-11
26-11-2035,2035-11-26
2027-11-24T23:53:16+2500,2027-11-24
2032-11-30T16:12:42.993590408Z,2032-11-30
06|03|00,2000-03-06
32-2-2020,2020-02-16
829587600000,1996-04-16
1837270800,2028-03-22
1739293200000,2025-02-12
12.7.2001,2001-07-12
19931213212205496,1993-12-13
2000-12-02T19:36:03Z+3,2000-12-02
10-12-99,1999-12-10
42-6-2006,2006-06-21
12 tháng 5 năm 2005,2005-05-12
2001/7/1T173920,2001-07-01
Event at 2034-12-19T6:4:5,2034-12-19
31 March 2029,2029-03-31
1990-08-11T20:51:50.057475581Z,1990-08-11
Event at 2028-09-27T23:53:4,2028-09-27
7 tháng 12 năm 2013,2013-12-07
2021/3/30T193120,2021-03-30
1845133200000000000,2028-06-21
23_5_1998,1998-05-23
28-1-2020,2020-01-14
2007-09-23T21:14:10+2500,2007-09-23
"December 26, 2027",2027-12-26
Ngày 13-8-2032,2032-08-13
04.13.2026,2026-04-13
15 tháng 12 năm 2011,2011-12-15
The system recorded 19971224231257,1997-12-24
1986829200,2032-12-17
1010422800000000000,2002-01-08
2005-06-19T21:38:59,2005-06-19
2005-09-10T05:51:45+2500,2005-09-10
"February 6, 2015",2015-02-06
1997/12/3T113826,1997-12-03
Sự kiện diễn ra vào 30/5/2030 0:44,2030-05-30
14 March 2020,2020-03-14
20140619172347,2014-06-19
The system recorded 19990603155057,1999-06-03
Event at 2028-09-03T14:58:11,2028-09-03
2 tháng 3 năm 2025,2025-03-02
2012_11_15T4_56_23-0330,2012-11-15
2032_06_12,2032-06-12
The system recorded 20301023162115,2030-10-23
20321029184546,2032-10-29
29 tháng 4 năm 2031,2031-04-29
2024/5/11T22852,2024-05-11
2000-02-10T01:11:27.427750948Z,2000-02-10
Event at 2004-01-22T20:55:18,2004-01-22
24 07 97,1997-07-24
1586106000000000,2020-04-06
15 tháng 1 năm 2005,2005-01-15
20211207121823076677,2021-12-07
Sự kiện diễn ra vào 7/4/1998 22:22,1998-04-07
2007_11_30T17_22_38+08,2007-11-30
16 3 2005,2005-03-16
639594000000,1990-04-09
2001/8/30T233050,2001-08-30
1763053200000000000,2025-11-14
20201011085630,2020-10-11
06|17|2001,2001-06-17
15/12-2032,2032-06-15
"April 8, 2017",2017-04-08
2001-08-23T02:49:57-05:00,2001-08-23
1936458000000000,2031-05-14
11/7/2019 giờ 4:35:30,2019-07-11
01 05 2016,2016-01-05
2014/5/16T121741,2014-05-16
"19th of April, 2025",2025-04-19
20120512104038368899,2012-05-12
2017-04-20T07:08:31+2500,2017-04-20
13-11-13,2013-11-13
2000|10|08,2000-10-08
19 February 1992,1992-02-19
25 Feb 2019,2019-02-25
2025-02-04,2025-02-04
ngày 5 tháng 3 năm 2023,2023-03-05
2023_05_18T7_27_38+3,2023-05-18
1999962000,2033-05-18
The system recorded 20020529125033,2002-05-29
20091217182027708943,2009-12-17
20250317142130,2025-03-17
25/18-2034,2034-09-25
14 April 2031,2031-04-14
19930918032534403903311,1993-09-18
20070514165419957,2007-05-14
ngày 3 tháng 5 năm 2014,2014-05-03
1.6.2020,2020-06-01
2024-09-22T04:49:31,2024-09-22
2003-02-28T02:00:58.657922854Z,2003-02-28
02|19|2008,2008-02-19
1995/9/23T20547,1995-09-23
"16th of June, 2017",2017-06-16
The system recorded 20241021082127,2024-10-21
2 April 2005,2005-04-02
2/12/2004 giờ 16:3:53,2004-12-02
2024-10-03T06:55:41Z+3,2024-10-03
1354381200000000000,2012-12-02
2007-06-12T23:14:19.885032089Z,2007-06-12
2031-11-08T08:28:20.199Z,2031-11-08
1211821200000000000,2008-05-27
20330329205905016410134,2033-03-29
1152723600,2006-07-13
20060401165347,2006-04-01
13-8-1998,1998-08-13
14/12/2025 giờ 6:23:31,2025-12-14
1398618000000000000,2014-04-28
2001-01-10T10:45:43+0500,2001-01-10
19980820030511807,1998-08-20
3/14-2002,2002-07-03
1117904400000,2005-06-05
48-6-2011,2011-06-24
22 tháng 6 năm 1992,1992-06-22
19921107000030,1992-11-07
1998-03-10T10:33:52+2500,1998-03-10
2026-10-31T10:42:01.765591397Z,2026-10-31
20351009135331162266,2035-10-09
28|10|31,2031-10-28
24.9.2032T2-14-10,2032-09-24
2033-07-04T06:24:48.146308Z,2033-07-04
20250609130314869,2025-06-09
2008-01-13T01:44:32Z+3,2008-01-13
Sự kiện diễn ra vào 21/11/1999 3:33,1999-11-21
1990-06-15T10:46:47Z,1990-06-15
Ngày 23-5-2006,2006-05-23
17/20-1993,1993-10-17
The system recorded 20010901024540,2001-09-01
"9th of April, 2026",2026-04-09
1087578000,2004-06-19
ngày 13 tháng 11 năm 1991,1991-11-13
1997-02-07T13:52:06.361Z,1997-02-07
2025-06-06T23:59:41.586552098Z,2025-06-06
2026/5/16T133020,2026-05-16
2018_01_19T3_29_47+00:00,2018-01-19
2005/10/27T011,2005-10-27
20240820094825459450988,2024-08-20
Sự kiện diễn ra vào 1/9/2006 8:44,2006-09-01
26/9/1994 giờ 6:38:39,1994-09-26
1985014800,2032-11-26
1991-02-09T13:49:30+2500,1991-02-09
909853200000000000,1998-11-01
27/10-2015,2015-05-27
19940614074000,1994-06-14
31 Jul 2024,2024-07-31
The system recorded 19951207183909,1995-12-07
"17th of July, 2018",2018-07-17
10 Jun 1994,1994-06-10
54-8-2008,2008-08-27
1605546000000000,2020-11-17
1999-10-03T22:53:10+2500,1999-10-03
8/6-2015,2015-03-08
2073574800,2035-09-17
10/02/2003,2003-10-02
2030-10-27T02:08:44,2030-10-27
ngày 20 tháng 9 năm 2023,2023-09-20
40-12-2034,2034-12-20
2021-09-04T22:10:19.379Z,2021-09-04
Event at 2021-05-15T8:12:42,2021-05-15
08|07|01,2001-07-08
07|10|14,2014-10-07
20231019225159957,2023-10-19
20061111011637817775753,2006-11-11
Sự kiện diễn ra vào 20/1/2001 18:39,2001-01-20
The system recorded 20111023093319,2011-10-23
10-10-16,2016-10-10
27|3|2020,2020-03-27
2022/5/20T82651,2022-05-20
965322000,2000-08-04
Sự kiện diễn ra vào 28/12/2029 11:2,2029-12-28
29 February 1992,1992-02-29
12/01/12,2012-01-12
2002-11-01T07:12:12Z+3,2002-11-01
8.11.2023T2-33-50,2023-11-08
2011|08|05,2011-08-05
ngày 14 tháng 10 năm 1998,1998-10-14
1206896400000000,2008-03-31
Event at 2019-07-28T9:42:34,2019-07-28
24-5-2003,2003-05-24
01 16 2019,2019-01-16
2021-01-03T12:11:40.015Z,2021-01-03
19970828092917,1997-08-28
11 December 2023,2023-12-11
1795885200000000,2026-11-29
18/09/91,1991-09-18
16 May 2001,2001-05-16
Event at 2010-09-30T23:29:47,2010-09-30
"January 26, 1993",1993-01-26
22 tháng 9 năm 2033,2033-09-22
11 May 2000,2000-05-11
"November 6, 2035",2035-11-06
2028/11/25T154246,2028-11-25
"April 23, 2029",2029-04-23
Sự kiện diễn ra vào 16/11/2021 12:3,2021-11-16
20 tháng 2 năm 2001,2001-02-20
2015-11-23T11:30:13.900349595Z,2015-11-23
Sự kiện diễn ra vào 9/7/2010 7:31,2010-07-09
2017-12-23T09:56:32.519580Z,2017-12-23
1780160400000000,2026-05-31
2024-06-12T20:15:33-0330,2024-06-12
3.5.1997T18-46-33,1997-05-03
2007-01-20T15:14:53.827Z,2007-01-20
"February 26, 2030",2030-02-26
2020-12-22T08:00:16.174812068Z,2020-12-22
"7th of May, 1992",1992-05-07
1992-12-13T09:56:41.708309189Z,1992-12-13
1777222800000000000,2026-04-27
2028-03-16T06:44:51.067Z,2028-03-16
2002-02-15T08:22:28Z+3,2002-02-15
20090918115934,2009-09-18
2004-10-29T17:44:31.685033988Z,2004-10-29
1994-05-27T14:58:20,1994-05-27
15 June 1998,1998-06-15
20/2-2009,2009-01-20
2003245200000,2033-06-25
8/18-2028,2028-09-08
1996_05_06T6_43_8-0300,1996-05-06
The system recorded 20020322054719,2002-03-22
"5th of November, 2026",2026-11-05
The system recorded 20051101033755,2005-11-01
20141228135701421,2014-12-28
1453827600000000000,2016-01-27
2034-04-04T10:29:47.165660Z,2034-04-04
2026-09-24T04:43:21-0300,2026-09-24
Sự kiện diễn ra vào 17/3/1996 9:27,1996-03-17
03|29|2000,2000-03-29
13 November 2028,2028-11-13
1996-05-11T15:14:25Z+3,1996-05-11
1992-04-29T21:59:03Z,1992-04-29
736966800000000,1993-05-10
1994.02.16,1994-02-16
13/22-2012,2012-11-13
721501200000000,1992-11-12
29.8.2018T3-4-20,2018-08-29
27 Jun 2030,2030-06-27
"July 26, 1993",1993-07-26
22 May 1993,1993-05-22
Sự kiện diễn ra vào 30/4/2035 12:15,2035-04-30
648579600000000,1990-07-22
2000-08-14T03:55:58Z+3,2000-08-14
1998/02/04,1998-02-04
2006-05-28T11:50:30Z+3,2006-05-28
2017-04-08T08:47:25+00:00,2017-04-08
"9th of December, 2035",2035-12-09
2003-11-22T20:44:10Z+3,2003-11-22
28/1/2029 giờ 22:46:7,2029-01-28
29-12-2021,2021-12-29
20101028151800414,2010-10-28
21.12.2021T15-29-27,2021-12-21
30.4.2029T13-58-40,2029-04-30
2031-01-23T07:19:52,2031-01-23
9 Jul 1993,1993-07-09
2031_08_17T11_31_5+00:00,2031-08-17
29 Oct 2022,2022-10-29
31/10/2009,2009-10-31
31 Jul 2019,2019-07-31
The system recorded 19930626072511,1993-06-26
1990-05-15T16:55:08Z+3,1990-05-15
1232470800,2009-01-21
14 March 2002,2002-03-14
932749200000000000,1999-07-24
1992-06-01T03:32:03.928Z,1992-06-01
12 Aug 1993,1993-08-12
1391878800000,2014-02-09
06_08_16,2016-08-06
31 Jul 2003,2003-07-31
Event at 2023-05-29T12:58:19,2023-05-29
16 Apr 2007,2007-04-16
2021/07/07,2021-07-07
2006-05-27T08:24:45.975748206Z,2006-05-27
20080629105129,2008-06-29
2031-07-02T07:41:17.897Z,2031-07-02
The system recorded 19970407201716,1997-04-07
"8th of May, 1991",1991-05-08
2000-08-01T23:05:12.741841474Z,2000-08-01
58-10-2005,2005-10-29
20/2-2009,2009-01-20
Sự kiện diễn ra vào 10/8/1996 22:11,1996-08-10
644605200000,1990-06-06
2018_01_10T2_33_59-05:00,2018-01-10
"November 1, 2005",2005-11-01
19910205134937040089390,1991-02-05
Event at 1999-06-07T7:34:55,1999-06-07
2026-01-08T03:38:43+2500,2026-01-08
9/11/2031 giờ 5:7:19,2031-11-09
2010-05-06T17:40:17,2010-05-06
1996|07|19,1996-07-19
11.11.31,2031-11-11
2017 12 27,2017-12-27
2021_02_10T11_34_11+07:00,2021-02-10
"August 22, 2035",2035-08-22
1773162000000000000,2026-03-11
24/2-2028,2028-01-24
2019-11-26T14:48:22.398388618Z,2019-11-26
2033-08-12T05:03:19Z+3,2033-08-12
18|02|00,2000-02-18
2003-04-04T14:36:16+2500,2003-04-04
1147626000000,2006-05-15
24.12.1994,1994-12-24
14/8-2003,2003-04-14
20270503142349040,2027-05-03
748198800000000000,1993-09-17
1071853200000000000,2003-12-20
11/1/2032 giờ 12:24:20,2032-01-11
2035-10-14T01:39:43-0330,2035-10-14
2007/9/24T123613,2007-09-24
20020406130901699,2002-04-06
9/3/2005 giờ 2:10:33,2005-03-09
10/7/2034 giờ 8:44:1,2034-07-10
03|01|2003,2003-03-01
5/18-2029,2029-09-05
62-5-2006,2006-05-31
6 Jun 1995,1995-06-06
1999_05_22,1999-05-22
832957200000000,1996-05-25
20070703090635952,2007-07-03
Event at 2006-10-18T0:18:50,2006-10-18
19990727015453995369455,1999-07-27
23-2-2015,2015-02-23
"August 4, 2005",2005-08-04
2015-07-22T23:07:55+2500,2015-07-22
"29th of July, 1999",1999-07-29
21.9.2027T3-30-19,2027-09-21
2027-04-15T17:08:30.913861Z,2027-04-15
"24th of November, 2004",2004-11-24
2003-04-13T15:04:04+2500,2003-04-13
20220714142117756525,2022-07-14
2007/9/29T1545,2007-09-29
2012-08-24T14:01:17.564Z,2012-08-24
710355600000000000,1992-07-06
The system recorded 20190816083810,2019-08-16
2005_09_27T20_15_29Z,2005-09-27
1990-12-13T09:02:34Z+3,1990-12-13
Ngày 26-8-2008,2008-08-26
1164560400000,2006-11-27
25.12.2002T17-29-34,2002-12-25
26/6/2034 giờ 20:11:54,2034-06-26
2035-09-02T13:30:44,2035-09-02
2026-04-20T06:14:07.915Z,2026-04-20
56-6-2004,2004-06-28
2018-04-02T13:14:46.517090597Z,2018-04-02
18/8-2030,2030-04-18
2017-08-15T21:16:15-0300,2017-08-15
Sự kiện diễn ra vào 16/7/2015 11:32,2015-07-16
30-12-1995,1995-12-30
20310429120307553,2031-04-29
1278435600000000,2010-07-07
19911221064714287618177,1991-12-21
1727542800,2024-09-29
20081030162617948472,2008-10-30
20040220143912964,2004-02-20
2000-03-28T02:54:10,2000-03-28
ngày 15 tháng 4 năm 2011,2011-04-15
3 tháng 2 năm 1990,1990-02-03
2006/06/14,2006-06-14
"12th of December, 2013",2013-12-12
28 Jun 2031,2031-06-28
24/4-2026,2026-02-24
28/2-2006,2006-01-28
19 April 2007,2007-04-19
16/22-2007,2007-11-16
2016-03-23T09:42:17.396042651Z,2016-03-23
2009-11-12T17:36:31+2500,2009-11-12
27 February 2022,2022-02-27
27.6.2011T1-16-12,2011-06-27
"24th of August, 2007",2007-08-24
"13th of June, 2019",2019-06-13
"5th of March, 2034",2034-03-05
2027-12-29T19:16:32Z+3,2027-12-29
01/02/2005,2005-01-02
1994-01-02T06:10:17.593295567Z,1994-01-02
Ngày 5-11-2031,2031-11-05
2024_10_29T14_24_37+3,2024-10-29
14-3-2027,2027-03-14
3/14-2029,2029-07-03
12-10-1990,1990-10-06
20170620211505186322,2017-06-20
24-8-1992,1992-08-12
20201012215638621207569,2020-10-12
14-12-2022,2022-12-14
1755363600000,2025-08-17
20220115092056339,2022-01-15
23/24-1992,1992-12-23
The system recorded 20290804040155,2029-08-04
1089392400000000,2004-07-10
1333386000000000,2012-04-03
2005-09-05T04:18:43,2005-09-05
1990-05-22T10:45:09.091977Z,1990-05-22
1743699600,2025-04-04
12 May 2000,2000-05-12
2028-08-26T12:29:28.657724857Z,2028-08-26
2021-09-08T20:44:50.510876Z,2021-09-08
19940628120804767,1994-06-28
2028-08-03T16:27:53-0330,2028-08-03
20101202160214332906,2010-12-02
6-12-2006,2006-12-06
"5th of July, 2012",2012-07-05
2032_06_13T16_40_20+07:00,2032-06-13
Ngày 10-9-2005,2005-09-10
"May 1, 2030",2030-05-01
1577811600000000000,2020-01-01
The system recorded 20170224223507,2017-02-24
1993-04-19T17:45:56.581881677Z,1993-04-19
1998_04_14T12_32_53Z+3,1998-04-14
12_6_1999,1999-06-12
20000620160413842754,2000-06-20
20140818094653,2014-08-18
1197392400000000,2007-12-12
28 Oct 2001,2001-10-28
20070327103440,2007-03-27
5.11.1999T9-7-9,1999-11-05
930848400,1999-07-02
2007-03-16T15:47:29Z+3,2007-03-16
19911026192835,1991-10-26
2026-12-23T07:08:44.594Z,2026-12-23
07|13|2024,2024-07-13
Event at 2000-03-05T1:29:32,2000-03-05
19991127165753,1999-11-27
Sự kiện diễn ra vào 28/4/2035 20:28,2035-04-28
1996-03-07T10:05:14.846Z,1996-03-07
Ngày 7-11-2035,2035-11-07
16/22-2030,2030-11-16
27.5.2028T1-16-31,2028-05-27
2026.04.22,2026-04-22
24/4/2032 giờ 9:43:48,2032-04-24
"22th of August, 1996",1996-08-22
21-8-2018,2018-08-21
2012-10-07T10:32:56.023299Z,2012-10-07
20020324231700,2002-03-24
2034-07-08T13:16:27+2500,2034-07-08
19950202064503,1995-02-02
21/14-2021,2021-07-21
26-8-2030,2030-08-13
18-2-1993,1993-02-09
1758906000000,2025-09-27
789325200000,1995-01-06
1540227600000000000,2018-10-23
2023-01-08T18:25:33.454039Z,2023-01-08
1996-05-29T10:52:56.681934Z,1996-05-29
2006-12-02T19:34:53,2006-12-02
1997-04-15T18:20:21+00:00,1997-04-15
17 May 2009,2009-05-17
20040318015317878,2004-03-18
04-11-2000,2000-04-11
08-07-1994,1994-08-07
2014-04-17T17:47:53Z+3,2014-04-17
13 Jul 1996,1996-07-13
17 Apr 1994,1994-04-17
3/11/2005 giờ 1:43:50,2005-11-03
The system recorded 20010715125339,2001-07-15
2030-03-19T17:50:51.110781502Z,2030-03-19
1|3|2005,2005-03-01
The system recorded 20000825062115,2000-08-25
859222800000000000,1997-03-25
24/9/2030 giờ 4:12:2,2030-09-24
19950107164115588,1995-01-07
6/2/1994 giờ 18:15:15,1994-02-06
1862586000000000,2029-01-09
2019-10-05T23:23:49-05:00,2019-10-05
10 September 2020,2020-09-10
1761757200000,2025-10-30
17 Jul 2020,2020-07-17
2011-06-12T10:15:39.466239Z,2011-06-12
Event at 2035-05-26T1:3:37,2035-05-26
"18th of May, 1994",1994-05-18
Event at 2017-05-08T15:51:27,2017-05-08
1805821200000,2027-03-24
2032-08-29T12:52:50.746372614Z,2032-08-29
2024-07-06T21:41:33.402826Z,2024-07-06
Ngày 22-5-1994,1994-05-22
ngày 20 tháng 8 năm 1998,1998-08-20
ngày 11 tháng 5 năm 1995,1995-05-11
"4th of January, 2033",2033-01-04
20170926015943239472,2017-09-26
2002-08-15T00:14:44Z+3,2002-08-15
12 22 1998,1998-12-22
12-1-2006,2006-01-12
1989939600000000,2033-01-22
"October 23, 2030",2030-10-23
2|9|2028,2028-09-02
24-8-2031,2031-08-12
07.03.2001,2001-07-03
ngày 3 tháng 10 năm 2033,2033-10-03
21/6/1992 giờ 3:20:13,1992-06-21
"April 1, 2002",2002-04-01
19950330123134184270,1995-03-30
1197738000000,2007-12-16
ngày 25 tháng 2 năm 1997,1997-02-25
1997 08 12,1997-08-12
4 October 1993,1993-10-04
18.2.2022T19-32-11,2022-02-18
23 tháng 8 năm 1996,1996-08-23
Sự kiện diễn ra vào 13/1/2009 17:27,2009-01-13
20150812095336,2015-08-12
25 2 2006,2006-02-25
2018-04-21T01:36:35.018060060Z,2018-04-21
Ngày 12-10-2005,2005-10-12
1 Dec 2029,2029-12-01
20210414174156492128957,2021-04-14
44-12-2030,2030-12-22
The system recorded 19951123045809,1995-11-23
2009-07-14T17:06:12Z+3,2009-07-14
2004-01-24T02:49:54.379Z,2004-01-24
18 04 21,2021-04-18
25/2/1999 giờ 0:33:2,1999-02-25
2027|06|01,2027-06-01
20290415031258004,2029-04-15
19_04_93,1993-04-19
25 4 2014,2014-04-25
6 Jul 2023,2023-07-06
1396717200,2014-04-06
29-5-2011,2011-05-29
1730566800000,2024-11-03
17/12-2020,2020-06-17
2028-03-12T12:38:06Z+3,2028-03-12
30 June 1994,1994-06-30
1995_05_13,1995-05-13
2006_08_26T18_10_21+2500,2006-08-26
20201229040106,2020-12-29
6-10-2024,2024-10-06
2021-07-26T05:20:48,2021-07-26
2007-06-09T10:19:03,2007-06-09
27 August 1997,1997-08-27
2024-02-24T22:25:30.216570Z,2024-02-24
2006-03-07T23:33:55+2500,2006-03-07
The system recorded 20261115035510,2026-11-15
12/4/2022 giờ 18:38:48,2022-04-12
2003/4/20T16200,2003-04-20
2031-04-27T02:51:38.176519Z,2031-04-27
The system recorded 20340726165819,2034-07-26
Event at 2018-04-07T4:48:56,2018-04-07
4/22-2004,2004-11-04
6/8/2021 giờ 12:46:21,2021-08-06
20280715010107927706,2028-07-15
1389286800000000,2014-01-10
2008-07-22T23:35:14+00:00,2008-07-22
2032-01-24T13:46:29+08,2032-01-24
1078592400000000,2004-03-07
29 July 2014,2014-07-29
21.6.2007T16-24-25,2007-06-21
The system recorded 19911229173912,1991-12-29
2016/5/30T20466,2016-05-30
20141118041356500,2014-11-18
1996-05-15T17:58:02Z+3,1996-05-15
20190803183354199393,2019-08-03
3 tháng 6 năm 1998,1998-06-03
2028-11-08T21:54:39+3,2028-11-08
The system recorded 19970225133341,1997-02-25
1492621200000000,2017-04-20
ngày 18 tháng 12 năm 1995,1995-12-18
2020-08-21T01:58:16,2020-08-21
987526800000,2001-04-18
21/4-2027,2027-02-21
Ngày 17-6-2017,2017-06-17
1657818000,2022-07-15
The system recorded 20270105095354,2027-01-05
1390150800000000000,2014-01-20
2020-04-20T08:13:01.169544Z,2020-04-20
20280716163600302,2028-07-16
2031/12/21T19931,2031-12-21
20_10_2030,2030-10-20
19960129160843,1996-01-29
7 tháng 3 năm 2009,2009-03-07
7/8-2009,2009-04-07
"30th of January, 2025",2025-01-30
2006_03_11T7_25_13-0330,2006-03-11
20220202073714278097739,2022-02-02
1066496400000000000,2003-10-19
824058000,1996-02-12
15 January 2020,2020-01-15
Sự kiện diễn ra vào 10/12/2000 12:8,2000-12-10
Sự kiện diễn ra vào 31/3/1999 14:41,1999-03-31
"May 29, 2012",2012-05-29
Event at 2029-05-29T14:5:24,2029-05-29
22 Jan 2003,2003-01-22
20201011233815,2020-10-11
2034_11_18T11_9_55Z+3,2034-11-18
10.3.1997T17-58-40,1997-03-10
The system recorded 19941107071104,1994-11-07
1472749200000000000,2016-09-02
"October 3, 2012",2012-10-03
2006-12-13T23:25:45.762798366Z,2006-12-13
2028/01/11,2028-01-11
46-11-2007,2007-11-23
2006_08_04T21_1_38+08,2006-08-04
1107968400,2005-02-10
863110800000,1997-05-09
2023-04-23T02:06:41.584151670Z,2023-04-23
2010 11 25,2010-11-25
02-21-2031,2031-02-21
"29th of June, 2011",2011-06-29
20_10_2033,2033-10-20
2017-11-15T02:25:37,2017-11-15
ngày 12 tháng 11 năm 2011,2011-11-12
"2nd of November, 2006",2006-11-02
19.10.2034T5-45-42,2034-10-19
30-10-2024,2024-10-30
29.5.2013T11-19-57,2013-05-29
2024/9/11T204332,2024-09-11
9/16-2022,2022-08-09
10/18-2005,2005-09-10
2025-05-13T19:07:54.418301110Z,2025-05-13
7 tháng 1 năm 2003,2003-01-07
ngày 31 tháng 5 năm 2002,2002-05-31
1721667600,2024-07-23
13/01/15,2015-01-13
Sự kiện diễn ra vào 25/2/2004 10:17,2004-02-25
20180708232821953340772,2018-07-08
1999-07-15T12:08:39+2500,1999-07-15
1772211600,2026-02-28
1993-09-22T05:40:07+2500,1993-09-22
"September 7, 2003",2003-09-07
"July 1, 2011",2011-07-01
20221219193244,2022-12-19
2017/10/24T03124,2017-10-24
11-12-1990,1990-12-11
8-11-2021,2021-11-04
769798800000,1994-05-25
19950113163130,1995-01-13
"27th of June, 2014",2014-06-27
13 June 2013,2013-06-13
2008_10_21T19_2_7-05:00,2008-10-21
Event at 1993-04-22T21:22:52,1993-04-22
The system recorded 20140627050107,2014-06-27
28 tháng 5 năm 2023,2023-05-28
2-1-2002,2002-01-02
2025-04-28T00:05:47+2500,2025-04-28
2027-12-07T01:50:11Z+3,2027-12-07
16 May 1994,1994-05-16
Event at 2010-05-08T20:17:25,2010-05-08
20000310134526205,2000-03-10
2025-08-02T12:23:48,2025-08-02
1991_11_29T8_28_56-0330,1991-11-29
1996-08-03T03:51:03.842947Z,1996-08-03
2022-01-26T20:41:25+2500,2022-01-26
2006/7/29T42948,2006-07-29
8/16-2028,2028-08-08
"23th of November, 2005",2005-11-23
2006-10-02,2006-10-02
2009_10_26T0_0_0Z+3,2009-10-26
2026-12-16T03:54:27.904Z,2026-12-16
834080400,1996-06-07
2001_10_14T1_22_11+00:00,2001-10-14
2014-06-01T16:24:26+00:00,2014-06-01
20320706060819331108334,2032-07-06
20280114020101201559369,2028-01-14
2028-12-21T01:37:32+3,2028-12-21
2013/1/9T2410,2013-01-09
2019/1/9T44424,2019-01-09
2021-11-15T08:00:53.516495030Z,2021-11-15
2009 03 23,2009-03-23
2 10 2025,2025-10-02
2020_09_02T8_39_4+08,2020-09-02
15 December 2023,2023-12-15
1683910800,2023-05-13
1282928400000,2010-08-28
2031-04-11T19:10:29.474455Z,2031-04-11
930848400000000000,1999-07-02
18-10-2003,2003-10-09
2028-06-25T19:38:59+2500,2028-06-25
2011/05/01,2011-05-01
1998-01-12T20:11:10,1998-01-12
1405962000,2014-07-22
19951018125721848,1995-10-18
ngày 11 tháng 6 năm 1990,1990-06-11
Ngày 3-5-2006,2006-05-03
20050413124947,2005-04-13
31|10|97,1997-10-31
1995-10-12T22:59:51.650Z,1995-10-12
13 Sep 1999,1999-09-13
ngày 5 tháng 7 năm 2002,2002-07-05
Event at 1999-07-18T20:46:20,1999-07-18
Sự kiện diễn ra vào 25/2/1991 13:40,1991-02-25
1/12/2024 giờ 10:14:3,2024-12-01
29-05-28,2028-05-29
24-4-2007,2007-04-24
06-07-16,2016-07-06
19930924193150343,1993-09-24
"30th of January, 2009",2009-01-30
7 tháng 2 năm 1993,1993-02-07
29/5/2024 giờ 21:58:8,2024-05-29
Sự kiện diễn ra vào 14/3/2030 11:4,2030-03-14
1995-06-24T21:30:58,1995-06-24
933958800000000000,1999-08-07
Ngày 14-5-2021,2021-05-14
"August 20, 2005",2005-08-20
"November 19, 2014",2014-11-19
"December 27, 1997",1997-12-27
2035-12-10T06:57:37.351648151Z,2035-12-10
ngày 25 tháng 12 năm 2035,2035-12-25
Sự kiện diễn ra vào 5/4/2011 21:26,2011-04-05
1790960400000,2026-10-03
"1st of March, 2018",2018-03-01
19920330053207254,1992-03-30
30 tháng 12 năm 1991,1991-12-30
1745600400000000000,2025-04-26
6/11/2030 giờ 8:4:45,2030-11-06
ngày 27 tháng 12 năm 2006,2006-12-27
1000486800,2001-09-15
20260131191535138799032,2026-01-31
1999-12-02T05:04:22,1999-12-02
21 tháng 10 năm 1997,1997-10-21
2009_05_16T16_34_20+3,2009-05-16
1724000400000000,2024-08-19
2023/12/03,2023-12-03
"11th of April, 2002",2002-04-11
1748019600000000000,2025-05-24
Sự kiện diễn ra vào 22/7/2029 9:23,2029-07-22
"January 5, 2018",2018-01-05
Ngày 13-1-2032,2032-01-13
Sự kiện diễn ra vào 7/2/2024 19:44,2024-02-07
11-1-2011,2011-01-11
2034-07-08T03:19:53.343984001Z,2034-07-08
Event at 1991-07-14T13:4:44,1991-07-14
19941225113737744,1994-12-25
The system recorded 19900331234632,1990-03-31
1998-02-20T22:08:31+2500,1998-02-20
2019-04-13T19:29:42-05:00,2019-04-13
20330125073344399,2033-01-25
2005-01-16T09:21:19Z+3,2005-01-16
2006-08-05T03:14:04,2006-08-05
1-3-2033,2033-03-01
26 4 2009,2009-04-26
"September 23, 2003",2003-09-23
"August 11, 2001",2001-08-11
2010-05-02T07:48:10+2500,2010-05-02
1641488400000000000,2022-01-07
1905267600000000000,2030-05-18
8-8-2007,2007-08-04
31/12/2003,2003-12-31
2028-02-04,2028-02-04
1994-04-24T11:32:53.924455Z,1994-04-24
56-2-2022,2022-02-28
29-5-1997,1997-05-29
05 23 2015,2015-05-23
"September 2, 1999",1999-09-02
13.9.1994T14-17-51,1994-09-13
12_02_2022,2022-12-02
11 Jul 2004,2004-07-11
12|07|2010,2010-12-07
21/1/2025 giờ 16:35:1,2025-01-21
Event at 2008-04-12T22:26:51,2008-04-12
1153674000000,2006-07-24
16-5-2018,2018-05-16
"August 19, 1993",1993-08-19
17/9/2025 giờ 22:12:8,2025-09-17
2022_03_14T22_18_33+0500,2022-03-14
2020-02-12T23:27:52Z+3,2020-02-12
20290228052406,2029-02-28
1994-10-24T12:31:41,1994-10-24
"22th of April, 2028",2028-04-22
20111229215358120,2011-12-29
2025-07-14T18:32:45.449Z,2025-07-14
29 10 34,2034-10-29
20 tháng 12 năm 2000,2000-12-20
1.10.2034T15-29-30,2034-10-01
7_8_2024,2024-08-07
2021-04-16T22:49:18+2500,2021-04-16
1245344400000000,2009-06-19
Event at 2003-01-05T22:58:49,2003-01-05
14 Jan 2012,2012-01-14
"24th of April, 2021",2021-04-24
30 Jun 2033,2033-06-30
14.2.1993T2-39-51,1993-02-14
ngày 12 tháng 12 năm 2018,2018-12-12
2021-10-04T18:41:19.683824660Z,2021-10-04
20020317081531985,2002-03-17
20080803071018978147897,2008-08-03
20180314065351349,2018-03-14
06_21_2028,2028-06-21
The system recorded 20181002053201,2018-10-02
948733200,2000-01-25
2002-10-05T04:37:04Z+3,2002-10-05
1992-08-09T12:51:02.598240Z,1992-08-09
13 September 2005,2005-09-13
4.5.2032T6-57-52,2032-05-04
19940328150606204092835,1994-03-28
2007-10-02T18:58:10+07:00,2007-10-02
2012-09-15T03:27:02.688Z,2012-09-15
04|05|2025,2025-04-05
2003-06-16T11:11:03Z+3,2003-06-16
655059600000000000,1990-10-05
19/10/2003 giờ 3:59:31,2003-10-19
20270808080556978,2027-08-08
"8th of January, 2024",2024-01-08
21/7/2020 giờ 4:48:8,2020-07-21
"23th of September, 2019",2019-09-23
970246800,2000-09-30
20000320212340857358,2000-03-20
"20th of March, 1999",1999-03-20
1099587600,2004-11-05
20331106161323178,2033-11-06
Event at 1991-03-08T12:49:24,1991-03-08
20111012171334,2011-10-12
2012-05-27T17:50:00Z+3,2012-05-27
6 tháng 10 năm 1994,1994-10-06
2008_03_30T9_12_30+08,2008-03-30
"April 7, 2029",2029-04-07
20310215025630446802,2031-02-15
1994/3/11T33247,1994-03-11
24-1-2030,2030-01-12
"December 19, 2017",2017-12-19
15-10-2017,2017-10-15
26 Apr 2033,2033-04-26
2027-12-23T15:18:52.063Z,2027-12-23
2011-05-18T12:09:01Z+3,2011-05-18
1120669200000,2005-07-07
07 17 2023,2023-07-17
908989200,1998-10-22
2033-12-01T20:54:39.534790994Z,2033-12-01
1995/1/22T122612,1995-01-22
1994-04-11T03:07:49+2500,1994-04-11
1962032400,2032-03-05
17/5/2007 giờ 9:34:29,2007-05-17
22-6-2028,2028-06-22
"January 10, 2009",2009-01-10
7/10/2031 giờ 22:41:11,2031-10-07
Event at 2018-04-19T11:25:35,2018-04-19
26 tháng 8 năm 2001,2001-08-26
14 Mar 2030,2030-03-14
19930529153453,1993-05-29
1868374800000000,2029-03-17
3 tháng 12 năm 2010,2010-12-03
3 May 2035,2035-05-03
Event at 1999-10-24T8:12:40,1999-10-24
7 Jan 1993,1993-01-07
1944925200000,2031-08-20
25 2 1990,1990-02-25
46-6-2028,2028-06-23
2067613200,2035-07-10
2027-03-07T16:15:30.740Z,2027-03-07
The system recorded 20340215152755,2034-02-15
Event at 2010-04-12T14:24:37,2010-04-12
11/11/15,2015-11-11
20280417012257667011653,2028-04-17
2006-03-21T20:26:19Z+3,2006-03-21
20330502171234,2033-05-02
1992-03-04T13:10:50.162885Z,1992-03-04
Ngày 4-6-2017,2017-06-04
Sự kiện diễn ra vào 12/4/2004 15:9,2004-04-12
10.10.2033T0-31-34,2033-10-10
08/05/92,1992-05-08
20140422161547670,2014-04-22
9 June 2018,2018-06-09
19930314193652128534881,1993-03-14
731264400000000000,1993-03-05
18/12/2022,2022-12-18
Sự kiện diễn ra vào 16/6/1997 13:3,1997-06-16
1312822800000000,2011-08-09
19970117222138473135169,1997-01-17
6 Apr 2000,2000-04-06
1998-11-12T19:08:44,1998-11-12
17/5/1994 giờ 8:57:34,1994-05-17
Event at 2018-11-03T10:26:56,2018-11-03
27.4.2012T19-40-0,2012-04-27
14/20-2022,2022-10-14
2021-08-20T09:37:39.596Z,2021-08-20
18-7-1993,1993-07-18
20301201180648955893873,2030-12-01
1734368400,2024-12-17
5-6-2009,2009-06-05
"12th of February, 2019",2019-02-12
20121029102406,2012-10-29
21 Nov 2010,2010-11-21
The system recorded 20140925102641,2014-09-25
The system recorded 20040625035400,2004-06-25
20130426032409104637810,2013-04-26
30.9.2001T10-42-40,2001-09-30
12.10.1998T12-31-43,1998-10-12
Event at 1992-04-11T15:21:30,1992-04-11
2008-03-16T02:00:39+2500,2008-03-16
26-6-2033,2033-06-26
753037200000000000,1993-11-12
20000906012653500007132,2000-09-06
19970205045516360202599,1997-02-05
908730000,1998-10-19
"3rd of June, 2025",2025-06-03
20350912155836085015,2035-09-12
20/9/1997 giờ 9:22:8,1997-09-20
29.11.2008T14-52-32,2008-11-29
2018/5/23T163749,2018-05-23
2011_07_12T1_39_53+0500,2011-07-12
"29th of December, 2028",2028-12-29
2007-07-05T05:50:32.002Z,2007-07-05
29.10.2004T3-35-25,2004-10-29
1995_07_10T6_47_7+3,1995-07-10
2014-07-03T13:45:21.844Z,2014-07-03
2024-06-10T23:45:40.930Z,2024-06-10
20030814155622,2003-08-14
2030-04-10T18:02:49.132622Z,2030-04-10
18.12.2022T15-5-22,2022-12-18
07-08-23,2023-08-07
5 February 2001,2001-02-05
20230228010752,2023-02-28
20270420003019820,2027-04-20
2012-02-16T02:34:05-0300,2012-02-16
2004-03-13T20:03:30Z+3,2004-03-13
20041219142329865112608,2004-12-19
Ngày 8-11-2004,2004-11-08
24-10-2032,2032-10-24
1563901200000,2019-07-24
8 May 2024,2024-05-08
4 February 2027,2027-02-04
5 12 2000,2000-12-05
8 tháng 11 năm 1996,1996-11-08
23 Jan 2011,2011-01-23
18.9.2032T21-37-7,2032-09-18
29 October 2012,2012-10-29
Ngày 7-7-2009,2009-07-07
1998-03-18T20:41:26+2500,1998-03-18
Event at 2017-10-04T9:57:18,2017-10-04
24/4-1994,1994-02-24
ngày 26 tháng 12 năm 2007,2007-12-26
2004-09-07T09:53:49+08,2004-09-07
"7th of August, 2014",2014-08-07
10.7.2022,2022-07-10
1325696400,2012-01-05
19961025224001545923,1996-10-25
25.10.2031T21-2-18,2031-10-25
1078678800000000,2004-03-08
2010-08-17T14:48:35.322268212Z,2010-08-17
ngày 17 tháng 6 năm 2033,2033-06-17
02.09.2028,2028-02-09
2019_11_24T3_45_43+2500,2019-11-24
21 tháng 11 năm 1992,1992-11-21
2022.06.14,2022-06-14
19930625110510,1993-06-25
"10th of November, 2002",2002-11-10
20080823063119772,2008-08-23
20180124222637,2018-01-24
ngày 17 tháng 4 năm 2022,2022-04-17
1992/5/19T174253,1992-05-19
679165200000000,1991-07-11
1032195600000,2002-09-17
2029-07-14T09:44:01,2029-07-14
1991-02-11T08:12:06-05:00,1991-02-11
20081125221753292,2008-11-25
2027-08-12T09:38:12Z+3,2027-08-12
1296406800000,2011-01-31
2021.12.13,2021-12-13
20341122214455700221,2034-11-22
Ngày 20-8-2030,2030-08-20
1/12/2023 giờ 3:41:6,2023-12-01
2027-08-01T03:29:13Z+3,2027-08-01
26.8.1994T14-28-14,1994-08-26
2033/7/27T03441,2033-07-27
6 Sep 2013,2013-09-06
2017_08_30T8_5_7+2500,2017-08-30
20020106212446165134,2002-01-06
The system recorded 20130816173018,2013-08-16
5 tháng 3 năm 2032,2032-03-05
20260614154938166926,2026-06-14
26-5-2035,2035-05-26
2013 10 14,2013-10-14
978022800000000000,2000-12-29
2027-01-05T19:17:33Z+3,2027-01-05
Ngày 18-6-2004,2004-06-18
05-26-2032,2032-05-26
2021-10-29T17:14:05.732Z,2021-10-29
915037200000000,1998-12-31
2003-07-01T19:19:04+2500,2003-07-01
19980305225842321,1998-03-05
18-12-2015,2015-12-09
1991-06-09T21:50:55.569807282Z,1991-06-09
2032-03-22T07:07:20,2032-03-22
1991-08-09T07:47:06-05:00,1991-08-09
1990|01|16,1990-01-16
2035/4/15T93323,2035-04-15
2029-05-04T13:09:30.498082111Z,2029-05-04
5.11.1996T8-25-15,1996-11-05
20190813081656913990,2019-08-13
20011119192141,2001-11-19
20310615042651949606047,2031-06-15
2.6.2004,2004-06-02
The system recorded 20290121024844,2029-01-21
1995-08-09T04:10:53.633Z,1995-08-09
2032-03-02T06:37:38,2032-03-02
2020_11_26T11_18_28+00:00,2020-11-26
1995_04_12T5_6_11+0500,1995-04-12
14 tháng 1 năm 2022,2022-01-14
1761757200,2025-10-30
14-2-2026,2026-02-07
20240814005454,2024-08-14
20 Aug 2030,2030-08-20
"3rd of September, 2026",2026-09-03
2025-10-07T20:10:24.991115129Z,2025-10-07
Event at 2007-06-29T3:51:48,2007-06-29
15 November 2023,2023-11-15
The system recorded 20240228223035,2024-02-28
1990-06-06T02:31:35.570236Z,1990-06-06
2019-02-21T11:57:08.596Z,2019-02-21
1993/8/12T05423,1993-08-12
1999-03-13,1999-03-13
Ngày 19-6-2002,2002-06-19
ngày 7 tháng 1 năm 2028,2028-01-07
7.6.2015T11-29-3,2015-06-07
2034-06-07T12:27:50.320988109Z,2034-06-07
2022_02_03T21_3_44Z+3,2022-02-03
3-2-2020,2020-02-03
8|1|1994,1994-01-08
1321722000000000000,2011-11-20
4_8_1990,1990-08-04
2023-09-25T18:42:43Z+3,2023-09-25
2028-04-07T03:44:36.620Z,2028-04-07
2018-02-20T04:50:22.848390Z,2018-02-20
01 19 2015,2015-01-19
24-12-2010,2010-12-12
2011-03-03,2011-03-03
03|10|2033,2033-03-10
2032-01-26T18:16:58+2500,2032-01-26
1730221200,2024-10-30
2019/5/27T183323,2019-05-27
14/5/2031 giờ 18:57:29,2031-05-14
30 Jan 2000,2000-01-30
1999-11-27T09:07:55+2500,1999-11-27
1921856400000,2030-11-26
1923757200000000000,2030-12-18
Ngày 18-9-2033,2033-09-18
20190918045142,2019-09-18
2007-04-04T12:25:01+07:00,2007-04-04
"December 21, 2022",2022-12-21
9 Feb 2031,2031-02-09
1 tháng 6 năm 1992,1992-06-01
Event at 1992-08-18T19:34:3,1992-08-18
1089565200,2004-07-12
1121360400000000,2005-07-15
1 January 2017,2017-01-01
Event at 1993-06-19T14:35:50,1993-06-19
Ngày 6-2-2004,2004-02-06
29 Apr 1994,1994-04-29
2000-10-29T17:34:51.273Z,2000-10-29
2027 03 18,2027-03-18
2028-03-21T21:38:38.965546Z,2028-03-21
19 tháng 1 năm 2021,2021-01-19
"25th of September, 2022",2022-09-25
2004.05.10,2004-05-10
1995/3/6T14165,1995-03-06
1909846800,2030-07-10
26-5-2015,2015-05-13
17 June 1992,1992-06-17
1818262800000,2027-08-15
01_19_2020,2020-01-19
20051212183216628,2005-12-12
20150824114100610758570,2015-08-24
1997-10-10T05:08:42+2500,1997-10-10
13/4-2031,2031-02-13
Ngày 22-3-2012,2012-03-22
2021-08-14T11:17:03.196353Z,2021-08-14
24-10-2011,2011-10-24
Event at 2019-10-17T11:7:40,2019-10-17
08.04.33,2033-04-08
20070124142531,2007-01-24
687373200000000,1991-10-14
19-5-2007,2007-05-19
20340516030006097,2034-05-16
2019_12_27,2019-12-27
"December 2, 2009",2009-12-02
16/18-2024,2024-09-16
2028-09-04T19:36:20Z+3,2028-09-04
2006-12-16T23:38:57.311324Z,2006-12-16
6 Jan 1998,1998-01-06
2008-06-14T07:39:59.341306Z,2008-06-14
20100111195152912,2010-01-11
16/14-2035,2035-07-16
The system recorded 20301231212800,2030-12-31
2015-05-19T10:53:26.953Z,2015-05-19
1997 03 14,1997-03-14
08 27 2031,2031-08-27
The system recorded 20280130113919,2028-01-30
2012-07-31T01:46:21Z+3,2012-07-31
17 January 1991,1991-01-17
2016-10-12T03:06:39.594379Z,2016-10-12
20030823143221397,2003-08-23
1 Nov 2007,2007-11-01
04 10 99,1999-10-04
20120314215045338,2012-03-14
The system recorded 20040115200805,2004-01-15
19950320163221876964,1995-03-20
"February 4, 2020",2020-02-04
1994/4/8T204558,1994-04-08
1999-07-17T07:47:00Z+3,1999-07-17
2013-10-12T07:21:27+2500,2013-10-12
ngày 1 tháng 10 năm 2006,2006-10-01
2033-09-13T18:43:41.624Z,2033-09-13
Sự kiện diễn ra vào 31/12/2000 1:24,2000-12-31
ngày 3 tháng 2 năm 2018,2018-02-03
2020/2/16T31418,2020-02-16
2012_02_12T9_55_9+0500,2012-02-12
"29th of June, 2003",2003-06-29
ngày 9 tháng 2 năm 2023,2023-02-09
2026-08-09T20:42:36.125121558Z,2026-08-09
895597200000000,1998-05-20
Ngày 14-9-1995,1995-09-14
08.27.2029,2029-08-27
1999-03-11T07:16:50Z+3,1999-03-11
1257872400000000,2009-11-11
20211203083152295756287,2021-12-03
20340724174804,2034-07-24
ngày 25 tháng 5 năm 2030,2030-05-25
62-5-1991,1991-05-31
748976400000000000,1993-09-26
20120816160119749627,2012-08-16
28-7-2024,2024-07-28
2012-02-14T18:46:20,2012-02-14
The system recorded 20350610195033,2035-06-10
1997/1/20T64015,1997-01-20
20060504214402545,2006-05-04
Sự kiện diễn ra vào 18/11/2017 18:47,2017-11-18
11/08/2008,2008-11-08
2029-12-26T14:47:56+2500,2029-12-26
19 April 2015,2015-04-19
23-07-20,2020-07-23
20.12.2021T7-55-50,2021-12-20
2034-06-13T20:24:58.584841352Z,2034-06-13
1830186000000,2027-12-31
9 Dec 1992,1992-12-09
1997-07-01T06:07:15.853102Z,1997-07-01
22/3/2031 giờ 10:58:49,2031-03-22
20010611184648,2001-06-11
20100727014747,2010-07-27
ngày 19 tháng 10 năm 2019,2019-10-19
15/24-1995,1995-12-15
2027/10/4T948,2027-10-04
1994-06-21T06:27:34.493410187Z,1994-06-21
24-10-95,1995-10-24
2018-01-14T16:05:34.334611Z,2018-01-14
3 August 2019,2019-08-03
"28th of August, 2016",2016-08-28
20171129170926007132,2017-11-29
1/5/2004,2004-05-01
07|09|07,2007-09-07
1689613200000000,2023-07-18
20340209080547896570,2034-02-09
21.1.1994T0-59-47,1994-01-21
2033-10-25T06:26:43+07:00,2033-10-25
2029|01|15,2029-01-15
14 Apr 2032,2032-04-14
11 Aug 2012,2012-08-11
12.6.2022T20-44-50,2022-06-12
1994-06-15T03:41:48+2500,1994-06-15
2017-01-05T18:19:44Z+3,2017-01-05
20351014024305044,2035-10-14
Ngày 13-12-2015,2015-12-13
20100827203249,2010-08-27
1181322000000000,2007-06-09
2008-09-11T14:54:55+2500,2008-09-11
1990-11-26T02:17:45,1990-11-26
"8th of October, 2034",2034-10-08
2005/2/4T8505,2005-02-04
2035-10-18T23:21:44.092Z,2035-10-18
19971125223905,1997-11-25
14 Oct 2022,2022-10-14
2016-09-15T20:09:03.315864Z,2016-09-15
The system recorded 19920528234432,1992-05-28
23.03.21,2021-03-23
Sự kiện diễn ra vào 8/12/1995 16:23,1995-12-08
The system recorded 20160306130040,2016-03-06
2009-01-10T18:13:34.251917Z,2009-01-10
25-3-2019,2019-03-25
12/07/2001,2001-12-07
Ngày 15-3-2024,2024-03-15
1890406800000000000,2029-11-27
22-05-26,2026-05-22
1/5/2013 giờ 3:45:31,2013-05-01
26.5.2005T2-6-21,2005-05-26
2-7-2013,2013-07-01
"December 25, 2011",2011-12-25
2026-02-23T13:42:51-05:00,2026-02-23
2004-05-15T11:04:43+2500,2004-05-15
Sự kiện diễn ra vào 14/1/2034 10:24,2034-01-14
2011/12/9T215024,2011-12-09
20330321074721,2033-03-21
1998-05-31T02:12:01+2500,1998-05-31
20040711113849679010618,2004-07-11
20310910180633,2031-09-10
2021-09-15T19:43:55.142211Z,2021-09-15
2021-01-14T05:50:12.815008351Z,2021-01-14
Event at 2005-11-29T20:56:45,2005-11-29
16.5.2020T2-49-18,2020-05-16
2005-05-18T07:58:57+00:00,2005-05-18
2008-03-14T10:30:09.406863664Z,2008-03-14
2026_10_21T12_39_41+3,2026-10-21
20/14-2015,2015-07-20
700678800000,1992-03-16
12-4-2034,2034-04-12
20021022133000863670377,2002-10-22
19 August 2007,2007-08-19
The system recorded 20090917080543,2009-09-17
Ngày 2-2-2031,2031-02-02
1993 12 11,1993-12-11
2008-05-05T13:57:58,2008-05-05
2024/3/31T2059,2024-03-31
Event at 2012-07-11T9:18:44,2012-07-11
2017-06-07T23:56:26Z+3,2017-06-07
2021/9/18T1419,2021-09-18
9|6|2031,2031-06-09
7/8-2019,2019-04-07
2019-10-06T05:31:09.411674Z,2019-10-06
20251018015740918758,2025-10-18
2002-02-06T13:09:59,2002-02-06
2007_11_27T22_16_50Z+3,2007-11-27
18.1.1998T10-25-30,1998-01-18
13|11|2032,2032-11-13
24 tháng 5 năm 2010,2010-05-24
56-8-2024,2024-08-28
18/6/1997 giờ 22:30:33,1997-06-18
12-12-1992,1992-12-12
ngày 10 tháng 3 năm 1997,1997-03-10
2020-10-28T16:02:12Z+3,2020-10-28
2010_03_06T15_34_46-0300,2010-03-06
15/12/1994 giờ 17:11:15,1994-12-15
1992|03|03,1992-03-03
"August 8, 2015",2015-08-08
20160411165520720483288,2016-04-11
1991/1/23T211626,1991-01-23
6/9/2008 giờ 14:51:2,2008-09-06
7 tháng 11 năm 1997,1997-11-07
2014-06-10T20:04:22.059694Z,2014-06-10
957286800000,2000-05-03
5 Apr 2012,2012-04-05
10/5/2032 giờ 15:51:22,2032-05-10
1753981200,2025-08-01
8/24-1999,1999-12-08
Ngày 24-9-2035,2035-09-24
58-8-2016,2016-08-29
1990-07-19T15:55:52.140459883Z,1990-07-19
15/2-2009,2009-01-15
20/20-2003,2003-10-20
2022_11_26T5_54_39-0330,2022-11-26
2015-05-20T23:50:53.783651Z,2015-05-20
27 04 24,2024-04-27
1972141200000,2032-06-30
"December 25, 1994",1994-12-25
24.11.2034T16-51-15,2034-11-24
2024-09-12T01:13:23+2500,2024-09-12
13 March 2028,2028-03-13
19-12-34,2034-12-19
643136400000,1990-05-20
The system recorded 20030924194152,2003-09-24
3/4-2015,2015-02-03
16.10.2006T7-24-35,2006-10-16
760554000000,1994-02-07
1998/2/24T04341,1998-02-24
2011-02-28T04:18:24Z+3,2011-02-28
2023_08_12,2023-08-12
4/7/2013 giờ 10:57:55,2013-07-04
18-1-2027,2027-01-18
20220206200208443284,2022-02-06
19 Oct 2011,2011-10-19
4-1-2024,2024-01-02
1990-08-08T06:47:25+2500,1990-08-08
2020|12|09,2020-12-09
30 Nov 2010,2010-11-30
19900217163737335090,1990-02-17
2023-12-15T01:52:44.961956Z,2023-12-15
ngày 15 tháng 12 năm 2029,2029-12-15
Ngày 24-1-2021,2021-01-24
2003-11-01T18:05:59,2003-11-01
12-28-2008,2008-12-28
2020/3/11T61821,2020-03-11
1992-04-26T13:05:12Z,1992-04-26
1997-06-25,1997-06-25
704307600000,1992-04-27
2011-06-16T10:35:29,2011-06-16
20290601065130415073,2029-06-01
1349715600000000000,2012-10-09
8-8-2010,2010-08-08
9 Jun 2027,2027-06-09
1992-10-14T06:31:26.234Z,1992-10-14
Ngày 7-9-2024,2024-09-07
36-10-2008,2008-10-18
2017/7/12T22352,2017-07-12
28 tháng 3 năm 2000,2000-03-28
10 Jan 2030,2030-01-10
2018/8/29T184112,2018-08-29
1511974800,2017-11-30
06.17.2028,2028-06-17
Event at 2017-10-27T5:4:50,2017-10-27
ngày 14 tháng 2 năm 2025,2025-02-14
15 tháng 10 năm 2010,2010-10-15
13_3_2004,2004-03-13
1976115600000,2032-08-15
31 Dec 2022,2022-12-31
Sự kiện diễn ra vào 21/12/1998 19:57,1998-12-21
19990605045719911416,1999-06-05
29/6-2001,2001-03-29
28-3-2000,2000-03-28
3 Oct 2017,2017-10-03
19_04_30,2030-04-19
1999_07_15T16_30_6+3,1999-07-15
2003-10-06T17:32:42Z+3,2003-10-06
ngày 1 tháng 11 năm 2027,2027-11-01
19/6-2016,2016-03-19
08.28.2006,2006-08-28
The system recorded 20200925194740,2020-09-25
26 Nov 2001,2001-11-26
20160331150700471458947,2016-03-31
2032-05-25T06:46:35Z+3,2032-05-25
16.3.1995,1995-03-16
04-20-2014,2014-04-20
1900861200,2030-03-28
24 October 1996,1996-10-24
1991-03-15T09:55:59,1991-03-15
28|05|90,1990-05-28
20.04.06,2006-04-20
6-12-2011,2011-12-06
1997/10/16T145935,1997-10-16
ngày 2 tháng 6 năm 1996,1996-06-02
2035/10/9T185359,2035-10-09
2017-10-13T22:25:45.410797Z,2017-10-13
30/6-2022,2022-03-30
Sự kiện diễn ra vào 4/9/1995 21:8,1995-09-04
ngày 30 tháng 5 năm 1996,1996-05-30
2019-01-02T14:16:16.056227995Z,2019-01-02
Sự kiện diễn ra vào 16/7/1995 19:32,1995-07-16
31 7 1994,1994-07-31
2008-11-07T03:14:36.371169Z,2008-11-07
The system recorded 20070909214540,2007-09-09
The system recorded 20290915074524,2029-09-15
15/9/2026 giờ 2:17:44,2026-09-15
2000-04-21T16:07:47Z+3,2000-04-21
2030/08/04,2030-08-04
20260421160421632374973,2026-04-21
841424400000,1996-08-31
2008-11-08T21:59:47Z+3,2008-11-08
1238691600000,2009-04-03
Sự kiện diễn ra vào 11/6/2022 23:47,2022-06-11
Sự kiện diễn ra vào 22/4/2031 0:51,2031-04-22
6/3/2003 giờ 18:14:20,2003-03-06
02.08.2029,2029-02-08
2024.09.21,2024-09-21
"5th of August, 2026",2026-08-05
Ngày 9-3-2006,2006-03-09
17/10-2008,2008-05-17
2028-03-13T14:00:57.679Z,2028-03-13
2034_07_23T8_54_30Z+3,2034-07-23
"December 12, 1993",1993-12-12
2011-09-22T23:35:22+3,2011-09-22
2014_02_13T4_25_51Z+3,2014-02-13
20121001210858401510304,2012-10-01
26-12-1993,1993-12-26
31/3/1994 giờ 14:59:14,1994-03-31
Sự kiện diễn ra vào 16/6/2025 23:30,2025-06-16
2028/8/10T154439,2028-08-10
20090622140432102755,2009-06-22
1997-05-05T23:10:46.555071Z,1997-05-05
2021-03-08T01:12:16.070648Z,2021-03-08
1995/10/25T173132,1995-10-25
20330425085737,2033-04-25
2020_01_10T3_12_30-0300,2020-01-10
40-6-2026,2026-06-20
19990627155027,1999-06-27
4.1.1994T4-4-47,1994-01-04
2026-06-21T09:33:13.670860644Z,2026-06-21
12_26_2002,2002-12-26
2002/2/18T73635,2002-02-18
14 October 2015,2015-10-14
ngày 12 tháng 4 năm 1997,1997-04-12
27 tháng 12 năm 2031,2031-12-27
20030813211434,2003-08-13
20280214045148450414008,2028-02-14
The system recorded 19910325085754,1991-03-25
2013_09_06,2013-09-06
2018-02-01T03:51:27Z+3,2018-02-01
636656400000000000,1990-03-06
3 May 2013,2013-05-03
The system recorded 20160223203453,2016-02-23
3/24-1997,1997-12-03
2002-07-17T18:18:04,2002-07-17
Event at 2011-08-24T0:5:51,2011-08-24
"28th of August, 2029",2029-08-28
2009-11-02T21:48:37.969878Z,2009-11-02
2014-07-21,2014-07-21
1078938000000000,2004-03-11
1998/3/20T171837,1998-03-20
22/1/2007 giờ 17:54:42,2007-01-22
Event at 2027-06-26T9:4:21,2027-06-26
727808400,1993-01-24
13 8 1992,1992-08-13
3 Jan 2033,2033-01-03
2021-10-05T02:56:31,2021-10-05
"March 25, 2021",2021-03-25
2022-06-26T11:48:12.570926Z,2022-06-26
The system recorded 19971121062327,1997-11-21
24-1-2016,2016-01-12
3/3/2024 giờ 10:56:32,2024-03-03
"19th of August, 2012",2012-08-19
3 tháng 10 năm 2019,2019-10-03
1039453200000000000,2002-12-10
2004|09|18,2004-09-18
2028-02-06,2028-02-06
16-8-2019,2019-08-08
1999_01_20T23_35_58-05:00,1999-01-20
01 11 16,2016-11-01
The system recorded 20180114195331,2018-01-14
2024-12-30T07:04:09Z+3,2024-12-30
1777050000,2026-04-25
28.7.2031,2031-07-28
2005-11-29T12:29:27Z+3,2005-11-29
20150901042758436,2015-09-01
1266598800000000000,2010-02-20
Ngày 29-4-2001,2001-04-29
10 tháng 6 năm 2022,2022-06-10
1995_11_26,1995-11-26
2006-08-10,2006-08-10
2012_10_12T23_10_38+2500,2012-10-12
1991-01-26T08:35:25.217Z,1991-01-26
750445200000,1993-10-13
1719594000000000000,2024-06-29
21/7/2030,2030-07-21
1992/6/18T91519,1992-06-18
2015-11-30,2015-11-30
19 tháng 6 năm 2034,2034-06-19
707590800000000000,1992-06-04
Sự kiện diễn ra vào 29/10/2002 18:31,2002-10-29
The system recorded 20051219170737,2005-12-19
The system recorded 20031018044502,2003-10-18
02_03_07,2007-03-02
Event at 2001-07-28T13:41:22,2001-07-28
951930000000000,2000-03-02
"3rd of October, 1991",1991-10-03
2018-11-02T01:45:05.992878Z,2018-11-02
2033-08-07T18:29:10,2033-08-07
2008/5/23T21734,2008-05-23
9/5/2031 giờ 18:56:10,2031-05-09
"26th of November, 2034",2034-11-26
The system recorded 20101114235541,2010-11-14
Ngày 22-12-2021,2021-12-22
3 tháng 7 năm 1993,1993-07-03
1990-05-09T14:09:39Z+3,1990-05-09
Ngày 29-10-2026,2026-10-29
19920914022652,1992-09-14
"December 15, 2034",2034-12-15
28_07_07,2007-07-28
1/14-1993,1993-07-01
6 December 1992,1992-12-06
910198800000000000,1998-11-05
757357200000000000,1994-01-01
2024/6/19T164235,2024-06-19
915642000000,1999-01-07
1574787600000000000,2019-11-27
12_03_2027,2027-12-03
2029-01-18T19:04:11,2029-01-18
2015 06 16,2015-06-16
1992-08-06T08:35:25+2500,1992-08-06
16-9-2029,2029-09-08
28 May 2019,2019-05-28
1999-09-24T02:53:38Z+3,1999-09-24
2021-09-05T10:25:42Z+3,2021-09-05
19920911093425146316294,1992-09-11
9 Jul 2006,2006-07-09
1315846800000000,2011-09-13
2012_12_11T13_45_56-0330,2012-12-11
2009 09 21,2009-09-21
802890000000,1995-06-12
20010601220629,2001-06-01
1992_09_01T1_43_17-0300,1992-09-01
2008-01-25T02:07:32.648250416Z,2008-01-25
2002-08-25T19:41:03+2500,2002-08-25
1992-04-18T21:05:29.458463265Z,1992-04-18
26 Nov 2020,2020-11-26
42-10-2002,2002-10-21
2031/11/8T84457,2031-11-08
993488400000,2001-06-26
20340318054828416998647,2034-03-18
"May 15, 2030",2030-05-15
11/20-1998,1998-10-11
The system recorded 20220216221802,2022-02-16
10-9-2008,2008-09-10
1991-11-12T00:46:39.258240319Z,1991-11-12
19/8-1994,1994-04-19
50-5-2000,2000-05-25
11.16.2030,2030-11-16
30/08/26,2026-08-30
1995-04-26T07:58:16.254Z,1995-04-26
1990-07-27T08:05:25+2500,1990-07-27
2005-07-30T05:53:09.669929557Z,2005-07-30
2 tháng 2 năm 2024,2024-02-02
Event at 2029-07-03T16:6:8,2029-07-03
15 tháng 4 năm 1993,1993-04-15
752346000000000,1993-11-04
22 July 2004,2004-07-22
1690477200,2023-07-28
1166720400000000000,2006-12-22
2035-09-26,2035-09-26
20190812154542217521,2019-08-12
1821978000,2027-09-27
"3rd of July, 1993",1993-07-03
18 Oct 2020,2020-10-18
27|1|2033,2033-01-27
1998_06_09T1_18_3+00:00,1998-06-09
The system recorded 20271204214131,2027-12-04
Event at 2001-11-03T7:54:35,2001-11-03
2013-07-15T04:03:53Z+3,2013-07-15
1482426000000000,2016-12-23
2001-06-25T11:48:48+2500,2001-06-25
04/24/1992,1992-04-24
01.13.2016,2016-01-13
1994-05-31T03:44:24,1994-05-31
2030-10-14T02:25:00.954Z,2030-10-14
19950304163251065,1995-03-04
2021_06_29T0_45_25-0330,2021-06-29
22-12-2005,2005-12-22
1991-12-13T02:45:17,1991-12-13
54-4-2029,2029-04-27
2000/01/14,2000-01-14
5/12/2000 giờ 23:54:30,2000-12-05
2009-09-06T13:05:36.946Z,2009-09-06
17 tháng 2 năm 2012,2012-02-17
15 May 2012,2012-05-15
1076950800000000000,2004-02-17
2003.09.15,2003-09-15
2 Apr 2000,2000-04-02
2011-05-26T20:05:41.618529921Z,2011-05-26
15/9/2021 giờ 1:40:29,2021-09-15
25 May 2002,2002-05-25
The system recorded 20260314213747,2026-03-14
ngày 3 tháng 6 năm 1993,1993-06-03
2023-11-12T16:52:16Z+3,2023-11-12
26 Mar 2006,2006-03-26
4/2-2023,2023-01-04
"October 14, 2009",2009-10-14
1711990800000000000,2024-04-02
16.11.2023T1-45-18,2023-11-16
Event at 2018-11-16T22:38:24,2018-11-16
28 tháng 1 năm 1997,1997-01-28
"September 17, 2026",2026-09-17
2007/3/13T234510,2007-03-13
20010409224149882719193,2001-04-09
21/12/2004,2004-12-21
9/5/1992 giờ 4:14:54,1992-05-09
20260131145410619723,2026-01-31
10 July 2000,2000-07-10
8/9/2026 giờ 7:19:37,2026-09-08
1759078800000,2025-09-29
2001-07-31T08:33:57.256887Z,2001-07-31
20150717080409374,2015-07-17
20350916220717100135469,2035-09-16
2021 04 09,2021-04-09
2016-03-20T20:29:29.084977241Z,2016-03-20
20/22-2002,2002-11-20
20030524220819558682,2003-05-24
9.2.1992T20-10-49,1992-02-09
2018-04-15T23:44:16-0330,2018-04-15
19931109073840347036,1993-11-09
20.9.2029T16-5-53,2029-09-20
54-9-2000,2000-09-27
20010727011659760,2001-07-27
09.01.24,2024-01-09
2007_03_09,2007-03-09
2010-06-26T13:03:47.410872876Z,2010-06-26
"21th of November, 2016",2016-11-21
2034-08-03T07:24:47.026Z,2034-08-03
The system recorded 19950430152257,1995-04-30
19980422120126,1998-04-22
9_8_2013,2013-08-09
Event at 2013-06-18T3:24:47,2013-06-18
Event at 1997-06-12T11:10:28,1997-06-12
1991_01_07T23_51_16-0330,1991-01-07
12-10-31,2031-10-12
2033-02-15T05:39:54+2500,2033-02-15
1085763600000000,2004-05-29
19 Feb 2033,2033-02-19
1322586000,2011-11-30
20300111102941,2030-01-11
19931113225901653,1993-11-13
872182800000000,1997-08-22
4/16-2000,2000-08-04
31-3-2008,2008-03-31
9 Dec 2019,2019-12-09
2018-01-06T12:15:42.722928Z,2018-01-06
"May 31, 2016",2016-05-31
ngày 28 tháng 3 năm 2035,2035-03-28
20040125103528596991617,2004-01-25
23/8-2022,2022-04-23
Ngày 4-5-1995,1995-05-04
2011_10_16T18_47_57+08,2011-10-16
2010-04-03T00:27:09Z+3,2010-04-03
2003-12-20T22:42:59Z+3,2003-12-20
1998-11-25T11:36:21+07:00,1998-11-25
20011009110531,2001-10-09
2035-06-24T14:15:40.934Z,2035-06-24
3 Sep 2032,2032-09-03
The system recorded 20220713223510,2022-07-13
01_08_2011,2011-01-08
2013-04-05T21:07:21.198995Z,2013-04-05
2018-02-13T04:20:08+2500,2018-02-13
1768496400000000000,2026-01-16
1202490000000,2008-02-09
2030|09|29,2030-09-29
1673024400,2023-01-07
2027-05-19T17:49:42.924Z,2027-05-19
2008-05-24T01:17:56+2500,2008-05-24
11/4/2030 giờ 15:47:9,2030-04-11
23.9.2013,2013-09-23
2005-07-26T08:01:39Z+3,2005-07-26
6 Dec 1994,1994-12-06
2008-06-17T11:34:51.761871Z,2008-06-17
"4th of December, 2018",2018-12-04
20210429064817,2021-04-29
953485200000000000,2000-03-20
20330822101015103210,2033-08-22
"9th of June, 2016",2016-06-09
19 Nov 2033,2033-11-19
Event at 2028-01-01T3:4:11,2028-01-01
23.8.2004T19-2-7,2004-08-23
05_03_90,1990-03-05
2018/9/2T125529,2018-09-02
2007-10-12T01:46:57.187026Z,2007-10-12
2012-07-24T23:15:23.523145Z,2012-07-24
2029-03-23T14:09:51Z+3,2029-03-23
3/1/2012 giờ 10:11:41,2012-01-03
Ngày 6-7-2028,2028-07-06
678387600000000,1991-07-02
2006-04-17T01:36:14+2500,2006-04-17
2010-07-19T01:51:52.190838448Z,2010-07-19
Sự kiện diễn ra vào 29/10/2017 2:14,2017-10-29
2006-06-06T21:27:45.386343Z,2006-06-06
29/20-2023,2023-10-29
6 August 2032,2032-08-06
2016.01.09,2016-01-09
7/3/2008 giờ 7:57:39,2008-03-07
2034-08-26T17:13:48.056Z,2034-08-26
4 May 1999,1999-05-04
44-7-2015,2015-07-22
2001-07-08T02:44:36-0300,2001-07-08
1761757200000000000,2025-10-30
"December 5, 2035",2035-12-05
01/06/2021,2021-01-06
684262800000000,1991-09-08
817405200000,1995-11-27
19940402114707711,1994-04-02
20181209230727329832,2018-12-09
2010-10-30T20:42:02+2500,2010-10-30
18/6/2021 giờ 5:4:26,2021-06-18
2018-09-05T01:40:21,2018-09-05
Sự kiện diễn ra vào 9/3/2019 9:10,2019-03-09
1731517200000000000,2024-11-14
2029-02-21T10:03:51.048Z,2029-02-21
1993/12/5T104543,1993-12-05
20050811154354791,2005-08-11
2030-03-01T14:53:02+2500,2030-03-01
"July 7, 2017",2017-07-07
09.26.2015,2015-09-26
2016-03-25T12:19:32Z+3,2016-03-25
The system recorded 19960206014049,1996-02-06
19990913100737754365,1999-09-13
1995-05-21T10:25:11+00:00,1995-05-21
Event at 2017-12-10T19:11:31,2017-12-10
2 Aug 2031,2031-08-02
2033-07-15T07:49:56.319732Z,2033-07-15
6 April 2027,2027-04-06
"July 7, 2001",2001-07-07
14 tháng 9 năm 2026,2026-09-14
688842000000000,1991-10-31
736794000000,1993-05-08
2014/8/22T7618,2014-08-22
Sự kiện diễn ra vào 28/4/2000 1:13,2000-04-28
28_05_26,2026-05-28
2016-08-31T22:52:41.595129640Z,2016-08-31
1113930000000000,2005-04-20
28 tháng 4 năm 2012,2012-04-28
29-10-1996,1996-10-29
2022-06-03T10:39:14.328768Z,2022-06-03
1279126800,2010-07-15
2022-11-27T09:41:43+2500,2022-11-27
"23th of June, 2017",2017-06-23
24.6.2018T21-25-19,2018-06-24
"September 19, 2016",2016-09-19
761850000000,1994-02-22
2002-05-04T12:33:26Z+3,2002-05-04
22/9/2026 giờ 2:56:28,2026-09-22
16-10-2015,2015-10-08
1 October 2017,2017-10-01
2031-05-31T20:17:56-0300,2031-05-31
17_02_93,1993-02-17
The system recorded 20151221094704,2015-12-21
2032-08-05T19:45:25+2500,2032-08-05
2004_11_11T15_26_30-0300,2004-11-11
742842000000000,1993-07-17
03|19|1996,1996-03-19
2010 09 02,2010-09-02
25-6-2029,2029-06-25
20170122195141,2017-01-22
2021-02-27T18:09:26Z+3,2021-02-27
20090716233640644048,2009-07-16
2021_06_26T1_12_20Z,2021-06-26
Ngày 10-7-2021,2021-07-10
"18th of September, 2023",2023-09-18
2009_04_27T14_28_26+0500,2009-04-27
2034-03-26T02:17:47.712Z,2034-03-26
1992.11.22,1992-11-22
Sự kiện diễn ra vào 14/1/2011 23:32,2011-01-14
20040910183650,2004-09-10
11/18-1990,1990-09-11
20090122041651467,2009-01-22
15 November 2034,2034-11-15
2055603600000,2035-02-21
Event at 2015-03-11T7:30:51,2015-03-11
1768842000000000000,2026-01-20
26/1/1990 giờ 15:10:50,1990-01-26
2035-03-06T01:18:16.546Z,2035-03-06
"21th of January, 2002",2002-01-21
ngày 25 tháng 12 năm 2027,2027-12-25
1991-02-04,1991-02-04
1465405200000000000,2016-06-09
Ngày 18-8-1998,1998-08-18
4-3-1997,1997-03-02
2020/11/8T11316,2020-11-08
2012-04-13T10:09:06,2012-04-13
2021-09-01T02:43:55,2021-09-01
Sự kiện diễn ra vào 17/4/2008 10:7,2008-04-17
19900106221525656580,1990-01-06
2028-08-04T03:32:30Z+3,2028-08-04
1927645200000000,2031-02-01
19970406224611466964580,1997-04-06
Event at 2031-07-31T8:4:21,2031-07-31
703616400000000000,1992-04-19
26 September 1999,1999-09-26
2003-09-06T01:19:35,2003-09-06
23 tháng 2 năm 2000,2000-02-23
"12th of January, 2006",2006-01-12
2002-11-08T10:58:05.565640255Z,2002-11-08
11/04/13,2013-04-11
1614618000000000000,2021-03-02
1062522000000,2003-09-03
13.8.2013T18-19-26,2013-08-13
11 October 2030,2030-10-11
1998-06-08T08:54:35-0330,1998-06-08
24/7/2005 giờ 21:39:31,2005-07-24
1998_09_06T0_5_33Z+3,1998-09-06
07_09_08,2008-09-07
Ngày 21-12-1998,1998-12-21
2007.08.19,2007-08-19
"14th of July, 2012",2012-07-14
1457024400000000000,2016-03-04
25/4-2012,2012-02-25
2007-06-17T11:29:41,2007-06-17
26/8/2024 giờ 0:7:29,2024-08-26
"12th of August, 1994",1994-08-12
18-8-2032,2032-08-09
2030-09-17T15:11:56+2500,2030-09-17
2021/1/8T19244,2021-01-08
09.27.2018,2018-09-27
60-6-2008,2008-06-30
2024-06-20T09:46:14+2500,2024-06-20
The system recorded 20220810204235,2022-08-10
17.9.2032T16-31-11,2032-09-17
25-07-03,2003-07-25
22.12.2001T3-51-20,2001-12-22
2001/10/02,2001-10-02
2018-06-09T14:15:26+2500,2018-06-09
2003-11-11T06:02:24Z+3,2003-11-11
20.1.2010T22-45-2,2010-01-20
Event at 2019-11-04T5:55:39,2019-11-04
1994/12/4T55412,1994-12-04
12 28 1996,1996-12-28
20060225091112615324,2006-02-25
"3rd of July, 2006",2006-07-03
1137603600000,2006-01-19
20/6-1999,1999-03-20
16-3-2032,2032-03-16
1993-10-03T16:03:38+2500,1993-10-03
Event at 2008-09-29T1:21:36,2008-09-29
15.8.2016T0-0-24,2016-08-15
2004-11-11T00:12:38,2004-11-11
08|03|2023,2023-08-03
20280508180443254,2028-05-08
ngày 5 tháng 9 năm 2008,2008-09-05
05-08-10,2010-08-05
1731517200000000000,2024-11-14
20340913023251848883,2034-09-13
1991-09-02T15:22:52.798Z,1991-09-02
"22th of October, 2027",2027-10-22
Sự kiện diễn ra vào 8/8/2005 17:54,2005-08-08
2022-02-17T12:15:37Z+3,2022-02-17
52-12-2009,2009-12-26
04|29|1994,1994-04-29
12 10 1990,1990-10-12
29.12.2021T1-33-17,2021-12-29
20271116034844,2027-11-16
26|12|1993,1993-12-26
2015-03-06T13:13:50,2015-03-06
Sự kiện diễn ra vào 29/4/1998 14:1,1998-04-29
2006-11-23T10:40:33Z+3,2006-11-23
07/23/2004,2004-07-23
19990318123230344777643,1999-03-18
Event at 2030-04-15T3:34:55,2030-04-15
20250410151724,2025-04-10
Sự kiện diễn ra vào 14/3/1991 21:1,1991-03-14
2032-01-29T06:35:15Z,2032-01-29
24 September 2026,2026-09-24
2018-06-29T09:38:52.593765244Z,2018-06-29
29.4.2023T8-37-44,2023-04-29
2023/11/14T203557,2023-11-14
ngày 2 tháng 5 năm 2016,2016-05-02
2000-08-08T18:39:50.860Z,2000-08-08
Ngày 27-11-2001,2001-11-27
2033-10-30T18:27:50Z+3,2033-10-30
The system recorded 20300322133233,2030-03-22
9/6-2013,2013-03-09
28.6.2018T13-19-9,2018-06-28
2012-07-11T05:22:34,2012-07-11
28 tháng 6 năm 2004,2004-06-28
21.10.1996T5-55-8,1996-10-21
1999-04-29T10:58:41.923Z,1999-04-29
02_05_94,1994-05-02
2020/4/29T133042,2020-04-29
Ngày 20-1-2033,2033-01-20
11 tháng 8 năm 2017,2017-08-11
20180204235932363851050,2018-02-04
1582218000000000,2020-02-21
20211109151640837303,2021-11-09
02/06/11,2011-06-02
1995-04-10T13:21:40.340663403Z,1995-04-10
2026_09_08T10_40_54+00:00,2026-09-08
1516813200,2018-01-25
29.7.1999T6-30-48,1999-07-29
720464400000,1992-10-31
2035-07-09T17:37:00.573221984Z,2035-07-09
2024-08-06T21:29:08,2024-08-06
1997-06-09T04:40:02,1997-06-09
28 Jun 2009,2009-06-28
23_01_10,2010-01-23
1996/6/18T16407,1996-06-18
"6th of October, 2014",2014-10-06
"20th of December, 2026",2026-12-20
21/14-2020,2020-07-21
1997-11-30T22:22:00+2500,1997-11-30
10.28.2000,2000-10-28
"14th of March, 2029",2029-03-14
20|03|14,2014-03-20
2031-04-29T03:52:05,2031-04-29
17-11-2027,2027-11-17
"5th of September, 2016",2016-09-05
20251104172147387754511,2025-11-04
12/7/2003 giờ 16:19:57,2003-07-12
9-12-2011,2011-12-09
21 2 2014,2014-02-21
1656867600000,2022-07-04
2030/9/4T203522,2030-09-04
2032.12.08,2032-12-08
1650992400000000,2022-04-27
20290529010115,2029-05-29
14-8-2005,2005-08-14
25 tháng 4 năm 2005,2005-04-25
20010906195237232336,2001-09-06
20070430233316389,2007-04-30
20271008101638834050669,2027-10-08
Ngày 10-3-2019,2019-03-10
20160221045925009,2016-02-21
2004_02_23T23_18_0+3,2004-02-23
20301004075610,2030-10-04
56-4-2005,2005-04-28
13 tháng 3 năm 1999,1999-03-13
1999-07-01T08:43:38+2500,1999-07-01
"7th of July, 2028",2028-07-07
20210926083208586,2021-09-26
1609520400000,2021-01-02
2029/11/9T24244,2029-11-09
18/11/2019 giờ 18:39:56,2019-11-18
2021-05-25T10:15:11Z+3,2021-05-25
20050913084621116104107,2005-09-13
2007-02-07,2007-02-07
2009 10 29,2009-10-29
Event at 1991-02-09T21:13:9,1991-02-09
28 November 2029,2029-11-28
22.6.2028T12-43-32,2028-06-22
10-10-2014,2014-10-05
2022|06|19,2022-06-19
1993-10-18T18:11:13.469005959Z,1993-10-18
1291654800000000,2010-12-07
20211220014303,2021-12-20
2004-05-19T09:24:22.514334302Z,2004-05-19
Sự kiện diễn ra vào 10/4/2006 8:54,2006-04-10
1734109200000000000,2024-12-14
19910509155511,1991-05-09
19910423203730585361,1991-04-23
1800810000,2027-01-25
1514221200000,2017-12-26
1930410000000000000,2031-03-05
14-2-2002,2002-02-14
2028-03-11T05:32:43.782154985Z,2028-03-11
2003-06-27,2003-06-27
1995-07-04T03:56:41.260865Z,1995-07-04
1994-01-19T03:37:32+3,1994-01-19
1860512400000000,2028-12-16
2025/5/30T205945,2025-05-30
Sự kiện diễn ra vào 10/7/2029 9:1,2029-07-10
20000207125202918,2000-02-07
27-1-1990,1990-01-27
1999|10|01,1999-10-01
14-2-2016,2016-02-07
1992_03_26T2_7_33+07:00,1992-03-26
23 June 2012,2012-06-23
945968400000000,1999-12-24
The system recorded 20111105074526,2011-11-05
20230708162216,2023-07-08
The system recorded 20241101180231,2024-11-01
2032|06|14,2032-06-14
1999-09-01T02:42:51Z+3,1999-09-01
2077462800,2035-11-01
20221003012409,2022-10-03
Ngày 30-1-2033,2033-01-30
1993.09.20,1993-09-20
"September 27, 2034",2034-09-27
10-8-2027,2027-08-05
2015_02_05T23_56_41-0300,2015-02-05
2002-06-10T16:49:13Z+3,2002-06-10
"September 14, 1994",1994-09-14
866307600000000,1997-06-15
4 February 1998,1998-02-04
1079024400000000000,2004-03-12
1472922000000,2016-09-04
29/5/2024 giờ 23:59:43,2024-05-29
1833210000,2028-02-04
ngày 22 tháng 2 năm 2035,2035-02-22
ngày 25 tháng 2 năm 2008,2008-02-25
7.7.1999T19-0-34,1999-07-07
1786554000,2026-08-13
2 tháng 2 năm 2015,2015-02-02
1990_03_16T3_16_52+0500,1990-03-16
"6th of January, 2021",2021-01-06
13.05.06,2006-05-13
20341129073541480,2034-11-29
2010-11-17T19:32:01.631056Z,2010-11-17
1291914000,2010-12-10
14.05.34,2034-05-14
1736787600000,2025-01-14
20070702071527018457177,2007-07-02
24/6-2027,2027-03-24
1990-03-14T02:11:02,1990-03-14
2007-09-09T16:51:46.224685Z,2007-09-09
The system recorded 19900901211622,1990-09-01
1232902800000,2009-01-26
22-10-2033,2033-10-22
842202000,1996-09-09
4/14-2020,2020-07-04
13/2-1994,1994-01-13
ngày 4 tháng 7 năm 2024,2024-07-04
15.5.2001T3-0-43,2001-05-15
20120504202357218944,2012-05-04
20220526052811230,2022-05-26
27_04_06,2006-04-27
Event at 2006-03-09T7:27:44,2006-03-09
2003-07-18T14:37:11Z+3,2003-07-18
27/10-2028,2028-05-27
8 Oct 1999,1999-10-08
3/6/2026 giờ 16:44:43,2026-06-03
1990-07-14T01:56:40.065729Z,1990-07-14
"December 17, 2007",2007-12-17
930243600000,1999-06-25
1621098000,2021-05-16
20131225120036,2013-12-25
20081209194147395,2008-12-09
1773334800000000000,2026-03-13
18/5/2034 giờ 18:50:18,2034-05-18
48-9-2010,2010-09-24
Event at 2022-02-23T16:49:47,2022-02-23
841856400000000000,1996-09-05
1630083600000,2021-08-28
The system recorded 20020501083634,2002-05-01
28/14-1992,1992-07-28
19971125225320237066,1997-11-25
2010-11-30T05:51:52.436976Z,2010-11-30
24 tháng 9 năm 2023,2023-09-24
01/08/28,2028-08-01
1370451600000,2013-06-06
1265907600000000,2010-02-12
2004/12/24T345,2004-12-24
2034/3/17T23126,2034-03-17
20090504045435,2009-05-04
8/12-1997,1997-06-08
Event at 2029-02-11T17:21:51,2029-02-11
1994-03-30T13:22:01+07:00,1994-03-30
Ngày 21-7-2001,2001-07-21
20071128181923,2007-11-28
2033-03-07T05:29:49.099Z,2033-03-07
1045328400000,2003-02-16
14/16-2008,2008-08-14
20330309130444561303260,2033-03-09
2031-09-12T01:51:03.070Z,2031-09-12
ngày 5 tháng 5 năm 2031,2031-05-05
24 tháng 7 năm 2023,2023-07-24
6 Oct 2026,2026-10-06
1268413200000000000,2010-03-13
1090515600000,2004-07-23
1329757200000000000,2012-02-21
20050903152251693967,2005-09-03
ngày 13 tháng 9 năm 2028,2028-09-13
"August 21, 1997",1997-08-21
24-6-2001,2001-06-24
26.6.2024T17-37-17,2024-06-26
6-7-2013,2013-07-06
2000/7/29T21739,2000-07-29
2026-10-16T07:52:05-05:00,2026-10-16
"1st of February, 2019",2019-02-01
"9th of March, 2012",2012-03-09
903027600000000,1998-08-14
2042211600000,2034-09-19
2010/4/25T92032,2010-04-25
"30th of January, 2002",2002-01-30
Event at 1996-05-25T11:48:29,1996-05-25
16/24-2008,2008-12-16
20170323161342693,2017-03-23
1991/2/22T85136,1991-02-22
1351184400000000000,2012-10-26
20230212053116158,2023-02-12
"March 25, 2018",2018-03-25
26 August 1991,1991-08-26
745347600000000,1993-08-15
20240724062556,2024-07-24
19/1/2021 giờ 2:3:56,2021-01-19
1993-12-27T20:32:37,1993-12-27
2005-12-17T04:24:39.142156Z,2005-12-17
1372870800000000000,2013-07-04
1995-10-03T02:59:32Z+3,1995-10-03
20251223043159831869,2025-12-23
1317229200000000000,2011-09-29
6-10-2025,2025-10-03
20191021143209,2019-10-21
2023_03_15T20_30_41Z,2023-03-15
742323600,1993-07-11
Ngày 27-4-2032,2032-04-27
2035-09-25T04:09:36.387921Z,2035-09-25
5 Nov 1998,1998-11-05
2015-03-14T18:14:49.778421766Z,2015-03-14
06 17 2016,2016-06-17
1832432400000000000,2028-01-26
14-11-1999,1999-11-07
2017-04-10T22:22:35.890461683Z,2017-04-10
"23th of December, 2017",2017-12-23
28-1-2035,2035-01-14
2029-03-11T06:02:40Z+3,2029-03-11
2004-01-08T10:54:42.057Z,2004-01-08
1653670800000000000,2022-05-28
"July 3, 1996",1996-07-03
2019-03-27T00:19:51,2019-03-27
1713978000,2024-04-25
2004/4/25T1206,2004-04-25
20040613070844976221,2004-06-13
2010-05-31T12:57:19.811161Z,2010-05-31
1998-09-26T21:04:16Z+3,1998-09-26
20020606080253443,2002-06-06
03.17.2023,2023-03-17
2025/10/4T35221,2025-10-04
19900301065235474651359,1990-03-01
10/8/2016 giờ 0:18:48,2016-08-10
2020 10 23,2020-10-23
25-2-2002,2002-02-25
2018-05-11T18:52:23.926334287Z,2018-05-11
Sự kiện diễn ra vào 30/12/2016 22:40,2016-12-30
"April 15, 2024",2024-04-15
1991_11_14T1_34_44+2500,1991-11-14
"17th of August, 1994",1994-08-17
02 22 2006,2006-02-22
ngày 2 tháng 9 năm 2008,2008-09-02
21/20-2020,2020-10-21
2001_03_26T3_54_35+0500,2001-03-26
2025-04-13T01:15:51Z+3,2025-04-13
2012-11-16T19:04:47Z+3,2012-11-16
1988470800000,2033-01-05
The system recorded 20200915163043,2020-09-15
2-8-2022,2022-08-02
07 16 2006,2006-07-16
ngày 9 tháng 8 năm 2016,2016-08-09
1997-05-20T11:06:24+07:00,1997-05-20
5 7 2002,2002-07-05
1/1/1996 giờ 12:38:34,1996-01-01
1705770000000000,2024-01-21
20290507113429042,2029-05-07
20080817194026357072,2008-08-17
900003600000000,1998-07-10
17 9 2026,2026-09-17
1995-07-15T12:14:47.078188955Z,1995-07-15
2027-08-09T09:29:57.747056402Z,2027-08-09
14.11.1990,1990-11-14
2024-08-22T14:27:50+00:00,2024-08-22
19930622070457,1993-06-22
20350614212627891674,2035-06-14
10/31/1991,1991-10-31
12-7-2003,2003-07-12
14 tháng 6 năm 2031,2031-06-14
9 Aug 2004,2004-08-09
1913994000000000000,2030-08-27
2010_08_14T9_10_0+07:00,2010-08-14
ngày 14 tháng 12 năm 2022,2022-12-14
1.2.2003T4-12-41,2003-02-01
2.1.2023T17-10-22,2023-01-02
20011027135736294819,2001-10-27
5/5/2000 giờ 12:52:43,2000-05-05
2019-04-16T18:58:24.645420Z,2019-04-16
25 April 2014,2014-04-25
2017-03-17T19:27:25,2017-03-17
2009898000,2033-09-10
Event at 2005-09-01T17:42:17,2005-09-01
Ngày 25-3-1998,1998-03-25
"May 31, 2019",2019-05-31
ngày 24 tháng 2 năm 2008,2008-02-24
1/14-2013,2013-07-01
20200322060248407201,2020-03-22
The system recorded 19960725000345,1996-07-25
"18th of November, 2021",2021-11-18
26 Jun 2025,2025-06-26
Sự kiện diễn ra vào 16/10/2015 13:34,2015-10-16
ngày 5 tháng 6 năm 2011,2011-06-05
20100501004101,2010-05-01
1227459600000000000,2008-11-24
9/22-2012,2012-11-09
2000-07-02T13:54:28+00:00,2000-07-02
"May 23, 2026",2026-05-23
2032794000000000000,2034-06-02
1991/7/19T12940,1991-07-19
1992_01_02T13_22_23+2500,1992-01-02
26 April 1993,1993-04-26
2014_08_05,2014-08-05
26-7-2035,2035-07-26
05.03.11,2011-03-05
15 Dec 2024,2024-12-15
30.05.08,2008-05-30
2013-08-02T14:30:32,2013-08-02
2008/11/26T21943,2008-11-26
2032-01-16T19:52:41.735766979Z,2032-01-16
"23th of February, 2029",2029-02-23
2004-06-20T05:02:36.702863Z,2004-06-20
"August 24, 1994",1994-08-24
Event at 2023-11-24T18:9:23,2023-11-24
2028-01-10T17:06:42+2500,2028-01-10
The system recorded 20130528072210,2013-05-28
2028_09_01T19_45_8+08,2028-09-01
20320614213540313,2032-06-14
09 30 2018,2018-09-30
"December 4, 2018",2018-12-04
15/06/13,2013-06-15
14.12.2011T2-36-13,2011-12-14
22/8-2035,2035-04-22
20121104141117073397,2012-11-04
03/18/2003,2003-03-18
19/10/2009 giờ 2:13:28,2009-10-19
Event at 2009-08-08T8:15:26,2009-08-08
2020-03-27T11:37:15-0300,2020-03-27
2020-01-27T19:50:09.681Z,2020-01-27
11_22_2007,2007-11-22
20321006222042947152,2032-10-06
27.03.24,2024-03-27
1257267600000000,2009-11-04
10.1.2021T14-3-6,2021-01-10
24 2 2027,2027-02-24
Sự kiện diễn ra vào 17/3/1990 19:51,1990-03-17
10 tháng 1 năm 2017,2017-01-10
28/12-1994,1994-06-28
2006-06-27T16:01:22.567691302Z,2006-06-27
20030611123103067470914,2003-06-11
The system recorded 19940310073503,1994-03-10
30 tháng 8 năm 2023,2023-08-30
1998 05 20,1998-05-20
2016-04-18T00:54:26+2500,2016-04-18
30 Sep 2028,2028-09-30
2004/12/25T2148,2004-12-25
20030413203148113,2003-04-13
24.04.34,2034-04-24
2010/9/13T2470,2010-09-13
10 Jan 2018,2018-01-10
The system recorded 20090325161810,2009-03-25
2032-09-21T05:52:27,2032-09-21
1990-08-09T18:39:45.998445Z,1990-08-09
Event at 2031-03-22T18:24:32,2031-03-22
20350801140320,2035-08-01
2006-03-24T08:10:12+08,2006-03-24
1263574800000000,2010-01-16
34-2-2011,2011-02-17
14 April 2022,2022-04-14
933699600000000,1999-08-04
2008/5/5T1091,2008-05-05
1232557200000000,2009-01-22
Event at 2030-01-06T8:14:36,2030-01-06
698259600000,1992-02-17
20290522022436016,2029-05-22
1999/2/14T235656,1999-02-14
08.11.27,2027-11-08
20321205115758275,2032-12-05
2022-04-04T05:14:10+2500,2022-04-04
2018-07-23T05:52:48.463423884Z,2018-07-23
4 October 2028,2028-10-04
1416762000,2014-11-24
2 Nov 2035,2035-11-02
20030406100636882,2003-04-06
Event at 2004-12-28T3:44:52,2004-12-28
The system recorded 19970513162721,1997-05-13
"26th of April, 2028",2028-04-26
20131013130230,2013-10-13
2015/12/16T20649,2015-12-16
1975165200,2032-08-04
8 July 2026,2026-07-08
ngày 26 tháng 9 năm 1993,1993-09-26
"January 13, 2033",2033-01-13
2003-01-22T14:22:09+2500,2003-01-22
2023_07_01T0_46_26+08,2023-07-01
2007-06-13T06:33:49-05:00,2007-06-13
2004-01-14T16:25:57+00:00,2004-01-14
"7th of December, 2005",2005-12-07
20280128072610146348,2028-01-28
20-6-2007,2007-06-20
Sự kiện diễn ra vào 5/5/2026 3:19,2026-05-05
06|08|91,1991-08-06
09 05 2028,2028-09-05
The system recorded 20070903173202,2007-09-03
1998-12-28T06:24:31+2500,1998-12-28
04-02-2031,2031-04-02
2014-09-18,2014-09-18
19950709033429611686,1995-07-09
4 Jul 2017,2017-07-04
15 June 2000,2000-06-15
ngày 10 tháng 6 năm 2019,2019-06-10
Event at 1994-06-30T17:40:1,1994-06-30
2015_05_08T2_50_38+3,2015-05-08
2020-01-15T09:16:32+08,2020-01-15
24 September 2014,2014-09-24
2.6.2020T13-37-28,2020-06-02
20020927105332845925812,2002-09-27
"October 2, 2030",2030-10-02
2013_01_21T0_45_12-0300,2013-01-21
10 Mar 2011,2011-03-10
14/12-1992,1992-06-14
2002-12-25T00:40:33Z+3,2002-12-25
2030-07-25T18:37:06.325424Z,2030-07-25
2033/4/30T135147,2033-04-30
24 October 2032,2032-10-24
27 03 11,2011-03-27
11 tháng 12 năm 2029,2029-12-11
ngày 4 tháng 5 năm 1990,1990-05-04
2026-03-16T01:35:19.072Z,2026-03-16
The system recorded 19990704154221,1999-07-04
1996/6/28T11844,1996-06-28
2005-07-15T09:27:39Z+3,2005-07-15
ngày 27 tháng 4 năm 2028,2028-04-27
3/12-2030,2030-06-03
18|6|2018,2018-06-18
20260211212641,2026-02-11
1110906000,2005-03-16
642618000000,1990-05-14
18-4-2007,2007-04-18
30 Sep 2018,2018-09-30
774550800,1994-07-19
Ngày 14-6-2035,2035-06-14
12 03 2017,2017-12-03
1530118800,2018-06-28
13 Apr 2009,2009-04-13
794595600000,1995-03-08
The system recorded 19941016213759,1994-10-16
2020-06-12T04:11:27Z+3,2020-06-12
2012-10-22T09:54:11,2012-10-22
08.27.2024,2024-08-27
1001264400,2001-09-24
2012/3/7T61546,2012-03-07
2025/7/26T23280,2025-07-26
2026-07-22T07:35:14,2026-07-22
06 12 2023,2023-06-12
16.4.2001T19-30-15,2001-04-16
The system recorded 19910902235210,1991-09-02
Sự kiện diễn ra vào 26/11/1996 11:5,1996-11-26
904669200000000000,1998-09-02
Event at 2005-03-21T21:19:1,2005-03-21
1469811600000000,2016-07-30
20180915050339395027,2018-09-15
The system recorded 20110410183912,2011-04-10
1998_02_24,1998-02-24
20281102091357,2028-11-02
1801933200000,2027-02-07
2012-08-30T21:11:52.302Z,2012-08-30
Event at 2024-09-27T3:11:53,2024-09-27
2004-05-04T15:22:34.592Z,2004-05-04
The system recorded 20030107115535,2003-01-07
30.08.04,2004-08-30
30 Jan 2007,2007-01-30
Event at 2034-05-14T23:35:34,2034-05-14
2015082000000000000,2033-11-09
10 tháng 7 năm 2027,2027-07-10
7-12-2000,2000-12-07
ngày 13 tháng 11 năm 2035,2035-11-13
2006-05-30,2006-05-30
9 tháng 3 năm 2034,2034-03-09
2005.06.16,2005-06-16
24-8-1996,1996-08-24
1993-02-18T01:03:19,1993-02-18
4/2-2015,2015-01-04
1707757200000000000,2024-02-13
1993-09-15T10:10:57+2500,1993-09-15
The system recorded 19910905215900,1991-09-05
1241024400000000,2009-04-30
2027|07|02,2027-07-02
11_12_2007,2007-12-11
2006-01-02T21:32:03.082Z,2006-01-02
25/3/1997 giờ 4:43:51,1997-03-25
Sự kiện diễn ra vào 12/11/2021 13:36,2021-11-12
16 tháng 4 năm 2003,2003-04-16
Event at 2021-03-01T21:19:45,2021-03-01
2009-07-27T18:46:59Z+3,2009-07-27
ngày 16 tháng 10 năm 2014,2014-10-16
19931109134344,1993-11-09
Sự kiện diễn ra vào 20/12/2027 14:59,2027-12-20
2013-01-21T09:49:46.650906Z,2013-01-21
20030109095802216,2003-01-09
Ngày 14-7-1996,1996-07-14
20020423145305392529885,2002-04-23
12 Jul 2027,2027-07-12
03/05/2009,2009-03-05
Sự kiện diễn ra vào 9/2/2011 22:23,2011-02-09
14.11.2028T20-50-35,2028-11-14
2022-04-25T15:15:04.491418Z,2022-04-25
29 tháng 1 năm 1995,1995-01-29
20/12-1992,1992-06-20
27.7.2012T12-45-20,2012-07-27
Event at 2003-07-27T22:41:31,2003-07-27
20041006082018762,2004-10-06
Event at 2018-10-01T11:15:32,2018-10-01
26 December 2007,2007-12-26
20340418025131643346,2034-04-18
9.4.2017T17-53-34,2017-04-09
29-7-2029,2029-07-29
22 August 2026,2026-08-22
Event at 2025-08-22T0:10:34,2025-08-22
Sự kiện diễn ra vào 26/4/2003 6:39,2003-04-26
2011-08-12T16:34:25.659093451Z,2011-08-12
2020-09-06T09:34:23,2020-09-06
20301106042600699,2030-11-06
Event at 1999-04-09T18:54:17,1999-04-09
1990-04-12T08:44:23.715Z,1990-04-12
2034-08-11T05:01:56+2500,2034-08-11
20 May 2017,2017-05-20
2009_02_21T22_8_44-0330,2009-02-21
Event at 2004-11-11T1:44:49,2004-11-11
932576400000000000,1999-07-22
2014-12-29T15:07:22.363693006Z,2014-12-29
2033/12/15T2755,2033-12-15
19970727172037354,1997-07-27
Sự kiện diễn ra vào 13/5/2025 19:52,2025-05-13
1391187600,2014-02-01
1090083600000000000,2004-07-18
2026-12-13T11:16:28+2500,2026-12-13
Sự kiện diễn ra vào 6/12/2014 17:14,2014-12-06
1597251600000000,2020-08-13
"7th of July, 2000",2000-07-07
28 October 2024,2024-10-28
27/16-2021,2021-08-27
2022-08-07T23:26:45+2500,2022-08-07
7/22-2028,2028-11-07
1272646800000,2010-05-01
ngày 23 tháng 8 năm 2033,2033-08-23
Event at 2002-09-18T0:0:23,2002-09-18
2003/2/4T205115,2003-02-04
8.5.2029T11-54-51,2029-05-08
"13th of August, 2012",2012-08-13
1252342800000000,2009-09-08
The system recorded 20020814140311,2002-08-14
2029-06-07T05:59:23,2029-06-07
The system recorded 20100901032405,2010-09-01
07|18|1990,1990-07-18
2014_05_24T8_24_57-05:00,2014-05-24
1990-11-29T23:18:34,1990-11-29
19930713095544718615,1993-07-13
20080620222829022389976,2008-06-20
1214672400,2008-06-29
27-03-32,2032-03-27
1992-03-14T15:34:37.128Z,1992-03-14
"October 15, 2020",2020-10-15
1815325200000000,2027-07-12
20250222182424099318,2025-02-22
"May 1, 2002",2002-05-01
1463677200000000,2016-05-20
2018_10_02T9_9_4-05:00,2018-10-02
11|06|2007,2007-11-06
1993-05-13T21:41:05.729145Z,1993-05-13
2023/10/22T213810,2023-10-22
2019/12/1T105925,2019-12-01
28 Mar 2017,2017-03-28
09_22_2027,2027-09-22
2033-02-25T05:21:18.155030261Z,2033-02-25
20-6-2014,2014-06-10
20280523113639337,2028-05-23
1941037200000000,2031-07-06
42-8-2031,2031-08-21
Ngày 24-11-1995,1995-11-24
"July 26, 2034",2034-07-26
The system recorded 20060801230355,2006-08-01
2010-03-15T22:55:36+2500,2010-03-15
20210311174739,2021-03-11
2 tháng 5 năm 2029,2029-05-02
ngày 9 tháng 2 năm 2012,2012-02-09
25-10-17,2017-10-25
23 tháng 5 năm 2028,2028-05-23
26 July 2020,2020-07-26
1992-04-18T00:31:35+2500,1992-04-18
ngày 23 tháng 9 năm 2007,2007-09-23
5|12|2023,2023-12-05
2034-01-14T11:50:11Z+3,2034-01-14
The system recorded 20271211232506,2027-12-11
1991_03_04T3_47_3Z,1991-03-04
20030912164155450028801,2003-09-12
14-4-1999,1999-04-14
"23th of March, 2031",2031-03-23
2035-03-23T05:21:27Z+3,2035-03-23
2017.06.01,2017-06-01
Sự kiện diễn ra vào 1/4/2001 9:7,2001-04-01
12/6/2022 giờ 10:51:3,2022-06-12
6/10/1991 giờ 11:56:37,1991-10-06
ngày 14 tháng 11 năm 2023,2023-11-14
1919264400000000,2030-10-27
Ngày 10-4-2025,2025-04-10
Event at 2019-01-21T3:42:13,2019-01-21
1.8.2002T23-17-43,2002-08-01
1327165200000,2012-01-22
11|19|2019,2019-11-19
21/10/2006 giờ 9:40:52,2006-10-21
2032-11-03T00:14:00.388478Z,2032-11-03
Ngày 16-6-1990,1990-06-16
Sự kiện diễn ra vào 27/10/2006 11:39,2006-10-27
"23th of January, 2013",2013-01-23
"7th of August, 2014",2014-08-07
4-3-1994,1994-03-04
22/6/2028 giờ 23:30:41,2028-06-22
2016-08-08T07:44:59.466Z,2016-08-08
2-3-2013,2013-03-01
2023-07-01T13:16:46,2023-07-01
3/9/2006 giờ 11:8:31,2006-09-03
2010_12_22T5_19_37+00:00,2010-12-22
1990_06_11,1990-06-11
10/8-2001,2001-04-10
Sự kiện diễn ra vào 7/9/1991 15:13,1991-09-07
Ngày 3-6-2016,2016-06-03
6/8-2009,2009-04-06
Event at 2001-08-09T4:34:36,2001-08-09
Ngày 5-5-2009,2009-05-05
14-10-2026,2026-10-14
2033/5/29T14396,2033-05-29
2028-01-03T10:14:24.478457Z,2028-01-03
28.8.1992T5-28-40,1992-08-28
20180411055549,2018-04-11
15.06.26,2026-06-15
28/2/1996,1996-02-28
1157043600000000000,2006-09-01
1877706000000,2029-07-03
Ngày 8-3-1995,1995-03-08
2009/8/20T12272,2009-08-20
Sự kiện diễn ra vào 13/3/2021 0:30,2021-03-13
2010/9/27T85950,2010-09-27
"November 10, 1990",1990-11-10
1995-06-28T04:42:00Z+3,1995-06-28
1928250000000000,2031-02-08
2017_10_17,2017-10-17
8 August 2009,2009-08-08
2019-04-15T23:39:18Z+3,2019-04-15
2008-01-23T16:03:21+2500,2008-01-23
2002-08-06T23:30:27.276968200Z,2002-08-06
19911104185744290091,1991-11-04
891363600000000000,1998-04-01
4 Aug 2025,2025-08-04
20261007025216636,2026-10-07
2015_03_09T18_26_25+07:00,2015-03-09
1 tháng 11 năm 2035,2035-11-01
20300417040458636774,2030-04-17
30 Oct 2014,2014-10-30
2014-08-08T15:02:20,2014-08-08
31 August 2001,2001-08-31
2001/8/26T163214,2001-08-26
22/18-1999,1999-09-22
2009-10-21T06:50:17.296928562Z,2009-10-21
1711472400,2024-03-27
2031-04-24T07:39:21.129730366Z,2031-04-24
18 January 2024,2024-01-18
ngày 8 tháng 6 năm 2000,2000-06-08
12_30_2022,2022-12-30
The system recorded 20150526211817,2015-05-26
11 Apr 1996,1996-04-11
05/12/98,1998-12-05
16/6/2033 giờ 14:43:20,2033-06-16
19/16-1990,1990-08-19
1202403600,2008-02-08
1521565200000,2018-03-21
"16th of February, 2021",2021-02-16
1868720400000000,2029-03-21
7 September 2009,2009-09-07
28.11.2016T20-1-59,2016-11-28
24-10-2003,2003-10-12
19930617105416,1993-06-17
20321029140553593133,2032-10-29
1992-02-07T08:43:02+07:00,1992-02-07
ngày 15 tháng 2 năm 1990,1990-02-15
15/16-2006,2006-08-15
2026-10-25T01:39:15.219987030Z,2026-10-25
4.4.2031T12-3-17,2031-04-04
20050218180321535253,2005-02-18
23-2-2008,2008-02-23
2023 03 19,2023-03-19
19950410144312191,1995-04-10
08-09-16,2016-09-08
28-2-2003,2003-02-14
1637859600,2021-11-26
2029-01-15T15:31:33,2029-01-15
20071114093226,2007-11-14
2030-01-15T00:04:38.674316988Z,2030-01-15
1994-08-16T14:07:28-0300,1994-08-16
"18th of July, 2005",2005-07-18
2023-10-06T18:35:27Z+3,2023-10-06
16 February 2035,2035-02-16
2008-04-09T21:49:02+2500,2008-04-09
31/3/2013 giờ 22:59:37,2013-03-31
21/20-1994,1994-10-21
04.15.2034,2034-04-15
1621616400000000,2021-05-22
3.8.1995T11-41-36,1995-08-03
2022-01-06T12:14:21Z+3,2022-01-06
Sự kiện diễn ra vào 10/10/2032 23:37,2032-10-10
11|14|2001,2001-11-14
The system recorded 20311003055254,2031-10-03
20010908101956616565662,2001-09-08
20340119024033,2034-01-19
"29th of October, 2020",2020-10-29
"30th of March, 2029",2029-03-30
2010-07-24T23:36:27+2500,2010-07-24
1930064400,2031-03-01
ngày 6 tháng 12 năm 2016,2016-12-06
31 Jan 2012,2012-01-31
20070308024856067142625,2007-03-08
2007-02-26T12:34:30.910042Z,2007-02-26
22/20-2004,2004-10-22
"17th of April, 2010",2010-04-17
2032-01-05T03:13:56.013918721Z,2032-01-05
1668358800000000000,2022-11-14
807555600000000000,1995-08-05
"18th of October, 2011",2011-10-18
2030-05-09T10:31:26-05:00,2030-05-09
1441731600000000,2015-09-09
2003-09-13T00:28:43.512Z,2003-09-13
2034-11-28T23:23:24,2034-11-28
58-5-2015,2015-05-29
1997_02_19T18_11_45+07:00,1997-02-19
2007-10-09T15:49:29.429Z,2007-10-09
20050226064833818889,2005-02-26
"March 21, 1997",1997-03-21
1275670800000000,2010-06-05
ngày 1 tháng 7 năm 2001,2001-07-01
2007-04-04T18:47:29+2500,2007-04-04
Ngày 16-10-2018,2018-10-16
10 06 98,1998-06-10
2027-08-14T09:39:26+08,2027-08-14
2-1-2028,2028-01-02
20330831201252720952031,2033-08-31
16.10.2016T7-9-18,2016-10-16
10.11.07,2007-11-10
18.1.2015T5-43-22,2015-01-18
20300829011719,2030-08-29
11.12.1998T17-56-3,1998-12-11
20020703012438441,2002-07-03
2016_04_14T8_38_48+0500,2016-04-14
6 tháng 2 năm 2028,2028-02-06
The system recorded 20111028090800,2011-10-28
1922634000000000000,2030-12-05
1992-09-06T19:38:48.608561Z,1992-09-06
2034_07_22T9_47_11-0300,2034-07-22
1 December 2010,2010-12-01
2009-12-09T09:40:22,2009-12-09
1637254800000000000,2021-11-19
5 Apr 2024,2024-04-05
6 November 2033,2033-11-06
1998-01-27T13:09:04+2500,1998-01-27
19920904042016840026,1992-09-04
Sự kiện diễn ra vào 15/1/2024 14:6,2024-01-15
8 September 2018,2018-09-08
6 Aug 2015,2015-08-06
2026-12-05T21:40:10.822Z,2026-12-05
"14th of March, 2024",2024-03-14
15 03 06,2006-03-15
13/22-2028,2028-11-13
"11th of May, 2012",2012-05-11
ngày 12 tháng 7 năm 1999,1999-07-12
30/5/2030 giờ 14:47:27,2030-05-30
1991-10-18T20:57:24.903Z,1991-10-18
Event at 2002-05-23T17:27:6,2002-05-23
"November 3, 2014",2014-11-03
1791306000,2026-10-07
5 Mar 2019,2019-03-05
1998_06_11T1_17_27+2500,1998-06-11
2031-05-04T18:41:06,2031-05-04
Ngày 24-8-2031,2031-08-24
2010-11-06T05:06:58,2010-11-06
20181206061759,2018-12-06
3/16-2004,2004-08-03
2027_03_23T18_45_7+0500,2027-03-23
1185037200,2007-07-22
2029-01-08T08:17:06.439060Z,2029-01-08
21 Feb 2013,2013-02-21
1962291600000,2032-03-08
12 20 2017,2017-12-20
2035-10-31T23:53:41+2500,2035-10-31
54-9-2007,2007-09-27
31.5.1996T0-53-41,1996-05-31
"13th of February, 2016",2016-02-13
07|25|2027,2027-07-25
13|06|35,2035-06-13
29 tháng 3 năm 2022,2022-03-29
2027-12-25T08:10:36.614Z,2027-12-25
20271008060815854185624,2027-10-08
2033_03_18T18_31_20+08,2033-03-18
11/11/2028 giờ 6:0:56,2028-11-11
1999-01-18T01:07:11+07:00,1999-01-18
894992400000000000,1998-05-13
20160224035406864038280,2016-02-24
Ngày 21-9-2019,2019-09-21
3.9.2003T19-7-8,2003-09-03
20150817161718,2015-08-17
1998/9/26T183857,1998-09-26
38-3-2013,2013-03-19
Sự kiện diễn ra vào 24/5/2016 16:54,2016-05-24
22 tháng 9 năm 2009,2009-09-22
20171030225011,2017-10-30
Ngày 25-9-2001,2001-09-25
2009-06-24T00:59:05+2500,2009-06-24
20220520231519352770050,2022-05-20
19.6.2027T0-45-5,2027-06-19
2022-07-02T02:26:21.229678Z,2022-07-02
20290116205321750357988,2029-01-16
06|23|1999,1999-06-23
2012/7/14T02334,2012-07-14
2012-03-20T21:35:38+2500,2012-03-20
Ngày 28-9-2005,2005-09-28
19910215063514095652001,1991-02-15
42-4-2032,2032-04-21
1998-04-13T17:03:57.144187740Z,1998-04-13
Event at 2026-07-08T20:6:32,2026-07-08
2013-01-28T03:51:32+2500,2013-01-28
1171386000000000000,2007-02-14
16/8-1991,1991-04-16
Ngày 4-2-2025,2025-02-04
1994_06_27T1_35_28+00:00,1994-06-27
The system recorded 20081207030650,2008-12-07
"17th of January, 2033",2033-01-17
The system recorded 20030523202727,2003-05-23
2007_11_25T6_30_57+08,2007-11-25
2-1-2030,2030-01-01
18-12-2033,2033-12-18
2009-11-14,2009-11-14
19980630102546424330,1998-06-30
20101207132818,2010-12-07
2034-03-14T15:27:42-0300,2034-03-14
10 Dec 2020,2020-12-10
30 tháng 3 năm 2000,2000-03-30
2002-10-12T03:11:29Z+3,2002-10-12
Sự kiện diễn ra vào 1/2/2028 19:2,2028-02-01
9.5.1994T2-49-57,1994-05-09
25/16-2010,2010-08-25
784486800000000000,1994-11-11
2010-08-05T00:01:31.298306Z,2010-08-05
829242000,1996-04-12
05_24_2020,2020-05-24
9.11.2027T14-12-52,2027-11-09
12 February 2022,2022-02-12
23.02.27,2027-02-23
22.05.01,2001-05-22
20290410121530,2029-04-10
Ngày 26-7-2032,2032-07-26
08|21|2026,2026-08-21
22/5/2004 giờ 15:40:37,2004-05-22
1657558800000000000,2022-07-12
2023_12_20T22_44_2+00:00,2023-12-20
5-11-2016,2016-11-05
11 17 2035,2035-11-17
2031-10-10T07:54:29.446579Z,2031-10-10
2033-10-01T09:35:46,2033-10-01
2013-03-15T08:15:09.392Z,2013-03-15
20070126153325288,2007-01-26
1449680400000000,2015-12-10
2004-01-14T18:04:18+2500,2004-01-14
26-5-2008,2008-05-26
1998/03/28,1998-03-28
The system recorded 20260325005419,2026-03-25
869936400000000000,1997-07-27
20301005043727992,2030-10-05
"October 26, 2006",2006-10-26
2019-06-14T10:59:35.788558Z,2019-06-14
1991_12_11T23_23_6+07:00,1991-12-11
"23th of December, 1993",1993-12-23
"July 6, 2003",2003-07-06
2034-07-16T19:50:44Z+3,2034-07-16
9 Apr 2021,2021-04-09
20190421031654997679,2019-04-21
26 tháng 6 năm 2011,2011-06-26
2033_10_14T13_49_30+0500,2033-10-14
17/09/21,2021-09-17
1990-09-04T07:19:50.378Z,1990-09-04
1076778000000000,2004-02-15
2029/11/23T6928,2029-11-23
19-5-1995,1995-05-19
21.3.2023T19-1-16,2023-03-21
Ngày 5-4-2016,2016-04-05
Ngày 26-12-2011,2011-12-26
15/10-2024,2024-05-15
The system recorded 19910413145703,1991-04-13
1998-01-02T05:17:05,1998-01-02
19951112001524784,1995-11-12
2026-09-09T20:09:56,2026-09-09
2018-08-17T18:32:16.713936898Z,2018-08-17
1557594000000,2019-05-12
20090503162857279951,2009-05-03
"August 16, 2032",2032-08-16
"August 16, 2031",2031-08-16
1 Jun 1996,1996-06-01
900262800000000000,1998-07-13
2029-02-17T05:47:38-0330,2029-02-17
25 tháng 4 năm 2002,2002-04-25
44-5-2025,2025-05-22
"25th of April, 2018",2018-04-25
1996_11_21T23_6_46Z,1996-11-21
20081101052656449692785,2008-11-01
19960517045017,1996-05-17
Sự kiện diễn ra vào 2/5/2012 11:52,2012-05-02
1993-08-06T08:46:33.832389924Z,1993-08-06
2009 12 10,2009-12-10
19 5 2001,2001-05-19
20081216041322732118442,2008-12-16
Sự kiện diễn ra vào 26/9/2003 23:5,2003-09-26
The system recorded 20320228044435,2032-02-28
24.02.19,2019-02-24
2031/12/20T141542,2031-12-20
"6th of May, 2027",2027-05-06
2040570000000,2034-08-31
1218214800000,2008-08-09
20080606193445,2008-06-06
1055178000000000,2003-06-10
23 Jan 2001,2001-01-23
20030902002245715,2003-09-02
Ngày 7-2-2023,2023-02-07
04/25/2012,2012-04-25
Sự kiện diễn ra vào 25/6/2024 21:22,2024-06-25
Sự kiện diễn ra vào 19/12/2028 10:17,2028-12-19
9 5 1999,1999-05-09
2026-06-18T05:11:20+08,2026-06-18
16/2-2023,2023-01-16
44-2-2011,2011-02-22
8.1.2007T21-57-33,2007-01-08
Ngày 28-11-2018,2018-11-28
The system recorded 20341021113106,2034-10-21
Event at 2031-09-17T4:1:44,2031-09-17
2005-10-30T14:03:12Z+3,2005-10-30
The system recorded 20110503064059,2011-05-03
2020-09-30T00:20:35.289396Z,2020-09-30
2006787600000000000,2033-08-05
2017-12-12T03:05:37-0330,2017-12-12
2011-02-14T17:50:32Z+3,2011-02-14
20001010073646,2000-10-10
ngày 26 tháng 4 năm 2021,2021-04-26
02_02_2020,2020-02-02
28_05_05,2005-05-28
1997-09-23,1997-09-23
4/6/2035 giờ 7:19:44,2035-06-04
2019/8/5T102757,2019-08-05
2024-02-28T06:57:21.676Z,2024-02-28
1908464400,2030-06-24
1995/1/7T182212,1995-01-07
25/2/1997 giờ 5:24:19,1997-02-25
23-1-2002,2002-01-23
2030_09_10T15_20_15+3,2030-09-10
1998-01-05T19:26:23.365Z,1998-01-05
Sự kiện diễn ra vào 5/9/2017 17:14,2017-09-05
2012-03-18T22:04:36,2012-03-18
1716483600000,2024-05-24
16_01_21,2021-01-16
19/12/2005,2005-12-19
23-12-2021,2021-12-23
Ngày 9-5-1996,1996-05-09
"17th of October, 2011",2011-10-17
2033-03-28T12:51:22.640784863Z,2033-03-28
2002_07_13,2002-07-13
19911127045658,1991-11-27
2025/1/26T203426,2025-01-26
20110930222548,2011-09-30
5/11/1995 giờ 3:44:40,1995-11-05
Ngày 23-3-1990,1990-03-23
1913389200000000000,2030-08-20
Ngày 27-12-2008,2008-12-27
1168016400000000,2007-01-06
685731600000000,1991-09-25
2018-02-27T08:35:28,2018-02-27
ngày 6 tháng 7 năm 2034,2034-07-06
20250521140936243,2025-05-21
1100883600000,2004-11-20
04/08/91,1991-08-04
2030/7/8T19517,2030-07-08
20320627215431534775467,2032-06-27
"20th of December, 1996",1996-12-20
16-9-1996,1996-09-16
Event at 1993-12-20T23:10:4,1993-12-20
2011-10-13T21:08:09.957Z,2011-10-13
20121015072134787538088,2012-10-15
2004_03_22T9_13_56+00:00,2004-03-22
20120304103315368960514,2012-03-04
The system recorded 20350829160155,2035-08-29
30/12/2004 giờ 22:40:16,2004-12-30
2008-05-04T11:08:58-05:00,2008-05-04
20081202102706256625,2008-12-02
23.9.1991T8-4-27,1991-09-23
28-1-2021,2021-01-14
30-9-2025,2025-09-30
2029-07-13T04:56:55.165Z,2029-07-13
731696400,1993-03-10
2010-09-03T15:47:52+2500,2010-09-03
"August 31, 2001",2001-08-31
7/14-2009,2009-07-07
2029-07-30T01:11:58.055176Z,2029-07-30
2019|12|16,2019-12-16
2018/09/10,2018-09-10
2025_12_22T15_10_53+08,2025-12-22
19980329000545024,1998-03-29
Ngày 11-11-2035,2035-11-11
2035-03-22T23:52:40Z+3,2035-03-22
1582304400000000000,2020-02-22
2025-07-31T03:20:41.235505402Z,2025-07-31
10 November 2021,2021-11-10
19920621022333208335,1992-06-21
842202000000000000,1996-09-09
"March 23, 2018",2018-03-23
2032-05-02T05:19:09+2500,2032-05-02
1933606800000000,2031-04-11
1691859600000000000,2023-08-13
2014-08-02T21:27:47.922088Z,2014-08-02
The system recorded 19940717120333,1994-07-17
31 tháng 1 năm 1990,1990-01-31
Sự kiện diễn ra vào 21/6/2007 2:46,2007-06-21
13/4-2016,2016-02-13
23.5.2011,2011-05-23
2 tháng 1 năm 2001,2001-01-02
Ngày 16-11-1994,1994-11-16
2029-10-02T03:34:38.766414932Z,2029-10-02
2024 07 11,2024-07-11
Sự kiện diễn ra vào 23/4/1993 16:18,1993-04-23
19970513022624,1997-05-13
2029-02-02T01:55:11.459035493Z,2029-02-02
ngày 3 tháng 3 năm 1999,1999-03-03
1015520400000000,2002-03-08
896893200000,1998-06-04
1258390800,2009-11-17
1992_09_03T15_57_5-0300,1992-09-03
2032-11-24T11:53:56,2032-11-24
26/8-2013,2013-04-26
12 tháng 4 năm 2018,2018-04-12
1990-02-17T19:44:48+2500,1990-02-17
18/6-1992,1992-03-18
2023-02-13T15:27:53+2500,2023-02-13
20161005121718477,2016-10-05
25-7-1994,1994-07-25
Event at 2012-02-01T15:10:15,2012-02-01
2003-04-12T12:22:26.252120Z,2003-04-12
2016-10-05T16:56:44+2500,2016-10-05
01|09|31,2031-09-01
12|28|2029,2029-12-28
2031_12_18T9_17_6Z,2031-12-18
2002-07-03T20:01:52.586Z,2002-07-03
Sự kiện diễn ra vào 18/8/1997 4:10,1997-08-18
20320428013559646,2032-04-28
20270813161246303396414,2027-08-13
20210504002602863,2021-05-04
2008-07-12T06:40:58+2500,2008-07-12
1328720400000,2012-02-09
20050413044002081144,2005-04-13
14 May 1993,1993-05-14
1998/2/12T2931,1998-02-12
2 Jul 1993,1993-07-02
1742317200,2025-03-19
1996-04-09T06:42:20.720047693Z,1996-04-09
18.07.21,2021-07-18
1540486800,2018-10-26
32-7-2002,2002-07-16
2027/2/26T85834,2027-02-26
28 April 2031,2031-04-28
6 December 1999,1999-12-06
17.5.2004T15-53-2,2004-05-17
23-4-2000,2000-04-23
21.5.1990T22-51-20,1990-05-21
07 25 2006,2006-07-25
27/2-2013,2013-01-27
2003-08-28T22:20:35.901062300Z,2003-08-28
20240215161321639266,2024-02-15
Ngày 17-4-2029,2029-04-17
Ngày 7-11-1990,1990-11-07
20160720204930890517442,2016-07-20
30.5.2028T23-29-13,2028-05-30
"August 15, 2027",2027-08-15
12.2.2010T6-12-4,2010-02-12
1706634000,2024-01-31
2024-07-15T00:15:55Z+3,2024-07-15
2028_10_07,2028-10-07
20200519164934,2020-05-19
12-19-1995,1995-12-19
20330820221145635196885,2033-08-20
2025-04-13T07:50:23+2500,2025-04-13
2012-02-02T03:09:40Z+3,2012-02-02
2007-07-02T08:08:54,2007-07-02
2013|08|27,2013-08-27
2019-12-26T07:47:49.680Z,2019-12-26
2016-10-17T15:24:46,2016-10-17
11.5.1994T4-26-58,1994-05-11
1695229200000000,2023-09-21
2016-07-30T21:48:28+2500,2016-07-30
2019_08_19T16_2_9+0500,2019-08-19
21-7-2006,2006-07-21
1738688400000000000,2025-02-05
2027-11-09T12:00:47.451081Z,2027-11-09
1.11.2031T22-16-46,2031-11-01
2035_03_17,2035-03-17
2030/12/07,2030-12-07
14/7/2028,2028-07-14
2048950800000,2034-12-06
Ngày 25-9-2030,2030-09-25
2003_11_29,2003-11-29
2012-06-03T16:58:58+2500,2012-06-03
1996-02-16T16:16:27.827931344Z,1996-02-16
Sự kiện diễn ra vào 18/8/2026 0:37,2026-08-18
ngày 22 tháng 5 năm 1998,1998-05-22
20090401131440962792104,2009-04-01
1296752400000000,2011-02-04
19930529230639,1993-05-29
Ngày 9-8-2033,2033-08-09
20220522022532,2022-05-22
6/16-2034,2034-08-06
48-4-2019,2019-04-24
20090617221023797043,2009-06-17
1999/4/14T20159,1999-04-14
Ngày 2-8-2022,2022-08-02
"May 9, 2027",2027-05-09
1995-02-16T16:40:30.844924346Z,1995-02-16
Sự kiện diễn ra vào 16/12/2006 16:45,2006-12-16
20310913183537968002,2031-09-13
2027-02-18T14:45:03,2027-02-18
19951107063810666398,1995-11-07
28/2-2020,2020-01-28
20160212084430,2016-02-12
2018-12-12T10:20:10Z+3,2018-12-12
2023-08-02T16:56:55,2023-08-02
1427130000000000,2015-03-24
Ngày 16-8-2023,2023-08-16
4-2-2019,2019-02-02
2018-01-19T14:10:03.029082812Z,2018-01-19
21 Jan 2033,2033-01-21
2026_07_22T10_41_49+07:00,2026-07-22
Sự kiện diễn ra vào 22/1/2001 13:59,2001-01-22
"27th of June, 1992",1992-06-27
2/18-1990,1990-09-02
2027-02-17T00:26:59.693062902Z,2027-02-17
1995_06_16T20_22_21+2500,1995-06-16
2031/8/15T215348,2031-08-15
15|04|98,1998-04-15
24-5-2034,2034-05-24
20220328204816892089067,2022-03-28
2035-06-14T14:53:40.054Z,2035-06-14
24-11-09,2009-11-24
14-11-2011,2011-11-07
Ngày 12-11-2007,2007-11-12
ngày 9 tháng 9 năm 2017,2017-09-09
Event at 1997-01-16T7:14:10,1997-01-16
Sự kiện diễn ra vào 10/4/2015 16:33,2015-04-10
"December 18, 2018",2018-12-18
Event at 2002-10-22T19:52:19,2002-10-22
3-2-2035,2035-02-03
1412528400000000,2014-10-06
"May 4, 2002",2002-05-04
11 February 1994,1994-02-11
10 tháng 11 năm 2003,2003-11-10
7 tháng 5 năm 1999,1999-05-07
1803229200000000,2027-02-22
08|31|2032,2032-08-31
22-7-1994,1994-07-22
18-7-2031,2031-07-18
Ngày 19-4-2025,2025-04-19
2 December 2001,2001-12-02
2016-12-16T01:13:49Z+3,2016-12-16
Sự kiện diễn ra vào 18/9/1999 18:10,1999-09-18
8.2.2010T9-44-23,2010-02-08
06 01 2035,2035-06-01
"14th of May, 2020",2020-05-14
ngày 25 tháng 3 năm 1996,1996-03-25
The system recorded 20220712233842,2022-07-12
20151130063204276,2015-11-30
4-7-1991,1991-07-04
1292000400,2010-12-11
2017-10-01T17:23:02-0330,2017-10-01
921603600000000000,1999-03-17
2031066000000,2034-05-13
Event at 2008-06-11T13:31:2,2008-06-11
2005-05-11T05:50:11.909Z,2005-05-11
2029-02-07T15:20:19.001Z,2029-02-07
4.3.2014T13-56-15,2014-03-04
28 Aug 1992,1992-08-28
19/7/2018,2018-07-19
16/8/2000 giờ 5:6:53,2000-08-16
29 Apr 1998,1998-04-29
2012-02-03T07:48:02+2500,2012-02-03
20061117044201062,2006-11-17
7-5-2032,2032-05-07
1008867600,2001-12-21
23/6/1994 giờ 22:6:53,1994-06-23
17-7-2002,2002-07-17
19910616090428,1991-06-16
Sự kiện diễn ra vào 16/2/2025 3:23,2025-02-16
The system recorded 20050724220201,2005-07-24
2020-06-16T07:18:50Z+3,2020-06-16
2021-08-07T14:43:37.853407Z,2021-08-07
20211218100328808,2021-12-18
15 Aug 1994,1994-08-15
2025.07.03,2025-07-03
Sự kiện diễn ra vào 26/7/1994 4:44,1994-07-26
2012-11-03T04:45:19.830Z,2012-11-03
17 Jun 2007,2007-06-17
9.4.1990T20-45-12,1990-04-09
5 tháng 12 năm 2029,2029-12-05
2007-09-24T19:03:53.166Z,2007-09-24
23 tháng 6 năm 2030,2030-06-23
11 May 2028,2028-05-11
1996-05-25T01:21:33.223Z,1996-05-25
20130307064749,2013-03-07
5 Jun 1998,1998-06-05
1 Feb 2026,2026-02-01
20180222024046466396360,2018-02-22
29 May 2022,2022-05-29
ngày 17 tháng 9 năm 2031,2031-09-17
2025-07-18T03:07:13.024682Z,2025-07-18
2031-02-19T21:30:35,2031-02-19
2019-05-29T03:46:49+2500,2019-05-29
Sự kiện diễn ra vào 17/8/2004 13:51,2004-08-17
04.06.2028,2028-04-06
18-7-1996,1996-07-09
Event at 2031-10-19T3:19:51,2031-10-19
12-11-1992,1992-11-12
2017-12-04T00:50:51.575592695Z,2017-12-04
1514998800,2018-01-04
15/24-1991,1991-12-15
5 tháng 4 năm 2035,2035-04-05
20 tháng 8 năm 2029,2029-08-20
24-10-2022,2022-10-24
ngày 2 tháng 2 năm 2032,2032-02-02
2009_08_19T18_0_52Z+3,2009-08-19
2020-12-03T17:28:29.144545969Z,2020-12-03
12_03_01,2001-03-12
1495731600000000000,2017-05-26
1711472400000000000,2024-03-27
1812474000000000000,2027-06-09
20260901122502972271,2026-09-01
"November 26, 1991",1991-11-26
2042470800,2034-09-22
2002-06-22T18:48:25+2500,2002-06-22
2034-06-19T15:11:02Z+3,2034-06-19
30 tháng 7 năm 2009,2009-07-30
10_20_2034,2034-10-20
1997 09 15,1997-09-15
18.4.2017,2017-04-18
9 Dec 1998,1998-12-09
21/10/1990 giờ 4:6:55,1990-10-21
13.09.16,2016-09-13
Event at 1994-03-16T21:5:39,1994-03-16
2032-08-05T09:10:40.207680872Z,2032-08-05
"11th of June, 2007",2007-06-11
24-05-01,2001-05-24
13 tháng 2 năm 2023,2023-02-13
2003-05-27T04:14:48Z+3,2003-05-27
27/4/2008 giờ 9:49:49,2008-04-27
1624986000,2021-06-30
2014/4/24T9657,2014-04-24
19961205041649139,1996-12-05
2015-01-16T09:07:04.560027516Z,2015-01-16
20340413160841,2034-04-13
1999-10-16T09:40:45,1999-10-16
2027-03-24T19:03:07.390666Z,2027-03-24
20070118001848,2007-01-18
1267117200000000000,2010-02-26
2027-09-20T03:54:25Z+3,2027-09-20
Event at 2009-06-13T22:43:53,2009-06-13
19970318192438,1997-03-18
1997-05-05T02:24:39Z+3,1997-05-05
9/11/2023 giờ 13:44:57,2023-11-09
1352566800000,2012-11-11
2011-02-27T02:49:37.680720Z,2011-02-27
1997/9/11T14541,1997-09-11
11 Jul 2013,2013-07-11
2027/4/27T231413,2027-04-27
44-9-2032,2032-09-22
1992099600000,2033-02-16
12 tháng 4 năm 2018,2018-04-12
2030 12 02,2030-12-02
07 01 1995,1995-07-01
1992_04_22T14_33_31+08,1992-04-22
1149094800,2006-06-01
20260914031113,2026-09-14
2008_08_11,2008-08-11
2005-10-30T23:11:45Z+3,2005-10-30
2013-08-10T23:20:34+2500,2013-08-10
21 Apr 2029,2029-04-21
10-20-2012,2012-10-20
2011-09-21T23:55:21Z+3,2011-09-21
2014-03-22T19:25:10.929Z,2014-03-22
2020 07 12,2020-07-12
2026-01-28T10:10:59.899023Z,2026-01-28
4-12-1990,1990-12-04
Event at 2007-02-11T2:7:45,2007-02-11
1991-11-03T16:53:30,1991-11-03
18/12-1998,1998-06-18
20140110061836842322409,2014-01-10
6/5/1990 giờ 11:1:12,1990-05-06
3/6-2000,2000-03-03
18 Jan 2003,2003-01-18
2018-07-26T19:22:27+00:00,2018-07-26
"24th of January, 2029",2029-01-24
2003-05-11,2003-05-11
10 Jul 2014,2014-07-10
Sự kiện diễn ra vào 13/2/2009 0:25,2009-02-13
2020-04-12T17:52:37+0500,2020-04-12
1763571600,2025-11-20
2014-03-22T21:13:42+08,2014-03-22
2033_07_23T8_56_33+0500,2033-07-23
3/5/1996 giờ 22:34:48,1996-05-03
13 02 19,2019-02-13
"11th of February, 1994",1994-02-11
24 3 2001,2001-03-24
14.2.2001T10-59-6,2001-02-14
2031-09-25T19:55:32+2500,2031-09-25
2003-03-08T08:35:03.047238243Z,2003-03-08
2007-09-07T10:00:27Z,2007-09-07
"December 22, 1990",1990-12-22
1325005200000000,2011-12-28
2018-02-11T01:07:56.198Z,2018-02-11
1357750800,2013-01-10
"28th of October, 2030",2030-10-28
20261001180956555416,2026-10-01
"18th of January, 2030",2030-01-18
21 June 2023,2023-06-21
28 tháng 9 năm 2026,2026-09-28
20150730055005557757119,2015-07-30
12 tháng 11 năm 2027,2027-11-12
6-3-2011,2011-03-06
2.9.2005,2005-09-02
"25th of July, 2024",2024-07-25
20250701061451726,2025-07-01
26-10-2018,2018-10-26
15.5.2004T11-46-28,2004-05-15
26.8.2019T15-46-24,2019-08-26
2016-08-20T18:20:34.191150518Z,2016-08-20
2027-09-01T03:26:33+2500,2027-09-01
Ngày 3-4-2035,2035-04-03
2013-06-13T02:47:55-0300,2013-06-13
20_3_2013,2013-03-20
2003-12-23T02:23:54+3,2003-12-23
ngày 30 tháng 4 năm 1998,1998-04-30
1890061200,2029-11-23
10 05 10,2010-05-10
2004-01-18T18:15:59-0300,2004-01-18
Sự kiện diễn ra vào 5/6/2010 0:30,2010-06-05
19960701014826,1996-07-01
38-2-2017,2017-02-19
2002-04-28T14:11:39Z+3,2002-04-28
1421686800000000000,2015-01-20
16/3/2015 giờ 18:5:13,2015-03-16
18/3/2006 giờ 3:58:51,2006-03-18
2004-04-30T13:13:22.763550Z,2004-04-30
24 February 1997,1997-02-24
Sự kiện diễn ra vào 28/9/2018 0:59,2018-09-28
20.7.2011T14-16-14,2011-07-20
2000_12_30T23_54_11+07:00,2000-12-30
20091024180431872,2009-10-24
2029-08-17T04:53:20+08,2029-08-17
13 Jun 2014,2014-06-13
2032-05-06,2032-05-06
"9th of October, 2018",2018-10-09
19950629085118,1995-06-29
20151113235418154459,2015-11-13
The system recorded 19950419180638,1995-04-19
25-10-1995,1995-10-25
2016-04-27T10:42:08.469936Z,2016-04-27
2012-08-03T16:30:56.133Z,2012-08-03
21 Apr 1997,1997-04-21
2026_06_10T19_39_54+00:00,2026-06-10
2008-10-24T22:18:35+0500,2008-10-24
"May 1, 2018",2018-05-01
25-7-2002,2002-07-25
2033-10-09,2033-10-09
ngày 24 tháng 3 năm 2015,2015-03-24
2011-03-03T17:39:59+3,2011-03-03
The system recorded 20080504055701,2008-05-04
20151024222521,2015-10-24
ngày 8 tháng 6 năm 2031,2031-06-08
"6th of October, 2002",2002-10-06
2032-08-28T18:30:47+2500,2032-08-28
2011-08-10T21:00:39+2500,2011-08-10
2021.06.11,2021-06-11
2022-08-21T00:07:24.030Z,2022-08-21
2031-08-02T17:40:29+2500,2031-08-02
11.11.2027T20-59-5,2027-11-11
1993-11-22T04:09:23.800152Z,1993-11-22
2014|09|01,2014-09-01
1005757200,2001-11-15
1839258000,2028-04-14
The system recorded 20281205031856,2028-12-05
1999-05-06T09:58:48.860083Z,1999-05-06
"January 1, 2002",2002-01-01
1999_12_07T22_25_3+2500,1999-12-07
2016-05-18T01:13:47.365Z,2016-05-18
Sự kiện diễn ra vào 14/6/1999 23:29,1999-06-14
Event at 2032-03-30T4:36:53,2032-03-30
1802970000,2027-02-19
2007-01-04T14:54:55.532Z,2007-01-04
2020-10-20T13:48:04Z+3,2020-10-20
2017/7/26T222553,2017-07-26
2001-03-11T00:15:56+2500,2001-03-11
Sự kiện diễn ra vào 2/2/2032 19:58,2032-02-02
2010-05-26T09:54:59.451341515Z,2010-05-26
2015-06-28T11:41:46Z+3,2015-06-28
1513098000,2017-12-13
1997/12/3T45743,1997-12-03
The system recorded 20130412025711,2013-04-12
20081225145231298516402,2008-12-25
15/7/2027 giờ 20:45:17,2027-07-15
1996-09-21T09:41:22+08,1996-09-21
940957200000000000,1999-10-27
ngày 20 tháng 12 năm 2012,2012-12-20
Ngày 28-7-1995,1995-07-28
30/4/2005 giờ 13:46:26,2005-04-30
2029078800,2034-04-20
24|6|2001,2001-06-24
2011-12-28T23:12:38+2500,2011-12-28
20111111161519,2011-11-11
Ngày 30-5-1997,1997-05-30
4/6/1990 giờ 7:1:3,1990-06-04
20340912112035350485470,2034-09-12
"9th of June, 2010",2010-06-09
Sự kiện diễn ra vào 24/7/2023 15:27,2023-07-24
29/2-1997,1997-01-29
20280803110341410016767,2028-08-03
Sự kiện diễn ra vào 31/8/2022 8:49,2022-08-31
1995/6/13T224925,1995-06-13
2018/10/23T2935,2018-10-23
"August 24, 2031",2031-08-24
20070621025232514857425,2007-06-21
18|08|30,2030-08-18
2025_02_11T14_47_13-0330,2025-02-11
1994-09-30T21:51:27.822Z,1994-09-30
Ngày 14-3-2000,2000-03-14
2010-03-27T23:09:14+2500,2010-03-27
1/1/1996 giờ 5:3:13,1996-01-01
2015-05-25T07:37:36.612125Z,2015-05-25
2023-01-05T06:13:51.701623Z,2023-01-05
2017-05-17T11:01:16.886971Z,2017-05-17
20241120060613260294,2024-11-20
2005-08-19T04:32:33.837Z,2005-08-19
20261223235005249908,2026-12-23
2033-08-08T10:34:34.994566325Z,2033-08-08
16/12-1997,1997-06-16
2028_12_02,2028-12-02
19930801073150361,1993-08-01
2008_04_16T6_57_48+0500,2008-04-16
9|12|1994,1994-12-09
2019-08-12T04:04:30+2500,2019-08-12
12.1.2026,2026-01-12
08|25|2031,2031-08-25
2025-03-15T00:36:39Z+3,2025-03-15
26 tháng 10 năm 2035,2035-10-26
15/05/14,2014-05-15
"13th of August, 2005",2005-08-13
Ngày 15-6-2029,2029-06-15
ngày 11 tháng 1 năm 2029,2029-01-11
2013-11-04T02:27:59+00:00,2013-11-04
20301229063736050919,2030-12-29
22/8/2013 giờ 13:49:47,2013-08-22
2 Apr 2032,2032-04-02
20320324080618131,2032-03-24
"June 28, 2018",2018-06-28
20230808034640,2023-08-08
30-5-2027,2027-05-15
22_2_1996,1996-02-22
20340804061957,2034-08-04
08.12.2022,2022-08-12
2014-01-28T03:16:53,2014-01-28
12_12_2006,2006-12-12
2025_11_20T20_17_41-0330,2025-11-20
"November 16, 2007",2007-11-16
"August 13, 2007",2007-08-13
1993_05_02T10_10_55-0330,1993-05-02
2005-09-18T01:06:22,2005-09-18
Ngày 6-12-2008,2008-12-06
2004-05-11T15:09:18+2500,2004-05-11
2024/2/20T14581,2024-02-20
2022-09-28T03:16:51.059Z,2022-09-28
2026-07-11T19:08:04.258Z,2026-07-11
2034-02-18T16:56:01.635746Z,2034-02-18
928688400,1999-06-07
2031-06-07T03:39:04,2031-06-07
20341128074607454150,2034-11-28
2009/7/25T191710,2009-07-25
60-6-1995,1995-06-30
"23th of September, 2033",2033-09-23
Event at 1994-12-15T18:43:0,1994-12-15
20-12-2000,2000-12-20
20-7-2032,2032-07-20
2014-10-09T18:37:26Z+3,2014-10-09
2022_12_11T21_13_42+0500,2022-12-11
2025_11_24T19_42_13+3,2025-11-24
26 tháng 5 năm 2004,2004-05-26
20340819013850816642,2034-08-19
19950621231637,1995-06-21
20.12.2000,2000-12-20
2003-11-25T06:40:17Z,2003-11-25
1.6.2007T0-26-3,2007-06-01
04 24 2032,2032-04-24
632250000,1990-01-14
1999-11-01T19:08:39+07:00,1999-11-01
The system recorded 20020729232634,2002-07-29
Event at 2017-01-24T23:53:5,2017-01-24
1766250000,2025-12-21
19990704180802995908631,1999-07-04
Ngày 20-9-2009,2009-09-20
2026-08-28T00:29:04.909127214Z,2026-08-28
9 tháng 9 năm 2006,2006-09-09
2009-08-05T16:58:37.305010Z,2009-08-05
1019322000000,2002-04-21
2030-09-14T06:09:26+2500,2030-09-14
ngày 26 tháng 6 năm 1997,1997-06-26
2024-08-29T19:54:42.799284Z,2024-08-29
1036429200,2002-11-05
22 December 1991,1991-12-22
ngày 31 tháng 1 năm 2025,2025-01-31
ngày 3 tháng 4 năm 2023,2023-04-03
1998/7/22T194748,1998-07-22
20110501184927887,2011-05-01
4 October 2033,2033-10-04
The system recorded 20241029210421,2024-10-29
16 Apr 2005,2005-04-16
01 16 2028,2028-01-16
10|25|2009,2009-10-25
2031-06-04T22:05:25.602Z,2031-06-04
06 24 2000,2000-06-24
08_04_2027,2027-08-04
02 11 07,2007-11-02
19950311050731097977564,1995-03-11
2010-12-18T03:16:05+08,2010-12-18
2022-04-10T07:34:28+2500,2022-04-10
2012-05-11T04:04:34Z+3,2012-05-11
7 8 2014,2014-08-07
2013-08-30T19:12:12.004621292Z,2013-08-30
23|8|2011,2011-08-23
11 tháng 5 năm 2015,2015-05-11
Sự kiện diễn ra vào 25/12/2031 10:2,2031-12-25
2010/8/10T35951,2010-08-10
The system recorded 19910124070016,1991-01-24
1994-05-27T08:47:18.446138Z,1994-05-27
1759078800000,2025-09-29
ngày 7 tháng 5 năm 2029,2029-05-07
1957798800000,2032-01-16
2012-12-11T21:32:45.659Z,2012-12-11
18-01-13,2013-01-18
2020-10-17T22:45:22Z+3,2020-10-17
1332608400000000000,2012-03-25
1165165200000000,2006-12-04
16_11_2018,2018-11-16
19960922212725967129416,1996-09-22
26/10/2023 giờ 5:23:3,2023-10-26
60-10-2022,2022-10-30
1991_11_19T1_7_15Z,1991-11-19
1991-08-03T18:19:06,1991-08-03
2003-04-29T02:06:18,2003-04-29
19900627131958,1990-06-27
2025-09-13T00:02:09.506Z,2025-09-13
17-6-1999,1999-06-17
2002-09-03T16:40:39Z+3,2002-09-03
11/28/2018,2018-11-28
19980722194220,1998-07-22
2021-04-24T02:01:41.093Z,2021-04-24
2019-03-27T20:25:21.330210199Z,2019-03-27
20170312131555003446,2017-03-12
2013-04-17T22:10:31.960155Z,2013-04-17
1935853200000,2031-05-07
2033-08-19T03:00:26+2500,2033-08-19
2001-08-21T22:00:55+0500,2001-08-21
2006-05-05T22:16:37.799207889Z,2006-05-05
2022-06-09T09:35:59,2022-06-09
976813200000000000,2000-12-15
Ngày 11-5-2022,2022-05-11
Sự kiện diễn ra vào 2/5/2024 11:5,2024-05-02
24/20-2014,2014-10-24
23 tháng 12 năm 2035,2035-12-23
2006-07-30T01:31:11Z+3,2006-07-30
2009-12-04T16:54:15-05:00,2009-12-04
25 May 2027,2027-05-25
8 tháng 2 năm 1995,1995-02-08
1215450000000000000,2008-07-08
20130223142507,2013-02-23
1996/12/13T153628,1996-12-13
2002_11_05T4_30_55+07:00,2002-11-05
"July 14, 2027",2027-07-14
2014-09-11T12:14:53.637632897Z,2014-09-11
20120302000351,2012-03-02
2013-07-03T17:45:05+2500,2013-07-03
22/3/2024 giờ 23:15:12,2024-03-22
1996-07-10T19:33:41+0500,1996-07-10
966186000,2000-08-14
20240922011850030606420,2024-09-22
1993_05_08T12_27_53-05:00,1993-05-08
1821459600,2027-09-21
20120411101655431519852,2012-04-11
Sự kiện diễn ra vào 28/11/2023 23:1,2023-11-28
2008-12-02T23:57:10Z+3,2008-12-02
03|02|12,2012-02-03
Sự kiện diễn ra vào 22/3/2026 23:10,2026-03-22
2004-01-09T02:24:30.507Z,2004-01-09
1997/12/22,1997-12-22
1622998800000000,2021-06-07
4/20-1993,1993-10-04
52-11-2013,2013-11-26
The system recorded 20280109013723,2028-01-09
10/11/2022 giờ 2:58:52,2022-11-10
966272400000,2000-08-15
1991-10-24T12:02:34.215768405Z,1991-10-24
10.10.1996,1996-10-10
02|14|2032,2032-02-14
3 6 2017,2017-06-03
Ngày 4-9-1997,1997-09-04
2014-01-01T22:56:01.501Z,2014-01-01
26.6.2030T12-32-56,2030-06-26
19980412021827407531449,1998-04-12
19961103121900879,1996-11-03
14 Feb 2031,2031-02-14
1669827600000000000,2022-12-01
ngày 27 tháng 11 năm 2023,2023-11-27
12-9-2022,2022-09-06
20190521045500551063544,2019-05-21
1992-06-16T05:53:48,1992-06-16
1994-01-27T19:20:26,1994-01-27
"March 19, 2029",2029-03-19
"March 2, 2030",2030-03-02
09|26|2034,2034-09-26
1873386000000000000,2029-05-14
8-9-1995,1995-09-04
2020-07-02T23:45:14+00:00,2020-07-02
Ngày 3-8-2018,2018-08-03
2003.05.27,2003-05-27
20090813013758,2009-08-13
2021-10-31T11:14:00.327490Z,2021-10-31
Sự kiện diễn ra vào 17/6/2009 13:45,2009-06-17
22/12-2010,2010-06-22
09-29-2024,2024-09-29
1957366800000,2032-01-11
1908205200000,2030-06-21
1994 01 21,1994-01-21
07/24/1992,1992-07-24
26.11.1993T22-58-27,1993-11-26
"November 5, 2012",2012-11-05
Ngày 17-8-2035,2035-08-17
23.1.1998T7-35-15,1998-01-23
The system recorded 19930517181038,1993-05-17
2023_12_16T13_40_35+07:00,2023-12-16
20171210163329826,2017-12-10
8 January 1991,1991-01-08
14 Feb 2017,2017-02-14
Ngày 2-12-2001,2001-12-02
25 tháng 2 năm 2016,2016-02-25
16-3-2021,2021-03-08
5 Feb 1990,1990-02-05
The system recorded 19921128221847,1992-11-28
Event at 2001-06-30T23:31:14,2001-06-30
1.3.2006T17-2-30,2006-03-01
"14th of October, 2016",2016-10-14
2026/3/15T94228,2026-03-15
7 Mar 2026,2026-03-07
20090515035012068521239,2009-05-15
1506963600,2017-10-03
2014-09-08T16:13:13+2500,2014-09-08
The system recorded 20040531135249,2004-05-31
"14th of April, 2001",2001-04-14
2 February 2030,2030-02-02
2 tháng 8 năm 1994,1994-08-02
10|8|2018,2018-08-10
1762362000,2025-11-06
24 Oct 2001,2001-10-24
1440954000000000000,2015-08-31
2010-08-02T08:47:24,2010-08-02
2026-10-08T10:52:45,2026-10-08
"January 1, 2004",2004-01-01
2015-05-19T14:32:46Z+3,2015-05-19
Sự kiện diễn ra vào 9/11/2010 23:47,2010-11-09
16 Dec 1998,1998-12-16
1 tháng 5 năm 1999,1999-05-01
Event at 2033-04-26T14:27:52,2033-04-26
22/10/2014 giờ 7:3:17,2014-10-22
12/24-2008,2008-12-12
"29th of September, 2035",2035-09-29
12-4-2022,2022-04-06
1164128400000000000,2006-11-22
2030-09-06T02:13:39.790796828Z,2030-09-06
20181217144221871,2018-12-17
2026-02-17T00:56:51Z+3,2026-02-17
1406826000000000000,2014-08-01
Sự kiện diễn ra vào 4/3/2024 15:39,2024-03-04
2011-12-01T09:03:09.870729Z,2011-12-01
1506618000,2017-09-29
2019-04-14T05:25:51,2019-04-14
54-3-2028,2028-03-27
The system recorded 20230103061526,2023-01-03
25-5-1999,1999-05-25
915469200000000000,1999-01-05
"18th of December, 2025",2025-12-18
"2nd of December, 1997",1997-12-02
2035558800000,2034-07-04
2011-03-11T01:01:51.804675Z,2011-03-11
Ngày 23-7-1996,1996-07-23
20250510141327119241902,2025-05-10
8 Aug 2011,2011-08-08
30/6-2004,2004-03-30
19950810085754,1995-08-10
19990911001517,1999-09-11
733856400000,1993-04-04
2017_02_12T10_1_5+2500,2017-02-12
28 Sep 2032,2032-09-28
Event at 2024-08-24T8:33:21,2024-08-24
16/3/2001,2001-03-16
"17th of October, 2033",2033-10-17
20220828061658279371,2022-08-28
01-13-2001,2001-01-13
2012-06-03T21:27:36Z+3,2012-06-03
25/4-2023,2023-02-25
780166800,1994-09-22
1993_01_19T6_15_55+00:00,1993-01-19
50-2-1997,1997-02-25
2026-03-15T02:34:06Z+3,2026-03-15
"1st of August, 2011",2011-08-01
15/3/2007 giờ 12:40:23,2007-03-15
15-8-2029,2029-08-15
13/2/2033 giờ 23:13:49,2033-02-13
20-10-1999,1999-10-10
2006-01-01T22:02:07,2006-01-01
10 tháng 6 năm 2006,2006-06-10
The system recorded 20200904032045,2020-09-04
Ngày 6-2-2020,2020-02-06
1192554000000000,2007-10-17
1996-08-30T04:48:50+2500,1996-08-30
2008-04-14T12:20:56-05:00,2008-04-14
5.6.2005T6-19-28,2005-06-05
28.2.2024T5-57-46,2024-02-28
2071933200000000000,2035-08-29
Ngày 7-9-1997,1997-09-07
2024_10_30T18_44_31+0500,2024-10-30
1996-09-16T04:14:50+2500,1996-09-16
2023-05-06T15:07:59Z,2023-05-06
Ngày 28-8-2002,2002-08-28
2022-06-03T03:07:32+2500,2022-06-03
2013-03-20T19:40:52Z+3,2013-03-20
26_05_99,1999-05-26
6.9.2014T21-39-7,2014-09-06
"18th of October, 2026",2026-10-18
26.8.1992T11-32-21,1992-08-26
2023 01 14,2023-01-14
20051026061837358466,2005-10-26
2019-02-27T20:21:36.887303Z,2019-02-27
23 Sep 2024,2024-09-23
2034-04-18T14:35:04Z+3,2034-04-18
8 November 2016,2016-11-08
1051290000,2003-04-26
1998-09-13T10:44:46Z+3,1998-09-13
Ngày 16-12-2029,2029-12-16
2033_01_21T19_51_38-0330,2033-01-21
1997-01-03T11:33:12-0300,1997-01-03
21|02|00,2000-02-21
1991-03-22T14:12:34.691Z,1991-03-22
20290331174320489326,2029-03-31
"17th of May, 2027",2027-05-17
1625936400000,2021-07-11
1996-09-08,1996-09-08
1998-10-19T20:24:42.946528711Z,1998-10-19
1873558800000000,2029-05-16
1993827600000,2033-03-08
20311222021818364745,2031-12-22
2022-05-02T09:02:06+2500,2022-05-02
"21th of April, 2003",2003-04-21
1990-10-09T14:03:41.983768615Z,1990-10-09
2025/5/19T132143,2025-05-19
20 tháng 8 năm 2024,2024-08-20
2029-07-01T20:49:10Z,2029-07-01
Sự kiện diễn ra vào 28/10/2011 18:42,2011-10-28
8-5-2003,2003-05-04
1990-09-25T14:59:18+2500,1990-09-25
10/11/2004,2004-10-11
14 tháng 8 năm 2001,2001-08-14
22-8-2002,2002-08-11
2024/2/8T42630,2024-02-08
The system recorded 20081005214027,2008-10-05
6-12-2002,2002-12-06
2008/10/14T13211,2008-10-14
2-4-2003,2003-04-01
14 Aug 1994,1994-08-14
2006-02-28T10:10:47+2500,2006-02-28
1 tháng 6 năm 2028,2028-06-01
1488819600000,2017-03-07
12_14_2035,2035-12-14
7.5.2009T2-37-14,2009-05-07
2020-03-27T07:00:00Z+3,2020-03-27
25 tháng 9 năm 2028,2028-09-25
Event at 2000-10-25T22:24:6,2000-10-25
1216573200,2008-07-21
Sự kiện diễn ra vào 19/10/2012 5:56,2012-10-19
The system recorded 20220827092842,2022-08-27
8 tháng 10 năm 2019,2019-10-08
987699600,2001-04-20
2/20-2013,2013-10-02
1030467600000000000,2002-08-28
ngày 19 tháng 5 năm 1990,1990-05-19
20150901105238503545199,2015-09-01
1937235600000,2031-05-23
29/6-2034,2034-03-29
2006-01-06T19:10:23+0500,2006-01-06
17.12.2011T17-4-21,2011-12-17
860432400,1997-04-08
4-5-2022,2022-05-04
22/4/2007 giờ 10:8:59,2007-04-22
03-08-2019,2019-03-08
2032-10-18T12:31:15+08,2032-10-18
26 October 2030,2030-10-26
13-2-2025,2025-02-13
2 tháng 11 năm 2007,2007-11-02
8 Feb 2003,2003-02-08
1957539600,2032-01-13
18-9-1991,1991-09-18
ngày 13 tháng 7 năm 2012,2012-07-13
2033-03-24T10:04:10,2033-03-24
15 Jun 1996,1996-06-15
11.10.2004T3-46-34,2004-10-11
2017_04_10T14_6_39+0500,2017-04-10
2026/4/6T52914,2026-04-06
ngày 17 tháng 7 năm 2024,2024-07-17
2013-08-22T01:41:26.171192Z,2013-08-22
20110709185559,2011-07-09
2032_04_04T11_42_47+0500,2032-04-04
2006-05-26T15:44:04Z,2006-05-26
2028_01_20T8_5_26+2500,2028-01-20
13-8-2025,2025-08-13
ngày 30 tháng 10 năm 1993,1993-10-30
17-1-1994,1994-01-17
2000.05.09,2000-05-09
2029-06-22T11:53:32.045904070Z,2029-06-22
2007-03-05T09:55:21.585757Z,2007-03-05
2033-06-29T12:11:16+3,2033-06-29
2013_11_20T8_45_44+07:00,2013-11-20
Ngày 13-2-2030,2030-02-13
1762275600000000000,2025-11-05
2000-11-02T14:20:54.529Z,2000-11-02
1991-08-30T01:14:45,1991-08-30
2020-03-07T09:23:10+08,2020-03-07
Ngày 20-3-2033,2033-03-20
The system recorded 20221126165218,2022-11-26
32-11-2033,2033-11-16
30-10-2010,2010-10-15
2015_06_05T8_48_21+3,2015-06-05
"27th of September, 1993",1993-09-27
20080811023610803,2008-08-11
20180129112528264674155,2018-01-29
1587920400000,2020-04-27
1056992400,2003-07-01
864579600000,1997-05-26
06.04.2020,2020-06-04
2003-09-12T12:42:15+2500,2003-09-12
ngày 14 tháng 5 năm 2004,2004-05-14
2023_02_17T23_14_34+0500,2023-02-17
20240630114501933823283,2024-06-30
2020-02-17T17:34:34Z+3,2020-02-17
20150223120040445416514,2015-02-23
6-10-2005,2005-10-06
1330362000,2012-02-28
18-6-2020,2020-06-09
01_21_1993,1993-01-21
ngày 16 tháng 6 năm 1994,1994-06-16
2025-12-10T22:46:27.426040Z,2025-12-10
24 tháng 12 năm 1996,1996-12-24
2009-06-22T08:11:52,2009-06-22
2020_08_03,2020-08-03
2035-11-20T07:14:20.208Z,2035-11-20
3 Jun 2005,2005-06-03
2027/1/12T172923,2027-01-12
1994-08-10T15:22:29Z+3,1994-08-10
26/4/2007 giờ 1:12:35,2007-04-26
9 November 1991,1991-11-09
"6th of July, 2017",2017-07-06
20131026200952141701626,2013-10-26
Sự kiện diễn ra vào 9/2/2019 17:2,2019-02-09
23 Sep 2030,2030-09-23
2019-08-25T07:29:26,2019-08-25
"March 3, 2025",2025-03-03
Ngày 16-4-2003,2003-04-16
2023-10-31T23:57:44.246188895Z,2023-10-31
ngày 12 tháng 10 năm 2032,2032-10-12
1459616400000,2016-04-03
19910515181833306591413,1991-05-15
The system recorded 20090802025812,2009-08-02
"30th of October, 1999",1999-10-30
22 tháng 2 năm 1999,1999-02-22
8/14-1995,1995-07-08
1138813200000000000,2006-02-02
The system recorded 20180508004337,2018-05-08
2018_07_26T13_34_22+00:00,2018-07-26
The system recorded 19930303183251,1993-03-03
1999-02-28T04:34:58Z+3,1999-02-28
2010_10_28T9_53_48+2500,2010-10-28
20151017095327,2015-10-17
1802451600,2027-02-13
4/12/2029,2029-12-04
"December 14, 1998",1998-12-14
1890493200,2029-11-28
Sự kiện diễn ra vào 28/12/2017 15:11,2017-12-28
1/8-1992,1992-04-01
846176400000000000,1996-10-25
20060623150319583430266,2006-06-23
06.05.17,2017-05-06
2021-03-16T21:12:45-0330,2021-03-16
2006-12-31T06:57:49+07:00,2006-12-31
14.10.2032T22-17-59,2032-10-14
2035-11-02T21:52:32,2035-11-02
2025-02-02T16:07:23Z+3,2025-02-02
1601139600,2020-09-27
20280201031647223697,2028-02-01
13 Oct 2004,2004-10-13
"12th of March, 2015",2015-03-12
2000-09-27T17:13:09Z+3,2000-09-27
20171123030134888747649,2017-11-23
958842000000000000,2000-05-21
Sự kiện diễn ra vào 6/6/2005 23:50,2005-06-06
1991-11-24T01:07:33,1991-11-24
1/10/2008 giờ 18:6:13,2008-10-01
1528304400000000,2018-06-07
ngày 10 tháng 12 năm 2004,2004-12-10
2011-11-25T21:01:39.286708958Z,2011-11-25
24-9-2031,2031-09-24
Ngày 13-3-2004,2004-03-13
2032/07/03,2032-07-03
2008-10-09T22:10:56+0500,2008-10-09
12 June 1991,1991-06-12
2032-09-28T17:55:44+2500,2032-09-28
ngày 18 tháng 9 năm 2018,2018-09-18
The system recorded 19910610021009,1991-06-10
19961105001412432,1996-11-05
748544400000,1993-09-21
20340402234245996,2034-04-02
13 Jul 2031,2031-07-13
2017-07-02T02:12:29+2500,2017-07-02
20111112071513769,2011-11-12
Ngày 21-11-2028,2028-11-21
9.3.2022T18-36-30,2022-03-09
27 tháng 10 năm 2010,2010-10-27
2003_01_11T9_26_2-0300,2003-01-11
4 tháng 9 năm 2018,2018-09-04
20281224135919478,2028-12-24
2012 06 22,2012-06-22
The system recorded 20050501120129,2005-05-01
1984496400000,2032-11-20
10_25_1997,1997-10-25
27 tháng 8 năm 1993,1993-08-27
"4th of January, 2015",2015-01-04
2024-04-05T19:02:20,2024-04-05
28/20-1995,1995-10-28
Event at 2013-03-05T8:58:14,2013-03-05
958842000000000,2000-05-21
ngày 8 tháng 6 năm 1993,1993-06-08
2029-02-17T12:13:33,2029-02-17
2010-10-27T07:54:10.686837769Z,2010-10-27
2008/4/4T11313,2008-04-04
1994-02-22T05:00:54+00:00,1994-02-22
20071208122543,2007-12-08
2030-12-26T19:37:37.579Z,2030-12-26
ngày 28 tháng 3 năm 2026,2026-03-28
20-4-2016,2016-04-10
21.7.1995T11-40-56,1995-07-21
Ngày 23-6-2007,2007-06-23
1996-06-20T04:26:37-0300,1996-06-20
2008/9/18T02449,2008-09-18
1565629200000000000,2019-08-13
1329411600000000,2012-02-17
20041214091434050849,2004-12-14
696013200000000,1992-01-22
1224608400,2008-10-22
14.7.2017,2017-07-14
29 tháng 12 năm 1992,1992-12-29
898966800000,1998-06-28
2016_09_11T4_8_16+0500,2016-09-11
2027-01-05T03:56:51+2500,2027-01-05
1671382800,2022-12-19
2014 09 16,2014-09-16
20290713113112747076765,2029-07-13
2031/7/17T17146,2031-07-17
642877200000000000,1990-05-17
"March 25, 2022",2022-03-25
10.3.2006T4-24-36,2006-03-10
2023-10-05T05:18:43.163Z,2023-10-05
2022-01-14T14:38:27.682917113Z,2022-01-14
The system recorded 19921129144026,1992-11-29
20/14-2034,2034-07-20
1411664400000,2014-09-26
12 January 2018,2018-01-12
2031|09|26,2031-09-26
"November 18, 2032",2032-11-18
15 May 2002,2002-05-15
1006102800000000,2001-11-19
1618160400000000000,2021-04-12
5/22-2035,2035-11-05
10.10.2024,2024-10-10
2005-04-04T03:31:58.638Z,2005-04-04
2024-10-03T20:54:42,2024-10-03
1544115600000000,2018-12-07
13.07.19,2019-07-13
1375117200000,2013-07-30
2013/5/31T35613,2013-05-31
2022-08-15T01:18:59+00:00,2022-08-15
2028-02-21T04:34:31Z+3,2028-02-21
1523638800,2018-04-14
ngày 3 tháng 10 năm 2000,2000-10-03
2019_06_30T22_13_22-0300,2019-06-30
2024-11-17T01:22:43.756Z,2024-11-17
5.12.2014T20-30-58,2014-12-05
2017 04 11,2017-04-11
20330616035416032392,2033-06-16
Ngày 21-2-1994,1994-02-21
20080112141007440911,2008-01-12
22 November 2031,2031-11-22
16 Nov 1992,1992-11-16
Sự kiện diễn ra vào 7/4/1993 20:34,1993-04-07
2007_04_01T15_0_45Z,2007-04-01
2021-04-09T16:57:04.996Z,2021-04-09
1 Dec 1998,1998-12-01
The system recorded 20220726202957,2022-07-26
The system recorded 20260708000302,2026-07-08
1992-03-16,1992-03-16
30-4-2034,2034-04-30
6 8 2016,2016-08-06
ngày 25 tháng 7 năm 2021,2021-07-25
16-01-13,2013-01-16
14 October 2017,2017-10-14
2010-07-21T06:34:27.840860512Z,2010-07-21
"8th of June, 2021",2021-06-08
6.1.2022T13-41-52,2022-01-06
Ngày 9-8-2014,2014-08-09
2019-04-25T22:16:52.577705354Z,2019-04-25
2020-02-19T16:24:57,2020-02-19
42-9-2004,2004-09-21
1999_08_19T7_11_52Z,1999-08-19
2000.03.22,2000-03-22
09|13|2008,2008-09-13
1637859600000000000,2021-11-26
6 tháng 7 năm 2025,2025-07-06
1992_08_28T20_1_1Z+3,1992-08-28
23 August 1992,1992-08-23
2031-08-24T05:50:44Z+3,2031-08-24
2009-12-29T05:18:04.752946Z,2009-12-29
11.10.2028T14-36-34,2028-10-11
23-03-06,2006-03-23
2028-06-26T15:19:29Z+3,2028-06-26
20281028173742,2028-10-28
26/07/26,2026-07-26
1917104400000000000,2030-10-02
20/2-2023,2023-01-20
1992-09-01T09:55:46.866781607Z,1992-09-01
30/2-2035,2035-01-30
The system recorded 20080704184634,2008-07-04
20340328051425391569294,2034-03-28
1689354000000,2023-07-15
50-9-2035,2035-09-25
7/24-1991,1991-12-07
1465750800000000,2016-06-13
1991-01-17T06:44:10.841025Z,1991-01-17
2024_02_28T20_37_3+08,2024-02-28
19930126082401187955909,1993-01-26
"September 17, 2014",2014-09-17
2013-10-28T22:07:46,2013-10-28
10-15-2024,2024-10-15
895942800000,1998-05-24
23 12 2002,2002-12-23
5/6/2015 giờ 16:21:17,2015-06-05
2003-08-11T02:40:34+07:00,2003-08-11
20110203055938304,2011-02-03
2009-07-27T07:29:43+2500,2009-07-27
2009-05-07T20:02:42.058152254Z,2009-05-07
"5th of August, 2003",2003-08-05
1-12-1996,1996-12-01
3.2.2001T1-12-3,2001-02-03
"October 20, 2022",2022-10-20
2017-02-13T03:11:58.895871Z,2017-02-13
2027-02-02T21:05:50Z+3,2027-02-02
09.11.1995,1995-09-11
Event at 2027-02-25T10:49:6,2027-02-25
2020-10-10T03:48:43.787687662Z,2020-10-10
Sự kiện diễn ra vào 29/1/2010 11:14,2010-01-29
2028-09-19T17:37:15-0300,2028-09-19
1890493200000000,2029-11-28
ngày 25 tháng 8 năm 2018,2018-08-25
Ngày 6-3-2019,2019-03-06
19 Jun 2025,2025-06-19
2000_08_26T19_26_58-05:00,2000-08-26
23/11/1999 giờ 8:46:0,1999-11-23
1997_05_28T10_50_46+07:00,1997-05-28
2023-01-09T05:47:28Z+3,2023-01-09
27/20-1992,1992-10-27
06 27 2027,2027-06-27
29/18-1992,1992-09-29
The system recorded 20070522222005,2007-05-22
2026_12_18,2026-12-18
2027-01-25T11:38:37,2027-01-25
28.09.18,2018-09-28
01_07_09,2009-07-01
The system recorded 20311103222054,2031-11-03
ngày 9 tháng 6 năm 2021,2021-06-09
1995_03_15T12_13_23-0330,1995-03-15
2023-09-04T12:02:35.411543403Z,2023-09-04
2035-10-11T23:31:49,2035-10-11
"September 1, 1992",1992-09-01
2012-03-28T05:39:31Z+3,2012-03-28
1-1-2015,2015-01-01
1334422800000000000,2012-04-15
01_11_1992,1992-01-11
1995-01-23T07:30:00.900023Z,1995-01-23
2029/5/5T2493,2029-05-05
2014-07-07T13:31:48.121967037Z,2014-07-07
Ngày 9-9-1991,1991-09-09
1747760400000000000,2025-05-21
Ngày 26-5-2028,2028-05-26
The system recorded 19920613152314,1992-06-13
Sự kiện diễn ra vào 21/11/2010 21:48,2010-11-21
20170927184658015152,2017-09-27
4-11-2032,2032-11-04
20350227072912618157735,2035-02-27
ngày 29 tháng 3 năm 2010,2010-03-29
20090511223731,2009-05-11
4-5-2027,2027-05-02
2030-02-10T20:09:16+2500,2030-02-10
2018/4/14T11454,2018-04-14
17 Sep 1990,1990-09-17
27.4.2000,2000-04-27
Event at 2024-10-15T23:38:25,2024-10-15
1283360400000,2010-09-02
Ngày 19-6-2034,2034-06-19
20210519075502,2021-05-19
8-11-1996,1996-11-04
ngày 22 tháng 11 năm 2031,2031-11-22
1880038800000000,2029-07-30
26 September 2004,2004-09-26
1415725200,2014-11-12
20061107160920622458559,2006-11-07
4-1-2008,2008-01-02
2000/5/15T133513,2000-05-15
2010-05-15T19:01:20,2010-05-15
2020_10_20T22_3_23+08,2020-10-20
19920323070527639458,1992-03-23
30.4.2004T22-41-46,2004-04-30
4 tháng 11 năm 2021,2021-11-04
4/7/2002 giờ 8:59:21,2002-07-04
2002-06-25T20:40:25.907Z,2002-06-25
2077549200000000000,2035-11-02
6-12-2005,2005-12-06
20240706083333867257,2024-07-06
2013-07-03T10:08:32.590Z,2013-07-03
2004-03-13T04:02:27.094155184Z,2004-03-13
1992-05-03T10:50:46.184238Z,1992-05-03
19960719073640,1996-07-19
2017_11_12T6_19_40+0500,2017-11-12
25/20-1992,1992-10-25
9/6/2035,2035-06-09
05-10-11,2011-10-05
Sự kiện diễn ra vào 22/8/2000 19:0,2000-08-22
09/14/2026,2026-09-14
19910126103919203524,1991-01-26
2000-12-09T04:36:31+2500,2000-12-09
1631379600000000000,2021-09-12
"May 13, 1997",1997-05-13
"3rd of August, 2032",2032-08-03
01|24|2019,2019-01-24
30/10/2012,2012-10-30
20/5/2004 giờ 7:10:9,2004-05-20
19 January 2005,2005-01-19
20/14-2005,2005-07-20
Sự kiện diễn ra vào 27/3/2021 16:48,2021-03-27
25/10/2016 giờ 2:37:56,2016-10-25
1995-08-05T11:46:28Z+3,1995-08-05
19921125042128,1992-11-25
1990/8/10T15199,1990-08-10
1993 10 22,1993-10-22
10/11/14,2014-11-10
11 Aug 1994,1994-08-11
20270501184700945639,2027-05-01
2030-06-30T15:29:12,2030-06-30
25 02 93,1993-02-25
34-6-2025,2025-06-17
2016.07.04,2016-07-04
The system recorded 19910314213145,1991-03-14
2021-08-03T02:32:50+2500,2021-08-03
01 22 1995,1995-01-22
19920516151537871,1992-05-16
1995-08-14T09:27:28.968355Z,1995-08-14
Sự kiện diễn ra vào 25/11/1999 10:5,1999-11-25
2027-02-24T07:34:59.586Z,2027-02-24
Event at 2027-12-29T1:43:5,2027-12-29
1427389200,2015-03-27
901990800000000000,1998-08-02
5-4-2018,2018-04-05
2024-11-03T09:01:14+2500,2024-11-03
1124557200,2005-08-21
1998-09-08T05:28:12+2500,1998-09-08
20230625204123,2023-06-25
1095699600000000000,2004-09-21
10/31/2007,2007-10-31
27/7/2007 giờ 17:20:39,2007-07-27
1999 12 06,1999-12-06
1849626000,2028-08-12
1803402000000000000,2027-02-24
2002-12-02T12:38:26.844Z,2002-12-02
2026-10-10T01:35:24,2026-10-10
1579107600000000,2020-01-16
2032-09-22T02:16:13.363870Z,2032-09-22
12-11-2011,2011-11-12
20310811233212398,2031-08-11
25/9/2031 giờ 7:37:38,2031-09-25
2035-08-15T21:36:06,2035-08-15
888858000,1998-03-03
5-8-2033,2033-08-05
12|22|2014,2014-12-22
1359651600,2013-02-01
1994-08-11T17:53:33Z+3,1994-08-11
2035-05-19T19:13:32.310680037Z,2035-05-19
4 Jan 2035,2035-01-04
04/23/1995,1995-04-23
775328400000,1994-07-28
19910101063606040810,1991-01-01
1998-09-20T11:16:39,1998-09-20
20250913072529,2025-09-13
19.12.1998,1998-12-19
1029603600000000,2002-08-18
Sự kiện diễn ra vào 31/12/2002 13:21,2002-12-31
"7th of November, 2026",2026-11-07
19910930200651512,1991-09-30
"30th of September, 2014",2014-09-30
2034-10-26T12:58:31+07:00,2034-10-26
17 March 2010,2010-03-17
Ngày 6-12-2002,2002-12-06
8|8|1994,1994-08-08
18-1-2006,2006-01-18
20351030162724904664386,2035-10-30
2032-09-25T13:36:02+2500,2032-09-25
19950402071344060482639,1995-04-02
2032-05-28T22:09:39,2032-05-28
2034-03-19T02:31:11.567624051Z,2034-03-19
42-10-2029,2029-10-21
Ngày 5-4-2031,2031-04-05
1996/11/27T31841,1996-11-27
654973200000,1990-10-04
1999_07_30T2_2_40+07:00,1999-07-30
Event at 1996-08-01T13:32:19,1996-08-01
953485200,2000-03-20
2000-08-02T12:21:24+2500,2000-08-02
2014736400000,2033-11-05
2010-02-16T01:06:04+2500,2010-02-16
"July 24, 2000",2000-07-24
Ngày 20-12-2000,2000-12-20
8.4.1999T9-13-31,1999-04-08
20050712082528,2005-07-12
Sự kiện diễn ra vào 31/1/2028 2:9,2028-01-31
3 tháng 5 năm 2010,2010-05-03
2018-06-26T16:55:20Z+3,2018-06-26
2007-04-23T00:14:00.748004256Z,2007-04-23
Ngày 27-2-2031,2031-02-27
23.10.2028,2028-10-23
21 Jan 2016,2016-01-21
20-1-2035,2035-01-10
12/14/2001,2001-12-14
20040209074232,2004-02-09
08.14.2027,2027-08-14
6/22-2012,2012-11-06
16/6-1998,1998-03-16
19 tháng 6 năm 2008,2008-06-19
23 Nov 2031,2031-11-23
2017-10-27T08:18:03Z+3,2017-10-27
20160108232509567661114,2016-01-08
20260924104430840207426,2026-09-24
19/14-2006,2006-07-19
ngày 7 tháng 7 năm 2031,2031-07-07
2022/6/29T142425,2022-06-29
20081204061826884,2008-12-04
ngày 8 tháng 12 năm 2003,2003-12-08
Event at 1994-08-14T9:4:12,1994-08-14
"31th of August, 1991",1991-08-31
20280506144210,2028-05-06
13-4-1996,1996-04-13
2001-05-09T15:33:04-05:00,2001-05-09
"14th of October, 2004",2004-10-14
8 Mar 2019,2019-03-08
3 tháng 1 năm 2019,2019-01-03
2014|12|07,2014-12-07
4-10-2005,2005-10-04
The system recorded 20130507220931,2013-05-07
24_08_15,2015-08-24
2006-12-03T04:43:30.161Z,2006-12-03
Ngày 25-12-2030,2030-12-25
1133197200,2005-11-29
2022-07-31T10:00:16-05:00,2022-07-31
11/8/2000,2000-08-11
1994-08-28T00:49:06.697937Z,1994-08-28
20220608035620,2022-06-08
Sự kiện diễn ra vào 30/11/2003 15:45,2003-11-30
20220331065255,2022-03-31
1 Jun 2002,2002-06-01
2028-02-25T21:39:44.788508913Z,2028-02-25
1011632400000,2002-01-22
ngày 26 tháng 11 năm 2009,2009-11-26
2000-08-08T11:23:46,2000-08-08
31/24-2019,2019-12-31
2012-01-23T09:09:15+2500,2012-01-23
ngày 19 tháng 12 năm 2002,2002-12-19
Sự kiện diễn ra vào 4/6/1993 2:56,1993-06-04
"24th of November, 2019",2019-11-24
31/12/2016 giờ 7:7:16,2016-12-31
Sự kiện diễn ra vào 22/7/2034 3:59,2034-07-22
2017-02-03T02:44:14Z+3,2017-02-03
20271007005708693002,2027-10-07
13/12-2024,2024-06-13
The system recorded 20020109050853,2002-01-09
2010-09-24T05:52:36.573Z,2010-09-24
2019-04-14T19:18:27.669594Z,2019-04-14
ngày 13 tháng 4 năm 1993,1993-04-13
1809018000,2027-04-30
26/10/2012 giờ 16:38:33,2012-10-26
2032-05-31T05:12:30.592888Z,2032-05-31
2017-04-30T04:12:55.015681929Z,2017-04-30
2020/12/26T34324,2020-12-26
30/18-1997,1997-09-30
Event at 2019-03-22T4:28:55,2019-03-22
27 September 2021,2021-09-27
2007-08-29T18:16:17Z+3,2007-08-29
632422800000000,1990-01-16
2025/6/14T51512,2025-06-14
28 tháng 5 năm 2029,2029-05-28
1994-11-19T11:28:30.092Z,1994-11-19
24-1-2031,2031-01-24
3.7.2013T14-11-19,2013-07-03
1698080400000000,2023-10-24
6 Jul 1999,1999-07-06
"13th of December, 2006",2006-12-13
ngày 27 tháng 5 năm 2003,2003-05-27
Ngày 26-3-2018,2018-03-26
"24th of April, 2024",2024-04-24
2006_04_10T21_42_34Z,2006-04-10
2020-11-17T15:16:47+2500,2020-11-17
07|28|2031,2031-07-28
20340716074716,2034-07-16
07 07 2016,2016-07-07
1008694800,2001-12-19
2035-05-01T20:50:34.285730Z,2035-05-01
25 Sep 2009,2009-09-25
2034-05-17T19:50:03Z+3,2034-05-17
Sự kiện diễn ra vào 20/7/1994 19:27,1994-07-20
14.6.2029T13-32-1,2029-06-14
20240422230319,2024-04-22
Event at 2002-09-16T22:13:59,2002-09-16
20141216180318274179,2014-12-16
"16th of April, 2009",2009-04-16
20260302115914597,2026-03-02
Sự kiện diễn ra vào 8/5/2026 17:25,2026-05-08
11-11-2028,2028-11-11
2014-02-27T22:20:20-0300,2014-02-27
2025/3/23T21243,2025-03-23
The system recorded 20091225020231,2009-12-25
05.24.2027,2027-05-24
812998800000000000,1995-10-07
Ngày 19-12-1998,1998-12-19
2001-06-10T05:25:54Z+3,2001-06-10
1998/9/18T132524,1998-09-18
2002-05-11T10:50:47-0330,2002-05-11
31.7.1998T10-29-39,1998-07-31
2032-11-09T23:37:30.226Z,2032-11-09
"June 9, 1996",1996-06-09
1821632400,2027-09-23
34-5-2018,2018-05-17
The system recorded 20130626182823,2013-06-26
3-7-2016,2016-07-03
20270705224816,2027-07-05
1965920400,2032-04-19
20 Jan 2021,2021-01-20
Sự kiện diễn ra vào 30/8/1994 20:53,1994-08-30
1990-10-18T09:03:45,1990-10-18
19940601092014847748,1994-06-01
2015_09_17T7_39_30-0300,2015-09-17
2029 05 23,2029-05-23
28.11.2006,2006-11-28
16 May 1990,1990-05-16
20241009025200145,2024-10-09
19 Mar 2000,2000-03-19
1476118800000000000,2016-10-11
720896400,1992-11-05
10-6-2017,2017-06-05
18/7/2003 giờ 4:15:0,2003-07-18
2012-06-18T03:49:45Z+3,2012-06-18
1295110800000,2011-01-16
17-05-13,2013-05-17
2012/3/28T19284,2012-03-28
1872954000000000,2029-05-09
20250523132311,2025-05-23
The system recorded 20130609014445,2013-06-09
2020-04-09T03:42:08.165775Z,2020-04-09
2006-09-25T21:36:01,2006-09-25
60-3-2028,2028-03-30
11_09_2019,2019-11-09
2032-01-26T07:04:26+2500,2032-01-26
30/14-2035,2035-07-30
20330813082830,2033-08-13
"January 20, 2029",2029-01-20
19930831054141088779422,1993-08-31
10 August 2031,2031-08-10
1998-06-25T04:40:33.439701Z,1998-06-25
2-3-2026,2026-03-02
2031-10-14T19:45:25Z+3,2031-10-14
26/14-2030,2030-07-26
2030-10-04T23:29:00.716445409Z,2030-10-04
2029-10-26T17:47:29.498018Z,2029-10-26
25 12 25,2025-12-25
2034-09-28T10:41:31-05:00,2034-09-28
Ngày 19-12-2026,2026-12-19
2024-04-25T11:10:12.297621Z,2024-04-25
6.3.2017T13-0-3,2017-03-06
20340429015816596,2034-04-29
ngày 26 tháng 9 năm 2003,2003-09-26
Sự kiện diễn ra vào 6/4/1991 17:7,1991-04-06
ngày 29 tháng 12 năm 2022,2022-12-29
Event at 2019-02-02T12:39:30,2019-02-02
"31th of October, 2013",2013-10-31
12_16_2035,2035-12-16
2031-10-07T22:16:47+2500,2031-10-07
16 Oct 2018,2018-10-16
30/3/2005 giờ 23:22:26,2005-03-30
2027-11-20T14:56:57Z+3,2027-11-20
5 tháng 9 năm 2018,2018-09-05
The system recorded 19951124151258,1995-11-24
20140208213023119514,2014-02-08
20040901115418052575,2004-09-01
2008-12-10T09:06:41.318072207Z,2008-12-10
"14th of August, 2009",2009-08-14
12 tháng 3 năm 2002,2002-03-12
2033-05-10T18:13:54.580Z,2033-05-10
872787600000000000,1997-08-29
19980408210639853681170,1998-04-08
1236963600000000,2009-03-14
18/11/2013 giờ 13:27:50,2013-11-18
29 Jan 2002,2002-01-29
20210714031455338,2021-07-14
2000-04-16T02:17:16+3,2000-04-16
2007-07-24T22:50:19.852Z,2007-07-24
24-8-2023,2023-08-24
2023-12-05T18:02:01.146Z,2023-12-05
8/8/2010 giờ 12:54:24,2010-08-08
2006/3/19T11414,2006-03-19
1318438800000000000,2011-10-13
1557766800000000000,2019-05-14
14/9/1995 giờ 15:46:36,1995-09-14
20/24-1992,1992-12-20
2032-11-04T09:24:50Z+3,2032-11-04
1993-03-03T23:17:37+00:00,1993-03-03
20051003181141184610524,2005-10-03
29.09.12,2012-09-29
2013-03-12T11:50:01.855684Z,2013-03-12
2037027600000000,2034-07-21
The system recorded 20270127234655,2027-01-27
1660410000,2022-08-14
ngày 23 tháng 3 năm 2005,2005-03-23
2030_09_21T9_43_39+0500,2030-09-21
2019-05-12T23:55:19+2500,2019-05-12
Event at 2010-12-10T23:20:17,2010-12-10
17 Oct 2021,2021-10-17
20010324210136867812315,2001-03-24
19/20-2007,2007-10-19
1937062800,2031-05-21
30/8-2028,2028-04-30
12-2-2015,2015-02-06
2025-05-12T21:40:48.423711262Z,2025-05-12
26 tháng 2 năm 1994,1994-02-26
2024499600000000000,2034-02-26
46-1-2013,2013-01-23
20211112230649066,2021-11-12
16.11.1999T20-38-1,1999-11-16
ngày 8 tháng 4 năm 2033,2033-04-08
Event at 2009-12-06T14:21:32,2009-12-06
25 tháng 11 năm 2010,2010-11-25
2003-08-08T16:00:17+07:00,2003-08-08
The system recorded 20051007163512,2005-10-07
11/28/2007,2007-11-28
Ngày 2-9-1992,1992-09-02
The system recorded 20100808075253,2010-08-08
21_4_2030,2030-04-21
20050917061857164941522,2005-09-17
The system recorded 20290917081311,2029-09-17
ngày 21 tháng 3 năm 1994,1994-03-21
27.2.1991T19-44-38,1991-02-27
Event at 2003-03-14T9:58:49,2003-03-14
"July 7, 2009",2009-07-07
1499446800000000,2017-07-08
20050515202803639193,2005-05-15
Event at 2032-07-05T18:50:1,2032-07-05
25-10-2022,2022-10-25
2024-10-23T02:08:23,2024-10-23
11.5.1992,1992-05-11
"July 4, 1997",1997-07-04
2035/5/11T152820,2035-05-11
Sự kiện diễn ra vào 19/5/2021 1:4,2021-05-19
Sự kiện diễn ra vào 17/10/2003 8:35,2003-10-17
12 Nov 2029,2029-11-12
16 Feb 2009,2009-02-16
13/8/1995 giờ 9:34:22,1995-08-13
2011-09-20T22:13:07.725287280Z,2011-09-20
2014-08-08T01:40:52+2500,2014-08-08
19/8-1990,1990-04-19
1305738000000,2011-05-19
Event at 2006-12-07T22:25:25,2006-12-07
19920420080522061355,1992-04-20
2015-12-14T06:55:14,2015-12-14
1561395600000,2019-06-25
ngày 13 tháng 6 năm 1990,1990-06-13
2018-10-24T03:28:49.021Z,2018-10-24
Event at 2002-08-19T13:44:40,2002-08-19
36-3-2001,2001-03-18
25 tháng 9 năm 2021,2021-09-25
1234976400000000000,2009-02-19
2027-03-07T23:02:49.629347249Z,2027-03-07
2008-10-04T22:57:40.146350213Z,2008-10-04
ngày 1 tháng 12 năm 2016,2016-12-01
26 Mar 2010,2010-03-26
11/6/2004 giờ 10:26:10,2004-06-11
The system recorded 19940125013912,1994-01-25
Ngày 30-8-2000,2000-08-30
20111121002533099,2011-11-21
19990823175428207,1999-08-23
ngày 15 tháng 6 năm 1995,1995-06-15
Sự kiện diễn ra vào 22/11/2021 16:33,2021-11-22
12|23|2019,2019-12-23
The system recorded 20250615160417,2025-06-15
The system recorded 19910105035334,1991-01-05
15 tháng 5 năm 1992,1992-05-15
25-9-2007,2007-09-25
2004-06-03T02:22:53,2004-06-03
1992-09-06T03:43:56Z+3,1992-09-06
936464400000000,1999-09-05
"6th of January, 1996",1996-01-06
20100222231006840265568,2010-02-22
"September 14, 1990",1990-09-14
2013/1/15T5218,2013-01-15
20030829071708306,2003-08-29
1980608400000000,2032-10-06
6-8-1998,1998-08-03
Event at 2005-02-18T0:24:24,2005-02-18
2001-03-07T03:35:14+2500,2001-03-07
22 tháng 2 năm 2027,2027-02-22
20_8_2025,2025-08-20
20090428070008,2009-04-28
6|6|1991,1991-06-06
24 May 1994,1994-05-24
31 March 2014,2014-03-31
2035/10/26T11921,2035-10-26
2020-07-12T05:53:07+2500,2020-07-12
"26th of July, 2032",2032-07-26
2013-03-19T12:06:20.156369Z,2013-03-19
1360947600000,2013-02-16
29/14-2006,2006-07-29
2031_07_11T5_51_37-0300,2031-07-11
26 10 1998,1998-10-26
19941124044251829,1994-11-24
7 April 1997,1997-04-07
"16th of November, 1994",1994-11-16
Sự kiện diễn ra vào 22/2/2004 15:22,2004-02-22
1131469200,2005-11-09
Sự kiện diễn ra vào 29/11/2015 18:10,2015-11-29
Ngày 1-12-2031,2031-12-01
Ngày 29-6-2000,2000-06-29
26 07 27,2027-07-26
2010-02-13T12:43:23.374Z,2010-02-13
1088269200,2004-06-27
13/11/03,2003-11-13
02|05|91,1991-05-02
10 Sep 2014,2014-09-10
Ngày 12-3-2004,2004-03-12
12 February 2000,2000-02-12
4 tháng 6 năm 1990,1990-06-04
2025_05_31T19_44_26+07:00,2025-05-31
6/10/2011 giờ 19:1:9,2011-10-06
20280111061900654532622,2028-01-11
1-5-1990,1990-05-01
649011600000000000,1990-07-27
4-2-2017,2017-02-02
1105462800000000000,2005-01-12
1422464400000000,2015-01-29
20251227165534252658638,2025-12-27
20040527160641421,2004-05-27
2009-09-11T09:28:11.211199584Z,2009-09-11
"14th of April, 2012",2012-04-14
1998-06-12T23:33:24.011Z,1998-06-12
1990 05 17,1990-05-17
705258000,1992-05-08
"March 29, 2012",2012-03-29
2021_01_23T20_45_54-0330,2021-01-23
15/4/2012 giờ 3:56:28,2012-04-15
2011-08-11T01:51:10.799Z,2011-08-11
20140518092141370,2014-05-18
2003-06-15T11:03:16.895323Z,2003-06-15
2006-09-15T04:30:30+2500,2006-09-15
Sự kiện diễn ra vào 20/5/2013 7:46,2013-05-20
1993-03-06T22:43:26.717912Z,1993-03-06
22/22-1992,1992-11-22
19 September 2001,2001-09-19
1941814800000,2031-07-15
1080320400,2004-03-27
2034_12_23,2034-12-23
1999/5/14T222223,1999-05-14
30-12-12,2012-12-30
2008-12-03T14:00:30,2008-12-03
22/3/2023 giờ 7:16:41,2023-03-22
8/7/2009 giờ 15:31:44,2009-07-08
"June 8, 1999",1999-06-08
2064070800000000,2035-05-30
19910906233346645064090,1991-09-06
2032-05-03T18:19:11.044Z,2032-05-03
31 05 16,2016-05-31
2014 02 03,2014-02-03
2018-03-13T19:23:14.954946358Z,2018-03-13
Ngày 29-5-2026,2026-05-29
811962000000000000,1995-09-25
716662800,1992-09-17
2014_05_25T11_10_7Z,2014-05-25
834166800000000000,1996-06-08
2003-12-16T00:14:30.433363Z,2003-12-16
1178470800000000000,2007-05-07
20290206152911,2029-02-06
20300309220537686,2030-03-09
2005_04_11T18_4_38+07:00,2005-04-11
08-31-2018,2018-08-31
29-12-1996,1996-12-29
ngày 28 tháng 8 năm 2001,2001-08-28
28/2-1995,1995-01-28
2031_01_19T21_36_12+08,2031-01-19
2029-10-02T10:26:28+2500,2029-10-02
The system recorded 20010602111904,2001-06-02
1574614800000000,2019-11-25
26 November 2026,2026-11-26
18/8/1998 giờ 18:56:7,1998-08-18
Ngày 13-10-2030,2030-10-13
1144256400,2006-04-06
2004-04-24T17:38:28.454430Z,2004-04-24
The system recorded 20031003065005,2003-10-03
5|4|1993,1993-04-05
Ngày 15-9-2035,2035-09-15
1178384400,2007-05-06
Ngày 30-12-2028,2028-12-30
832525200,1996-05-20
2004-11-18T04:48:54.205Z,2004-11-18
19980512215155,1998-05-12
672771600,1991-04-28
1734282000000,2024-12-16
20140829141818,2014-08-29
26/6-2028,2028-03-26
26/2/2026,2026-02-26
2003-09-05T22:23:26-0330,2003-09-05
20120803172711287,2012-08-03
1993-05-24T08:19:23.750160Z,1993-05-24
20300128084627138317860,2030-01-28
19971112134746,1997-11-12
30 December 2028,2028-12-30
2003-11-16T06:19:26.883887Z,2003-11-16
16-6-1993,1993-06-08
Event at 1997-10-14T11:16:40,1997-10-14
993229200000000,2001-06-23
12.08.2026,2026-12-08
20350519030209818496493,2035-05-19
1630083600000000,2021-08-28
"17th of December, 2023",2023-12-17
44-6-1997,1997-06-22
Ngày 19-2-2027,2027-02-19
20231017221054097712144,2023-10-17
2016-06-08T21:11:03+3,2016-06-08
Ngày 12-6-2006,2006-06-12
"27th of December, 2023",2023-12-27
The system recorded 20061107074825,2006-11-07
1866301200000000000,2029-02-21
1972227600000,2032-07-01
Sự kiện diễn ra vào 24/10/2017 13:21,2017-10-24
Sự kiện diễn ra vào 14/9/1999 12:26,1999-09-14
2019-04-24T09:14:32+07:00,2019-04-24
2009-08-21T09:35:06.734Z,2009-08-21
Sự kiện diễn ra vào 30/10/2024 20:57,2024-10-30
1076518800000,2004-02-12
30 March 1996,1996-03-30
2002-05-19T02:11:25.330Z,2002-05-19
2022-08-17T11:32:50.576037327Z,2022-08-17
20300617063039,2030-06-17
23.8.1996T5-28-33,1996-08-23
1559408400000000,2019-06-02
20190218114021474246,2019-02-18
23 September 1994,1994-09-23
2003-05-20T06:28:07+2500,2003-05-20
28.2.2012T3-32-22,2012-02-28
58-10-2029,2029-10-29
11.9.2000T15-53-45,2000-09-11
22/9/2016 giờ 13:44:3,2016-09-22
ngày 7 tháng 7 năm 2010,2010-07-07
2035-11-20T03:37:14+08,2035-11-20
23.8.2027T19-22-3,2027-08-23
20051231215705238,2005-12-31
5/2-2021,2021-01-05
3/12/2012 giờ 23:40:56,2012-12-03
ngày 10 tháng 6 năm 2013,2013-06-10
Sự kiện diễn ra vào 20/6/2003 17:17,2003-06-20
2029-04-02T04:02:31Z+3,2029-04-02
20340329020358,2034-03-29
Ngày 13-2-2024,2024-02-13
20/18-2023,2023-09-20
1731949200,2024-11-19
11/4-2011,2011-02-11
26-7-2012,2012-07-13
18-3-1995,1995-03-18
662317200000000000,1990-12-28
22/24-2021,2021-12-22
The system recorded 19960309130343,1996-03-09
2004_10_04T6_5_9Z+3,2004-10-04
2027-01-09T18:03:23+2500,2027-01-09
4/10-2010,2010-05-04
"October 19, 1992",1992-10-19
1747155600000000,2025-05-14
14.2.2011T5-1-50,2011-02-14
22-7-2023,2023-07-11
2017-12-13T15:43:32,2017-12-13
2059923600000,2035-04-12
960483600000,2000-06-09
2023-11-11T07:54:54.717333965Z,2023-11-11
19950601133447391,1995-06-01
2071069200000,2035-08-19
6/22-2022,2022-11-06
20270727060248000419234,2027-07-27
2035-03-08T04:57:32.794Z,2035-03-08
1990-03-27T04:58:40.373292137Z,1990-03-27
1966352400000000,2032-04-24
8 Jul 2006,2006-07-08
1991-04-28T20:40:38.012Z,1991-04-28
1552064400000,2019-03-09
2005-06-28T10:27:04.388934Z,2005-06-28
Event at 2017-07-10T11:45:37,2017-07-10
7/10/2005 giờ 21:14:29,2005-10-07
20181229080036,2018-12-29
2003-06-28T16:26:37Z+3,2003-06-28
1991-02-25T16:27:11,1991-02-25
1994-10-15T13:16:37.404Z,1994-10-15
1990-11-27T18:15:17+2500,1990-11-27
20000915074700547667076,2000-09-15
ngày 22 tháng 6 năm 2012,2012-06-22
9|8|1998,1998-08-09
2021-04-07,2021-04-07
20180411195609465,2018-04-11
7/2-2001,2001-01-07
10/05/94,1994-05-10
"August 14, 1993",1993-08-14
12_13_2030,2030-12-13
2013-02-02T22:34:45Z+3,2013-02-02
20100220000355029,2010-02-20
The system recorded 20110925091428,2011-09-25
20050203195608239882,2005-02-03
"27th of September, 2001",2001-09-27
52-6-2004,2004-06-26
The system recorded 20130323145435,2013-03-23
19970908024622417,1997-09-08
Event at 1993-03-05T1:42:57,1993-03-05
1519750800000,2018-02-28
"7th of February, 2005",2005-02-07
48-12-2006,2006-12-24
Sự kiện diễn ra vào 19/1/2007 6:38,2007-01-19
The system recorded 20000903041505,2000-09-03
"February 13, 2012",2012-02-13
2005-04-13T02:45:30.396897538Z,2005-04-13
9-3-2007,2007-03-09
The system recorded 20320207143858,2032-02-07
1992-12-30T14:23:13+07:00,1992-12-30
20131008181819497974268,2013-10-08
1164128400000000,2006-11-22
29/20-2018,2018-10-29
ngày 11 tháng 6 năm 1992,1992-06-11
941043600000000,1999-10-28
2008.01.26,2008-01-26
15 Feb 2013,2013-02-15
22 November 1990,1990-11-22
1863277200,2029-01-17
1548867600,2019-01-31
1477501200000000000,2016-10-27
ngày 6 tháng 7 năm 2003,2003-07-06
1997_12_06,1997-12-06
19930212135044,1993-02-12
Event at 2003-06-22T14:1:31,2003-06-22
23/24-2012,2012-12-23
2027-03-26T18:48:08.096632079Z,2027-03-26
17 Mar 2022,2022-03-17
2028-11-10T18:31:10+2500,2028-11-10
2015-02-28T20:37:30+08,2015-02-28
2007-10-06T19:43:44.659975682Z,2007-10-06
4 tháng 9 năm 2006,2006-09-04
785610000,1994-11-24
2005/10/25,2005-10-25
11 May 1993,1993-05-11
50-12-2033,2033-12-25
32-3-2029,2029-03-16
09-02-92,1992-02-09
2028-01-11T06:24:20Z+3,2028-01-11
2029-02-21T09:39:32.370077591Z,2029-02-21
23 May 2032,2032-05-23
1796058000000000000,2026-12-01
Event at 2031-07-25T14:34:53,2031-07-25
1997-04-16T18:40:28Z+3,1997-04-16
1994/6/8T1181,1994-06-08
2023-08-13T21:49:32-05:00,2023-08-13
12/11/1994 giờ 20:35:21,1994-11-12
1047142800,2003-03-09
27 2 2034,2034-02-27
1595696400,2020-07-26
2026-07-03T13:45:25-05:00,2026-07-03
20330813102854104697,2033-08-13
ngày 8 tháng 1 năm 2030,2030-01-08
19900920062751666924,1990-09-20
19960619044612838667355,1996-06-19
23 November 1991,1991-11-23
19990308154312481099001,1999-03-08
17/5/2001 giờ 1:40:59,2001-05-17
11/4-2003,2003-02-11
29-7-2009,2009-07-29
Sự kiện diễn ra vào 15/3/2003 6:26,2003-03-15
Sự kiện diễn ra vào 5/10/1990 17:52,1990-10-05
"October 25, 1998",1998-10-25
14.3.1990T2-51-44,1990-03-14
20041229111935786123,2004-12-29
17.8.2009T21-24-44,2009-08-17
31-10-99,1999-10-31
20140215203144785322,2014-02-15
1994_06_27T8_42_17Z+3,1994-06-27
2070378000000000000,2035-08-11
20150101055619894,2015-01-01
1990-12-12T08:51:59.089249Z,1990-12-12
2034/01/22,2034-01-22
"October 29, 2034",2034-10-29
28 January 2020,2020-01-28
2001-11-28T14:51:27.433294632Z,2001-11-28
1998-01-26T23:28:01.992202439Z,1998-01-26
2015-09-13T10:44:37.184203867Z,2015-09-13
23/10/1996 giờ 14:20:20,1996-10-23
2019-07-07T08:08:08.994611Z,2019-07-07
2013/5/3T10637,2013-05-03
"27th of February, 2003",2003-02-27
1354208400,2012-11-30
"9th of November, 2035",2035-11-09
20020103143047649496,2002-01-03
20270113164511142259,2027-01-13
2034_05_03T10_58_35+00:00,2034-05-03
2004_04_03T19_45_35+07:00,2004-04-03
2005-01-07T08:33:56Z+3,2005-01-07
2006-10-31T16:25:15-05:00,2006-10-31
25/12/2033 giờ 17:21:22,2033-12-25
1311094800,2011-07-20
2005/12/13T22610,2005-12-13
Event at 2032-01-14T10:7:53,2032-01-14
809629200,1995-08-29
8 February 2028,2028-02-08
10 Feb 2004,2004-02-10
886266000000000,1998-02-01
30/6/2007 giờ 0:59:56,2007-06-30
1995-04-10T05:01:05.298003Z,1995-04-10
2012/8/10T54549,2012-08-10
"23th of April, 2030",2030-04-23
2029-03-02T13:33:39.400321076Z,2029-03-02
12 tháng 12 năm 2035,2035-12-12
12_04_2016,2016-12-04
2034/12/4T31515,2034-12-04
The system recorded 20160814071854,2016-08-14
30/10/2022 giờ 1:41:11,2022-10-30
ngày 30 tháng 7 năm 2016,2016-07-30
1994_10_17,1994-10-17
1-9-2000,2000-09-01
13-3-2015,2015-03-13
2019/10/22T133752,2019-10-22
12-3-1990,1990-03-06
1681923600000000,2023-04-20
2012-09-17T07:11:32Z+3,2012-09-17
Ngày 12-7-2029,2029-07-12
2020-10-03T23:11:45Z+3,2020-10-03
Sự kiện diễn ra vào 10/8/2012 19:18,2012-08-10
2017-05-03T00:26:28.205456Z,2017-05-03
Sự kiện diễn ra vào 27/9/1996 19:33,1996-09-27
20290807171043164446748,2029-08-07
1259082000000000,2009-11-25
19940101010631057,1994-01-01
11 September 2031,2031-09-11
2005-06-12T14:04:11,2005-06-12
The system recorded 20160724003620,2016-07-24
20070928163320,2007-09-28
2013-11-27T21:27:01Z,2013-11-27
Event at 1998-10-26T4:8:11,1998-10-26
The system recorded 20041209031856,2004-12-09
2001-02-08T09:29:03.693079098Z,2001-02-08
"28th of April, 1991",1991-04-28
04_02_2032,2032-04-02
19/22-2017,2017-11-19
1873040400000000000,2029-05-10
Sự kiện diễn ra vào 16/4/2017 21:50,2017-04-16
Sự kiện diễn ra vào 13/6/2009 4:24,2009-06-13
21/11/2004 giờ 23:48:36,2004-11-21
2035-08-09T09:05:39Z+3,2035-08-09
8-9-2010,2010-09-04
20071211034633,2007-12-11
714934800000000,1992-08-28
2014/5/13T34831,2014-05-13
20010618183525328280554,2001-06-18
Ngày 7-6-1993,1993-06-07
2018-12-07T22:50:02Z+3,2018-12-07
20010321174940,2001-03-21
1991-04-05T23:28:14,1991-04-05
1997-08-24T07:44:30.567Z,1997-08-24
2024-05-16,2024-05-16
24.8.1991T18-28-26,1991-08-24
24|2|2013,2013-02-24
20320516040848,2032-05-16
797014800000000000,1995-04-05
27 tháng 10 năm 2016,2016-10-27
27 Oct 2031,2031-10-27
1611853200000,2021-01-29
The system recorded 20321022175300,2032-10-22
4.9.2007T2-36-30,2007-09-04
19940603143908709,1994-06-03
2002-05-13T04:09:16.338Z,2002-05-13
The system recorded 19960705040242,1996-07-05
2003-05-17T15:16:23,2003-05-17
"28th of May, 2011",2011-05-28
22 April 2005,2005-04-22
2007-06-12T16:21:32.120684556Z,2007-06-12
2030-12-07T12:43:26,2030-12-07
1771261200,2026-02-17
19930505123856666345,1993-05-05
20180204080520229,2018-02-04
2022/3/29T12340,2022-03-29
2029|09|17,2029-09-17
Sự kiện diễn ra vào 24/5/2019 9:31,2019-05-24
20201019180043,2020-10-19
1998-11-18T00:50:28.803643003Z,1998-11-18
The system recorded 19940628033644,1994-06-28
7/10-2022,2022-05-07
1184000400000,2007-07-10
20351112204444168,2035-11-12
2025-06-14T04:01:39.531477568Z,2025-06-14
1997-07-29T18:26:55.864195Z,1997-07-29
44-12-2007,2007-12-22
2011-08-11T00:35:14+08,2011-08-11
10 tháng 12 năm 2025,2025-12-10
30 3 2025,2025-03-30
8-10-2015,2015-10-04
05-16-2009,2009-05-16
19950523190737,1995-05-23
2001/2/20T21238,2001-02-20
Event at 2012-07-09T4:17:37,2012-07-09
1998-05-16T10:57:06.102390Z,1998-05-16
12 May 2015,2015-05-12
1526922000,2018-05-22
ngày 29 tháng 6 năm 2002,2002-06-29
2022-10-11T15:05:14Z+3,2022-10-11
1983718800,2032-11-11
4 Mar 2018,2018-03-04
1992_03_20T21_13_56Z+3,1992-03-20
2 tháng 12 năm 2015,2015-12-02
42-9-2005,2005-09-21
11.7.1994T7-58-37,1994-07-11
2008-02-02T17:02:00+2500,2008-02-02
ngày 2 tháng 5 năm 2030,2030-05-02
Sự kiện diễn ra vào 1/9/1994 1:27,1994-09-01
11.3.1990T21-33-51,1990-03-11
22_07_26,2026-07-22
20180302155158007279,2018-03-02
25_3_1990,1990-03-25
The system recorded 20150430140843,2015-04-30
05 06 2015,2015-05-06
2030-12-09T21:29:53Z,2030-12-09
21/2/2009 giờ 18:26:28,2009-02-21
"9th of August, 2025",2025-08-09
Event at 2034-07-12T14:58:55,2034-07-12
26/06/22,2022-06-26
Event at 1996-04-09T10:24:55,1996-04-09
1039366800,2002-12-09
1979571600000,2032-09-24
1549731600,2019-02-10
20041013180649012353835,2004-10-13
2017 08 27,2017-08-27
2020-11-25T01:51:46Z+3,2020-11-25
"September 12, 1995",1995-09-12
7 tháng 7 năm 2026,2026-07-07
1021654800,2002-05-18
11|02|2001,2001-11-02
21/09/04,2004-09-21
2000-10-17T19:18:58Z,2000-10-17
20240327152537736801532,2024-03-27
1555088400000,2019-04-13
20160509135318466,2016-05-09
2017-02-23T14:15:00Z+3,2017-02-23
17/2-2034,2034-01-17
"February 20, 1996",1996-02-20
2003-10-01T18:30:34.438Z,2003-10-01
20310205063034153,2031-02-05
1998-06-16T19:06:08,1998-06-16
2014/5/1T23643,2014-05-01
20080416101450818633417,2008-04-16
11 Nov 1990,1990-11-11
18-9-1996,1996-09-18
25/3/2019 giờ 3:59:14,2019-03-25
1996-09-12T20:17:38+3,1996-09-12
ngày 28 tháng 6 năm 2000,2000-06-28
6 tháng 1 năm 2030,2030-01-06
20130413101045190132,2013-04-13
18-5-1994,1994-05-09
19-3-2018,2018-03-19
20350917180820008,2035-09-17
Event at 2023-06-22T15:5:36,2023-06-22
1628614800,2021-08-11
25.06.31,2031-06-25
19960611183408,1996-06-11
"16th of December, 2035",2035-12-16
20140727144327227829934,2014-07-27
Event at 2018-02-18T3:38:11,2018-02-18
Ngày 22-7-2008,2008-07-22
19961231224922369672301,1996-12-31
7 tháng 4 năm 2012,2012-04-07
1 tháng 7 năm 2016,2016-07-01
20191217045902783,2019-12-17
19930401141318953288707,1993-04-01
26_4_2033,2033-04-26
11/22-2005,2005-11-11
2012|01|11,2012-01-11
Event at 1994-03-26T21:7:57,1994-03-26
2024-08-11T05:32:15,2024-08-11
"June 24, 2003",2003-06-24
The system recorded 20011124084759,2001-11-24
2035-01-22,2035-01-22
1990 08 07,1990-08-07
2012_06_01T14_3_37-0330,2012-06-01
"27th of March, 2035",2035-03-27
15 Nov 1999,1999-11-15
2035/3/30T7295,2035-03-30
20160510231317417,2016-05-10
1762016400000000,2025-11-02
9.1.2035T13-2-9,2035-01-09
2015-02-09T18:24:03+2500,2015-02-09
2027-03-08T18:33:31+2500,2027-03-08
2010-04-10T09:19:29Z+3,2010-04-10
10/3/1997 giờ 3:30:32,1997-03-10
2001_10_27T16_4_2-0330,2001-10-27
Ngày 25-8-2032,2032-08-25
29-7-2024,2024-07-29
1658682000000000,2022-07-25
Event at 1996-02-23T12:2:59,1996-02-23
2014-01-18T10:32:19.287976579Z,2014-01-18
The system recorded 20200919123241,2020-09-19
"12th of November, 1992",1992-11-12
20130920072148,2013-09-20
"15th of February, 1990",1990-02-15
1994-02-16T15:24:54Z+3,1994-02-16
20150729054747233,2015-07-29
19/4/2005 giờ 14:32:46,2005-04-19
27/5/2017,2017-05-27
1 Mar 2033,2033-03-01
The system recorded 20090923045446,2009-09-23
1172682000000,2007-03-01
1990-02-23T08:15:18Z+3,1990-02-23
11.3.2035T15-16-7,2035-03-11
14-10-2025,2025-10-07
7 Oct 2001,2001-10-07
1999-09-05T10:37:51.127670Z,1999-09-05
2024-12-11T00:25:18,2024-12-11
4 Jun 2024,2024-06-04
Ngày 26-9-2018,2018-09-26
21 May 2014,2014-05-21
1742749200,2025-03-24
1995037200000,2033-03-22
1283619600000,2010-09-05
The system recorded 19990610134645,1999-06-10
20271031012409,2027-10-31
22 July 2017,2017-07-22
703875600000000,1992-04-22
19940324181021263,1994-03-24
ngày 30 tháng 7 năm 2007,2007-07-30
15-4-2000,2000-04-15
16|05|04,2004-05-16
1433264400000,2015-06-03
Event at 2012-01-20T20:1:26,2012-01-20
1993_07_09T18_8_59+0500,1993-07-09
2021-07-10T08:47:42+07:00,2021-07-10
2015/4/6T43833,2015-04-06
20320421093139541942,2032-04-21
1285606800000000,2010-09-28
2023-10-12T06:21:06Z,2023-10-12
2005-11-09T05:22:22.943Z,2005-11-09
14/18-2014,2014-09-14
1997-08-18T19:10:12Z+3,1997-08-18
2014/5/8T61111,2014-05-08
22.6.2008,2008-06-22
12.07.1993,1993-12-07
Ngày 4-8-1991,1991-08-04
21.7.2034T22-20-48,2034-07-21
1848157200,2028-07-26
2016/9/5T121447,2016-09-05
2014-04-27T14:45:41Z+3,2014-04-27
20 08 22,2022-08-20
2031-09-16T21:04:02+3,2031-09-16
2012-02-27T22:59:43.079Z,2012-02-27
ngày 2 tháng 5 năm 1999,1999-05-02
The system recorded 19991114203016,1999-11-14
20/20-2003,2003-10-20
1 Oct 2000,2000-10-01
Event at 2002-01-15T8:13:27,2002-01-15
ngày 23 tháng 6 năm 2001,2001-06-23
16/5/2011 giờ 5:48:47,2011-05-16
"7th of February, 2002",2002-02-07
06_02_2022,2022-06-02
26 02 20,2020-02-26
28.6.2007T13-42-15,2007-06-28
29/6-2007,2007-03-29
06 02 1993,1993-06-02
20091024054116867,2009-10-24
60-12-1999,1999-12-30
"28th of March, 2034",2034-03-28
1997-10-09T17:25:45-05:00,1997-10-09
20161202020232918345908,2016-12-02
16 tháng 2 năm 2005,2005-02-16
Ngày 13-7-2010,2010-07-13
28 Apr 2017,2017-04-28
1993/8/25T23518,1993-08-25
24/2/2014 giờ 18:0:38,2014-02-24
19900211075227291037978,1990-02-11
1999-07-16T23:03:15.147Z,1999-07-16
18/10-2017,2017-05-18
2020-08-11T07:02:59Z+3,2020-08-11
2031/6/2T1813,2031-06-02
7.7.2035,2035-07-07
ngày 26 tháng 10 năm 1991,1991-10-26
20080522105256999017514,2008-05-22
18 tháng 4 năm 1993,1993-04-18
20320304111059570,2032-03-04
2024-10-17T01:27:33Z+3,2024-10-17
20340407181533621580199,2034-04-07
Event at 2007-11-02T12:11:8,2007-11-02
3.3.2022T10-13-40,2022-03-03
8/9/2017 giờ 18:38:29,2017-09-08
7 November 1994,1994-11-07
12 Aug 2022,2022-08-12
9 tháng 3 năm 2023,2023-03-09
2009-07-20T11:44:27.355338Z,2009-07-20
9 tháng 11 năm 2027,2027-11-09
19941127190931813,1994-11-27
"17th of September, 2003",2003-09-17
20121124061438,2012-11-24
6.8.1995T20-55-59,1995-08-06
2017/8/6T192759,2017-08-06
"29th of September, 2000",2000-09-29
2008/2/17T125813,2008-02-17
20061228112623822,2006-12-28
1 October 1991,1991-10-01
The system recorded 20330607035455,2033-06-07
1/16-2031,2031-08-01
851619600000,1996-12-27
7-7-2034,2034-07-07
"23th of April, 2006",2006-04-23
Sự kiện diễn ra vào 16/10/1994 14:11,1994-10-16
6 tháng 10 năm 1999,1999-10-06
1999270800,2033-05-10
1/14-1999,1999-07-01
48-4-2025,2025-04-24
20.11.2006T0-17-4,2006-11-20
The system recorded 20341026121032,2034-10-26
2010-07-27T05:07:18+3,2010-07-27
20231011204900875,2023-10-11
28-03-35,2035-03-28
20-12-2017,2017-12-10
2007-12-18T20:07:36Z+3,2007-12-18
2008-02-19T07:26:46.636009177Z,2008-02-19
1996/1/25T6636,1996-01-25
ngày 23 tháng 4 năm 2017,2017-04-23
ngày 8 tháng 9 năm 2017,2017-09-08
Event at 2003-04-22T14:29:55,2003-04-22
1997-06-26T12:50:39.364372Z,1997-06-26
"10th of December, 1997",1997-12-10
17/11/2023,2023-11-17
1998-10-12T23:49:01.791645Z,1998-10-12
Event at 2004-03-27T17:42:50,2004-03-27
2025-08-16T07:56:28.814421443Z,2025-08-16
15 tháng 8 năm 2001,2001-08-15
Ngày 11-10-2001,2001-10-11
20/7/2033 giờ 8:54:37,2033-07-20
10.10.93,1993-10-10
23/4/1995 giờ 13:22:14,1995-04-23
19980427172900,1998-04-27
2006-08-23T09:17:10,2006-08-23
2059923600000000000,2035-04-12
9|5|2013,2013-05-09
19990222211445,1999-02-22
08_12_2001,2001-08-12
29 tháng 11 năm 2007,2007-11-29
2016-06-12T05:00:28.736806Z,2016-06-12
Event at 2000-07-30T12:1:57,2000-07-30
20040903152715,2004-09-03
1995_01_22T14_46_53+3,1995-01-22
2016 09 20,2016-09-20
26-2-2034,2034-02-26
2017-09-10T06:57:32+2500,2017-09-10
ngày 23 tháng 7 năm 2007,2007-07-23
26 tháng 3 năm 2016,2016-03-26
2012_10_24T23_37_48+00:00,2012-10-24
09-16-2027,2027-09-16
12 Mar 1998,1998-03-12
21-2-2008,2008-02-21
6-4-2014,2014-04-03
19921105212624953653,1992-11-05
Ngày 24-10-2014,2014-10-24
10|09|2005,2005-10-09
1990-04-15T01:27:28,1990-04-15
17/22-2006,2006-11-17
6/4/1995 giờ 11:7:0,1995-04-06
ngày 15 tháng 1 năm 2032,2032-01-15
21-3-1999,1999-03-21
2028 08 14,2028-08-14
1643734800000,2022-02-02
21.1.2019T20-13-19,2019-01-21
The system recorded 20190421030312,2019-04-21
7/4-2015,2015-02-07
774810000000000000,1994-07-22
19.3.2009T21-14-34,2009-03-19
1543683600000000000,2018-12-02
986058000,2001-04-01
16 Jun 1996,1996-06-16
13-9-1997,1997-09-13
17 Aug 2019,2019-08-17
1990_06_06T9_36_38+00:00,1990-06-06
19990714051909137934,1999-07-14
03|26|1995,1995-03-26
Sự kiện diễn ra vào 13/3/2012 4:47,2012-03-13
2023-09-06T05:37:56.605Z,2023-09-06
2030_07_17T22_15_47+3,2030-07-17
"30th of April, 2030",2030-04-30
"January 31, 2000",2000-01-31
04-14-1992,1992-04-14
"July 30, 2014",2014-07-30
20181204154503283,2018-12-04
5/20-2021,2021-10-05
7/11/2013 giờ 8:48:0,2013-11-07
Sự kiện diễn ra vào 14/11/2010 12:4,2010-11-14
"30th of May, 2013",2013-05-30
20190818090427229268913,2019-08-18
3 Aug 2019,2019-08-03
20111115052958,2011-11-15
2015-03-08T13:58:06Z+3,2015-03-08
"10th of March, 2028",2028-03-10
The system recorded 20320915171205,2032-09-15
20111012153552,2011-10-12
04_10_2001,2001-04-10
19940727014528,1994-07-27
2015-05-16T18:12:41.129653Z,2015-05-16
ngày 8 tháng 11 năm 2032,2032-11-08
7/8/1999 giờ 7:4:31,1999-08-07
20250223142406,2025-02-23
20250429090807486030,2025-04-29
16/2-2008,2008-01-16
20090602162851171,2009-06-02
19931127235745771,1993-11-27
2031_12_10T12_16_7Z,2031-12-10
2024-10-11T22:42:28Z+3,2024-10-11
1477674000000000000,2016-10-29
ngày 9 tháng 3 năm 2021,2021-03-09
2030/5/30T95250,2030-05-30
17_2_2022,2022-02-17
Sự kiện diễn ra vào 28/1/2012 12:27,2012-01-28
20050601185651478501195,2005-06-01
2032-12-09T09:28:25Z+3,2032-12-09
Sự kiện diễn ra vào 22/8/2031 23:22,2031-08-22
Sự kiện diễn ra vào 10/5/1990 8:45,1990-05-10
The system recorded 20130207072824,2013-02-07
Ngày 18-4-2000,2000-04-18
Ngày 6-11-1997,1997-11-06
7.9.2009T13-15-54,2009-09-07
29/18-2013,2013-09-29
13/20-1997,1997-10-13
1998-07-25T00:13:40.652074Z,1998-07-25
ngày 5 tháng 11 năm 2005,2005-11-05
23/18-2023,2023-09-23
10-8-2031,2031-08-10
"3rd of September, 2030",2030-09-03
2017-02-08T19:17:32.908578432Z,2017-02-08
1990-09-01T01:13:29,1990-09-01
2031_12_02T18_11_45+2500,2031-12-02
1995-06-05T20:03:27.268Z,1995-06-05
Ngày 24-9-1997,1997-09-24
The system recorded 20080805035502,2008-08-05
1999-11-02T21:57:49.123530Z,1999-11-02
20180708064103352735419,2018-07-08
25-10-1994,1994-10-25
11/14-2032,2032-07-11
2018-04-20T12:36:02.483Z,2018-04-20
2021/8/1T83812,2021-08-01
56-11-1998,1998-11-28
1997-01-30T15:21:09Z+3,1997-01-30
48-2-2028,2028-02-24
The system recorded 20331208030735,2033-12-08
2035-06-12T08:54:53.898Z,2035-06-12
2023808400,2034-02-18
2010-04-23T14:47:41+2500,2010-04-23
20130217205534222856,2013-02-17
19940326013934685,1994-03-26
7.2.2029,2029-02-07
Event at 2020-09-09T3:51:9,2020-09-09
7/6/2029 giờ 1:22:57,2029-06-07
2014/7/29T151913,2014-07-29
Sự kiện diễn ra vào 24/10/2003 23:27,2003-10-24
1995-04-17T16:24:47.396Z,1995-04-17
34-2-1995,1995-02-17
"August 25, 1990",1990-08-25
20211228074046,2021-12-28
2030-07-17T19:52:57Z+3,2030-07-17
20201106020306082644,2020-11-06
5 Jan 2018,2018-01-05
1434301200000000000,2015-06-15
20040222082709070,2004-02-22
06_11_29,2029-11-06
2/6-1992,1992-03-02
19911119162932141703,1991-11-19
2022-10-28T06:05:09,2022-10-28
"6th of September, 2030",2030-09-06
12_07_2015,2015-12-07
10/2/2018 giờ 2:20:34,2018-02-10
2034/12/18T1068,2034-12-18
The system recorded 20150125231139,2015-01-25
1996-08-06T07:26:04+2500,1996-08-06
25-09-10,2010-09-25
5 tháng 2 năm 2018,2018-02-05
5 June 2011,2011-06-05
46-5-2016,2016-05-23
2007_06_02,2007-06-02
20340613090403532,2034-06-13
Event at 1997-09-03T15:52:42,1997-09-03
Event at 2030-07-28T20:47:43,2030-07-28
7/24-1998,1998-12-07
Sự kiện diễn ra vào 6/9/2022 17:50,2022-09-06
19901113030924660445516,1990-11-13
12-31-1999,1999-12-31
02_06_01,2001-06-02
ngày 1 tháng 8 năm 2018,2018-08-01
1450371600000000,2015-12-18
2018_10_24T11_26_32+07:00,2018-10-24
1844528400,2028-06-14
2015-06-10T10:26:16+2500,2015-06-10
2033_12_06T18_2_18+0500,2033-12-06
10.15.2028,2028-10-15
1993-01-10T00:54:31.554051503Z,1993-01-10
2018-04-19T07:05:40,2018-04-19
1547744400000,2019-01-18
29 December 2025,2025-12-29
22 September 1997,1997-09-22
3/6/2002 giờ 16:6:52,2002-06-03
The system recorded 20261006201736,2026-10-06
1244394000000,2009-06-08
2030-03-04T20:42:08.455688555Z,2030-03-04
"13th of June, 2016",2016-06-13
2006-01-23T13:02:40.331908371Z,2006-01-23
24.1.2029T18-44-38,2029-01-24
2002-02-09T00:39:34.500Z,2002-02-09
"14th of May, 2019",2019-05-14
2027-10-14T10:41:14.008Z,2027-10-14
20321026063013123025396,2032-10-26
3/16-1999,1999-08-03
6 June 2031,2031-06-06
2013_11_27T22_24_33Z,2013-11-27
25-09-29,2029-09-25
20070124202832901020,2007-01-24
The system recorded 19920722230921,1992-07-22
Event at 2019-12-14T13:17:50,2019-12-14
20140625024156639373,2014-06-25
"6th of July, 1992",1992-07-06
Sự kiện diễn ra vào 24/8/1997 22:7,1997-08-24
20010920121607430423,2001-09-20
1109264400000000000,2005-02-25
10 Aug 2024,2024-08-10
2014-07-03T14:24:03+2500,2014-07-03
2002.10.10,2002-10-10
17 Mar 1999,1999-03-17
17/2-2021,2021-01-17
03/23/2007,2007-03-23
"12th of June, 1991",1991-06-12
"18th of February, 2028",2028-02-18
2032-12-03T00:21:11.141243Z,2032-12-03
"September 1, 2009",2009-09-01
2015-10-17T13:54:02.243604Z,2015-10-17
17 tháng 8 năm 2010,2010-08-17
2008-03-29T14:20:40.809Z,2008-03-29
1974819600000000,2032-07-31
Event at 2026-05-18T13:23:34,2026-05-18
2022-06-24T10:59:13Z+3,2022-06-24
20200518215843754671,2020-05-18
2010_01_17T16_45_43+08,2010-01-17
2-12-2006,2006-12-02
"18th of January, 2033",2033-01-18
2008-07-11T13:48:46+2500,2008-07-11
23 3 1997,1997-03-23
2018-05-30T02:53:26+08,2018-05-30
2000-01-20T04:48:00.044361861Z,2000-01-20
20290325035149412608177,2029-03-25
2015-10-03T23:57:55+2500,2015-10-03
2011-06-24T17:07:57+0500,2011-06-24
3-10-2028,2028-10-03
Sự kiện diễn ra vào 7/10/2010 1:53,2010-10-07
1098378000000000,2004-10-22
1993-09-25T03:28:59.707Z,1993-09-25
1115571600,2005-05-09
20161126065019,2016-11-26
2013_10_13T1_53_59-0330,2013-10-13
"17th of October, 2002",2002-10-17
2033-11-04T12:03:04,2033-11-04
11/02/29,2029-02-11
2030-11-30T22:21:34.787189501Z,2030-11-30
Ngày 19-4-1998,1998-04-19
2004/2/22T14428,2004-02-22
926960400000,1999-05-18
1753981200,2025-08-01
20110903231237821420,2011-09-03
24/5/2022 giờ 5:33:7,2022-05-24
ngày 11 tháng 10 năm 2004,2004-10-11
1555779600000000,2019-04-21
2011-10-17T05:43:03+2500,2011-10-17
19960609184503,1996-06-09
5/2/2030 giờ 23:51:5,2030-02-05
20180516230742121,2018-05-16
Event at 2019-03-25T23:12:27,2019-03-25
11 20 2020,2020-11-20
1991-09-23T04:14:39Z+3,1991-09-23
2017-11-25,2017-11-25
Sự kiện diễn ra vào 19/5/2012 19:36,2012-05-19
2005/11/25T235215,2005-11-25
897066000000000000,1998-06-06
1997-06-09T00:17:35+08,1997-06-09
1607533200000000000,2020-12-10
17 12 14,2014-12-17
62-7-2029,2029-07-31
20190701052225286564,2019-07-01
20120915002358640483,2012-09-15
04|12|2011,2011-04-12
1995/12/3T85412,1995-12-03
Ngày 17-2-2027,2027-02-17
"4th of July, 2021",2021-07-04
1103907600000000,2004-12-25
"August 17, 1994",1994-08-17
2026-03-12T14:01:38.155048565Z,2026-03-12
2016-07-22T06:00:43+3,2016-07-22
11 February 2032,2032-02-11
2009_04_02T12_57_48+3,2009-04-02
2005-07-12T23:05:35.760334987Z,2005-07-12
"25th of August, 2015",2015-08-25
Ngày 19-1-2027,2027-01-19
Sự kiện diễn ra vào 7/12/2024 10:7,2024-12-07
29_05_07,2007-05-29
"August 5, 2024",2024-08-05
20151007140401850833,2015-10-07
1700154000000000,2023-11-17
"3rd of December, 2008",2008-12-03
Event at 2000-10-10T17:44:17,2000-10-10
9-5-2035,2035-05-09
17 tháng 12 năm 2011,2011-12-17
28.11.2001T6-23-53,2001-11-28
22 August 2007,2007-08-22
34-7-2014,2014-07-17
24.2.2015,2015-02-24
1995-10-09T16:17:20+2500,1995-10-09
The system recorded 20261105090738,2026-11-05
The system recorded 20160511172624,2016-05-11
1991.06.16,1991-06-16
20-8-2003,2003-08-10
13 tháng 1 năm 2015,2015-01-13
26.11.34,2034-11-26
ngày 6 tháng 5 năm 2020,2020-05-06
712602000000000,1992-08-01
08|18|2010,2010-08-18
36-12-2034,2034-12-18
18-7-2024,2024-07-18
19951117141908,1995-11-17
2017-06-14T15:23:43,2017-06-14
2016-12-15T18:51:35.941Z,2016-12-15
20270226171102506803671,2027-02-26
17 July 2021,2021-07-17
684522000000000000,1991-09-11
Ngày 23-9-2030,2030-09-23
19990912105255158685347,1999-09-12
16.2.2034T11-2-56,2034-02-16
1990-05-13T03:16:13+2500,1990-05-13
1998_02_21T3_15_25-05:00,1998-02-21
The system recorded 19940122022514,1994-01-22
2031-06-24T21:52:37Z+3,2031-06-24
Ngày 21-9-1993,1993-09-21
1768928400,2026-01-21
32-10-2031,2031-10-16
2032-11-15T06:36:49.970146424Z,2032-11-15
"January 19, 2002",2002-01-19
12/30/2003,2003-12-30
1999-06-11T03:30:15.428Z,1999-06-11
11 September 2012,2012-09-11
3 February 1994,1994-02-03
09 01 1993,1993-09-01
20260516072419555133001,2026-05-16
8/16-2008,2008-08-08
16/2/2022 giờ 8:27:24,2022-02-16
Ngày 7-8-2019,2019-08-07
"February 11, 1997",1997-02-11
1993/7/21T114038,1993-07-21
4.3.2012T14-30-22,2012-03-04
2032-01-14T21:47:59.682863Z,2032-01-14
2021/3/11T1216,2021-03-11
2026/10/23T17824,2026-10-23
20290829044853896647,2029-08-29
ngày 8 tháng 4 năm 2022,2022-04-08
8-4-2002,2002-04-08
2 Aug 2005,2005-08-02
2020-10-07T08:01:27+2500,2020-10-07
1681923600,2023-04-20
19961022175720353299389,1996-10-22
19/7/2034 giờ 3:53:40,2034-07-19
06 01 25,2025-01-06
1816966800,2027-07-31
26/16-1999,1999-08-26
18-10-97,1997-10-18
20150513024835152,2015-05-13
8-2-2028,2028-02-08
2018-09-01T00:24:26.090Z,2018-09-01
20310630203214,2031-06-30
17/4/2015 giờ 7:50:4,2015-04-17
24 tháng 8 năm 2023,2023-08-24
27-11-2001,2001-11-27
31 tháng 8 năm 2015,2015-08-31
1994-02-21T09:47:34.966489775Z,1994-02-21
2018-03-24T17:14:55.901Z,2018-03-24
ngày 2 tháng 9 năm 2024,2024-09-02
2030-09-27T01:31:49.546753886Z,2030-09-27
20260807190923137820488,2026-08-07
2031-03-21T03:20:30.755Z,2031-03-21
"19th of March, 2000",2000-03-19
1422982800000,2015-02-04
2032-07-25T00:26:50Z+3,2032-07-25
22/22-2004,2004-11-22
811789200000000,1995-09-23
953485200000,2000-03-20
22 Aug 2031,2031-08-22
1999-05-14T08:52:46.849873Z,1999-05-14
2005-08-12T14:30:38Z+3,2005-08-12
1995-07-04T15:42:58Z,1995-07-04
6 Oct 2027,2027-10-06
2028 02 01,2028-02-01
22 tháng 6 năm 2006,2006-06-22
Ngày 3-11-2030,2030-11-03
13.5.2033T6-29-28,2033-05-13
Sự kiện diễn ra vào 12/6/2025 17:46,2025-06-12
"3rd of January, 1995",1995-01-03
2026-03-29T19:53:33.963Z,2026-03-29
Event at 1997-02-23T10:48:11,1997-02-23
2000 04 28,2000-04-28
20270212073643589587806,2027-02-12
2032-04-13T16:57:43+2500,2032-04-13
30-1-2013,2013-01-15
1198256400000,2007-12-22
1874768400000,2029-05-30
Sự kiện diễn ra vào 27/10/2002 21:46,2002-10-27
1728061200000000000,2024-10-05
"12th of May, 2028",2028-05-12
24 January 1998,1998-01-24
2021-08-17T02:10:00Z+3,2021-08-17
2020_11_13T14_57_11-0300,2020-11-13
02.10.22,2022-10-02
2020-02-18T22:11:55Z+3,2020-02-18
719341200,1992-10-18
2028-05-29T00:23:36+2500,2028-05-29
29 tháng 5 năm 2010,2010-05-29
2024-07-26T10:47:06.954003242Z,2024-07-26
1996-05-30T09:46:49,1996-05-30
2010-05-31T18:53:28Z+3,2010-05-31
27/9/2034 giờ 9:11:30,2034-09-27
2012-03-02T00:37:08+2500,2012-03-02
19970629141856159,1997-06-29
The system recorded 20310313231511,2031-03-13
1998-11-18T05:45:04+2500,1998-11-18
Ngày 19-1-1995,1995-01-19
Event at 2011-06-11T20:10:46,2011-06-11
2021-09-07T12:01:25+2500,2021-09-07
06_06_2030,2030-06-06
1990-06-09T02:57:32.720608Z,1990-06-09
19901231234227620807664,1990-12-31
8 Mar 2013,2013-03-08
2016_01_06T2_14_54-05:00,2016-01-06
The system recorded 19921102124757,1992-11-02
21/7/1997 giờ 16:29:20,1997-07-21
ngày 10 tháng 1 năm 2022,2022-01-10
6 tháng 3 năm 1991,1991-03-06
23.04.98,1998-04-23
Event at 2010-09-28T10:22:43,2010-09-28
2007-06-12T21:52:24.226Z,2007-06-12
Event at 2016-03-17T14:23:56,2016-03-17
20180726183804162791,2018-07-26
2023_04_28T6_3_8+2500,2023-04-28
03.09.2016,2016-03-09
The system recorded 20200623183526,2020-06-23
1040835600000000,2002-12-26
3|3|1999,1999-03-03
2027-01-07T05:03:37.331883000Z,2027-01-07
"1st of September, 2027",2027-09-01
06|09|2021,2021-06-09
2035_05_26,2035-05-26
23.02.25,2025-02-23
16 August 2026,2026-08-16
ngày 4 tháng 1 năm 2034,2034-01-04
2020-10-09T07:21:48+2500,2020-10-09
1991/3/17T8573,1991-03-17
713811600000000000,1992-08-15
20040313105442321912312,2004-03-13
2015/9/25T9344,2015-09-25
1994-05-26T14:14:52+2500,1994-05-26
2011-10-03T04:11:31.140720Z,2011-10-03
"18th of September, 1996",1996-09-18
Event at 2008-03-30T17:14:12,2008-03-30
Sự kiện diễn ra vào 24/11/2010 13:57,2010-11-24
1436115600,2015-07-06
2016|01|20,2016-01-20
07.01.2024,2024-07-01
30-04-32,2032-04-30
2020-05-10T03:40:49.986Z,2020-05-10
20170524155341,2017-05-24
2033-11-08T12:19:34.364Z,2033-11-08
20 December 2004,2004-12-20
Event at 2028-06-14T21:5:58,2028-06-14
20041224183106270700895,2004-12-24
Ngày 4-3-1994,1994-03-04
20/1/2016,2016-01-20
44-6-2035,2035-06-22
28/11/1992,1992-11-28
2015/6/7T171931,2015-06-07
08/06/2008,2008-08-06
2029-05-16T17:23:33Z+3,2029-05-16
3/2/2018 giờ 12:18:36,2018-02-03
801075600000000000,1995-05-22
1674234000000000,2023-01-21
16-5-2002,2002-05-08
2 Nov 2012,2012-11-02
"January 19, 2002",2002-01-19
1825347600000000,2027-11-05
Event at 2014-06-19T20:24:41,2014-06-19
2009-08-11T17:28:03.660795Z,2009-08-11
8/11/1995 giờ 18:16:52,1995-11-08
16.9.2001T8-23-37,2001-09-16
19900721051452668194850,1990-07-21
Sự kiện diễn ra vào 16/12/2001 3:36,2001-12-16
4.7.2025,2025-07-04
2035-07-03T00:40:09.906485Z,2035-07-03
1474650000,2016-09-24
2026-10-07T15:37:30.982Z,2026-10-07
20000425061249,2000-04-25
28-6-1992,1992-06-14
1994-11-30T08:03:11.251Z,1994-11-30
14.08.33,2033-08-14
2010-10-31T21:59:32,2010-10-31
"March 5, 2003",2003-03-05
2034-07-01T23:09:26.314247Z,2034-07-01
Sự kiện diễn ra vào 7/11/2031 13:49,2031-11-07
10.10.2030T22-5-2,2030-10-10
22/4/2009 giờ 14:37:34,2009-04-22
3 1 2018,2018-01-03
20210715094119480020939,2021-07-15
2035_09_17,2035-09-17
08 28 1997,1997-08-28
20221108025800246050,2022-11-08
1 tháng 1 năm 2013,2013-01-01
1903626000,2030-04-29
1709226000000000000,2024-03-01
2019-01-21T23:03:53.820521086Z,2019-01-21
957286800000,2000-05-03
2/1/2026 giờ 23:36:13,2026-01-02
1813856400000000000,2027-06-25
20071005021704099789345,2007-10-05
9 February 2003,2003-02-09
13/05/06,2006-05-13
"14th of May, 2003",2003-05-14
29 tháng 6 năm 2020,2020-06-29
Event at 2031-07-10T6:21:24,2031-07-10
Sự kiện diễn ra vào 29/5/1994 0:30,1994-05-29
19980310194738,1998-03-10
Ngày 31-10-2023,2023-10-31
13-3-2020,2020-03-13
2014-12-02T21:36:55.402Z,2014-12-02
2007-01-25T23:40:29,2007-01-25
25 8 2004,2004-08-25
The system recorded 19900204202132,1990-02-04
1318698000000000000,2011-10-16
"10th of August, 2009",2009-08-10
19960501204251849448,1996-05-01
6 Mar 2033,2033-03-06
10-10-2004,2004-10-05
Event at 2013-09-11T23:39:46,2013-09-11
1697130000000000000,2023-10-13
34-4-1992,1992-04-17
20120112141826668526940,2012-01-12
2010-10-09T01:21:02+2500,2010-10-09
46-10-2035,2035-10-23
2017-01-10T08:53:03.159955036Z,2017-01-10
2011/10/11T12011,2011-10-11
18 July 1992,1992-07-18
2011-08-30T08:41:07,2011-08-30
2023-02-20T08:07:30.474080Z,2023-02-20
2017-01-25T16:34:22+2500,2017-01-25
31/7/2030 giờ 1:15:26,2030-07-31
890758800000000,1998-03-25
1438707600000,2015-08-05
"February 23, 2008",2008-02-23
ngày 21 tháng 10 năm 2005,2005-10-21
2017-03-23T18:23:14+2500,2017-03-23
1548694800,2019-01-29
The system recorded 20090404230802,2009-04-04
Event at 2029-05-17T18:56:29,2029-05-17
19/20-2001,2001-10-19
721069200000000,1992-11-07
20230402173210787571699,2023-04-02
Sự kiện diễn ra vào 4/6/2000 18:30,2000-06-04
2025-02-15T14:35:51+2500,2025-02-15
1758819600000,2025-09-26
795286800000000,1995-03-16
"May 17, 2034",2034-05-17
1992/11/3T215230,1992-11-03
20250824103608943,2025-08-24
1568826000000000000,2019-09-19
20010313015544923260,2001-03-13
Event at 2015-04-14T1:37:40,2015-04-14
20171230043249708079,2017-12-30
2021-11-03T09:21:38.854Z,2021-11-03
20260829104515,2026-08-29
Sự kiện diễn ra vào 28/12/1992 18:44,1992-12-28
ngày 13 tháng 8 năm 2026,2026-08-13
20321103070148462538272,2032-11-03
20051101045827,2005-11-01
20131105011239,2013-11-05
8 Dec 2023,2023-12-08
2008-10-01T21:52:11.500Z,2008-10-01
Ngày 26-4-2022,2022-04-26
1993-11-18T13:41:13-0300,1993-11-18
11 Dec 1995,1995-12-11
5 March 2022,2022-03-05
20311004001613156,2031-10-04
The system recorded 20080722014416,2008-07-22
1990-07-19T17:45:38.712668Z,1990-07-19
2007-11-22T15:01:54+2500,2007-11-22
2001-05-20T04:54:17.301776955Z,2001-05-20
2004-10-11T03:31:22.387043Z,2004-10-11
26-5-2035,2035-05-26
26 06 08,2008-06-26
2014-10-05T11:33:21Z+3,2014-10-05
04 28 2002,2002-04-28
1887123600000000,2029-10-20
4-8-2018,2018-08-02
"June 19, 1995",1995-06-19
1999-12-07T03:26:17+2500,1999-12-07
1277398800,2010-06-25
2030-01-06,2030-01-06
2018_02_06,2018-02-06
20021016202702034914317,2002-10-16
4.7.2017T19-22-8,2017-07-04
19960810094548294391,1996-08-10
ngày 22 tháng 10 năm 2004,2004-10-22
2021_08_21,2021-08-21
"26th of June, 2021",2021-06-26
Ngày 11-12-2027,2027-12-11
2018-12-30T17:37:55.050700720Z,2018-12-30
20000423100834710,2000-04-23
2006/5/31T212836,2006-05-31
1993-04-03T18:12:27+2500,1993-04-03
20290602083917948112775,2029-06-02
Event at 2024-08-01T21:4:40,2024-08-01
2003-06-28,2003-06-28
1347382800,2012-09-12
20240602215002230,2024-06-02
Ngày 6-10-2029,2029-10-06
2017-04-01T23:51:50Z+3,2017-04-01
"May 3, 2029",2029-05-03
20200221172622281,2020-02-21
8-1-2016,2016-01-08
7/8-2001,2001-04-07
"12th of August, 2025",2025-08-12
1707930000000000,2024-02-15
952275600000000,2000-03-06
2012-11-08T13:47:21.232Z,2012-11-08
24 March 2021,2021-03-24
2023/1/23T81326,2023-01-23
1990/6/30T224939,1990-06-30
4.9.2023T0-45-0,2023-09-04
2017-10-12,2017-10-12
12 05 1992,1992-12-05
Event at 2034-05-10T17:36:8,2034-05-10
The system recorded 20061001195030,2006-10-01
2017-02-18T03:00:41,2017-02-18
ngày 6 tháng 2 năm 2008,2008-02-06
10_01_12,2012-01-10
9/18-2010,2010-09-09
2007-12-11T23:48:45.622448088Z,2007-12-11
13-10-1996,1996-10-13
ngày 21 tháng 9 năm 2011,2011-09-21
13 March 2023,2023-03-13
16 November 2020,2020-11-16
1355504400000000000,2012-12-15
"July 15, 2013",2013-07-15
17/10-2005,2005-05-17
20200408151035147,2020-04-08
16-10-1996,1996-10-16
20140908044954,2014-09-08
20 tháng 7 năm 2035,2035-07-20
2051802000000000,2035-01-08
1/12/2002,2002-12-01
1576774800,2019-12-20
2000-03-24T18:53:16Z+3,2000-03-24
Ngày 6-1-2032,2032-01-06
11 October 2019,2019-10-11
2013-06-12T19:36:28+0500,2013-06-12
2010_08_23T7_10_21-0330,2010-08-23
14.2.2012T4-12-41,2012-02-14
2007-11-12T22:28:42.735543Z,2007-11-12
2008-05-27T00:34:21.946Z,2008-05-27
The system recorded 19980301082113,1998-03-01
1697994000000000000,2023-10-23
28/7/1999,1999-07-28
10 tháng 11 năm 2021,2021-11-10
Sự kiện diễn ra vào 6/8/2023 3:42,2023-08-06
"8th of July, 2021",2021-07-08
22.10.2034T4-44-39,2034-10-22
2014-10-11T06:52:26.123Z,2014-10-11
20-5-2026,2026-05-10
1998-02-11T01:30:17+2500,1998-02-11
30/2-2029,2029-01-30
29/4/2013 giờ 13:32:12,2013-04-29
2011-04-18T23:24:20.173Z,2011-04-18
2017-04-10T06:10:35.473Z,2017-04-10
25-1-2000,2000-01-25
1219856400,2008-08-28
945190800000000,1999-12-15
2019-11-01T23:10:16+2500,2019-11-01
2028-05-27T05:31:13,2028-05-27
20080905050117429790,2008-09-05
19930403200425,1993-04-03
20031204073921225,2003-12-04
20070323221019766961,2007-03-23
2025018000000000,2034-03-04
ngày 25 tháng 4 năm 1990,1990-04-25
31-5-2010,2010-05-31
1990-10-03T23:38:37.096Z,1990-10-03
771526800000,1994-06-14
2027-05-27T12:57:03Z+3,2027-05-27
The system recorded 20280924155156,2028-09-24
651862800,1990-08-29
"9th of March, 2021",2021-03-09
1560272400,2019-06-12
19 tháng 2 năm 2024,2024-02-19
"November 27, 2035",2035-11-27
1992-02-08T23:26:10,1992-02-08
2024-07-07T21:48:57,2024-07-07
15.1.1998T13-25-17,1998-01-15
2014_06_16T7_20_46+3,2014-06-16
2 tháng 3 năm 2002,2002-03-02
1991-01-29T01:50:34.985310Z,1991-01-29
2024-12-16T17:58:24+2500,2024-12-16
2028-01-13T04:36:43+2500,2028-01-13
1823878800000,2027-10-19
The system recorded 20010524163955,2001-05-24
2023-03-11T13:12:09.788087Z,2023-03-11
7.2.2011T9-44-7,2011-02-07
Event at 2002-05-10T15:9:56,2002-05-10
20070220214630617319,2007-02-20
24-5-1998,1998-05-24
2011-04-15T10:36:08.338Z,2011-04-15
Ngày 30-7-1994,1994-07-30
17/16-2005,2005-08-17
2003_04_28T11_4_22Z+3,2003-04-28
The system recorded 20281027162855,2028-10-27
1990-09-05T02:37:48.364767280Z,1990-09-05
2012/12/7T234426,2012-12-07
"24th of June, 2030",2030-06-24
2018-02-26T06:47:05+00:00,2018-02-26
09-13-2002,2002-09-13
ngày 29 tháng 1 năm 1995,1995-01-29
17_6_2021,2021-06-17
11-2-2031,2031-02-11
1 March 2020,2020-03-01
2022_10_15T16_27_22-0300,2022-10-15
16-12-2024,2024-12-16
1999/3/24T9430,1999-03-24
28/11/2024 giờ 20:20:26,2024-11-28
"September 15, 2014",2014-09-15
5 tháng 1 năm 2006,2006-01-05
20060704003338271,2006-07-04
16|11|1992,1992-11-16
2000-08-02T20:11:44-0300,2000-08-02
06|01|2025,2025-06-01
1015434000,2002-03-07
2033/4/13T01529,2033-04-13
4 Nov 2027,2027-11-04
46-10-2008,2008-10-23
36-11-2008,2008-11-18
19920106013335318536860,1992-01-06
20170308000134026,2017-03-08
ngày 19 tháng 6 năm 2006,2006-06-19
"July 22, 1995",1995-07-22
"5th of November, 1993",1993-11-05
1993-09-24T18:56:58.795894Z,1993-09-24
8/10/2035 giờ 21:21:32,2035-10-08
Ngày 7-9-1999,1999-09-07
12-10-2015,2015-10-12
20020419231755871568401,2002-04-19
2008/7/25T123615,2008-07-25
20280517110953848094728,2028-05-17
1993-10-30T05:38:49-0300,1993-10-30
2030-05-13T16:37:20Z+3,2030-05-13
2029-12-06T16:53:41Z+3,2029-12-06
The system recorded 20170529142856,2017-05-29
23 June 1990,1990-06-23
2004-11-02T07:09:42.591879746Z,2004-11-02
1996-09-23T09:27:40+3,1996-09-23
"21th of May, 2008",2008-05-21
46-12-1994,1994-12-23
Sự kiện diễn ra vào 3/9/1993 16:29,1993-09-03
1997-08-21T23:11:15.630Z,1997-08-21
19980422213730016281959,1998-04-22
6.1.2031T18-18-30,2031-01-06
2015-08-11T07:43:53,2015-08-11
Event at 2034-01-01T10:13:9,2034-01-01
1179334800000000000,2007-05-17
The system recorded 20291009171952,2029-10-09
20|9|2023,2023-09-20
2034-07-06T13:06:30-0330,2034-07-06
2 Jan 2012,2012-01-02
11_06_2015,2015-11-06
30 April 1993,1993-04-30
2025-11-25T12:17:27Z+3,2025-11-25
20020419075722086889802,2002-04-19
"September 27, 2031",2031-09-27
2021-09-12T19:40:25.052594Z,2021-09-12
1992-11-08T16:42:04.167Z,1992-11-08
1996/2/21T112236,1996-02-21
10/16-2033,2033-08-10
05.28.2016,2016-05-28
20070310231755045777,2007-03-10
20280121161700186,2028-01-21
795114000,1995-03-14
