input_text,target_text
6/20/1994,1994-06-20
2029-10-11,2029-10-11
1995/9,1995-09-17
11th of December 2022,2022-12-11
5/24/2010,2010-05-24
2032-6-3,2032-06-03
ngày 13 tháng 1 năm 1992,1992-01-13
9/18/98,1998-09-18
2010/5,2010-05-03
Jan 4 35,2035-01-04
"February 7, 2015",2015-02-07
20/2/27,2027-02-20
22/7/09,2009-07-22
4 Sep 2027,2027-09-04
25/5-1993,1993-05-25
7-22-91,1991-07-22
17/6/99,1999-06-17
"July 28, 2035",2035-07-28
18/4-1997,1997-04-18
2012/4/11,2012-04-11
2031-11-25,2031-11-25
2-12-2004,2004-12-01
1/8-2015,2015-08-01
28:8:2023,2023-08-28
13th of May 2002,2002-05-13
14/1/15,2015-01-14
6Sep1997,1997-09-06
16 tháng 11 năm 2034,2034-11-16
"Jan 19th, 2031",2031-01-19
5th of February 1990,1990-02-05
11/8/93,1993-11-08
8-4,2002-04-08
2022/2/8,2022-02-08
18-11,2004-11-18
44-5-1998,1998-05-22
2006-9-12,2006-09-12
9th of September 1995,1995-09-09
3/9-1999,1999-09-03
18-6,2027-06-18
2/5/2024,2024-02-05
27 tháng 11 năm 2030,2030-11-27
Jul 10 90,1990-07-10
12/14/12,2012-12-14
20072006,2006-07-20
1990/8/5,1990-08-05
2019/9/21,2019-09-21
28th of November 2024,2024-11-28
10-3,2029-03-10
6/3/22,2022-03-06
11-17-35,2035-11-17
20062007,2007-06-20
Jan 3 96,1996-01-03
4:6:2023,2023-06-04
8/2-2029,2029-02-08
17/10/28,2028-10-17
12/10/08,2008-10-12
4/21/2019,2019-07-04
21 April 1991,1991-04-21
11/25/2030,2030-11-25
7-2-99,1999-07-02
4/14-2022,2022-07-04
2007/9,2007-09-03
14.12.2002,2002-12-14
1 Jan 2014,2014-01-01
4 October 2023,2023-10-04
8/12/2030,2030-08-12
11/9-2010,2010-09-11
27/7-2006,2006-07-27
4/14/24,2024-04-14
7/5/20,2020-05-07
2009/7/16,2009-07-16
7/26/94,1994-07-26
2 Ap 2023,2023-04-02
7/6-2018,2018-06-07
16:5:2001,2001-05-16
26/3-2002,2002-03-26
19 tháng 11 năm 1997,1997-11-19
2-17-00,2000-02-17
7th of July 2034,2034-07-07
27 Dec 2017,2017-12-27
"March 7, 2018",2018-03-07
2 Oc 2025,2025-10-02
"Oct 14th, 2016",2016-10-14
14-3-2022,2022-03-14
20/12-2034,2034-06-20
4 Mar 1995,1995-03-04
22 October 2030,2030-10-22
08111999,1999-11-08
10/6/33,2033-06-10
09122035,2035-12-09
24/9/00,2000-09-24
21th of May 2016,2016-05-21
Jan 27 25,2025-01-27
10/9-2007,2007-09-10
10-2-2034,2034-02-05
1-25-00,2000-01-25
23/1/06,2006-01-23
1/10-2007,2007-05-01
09112028,2028-11-09
2/9/2018,2018-09-02
15/15/2021,2021-05-15
11Oct2025,2025-10-11
9.7.1999,1999-07-09
2032/2/24,2032-02-24
12 Sep 2017,2017-09-12
9:5:1995,1995-05-09
9Sep2015,2015-09-09
5-8-2025,2025-08-05
48-2-2022,2022-02-24
1 October 2018,2018-10-01
Oct 20 11,2011-10-20
7/3-1993,1993-03-07
11-14-33,2033-11-14
2/4/05,2005-02-04
28-2,1999-02-28
28/1/11,2011-01-28
26/4-2028,2028-02-26
Oct 24 09,2009-10-24
10-1-2032,2032-01-05
10.9.1999,1999-09-10
14/11/15,2015-11-14
1997/4,1997-04-03
28/6/1994,1994-06-28
26 Nov 2022,2022-11-26
2022/1/10,2022-01-10
1991-3-15,1991-03-15
9/9-2005,2005-09-09
"Mar 4th, 1991",1991-03-04
2012/5/17,2012-05-17
27/1/97,1997-01-27
44-2-2013,2013-02-22
2003/9/15,2003-09-15
26/6-2021,2021-06-26
"Jun 25th, 2000",2000-06-25
13/2/05,2005-02-13
20/4/2016,2016-04-20
"Sep 16th, 2023",2023-09-16
9/6/1992,1992-06-09
1/4/1993,1993-01-04
5th of December 2009,2009-12-05
10-8-2019,2019-08-10
18:5:2001,2001-05-18
"Jan 15th, 1992",1992-01-15
12/9/2015,2015-09-12
10:10:2026,2026-10-10
2/10/24,2024-10-02
"Oct 28th, 2006",2006-10-28
26/6/29,2029-06-26
ngày 14 tháng 2 năm 2008,2008-02-14
18 Feb 2030,2030-02-18
11th of February 2028,2028-02-11
2004/9,2004-09-01
23-4-2035,2035-04-23
12 Ap 1994,1994-04-12
28 Oc 2015,2015-10-28
14Jun1998,1998-06-14
6/1/26,2026-06-01
2/7/2001,2001-07-02
3/2/01,2001-03-02
1/8-2016,2016-04-01
5 June 2020,2020-06-05
7:8:1997,1997-08-07
3Aug2006,2006-08-03
12041990,1990-04-12
34-5-2016,2016-05-17
13Jul2026,2026-07-13
12th of October 1990,1990-10-12
2-7-00,2000-02-07
17-1,2035-01-17
4/17/2024,2024-04-17
21-12,2022-12-21
2017/1/23,2017-01-23
9/4-2022,2022-02-09
2032/10,2032-10-08
20.5.2023,2023-05-20
"Dec 10th, 2000",2000-12-10
6/10/1991,1991-10-06
20 Oct 2017,2017-10-20
2017-5-25,2017-05-25
24 February 2023,2023-02-24
28/5-2032,2032-05-28
54-7-2033,2033-07-27
1992-8-4,1992-08-04
11/2/1992,1992-11-02
8/6/2015,2015-02-08
27/7-2027,2027-07-27
25 De 2017,2017-12-25
"June 4, 2013",2013-06-04
2012/2,2012-02-15
"Jul 10th, 2029",2029-07-10
4:4:1995,1995-04-04
6/36/2003,2003-12-06
1/18/2011,2011-01-18
4 December 1998,1998-12-04
13/9/17,2017-09-13
46-8-2024,2024-08-23
"Mar 23th, 1991",1991-03-23
13-9-2003,2003-09-13
12 January 2027,2027-01-12
25/21/2022,2022-07-25
9:5:2033,2033-05-09
2015/7/17,2015-07-17
ngày 21 tháng 11 năm 2020,2020-11-21
1:8:2012,2012-08-01
2025/11,2025-11-09
27/8-2022,2022-08-27
13/24-2014,2014-12-13
7Jul2006,2006-07-07
13Aug2002,2002-08-13
25 Feb 1992,1992-02-25
Nov 16 06,2006-11-16
5 Ap 2009,2009-04-05
9 Apr 2014,2014-04-09
24-9-2018,2018-09-24
2031-8-1,2031-08-01
20/9-2009,2009-09-20
1Dec1990,1990-12-01
2025-7-21,2025-07-21
2024/5/18,2024-05-18
18 Ap 2020,2020-04-18
ngày 18 tháng 10 năm 2018,2018-10-18
1/8/2009,2009-01-08
5-11-08,2008-05-11
2002/8,2002-08-27
18 tháng 2 năm 2006,2006-02-18
19th of January 2022,2022-01-19
14/10/24,2024-10-14
20-1-2007,2007-01-20
16/7/2032,2032-07-16
ngày 2 tháng 3 năm 2010,2010-03-02
27 tháng 7 năm 2023,2023-07-27
24 Jul 1992,1992-07-24
01042032,2032-04-01
1-7-2022,2022-07-01
28/10/2027,2027-10-28
9/11/1990,1990-09-11
9-6-12,2012-09-06
15/5/00,2000-05-15
28 May 2013,2013-05-28
9/10/12,2012-10-09
ngày 16 tháng 10 năm 2006,2006-10-16
19/7/25,2025-07-19
"Oct 5th, 2007",2007-10-05
11-23-21,2021-11-23
25/36/2006,2006-12-25
6 March 1996,1996-03-06
"Feb 2nd, 1996",1996-02-02
19 Ma 2018,2018-05-19
"April 10, 2017",2017-04-10
ngày 26 tháng 2 năm 1991,1991-02-26
27 Ju 2031,2031-06-27
20122032,2032-12-20
2000/8/4,2000-08-04
3Mar2003,2003-03-03
4/8/02,2002-08-04
11-18-30,2030-11-18
"April 1, 2028",2028-04-01
7/11/11,2011-07-11
23/15/2021,2021-05-23
16102016,2016-10-16
2016/11,2016-11-05
05012021,2021-01-05
7/9/2032,2032-07-09
9/4/24,2024-04-09
1/23/17,2017-01-23
"July 12, 1997",1997-07-12
17-3-2001,2001-03-17
Mar 7 22,2022-03-07
18/12/10,2010-12-18
2020/6/1,2020-06-01
15052014,2014-05-15
27th of April 2017,2017-04-27
4 August 1994,1994-08-04
2004/1/5,2004-01-05
7/7/05,2005-07-07
2011/8/9,2011-08-09
24 Jul 2030,2030-07-24
22 tháng 3 năm 1990,1990-03-22
6/18/2016,2016-06-06
10/18-2016,2016-09-10
24 Jul 2005,2005-07-24
5/25/2016,2016-05-25
17/8-1999,1999-08-17
2017-6-6,2017-06-06
22 Oct 2007,2007-10-22
2005-9-17,2005-09-17
6Feb1990,1990-02-06
9/19/2034,2034-09-19
15-8,1990-08-15
10/22/12,2012-10-22
23:2:2033,2033-02-23
5Apr2026,2026-04-05
27/6-1991,1991-06-27
13/24-2025,2025-12-13
9 Mar 2017,2017-03-09
17:7:2007,2007-07-17
6Jan2001,2001-01-06
3 May 2032,2032-05-03
19 Jul 2017,2017-07-19
2 Apr 2004,2004-04-02
8th of April 2031,2031-04-08
2.10.2034,2034-10-02
19:10:2009,2009-10-19
24/11/02,2002-11-24
27/5/1998,1998-05-27
16-11-2012,2012-11-08
10-4,2017-04-10
"June 28, 2033",2033-06-28
26/9/08,2008-09-26
2006-4-26,2006-04-26
2025-8-9,2025-08-09
Dec 1 19,2019-12-01
23 Ju 2028,2028-06-23
24:6:2017,2017-06-24
11:4:2028,2028-04-11
10-4-08,2008-10-04
4/3/34,2034-03-04
09082005,2005-08-09
"Dec 6th, 2035",2035-12-06
2-2-15,2015-02-02
7-6-2019,2019-06-07
10.7.2027,2027-07-10
2018/8,2018-08-17
16/15/2027,2027-05-16
"April 1, 2025",2025-04-01
2009/2,2009-02-09
20 Ja 1996,1996-01-20
16-12-2028,2028-12-08
6/9/1992,1992-09-06
21-3-2025,2025-03-21
2005/3/14,2005-03-14
1-4-1996,1996-04-01
"Jul 1st, 2008",2008-07-01
1st of September 2017,2017-09-01
16-1,1993-01-16
Jan 3 09,2009-01-03
13:12:2025,2025-12-13
4th of October 2003,2003-10-04
18/12/10,2010-12-18
54-2-2005,2005-02-27
10 tháng 1 năm 2023,2023-01-10
10.9.2012,2012-09-10
2000/10,2000-10-25
26 tháng 10 năm 1996,1996-10-26
7/6/10,2010-07-06
32-3-2000,2000-03-16
2/17/1995,1995-02-17
2Jan2026,2026-01-02
2/17/11,2011-02-17
26 Jul 2007,2007-07-26
9/36/2010,2010-12-09
"Nov 2nd, 2027",2027-11-02
2010-5-2,2010-05-02
6-6,2009-06-06
38-10-2002,2002-10-19
Feb 15 01,2001-02-15
1/7-2005,2005-07-01
11-10-2007,2007-10-11
ngày 10 tháng 2 năm 1999,1999-02-10
14/3/09,2009-03-14
8/7/1992,1992-07-08
9-26-24,2024-09-26
12-23-02,2002-12-23
1/22-2025,2025-11-01
21 tháng 5 năm 2013,2013-05-21
17 Ma 2027,2027-05-17
25/10-2002,2002-10-25
8/16/18,2018-08-16
5 June 2025,2025-06-05
14-8-2032,2032-08-14
2/2/90,1990-02-02
6/19/02,2002-06-19
Apr 20 17,2017-04-20
10/1/01,2001-01-10
26/16-2029,2029-08-26
22 March 2020,2020-03-22
10Jun1995,1995-06-10
15/12-2002,2002-12-15
26/30/2028,2028-10-26
5/9-2011,2011-09-05
6-11-15,2015-06-11
8-5,2026-05-08
5 tháng 9 năm 2030,2030-09-05
20 tháng 8 năm 2016,2016-08-20
5-9-1994,1994-09-05
23/24/2016,2016-08-23
2006-12-20,2006-12-20
2026/11/27,2026-11-27
16 Se 2026,2026-09-16
16th of May 2020,2020-05-16
7/2-2024,2024-02-07
3/22-1991,1991-11-03
1 Apr 2002,2002-04-01
6/19/96,1996-06-19
20/5-2013,2013-05-20
27/6/2015,2015-06-27
12-9,2029-09-12
1Jun1992,1992-06-01
ngày 14 tháng 9 năm 2028,2028-09-14
6/9/1997,1997-09-06
5/8/11,2011-08-05
12.6.2005,2005-06-12
"May 28th, 2030",2030-05-28
22 December 2005,2005-12-22
12/27/07,2007-12-27
20/7/16,2016-07-20
12 tháng 8 năm 2004,2004-08-12
ngày 6 tháng 4 năm 2022,2022-04-06
11/9/2030,2030-11-09
06082007,2007-08-06
Jul 17 98,1998-07-17
27/9/2003,2003-03-27
1999/1/22,1999-01-22
01072017,2017-07-01
2017/1,2017-01-14
2001/9/2,2001-09-02
20042020,2020-04-20
10051994,1994-05-10
2012-1-12,2012-01-12
4/24/1990,1990-04-24
2002-5-26,2002-05-26
2 De 2028,2028-12-02
18.8.1992,1992-08-18
6/6/23,2023-06-06
12/5-2009,2009-05-12
21031997,1997-03-21
26:2:2031,2031-02-26
27Nov1991,1991-11-27
"October 27, 2003",2003-10-27
02122028,2028-12-02
24-4-2019,2019-04-12
11022012,2012-02-11
21/10/04,2004-10-21
15-10,2035-10-15
46-2-2030,2030-02-23
4 Aug 2007,2007-08-04
18/16-2032,2032-08-18
16/11-2011,2011-11-16
22/11-2003,2003-11-22
1999/7,1999-07-27
"Mar 28th, 2026",2026-03-28
11/18-2032,2032-09-11
22/3/96,1996-03-22
15 Oct 2002,2002-10-15
2.5.2028,2028-05-02
ngày 16 tháng 4 năm 2033,2033-04-16
7/33/1993,1993-11-07
14:3:2030,2030-03-14
Jun 10 94,1994-06-10
19th of November 2010,2010-11-19
"Apr 21th, 2012",2012-04-21
10/3/2028,2028-01-10
22/24/1991,1991-08-22
"Mar 27th, 1995",1995-03-27
30-8-2019,2019-08-15
2027/7,2027-07-25
18 Ju 2008,2008-06-18
9 June 2001,2001-06-09
50-3-2009,2009-03-25
22-2-1993,1993-02-11
10-13-15,2015-10-13
25/3-2027,2027-03-25
22 Ma 2024,2024-05-22
25 tháng 1 năm 2026,2026-01-25
6 Mar 2022,2022-03-06
1.6.2020,2020-06-01
2007/3/13,2007-03-13
6Jan2000,2000-01-06
16/12-2003,2003-12-16
Aug 14 16,2016-08-14
Jan 10 18,2018-01-10
12-7,2025-07-12
ngày 26 tháng 4 năm 2022,2022-04-26
20/30/2022,2022-10-20
9/7/03,2003-07-09
01102022,2022-10-01
Nov 4 14,2014-11-04
4/4/96,1996-04-04
ngày 11 tháng 6 năm 2032,2032-06-11
10 Se 2007,2007-09-10
1/6-2024,2024-03-01
2035/11/20,2035-11-20
"January 27, 2018",2018-01-27
Jul 28 07,2007-07-28
22 tháng 4 năm 2027,2027-04-22
2010-3-9,2010-03-09
6/9-2001,2001-09-06
"December 10, 2019",2019-12-10
52-12-2013,2013-12-26
3/7/11,2011-07-03
3.3.2009,2009-03-03
"February 9, 1998",1998-02-09
3 De 2003,2003-12-03
2000/11,2000-11-17
2/20/2014,2014-02-20
2028/5,2028-05-06
3/16/13,2013-03-16
27062002,2002-06-27
4/8/2017,2017-08-04
3:1:2028,2028-01-03
5/14-2011,2011-07-05
21/3/11,2011-03-21
05072012,2012-07-05
19.9.1995,1995-09-19
"Nov 18th, 2005",2005-11-18
24/9/08,2008-09-24
4-4-03,2003-04-04
24/14-2019,2019-07-24
23:3:2020,2020-03-23
5-28-34,2034-05-28
6-9-2005,2005-09-03
2/9/00,2000-09-02
23/3-2004,2004-03-23
4/22/2022,2022-04-22
20Nov2019,2019-11-20
9-19-19,2019-09-19
8/6/2018,2018-08-06
2014/1,2014-01-21
6.11.2018,2018-11-06
17.11.1996,1996-11-17
2023/9,2023-09-10
25091990,1990-09-25
22062019,2019-06-22
2000/6/3,2000-06-03
7/1/2009,2009-01-07
1/18/2023,2023-06-01
"Jun 23th, 1997",1997-06-23
"May 9, 1998",1998-05-09
11/2/15,2015-02-11
7Nov2012,2012-11-07
14-8,2023-08-14
1998/9/12,1998-09-12
9/4/21,2021-04-09
11:8:2027,2027-08-11
27 May 1994,1994-05-27
1992/9,1992-09-02
12-1-31,2031-12-01
27/12/02,2002-12-27
28/5-2018,2018-05-28
28 July 2033,2033-07-28
21Sep2015,2015-09-21
2/20/07,2007-02-20
26/5/1993,1993-05-26
2032-11-4,2032-11-04
2/5/33,2033-02-05
1:3:1995,1995-03-01
6/2/23,2023-02-06
14/11/09,2009-11-14
1/12/2027,2027-01-12
13Apr2014,2014-04-13
21/8-1990,1990-08-21
7/12/2016,2016-04-07
5Feb2035,2035-02-05
24th of December 2021,2021-12-24
"May 22th, 2021",2021-05-22
3-21-15,2015-03-21
11/21/2028,2028-11-21
8/7/99,1999-07-08
2032/1,2032-01-19
4 July 1991,1991-07-04
25 Dec 2025,2025-12-25
2Oct2026,2026-10-02
12 January 1997,1997-01-12
5/11/09,2009-11-05
2/12-2014,2014-06-02
12 De 1993,1993-12-12
20:11:2022,2022-11-20
4/5/2004,2004-04-05
ngày 14 tháng 10 năm 2029,2029-10-14
25 Jan 2004,2004-01-25
10/10/1993,1993-10-10
ngày 18 tháng 2 năm 2010,2010-02-18
"August 4, 2028",2028-08-04
15:3:2003,2003-03-15
21-11-2013,2013-11-21
24-1-2025,2025-01-24
9-24-32,2032-09-24
21-2-2001,2001-02-21
20/7/04,2004-07-20
1/3/98,1998-03-01
2026/2/16,2026-02-16
4 Jan 2026,2026-01-04
15 tháng 2 năm 2013,2013-02-15
2Dec2031,2031-12-02
11/10-1999,1999-05-11
08061996,1996-06-08
10/2/2026,2026-02-10
11/6-2035,2035-06-11
21 tháng 1 năm 2005,2005-01-21
14-12-2009,2009-12-07
17/14-2033,2033-07-17
2003/7,2003-07-03
2:2:2001,2001-02-02
16.6.1999,1999-06-16
10th of March 2030,2030-03-10
11.10.2031,2031-10-11
28 Oc 2031,2031-10-28
2009/10/4,2009-10-04
"July 17, 1991",1991-07-17
23.8.2020,2020-08-23
22/2-1993,1993-02-22
20/9-2001,2001-09-20
8 Ma 2008,2008-05-08
1/24/1997,1997-01-24
ngày 1 tháng 9 năm 1990,1990-09-01
4/7/96,1996-04-07
7th of March 2019,2019-03-07
48-8-2033,2033-08-24
3/15/07,2007-03-15
4/1-2012,2012-01-04
16th of April 2025,2025-04-16
13/6/99,1999-06-13
"May 15, 2031",2031-05-15
1/6-2020,2020-03-01
20-12,2014-12-20
09042026,2026-04-09
13/11/29,2029-11-13
10 Ap 2020,2020-04-10
16-10,1993-10-16
11-20-30,2030-11-20
15Sep2005,2005-09-15
22/6-2018,2018-06-22
28-10-2017,2017-10-28
21/2/34,2034-02-21
9-7-2022,2022-07-09
26-6,2033-06-26
19Dec2012,2012-12-19
ngày 16 tháng 11 năm 2010,2010-11-16
2nd of November 1993,1993-11-02
20Apr2006,2006-04-20
Aug 17 25,2025-08-17
23102011,2011-10-23
16072030,2030-07-16
10-10-34,2034-10-10
24 January 2012,2012-01-24
21/10/2031,2031-10-21
23/9/02,2002-09-23
27 May 2003,2003-05-27
24/11-2005,2005-11-24
15/30/1997,1997-10-15
28/18-2030,2030-09-28
15-6-2027,2027-06-15
11/28/2011,2011-11-28
13/10/09,2009-10-13
18/5-1999,1999-05-18
2004/9/18,2004-09-18
3/26/2030,2030-03-26
21-8,2001-08-21
15/6-2010,2010-06-15
"Feb 25th, 2009",2009-02-25
11/10-2016,2016-10-11
1997/6,1997-06-07
2-12,2020-12-02
18/7/17,2017-07-18
28/12-2031,2031-12-28
2026/11/24,2026-11-24
2007-2-3,2007-02-03
8 tháng 5 năm 2004,2004-05-08
7/16/28,2028-07-16
5/18/19,2019-05-18
18-12,1996-12-18
46-9-2021,2021-09-23
2/5/1991,1991-02-05
2-6-2011,2011-06-02
"Oct 9th, 2022",2022-10-09
9/10-1993,1993-10-09
1st of September 2005,2005-09-01
10-4-06,2006-10-04
9-9-31,2031-09-09
28-6-2031,2031-06-28
26-9-2014,2014-09-13
20/5-2015,2015-05-20
26-2-2017,2017-02-26
6/27/2027,2027-09-06
2 Sep 2005,2005-09-02
12/10/2024,2024-10-12
1-26-11,2011-01-26
23:8:1999,1999-08-23
19-5-2017,2017-05-19
11/18/93,1993-11-18
23/10/08,2008-10-23
25/9-2019,2019-09-25
14/5/2035,2035-05-14
25:8:2010,2010-08-25
14/8-2016,2016-04-14
10-3,2021-03-10
26/22-2031,2031-11-26
2/6-2014,2014-06-02
10/24/2003,2003-10-24
11/6/1994,1994-06-11
20/2-2035,2035-02-20
6 Aug 2005,2005-08-06
09072007,2007-07-09
13-1,2023-01-13
Aug 26 30,2030-08-26
22/15/2031,2031-05-22
2/28/04,2004-02-28
Dec 11 95,1995-12-11
11/11/14,2014-11-11
22-7-2005,2005-07-11
"December 4, 2035",2035-12-04
08112000,2000-11-08
11112006,2006-11-11
10 tháng 3 năm 2004,2004-03-10
7-5,1994-05-07
2001/4/22,2001-04-22
10101992,1992-10-10
6/20/35,2035-06-20
"January 25, 2001",2001-01-25
21/10/23,2023-10-21
3/15/2017,2017-03-15
28-8-2030,2030-08-28
14Oct2012,2012-10-14
25-12-1992,1992-12-25
28-8-2017,2017-08-28
1991-1-27,1991-01-27
3Jan2035,2035-01-03
2031-12-28,2031-12-28
2001-10-3,2001-10-03
36-12-2029,2029-12-18
6/18/2002,2002-06-06
13/6/2024,2024-06-13
ngày 5 tháng 11 năm 2022,2022-11-05
21-5,2000-05-21
08021992,1992-02-08
10-7-2031,2031-07-10
16/5/15,2015-05-16
28 Ja 2001,2001-01-28
2-7-25,2025-02-07
7/16/00,2000-07-16
4:10:2030,2030-10-04
21.8.2012,2012-08-21
6 Ma 2001,2001-05-06
15Mar2015,2015-03-15
20/6/20,2020-06-20
28 Jun 2030,2030-06-28
7 tháng 8 năm 2008,2008-08-07
4th of June 2006,2006-06-04
21/4/28,2028-04-21
27:10:2031,2031-10-27
ngày 24 tháng 9 năm 2033,2033-09-24
25/8-2000,2000-08-25
"February 22, 2004",2004-02-22
6-10,2009-10-06
23/24/2016,2016-08-23
9-25-32,2032-09-25
1/16/15,2015-01-16
15 September 2003,2003-09-15
4:1:2002,2002-01-04
13 August 2003,2003-08-13
16Jan2026,2026-01-16
2002/1,2002-01-12
24/12-2032,2032-12-24
12/33/2024,2024-11-12
24 Ja 2023,2023-01-24
27 Nov 1999,1999-11-27
Aug 9 15,2015-08-09
24/18-1995,1995-09-24
2025-5-7,2025-05-07
7:10:1995,1995-10-07
2031/6/8,2031-06-08
24-4-1998,1998-04-12
27/2/32,2032-02-27
25th of July 2034,2034-07-25
14-10,2017-10-14
26/8/2017,2017-08-26
20 May 2023,2023-05-20
21th of August 1993,1993-08-21
1 Ma 2035,2035-03-01
15/9/05,2005-09-15
12 Aug 1991,1991-08-12
28/7/2026,2026-07-28
"Nov 16th, 1993",1993-11-16
2027-6-12,2027-06-12
17 June 1999,1999-06-17
5-17-15,2015-05-17
13 tháng 2 năm 2007,2007-02-13
2000/7/24,2000-07-24
27 Ma 1995,1995-05-27
4/2-2002,2002-02-04
19/5/24,2024-05-19
18.4.2029,2029-04-18
15/3/27,2027-03-15
10/15/2013,2013-10-15
2033/10,2033-10-20
25/12/01,2001-12-25
25:2:2003,2003-02-25
"May 1st, 2032",2032-05-01
7/4/2028,2028-04-07
"February 23, 2018",2018-02-23
2024/10/17,2024-10-17
48-2-2024,2024-02-24
7.10.1992,1992-10-07
23/4/96,1996-04-23
15-2-2027,2027-02-15
1-28-27,2027-01-28
27.3.1999,1999-03-27
12-20-91,1991-12-20
27.4.2034,2034-04-27
24 tháng 6 năm 2025,2025-06-24
13/16-2031,2031-08-13
17 tháng 12 năm 1996,1996-12-17
12Jan2023,2023-01-12
8/28/2031,2031-08-28
22/1/97,1997-01-22
5 Ma 2034,2034-03-05
9/11/17,2017-11-09
3-27-26,2026-03-27
23/7/92,1992-07-23
4-11-32,2032-04-11
20 tháng 4 năm 2022,2022-04-20
16 tháng 9 năm 2002,2002-09-16
7/16-2018,2018-08-07
20/8/2014,2014-08-20
28/4/2017,2017-04-28
Jun 1 99,1999-06-01
25/11/1994,1994-11-25
6th of July 1991,1991-07-06
8/7/00,2000-07-08
Sep 3 07,2007-09-03
10/12/2009,2009-04-10
2034/9/2,2034-09-02
2035/3,2035-03-18
22.7.2030,2030-07-22
6-1-1998,1998-01-06
3/10/03,2003-10-03
1991/2/4,1991-02-04
3/4/34,2034-04-03
11/22/2029,2029-11-22
5/10/30,2030-10-05
17/10-1992,1992-10-17
1-10-12,2012-01-10
7:11:2027,2027-11-07
28/12/1997,1997-04-28
1:7:2016,2016-07-01
27Dec2029,2029-12-27
19-5-2031,2031-05-19
"January 27, 2023",2023-01-27
5-3,2006-03-05
"Sep 18th, 1992",1992-09-18
8th of January 2004,2004-01-08
25/7/2023,2023-07-25
22062019,2019-06-22
14.1.2022,2022-01-14
May 11 23,2023-05-11
22th of February 2023,2023-02-22
2011/1/24,2011-01-24
6-24-28,2028-06-24
2001/2,2001-02-03
9/24/2018,2018-08-09
1993/7/1,1993-07-01
14 Ma 1994,1994-05-14
2/18/2035,2035-02-18
2/7/20,2020-02-07
25 Au 1996,1996-08-25
14/6/03,2003-06-14
9:11:2007,2007-11-09
3 tháng 12 năm 2021,2021-12-03
27/8/1996,1996-08-27
17-2,2005-02-17
20/11/00,2000-11-20
25.7.1997,1997-07-25
24-10-2006,2006-10-24
7 Jan 2005,2005-01-07
24 June 2033,2033-06-24
17 Ja 2017,2017-01-17
7-17-18,2018-07-17
22/10-1992,1992-10-22
28Jan1998,1998-01-28
4 tháng 3 năm 2012,2012-03-04
27:12:2020,2020-12-27
"December 26, 2023",2023-12-26
27/12/2007,2007-04-27
12/2-2026,2026-02-12
"Aug 2nd, 1991",1991-08-02
2 Ju 1993,1993-07-02
20:7:2012,2012-07-20
18082025,2025-08-18
17 November 1993,1993-11-17
5 Au 2001,2001-08-05
25/9/30,2030-09-25
18/12/2001,2001-04-18
4Jun2002,2002-06-04
7/11/92,1992-11-07
28-9-2024,2024-09-28
2029/8/27,2029-08-27
10 Dec 2029,2029-12-10
12/3/2010,2010-03-12
2 tháng 6 năm 2004,2004-06-02
Aug 23 16,2016-08-23
11th of November 1995,1995-11-11
25Nov2023,2023-11-25
20/3/30,2030-03-20
Jun 24 93,1993-06-24
10/9/20,2020-10-09
14 June 2023,2023-06-14
11-3-2000,2000-03-11
12-6,1997-06-12
14 Feb 1998,1998-02-14
8-19-99,1999-08-19
9/15/01,2001-09-15
7 tháng 4 năm 2021,2021-04-07
10 Au 1998,1998-08-10
24/8-2013,2013-04-24
18 Ju 2034,2034-07-18
26.12.2012,2012-12-26
12/8/06,2006-12-08
28/2/20,2020-02-28
1993/7,1993-07-24
14/11-1998,1998-11-14
5 tháng 12 năm 2012,2012-12-05
4 May 2027,2027-05-04
28Nov1991,1991-11-28
"November 16, 2011",2011-11-16
25th of April 2011,2011-04-25
"Feb 20th, 1996",1996-02-20
4-5-2013,2013-05-04
1.8.2004,2004-08-01
"Oct 27th, 2020",2020-10-27
2/24/31,2031-02-24
22-3-2024,2024-03-22
ngày 3 tháng 10 năm 2016,2016-10-03
13:7:2004,2004-07-13
2035-1-27,2035-01-27
"Nov 19th, 2011",2011-11-19
"Apr 28th, 2016",2016-04-28
3-4-2012,2012-04-03
24 July 2025,2025-07-24
16/4-1992,1992-04-16
15Oct2017,2017-10-15
3/24/23,2023-03-24
9 Ju 2010,2010-06-09
26/18/2026,2026-06-26
2031/12/2,2031-12-02
6/10/2003,2003-06-10
7 Se 2000,2000-09-07
2029/3,2029-03-11
2/8-2011,2011-08-02
19022006,2006-02-19
28/14-2017,2017-07-28
12/11-2027,2027-11-12
14 May 2000,2000-05-14
2025-5-17,2025-05-17
2022-5-5,2022-05-05
19062024,2024-06-19
10 Fe 2016,2016-02-10
5-8-04,2004-05-08
ngày 14 tháng 1 năm 1998,1998-01-14
14-6-1991,1991-06-07
28 Se 2034,2034-09-28
2 Ma 2005,2005-05-02
15:8:2006,2006-08-15
23/3/29,2029-03-23
06052030,2030-05-06
2034/1,2034-01-19
27/4/2033,2033-04-27
26071991,1991-07-26
23/6-2032,2032-06-23
15/2-2012,2012-02-15
14/4-2007,2007-02-14
14/5/2001,2001-05-14
1/11/17,2017-11-01
2 Sep 2006,2006-09-02
14/33/2031,2031-11-14
24/24-2001,2001-12-24
2035-7-7,2035-07-07
"May 24th, 1992",1992-05-24
12/6/2023,2023-06-12
21 tháng 6 năm 1994,1994-06-21
2-12-26,2026-02-12
27Aug2007,2007-08-27
16 Ma 2003,2003-03-16
"October 4, 2033",2033-10-04
12/21/12,2012-12-21
1-21-90,1990-01-21
4 Se 2011,2011-09-04
18th of August 1990,1990-08-18
2020-4-23,2020-04-23
2029/2,2029-02-04
"August 18, 2009",2009-08-18
19/1/29,2029-01-19
26.5.1990,1990-05-26
18-7-2035,2035-07-18
2028/12/7,2028-12-07
4/2/19,2019-02-04
16 Jun 1994,1994-06-16
21/8/25,2025-08-21
23 March 2029,2029-03-23
28:7:2006,2006-07-28
9Mar2011,2011-03-09
11/15/1990,1990-11-15
5/9-1994,1994-09-05
8 tháng 10 năm 2010,2010-10-08
Sep 13 34,2034-09-13
10/10/35,2035-10-10
2008/4/28,2008-04-28
15 Jul 2023,2023-07-15
2031-5-10,2031-05-10
27/24-2024,2024-12-27
5/2/19,2019-02-05
"Apr 21th, 2034",2034-04-21
ngày 11 tháng 4 năm 2000,2000-04-11
1996-7-22,1996-07-22
1997-1-22,1997-01-22
"Aug 25th, 1991",1991-08-25
13.3.2029,2029-03-13
2035/2/23,2035-02-23
2022/5/9,2022-05-09
6/6/93,1993-06-06
1/11/31,2031-11-01
5Oct2016,2016-10-05
21/6/2006,2006-06-21
10-1,2035-01-10
3rd of August 1998,1998-08-03
9-8-90,1990-09-08
ngày 14 tháng 10 năm 2002,2002-10-14
20/12-2020,2020-12-20
18th of October 2002,2002-10-18
2021/6,2021-06-02
26/5/2024,2024-05-26
"Jan 3rd, 2017",2017-01-03
8/1/2018,2018-01-08
14042026,2026-04-14
6/5-2012,2012-05-06
12/12/2013,2013-04-12
8.9.2010,2010-09-08
2nd of August 2025,2025-08-02
10-11-16,2016-10-11
7.8.2013,2013-08-07
6/3/1994,1994-03-06
ngày 14 tháng 8 năm 2035,2035-08-14
"Jan 24th, 1996",1996-01-24
3Aug2001,2001-08-03
"May 7, 2026",2026-05-07
12-22-25,2025-12-22
9 May 2028,2028-05-09
25/6-2000,2000-03-25
1-16-20,2020-01-16
14:2:2009,2009-02-14
5Jul2016,2016-07-05
19-11-1990,1990-11-19
23.5.2017,2017-05-23
2/6/2009,2009-02-02
ngày 11 tháng 8 năm 2023,2023-08-11
22-5,2017-05-22
25.1.2034,2034-01-25
Jan 14 94,1994-01-14
15/3/2033,2033-03-15
13 Fe 2020,2020-02-13
56-12-2010,2010-12-28
26th of April 2011,2011-04-26
27/14-2000,2000-07-27
28/36/1992,1992-12-28
1 Ma 1999,1999-03-01
8/12/1992,1992-08-12
2035-2-7,2035-02-07
15/27/2003,2003-09-15
48-12-2026,2026-12-24
18.10.2013,2013-10-18
Mar 3 25,2025-03-03
13Oct2033,2033-10-13
11/23/93,1993-11-23
22/8/93,1993-08-22
17 tháng 7 năm 2002,2002-07-17
10/4/17,2017-10-04
16 June 2032,2032-06-16
8/8/1997,1997-08-08
"Jan 15th, 2023",2023-01-15
27/6-2011,2011-06-27
2009/7/12,2009-07-12
18/1-2022,2022-01-18
2/6/2026,2026-06-02
17/27/2025,2025-09-17
13/11/23,2023-11-13
3/4/2022,2022-04-03
1990/12,1990-12-09
"Sep 12th, 2004",2004-09-12
3-15-28,2028-03-15
2015/8,2015-08-13
21th of October 2012,2012-10-21
8/11/2022,2022-08-11
"May 6th, 1992",1992-05-06
May 13 33,2033-05-13
25:4:2009,2009-04-25
15/7/04,2004-07-15
"July 12, 2015",2015-07-12
18 Mar 2024,2024-03-18
2005/11/9,2005-11-09
"Sep 27th, 2008",2008-09-27
17 Nov 1998,1998-11-17
ngày 15 tháng 11 năm 2022,2022-11-15
2032/1,2032-01-10
4/8/2000,2000-08-04
"Feb 22th, 1994",1994-02-22
2/10-2021,2021-10-02
ngày 5 tháng 4 năm 2032,2032-04-05
16/9/29,2029-09-16
24th of October 2009,2009-10-24
18062021,2021-06-18
12/21/2012,2012-07-12
"May 4, 2002",2002-05-04
6 Jun 2034,2034-06-06
19-2-2011,2011-02-19
20 March 2021,2021-03-20
2020/8,2020-08-28
ngày 18 tháng 12 năm 2033,2033-12-18
ngày 14 tháng 4 năm 2021,2021-04-14
1996-8-26,1996-08-26
2 August 1999,1999-08-02
2013/2/5,2013-02-05
09012021,2021-01-09
1/8/94,1994-01-08
2024-11-11,2024-11-11
8.4.2005,2005-04-08
21/9/2021,2021-09-21
2032/3,2032-03-12
ngày 6 tháng 11 năm 2018,2018-11-06
"Feb 17th, 2030",2030-02-17
1/20/01,2001-01-20
6/3/1993,1993-01-06
14:11:2003,2003-11-14
17th of July 2009,2009-07-17
24122026,2026-12-24
19/3-2012,2012-03-19
ngày 13 tháng 1 năm 1990,1990-01-13
2020/9/9,2020-09-09
24 Apr 1992,1992-04-24
28/11/09,2009-11-28
19/8/2018,2018-08-19
18/10-2020,2020-05-18
22 Sep 2012,2012-09-22
8 Nov 2025,2025-11-08
14May2018,2018-05-14
ngày 7 tháng 7 năm 2016,2016-07-07
19:3:2007,2007-03-19
21Oct2001,2001-10-21
15/6-2033,2033-03-15
15/4/2028,2028-04-15
12th of May 1997,1997-05-12
21102024,2024-10-21
6th of September 1995,1995-09-06
ngày 26 tháng 9 năm 2033,2033-09-26
17 tháng 2 năm 1994,1994-02-17
14-6-2017,2017-06-14
16/1/2003,2003-01-16
1996-6-11,1996-06-11
07102030,2030-10-07
2030-12-1,2030-12-01
19/8-2006,2006-04-19
1-18-19,2019-01-18
9/4/2021,2021-04-09
21/12-2013,2013-12-21
19/5/35,2035-05-19
ngày 24 tháng 1 năm 2011,2011-01-24
2021/4,2021-04-01
4:1:2023,2023-01-04
4th of May 2008,2008-05-04
8/14-1993,1993-07-08
7/11/2024,2024-11-07
5-5-14,2014-05-05
12-1-1992,1992-01-06
25/8-1992,1992-04-25
13/1/31,2031-01-13
7/3/1995,1995-01-07
11:12:2029,2029-12-11
18122008,2008-12-18
22/18/2025,2025-06-22
4th of November 2016,2016-11-04
6Feb1990,1990-02-06
5-9,2010-09-05
ngày 16 tháng 3 năm 2004,2004-03-16
12/3/13,2013-12-03
1-12-2021,2021-12-01
22/1/2006,2006-01-22
25 August 2022,2022-08-25
Jul 10 98,1998-07-10
4-4,1991-04-04
18May2011,2011-05-18
ngày 9 tháng 2 năm 2004,2004-02-09
1997-4-4,1997-04-04
20th of April 2004,2004-04-20
11/4/2026,2026-11-04
22-9-1992,1992-09-11
21/12/32,2032-12-21
17 Ju 2023,2023-06-17
2024-6-28,2024-06-28
"Jan 23th, 2033",2033-01-23
12/22/21,2021-12-22
1991-11-17,1991-11-17
28 January 2011,2011-01-28
May 27 06,2006-05-27
19.2.1993,1993-02-19
3/1/12,2012-01-03
26-3,2024-03-26
2/16/2017,2017-02-16
1-5,2005-05-01
18 Oc 2030,2030-10-18
2031/6,2031-06-16
28-8,1999-08-28
1/23/19,2019-01-23
03052003,2003-05-03
18:12:2011,2011-12-18
1990/3,1990-03-17
ngày 3 tháng 3 năm 2024,2024-03-03
27th of September 2035,2035-09-27
9/21/2023,2023-07-09
07052015,2015-05-07
4:6:1995,1995-06-04
6/21/2023,2023-06-21
3/8/04,2004-08-03
3/11/2025,2025-11-03
11/8-2023,2023-04-11
26:3:2030,2030-03-26
5.3.2033,2033-03-05
2006/7,2006-07-17
5/2/2010,2010-02-05
4/30/2031,2031-10-04
15/11/2018,2018-11-15
5/30/2007,2007-10-05
12 tháng 8 năm 2003,2003-08-12
8 tháng 12 năm 1998,1998-12-08
1 Jan 2012,2012-01-01
27/1-2032,2032-01-27
Feb 17 17,2017-02-17
2000/4/5,2000-04-05
2025/7/19,2025-07-19
25-4-2032,2032-04-25
16-2-2009,2009-02-08
10/19/2004,2004-10-19
7 June 1997,1997-06-07
1-1-1999,1999-01-01
5/10-1990,1990-10-05
23/12/2023,2023-12-23
2027/7,2027-07-21
9-4-2015,2015-04-09
ngày 13 tháng 2 năm 2018,2018-02-13
7/7/1991,1991-07-07
Jun 13 23,2023-06-13
22:9:1997,1997-09-22
13-5,2035-05-13
28/5/24,2024-05-28
5 Ju 2006,2006-07-05
1/9/93,1993-01-09
24 tháng 3 năm 2012,2012-03-24
"April 10, 2009",2009-04-10
1995-6-10,1995-06-10
ngày 1 tháng 5 năm 1992,1992-05-01
2024/5/19,2024-05-19
18-6-2007,2007-06-09
20 tháng 4 năm 1997,1997-04-20
19 tháng 10 năm 1997,1997-10-19
9Mar2027,2027-03-09
38-11-2023,2023-11-19
5:4:2023,2023-04-05
24-12-2019,2019-12-24
2003/10,2003-10-26
12/9/2031,2031-09-12
"October 28, 2018",2018-10-28
26/6/2013,2013-02-26
23/2-1992,1992-01-23
16:12:2019,2019-12-16
2016-8-16,2016-08-16
25-7,2035-07-25
10 tháng 5 năm 2008,2008-05-10
6.7.2019,2019-07-06
22/12-2018,2018-06-22
ngày 17 tháng 5 năm 1996,1996-05-17
17 Au 1999,1999-08-17
1-13-06,2006-01-13
26.3.2014,2014-03-26
4.3.1996,1996-03-04
"Aug 14th, 1998",1998-08-14
5/16-2006,2006-08-05
12 Ma 2005,2005-03-12
2028-11-12,2028-11-12
16 Sep 2000,2000-09-16
3 De 2035,2035-12-03
20/5/16,2016-05-20
"April 12, 1990",1990-04-12
9/9/2011,2011-03-09
11 Aug 2008,2008-08-11
14 Oc 2017,2017-10-14
2007/4/17,2007-04-17
44-8-2013,2013-08-22
6-1,2016-01-06
11/6/2033,2033-11-06
4/21/2010,2010-07-04
20062008,2008-06-20
12-8-2021,2021-08-12
5-6,2010-06-05
10/1/16,2016-10-01
4/4-2025,2025-02-04
24 Ma 2003,2003-05-24
10/4/16,2016-04-10
23-7,2035-07-23
1-5,2007-05-01
27Dec2015,2015-12-27
22Aug2029,2029-08-22
12/18/2012,2012-06-12
8 February 2001,2001-02-08
19-2,2006-02-19
20-9,2006-09-20
16 May 1997,1997-05-16
10/4-2007,2007-04-10
19112014,2014-11-19
ngày 16 tháng 10 năm 2026,2026-10-16
8-4-2012,2012-04-04
6/6/2030,2030-06-06
27 December 2019,2019-12-27
21/5-1998,1998-05-21
18:1:2005,2005-01-18
ngày 17 tháng 8 năm 2019,2019-08-17
"July 17, 2005",2005-07-17
1.5.2001,2001-05-01
8-9-2003,2003-09-04
1/16-2035,2035-08-01
18 September 2000,2000-09-18
24022034,2034-02-24
24-12-2000,2000-12-12
24071991,1991-07-24
18Feb2017,2017-02-18
5.6.2016,2016-06-05
2005-6-28,2005-06-28
7-10-09,2009-07-10
28 Au 1991,1991-08-28
2026-10-8,2026-10-08
15 Ju 2022,2022-06-15
25 August 1991,1991-08-25
15/11/26,2026-11-15
20/9/94,1994-09-20
12 September 2025,2025-09-12
27 tháng 8 năm 1995,1995-08-27
8/6/1996,1996-08-06
2006/4,2006-04-12
26/9/10,2010-09-26
22:3:2027,2027-03-22
12/22/14,2014-12-22
2/7/2028,2028-02-07
"February 23, 2018",2018-02-23
7May2029,2029-05-07
22/8/2009,2009-08-22
9 Sep 2015,2015-09-09
1/6/23,2023-01-06
11.5.2029,2029-05-11
Mar 23 28,2028-03-23
8th of August 2031,2031-08-08
"July 25, 2004",2004-07-25
2011-6-11,2011-06-11
2030-10-19,2030-10-19
15/2-2021,2021-02-15
25-1-2025,2025-01-25
16/3/2022,2022-01-16
ngày 6 tháng 3 năm 1997,1997-03-06
14.7.1993,1993-07-14
38-5-2001,2001-05-19
"September 6, 2010",2010-09-06
10th of April 2035,2035-04-10
24 Fe 2005,2005-02-24
16:6:1999,1999-06-16
1990/1/4,1990-01-04
May 13 33,2033-05-13
2005/4,2005-04-24
3rd of January 2031,2031-01-03
7:1:2010,2010-01-07
23/4-2035,2035-02-23
3/5/35,2035-05-03
2-1,2029-01-02
"December 22, 2027",2027-12-22
18 Oc 2026,2026-10-18
19/24-1997,1997-12-19
18:10:2032,2032-10-18
Jul 26 05,2005-07-26
38-4-1999,1999-04-19
28/8/1994,1994-08-28
16/8/28,2028-08-16
3/6-2026,2026-06-03
16.11.2012,2012-11-16
Apr 12 22,2022-04-12
26-11,2007-11-26
14/4/1995,1995-04-14
14-12-1990,1990-12-07
ngày 19 tháng 2 năm 2005,2005-02-19
06062003,2003-06-06
1/11/2020,2020-01-11
20 tháng 7 năm 1996,1996-07-20
"Feb 25th, 2013",2013-02-25
27/2-1998,1998-01-27
20-9-2016,2016-09-10
1995/6,1995-06-17
"Dec 15th, 2033",2033-12-15
25/5/2025,2025-05-25
May 23 31,2031-05-23
9/2-2012,2012-02-09
Jan 4 22,2022-01-04
9-13-31,2031-09-13
25/6-1990,1990-06-25
ngày 11 tháng 5 năm 2005,2005-05-11
"May 9th, 2009",2009-05-09
2033/4/10,2033-04-10
28-5-2003,2003-05-28
11/1/15,2015-01-11
18/22-2013,2013-11-18
25/14-2016,2016-07-25
5/4-2035,2035-04-05
8/30/2024,2024-10-08
11/26/22,2022-11-26
28/11/13,2013-11-28
13.6.2031,2031-06-13
13 tháng 8 năm 1994,1994-08-13
23/18/2005,2005-06-23
ngày 3 tháng 5 năm 2013,2013-05-03
11th of September 2028,2028-09-11
2006/7,2006-07-28
15/10/35,2035-10-15
10/3-2032,2032-03-10
13 December 2027,2027-12-13
1 Ma 2004,2004-03-01
Dec 11 27,2027-12-11
2013/6/7,2013-06-07
2028-10-24,2028-10-24
1-12-16,2016-01-12
18032034,2034-03-18
14 tháng 5 năm 2028,2028-05-14
9 February 2034,2034-02-09
11/12/2018,2018-04-11
2031/12,2031-12-11
1993/1,1993-01-06
24/3/1991,1991-03-24
22-6-2019,2019-06-11
3/23/11,2011-03-23
14/7/21,2021-07-14
4Feb1990,1990-02-04
6th of August 2007,2007-08-06
ngày 9 tháng 11 năm 1994,1994-11-09
12/16-2019,2019-08-12
17 Ju 2000,2000-06-17
10:2:2008,2008-02-10
"September 11, 2030",2030-09-11
9/14/2006,2006-09-14
2035/1,2035-01-28
9-11-18,2018-09-11
11Dec2017,2017-12-11
17/1/18,2018-01-17
18-3,2021-03-18
07011994,1994-01-07
"November 17, 2027",2027-11-17
3/22/15,2015-03-22
4/33/2003,2003-11-04
38-4-2028,2028-04-19
23.6.2011,2011-06-23
2008-7-1,2008-07-01
"April 12, 2031",2031-04-12
9-8,2002-08-09
25/3/2032,2032-01-25
24.10.2029,2029-10-24
1-21-91,1991-01-21
9-19-95,1995-09-19
2032-11-11,2032-11-11
Nov 19 90,1990-11-19
2009/4,2009-04-17
11-23-05,2005-11-23
11 Feb 2008,2008-02-11
7/4-2003,2003-04-07
3-15-31,2031-03-15
25:1:2021,2021-01-25
2/18/17,2017-02-18
12/10/2011,2011-12-10
2014/7/26,2014-07-26
1996/3/16,1996-03-16
17/7/13,2013-07-17
1.5.2014,2014-05-01
11/23/14,2014-11-23
11/6-2033,2033-06-11
11.1.1994,1994-01-11
10-8,2032-08-10
Nov 2 24,2024-11-02
11/4/12,2012-11-04
28-8-2028,2028-08-28
28/2-1999,1999-01-28
20042003,2003-04-20
18Apr1994,1994-04-18
28.4.2023,2023-04-28
"July 13, 2023",2023-07-13
3-26-32,2032-03-26
"Dec 23th, 2029",2029-12-23
6/11/92,1992-06-11
15/9/05,2005-09-15
14/6-2033,2033-06-14
13 No 2009,2009-11-13
16-9-2034,2034-09-16
2023-3-10,2023-03-10
3/10/01,2001-03-10
3/22/1998,1998-03-22
Nov 8 91,1991-11-08
1999/3,1999-03-05
15/6-2006,2006-06-15
22/7/05,2005-07-22
7/17/1993,1993-07-17
5/10-1994,1994-10-05
22/4/30,2030-04-22
25/9/91,1991-09-25
2-24-18,2018-02-24
20/3/11,2011-03-20
3-14-90,1990-03-14
2034/11,2034-11-26
23/18/1991,1991-06-23
11-8-16,2016-11-08
8/2/04,2004-02-08
13/1/2014,2014-01-13
2016/1/17,2016-01-17
23.2.2022,2022-02-23
"September 7, 2004",2004-09-07
28-5,2014-05-28
34-9-2005,2005-09-17
12/2/25,2025-02-12
18 Apr 2031,2031-04-18
13/30/2027,2027-10-13
4.9.2019,2019-09-04
14/8-2011,2011-04-14
26 January 2010,2010-01-26
16/6/33,2033-06-16
"Jan 15th, 2026",2026-01-15
25/2-2018,2018-01-25
20:6:2005,2005-06-20
18 Mar 2035,2035-03-18
7/12/2020,2020-07-12
28/2/27,2027-02-28
1990-9-24,1990-09-24
15 August 2007,2007-08-15
21/14-2004,2004-07-21
22 Mar 2028,2028-03-22
10/24-2030,2030-12-10
6-1,2007-01-06
8-20-19,2019-08-20
15:11:2004,2004-11-15
6 September 2000,2000-09-06
1998/2,1998-02-11
6-2-2015,2015-02-03
25 May 2012,2012-05-25
4/12-2006,2006-12-04
20/10-2006,2006-05-20
10-7-90,1990-10-07
2004/7/28,2004-07-28
4th of July 1995,1995-07-04
48-7-2003,2003-07-24
28-2,2002-02-28
18 February 2004,2004-02-18
13/11/2002,2002-11-13
ngày 3 tháng 3 năm 2003,2003-03-03
12:10:2026,2026-10-12
26/12/2015,2015-04-26
19-4,1991-04-19
44-5-2022,2022-05-22
2033/1,2033-01-04
10/5/27,2027-10-05
"February 12, 1992",1992-02-12
28-12,1993-12-28
17th of September 1992,1992-09-17
7/12/15,2015-12-07
"Feb 6th, 2005",2005-02-06
14/7-2007,2007-07-14
5-7-19,2019-05-07
19/2/22,2022-02-19
2/19/2004,2004-02-19
19/5/13,2013-05-19
9 June 2007,2007-06-09
13.12.2009,2009-12-13
2016/6/18,2016-06-18
25 September 2020,2020-09-25
2013-12-12,2013-12-12
2-11-2016,2016-11-01
"Jul 4th, 2026",2026-07-04
17-2,2001-02-17
10/23/24,2024-10-23
2-17-93,1993-02-17
11/16-2009,2009-08-11
10051993,1993-05-10
13/9/2008,2008-09-13
10 Oc 2011,2011-10-10
24/9-1999,1999-09-24
"February 6, 2002",2002-02-06
"Feb 19th, 2012",2012-02-19
1Jul2020,2020-07-01
18 February 2027,2027-02-18
28/9/11,2011-09-28
10/21/2001,2001-10-21
16/2-2028,2028-01-16
09032005,2005-03-09
52-3-1991,1991-03-26
2026/10,2026-10-14
2-7-1993,1993-07-01
9/12-1995,1995-12-09
2nd of March 1998,1998-03-02
3 August 1995,1995-08-03
14 De 2031,2031-12-14
10Sep2022,2022-09-10
2013/5/13,2013-05-13
ngày 21 tháng 6 năm 2022,2022-06-21
"May 19, 2024",2024-05-19
14/12/08,2008-12-14
22/5/11,2011-05-22
"March 26, 2008",2008-03-26
ngày 21 tháng 6 năm 1995,1995-06-21
1997-3-21,1997-03-21
15/8-2035,2035-08-15
"Dec 23th, 2024",2024-12-23
5 tháng 5 năm 2013,2013-05-05
19/22-2001,2001-11-19
8.12.2033,2033-12-08
"December 2, 1995",1995-12-02
3:7:2034,2034-07-03
1 tháng 2 năm 2026,2026-02-01
"Nov 17th, 2026",2026-11-17
21/10/2000,2000-10-21
ngày 15 tháng 9 năm 2030,2030-09-15
1.12.1999,1999-12-01
27.10.1994,1994-10-27
12 February 2023,2023-02-12
2027/9,2027-09-13
15/9/2009,2009-03-15
12-26-97,1997-12-26
14.1.1991,1991-01-14
6/17/96,1996-06-17
8/4/08,2008-04-08
25.10.1998,1998-10-25
27 tháng 2 năm 2032,2032-02-27
"November 7, 1998",1998-11-07
21 November 2034,2034-11-21
1/1-2007,2007-01-01
22-7-2018,2018-07-22
8 tháng 6 năm 2016,2016-06-08
18 December 2030,2030-12-18
6Aug2024,2024-08-06
24/5/2034,2034-05-24
12012031,2031-01-12
26-2,1992-02-26
8/1-2003,2003-01-08
18Aug2019,2019-08-18
13 tháng 5 năm 2029,2029-05-13
2013/3,2013-03-06
"January 3, 2009",2009-01-03
10/22-2029,2029-11-10
"May 24, 2023",2023-05-24
2002-12-13,2002-12-13
2011/9/13,2011-09-13
1/9-1997,1997-09-01
10 June 2035,2035-06-10
"February 24, 2014",2014-02-24
18 Fe 2027,2027-02-18
"Jun 15th, 2024",2024-06-15
12-3-1998,1998-03-06
27-3-2031,2031-03-27
3 Ma 2026,2026-05-03
Mar 7 98,1998-03-07
23 June 2032,2032-06-23
15Apr1991,1991-04-15
9 Ju 2004,2004-06-09
20/15/2033,2033-05-20
"May 5th, 2006",2006-05-05
09092003,2003-09-09
24071991,1991-07-24
25:3:1991,1991-03-25
2033/2,2033-02-16
"Dec 17th, 2022",2022-12-17
7:9:2013,2013-09-07
17-12-2017,2017-12-17
18-4,2016-04-18
20 November 2001,2001-11-20
24111991,1991-11-24
6:10:2007,2007-10-06
1/25/2016,2016-01-25
2014-12-20,2014-12-20
12 January 2013,2013-01-12
6-12,2028-12-06
4Dec2023,2023-12-04
26/9/2013,2013-09-26
11 De 2032,2032-12-11
7Aug1990,1990-08-07
12 December 2011,2011-12-12
2005-3-4,2005-03-04
2003/3,2003-03-11
28:7:2012,2012-07-28
23.10.2026,2026-10-23
ngày 3 tháng 1 năm 2032,2032-01-03
ngày 17 tháng 5 năm 2028,2028-05-17
23/4/28,2028-04-23
27 May 2024,2024-05-27
7/26/34,2034-07-26
22/21/2027,2027-07-22
ngày 24 tháng 5 năm 2018,2018-05-24
3-6-33,2033-03-06
24/3-2009,2009-03-24
9 Jul 2024,2024-07-09
05052001,2001-05-05
"Apr 15th, 2019",2019-04-15
25th of August 1994,1994-08-25
28-10-2026,2026-10-28
5/21/2006,2006-07-05
8:11:2026,2026-11-08
"June 7, 2027",2027-06-07
7/11/1997,1997-11-07
10-5-2025,2025-05-05
17 tháng 7 năm 2012,2012-07-17
16.9.2010,2010-09-16
13th of July 2010,2010-07-13
17.5.2006,2006-05-17
ngày 9 tháng 12 năm 2032,2032-12-09
1/3-2016,2016-03-01
5 tháng 8 năm 1996,1996-08-05
4-7-2013,2013-07-04
23/36/2002,2002-12-23
16/36/2005,2005-12-16
6-5-2018,2018-05-06
13th of September 2004,2004-09-13
2001-5-26,2001-05-26
09062012,2012-06-09
13/33/2023,2023-11-13
12 tháng 3 năm 2008,2008-03-12
38-2-1997,1997-02-19
12-22-06,2006-12-22
18/7-2035,2035-07-18
1/18/2023,2023-06-01
2010-4-12,2010-04-12
"March 14, 2007",2007-03-14
"Jul 7th, 2001",2001-07-07
15/9/2031,2031-03-15
26 tháng 2 năm 2019,2019-02-26
2001/11/14,2001-11-14
8.10.2000,2000-10-08
22/4/09,2009-04-22
14Mar2013,2013-03-14
27:10:2015,2015-10-27
2031/12/24,2031-12-24
"May 25th, 2029",2029-05-25
20-6,2033-06-20
2019/9/4,2019-09-04
1995/10,1995-10-03
12/2-2007,2007-02-12
6Mar1997,1997-03-06
10/8-2002,2002-04-10
4Oct2007,2007-10-04
26/6/2002,2002-06-26
"May 9th, 1992",1992-05-09
20121990,1990-12-20
25Feb2023,2023-02-25
10:9:2000,2000-09-10
ngày 28 tháng 1 năm 2005,2005-01-28
1991-9-11,1991-09-11
2-12-2016,2016-12-01
19Oct2012,2012-10-19
Nov 2 25,2025-11-02
30-11-2021,2021-11-15
18/7/2017,2017-07-18
3-1-98,1998-03-01
18/33/2015,2015-11-18
1997/3,1997-03-04
15Jan1999,1999-01-15
4/2/92,1992-04-02
26.11.2013,2013-11-26
11-26-23,2023-11-26
7th of July 2019,2019-07-07
1995/10,1995-10-01
27-4-1998,1998-04-27
02062031,2031-06-02
7/28/11,2011-07-28
27/12/93,1993-12-27
26/10-1995,1995-10-26
11-12-92,1992-11-12
"April 26, 1990",1990-04-26
15/7/08,2008-07-15
24111999,1999-11-24
17/11-2005,2005-11-17
09102002,2002-10-09
19-4,1993-04-19
17/8-2012,2012-04-17
19May2006,2006-05-19
8-1,2031-01-08
25.12.2016,2016-12-25
2006/11/17,2006-11-17
23/3/11,2011-03-23
26Jul2024,2024-07-26
12 Nov 2011,2011-11-12
2003/4/10,2003-04-10
7:11:2004,2004-11-07
2009/9,2009-09-13
23th of November 2033,2033-11-23
2/9/01,2001-02-09
28/12-1993,1993-06-28
3/15/2030,2030-05-03
Feb 28 27,2027-02-28
1Feb2009,2009-02-01
9/2-2016,2016-02-09
"Oct 7th, 2019",2019-10-07
2 tháng 4 năm 2004,2004-04-02
22-4-2033,2033-04-22
4/30/2004,2004-10-04
19052002,2002-05-19
2020-2-16,2020-02-16
Feb 2 04,2004-02-02
"June 16, 2013",2013-06-16
02032003,2003-03-02
12/8-2029,2029-08-12
7/12-1994,1994-12-07
6:3:2024,2024-03-06
May 13 09,2009-05-13
15 tháng 6 năm 2028,2028-06-15
"March 8, 2026",2026-03-08
21 Oct 1999,1999-10-21
15:9:1991,1991-09-15
6/6/1996,1996-06-06
20th of February 1997,1997-02-20
7/8-2002,2002-08-07
25 Oc 1992,1992-10-25
"November 14, 2008",2008-11-14
4-16-31,2031-04-16
14/18/1999,1999-06-14
27-1-2024,2024-01-27
16-2-2025,2025-02-08
ngày 20 tháng 4 năm 2017,2017-04-20
2023-8-6,2023-08-06
9:12:2025,2025-12-09
6 tháng 10 năm 2023,2023-10-06
3/4/93,1993-04-03
24 tháng 12 năm 1996,1996-12-24
4-9-1994,1994-09-02
27 July 2020,2020-07-27
20 May 2009,2009-05-20
2-1,1999-01-02
20/3/2021,2021-03-20
27/7-2034,2034-07-27
1-27-19,2019-01-27
27/9/20,2020-09-27
Nov 3 98,1998-11-03
5/4/98,1998-04-05
1998-1-14,1998-01-14
8.12.2000,2000-12-08
24/1-2027,2027-01-24
24/3/2027,2027-01-24
14th of June 2018,2018-06-14
18 tháng 7 năm 2031,2031-07-18
7/1/2032,2032-01-07
"Jan 5th, 2012",2012-01-05
23May2023,2023-05-23
12/12-2004,2004-06-12
7-12,1992-12-07
25-7-1991,1991-07-25
5/28/96,1996-05-28
11:7:2033,2033-07-11
22/4/2030,2030-04-22
28/1/09,2009-01-28
19/18/2009,2009-06-19
1995/7,1995-07-22
7-13-30,2030-07-13
18th of September 2019,2019-09-18
Mar 20 90,1990-03-20
"Oct 5th, 2026",2026-10-05
1 Sep 2019,2019-09-01
2nd of November 2035,2035-11-02
18/1-2033,2033-01-18
2006-9-11,2006-09-11
5-1-96,1996-05-01
Jun 15 10,2010-06-15
1/1/12,2012-01-01
21/16-2025,2025-08-21
17-8,2007-08-17
25th of January 2009,2009-01-25
ngày 12 tháng 8 năm 1995,1995-08-12
6/15/2012,2012-06-15
28/8/09,2009-08-28
ngày 16 tháng 11 năm 1999,1999-11-16
16 Ma 2022,2022-05-16
8/17/18,2018-08-17
11/3/91,1991-03-11
25 Jan 2026,2026-01-25
16Jul2024,2024-07-16
4.3.2014,2014-03-04
1990-1-27,1990-01-27
8/26/2030,2030-08-26
1Jun2023,2023-06-01
Jun 25 16,2016-06-25
42-8-2015,2015-08-21
1992-11-6,1992-11-06
13-4-2005,2005-04-13
16-5-2013,2013-05-08
27/9-1991,1991-09-27
8/2-2013,2013-02-08
12/27/2007,2007-12-27
5/2/29,2029-02-05
11/15/2025,2025-05-11
5/11/1999,1999-11-05
27/3-1998,1998-03-27
Dec 20 27,2027-12-20
1993-5-10,1993-05-10
15/7/06,2006-07-15
14/2/07,2007-02-14
20/6/08,2008-06-20
2/6/07,2007-06-02
8-4-1991,1991-04-08
12/11/28,2028-11-12
20/2-2025,2025-02-20
"April 10, 2027",2027-04-10
2032-8-4,2032-08-04
19/8/99,1999-08-19
12-24-09,2009-12-24
2035/8,2035-08-05
2004-7-1,2004-07-01
6/10-2021,2021-10-06
12/26/1998,1998-12-26
08011992,1992-01-08
Dec 20 17,2017-12-20
28/3-2032,2032-03-28
27Dec2023,2023-12-27
5/3/10,2010-03-05
9/11/1990,1990-11-09
1997/11/28,1997-11-28
8-3-2028,2028-03-08
20/27/1992,1992-09-20
"March 12, 2031",2031-03-12
"Oct 6th, 2010",2010-10-06
20 March 2018,2018-03-20
Jul 19 11,2011-07-19
22/22-2001,2001-11-22
Apr 23 00,2000-04-23
Feb 3 94,1994-02-03
21/11-2022,2022-11-21
13/9/2002,2002-09-13
2027/12/2,2027-12-02
1993/12,1993-12-28
13th of October 2008,2008-10-13
9:4:2002,2002-04-09
5-4,2035-04-05
5/18/2021,2021-06-05
2029-8-23,2029-08-23
10/1/31,2031-01-10
26 Jan 1992,1992-01-26
15 May 2032,2032-05-15
16 Mar 2004,2004-03-16
3/2/2031,2031-03-02
19 tháng 8 năm 2012,2012-08-19
12/12/13,2013-12-12
21th of April 2012,2012-04-21
2005/8,2005-08-11
6/9/2023,2023-03-06
3-6,2027-06-03
8 May 2022,2022-05-08
13/6-2002,2002-06-13
2026-2-27,2026-02-27
19/11-2018,2018-11-19
3/8/07,2007-08-03
02112005,2005-11-02
11 Fe 2014,2014-02-11
ngày 1 tháng 11 năm 1992,1992-11-01
25th of October 2000,2000-10-25
34-10-2008,2008-10-17
11/8-2005,2005-08-11
"May 3rd, 1995",1995-05-03
5May2021,2021-05-05
11 August 2007,2007-08-11
5/2/2034,2034-05-02
26112014,2014-11-26
"Dec 10th, 1999",1999-12-10
22/12-2017,2017-12-22
7/4-2020,2020-02-07
4 No 2008,2008-11-04
"Jul 4th, 2005",2005-07-04
16-2-2034,2034-02-16
2009-8-26,2009-08-26
16 Ju 1990,1990-06-16
1/10-2010,2010-05-01
8/12/2006,2006-08-12
9/9-2005,2005-09-09
2034/9,2034-09-01
38-10-1997,1997-10-19
1Mar2015,2015-03-01
16/6/2030,2030-06-16
36-12-1990,1990-12-18
16-11-1996,1996-11-16
36-6-2017,2017-06-18
"Jan 1st, 2000",2000-01-01
2025-12-3,2025-12-03
21.12.2030,2030-12-21
ngày 26 tháng 7 năm 2022,2022-07-26
9-2,2020-02-09
5/2-2016,2016-02-05
1 Au 2017,2017-08-01
13 No 2024,2024-11-13
25 Jun 2010,2010-06-25
10May1996,1996-05-10
6/10-2023,2023-10-06
7-14-02,2002-07-14
"May 18th, 1994",1994-05-18
19/10-1991,1991-05-19
4/8/33,2033-08-04
4-11-22,2022-04-11
26071999,1999-07-26
26Apr2029,2029-04-26
ngày 13 tháng 8 năm 2031,2031-08-13
8-5,1999-05-08
"December 23, 2025",2025-12-23
36-1-2000,2000-01-18
3/3/2020,2020-01-03
24.9.2026,2026-09-24
"July 28, 2001",2001-07-28
3-18-00,2000-03-18
24072029,2029-07-24
11/1/95,1995-11-01
17:4:2034,2034-04-17
28/3/92,1992-03-28
17 tháng 6 năm 2035,2035-06-17
1/4/1998,1998-01-04
2009/1,2009-01-18
"Jun 19th, 2011",2011-06-19
13/1/97,1997-01-13
10Feb2026,2026-02-10
1/8/16,2016-01-08
2Mar2003,2003-03-02
23/8/1997,1997-08-23
26/10-2011,2011-05-26
Jun 3 92,1992-06-03
ngày 6 tháng 10 năm 1998,1998-10-06
1/2-2008,2008-02-01
13/24/2008,2008-08-13
26:8:2029,2029-08-26
"May 10, 1991",1991-05-10
2003-8-27,2003-08-27
26/2-2013,2013-02-26
1-5,2005-05-01
16/6-2025,2025-03-16
14 February 2000,2000-02-14
"Jul 23th, 1999",1999-07-23
9/3-2034,2034-03-09
10/6-2006,2006-03-10
15/10-2000,2000-10-15
1994/8/4,1994-08-04
Jul 20 97,1997-07-20
14 Jul 1993,1993-07-14
2/14/98,1998-02-14
11.9.2027,2027-09-11
2-25-17,2017-02-25
15th of December 2030,2030-12-15
22-4,2011-04-22
"September 26, 1996",1996-09-26
28 May 2007,2007-05-28
2025-11-13,2025-11-13
5:11:1995,1995-11-05
12/23/2011,2011-12-23
16th of August 2034,2034-08-16
12/4/91,1991-04-12
"Dec 4th, 2024",2024-12-04
14092031,2031-09-14
ngày 13 tháng 11 năm 1996,1996-11-13
25:2:2035,2035-02-25
4 Dec 1995,1995-12-04
20 Ju 2014,2014-07-20
Dec 28 19,2019-12-28
15 August 2011,2011-08-15
22 April 2003,2003-04-22
7/27/15,2015-07-27
19 Mar 2008,2008-03-19
14th of May 2006,2006-05-14
5th of May 2005,2005-05-05
1.8.2010,2010-08-01
1/36/2029,2029-12-01
22-2,2016-02-22
22/12-1994,1994-12-22
23/12/96,1996-12-23
3 November 2008,2008-11-03
12/7/10,2010-07-12
ngày 12 tháng 11 năm 2027,2027-11-12
17Jun1999,1999-06-17
18 Ja 1997,1997-01-18
11Dec2009,2009-12-11
10/3/31,2031-03-10
56-3-1995,1995-03-28
8 Jan 2024,2024-01-08
2027-4-4,2027-04-04
4/17/34,2034-04-17
12/9/18,2018-09-12
24 tháng 12 năm 1995,1995-12-24
07032029,2029-03-07
7th of July 2006,2006-07-07
10 October 2010,2010-10-10
19-10-2005,2005-10-19
1999/3,1999-03-11
17-9-2019,2019-09-17
17/2/21,2021-02-17
19 Ma 2006,2006-05-19
ngày 18 tháng 11 năm 2009,2009-11-18
20:8:2031,2031-08-20
9.7.1995,1995-07-09
5/6/99,1999-06-05
10-9-1996,1996-09-05
27 Fe 2029,2029-02-27
24 June 1998,1998-06-24
21-5-2021,2021-05-21
2014/8,2014-08-04
6.11.2028,2028-11-06
16/20-1994,1994-10-16
9/4/21,2021-04-09
11/17/1993,1993-11-17
2/14-2021,2021-07-02
2008-6-3,2008-06-03
7/24/1991,1991-07-24
2008/9,2008-09-28
7:3:2012,2012-03-07
15/2-1994,1994-02-15
1/11/1998,1998-01-11
4 December 1999,1999-12-04
14-2-2011,2011-02-14
1-6-28,2028-01-06
11th of November 1990,1990-11-11
10-8-22,2022-10-08
11 Sep 1993,1993-09-11
4th of September 2020,2020-09-04
2/2/08,2008-02-02
20/11/2013,2013-11-20
12/4/31,2031-04-12
22/8/24,2024-08-22
2011-3-27,2011-03-27
13Sep2017,2017-09-13
11 May 1999,1999-05-11
"August 27, 1994",1994-08-27
4/8/2014,2014-08-04
ngày 16 tháng 12 năm 2035,2035-12-16
22 tháng 2 năm 2009,2009-02-22
15 Ju 2002,2002-06-15
26/11-1991,1991-11-26
16:8:2016,2016-08-16
Apr 8 05,2005-04-08
2.8.2018,2018-08-02
ngày 23 tháng 12 năm 2011,2011-12-23
24/2/21,2021-02-24
8/9-2018,2018-09-08
19Jun1998,1998-06-19
20/7-2023,2023-07-20
15 Ju 1993,1993-07-15
19:4:1995,1995-04-19
16 tháng 3 năm 2032,2032-03-16
13 May 2023,2023-05-13
28 Au 2012,2012-08-28
2028-1-15,2028-01-15
8/1/21,2021-01-08
2004/3,2004-03-12
1-13-29,2029-01-13
25 tháng 10 năm 2035,2035-10-25
1.8.2020,2020-08-01
9th of May 1997,1997-05-09
4/4/90,1990-04-04
18/11/20,2020-11-18
ngày 10 tháng 5 năm 2030,2030-05-10
1-8,2016-08-01
19-7-1996,1996-07-19
25-12-2010,2010-12-25
12Nov2029,2029-11-12
3/12/96,1996-03-12
15/6-2029,2029-06-15
12/2/98,1998-02-12
19 March 2009,2009-03-19
24th of December 1996,1996-12-24
13th of February 2031,2031-02-13
24 January 2017,2017-01-24
7/2/2001,2001-02-07
6-18-06,2006-06-18
6-5,2030-05-06
5:7:2018,2018-07-05
1/11/94,1994-11-01
19 December 2004,2004-12-19
17/11-2007,2007-11-17
11/8-1994,1994-08-11
28 March 1991,1991-03-28
12 Oct 1999,1999-10-12
12/21/33,2033-12-21
19/11/98,1998-11-19
16 tháng 4 năm 1996,1996-04-16
17-4,2010-04-17
7-14-35,2035-07-14
2028/6/27,2028-06-27
7-10,2002-10-07
7/3/20,2020-03-07
12Feb1994,1994-02-12
9-26-99,1999-09-26
23 tháng 9 năm 2024,2024-09-23
6:4:1992,1992-04-06
14th of February 2018,2018-02-14
21/9/06,2006-09-21
1-10-1999,1999-10-01
6-27-15,2015-06-27
14 January 2001,2001-01-14
14-10,2009-10-14
8/3-2006,2006-03-08
14.8.2021,2021-08-14
1/11-2018,2018-11-01
28.10.2030,2030-10-28
03102011,2011-10-03
14-10,2028-10-14
"Jan 10th, 2004",2004-01-10
18:11:2025,2025-11-18
ngày 21 tháng 5 năm 2014,2014-05-21
"Feb 16th, 1996",1996-02-16
20.10.2006,2006-10-20
"June 8, 2021",2021-06-08
7:11:2004,2004-11-07
10/6/2018,2018-10-06
13-3-2022,2022-03-13
27/2/2022,2022-02-27
3 November 2017,2017-11-03
26/1-2033,2033-01-26
ngày 20 tháng 8 năm 2024,2024-08-20
3/18/2013,2013-03-18
22 April 2012,2012-04-22
25/2-2012,2012-02-25
34-10-2035,2035-10-17
10/27/2007,2007-09-10
14/18/1997,1997-06-14
May 5 20,2020-05-05
22/3/21,2021-03-22
4-6-2000,2000-06-04
2012/5/12,2012-05-12
14052029,2029-05-14
27:1:1995,1995-01-27
28 Nov 2031,2031-11-28
10/8-2031,2031-08-10
2019/4,2019-04-05
5/12-2020,2020-12-05
12062033,2033-06-12
1993/11,1993-11-18
"Dec 23th, 1998",1998-12-23
01062033,2033-06-01
32-7-2005,2005-07-16
2023/1/14,2023-01-14
"Jul 11th, 2031",2031-07-11
Apr 4 99,1999-04-04
1/26/95,1995-01-26
8 Ju 2014,2014-06-08
5/12/09,2009-12-05
24 Oc 1996,1996-10-24
"Jul 17th, 2014",2014-07-17
20 tháng 1 năm 1990,1990-01-20
6/21/2000,2000-06-21
7/3/94,1994-03-07
13052034,2034-05-13
1:6:1998,1998-06-01
18 tháng 11 năm 2013,2013-11-18
8/20-2023,2023-10-08
25-7,1996-07-25
15/7/03,2003-07-15
6-10-95,1995-06-10
6.12.2008,2008-12-06
10:4:2031,2031-04-10
"Oct 19th, 2035",2035-10-19
9/11/11,2011-09-11
10 tháng 7 năm 2031,2031-07-10
24 De 1994,1994-12-24
25.9.2029,2029-09-25
21/3/28,2028-03-21
24 Dec 2016,2016-12-24
"May 4th, 1991",1991-05-04
17/3/1993,1993-01-17
2/22/1997,1997-02-22
36-10-1993,1993-10-18
7 tháng 5 năm 2033,2033-05-07
"Mar 27th, 2004",2004-03-27
27 August 2013,2013-08-27
2005/7/3,2005-07-03
01102022,2022-10-01
4/14/1993,1993-04-14
16/6/2021,2021-06-16
3-7,2004-07-03
38-8-2028,2028-08-19
6-11,2001-11-06
12May2019,2019-05-12
7-6,2006-06-07
9 tháng 3 năm 2016,2016-03-09
2/3/2027,2027-03-02
"Apr 2nd, 2018",2018-04-02
1/14-2000,2000-07-01
3-9-24,2024-03-09
21/18/2012,2012-06-21
6-22-17,2017-06-22
16/11/2024,2024-11-16
ngày 6 tháng 12 năm 2021,2021-12-06
7 Apr 2019,2019-04-07
1:12:2030,2030-12-01
22/14-2034,2034-07-22
"June 18, 2006",2006-06-18
2033-4-17,2033-04-17
20 Ma 2019,2019-03-20
26-4-1993,1993-04-26
14/5/2010,2010-05-14
1-2-2003,2003-02-01
2026-6-26,2026-06-26
25/9/2029,2029-09-25
11.2.2031,2031-02-11
11/27/2024,2024-09-11
19 Ma 2001,2001-03-19
17.10.2026,2026-10-17
12-1-2019,2019-01-12
5 September 2004,2004-09-05
2010/5/12,2010-05-12
"May 4, 1991",1991-05-04
12/22/2020,2020-12-22
7th of October 2029,2029-10-07
10/4/16,2016-10-04
20 January 2014,2014-01-20
7-9-03,2003-07-09
27/9/90,1990-09-27
17/2/2016,2016-02-17
23 July 2030,2030-07-23
17/8/2030,2030-08-17
5/15/1991,1991-05-05
13Jul2026,2026-07-13
20 Feb 2029,2029-02-20
1.9.2000,2000-09-01
2029-2-20,2029-02-20
17-7,2004-07-17
23111991,1991-11-23
42-5-2005,2005-05-21
"October 4, 2030",2030-10-04
7/5/2024,2024-07-05
1/16-2031,2031-08-01
6 April 1991,1991-04-06
2023/7,2023-07-01
11/30/2026,2026-10-11
"Dec 19th, 1992",1992-12-19
21/5-2026,2026-05-21
14 Apr 2008,2008-04-14
1/9/14,2014-01-09
Feb 25 95,1995-02-25
20.6.1993,1993-06-20
20/2/2025,2025-02-20
11th of March 2025,2025-03-11
11-3-01,2001-11-03
11 tháng 11 năm 2007,2007-11-11
27.10.2018,2018-10-27
9-12-2027,2027-12-09
ngày 13 tháng 11 năm 1990,1990-11-13
5 Ma 2011,2011-05-05
2-2-1993,1993-02-01
1 July 2010,2010-07-01
7 Se 1992,1992-09-07
8/16-1994,1994-08-08
22 December 1992,1992-12-22
2001-5-17,2001-05-17
17032032,2032-03-17
4Dec2022,2022-12-04
1994-1-16,1994-01-16
1st of May 2016,2016-05-01
21/10-2031,2031-10-21
2/4/31,2031-02-04
3/14/1998,1998-03-14
9/6/26,2026-06-09
"Nov 15th, 2029",2029-11-15
22:5:2018,2018-05-22
Apr 15 25,2025-04-15
"February 23, 2000",2000-02-23
28/5/10,2010-05-28
6/26/12,2012-06-26
"July 27, 1991",1991-07-27
10May2027,2027-05-10
19/2/2001,2001-02-19
05122014,2014-12-05
18/8-2028,2028-08-18
11th of May 1990,1990-05-11
6/16/03,2003-06-16
23/3-2015,2015-03-23
7/11/08,2008-11-07
8/8-2011,2011-08-08
1992/3/27,1992-03-27
6th of December 2001,2001-12-06
"August 1, 2019",2019-08-01
8-3-02,2002-08-03
14/6-2005,2005-06-14
18 tháng 5 năm 2008,2008-05-18
"Mar 20th, 2014",2014-03-20
ngày 16 tháng 5 năm 2016,2016-05-16
"Oct 24th, 2017",2017-10-24
7/18/27,2027-07-18
12/6/2007,2007-06-12
18-5-2014,2014-05-18
7-23-15,2015-07-23
21.5.2027,2027-05-21
23 Nov 2025,2025-11-23
22/4/29,2029-04-22
16th of March 2035,2035-03-16
28:3:1996,1996-03-28
19/12/1991,1991-12-19
ngày 8 tháng 10 năm 1995,1995-10-08
8 July 2034,2034-07-08
"October 22, 1995",1995-10-22
14/3-2034,2034-03-14
6Jun2021,2021-06-06
1/5/26,2026-01-05
12-2,2020-02-12
14-2,1991-02-14
26/6-2007,2007-06-26
"Mar 17th, 2010",2010-03-17
16 tháng 4 năm 2018,2018-04-16
2/20-2028,2028-10-02
Feb 5 04,2004-02-05
14.8.2032,2032-08-14
11/21/33,2033-11-21
1.6.2007,2007-06-01
4 tháng 12 năm 2005,2005-12-04
Jul 8 34,2034-07-08
17 Jun 2013,2013-06-17
Aug 22 98,1998-08-22
2-10,2007-10-02
"October 5, 2000",2000-10-05
5/24-2030,2030-12-05
9 February 2022,2022-02-09
"January 19, 2027",2027-01-19
12/10/2034,2034-12-10
10/6/2027,2027-10-06
"Sep 8th, 2032",2032-09-08
ngày 11 tháng 9 năm 1997,1997-09-11
16Jun2005,2005-06-16
16/10-2029,2029-10-16
1Oct2026,2026-10-01
5/6/2035,2035-02-05
27021991,1991-02-27
Jan 13 07,2007-01-13
3/24/2006,2006-03-24
13/12/31,2031-12-13
ngày 22 tháng 1 năm 1994,1994-01-22
1/3/2016,2016-03-01
Jul 10 26,2026-07-10
"May 20, 2018",2018-05-20
17th of October 2030,2030-10-17
13Feb2006,2006-02-13
12/8/24,2024-08-12
17/3/15,2015-03-17
14 Au 2016,2016-08-14
13/10-2005,2005-10-13
"Mar 9th, 2033",2033-03-09
11/6/07,2007-11-06
"Apr 7th, 2023",2023-04-07
23/18/2008,2008-06-23
4/10/19,2019-10-04
6-8,2007-08-06
28 No 1997,1997-11-28
Oct 23 34,2034-10-23
23-3,2013-03-23
13Nov2024,2024-11-13
"Jun 23th, 2034",2034-06-23
2019/8/19,2019-08-19
3/2-2015,2015-02-03
26/7-2014,2014-07-26
1/9-2000,2000-09-01
12/21/07,2007-12-21
ngày 22 tháng 1 năm 2003,2003-01-22
4-8,1994-08-04
25/9-2025,2025-09-25
5/7/2028,2028-05-07
5.2.2035,2035-02-05
18/10-2004,2004-05-18
10/6/95,1995-06-10
6/9/2005,2005-03-06
Apr 24 35,2035-04-24
5/15/1993,1993-05-05
8-2-2025,2025-02-04
16/36/2014,2014-12-16
Apr 27 04,2004-04-27
16/10/19,2019-10-16
"Dec 9th, 2002",2002-12-09
18 No 2015,2015-11-18
28/10-2011,2011-10-28
7th of June 2012,2012-06-07
17th of February 1997,1997-02-17
18:2:2016,2016-02-18
2031/12,2031-12-05
23/11/32,2032-11-23
7:10:2034,2034-10-07
1 August 2029,2029-08-01
11 Ju 2007,2007-07-11
1995-4-22,1995-04-22
May 13 22,2022-05-13
7-17-02,2002-07-17
19Dec2035,2035-12-19
7/7/2017,2017-07-07
2030/3/9,2030-03-09
ngày 20 tháng 9 năm 2021,2021-09-20
2020/1/11,2020-01-11
6/24/2009,2009-08-06
19 June 2035,2035-06-19
ngày 2 tháng 11 năm 2007,2007-11-02
22th of April 2010,2010-04-22
01122024,2024-12-01
1/1/1993,1993-01-01
"Jan 2nd, 2023",2023-01-02
2008/7,2008-07-07
"November 14, 2005",2005-11-14
23 Ap 2013,2013-04-23
Jul 6 18,2018-07-06
1/17/2016,2016-01-17
13 tháng 7 năm 1995,1995-07-13
22-4-2001,2001-04-11
"July 7, 2018",2018-07-07
28-2,2027-02-28
2033/1/28,2033-01-28
2007/10,2007-10-02
2010/8/8,2010-08-08
2/12/2021,2021-02-12
20-12-2017,2017-12-10
"November 7, 2002",2002-11-07
22-5,2002-05-22
28/7/99,1999-07-28
10-12,1995-12-10
5 Jul 2015,2015-07-05
18062034,2034-06-18
Nov 20 02,2002-11-20
3/4/2000,2000-03-04
21 April 2022,2022-04-21
1998-2-2,1998-02-02
6Mar2029,2029-03-06
"September 5, 2021",2021-09-05
2019/7/13,2019-07-13
14/1/11,2011-01-14
12/27/99,1999-12-27
15.7.2004,2004-07-15
18/9/2032,2032-09-18
18/9/35,2035-09-18
7/1/17,2017-01-07
10/27/2006,2006-09-10
24-3-2015,2015-03-12
3/26/2018,2018-03-26
1991/8,1991-08-13
2035/4/26,2035-04-26
1.9.2011,2011-09-01
17Apr1992,1992-04-17
28/5-2010,2010-05-28
26 June 2006,2006-06-26
6-26-95,1995-06-26
ngày 19 tháng 9 năm 2014,2014-09-19
21/7-2006,2006-07-21
"August 3, 2005",2005-08-03
13 March 1990,1990-03-13
12.3.2010,2010-03-12
2033/2/15,2033-02-15
3/7-2003,2003-07-03
5/2/2002,2002-02-05
1/27/01,2001-01-27
18-12-2028,2028-12-09
2Nov2020,2020-11-02
7 tháng 1 năm 2024,2024-01-07
"August 19, 2015",2015-08-19
10/21/2027,2027-10-21
24 March 1994,1994-03-24
11 tháng 9 năm 1994,1994-09-11
17/12/27,2027-12-17
24/3/2034,2034-01-24
17/11-2014,2014-11-17
12/5/93,1993-05-12
2003/4,2003-04-06
3/26/97,1997-03-26
30-4-2024,2024-04-15
23Feb2023,2023-02-23
21112013,2013-11-21
17-6,2035-06-17
22/24/2014,2014-08-22
5/26/2026,2026-05-26
"May 11, 2008",2008-05-11
7/25/2023,2023-07-25
12/6/2027,2027-02-12
18/12-1991,1991-12-18
19 May 2020,2020-05-19
6/27/24,2024-06-27
9th of April 1999,1999-04-09
12Jan2018,2018-01-12
10/9/19,2019-09-10
2017-6-16,2017-06-16
9-8,2017-08-09
3/2/2002,2002-02-03
Sep 28 12,2012-09-28
8-5-19,2019-08-05
27.8.2020,2020-08-27
2027/11/19,2027-11-19
7May2035,2035-05-07
6 October 2009,2009-10-06
23/6/10,2010-06-23
Aug 6 92,1992-08-06
20 Ja 1999,1999-01-20
22/10/94,1994-10-22
3Apr1994,1994-04-03
7Oct1990,1990-10-07
6/19/2005,2005-06-19
12-1-2016,2016-01-06
2020/9/16,2020-09-16
8 February 2005,2005-02-08
2001-11-19,2001-11-19
23 January 2009,2009-01-23
16Nov2012,2012-11-16
1/10/2000,2000-01-10
28 tháng 8 năm 2030,2030-08-28
"June 22, 2024",2024-06-22
13:2:1990,1990-02-13
2/3-2007,2007-03-02
ngày 25 tháng 6 năm 2012,2012-06-25
19/27/2004,2004-09-19
8/16-2008,2008-08-08
9/10/99,1999-09-10
21Apr2012,2012-04-21
2031/5/15,2031-05-15
13-9-2022,2022-09-13
2016-12-14,2016-12-14
13/3-2008,2008-03-13
2004-3-3,2004-03-03
"February 10, 2018",2018-02-10
10-13-16,2016-10-13
2025/6,2025-06-04
9Nov1990,1990-11-09
16/12/2001,2001-04-16
19/4-2001,2001-04-19
28.1.2015,2015-01-28
25/7-2002,2002-07-25
6/10-1996,1996-05-06
25/9-2010,2010-09-25
13/6/01,2001-06-13
10 Ma 2033,2033-03-10
6 De 2020,2020-12-06
28-4,2012-04-28
"Dec 10th, 1992",1992-12-10
8-16-15,2015-08-16
7/17/1992,1992-07-17
"June 19, 2002",2002-06-19
6:5:2001,2001-05-06
"February 11, 1998",1998-02-11
1-12-16,2016-01-12
5/1/32,2032-01-05
3 Au 2018,2018-08-03
26/11-2028,2028-11-26
24 Dec 1990,1990-12-24
15 October 2014,2014-10-15
27 tháng 12 năm 2021,2021-12-27
26-9-2001,2001-09-26
Feb 11 02,2002-02-11
24/33/2016,2016-11-24
6 Nov 2008,2008-11-06
"September 20, 2017",2017-09-20
26-8,1999-08-26
ngày 14 tháng 12 năm 2015,2015-12-14
2020/12,2020-12-13
22.3.2006,2006-03-22
7-21-10,2010-07-21
1 Nov 1997,1997-11-01
12/12/1995,1995-12-12
20/15/2013,2013-05-20
14-2-2005,2005-02-07
2/7/10,2010-02-07
"January 3, 1990",1990-01-03
"Jul 9th, 2028",2028-07-09
11-13-31,2031-11-13
15/24/1995,1995-08-15
2028/3,2028-03-04
26/5/2014,2014-05-26
2017/9,2017-09-17
12/8/1996,1996-08-12
2016-5-18,2016-05-18
19/12/2025,2025-12-19
20:10:2023,2023-10-20
11/30/2012,2012-10-11
5/10-2023,2023-05-05
23-3-2029,2029-03-23
2009/12/24,2009-12-24
8/12-1993,1993-06-08
2025/5,2025-05-16
May 21 21,2021-05-21
1st of September 2024,2024-09-01
13/3/91,1991-03-13
20/12/95,1995-12-20
12 Jun 1994,1994-06-12
May 9 02,2002-05-09
ngày 2 tháng 6 năm 2009,2009-06-02
"March 16, 1994",1994-03-16
8 Jul 1996,1996-07-08
2004/6,2004-06-13
2030-1-14,2030-01-14
19.12.2034,2034-12-19
1997/4/13,1997-04-13
"Nov 13th, 1990",1990-11-13
"Apr 18th, 2002",2002-04-18
15/10-2003,2003-10-15
1-16-10,2010-01-16
11/8/32,2032-08-11
23 Jan 2029,2029-01-23
10/1/96,1996-10-01
16 tháng 2 năm 2009,2009-02-16
ngày 24 tháng 3 năm 2016,2016-03-24
2010/6,2010-06-09
14-1,1990-01-14
"Jul 9th, 2003",2003-07-09
1:10:2004,2004-10-01
20-12,2011-12-20
26/5-2029,2029-05-26
27/4-2018,2018-04-27
12 Jun 1995,1995-06-12
20/20-2013,2013-10-20
18.9.1999,1999-09-18
3-15-33,2033-03-15
6/4/22,2022-04-06
"May 10th, 1994",1994-05-10
9-8,2000-08-09
ngày 12 tháng 10 năm 2008,2008-10-12
Mar 28 94,1994-03-28
19/9/2025,2025-03-19
10/4/14,2014-04-10
24-6-2007,2007-06-12
16/11-1991,1991-11-16
07092004,2004-09-07
13.6.2014,2014-06-13
ngày 2 tháng 2 năm 2032,2032-02-02
3-9-2016,2016-09-03
4/25/23,2023-04-25
2020-10-1,2020-10-01
23 Apr 2004,2004-04-23
19 tháng 12 năm 2022,2022-12-19
26-3-2034,2034-03-13
27-6,2022-06-27
8Sep2028,2028-09-08
2027/11/10,2027-11-10
Feb 8 17,2017-02-08
15:2:2000,2000-02-15
5 tháng 3 năm 2020,2020-03-05
26 Ma 2029,2029-03-26
8May2020,2020-05-08
22May2030,2030-05-22
04051998,1998-05-04
24 tháng 12 năm 2024,2024-12-24
6 Ju 2028,2028-06-06
17/1/97,1997-01-17
3.10.2006,2006-10-03
2018/11,2018-11-10
"July 10, 1992",1992-07-10
"Oct 1st, 2010",2010-10-01
1999/1,1999-01-12
3Mar2016,2016-03-03
May 18 32,2032-05-18
6:12:2005,2005-12-06
13:12:2015,2015-12-13
3-12,2006-12-03
5-20-97,1997-05-20
27th of November 2009,2009-11-27
22Jun2001,2001-06-22
"Apr 7th, 2014",2014-04-07
16Feb2004,2004-02-16
ngày 25 tháng 12 năm 2012,2012-12-25
11 May 2017,2017-05-11
12/7/1990,1990-12-07
25/3/2012,2012-01-25
13/9-2007,2007-09-13
1/2-2013,2013-02-01
25-5-2009,2009-05-25
9-2,2023-02-09
21th of March 2008,2008-03-21
25 tháng 4 năm 2031,2031-04-25
5/10-2007,2007-10-05
"July 14, 2035",2035-07-14
Oct 4 13,2013-10-04
18-2-2026,2026-02-09
2023/1,2023-01-03
10.11.2034,2034-11-10
22:2:2023,2023-02-22
4/5/2026,2026-05-04
3/25/2008,2008-03-25
23-12-2011,2011-12-23
1 May 1992,1992-05-01
8/13/91,1991-08-13
25 August 2026,2026-08-25
4/7/2004,2004-07-04
26Feb1994,1994-02-26
19/3/2016,2016-03-19
4/13/2027,2027-04-13
ngày 21 tháng 8 năm 2002,2002-08-21
16/3/92,1992-03-16
9-16-98,1998-09-16
2007-8-19,2007-08-19
5/8-2025,2025-04-05
ngày 18 tháng 7 năm 2025,2025-07-18
23th of May 2028,2028-05-23
23/8/20,2020-08-23
8-27-10,2010-08-27
2014/4,2014-04-08
ngày 15 tháng 2 năm 2012,2012-02-15
11 December 2023,2023-12-11
22:8:2034,2034-08-22
2004/2/15,2004-02-15
10-6-34,2034-10-06
3.3.2027,2027-03-03
Aug 13 91,1991-08-13
1.10.2014,2014-10-01
20 tháng 1 năm 2031,2031-01-20
27Feb2004,2004-02-27
6 Ju 2005,2005-07-06
4/16/20,2020-04-16
2023-11-2,2023-11-02
22/11-2007,2007-11-22
Feb 8 31,2031-02-08
46-1-2023,2023-01-23
"December 25, 2008",2008-12-25
2002/2/28,2002-02-28
25/8/20,2020-08-25
23/16-2012,2012-08-23
28 August 1990,1990-08-28
23-8,1999-08-23
19Jun2020,2020-06-19
9/25/2018,2018-09-25
17:9:2028,2028-09-17
12 Fe 2008,2008-02-12
24 July 2030,2030-07-24
7.7.2019,2019-07-07
Apr 27 90,1990-04-27
17/4/97,1997-04-17
14-6-2024,2024-06-14
ngày 2 tháng 5 năm 2014,2014-05-02
1/3/10,2010-01-03
14/2-2033,2033-02-14
24Apr2029,2029-04-24
8-8-1991,1991-08-08
May 9 95,1995-05-09
12/5/03,2003-12-05
18/12-2001,2001-06-18
26:5:2019,2019-05-26
Nov 25 29,2029-11-25
2004/7,2004-07-02
18/6/2031,2031-06-18
13 Ja 2019,2019-01-13
21062013,2013-06-21
4/12/00,2000-12-04
9-18-18,2018-09-18
27/6/03,2003-06-27
"December 21, 2033",2033-12-21
52-6-2001,2001-06-26
17:5:2024,2024-05-17
"June 2, 1997",1997-06-02
13/33/1996,1996-11-13
28 tháng 9 năm 2030,2030-09-28
4-5-34,2034-04-05
2012/5,2012-05-23
18/6-1990,1990-03-18
5 Mar 2003,2003-03-05
7:3:2006,2006-03-07
"November 18, 2012",2012-11-18
5/1/99,1999-01-05
10/10/2022,2022-10-10
25 Ja 2021,2021-01-25
28/9/2031,2031-09-28
8:10:1994,1994-10-08
2012/5/20,2012-05-20
10/11/10,2010-10-11
9th of September 1998,1998-09-09
2031/4/1,2031-04-01
13 tháng 6 năm 2027,2027-06-13
9-12,2010-12-09
ngày 16 tháng 11 năm 2013,2013-11-16
7:4:2020,2020-04-07
8/7/90,1990-07-08
14-6-2031,2031-06-14
13071997,1997-07-13
5-20-00,2000-05-20
28:3:2014,2014-03-28
13/8-2026,2026-08-13
14/21/2023,2023-07-14
10/5-2001,2001-05-10
"Apr 21th, 2022",2022-04-21
ngày 22 tháng 3 năm 1990,1990-03-22
19 tháng 4 năm 2022,2022-04-19
2018/2,2018-02-09
2nd of February 2024,2024-02-02
19-7-2001,2001-07-19
9/4-1990,1990-04-09
22 Ju 2021,2021-07-22
24/2/30,2030-02-24
2/20/97,1997-02-20
1/10-2020,2020-10-01
21/4/27,2027-04-21
15/1-2015,2015-01-15
1/15/2003,2003-01-15
Aug 22 24,2024-08-22
28/1/92,1992-01-28
9-6,2008-06-09
14072006,2006-07-14
ngày 8 tháng 9 năm 2002,2002-09-08
11/7-2005,2005-07-11
27 tháng 5 năm 2015,2015-05-27
12-6-1992,1992-06-12
4.12.2013,2013-12-04
"January 13, 2035",2035-01-13
25th of February 2003,2003-02-25
18-1-2033,2033-01-09
1993/2,1993-02-22
2014-5-18,2014-05-18
1993/2/10,1993-02-10
2019/4,2019-04-04
11 May 2027,2027-05-11
Sep 25 99,1999-09-25
22:11:1991,1991-11-22
2003-9-15,2003-09-15
"Dec 14th, 2027",2027-12-14
26Jan2011,2011-01-26
19/10/25,2025-10-19
11/20/2022,2022-11-20
25th of July 2001,2001-07-25
24Jan2006,2006-01-24
19/11-2018,2018-11-19
7th of May 2016,2016-05-07
12-25-00,2000-12-25
26/15/2034,2034-05-26
9 tháng 5 năm 2005,2005-05-09
Jun 8 32,2032-06-08
25102034,2034-10-25
9Jan1999,1999-01-09
28/8/23,2023-08-28
7/19/1994,1994-07-19
21:4:2027,2027-04-21
25/6/22,2022-06-25
5/2/92,1992-02-05
"March 7, 1998",1998-03-07
8/9/2004,2004-03-08
5-20-18,2018-05-20
44-11-2016,2016-11-22
24/6-1991,1991-06-24
6-11-1997,1997-11-06
2002/5/6,2002-05-06
21/3/2001,2001-01-21
Jun 20 07,2007-06-20
3 Ju 2035,2035-07-03
ngày 25 tháng 5 năm 1993,1993-05-25
26/10/2018,2018-10-26
2013/6/12,2013-06-12
12 May 2024,2024-05-12
2017-4-8,2017-04-08
4-2-2005,2005-02-04
20-5,2022-05-20
11/18/2021,2021-11-18
8 November 2009,2009-11-08
3/8/07,2007-03-08
5/20/2006,2006-05-20
8 August 2010,2010-08-08
2005-3-2,2005-03-02
Jul 21 26,2026-07-21
3/36/2013,2013-12-03
4.6.2027,2027-06-04
"Sep 22th, 1994",1994-09-22
13 No 2009,2009-11-13
18th of January 2014,2014-01-18
20/2/33,2033-02-20
28-6-2032,2032-06-28
4 tháng 4 năm 2023,2023-04-04
3 tháng 1 năm 2001,2001-01-03
7:4:2029,2029-04-07
2/8/28,2028-08-02
ngày 4 tháng 7 năm 2016,2016-07-04
20/1/1993,1993-01-20
20/1-2015,2015-01-20
34-10-2002,2002-10-17
9:10:2022,2022-10-09
24/21/1992,1992-07-24
2003/6,2003-06-13
5/17/2033,2033-05-17
"August 17, 2030",2030-08-17
4/2-1996,1996-01-04
ngày 15 tháng 2 năm 2026,2026-02-15
14021995,1995-02-14
10-2-2019,2019-02-10
1992-5-8,1992-05-08
11:8:2031,2031-08-11
2015/7,2015-07-23
22 Dec 2011,2011-12-22
1990/1,1990-01-10
Dec 24 35,2035-12-24
22 Ju 2014,2014-07-22
16/11/22,2022-11-16
11/19/32,2032-11-19
5-1-2010,2010-01-05
2028/9,2028-09-21
03082021,2021-08-03
3/27/15,2015-03-27
9/18/10,2010-09-18
14-5,2008-05-14
17022026,2026-02-17
26 March 1991,1991-03-26
10-2-2017,2017-02-05
18 tháng 12 năm 1992,1992-12-18
19 Sep 2005,2005-09-19
Apr 16 17,2017-04-16
7 February 2006,2006-02-07
24/2/09,2009-02-24
4.4.2016,2016-04-04
16/33/2008,2008-11-16
1999-4-14,1999-04-14
ngày 12 tháng 4 năm 2013,2013-04-12
2015/3,2015-03-18
5-10-2024,2024-10-05
12/11/32,2032-12-11
"Dec 12th, 2027",2027-12-12
"Dec 19th, 2033",2033-12-19
3 Ma 2018,2018-05-03
18/9-2009,2009-09-18
10/9-2015,2015-09-10
16:3:2007,2007-03-16
18/4-1995,1995-02-18
"Mar 9th, 2028",2028-03-09
8May2013,2013-05-08
23 tháng 9 năm 1997,1997-09-23
2000/6/12,2000-06-12
2 Nov 2007,2007-11-02
"March 13, 2004",2004-03-13
ngày 7 tháng 12 năm 2020,2020-12-07
2018/4/1,2018-04-01
2035/7/5,2035-07-05
9-3-94,1994-09-03
19031996,1996-03-19
"September 19, 1991",1991-09-19
11/4/2008,2008-11-04
1997/10/11,1997-10-11
23101990,1990-10-23
3/2-1999,1999-02-03
1 November 1994,1994-11-01
Apr 2 98,1998-04-02
"Feb 14th, 2006",2006-02-14
23 Ja 2016,2016-01-23
2019/1/1,2019-01-01
"May 26, 2022",2022-05-26
7/10/98,1998-07-10
27th of March 2023,2023-03-27
28 Ap 2016,2016-04-28
Jun 23 15,2015-06-23
1/15/2021,2021-01-15
19-4-2033,2033-04-19
4-7-19,2019-04-07
"July 17, 2006",2006-07-17
6/24-2031,2031-12-06
ngày 13 tháng 3 năm 1994,1994-03-13
Oct 11 16,2016-10-11
"June 3, 2032",2032-06-03
1999-5-28,1999-05-28
17 December 2033,2033-12-17
27 May 2025,2025-05-27
20/4/15,2015-04-20
ngày 16 tháng 3 năm 2024,2024-03-16
6 tháng 2 năm 2009,2009-02-06
2028-7-5,2028-07-05
20-2-2034,2034-02-10
18-1,2011-01-18
6Jun1998,1998-06-06
"Apr 1st, 2023",2023-04-01
22082019,2019-08-22
10/9/30,2030-10-09
10 December 2005,2005-12-10
"November 18, 2017",2017-11-18
24/8-2006,2006-04-24
7th of October 2023,2023-10-07
4/6/2001,2001-02-04
22-10-2001,2001-10-22
3/22/2004,2004-03-22
27Dec2012,2012-12-27
2019/3/18,2019-03-18
2034-8-19,2034-08-19
14th of August 2001,2001-08-14
17/2-1994,1994-01-17
Apr 13 08,2008-04-13
2022/10,2022-10-09
8/1/24,2024-01-08
1/10/2007,2007-01-10
28.12.2025,2025-12-28
2021/7,2021-07-27
19/8-2024,2024-08-19
21/10/03,2003-10-21
12/25/07,2007-12-25
Jan 26 95,1995-01-26
3/2/2020,2020-02-03
7-16-00,2000-07-16
14/2-2019,2019-01-14
24-3-1991,1991-03-12
16 April 2030,2030-04-16
"August 27, 2020",2020-08-27
2025/6,2025-06-15
24-4-2022,2022-04-12
24/12/23,2023-12-24
18/10-2001,2001-10-18
15Feb2018,2018-02-15
22/11/32,2032-11-22
21 Mar 2020,2020-03-21
6/11-2034,2034-11-06
8/15/28,2028-08-15
16/24/1999,1999-08-16
11Sep2028,2028-09-11
21/1-2034,2034-01-21
Oct 22 30,2030-10-22
23 Se 2027,2027-09-23
20/12-2016,2016-06-20
19 May 2021,2021-05-19
18-11,2013-11-18
48-2-2029,2029-02-24
Mar 24 11,2011-03-24
3/3/2024,2024-03-03
10/15/2009,2009-05-10
24/11/13,2013-11-24
3Nov1992,1992-11-03
34-8-1999,1999-08-17
9-4-10,2010-09-04
6 Fe 2014,2014-02-06
ngày 2 tháng 1 năm 2031,2031-01-02
10/6/2006,2006-10-06
27 Ju 2000,2000-06-27
19/1-2009,2009-01-19
ngày 16 tháng 1 năm 2034,2034-01-16
2006/1,2006-01-08
2013/1,2013-01-03
13May1993,1993-05-13
17/4-2018,2018-02-17
27/12/90,1990-12-27
5/1/10,2010-01-05
27May1996,1996-05-27
1996/11/13,1996-11-13
1999/5,1999-05-03
16092023,2023-09-16
18/10-2028,2028-10-18
16 Jan 2010,2010-01-16
2001/6,2001-06-03
4:12:2015,2015-12-04
27th of April 2001,2001-04-27
44-5-2033,2033-05-22
2-7-92,1992-02-07
"May 19th, 2010",2010-05-19
18Jan2022,2022-01-18
ngày 25 tháng 3 năm 2016,2016-03-25
23/7/1991,1991-07-23
21/7/14,2014-07-21
17/7/10,2010-07-17
56-1-2013,2013-01-28
1997/8,1997-08-21
26/21/2012,2012-07-26
15/9/20,2020-09-15
"May 3rd, 2021",2021-05-03
1-2,1999-02-01
10-5,2029-05-10
17 Jul 2025,2025-07-17
21-3-1995,1995-03-21
25/11/04,2004-11-25
2/19/2018,2018-02-19
9-11,2029-11-09
26th of July 2003,2003-07-26
2004/3/19,2004-03-19
"Sep 2nd, 2034",2034-09-02
6th of April 2011,2011-04-06
17 tháng 6 năm 2002,2002-06-17
16/9-2018,2018-09-16
8-6-21,2021-08-06
19 February 2010,2010-02-19
26-10-2017,2017-10-26
8/3-1994,1994-03-08
24.3.2023,2023-03-24
18Jul2025,2025-07-18
06102001,2001-10-06
4/8-1995,1995-08-04
1997-7-19,1997-07-19
27/1/30,2030-01-27
3/16/2003,2003-03-16
21/3/2031,2031-01-21
23.6.2016,2016-06-23
Jun 7 95,1995-06-07
6 May 2001,2001-05-06
1990/10,1990-10-05
ngày 19 tháng 5 năm 2003,2003-05-19
8-2-24,2024-08-02
2-11-2007,2007-11-02
Jun 8 33,2033-06-08
13/10/20,2020-10-13
15/10-2001,2001-10-15
7-14-24,2024-07-14
3 May 2018,2018-05-03
9-3-92,1992-09-03
02122011,2011-12-02
5-2-00,2000-05-02
17042024,2024-04-17
20th of February 2009,2009-02-20
26 tháng 6 năm 1990,1990-06-26
10/2/2025,2025-02-10
"October 4, 1996",1996-10-04
28Mar2019,2019-03-28
5/13/2012,2012-05-13
24/12/05,2005-12-24
8.8.2008,2008-08-08
46-4-2002,2002-04-23
ngày 23 tháng 7 năm 2007,2007-07-23
11-7-2025,2025-07-11
14 Ma 2003,2003-03-14
2019/2/26,2019-02-26
2019/2/12,2019-02-12
03042002,2002-04-03
7 Aug 2005,2005-08-07
2034/9/20,2034-09-20
8-6-95,1995-08-06
18/4/09,2009-04-18
15/12/2024,2024-04-15
2/12/06,2006-02-12
11/19/2006,2006-11-19
21/10/2032,2032-10-21
May 4 97,1997-05-04
5/10/2012,2012-10-05
26112024,2024-11-26
5 Dec 2003,2003-12-05
20/12/02,2002-12-20
10042035,2035-04-10
"Mar 7th, 2001",2001-03-07
3/6-2003,2003-06-03
4/27/2005,2005-09-04
17 Feb 1998,1998-02-17
9/6/1996,1996-06-09
13/9/96,1996-09-13
5/2/2014,2014-02-05
18.10.2015,2015-10-18
Jul 15 11,2011-07-15
5.9.2010,2010-09-05
6.7.2034,2034-07-06
2031/8/18,2031-08-18
4-7,2000-07-04
"April 17, 2003",2003-04-17
"Dec 28th, 2008",2008-12-28
ngày 7 tháng 5 năm 1996,1996-05-07
12 August 2016,2016-08-12
23:1:2017,2017-01-23
17/10/26,2026-10-17
2/4/1993,1993-02-04
2/10-2011,2011-10-02
19/10/17,2017-10-19
11/2/02,2002-02-11
9-12-2033,2033-12-09
06012019,2019-01-06
5/6/2030,2030-02-05
"March 27, 2032",2032-03-27
2007/4/7,2007-04-07
17032032,2032-03-17
"March 17, 2018",2018-03-17
2-12-2015,2015-12-02
2005-12-26,2005-12-26
2-17-06,2006-02-17
12Mar2020,2020-03-12
8Dec1996,1996-12-08
4-2,1991-02-04
2029/4/18,2029-04-18
6th of June 2008,2008-06-06
15 January 1997,1997-01-15
20/12/2025,2025-12-20
14/7/90,1990-07-14
8/3/08,2008-08-03
19-7,2024-07-19
2015/4/2,2015-04-02
12:7:1996,1996-07-12
12-7-10,2010-12-07
34-1-2022,2022-01-17
4 Mar 2019,2019-03-04
15/12/2009,2009-04-15
27.7.2027,2027-07-27
10/22-1997,1997-11-10
27012016,2016-01-27
2016/12,2016-12-12
1/9/15,2015-09-01
25/9/2031,2031-03-25
11/15/2007,2007-05-11
"December 28, 2020",2020-12-28
18/5-2032,2032-05-18
14-6-2018,2018-06-07
6/8/95,1995-08-06
14 tháng 11 năm 2020,2020-11-14
6-9-2022,2022-09-06
ngày 26 tháng 9 năm 2007,2007-09-26
17May2025,2025-05-17
26/18/2018,2018-06-26
3-16-97,1997-03-16
1 Ju 2026,2026-07-01
4/18/1992,1992-04-18
23/16-2013,2013-08-23
27/3/2018,2018-01-27
20/12-2025,2025-12-20
1998/9/11,1998-09-11
15/9/2033,2033-03-15
"August 26, 1994",1994-08-26
15/2-2029,2029-02-15
1997-6-2,1997-06-02
2:5:1991,1991-05-02
14th of February 2022,2022-02-14
26052032,2032-05-26
"Feb 8th, 1996",1996-02-08
2019/8,2019-08-25
11/4-2009,2009-04-11
54-3-2022,2022-03-27
24 Aug 2004,2004-08-24
21/9-2005,2005-09-21
15/21/2002,2002-07-15
17-11-2024,2024-11-17
23/9/24,2024-09-23
3Mar1998,1998-03-03
11/12-2017,2017-06-11
11 November 1994,1994-11-11
27-11-2008,2008-11-27
54-1-2026,2026-01-27
1/6-2003,2003-03-01
7-1,2006-01-07
14/5/12,2012-05-14
14 tháng 5 năm 2022,2022-05-14
9 Au 2005,2005-08-09
16/11/2012,2012-11-16
13/11/14,2014-11-13
13.12.2008,2008-12-13
1996-3-7,1996-03-07
26/1/2024,2024-01-26
28:3:2023,2023-03-28
23 tháng 10 năm 2010,2010-10-23
3/6/95,1995-03-06
"Aug 13th, 2002",2002-08-13
2 De 2022,2022-12-02
42-3-2004,2004-03-21
7th of September 2013,2013-09-07
22/2-2020,2020-02-22
9-24-20,2020-09-24
19/7/98,1998-07-19
2011/1/18,2011-01-18
8/3/24,2024-03-08
12-7-08,2008-12-07
5-10-2008,2008-10-05
Aug 8 32,2032-08-08
4/24/2021,2021-04-24
1997/5/15,1997-05-15
1/9/1996,1996-09-01
2019/6,2019-06-06
6.10.2008,2008-10-06
4-2,2007-02-04
22 Se 2000,2000-09-22
Jul 18 05,2005-07-18
10 Nov 2010,2010-11-10
13/21/2034,2034-07-13
"November 6, 2005",2005-11-06
40-5-1998,1998-05-20
2 tháng 6 năm 2010,2010-06-02
2021/2,2021-02-22
Feb 23 26,2026-02-23
8/26/2024,2024-08-26
2010-5-14,2010-05-14
8 Aug 2018,2018-08-08
2029/10/25,2029-10-25
25/12-2032,2032-12-25
24Sep2033,2033-09-24
7/11/2006,2006-11-07
17.2.2014,2014-02-17
18/9/35,2035-09-18
7/16/97,1997-07-16
3Dec2030,2030-12-03
21-12,2028-12-21
23-4,2035-04-23
18-10-2031,2031-10-09
10/11-2002,2002-11-10
17th of February 2021,2021-02-17
1-4,1996-04-01
21061999,1999-06-21
1997/1/2,1997-01-02
13Sep2019,2019-09-13
11/13/2030,2030-11-13
ngày 24 tháng 10 năm 2014,2014-10-24
56-7-2028,2028-07-28
ngày 20 tháng 6 năm 2029,2029-06-20
9/14/15,2015-09-14
"Sep 14th, 2012",2012-09-14
2019-9-20,2019-09-20
"Mar 18th, 2029",2029-03-18
ngày 1 tháng 12 năm 2024,2024-12-01
3/12-1996,1996-12-03
28/8-2019,2019-08-28
27/11-2005,2005-11-27
5-2-2003,2003-02-05
1/6/13,2013-01-06
2034/1,2034-01-11
ngày 12 tháng 12 năm 2007,2007-12-12
ngày 16 tháng 11 năm 2006,2006-11-16
Sep 2 99,1999-09-02
2 Mar 2003,2003-03-02
26.4.2019,2019-04-26
ngày 12 tháng 12 năm 1996,1996-12-12
23/11/10,2010-11-23
7-1-01,2001-07-01
16/5/26,2026-05-16
3-15-22,2022-03-15
22.5.2015,2015-05-22
15th of May 2007,2007-05-15
13/10/08,2008-10-13
7/2-2020,2020-02-07
"June 14, 2001",2001-06-14
14/9/25,2025-09-14
28/2-1997,1997-01-28
"April 21, 2025",2025-04-21
14/18-2012,2012-09-14
2027/7/9,2027-07-09
12/9/01,2001-12-09
24/6-2012,2012-03-24
11/27/2023,2023-11-27
"Feb 18th, 2032",2032-02-18
2032-3-26,2032-03-26
8-1-1999,1999-01-08
8/8/05,2005-08-08
6th of February 2033,2033-02-06
13 tháng 7 năm 2035,2035-07-13
7-10,2030-10-07
22/8/31,2031-08-22
8/9/1997,1997-08-09
25/6/2026,2026-06-25
3/3-2030,2030-03-03
"July 24, 2020",2020-07-24
15122013,2013-12-15
26/3/2016,2016-03-26
38-3-2004,2004-03-19
2019-12-2,2019-12-02
1990/6,1990-06-11
1/1-2016,2016-01-01
10th of October 2031,2031-10-10
9 Apr 2005,2005-04-09
7-2-2026,2026-02-07
May 22 34,2034-05-22
1994/10/13,1994-10-13
15/2-1990,1990-01-15
2000/6/1,2000-06-01
25th of January 1997,1997-01-25
22/3/1994,1994-03-22
12-3-2000,2000-03-12
2/24-2027,2027-12-02
2 tháng 3 năm 2013,2013-03-02
18-10-2033,2033-10-18
10/2-2001,2001-01-10
20th of December 2026,2026-12-20
Oct 11 18,2018-10-11
"Oct 8th, 1995",1995-10-08
8/10/04,2004-10-08
Oct 4 19,2019-10-04
18/7/25,2025-07-18
12 April 2015,2015-04-12
5/2-2009,2009-02-05
Dec 19 31,2031-12-19
2002/10/25,2002-10-25
21/11/23,2023-11-21
10/20/2030,2030-10-20
28.7.2014,2014-07-28
3-12,2026-12-03
"Feb 16th, 1999",1999-02-16
1 Au 2027,2027-08-01
3-10-35,2035-03-10
4 May 2031,2031-05-04
18 Apr 2032,2032-04-18
18/4/93,1993-04-18
21:7:2012,2012-07-21
27082009,2009-08-27
20/6/25,2025-06-20
"September 19, 2029",2029-09-19
1 Oc 1994,1994-10-01
2Jun2018,2018-06-02
26/6-2015,2015-03-26
"April 6, 2010",2010-04-06
"Mar 8th, 2016",2016-03-08
20th of April 1998,1998-04-20
9-1-28,2028-09-01
4-16-06,2006-04-16
ngày 24 tháng 10 năm 2015,2015-10-24
9-28-99,1999-09-28
28/14-2033,2033-07-28
28/8/25,2025-08-28
4-8-2022,2022-08-04
25/11/30,2030-11-25
20-7-2034,2034-07-20
11-9,2029-09-11
5-11,2020-11-05
17122023,2023-12-17
17Nov2001,2001-11-17
ngày 22 tháng 10 năm 1999,1999-10-22
3/3/06,2006-03-03
ngày 26 tháng 3 năm 2002,2002-03-26
6-8-2025,2025-08-06
22/12/2014,2014-12-22
28/4-2021,2021-02-28
2 Mar 2007,2007-03-02
22 Aug 2015,2015-08-22
"Dec 7th, 2032",2032-12-07
7/6-2011,2011-06-07
14Jun2032,2032-06-14
15 Apr 2003,2003-04-15
Mar 21 03,2003-03-21
11/3/32,2032-03-11
2020/5/13,2020-05-13
26/3/23,2023-03-26
18 October 2008,2008-10-18
6-19-04,2004-06-19
ngày 8 tháng 6 năm 2018,2018-06-08
2012-8-5,2012-08-05
25-9,1999-09-25
20Jul2017,2017-07-20
1/9/29,2029-09-01
24/24-1999,1999-12-24
8-1,2004-01-08
8.8.1998,1998-08-08
21-11-2011,2011-11-21
"Apr 21th, 2014",2014-04-21
15.1.1998,1998-01-15
23 June 2035,2035-06-23
22 tháng 3 năm 1990,1990-03-22
7-28-14,2014-07-28
9th of September 2012,2012-09-09
4 Se 2003,2003-09-04
14-6,2032-06-14
6/15/11,2011-06-15
10/19/2015,2015-10-19
11 Nov 2032,2032-11-11
24/4/00,2000-04-24
1/6/03,2003-01-06
27 April 2034,2034-04-27
4-3-2009,2009-03-04
8Feb2009,2009-02-08
1st of October 2019,2019-10-01
2022/2/3,2022-02-03
ngày 20 tháng 5 năm 2029,2029-05-20
10 April 2024,2024-04-10
12-16-19,2019-12-16
Aug 4 30,2030-08-04
ngày 10 tháng 10 năm 1991,1991-10-10
2028-2-5,2028-02-05
20/8-2029,2029-04-20
27/24-2029,2029-12-27
2026/10/17,2026-10-17
ngày 27 tháng 6 năm 1996,1996-06-27
4 August 2000,2000-08-04
9-4-16,2016-09-04
6-11-2031,2031-11-03
24/12-2017,2017-06-24
1999/4/19,1999-04-19
14/12/2015,2015-04-14
1/6/2019,2019-06-01
9 October 1994,1994-10-09
14 Fe 2000,2000-02-14
8-25-01,2001-08-25
"February 21, 2035",2035-02-21
11/8/2010,2010-11-08
2/1/14,2014-01-02
"Sep 6th, 2008",2008-09-06
Sep 9 35,2035-09-09
"February 5, 2024",2024-02-05
"Mar 9th, 2022",2022-03-09
9Nov1991,1991-11-09
"April 8, 1993",1993-04-08
3 tháng 12 năm 2026,2026-12-03
2017/7/6,2017-07-06
6 July 1992,1992-07-06
3 tháng 6 năm 1990,1990-06-03
2006/7/27,2006-07-27
12/24/2033,2033-12-24
ngày 20 tháng 2 năm 2003,2003-02-20
9/2-2029,2029-01-09
13:12:2027,2027-12-13
Jan 28 25,2025-01-28
28/6/15,2015-06-28
5/1/09,2009-05-01
7/21/2018,2018-07-07
2.6.1997,1997-06-02
2017-5-18,2017-05-18
2 Feb 2030,2030-02-02
5/28/2015,2015-05-28
1999/3,1999-03-01
2/8/2014,2014-02-08
25-7-2007,2007-07-25
10-12-1995,1995-12-05
27-8,2021-08-27
20-7-2016,2016-07-10
25/12/2012,2012-12-25
24 Au 1999,1999-08-24
25/2/2009,2009-02-25
24 May 2027,2027-05-24
28/4-2011,2011-04-28
10 Jul 2021,2021-07-10
11-19-32,2032-11-19
46-7-1999,1999-07-23
18-8,1996-08-18
5/2-2005,2005-01-05
7/6-2005,2005-06-07
2008-7-4,2008-07-04
1997-11-6,1997-11-06
17/4/22,2022-04-17
7 Se 2010,2010-09-07
10-11-2013,2013-11-05
9th of October 2029,2029-10-09
"Feb 21th, 2014",2014-02-21
14:12:2011,2011-12-14
20.1.2029,2029-01-20
23/10-2031,2031-10-23
22.3.2026,2026-03-22
19-9-2003,2003-09-19
1-12-2004,2004-12-01
4.7.2013,2013-07-04
ngày 25 tháng 4 năm 2024,2024-04-25
13Sep1999,1999-09-13
24Sep1996,1996-09-24
23 Au 1998,1998-08-23
9 Ma 2012,2012-03-09
9 Fe 2008,2008-02-09
15.9.2014,2014-09-15
28062024,2024-06-28
16/15/1993,1993-05-16
9-6,2014-06-09
2008/10/25,2008-10-25
17-7-2017,2017-07-17
"Mar 16th, 2027",2027-03-16
24/6/2025,2025-06-24
21/6-2023,2023-03-21
14/7-2027,2027-07-14
2-4-12,2012-02-04
16/5-2009,2009-05-16
44-10-2008,2008-10-22
15/12-1992,1992-06-15
20 February 2008,2008-02-20
6-12-99,1999-06-12
27-7-1997,1997-07-27
8/6/94,1994-08-06
18:3:2019,2019-03-18
17/8/1990,1990-08-17
20 tháng 4 năm 2018,2018-04-20
8/11/14,2014-11-08
Oct 3 14,2014-10-03
7 Oc 2024,2024-10-07
8-1,2031-01-08
9/2/25,2025-09-02
17th of June 2012,2012-06-17
Jan 25 29,2029-01-25
26-3,2028-03-26
18th of March 2008,2008-03-18
9 Ma 2034,2034-03-09
3:7:2000,2000-07-03
"Nov 5th, 2035",2035-11-05
7/9-2034,2034-09-07
11 tháng 12 năm 2001,2001-12-11
2023/8,2023-08-09
1998/1/2,1998-01-02
25/22-2015,2015-11-25
12.11.2033,2033-11-12
ngày 16 tháng 5 năm 2007,2007-05-16
25 tháng 1 năm 2003,2003-01-25
"Jun 25th, 2001",2001-06-25
7-21-02,2002-07-21
01012020,2020-01-01
7 tháng 10 năm 2006,2006-10-07
2014-9-1,2014-09-01
ngày 25 tháng 11 năm 2010,2010-11-25
25/24/2028,2028-08-25
9 Oc 2008,2008-10-09
15052016,2016-05-15
2002/3,2002-03-25
"December 5, 2005",2005-12-05
27:12:2026,2026-12-27
12-1-02,2002-12-01
1 November 2030,2030-11-01
2014/11,2014-11-27
3/17/1994,1994-03-17
25-12-1997,1997-12-25
2033/2,2033-02-07
6:4:2010,2010-04-06
19th of July 2029,2029-07-19
04042010,2010-04-04
25/9-2025,2025-09-25
"August 16, 2026",2026-08-16
"November 28, 2015",2015-11-28
3 De 2014,2014-12-03
22 May 2000,2000-05-22
26/30/2030,2030-10-26
10-10,2030-10-10
10-1,2003-01-10
19th of April 2015,2015-04-19
2013/12,2013-12-03
"Jun 13th, 2028",2028-06-13
21.3.2007,2007-03-21
3-1-12,2012-03-01
11-18-09,2009-11-18
50-12-2006,2006-12-25
23 tháng 7 năm 2031,2031-07-23
13.12.2010,2010-12-13
1-6-1995,1995-06-01
"Aug 8th, 2008",2008-08-08
27 Ma 2026,2026-05-27
10/5-1993,1993-05-10
2028-3-5,2028-03-05
12Sep2016,2016-09-12
"Sep 10th, 2013",2013-09-10
10-1-2017,2017-01-05
ngày 6 tháng 12 năm 2017,2017-12-06
3/12/2030,2030-03-12
28/21/1990,1990-07-28
6/2-2017,2017-02-06
17 Ma 2002,2002-05-17
Nov 11 92,1992-11-11
"December 18, 2023",2023-12-18
9/10-2028,2028-05-09
2018/6/20,2018-06-20
ngày 5 tháng 2 năm 2022,2022-02-05
2025/1,2025-01-17
3/5/1993,1993-05-03
May 13 14,2014-05-13
13 Dec 2020,2020-12-13
26102029,2029-10-26
1994/2,1994-02-18
ngày 1 tháng 6 năm 2020,2020-06-01
11/18/1995,1995-11-18
3-12-29,2029-03-12
2.4.2000,2000-04-02
8 Fe 2002,2002-02-08
"October 24, 2027",2027-10-24
1/1-2003,2003-01-01
10/3/28,2028-10-03
ngày 19 tháng 11 năm 2001,2001-11-19
19:1:1999,1999-01-19
3 tháng 4 năm 2003,2003-04-03
17.6.2005,2005-06-17
10-8-08,2008-10-08
27 Au 2020,2020-08-27
26/7/30,2030-07-26
1998/2/12,1998-02-12
19/9/33,2033-09-19
26 Nov 2001,2001-11-26
Oct 21 06,2006-10-21
28th of June 2017,2017-06-28
12-1-24,2024-12-01
19/12/2013,2013-12-19
19/10/23,2023-10-19
16/2/24,2024-02-16
6th of May 1999,1999-05-06
25/18-2002,2002-09-25
11 Fe 2017,2017-02-11
9th of September 2022,2022-09-09
26 Mar 2031,2031-03-26
7-2,2007-02-07
5:2:2016,2016-02-05
"Sep 17th, 2021",2021-09-17
Aug 13 02,2002-08-13
2019/5/17,2019-05-17
21/6-2033,2033-06-21
54-5-2018,2018-05-27
23/12/95,1995-12-23
2030/4,2030-04-17
"January 27, 2014",2014-01-27
26Jan2013,2013-01-26
Nov 21 91,1991-11-21
Jun 11 05,2005-06-11
27/7/2034,2034-07-27
ngày 27 tháng 1 năm 2014,2014-01-27
21092008,2008-09-21
2/6/2012,2012-02-06
9-8-2009,2009-08-09
18/8-1990,1990-08-18
04012019,2019-01-04
3/6/00,2000-06-03
03092030,2030-09-03
4 Mar 1996,1996-03-04
16/10-2033,2033-10-16
ngày 9 tháng 4 năm 2023,2023-04-09
19 tháng 5 năm 2028,2028-05-19
17 Oct 2030,2030-10-17
1 Ja 2014,2014-01-01
25112003,2003-11-25
12-3-14,2014-12-03
Oct 23 05,2005-10-23
Oct 28 09,2009-10-28
21/4/31,2031-04-21
2/18-1997,1997-09-02
27.2.2020,2020-02-27
7:5:2014,2014-05-07
"Jun 7th, 2002",2002-06-07
19 Apr 2010,2010-04-19
21Nov2035,2035-11-21
1993/7,1993-07-13
8-18-16,2016-08-18
16 Jul 2030,2030-07-16
ngày 16 tháng 6 năm 2024,2024-06-16
5/6/13,2013-06-05
23 Ma 2024,2024-05-23
04112028,2028-11-04
26-1-2006,2006-01-13
4/25/96,1996-04-25
27 November 2013,2013-11-27
10/11/93,1993-11-10
"January 21, 1992",1992-01-21
3 tháng 10 năm 2018,2018-10-03
44-5-2030,2030-05-22
May 9 03,2003-05-09
1-1,2011-01-01
10/22/2028,2028-10-22
2027/9/26,2027-09-26
9-2-05,2005-09-02
2nd of December 2022,2022-12-02
2031/2,2031-02-07
"March 20, 2012",2012-03-20
23 Jul 1993,1993-07-23
3/2-2025,2025-01-03
"Dec 2nd, 2035",2035-12-02
22/4/19,2019-04-22
6 tháng 1 năm 1994,1994-01-06
"May 26, 1990",1990-05-26
5/9/91,1991-05-09
5:11:2002,2002-11-05
12th of March 2003,2003-03-12
ngày 1 tháng 2 năm 2028,2028-02-01
7-1-2007,2007-01-07
17Dec2007,2007-12-17
22092020,2020-09-22
2006/4,2006-04-28
19 tháng 4 năm 2009,2009-04-19
2 tháng 10 năm 2015,2015-10-02
14 tháng 6 năm 1995,1995-06-14
3rd of August 2006,2006-08-03
2012/3,2012-03-02
22-9,2015-09-22
12/6/2009,2009-12-06
May 3 03,2003-05-03
ngày 9 tháng 9 năm 1990,1990-09-09
28 tháng 11 năm 2004,2004-11-28
"Oct 28th, 2023",2023-10-28
1996-3-5,1996-03-05
12/22/33,2033-12-22
27 June 2001,2001-06-27
11112024,2024-11-11
"December 7, 2021",2021-12-07
"Feb 13th, 2023",2023-02-13
8-7,1993-07-08
13 Se 2013,2013-09-13
18/6-1990,1990-06-18
5/5/13,2013-05-05
2016/5/23,2016-05-23
4/7/27,2027-07-04
15Nov2013,2013-11-15
5/8-2021,2021-08-05
ngày 14 tháng 1 năm 2018,2018-01-14
Jun 27 00,2000-06-27
ngày 16 tháng 9 năm 2015,2015-09-16
10082004,2004-08-10
23/18/2035,2035-06-23
42-12-2013,2013-12-21
23th of May 2021,2021-05-23
2033/6,2033-06-08
"Jul 3rd, 2006",2006-07-03
5 De 2006,2006-12-05
2/13/2024,2024-02-13
27/4-2031,2031-02-27
21/2-1996,1996-02-21
10-5-2016,2016-05-05
22.4.2029,2029-04-22
12 June 2020,2020-06-12
4 September 2000,2000-09-04
1997-4-11,1997-04-11
5 Apr 2003,2003-04-05
10-24-03,2003-10-24
16 May 2011,2011-05-16
10 Apr 1990,1990-04-10
15Apr2005,2005-04-15
2-5-96,1996-02-05
24102017,2017-10-24
15/4-2010,2010-04-15
"Jan 6th, 2007",2007-01-06
2/4/06,2006-04-02
9/3/2008,2008-01-09
6/1/15,2015-06-01
7/1/06,2006-01-07
6/7/99,1999-06-07
11-12-2012,2012-12-11
12-22-26,2026-12-22
23/18-1993,1993-09-23
18 tháng 10 năm 2003,2003-10-18
4th of April 1994,1994-04-04
17-5,2029-05-17
2/24/2019,2019-08-02
28122012,2012-12-28
28 April 2010,2010-04-28
6/4-1991,1991-02-06
22:6:2035,2035-06-22
ngày 10 tháng 11 năm 2020,2020-11-10
"November 5, 2012",2012-11-05
17 tháng 7 năm 2003,2003-07-17
36-8-2022,2022-08-18
18 Nov 2023,2023-11-18
26/6/08,2008-06-26
2003-5-9,2003-05-09
18 July 1991,1991-07-18
5:8:2014,2014-08-05
4 Oc 2031,2031-10-04
19/9/08,2008-09-19
2020/4,2020-04-13
14 December 2022,2022-12-14
15 Se 2023,2023-09-15
26th of May 2009,2009-05-26
1/7-2016,2016-07-01
9 tháng 4 năm 2016,2016-04-09
28/8-2007,2007-04-28
2/3/2030,2030-02-03
12.2.1996,1996-02-12
7 De 2018,2018-12-07
22/4/05,2005-04-22
Dec 25 22,2022-12-25
23 tháng 1 năm 2004,2004-01-23
"May 25th, 1998",1998-05-25
22-10,2004-10-22
19-8-2022,2022-08-19
2-3,2020-03-02
1-16-95,1995-01-16
20th of March 2009,2009-03-20
9/3-1991,1991-03-09
2015-2-21,2015-02-21
2nd of July 2034,2034-07-02
2023/5,2023-05-23
28-2-1997,1997-02-28
9-5-08,2008-09-05
8/18/2021,2021-06-08
2032/2,2032-02-16
1/8-2013,2013-04-01
2004-6-12,2004-06-12
04062007,2007-06-04
2019/7,2019-07-12
23 Mar 2009,2009-03-23
11th of February 2013,2013-02-11
3 No 1991,1991-11-03
6/11/2007,2007-11-06
18/11/04,2004-11-18
2015/6/26,2015-06-26
6/4/2012,2012-04-06
24 December 1998,1998-12-24
7 Ap 1997,1997-04-07
11/17/34,2034-11-17
18/8/2015,2015-08-18
2012/9,2012-09-20
25 April 2001,2001-04-25
9th of October 2028,2028-10-09
40-1-1993,1993-01-20
2010/6/1,2010-06-01
28-11,2013-11-28
21/2/2005,2005-02-21
17-12-2016,2016-12-17
4 tháng 2 năm 2021,2021-02-04
11/4-1991,1991-04-11
7-8-19,2019-07-08
ngày 6 tháng 1 năm 2018,2018-01-06
8-6-1991,1991-06-08
10/3/05,2005-10-03
14/9/2034,2034-09-14
"January 12, 2021",2021-01-12
26-2-2034,2034-02-26
1-16-30,2030-01-16
24-10,2023-10-24
5/1/1991,1991-01-05
5 May 2028,2028-05-05
24/7-2014,2014-07-24
18/5-2017,2017-05-18
13/7/1994,1994-07-13
Dec 5 99,1999-12-05
20/8/1999,1999-08-20
6:1:1997,1997-01-06
27/11/08,2008-11-27
7 Ju 2003,2003-06-07
19072015,2015-07-19
52-2-2006,2006-02-26
"February 19, 2003",2003-02-19
27 Oc 2021,2021-10-27
7/24/94,1994-07-24
1991/8/5,1991-08-05
Jul 5 23,2023-07-05
24th of September 2011,2011-09-24
21-8-2005,2005-08-21
4 tháng 6 năm 2015,2015-06-04
14 De 2031,2031-12-14
20 tháng 2 năm 2019,2019-02-20
23/2/2004,2004-02-23
20/9/1992,1992-03-20
24-4-1998,1998-04-24
22102025,2025-10-22
5-11,1990-11-05
4/12/1990,1990-04-12
27 Ma 2032,2032-03-27
"Apr 22th, 2034",2034-04-22
"Mar 14th, 2030",2030-03-14
"Nov 23th, 2017",2017-11-23
19/8/95,1995-08-19
15/24/2000,2000-08-15
9/8/09,2009-08-09
8 December 2018,2018-12-08
17.6.1997,1997-06-17
20 January 2032,2032-01-20
"August 19, 2014",2014-08-19
6/12/19,2019-12-06
21/11/91,1991-11-21
20/10-2026,2026-10-20
2/3/34,2034-02-03
9/10-2010,2010-10-09
4-7-2024,2024-07-02
1/14/1998,1998-01-14
25 tháng 2 năm 2024,2024-02-25
25-12-2018,2018-12-25
2/20/07,2007-02-20
25-4,2015-04-25
12 Ma 2020,2020-05-12
12:2:2015,2015-02-12
12/11/27,2027-12-11
"Sep 10th, 1990",1990-09-10
16 tháng 6 năm 2030,2030-06-16
2-27-35,2035-02-27
6 February 1998,1998-02-06
ngày 3 tháng 10 năm 1992,1992-10-03
22.2.2008,2008-02-22
2025-6-13,2025-06-13
5.1.2017,2017-01-05
3rd of April 2025,2025-04-03
1/2/2013,2013-01-02
23:11:1999,1999-11-23
7/4-2001,2001-04-07
22/11/2022,2022-11-22
8/1/98,1998-08-01
5-9,2026-09-05
28 Ma 2026,2026-05-28
ngày 25 tháng 10 năm 2003,2003-10-25
"Apr 24th, 2021",2021-04-24
15 Ma 2000,2000-05-15
Jun 8 12,2012-06-08
21/15/2007,2007-05-21
2002/8,2002-08-14
03022031,2031-02-03
5/21/24,2024-05-21
25th of December 2003,2003-12-25
10/5/01,2001-05-10
4/5-2021,2021-05-04
7/23/34,2034-07-23
15/12-1998,1998-06-15
5:10:2032,2032-10-05
ngày 26 tháng 10 năm 2004,2004-10-26
27/16-2000,2000-08-27
ngày 22 tháng 11 năm 2030,2030-11-22
9-22-16,2016-09-22
2019/4/15,2019-04-15
28/30/2021,2021-10-28
8/4-2009,2009-04-08
Aug 10 10,2010-08-10
2000-10-13,2000-10-13
8/8/2035,2035-08-08
2007-4-7,2007-04-07
24/2/1992,1992-02-24
7/9-1998,1998-09-07
30-11-2005,2005-11-15
52-8-2032,2032-08-26
46-10-2029,2029-10-23
2034-11-25,2034-11-25
26/1-1990,1990-01-26
3/6-2028,2028-06-03
"June 2, 2009",2009-06-02
14/6/11,2011-06-14
2006/7,2006-07-16
26-6-2010,2010-06-26
1/24/2014,2014-01-24
8-4,2003-04-08
40-2-2021,2021-02-20
2018/6,2018-06-14
20/14-2007,2007-07-20
2033/4,2033-04-25
19th of April 2032,2032-04-19
28/10-1994,1994-05-28
"May 28th, 2007",2007-05-28
2003/8,2003-08-26
1/4/2023,2023-04-01
1 Ap 2032,2032-04-01
ngày 19 tháng 2 năm 1990,1990-02-19
28 tháng 12 năm 2019,2019-12-28
22 April 2001,2001-04-22
11 Ju 2011,2011-07-11
7-12-2012,2012-12-07
13 January 2000,2000-01-13
17012028,2028-01-17
05052000,2000-05-05
27/4-2034,2034-04-27
2001-2-22,2001-02-22
1997/7,1997-07-14
1:12:1999,1999-12-01
2-5-2029,2029-05-02
15 tháng 9 năm 2027,2027-09-15
17/11-2025,2025-11-17
21 January 2030,2030-01-21
Feb 26 24,2024-02-26
5/3/31,2031-05-03
24 Ju 2032,2032-07-24
15 February 2029,2029-02-15
2009/4,2009-04-05
20/11-2032,2032-11-20
27022011,2011-02-27
5/6-2014,2014-06-05
ngày 27 tháng 1 năm 2021,2021-01-27
10/3-1990,1990-03-10
12/2/2027,2027-12-02
22 Mar 2010,2010-03-22
17/4-1994,1994-04-17
4-5-2011,2011-05-04
2-1,2008-01-02
ngày 16 tháng 8 năm 2028,2028-08-16
8/22/08,2008-08-22
10/7-2009,2009-07-10
5Aug2011,2011-08-05
12/8/00,2000-12-08
19 tháng 7 năm 2003,2003-07-19
5/6/28,2028-05-06
Dec 19 97,1997-12-19
1992/5,1992-05-08
4 October 2001,2001-10-04
9 July 2002,2002-07-09
2035/11,2035-11-19
24-7-2033,2033-07-12
ngày 15 tháng 2 năm 2024,2024-02-15
23May1994,1994-05-23
11Nov2018,2018-11-11
7/5/2029,2029-05-07
7/27/97,1997-07-27
2029/5,2029-05-27
26-4,2015-04-26
"Jun 14th, 1999",1999-06-14
1-7-2034,2034-07-01
10 tháng 4 năm 2016,2016-04-10
11/1-1998,1998-01-11
20052001,2001-05-20
28022033,2033-02-28
"April 22, 2022",2022-04-22
24/6/31,2031-06-24
3 Ju 1996,1996-06-03
17121995,1995-12-17
11012026,2026-01-11
2005/5,2005-05-07
21/21/1994,1994-07-21
7 Jul 2009,2009-07-07
16/6-2026,2026-03-16
13Jul2010,2010-07-13
"Jul 8th, 2017",2017-07-08
13/12/29,2029-12-13
4th of April 2011,2011-04-04
6/6/1996,1996-06-06
10-26-30,2030-10-26
"Sep 18th, 1991",1991-09-18
14th of July 1990,1990-07-14
17/12/07,2007-12-17
27 Sep 2007,2007-09-27
26 tháng 6 năm 2004,2004-06-26
26 Ju 2033,2033-06-26
26Feb2015,2015-02-26
7-24-96,1996-07-24
23/10/99,1999-10-23
27-2,2018-02-27
8 tháng 5 năm 2029,2029-05-08
21 Fe 2008,2008-02-21
8/5-1996,1996-05-08
10/36/2018,2018-12-10
21/7/07,2007-07-21
14/11-1993,1993-11-14
23/9-1996,1996-09-23
Jan 5 20,2020-01-05
21 December 2007,2007-12-21
9/4-1995,1995-04-09
6/11/2015,2015-06-11
23/5/2013,2013-05-23
18/5-2015,2015-05-18
10-8-2005,2005-08-10
1:7:1997,1997-07-01
15/7-2003,2003-07-15
16 tháng 4 năm 2021,2021-04-16
12/9-1998,1998-09-12
27/4-2005,2005-04-27
"September 25, 2017",2017-09-25
7-7,2006-07-07
15 tháng 8 năm 2013,2013-08-15
20.11.2033,2033-11-20
5/9/2016,2016-09-05
18 June 2022,2022-06-18
ngày 24 tháng 2 năm 2002,2002-02-24
24-11-2021,2021-11-24
9th of October 2005,2005-10-09
12 July 2006,2006-07-12
5-7-2034,2034-07-05
7/22-2010,2010-11-07
15/10-2027,2027-10-15
6:9:2022,2022-09-06
"Oct 13th, 1996",1996-10-13
23/2/2026,2026-02-23
18.4.2024,2024-04-18
48-8-2020,2020-08-24
22-1,2001-01-22
Feb 27 04,2004-02-27
9.10.2022,2022-10-09
10-10-04,2004-10-10
20-4-2013,2013-04-20
10102028,2028-10-10
2002/3,2002-03-10
17-4,2020-04-17
"November 16, 2019",2019-11-16
15.11.2033,2033-11-15
ngày 22 tháng 7 năm 2021,2021-07-22
Dec 19 90,1990-12-19
2/28/19,2019-02-28
11/16-1997,1997-08-11
28/5/19,2019-05-28
4/9/2005,2005-09-04
22/2/1998,1998-02-22
Apr 28 35,2035-04-28
"January 2, 2001",2001-01-02
6 December 2010,2010-12-06
28:3:2016,2016-03-28
22/4/2012,2012-04-22
26/6/2033,2033-06-26
Jul 20 97,1997-07-20
ngày 15 tháng 10 năm 2010,2010-10-15
7/7/22,2022-07-07
7Dec2028,2028-12-07
21th of June 1992,1992-06-21
"September 20, 2002",2002-09-20
2009-10-19,2009-10-19
11/7/90,1990-07-11
"Dec 28th, 1992",1992-12-28
14/11/91,1991-11-14
8/1/24,2024-01-08
Oct 5 15,2015-10-05
2Apr2002,2002-04-02
17th of November 2020,2020-11-17
23/12/35,2035-12-23
11/2-2030,2030-02-11
17062015,2015-06-17
27.7.2032,2032-07-27
3/17/91,1991-03-17
27 May 2026,2026-05-27
27/3-2034,2034-03-27
13-6,2003-06-13
Sep 11 23,2023-09-11
2014/8,2014-08-14
9 October 2033,2033-10-09
21/2/23,2023-02-21
8:6:2008,2008-06-08
19 tháng 6 năm 2006,2006-06-19
17/10-2010,2010-05-17
"March 23, 1998",1998-03-23
1/19/30,2030-01-19
Feb 15 05,2005-02-15
"Sep 1st, 2000",2000-09-01
18/11-2007,2007-11-18
ngày 24 tháng 4 năm 2034,2034-04-24
2nd of April 2007,2007-04-02
34-7-1999,1999-07-17
20/9/1994,1994-03-20
24 March 1990,1990-03-24
1 No 2006,2006-11-01
2029-3-25,2029-03-25
11 tháng 5 năm 2033,2033-05-11
16th of April 2033,2033-04-16
17/3/2004,2004-03-17
20:6:2032,2032-06-20
3Feb2015,2015-02-03
22/9-2006,2006-09-22
21:3:2007,2007-03-21
36-12-2011,2011-12-18
4-3-2022,2022-03-04
13 No 2033,2033-11-13
11 tháng 11 năm 2022,2022-11-11
10Sep2021,2021-09-10
18/8-1996,1996-08-18
3-20-07,2007-03-20
17092001,2001-09-17
14/2-2019,2019-02-14
26 Fe 2011,2011-02-26
15 Se 2024,2024-09-15
12/20-1996,1996-10-12
8/1/2026,2026-08-01
3 October 2015,2015-10-03
14/16-2035,2035-08-14
ngày 8 tháng 1 năm 2010,2010-01-08
4/20-2008,2008-10-04
"Jul 5th, 2032",2032-07-05
10 Se 1997,1997-09-10
1994-12-5,1994-12-05
13th of June 2007,2007-06-13
20.9.2004,2004-09-20
7/2-2013,2013-02-07
10/26/17,2017-10-26
"September 3, 2027",2027-09-03
2000/10,2000-10-23
Aug 19 17,2017-08-19
17/10-1999,1999-05-17
19Feb2033,2033-02-19
22-10-2010,2010-10-22
5Feb2006,2006-02-05
1/9/2028,2028-03-01
10/2/32,2032-02-10
"Apr 3rd, 2010",2010-04-03
2018/10/7,2018-10-07
10-6,2012-06-10
1992-7-24,1992-07-24
42-6-2024,2024-06-21
12/21/1996,1996-12-21
14/3/00,2000-03-14
14102012,2012-10-14
8 September 2035,2035-09-08
10/8-2035,2035-08-10
23th of December 2000,2000-12-23
28.6.2029,2029-06-28
"March 25, 2001",2001-03-25
"May 11th, 2030",2030-05-11
22 Fe 2019,2019-02-22
22 April 2034,2034-04-22
28.8.2033,2033-08-28
"October 24, 2004",2004-10-24
16-7-2004,2004-07-16
23 Oct 2025,2025-10-23
4 tháng 6 năm 2026,2026-06-04
1997-5-10,1997-05-10
25/3/2010,2010-03-25
10-12,2033-12-10
"Jul 5th, 2011",2011-07-05
9/9/1995,1995-03-09
26.12.2003,2003-12-26
18:2:2004,2004-02-18
15 Oc 2005,2005-10-15
2028/1/27,2028-01-27
2 May 2023,2023-05-02
2006/5/26,2006-05-26
10:10:2031,2031-10-10
2/6/31,2031-06-02
6:2:2001,2001-02-06
18/33/1990,1990-11-18
10-27-04,2004-10-27
23/22-2020,2020-11-23
13112000,2000-11-13
15-12,2014-12-15
15 Apr 2007,2007-04-15
13.3.2004,2004-03-13
52-6-2008,2008-06-26
9:11:2014,2014-11-09
21/2/24,2024-02-21
21/6-1998,1998-06-21
9 Ju 2014,2014-06-09
8-9,1996-09-08
2005/1,2005-01-18
14Aug1998,1998-08-14
42-11-2017,2017-11-21
"Oct 26th, 2016",2016-10-26
ngày 4 tháng 2 năm 1998,1998-02-04
14-3-2012,2012-03-14
22 tháng 5 năm 2006,2006-05-22
24 Apr 1999,1999-04-24
"May 3, 2030",2030-05-03
2/3/07,2007-03-02
28/2-1991,1991-01-28
26/24/2033,2033-08-26
10101995,1995-10-10
10:12:1998,1998-12-10
2029/6,2029-06-28
"August 13, 1990",1990-08-13
19-9-1997,1997-09-19
2016-12-22,2016-12-22
4/5/08,2008-05-04
2-7,2035-07-02
13/12-2030,2030-12-13
"October 28, 1996",1996-10-28
3/9-2028,2028-09-03
25 tháng 1 năm 2030,2030-01-25
19/10-2035,2035-05-19
23Mar2013,2013-03-23
17 Ma 2010,2010-03-17
12 August 2016,2016-08-12
2008-2-9,2008-02-09
10/15/2019,2019-05-10
"Jun 20th, 2007",2007-06-20
"May 13, 2013",2013-05-13
13/9/2028,2028-09-13
ngày 3 tháng 1 năm 2021,2021-01-03
Nov 15 20,2020-11-15
2024/10/24,2024-10-24
27/6-2033,2033-06-27
18Nov1997,1997-11-18
13th of April 2006,2006-04-13
20/9-1993,1993-09-20
1992-10-17,1992-10-17
25072033,2033-07-25
23 Ma 1996,1996-03-23
1/8/2029,2029-08-01
1/11/26,2026-11-01
14.9.2033,2033-09-14
"April 6, 2021",2021-04-06
3-17-13,2013-03-17
1999-1-16,1999-01-16
8.9.2031,2031-09-08
18/7-2024,2024-07-18
23/9/96,1996-09-23
16/1/04,2004-01-16
4.5.1992,1992-05-04
"October 4, 2015",2015-10-04
1Oct2002,2002-10-01
"July 20, 2004",2004-07-20
7/3-2018,2018-03-07
25/1/15,2015-01-25
27 Ma 2002,2002-03-27
12/8/03,2003-08-12
27 tháng 9 năm 2018,2018-09-27
7/20/2025,2025-07-20
10/4/31,2031-04-10
6/7/22,2022-06-07
10/9-2030,2030-09-10
27-1,2008-01-27
17/10/32,2032-10-17
2004-5-8,2004-05-08
12-2-2019,2019-02-06
Sep 2 95,1995-09-02
21062028,2028-06-21
2022/2/28,2022-02-28
27 Oct 2034,2034-10-27
7/1/10,2010-01-07
19/6-2024,2024-06-19
2009/10/2,2009-10-02
19/11-2014,2014-11-19
6 Au 2021,2021-08-06
2005/5/20,2005-05-20
21/4/00,2000-04-21
7-20-19,2019-07-20
7/1-2021,2021-01-07
1993/1,1993-01-01
"Jul 19th, 1993",1993-07-19
17/1/08,2008-01-17
4Apr1996,1996-04-04
11/9/1990,1990-03-11
18 Jun 2005,2005-06-18
2015-3-12,2015-03-12
28/11-2010,2010-11-28
21-1-2011,2011-01-21
3/21/2029,2029-07-03
23/7/22,2022-07-23
Nov 16 10,2010-11-16
Nov 14 32,2032-11-14
23th of April 2009,2009-04-23
8/15/1991,1991-05-08
04032029,2029-03-04
15/5/13,2013-05-15
2009/2,2009-02-19
15-6,2034-06-15
2005-9-5,2005-09-05
17 Se 2015,2015-09-17
20/1/2025,2025-01-20
1.10.1995,1995-10-01
24 Jun 2016,2016-06-24
1/2/1995,1995-02-01
16/5-2034,2034-05-16
4-14-16,2016-04-14
16/11/2028,2028-11-16
"Feb 23th, 2020",2020-02-23
6-12-2030,2030-12-03
4-11-2016,2016-11-04
7 January 1996,1996-01-07
16.1.1997,1997-01-16
"Nov 4th, 2022",2022-11-04
15Mar2011,2011-03-15
20-9-1995,1995-09-20
6:1:2000,2000-01-06
8/5/21,2021-05-08
19/4/2024,2024-04-19
5/3-2019,2019-03-05
16th of March 1993,1993-03-16
26-10-2007,2007-10-26
2027/7,2027-07-23
3/6/30,2030-06-03
7/28/07,2007-07-28
21/12-2010,2010-06-21
Sep 4 28,2028-09-04
2025/9/25,2025-09-25
6Dec2034,2034-12-06
8th of November 2022,2022-11-08
3/10/29,2029-10-03
"May 11, 2020",2020-05-11
2016/1,2016-01-25
6/18/2001,2001-06-06
40-11-2027,2027-11-20
05122007,2007-12-05
2034/8,2034-08-06
5/4-2012,2012-04-05
4/9/2006,2006-04-09
18-10,2016-10-18
7/9/1992,1992-09-07
25/4/94,1994-04-25
10 September 2018,2018-09-10
22:2:2013,2013-02-22
22/10/1996,1996-10-22
"February 18, 2010",2010-02-18
24-12-2034,2034-12-24
9/4/33,2033-04-09
2019/9,2019-09-11
14/7/01,2001-07-14
Sep 5 15,2015-09-05
18 tháng 12 năm 2024,2024-12-18
11/24/2013,2013-11-24
12th of December 1998,1998-12-12
13th of April 1995,1995-04-13
34-3-2011,2011-03-17
18/14-2006,2006-07-18
22/22-2025,2025-11-22
26/4-2015,2015-04-26
"September 23, 2016",2016-09-23
ngày 16 tháng 11 năm 2013,2013-11-16
3/9/2021,2021-03-03
7.8.2012,2012-08-07
2010/10,2010-10-02
"May 7, 2000",2000-05-07
28/11/2007,2007-11-28
8/19/2020,2020-08-19
12/9/2016,2016-12-09
18/1/1997,1997-01-18
ngày 3 tháng 8 năm 1994,1994-08-03
2 March 2009,2009-03-02
19 Ma 2028,2028-03-19
"Feb 23th, 2013",2013-02-23
2012/6/21,2012-06-21
19th of October 2026,2026-10-19
6Jul2026,2026-07-06
23 Aug 2011,2011-08-23
50-3-2027,2027-03-25
16 Ap 2023,2023-04-16
11/5/99,1999-11-05
7/11/96,1996-07-11
9/5-1999,1999-05-09
9/4-2009,2009-04-09
"Jun 7th, 2027",2027-06-07
1991-1-26,1991-01-26
10-12-2024,2024-12-10
21.1.2020,2020-01-21
22.12.2007,2007-12-22
20-10,2007-10-20
11/1-2022,2022-01-11
4-9-2019,2019-09-02
26/9/2022,2022-09-26
16 tháng 7 năm 2008,2008-07-16
24/12-2030,2030-12-24
"May 9th, 1991",1991-05-09
4-3-94,1994-04-03
2016-6-14,2016-06-14
25:5:2017,2017-05-25
2008-6-22,2008-06-22
18/2/31,2031-02-18
8/3-2012,2012-03-08
3/19/09,2009-03-19
11062020,2020-06-11
"February 2, 2006",2006-02-02
"Nov 21th, 1999",1999-11-21
1Apr1991,1991-04-01
1/12-2022,2022-06-01
24th of February 2011,2011-02-24
2018/10,2018-10-13
7-2-2015,2015-02-07
7/12/12,2012-12-07
ngày 21 tháng 7 năm 2021,2021-07-21
"November 9, 1997",1997-11-09
11:4:2019,2019-04-11
1/21/28,2028-01-21
1992-3-28,1992-03-28
17/11-1999,1999-11-17
11/10/01,2001-10-11
2/6-1990,1990-06-02
28/4-2034,2034-04-28
"May 10th, 2012",2012-05-10
6/12/28,2028-12-06
7-3-16,2016-07-03
5/21/2013,2013-07-05
19 March 2000,2000-03-19
28/6-2023,2023-06-28
6/17/1992,1992-06-17
4-9-31,2031-04-09
6May1999,1999-05-06
24/21/2016,2016-07-24
9 Jun 2005,2005-06-09
11101994,1994-10-11
4 Oct 2024,2024-10-04
2005/11/2,2005-11-02
24 De 2031,2031-12-24
18/6/21,2021-06-18
1999/8/2,1999-08-02
16Mar2005,2005-03-16
16Jul2006,2006-07-16
11/5/22,2022-05-11
28.2.2018,2018-02-28
10:9:2027,2027-09-10
6/2/19,2019-06-02
20 Aug 2033,2033-08-20
28/4/2034,2034-04-28
11 tháng 9 năm 2007,2007-09-11
10-8-2032,2032-08-05
"February 12, 1995",1995-02-12
1992-11-14,1992-11-14
5/15/32,2032-05-15
1 May 2014,2014-05-01
24:9:2008,2008-09-24
10Feb2024,2024-02-10
1-27-23,2023-01-27
27/1/2000,2000-01-27
23/9/20,2020-09-23
Sep 21 96,1996-09-21
6/6/09,2009-06-06
"June 10, 1993",1993-06-10
20/9/20,2020-09-20
24/9/18,2018-09-24
"Jul 25th, 2029",2029-07-25
"August 6, 2028",2028-08-06
14/2-1992,1992-02-14
16/8/1993,1993-08-16
Jul 6 21,2021-07-06
16-9-2013,2013-09-16
26-10-1997,1997-10-26
8/4-2007,2007-02-08
26-9-2025,2025-09-13
25021997,1997-02-25
01122023,2023-12-01
23-9,1998-09-23
36-8-2013,2013-08-18
"Sep 17th, 2025",2025-09-17
4/19/2007,2007-04-19
21 Jun 2018,2018-06-21
8 Aug 1991,1991-08-08
12/18-2030,2030-09-12
14.10.2018,2018-10-14
1st of April 2029,2029-04-01
25/20-2016,2016-10-25
ngày 14 tháng 10 năm 2013,2013-10-14
3/19/1999,1999-03-19
2008/5/28,2008-05-28
16/36/2018,2018-12-16
8-2-93,1993-08-02
4-10-1993,1993-10-04
"Aug 4th, 2001",2001-08-04
22/8-2001,2001-08-22
7 May 1997,1997-05-07
5-8-98,1998-05-08
Sep 21 11,2011-09-21
8 Ju 2005,2005-06-08
1996-3-15,1996-03-15
7 tháng 3 năm 2034,2034-03-07
10/2/2034,2034-02-10
ngày 2 tháng 2 năm 1996,1996-02-02
19-10-2019,2019-10-19
11/14/90,1990-11-14
10/28/2007,2007-10-28
11/13/2024,2024-11-13
ngày 13 tháng 12 năm 2016,2016-12-13
"March 18, 1990",1990-03-18
May 28 35,2035-05-28
22 De 2010,2010-12-22
19 Oct 2024,2024-10-19
2029/11/13,2029-11-13
"November 26, 2029",2029-11-26
"Mar 13th, 1996",1996-03-13
"Dec 12th, 2009",2009-12-12
1st of January 2002,2002-01-01
2005-5-27,2005-05-27
2000-8-12,2000-08-12
26 December 1991,1991-12-26
1996/2/11,1996-02-11
12/8/17,2017-08-12
27:10:2023,2023-10-27
7/15/2021,2021-05-07
20:6:2027,2027-06-20
25 tháng 6 năm 2024,2024-06-25
10/9/30,2030-09-10
Feb 9 14,2014-02-09
3 Ju 2012,2012-07-03
6.1.2019,2019-01-06
2003/11,2003-11-15
24/2/2021,2021-02-24
2007-6-4,2007-06-04
24 Ja 1999,1999-01-24
21 December 2003,2003-12-21
1/17/2034,2034-01-17
2010-12-23,2010-12-23
2009-12-4,2009-12-04
"Feb 28th, 1997",1997-02-28
1999/4,1999-04-18
8:3:2013,2013-03-08
May 17 30,2030-05-17
2007-6-7,2007-06-07
13/4/18,2018-04-13
10/2/2033,2033-10-02
ngày 12 tháng 8 năm 1997,1997-08-12
4Oct2014,2014-10-04
2/24-2026,2026-12-02
8/8/07,2007-08-08
3/19/2034,2034-03-19
"May 6, 2012",2012-05-06
1999/2,1999-02-03
ngày 12 tháng 3 năm 2025,2025-03-12
7/4/2031,2031-07-04
Apr 16 16,2016-04-16
2022/9,2022-09-13
8/10/2004,2004-10-08
28 tháng 10 năm 1996,1996-10-28
1991-7-3,1991-07-03
10/7/17,2017-10-07
4:12:2012,2012-12-04
Sep 3 02,2002-09-03
16.6.2000,2000-06-16
"Mar 16th, 1999",1999-03-16
21/3/92,1992-03-21
17/7-2006,2006-07-17
"May 18th, 2023",2023-05-18
24:4:2024,2024-04-24
26/1-2011,2011-01-26
"Feb 12th, 1991",1991-02-12
13.5.2002,2002-05-13
7 tháng 12 năm 2005,2005-12-07
23:3:2016,2016-03-23
20/4-2000,2000-04-20
"January 24, 2034",2034-01-24
1-5-09,2009-01-05
26 December 2011,2011-12-26
7Jul2030,2030-07-07
20:4:2026,2026-04-20
ngày 9 tháng 4 năm 2010,2010-04-09
1st of August 2000,2000-08-01
2014/12,2014-12-28
10May2001,2001-05-10
Oct 14 05,2005-10-14
5th of November 2004,2004-11-05
15 June 2012,2012-06-15
16-9,1990-09-16
12/21/2034,2034-12-21
6 Jun 1997,1997-06-06
22 October 2007,2007-10-22
19/6-2026,2026-06-19
17/9/2026,2026-09-17
27.5.2029,2029-05-27
21-3-2025,2025-03-21
27111991,1991-11-27
17/4/97,1997-04-17
24052018,2018-05-24
1996/2,1996-02-13
Jan 27 26,2026-01-27
28.8.2024,2024-08-28
27/6-2025,2025-06-27
8/7/2026,2026-07-08
1/7/2011,2011-01-07
12th of January 2012,2012-01-12
6/27/06,2006-06-27
4/11/2032,2032-11-04
18/10/32,2032-10-18
15 No 1992,1992-11-15
Jan 7 18,2018-01-07
6-18-08,2008-06-18
"April 5, 2033",2033-04-05
Nov 23 28,2028-11-23
25 May 2032,2032-05-25
27/8/34,2034-08-27
22:11:2011,2011-11-22
9/10/1998,1998-09-10
"May 11th, 1998",1998-05-11
Mar 10 01,2001-03-10
22 tháng 9 năm 2028,2028-09-22
18/7/90,1990-07-18
11/1/2023,2023-01-11
19/5/13,2013-05-19
8/20-2024,2024-10-08
23 tháng 10 năm 1992,1992-10-23
26 Ma 2006,2006-03-26
9 Nov 2012,2012-11-09
15 Ju 2030,2030-07-15
May 16 34,2034-05-16
16 June 2010,2010-06-16
02061995,1995-06-02
2007/7,2007-07-22
21th of August 2029,2029-08-21
3-11,2019-11-03
18.7.2024,2024-07-18
16Apr1996,1996-04-16
25/18-2028,2028-09-25
8 Jan 1996,1996-01-08
23/8-2027,2027-08-23
6/2/92,1992-02-06
2034/12,2034-12-21
27:1:2019,2019-01-27
02101991,1991-10-02
1-11-2006,2006-11-01
3/10-2023,2023-10-03
18Apr2015,2015-04-18
17.6.2028,2028-06-17
"Oct 7th, 2015",2015-10-07
25Oct1999,1999-10-25
"Mar 22th, 2020",2020-03-22
ngày 7 tháng 8 năm 2020,2020-08-07
21th of June 2020,2020-06-21
12/25/2017,2017-12-25
27 September 1991,1991-09-27
4th of May 1993,1993-05-04
Mar 24 28,2028-03-24
8/9/2006,2006-03-08
4-10,2032-10-04
13072035,2035-07-13
21 Oct 2035,2035-10-21
23/30/2011,2011-10-23
19th of February 2010,2010-02-19
04032013,2013-03-04
15052014,2014-05-15
26:6:2022,2022-06-26
15012019,2019-01-15
13:9:2018,2018-09-13
2011/6,2011-06-09
24/6/2008,2008-06-24
9th of March 2029,2029-03-09
2 Ja 2000,2000-01-02
14042008,2008-04-14
2021-5-26,2021-05-26
10/7/32,2032-10-07
Feb 13 13,2013-02-13
19:4:2025,2025-04-19
ngày 21 tháng 11 năm 2001,2001-11-21
21Sep2033,2033-09-21
1/6/2001,2001-01-06
12/24/2005,2005-08-12
2010/9,2010-09-09
7:7:2029,2029-07-07
22/18-1997,1997-09-22
2009/8,2009-08-28
"December 17, 2004",2004-12-17
2/28/2016,2016-02-28
5/36/2009,2009-12-05
1-19-01,2001-01-19
25 May 2015,2015-05-25
52-7-2012,2012-07-26
10/12/15,2015-12-10
01082033,2033-08-01
"September 2, 2010",2010-09-02
Dec 20 96,1996-12-20
2001-6-10,2001-06-10
23-12,2002-12-23
27/1/91,1991-01-27
30-10-2002,2002-10-15
17/1-2016,2016-01-17
21/33/2017,2017-11-21
ngày 15 tháng 6 năm 2031,2031-06-15
26/8/2005,2005-08-26
17-1,2031-01-17
5/8/2017,2017-08-05
2024-4-20,2024-04-20
21.5.2008,2008-05-21
7:2:2027,2027-02-07
5th of August 2000,2000-08-05
11/15/2021,2021-11-15
22 April 2003,2003-04-22
5 Au 2025,2025-08-05
4-11-03,2003-04-11
6/4-2015,2015-04-06
16 October 2015,2015-10-16
2016/1/8,2016-01-08
24.12.2032,2032-12-24
22 Oc 2033,2033-10-22
2-17-93,1993-02-17
7/20/1991,1991-07-20
40-1-2032,2032-01-20
"November 7, 2025",2025-11-07
8/12/23,2023-08-12
09021996,1996-02-09
14/4/2009,2009-04-14
2028-7-18,2028-07-18
7-2,2022-02-07
28/5-2019,2019-05-28
8.1.1998,1998-01-08
5 Nov 2028,2028-11-05
3rd of September 1997,1997-09-03
Aug 21 12,2012-08-21
15/3-1991,1991-03-15
Sep 13 13,2013-09-13
18/4/00,2000-04-18
"May 18th, 2017",2017-05-18
5/4/1996,1996-04-05
8/6/23,2023-06-08
1991-7-20,1991-07-20
12.1.1999,1999-01-12
50-2-2008,2008-02-25
6/9-2021,2021-09-06
1-3-2029,2029-03-01
4-6-2003,2003-06-02
17/21/2017,2017-07-17
23-12,2010-12-23
17-3,1994-03-17
13 De 2011,2011-12-13
42-2-2011,2011-02-21
5/12/26,2026-12-05
21.8.1996,1996-08-21
"Oct 14th, 2018",2018-10-14
26 Apr 2004,2004-04-26
7/2-2032,2032-01-07
26.7.2003,2003-07-26
17 Ap 2019,2019-04-17
2/18/2022,2022-02-18
7/8/91,1991-07-08
ngày 11 tháng 10 năm 2034,2034-10-11
2/1-2006,2006-01-02
25-12-2008,2008-12-25
1995-6-6,1995-06-06
3-5-08,2008-03-05
26/7-1992,1992-07-26
21/10/2035,2035-10-21
6th of June 2024,2024-06-06
4 tháng 5 năm 1996,1996-05-04
28/2-2030,2030-02-28
2030/1/3,2030-01-03
27-10-2029,2029-10-27
8 De 2033,2033-12-08
6/18/2008,2008-06-06
9/2/22,2022-02-09
11 Se 2003,2003-09-11
"May 20th, 2001",2001-05-20
17th of July 2028,2028-07-17
2003/7,2003-07-02
26 Jan 1991,1991-01-26
12th of March 2023,2023-03-12
2/10/32,2032-10-02
15:3:2028,2028-03-15
22 July 2001,2001-07-22
May 3 32,2032-05-03
"November 19, 2003",2003-11-19
17 May 1997,1997-05-17
22/5/27,2027-05-22
2008/8/21,2008-08-21
24 Ju 2031,2031-06-24
2029-10-22,2029-10-22
12 Dec 1998,1998-12-12
48-9-2023,2023-09-24
14-10,2014-10-14
12 August 2024,2024-08-12
23-2-2034,2034-02-23
"July 22, 2031",2031-07-22
27-3,1991-03-27
27 October 1991,1991-10-27
1998/7/20,1998-07-20
23/9/08,2008-09-23
2015/10/26,2015-10-26
9 January 2013,2013-01-09
4-1-2011,2011-01-04
4 January 2012,2012-01-04
14 Oc 2026,2026-10-14
20/1/2006,2006-01-20
26th of March 2015,2015-03-26
22/9/1996,1996-03-22
22/18-2030,2030-09-22
"Sep 3rd, 2005",2005-09-03
Aug 15 03,2003-08-15
17072033,2033-07-17
9/3-2027,2027-03-09
1/5/98,1998-05-01
2 Jan 2023,2023-01-02
12/11/21,2021-11-12
25:3:2010,2010-03-25
2020/6,2020-06-15
5/28/2016,2016-05-28
2002/11/22,2002-11-22
14.12.2011,2011-12-14
1997-7-10,1997-07-10
11/5-2010,2010-05-11
25-7-2012,2012-07-25
28/24/2014,2014-08-28
17Apr1992,1992-04-17
20 Ju 2024,2024-07-20
5/11/2015,2015-05-11
10-4-06,2006-10-04
7th of November 2030,2030-11-07
"November 10, 2009",2009-11-10
5 tháng 7 năm 2004,2004-07-05
19/9/2027,2027-03-19
2022/11/17,2022-11-17
22042025,2025-04-22
22.8.2004,2004-08-22
19th of December 2002,2002-12-19
24:6:1996,1996-06-24
8/11/22,2022-11-08
11/10/00,2000-11-10
4-6-2005,2005-06-02
25 May 2026,2026-05-25
12th of October 2010,2010-10-12
7/24/91,1991-07-24
ngày 6 tháng 10 năm 2003,2003-10-06
6/18/2017,2017-06-06
14/10-2025,2025-05-14
2/20-1996,1996-10-02
10 tháng 11 năm 2010,2010-11-10
05061995,1995-06-05
28th of December 2024,2024-12-28
7/24/2007,2007-08-07
23Jul2002,2002-07-23
2008/2/14,2008-02-14
"April 9, 2033",2033-04-09
23-11,2017-11-23
15/9/2007,2007-09-15
23Mar2025,2025-03-23
ngày 18 tháng 6 năm 2030,2030-06-18
9 June 2022,2022-06-09
23th of July 2026,2026-07-23
8/27/2010,2010-09-08
19 tháng 10 năm 1995,1995-10-19
4Feb2032,2032-02-04
19 March 1997,1997-03-19
5:11:2002,2002-11-05
26/2-2011,2011-02-26
9/16-2010,2010-08-09
2034/7/22,2034-07-22
4/1/2004,2004-04-01
19/11/2016,2016-11-19
11/4/20,2020-04-11
20.2.2033,2033-02-20
1999/8,1999-08-01
2 tháng 4 năm 1994,1994-04-02
3/6/15,2015-03-06
2016-12-10,2016-12-10
2012/3,2012-03-14
07102003,2003-10-07
27042032,2032-04-27
5 March 2020,2020-03-05
21 Jun 2033,2033-06-21
09102006,2006-10-09
18/4/34,2034-04-18
11-1,2004-01-11
"Jan 10th, 2004",2004-01-10
9/3-2012,2012-03-09
11 Dec 1995,1995-12-11
5:2:1992,1992-02-05
8-14-90,1990-08-14
8th of October 1993,1993-10-08
11/3/03,2003-11-03
21/1/13,2013-01-21
22-10-2008,2008-10-11
Sep 22 10,2010-09-22
16/2-2007,2007-01-16
26:6:2028,2028-06-26
24Sep2017,2017-09-24
22:12:2009,2009-12-22
2029-7-7,2029-07-07
ngày 10 tháng 10 năm 2019,2019-10-10
3-8-2035,2035-08-03
46-1-2027,2027-01-23
4/12/2024,2024-12-04
ngày 9 tháng 9 năm 2011,2011-09-09
24th of June 2028,2028-06-24
19/9-1991,1991-09-19
17 tháng 2 năm 1999,1999-02-17
"Dec 21th, 2031",2031-12-21
17 Ap 2021,2021-04-17
4.9.1998,1998-09-04
7:5:2022,2022-05-07
9/5-2029,2029-05-09
ngày 22 tháng 4 năm 2034,2034-04-22
15/6/24,2024-06-15
1999/10/9,1999-10-09
9/8/1991,1991-09-08
4/18/2031,2031-06-04
19:4:2024,2024-04-19
19/12/95,1995-12-19
2031-9-10,2031-09-10
2/18-2016,2016-09-02
4/10/2000,2000-10-04
"August 12, 2011",2011-08-12
9 tháng 6 năm 2007,2007-06-09
3/11/1994,1994-03-11
1996/4/9,1996-04-09
25 May 2007,2007-05-25
20-2-1998,1998-02-20
28 February 2021,2021-02-28
13-3,2012-03-13
Oct 7 33,2033-10-07
11081992,1992-08-11
ngày 4 tháng 9 năm 2001,2001-09-04
12/7/2026,2026-12-07
9th of November 1994,1994-11-09
3/10-2004,2004-10-03
2023-11-13,2023-11-13
3:5:2003,2003-05-03
8:8:1990,1990-08-08
1.6.1999,1999-06-01
1/8-1993,1993-08-01
22032016,2016-03-22
"February 2, 2033",2033-02-02
10/3/2011,2011-10-03
24 Jul 2015,2015-07-24
28:7:2020,2020-07-28
ngày 12 tháng 9 năm 2026,2026-09-12
24/12/00,2000-12-24
44-5-1994,1994-05-22
16 January 2000,2000-01-16
2029/11/21,2029-11-21
20/4/32,2032-04-20
2/12-2023,2023-06-02
"August 2, 2023",2023-08-02
10-9-95,1995-10-09
4/17/2022,2022-04-17
1997/12,1997-12-13
32-1-2014,2014-01-16
14/4/2007,2007-04-14
2008/2/28,2008-02-28
ngày 16 tháng 5 năm 1991,1991-05-16
2033-5-5,2033-05-05
27 Nov 2033,2033-11-27
23.6.2004,2004-06-23
7:7:1992,1992-07-07
14 July 1991,1991-07-14
8/2-1994,1994-01-08
3 tháng 9 năm 2001,2001-09-03
2-13-12,2012-02-13
15052024,2024-05-15
18-7-2026,2026-07-09
8-28-95,1995-08-28
18/12-2019,2019-12-18
5/12-2014,2014-12-05
2024/1/17,2024-01-17
26/5-2034,2034-05-26
"Sep 14th, 2023",2023-09-14
24-7-2008,2008-07-12
ngày 6 tháng 4 năm 2003,2003-04-06
2/24/2026,2026-08-02
2011/4,2011-04-06
ngày 16 tháng 11 năm 2022,2022-11-16
5-25-98,1998-05-25
"August 11, 2023",2023-08-11
25 tháng 5 năm 1995,1995-05-25
2015/3,2015-03-01
7.11.2014,2014-11-07
23/12/28,2028-12-23
3-5-16,2016-03-05
13:1:2034,2034-01-13
7 tháng 2 năm 2031,2031-02-07
28/4/30,2030-04-28
12/11-2012,2012-11-12
13th of May 2016,2016-05-13
2006/8,2006-08-13
2009/1/10,2009-01-10
20-7-1995,1995-07-20
ngày 8 tháng 11 năm 1993,1993-11-08
15/30/1992,1992-10-15
27/4/1999,1999-04-27
25/6/26,2026-06-25
13:7:2016,2016-07-13
12-10,1993-10-12
3/11-2003,2003-11-03
27th of October 2023,2023-10-27
28 tháng 11 năm 2026,2026-11-28
22Jul2028,2028-07-22
ngày 16 tháng 5 năm 2031,2031-05-16
2014-5-4,2014-05-04
ngày 14 tháng 3 năm 2025,2025-03-14
15 No 2004,2004-11-15
26th of June 2011,2011-06-26
23-8-2019,2019-08-23
24 tháng 3 năm 2003,2003-03-24
6/11/2002,2002-06-11
9/11/2020,2020-11-09
7:8:1996,1996-08-07
2004/5/13,2004-05-13
8-22-95,1995-08-22
2005/3,2005-03-24
12-10-2018,2018-10-12
7/1/00,2000-07-01
20041998,1998-04-20
27Aug2008,2008-08-27
14/6/1991,1991-06-14
2024/7,2024-07-28
27 May 2005,2005-05-27
15 August 2016,2016-08-15
11/5/06,2006-05-11
20/11/2010,2010-11-20
ngày 16 tháng 4 năm 1990,1990-04-16
ngày 16 tháng 11 năm 2026,2026-11-16
22-2,2025-02-22
08062026,2026-06-08
9th of October 1990,1990-10-09
12-23-17,2017-12-23
3-4,1990-04-03
7 Ap 2017,2017-04-07
1994/5/13,1994-05-13
17 May 2025,2025-05-17
17/3/2009,2009-01-17
11:10:2033,2033-10-11
26:8:2015,2015-08-26
Feb 8 16,2016-02-08
2023/4/16,2023-04-16
12/12/2007,2007-04-12
13-10,2004-10-13
17/11/09,2009-11-17
1st of February 1997,1997-02-01
2002-12-5,2002-12-05
12Oct2001,2001-10-12
26-4,1996-04-26
18/30/2010,2010-10-18
1 Jun 2028,2028-06-01
11/8/2020,2020-11-08
2033/8/3,2033-08-03
2029/2/17,2029-02-17
13-2,2024-02-13
14:7:1990,1990-07-14
3/1/98,1998-01-03
28-5-1996,1996-05-14
10/12/16,2016-12-10
2021/12,2021-12-22
4/11/13,2013-11-04
24-10-2007,2007-10-24
2001-6-23,2001-06-23
25 July 2010,2010-07-25
25:1:1998,1998-01-25
28-7-1998,1998-07-28
21/10/2019,2019-10-21
6 Se 1996,1996-09-06
13th of February 1993,1993-02-13
13 tháng 11 năm 1995,1995-11-13
27/3-2031,2031-03-27
13/12/30,2030-12-13
"Dec 28th, 2003",2003-12-28
1-12-90,1990-01-12
4/36/2008,2008-12-04
9.8.2010,2010-08-09
"January 19, 2000",2000-01-19
18 Au 1997,1997-08-18
17-2-2019,2019-02-17
"Jul 22th, 2024",2024-07-22
2017/8/20,2017-08-20
3/5/2022,2022-05-03
12/7/34,2034-07-12
7/5/2017,2017-07-05
23 tháng 12 năm 2019,2019-12-23
4/12-1996,1996-12-04
52-3-2002,2002-03-26
3 Feb 2018,2018-02-03
17/2-2002,2002-02-17
16/10-2033,2033-05-16
"Dec 13th, 2026",2026-12-13
11-2-34,2034-11-02
7/12-1995,1995-12-07
8/10-2010,2010-10-08
11-9-28,2028-11-09
14 Nov 2000,2000-11-14
25/9-1993,1993-09-25
4/24/2026,2026-04-24
15/27/2027,2027-09-15
Mar 1 90,1990-03-01
1992/2/28,1992-02-28
5/5/09,2009-05-05
8/8/28,2028-08-08
4-3-2008,2008-03-04
12/10/21,2021-12-10
10102035,2035-10-10
10/6-2012,2012-03-10
21Aug2033,2033-08-21
13 June 2002,2002-06-13
12/33/2022,2022-11-12
1996-11-27,1996-11-27
42-11-2018,2018-11-21
24.3.1995,1995-03-24
20-9-1991,1991-09-20
10-4,2007-04-10
24/10/1997,1997-10-24
38-11-1995,1995-11-19
ngày 16 tháng 9 năm 2015,2015-09-16
"September 19, 2015",2015-09-19
12/12-1996,1996-12-12
2019/12,2019-12-15
Jan 16 21,2021-01-16
2016/7,2016-07-27
17:4:1994,1994-04-17
9/7/90,1990-07-09
2034/1,2034-01-05
Jul 2 11,2011-07-02
14062027,2027-06-14
19/2-2034,2034-02-19
20/27/1992,1992-09-20
17/10-2020,2020-10-17
ngày 9 tháng 10 năm 2019,2019-10-09
2-5-2017,2017-05-01
19-6-2008,2008-06-19
14/12/2022,2022-12-14
7/3/2003,2003-07-03
2031/4/27,2031-04-27
ngày 22 tháng 5 năm 2028,2028-05-22
12/4-2033,2033-04-12
11/7-1997,1997-07-11
"August 20, 2007",2007-08-20
2029/6,2029-06-26
1/30/1993,1993-10-01
18/10-2023,2023-10-18
2010-2-12,2010-02-12
11/6-1992,1992-03-11
6/7/35,2035-07-06
2001-10-13,2001-10-13
22122009,2009-12-22
16 Oc 2014,2014-10-16
10:6:2004,2004-06-10
25th of March 2011,2011-03-25
1/27/2026,2026-09-01
21-9,2035-09-21
15:8:2018,2018-08-15
8/18/2023,2023-06-08
7:4:2000,2000-04-07
22/11-2004,2004-11-22
10/21/1994,1994-10-21
16-10-2031,2031-10-16
26/1-2016,2016-01-26
11:7:2029,2029-07-11
17:5:2013,2013-05-17
12-1-2006,2006-01-06
18/9-2021,2021-09-18
"Nov 8th, 2000",2000-11-08
2-28-01,2001-02-28
3 Fe 1996,1996-02-03
10-8,1996-08-10
14-2-2019,2019-02-07
20 Ma 1999,1999-03-20
27-11-2026,2026-11-27
ngày 18 tháng 12 năm 2000,2000-12-18
6-10-14,2014-06-10
20/6/90,1990-06-20
27/1/1995,1995-01-27
"December 14, 1992",1992-12-14
3Nov2026,2026-11-03
2000-1-25,2000-01-25
9/10-2032,2032-05-09
7-26-21,2021-07-26
9/3/34,2034-03-09
10th of December 2033,2033-12-10
6-7-2021,2021-07-03
2032/6/17,2032-06-17
4-1-18,2018-04-01
May 2 15,2015-05-02
12 July 2019,2019-07-12
15/15/2021,2021-05-15
"Aug 21th, 1990",1990-08-21
ngày 28 tháng 5 năm 1993,1993-05-28
12/13/14,2014-12-13
25/5/2035,2035-05-25
12 February 1991,1991-02-12
15/3/2003,2003-03-15
6-1-2014,2014-01-06
14/2-2028,2028-01-14
27/1-2000,2000-01-27
12th of January 2024,2024-01-12
2012/10/3,2012-10-03
24-11-1992,1992-11-24
17 Oct 2033,2033-10-17
21/10/99,1999-10-21
17-2,2027-02-17
"April 12, 2031",2031-04-12
10 Ju 2033,2033-06-10
20/3/2022,2022-03-20
12-27-01,2001-12-27
26/1/2012,2012-01-26
28/6/35,2035-06-28
26-1-2006,2006-01-13
9/1/1993,1993-09-01
1-6-2003,2003-06-01
2032/6,2032-06-16
8-18-35,2035-08-18
24/10-2023,2023-05-24
2025/9,2025-09-01
2/18/2015,2015-02-18
"January 9, 2023",2023-01-09
6-4-2033,2033-04-03
25Jan2006,2006-01-25
"March 10, 2012",2012-03-10
2005-3-14,2005-03-14
6:9:2003,2003-09-06
13/16-2034,2034-08-13
2:4:2010,2010-04-02
18Dec2005,2005-12-18
"Jan 15th, 2026",2026-01-15
22 No 1996,1996-11-22
20:9:1994,1994-09-20
3:12:2029,2029-12-03
25-1,1998-01-25
2/4-2019,2019-04-02
20Oct2034,2034-10-20
1993/2,1993-02-14
17/8-1996,1996-08-17
19 Apr 2025,2025-04-19
16th of August 2008,2008-08-16
25 November 1992,1992-11-25
"Nov 4th, 2002",2002-11-04
"August 14, 2032",2032-08-14
22/21/2007,2007-07-22
8 tháng 10 năm 2028,2028-10-08
1/6/2025,2025-02-01
27th of May 2009,2009-05-27
11th of December 2000,2000-12-11
9 De 2031,2031-12-09
4/25/18,2018-04-25
12/10/1991,1991-10-12
15:6:2012,2012-06-15
25/7/33,2033-07-25
7 tháng 6 năm 2022,2022-06-07
24May1993,1993-05-24
2033-7-5,2033-07-05
11th of June 2025,2025-06-11
50-10-2024,2024-10-25
10-2-2019,2019-02-05
2004/11,2004-11-19
21 tháng 4 năm 2034,2034-04-21
5 Feb 1991,1991-02-05
2017/7/6,2017-07-06
17082030,2030-08-17
17:12:2021,2021-12-17
1994-7-22,1994-07-22
"February 20, 2017",2017-02-20
21/6/2030,2030-02-21
5/8-2012,2012-08-05
24th of March 1998,1998-03-24
2004/3,2004-03-10
9/6-2006,2006-03-09
22/10/00,2000-10-22
"Jan 21th, 2035",2035-01-21
9/22/29,2029-09-22
19 May 1991,1991-05-19
28 Oc 2023,2023-10-28
19-6-1993,1993-06-19
2-8-98,1998-02-08
14/18/2026,2026-06-14
25/8-2013,2013-08-25
19-9,1993-09-19
23th of May 1991,1991-05-23
5-14-91,1991-05-14
3/12-2001,2001-12-03
6/4/1992,1992-06-04
17/33/1992,1992-11-17
2023-2-14,2023-02-14
16th of February 2027,2027-02-16
24 Mar 1992,1992-03-24
23/8-2002,2002-08-23
8/18-2009,2009-09-08
2-18-34,2034-02-18
15/5/02,2002-05-15
7-10-2034,2034-10-07
7/13/2010,2010-07-13
8/18/2032,2032-06-08
14-9-2031,2031-09-14
"Jun 19th, 2023",2023-06-19
3 June 2018,2018-06-03
18/9/2011,2011-09-18
"September 18, 1999",1999-09-18
"November 19, 2011",2011-11-19
5-6-2001,2001-06-05
22-4-2016,2016-04-22
21012025,2025-01-21
9/16-2020,2020-08-09
42-10-2019,2019-10-21
3 tháng 5 năm 2003,2003-05-03
5-9-31,2031-05-09
7th of May 1999,1999-05-07
2-1-2005,2005-01-02
1 January 2022,2022-01-01
1998-8-21,1998-08-21
16 tháng 9 năm 2020,2020-09-16
10 Mar 2005,2005-03-10
38-8-1999,1999-08-19
1/9/04,2004-09-01
24th of November 2035,2035-11-24
2022/12,2022-12-12
5 Se 2008,2008-09-05
26 Dec 2013,2013-12-26
4/33/2001,2001-11-04
2005/5,2005-05-07
09111990,1990-11-09
2008/7/2,2008-07-02
15/5-2006,2006-05-15
5/9/2026,2026-05-09
22/2/01,2001-02-22
5/2/23,2023-05-02
23th of May 1993,1993-05-23
3/5/09,2009-05-03
18 Mar 2006,2006-03-18
17 Ma 2029,2029-05-17
13/12/99,1999-12-13
6/25/2004,2004-06-25
1 Ju 2033,2033-07-01
12072017,2017-07-12
1/9/08,2008-09-01
9/12/2002,2002-04-09
11/3/2000,2000-03-11
15 Apr 2020,2020-04-15
23062022,2022-06-23
24/11-2008,2008-11-24
05072012,2012-07-05
14 January 2000,2000-01-14
"July 11, 2004",2004-07-11
21Jun1991,1991-06-21
17 August 2004,2004-08-17
13/1/15,2015-01-13
14/5/23,2023-05-14
2012/1/4,2012-01-04
5:12:2034,2034-12-05
3/20-2027,2027-10-03
6-23-15,2015-06-23
14 tháng 6 năm 2013,2013-06-14
17/10-2024,2024-10-17
2019/5,2019-05-12
"June 28, 1992",1992-06-28
24.12.1997,1997-12-24
8 Oct 2022,2022-10-08
8 Ap 1990,1990-04-08
12/1-2007,2007-01-12
May 25 21,2021-05-25
24th of November 1990,1990-11-24
6/13/30,2030-06-13
8/14/94,1994-08-14
May 14 29,2029-05-14
01112032,2032-11-01
19/4/14,2014-04-19
4/7-1990,1990-07-04
17:5:2002,2002-05-17
ngày 13 tháng 8 năm 2001,2001-08-13
Jan 25 15,2015-01-25
22/3-2023,2023-03-22
28/30/2027,2027-10-28
"Dec 7th, 2002",2002-12-07
44-4-2006,2006-04-22
1-10-29,2029-01-10
16 Mar 2025,2025-03-16
28-4-2011,2011-04-28
1 Dec 1993,1993-12-01
9/20/08,2008-09-20
2001/10,2001-10-10
4-11-03,2003-04-11
2 tháng 2 năm 2029,2029-02-02
"September 19, 1993",1993-09-19
2/18/2028,2028-06-02
24/15/2014,2014-05-24
11042005,2005-04-11
19.11.2027,2027-11-19
8/12/24,2024-12-08
5/5/2008,2008-05-05
Jul 22 26,2026-07-22
3 Feb 2023,2023-02-03
"October 18, 2018",2018-10-18
22112027,2027-11-22
14072003,2003-07-14
1992-9-10,1992-09-10
05112003,2003-11-05
4:11:2024,2024-11-04
24/7-2010,2010-07-24
27/11/94,1994-11-27
3-9,2025-09-03
13/11-1995,1995-11-13
23 September 1999,1999-09-23
25-1-2020,2020-01-25
1991-1-2,1991-01-02
3 Mar 2029,2029-03-03
17 Jun 2013,2013-06-17
7Apr2028,2028-04-07
5.5.1995,1995-05-05
19/5-2002,2002-05-19
9/8-2016,2016-04-09
1-11,1996-11-01
8/2-2030,2030-02-08
19/1-2010,2010-01-19
4 tháng 5 năm 2025,2025-05-04
20/12/2001,2001-04-20
2 Jun 1999,1999-06-02
24/3-2005,2005-03-24
15 tháng 7 năm 2027,2027-07-15
3-4,2010-04-03
8/16-2015,2015-08-08
1/11/97,1997-11-01
16-2-2010,2010-02-16
1/2/1999,1999-02-01
23-12,2009-12-23
"December 24, 1995",1995-12-24
3rd of August 2028,2028-08-03
13/1/24,2024-01-13
"August 15, 2007",2007-08-15
18/1/07,2007-01-18
5/18-2011,2011-09-05
2:2:2035,2035-02-02
ngày 28 tháng 12 năm 2005,2005-12-28
9/15/2001,2001-09-15
28/1-2029,2029-01-28
46-1-2021,2021-01-23
2028/12/3,2028-12-03
2 Se 2008,2008-09-02
10.4.1992,1992-04-10
10/14/25,2025-10-14
5/12/20,2020-05-12
20th of June 2018,2018-06-20
2009-4-8,2009-04-08
1998-12-20,1998-12-20
2019/1,2019-01-09
12/9-1997,1997-09-12
5.12.2028,2028-12-05
"Oct 25th, 2006",2006-10-25
13-5-2015,2015-05-13
"Oct 27th, 1992",1992-10-27
19/10-1992,1992-10-19
2026/8,2026-08-10
20/7/2009,2009-07-20
3/4-1997,1997-02-03
9/2/06,2006-02-09
15 tháng 10 năm 2009,2009-10-15
19/11/35,2035-11-19
1990/1/8,1990-01-08
"Jun 28th, 2033",2033-06-28
26 tháng 10 năm 1995,1995-10-26
ngày 17 tháng 10 năm 2017,2017-10-17
22 Au 2015,2015-08-22
18-5-1996,1996-05-18
ngày 19 tháng 10 năm 2011,2011-10-19
11Aug2011,2011-08-11
Sep 16 34,2034-09-16
12 tháng 2 năm 1999,1999-02-12
21/2-1997,1997-02-21
23 November 2000,2000-11-23
20/1-2029,2029-01-20
11/11/09,2009-11-11
8/30/2011,2011-10-08
26 Ma 1992,1992-03-26
6-8-15,2015-06-08
14/18/1993,1993-06-14
14.2.2034,2034-02-14
22 November 2013,2013-11-22
17/6/26,2026-06-17
17052011,2011-05-17
21 Aug 2018,2018-08-21
"Aug 7th, 1990",1990-08-07
ngày 22 tháng 11 năm 1994,1994-11-22
16/4/18,2018-04-16
20/3/00,2000-03-20
7:3:2006,2006-03-07
13/9-2023,2023-09-13
28-2-2023,2023-02-28
28 May 2005,2005-05-28
May 14 12,2012-05-14
20 Fe 2029,2029-02-20
23:8:2006,2006-08-23
20th of December 2015,2015-12-20
04111993,1993-11-04
6/18-2013,2013-09-06
27.9.2012,2012-09-27
12-3-97,1997-12-03
2034/2,2034-02-13
2010-3-11,2010-03-11
5/18/20,2020-05-18
10/2-2011,2011-02-10
Apr 24 23,2023-04-24
2031/5/7,2031-05-07
2030/10,2030-10-04
26-9,2033-09-26
22:6:2006,2006-06-22
9/3-2018,2018-03-09
21 tháng 5 năm 2012,2012-05-21
23/6-2009,2009-06-23
1.3.2027,2027-03-01
"February 27, 1996",1996-02-27
25-3,2015-03-25
7/9-2029,2029-09-07
4/11-2014,2014-11-04
13th of June 1995,1995-06-13
23Jan2024,2024-01-23
ngày 19 tháng 3 năm 2026,2026-03-19
26031997,1997-03-26
2025/12,2025-12-16
12/30/2035,2035-10-12
2003/11/19,2003-11-19
27/10/20,2020-10-27
"November 24, 2017",2017-11-24
12/27/2014,2014-12-27
34-8-2003,2003-08-17
5/9/33,2033-09-05
1997/11,1997-11-03
14/11-2002,2002-11-14
23/7-2008,2008-07-23
13071998,1998-07-13
3/12/2016,2016-03-12
20 September 2017,2017-09-20
6/23/2025,2025-06-23
"February 9, 1992",1992-02-09
28th of October 2023,2023-10-28
5 Oc 2006,2006-10-05
Dec 21 11,2011-12-21
May 11 03,2003-05-11
"July 8, 2012",2012-07-08
23:2:2027,2027-02-23
26051998,1998-05-26
3/12/19,2019-12-03
1997/8,1997-08-16
11/16/2030,2030-11-16
12Nov2000,2000-11-12
"January 10, 2023",2023-01-10
2002-2-9,2002-02-09
23042006,2006-04-23
2-15-20,2020-02-15
2009/2,2009-02-08
2022/1,2022-01-23
27/12-2024,2024-06-27
6/19/2016,2016-06-19
16 May 2025,2025-05-16
1 Se 2006,2006-09-01
28/6-2008,2008-06-28
3-9,1994-09-03
02062000,2000-06-02
ngày 2 tháng 8 năm 2006,2006-08-02
54-4-1990,1990-04-27
Nov 9 34,2034-11-09
Sep 8 20,2020-09-08
19/1/29,2029-01-19
13-6,1992-06-13
12-1-2019,2019-01-12
20 tháng 1 năm 1995,1995-01-20
26.1.2001,2001-01-26
20-1-1992,1992-01-20
2025/2/10,2025-02-10
8th of September 1999,1999-09-08
6/19/2021,2021-06-19
3/20/1996,1996-03-20
ngày 23 tháng 10 năm 1999,1999-10-23
"Jun 17th, 2035",2035-06-17
1990/9,1990-09-08
12/33/1997,1997-11-12
3 Jan 1999,1999-01-03
2010/10,2010-10-06
28082018,2018-08-28
18 tháng 5 năm 2020,2020-05-18
2034/4/15,2034-04-15
Oct 27 02,2002-10-27
8/3-2010,2010-03-08
2 No 2025,2025-11-02
11 Au 2011,2011-08-11
12/36/2009,2009-12-12
"Jan 26th, 2000",2000-01-26
17-1-2004,2004-01-17
9 Oct 2027,2027-10-09
2.4.2011,2011-04-02
15/30/1991,1991-10-15
03092002,2002-09-03
Dec 16 32,2032-12-16
2-10-93,1993-02-10
8-2-2013,2013-02-04
1/36/2022,2022-12-01
17071990,1990-07-17
2003-9-6,2003-09-06
7/2-2025,2025-02-07
12-14-09,2009-12-14
4/3/19,2019-03-04
20/18-1991,1991-09-20
17.2.2010,2010-02-17
28-10-2011,2011-10-28
6/13/13,2013-06-13
23th of January 2008,2008-01-23
5 Se 2019,2019-09-05
2 Jun 2008,2008-06-02
19 March 2015,2015-03-19
21/11-1995,1995-11-21
9/23/1993,1993-09-23
3 Sep 2021,2021-09-03
3-23-16,2016-03-23
11/9/2031,2031-09-11
Jul 1 20,2020-07-01
17-12-2025,2025-12-17
18 Se 2002,2002-09-18
2024-10-3,2024-10-03
2013-11-7,2013-11-07
15:12:2006,2006-12-15
21Jan2023,2023-01-21
12/17/2013,2013-12-17
6/33/1998,1998-11-06
18/11-1993,1993-11-18
2000/7/1,2000-07-01
15/11-2009,2009-11-15
6/33/2017,2017-11-06
14 July 2020,2020-07-14
2/1/11,2011-02-01
"July 12, 2012",2012-07-12
"Feb 22th, 2002",2002-02-22
11/5-1997,1997-05-11
23-4,2033-04-23
18/10-1990,1990-10-18
1990/3,1990-03-11
10/25/97,1997-10-25
Mar 5 26,2026-03-05
18-11-1998,1998-11-09
15 tháng 3 năm 2030,2030-03-15
"Dec 2nd, 2017",2017-12-02
2003/6,2003-06-07
25-12-2009,2009-12-25
1.1.2014,2014-01-01
2027/1,2027-01-21
19 Feb 2016,2016-02-19
20/20-2027,2027-10-20
21-11-2021,2021-11-21
1995/12/24,1995-12-24
"Dec 16th, 2003",2003-12-16
5/1-2015,2015-01-05
14/9-1994,1994-09-14
3.3.2031,2031-03-03
ngày 5 tháng 10 năm 2035,2035-10-05
10/9/2017,2017-03-10
"February 12, 2031",2031-02-12
14-9-1996,1996-09-07
10-2-2033,2033-02-10
3 April 2002,2002-04-03
21/12/1995,1995-04-21
5/4-2033,2033-04-05
7/3/00,2000-07-03
16/12-2022,2022-06-16
2033/11,2033-11-27
2024/8/14,2024-08-14
21 Se 2023,2023-09-21
16:12:2017,2017-12-16
2-9-27,2027-02-09
ngày 6 tháng 12 năm 2014,2014-12-06
04112029,2029-11-04
"July 11, 2008",2008-07-11
23 De 1991,1991-12-23
17 De 2013,2013-12-17
12/4-2020,2020-04-12
3/6-2005,2005-03-03
Nov 11 22,2022-11-11
26 January 2021,2021-01-26
"June 20, 2032",2032-06-20
"Aug 23th, 2010",2010-08-23
16/2/35,2035-02-16
12/15/2018,2018-12-15
1996/4/28,1996-04-28
3:4:1990,1990-04-03
19 Sep 2005,2005-09-19
9 Ma 1993,1993-03-09
9:5:2028,2028-05-09
"October 22, 2033",2033-10-22
16.8.2001,2001-08-16
04022002,2002-02-04
12-3-1999,1999-03-06
9/25/1994,1994-09-25
46-2-2004,2004-02-23
1/10/2016,2016-10-01
14:8:2031,2031-08-14
2008-3-2,2008-03-02
19/1-2020,2020-01-19
2033/3/28,2033-03-28
28 De 2017,2017-12-28
1/4/1991,1991-04-01
2025/5,2025-05-23
17/10/02,2002-10-17
2017/7,2017-07-05
5 De 1996,1996-12-05
8th of July 2032,2032-07-08
3-8,2000-08-03
25 tháng 3 năm 1992,1992-03-25
9/23/1996,1996-09-23
28th of July 2028,2028-07-28
"Aug 5th, 2020",2020-08-05
26/10-1995,1995-05-26
6/12/2026,2026-06-12
"November 9, 2034",2034-11-09
3/11/01,2001-11-03
Nov 17 90,1990-11-17
15/11-2018,2018-11-15
20/10/35,2035-10-20
16/10/32,2032-10-16
19122035,2035-12-19
2023/1/4,2023-01-04
3 tháng 9 năm 2019,2019-09-03
4.8.1999,1999-08-04
9 Apr 1996,1996-04-09
6th of February 2005,2005-02-06
18-5-2012,2012-05-18
1 Ja 1994,1994-01-01
02102015,2015-10-02
26-1-1996,1996-01-13
2022-11-16,2022-11-16
10-8-2010,2010-08-05
12 April 1998,1998-04-12
13th of November 2003,2003-11-13
26 Au 2008,2008-08-26
9/2/2005,2005-09-02
Jul 3 29,2029-07-03
9-6-2033,2033-06-09
27:9:1999,1999-09-27
15-8,2015-08-15
11 tháng 8 năm 2017,2017-08-11
04121998,1998-12-04
21 Ju 1999,1999-06-21
"June 19, 2002",2002-06-19
10/2/97,1997-10-02
12.12.2004,2004-12-12
10-7-2028,2028-07-05
Dec 16 26,2026-12-16
1998-1-11,1998-01-11
1993/5,1993-05-24
17/3-2014,2014-03-17
3-16-18,2018-03-16
23 Jul 2029,2029-07-23
25:4:2006,2006-04-25
15/12-2023,2023-12-15
15/4/2019,2019-04-15
44-1-1999,1999-01-22
10 Ju 2011,2011-06-10
17/11-1995,1995-11-17
10/5-1998,1998-05-10
8/10-2008,2008-05-08
2030/9,2030-09-27
8-3-08,2008-08-03
2:10:2021,2021-10-02
2014/3/17,2014-03-17
2.11.2002,2002-11-02
25 August 1999,1999-08-25
18/24-1994,1994-12-18
"Apr 9th, 2021",2021-04-09
11/7/01,2001-11-07
6/2/35,2035-06-02
12 December 2011,2011-12-12
15.3.2027,2027-03-15
"September 20, 2028",2028-09-20
11032020,2020-03-11
7-18-28,2028-07-18
1/12/2031,2031-04-01
10 September 1991,1991-09-10
19/5/12,2012-05-19
26-4-2033,2033-04-13
5 tháng 5 năm 2025,2025-05-05
3 tháng 10 năm 1994,1994-10-03
12 tháng 2 năm 2012,2012-02-12
18011991,1991-01-18
5/14/2013,2013-05-14
Nov 2 11,2011-11-02
18 tháng 6 năm 2001,2001-06-18
26 tháng 1 năm 2028,2028-01-26
"March 18, 1997",1997-03-18
22 tháng 12 năm 2009,2009-12-22
9 July 2028,2028-07-09
2023-8-1,2023-08-01
10 Dec 2022,2022-12-10
21th of February 2034,2034-02-21
27 Jan 2018,2018-01-27
ngày 17 tháng 5 năm 2008,2008-05-17
25.6.2011,2011-06-25
2021-11-23,2021-11-23
19-2,2025-02-19
3/5/2005,2005-05-03
21/12-1996,1996-06-21
23-3,2026-03-23
11-4,2034-04-11
17/5-2020,2020-05-17
12/13/2009,2009-12-13
22 tháng 10 năm 1999,1999-10-22
21/18/2027,2027-06-21
21th of October 2009,2009-10-21
3/8/2032,2032-03-08
16/10-2025,2025-10-16
6.9.2013,2013-09-06
1992/11,1992-11-26
ngày 13 tháng 10 năm 2025,2025-10-13
24092021,2021-09-24
5th of December 2002,2002-12-05
3.10.2025,2025-10-03
10 tháng 10 năm 2014,2014-10-10
8/17/22,2022-08-17
7/21/2022,2022-07-21
22 De 2002,2002-12-22
20th of February 2000,2000-02-20
22 Jun 2028,2028-06-22
1.5.2020,2020-05-01
13/6/2008,2008-02-13
8/2/1993,1993-02-08
"November 28, 1997",1997-11-28
6Jul2012,2012-07-06
11:11:1999,1999-11-11
22/7/25,2025-07-22
1/36/1993,1993-12-01
"September 22, 2006",2006-09-22
18 Ju 2001,2001-06-18
ngày 6 tháng 12 năm 2019,2019-12-06
"Jan 12th, 2004",2004-01-12
4.7.2023,2023-07-04
9-23-02,2002-09-23
2018-2-25,2018-02-25
13/3/12,2012-03-13
17/8-2009,2009-04-17
18 June 2034,2034-06-18
25/11/1998,1998-11-25
17/8-2022,2022-04-17
19 July 2005,2005-07-19
01052005,2005-05-01
24 Ma 1998,1998-03-24
27 tháng 2 năm 2023,2023-02-27
15 Ju 1999,1999-06-15
Feb 6 21,2021-02-06
22/36/2017,2017-12-22
ngày 19 tháng 4 năm 2025,2025-04-19
26/10/2013,2013-10-26
18.12.2005,2005-12-18
16-7,2024-07-16
7Dec1990,1990-12-07
9 July 2019,2019-07-09
ngày 14 tháng 5 năm 2012,2012-05-14
27.3.2010,2010-03-27
13 tháng 9 năm 2011,2011-09-13
17.8.2027,2027-08-17
8/30/2005,2005-10-08
2/24/09,2009-02-24
24-5-1990,1990-05-24
27/2/2025,2025-02-27
7/6/2019,2019-02-07
26Sep1998,1998-09-26
7/8/96,1996-08-07
ngày 11 tháng 8 năm 2001,2001-08-11
17/9/20,2020-09-17
21082020,2020-08-21
2015/4/6,2015-04-06
10-4-24,2024-10-04
8/19/2028,2028-08-19
3/21/33,2033-03-21
12/11/2028,2028-11-12
27-8,2002-08-27
ngày 19 tháng 5 năm 1990,1990-05-19
"Feb 11th, 2021",2021-02-11
12 tháng 8 năm 2004,2004-08-12
28/6/95,1995-06-28
19 April 2004,2004-04-19
27/10-1990,1990-05-27
ngày 7 tháng 11 năm 2006,2006-11-07
1st of June 2003,2003-06-01
6/6-1991,1991-06-06
11/8-2022,2022-08-11
19 Ma 2033,2033-03-19
18-11-2008,2008-11-09
12/6-2000,2000-06-12
ngày 9 tháng 12 năm 2017,2017-12-09
1991/7,1991-07-11
2013/7,2013-07-07
1991-6-12,1991-06-12
9Oct2010,2010-10-09
19/12-2027,2027-06-19
2/5/90,1990-05-02
21/11-2022,2022-11-21
7 tháng 7 năm 2014,2014-07-07
22:11:2000,2000-11-22
2-20-14,2014-02-20
26 Ja 1990,1990-01-26
24 Nov 2017,2017-11-24
26:2:2001,2001-02-26
1995/5/28,1995-05-28
11/12/01,2001-12-11
27th of March 1990,1990-03-27
1991/12/7,1991-12-07
"May 6, 2009",2009-05-06
2Jul1999,1999-07-02
1/6/2001,2001-01-06
5/4-2019,2019-04-05
2003/5,2003-05-03
3-12-2001,2001-12-03
10-8-14,2014-10-08
40-10-2029,2029-10-20
9-14-24,2024-09-14
17 June 2020,2020-06-17
14-11-2030,2030-11-07
1/6/00,2000-01-06
15/6/2013,2013-02-15
27/3-2011,2011-03-27
25/6/27,2027-06-25
16-12-2002,2002-12-16
21/9-1994,1994-09-21
28th of September 2029,2029-09-28
7.2.1992,1992-02-07
5.12.2015,2015-12-05
22.8.2004,2004-08-22
27:10:2023,2023-10-27
28 Jul 2022,2022-07-28
17th of July 2010,2010-07-17
14/7/2010,2010-07-14
11/10-2003,2003-10-11
16Sep2016,2016-09-16
2-6-2030,2030-06-01
Mar 6 02,2002-03-06
21 tháng 5 năm 2004,2004-05-21
7 Ma 2025,2025-05-07
24-4-2032,2032-04-24
22/9/25,2025-09-22
4-19-33,2033-04-19
2-6-20,2020-02-06
18/4/1991,1991-04-18
7 tháng 6 năm 1998,1998-06-07
42-3-2025,2025-03-21
2 tháng 4 năm 2023,2023-04-02
2018-10-9,2018-10-09
21-5-2014,2014-05-21
20:2:1992,1992-02-20
21 November 2007,2007-11-21
Sep 2 14,2014-09-02
1990/6,1990-06-02
28/18/2000,2000-06-28
3-1-2030,2030-01-03
ngày 5 tháng 9 năm 2020,2020-09-05
19/1/1991,1991-01-19
2019-8-5,2019-08-05
6:2:2003,2003-02-06
22 June 2034,2034-06-22
25th of September 2008,2008-09-25
2015-5-19,2015-05-19
21 tháng 4 năm 2035,2035-04-21
Feb 3 20,2020-02-03
4-1-2013,2013-01-02
1995/12,1995-12-07
23:1:2005,2005-01-23
12/4/21,2021-12-04
9 Fe 2001,2001-02-09
25112024,2024-11-25
2000/10/1,2000-10-01
21 Nov 2018,2018-11-21
3/26/29,2029-03-26
15 May 2030,2030-05-15
"August 15, 2002",2002-08-15
25041996,1996-04-25
17/5/28,2028-05-17
"December 24, 2030",2030-12-24
1/15/2008,2008-01-15
22-1,2031-01-22
13:7:1993,1993-07-13
ngày 7 tháng 4 năm 1991,1991-04-07
9/5-2006,2006-05-09
"Jun 14th, 1991",1991-06-14
24/4-2029,2029-04-24
2016-10-19,2016-10-19
15 tháng 12 năm 1995,1995-12-15
3 tháng 2 năm 1992,1992-02-03
2023/12/5,2023-12-05
23 tháng 5 năm 1997,1997-05-23
11.1.1995,1995-01-11
6th of December 2028,2028-12-06
20/6/27,2027-06-20
7.12.2030,2030-12-07
2/28/2000,2000-02-28
21/3/95,1995-03-21
5/6-2028,2028-06-05
14/24-2027,2027-12-14
2005/2/8,2005-02-08
10:6:2016,2016-06-10
20-2-2006,2006-02-10
2 No 1999,1999-11-02
1999/10/28,1999-10-28
25/3-1995,1995-03-25
20 Nov 2000,2000-11-20
"August 14, 2007",2007-08-14
5/33/2014,2014-11-05
21082009,2009-08-21
ngày 7 tháng 5 năm 2004,2004-05-07
11072015,2015-07-11
4/3/2004,2004-03-04
6-3,2021-03-06
2/1/2027,2027-01-02
16-11,2008-11-16
"Jan 6th, 2018",2018-01-06
15/7/03,2003-07-15
2011/5/24,2011-05-24
6/13/2028,2028-06-13
26122032,2032-12-26
23/11-1996,1996-11-23
26/10-1997,1997-10-26
9-22-33,2033-09-22
Jul 1 16,2016-07-01
2000-9-4,2000-09-04
23 Jan 1992,1992-01-23
21/4-2020,2020-04-21
09102027,2027-10-09
1/14/18,2018-01-14
16/36/2001,2001-12-16
Oct 24 02,2002-10-24
"May 26th, 2024",2024-05-26
18 November 2003,2003-11-18
ngày 3 tháng 9 năm 2019,2019-09-03
2027/1/22,2027-01-22
13/1-2016,2016-01-13
"August 28, 2028",2028-08-28
2.1.1996,1996-01-02
9 Fe 2019,2019-02-09
9 Fe 2027,2027-02-09
8-24-23,2023-08-24
12/1/2034,2034-12-01
28-3-2008,2008-03-28
Nov 26 28,2028-11-26
5-18-25,2025-05-18
23th of February 2006,2006-02-23
14/14-2015,2015-07-14
1/6/02,2002-06-01
15 Oc 1992,1992-10-15
19/12/21,2021-12-19
5/6-2018,2018-03-05
23-3,2022-03-23
"July 20, 1993",1993-07-20
"October 9, 2006",2006-10-09
3/5/2025,2025-03-05
7-10-23,2023-07-10
11 tháng 1 năm 2004,2004-01-11
5Mar1998,1998-03-05
13-10,2001-10-13
2nd of June 2021,2021-06-02
9/5-2030,2030-05-09
25/18/2025,2025-06-25
4.5.2022,2022-05-04
12 March 1992,1992-03-12
11/28/2011,2011-11-28
26-9-2008,2008-09-26
6/19/19,2019-06-19
11th of January 2031,2031-01-11
18.10.2001,2001-10-18
16 Ma 2014,2014-05-16
28/12-2000,2000-12-28
ngày 13 tháng 4 năm 2014,2014-04-13
1/6/11,2011-06-01
"Jul 4th, 2024",2024-07-04
22/10/26,2026-10-22
ngày 14 tháng 5 năm 2031,2031-05-14
21/6-1999,1999-06-21
1995-7-7,1995-07-07
16.1.2000,2000-01-16
Aug 21 35,2035-08-21
2000/8,2000-08-21
ngày 3 tháng 8 năm 2009,2009-08-03
15May2021,2021-05-15
ngày 28 tháng 12 năm 2023,2023-12-28
4/5/22,2022-04-05
"December 7, 2013",2013-12-07
18/12-2011,2011-06-18
5-10-12,2012-05-10
11.9.2006,2006-09-11
22th of August 2031,2031-08-22
8/23/90,1990-08-23
"December 21, 2031",2031-12-21
2.6.2008,2008-06-02
2026/6/21,2026-06-21
18-6,2034-06-18
"October 26, 2007",2007-10-26
9:8:1999,1999-08-09
11/16/2025,2025-11-16
23Dec2018,2018-12-23
10/15/2022,2022-10-15
14 March 2002,2002-03-14
21-6-1994,1994-06-21
28052026,2026-05-28
2029-7-7,2029-07-07
15Feb2022,2022-02-15
12/6-2003,2003-06-12
11-4-33,2033-11-04
15/8-2012,2012-08-15
14Dec1996,1996-12-14
"Jul 25th, 2006",2006-07-25
2001/5/8,2001-05-08
26 Jul 1993,1993-07-26
Dec 3 04,2004-12-03
3.12.1999,1999-12-03
14/3-2005,2005-03-14
5/9/10,2010-05-09
20Feb1994,1994-02-20
25 tháng 11 năm 2018,2018-11-25
4/21/03,2003-04-21
2027-1-27,2027-01-27
2:12:2025,2025-12-02
17:8:2002,2002-08-17
16/8-2020,2020-04-16
16042011,2011-04-16
2008/5,2008-05-28
21th of October 2017,2017-10-21
Sep 17 09,2009-09-17
7 tháng 6 năm 2028,2028-06-07
13/7/2012,2012-07-13
10-12-1998,1998-12-05
"Aug 19th, 2001",2001-08-19
30-10-2023,2023-10-15
"Jan 3rd, 2027",2027-01-03
4.4.2001,2001-04-04
54-11-2009,2009-11-27
17 Ap 2000,2000-04-17
12-1-1999,1999-01-06
11/3/98,1998-03-11
8-3-17,2017-08-03
23:2:2030,2030-02-23
12/20/98,1998-12-20
18/16-1992,1992-08-18
16/10-2019,2019-10-16
3.7.2004,2004-07-03
6-6-2020,2020-06-03
4th of January 2016,2016-01-04
9/15/34,2034-09-15
12/6-2012,2012-03-12
24-7-1998,1998-07-12
19/12/12,2012-12-19
07012017,2017-01-07
15/27/2027,2027-09-15
4/2/2013,2013-02-04
7 Apr 2000,2000-04-07
1/11-2033,2033-11-01
2004/3,2004-03-23
2/7/2031,2031-02-07
19:4:1998,1998-04-19
10-16-16,2016-10-16
17/3/2016,2016-03-17
2010/1,2010-01-17
2010/5/11,2010-05-11
23 Jun 1990,1990-06-23
11/10-2015,2015-10-11
12-4,2034-04-12
26 June 1998,1998-06-26
1-28-93,1993-01-28
23-6,2033-06-23
4/1/2017,2017-01-04
Sep 8 94,1994-09-08
18/2-1993,1993-01-18
27th of October 2007,2007-10-27
25/3-2007,2007-03-25
"March 8, 2006",2006-03-08
5/12-2022,2022-12-05
4th of April 2030,2030-04-04
24/10/04,2004-10-24
24/3/2020,2020-03-24
2017/10/10,2017-10-10
05112033,2033-11-05
19/8/09,2009-08-19
9th of September 2030,2030-09-09
6/33/2019,2019-11-06
23-1-2013,2013-01-23
2/21/98,1998-02-21
3:7:2032,2032-07-03
24/6-2016,2016-03-24
2033/5/11,2033-05-11
9/5/2034,2034-09-05
2020-8-19,2020-08-19
"Jun 21th, 1991",1991-06-21
1/2-2002,2002-01-01
12/2/2029,2029-02-12
2/3-2031,2031-03-02
13 Jan 2020,2020-01-13
14Jun2023,2023-06-14
27/11/25,2025-11-27
7/5/1999,1999-05-07
28072024,2024-07-28
12071998,1998-07-12
20Sep2017,2017-09-20
1.8.1993,1993-08-01
8/9-2026,2026-09-08
ngày 22 tháng 11 năm 2035,2035-11-22
10 tháng 4 năm 2032,2032-04-10
26 Ap 2034,2034-04-26
22 tháng 9 năm 1995,1995-09-22
ngày 24 tháng 5 năm 2026,2026-05-24
18/9/2026,2026-09-18
23.1.2031,2031-01-23
14/18-2014,2014-09-14
21 tháng 3 năm 2020,2020-03-21
1/12-2016,2016-06-01
26th of March 2004,2004-03-26
"May 4th, 2007",2007-05-04
20Mar2023,2023-03-20
Aug 25 10,2010-08-25
23-12,2011-12-23
8/21/1994,1994-07-08
2019/5,2019-05-02
08052025,2025-05-08
9 tháng 10 năm 2001,2001-10-09
12/27/2019,2019-12-27
2000/10,2000-10-20
5/25/22,2022-05-25
8th of February 2029,2029-02-08
4:5:2012,2012-05-04
1/1/93,1993-01-01
32-2-1996,1996-02-16
5/6/28,2028-06-05
1998/5,1998-05-20
16:4:2000,2000-04-16
11-18-97,1997-11-18
2001/4,2001-04-05
15/1/2026,2026-01-15
10/23/96,1996-10-23
25Oct2033,2033-10-25
20 tháng 7 năm 2006,2006-07-20
5th of November 1991,1991-11-05
20 Jun 2025,2025-06-20
12.8.2035,2035-08-12
2003/3,2003-03-01
16 Se 2028,2028-09-16
ngày 13 tháng 10 năm 2020,2020-10-13
"September 20, 2005",2005-09-20
8Jun2019,2019-06-08
2027-3-7,2027-03-07
10 tháng 10 năm 1994,1994-10-10
7-2-98,1998-07-02
16/8/91,1991-08-16
"Feb 1st, 1990",1990-02-01
17:7:2029,2029-07-17
19/8/27,2027-08-19
24 Au 1991,1991-08-24
2008-5-4,2008-05-04
6/18-2001,2001-09-06
19 Jun 2019,2019-06-19
23 tháng 6 năm 2003,2003-06-23
7/10/26,2026-10-07
2035/10,2035-10-02
26/11-2028,2028-11-26
2034/7/4,2034-07-04
13.9.2001,2001-09-13
9/7/2034,2034-09-07
22/5/21,2021-05-22
5 Nov 2024,2024-11-05
25:1:2004,2004-01-25
2035/11,2035-11-25
21/12/20,2020-12-21
12 tháng 2 năm 2025,2025-02-12
24 December 2022,2022-12-24
2014-11-21,2014-11-21
2/9/2029,2029-03-02
6 De 2008,2008-12-06
2032/11,2032-11-12
19/6/07,2007-06-19
"January 5, 1998",1998-01-05
18.10.2012,2012-10-18
17/24/2001,2001-08-17
18/4-1994,1994-04-18
11/10/19,2019-11-10
1-28-29,2029-01-28
3rd of November 2005,2005-11-03
15.4.1997,1997-04-15
2021/6/25,2021-06-25
10/16/17,2017-10-16
12-10-2009,2009-10-12
12/21/2013,2013-12-21
11/9/18,2018-09-11
36-2-2032,2032-02-18
50-7-2019,2019-07-25
Jun 16 09,2009-06-16
26 December 2034,2034-12-26
27th of July 2034,2034-07-27
1 Feb 2029,2029-02-01
12072009,2009-07-12
16-2-1999,1999-02-16
8th of July 2014,2014-07-08
10:4:1992,1992-04-10
3 Ja 2019,2019-01-03
"Mar 3rd, 2032",2032-03-03
24/1/13,2013-01-24
"September 3, 2009",2009-09-03
25/15/1997,1997-05-25
"Apr 28th, 1998",1998-04-28
28/8-1992,1992-04-28
Oct 8 08,2008-10-08
28/5/20,2020-05-28
"November 4, 1999",1999-11-04
15.4.2025,2025-04-15
32-3-1997,1997-03-16
9/4/01,2001-09-04
"Jan 13th, 2011",2011-01-13
1/20-2026,2026-10-01
"January 21, 2028",2028-01-21
12/11-2029,2029-11-12
23/1-2013,2013-01-23
13 Aug 2026,2026-08-13
6/19/2006,2006-06-19
25/2/01,2001-02-25
26th of October 2000,2000-10-26
"Mar 1st, 2019",2019-03-01
26-3-2032,2032-03-13
"July 10, 2027",2027-07-10
1993-12-6,1993-12-06
2024/11,2024-11-13
7/27/2023,2023-09-07
"September 17, 2021",2021-09-17
2014-1-20,2014-01-20
10/5/13,2013-05-10
"April 12, 2026",2026-04-12
22:2:2020,2020-02-22
20 tháng 6 năm 2018,2018-06-20
22/4-1995,1995-02-22
10/12-2014,2014-06-10
2/12/2001,2001-12-02
5 No 2011,2011-11-05
"Feb 17th, 2011",2011-02-17
17/7/29,2029-07-17
"April 10, 1998",1998-04-10
4/6-2032,2032-06-04
15Aug2021,2021-08-15
ngày 14 tháng 6 năm 2019,2019-06-14
36-2-2012,2012-02-18
7-28-28,2028-07-28
11-11,2018-11-11
2006/12/9,2006-12-09
21th of June 2016,2016-06-21
ngày 26 tháng 3 năm 2026,2026-03-26
17 December 2028,2028-12-17
9:9:2008,2008-09-09
1-3-2006,2006-03-01
27.9.2023,2023-09-27
2-12,2024-12-02
10/3/10,2010-03-10
Mar 7 93,1993-03-07
2022/10/14,2022-10-14
20-5-2028,2028-05-10
3 December 1993,1993-12-03
Jun 15 32,2032-06-15
1/6-2019,2019-06-01
7/22/08,2008-07-22
2027-12-2,2027-12-02
28.7.1999,1999-07-28
Dec 6 28,2028-12-06
2/26/22,2022-02-26
17/6/1995,1995-02-17
9.2.2028,2028-02-09
28:9:2033,2033-09-28
3/8/13,2013-03-08
7-23-10,2010-07-23
2022/7/26,2022-07-26
32-10-2019,2019-10-16
8/10/2025,2025-08-10
2013/6,2013-06-09
1/12/2019,2019-01-12
May 9 14,2014-05-09
1st of October 2030,2030-10-01
12/2-1999,1999-01-12
24-3-2003,2003-03-12
21.5.2026,2026-05-21
9/14/05,2005-09-14
13 Dec 2006,2006-12-13
25/12-2022,2022-06-25
1/5/2019,2019-01-05
21/10/2004,2004-10-21
3/5/00,2000-05-03
14th of October 2005,2005-10-14
24/8/2006,2006-08-24
14/22-2033,2033-11-14
May 18 34,2034-05-18
14/18-1997,1997-09-14
2004/1,2004-01-05
25/1-2028,2028-01-25
19 Ma 2031,2031-05-19
"October 9, 2020",2020-10-09
21-8,2002-08-21
20th of May 2020,2020-05-20
2005/10/1,2005-10-01
1999/2,1999-02-19
23062014,2014-06-23
"February 27, 2005",2005-02-27
"Jan 6th, 2035",2035-01-06
12/8-2017,2017-08-12
20/12/94,1994-12-20
15/6/31,2031-06-15
6-2-2012,2012-02-06
19 tháng 12 năm 2031,2031-12-19
6:10:2028,2028-10-06
1996/6/21,1996-06-21
16/27/2031,2031-09-16
27/8/17,2017-08-27
11/8-2028,2028-08-11
13/2/03,2003-02-13
17-3-2020,2020-03-17
2.1.2005,2005-01-02
22-6-2020,2020-06-22
"October 9, 2025",2025-10-09
6/17/2031,2031-06-17
2020/8/10,2020-08-10
6-19-24,2024-06-19
28.4.2030,2030-04-28
12 tháng 6 năm 2015,2015-06-12
7:1:2020,2020-01-07
13 Jan 2009,2009-01-13
6/6/00,2000-06-06
05091990,1990-09-05
1/27/2001,2001-01-27
22/8-2001,2001-08-22
6/8/31,2031-08-06
4 tháng 1 năm 2023,2023-01-04
23-9-2001,2001-09-23
9Apr2018,2018-04-09
2-1,2016-01-02
ngày 18 tháng 7 năm 2005,2005-07-18
5Jun2006,2006-06-05
Feb 21 96,1996-02-21
1997-3-16,1997-03-16
8.10.2024,2024-10-08
22/9/21,2021-09-22
Oct 4 20,2020-10-04
15/3-2022,2022-03-15
21/12-2035,2035-06-21
24/6/90,1990-06-24
10-5-2022,2022-05-10
28Mar1991,1991-03-28
13-10,2030-10-13
14/5/16,2016-05-14
10/1/2022,2022-01-10
Nov 19 03,2003-11-19
8 tháng 3 năm 2026,2026-03-08
18/4/25,2025-04-18
4.1.1992,1992-01-04
7 August 2001,2001-08-07
8/27/2009,2009-08-27
11Dec2017,2017-12-11
13092018,2018-09-13
Aug 7 31,2031-08-07
Sep 16 90,1990-09-16
"Oct 17th, 2026",2026-10-17
11 Apr 2022,2022-04-11
Nov 11 91,1991-11-11
11 Se 2014,2014-09-11
3-19-22,2022-03-19
26/12/1990,1990-04-26
1998-5-20,1998-05-20
2023-1-27,2023-01-27
5/30/2024,2024-10-05
7-4,2004-04-07
2011/9,2011-09-10
6/22-1995,1995-11-06
6/1/2000,2000-01-06
23012030,2030-01-23
3-2-20,2020-03-02
11 Ma 2023,2023-03-11
21th of May 1990,1990-05-21
23/10-2023,2023-10-23
2020/1,2020-01-11
7/4-2025,2025-04-07
17 January 1999,1999-01-17
10/10-2026,2026-05-10
4Feb2018,2018-02-04
1/6/1995,1995-06-01
"Dec 5th, 2013",2013-12-05
23 tháng 3 năm 2002,2002-03-23
26.9.2029,2029-09-26
9 January 1990,1990-01-09
17/11/1996,1996-11-17
25/30/2022,2022-10-25
3/12-2019,2019-12-03
5-26-14,2014-05-26
10.11.1991,1991-11-10
ngày 14 tháng 7 năm 1992,1992-07-14
21/18/2024,2024-06-21
23/4-1997,1997-04-23
5 tháng 4 năm 1996,1996-04-05
20/21/2024,2024-07-20
3-14-15,2015-03-14
ngày 9 tháng 9 năm 2002,2002-09-09
18/8/92,1992-08-18
10/8/27,2027-08-10
7/5/2030,2030-05-07
"July 28, 2013",2013-07-28
2007-9-6,2007-09-06
14092029,2029-09-14
16:10:1993,1993-10-16
27/6/2019,2019-02-27
6/25/2015,2015-06-25
21/8-1997,1997-08-21
20 Oc 1991,1991-10-20
16/7/97,1997-07-16
4/25/2019,2019-04-25
28 Ju 2026,2026-06-28
26Aug2026,2026-08-26
1993/7,1993-07-01
12:12:2031,2031-12-12
2016/10,2016-10-11
20-4-2018,2018-04-20
3-11-2017,2017-11-03
Dec 13 27,2027-12-13
10/7/14,2014-07-10
38-2-2009,2009-02-19
12/20-2005,2005-10-12
"May 27, 2031",2031-05-27
17/14-2007,2007-07-17
2/14/33,2033-02-14
17/6/10,2010-06-17
3-11-06,2006-03-11
1999/2,1999-02-18
22 Ju 2033,2033-07-22
3:12:2030,2030-12-03
"September 10, 1991",1991-09-10
26.9.1996,1996-09-26
2011-5-5,2011-05-05
"May 1st, 1999",1999-05-01
2/24/2001,2001-08-02
8 tháng 8 năm 2035,2035-08-08
2032-4-20,2032-04-20
4:9:1995,1995-09-04
6 Oc 1995,1995-10-06
10/14-2018,2018-07-10
12.10.2029,2029-10-12
1/12/2031,2031-12-01
2/23/2017,2017-02-23
18 September 2035,2035-09-18
12/1/2015,2015-12-01
9/6/92,1992-06-09
16/3-2008,2008-03-16
13 Ma 2019,2019-03-13
2010-5-13,2010-05-13
12 tháng 5 năm 1994,1994-05-12
2020-4-1,2020-04-01
11 September 2012,2012-09-11
28-2,1998-02-28
ngày 26 tháng 6 năm 2012,2012-06-26
25/3-2030,2030-03-25
17th of April 2034,2034-04-17
2029/9,2029-09-07
23 tháng 6 năm 2015,2015-06-23
2/12-2017,2017-12-02
11/14-2015,2015-07-11
21/11/22,2022-11-21
ngày 2 tháng 7 năm 2029,2029-07-02
2/10-2032,2032-10-02
25.2.1994,1994-02-25
1/14/31,2031-01-14
28-8-2021,2021-08-28
12Sep2013,2013-09-12
23.5.2024,2024-05-23
1:8:2025,2025-08-01
1:8:2024,2024-08-01
22th of April 2017,2017-04-22
18 August 2014,2014-08-18
28th of May 2008,2008-05-28
27.8.2009,2009-08-27
Nov 11 02,2002-11-11
"December 3, 2029",2029-12-03
4/15/99,1999-04-15
Feb 21 05,2005-02-21
27/7-1999,1999-07-27
20122002,2002-12-20
17th of December 2032,2032-12-17
1/24/24,2024-01-24
8-6-1990,1990-06-04
13/3/1996,1996-03-13
8/10/29,2029-08-10
"January 24, 2007",2007-01-24
26/6/2015,2015-02-26
10/33/2016,2016-11-10
12.3.2020,2020-03-12
"February 27, 2021",2021-02-27
Aug 15 29,2029-08-15
11/21/2010,2010-07-11
Feb 12 29,2029-02-12
1/9/2013,2013-09-01
1 November 1997,1997-11-01
18/1-2024,2024-01-18
8 Feb 2001,2001-02-08
9/8/33,2033-08-09
01012024,2024-01-01
9/14/21,2021-09-14
28/6/2001,2001-02-28
"July 11, 2003",2003-07-11
"Apr 27th, 2012",2012-04-27
10/3/11,2011-10-03
4/13/2014,2014-04-13
"November 24, 1990",1990-11-24
7 Ap 1995,1995-04-07
2-15-16,2016-02-15
2-12-16,2016-02-12
1990/1/8,1990-01-08
14 Feb 1992,1992-02-14
"Mar 19th, 1990",1990-03-19
21-1-2030,2030-01-21
28/5/14,2014-05-28
22/1/08,2008-01-22
10/12/1999,1999-10-12
4-19-92,1992-04-19
12/11-2003,2003-11-12
8-6,2005-06-08
8/14/30,2030-08-14
19 Jun 2011,2011-06-19
ngày 19 tháng 3 năm 2017,2017-03-19
12/16-2018,2018-08-12
12-1-2026,2026-01-12
3:7:2004,2004-07-03
19.12.2032,2032-12-19
2031/10/4,2031-10-04
1994/1,1994-01-15
21 Jan 1992,1992-01-21
4-3-31,2031-04-03
ngày 20 tháng 10 năm 2011,2011-10-20
12 December 2014,2014-12-12
14/4-2012,2012-04-14
2021/11/7,2021-11-07
8-8-96,1996-08-08
2/2-2001,2001-01-02
7 June 2026,2026-06-07
15/4/23,2023-04-15
"September 21, 2008",2008-09-21
2003-8-15,2003-08-15
12th of October 2004,2004-10-12
9-1-2014,2014-01-09
11/3/93,1993-11-03
7-1,1998-01-07
12/1/98,1998-12-01
ngày 25 tháng 6 năm 2013,2013-06-25
24th of April 2031,2031-04-24
12:2:2034,2034-02-12
1/2-2009,2009-02-01
5/21/2027,2027-07-05
13/15/1991,1991-05-13
2025-12-15,2025-12-15
5-8,2027-08-05
12/11/2028,2028-11-12
27/3-2014,2014-03-27
3Aug2024,2024-08-03
10 November 2013,2013-11-10
18022029,2029-02-18
2017/6/27,2017-06-27
Mar 21 99,1999-03-21
19/8-2024,2024-04-19
17th of January 2009,2009-01-17
8/3/11,2011-03-08
May 15 22,2022-05-15
10/16/01,2001-10-16
2015/8,2015-08-03
Jan 9 25,2025-01-09
ngày 10 tháng 11 năm 2010,2010-11-10
19/3/1997,1997-01-19
28/2-1996,1996-02-28
2035-12-22,2035-12-22
24/2/26,2026-02-24
23/6/2028,2028-02-23
21 February 2003,2003-02-21
24May2013,2013-05-24
ngày 19 tháng 10 năm 1990,1990-10-19
3 Apr 2010,2010-04-03
28091995,1995-09-28
10:12:1993,1993-12-10
ngày 18 tháng 11 năm 2018,2018-11-18
May 14 07,2007-05-14
1996/10/21,1996-10-21
7/27/2003,2003-09-07
03062017,2017-06-03
5 Sep 1996,1996-09-05
10/8/1997,1997-08-10
32-12-2004,2004-12-16
2001/10/19,2001-10-19
23th of October 2025,2025-10-23
7/6/2021,2021-07-06
25/3-2019,2019-03-25
5/4/1998,1998-05-04
16 Apr 2008,2008-04-16
18/15/1992,1992-05-18
8:7:2017,2017-07-08
6/3-2010,2010-03-06
"October 3, 2000",2000-10-03
12/1/91,1991-01-12
23/24/1990,1990-08-23
2034/8,2034-08-22
11-8,2033-08-11
6-22-34,2034-06-22
20091998,1998-09-20
8 November 1993,1993-11-08
ngày 23 tháng 1 năm 1998,1998-01-23
20072030,2030-07-20
14 April 1992,1992-04-14
20.10.2028,2028-10-20
27.9.2029,2029-09-27
17th of July 2003,2003-07-17
10-6-04,2004-10-06
11/9/28,2028-09-11
2/2-2020,2020-01-02
08061996,1996-06-08
2015/9/11,2015-09-11
7/18/1992,1992-07-18
2014-9-1,2014-09-01
13/7/34,2034-07-13
4-12-91,1991-04-12
2031-5-3,2031-05-03
23Apr2010,2010-04-23
Apr 16 25,2025-04-16
1994/5,1994-05-20
"Jun 13th, 2023",2023-06-13
May 14 24,2024-05-14
11/9/1999,1999-11-09
27Jan1991,1991-01-27
24 Dec 2026,2026-12-24
2007-11-28,2007-11-28
28/6/11,2011-06-28
25/5/2014,2014-05-25
12Dec2003,2003-12-12
06042034,2034-04-06
19.5.1993,1993-05-19
6/10-2000,2000-10-06
18.11.2000,2000-11-18
Jul 1 02,2002-07-01
7-10-08,2008-07-10
4/2-2017,2017-02-04
17/12/2033,2033-04-17
22 October 2027,2027-10-22
6/18/2008,2008-06-06
14Oct2024,2024-10-14
25/27/2017,2017-09-25
ngày 13 tháng 11 năm 2014,2014-11-13
2019-10-5,2019-10-05
26 tháng 7 năm 2003,2003-07-26
28-10,1999-10-28
4/10-2009,2009-10-04
21/2-2025,2025-02-21
"Feb 15th, 2035",2035-02-15
10Sep2031,2031-09-10
12/21/94,1994-12-21
12:10:2001,2001-10-12
22Apr2020,2020-04-22
1 December 2031,2031-12-01
ngày 28 tháng 7 năm 2002,2002-07-28
9-17-11,2011-09-17
"July 16, 2032",2032-07-16
9/2/31,2031-09-02
23 Dec 2012,2012-12-23
5:10:2010,2010-10-05
27/12-2004,2004-12-27
16/3/15,2015-03-16
2-22-99,1999-02-22
4-4-25,2025-04-04
18011994,1994-01-18
26 No 2013,2013-11-26
28/9-2019,2019-09-28
20/10-2034,2034-05-20
24/1-1993,1993-01-24
23:5:1997,1997-05-23
9-10-1995,1995-10-09
32-1-2004,2004-01-16
Sep 12 10,2010-09-12
2/1/31,2031-02-01
10/1/2001,2001-01-10
2030/9,2030-09-27
10-1,2026-01-10
5/7-1995,1995-07-05
22032020,2020-03-22
20.2.2031,2031-02-20
34-8-2031,2031-08-17
"September 6, 1990",1990-09-06
ngày 19 tháng 1 năm 2027,2027-01-19
Jun 12 99,1999-06-12
26-11-2018,2018-11-13
Aug 15 90,1990-08-15
"Oct 13th, 1996",1996-10-13
17/1/94,1994-01-17
5/16-2008,2008-08-05
2014/11/19,2014-11-19
8/10/2019,2019-10-08
20 De 2005,2005-12-20
19 Ja 2001,2001-01-19
10/6/2005,2005-02-10
ngày 15 tháng 1 năm 1992,1992-01-15
5/22/2015,2015-05-22
2013/7/16,2013-07-16
Jul 14 19,2019-07-14
23/8-1998,1998-08-23
26-6-2009,2009-06-13
24 tháng 1 năm 1991,1991-01-24
1994/5/17,1994-05-17
4/28/1997,1997-04-28
2000/2/21,2000-02-21
1999-1-15,1999-01-15
5:2:2011,2011-02-05
2 Ja 2029,2029-01-02
6 Se 1996,1996-09-06
11/7/29,2029-07-11
1Sep1999,1999-09-01
4/12/35,2035-12-04
20/6/2026,2026-06-20
24/2/91,1991-02-24
2nd of November 2026,2026-11-02
28 Ju 2012,2012-06-28
"March 4, 2029",2029-03-04
3/7/2001,2001-03-07
17/6/2032,2032-02-17
16May2009,2009-05-16
11/9/94,1994-11-09
ngày 10 tháng 12 năm 1998,1998-12-10
15-12-2009,2009-12-15
"May 9, 2017",2017-05-09
11.6.1994,1994-06-11
2014-12-27,2014-12-27
24.1.2015,2015-01-24
4/15/2017,2017-05-04
11/10/23,2023-10-11
6 tháng 6 năm 2031,2031-06-06
12/8/2005,2005-12-08
26/11/11,2011-11-26
"Nov 2nd, 2002",2002-11-02
10-5-2015,2015-05-05
8:7:2033,2033-07-08
3 September 2000,2000-09-03
2012-4-6,2012-04-06
6/7/2028,2028-06-07
13 Dec 2019,2019-12-13
2:6:2034,2034-06-02
8 Se 2033,2033-09-08
1999-9-24,1999-09-24
42-9-2020,2020-09-21
2005/2/6,2005-02-06
9/16-1994,1994-08-09
7-10-05,2005-07-10
19/15/1992,1992-05-19
13 Au 1994,1994-08-13
2004/11,2004-11-10
27092028,2028-09-27
15 Jun 2031,2031-06-15
7 May 2007,2007-05-07
6-2-95,1995-06-02
11 February 2026,2026-02-11
21-11,2023-11-21
4.9.2005,2005-09-04
13 Ma 2004,2004-05-13
ngày 15 tháng 9 năm 2009,2009-09-15
25012003,2003-01-25
2018-2-28,2018-02-28
12:1:2009,2009-01-12
26/5/1994,1994-05-26
15/12/03,2003-12-15
12-4-2007,2007-04-12
"January 25, 2017",2017-01-25
15/7/04,2004-07-15
19Nov2029,2029-11-19
24/4-2007,2007-02-24
16.2.2028,2028-02-16
8/20-2028,2028-10-08
Jul 4 06,2006-07-04
3-24-31,2031-03-24
3/2/17,2017-03-02
21/12-2026,2026-06-21
30-12-2032,2032-12-15
6/25/2027,2027-06-25
04032035,2035-03-04
ngày 27 tháng 1 năm 2020,2020-01-27
10/18/90,1990-10-18
6/2/2018,2018-02-06
9/36/1997,1997-12-09
9/25/2032,2032-09-25
18 February 2006,2006-02-18
2nd of November 2025,2025-11-02
14/16-1997,1997-08-14
12:8:2001,2001-08-12
18-6-2008,2008-06-18
17Nov2023,2023-11-17
40-6-2021,2021-06-20
2003-7-19,2003-07-19
12/4/19,2019-04-12
7 Jan 2019,2019-01-07
23 Fe 2004,2004-02-23
12:8:2001,2001-08-12
22-11-2007,2007-11-11
Jul 27 19,2019-07-27
11 July 2010,2010-07-11
4/2-2031,2031-02-04
28.3.2001,2001-03-28
"Jan 12th, 2020",2020-01-12
1990/3/15,1990-03-15
19112006,2006-11-19
12/21/2025,2025-07-12
10-16-10,2010-10-16
27th of May 2014,2014-05-27
ngày 12 tháng 1 năm 2031,2031-01-12
10-18-98,1998-10-18
6/19/33,2033-06-19
12 Ja 2016,2016-01-12
6:9:2014,2014-09-06
20Mar2028,2028-03-20
14-10-2029,2029-10-14
21-1,2027-01-21
10-27-06,2006-10-27
25 May 2014,2014-05-25
5.8.1999,1999-08-05
11/1/10,2010-01-11
1/2-2017,2017-02-01
Jan 7 92,1992-01-07
9/11/2031,2031-09-11
25-6,2020-06-25
11062019,2019-06-11
27 Dec 1993,1993-12-27
2021/11,2021-11-06
6-2-2018,2018-02-06
"Sep 22th, 1992",1992-09-22
22/6/02,2002-06-22
12/22/2034,2034-12-22
"Dec 3rd, 2032",2032-12-03
2022-10-2,2022-10-02
Aug 13 92,1992-08-13
1993-10-10,1993-10-10
26:9:2009,2009-09-26
20/4-2031,2031-04-20
10th of February 2026,2026-02-10
5/18/17,2017-05-18
4/4/16,2016-04-04
10-2,2008-02-10
8-3-04,2004-08-03
6 Nov 2006,2006-11-06
1993/2/17,1993-02-17
19-1,2027-01-19
18/12/07,2007-12-18
22-12-2031,2031-12-22
16 Au 2023,2023-08-16
4/3/27,2027-04-03
5-5,2028-05-05
2032/2,2032-02-04
9/3/93,1993-09-03
15/5/16,2016-05-15
2007/11/17,2007-11-17
21-2,2034-02-21
28112030,2030-11-28
9/20/2012,2012-09-20
15-2,1998-02-15
16/8-2010,2010-04-16
3/10/23,2023-10-03
14/30/2016,2016-10-14
15:5:2014,2014-05-15
52-5-2034,2034-05-26
28Apr2017,2017-04-28
14/1-2013,2013-01-14
18 Jun 2023,2023-06-18
26-10,2030-10-26
22 Ma 2000,2000-05-22
"Oct 15th, 1996",1996-10-15
1995/2/15,1995-02-15
2/24/2017,2017-08-02
21/8-2015,2015-08-21
15-7,1992-07-15
50-4-2014,2014-04-25
5-20-92,1992-05-20
24 Se 2035,2035-09-24
4 June 2028,2028-06-04
15 tháng 11 năm 2001,2001-11-15
3/5/92,1992-05-03
5-15-31,2031-05-15
12-5-00,2000-12-05
16:10:2021,2021-10-16
27-9-2004,2004-09-27
25-5-1991,1991-05-25
16-11-2026,2026-11-16
2020/7/28,2020-07-28
1/24-2000,2000-12-01
3Jul2016,2016-07-03
8/16-2019,2019-08-08
2034/1/9,2034-01-09
19th of January 1990,1990-01-19
4/3/02,2002-03-04
24/27/2000,2000-09-24
15/8-2000,2000-04-15
24/11/05,2005-11-24
3Jul2007,2007-07-03
25052005,2005-05-25
5/13/2014,2014-05-13
4-3-95,1995-04-03
2022/1,2022-01-20
9 June 2026,2026-06-09
Oct 4 92,1992-10-04
5/9/2034,2034-03-05
"Oct 10th, 2030",2030-10-10
2 Ma 2020,2020-05-02
9-11,1990-11-09
07062006,2006-06-07
"May 23, 2006",2006-05-23
28.4.2004,2004-04-28
13-8-2033,2033-08-13
4-23-98,1998-04-23
2003/1,2003-01-01
7/6-2008,2008-06-07
9-7-26,2026-09-07
7/11-2010,2010-11-07
21.11.2027,2027-11-21
24/8/13,2013-08-24
"Jul 7th, 1994",1994-07-07
16/2/23,2023-02-16
ngày 7 tháng 9 năm 1998,1998-09-07
34-7-2003,2003-07-17
6/5/32,2032-05-06
24 December 2018,2018-12-24
32-3-2032,2032-03-16
11 Fe 1990,1990-02-11
ngày 10 tháng 1 năm 2029,2029-01-10
ngày 2 tháng 9 năm 2017,2017-09-02
ngày 4 tháng 10 năm 2000,2000-10-04
23 tháng 1 năm 1993,1993-01-23
8/3-1996,1996-03-08
2 Ja 1995,1995-01-02
1-4-1995,1995-04-01
2015/5/13,2015-05-13
26 November 2000,2000-11-26
24-3,2026-03-24
4/12/2015,2015-04-12
4 February 2001,2001-02-04
7th of November 2029,2029-11-07
4/4/2035,2035-04-04
6/18/28,2028-06-18
2029-5-12,2029-05-12
21/4-1990,1990-04-21
"Jul 28th, 2027",2027-07-28
2027/9,2027-09-05
Apr 3 35,2035-04-03
5/11/2017,2017-11-05
24092035,2035-09-24
1 No 1996,1996-11-01
12/5/25,2025-05-12
ngày 4 tháng 3 năm 1999,1999-03-04
1/4-2026,2026-04-01
12/17/12,2012-12-17
20/10/2001,2001-10-20
15/9-2025,2025-09-15
12-12-2015,2015-12-06
23 March 2010,2010-03-23
8/11/2016,2016-08-11
"December 3, 2033",2033-12-03
24/18/2017,2017-06-24
10Jun2010,2010-06-10
22 Fe 2018,2018-02-22
17/2/2027,2027-02-17
9 tháng 10 năm 1999,1999-10-09
2/28/1995,1995-02-28
17 April 2034,2034-04-17
23/1/31,2031-01-23
16 tháng 11 năm 1994,1994-11-16
ngày 6 tháng 5 năm 2007,2007-05-06
20112030,2030-11-20
20-2-2018,2018-02-20
19/10-2033,2033-05-19
4Nov2022,2022-11-04
5/12/2035,2035-12-05
10 Oct 2020,2020-10-10
11/14/2025,2025-11-14
54-4-2001,2001-04-27
16.11.1997,1997-11-16
11/9/2011,2011-09-11
4/7/1994,1994-04-07
15/27/2021,2021-09-15
22 May 1991,1991-05-22
24112004,2004-11-24
24/3-2032,2032-03-24
"May 4, 1992",1992-05-04
12.8.2012,2012-08-12
9th of May 2001,2001-05-09
15/8/96,1996-08-15
2-6-92,1992-02-06
ngày 21 tháng 5 năm 1998,1998-05-21
6/3/18,2018-03-06
12/18/2007,2007-12-18
8-8-1999,1999-08-04
3/3/2006,2006-03-03
"March 22, 2034",2034-03-22
"Sep 27th, 2030",2030-09-27
Feb 10 35,2035-02-10
Feb 21 01,2001-02-21
ngày 23 tháng 8 năm 2033,2033-08-23
20/27/2029,2029-09-20
5/16/2033,2033-05-16
5/9/04,2004-09-05
16 May 2025,2025-05-16
11/18/2001,2001-06-11
23Apr2022,2022-04-23
16 tháng 12 năm 2012,2012-12-16
20.6.2024,2024-06-20
2/9/31,2031-02-09
3/8/33,2033-03-08
2-10-1995,1995-10-02
7Jul2003,2003-07-07
2-10-1993,1993-10-02
6/5/18,2018-06-05
"Dec 10th, 1999",1999-12-10
11-9,2029-09-11
1/2/06,2006-02-01
10May2018,2018-05-10
6 Fe 2026,2026-02-06
16-4-2022,2022-04-16
"Feb 24th, 1994",1994-02-24
28 May 1991,1991-05-28
3-10-08,2008-03-10
"September 8, 2004",2004-09-08
15 Ju 2033,2033-07-15
"Mar 17th, 2026",2026-03-17
18 tháng 1 năm 2026,2026-01-18
8-9,2035-09-08
6 Oct 1996,1996-10-06
7 Ju 2006,2006-07-07
8-3-90,1990-08-03
16/5/92,1992-05-16
20th of February 2016,2016-02-20
"February 9, 2004",2004-02-09
25Jun2019,2019-06-25
15/1/04,2004-01-15
2014-12-9,2014-12-09
"Jun 25th, 2026",2026-06-25
2030/6/7,2030-06-07
19-12,2001-12-19
18/12/29,2029-12-18
22/6/1997,1997-02-22
8-3,1998-03-08
4/7/06,2006-07-04
25.5.2021,2021-05-25
13/12/2008,2008-12-13
9/5/2019,2019-09-05
2010/9/1,2010-09-01
14th of September 2024,2024-09-14
17/1-2023,2023-01-17
7 August 2000,2000-08-07
5/6-2025,2025-06-05
11/33/1990,1990-11-11
"February 21, 1990",1990-02-21
2024-10-3,2024-10-03
1.7.2012,2012-07-01
Nov 17 29,2029-11-17
21/9-1992,1992-09-21
2021/11/17,2021-11-17
16041992,1992-04-16
ngày 11 tháng 5 năm 2000,2000-05-11
2022/8,2022-08-18
5/9/2005,2005-03-05
22 tháng 9 năm 2031,2031-09-22
10/7-2031,2031-07-10
2002-11-6,2002-11-06
10/18/2024,2024-10-18
"September 17, 2017",2017-09-17
23 Sep 2015,2015-09-23
9-28-96,1996-09-28
2:10:2012,2012-10-02
19th of May 2007,2007-05-19
2/11/32,2032-02-11
11-14-24,2024-11-14
ngày 20 tháng 5 năm 2022,2022-05-20
ngày 6 tháng 10 năm 1998,1998-10-06
16/11/19,2019-11-16
28 April 2012,2012-04-28
2027/12,2027-12-08
2018-11-16,2018-11-16
24 September 2028,2028-09-24
4-12,2024-12-04
5/7-1999,1999-07-05
24:7:2018,2018-07-24
1991/5,1991-05-07
2-10-2029,2029-10-01
15112009,2009-11-15
7-17-93,1993-07-17
Apr 10 12,2012-04-10
22/1/26,2026-01-22
9/3/2022,2022-03-09
44-2-2025,2025-02-22
27/1/2018,2018-01-27
9/3-2014,2014-03-09
2025/12,2025-12-24
May 18 17,2017-05-18
12/21/32,2032-12-21
"September 6, 2023",2023-09-06
15:7:1994,1994-07-15
24/1-2001,2001-01-24
6/9-1995,1995-09-06
Dec 22 17,2017-12-22
9/6-2029,2029-06-09
10/11/2025,2025-10-11
4 tháng 2 năm 1992,1992-02-04
27/2-2032,2032-02-27
2018/12,2018-12-23
Dec 28 93,1993-12-28
18042012,2012-04-18
23Oct2016,2016-10-23
22 No 2029,2029-11-22
13th of April 1999,1999-04-13
"Feb 21th, 2030",2030-02-21
24042035,2035-04-24
11/11/1994,1994-11-11
21121990,1990-12-21
ngày 7 tháng 1 năm 2005,2005-01-07
2031-4-14,2031-04-14
26:5:2035,2035-05-26
11 December 1997,1997-12-11
23/12/2015,2015-12-23
19-3-2024,2024-03-19
22/2-2034,2034-02-22
50-9-2011,2011-09-25
18/20-2003,2003-10-18
11/10/2008,2008-10-11
48-5-2034,2034-05-24
15/2/99,1999-02-15
1/11/97,1997-01-11
27May2026,2026-05-27
9 No 1991,1991-11-09
01032017,2017-03-01
1992-10-6,1992-10-06
2/6/1994,1994-02-06
8/3/29,2029-03-08
ngày 26 tháng 12 năm 2003,2003-12-26
14.1.2016,2016-01-14
"Dec 19th, 2031",2031-12-19
8/6-2025,2025-06-08
"February 19, 2025",2025-02-19
Mar 23 98,1998-03-23
26 Ma 1995,1995-03-26
13/4-2017,2017-04-13
12/1/95,1995-01-12
5/18/92,1992-05-18
2027/8,2027-08-20
26 tháng 6 năm 2011,2011-06-26
19/1/26,2026-01-19
2 tháng 6 năm 2016,2016-06-02
14/18-1997,1997-09-14
24 Ju 1995,1995-07-24
2032/10/24,2032-10-24
16th of November 1996,1996-11-16
15/11-1990,1990-11-15
5Oct2008,2008-10-05
27051994,1994-05-27
10/11/26,2026-10-11
6Mar2027,2027-03-06
8/2/28,2028-02-08
"July 5, 1995",1995-07-05
10Apr2015,2015-04-10
ngày 10 tháng 2 năm 2031,2031-02-10
17/7/26,2026-07-17
8-19-94,1994-08-19
4 September 2016,2016-09-04
7/10-2034,2034-10-07
21th of June 2010,2010-06-21
14 April 2007,2007-04-14
7-18-05,2005-07-18
7-11-93,1993-07-11
9:1:2010,2010-01-09
26-11-2002,2002-11-26
13/9-1994,1994-09-13
13/5-2002,2002-05-13
10-12,2008-12-10
11 Apr 2019,2019-04-11
7 tháng 1 năm 2005,2005-01-07
17/30/2001,2001-10-17
6-13-24,2024-06-13
8/3/14,2014-08-03
2012/7,2012-07-22
6/27/2012,2012-06-27
17:3:2021,2021-03-17
25-2,2005-02-25
20 June 2029,2029-06-20
24112028,2028-11-24
19 February 2025,2025-02-19
19th of April 2011,2011-04-19
Oct 15 12,2012-10-15
21/3-2023,2023-03-21
3/4/15,2015-04-03
2035/2,2035-02-24
16/4-2035,2035-04-16
9.4.2005,2005-04-09
17/9/2035,2035-03-17
27 Ja 2016,2016-01-27
26/12/2035,2035-12-26
ngày 12 tháng 12 năm 2013,2013-12-12
12-7-2034,2034-07-12
14.12.2028,2028-12-14
25/10-1996,1996-10-25
ngày 8 tháng 12 năm 2034,2034-12-08
2.10.2027,2027-10-02
"January 8, 2022",2022-01-08
09102012,2012-10-09
"Dec 20th, 2024",2024-12-20
11/12/1990,1990-04-11
17 tháng 5 năm 2034,2034-05-17
1-28-21,2021-01-28
9:11:2031,2031-11-09
2032/8/13,2032-08-13
1992-4-8,1992-04-08
4-22-35,2035-04-22
10.3.2031,2031-03-10
14092020,2020-09-14
24th of April 2002,2002-04-24
20/2-1990,1990-01-20
12/12-2003,2003-12-12
1:6:2004,2004-06-01
01121995,1995-12-01
22 tháng 11 năm 2025,2025-11-22
15-11-2007,2007-11-15
10 tháng 7 năm 1996,1996-07-10
26Aug1992,1992-08-26
9.3.2011,2011-03-09
24/3/15,2015-03-24
10-17-23,2023-10-17
3-15-33,2033-03-15
28-3,2015-03-28
24/20-2016,2016-10-24
7 Sep 2034,2034-09-07
26/30/2014,2014-10-26
24/3/29,2029-03-24
2033-8-16,2033-08-16
23 Feb 2003,2003-02-23
6-1-18,2018-06-01
Apr 24 15,2015-04-24
30-8-2011,2011-08-15
20Apr2010,2010-04-20
2010/2/2,2010-02-02
21 May 2027,2027-05-21
13-11-2016,2016-11-13
9/30/1991,1991-10-09
9/5/29,2029-09-05
14-2-2006,2006-02-07
2/10/21,2021-02-10
18 Jul 1994,1994-07-18
Apr 9 12,2012-04-09
2035-12-10,2035-12-10
20-3-1990,1990-03-10
2009/4,2009-04-07
4-16-23,2023-04-16
2.7.1997,1997-07-02
17 tháng 2 năm 2021,2021-02-17
2/7-2034,2034-07-02
6/28/03,2003-06-28
17-4,1991-04-17
2030-8-17,2030-08-17
16 tháng 8 năm 2016,2016-08-16
21062012,2012-06-21
8-5-05,2005-08-05
ngày 10 tháng 6 năm 2026,2026-06-10
1997-6-28,1997-06-28
9-1-34,2034-09-01
4/8/2032,2032-08-04
"July 12, 2000",2000-07-12
"Dec 22th, 2003",2003-12-22
16/12-2030,2030-06-16
7/4/15,2015-07-04
2032-5-20,2032-05-20
3-15-03,2003-03-15
3/12/2015,2015-12-03
2018/9/13,2018-09-13
9-16-26,2026-09-16
26:11:2014,2014-11-26
9-16-17,2017-09-16
15/15/2034,2034-05-15
32-11-2031,2031-11-16
28-12-2013,2013-12-28
2018-1-4,2018-01-04
20082005,2005-08-20
28/12-2034,2034-12-28
1992/1,1992-01-22
17/21/2035,2035-07-17
9/18/1992,1992-06-09
2:8:2000,2000-08-02
10/12/33,2033-12-10
26/1-2011,2011-01-26
08101999,1999-10-08
3/20/96,1996-03-20
17/3/97,1997-03-17
2026-11-19,2026-11-19
15/8-2025,2025-04-15
24Feb1993,1993-02-24
"October 14, 2026",2026-10-14
Jun 23 99,1999-06-23
14 Aug 2030,2030-08-14
"Jun 12th, 2028",2028-06-12
9-10,2027-10-09
18-12,2014-12-18
2005-1-18,2005-01-18
5/10-1999,1999-05-05
2010/8/26,2010-08-26
10/7/2024,2024-07-10
9-15-17,2017-09-15
2029/12,2029-12-17
19-10,2022-10-19
3/4/18,2018-04-03
17/22-2010,2010-11-17
8/9-2016,2016-09-08
15.3.1999,1999-03-15
ngày 10 tháng 2 năm 2003,2003-02-10
22062009,2009-06-22
Jan 27 15,2015-01-27
6/21/13,2013-06-21
14/4/2030,2030-04-14
Feb 15 07,2007-02-15
3/2-2018,2018-02-03
21 June 2034,2034-06-21
ngày 19 tháng 9 năm 2034,2034-09-19
25/3-2019,2019-03-25
May 1 00,2000-05-01
9Nov2028,2028-11-09
"Jun 12th, 2024",2024-06-12
12/2/2012,2012-12-02
7/2/2034,2034-02-07
10/5-2030,2030-05-10
36-8-2011,2011-08-18
14/2-2033,2033-02-14
22 Ju 2030,2030-07-22
15.3.2013,2013-03-15
4 Sep 1996,1996-09-04
1998-6-17,1998-06-17
1992-1-7,1992-01-07
"October 20, 2004",2004-10-20
15Jun1996,1996-06-15
14/3-1999,1999-03-14
27/12/2032,2032-12-27
27/10/33,2033-10-27
15.9.1998,1998-09-15
24/6/14,2014-06-24
"February 7, 1999",1999-02-07
Sep 28 23,2023-09-28
6 tháng 5 năm 2027,2027-05-06
4/26/2006,2006-04-26
2 tháng 6 năm 1999,1999-06-02
13/8-2001,2001-04-13
7/10/2021,2021-07-10
22May1991,1991-05-22
8-25-16,2016-08-25
10-17-16,2016-10-17
Dec 12 97,1997-12-12
20-9-2001,2001-09-10
7/4/02,2002-04-07
17 tháng 11 năm 2014,2014-11-17
21 Jul 2034,2034-07-21
7 Jun 2014,2014-06-07
5 April 1992,1992-04-05
15092033,2033-09-15
"Sep 1st, 2027",2027-09-01
2 Nov 1991,1991-11-02
19 January 2003,2003-01-19
9:5:2035,2035-05-09
"December 11, 2008",2008-12-11
18-10,2002-10-18
27/6-2000,2000-06-27
24/7/1992,1992-07-24
2002/5/17,2002-05-17
ngày 10 tháng 9 năm 1996,1996-09-10
6-20-29,2029-06-20
14/5/07,2007-05-14
1/13/2022,2022-01-13
6/10/2006,2006-06-10
12-6-11,2011-12-06
20 Jun 2029,2029-06-20
1/26/92,1992-01-26
10/2-2018,2018-02-10
1 tháng 10 năm 1997,1997-10-01
22011997,1997-01-22
20 tháng 6 năm 1991,1991-06-20
2034-2-26,2034-02-26
28 Ju 2002,2002-06-28
04101998,1998-10-04
7-3,2003-03-07
"Feb 17th, 2001",2001-02-17
17th of June 2034,2034-06-17
16/1-2015,2015-01-16
May 11 23,2023-05-11
8-1-2031,2031-01-08
18th of May 1993,1993-05-18
22 Fe 2028,2028-02-22
10/2/15,2015-02-10
18/6-2033,2033-03-18
ngày 26 tháng 12 năm 2004,2004-12-26
ngày 5 tháng 1 năm 2028,2028-01-05
ngày 19 tháng 2 năm 2009,2009-02-19
9 Ma 1998,1998-05-09
2020/4,2020-04-10
"March 2, 2016",2016-03-02
Mar 27 16,2016-03-27
"July 2, 2030",2030-07-02
28 July 2022,2022-07-28
25 Jul 2028,2028-07-25
7Feb1994,1994-02-07
9/7-2010,2010-07-09
15022019,2019-02-15
19012013,2013-01-19
ngày 10 tháng 5 năm 2008,2008-05-10
9 June 1995,1995-06-09
17.6.2033,2033-06-17
20th of September 1993,1993-09-20
Sep 28 17,2017-09-28
21/6/16,2016-06-21
12 Aug 1996,1996-08-12
5 tháng 7 năm 1993,1993-07-05
10 September 2024,2024-09-10
11/11-2029,2029-11-11
12th of April 2015,2015-04-12
Oct 5 22,2022-10-05
5/5/2015,2015-05-05
20 Ap 2005,2005-04-20
23/9/2013,2013-03-23
2010/4/7,2010-04-07
1994-11-20,1994-11-20
ngày 5 tháng 8 năm 2025,2025-08-05
25/4-2010,2010-02-25
2014/9/2,2014-09-02
7-6,1990-06-07
8/23/2014,2014-08-23
"Nov 21th, 2005",2005-11-21
"Feb 22th, 2025",2025-02-22
20Dec2000,2000-12-20
2:8:2030,2030-08-02
ngày 14 tháng 10 năm 2010,2010-10-14
20112030,2030-11-20
2004/9,2004-09-15
11 Feb 2004,2004-02-11
28 Ap 1998,1998-04-28
7 tháng 11 năm 2030,2030-11-07
01041995,1995-04-01
24/33/2027,2027-11-24
10-12-2024,2024-12-05
"Feb 27th, 2009",2009-02-27
1995-5-26,1995-05-26
1993-11-8,1993-11-08
2032/6,2032-06-28
22/9/93,1993-09-22
6/13/1997,1997-06-13
3/21/94,1994-03-21
Apr 15 19,2019-04-15
8-27-96,1996-08-27
16-6-1993,1993-06-16
15-1-2033,2033-01-15
10-1,2002-01-10
18/1-2009,2009-01-18
16 Ma 1992,1992-05-16
6-14-04,2004-06-14
2004/5/26,2004-05-26
ngày 27 tháng 5 năm 2028,2028-05-27
2001/9/2,2001-09-02
25/5-2031,2031-05-25
3/18/2016,2016-03-18
14 tháng 7 năm 2028,2028-07-14
19-9-2022,2022-09-19
17.11.2008,2008-11-17
16/2/33,2033-02-16
11/10-2012,2012-10-11
17Oct1995,1995-10-17
11 tháng 3 năm 1995,1995-03-11
16/5-2029,2029-05-16
26042003,2003-04-26
3/8/95,1995-08-03
1991-3-12,1991-03-12
2024-7-18,2024-07-18
19/3/2035,2035-03-19
26th of September 2001,2001-09-26
1992/3/13,1992-03-13
2001-3-12,2001-03-12
15/10-2031,2031-10-15
25/5/2001,2001-05-25
38-9-1998,1998-09-19
24 tháng 11 năm 1993,1993-11-24
8Aug2003,2003-08-08
"Dec 12th, 2012",2012-12-12
23-10,2012-10-23
1 August 2017,2017-08-01
16 November 1991,1991-11-16
8/4-2003,2003-04-08
2020-9-24,2020-09-24
4/9/2031,2031-03-04
6/8-2012,2012-08-06
25/21/2033,2033-07-25
1-12-2020,2020-12-01
2017-10-9,2017-10-09
"June 5, 2027",2027-06-05
13-6-2007,2007-06-13
"Dec 28th, 2026",2026-12-28
20052004,2004-05-20
01102001,2001-10-01
56-5-1994,1994-05-28
19th of September 2020,2020-09-19
10/1/99,1999-01-10
20 Apr 2014,2014-04-20
ngày 27 tháng 1 năm 1997,1997-01-27
09042035,2035-04-09
6.8.2019,2019-08-06
19 October 2035,2035-10-19
ngày 27 tháng 11 năm 2002,2002-11-27
8-15-29,2029-08-15
1/8-2008,2008-08-01
10/13/00,2000-10-13
1:4:2021,2021-04-01
16 tháng 9 năm 2028,2028-09-16
2028/7/9,2028-07-09
17/2-1993,1993-02-17
5:6:2005,2005-06-05
23 Ma 2005,2005-03-23
7-4-00,2000-07-04
11-8-2013,2013-08-11
6th of February 2033,2033-02-06
18/24-2007,2007-12-18
17 tháng 5 năm 2011,2011-05-17
42-5-2029,2029-05-21
28-12-2015,2015-12-28
15/36/1995,1995-12-15
14/12/14,2014-12-14
8/9/2023,2023-09-08
28 Dec 2007,2007-12-28
4/2-1998,1998-01-04
7-8-31,2031-07-08
"Oct 16th, 2004",2004-10-16
5Apr2020,2020-04-05
Nov 6 90,1990-11-06
20/12/2001,2001-12-20
9-2-07,2007-09-02
14/7-2020,2020-07-14
50-7-2034,2034-07-25
"Feb 1st, 2004",2004-02-01
4-3-96,1996-04-03
17Jan2013,2013-01-17
23 September 2013,2013-09-23
24/10/2020,2020-10-24
14021998,1998-02-14
2014/1/11,2014-01-11
52-5-2004,2004-05-26
20/3-2024,2024-03-20
"December 10, 2011",2011-12-10
24022018,2018-02-24
38-6-2018,2018-06-19
"July 21, 2017",2017-07-21
16Aug1991,1991-08-16
13032028,2028-03-13
2011/9/3,2011-09-03
34-10-2028,2028-10-17
20/4/98,1998-04-20
14/10-1997,1997-05-14
28102027,2027-10-28
21May2026,2026-05-21
27/10/94,1994-10-27
"April 15, 2018",2018-04-15
21/4-2004,2004-04-21
9/10/1990,1990-10-09
4/12/2005,2005-04-12
2000/11/25,2000-11-25
18-6-1995,1995-06-18
18 December 2010,2010-12-18
19/6/30,2030-06-19
Oct 23 92,1992-10-23
12Dec1999,1999-12-12
24/7-2027,2027-07-24
23/6/17,2017-06-23
23 tháng 6 năm 1991,1991-06-23
1992/9/22,1992-09-22
4.4.2029,2029-04-04
11 Se 2012,2012-09-11
1/8-2001,2001-08-01
19/6-2031,2031-06-19
3/15/2028,2028-05-03
24th of May 2020,2020-05-24
24Oct2028,2028-10-24
18/9-2013,2013-09-18
6/7/95,1995-07-06
3/12/35,2035-12-03
12/1-2029,2029-01-12
6/6-2008,2008-06-06
"June 13, 2000",2000-06-13
Mar 17 99,1999-03-17
12/10-2024,2024-10-12
13 tháng 10 năm 2015,2015-10-13
4Apr2029,2029-04-04
1/21/08,2008-01-21
3/27/2032,2032-03-27
19 Nov 1991,1991-11-19
4-2,2000-02-04
2021-2-28,2021-02-28
"November 11, 2023",2023-11-11
23-10-2010,2010-10-23
1990-12-22,1990-12-22
28-10,1992-10-28
26-9-2034,2034-09-13
2023-6-1,2023-06-01
11/28/14,2014-11-28
19Feb2024,2024-02-19
13/9-2005,2005-09-13
14th of September 1991,1991-09-14
22/6/2019,2019-06-22
14-4,2035-04-14
9-8,2018-08-09
26/12/2018,2018-04-26
ngày 6 tháng 3 năm 2019,2019-03-06
9Oct2011,2011-10-09
14/10/31,2031-10-14
2034-10-3,2034-10-03
26/9/2000,2000-09-26
21-4,1990-04-21
3/11/2013,2013-03-11
4-5-2007,2007-05-04
25Jan2028,2028-01-25
"Oct 21th, 2012",2012-10-21
23-7-1999,1999-07-23
16Jul2001,2001-07-16
2016-8-1,2016-08-01
9-23-91,1991-09-23
22/5/2025,2025-05-22
12:6:2035,2035-06-12
2014-7-11,2014-07-11
3-2-1995,1995-02-03
15 tháng 9 năm 1990,1990-09-15
7/5/06,2006-07-05
3.8.1996,1996-08-03
"Jan 13th, 2021",2021-01-13
26 tháng 3 năm 2032,2032-03-26
1/12/31,2031-12-01
4/25/2022,2022-04-25
18/14-2023,2023-07-18
3/26/2021,2021-03-26
25-1,2013-01-25
7-4-2003,2003-04-07
7-19-93,1993-07-19
2/20-2033,2033-10-02
11102000,2000-10-11
2002/8/27,2002-08-27
8/13/2035,2035-08-13
13 Jan 2022,2022-01-13
27Apr2012,2012-04-27
3-8,2029-08-03
10-7-2027,2027-07-05
17/27/1993,1993-09-17
24/6-2025,2025-03-24
2028/9,2028-09-18
2:3:2023,2023-03-02
22/18-2017,2017-09-22
17th of July 2020,2020-07-17
7/22-2013,2013-11-07
2023/8/21,2023-08-21
"March 26, 2023",2023-03-26
2035/8/26,2035-08-26
28/9/2022,2022-03-28
21/7/30,2030-07-21
2020/8/2,2020-08-02
2012/9,2012-09-27
1997-1-10,1997-01-10
20102007,2007-10-20
7 April 2022,2022-04-07
9/33/2018,2018-11-09
19 July 2003,2003-07-19
1994/12,1994-12-03
22 tháng 10 năm 2015,2015-10-22
12.9.1997,1997-09-12
2.1.1996,1996-01-02
Jul 21 07,2007-07-21
18-5-2007,2007-05-18
"Feb 9th, 2010",2010-02-09
23/2-1998,1998-01-23
28122021,2021-12-28
7-9,2009-09-07
12 January 2005,2005-01-12
19 Jun 1995,1995-06-19
18 Au 2003,2003-08-18
24 Ju 2017,2017-07-24
"August 22, 2014",2014-08-22
11Mar2033,2033-03-11
"January 8, 2016",2016-01-08
2 tháng 1 năm 2020,2020-01-02
17 May 1998,1998-05-17
"Aug 23th, 2015",2015-08-23
13/12/06,2006-12-13
25 Se 2003,2003-09-25
2015/4/3,2015-04-03
2007/11,2007-11-04
1st of April 2006,2006-04-01
Feb 28 19,2019-02-28
17082002,2002-08-17
13.2.2003,2003-02-13
2019/1/16,2019-01-16
1997/1/6,1997-01-06
"Oct 8th, 2024",2024-10-08
20:12:2008,2008-12-20
17/6/2026,2026-06-17
2015/4/5,2015-04-05
26/9/1997,1997-03-26
25 Ap 1994,1994-04-25
5 Ju 2003,2003-07-05
14/10-2035,2035-10-14
10 Oc 2033,2033-10-10
11-4-35,2035-11-04
11Dec2002,2002-12-11
6:11:2007,2007-11-06
"Nov 17th, 1997",1997-11-17
10/6/1991,1991-02-10
1.2.2035,2035-02-01
19/8/20,2020-08-19
27Aug1997,1997-08-27
4/9/2014,2014-03-04
2021/5,2021-05-11
12.1.2010,2010-01-12
5/26/2033,2033-05-26
8 December 2023,2023-12-08
2 October 2001,2001-10-02
24061992,1992-06-24
"June 2, 2007",2007-06-02
24-7,2001-07-24
11102019,2019-10-11
8Apr2031,2031-04-08
38-1-2015,2015-01-19
1990/11,1990-11-14
"Sep 7th, 2032",2032-09-07
9:3:2018,2018-03-09
"Apr 14th, 2022",2022-04-14
12/12-2017,2017-12-12
6 tháng 4 năm 2009,2009-04-06
18/3-2031,2031-03-18
48-5-2033,2033-05-24
25 tháng 12 năm 2032,2032-12-25
23.10.2017,2017-10-23
2:12:2015,2015-12-02
Aug 22 34,2034-08-22
1/11/2002,2002-11-01
ngày 28 tháng 8 năm 2016,2016-08-28
15/4/97,1997-04-15
16/1/08,2008-01-16
2003/2/25,2003-02-25
Sep 13 14,2014-09-13
21/11/35,2035-11-21
26/4-1998,1998-04-26
16/3/2011,2011-03-16
18/9/1990,1990-03-18
2/11/2017,2017-02-11
1/12/34,2034-12-01
4 July 2005,2005-07-04
1991/8/5,1991-08-05
8/30/2000,2000-10-08
14-8-1997,1997-08-14
ngày 27 tháng 3 năm 2011,2011-03-27
21 tháng 7 năm 1990,1990-07-21
10/2/2025,2025-10-02
26/7/93,1993-07-26
21012024,2024-01-21
9/18/1994,1994-06-09
54-4-2010,2010-04-27
"Aug 7th, 2000",2000-08-07
ngày 15 tháng 1 năm 1992,1992-01-15
9 October 2012,2012-10-09
9/9/2013,2013-09-09
7th of June 2004,2004-06-07
25/7-1990,1990-07-25
"October 12, 2001",2001-10-12
ngày 5 tháng 9 năm 2013,2013-09-05
16-5-2016,2016-05-08
40-11-1994,1994-11-20
18102013,2013-10-18
27/24/2026,2026-08-27
17 Apr 2033,2033-04-17
1994-3-3,1994-03-03
2 tháng 9 năm 2008,2008-09-02
11Apr2013,2013-04-11
ngày 12 tháng 9 năm 2003,2003-09-12
10/23/09,2009-10-23
2-2-09,2009-02-02
13-3-2014,2014-03-13
6/10/2002,2002-06-10
14012026,2026-01-14
32-12-2018,2018-12-16
5/4-1993,1993-02-05
ngày 17 tháng 10 năm 2034,2034-10-17
6/16/00,2000-06-16
2021/11/18,2021-11-18
"Jan 3rd, 2026",2026-01-03
21-1,2009-01-21
9/10/31,2031-10-09
15/5/26,2026-05-15
2004/9/9,2004-09-09
18-12-2006,2006-12-18
3 tháng 5 năm 2015,2015-05-03
12 June 2033,2033-06-12
13/15/2010,2010-05-13
21/1-2006,2006-01-21
15/2-2030,2030-02-15
16/6/13,2013-06-16
8th of November 2015,2015-11-08
9Nov2000,2000-11-09
6/30/2022,2022-10-06
6/10-2027,2027-10-06
2 Mar 1991,1991-03-02
1 June 2027,2027-06-01
"Dec 23th, 2015",2015-12-23
1995/1,1995-01-16
2011/3/23,2011-03-23
18 tháng 2 năm 2005,2005-02-18
6.3.2006,2006-03-06
30-3-2033,2033-03-15
Jun 14 90,1990-06-14
"Oct 20th, 2000",2000-10-20
11-16-19,2019-11-16
22/7-1998,1998-07-22
3/7-1998,1998-07-03
9/7/20,2020-07-09
11/6/99,1999-06-11
4/7-2029,2029-07-04
13/7-2014,2014-07-13
12/4/2027,2027-12-04
22 No 2015,2015-11-22
26-9-2011,2011-09-13
17 Aug 1995,1995-08-17
13-7,2032-07-13
Mar 8 19,2019-03-08
24-9,2000-09-24
Jan 3 91,1991-01-03
21.4.2032,2032-04-21
27/9-2028,2028-09-27
56-3-1995,1995-03-28
6 November 2003,2003-11-06
14/3-2023,2023-03-14
7-4-96,1996-07-04
6/1-2001,2001-01-06
18th of April 1998,1998-04-18
ngày 19 tháng 6 năm 2011,2011-06-19
15 October 1997,1997-10-15
34-6-2021,2021-06-17
11/7/14,2014-07-11
24-8,2017-08-24
7/1-2021,2021-01-07
18-1,1996-01-18
4/4-2024,2024-02-04
ngày 18 tháng 4 năm 1992,1992-04-18
15 October 2018,2018-10-15
"Jun 17th, 2008",2008-06-17
6 Mar 1990,1990-03-06
27/36/2025,2025-12-27
19/9/2025,2025-03-19
22/10-2031,2031-05-22
14/3/23,2023-03-14
7.5.2012,2012-05-07
28th of May 2004,2004-05-28
27/5/21,2021-05-27
12 tháng 8 năm 2008,2008-08-12
27.11.2033,2033-11-27
24:8:1991,1991-08-24
"Jan 6th, 2010",2010-01-06
2029/2/12,2029-02-12
ngày 2 tháng 7 năm 2016,2016-07-02
7-20-34,2034-07-20
6/15/2026,2026-06-15
4/9/2021,2021-03-04
6/3/14,2014-06-03
2035/12,2035-12-22
8 Ma 2032,2032-05-08
2006/4/16,2006-04-16
16-3-1996,1996-03-16
12Oct2004,2004-10-12
24/30/2008,2008-10-24
28082023,2023-08-28
1/9-2017,2017-09-01
15Apr2023,2023-04-15
26-4,2020-04-26
2016-2-8,2016-02-08
Dec 12 92,1992-12-12
19/21/2034,2034-07-19
12.7.1994,1994-07-12
2003/1,2003-01-05
11-9-01,2001-11-09
25/1-1993,1993-01-25
32-6-2029,2029-06-16
19/12/31,2031-12-19
13/11-2004,2004-11-13
3 Apr 2032,2032-04-03
"April 24, 2020",2020-04-24
11 Apr 2019,2019-04-11
8/12-2016,2016-12-08
Jan 12 02,2002-01-12
2 tháng 1 năm 2002,2002-01-02
5/8-1995,1995-08-05
6/22-2030,2030-11-06
3/8/99,1999-03-08
19 Apr 2028,2028-04-19
1/8-2030,2030-08-01
14082018,2018-08-14
10-3-2011,2011-03-05
"September 12, 2023",2023-09-12
28/4-2029,2029-04-28
16/6/2023,2023-02-16
21.8.2008,2008-08-21
16/3/1996,1996-01-16
"November 13, 2026",2026-11-13
14-2,2031-02-14
16/3/97,1997-03-16
16-6-2020,2020-06-16
1 tháng 12 năm 1995,1995-12-01
9 July 2011,2011-07-09
15Sep2007,2007-09-15
13Jun2016,2016-06-13
"August 19, 1995",1995-08-19
15/7-2002,2002-07-15
21-10-2022,2022-10-21
1/2-2009,2009-02-01
16 Jan 2034,2034-01-16
08042025,2025-04-08
25.6.2014,2014-06-25
07122021,2021-12-07
"Jul 26th, 2027",2027-07-26
17/8-1990,1990-08-17
12-4,1992-04-12
3/11-2028,2028-11-03
"Dec 17th, 1995",1995-12-17
4/4/21,2021-04-04
42-11-2035,2035-11-21
1999/2/19,1999-02-19
2-10-96,1996-02-10
2/9/2015,2015-09-02
4/4/2026,2026-04-04
ngày 12 tháng 10 năm 2029,2029-10-12
15 November 2027,2027-11-15
21/15/1992,1992-05-21
2029/4,2029-04-03
"July 4, 2015",2015-07-04
27042001,2001-04-27
13/2/22,2022-02-13
1.5.2027,2027-05-01
8/30/2013,2013-10-08
25 Au 2032,2032-08-25
2015/3/19,2015-03-19
56-12-2006,2006-12-28
14/10-2022,2022-10-14
26/10-2005,2005-05-26
2/20/91,1991-02-20
26/3/30,2030-03-26
19.2.2022,2022-02-19
7-12-92,1992-07-12
13-9-1995,1995-09-13
2-8-2007,2007-08-02
7/14-1991,1991-07-07
3/3-2013,2013-03-03
21-4,2035-04-21
4-22-21,2021-04-22
1993/6/28,1993-06-28
2023-9-19,2023-09-19
7/12/94,1994-07-12
1999/3,1999-03-24
17/10-2027,2027-05-17
10/1-2004,2004-01-10
21/9/2016,2016-03-21
11:11:1994,1994-11-11
13/4/33,2033-04-13
13/1/2012,2012-01-13
15/6/1995,1995-02-15
2019-2-10,2019-02-10
23.7.2009,2009-07-23
7Sep2016,2016-09-07
16 Dec 2012,2012-12-16
Apr 18 24,2024-04-18
2029-12-6,2029-12-06
4th of November 1998,1998-11-04
2007/5,2007-05-05
"Jun 3rd, 1993",1993-06-03
2025/5,2025-05-26
17.6.1995,1995-06-17
6 October 2004,2004-10-06
20-6,2023-06-20
5/22-1996,1996-11-05
ngày 2 tháng 5 năm 2033,2033-05-02
21 tháng 5 năm 2018,2018-05-21
3/11/06,2006-11-03
"Jan 26th, 1997",1997-01-26
"June 10, 2005",2005-06-10
8/5-2017,2017-05-08
18/6-2013,2013-03-18
24032025,2025-03-24
8/2/18,2018-08-02
11 Oct 2003,2003-10-11
"May 14, 2009",2009-05-14
11/12-2028,2028-12-11
16-6-2001,2001-06-16
1996-10-4,1996-10-04
13Jul2020,2020-07-13
18 tháng 8 năm 1991,1991-08-18
1st of July 2012,2012-07-01
"Dec 9th, 2035",2035-12-09
7/11/2005,2005-07-11
23:6:1996,1996-06-23
12-9-2035,2035-09-12
1/36/2031,2031-12-01
1995/5,1995-05-04
7 tháng 2 năm 2026,2026-02-07
16/6-2031,2031-03-16
10th of November 2013,2013-11-10
18/2-2010,2010-02-18
12Sep2013,2013-09-12
6-1-2026,2026-01-03
11/7/2005,2005-11-07
18:9:2014,2014-09-18
14/22-2021,2021-11-14
3/1/2009,2009-01-03
21th of October 2027,2027-10-21
8-6-2015,2015-06-04
25 Aug 2008,2008-08-25
3/22-1997,1997-11-03
7/6/33,2033-06-07
10/7-2026,2026-07-10
18/21/2027,2027-07-18
7/26/1991,1991-07-26
8-6-14,2014-08-06
25:10:2023,2023-10-25
23-12-2003,2003-12-23
2/20/2020,2020-02-20
2-2-2019,2019-02-02
"March 20, 2034",2034-03-20
23/36/2008,2008-12-23
7/2-2035,2035-02-07
6/7-2009,2009-07-06
2028/12,2028-12-02
1990/5/5,1990-05-05
Oct 5 93,1993-10-05
12 July 2027,2027-07-12
15.4.2021,2021-04-15
14/2-2035,2035-02-14
3/12-2035,2035-06-03
2009-7-16,2009-07-16
"Jun 2nd, 2031",2031-06-02
8/1/02,2002-01-08
17011995,1995-01-17
2018/8/10,2018-08-10
03122027,2027-12-03
15/5-1999,1999-05-15
27th of September 2026,2026-09-27
9-8-98,1998-09-08
4/15/15,2015-04-15
21/36/1996,1996-12-21
4/28/2016,2016-04-28
26-1-2015,2015-01-13
4 Ja 2025,2025-01-04
2016-4-15,2016-04-15
19Nov1995,1995-11-19
19 Fe 2011,2011-02-19
"October 1, 2006",2006-10-01
50-12-2001,2001-12-25
9/20-2035,2035-10-09
16/7/26,2026-07-16
5-12-2005,2005-12-05
7/4/2007,2007-04-07
6-2,1996-02-06
"February 27, 2035",2035-02-27
14/8/98,1998-08-14
26-11-1995,1995-11-26
5 tháng 11 năm 2019,2019-11-05
"May 24th, 2012",2012-05-24
1-4-2007,2007-04-01
"Sep 10th, 1997",1997-09-10
16122033,2033-12-16
1992/9/11,1992-09-11
"September 18, 2006",2006-09-18
2022/6,2022-06-15
ngày 1 tháng 11 năm 1991,1991-11-01
16 February 2014,2014-02-16
24.2.2020,2020-02-24
15 Sep 2016,2016-09-15
18 tháng 11 năm 1997,1997-11-18
4/9/2019,2019-03-04
20 Ja 1992,1992-01-20
3-4-02,2002-03-04
2029-6-15,2029-06-15
2-24-06,2006-02-24
"June 23, 1997",1997-06-23
28/3/1990,1990-01-28
2032/4,2032-04-15
19/10/93,1993-10-19
9/2-2005,2005-01-09
5/8/1997,1997-05-08
16/10-1999,1999-05-16
5/25/34,2034-05-25
14/9/05,2005-09-14
"November 25, 2002",2002-11-25
2-25-22,2022-02-25
13/6/98,1998-06-13
2029/4/24,2029-04-24
8/8-2027,2027-08-08
"Jun 2nd, 1992",1992-06-02
"November 24, 2022",2022-11-24
28/8-2026,2026-04-28
6/2/2025,2025-06-02
5/8/95,1995-08-05
5.10.2021,2021-10-05
23.11.1998,1998-11-23
22.11.2006,2006-11-22
20-1,1992-01-20
28:6:2029,2029-06-28
20-12,2019-12-20
6/17/2035,2035-06-17
6 May 2001,2001-05-06
13/10/2022,2022-10-13
2007/1,2007-01-15
2002/9/20,2002-09-20
2019/11/12,2019-11-12
13Oct2000,2000-10-13
2033/11/5,2033-11-05
4/18-2027,2027-09-04
3-15-27,2027-03-15
20 March 2011,2011-03-20
21122001,2001-12-21
1.6.2029,2029-06-01
17/5/24,2024-05-17
14/1-2012,2012-01-14
2015/10,2015-10-26
3rd of January 2001,2001-01-03
19 June 2000,2000-06-19
26/12-2031,2031-12-26
"Oct 16th, 2032",2032-10-16
"June 21, 2032",2032-06-21
2024-11-26,2024-11-26
19-1-2033,2033-01-19
15May2005,2005-05-15
"October 8, 2026",2026-10-08
15 tháng 12 năm 2016,2016-12-15
12/6-2027,2027-03-12
2015/3,2015-03-08
12/2/06,2006-02-12
ngày 27 tháng 12 năm 2009,2009-12-27
42-11-1990,1990-11-21
4Mar2030,2030-03-04
32-3-2005,2005-03-16
13 Dec 2007,2007-12-13
1/3/05,2005-03-01
15-3,1998-03-15
"April 28, 1996",1996-04-28
Nov 26 92,1992-11-26
21:9:2032,2032-09-21
2015/7/15,2015-07-15
12-17-28,2028-12-17
2/2/07,2007-02-02
2025-7-7,2025-07-07
7-28-18,2018-07-28
21Mar2009,2009-03-21
15th of June 1999,1999-06-15
"Dec 25th, 2016",2016-12-25
16/3/94,1994-03-16
2030-12-26,2030-12-26
4/12/2012,2012-04-04
6:6:2023,2023-06-06
9-6-08,2008-09-06
12 tháng 9 năm 2003,2003-09-12
18-4,2032-04-18
12/21/2004,2004-12-21
2035/3/10,2035-03-10
25/8-2001,2001-08-25
ngày 15 tháng 11 năm 2004,2004-11-15
"November 25, 1992",1992-11-25
1-18-96,1996-01-18
1993/1/19,1993-01-19
14/6/2007,2007-02-14
Jan 13 91,1991-01-13
14 Mar 2030,2030-03-14
7/18/2025,2025-06-07
13:11:1993,1993-11-13
17Jan1992,1992-01-17
ngày 11 tháng 9 năm 2032,2032-09-11
17/1-1994,1994-01-17
2028-2-3,2028-02-03
18-3-2015,2015-03-09
ngày 18 tháng 6 năm 1997,1997-06-18
3-1-2006,2006-01-03
16 January 2020,2020-01-16
10-15-20,2020-10-15
10 Nov 2017,2017-11-10
15-10-2027,2027-10-15
2/1/13,2013-01-02
17 tháng 4 năm 2000,2000-04-17
5-15-99,1999-05-15
6 July 2015,2015-07-06
6/11/2009,2009-11-06
11 Mar 1994,1994-03-11
7/10/18,2018-10-07
9/14-2032,2032-07-09
17:1:1995,1995-01-17
11/4/19,2019-04-11
12/30/2009,2009-10-12
50-6-1993,1993-06-25
"April 11, 2004",2004-04-11
Aug 23 24,2024-08-23
3Dec2013,2013-12-03
26-7-2034,2034-07-26
2/8-1994,1994-08-02
4-18-09,2009-04-18
14/9-2026,2026-09-14
18th of May 2031,2031-05-18
2035/5/10,2035-05-10
27-9,2022-09-27
14/7/2034,2034-07-14
20:11:2005,2005-11-20
"March 17, 2034",2034-03-17
11.5.2016,2016-05-11
16/6/1990,1990-06-16
52-9-2026,2026-09-26
2032-8-16,2032-08-16
6-22-27,2027-06-22
19/16-2020,2020-08-19
8/1/11,2011-01-08
14052019,2019-05-14
26-11-2003,2003-11-13
Jun 16 16,2016-06-16
10.3.2027,2027-03-10
3-11-19,2019-03-11
3rd of April 2009,2009-04-03
26 No 2009,2009-11-26
30-10-2000,2000-10-15
12/6-2024,2024-06-12
26Jul2034,2034-07-26
25-1,2011-01-25
28 Au 1990,1990-08-28
13.1.2023,2023-01-13
11:2:2004,2004-02-11
6/7/2034,2034-07-06
ngày 3 tháng 5 năm 2002,2002-05-03
02111991,1991-11-02
1/9/11,2011-01-09
21/6-2015,2015-06-21
11/8-1991,1991-08-11
28 tháng 8 năm 2007,2007-08-28
13 tháng 2 năm 2026,2026-02-13
6:4:1996,1996-04-06
08122026,2026-12-08
"Jan 19th, 2006",2006-01-19
7 Feb 2008,2008-02-07
28/8-2016,2016-04-28
7/10/1992,1992-10-07
"May 9, 1991",1991-05-09
17:12:2021,2021-12-17
27 December 1995,1995-12-27
27/7-2033,2033-07-27
18 tháng 9 năm 2022,2022-09-18
18/16-2024,2024-08-18
24/3-2004,2004-03-24
3/24/2013,2013-08-03
2003/4,2003-04-05
6-1-2025,2025-01-03
3-2-2027,2027-02-03
2/27/1994,1994-09-02
21 De 2019,2019-12-21
"July 18, 2026",2026-07-18
17 tháng 9 năm 2029,2029-09-17
27 Dec 2004,2004-12-27
10 tháng 4 năm 2016,2016-04-10
24/3/2031,2031-01-24
28Oct2009,2009-10-28
8-22-17,2017-08-22
1994/1/25,1994-01-25
"March 11, 2000",2000-03-11
3/3/27,2027-03-03
10/14/2000,2000-10-14
16 Ap 2002,2002-04-16
27th of January 2020,2020-01-27
23-10,1994-10-23
20/6-2003,2003-03-20
23/12/2022,2022-12-23
13 tháng 4 năm 2025,2025-04-13
"Apr 25th, 2000",2000-04-25
11/10-2005,2005-05-11
"Dec 28th, 1994",1994-12-28
10:8:2032,2032-08-10
1-24-03,2003-01-24
3rd of September 2008,2008-09-03
18/18/2018,2018-06-18
5Jan2012,2012-01-05
8/6-2020,2020-06-08
12112002,2002-11-12
22/2-2022,2022-01-22
26-5-1999,1999-05-13
7-16-15,2015-07-16
9 February 2031,2031-02-09
28/10/09,2009-10-28
6 Oct 2029,2029-10-06
21/11-2022,2022-11-21
3 September 1993,1993-09-03
1Feb2026,2026-02-01
11 Mar 2009,2009-03-11
7 September 2022,2022-09-07
5/3/20,2020-03-05
20 Ma 2002,2002-03-20
12 Feb 2016,2016-02-12
4-12,2031-12-04
3-22-91,1991-03-22
6/14-1994,1994-07-06
8/1-2033,2033-01-08
12-8-2015,2015-08-12
10 De 2033,2033-12-10
6/8-2026,2026-08-06
1995-6-8,1995-06-08
8th of July 2013,2013-07-08
16 August 2021,2021-08-16
19/2/31,2031-02-19
17 Oc 2032,2032-10-17
08011990,1990-01-08
17.3.2012,2012-03-17
1994/2/9,1994-02-09
22/7-1992,1992-07-22
8/6/23,2023-06-08
26th of May 2004,2004-05-26
"May 5th, 2030",2030-05-05
2000/7/18,2000-07-18
12/24/2008,2008-12-24
2007-1-13,2007-01-13
9/22-2016,2016-11-09
25/8/2035,2035-08-25
4-7-2019,2019-07-02
26 No 2011,2011-11-26
5Aug2002,2002-08-05
22/6/27,2027-06-22
2.4.2020,2020-04-02
22:1:2013,2013-01-22
21 tháng 8 năm 2009,2009-08-21
27-12-1998,1998-12-27
14062016,2016-06-14
15/8-2017,2017-04-15
26 De 2016,2016-12-26
"May 6, 2029",2029-05-06
ngày 18 tháng 6 năm 1993,1993-06-18
21081991,1991-08-21
27:2:2017,2017-02-27
"June 10, 2030",2030-06-10
2002-2-24,2002-02-24
28/12/30,2030-12-28
2025-4-17,2025-04-17
3/6/2026,2026-03-06
12/7/2022,2022-07-12
22 tháng 3 năm 2032,2032-03-22
23-6-2011,2011-06-23
"September 4, 1991",1991-09-04
Nov 10 30,2030-11-10
18 Jun 1991,1991-06-18
18022017,2017-02-18
24 Sep 1999,1999-09-24
28-6-2011,2011-06-14
25.3.1993,1993-03-25
28 Oct 1993,1993-10-28
6-1-2022,2022-01-03
21.11.2021,2021-11-21
2027-11-16,2027-11-16
Jun 14 35,2035-06-14
Oct 6 14,2014-10-06
19/11/2001,2001-11-19
"Jan 17th, 1992",1992-01-17
25 tháng 1 năm 1999,1999-01-25
3/23/2029,2029-03-23
28/30/2007,2007-10-28
11 tháng 11 năm 1992,1992-11-11
21th of November 1992,1992-11-21
7/4/18,2018-07-04
7/2/95,1995-02-07
15:4:2034,2034-04-15
"September 1, 2016",2016-09-01
27.4.2020,2020-04-27
3:4:2035,2035-04-03
1-9,2021-09-01
8/28/27,2027-08-28
2/7/2007,2007-02-07
6/30/1997,1997-10-06
23/7-2019,2019-07-23
15102002,2002-10-15
"Jul 10th, 2017",2017-07-10
19 Ma 1991,1991-05-19
Jul 11 95,1995-07-11
24-11-2018,2018-11-24
15/33/2007,2007-11-15
10 March 1997,1997-03-10
"March 6, 2021",2021-03-06
17.4.2035,2035-04-17
21/2-2005,2005-01-21
17 Fe 2011,2011-02-17
26 Mar 2012,2012-03-26
Aug 9 90,1990-08-09
"Apr 24th, 2015",2015-04-24
16 Dec 2020,2020-12-16
18/14-2013,2013-07-18
2/6/2031,2031-02-02
2035/4/7,2035-04-07
26th of June 2013,2013-06-26
10-10-2002,2002-10-05
04122021,2021-12-04
10 Aug 2005,2005-08-10
2023/7,2023-07-27
5:3:2026,2026-03-05
9/6/00,2000-06-09
2013/9,2013-09-24
"Sep 6th, 1992",1992-09-06
18Sep2018,2018-09-18
22/5-2010,2010-05-22
12-3-09,2009-12-03
23th of April 2017,2017-04-23
8-14-12,2012-08-14
15/4-2027,2027-02-15
02102005,2005-10-02
26 tháng 1 năm 2012,2012-01-26
11:12:2010,2010-12-11
24 August 2025,2025-08-24
28-3,2031-03-28
2023/3,2023-03-22
1999/9,1999-09-27
6:7:2007,2007-07-06
"November 14, 2024",2024-11-14
6 March 1996,1996-03-06
1/10-2014,2014-10-01
2024/9/13,2024-09-13
27:8:1992,1992-08-27
8 tháng 8 năm 2003,2003-08-08
5 Ma 2007,2007-05-05
12/22-1993,1993-11-12
22/11-2026,2026-11-22
Oct 22 12,2012-10-22
30-12-2014,2014-12-15
8Jan2009,2009-01-08
4/26/2027,2027-04-26
3/12/00,2000-12-03
21-7,2006-07-21
2017/12/15,2017-12-15
13/1/31,2031-01-13
2003/7/16,2003-07-16
4:11:2014,2014-11-04
9-3-2026,2026-03-09
1/20-2013,2013-10-01
10/27/2023,2023-09-10
28Apr2025,2025-04-28
"October 11, 2021",2021-10-11
16th of January 2015,2015-01-16
27/11-2010,2010-11-27
1/10/2012,2012-01-10
13/4/31,2031-04-13
23-1,1994-01-23
5 Feb 1994,1994-02-05
22/14-2002,2002-07-22
22/12/2026,2026-04-22
"April 10, 2014",2014-04-10
17th of September 2017,2017-09-17
12-7-24,2024-12-07
"September 5, 2017",2017-09-05
18/15/2012,2012-05-18
ngày 9 tháng 9 năm 2028,2028-09-09
2015-11-17,2015-11-17
ngày 9 tháng 11 năm 2024,2024-11-09
11 Apr 2024,2024-04-11
5 Jul 1999,1999-07-05
1Jun1998,1998-06-01
2004/1/27,2004-01-27
"Sep 11th, 1994",1994-09-11
12.4.2004,2004-04-12
01121992,1992-12-01
18/2/2032,2032-02-18
1995/2/22,1995-02-22
9/15/2031,2031-05-09
5/11/1995,1995-05-11
5-4-2019,2019-04-05
16-6-2010,2010-06-08
23/10-2015,2015-05-23
11-4-90,1990-11-04
20/10-2013,2013-05-20
25Apr1991,1991-04-25
21.9.1998,1998-09-21
22.1.1997,1997-01-22
5-5-92,1992-05-05
"October 11, 2004",2004-10-11
17/4-2014,2014-04-17
Feb 4 25,2025-02-04
36-2-2028,2028-02-18
2026/7/20,2026-07-20
2028/3/7,2028-03-07
5.4.2023,2023-04-05
19.4.2004,2004-04-19
40-3-1990,1990-03-20
6-11-2010,2010-11-06
2017/5,2017-05-23
"June 19, 2021",2021-06-19
13/8-2009,2009-04-13
ngày 11 tháng 6 năm 2030,2030-06-11
17th of June 2016,2016-06-17
Jan 27 29,2029-01-27
7/5/06,2006-05-07
4th of March 2013,2013-03-04
ngày 11 tháng 12 năm 2025,2025-12-11
4 tháng 12 năm 2025,2025-12-04
Feb 6 12,2012-02-06
10 tháng 9 năm 1995,1995-09-10
1 August 1998,1998-08-01
2 Jul 2027,2027-07-02
11/16/96,1996-11-16
11 Ju 2024,2024-06-11
12/2-2024,2024-01-12
2003/4/2,2003-04-02
18 October 1995,1995-10-18
23 tháng 9 năm 1997,1997-09-23
2031/8/25,2031-08-25
6 tháng 1 năm 2021,2021-01-06
8/15/29,2029-08-15
18Aug2027,2027-08-18
2012-2-12,2012-02-12
4-8-2007,2007-08-04
4-6-1995,1995-06-02
14.4.2019,2019-04-14
"November 1, 2032",2032-11-01
2029/1,2029-01-10
5:11:1998,1998-11-05
21/2-1997,1997-02-21
May 9 92,1992-05-09
2032/3/13,2032-03-13
1st of March 2000,2000-03-01
07031991,1991-03-07
2-7-05,2005-02-07
"Jan 28th, 2020",2020-01-28
2031/3,2031-03-09
12-1-2024,2024-01-12
6/2/31,2031-02-06
7/10/32,2032-10-07
21-12,2021-12-21
ngày 13 tháng 11 năm 2005,2005-11-13
21/1/31,2031-01-21
Sep 11 27,2027-09-11
"Aug 12th, 2005",2005-08-12
6-4-2022,2022-04-06
"Aug 5th, 1990",1990-08-05
16 Feb 2029,2029-02-16
Oct 14 34,2034-10-14
1.9.1997,1997-09-01
8:1:2010,2010-01-08
2024/10,2024-10-21
Mar 28 00,2000-03-28
7/3/34,2034-03-07
24 July 2013,2013-07-24
5 Nov 2001,2001-11-05
25-4-2020,2020-04-25
"Jul 24th, 2035",2035-07-24
2017-1-3,2017-01-03
2007/7/24,2007-07-24
27/6-2008,2008-03-27
11-13-35,2035-11-13
1999/8,1999-08-10
1/9/2010,2010-09-01
"Dec 8th, 1991",1991-12-08
22/5-1990,1990-05-22
"April 8, 2003",2003-04-08
27/12/27,2027-12-27
13 tháng 4 năm 2024,2024-04-13
26/4-2025,2025-04-26
19-1,2035-01-19
1998-5-3,1998-05-03
2/7/2017,2017-02-07
19/6-2030,2030-06-19
15/3/2018,2018-01-15
12:1:2018,2018-01-12
6-25-93,1993-06-25
14/21/1996,1996-07-14
15/1/2021,2021-01-15
15/10-2020,2020-10-15
12/13/93,1993-12-13
"Nov 2nd, 1995",1995-11-02
"October 13, 1991",1991-10-13
23:7:2019,2019-07-23
7th of April 2008,2008-04-07
16-4-2007,2007-04-16
5/22-1998,1998-11-05
17-8-2013,2013-08-17
20/11/1991,1991-11-20
19/2-2015,2015-02-19
10/6-1990,1990-03-10
56-3-2034,2034-03-28
2007/12,2007-12-02
16-12,2033-12-16
3-15-18,2018-03-15
20112028,2028-11-20
"Apr 26th, 2018",2018-04-26
10.5.2012,2012-05-10
9 tháng 6 năm 2016,2016-06-09
2002/10/4,2002-10-04
23 January 2013,2013-01-23
23092002,2002-09-23
ngày 1 tháng 3 năm 2012,2012-03-01
28:11:1993,1993-11-28
10/11/12,2012-10-11
21th of April 2028,2028-04-21
2020/12,2020-12-03
28 No 2004,2004-11-28
10.6.2009,2009-06-10
9th of November 2031,2031-11-09
1993/6/9,1993-06-09
12/18/2022,2022-06-12
12.1.2019,2019-01-12
12/6/1990,1990-06-12
12 November 1996,1996-11-12
5-15-25,2025-05-15
21-12-2004,2004-12-21
Jul 22 10,2010-07-22
1/5/93,1993-05-01
18-8,2033-08-18
17032015,2015-03-17
22-5,1993-05-22
2006/3/22,2006-03-22
2033-7-1,2033-07-01
32-1-2017,2017-01-16
2-1,2008-01-02
5Sep2003,2003-09-05
16/7-2031,2031-07-16
21 Ja 2013,2013-01-21
"June 21, 2027",2027-06-21
23/9/10,2010-09-23
7-26-23,2023-07-26
6:6:2006,2006-06-06
13 January 2032,2032-01-13
"August 27, 2032",2032-08-27
25 No 2023,2023-11-25
07042016,2016-04-07
27/4/07,2007-04-27
28/7-2028,2028-07-28
11 tháng 12 năm 2003,2003-12-11
11th of October 2030,2030-10-11
"December 22, 1996",1996-12-22
2/23/23,2023-02-23
6/7/2033,2033-07-06
48-7-2024,2024-07-24
4/5/1995,1995-04-05
7/12/2028,2028-07-12
"July 14, 2021",2021-07-14
28 Oc 2005,2005-10-28
14/8/10,2010-08-14
Mar 4 13,2013-03-04
20-8-2001,2001-08-10
1/3-2034,2034-03-01
28 Sep 2025,2025-09-28
02022028,2028-02-02
1/13/1995,1995-01-13
27/2/92,1992-02-27
23/3/19,2019-03-23
8/11/20,2020-11-08
25 Ma 2015,2015-05-25
21 tháng 5 năm 2004,2004-05-21
20/9/2030,2030-09-20
2031/11/16,2031-11-16
"March 14, 2011",2011-03-14
16061997,1997-06-16
2015-7-19,2015-07-19
Sep 4 05,2005-09-04
"February 1, 2004",2004-02-01
27/3/14,2014-03-27
7-12,2020-12-07
Aug 18 00,2000-08-18
"Jan 9th, 1996",1996-01-09
"Jun 1st, 2017",2017-06-01
7-8-00,2000-07-08
"Feb 26th, 2028",2028-02-26
2 April 2008,2008-04-02
12 tháng 7 năm 2027,2027-07-12
2024/1,2024-01-03
Nov 9 06,2006-11-09
"October 9, 2031",2031-10-09
9/9/2015,2015-09-09
5.3.2034,2034-03-05
15 January 2007,2007-01-15
3 Nov 2034,2034-11-03
23/6/06,2006-06-23
2014-6-16,2014-06-16
21th of February 1995,1995-02-21
Nov 3 13,2013-11-03
16Jun1996,1996-06-16
19/1/2029,2029-01-19
2021/11/18,2021-11-18
06082022,2022-08-06
17 December 2035,2035-12-17
2024/1,2024-01-23
27May2015,2015-05-27
11.2.1990,1990-02-11
27/4/27,2027-04-27
1-14-18,2018-01-14
28 tháng 3 năm 1993,1993-03-28
2-27-01,2001-02-27
ngày 23 tháng 3 năm 2025,2025-03-23
Nov 17 96,1996-11-17
11/30/2017,2017-10-11
4-1-2003,2003-01-04
6/6/02,2002-06-06
20Mar2008,2008-03-20
2004/9/16,2004-09-16
15 tháng 3 năm 1998,1998-03-15
2022-10-27,2022-10-27
12/27/2019,2019-09-12
May 9 07,2007-05-09
1994/9/17,1994-09-17
2003-11-2,2003-11-02
1:1:1999,1999-01-01
ngày 5 tháng 9 năm 2025,2025-09-05
50-10-2029,2029-10-25
12-11-94,1994-12-11
2/2/25,2025-02-02
27th of November 2015,2015-11-27
11/9/2003,2003-11-09
1 tháng 7 năm 2003,2003-07-01
8/11-2018,2018-11-08
13.5.2026,2026-05-13
13 Au 2013,2013-08-13
1/11/1998,1998-01-11
Oct 2 15,2015-10-02
17/4/21,2021-04-17
27th of February 2022,2022-02-27
5-12,2032-12-05
12/7/91,1991-07-12
1/10/2002,2002-01-10
10/21/1998,1998-07-10
21-1,2002-01-21
14 Se 2006,2006-09-14
19/18-2000,2000-09-19
ngày 20 tháng 1 năm 2016,2016-01-20
1/3/29,2029-01-03
23.7.2016,2016-07-23
13/3-2004,2004-03-13
17/11/2030,2030-11-17
13.11.2011,2011-11-13
6 November 2015,2015-11-06
14 tháng 4 năm 2033,2033-04-14
23032014,2014-03-23
12 September 2025,2025-09-12
14/6-2019,2019-06-14
24Nov2024,2024-11-24
6/10-2005,2005-10-06
26/4-2031,2031-02-26
ngày 2 tháng 12 năm 2001,2001-12-02
2012/4,2012-04-13
22/3-2017,2017-03-22
21/5/94,1994-05-21
22-2,2006-02-22
1/4/2013,2013-01-04
15/3-2013,2013-03-15
12/5-2011,2011-05-12
10/4-2006,2006-04-10
9/9/90,1990-09-09
26-2-2004,2004-02-13
"April 16, 2021",2021-04-16
20/18/2002,2002-06-20
2009-6-23,2009-06-23
3/14-2033,2033-07-03
9 July 2019,2019-07-09
"October 28, 2012",2012-10-28
5Dec2020,2020-12-05
3/1/17,2017-03-01
4/11-2033,2033-11-04
ngày 8 tháng 2 năm 2022,2022-02-08
7-23-91,1991-07-23
2015-11-22,2015-11-22
24042011,2011-04-24
23th of February 2011,2011-02-23
27Jan2027,2027-01-27
10 September 2034,2034-09-10
7/15/1997,1997-05-07
9.4.2015,2015-04-09
11/5/06,2006-11-05
8/14/2035,2035-08-14
27/6/2013,2013-06-27
1/18/20,2020-01-18
52-4-1999,1999-04-26
16031998,1998-03-16
"September 2, 2028",2028-09-02
"Jul 25th, 2016",2016-07-25
5 De 1998,1998-12-05
18/8/05,2005-08-18
18/6-2010,2010-06-18
4 September 2030,2030-09-04
2015-6-19,2015-06-19
12/11/2013,2013-12-11
27-5-2013,2013-05-27
2 May 2032,2032-05-02
11/21/1991,1991-11-21
19 Ma 2004,2004-05-19
1-19-35,2035-01-19
16 tháng 12 năm 1998,1998-12-16
8-7-96,1996-08-07
17 May 1995,1995-05-17
"May 8, 2021",2021-05-08
54-6-2008,2008-06-27
4 Ja 1995,1995-01-04
14-1,2007-01-14
ngày 17 tháng 9 năm 2004,2004-09-17
2029-3-22,2029-03-22
9:9:1993,1993-09-09
3/8-2000,2000-04-03
23 Jun 2001,2001-06-23
1/6/2031,2031-06-01
23 November 2005,2005-11-23
26:6:2025,2025-06-26
8.12.1998,1998-12-08
27Jan2019,2019-01-27
16/2/95,1995-02-16
14Jan2029,2029-01-14
Dec 11 13,2013-12-11
3-8-26,2026-03-08
23 Jul 1995,1995-07-23
23/5-2011,2011-05-23
Aug 17 23,2023-08-17
09112019,2019-11-09
Aug 19 14,2014-08-19
13 Ju 2025,2025-07-13
5 Ju 1994,1994-06-05
17Jan1995,1995-01-17
27 Au 1995,1995-08-27
2001-2-22,2001-02-22
"Jul 10th, 2011",2011-07-10
4/24/29,2029-04-24
11 tháng 10 năm 2031,2031-10-11
1Dec2002,2002-12-01
ngày 10 tháng 7 năm 1993,1993-07-10
19.4.1990,1990-04-19
22 July 2022,2022-07-22
5/11-2005,2005-11-05
3-24-03,2003-03-24
15/30/2021,2021-10-15
26.1.2011,2011-01-26
2019-6-3,2019-06-03
6/15/2024,2024-05-06
ngày 14 tháng 6 năm 2024,2024-06-14
2/9-2002,2002-09-02
6-4-93,1993-06-04
16-7-2020,2020-07-16
1Nov1991,1991-11-01
32-1-2026,2026-01-16
12 Feb 2033,2033-02-12
9/6/2004,2004-02-09
6 Jun 2003,2003-06-06
1/11-1990,1990-11-01
1.10.2018,2018-10-01
2033/4/16,2033-04-16
27/6-2034,2034-03-27
19/8/30,2030-08-19
24-7-2006,2006-07-12
2033-1-16,2033-01-16
"Feb 11th, 2004",2004-02-11
21/10/16,2016-10-21
2 Mar 2027,2027-03-02
"November 9, 2030",2030-11-09
6/12/2021,2021-04-06
9.8.2029,2029-08-09
2004/4,2004-04-19
14.8.2034,2034-08-14
7-1-96,1996-07-01
26022033,2033-02-26
10-19-02,2002-10-19
21 Aug 2010,2010-08-21
Jan 9 21,2021-01-09
27 Fe 2017,2017-02-27
22-6,1997-06-22
8th of July 2000,2000-07-08
10/19/2008,2008-10-19
22-5-1990,1990-05-11
5/2/00,2000-05-02
17 Fe 2034,2034-02-17
7.11.2022,2022-11-07
2005-8-20,2005-08-20
5/9/02,2002-09-05
15 tháng 12 năm 2025,2025-12-15
Oct 24 31,2031-10-24
2016/1/14,2016-01-14
25 June 1996,1996-06-25
24/11/02,2002-11-24
30-1-2035,2035-01-15
5 Jul 1994,1994-07-05
13/12/20,2020-12-13
18.2.1999,1999-02-18
"August 27, 2022",2022-08-27
17/4/21,2021-04-17
23/8-2002,2002-08-23
2028/1,2028-01-28
Jan 4 14,2014-01-04
2022/2,2022-02-16
2005-12-12,2005-12-12
11-16-24,2024-11-16
5-19-35,2035-05-19
11/21/1993,1993-11-21
27 Sep 2004,2004-09-27
25032001,2001-03-25
16 Mar 2003,2003-03-16
4/6/18,2018-04-06
20/11/92,1992-11-20
25-8,2026-08-25
11/14/2009,2009-11-14
14Nov2013,2013-11-14
2014-10-13,2014-10-13
9.3.2024,2024-03-09
23 Sep 2011,2011-09-23
27:5:2023,2023-05-27
5/5/2019,2019-05-05
15 Dec 2006,2006-12-15
25/5/2012,2012-05-25
5/9/2017,2017-03-05
2-7-29,2029-02-07
14-9,2035-09-14
2/9/33,2033-09-02
ngày 20 tháng 12 năm 2014,2014-12-20
ngày 12 tháng 11 năm 2016,2016-11-12
5/10/28,2028-10-05
23-3,2030-03-23
20Dec2022,2022-12-20
15.2.1997,1997-02-15
15/4-2015,2015-04-15
20-7-2021,2021-07-10
24012014,2014-01-24
10/26/92,1992-10-26
4/28/2004,2004-04-28
6 May 2003,2003-05-06
"Apr 27th, 2008",2008-04-27
"Aug 5th, 2028",2028-08-05
12th of June 2004,2004-06-12
"Jul 3rd, 1998",1998-07-03
14/7/24,2024-07-14
17 Ap 2005,2005-04-17
4/21/25,2025-04-21
21 tháng 1 năm 2024,2024-01-21
4/15/2020,2020-05-04
7/11/30,2030-11-07
20/1-2007,2007-01-20
25 April 2028,2028-04-25
20:3:2034,2034-03-20
2022/12,2022-12-01
4-24-16,2016-04-24
3/1/2017,2017-01-03
ngày 25 tháng 2 năm 2028,2028-02-25
5/28/2019,2019-05-28
3-14-12,2012-03-14
7Jul2028,2028-07-07
26/20-2032,2032-10-26
1/6/27,2027-06-01
20:10:2003,2003-10-20
6/9/19,2019-09-06
03062015,2015-06-03
2/15/2015,2015-05-02
17 October 2032,2032-10-17
8/1/20,2020-08-01
1990/1/12,1990-01-12
26.10.2028,2028-10-26
10Jul2033,2033-07-10
6/3/2026,2026-06-03
"Jul 25th, 1996",1996-07-25
13 August 1998,1998-08-13
7 Ju 2024,2024-07-07
8/12-2033,2033-06-08
12041993,1993-04-12
16/8-2018,2018-04-16
19.1.2000,2000-01-19
1/19/2027,2027-01-19
22:5:2003,2003-05-22
ngày 11 tháng 5 năm 2028,2028-05-11
14 Ma 1992,1992-05-14
"Oct 25th, 1998",1998-10-25
25082029,2029-08-25
19-8-2008,2008-08-19
16/2-1990,1990-01-16
4/12-2021,2021-06-04
18.6.2002,2002-06-18
8 tháng 4 năm 1994,1994-04-08
12th of December 1999,1999-12-12
2010-8-23,2010-08-23
8.3.1990,1990-03-08
9/4-2034,2034-04-09
6-2-33,2033-06-02
"Feb 26th, 1995",1995-02-26
38-8-1996,1996-08-19
8 Ma 1993,1993-03-08
5-1-05,2005-05-01
14/5/2033,2033-05-14
14/24/1993,1993-08-14
4 tháng 11 năm 1990,1990-11-04
1991/12,1991-12-06
16/2/02,2002-02-16
2000-12-17,2000-12-17
12Jan1992,1992-01-12
19112005,2005-11-19
1992/12/14,1992-12-14
9 January 2029,2029-01-09
3Oct1990,1990-10-03
2027-1-8,2027-01-08
17/5/2014,2014-05-17
Nov 3 25,2025-11-03
12/10-2033,2033-10-12
23.3.2009,2009-03-23
2005/1,2005-01-12
8/16/2027,2027-08-16
10-8,2024-08-10
11 tháng 5 năm 2004,2004-05-11
6/14/94,1994-06-14
2Jun2008,2008-06-02
1991/3/20,1991-03-20
2013/6/20,2013-06-20
23-12,2000-12-23
2030/9,2030-09-07
ngày 12 tháng 12 năm 2001,2001-12-12
2/1/12,2012-02-01
5/25/96,1996-05-25
2009-11-26,2009-11-26
13 De 2024,2024-12-13
9 Dec 2022,2022-12-09
12/2/11,2011-02-12
ngày 21 tháng 1 năm 2025,2025-01-21
1990/1/10,1990-01-10
2002-6-21,2002-06-21
25.4.2007,2007-04-25
20 No 2027,2027-11-20
28/9/2030,2030-09-28
10Sep2030,2030-09-10
May 16 26,2026-05-16
16-1-1994,1994-01-08
10:7:2003,2003-07-10
11/7/2006,2006-11-07
Apr 1 99,1999-04-01
"Dec 10th, 2019",2019-12-10
"Jan 16th, 2025",2025-01-16
25/6-2001,2001-03-25
10/5-2017,2017-05-10
8Aug2019,2019-08-08
18-2-2029,2029-02-18
ngày 10 tháng 10 năm 2007,2007-10-10
"March 7, 2005",2005-03-07
22 tháng 12 năm 2025,2025-12-22
ngày 23 tháng 4 năm 1998,1998-04-23
21.3.2025,2025-03-21
"Mar 14th, 2012",2012-03-14
2024/8/22,2024-08-22
25/3-2020,2020-03-25
1/9/25,2025-09-01
"Jun 20th, 1998",1998-06-20
21/9/01,2001-09-21
28/9/02,2002-09-28
15-10,1998-10-15
6/19/19,2019-06-19
2026/4/8,2026-04-08
May 26 97,1997-05-26
6/12/1990,1990-06-12
28/10-1992,1992-10-28
28/3/2003,2003-01-28
9/9/2029,2029-03-09
15 tháng 2 năm 2013,2013-02-15
19/5/33,2033-05-19
6Jul1999,1999-07-06
2033/2,2033-02-02
01071994,1994-07-01
21/22-2019,2019-11-21
Sep 22 02,2002-09-22
10-1-2012,2012-01-10
25/8-2008,2008-08-25
11042021,2021-04-11
17/14-2013,2013-07-17
Sep 12 34,2034-09-12
2005/4/16,2005-04-16
ngày 5 tháng 5 năm 1990,1990-05-05
6/12-2021,2021-12-06
23-1,2021-01-23
Jun 6 24,2024-06-06
"Mar 5th, 2017",2017-03-05
10 Dec 2015,2015-12-10
12-8-1992,1992-08-12
25/6-2004,2004-06-25
1/7-1993,1993-07-01
ngày 3 tháng 10 năm 1999,1999-10-03
18/18-2032,2032-09-18
15.1.1991,1991-01-15
2-8,2033-08-02
20/12/2028,2028-04-20
8 October 2002,2002-10-08
2031/11/8,2031-11-08
15052035,2035-05-15
5/12-2031,2031-12-05
1/9/2006,2006-09-01
20 tháng 4 năm 2001,2001-04-20
48-1-2013,2013-01-24
Feb 27 02,2002-02-27
7 De 1990,1990-12-07
"February 24, 2025",2025-02-24
21/12/2026,2026-12-21
"January 26, 2031",2031-01-26
12/3/2005,2005-12-03
23/8-2006,2006-08-23
12/10-2007,2007-05-12
17/7/1992,1992-07-17
11/16/10,2010-11-16
ngày 23 tháng 1 năm 2014,2014-01-23
Jul 12 30,2030-07-12
2014/11/26,2014-11-26
1-10-2012,2012-10-01
2034/12/24,2034-12-24
20th of March 2009,2009-03-20
56-10-2000,2000-10-28
11 tháng 6 năm 2007,2007-06-11
4/4/13,2013-04-04
14th of October 2028,2028-10-14
ngày 25 tháng 12 năm 1993,1993-12-25
20/10-1995,1995-05-20
17/18-2032,2032-09-17
15-2-2030,2030-02-15
9/2-1992,1992-02-09
27 No 2029,2029-11-27
13.5.2033,2033-05-13
8/11/2026,2026-08-11
14/8/1999,1999-08-14
5 tháng 3 năm 2020,2020-03-05
22.7.1997,1997-07-22
"Dec 12th, 2013",2013-12-12
14/10/00,2000-10-14
23-6,2031-06-23
6/6/2035,2035-06-06
21th of January 2031,2031-01-21
3/9/2009,2009-03-09
26-6-2019,2019-06-26
28 Se 2006,2006-09-28
May 10 16,2016-05-10
18 Ma 2003,2003-03-18
20/4/24,2024-04-20
13:4:2006,2006-04-13
"Aug 20th, 1992",1992-08-20
11/3-2027,2027-03-11
24.9.2009,2009-09-24
24121997,1997-12-24
15/1-1997,1997-01-15
ngày 21 tháng 11 năm 2027,2027-11-21
"April 10, 1996",1996-04-10
4th of March 2003,2003-03-04
6th of March 2031,2031-03-06
16/3/2017,2017-03-16
1991/7,1991-07-21
11 tháng 7 năm 1996,1996-07-11
9/2-1997,1997-01-09
4 Mar 1998,1998-03-04
6 tháng 12 năm 2017,2017-12-06
Apr 3 23,2023-04-03
4 tháng 6 năm 2001,2001-06-04
28/7/33,2033-07-28
28-9-1997,1997-09-28
13 Ma 2028,2028-03-13
12-27-18,2018-12-27
2035-12-22,2035-12-22
24-8-2014,2014-08-24
5Aug1991,1991-08-05
12 Au 2022,2022-08-12
8/28/14,2014-08-28
3/3/2013,2013-01-03
28 Aug 2014,2014-08-28
25/8/91,1991-08-25
9/5/98,1998-05-09
10th of April 1998,1998-04-10
11/16/95,1995-11-16
18102028,2028-10-18
1/8-2013,2013-08-01
2015/9,2015-09-23
1-11,2013-11-01
8/24/1994,1994-08-24
16/2/2002,2002-02-16
"April 22, 1998",1998-04-22
2 June 1991,1991-06-02
2031/11,2031-11-11
1/2/00,2000-02-01
3/7-2028,2028-07-03
26 Nov 1996,1996-11-26
8/36/2030,2030-12-08
22 Au 1996,1996-08-22
1/5/2009,2009-01-05
5/12-2001,2001-12-05
4/3-1991,1991-03-04
4/16/22,2022-04-16
3/8-2032,2032-04-03
2:12:2027,2027-12-02
18:10:2030,2030-10-18
2024/2/20,2024-02-20
6/33/2035,2035-11-06
9-5-2034,2034-05-09
6 Oc 2004,2004-10-06
"September 18, 2013",2013-09-18
13-9,2035-09-13
12Mar2014,2014-03-12
17/6/17,2017-06-17
8-12,2033-12-08
"Apr 21th, 1996",1996-04-21
11/4/1997,1997-04-11
1:5:2011,2011-05-01
2003/9/11,2003-09-11
ngày 1 tháng 11 năm 1991,1991-11-01
7/4/06,2006-04-07
1/18/1996,1996-01-18
2027-9-20,2027-09-20
25 May 2030,2030-05-25
44-9-2033,2033-09-22
1/3/94,1994-03-01
48-8-2031,2031-08-24
12 Ap 2007,2007-04-12
9th of October 2031,2031-10-09
20/11/08,2008-11-20
23/11/94,1994-11-23
14/22-2003,2003-11-14
8/2/35,2035-02-08
7/10/2015,2015-07-10
Apr 16 95,1995-04-16
21 February 2034,2034-02-21
5/8-1993,1993-08-05
9-11-2026,2026-11-09
07012014,2014-01-07
12 tháng 6 năm 1998,1998-06-12
16/10/2032,2032-10-16
12Jun2029,2029-06-12
14 November 2030,2030-11-14
"May 27th, 2021",2021-05-27
11/24-1996,1996-12-11
13/20-1994,1994-10-13
8-7-1991,1991-07-08
2015-6-10,2015-06-10
4:6:2022,2022-06-04
19th of March 1991,1991-03-19
ngày 12 tháng 3 năm 2002,2002-03-12
6/4/03,2003-06-04
1993-1-2,1993-01-02
1/3/10,2010-01-03
5/19/2026,2026-05-19
12/4/07,2007-04-12
5/4/32,2032-04-05
10Nov2002,2002-11-10
7 tháng 11 năm 2023,2023-11-07
"Aug 4th, 2034",2034-08-04
2029/1,2029-01-11
3.8.2022,2022-08-03
7:9:1997,1997-09-07
"May 25th, 2005",2005-05-25
2024/8/21,2024-08-21
4/20/28,2028-04-20
3/2-2029,2029-01-03
15/4-2025,2025-02-15
5-4-12,2012-05-04
4 February 1992,1992-02-04
2011-7-20,2011-07-20
8/10/99,1999-10-08
28/3-2030,2030-03-28
"Mar 23th, 2021",2021-03-23
7 tháng 6 năm 2000,2000-06-07
22/12/2025,2025-12-22
11/1/03,2003-11-01
14.12.2015,2015-12-14
14.11.2000,2000-11-14
6/2-2028,2028-01-06
8/9/15,2015-09-08
"May 27th, 2017",2017-05-27
1/1-2001,2001-01-01
7/8-1995,1995-08-07
"November 12, 1991",1991-11-12
22.10.2000,2000-10-22
12.9.2006,2006-09-12
28th of June 2006,2006-06-28
3-6-2010,2010-06-03
16/30/2018,2018-10-16
18 January 2030,2030-01-18
11/8-1991,1991-04-11
56-7-1998,1998-07-28
2026/2,2026-02-13
17-8-2007,2007-08-17
6 tháng 3 năm 2014,2014-03-06
Dec 7 16,2016-12-07
13-12-1999,1999-12-13
22 November 2034,2034-11-22
3 Fe 2012,2012-02-03
3 Ma 1991,1991-05-03
ngày 22 tháng 10 năm 1990,1990-10-22
17 Fe 2035,2035-02-17
28Nov2025,2025-11-28
11/15/1998,1998-05-11
3Feb2016,2016-02-03
3/33/2011,2011-11-03
1998-6-10,1998-06-10
23/18/2007,2007-06-23
1997/2/17,1997-02-17
21051996,1996-05-21
24/10/15,2015-10-24
20 tháng 12 năm 1997,1997-12-20
5-5-26,2026-05-05
16.9.2001,2001-09-16
4-4-27,2027-04-04
22/5-2034,2034-05-22
21Aug2002,2002-08-21
23-4-2026,2026-04-23
11/24/1993,1993-11-24
10/3/1996,1996-03-10
10 Oc 1991,1991-10-10
27/12/2028,2028-12-27
ngày 28 tháng 11 năm 1992,1992-11-28
12-13-93,1993-12-13
2014/6,2014-06-08
21 Sep 2009,2009-09-21
6th of August 2006,2006-08-06
28/21/2028,2028-07-28
2006/5,2006-05-24
4-12-1995,1995-12-02
2-27-21,2021-02-27
6 tháng 12 năm 2032,2032-12-06
Sep 3 93,1993-09-03
7 May 2034,2034-05-07
15/30/2019,2019-10-15
4/3-2017,2017-03-04
17/6/2003,2003-02-17
11 February 2008,2008-02-11
23122021,2021-12-23
"December 4, 2005",2005-12-04
10 May 2008,2008-05-10
5/9/2002,2002-03-05
"May 24th, 1995",1995-05-24
5 Ja 2000,2000-01-05
ngày 7 tháng 12 năm 2035,2035-12-07
5Oct1992,1992-10-05
27/8-2018,2018-08-27
1/2-2029,2029-02-01
11Aug2006,2006-08-11
15/2/25,2025-02-15
7/14-2019,2019-07-07
ngày 25 tháng 2 năm 1997,1997-02-25
23 September 2012,2012-09-23
7/11/1991,1991-11-07
24/11-2033,2033-11-24
2/6/09,2009-06-02
22 tháng 10 năm 1993,1993-10-22
20/14-2010,2010-07-20
6-17-16,2016-06-17
13/8-2035,2035-08-13
16th of October 2015,2015-10-16
18/6-2003,2003-06-18
"Jan 13th, 1997",1997-01-13
52-10-2017,2017-10-26
10/2-2027,2027-01-10
"Apr 28th, 1994",1994-04-28
16-10,2003-10-16
23 May 2011,2011-05-23
28082001,2001-08-28
27:12:2023,2023-12-27
6/5/91,1991-05-06
9 tháng 12 năm 2026,2026-12-09
23th of September 2017,2017-09-23
32-1-2015,2015-01-16
01092023,2023-09-01
36-7-2029,2029-07-18
16 Ja 2017,2017-01-16
20-12-2000,2000-12-20
2014-9-2,2014-09-02
23 Ju 1994,1994-06-23
1999-7-25,1999-07-25
Sep 12 00,2000-09-12
2Aug1991,1991-08-02
2010/10/1,2010-10-01
2004-6-18,2004-06-18
28-12-2034,2034-12-28
"Jun 25th, 2007",2007-06-25
15th of February 2003,2003-02-15
23 tháng 10 năm 2035,2035-10-23
5/4/08,2008-05-04
16 Jan 2011,2011-01-16
21 Se 1995,1995-09-21
25 Fe 1994,1994-02-25
8/16/05,2005-08-16
20:8:2034,2034-08-20
25/8/2018,2018-08-25
10-9-2002,2002-09-05
19 Jul 2017,2017-07-19
7-6-2022,2022-06-07
14-7,2035-07-14
3 Ja 2002,2002-01-03
25-11-2021,2021-11-25
50-7-2027,2027-07-25
27.7.2030,2030-07-27
2022-6-24,2022-06-24
1/8/22,2022-08-01
7 August 1990,1990-08-07
2-13-15,2015-02-13
20/5-2028,2028-05-20
25112023,2023-11-25
ngày 5 tháng 4 năm 2029,2029-04-05
"August 5, 2028",2028-08-05
26/3/2004,2004-03-26
2:5:2028,2028-05-02
17 October 2009,2009-10-17
24th of July 1990,1990-07-24
21Oct2017,2017-10-21
2022-12-24,2022-12-24
5/2-2024,2024-01-05
23 tháng 12 năm 1994,1994-12-23
Mar 16 16,2016-03-16
16/4-2016,2016-04-16
19/10/23,2023-10-19
5 Se 1992,1992-09-05
11/18/27,2027-11-18
2-11-95,1995-02-11
8:9:2009,2009-09-08
1-8-2001,2001-08-01
19/5/14,2014-05-19
ngày 18 tháng 2 năm 2029,2029-02-18
1-3,2020-03-01
26102015,2015-10-26
"Sep 25th, 1999",1999-09-25
6/25/17,2017-06-25
ngày 25 tháng 5 năm 1993,1993-05-25
21th of November 2029,2029-11-21
17/18/2004,2004-06-17
"Mar 2nd, 1997",1997-03-02
5-15-30,2030-05-15
"Sep 5th, 2015",2015-09-05
6-6,2005-06-06
18/10/2000,2000-10-18
25th of November 1999,1999-11-25
"Sep 2nd, 2016",2016-09-02
24 May 2025,2025-05-24
1/6-2001,2001-06-01
9/18-2035,2035-09-09
2018/3,2018-03-12
1-2,2007-02-01
"Dec 6th, 2005",2005-12-06
6/14/2014,2014-06-14
3/26/2008,2008-03-26
Aug 12 07,2007-08-12
13/24-2009,2009-12-13
13th of June 1993,1993-06-13
1998/4,1998-04-12
13-7,2007-07-13
"May 13, 2035",2035-05-13
6Oct2021,2021-10-06
2022/12/27,2022-12-27
3 tháng 6 năm 2015,2015-06-03
16 Ja 2011,2011-01-16
5/8/04,2004-05-08
ngày 19 tháng 2 năm 2012,2012-02-19
2-23-05,2005-02-23
13022017,2017-02-13
"Nov 9th, 2030",2030-11-09
2023-12-5,2023-12-05
1997/2/4,1997-02-04
ngày 16 tháng 4 năm 2010,2010-04-16
1994-3-2,1994-03-02
26/4/1991,1991-04-26
Jun 17 03,2003-06-17
Dec 19 00,2000-12-19
21061998,1998-06-21
20 Dec 2001,2001-12-20
3/4-2009,2009-04-03
ngày 27 tháng 12 năm 1990,1990-12-27
18052011,2011-05-18
11102014,2014-10-11
23/33/2025,2025-11-23
Mar 13 08,2008-03-13
3-7-2011,2011-07-03
11/1-2013,2013-01-11
27-10-2017,2017-10-27
52-1-2033,2033-01-26
19/4/90,1990-04-19
"February 5, 2017",2017-02-05
Feb 21 93,1993-02-21
19Jul2014,2014-07-19
1993/3/14,1993-03-14
2021-9-23,2021-09-23
22Jan2029,2029-01-22
25111998,1998-11-25
ngày 3 tháng 12 năm 2008,2008-12-03
1994/8,1994-08-11
2-6-03,2003-02-06
"Jan 22th, 2007",2007-01-22
11 tháng 1 năm 2008,2008-01-11
2020/10/26,2020-10-26
8/10/09,2009-10-08
2000/12,2000-12-14
26-1,2014-01-26
5 Sep 2013,2013-09-05
ngày 3 tháng 5 năm 1995,1995-05-03
25 tháng 1 năm 2011,2011-01-25
Jun 10 09,2009-06-10
Mar 24 08,2008-03-24
15.10.2023,2023-10-15
1991/5,1991-05-04
22th of July 2004,2004-07-22
Mar 5 96,1996-03-05
22/12/10,2010-12-22
8/12-2001,2001-12-08
14/2-2011,2011-02-14
28:2:2035,2035-02-28
"Sep 18th, 2024",2024-09-18
9.4.2002,2002-04-09
"Apr 12th, 2014",2014-04-12
ngày 27 tháng 10 năm 2013,2013-10-27
2021/1/13,2021-01-13
11/8-2023,2023-04-11
"February 27, 2032",2032-02-27
2014/9,2014-09-11
4 March 2030,2030-03-04
17/1-2008,2008-01-17
14-12-1994,1994-12-07
6/20/2027,2027-06-20
2/18/2024,2024-02-18
22th of December 2004,2004-12-22
1996-12-6,1996-12-06
14Oct1995,1995-10-14
18/2-2025,2025-02-18
17/2/1993,1993-02-17
3 tháng 8 năm 2019,2019-08-03
23:11:2000,2000-11-23
19112027,2027-11-19
4 May 2016,2016-05-04
2032-5-18,2032-05-18
ngày 27 tháng 8 năm 2034,2034-08-27
22/5-1999,1999-05-22
8Oct2027,2027-10-08
2005/9,2005-09-19
2024/10/16,2024-10-16
10 Feb 2006,2006-02-10
17/9/2004,2004-03-17
18/8-2033,2033-04-18
2015/6,2015-06-16
1990/11/10,1990-11-10
28/5-2031,2031-05-28
16/12-2029,2029-06-16
"January 23, 2035",2035-01-23
26/12/22,2022-12-26
"November 5, 2028",2028-11-05
23/8-2013,2013-08-23
10 November 2001,2001-11-10
13.12.1990,1990-12-13
"Aug 24th, 2010",2010-08-24
27 tháng 11 năm 2011,2011-11-27
"Apr 8th, 1995",1995-04-08
24 tháng 6 năm 2002,2002-06-24
15-7-2003,2003-07-15
"February 25, 2004",2004-02-25
16/10-1991,1991-05-16
1-4-94,1994-01-04
22:7:2018,2018-07-22
2012/3,2012-03-01
16-9-2011,2011-09-16
2014/1,2014-01-07
2026/4/7,2026-04-07
52-11-2002,2002-11-26
28/10/1994,1994-10-28
01021995,1995-02-01
14/24/2016,2016-08-14
Feb 16 99,1999-02-16
16/8-2007,2007-04-16
6/1/2005,2005-01-06
"May 17th, 2034",2034-05-17
4:7:2023,2023-07-04
2 Aug 2018,2018-08-02
15.5.2032,2032-05-15
2031/3/23,2031-03-23
2034/5/10,2034-05-10
2033/10,2033-10-01
27th of December 2016,2016-12-27
2026-2-26,2026-02-26
22/4/08,2008-04-22
2001/4,2001-04-13
19/7/2004,2004-07-19
18th of January 2022,2022-01-18
2016-3-12,2016-03-12
4-4,2027-04-04
9/3/2006,2006-03-09
20Apr2028,2028-04-20
6th of April 1991,1991-04-06
3/9/12,2012-03-09
1994-7-22,1994-07-22
2001/12/13,2001-12-13
20/6/2013,2013-06-20
14082012,2012-08-14
9/1-1992,1992-01-09
3Jun2000,2000-06-03
27/3-1993,1993-03-27
12 May 2014,2014-05-12
9/11-2004,2004-11-09
4-12-2030,2030-12-04
Dec 27 24,2024-12-27
11/5/10,2010-11-05
28-5,1992-05-28
"Jun 12th, 1991",1991-06-12
24.1.2026,2026-01-24
1.10.2031,2031-10-01
25/5-1994,1994-05-25
9:8:1990,1990-08-09
2015-4-16,2015-04-16
54-3-2017,2017-03-27
"February 28, 2018",2018-02-28
9 tháng 9 năm 1995,1995-09-09
15/3-2021,2021-03-15
18th of December 1997,1997-12-18
14-1-1996,1996-01-14
12 tháng 3 năm 2010,2010-03-12
11 June 2020,2020-06-11
14/18/2002,2002-06-14
2004/9/4,2004-09-04
11 Fe 2002,2002-02-11
2000-7-13,2000-07-13
"Apr 27th, 2030",2030-04-27
23/3/2014,2014-01-23
20 Ju 2013,2013-06-20
2023-12-26,2023-12-26
ngày 10 tháng 4 năm 2024,2024-04-10
"August 2, 1993",1993-08-02
5Apr2034,2034-04-05
2013/8/23,2013-08-23
2/2/16,2016-02-02
12/26/01,2001-12-26
10/6/2012,2012-06-10
15 tháng 12 năm 2003,2003-12-15
"March 5, 1991",1991-03-05
11022020,2020-02-11
8-1-17,2017-08-01
2011-11-14,2011-11-14
Dec 11 97,1997-12-11
2034-4-7,2034-04-07
Feb 5 90,1990-02-05
14/4/98,1998-04-14
8-2-93,1993-08-02
ngày 16 tháng 8 năm 2031,2031-08-16
11-28-27,2027-11-28
22th of September 2011,2011-09-22
3/2/33,2033-03-02
2033/6/18,2033-06-18
14/12-2014,2014-12-14
28Oct2015,2015-10-28
26-3-2015,2015-03-13
10.3.1997,1997-03-10
28-10-2020,2020-10-28
ngày 24 tháng 11 năm 2010,2010-11-24
6th of July 2031,2031-07-06
14 October 2034,2034-10-14
2029/6,2029-06-09
5/25/2018,2018-05-25
12-5-2032,2032-05-12
"Sep 3rd, 2012",2012-09-03
6/23/2006,2006-06-23
4/10-2019,2019-10-04
2001/2/16,2001-02-16
12:2:2034,2034-02-12
"Oct 15th, 2000",2000-10-15
"Nov 10th, 1995",1995-11-10
27-9,2035-09-27
1/9-2020,2020-09-01
16-4-2016,2016-04-16
"April 12, 2015",2015-04-12
2033-12-3,2033-12-03
"Nov 14th, 2027",2027-11-14
15-11-2012,2012-11-15
2-2-2016,2016-02-02
12/17/22,2022-12-17
10 tháng 11 năm 2004,2004-11-10
ngày 19 tháng 1 năm 2030,2030-01-19
16/4-1999,1999-02-16
24Mar2010,2010-03-24
1st of December 2027,2027-12-01
32-12-2031,2031-12-16
2017/11,2017-11-13
11/27/1994,1994-09-11
8th of October 2024,2024-10-08
14-9-2023,2023-09-07
24/6/33,2033-06-24
46-10-2024,2024-10-23
2007-8-2,2007-08-02
May 18 91,1991-05-18
Jul 10 33,2033-07-10
22Dec2019,2019-12-22
12-9,1998-09-12
4/14/93,1993-04-14
10/7-2012,2012-07-10
1/24/2033,2033-01-24
16/30/2034,2034-10-16
17:4:2033,2033-04-17
"March 9, 2004",2004-03-09
2025/6,2025-06-01
1996/11,1996-11-15
22Oct2005,2005-10-22
"October 7, 1990",1990-10-07
14 tháng 5 năm 1993,1993-05-14
9/11/93,1993-11-09
2016/10/28,2016-10-28
7/18/2002,2002-06-07
1990/10,1990-10-11
22 tháng 11 năm 1995,1995-11-22
2/4/16,2016-04-02
13/6/10,2010-06-13
5/2-2015,2015-01-05
3 Jul 1990,1990-07-03
7/24/2000,2000-07-24
1st of March 2028,2028-03-01
4th of May 2007,2007-05-04
3/2/91,1991-03-02
ngày 20 tháng 10 năm 2017,2017-10-20
19 Mar 2022,2022-03-19
12/8-2023,2023-08-12
2026/2,2026-02-15
ngày 7 tháng 9 năm 2005,2005-09-07
1.1.2020,2020-01-01
3-26-12,2012-03-26
23:10:2005,2005-10-23
9-5-18,2018-09-05
9-12-2006,2006-12-09
22-1-2019,2019-01-11
18/6/2017,2017-06-18
6 March 2013,2013-03-06
1998/10,1998-10-04
27/4-2019,2019-02-27
9 tháng 5 năm 2010,2010-05-09
15 Mar 2032,2032-03-15
2/4/07,2007-04-02
21th of December 2024,2024-12-21
24/6/17,2017-06-24
9-9-04,2004-09-09
14 Dec 2002,2002-12-14
11 April 2028,2028-04-11
2019/4/19,2019-04-19
46-12-2001,2001-12-23
4/2/2004,2004-02-04
"Jan 5th, 2033",2033-01-05
"March 5, 2009",2009-03-05
2/8-1995,1995-08-02
9 tháng 4 năm 2033,2033-04-09
"July 14, 2031",2031-07-14
12/2/35,2035-12-02
11:10:2024,2024-10-11
14-9-1992,1992-09-14
14 May 1995,1995-05-14
"October 3, 2019",2019-10-03
14 De 2022,2022-12-14
Jan 3 95,1995-01-03
17102001,2001-10-17
21/18/2014,2014-06-21
5 April 2019,2019-04-05
8 tháng 9 năm 2008,2008-09-08
13/6/1992,1992-02-13
2:10:1996,1996-10-02
26 tháng 7 năm 2016,2016-07-26
9.5.2015,2015-05-09
1994/8,1994-08-15
7/20/2006,2006-07-20
15/4/20,2020-04-15
25/8/06,2006-08-25
1-23-33,2033-01-23
9 tháng 7 năm 2000,2000-07-09
2014/6/7,2014-06-07
13th of March 2004,2004-03-13
"August 7, 2027",2027-08-07
5-3-13,2013-05-03
Feb 4 15,2015-02-04
1998/2,1998-02-15
2030/7/15,2030-07-15
"Jan 23th, 2000",2000-01-23
22Apr2009,2009-04-22
3/12/23,2023-03-12
2025/6/23,2025-06-23
25th of June 2008,2008-06-25
12/11/27,2027-12-11
27 tháng 8 năm 2015,2015-08-27
4/10-1998,1998-10-04
18/2/05,2005-02-18
2022-3-24,2022-03-24
"January 3, 2028",2028-01-03
Feb 2 21,2021-02-02
4:5:2022,2022-05-04
15/10/28,2028-10-15
25/1/29,2029-01-25
6/22/01,2001-06-22
"February 18, 1995",1995-02-18
26-6,2016-06-26
"October 14, 2021",2021-10-14
02072013,2013-07-02
Aug 27 32,2032-08-27
"Dec 11th, 2029",2029-12-11
12/4/97,1997-12-04
23/5/2000,2000-05-23
9/11/03,2003-11-09
28/1/13,2013-01-28
18.8.2024,2024-08-18
ngày 3 tháng 4 năm 1995,1995-04-03
10/8-1995,1995-08-10
10/24/2001,2001-10-24
2027/10/8,2027-10-08
26 tháng 8 năm 2033,2033-08-26
3/3/2011,2011-03-03
54-6-2013,2013-06-27
1995/4,1995-04-14
26:4:2009,2009-04-26
6/10/98,1998-10-06
4 May 2010,2010-05-04
3-27-13,2013-03-27
4/3/1992,1992-01-04
Feb 16 26,2026-02-16
14/3/2033,2033-01-14
24.11.1992,1992-11-24
2/5/15,2015-05-02
20-8,1995-08-20
10:11:1993,1993-11-10
ngày 16 tháng 6 năm 2023,2023-06-16
13/20-2011,2011-10-13
23-10,2033-10-23
4:3:2035,2035-03-04
20-6-1991,1991-06-20
12/2/13,2013-12-02
14/1/2001,2001-01-14
25/14-1991,1991-07-25
2 No 2023,2023-11-02
7 tháng 6 năm 2024,2024-06-07
54-3-2031,2031-03-27
27Jan2000,2000-01-27
ngày 11 tháng 4 năm 1994,1994-04-11
20/15/2031,2031-05-20
5/12/2018,2018-04-05
2014/1/5,2014-01-05
20 tháng 2 năm 2027,2027-02-20
14/11/20,2020-11-14
26th of September 1997,1997-09-26
24 tháng 4 năm 1994,1994-04-24
"July 27, 2010",2010-07-27
4-5-2012,2012-05-02
1996/2,1996-02-19
7/6-2030,2030-03-07
ngày 5 tháng 10 năm 1990,1990-10-05
11-4-14,2014-11-04
6 Feb 2006,2006-02-06
1/6/25,2025-06-01
6.4.1991,1991-04-06
"April 20, 2002",2002-04-20
"March 1, 2014",2014-03-01
"August 14, 2009",2009-08-14
2003/1,2003-01-03
20:8:1997,1997-08-20
27/16-2011,2011-08-27
24-12-2027,2027-12-24
21 June 1999,1999-06-21
6-1-97,1997-06-01
ngày 2 tháng 8 năm 2013,2013-08-02
1990/12/10,1990-12-10
13/10-2026,2026-05-13
ngày 14 tháng 8 năm 1993,1993-08-14
16/18-1993,1993-09-16
10072033,2033-07-10
13th of August 2012,2012-08-13
13th of September 2016,2016-09-13
9-9-2034,2034-09-09
22/3/91,1991-03-22
2-10,1996-10-02
7/2-2002,2002-02-07
9-25-19,2019-09-25
16/12-2033,2033-12-16
"November 23, 2006",2006-11-23
8/12/2016,2016-08-12
23 February 2020,2020-02-23
6Dec2003,2003-12-06
7 Sep 2030,2030-09-07
25/3/25,2025-03-25
"Feb 8th, 2013",2013-02-08
"September 25, 2031",2031-09-25
21/10-2013,2013-10-21
18/9/10,2010-09-18
25/4-2033,2033-04-25
12-18-22,2022-12-18
21/36/1995,1995-12-21
3 Jan 2016,2016-01-03
24 May 2012,2012-05-24
May 6 90,1990-05-06
3rd of March 2024,2024-03-03
17-12,2032-12-17
9/1/10,2010-01-09
4-4,2011-04-04
Jun 27 30,2030-06-27
4/14/98,1998-04-14
1999/1,1999-01-26
25/4/2021,2021-04-25
5/10/2004,2004-05-10
3/16/1996,1996-03-16
26 Fe 2006,2006-02-26
12/9/2035,2035-03-12
2015/4,2015-04-14
23th of January 1991,1991-01-23
5-9-22,2022-05-09
24122004,2004-12-24
19May2009,2009-05-19
"November 21, 1997",1997-11-21
16/11/06,2006-11-16
Apr 9 22,2022-04-09
4/3/93,1993-03-04
15Sep2003,2003-09-15
12-17-17,2017-12-17
16-8,2014-08-16
11-1-2018,2018-01-11
2019/12/8,2019-12-08
"Oct 27th, 2001",2001-10-27
ngày 20 tháng 10 năm 2020,2020-10-20
24:2:2022,2022-02-24
6/2-1991,1991-02-06
27112030,2030-11-27
ngày 19 tháng 3 năm 1998,1998-03-19
2011-5-18,2011-05-18
22112026,2026-11-22
34-6-2022,2022-06-17
8/10/24,2024-10-08
23/6-2001,2001-06-23
20th of February 2011,2011-02-20
"July 24, 2027",2027-07-24
11/4/06,2006-04-11
14/9/2019,2019-09-14
25 Ma 2035,2035-05-25
18/6-1997,1997-06-18
3-18-12,2012-03-18
14 tháng 7 năm 2008,2008-07-14
2003-9-8,2003-09-08
09112028,2028-11-09
16 Ja 1992,1992-01-16
17-6,2007-06-17
2006/4,2006-04-15
3 Se 2008,2008-09-03
21-10,2018-10-21
20082002,2002-08-20
18/14-1992,1992-07-18
3/10/94,1994-10-03
10 Ma 2035,2035-05-10
"October 24, 2022",2022-10-24
11.3.2008,2008-03-11
2019/9/7,2019-09-07
3-8,2026-08-03
Sep 23 08,2008-09-23
1995/1,1995-01-08
1-25-31,2031-01-25
16/6-2019,2019-06-16
6/12/90,1990-12-06
26/1/2012,2012-01-26
22-1-2001,2001-01-11
2019-9-1,2019-09-01
7/4-1994,1994-04-07
12/1-1990,1990-01-12
Jul 7 17,2017-07-07
21/4/2023,2023-04-21
2/13/2006,2006-02-13
"Mar 14th, 2029",2029-03-14
"May 24th, 2016",2016-05-24
17/11/25,2025-11-17
Jan 14 22,2022-01-14
Oct 1 32,2032-10-01
22/4-1992,1992-02-22
26-6-2034,2034-06-13
28 tháng 2 năm 2031,2031-02-28
26/2/19,2019-02-26
2016/7,2016-07-23
8-3-2035,2035-03-08
2015/10/16,2015-10-16
4/3/2028,2028-04-03
ngày 25 tháng 1 năm 2029,2029-01-25
3/21/93,1993-03-21
2 July 2001,2001-07-02
28:1:2011,2011-01-28
12032016,2016-03-12
2005-8-17,2005-08-17
13/11/22,2022-11-13
1993/5,1993-05-13
2014/1/12,2014-01-12
36-11-2024,2024-11-18
21/12-1993,1993-12-21
22Jan2035,2035-01-22
24/11/2019,2019-11-24
Dec 25 95,1995-12-25
12/10/09,2009-12-10
8/36/2027,2027-12-08
8/15/2027,2027-05-08
2 November 2004,2004-11-02
1/18-2034,2034-09-01
2026/10,2026-10-16
26 tháng 7 năm 2007,2007-07-26
28/2/1998,1998-02-28
5/10/06,2006-10-05
20/11/19,2019-11-20
2012/11,2012-11-25
19 September 1994,1994-09-19
ngày 20 tháng 9 năm 2030,2030-09-20
19082026,2026-08-19
14Feb1992,1992-02-14
12Feb2000,2000-02-12
10Jan2027,2027-01-10
25/12/14,2014-12-25
9-10-28,2028-09-10
2008/11,2008-11-19
3/6/1998,1998-06-03
25:6:2009,2009-06-25
11:7:2014,2014-07-11
2nd of February 2023,2023-02-02
34-6-2029,2029-06-17
"August 6, 2030",2030-08-06
25 Fe 2020,2020-02-25
2016/2/17,2016-02-17
5/13/95,1995-05-13
2007/3/6,2007-03-06
2012-7-18,2012-07-18
1/6/10,2010-06-01
"June 25, 1994",1994-06-25
16/1/2015,2015-01-16
2020-4-19,2020-04-19
1/12/02,2002-01-12
ngày 20 tháng 4 năm 1999,1999-04-20
3rd of October 2020,2020-10-03
Aug 7 16,2016-08-07
19/1-1997,1997-01-19
10031999,1999-03-10
"September 16, 2010",2010-09-16
4-6-01,2001-04-06
18 Aug 2019,2019-08-18
11Dec1991,1991-12-11
24-10-1994,1994-10-24
22-3-2022,2022-03-22
26:12:2021,2021-12-26
28/14-2020,2020-07-28
5/9/32,2032-09-05
27 April 2006,2006-04-27
26/15/2006,2006-05-26
18022011,2011-02-18
6/5-1992,1992-05-06
Feb 5 10,2010-02-05
"January 20, 2001",2001-01-20
2007-7-27,2007-07-27
2 tháng 3 năm 2020,2020-03-02
21th of August 2022,2022-08-21
2010/10/3,2010-10-03
23Dec2031,2031-12-23
20122025,2025-12-20
10/16/2033,2033-10-16
5/6-2033,2033-03-05
17Jan2002,2002-01-17
25-12,2016-12-25
12-9-10,2010-12-09
20-3-2034,2034-03-20
Mar 7 07,2007-03-07
28-4-1997,1997-04-28
Apr 13 22,2022-04-13
18.9.2018,2018-09-18
2022/1/5,2022-01-05
24th of March 2033,2033-03-24
27/9-2002,2002-09-27
2/6-2007,2007-06-02
21/15/2028,2028-05-21
10/4-2019,2019-04-10
1990/4/4,1990-04-04
23-5-2008,2008-05-23
4-11-2026,2026-11-02
"Apr 16th, 2013",2013-04-16
Jul 14 93,1993-07-14
04012000,2000-01-04
20.9.1994,1994-09-20
2 tháng 12 năm 2005,2005-12-02
2006-10-15,2006-10-15
Nov 11 21,2021-11-11
"Aug 6th, 1995",1995-08-06
Nov 12 03,2003-11-12
15/33/2012,2012-11-15
10Apr2006,2006-04-10
4.2.2020,2020-02-04
28 tháng 7 năm 1999,1999-07-28
8 Apr 2029,2029-04-08
19/12-2010,2010-12-19
11-20-91,1991-11-20
28-10-2030,2030-10-28
24:9:2020,2020-09-24
6 February 2025,2025-02-06
1994/12/1,1994-12-01
"September 17, 2013",2013-09-17
21/3-2003,2003-03-21
3/9/2011,2011-03-03
ngày 23 tháng 6 năm 2027,2027-06-23
12/9/2017,2017-09-12
2 tháng 6 năm 2016,2016-06-02
54-11-2016,2016-11-27
19 Oct 2014,2014-10-19
10 January 2001,2001-01-10
26 Nov 2035,2035-11-26
ngày 20 tháng 8 năm 2034,2034-08-20
17072035,2035-07-17
11-25-21,2021-11-25
1995/6,1995-06-18
13/6-2000,2000-06-13
2012/12,2012-12-09
18Jan1996,1996-01-18
10/6/92,1992-10-06
"May 14, 2019",2019-05-14
2019/8/3,2019-08-03
6.1.2035,2035-01-06
2005-7-21,2005-07-21
"Aug 24th, 2022",2022-08-24
1-10-15,2015-01-10
1/16-2000,2000-08-01
26th of March 2027,2027-03-26
34-12-2019,2019-12-17
1997-9-10,1997-09-10
1.4.2009,2009-04-01
2019/7,2019-07-08
10-6-2002,2002-06-10
21/5-1996,1996-05-21
2002/9/24,2002-09-24
2002/12/21,2002-12-21
7/9/2022,2022-07-09
6 Sep 2006,2006-09-06
7/9/2002,2002-09-07
15-9,2007-09-15
24Apr1991,1991-04-24
20/2/2034,2034-02-20
Feb 26 05,2005-02-26
Dec 6 15,2015-12-06
ngày 10 tháng 10 năm 2010,2010-10-10
Dec 6 99,1999-12-06
2027-10-5,2027-10-05
1997/6,1997-06-18
24/4-2016,2016-04-24
8th of July 2010,2010-07-08
4 Mar 2014,2014-03-04
23th of February 2007,2007-02-23
13/10-2010,2010-10-13
18.5.2018,2018-05-18
"Aug 20th, 1992",1992-08-20
Feb 21 02,2002-02-21
12/12/25,2025-12-12
21/5/01,2001-05-21
27/12-2031,2031-12-27
7 tháng 11 năm 2027,2027-11-07
01071993,1993-07-01
10/24/2022,2022-10-24
13-5,1990-05-13
9/21/2028,2028-09-21
19081994,1994-08-19
1991/9/11,1991-09-11
Sep 20 20,2020-09-20
ngày 22 tháng 2 năm 2007,2007-02-22
05012018,2018-01-05
2:4:2012,2012-04-02
"Jul 7th, 2024",2024-07-07
2033/11,2033-11-10
ngày 20 tháng 1 năm 1992,1992-01-20
24th of January 2008,2008-01-24
7/20/31,2031-07-20
1-3-2004,2004-03-01
9-2,2008-02-09
13/10/03,2003-10-13
ngày 19 tháng 3 năm 1997,1997-03-19
7:5:2008,2008-05-07
25 Sep 1995,1995-09-25
3Apr1997,1997-04-03
20th of May 2031,2031-05-20
5 March 2011,2011-03-05
2007/9,2007-09-27
18/2-2012,2012-01-18
1/10-2022,2022-05-01
5th of July 2000,2000-07-05
23:4:2014,2014-04-23
ngày 5 tháng 4 năm 2001,2001-04-05
1993/12/26,1993-12-26
25 Ma 2015,2015-03-25
ngày 19 tháng 2 năm 2018,2018-02-19
23th of March 1990,1990-03-23
19-7,2030-07-19
28.7.2009,2009-07-28
Jun 4 03,2003-06-04
17 Nov 2010,2010-11-17
26.12.2034,2034-12-26
4/26/2020,2020-04-26
21.2.2011,2011-02-21
Nov 16 15,2015-11-16
1991-12-4,1991-12-04
ngày 2 tháng 11 năm 2003,2003-11-02
05091996,1996-09-05
10/11/2005,2005-11-10
ngày 21 tháng 8 năm 2017,2017-08-21
4/10/2018,2018-10-04
14-1,2011-01-14
21/8-2004,2004-04-21
25.1.1999,1999-01-25
2024/6/26,2024-06-26
25-4-2008,2008-04-25
ngày 25 tháng 10 năm 2027,2027-10-25
27-8-2005,2005-08-27
15 Oc 1994,1994-10-15
15 Aug 2004,2004-08-15
8/8-2017,2017-04-08
6/6/2035,2035-02-06
7/1-2020,2020-01-07
8/28/2027,2027-08-28
6-2-32,2032-06-02
3/6/13,2013-06-03
8/26/95,1995-08-26
7:9:2026,2026-09-07
1995/10/8,1995-10-08
22 December 2010,2010-12-22
1990/6,1990-06-02
2014/2,2014-02-22
14 May 2015,2015-05-14
19 February 2011,2011-02-19
17/18-2028,2028-09-17
24/20-2011,2011-10-24
15-2-2011,2011-02-15
10/3/1998,1998-03-10
18 Fe 2028,2028-02-18
"Nov 16th, 2000",2000-11-16
10/7/98,1998-07-10
2027/10/13,2027-10-13
18 Jan 1991,1991-01-18
25/14-1992,1992-07-25
9/15/2021,2021-05-09
24th of February 2000,2000-02-24
"October 13, 1995",1995-10-13
Feb 21 05,2005-02-21
21 Fe 2025,2025-02-21
28 tháng 3 năm 2006,2006-03-28
28-2,2029-02-28
42-2-2006,2006-02-21
ngày 25 tháng 8 năm 2035,2035-08-25
"Apr 8th, 1993",1993-04-08
11052009,2009-05-11
13 tháng 1 năm 2027,2027-01-13
22Dec2018,2018-12-22
14022015,2015-02-14
03122023,2023-12-03
ngày 17 tháng 10 năm 2034,2034-10-17
11 tháng 6 năm 2017,2017-06-11
15-5-2015,2015-05-15
14/9-2025,2025-09-14
7/10/2014,2014-07-10
"July 16, 2000",2000-07-16
6th of February 2000,2000-02-06
11-19-97,1997-11-19
14/10/1998,1998-10-14
"August 27, 2006",2006-08-27
2/5/10,2010-02-05
23Nov1996,1996-11-23
ngày 27 tháng 1 năm 2018,2018-01-27
24-10-2032,2032-10-12
32-7-1996,1996-07-16
25 Jan 2004,2004-01-25
4/1/2028,2028-01-04
"Mar 19th, 2016",2016-03-19
2034/2,2034-02-25
25/9/22,2022-09-25
2035/8/3,2035-08-03
1998/2/15,1998-02-15
10-6,2001-06-10
9/10-2015,2015-10-09
Jan 13 10,2010-01-13
16 Ma 2006,2006-03-16
17/12-2031,2031-12-17
1Jan2023,2023-01-01
"April 8, 2012",2012-04-08
ngày 15 tháng 4 năm 2020,2020-04-15
26-9-2003,2003-09-13
ngày 4 tháng 5 năm 1997,1997-05-04
21 September 2014,2014-09-21
12:3:2032,2032-03-12
14:7:2003,2003-07-14
26/11/2000,2000-11-26
23/5/21,2021-05-23
27 tháng 6 năm 2026,2026-06-27
6/7/18,2018-07-06
2015-1-5,2015-01-05
05112018,2018-11-05
20-2-1990,1990-02-10
ngày 17 tháng 3 năm 2027,2027-03-17
"Mar 19th, 2034",2034-03-19
3/7-1993,1993-07-03
4 Jun 2016,2016-06-04
7 August 2007,2007-08-07
"January 12, 2025",2025-01-12
12-3-1990,1990-03-06
16/10-2013,2013-05-16
6th of September 2005,2005-09-06
6/6/22,2022-06-06
2005-1-12,2005-01-12
Apr 2 17,2017-04-02
15.1.1995,1995-01-15
"June 4, 2027",2027-06-04
8.9.2016,2016-09-08
2031/7,2031-07-14
18/9/07,2007-09-18
18/9/08,2008-09-18
6/17/2017,2017-06-17
26 Jan 2029,2029-01-26
11 tháng 4 năm 2019,2019-04-11
1990/12/14,1990-12-14
2-10-02,2002-02-10
4/24/1995,1995-08-04
ngày 8 tháng 3 năm 2035,2035-03-08
2030/2,2030-02-18
10/2/2010,2010-02-10
2Jan2001,2001-01-02
24/14-2014,2014-07-24
46-7-2023,2023-07-23
8-6,2009-06-08
"Dec 4th, 2007",2007-12-04
6/18/2028,2028-06-06
16/12-2007,2007-12-16
3-13-08,2008-03-13
5-3-26,2026-05-03
3 Jul 2010,2010-07-03
3/12/2029,2029-03-12
2/10/2002,2002-10-02
ngày 25 tháng 4 năm 2033,2033-04-25
ngày 6 tháng 1 năm 2022,2022-01-06
Apr 19 16,2016-04-19
24Apr2008,2008-04-24
"Feb 1st, 2013",2013-02-01
15 Jun 1995,1995-06-15
5:2:2035,2035-02-05
27 Ju 2003,2003-07-27
7 Mar 1999,1999-03-07
16/6-1996,1996-03-16
25/12/2010,2010-04-25
6.10.2010,2010-10-06
Feb 24 30,2030-02-24
"January 12, 2032",2032-01-12
10 November 1996,1996-11-10
25/15/2024,2024-05-25
20/16-1992,1992-08-20
23/12-1995,1995-06-23
15Aug2027,2027-08-15
9/12/95,1995-12-09
"Dec 9th, 2020",2020-12-09
3/36/2032,2032-12-03
5 Mar 1996,1996-03-05
21/7/22,2022-07-21
4 March 1998,1998-03-04
1/10/06,2006-10-01
"July 3, 2023",2023-07-03
2022/2/10,2022-02-10
5-24-11,2011-05-24
2028/4/1,2028-04-01
19 tháng 5 năm 1995,1995-05-19
25/10/02,2002-10-25
2020-6-27,2020-06-27
ngày 8 tháng 1 năm 2024,2024-01-08
23-3-2012,2012-03-23
10 tháng 9 năm 1999,1999-09-10
2/9/2027,2027-09-02
1-3,2005-03-01
4/5/30,2030-04-05
Dec 19 94,1994-12-19
18/6/04,2004-06-18
15-12-2006,2006-12-15
28:10:1994,1994-10-28
38-3-2002,2002-03-19
14-11-1996,1996-11-07
ngày 24 tháng 5 năm 2011,2011-05-24
2024/12/18,2024-12-18
18/6/1994,1994-06-18
11 November 2033,2033-11-11
19/10/26,2026-10-19
7-14-95,1995-07-14
"Mar 5th, 2027",2027-03-05
21:11:2009,2009-11-21
1Sep2015,2015-09-01
2.10.2008,2008-10-02
9-15-20,2020-09-15
20/5/93,1993-05-20
11/5/2012,2012-11-05
ngày 3 tháng 2 năm 2011,2011-02-03
4-10-2004,2004-10-04
12/11-2009,2009-11-12
20 October 2031,2031-10-20
9-23-07,2007-09-23
14032035,2035-03-14
2017/1/27,2017-01-27
3-10-20,2020-03-10
9/1-2021,2021-01-09
12/11/2002,2002-11-12
20-1-2010,2010-01-10
26/6-2010,2010-06-26
3rd of July 2018,2018-07-03
16.3.2008,2008-03-16
7/7-2019,2019-07-07
15/10/2026,2026-10-15
10 Se 1996,1996-09-10
ngày 28 tháng 2 năm 2004,2004-02-28
12072015,2015-07-12
9/1/17,2017-09-01
26May2031,2031-05-26
27 tháng 11 năm 2003,2003-11-27
9-4,2004-04-09
2013-1-7,2013-01-07
28/24/2018,2018-08-28
8/9/1994,1994-03-08
6/18/2010,2010-06-06
6-8,2005-08-06
"Dec 17th, 2020",2020-12-17
15 Ap 2032,2032-04-15
11/2/22,2022-02-11
2002-4-20,2002-04-20
5/10-1993,1993-05-05
20/2/2005,2005-02-20
"Jun 26th, 2018",2018-06-26
17/6-2028,2028-03-17
14 Se 2032,2032-09-14
ngày 27 tháng 11 năm 2033,2033-11-27
12/14/1998,1998-12-14
10081999,1999-08-10
6.5.2024,2024-05-06
1/4-2014,2014-04-01
8/2/04,2004-08-02
27/21/2025,2025-07-27
2028-8-17,2028-08-17
"March 25, 2035",2035-03-25
16/12-2030,2030-12-16
2018/5,2018-05-25
Nov 2 14,2014-11-02
14-12,2029-12-14
48-3-2032,2032-03-24
"Jul 6th, 2022",2022-07-06
19 Jun 1998,1998-06-19
12 Nov 1995,1995-11-12
12/7/98,1998-07-12
13-7,2033-07-13
10/18/99,1999-10-18
14/4/2030,2030-04-14
15/15/2018,2018-05-15
7/7/02,2002-07-07
11th of July 2017,2017-07-11
1 Oc 2003,2003-10-01
12-7,2011-07-12
22022011,2011-02-22
7/5/98,1998-05-07
17Jan2022,2022-01-17
16 September 2018,2018-09-16
25Sep2002,2002-09-25
24/11-1993,1993-11-24
27.2.2024,2024-02-27
56-8-2010,2010-08-28
9/7-2025,2025-07-09
"October 21, 1993",1993-10-21
2011/5/1,2011-05-01
13/12/2007,2007-04-13
May 8 26,2026-05-08
22 Oct 2031,2031-10-22
2/7/35,2035-07-02
13-3-2004,2004-03-13
10/5-2003,2003-05-10
25/1/32,2032-01-25
6/12/2012,2012-12-06
10 Ma 2015,2015-05-10
9/8-2020,2020-08-09
17:6:1993,1993-06-17
27/10/2011,2011-10-27
ngày 24 tháng 4 năm 2003,2003-04-24
7 Aug 2008,2008-08-07
23/5/2021,2021-05-23
20/5-2035,2035-05-20
26.2.1998,1998-02-26
9/19/2016,2016-09-19
2031/2,2031-02-23
15/7-2002,2002-07-15
19/33/2014,2014-11-19
2021/8,2021-08-11
24/9-2022,2022-09-24
6-12-92,1992-06-12
28/18-2025,2025-09-28
13-2-2019,2019-02-13
21-4-2000,2000-04-21
9th of October 1999,1999-10-09
ngày 17 tháng 12 năm 2009,2009-12-17
13 tháng 9 năm 2009,2009-09-13
11 tháng 7 năm 2030,2030-07-11
25/10/92,1992-10-25
13/22-1998,1998-11-13
26-8-2026,2026-08-26
7/3/2003,2003-07-03
1/8/93,1993-08-01
7-5-95,1995-07-05
10-6-31,2031-10-06
2019-8-6,2019-08-06
1/10-1996,1996-10-01
Jan 23 06,2006-01-23
5/36/2032,2032-12-05
1996/1,1996-01-03
7Sep2030,2030-09-07
"Mar 24th, 2000",2000-03-24
16-4-2032,2032-04-08
"March 5, 2033",2033-03-05
12/12/18,2018-12-12
Oct 8 04,2004-10-08
25 Se 2029,2029-09-25
22122016,2016-12-22
4-1-1997,1997-01-02
4-11-1990,1990-11-04
16/27/1992,1992-09-16
3/18/2020,2020-03-18
2002/10,2002-10-01
2021/1,2021-01-17
26 February 2032,2032-02-26
11-12-1994,1994-12-11
9th of April 2010,2010-04-09
25Feb2026,2026-02-25
21/11/29,2029-11-21
17/5/14,2014-05-17
2022/1,2022-01-24
2/7-2022,2022-07-02
7-15-96,1996-07-15
5 February 2002,2002-02-05
2011/7/20,2011-07-20
17:12:2023,2023-12-17
4/3/35,2035-03-04
2020/6,2020-06-02
ngày 11 tháng 1 năm 1999,1999-01-11
Jul 26 99,1999-07-26
2023/8,2023-08-14
6/5/2003,2003-05-06
27 September 2035,2035-09-27
2001/1/14,2001-01-14
5/3/90,1990-05-03
Dec 23 27,2027-12-23
28/7/97,1997-07-28
6Sep2002,2002-09-06
18/10/2029,2029-10-18
23/3-2034,2034-03-23
ngày 4 tháng 7 năm 1996,1996-07-04
6/4-2015,2015-04-06
10 tháng 7 năm 2011,2011-07-10
"Oct 13th, 2014",2014-10-13
28 August 2019,2019-08-28
21 tháng 8 năm 2029,2029-08-21
Jan 1 16,2016-01-01
2024-10-5,2024-10-05
11/23/91,1991-11-23
2020-1-18,2020-01-18
2022/9,2022-09-04
24 May 2034,2034-05-24
22Nov2011,2011-11-22
25-5,2021-05-25
9 Fe 2003,2003-02-09
3/10/94,1994-03-10
5/8/2018,2018-05-08
ngày 3 tháng 11 năm 1999,1999-11-03
12-24-19,2019-12-24
21/27/1999,1999-09-21
1-2,2035-02-01
16/10/27,2027-10-16
02121994,1994-12-02
Sep 27 33,2033-09-27
6.1.2004,2004-01-06
11/9/2010,2010-11-09
8/10-2021,2021-10-08
12/2/05,2005-02-12
"Aug 18th, 1990",1990-08-18
16 Se 2008,2008-09-16
1:5:2005,2005-05-01
28/7-2018,2018-07-28
2-20-30,2030-02-20
28/5-1991,1991-05-28
5.5.2001,2001-05-05
1991/1/28,1991-01-28
28032020,2020-03-28
Apr 24 93,1993-04-24
11Feb1991,1991-02-11
11 tháng 10 năm 2010,2010-10-11
10 No 2017,2017-11-10
2015-6-1,2015-06-01
8 Mar 2013,2013-03-08
11:9:2023,2023-09-11
23/4-2002,2002-04-23
2023/3/27,2023-03-27
8:2:2001,2001-02-08
16/12-2005,2005-12-16
2019-9-19,2019-09-19
21/36/2029,2029-12-21
1 Sep 2000,2000-09-01
1 Ma 2016,2016-03-01
ngày 20 tháng 3 năm 2021,2021-03-20
22/8/91,1991-08-22
28 Ju 1993,1993-06-28
2003/9,2003-09-06
08112013,2013-11-08
Jul 9 96,1996-07-09
6-8,2022-08-06
22/18-2031,2031-09-22
"Mar 28th, 2016",2016-03-28
8/14/2006,2006-08-14
9/9-2019,2019-09-09
8/17/2023,2023-08-17
4/13/2015,2015-04-13
"October 24, 1996",1996-10-24
26-11,2010-11-26
23Aug2021,2021-08-23
21:8:2001,2001-08-21
3/24/2021,2021-08-03
9 Ja 2020,2020-01-09
4/2-2001,2001-01-04
2033-5-24,2033-05-24
25-11-1994,1994-11-25
2031/9/14,2031-09-14
3-3-2025,2025-03-03
2034-7-20,2034-07-20
27-4-2035,2035-04-27
16/9/24,2024-09-16
1-8,2012-08-01
"Dec 10th, 2035",2035-12-10
28/3-2012,2012-03-28
16:6:2006,2006-06-16
1994-7-7,1994-07-07
4th of November 2031,2031-11-04
27-1-2007,2007-01-27
14/12-1990,1990-12-14
1996-7-24,1996-07-24
24112032,2032-11-24
14/12/2027,2027-12-14
18/2-2024,2024-02-18
18 Oct 2011,2011-10-18
2031-1-14,2031-01-14
6/8/2029,2029-06-08
22 tháng 6 năm 2028,2028-06-22
"Oct 6th, 2024",2024-10-06
2/8/09,2009-08-02
ngày 14 tháng 10 năm 1999,1999-10-14
7-26-32,2032-07-26
19/11/2004,2004-11-19
2/9/30,2030-09-02
22/1/18,2018-01-22
17 Mar 2019,2019-03-17
25041993,1993-04-25
22:1:2013,2013-01-22
20th of March 2005,2005-03-20
20/4-1997,1997-04-20
"November 15, 2000",2000-11-15
8/4-2007,2007-04-08
2/2/13,2013-02-02
11th of March 2003,2003-03-11
11-22-96,1996-11-22
25 June 1992,1992-06-25
8 Aug 2035,2035-08-08
19/1/00,2000-01-19
"May 11th, 1994",1994-05-11
ngày 10 tháng 8 năm 1999,1999-08-10
5 Feb 1990,1990-02-05
2011/1/15,2011-01-15
2007-9-25,2007-09-25
54-4-2015,2015-04-27
"Oct 23th, 2035",2035-10-23
"August 16, 1999",1999-08-16
22Apr2007,2007-04-22
24/8/24,2024-08-24
Jun 11 08,2008-06-11
16/6/2035,2035-06-16
18-1-2002,2002-01-18
Nov 1 32,2032-11-01
2021-1-18,2021-01-18
22Dec2023,2023-12-22
19 tháng 11 năm 1997,1997-11-19
24-2,2011-02-24
4-12-2017,2017-12-02
52-7-2017,2017-07-26
2/12-2004,2004-12-02
"January 10, 2005",2005-01-10
28 Jul 2008,2008-07-28
22-3-2008,2008-03-22
12.5.2026,2026-05-12
7/15/2015,2015-07-15
20/14-2015,2015-07-20
3-11-16,2016-03-11
12 tháng 4 năm 2020,2020-04-12
23 Ja 2025,2025-01-23
12/16/1990,1990-12-16
ngày 12 tháng 4 năm 2005,2005-04-12
15 tháng 8 năm 2007,2007-08-15
16/5/2002,2002-05-16
5/2-1993,1993-02-05
4-7,2019-07-04
ngày 19 tháng 3 năm 1995,1995-03-19
11/25/2010,2010-11-25
6May2032,2032-05-06
2030/9/12,2030-09-12
7/9/32,2032-09-07
Oct 2 24,2024-10-02
25.12.2019,2019-12-25
10.2.2010,2010-02-10
13 Se 2013,2013-09-13
3Nov2034,2034-11-03
Oct 27 93,1993-10-27
13111996,1996-11-13
23 tháng 2 năm 2003,2003-02-23
7/2/17,2017-02-07
5/25/1997,1997-05-25
22/8/2035,2035-08-22
2034/10/6,2034-10-06
6/6/1999,1999-06-06
18/11-2018,2018-11-18
27-8-2030,2030-08-27
14-12-2003,2003-12-14
ngày 13 tháng 5 năm 2010,2010-05-13
1995-11-23,1995-11-23
7/1/92,1992-07-01
8/27/2021,2021-08-27
5/7-2004,2004-07-05
6th of May 2030,2030-05-06
19/1/99,1999-01-19
16:5:2015,2015-05-16
1/26/2031,2031-01-26
6/24/2029,2029-08-06
28/3/04,2004-03-28
28 tháng 10 năm 2010,2010-10-28
19:7:2009,2009-07-19
"August 4, 1993",1993-08-04
1997/12,1997-12-14
1/5/2034,2034-05-01
13 Sep 1993,1993-09-13
2025/12,2025-12-21
28-8-2032,2032-08-28
"February 15, 2002",2002-02-15
20:10:2024,2024-10-20
16 tháng 3 năm 2026,2026-03-16
12/19/2035,2035-12-19
"November 26, 2027",2027-11-26
21 tháng 2 năm 2018,2018-02-21
8/16-2027,2027-08-08
27th of April 2004,2004-04-27
Aug 11 06,2006-08-11
10062032,2032-06-10
12/3/2029,2029-03-12
26/11/2029,2029-11-26
26-8,1994-08-26
7/1-2029,2029-01-07
2027/9/19,2027-09-19
15/2/96,1996-02-15
24/30/2020,2020-10-24
6/6-2014,2014-06-06
2004/1/2,2004-01-02
24 March 2010,2010-03-24
2002-11-27,2002-11-27
"October 20, 2030",2030-10-20
15/11-2018,2018-11-15
23.10.2021,2021-10-23
16 Feb 2025,2025-02-16
24/8/35,2035-08-24
11-12,2009-12-11
11/8/2011,2011-08-11
2-4,2030-04-02
2-20-15,2015-02-20
2030/12/19,2030-12-19
4/17/2001,2001-04-17
1:1:1994,1994-01-01
10/6/10,2010-10-06
4-11-91,1991-04-11
19 Ma 2034,2034-03-19
ngày 25 tháng 10 năm 2022,2022-10-25
11/7-2023,2023-07-11
16:8:1992,1992-08-16
6-8-96,1996-06-08
9/10/33,2033-10-09
4/1-2030,2030-01-04
7 Jul 1993,1993-07-07
2005/7,2005-07-02
18 tháng 7 năm 1991,1991-07-18
5 Jun 2003,2003-06-05
20-3,1995-03-20
"August 17, 2011",2011-08-17
17/15/2030,2030-05-17
1.7.2022,2022-07-01
23/5/98,1998-05-23
11Dec2012,2012-12-11
25/2-2033,2033-01-25
19Aug2002,2002-08-19
28/6-2023,2023-06-28
3-11-06,2006-03-11
4 tháng 7 năm 2029,2029-07-04
19th of January 2001,2001-01-19
20-10,1993-10-20
17:2:1991,1991-02-17
ngày 4 tháng 11 năm 1997,1997-11-04
ngày 4 tháng 12 năm 1992,1992-12-04
2023-8-14,2023-08-14
2006-8-1,2006-08-01
5/9/2015,2015-05-09
21/2-2024,2024-01-21
3 Sep 2024,2024-09-03
"April 9, 1997",1997-04-09
12/13/09,2009-12-13
24/3/2027,2027-01-24
2028/11/26,2028-11-26
23/6/91,1991-06-23
5 Aug 1992,1992-08-05
ngày 24 tháng 1 năm 2028,2028-01-24
12082034,2034-08-12
28 tháng 10 năm 1997,1997-10-28
8Oct2000,2000-10-08
9/24/34,2034-09-24
Jan 21 25,2025-01-21
27/2-2022,2022-01-27
2026-12-4,2026-12-04
3 tháng 11 năm 2035,2035-11-03
26/4-2017,2017-02-26
Nov 3 99,1999-11-03
13th of April 1991,1991-04-13
May 13 21,2021-05-13
2029/11/15,2029-11-15
"June 25, 1996",1996-06-25
40-2-2015,2015-02-20
7/10-2031,2031-05-07
42-12-2026,2026-12-21
26.12.2025,2025-12-26
10122009,2009-12-10
1 Ju 2002,2002-07-01
20/9/2024,2024-03-20
2030/10/26,2030-10-26
15:8:2004,2004-08-15
9 Ja 2030,2030-01-09
2 Ju 2010,2010-06-02
1991-7-9,1991-07-09
5-25-11,2011-05-25
12102015,2015-10-12
7/22-2017,2017-11-07
9/8/2008,2008-09-08
28102021,2021-10-28
22/27/2000,2000-09-22
26/8-2016,2016-04-26
2/9-1998,1998-09-02
"Mar 21th, 2023",2023-03-21
8 May 2019,2019-05-08
20 Ma 2019,2019-03-20
6-26-23,2023-06-26
10/22/2035,2035-10-22
9 Mar 2016,2016-03-09
Oct 28 07,2007-10-28
25 Sep 1999,1999-09-25
21/3/2032,2032-03-21
6Mar2007,2007-03-06
10/36/2032,2032-12-10
11Jul2035,2035-07-11
52-7-2002,2002-07-26
2022-9-27,2022-09-27
1995/3,1995-03-01
2 Oct 2012,2012-10-02
16.7.2034,2034-07-16
23/9/1992,1992-09-23
9-14-94,1994-09-14
Jan 13 10,2010-01-13
28/4-1998,1998-04-28
6/10/22,2022-06-10
9/12-2028,2028-12-09
9 Ap 2028,2028-04-09
18/3-2015,2015-03-18
6th of September 2014,2014-09-06
2024/12,2024-12-07
22/7-2017,2017-07-22
17/4/13,2013-04-17
2020-3-18,2020-03-18
9Dec1994,1994-12-09
18 tháng 3 năm 2035,2035-03-18
11/19/11,2011-11-19
28/3/14,2014-03-28
17th of June 2006,2006-06-17
8/10-2013,2013-05-08
"Jan 1st, 2000",2000-01-01
20/7-1994,1994-07-20
"May 8, 2021",2021-05-08
2020-3-12,2020-03-12
18042012,2012-04-18
5/7/1996,1996-05-07
17May2012,2012-05-17
14-6-2009,2009-06-14
1993-11-9,1993-11-09
27 Apr 2019,2019-04-27
14 Ju 2021,2021-06-14
Jan 2 99,1999-01-02
3/25/11,2011-03-25
2/6-1994,1994-06-02
21 Fe 2003,2003-02-21
4/1-2002,2002-01-04
8.11.2020,2020-11-08
4/12/1990,1990-12-04
23-9,2035-09-23
6/18/93,1993-06-18
ngày 21 tháng 7 năm 1998,1998-07-21
38-2-2016,2016-02-19
10/7/35,2035-07-10
2/7/2002,2002-02-07
9/24-1995,1995-12-09
2035/10/28,2035-10-28
"Nov 24th, 1998",1998-11-24
1/4-1995,1995-02-01
21/2/90,1990-02-21
5/16/19,2019-05-16
15/6-1996,1996-06-15
"August 14, 2016",2016-08-14
20/7/02,2002-07-20
8-19-33,2033-08-19
Sep 12 24,2024-09-12
6Jun2035,2035-06-06
Apr 8 99,1999-04-08
21 January 2030,2030-01-21
13062016,2016-06-13
7-10,1992-10-07
3.11.2019,2019-11-03
2006/9/22,2006-09-22
25/6-2007,2007-06-25
"Jun 25th, 2034",2034-06-25
6/9/34,2034-06-09
11th of May 2035,2035-05-11
9.3.1992,1992-03-09
2/2/2012,2012-02-02
2 Oc 1992,1992-10-02
14/11-2019,2019-11-14
4-13-34,2034-04-13
"Oct 10th, 2006",2006-10-10
3/2/1990,1990-02-03
Jun 1 07,2007-06-01
16 May 2008,2008-05-16
16122031,2031-12-16
34-1-2029,2029-01-17
8/8-2031,2031-08-08
Aug 26 34,2034-08-26
20/5/04,2004-05-20
10 Jun 2028,2028-06-10
12Nov2005,2005-11-12
2/9-2029,2029-09-02
1/8/27,2027-01-08
18-12-1994,1994-12-09
8/1/15,2015-01-08
26 tháng 10 năm 2005,2005-10-26
20/27/1992,1992-09-20
9/8/1997,1997-09-08
25:11:1993,1993-11-25
1997/3/19,1997-03-19
"August 6, 1995",1995-08-06
1/28/2027,2027-01-28
7/6-2011,2011-06-07
2/24/95,1995-02-24
15/6/1997,1997-02-15
Feb 15 26,2026-02-15
1990-12-7,1990-12-07
26/10-2007,2007-10-26
27 Jul 1991,1991-07-27
42-1-2025,2025-01-21
Aug 10 06,2006-08-10
1992/9/16,1992-09-16
14-8-2000,2000-08-07
30-11-2028,2028-11-15
12/3/2022,2022-01-12
1/3-2030,2030-03-01
2027/5,2027-05-14
11/5/97,1997-05-11
2-4-2024,2024-04-01
ngày 21 tháng 10 năm 2022,2022-10-21
2/16/2004,2004-02-16
12-10-2031,2031-10-12
2007/7,2007-07-14
21/9/03,2003-09-21
27052021,2021-05-27
3/6/17,2017-06-03
44-12-2034,2034-12-22
3-7-16,2016-03-07
21-11,2013-11-21
8:9:2026,2026-09-08
1995/7,1995-07-01
5-2-2000,2000-02-05
6.7.2030,2030-07-06
24/10/93,1993-10-24
26-6,2008-06-26
06052029,2029-05-06
2Sep2018,2018-09-02
19122017,2017-12-19
28 May 2009,2009-05-28
20 Feb 2028,2028-02-20
17102029,2029-10-17
44-7-2008,2008-07-22
4/16-2020,2020-08-04
20 Ma 2035,2035-05-20
6th of June 1992,1992-06-06
16/7-2016,2016-07-16
15Nov2035,2035-11-15
1992-9-5,1992-09-05
"Oct 20th, 2025",2025-10-20
27/1/33,2033-01-27
5 tháng 1 năm 1997,1997-01-05
1996/4/20,1996-04-20
27-6,1993-06-27
2.12.2032,2032-12-02
2025-5-7,2025-05-07
8.7.2033,2033-07-08
ngày 7 tháng 2 năm 2016,2016-02-07
7/7-1999,1999-07-07
5-3-95,1995-05-03
18 tháng 3 năm 1997,1997-03-18
2035-1-6,2035-01-06
13/5-2026,2026-05-13
2025-7-14,2025-07-14
2014/3,2014-03-25
24 tháng 8 năm 1991,1991-08-24
1:4:2027,2027-04-01
10122033,2033-12-10
13/27/2031,2031-09-13
14 November 2001,2001-11-14
1Oct2026,2026-10-01
23/14-1998,1998-07-23
13081994,1994-08-13
5:8:2010,2010-08-05
8-19-30,2030-08-19
27/2-1990,1990-02-27
1996-9-14,1996-09-14
19/6/2022,2022-06-19
18/1/24,2024-01-18
22 Ju 2010,2010-07-22
"January 2, 1991",1991-01-02
2020-1-4,2020-01-04
4-1,2010-01-04
21th of March 2033,2033-03-21
"Jun 12th, 2035",2035-06-12
10/17/2029,2029-10-17
2001/6,2001-06-15
24 Au 1996,1996-08-24
2/10-2010,2010-10-02
5/8-2013,2013-08-05
24/2/20,2020-02-24
9/1/23,2023-01-09
ngày 14 tháng 2 năm 1998,1998-02-14
7-28-90,1990-07-28
38-6-1994,1994-06-19
1999/6,1999-06-05
9/24/2008,2008-09-24
26th of October 2029,2029-10-26
ngày 22 tháng 2 năm 2007,2007-02-22
12/6/17,2017-06-12
10:11:1991,1991-11-10
2001/1,2001-01-26
21:12:1993,1993-12-21
1995/7,1995-07-11
16 January 2023,2023-01-16
19:8:1995,1995-08-19
9/12-2011,2011-12-09
2016-5-19,2016-05-19
2/9/32,2032-09-02
27/12/1995,1995-12-27
"November 14, 2030",2030-11-14
2032/10/17,2032-10-17
01091991,1991-09-01
Feb 16 31,2031-02-16
14/24-2005,2005-12-14
1999/2,1999-02-27
28/2-1992,1992-02-28
ngày 11 tháng 8 năm 2033,2033-08-11
1:4:2029,2029-04-01
10 January 2008,2008-01-10
27 Jan 2032,2032-01-27
16 Sep 2026,2026-09-16
1991/8,1991-08-21
16th of April 2025,2025-04-16
2011/12,2011-12-26
15/1-2023,2023-01-15
2028-6-22,2028-06-22
19th of November 2021,2021-11-19
2012/8,2012-08-14
8 Ma 2013,2013-03-08
12-12-2032,2032-12-12
2014/7,2014-07-15
27 Oc 2030,2030-10-27
23th of February 2007,2007-02-23
26-9-2018,2018-09-26
1/12/03,2003-12-01
12/12/95,1995-12-12
10/1/1999,1999-01-10
27 De 2031,2031-12-27
21/1/09,2009-01-21
10/2/32,2032-10-02
13 October 2008,2008-10-13
9/1/2000,2000-09-01
20Aug1993,1993-08-20
9-5,2019-05-09
Dec 13 00,2000-12-13
2016/3/8,2016-03-08
17/1-2007,2007-01-17
15th of May 2002,2002-05-15
28th of November 1997,1997-11-28
15/8-2029,2029-08-15
25/12/18,2018-12-25
2032/2/9,2032-02-09
9/6/2030,2030-02-09
12102027,2027-10-12
22Mar2031,2031-03-22
13/3/1992,1992-01-13
4/9-1999,1999-09-04
23 December 2018,2018-12-23
ngày 8 tháng 8 năm 2016,2016-08-08
7th of October 2000,2000-10-07
12/8/02,2002-08-12
"Aug 28th, 2026",2026-08-28
28.1.1996,1996-01-28
21012026,2026-01-21
17-12,2034-12-17
7/18/1997,1997-07-18
Jun 14 95,1995-06-14
27:4:2010,2010-04-27
2/19/2021,2021-02-19
9-5-1990,1990-05-09
15/9/2015,2015-09-15
2032-3-12,2032-03-12
24/4-2032,2032-04-24
2019/6,2019-06-05
18.9.2022,2022-09-18
13 tháng 5 năm 2015,2015-05-13
21/27/2028,2028-09-21
3-21-00,2000-03-21
1 tháng 1 năm 2027,2027-01-01
1992-11-18,1992-11-18
15 Se 1991,1991-09-15
9/5/1998,1998-09-05
3/3/13,2013-03-03
44-9-2009,2009-09-22
5/20/09,2009-05-20
11:10:2030,2030-10-11
16 Oc 2000,2000-10-16
18 tháng 2 năm 2030,2030-02-18
23/12-2028,2028-12-23
24 April 1993,1993-04-24
2020/4/11,2020-04-11
16/9-2016,2016-09-16
6/6-2016,2016-03-06
12 April 2021,2021-04-12
8-16-19,2019-08-16
8/3-2002,2002-03-08
5 Apr 1990,1990-04-05
2018/6/22,2018-06-22
23/21/2033,2033-07-23
14.4.2027,2027-04-14
Sep 2 27,2027-09-02
ngày 8 tháng 7 năm 2016,2016-07-08
8/24/90,1990-08-24
2018/5/26,2018-05-26
27Jul2016,2016-07-27
12 October 2028,2028-10-12
18th of February 1998,1998-02-18
22/6/2015,2015-02-22
2021/2/24,2021-02-24
11 tháng 6 năm 1997,1997-06-11
8/23/31,2031-08-23
1/4/2021,2021-01-04
18-5-2007,2007-05-09
14/3/2018,2018-03-14
1997/12,1997-12-16
2000-5-15,2000-05-15
1/5-1990,1990-05-01
2009/6,2009-06-01
1994/9,1994-09-03
"January 6, 2031",2031-01-06
1998/9/20,1998-09-20
16112015,2015-11-16
Oct 4 98,1998-10-04
"Sep 15th, 1997",1997-09-15
ngày 23 tháng 3 năm 2007,2007-03-23
1993/3,1993-03-06
22.9.2027,2027-09-22
4-11,1994-11-04
Dec 6 90,1990-12-06
6 March 1999,1999-03-06
4 tháng 1 năm 2030,2030-01-04
6-3-2023,2023-03-06
2/8/1996,1996-08-02
3-18-32,2032-03-18
Feb 13 35,2035-02-13
3/4/1991,1991-03-04
27/12/22,2022-12-27
23.5.2029,2029-05-23
1/4-2024,2024-04-01
11/11-2007,2007-11-11
18/6/2013,2013-06-18
22/18/2011,2011-06-22
Sep 7 23,2023-09-07
2-28-33,2033-02-28
28-11,1998-11-28
2013-6-26,2013-06-26
2-14-95,1995-02-14
21 Oct 2035,2035-10-21
"May 25, 2013",2013-05-25
Dec 3 04,2004-12-03
9-18-94,1994-09-18
Sep 4 32,2032-09-04
21-7-2019,2019-07-21
27/4/03,2003-04-27
8-8,1993-08-08
28/12-2030,2030-12-28
6/1/2014,2014-06-01
ngày 10 tháng 4 năm 2004,2004-04-10
10/2/07,2007-02-10
25Apr1991,1991-04-25
25.1.2007,2007-01-25
2021/11/10,2021-11-10
Feb 16 23,2023-02-16
2033/1/17,2033-01-17
17/24-2000,2000-12-17
27 September 2032,2032-09-27
11/5/2008,2008-11-05
12 January 2032,2032-01-12
9/14/07,2007-09-14
8-1-1991,1991-01-08
1 tháng 3 năm 2006,2006-03-01
7 September 2029,2029-09-07
13/1/16,2016-01-13
2001/12,2001-12-22
24-3-2012,2012-03-12
23 July 2012,2012-07-23
10/5/04,2004-05-10
7/25/2032,2032-07-25
14/5/28,2028-05-14
21-4,2021-04-21
27 No 2005,2005-11-27
25Sep2009,2009-09-25
2015/11/13,2015-11-13
3/2/15,2015-03-02
"Oct 6th, 1997",1997-10-06
11/14/11,2011-11-14
1/23/2006,2006-01-23
19/11/2020,2020-11-19
17/11-2012,2012-11-17
"Jul 7th, 2019",2019-07-07
3/3-2023,2023-03-03
18/22-1996,1996-11-18
8/21/09,2009-08-21
7th of May 2020,2020-05-07
2034/12/7,2034-12-07
"May 27th, 2018",2018-05-27
21/8/2025,2025-08-21
20-5-2030,2030-05-20
23/8/16,2016-08-23
5:6:2010,2010-06-05
10-2-2014,2014-02-05
25/3-2028,2028-03-25
20/1/17,2017-01-20
Jan 12 05,2005-01-12
"February 18, 2010",2010-02-18
27.2.2022,2022-02-27
16/20-1991,1991-10-16
22Oct2000,2000-10-22
1-7,1998-07-01
4-1-2033,2033-01-02
5-9-1999,1999-09-05
6/27/25,2025-06-27
6-7-2009,2009-07-03
23/4/2031,2031-04-23
2010-5-15,2010-05-15
2000/1/7,2000-01-07
20/4-1998,1998-02-20
18051992,1992-05-18
11-15-29,2029-11-15
"Oct 12th, 2030",2030-10-12
6/6/95,1995-06-06
Jan 5 99,1999-01-05
10/12/2025,2025-10-12
"June 3, 2018",2018-06-03
"Jun 4th, 2024",2024-06-04
23-7,2009-07-23
13112004,2004-11-13
21 No 2033,2033-11-21
25 Sep 1999,1999-09-25
"Apr 3rd, 2003",2003-04-03
1995/3/27,1995-03-27
12-1-2004,2004-01-12
2/28/2016,2016-02-28
15022030,2030-02-15
Jul 5 21,2021-07-05
Nov 16 30,2030-11-16
16/18/2006,2006-06-16
11Mar2021,2021-03-11
3:2:2023,2023-02-03
1-24-92,1992-01-24
15-12,2003-12-15
27 February 2007,2007-02-27
8/6/2002,2002-06-08
"February 28, 2014",2014-02-28
2031/2,2031-02-27
"August 27, 2027",2027-08-27
Sep 26 27,2027-09-26
18 July 2002,2002-07-18
44-10-2027,2027-10-22
15122006,2006-12-15
13 Nov 1995,1995-11-13
17th of July 2004,2004-07-17
21/6-1991,1991-03-21
15 March 2023,2023-03-15
17/4/2030,2030-04-17
19/8-2029,2029-08-19
ngày 5 tháng 4 năm 2028,2028-04-05
25/3/23,2023-03-25
7th of February 2010,2010-02-07
17/1/2006,2006-01-17
23/2/12,2012-02-23
23/24/2010,2010-08-23
9th of December 2012,2012-12-09
12-19-93,1993-12-19
27.1.2027,2027-01-27
26/7/2031,2031-07-26
Oct 10 05,2005-10-10
ngày 1 tháng 8 năm 2009,2009-08-01
13/6/96,1996-06-13
Apr 26 33,2033-04-26
1996/10/6,1996-10-06
11-6-1992,1992-06-11
22/27/2034,2034-09-22
19.12.1997,1997-12-19
22 Feb 2014,2014-02-22
7/1/17,2017-01-07
18/18-2032,2032-09-18
04102033,2033-10-04
16101990,1990-10-16
23/2/14,2014-02-23
7 Jan 2013,2013-01-07
38-7-2030,2030-07-19
17:1:2000,2000-01-17
25th of May 1992,1992-05-25
6-1,2003-01-06
2013/4,2013-04-03
ngày 5 tháng 12 năm 1995,1995-12-05
"January 19, 2018",2018-01-19
7:10:2001,2001-10-07
13 Ja 1997,1997-01-13
27/4-2018,2018-02-27
4/7/2027,2027-07-04
9:7:1993,1993-07-09
"Oct 20th, 2014",2014-10-20
26/9/2025,2025-09-26
24.3.2016,2016-03-24
18/12-2012,2012-06-18
10th of April 2022,2022-04-10
11/13/2025,2025-11-13
Aug 1 23,2023-08-01
46-5-2020,2020-05-23
5/5-2028,2028-05-05
Apr 21 25,2025-04-21
25.6.2007,2007-06-25
24 tháng 5 năm 2001,2001-05-24
17/3/17,2017-03-17
10:12:2025,2025-12-10
11-7,2031-07-11
"February 22, 2018",2018-02-22
24/10-2024,2024-10-24
10081995,1995-08-10
42-10-2013,2013-10-21
4 August 2009,2009-08-04
7/8/1992,1992-08-07
14/6/03,2003-06-14
18112017,2017-11-18
44-12-2007,2007-12-22
28032001,2001-03-28
8-6-2015,2015-06-08
13/8-2004,2004-08-13
15th of July 2010,2010-07-15
6/27/10,2010-06-27
25 September 2013,2013-09-25
12/10-2026,2026-05-12
2028/2/8,2028-02-08
14Oct2034,2034-10-14
5-11-03,2003-05-11
13 October 2007,2007-10-13
27/4/2032,2032-04-27
7/3/1994,1994-01-07
7/22/19,2019-07-22
27/8-2013,2013-08-27
3/23/1990,1990-03-23
1-27-29,2029-01-27
14 Mar 2013,2013-03-14
08101995,1995-10-08
2004-12-18,2004-12-18
5-10,2003-10-05
01051997,1997-05-01
10/6/01,2001-10-06
"October 18, 2009",2009-10-18
27/6-2002,2002-06-27
17/10-2014,2014-10-17
24/10/04,2004-10-24
14Feb1992,1992-02-14
13-4,1997-04-13
1999/9,1999-09-06
1997/12/20,1997-12-20
2010-9-16,2010-09-16
15/10/02,2002-10-15
12/28/93,1993-12-28
1/2/90,1990-01-02
"Nov 16th, 2016",2016-11-16
Dec 16 08,2008-12-16
22 Dec 2034,2034-12-22
ngày 1 tháng 12 năm 2018,2018-12-01
4/36/2029,2029-12-04
2004/3,2004-03-01
5 Ap 2035,2035-04-05
7Dec2012,2012-12-07
Jan 13 96,1996-01-13
2024/6,2024-06-19
25/9/03,2003-09-25
9/21/11,2011-09-21
50-4-2035,2035-04-25
6-2-2002,2002-02-03
28 tháng 11 năm 1995,1995-11-28
5/10/29,2029-10-05
6/11-1996,1996-11-06
15.8.2022,2022-08-15
24/1/27,2027-01-24
2028-9-4,2028-09-04
5:8:2007,2007-08-05
19 August 2001,2001-08-19
56-6-2002,2002-06-28
4.7.2031,2031-07-04
12/7/2003,2003-07-12
13/11/91,1991-11-13
5/19/2025,2025-05-19
9-5-02,2002-09-05
25:3:2035,2035-03-25
2030-11-25,2030-11-25
26092029,2029-09-26
ngày 3 tháng 2 năm 2010,2010-02-03
2010/8/17,2010-08-17
9-8,2010-08-09
2034-11-24,2034-11-24
25/10-2022,2022-10-25
9th of October 2035,2035-10-09
28/12/2016,2016-04-28
13 tháng 11 năm 1999,1999-11-13
Aug 3 02,2002-08-03
3Dec2017,2017-12-03
2032-5-12,2032-05-12
4/12/2007,2007-04-12
24th of June 1998,1998-06-24
2012-1-8,2012-01-08
22 May 2005,2005-05-22
2006/3,2006-03-12
15/4-1997,1997-04-15
9Jul1999,1999-07-09
6/6/1999,1999-06-06
23/5/32,2032-05-23
2nd of March 2011,2011-03-02
1/6/1997,1997-01-06
9/16-2026,2026-08-09
27 Fe 2012,2012-02-27
"May 9, 2013",2013-05-09
6.3.2011,2011-03-06
ngày 9 tháng 10 năm 2001,2001-10-09
9/8/2035,2035-09-08
ngày 9 tháng 10 năm 2031,2031-10-09
6-12-1996,1996-12-06
25/9-2011,2011-09-25
6.12.2003,2003-12-06
3/22/2001,2001-03-22
6/7/07,2007-07-06
10/26/2035,2035-10-26
11/1/35,2035-01-11
15:12:2032,2032-12-15
13 tháng 12 năm 2005,2005-12-13
9/4-2014,2014-04-09
28 tháng 9 năm 2001,2001-09-28
Mar 14 10,2010-03-14
2002/11/3,2002-11-03
26/27/1992,1992-09-26
ngày 6 tháng 8 năm 1993,1993-08-06
2014/8/18,2014-08-18
"June 15, 2003",2003-06-15
2035/4/15,2035-04-15
8/2/2000,2000-02-08
24 Jun 2008,2008-06-24
2022/3/3,2022-03-03
11-2-27,2027-11-02
19/10-1999,1999-05-19
12 Ap 2016,2016-04-12
27/10-2032,2032-10-27
"March 20, 2033",2033-03-20
1990/10,1990-10-11
25-3-1995,1995-03-25
12th of December 1996,1996-12-12
2002/9/24,2002-09-24
2/4/2009,2009-04-02
20Jul2031,2031-07-20
14/3-2026,2026-03-14
17-10,2030-10-17
3 Fe 1991,1991-02-03
2/1-2010,2010-01-02
19 January 2028,2028-01-19
2007/6,2007-06-11
5-5-2032,2032-05-05
27 tháng 1 năm 1991,1991-01-27
12/10/22,2022-10-12
18/6/34,2034-06-18
17/1/27,2027-01-17
1998-2-4,1998-02-04
2/28/2028,2028-02-28
"Mar 8th, 1999",1999-03-08
2008/7/16,2008-07-16
4/2/2028,2028-02-04
12 tháng 12 năm 2023,2023-12-12
9 July 1994,1994-07-09
16/11/95,1995-11-16
9/11/2032,2032-09-11
20th of November 2016,2016-11-20
7/13/2019,2019-07-13
17 tháng 4 năm 2027,2027-04-17
ngày 9 tháng 12 năm 2010,2010-12-09
4 tháng 1 năm 1993,1993-01-04
1-28-98,1998-01-28
Jan 12 24,2024-01-12
9 tháng 11 năm 2005,2005-11-09
14/3/14,2014-03-14
8-16-99,1999-08-16
1998-1-14,1998-01-14
12 Oct 2010,2010-10-12
15.6.2014,2014-06-15
1994/9,1994-09-03
28/4-2008,2008-02-28
19 January 2000,2000-01-19
2/2-2028,2028-02-02
21032001,2001-03-21
28 October 2011,2011-10-28
9 Au 2009,2009-08-09
18/12-2009,2009-12-18
28.9.1999,1999-09-28
18 September 2003,2003-09-18
27:3:2021,2021-03-27
Apr 19 26,2026-04-19
16-3-1990,1990-03-16
1 Feb 2033,2033-02-01
16-6,2009-06-16
25 tháng 1 năm 2005,2005-01-25
22-5-1994,1994-05-11
2035/8/23,2035-08-23
22/12-1999,1999-12-22
5/2/1993,1993-05-02
10.12.2006,2006-12-10
18/4-2035,2035-04-18
11/7-2029,2029-07-11
12-10-06,2006-12-10
8th of January 2007,2007-01-08
5-6,2026-06-05
18 tháng 2 năm 2014,2014-02-18
9/11/34,2034-11-09
06082020,2020-08-06
9 Nov 2014,2014-11-09
2016-2-22,2016-02-22
ngày 6 tháng 9 năm 2010,2010-09-06
2022-7-1,2022-07-01
23/3/10,2010-03-23
10/4/13,2013-04-10
28-9-2024,2024-09-28
21.7.2003,2003-07-21
11/27/2003,2003-11-27
3/4/23,2023-03-04
7 Oc 2026,2026-10-07
11-10-14,2014-11-10
"Feb 18th, 1992",1992-02-18
"Oct 7th, 2026",2026-10-07
1997-10-22,1997-10-22
12-2-2034,2034-02-12
"August 23, 2012",2012-08-23
5/21/2013,2013-07-05
2022/2/3,2022-02-03
23/7-2012,2012-07-23
ngày 17 tháng 5 năm 2024,2024-05-17
2029/3,2029-03-03
16/7/92,1992-07-16
26/10-2031,2031-10-26
1 Jan 1993,1993-01-01
04072022,2022-07-04
2-24-21,2021-02-24
13/9-2005,2005-09-13
26-3-2030,2030-03-26
24th of February 2017,2017-02-24
7-13-92,1992-07-13
16 July 2012,2012-07-16
9/18-2000,2000-09-09
19th of November 2017,2017-11-19
25/24/2003,2003-08-25
1/8-2027,2027-08-01
2016/4/11,2016-04-11
11/4/00,2000-04-11
9-3-2026,2026-03-09
16/6/06,2006-06-16
2035-12-10,2035-12-10
27-9,1994-09-27
16 Se 1992,1992-09-16
"September 23, 2026",2026-09-23
"March 1, 2024",2024-03-01
16041994,1994-04-16
"Mar 2nd, 2016",2016-03-02
23.3.2007,2007-03-23
3/3/2026,2026-03-03
2.11.1993,1993-11-02
12102031,2031-10-12
1/3/95,1995-03-01
2019-3-21,2019-03-21
Apr 12 93,1993-04-12
14-5,2031-05-14
38-5-2016,2016-05-19
12/3/25,2025-03-12
25 Ju 1991,1991-06-25
20Nov2034,2034-11-20
Sep 3 25,2025-09-03
18/15/1998,1998-05-18
14 Ma 2018,2018-03-14
8/9/2020,2020-03-08
16 De 2010,2010-12-16
19/10/97,1997-10-19
9/6/2018,2018-09-06
4 tháng 8 năm 2002,2002-08-04
7-8-08,2008-07-08
ngày 11 tháng 8 năm 2028,2028-08-11
1997/3,1997-03-27
20/5/95,1995-05-20
20Aug2025,2025-08-20
2004-5-9,2004-05-09
20Aug2024,2024-08-20
22-8-2010,2010-08-11
14 February 2002,2002-02-14
2016/6,2016-06-08
20/18/2002,2002-06-20
20/15/2033,2033-05-20
12/3/33,2033-12-03
8-5,2020-05-08
26/36/2022,2022-12-26
1/7/32,2032-07-01
17-12,2004-12-17
3/12-1992,1992-06-03
36-7-2022,2022-07-18
Aug 24 09,2009-08-24
2016-7-9,2016-07-09
20/6-2023,2023-06-20
"May 23th, 1997",1997-05-23
26/11/13,2013-11-26
2/3-1999,1999-03-02
ngày 16 tháng 8 năm 2033,2033-08-16
6/22/12,2012-06-22
22 Fe 2017,2017-02-22
Feb 19 23,2023-02-19
27/12/2013,2013-04-27
3 tháng 4 năm 2035,2035-04-03
26 tháng 6 năm 2033,2033-06-26
"Mar 4th, 2020",2020-03-04
18/3-2020,2020-03-18
27/12/2011,2011-12-27
1/1-2022,2022-01-01
2002/2,2002-02-14
15 Jul 2033,2033-07-15
28/6-1992,1992-06-28
4/9/2014,2014-04-09
5/8/99,1999-08-05
5 April 2006,2006-04-05
14 Sep 1992,1992-09-14
22/11-2002,2002-11-22
Oct 24 15,2015-10-24
7.1.2030,2030-01-07
2/19/2027,2027-02-19
2003-1-13,2003-01-13
18/1-2011,2011-01-18
2/5/2009,2009-05-02
ngày 15 tháng 3 năm 1999,1999-03-15
10121996,1996-12-10
Jul 5 11,2011-07-05
13/3/17,2017-03-13
2 Jun 2035,2035-06-02
2013/8/8,2013-08-08
"May 21, 2013",2013-05-21
"July 19, 2008",2008-07-19
19051991,1991-05-19
25-11,1995-11-25
17 tháng 10 năm 1999,1999-10-17
23 Jan 1990,1990-01-23
1-11-1992,1992-11-01
7/10-2030,2030-05-07
21/7/98,1998-07-21
23/20-2022,2022-10-23
12-2-02,2002-12-02
28 Jun 2031,2031-06-28
4/4/2029,2029-04-04
21 August 2027,2027-08-21
24052004,2004-05-24
ngày 14 tháng 1 năm 2032,2032-01-14
"Feb 13th, 1997",1997-02-13
19 Dec 1994,1994-12-19
6-11-12,2012-06-11
21/3-1995,1995-03-21
8-24-24,2024-08-24
18/2-2007,2007-02-18
5 December 1999,1999-12-05
13.12.2012,2012-12-13
16:6:1995,1995-06-16
15 December 2015,2015-12-15
11.5.2019,2019-05-11
24th of November 2017,2017-11-24
ngày 1 tháng 3 năm 2034,2034-03-01
Dec 6 09,2009-12-06
23 tháng 6 năm 2026,2026-06-23
4.10.1994,1994-10-04
26 Mar 2031,2031-03-26
6th of August 2025,2025-08-06
04021991,1991-02-04
2026/6/3,2026-06-03
"February 8, 2003",2003-02-08
18May2035,2035-05-18
12-11-2016,2016-11-06
"Nov 27th, 2001",2001-11-27
ngày 1 tháng 7 năm 2001,2001-07-01
23May2030,2030-05-23
16.3.2034,2034-03-16
27 July 2020,2020-07-27
1/3-1990,1990-03-01
28th of November 1990,1990-11-28
18/20-2035,2035-10-18
4th of May 1991,1991-05-04
24th of August 1991,1991-08-24
15th of October 2011,2011-10-15
23 Ap 2022,2022-04-23
4/1-2024,2024-01-04
3 tháng 3 năm 2032,2032-03-03
10:5:2033,2033-05-10
05012032,2032-01-05
ngày 13 tháng 9 năm 2013,2013-09-13
"Nov 28th, 2023",2023-11-28
16-9-1998,1998-09-16
"September 3, 1997",1997-09-03
28.4.2010,2010-04-28
6/23/1995,1995-06-23
15/9-1998,1998-09-15
1 tháng 12 năm 1993,1993-12-01
"July 19, 2020",2020-07-19
20 Jan 2011,2011-01-20
40-1-1992,1992-01-20
20/12/19,2019-12-20
14.11.2021,2021-11-14
4/27/1998,1998-04-27
10/10-2034,2034-10-10
11/11-2017,2017-11-11
19 January 1994,1994-01-19
2002/10,2002-10-22
Jul 19 22,2022-07-19
Jan 17 08,2008-01-17
ngày 19 tháng 9 năm 2022,2022-09-19
14122004,2004-12-14
24/7/2002,2002-07-24
5/20/98,1998-05-20
"Feb 10th, 2021",2021-02-10
13/8-2008,2008-04-13
16/10-2013,2013-10-16
26/24-2001,2001-12-26
22/4/2019,2019-04-22
20/4/1999,1999-04-20
23112011,2011-11-23
6-17-16,2016-06-17
28th of April 1992,1992-04-28
23.4.2005,2005-04-23
27/6/2016,2016-06-27
18:3:2032,2032-03-18
1997-10-1,1997-10-01
25 May 2003,2003-05-25
18 Ju 2001,2001-07-18
ngày 10 tháng 2 năm 1991,1991-02-10
1997/5/23,1997-05-23
28/14-2009,2009-07-28
6/18-2006,2006-09-06
2/16-2004,2004-08-02
ngày 19 tháng 6 năm 2007,2007-06-19
17 Dec 2033,2033-12-17
16/21/2007,2007-07-16
10:2:2029,2029-02-10
4-26-07,2007-04-26
2nd of January 2004,2004-01-02
6 tháng 3 năm 2031,2031-03-06
Aug 20 02,2002-08-20
4/6/27,2027-06-04
8/3/2012,2012-03-08
Jan 16 00,2000-01-16
25:6:2017,2017-06-25
14/18-2020,2020-09-14
7-12,2026-12-07
27:6:2032,2032-06-27
7/14-2014,2014-07-07
3-3-06,2006-03-03
"October 15, 2011",2011-10-15
1/18-2002,2002-09-01
5/8/35,2035-08-05
7-8-2022,2022-08-07
9/8/2035,2035-09-08
23/9-2006,2006-09-23
18/8-2019,2019-08-18
"Jan 26th, 2030",2030-01-26
"Apr 26th, 2016",2016-04-26
19May2000,2000-05-19
16/11/05,2005-11-16
ngày 25 tháng 6 năm 2026,2026-06-25
2031/8,2031-08-26
13/9/01,2001-09-13
7/5/27,2027-05-07
25-7,2023-07-25
22/3-1993,1993-03-22
6.3.2004,2004-03-06
07111994,1994-11-07
2nd of May 2016,2016-05-02
26 October 2030,2030-10-26
"June 21, 2031",2031-06-21
19/3/1999,1999-01-19
"Apr 7th, 2019",2019-04-07
25/3/25,2025-03-25
ngày 12 tháng 2 năm 2018,2018-02-12
27-7,2016-07-27
14042023,2023-04-14
2/8-1996,1996-08-02
15:6:1998,1998-06-15
2/1-1995,1995-01-02
24/1-1998,1998-01-24
6/16/31,2031-06-16
4 May 2004,2004-05-04
8.1.2000,2000-01-08
27 Sep 2027,2027-09-27
ngày 19 tháng 3 năm 2017,2017-03-19
2004/7,2004-07-26
Feb 9 14,2014-02-09
1995-5-23,1995-05-23
15 tháng 1 năm 2031,2031-01-15
4-4-2011,2011-04-02
1996/12,1996-12-05
13-5,2005-05-13
27022035,2035-02-27
28-8,2002-08-28
ngày 17 tháng 7 năm 2022,2022-07-17
24 No 2034,2034-11-24
3 December 2025,2025-12-03
4-1-2017,2017-01-04
19/1/05,2005-01-19
11 July 2017,2017-07-11
Oct 6 21,2021-10-06
19 Apr 2025,2025-04-19
20.12.2025,2025-12-20
11 tháng 5 năm 2006,2006-05-11
5/12/13,2013-05-12
11/9/2023,2023-03-11
21/6/2003,2003-06-21
17th of May 1998,1998-05-17
26102000,2000-10-26
2020/5,2020-05-22
22th of November 2011,2011-11-22
2002/4/5,2002-04-05
15/8-2002,2002-08-15
Oct 20 01,2001-10-20
16/5/90,1990-05-16
19.1.2001,2001-01-19
1/7-2018,2018-07-01
56-8-2035,2035-08-28
16-10,2020-10-16
16-10-2033,2033-10-08
12/5-2013,2013-05-12
4/2/96,1996-02-04
2022/12/23,2022-12-23
24/16-2007,2007-08-24
14.2.1999,1999-02-14
28:7:1997,1997-07-28
3/18/2017,2017-06-03
10/18/2019,2019-10-18
24 tháng 3 năm 2027,2027-03-24
"November 1, 2030",2030-11-01
8/6-2011,2011-03-08
22 tháng 6 năm 1998,1998-06-22
4-14-06,2006-04-14
12-6,2009-06-12
6/6/28,2028-06-06
2 tháng 8 năm 1991,1991-08-02
8-4-11,2011-08-04
Oct 13 16,2016-10-13
"October 1, 2008",2008-10-01
15/9-2003,2003-09-15
3 Oc 2003,2003-10-03
17 Ma 2009,2009-05-17
"Aug 13th, 2027",2027-08-13
2003-1-26,2003-01-26
4/8-2004,2004-08-04
2 tháng 6 năm 1991,1991-06-02
5/10-2033,2033-05-05
Jun 15 32,2032-06-15
54-7-2003,2003-07-27
2/26/08,2008-02-26
11/13/00,2000-11-13
1/2-2032,2032-02-01
28/6-2024,2024-03-28
13 Fe 2011,2011-02-13
13 tháng 12 năm 2034,2034-12-13
12/25/03,2003-12-25
15 Ma 2009,2009-05-15
14 tháng 5 năm 2020,2020-05-14
1 tháng 5 năm 2010,2010-05-01
10:5:2022,2022-05-10
21.8.2006,2006-08-21
11/8/21,2021-08-11
3/4/2035,2035-03-04
ngày 25 tháng 5 năm 2025,2025-05-25
15/30/2002,2002-10-15
16/12-2000,2000-06-16
6/11/11,2011-11-06
16082002,2002-08-16
"Aug 20th, 2028",2028-08-20
ngày 1 tháng 12 năm 2007,2007-12-01
5 tháng 10 năm 2035,2035-10-05
17 No 1996,1996-11-17
26th of January 2001,2001-01-26
8/9/14,2014-09-08
2033-11-9,2033-11-09
15/7-1995,1995-07-15
7Jul2024,2024-07-07
"May 16, 2029",2029-05-16
15Feb2003,2003-02-15
2031/3,2031-03-15
"October 2, 1996",1996-10-02
2-3-05,2005-02-03
5/1/1996,1996-01-05
2/5-2028,2028-05-02
1/12/13,2013-12-01
2020/6/18,2020-06-18
24 No 2033,2033-11-24
1-24-07,2007-01-24
Feb 22 00,2000-02-22
2/8/2016,2016-02-08
20 December 2030,2030-12-20
3-27-19,2019-03-27
2035/9,2035-09-28
2nd of March 2021,2021-03-02
19 May 1996,1996-05-19
1996/7,1996-07-18
4 Ju 2010,2010-07-04
11/10/2009,2009-11-10
19/5/25,2025-05-19
26Jan2031,2031-01-26
22/7-2022,2022-07-22
2018/2,2018-02-20
28:3:2009,2009-03-28
38-5-2009,2009-05-19
19 Aug 2007,2007-08-19
9/2/19,2019-09-02
24/24/1993,1993-08-24
20/7/03,2003-07-20
6/15/2018,2018-05-06
20:3:2014,2014-03-20
9/12-2032,2032-06-09
19/2-2003,2003-02-19
2-23-90,1990-02-23
"September 10, 2007",2007-09-10
2026/1/25,2026-01-25
14-3-2028,2028-03-07
20/7/1990,1990-07-20
3/2/2000,2000-03-02
18 Aug 2002,2002-08-18
2 May 2017,2017-05-02
2003/5,2003-05-08
15 Ap 2013,2013-04-15
ngày 9 tháng 12 năm 2021,2021-12-09
23-2,2014-02-23
11/21/22,2022-11-21
21Apr2015,2015-04-21
3/12-2024,2024-06-03
26/3-2010,2010-03-26
6-17-22,2022-06-17
Jun 28 26,2026-06-28
1995-12-3,1995-12-03
26May1998,1998-05-26
1Apr1991,1991-04-01
6/33/2002,2002-11-06
4/18/1992,1992-04-18
3 tháng 10 năm 2010,2010-10-03
20-7,2019-07-20
9 Fe 1998,1998-02-09
32-2-1991,1991-02-16
2013-10-20,2013-10-20
7:10:2002,2002-10-07
5 tháng 7 năm 2018,2018-07-05
1 Se 1997,1997-09-01
3/23/1997,1997-03-23
21:2:2003,2003-02-21
24 tháng 7 năm 2008,2008-07-24
1999/9/21,1999-09-21
15/12-2030,2030-12-15
2031-7-25,2031-07-25
8 Se 1993,1993-09-08
17/6/03,2003-06-17
17.1.1995,1995-01-17
24Jul1993,1993-07-24
1/7-2014,2014-07-01
23/21/1996,1996-07-23
21Aug2006,2006-08-21
8/24-1990,1990-12-08
28-2-2006,2006-02-14
2019/11,2019-11-07
8Feb1997,1997-02-08
19.8.2010,2010-08-19
17082010,2010-08-17
1-8,2027-08-01
2030-9-5,2030-09-05
Jan 7 18,2018-01-07
40-4-2002,2002-04-20
2002-3-2,2002-03-02
18 Feb 2015,2015-02-18
1991-8-17,1991-08-17
22:3:2014,2014-03-22
11 May 2030,2030-05-11
21 Sep 2029,2029-09-21
34-6-1991,1991-06-17
2014/12/16,2014-12-16
52-3-1999,1999-03-26
3 tháng 11 năm 2026,2026-11-03
13Mar1993,1993-03-13
2004/10,2004-10-28
25 Mar 2033,2033-03-25
28/36/2032,2032-12-28
Oct 23 32,2032-10-23
28 tháng 11 năm 1994,1994-11-28
ngày 24 tháng 3 năm 2030,2030-03-24
2002-11-11,2002-11-11
9 Sep 2032,2032-09-09
10 tháng 11 năm 2024,2024-11-10
7th of January 2003,2003-01-07
24th of October 2002,2002-10-24
18/6-2001,2001-06-18
22 No 2007,2007-11-22
19/7/2018,2018-07-19
ngày 26 tháng 12 năm 2001,2001-12-26
14-11-1997,1997-11-14
2-4,2006-04-02
ngày 2 tháng 1 năm 2007,2007-01-02
20/12/2003,2003-04-20
9 May 2004,2004-05-09
12/4-2009,2009-02-12
5/6-2004,2004-03-05
21 Sep 2024,2024-09-21
ngày 3 tháng 6 năm 2034,2034-06-03
13:5:1994,1994-05-13
21/3/1997,1997-01-21
17 tháng 10 năm 1995,1995-10-17
2032/10,2032-10-27
"Dec 6th, 2009",2009-12-06
6/16-2019,2019-08-06
13/12/00,2000-12-13
4-11-2026,2026-11-02
10-22-04,2004-10-22
30-6-2008,2008-06-15
8/18/2002,2002-06-08
5/10/2030,2030-10-05
18/10/22,2022-10-18
4.9.2008,2008-09-04
24 August 1990,1990-08-24
24.5.1998,1998-05-24
2033/12/21,2033-12-21
6-23-15,2015-06-23
9 November 2017,2017-11-09
22th of October 2033,2033-10-22
"March 15, 2012",2012-03-15
10/5-2016,2016-05-10
ngày 18 tháng 11 năm 2016,2016-11-18
9 November 2011,2011-11-09
9th of September 2024,2024-09-09
24 Ma 2033,2033-05-24
25/5-2012,2012-05-25
6:10:2031,2031-10-06
4-12,2012-12-04
4.2.2001,2001-02-04
"December 15, 1995",1995-12-15
12/14/26,2026-12-14
2002/3,2002-03-05
5 Dec 2025,2025-12-05
1/6/18,2018-06-01
26-3-2012,2012-03-26
2/21/15,2015-02-21
7 Jul 2016,2016-07-07
2019-9-12,2019-09-12
13032030,2030-03-13
24121997,1997-12-24
7/9/2028,2028-03-07
28/7/17,2017-07-28
9 Apr 2003,2003-04-09
21/6-2002,2002-06-21
6/3/13,2013-03-06
21.7.2008,2008-07-21
22May1990,1990-05-22
ngày 16 tháng 6 năm 2011,2011-06-16
13Feb1990,1990-02-13
21 Aug 2019,2019-08-21
"May 17, 2013",2013-05-17
3-1-2023,2023-01-03
26 December 1993,1993-12-26
5:1:1995,1995-01-05
15.7.2009,2009-07-15
5-3-2020,2020-03-05
26/5/2024,2024-05-26
Mar 1 28,2028-03-01
6/3/29,2029-03-06
20.3.2008,2008-03-20
2019/7/27,2019-07-27
22/1-2009,2009-01-22
28.8.1990,1990-08-28
11-3,2008-03-11
9/22-2000,2000-11-09
03122001,2001-12-03
15 Ma 2003,2003-03-15
27-7,1994-07-27
26 No 2020,2020-11-26
8/5/90,1990-05-08
"Feb 20th, 2014",2014-02-20
10-7-2003,2003-07-10
3 Ma 2006,2006-03-03
19 July 2013,2013-07-19
8-7-2012,2012-07-04
Apr 28 27,2027-04-28
11.11.2002,2002-11-11
"Jul 23th, 2001",2001-07-23
3 tháng 1 năm 2026,2026-01-03
2013/2,2013-02-10
21Nov2025,2025-11-21
10/36/1995,1995-12-10
22/5/08,2008-05-22
22072021,2021-07-22
3-3-2002,2002-03-03
18-1,1998-01-18
5/1/22,2022-05-01
2009-7-2,2009-07-02
10/9-2004,2004-09-10
4 Fe 2031,2031-02-04
8:2:1997,1997-02-08
7Jun2015,2015-06-07
26 October 2031,2031-10-26
6th of December 2031,2031-12-06
20/9/95,1995-09-20
22022030,2030-02-22
13/20-2006,2006-10-13
3/8/99,1999-03-08
03122027,2027-12-03
1/6-2023,2023-06-01
2005/7/24,2005-07-24
12 Ju 2026,2026-07-12
1 Feb 2030,2030-02-01
20/10-2011,2011-05-20
4/7/99,1999-04-07
Oct 1 02,2002-10-01
23-5,1993-05-23
13/21/1990,1990-07-13
5/9/2026,2026-03-05
12/7/30,2030-07-12
18-7-2018,2018-07-18
17 Ju 2017,2017-07-17
13122021,2021-12-13
18/9-2012,2012-09-18
15-6-1996,1996-06-15
16 Feb 1991,1991-02-16
Nov 7 15,2015-11-07
15May1999,1999-05-15
2006/9/24,2006-09-24
"Jan 4th, 2006",2006-01-04
21-8-2024,2024-08-21
19092009,2009-09-19
19-10,2032-10-19
23Sep1995,1995-09-23
25/8/2027,2027-08-25
Jun 22 24,2024-06-22
11/4/2013,2013-04-11
16.2.1990,1990-02-16
10/21/12,2012-10-21
12 Mar 2031,2031-03-12
Aug 16 19,2019-08-16
9/5/2010,2010-05-09
"January 8, 2020",2020-01-08
15th of April 2030,2030-04-15
10-10-2020,2020-10-10
6Jan2018,2018-01-06
Oct 9 21,2021-10-09
19/10-2023,2023-10-19
11/8/19,2019-11-08
18/8-2022,2022-08-18
27th of May 2002,2002-05-27
16 tháng 5 năm 2005,2005-05-16
36-3-2025,2025-03-18
25-10-2017,2017-10-25
2/20-1997,1997-10-02
14102018,2018-10-14
15/1/2023,2023-01-15
18102027,2027-10-18
22Nov2018,2018-11-22
23/4/22,2022-04-23
17/6/32,2032-06-17
12/4/94,1994-12-04
8th of September 2015,2015-09-08
28-10-1998,1998-10-28
22th of November 2035,2035-11-22
6 October 2011,2011-10-06
1 June 2022,2022-06-01
18 Se 2018,2018-09-18
14.5.1999,1999-05-14
22/4-2027,2027-02-22
21.6.1999,1999-06-21
18Mar2014,2014-03-18
10/24/2021,2021-10-24
Jul 5 01,2001-07-05
18 December 2034,2034-12-18
10/10/2010,2010-10-10
ngày 25 tháng 3 năm 2033,2033-03-25
2003/7/15,2003-07-15
18/9-2016,2016-09-18
24/8/00,2000-08-24
2035/6/1,2035-06-01
2035-9-7,2035-09-07
2023/6/25,2023-06-25
4 Aug 2008,2008-08-04
"Oct 6th, 2011",2011-10-06
18042029,2029-04-18
"February 17, 2022",2022-02-17
19/10/94,1994-10-19
16/5/91,1991-05-16
6 Dec 2001,2001-12-06
12-9-29,2029-12-09
4:3:1991,1991-03-04
6 Mar 2032,2032-03-06
11/21/1990,1990-11-21
24-8-2001,2001-08-12
Mar 22 08,2008-03-22
25 March 2002,2002-03-25
"Mar 20th, 2003",2003-03-20
18/2/26,2026-02-18
21/6/1991,1991-06-21
15/9/2027,2027-09-15
10121997,1997-12-10
2-28-21,2021-02-28
15/14-2035,2035-07-15
28/12-2010,2010-06-28
20/4/35,2035-04-20
2015/11/16,2015-11-16
"January 13, 1999",1999-01-13
16/12/2019,2019-12-16
22/20-2034,2034-10-22
24Apr2019,2019-04-24
22Mar2001,2001-03-22
21 Ma 2000,2000-05-21
"October 21, 2027",2027-10-21
6/6/1996,1996-02-06
12.5.2025,2025-05-12
21-9,2000-09-21
14 August 1992,1992-08-14
9/22/08,2008-09-22
27/12/2016,2016-04-27
17 tháng 10 năm 2006,2006-10-17
12-6-04,2004-12-06
11/23/2016,2016-11-23
22-4-1991,1991-04-22
12/27/2010,2010-09-12
4-10-1990,1990-10-04
11-28-30,2030-11-28
2025/2,2025-02-28
"Jul 10th, 2020",2020-07-10
16 Ap 2020,2020-04-16
15/2-2034,2034-02-15
3-3,2015-03-03
16-6,2018-06-16
9/6/1990,1990-02-09
7/14/1997,1997-07-14
2031-5-11,2031-05-11
10th of August 2000,2000-08-10
1st of September 2029,2029-09-01
11 Ma 2003,2003-03-11
"Dec 19th, 2024",2024-12-19
1992/8,1992-08-01
2032/1,2032-01-22
10092006,2006-09-10
01021993,1993-02-01
ngày 13 tháng 4 năm 2021,2021-04-13
2005/8,2005-08-18
13-2,2011-02-13
24-8-1995,1995-08-24
27Apr2008,2008-04-27
2034/6/17,2034-06-17
10 May 2028,2028-05-10
4-3-2024,2024-03-04
10/18/2022,2022-06-10
10 Feb 2017,2017-02-10
1/6/2013,2013-01-06
24-6,2018-06-24
19/5/16,2016-05-19
4/33/1995,1995-11-04
21 Jul 2012,2012-07-21
"May 17th, 1996",1996-05-17
1:7:2006,2006-07-01
52-6-2011,2011-06-26
8-19-99,1999-08-19
5-1-2001,2001-01-05
25 tháng 7 năm 1998,1998-07-25
1-11-2007,2007-11-01
ngày 11 tháng 2 năm 2008,2008-02-11
2003/8,2003-08-24
2035/2/26,2035-02-26
23th of December 2000,2000-12-23
8 Ap 2007,2007-04-08
Jun 24 94,1994-06-24
3/2/08,2008-02-03
28/33/2032,2032-11-28
"November 14, 1991",1991-11-14
7th of June 1990,1990-06-07
10/19/2001,2001-10-19
20th of July 2013,2013-07-20
11071990,1990-07-11
11-15-09,2009-11-15
1/14/19,2019-01-14
24021998,1998-02-24
21 Nov 1996,1996-11-21
2030/6/3,2030-06-03
18/10-2016,2016-10-18
5:9:2025,2025-09-05
6/21/2007,2007-07-06
ngày 25 tháng 12 năm 2009,2009-12-25
19/10/32,2032-10-19
25-6,2015-06-25
ngày 26 tháng 7 năm 2004,2004-07-26
"August 1, 1991",1991-08-01
10Mar2027,2027-03-10
12/6/1997,1997-12-06
2028/5/1,2028-05-01
24 Jul 2004,2004-07-24
2015/6,2015-06-05
36-6-2004,2004-06-18
7-5-97,1997-07-05
1994-12-11,1994-12-11
5/8-2013,2013-08-05
15-3,2028-03-15
Jan 18 05,2005-01-18
4/8/05,2005-08-04
8/2/2006,2006-08-02
21.11.1991,1991-11-21
Jul 25 08,2008-07-25
"May 14, 2004",2004-05-14
2013-12-10,2013-12-10
15/8-2009,2009-04-15
9-27-98,1998-09-27
26 September 2005,2005-09-26
1Nov2001,2001-11-01
ngày 12 tháng 10 năm 2005,2005-10-12
27Oct2010,2010-10-27
7-3-17,2017-07-03
2027/10,2027-10-28
12.5.1995,1995-05-12
"November 20, 2020",2020-11-20
12-15-30,2030-12-15
16 tháng 12 năm 2022,2022-12-16
"Oct 25th, 2031",2031-10-25
25/8/24,2024-08-25
9/18/2013,2013-06-09
18 February 2023,2023-02-18
2019-8-13,2019-08-13
3-10-2008,2008-10-03
8:8:1990,1990-08-08
7/23/1998,1998-07-23
3-25-05,2005-03-25
4/8-2022,2022-08-04
23-3,2028-03-23
10-2-22,2022-10-02
23 Apr 2015,2015-04-23
Sep 17 27,2027-09-17
54-1-1992,1992-01-27
5th of September 2029,2029-09-05
15 November 2005,2005-11-15
6/2/2000,2000-06-02
19/11-2011,2011-11-19
9:4:2029,2029-04-09
16/7-2004,2004-07-16
"Dec 16th, 1999",1999-12-16
ngày 1 tháng 11 năm 2030,2030-11-01
1996/8/9,1996-08-09
2010/9/8,2010-09-08
24/12-2016,2016-12-24
11th of June 2017,2017-06-11
34-11-1991,1991-11-17
6/1/33,2033-06-01
15/36/2023,2023-12-15
ngày 20 tháng 3 năm 2023,2023-03-20
4/23/2029,2029-04-23
2018-11-15,2018-11-15
2.10.1993,1993-10-02
ngày 11 tháng 11 năm 2035,2035-11-11
2/23/2002,2002-02-23
8th of August 2000,2000-08-08
Nov 9 15,2015-11-09
9/11/13,2013-11-09
15/18-2027,2027-09-15
8Mar2019,2019-03-08
18 January 2000,2000-01-18
"February 20, 2003",2003-02-20
"September 7, 1995",1995-09-07
28th of May 2024,2024-05-28
24 tháng 2 năm 2004,2004-02-24
"Feb 1st, 2011",2011-02-01
23/10-1997,1997-05-23
ngày 14 tháng 11 năm 2017,2017-11-14
12/10/2002,2002-12-10
Mar 6 32,2032-03-06
15-2,2005-02-15
50-6-2033,2033-06-25
2009/8/28,2009-08-28
23 February 2005,2005-02-23
26th of March 2013,2013-03-26
2002/12,2002-12-11
2011/7/11,2011-07-11
2/2/2008,2008-02-02
20.4.2032,2032-04-20
12/9/09,2009-09-12
36-5-2002,2002-05-18
26/11/2003,2003-11-26
2/27/2022,2022-02-27
17-2,1990-02-17
9-9-2034,2034-09-09
12th of September 2009,2009-09-12
"Oct 10th, 1992",1992-10-10
1/6/05,2005-01-06
7-7-2033,2033-07-07
8:3:2012,2012-03-08
3:10:2006,2006-10-03
11/6/92,1992-06-11
12.5.2027,2027-05-12
16 Oc 2005,2005-10-16
15/3-2027,2027-03-15
17102012,2012-10-17
27 August 2001,2001-08-27
17/6/35,2035-06-17
18 Nov 2004,2004-11-18
8/6/2020,2020-06-08
"Dec 21th, 2024",2024-12-21
11/5/12,2012-11-05
11-8-2010,2010-08-11
24/36/2024,2024-12-24
21/5/10,2010-05-21
4th of January 2032,2032-01-04
11/3/2004,2004-01-11
23/10-1995,1995-10-23
Oct 1 16,2016-10-01
19/7-2013,2013-07-19
15 October 2029,2029-10-15
11/15/2006,2006-11-15
5/27/2012,2012-05-27
15 Se 2019,2019-09-15
14-6,2034-06-14
Aug 21 96,1996-08-21
2010-9-27,2010-09-27
2000/8,2000-08-02
"November 13, 2018",2018-11-13
8-23-27,2027-08-23
"Feb 11th, 2028",2028-02-11
11112034,2034-11-11
2002/6/10,2002-06-10
8/11/2017,2017-08-11
21/6-2017,2017-03-21
15/1-2008,2008-01-15
14/2/31,2031-02-14
6Sep1991,1991-09-06
10/3-2005,2005-03-10
3/8-2034,2034-04-03
16Nov2025,2025-11-16
21 December 2009,2009-12-21
1/2/2010,2010-01-02
"October 17, 1998",1998-10-17
26 February 2019,2019-02-26
"December 7, 2008",2008-12-07
2-16-93,1993-02-16
9.4.1991,1991-04-09
2 tháng 7 năm 2016,2016-07-02
16.9.2004,2004-09-16
4:7:1996,1996-07-04
23092003,2003-09-23
"Dec 28th, 2011",2011-12-28
16/2-2033,2033-02-16
11/2/1994,1994-11-02
ngày 10 tháng 7 năm 2009,2009-07-10
1991/7/18,1991-07-18
18/5-2019,2019-05-18
15/1/04,2004-01-15
1996-11-14,1996-11-14
10/11/07,2007-11-10
7 Aug 2032,2032-08-07
28.7.2008,2008-07-28
23-5,2013-05-23
ngày 11 tháng 7 năm 1992,1992-07-11
16.5.2013,2013-05-16
27/9-2004,2004-09-27
2 Dec 2002,2002-12-02
2009-7-26,2009-07-26
14-1-1996,1996-01-14
ngày 15 tháng 4 năm 2021,2021-04-15
4-4,1993-04-04
6-13-92,1992-06-13
24-6,1995-06-24
16-1-1999,1999-01-16
50-7-2024,2024-07-25
8 tháng 5 năm 1992,1992-05-08
3:11:2005,2005-11-03
2030-10-26,2030-10-26
18 tháng 12 năm 2002,2002-12-18
27.7.2027,2027-07-27
14 Jun 2012,2012-06-14
"Aug 12th, 2030",2030-08-12
ngày 10 tháng 11 năm 2020,2020-11-10
10-11-14,2014-10-11
27 July 2032,2032-07-27
28-9,2022-09-28
7 Se 2021,2021-09-07
2018-1-5,2018-01-05
15 Dec 1994,1994-12-15
2008/11/27,2008-11-27
2030/6,2030-06-01
13-8-1996,1996-08-13
ngày 24 tháng 8 năm 2007,2007-08-24
10-4,2032-04-10
24 Jul 1991,1991-07-24
2021/10/24,2021-10-24
10/19/25,2025-10-19
16th of June 2029,2029-06-16
"Jan 17th, 2014",2014-01-17
27 February 2032,2032-02-27
1992/8,1992-08-01
"Jan 3rd, 1991",1991-01-03
15/12-2022,2022-12-15
19/6-2016,2016-06-19
7-10-08,2008-07-10
4.8.2016,2016-08-04
8/4/22,2022-08-04
10 May 2007,2007-05-10
15/2/17,2017-02-15
1997/6,1997-06-07
20/1-2035,2035-01-20
"Jun 12th, 2003",2003-06-12
9 Mar 1992,1992-03-09
17/4-2032,2032-02-17
Jul 8 02,2002-07-08
48-12-2023,2023-12-24
6-3-92,1992-06-03
10 Mar 2031,2031-03-10
17/4-2012,2012-04-17
5 tháng 7 năm 2034,2034-07-05
26th of April 2001,2001-04-26
7/21/2008,2008-07-07
"August 2, 2032",2032-08-02
"Dec 1st, 2019",2019-12-01
11/8-1999,1999-04-11
11May2021,2021-05-11
12/10/94,1994-12-10
15/6/2035,2035-06-15
48-3-1990,1990-03-24
10.12.1992,1992-12-10
21 Sep 2005,2005-09-21
9/10/2018,2018-10-09
6 Jan 2002,2002-01-06
"Jun 20th, 2009",2009-06-20
10 May 1998,1998-05-10
1/23/33,2033-01-23
2021/3,2021-03-09
"Apr 13th, 2009",2009-04-13
1990-3-8,1990-03-08
4/15/90,1990-04-15
5Dec2002,2002-12-05
16/10-2009,2009-10-16
4-26-26,2026-04-26
ngày 3 tháng 10 năm 1994,1994-10-03
26112030,2030-11-26
23.8.2011,2011-08-23
28th of March 2028,2028-03-28
3/4-2028,2028-04-03
2018/1,2018-01-06
25/8/12,2012-08-25
16/7-2011,2011-07-16
27/1/2001,2001-01-27
2010/2/9,2010-02-09
17/8/91,1991-08-17
8 Ma 1993,1993-03-08
2034-4-26,2034-04-26
12-4-2027,2027-04-12
19 Ap 2013,2013-04-19
4/20/2014,2014-04-20
10/8/21,2021-08-10
24-11-2008,2008-11-12
23/9-2028,2028-09-23
7/5/98,1998-05-07
12 Apr 2004,2004-04-12
5:7:2032,2032-07-05
4/8-2018,2018-08-04
9 tháng 1 năm 2011,2011-01-09
2000/3,2000-03-04
25/2-2032,2032-01-25
1/9-2004,2004-09-01
Jul 11 33,2033-07-11
12 Ma 2020,2020-03-12
1/10/03,2003-10-01
2/18/02,2002-02-18
20 October 1993,1993-10-20
10 December 2009,2009-12-10
23 Au 2001,2001-08-23
17/1/2025,2025-01-17
4-3,1999-03-04
Sep 17 97,1997-09-17
17 July 2026,2026-07-17
20/3-2002,2002-03-20
2032-9-15,2032-09-15
Jul 1 32,2032-07-01
20Mar2002,2002-03-20
20-8-1998,1998-08-10
13/7/2034,2034-07-13
10 September 2017,2017-09-10
10-14-04,2004-10-14
12/6/2001,2001-02-12
8/22-2012,2012-11-08
11/12/99,1999-12-11
5/8-2034,2034-04-05
27.2.2020,2020-02-27
2029-3-22,2029-03-22
"Aug 3rd, 1990",1990-08-03
22th of March 2008,2008-03-22
4/12-2022,2022-06-04
1999/11/16,1999-11-16
5/10/35,2035-05-10
19/11/10,2010-11-19
2/18/34,2034-02-18
"September 24, 2008",2008-09-24
26-3,2001-03-26
2020/11,2020-11-23
23Sep2030,2030-09-23
2/17/12,2012-02-17
14 tháng 2 năm 2026,2026-02-14
2Jul2018,2018-07-02
Mar 13 33,2033-03-13
Sep 15 14,2014-09-15
28-11-2027,2027-11-28
18/8/94,1994-08-18
14/9/2018,2018-03-14
8/6/34,2034-06-08
3Aug2005,2005-08-03
26:6:1996,1996-06-26
10/17/2005,2005-10-17
1/19/2019,2019-01-19
8Oct2013,2013-10-08
20.8.2032,2032-08-20
7Jun2034,2034-06-07
22 May 2034,2034-05-22
"June 1, 2006",2006-06-01
"July 6, 2010",2010-07-06
13-5-2019,2019-05-13
12/5-2024,2024-05-12
6-17-22,2022-06-17
11/6-2033,2033-06-11
7/24/2006,2006-07-24
10/7/13,2013-10-07
27/11/2012,2012-11-27
17 Feb 2014,2014-02-17
24/9/17,2017-09-24
2/9/1997,1997-03-02
2018/11/26,2018-11-26
Sep 21 05,2005-09-21
4/18-2005,2005-09-04
"September 16, 2013",2013-09-16
15072020,2020-07-15
2003/3,2003-03-24
"November 26, 2019",2019-11-26
Feb 7 04,2004-02-07
ngày 11 tháng 2 năm 2034,2034-02-11
20/1/2000,2000-01-20
8/8/26,2026-08-08
11/36/1997,1997-12-11
18.1.2000,2000-01-18
4/9/2025,2025-03-04
9-15-30,2030-09-15
17011995,1995-01-17
"Feb 7th, 2018",2018-02-07
2014/6,2014-06-06
2031/9/21,2031-09-21
2001-12-18,2001-12-18
23/8/08,2008-08-23
ngày 12 tháng 8 năm 2018,2018-08-12
2 Se 2014,2014-09-02
7/27/2007,2007-09-07
17/11/98,1998-11-17
3/9/00,2000-09-03
13.3.2033,2033-03-13
25/24/2011,2011-08-25
25012012,2012-01-25
24/2-1999,1999-02-24
5Apr2015,2015-04-05
ngày 7 tháng 11 năm 2008,2008-11-07
4 Ju 2010,2010-07-04
10 May 2017,2017-05-10
1998-7-14,1998-07-14
Mar 24 01,2001-03-24
Jan 17 91,1991-01-17
21 tháng 7 năm 2009,2009-07-21
2-2-30,2030-02-02
6 November 1993,1993-11-06
25 Mar 1995,1995-03-25
17:8:2026,2026-08-17
12/9/32,2032-09-12
7-21-22,2022-07-21
9 tháng 11 năm 2020,2020-11-09
34-1-2003,2003-01-17
26/5/09,2009-05-26
3/11/25,2025-11-03
26/12/2008,2008-04-26
21:6:2018,2018-06-21
23/10-2023,2023-10-23
18 Ja 2022,2022-01-18
19 Ja 2004,2004-01-19
5/13/22,2022-05-13
May 10 16,2016-05-10
2020/8/25,2020-08-25
Apr 24 10,2010-04-24
26th of January 2021,2021-01-26
5/9/24,2024-05-09
5 tháng 2 năm 2033,2033-02-05
3/5/2009,2009-05-03
4:3:2030,2030-03-04
5/33/2035,2035-11-05
7/11/24,2024-07-11
May 6 06,2006-05-06
8/14/28,2028-08-14
"Oct 21th, 2023",2023-10-21
8-6-1992,1992-06-08
10-8-2035,2035-08-10
2033/2,2033-02-21
2010-11-8,2010-11-08
28.4.2010,2010-04-28
26 Ma 2030,2030-05-26
28/15/2005,2005-05-28
42-2-2002,2002-02-21
3 tháng 4 năm 2022,2022-04-03
Jan 8 33,2033-01-08
19-9,2015-09-19
"October 6, 2009",2009-10-06
26 Au 2019,2019-08-26
9/13/13,2013-09-13
18 Jul 1990,1990-07-18
3-8-91,1991-03-08
2/12/08,2008-12-02
"Jun 17th, 1991",1991-06-17
16/10/93,1993-10-16
8 Dec 2009,2009-12-08
14:4:2034,2034-04-14
"Apr 22th, 2034",2034-04-22
10 Oc 1993,1993-10-10
1-3,2018-03-01
Nov 3 10,2010-11-03
15/4/2023,2023-04-15
5/21/2025,2025-07-05
17 No 2003,2003-11-17
3-13-21,2021-03-13
18-9,2025-09-18
12/4-2006,2006-04-12
2 tháng 11 năm 2021,2021-11-02
2/24/2030,2030-02-24
Jun 3 17,2017-06-03
12/4/14,2014-04-12
9/10/28,2028-10-09
22/22-2026,2026-11-22
4/21/2012,2012-04-21
10-5-2030,2030-05-10
12/6/2006,2006-12-06
19 March 1994,1994-03-19
6/12-1991,1991-12-06
25May1995,1995-05-25
3/10/2002,2002-10-03
36-7-2000,2000-07-18
27 June 2005,2005-06-27
17.1.2029,2029-01-17
4 tháng 12 năm 2033,2033-12-04
12/2/1999,1999-02-12
"Jul 21th, 2031",2031-07-21
21/3/2006,2006-03-21
11 Nov 2003,2003-11-11
28 Feb 2029,2029-02-28
2 June 2025,2025-06-02
1/25/09,2009-01-25
2.9.2020,2020-09-02
9-4-2000,2000-04-09
26 Ju 2017,2017-06-26
2026/7,2026-07-23
15Aug2006,2006-08-15
25/2/95,1995-02-25
2007/4,2007-04-14
28/2/15,2015-02-28
26/10/96,1996-10-26
12.1.2006,2006-01-12
8/19/2018,2018-08-19
12 Se 2019,2019-09-12
6/10/93,1993-10-06
10062035,2035-06-10
11 Ap 1996,1996-04-11
16/11/09,2009-11-16
2/6-2008,2008-06-02
26/5/16,2016-05-26
2006-1-7,2006-01-07
16/14-2007,2007-07-16
12/36/2029,2029-12-12
20/6/95,1995-06-20
2 Aug 2025,2025-08-02
27/1-2002,2002-01-27
Jun 9 91,1991-06-09
6 December 2006,2006-12-06
5/10-1993,1993-10-05
11-6-93,1993-11-06
"October 18, 2020",2020-10-18
"July 19, 2008",2008-07-19
22th of July 2012,2012-07-22
8/2/20,2020-08-02
28:11:2032,2032-11-28
10-22-19,2019-10-22
8/4/16,2016-08-04
04012001,2001-01-04
16/12/08,2008-12-16
10 Jun 2017,2017-06-10
Oct 1 91,1991-10-01
2026-6-7,2026-06-07
16 De 2003,2003-12-16
16 Aug 2018,2018-08-16
20/20-2035,2035-10-20
19 De 2006,2006-12-19
23-5-2019,2019-05-23
2014/2/9,2014-02-09
"Oct 23th, 2002",2002-10-23
2008-12-21,2008-12-21
2010/5/12,2010-05-12
2034/1,2034-01-26
14-10-2022,2022-10-07
9/3-2023,2023-03-09
2008-8-25,2008-08-25
3/10/2024,2024-10-03
4Nov2019,2019-11-04
4 tháng 5 năm 2011,2011-05-04
Sep 17 94,1994-09-17
22 Ja 1999,1999-01-22
23 tháng 6 năm 1994,1994-06-23
7/3/2002,2002-07-03
2-10,2003-10-02
"August 23, 2000",2000-08-23
25 Jan 2025,2025-01-25
8/12/2006,2006-04-08
"Nov 2nd, 2012",2012-11-02
3-11-07,2007-03-11
23.5.2023,2023-05-23
8.11.2023,2023-11-08
2003/9/12,2003-09-12
11-17-29,2029-11-17
1999/8/5,1999-08-05
48-12-2014,2014-12-24
24 December 2013,2013-12-24
11/13/2004,2004-11-13
24-9-2021,2021-09-24
26/1/1998,1998-01-26
ngày 27 tháng 10 năm 1997,1997-10-27
4/1-2023,2023-01-04
2033-2-6,2033-02-06
11/10/11,2011-10-11
6-17-02,2002-06-17
27/16-2003,2003-08-27
17/8/25,2025-08-17
1999/11/26,1999-11-26
21 tháng 9 năm 2008,2008-09-21
2024/10,2024-10-08
6/20/32,2032-06-20
2/22/2003,2003-02-22
2027/7,2027-07-03
22:3:2015,2015-03-22
8 Ju 2005,2005-07-08
25:10:2035,2035-10-25
08082003,2003-08-08
11-12,2027-12-11
3/6/07,2007-06-03
"Jan 9th, 1993",1993-01-09
2024/1/16,2024-01-16
5/4/2009,2009-05-04
12/15/2029,2029-12-15
Sep 21 94,1994-09-21
"August 19, 2019",2019-08-19
6/4-1990,1990-04-06
10 tháng 2 năm 2019,2019-02-10
4/19/1997,1997-04-19
20/4-2012,2012-04-20
02031995,1995-03-02
7/22/00,2000-07-22
24 May 2004,2004-05-24
"Apr 12th, 2024",2024-04-12
24:12:2012,2012-12-24
10 tháng 1 năm 1992,1992-01-10
6-27-16,2016-06-27
6 tháng 9 năm 2017,2017-09-06
10/4/97,1997-04-10
23/8-2029,2029-04-23
"Jan 27th, 1992",1992-01-27
1/11-2021,2021-11-01
12/2/16,2016-02-12
20May2024,2024-05-20
19/18/2001,2001-06-19
13/4-2000,2000-04-13
25 Ju 2004,2004-07-25
15 De 1998,1998-12-15
"July 16, 2002",2002-07-16
22:9:2008,2008-09-22
19/9/2011,2011-03-19
18-11-1995,1995-11-09
12/11-2023,2023-11-12
15/2/00,2000-02-15
9/1/02,2002-01-09
16 Ju 2035,2035-06-16
"January 6, 2006",2006-01-06
2009-11-21,2009-11-21
2006/12,2006-12-16
"May 4th, 2034",2034-05-04
"October 22, 2027",2027-10-22
11/10/12,2012-11-10
12-12-2019,2019-12-12
23 Ju 2022,2022-07-23
2-7,2010-07-02
23/10/29,2029-10-23
7/24/93,1993-07-24
6/12/1993,1993-12-06
3/16/33,2033-03-16
2010/12,2010-12-08
26 Oct 2010,2010-10-26
23/2-1996,1996-01-23
12/6-2007,2007-06-12
08042033,2033-04-08
2/3/1994,1994-02-03
22-4-2022,2022-04-22
1995-12-2,1995-12-02
12/14-2008,2008-07-12
24-1,2007-01-24
8-5-01,2001-08-05
2025/5/16,2025-05-16
"Apr 6th, 2020",2020-04-06
19 Dec 2010,2010-12-19
22/2/27,2027-02-22
6Feb2005,2005-02-06
8 Se 2004,2004-09-08
23/3/2005,2005-03-23
21081995,1995-08-21
2000-9-5,2000-09-05
17 Nov 1999,1999-11-17
"Mar 2nd, 2005",2005-03-02
23.5.2031,2031-05-23
Mar 13 90,1990-03-13
"December 14, 2010",2010-12-14
24/8/2014,2014-08-24
14/1/2024,2024-01-14
17 November 2004,2004-11-17
18.7.2005,2005-07-18
8 Jul 2019,2019-07-08
15 Ma 1995,1995-03-15
24 January 2026,2026-01-24
20-7-2030,2030-07-20
6/9-2033,2033-09-06
Jul 28 03,2003-07-28
2013/9/24,2013-09-24
2/4/03,2003-02-04
24 De 2014,2014-12-24
Apr 27 09,2009-04-27
18/4-2010,2010-02-18
2nd of August 2017,2017-08-02
1/2-2018,2018-02-01
20/33/2004,2004-11-20
19/6/2013,2013-02-19
23.3.1999,1999-03-23
22/8/2027,2027-08-22
19/11/25,2025-11-19
2030-6-14,2030-06-14
10.10.2025,2025-10-10
5-13-95,1995-05-13
19Jul2003,2003-07-19
13/12/30,2030-12-13
ngày 10 tháng 2 năm 1999,1999-02-10
4-24-35,2035-04-24
"April 5, 1997",1997-04-05
1/11/2013,2013-11-01
2006-5-22,2006-05-22
2006/11/22,2006-11-22
4/3/1991,1991-03-04
ngày 25 tháng 6 năm 2012,2012-06-25
1-8-2032,2032-08-01
8 Ap 2034,2034-04-08
28/2-2007,2007-02-28
21 Ma 2014,2014-05-21
2031/2/1,2031-02-01
19Jun2008,2008-06-19
ngày 25 tháng 5 năm 2033,2033-05-25
27/1-2007,2007-01-27
18:9:2014,2014-09-18
2002/5/7,2002-05-07
5/23/12,2012-05-23
10/10/2007,2007-10-10
7:12:1990,1990-12-07
19/10-2020,2020-05-19
20-12,2027-12-20
9-2,1996-02-09
12/14/00,2000-12-14
3/10-2028,2028-10-03
18/3-2025,2025-03-18
4:11:2019,2019-11-04
23/6/22,2022-06-23
"Mar 2nd, 2033",2033-03-02
11/3/93,1993-03-11
15/4-2004,2004-02-15
8.11.2008,2008-11-08
23 Se 2021,2021-09-23
22 December 1999,1999-12-22
"Dec 18th, 2005",2005-12-18
9.10.2015,2015-10-09
9/10/2028,2028-10-09
23-12,2020-12-23
24.5.2001,2001-05-24
12Apr1996,1996-04-12
"Oct 22th, 2006",2006-10-22
24:5:2020,2020-05-24
19/9-1992,1992-09-19
6/1-2033,2033-01-06
26-6-2035,2035-06-26
13-9-2018,2018-09-13
"Nov 14th, 2008",2008-11-14
7-2-14,2014-07-02
9-2-08,2008-09-02
17:2:1995,1995-02-17
5 July 2015,2015-07-05
17 May 2014,2014-05-17
18/16-1997,1997-08-18
"February 17, 2013",2013-02-17
"October 26, 1995",1995-10-26
Mar 9 27,2027-03-09
14.3.2024,2024-03-14
9/19/15,2015-09-19
2004/10,2004-10-16
1994/11/28,1994-11-28
15-1,2026-01-15
20-6,2022-06-20
27/3/2020,2020-01-27
"Jul 14th, 2003",2003-07-14
19-1,2026-01-19
9 Au 2015,2015-08-09
22/8/96,1996-08-22
Sep 16 10,2010-09-16
13 November 1994,1994-11-13
20 tháng 8 năm 2016,2016-08-20
22 tháng 9 năm 1995,1995-09-22
"Nov 18th, 2002",2002-11-18
2-9-1997,1997-09-02
2007/3,2007-03-05
2030/8/7,2030-08-07
23.8.1995,1995-08-23
10.7.2014,2014-07-10
Apr 18 09,2009-04-18
54-8-2034,2034-08-27
21/7/2005,2005-07-21
8/28/13,2013-08-28
2:12:1995,1995-12-02
2-6-2002,2002-06-02
13/1/2027,2027-01-13
21/12-2028,2028-06-21
24 tháng 7 năm 2015,2015-07-24
17 Sep 1997,1997-09-17
7/10-2032,2032-05-07
2019-8-19,2019-08-19
26/4/08,2008-04-26
3/3/2002,2002-03-03
7/13/04,2004-07-13
26 Sep 2016,2016-09-26
2005-12-5,2005-12-05
14062022,2022-06-14
12-11,1998-11-12
Sep 1 06,2006-09-01
5/11/13,2013-05-11
2034/2/16,2034-02-16
16:8:1992,1992-08-16
28/4/11,2011-04-28
7/3/2017,2017-01-07
12/16-2001,2001-08-12
5/9/2004,2004-05-09
19/4/2035,2035-04-19
Jul 22 35,2035-07-22
26th of October 2003,2003-10-26
14 Ja 1994,1994-01-14
Jun 21 15,2015-06-21
6/18/1998,1998-06-06
2005/2,2005-02-15
20/5-2013,2013-05-20
22:6:2017,2017-06-22
1992/10,1992-10-05
11/9/2009,2009-11-09
8/9/2022,2022-08-09
22:3:2029,2029-03-22
8th of February 2021,2021-02-08
9-16-91,1991-09-16
2008-8-14,2008-08-14
34-6-2004,2004-06-17
10/3/90,1990-03-10
8/10-2027,2027-05-08
28th of September 2030,2030-09-28
1/5/12,2012-01-05
12/2/26,2026-12-02
1997-6-19,1997-06-19
"April 23, 1998",1998-04-23
"July 17, 1996",1996-07-17
2022-10-5,2022-10-05
22-1-2025,2025-01-22
2006/7,2006-07-02
Dec 7 27,2027-12-07
24072015,2015-07-24
2nd of June 2034,2034-06-02
"Sep 13th, 2018",2018-09-13
2003-9-24,2003-09-24
26 Sep 2017,2017-09-26
2 Ma 1997,1997-03-02
1-8-95,1995-01-08
26:3:1991,1991-03-26
Mar 13 27,2027-03-13
4/18/2004,2004-06-04
15 Jan 2030,2030-01-15
11/2-2017,2017-02-11
22-11-2009,2009-11-22
4/16/2028,2028-04-16
ngày 26 tháng 3 năm 1995,1995-03-26
12-19-16,2016-12-19
7/11-1992,1992-11-07
24/2/27,2027-02-24
Jul 18 35,2035-07-18
26.10.2020,2020-10-26
1/30/1992,1992-10-01
ngày 11 tháng 2 năm 2013,2013-02-11
4-6-35,2035-04-06
14 tháng 4 năm 2020,2020-04-14
12/24-2009,2009-12-12
ngày 2 tháng 4 năm 2033,2033-04-02
5 April 2026,2026-04-05
20:7:2025,2025-07-20
21/10-2000,2000-05-21
20/5-2031,2031-05-20
7/9/94,1994-09-07
2 May 2015,2015-05-02
ngày 7 tháng 4 năm 1993,1993-04-07
Jul 22 12,2012-07-22
ngày 18 tháng 9 năm 1990,1990-09-18
1/20/2030,2030-01-20
"Jan 1st, 2003",2003-01-01
5/9/2021,2021-03-05
"January 8, 1995",1995-01-08
"Dec 12th, 2022",2022-12-12
2/1/1997,1997-01-02
12/18/2001,2001-06-12
"April 8, 1998",1998-04-08
7/10-2003,2003-10-07
20-2-2020,2020-02-20
06011992,1992-01-06
4-8,2035-08-04
14/12/2006,2006-04-14
5:2:2017,2017-02-05
1996/11,1996-11-22
27/10/1995,1995-10-27
18th of April 2012,2012-04-18
12/15/2003,2003-12-15
21092019,2019-09-21
24 tháng 8 năm 2010,2010-08-24
8/12-2012,2012-12-08
Nov 24 14,2014-11-24
2012/10,2012-10-07
6th of July 2027,2027-07-06
2010/11,2010-11-07
ngày 17 tháng 2 năm 2013,2013-02-17
"Jul 28th, 2009",2009-07-28
3/2/2031,2031-02-03
19-9-1994,1994-09-19
ngày 10 tháng 2 năm 2006,2006-02-10
"Apr 20th, 2017",2017-04-20
2016/5,2016-05-23
12.11.2021,2021-11-12
25th of May 1991,1991-05-25
22/24/2004,2004-08-22
24:2:1990,1990-02-24
5/21/34,2034-05-21
22-3,2013-03-22
6/12/2027,2027-12-06
May 4 98,1998-05-04
18Oct1994,1994-10-18
"Apr 8th, 2021",2021-04-08
28/27/2017,2017-09-28
10Mar1991,1991-03-10
14012013,2013-01-14
10Feb1996,1996-02-10
"Sep 18th, 2026",2026-09-18
"Aug 26th, 2014",2014-08-26
4 tháng 9 năm 2002,2002-09-04
2-2,2010-02-02
1993/12/17,1993-12-17
14-6-2004,2004-06-07
11-19-91,1991-11-19
3:11:2034,2034-11-03
28/5-2021,2021-05-28
4.5.1993,1993-05-04
4-9-2034,2034-09-02
25-1-1993,1993-01-25
36-7-2018,2018-07-18
"December 14, 2026",2026-12-14
5/11/2028,2028-11-05
"January 26, 2007",2007-01-26
11/7/2010,2010-11-07
16 September 2004,2004-09-16
11/1/27,2027-01-11
17/11-2023,2023-11-17
5/11/20,2020-11-05
13/10-2022,2022-10-13
ngày 17 tháng 4 năm 2006,2006-04-17
28 tháng 7 năm 2022,2022-07-28
7 Ap 2019,2019-04-07
2033-1-23,2033-01-23
Jun 13 24,2024-06-13
18 May 2013,2013-05-18
2007/5,2007-05-04
8 tháng 8 năm 1996,1996-08-08
6-1-2016,2016-01-03
"Apr 12th, 2008",2008-04-12
15/24/2000,2000-08-15
20/18/2010,2010-06-20
20 tháng 3 năm 2017,2017-03-20
1.6.2032,2032-06-01
16/2-2033,2033-01-16
10/24/2032,2032-08-10
14/3-2017,2017-03-14
6-1,2006-01-06
5/9-2032,2032-09-05
25 Sep 2034,2034-09-25
"October 7, 2010",2010-10-07
2-11,1997-11-02
3.10.1995,1995-10-03
2010/8/1,2010-08-01
18-11-1994,1994-11-18
Nov 21 35,2035-11-21
10-2,2003-02-10
9.10.2018,2018-10-09
ngày 6 tháng 3 năm 2034,2034-03-06
17/4-2012,2012-02-17
5/14/20,2020-05-14
2016/1,2016-01-27
2016/9/2,2016-09-02
26/8-2019,2019-04-26
16 February 2017,2017-02-16
09022014,2014-02-09
26.2.2024,2024-02-26
27 August 2008,2008-08-27
25th of May 2016,2016-05-25
5/4-2011,2011-02-05
"Nov 1st, 2028",2028-11-01
25 March 1994,1994-03-25
24-12,2031-12-24
14:3:2009,2009-03-14
"June 25, 2010",2010-06-25
3rd of November 2020,2020-11-03
4/9/2027,2027-09-04
6.5.2035,2035-05-06
18/8/11,2011-08-18
4-5-1992,1992-05-02
12071993,1993-07-12
10/21/10,2010-10-21
06032025,2025-03-06
40-9-2001,2001-09-20
7/9/07,2007-09-07
"Mar 28th, 1995",1995-03-28
2006/9,2006-09-09
1990/2/15,1990-02-15
3 tháng 10 năm 2019,2019-10-03
13Nov2003,2003-11-13
ngày 8 tháng 8 năm 1997,1997-08-08
7th of July 2032,2032-07-07
12-28-92,1992-12-28
5/3-2012,2012-03-05
15/5/95,1995-05-15
4-17-29,2029-04-17
11/2/29,2029-11-02
22 Nov 2003,2003-11-22
4 Dec 2002,2002-12-04
Sep 23 02,2002-09-23
17Feb2016,2016-02-17
2031-9-25,2031-09-25
Nov 16 93,1993-11-16
22/12-2028,2028-12-22
15:8:2030,2030-08-15
1997/6,1997-06-01
2034/11/21,2034-11-21
24-10,1991-10-24
6-5-95,1995-06-05
6/30/2014,2014-10-06
2018/6/27,2018-06-27
1992/6,1992-06-18
20/10-2031,2031-10-20
2024/10,2024-10-26
2005/2/18,2005-02-18
2008/3,2008-03-07
26th of September 2030,2030-09-26
2019-3-2,2019-03-02
Jan 10 92,1992-01-10
18-2-2006,2006-02-18
25:8:2024,2024-08-25
8th of October 2029,2029-10-08
8Mar1990,1990-03-08
15:10:2000,2000-10-15
25 February 2024,2024-02-25
8.7.1992,1992-07-08
7/26/26,2026-07-26
22.9.2034,2034-09-22
19/1-2029,2029-01-19
22/3-1999,1999-03-22
2029/3,2029-03-05
22102015,2015-10-22
5/9/2000,2000-09-05
23 Dec 2004,2004-12-23
10.1.1993,1993-01-10
2nd of October 1998,1998-10-02
6 February 2029,2029-02-06
38-8-2010,2010-08-19
12 tháng 4 năm 2027,2027-04-12
Feb 25 23,2023-02-25
8:11:2006,2006-11-08
3/21/1999,1999-07-03
17th of August 1998,1998-08-17
7-8,1997-08-07
5/24/2022,2022-08-05
2 October 2031,2031-10-02
10/2-2027,2027-02-10
24Aug2027,2027-08-24
5 tháng 12 năm 2012,2012-12-05
11Jul2034,2034-07-11
18Jan2031,2031-01-18
25:3:2024,2024-03-25
5/2/13,2013-05-02
6/6-2024,2024-06-06
11-7,2018-07-11
1/12/2026,2026-04-01
24072016,2016-07-24
26-5-2015,2015-05-26
14.3.2032,2032-03-14
"April 11, 2028",2028-04-11
2035/4/3,2035-04-03
15/9/05,2005-09-15
13-6,2026-06-13
18:4:2032,2032-04-18
12.6.1991,1991-06-12
21.9.2014,2014-09-21
"December 14, 2016",2016-12-14
9/5-2018,2018-05-09
21-3,2026-03-21
Oct 12 12,2012-10-12
1 Ju 2028,2028-06-01
2030/3,2030-03-06
12102012,2012-10-12
1-6-20,2020-01-06
19/9-2021,2021-09-19
24 tháng 1 năm 1998,1998-01-24
12:4:1991,1991-04-12
"September 18, 2010",2010-09-18
1991/7,1991-07-22
28/1-2026,2026-01-28
1/7/91,1991-01-07
1 Oct 2031,2031-10-01
6/2/05,2005-02-06
25/5-1991,1991-05-25
12-3-2025,2025-03-06
"September 5, 2022",2022-09-05
10/9/05,2005-10-09
Nov 18 17,2017-11-18
ngày 14 tháng 11 năm 2004,2004-11-14
"May 28, 2017",2017-05-28
ngày 2 tháng 1 năm 2031,2031-01-02
6Jul2009,2009-07-06
"March 2, 2016",2016-03-02
16 Aug 2021,2021-08-16
2005-6-22,2005-06-22
"February 19, 2002",2002-02-19
14Mar1995,1995-03-14
15th of August 2015,2015-08-15
28 Mar 2020,2020-03-28
2-5-30,2030-02-05
19/8/2016,2016-08-19
17/8/2004,2004-08-17
21/11-2017,2017-11-21
ngày 16 tháng 9 năm 2007,2007-09-16
11-4-18,2018-11-04
4 Oc 2029,2029-10-04
16062007,2007-06-16
23/10/12,2012-10-23
26-11,2018-11-26
17:3:2015,2015-03-17
22/9-2034,2034-09-22
ngày 21 tháng 10 năm 1998,1998-10-21
17/4-2025,2025-04-17
23/11-2005,2005-11-23
19-3,2010-03-19
13 May 2002,2002-05-13
27Oct2010,2010-10-27
11012011,2011-01-11
6Jul2000,2000-07-06
Oct 18 95,1995-10-18
24-5,2002-05-24
8/16/2030,2030-08-16
5/30/2021,2021-10-05
1993/7,1993-07-01
7 Feb 2008,2008-02-07
05071993,1993-07-05
1/15/06,2006-01-15
6/9/2022,2022-06-09
21 Nov 2020,2020-11-21
44-5-2014,2014-05-22
21 tháng 7 năm 2007,2007-07-21
15/8-1993,1993-04-15
15/4/17,2017-04-15
21 May 2021,2021-05-21
6 No 1990,1990-11-06
4/5/2031,2031-04-05
13th of June 2010,2010-06-13
12-7-2012,2012-07-12
13th of December 2025,2025-12-13
1/14-2001,2001-07-01
2/5/21,2021-05-02
8/8/00,2000-08-08
14/8-2010,2010-08-14
ngày 1 tháng 11 năm 2000,2000-11-01
"December 1, 2011",2011-12-01
02042012,2012-04-02
8/16-1999,1999-08-08
1/6-2034,2034-06-01
2020/3/12,2020-03-12
2027/1,2027-01-19
20/11-2035,2035-11-20
2003/10,2003-10-18
"December 3, 1993",1993-12-03
10/30/2028,2028-10-10
15-12,2001-12-15
22 tháng 5 năm 1994,1994-05-22
34-7-2029,2029-07-17
"May 17th, 2031",2031-05-17
3/9-1994,1994-09-03
20/8-1999,1999-08-20
20 Jun 2008,2008-06-20
6 September 2030,2030-09-06
10/7/1998,1998-07-10
24-7-2002,2002-07-24
5/4-2027,2027-02-05
26-4-2023,2023-04-26
3/12-2020,2020-12-03
17/9/2017,2017-09-17
12-27-10,2010-12-27
23:8:2006,2006-08-23
20/5/98,1998-05-20
2/10-2011,2011-10-02
8th of November 2009,2009-11-08
22/4-2016,2016-04-22
26-1-2017,2017-01-13
12:11:2034,2034-11-12
25/6/2018,2018-02-25
23-7,2001-07-23
6/5/31,2031-06-05
26:1:2001,2001-01-26
Aug 13 17,2017-08-13
"August 28, 2009",2009-08-28
2014-5-10,2014-05-10
17-3,2009-03-17
"November 5, 2018",2018-11-05
28th of May 2013,2013-05-28
"October 25, 2002",2002-10-25
7/7/92,1992-07-07
28-4-2027,2027-04-28
1999/4/3,1999-04-03
"Feb 13th, 2013",2013-02-13
22102021,2021-10-22
26th of November 2019,2019-11-26
8Sep2001,2001-09-08
12Aug2011,2011-08-12
2009/9,2009-09-04
26.10.1997,1997-10-26
Jun 9 94,1994-06-09
19 Fe 2034,2034-02-19
22:1:2013,2013-01-22
13102011,2011-10-13
"Feb 26th, 1995",1995-02-26
2033/5/28,2033-05-28
20-8-2029,2029-08-20
"Mar 22th, 1997",1997-03-22
14 tháng 4 năm 2030,2030-04-14
2004-12-25,2004-12-25
1/20/2032,2032-01-20
2020-1-17,2020-01-17
14/1-2007,2007-01-14
"Jul 24th, 1997",1997-07-24
12-2,2009-02-12
8/6/2000,2000-06-08
2/8-2019,2019-08-02
10/7-1993,1993-07-10
19 May 2012,2012-05-19
Sep 3 10,2010-09-03
7-7-2016,2016-07-07
"Feb 9th, 1995",1995-02-09
7/7/2016,2016-07-07
12/20-2021,2021-10-12
56-6-2010,2010-06-28
10th of February 2031,2031-02-10
ngày 11 tháng 1 năm 2006,2006-01-11
21 Nov 2007,2007-11-21
24:8:2004,2004-08-24
ngày 3 tháng 8 năm 2030,2030-08-03
13:4:2006,2006-04-13
27Jan1991,1991-01-27
14/36/2006,2006-12-14
8 Ap 2003,2003-04-08
3-8-96,1996-03-08
26/20-2007,2007-10-26
6-4-2005,2005-04-03
Jul 23 94,1994-07-23
23/16-2035,2035-08-23
8/1/08,2008-08-01
12/10/2006,2006-12-10
ngày 2 tháng 12 năm 2022,2022-12-02
1 tháng 9 năm 1999,1999-09-01
3/5/03,2003-03-05
20 Fe 2033,2033-02-20
2/9/1990,1990-09-02
20/10-2022,2022-05-20
"December 9, 2005",2005-12-09
19Sep1994,1994-09-19
ngày 11 tháng 7 năm 2006,2006-07-11
28th of September 2002,2002-09-28
13 Ja 2022,2022-01-13
2029/1,2029-01-05
"Sep 25th, 2025",2025-09-25
6/21/02,2002-06-21
9-2,2009-02-09
4/7/1996,1996-04-07
"December 9, 2017",2017-12-09
13/10/12,2012-10-13
25 tháng 10 năm 2030,2030-10-25
24/9/1998,1998-09-24
1/33/2002,2002-11-01
18.5.2030,2030-05-18
26 tháng 8 năm 2013,2013-08-26
7/11/1994,1994-07-11
11-24-11,2011-11-24
16 tháng 5 năm 2028,2028-05-16
"Aug 26th, 1991",1991-08-26
28/9-2027,2027-09-28
27.6.2002,2002-06-27
"Mar 4th, 2019",2019-03-04
Jun 3 35,2035-06-03
23Jun2031,2031-06-23
38-12-2011,2011-12-19
9/4-2035,2035-04-09
"June 1, 2024",2024-06-01
2031/7,2031-07-24
10 Ma 2009,2009-05-10
8Apr1996,1996-04-08
22/10/18,2018-10-22
4/20/2024,2024-04-20
12/11/1996,1996-11-12
22-4,2006-04-22
21 tháng 3 năm 2003,2003-03-21
2027/4,2027-04-25
21/5-2005,2005-05-21
9Jan2011,2011-01-09
19 Jun 1997,1997-06-19
Nov 4 98,1998-11-04
27Mar1997,1997-03-27
15/11/99,1999-11-15
9:10:2024,2024-10-09
23/3-2019,2019-03-23
2022/6/25,2022-06-25
2010/7/28,2010-07-28
"Jul 5th, 2010",2010-07-05
ngày 11 tháng 6 năm 2007,2007-06-11
13/8-2007,2007-08-13
17th of February 2025,2025-02-17
15/11/1992,1992-11-15
1994-7-15,1994-07-15
11/15/06,2006-11-15
16-5-1994,1994-05-16
21.9.1994,1994-09-21
10-4-2012,2012-04-10
1995/2/5,1995-02-05
1996/2,1996-02-09
1 Se 2009,2009-09-01
22/6/03,2003-06-22
4th of February 1996,1996-02-04
8-9-2032,2032-09-08
3-10-2024,2024-10-03
2001-12-8,2001-12-08
1994-1-28,1994-01-28
6 November 2025,2025-11-06
ngày 20 tháng 4 năm 2001,2001-04-20
24 Oc 2019,2019-10-24
22/10/16,2016-10-22
20/7-1993,1993-07-20
"Jun 12th, 1995",1995-06-12
24:9:1990,1990-09-24
44-6-2015,2015-06-22
2/18-2029,2029-09-02
"June 12, 1997",1997-06-12
19 Sep 2001,2001-09-19
10/9/1997,1997-03-10
28-11-1997,1997-11-28
"Sep 22th, 2021",2021-09-22
8 tháng 7 năm 2012,2012-07-08
10-9-24,2024-10-09
1999/9/28,1999-09-28
16/2-2015,2015-02-16
15-4-2024,2024-04-15
2030/9,2030-09-17
2012-12-22,2012-12-22
17/2/30,2030-02-17
15/30/2022,2022-10-15
16/10-2002,2002-10-16
Jan 21 03,2003-01-21
27 Oct 2026,2026-10-27
2/14/25,2025-02-14
19-7,2034-07-19
07032017,2017-03-07
11/10/2016,2016-10-11
2017/10,2017-10-22
18 Ap 1990,1990-04-18
12-21-33,2033-12-21
5.12.2021,2021-12-05
Apr 11 92,1992-04-11
28-4-2029,2029-04-28
2009/7/13,2009-07-13
28/30/2002,2002-10-28
2-6-28,2028-02-06
"Mar 2nd, 2003",2003-03-02
11/18/1997,1997-11-18
27 Au 1993,1993-08-27
20/10-2016,2016-10-20
3-16-26,2026-03-16
3.1.2017,2017-01-03
10/5-2023,2023-05-10
7/3/90,1990-07-03
17 June 1997,1997-06-17
19122027,2027-12-19
14.2.2027,2027-02-14
20/4-2031,2031-04-20
4/5-2011,2011-05-04
Jan 7 29,2029-01-07
11:3:1992,1992-03-11
27 tháng 10 năm 2027,2027-10-27
27 tháng 4 năm 2034,2034-04-27
2/6/09,2009-02-06
Feb 23 92,1992-02-23
"Jan 22th, 1992",1992-01-22
"January 12, 2034",2034-01-12
2022-6-15,2022-06-15
26-3,2016-03-26
1/11-2035,2035-11-01
1-12-09,2009-01-12
6Jul2005,2005-07-06
10-11-1994,1994-11-10
11th of June 1998,1998-06-11
22/20-1992,1992-10-22
16/27/2026,2026-09-16
15-5,1994-05-15
16 De 1991,1991-12-16
10:5:1994,1994-05-10
7/5/16,2016-05-07
21/5-2008,2008-05-21
1:10:2001,2001-10-01
2035/1,2035-01-23
19/10-2015,2015-10-19
"Dec 1st, 2004",2004-12-01
5.2.2015,2015-02-05
16 Jan 2024,2024-01-16
1st of June 2029,2029-06-01
6/20-2019,2019-10-06
2008/12,2008-12-28
"February 23, 2022",2022-02-23
3-25-29,2029-03-25
19 February 2003,2003-02-19
23:11:2000,2000-11-23
10th of October 2003,2003-10-10
6/14/01,2001-06-14
13th of February 2011,2011-02-13
6/6-2007,2007-06-06
7-7,2008-07-07
1:1:1996,1996-01-01
19/12-1995,1995-06-19
25/3/1995,1995-03-25
7 November 2024,2024-11-07
12/7-2007,2007-07-12
1-10,2021-10-01
7.5.2034,2034-05-07
16-8-1996,1996-08-08
22-8,2013-08-22
"Jan 12th, 2026",2026-01-12
9th of January 1991,1991-01-09
14 October 2035,2035-10-14
6 Apr 2027,2027-04-06
2017-2-22,2017-02-22
2034-8-24,2034-08-24
2013/9/26,2013-09-26
Oct 11 33,2033-10-11
25:2:2016,2016-02-25
8/12-2021,2021-06-08
7-1,1991-01-07
10/22-1992,1992-11-10
08072008,2008-07-08
40-12-2001,2001-12-20
6/17/16,2016-06-17
2014/7/25,2014-07-25
28:11:2031,2031-11-28
25-5,2005-05-25
21-9,2020-09-21
21.5.2009,2009-05-21
3rd of November 2014,2014-11-03
"Oct 1st, 1996",1996-10-01
9/8-1994,1994-08-09
2023-12-19,2023-12-19
28Dec2001,2001-12-28
25/12/02,2002-12-25
12032022,2022-03-12
2023-11-2,2023-11-02
3/4-2033,2033-02-03
26-8,1999-08-26
3Mar2024,2024-03-03
27032007,2007-03-27
24-2-2012,2012-02-12
5:8:2007,2007-08-05
8-9-15,2015-08-09
56-9-1992,1992-09-28
ngày 24 tháng 2 năm 2033,2033-02-24
10/33/2022,2022-11-10
Mar 26 11,2011-03-26
11.10.2027,2027-10-11
10/24/07,2007-10-24
ngày 28 tháng 5 năm 1995,1995-05-28
5/6/15,2015-05-06
2026/11,2026-11-27
15/7-1999,1999-07-15
22-9-2004,2004-09-11
4-27-97,1997-04-27
"Nov 27th, 2001",2001-11-27
10-27-09,2009-10-27
"Aug 27th, 1994",1994-08-27
18:3:2011,2011-03-18
7.4.2012,2012-04-07
"September 5, 2006",2006-09-05
3/25/20,2020-03-25
11-11-24,2024-11-11
18Oct2000,2000-10-18
May 26 27,2027-05-26
15 tháng 3 năm 2016,2016-03-15
ngày 23 tháng 11 năm 2031,2031-11-23
14 November 2000,2000-11-14
12/15/2021,2021-05-12
Aug 25 02,2002-08-25
Sep 12 20,2020-09-12
2017-11-3,2017-11-03
20/33/2031,2031-11-20
7-9-2006,2006-09-07
18Nov2013,2013-11-18
9Nov2015,2015-11-09
7-10,2026-10-07
28-3,2021-03-28
Dec 3 35,2035-12-03
2021-10-7,2021-10-07
24/4/13,2013-04-24
2027/3,2027-03-22
3/7/1998,1998-03-07
26/6-1995,1995-06-26
13-1,1990-01-13
15 Ju 1995,1995-07-15
ngày 7 tháng 5 năm 2032,2032-05-07
11-1-1995,1995-01-11
26/8/03,2003-08-26
5th of March 1990,1990-03-05
27/7/2029,2029-07-27
7/10/1995,1995-07-10
"September 2, 2013",2013-09-02
3 tháng 4 năm 2033,2033-04-03
20 Aug 2016,2016-08-20
2/3/2002,2002-03-02
"May 24th, 1994",1994-05-24
7 Sep 2015,2015-09-07
9-25-11,2011-09-25
20 Ju 2015,2015-07-20
12-22-33,2033-12-22
May 27 04,2004-05-27
6/12/12,2012-12-06
17/3-2031,2031-03-17
"Sep 2nd, 2030",2030-09-02
2027-11-17,2027-11-17
19 Jul 2018,2018-07-19
16Feb2023,2023-02-16
2014/9/16,2014-09-16
22 Oc 2001,2001-10-22
13-7-2005,2005-07-13
22-12-2011,2011-12-22
23.4.2006,2006-04-23
22061998,1998-06-22
ngày 7 tháng 2 năm 2013,2013-02-07
1997/7,1997-07-21
12/11-2027,2027-11-12
20-8,1992-08-20
6/15/11,2011-06-15
3 Oc 2035,2035-10-03
5th of April 2003,2003-04-05
11-2,2032-02-11
ngày 5 tháng 11 năm 2010,2010-11-05
"Feb 12th, 2033",2033-02-12
26-10,2002-10-26
12/4/2032,2032-04-12
9/11/2019,2019-11-09
8/1/14,2014-08-01
7/18/2008,2008-07-18
ngày 10 tháng 11 năm 2031,2031-11-10
13 tháng 2 năm 2024,2024-02-13
4/33/2021,2021-11-04
16/11/90,1990-11-16
20 Ju 2021,2021-07-20
"November 23, 1999",1999-11-23
2032/6,2032-06-12
9/5/2032,2032-05-09
1/4/2016,2016-01-04
18 tháng 7 năm 1996,1996-07-18
22/9/17,2017-09-22
Sep 24 34,2034-09-24
"April 5, 2015",2015-04-05
11-25-15,2015-11-25
7/12-2027,2027-06-07
19Apr2005,2005-04-19
8/10-1995,1995-10-08
1997-2-22,1997-02-22
19/8/07,2007-08-19
11th of October 2003,2003-10-11
6 tháng 2 năm 1996,1996-02-06
3/14/2029,2029-03-14
01102001,2001-10-01
10th of November 1990,1990-11-10
5/24/07,2007-05-24
27/11/32,2032-11-27
10/36/2023,2023-12-10
7/9/1993,1993-03-07
17/6/93,1993-06-17
"December 11, 2030",2030-12-11
2017/3/28,2017-03-28
3/11/2021,2021-11-03
28th of September 2022,2022-09-28
16 De 2004,2004-12-16
8-8-11,2011-08-08
16/8-1995,1995-08-16
6/3/16,2016-03-06
1/15/2014,2014-05-01
2003-10-27,2003-10-27
21:6:2034,2034-06-21
22 January 2008,2008-01-22
Jun 6 16,2016-06-06
2004/1,2004-01-17
6-9-29,2029-06-09
15/14-2027,2027-07-15
2 June 2024,2024-06-02
19 Se 2016,2016-09-19
27/8/2016,2016-08-27
2002-2-9,2002-02-09
25092028,2028-09-25
20Dec2006,2006-12-20
6/23/1991,1991-06-23
9-26-94,1994-09-26
20 Oc 2001,2001-10-20
ngày 12 tháng 10 năm 2030,2030-10-12
30-11-2033,2033-11-15
9/4/26,2026-09-04
1-6-2033,2033-06-01
13.10.2004,2004-10-13
11-19-06,2006-11-19
1993/2/9,1993-02-09
"Oct 18th, 2017",2017-10-18
7/15/2027,2027-07-15
ngày 5 tháng 7 năm 1996,1996-07-05
11/5-2007,2007-05-11
42-8-1999,1999-08-21
2021/8,2021-08-28
18 Fe 1997,1997-02-18
"September 28, 1996",1996-09-28
25 Apr 2026,2026-04-25
8/2-2028,2028-02-08
27.6.1991,1991-06-27
12Dec2022,2022-12-12
12-9,2014-09-12
2026/12,2026-12-28
21 Se 2008,2008-09-21
5/1/2018,2018-01-05
19 Jan 2030,2030-01-19
"June 27, 2014",2014-06-27
9/9/14,2014-09-09
28 Sep 2015,2015-09-28
1994/9/1,1994-09-01
12-19-21,2021-12-19
03112019,2019-11-03
9-3-2017,2017-03-09
2017/1,2017-01-28
2028/10,2028-10-14
18th of June 1990,1990-06-18
23/7/2027,2027-07-23
26/6/01,2001-06-26
"Jun 28th, 2010",2010-06-28
40-8-1998,1998-08-20
ngày 14 tháng 4 năm 1997,1997-04-14
9-3-12,2012-09-03
13 tháng 9 năm 2027,2027-09-13
ngày 10 tháng 4 năm 1994,1994-04-10
2017/11,2017-11-08
26/5-2021,2021-05-26
3-19-18,2018-03-19
12/11/1995,1995-11-12
ngày 23 tháng 3 năm 2014,2014-03-23
4 September 1991,1991-09-04
11/12-2020,2020-06-11
2-6-19,2019-02-06
6-2-2025,2025-02-03
15/2/1999,1999-02-15
14/12-2004,2004-12-14
24 De 2011,2011-12-24
ngày 4 tháng 8 năm 2025,2025-08-04
2002/9/23,2002-09-23
1/6/10,2010-01-06
11 tháng 8 năm 1992,1992-08-11
Aug 14 18,2018-08-14
40-2-2009,2009-02-20
5-2,2034-02-05
1/1-2033,2033-01-01
Apr 7 34,2034-04-07
26/6/2016,2016-02-26
13-3,2033-03-13
42-4-2035,2035-04-21
ngày 27 tháng 9 năm 2035,2035-09-27
22/4/2001,2001-04-22
11/3-2026,2026-03-11
2006/11,2006-11-03
ngày 4 tháng 12 năm 2006,2006-12-04
15 Se 1998,1998-09-15
4 July 1995,1995-07-04
13/22-2032,2032-11-13
2/18-1998,1998-09-02
11th of April 2023,2023-04-11
06082025,2025-08-06
1992/12,1992-12-22
16 Aug 2019,2019-08-16
11/11/18,2018-11-11
9 tháng 7 năm 2023,2023-07-09
21 tháng 1 năm 2013,2013-01-21
27 Nov 2022,2022-11-27
21/2/91,1991-02-21
4:4:2029,2029-04-04
7 tháng 1 năm 2031,2031-01-07
5/26/99,1999-05-26
2032/7,2032-07-02
9/26/93,1993-09-26
3Dec2013,2013-12-03
8-1-2031,2031-01-08
1/26/1990,1990-01-26
ngày 2 tháng 6 năm 2004,2004-06-02
16 April 2022,2022-04-16
"April 8, 1995",1995-04-08
7/3/2026,2026-03-07
2022-6-10,2022-06-10
1/1-2033,2033-01-01
2016/9/3,2016-09-03
17:1:2007,2007-01-17
2024/1,2024-01-02
28/4-2001,2001-04-28
9 tháng 10 năm 2012,2012-10-09
10122025,2025-12-10
Oct 3 35,2035-10-03
2004-6-23,2004-06-23
24 tháng 3 năm 2022,2022-03-24
5/3/96,1996-03-05
4/30/2006,2006-10-04
19 tháng 7 năm 2008,2008-07-19
5-10-10,2010-05-10
7 tháng 8 năm 2011,2011-08-07
18.9.2025,2025-09-18
10/4/2035,2035-10-04
12/15/2028,2028-05-12
25 De 2010,2010-12-25
2023/12/23,2023-12-23
2014/2/25,2014-02-25
22-9,2008-09-22
11/18/1999,1999-11-18
11112022,2022-11-11
9 tháng 3 năm 2000,2000-03-09
18/6/2035,2035-06-18
"July 18, 2009",2009-07-18
28/9-2035,2035-09-28
13:3:2022,2022-03-13
17th of May 1997,1997-05-17
18/2/94,1994-02-18
1/22-2006,2006-11-01
22/5-1997,1997-05-22
4 Ja 2014,2014-01-04
Jul 24 92,1992-07-24
27 tháng 4 năm 1995,1995-04-27
12-3-2011,2011-03-06
25 Mar 2017,2017-03-25
6-7,1999-07-06
"April 26, 2010",2010-04-26
28 August 2033,2033-08-28
6:4:2027,2027-04-06
11th of April 2027,2027-04-11
2019/12/20,2019-12-20
24062022,2022-06-24
20.11.2000,2000-11-20
ngày 4 tháng 8 năm 2018,2018-08-04
07012003,2003-01-07
4 Oc 2018,2018-10-04
6 tháng 8 năm 2003,2003-08-06
5-7,1991-07-05
1997/12,1997-12-26
5-18-28,2028-05-18
13/12/1997,1997-04-13
1/9/05,2005-09-01
8/2/12,2012-02-08
2021-1-13,2021-01-13
2009/8,2009-08-05
6/28/26,2026-06-28
2.7.2015,2015-07-02
4/9-1991,1991-09-04
1990-6-24,1990-06-24
11/2/11,2011-02-11
12-25-07,2007-12-25
11th of February 1993,1993-02-11
13/6-1992,1992-06-13
7 Ma 2000,2000-03-07
"June 17, 2007",2007-06-17
10th of February 1993,1993-02-10
5 February 2001,2001-02-05
4/4/96,1996-04-04
1 Aug 1993,1993-08-01
2008/5/16,2008-05-16
17 March 2032,2032-03-17
18092002,2002-09-18
12/25/1992,1992-12-25
21-1-2013,2013-01-21
ngày 28 tháng 12 năm 2012,2012-12-28
"Sep 20th, 2022",2022-09-20
ngày 19 tháng 1 năm 2023,2023-01-19
10/25/1994,1994-10-25
27 Jul 2027,2027-07-27
20/11-1990,1990-11-20
8/15/27,2027-08-15
ngày 19 tháng 4 năm 1995,1995-04-19
10/7/1994,1994-07-10
3-22-21,2021-03-22
22-4,1990-04-22
2031/10,2031-10-17
2004-8-7,2004-08-07
08091997,1997-09-08
2017/6,2017-06-13
17th of September 2020,2020-09-17
21 February 2021,2021-02-21
4-3-2003,2003-03-02
7 Jun 1991,1991-06-07
10-3-2026,2026-03-05
19 February 2025,2025-02-19
6/6/30,2030-06-06
26 July 2023,2023-07-26
2028/5,2028-05-18
ngày 1 tháng 2 năm 2032,2032-02-01
7 Ap 2031,2031-04-07
15/33/2006,2006-11-15
27Feb2016,2016-02-27
4/4/00,2000-04-04
18/3/09,2009-03-18
5/6/2016,2016-02-05
2006/8,2006-08-19
ngày 21 tháng 7 năm 1999,1999-07-21
"September 17, 2032",2032-09-17
8th of March 2033,2033-03-08
8-12-27,2027-08-12
17:2:2035,2035-02-17
13 December 2015,2015-12-13
1st of August 2019,2019-08-01
Aug 28 26,2026-08-28
16-7-2032,2032-07-08
26 Oc 2032,2032-10-26
1/9/92,1992-01-09
14-9-1994,1994-09-07
5-5-01,2001-05-05
2/8/15,2015-08-02
1999/1/16,1999-01-16
"December 19, 2008",2008-12-19
5-11,2018-11-05
20/8/94,1994-08-20
2028/4/15,2028-04-15
16 April 2031,2031-04-16
7/5/23,2023-05-07
1/24/2031,2031-01-24
1Mar2000,2000-03-01
"August 28, 2022",2022-08-28
3/10/02,2002-10-03
2005/3/24,2005-03-24
"Nov 19th, 2034",2034-11-19
10-27-06,2006-10-27
1/8/2028,2028-01-08
11 Oc 2006,2006-10-11
27/14-2005,2005-07-27
10/7-2032,2032-07-10
May 4 19,2019-05-04
1992-5-23,1992-05-23
"March 2, 1993",1993-03-02
8/10/23,2023-10-08
7:6:2022,2022-06-07
2 Se 2006,2006-09-02
4/1/2027,2027-04-01
"December 19, 2027",2027-12-19
2007/6/10,2007-06-10
5/3/2018,2018-03-05
1/10/95,1995-01-10
24/2/98,1998-02-24
2/21/93,1993-02-21
17 Se 2012,2012-09-17
9/16/01,2001-09-16
"June 22, 2007",2007-06-22
5/12-2022,2022-06-05
2001-2-2,2001-02-02
13 tháng 7 năm 2021,2021-07-13
3/23/94,1994-03-23
12th of October 2034,2034-10-12
1993/3,1993-03-23
1-16-99,1999-01-16
2-9-2011,2011-09-02
"December 24, 2031",2031-12-24
13062013,2013-06-13
9-3,2000-03-09
24 October 2014,2014-10-24
1/15/2004,2004-01-15
10-17-91,1991-10-17
2034-7-8,2034-07-08
13/12-1999,1999-12-13
3/13/96,1996-03-13
27/6-2028,2028-03-27
2019-9-23,2019-09-23
13/12/2034,2034-12-13
6 Dec 1990,1990-12-06
4th of June 2004,2004-06-04
6 November 2009,2009-11-06
7/1-2022,2022-01-07
15th of June 2006,2006-06-15
Mar 6 20,2020-03-06
2022/3,2022-03-06
2-6-1991,1991-06-02
ngày 12 tháng 4 năm 2032,2032-04-12
5/3/1990,1990-01-05
1993/11/12,1993-11-12
Jan 15 06,2006-01-15
1 tháng 7 năm 2035,2035-07-01
25/11-2000,2000-11-25
7:9:2020,2020-09-07
2-8,2007-08-02
6/3/19,2019-03-06
5/2/2025,2025-05-02
30-10-2027,2027-10-15
5-5-07,2007-05-05
10-15-21,2021-10-15
4/5/2007,2007-04-05
26/5-1991,1991-05-26
9/22/2016,2016-09-22
3/19/30,2030-03-19
22/10/17,2017-10-22
19th of February 2015,2015-02-19
9.3.1993,1993-03-09
7 Au 2030,2030-08-07
21 No 1997,1997-11-21
11 November 2020,2020-11-11
3/28/13,2013-03-28
2015/10,2015-10-20
3 Au 2005,2005-08-03
10/6-2018,2018-06-10
21/27/2020,2020-09-21
ngày 24 tháng 2 năm 2020,2020-02-24
"Jan 18th, 2004",2004-01-18
18-7,2028-07-18
12/5/1990,1990-05-12
28 Dec 2016,2016-12-28
21/2-2002,2002-02-21
22-3,2014-03-22
7Jun2002,2002-06-07
2031-11-14,2031-11-14
"Jul 6th, 2029",2029-07-06
20.5.2023,2023-05-20
12-12,2030-12-12
24/12-1998,1998-12-24
"Jul 26th, 2013",2013-07-26
11Mar2009,2009-03-11
"Nov 16th, 2020",2020-11-16
19 August 1993,1993-08-19
21Jun2026,2026-06-21
2-2,2026-02-02
23 April 2021,2021-04-23
Jan 27 11,2011-01-27
4/16-2014,2014-08-04
5 tháng 10 năm 2015,2015-10-05
5/5-2011,2011-05-05
9-8-95,1995-09-08
2020/9,2020-09-07
19/1-2033,2033-01-19
2002/2/10,2002-02-10
19Oct2006,2006-10-19
2015/7,2015-07-02
48-2-2012,2012-02-24
8-20-17,2017-08-20
36-12-1998,1998-12-18
18/24/1994,1994-08-18
19-4-2022,2022-04-19
7/1/2003,2003-01-07
7-21-10,2010-07-21
"February 22, 2006",2006-02-22
14 November 1997,1997-11-14
23 Ju 2011,2011-06-23
1-10,1993-10-01
25.4.2007,2007-04-25
11/9/30,2030-11-09
10/4-2023,2023-04-10
2013/10/3,2013-10-03
27 Se 2032,2032-09-27
3/18/1992,1992-06-03
20/8/94,1994-08-20
9/3/00,2000-09-03
12:12:2001,2001-12-12
2025-10-2,2025-10-02
15Dec2018,2018-12-15
23.2.2012,2012-02-23
6:10:2005,2005-10-06
15 October 2028,2028-10-15
13-9-2009,2009-09-13
9/5-2015,2015-05-09
18/6-2009,2009-06-18
21.4.2022,2022-04-21
2029-3-5,2029-03-05
27/7-2015,2015-07-27
24/9/14,2014-09-24
3 October 2017,2017-10-03
12/10/2007,2007-10-12
2016/4,2016-04-23
25/6-1993,1993-03-25
"Nov 21th, 2016",2016-11-21
9th of August 1992,1992-08-09
12-27-30,2030-12-27
22.10.2017,2017-10-22
"Jun 22th, 2014",2014-06-22
9/12-2027,2027-12-09
9/11-1995,1995-11-09
7-11-2009,2009-11-07
2034-5-9,2034-05-09
27-10-2012,2012-10-27
2005/8,2005-08-07
13 Oc 2010,2010-10-13
6Jul2011,2011-07-06
2027-11-7,2027-11-07
11th of August 2002,2002-08-11
20 Oct 2018,2018-10-20
2 Sep 2023,2023-09-02
28/7/20,2020-07-28
2006-3-2,2006-03-02
6th of November 2032,2032-11-06
24/8/14,2014-08-24
4/19/2027,2027-04-19
24/5/2030,2030-05-24
18/3/1993,1993-01-18
9/8/2008,2008-09-08
26th of October 2026,2026-10-26
2035/7/11,2035-07-11
01112014,2014-11-01
2008/3/27,2008-03-27
19/1/2015,2015-01-19
6/24/2004,2004-08-06
22/2-2029,2029-02-22
9th of November 2016,2016-11-09
6/4/22,2022-04-06
2007-1-11,2007-01-11
Feb 12 30,2030-02-12
11/8/08,2008-08-11
27 tháng 2 năm 2031,2031-02-27
11/6-1997,1997-06-11
2021/9,2021-09-21
ngày 20 tháng 5 năm 2009,2009-05-20
20Jun1994,1994-06-20
7/2/22,2022-07-02
4/7/2012,2012-07-04
23/7-2032,2032-07-23
20:3:2028,2028-03-20
"April 4, 2024",2024-04-04
7 No 2017,2017-11-07
"Apr 8th, 2031",2031-04-08
12 Sep 2024,2024-09-12
2008/8/3,2008-08-03
"January 7, 2008",2008-01-07
14-11-1996,1996-11-07
ngày 20 tháng 1 năm 2030,2030-01-20
34-2-2001,2001-02-17
1/14/20,2020-01-14
14/7/16,2016-07-14
21/11/92,1992-11-21
6/6/2011,2011-06-06
ngày 2 tháng 4 năm 2023,2023-04-02
5/10/04,2004-10-05
3 Aug 2011,2011-08-03
14031994,1994-03-14
20/3-1996,1996-03-20
Feb 4 02,2002-02-04
7/7/13,2013-07-07
4 Ma 2022,2022-05-04
15/8/94,1994-08-15
28Apr2012,2012-04-28
2029/4/28,2029-04-28
Mar 13 02,2002-03-13
25 Ma 1995,1995-03-25
6/19/2025,2025-06-19
5/21/1993,1993-07-05
19-1,1990-01-19
07091991,1991-09-07
2006/5/4,2006-05-04
20.12.2025,2025-12-20
ngày 25 tháng 9 năm 2035,2035-09-25
26 Apr 1998,1998-04-26
"January 14, 2010",2010-01-14
6 April 2001,2001-04-06
11:10:2020,2020-10-11
2012-11-16,2012-11-16
2-12-1995,1995-12-02
27/2/13,2013-02-27
13 tháng 4 năm 2013,2013-04-13
18Jan2003,2003-01-18
22 Dec 1993,1993-12-22
21 December 2029,2029-12-21
"Aug 18th, 2030",2030-08-18
1995/3/1,1995-03-01
7/7-1999,1999-07-07
7 tháng 6 năm 2023,2023-06-07
14.8.1991,1991-08-14
2013/9,2013-09-17
ngày 22 tháng 11 năm 2000,2000-11-22
22Nov1994,1994-11-22
ngày 23 tháng 4 năm 2011,2011-04-23
8/13/2027,2027-08-13
15:4:2026,2026-04-15
4/12-2035,2035-12-04
20062032,2032-06-20
12:8:2020,2020-08-12
25/30/1991,1991-10-25
1992/4/19,1992-04-19
24th of November 2013,2013-11-24
8/14/2013,2013-08-14
6/4/2026,2026-06-04
20-6-2003,2003-06-20
3/30/2016,2016-10-03
17/3-2018,2018-03-17
5/12-2007,2007-12-05
19.9.2035,2035-09-19
23/20-2006,2006-10-23
10/10/2028,2028-10-10
24.6.2011,2011-06-24
"April 25, 2031",2031-04-25
14/8-1993,1993-04-14
28/1-2019,2019-01-28
09112019,2019-11-09
1997-2-15,1997-02-15
1995/12/28,1995-12-28
2025-6-27,2025-06-27
Jul 10 17,2017-07-10
10-1-2002,2002-01-10
2.5.2016,2016-05-02
8-3-1993,1993-03-04
3.8.2035,2035-08-03
48-1-2009,2009-01-24
1997/2/21,1997-02-21
22 April 1995,1995-04-22
8/20/29,2029-08-20
12 January 2018,2018-01-12
14th of September 2033,2033-09-14
12-11-30,2030-12-11
22-9-2005,2005-09-11
9/9/1999,1999-09-09
2015-8-11,2015-08-11
11:12:2029,2029-12-11
ngày 6 tháng 9 năm 2006,2006-09-06
11/24/1991,1991-11-24
21 Fe 2001,2001-02-21
4/11/2023,2023-04-11
2031/12,2031-12-16
10-9,2000-09-10
26/2/94,1994-02-26
Sep 27 21,2021-09-27
4/7-2029,2029-07-04
16 November 2012,2012-11-16
17th of December 2005,2005-12-17
"Apr 25th, 2032",2032-04-25
18 tháng 3 năm 1992,1992-03-18
16th of June 2021,2021-06-16
Oct 14 34,2034-10-14
21/5/22,2022-05-21
21/2-2026,2026-02-21
"February 25, 1997",1997-02-25
14/7/03,2003-07-14
13 Ja 2005,2005-01-13
28/9/2014,2014-03-28
12-12-2015,2015-12-12
2/4-2013,2013-04-02
14:4:2026,2026-04-14
"Sep 22th, 2022",2022-09-22
21/36/2000,2000-12-21
10/10-2034,2034-10-10
32-9-2031,2031-09-16
ngày 24 tháng 10 năm 2006,2006-10-24
26 Ju 2028,2028-06-26
13061993,1993-06-13
28 Fe 2018,2018-02-28
8/7/2033,2033-08-07
ngày 16 tháng 10 năm 2022,2022-10-16
5-16-28,2028-05-16
22 August 1991,1991-08-22
25 De 2008,2008-12-25
10/9/16,2016-09-10
23 July 1991,1991-07-23
21 Mar 2021,2021-03-21
21 Jun 2020,2020-06-21
2030-8-9,2030-08-09
18/10/13,2013-10-18
1:10:2014,2014-10-01
12-24-34,2034-12-24
2032-5-23,2032-05-23
10/24/2013,2013-10-24
3.3.2014,2014-03-03
9-9-1990,1990-09-09
3/3/1993,1993-03-03
8/1/2035,2035-08-01
17/12/2027,2027-12-17
6-9-2027,2027-09-03
4/9-2007,2007-09-04
"Aug 8th, 2001",2001-08-08
14-4-1993,1993-04-14
25/3/2021,2021-03-25
27-8,2011-08-27
19/9-2009,2009-09-19
19/20-2015,2015-10-19
28/4-1995,1995-04-28
4/12/2033,2033-12-04
4-1-2019,2019-01-04
10/7-1996,1996-07-10
2022-12-12,2022-12-12
3/11/2016,2016-11-03
7/9/28,2028-09-07
Mar 20 24,2024-03-20
Jan 10 92,1992-01-10
2034/9/18,2034-09-18
8 tháng 11 năm 2022,2022-11-08
19/12-2000,2000-12-19
19/6/2020,2020-02-19
2015-3-16,2015-03-16
26:8:2023,2023-08-26
9:8:2014,2014-08-09
ngày 19 tháng 2 năm 2032,2032-02-19
1995/2,1995-02-08
5/14/2013,2013-05-14
14 Ju 2029,2029-07-14
13/2-2025,2025-02-13
2Aug2022,2022-08-02
8:4:1997,1997-04-08
"Jul 19th, 2017",2017-07-19
13:9:1994,1994-09-13
13/7-2014,2014-07-13
8/2-2029,2029-02-08
16 tháng 7 năm 2022,2022-07-16
7th of November 2004,2004-11-07
4/8/05,2005-08-04
7 tháng 6 năm 2033,2033-06-07
11/4/30,2030-04-11
17/14-2022,2022-07-17
8-1,2033-01-08
23 Jan 1991,1991-01-23
24.1.2034,2034-01-24
2/17/05,2005-02-17
4:10:2035,2035-10-04
16/10/1995,1995-10-16
"Nov 6th, 2027",2027-11-06
18/3-2011,2011-03-18
1 tháng 7 năm 2014,2014-07-01
12/2/99,1999-02-12
3/20/2005,2005-03-20
"Aug 13th, 2002",2002-08-13
ngày 15 tháng 3 năm 2017,2017-03-15
7/8/2035,2035-07-08
3/14-2030,2030-07-03
16Nov2017,2017-11-16
28022006,2006-02-28
1998/6,1998-06-05
1997/7,1997-07-16
"May 9, 2015",2015-05-09
28/12-1998,1998-12-28
11/25/94,1994-11-25
28:4:2033,2033-04-28
23051995,1995-05-23
5 September 2016,2016-09-05
7/3/2007,2007-03-07
"Apr 1st, 2015",2015-04-01
25/1-2030,2030-01-25
14/12-2003,2003-12-14
20-9,2004-09-20
2030-9-18,2030-09-18
16/27/2034,2034-09-16
18 tháng 10 năm 2012,2012-10-18
20 January 2019,2019-01-20
28 April 1992,1992-04-28
13:5:2026,2026-05-13
2033/10,2033-10-03
28-11-2007,2007-11-14
2035/9,2035-09-26
2003-12-1,2003-12-01
6 February 2016,2016-02-06
02021998,1998-02-02
2029/9/16,2029-09-16
8 October 1997,1997-10-08
13 February 2023,2023-02-13
"November 21, 1993",1993-11-21
2033-2-25,2033-02-25
22th of June 2031,2031-06-22
9 December 2016,2016-12-09
28Dec2012,2012-12-28
19th of July 1996,1996-07-19
3Nov2035,2035-11-03
18/2/29,2029-02-18
21th of October 2009,2009-10-21
17 June 1991,1991-06-17
4/4/2018,2018-04-04
27:12:2028,2028-12-27
9/6/92,1992-06-09
ngày 14 tháng 5 năm 1997,1997-05-14
"Feb 16th, 2035",2035-02-16
9/22/94,1994-09-22
9/14-1996,1996-07-09
22112006,2006-11-22
3 Nov 2032,2032-11-03
"June 10, 2032",2032-06-10
24 Ma 2024,2024-05-24
2027/2,2027-02-19
ngày 25 tháng 1 năm 2020,2020-01-25
25 Feb 2022,2022-02-25
17 Ma 2026,2026-05-17
8/4/11,2011-08-04
1 Mar 2016,2016-03-01
11/16-2026,2026-08-11
27 No 2019,2019-11-27
3-12-08,2008-03-12
10/7/2018,2018-07-10
25 Se 1991,1991-09-25
2023-4-6,2023-04-06
26-4-2007,2007-04-26
22 Ma 2015,2015-05-22
17-4,2021-04-17
2008-1-26,2008-01-26
4 Sep 2025,2025-09-04
2023/12/5,2023-12-05
10-1-2030,2030-01-10
"Jun 1st, 2017",2017-06-01
2/12/27,2027-12-02
12/6/2003,2003-06-12
"Feb 11th, 2025",2025-02-11
17-6-1990,1990-06-17
27/27/2007,2007-09-27
17/10-2024,2024-10-17
19 Oc 2024,2024-10-19
9/6/03,2003-06-09
22-1-2020,2020-01-22
21.9.2013,2013-09-21
2004-12-4,2004-12-04
"Sep 28th, 2013",2013-09-28
"Jun 22th, 2016",2016-06-22
1998-10-28,1998-10-28
25/24/2018,2018-08-25
12/12-2029,2029-12-12
25/1/2004,2004-01-25
6 February 1995,1995-02-06
9/19/25,2025-09-19
18/12/97,1997-12-18
17 Ja 2021,2021-01-17
"Jan 10th, 2002",2002-01-10
28 Sep 1995,1995-09-28
11/9/13,2013-09-11
"Sep 23th, 2027",2027-09-23
7Jan1992,1992-01-07
7/6/2028,2028-02-07
8-8-90,1990-08-08
12/24/2025,2025-12-24
"April 10, 2021",2021-04-10
20 November 1998,1998-11-20
24May2000,2000-05-24
5Jul1991,1991-07-05
23-7,2013-07-23
12th of January 2033,2033-01-12
3/17/2007,2007-03-17
18 August 2033,2033-08-18
10-3,2003-03-10
28Nov1990,1990-11-28
26/5/23,2023-05-26
7/2/2033,2033-07-02
"Aug 4th, 2002",2002-08-04
5/3/30,2030-03-05
26 Oct 2015,2015-10-26
26/6/2025,2025-02-26
11/16/1991,1991-11-16
2029/9,2029-09-17
2Aug2011,2011-08-02
26/2-2011,2011-01-26
23 tháng 6 năm 2002,2002-06-23
7.1.2032,2032-01-07
27 Dec 1998,1998-12-27
10-10-2028,2028-10-10
20:1:1996,1996-01-20
"Oct 6th, 1990",1990-10-06
ngày 19 tháng 6 năm 2020,2020-06-19
08082002,2002-08-08
25 tháng 11 năm 1990,1990-11-25
17.12.1995,1995-12-17
17/8-1991,1991-08-17
1/22-1992,1992-11-01
"December 27, 2003",2003-12-27
24.10.2014,2014-10-24
5 December 1993,1993-12-05
15Oct1992,1992-10-15
11/6-2020,2020-06-11
6:11:2007,2007-11-06
8/4/20,2020-04-08
19/2-1994,1994-02-19
Jan 25 26,2026-01-25
8Oct2027,2027-10-08
10072023,2023-07-10
12/8/2020,2020-08-12
5-8,2025-08-05
9-26-30,2030-09-26
ngày 12 tháng 5 năm 1991,1991-05-12
16/11/05,2005-11-16
19/20-2023,2023-10-19
11 Jul 2022,2022-07-11
22/10/30,2030-10-22
6-4-91,1991-06-04
"October 2, 1996",1996-10-02
2006/6/20,2006-06-20
7:12:2024,2024-12-07
2012-3-1,2012-03-01
"Mar 26th, 1995",1995-03-26
ngày 10 tháng 7 năm 2024,2024-07-10
28.5.2014,2014-05-28
"January 4, 2010",2010-01-04
14/6/94,1994-06-14
"Aug 4th, 2012",2012-08-04
22Apr2034,2034-04-22
21 tháng 8 năm 2007,2007-08-21
8/5/09,2009-08-05
2027/5,2027-05-14
13-2,2012-02-13
21-1,2008-01-21
18 May 2028,2028-05-18
18th of August 2001,2001-08-18
22/12/1999,1999-04-22
10/3-1991,1991-03-10
1992-5-21,1992-05-21
Jul 26 03,2003-07-26
"June 13, 2004",2004-06-13
2Feb1993,1993-02-02
28/27/2019,2019-09-28
11/20/17,2017-11-20
10-1-28,2028-10-01
52-4-2028,2028-04-26
01112012,2012-11-01
21/8-2002,2002-04-21
1995-6-13,1995-06-13
18th of July 1992,1992-07-18
Mar 20 35,2035-03-20
2023/6/26,2023-06-26
2027-4-18,2027-04-18
28Jun2026,2026-06-28
24 tháng 5 năm 1997,1997-05-24
26 August 1999,1999-08-26
8-6-2017,2017-06-08
4/11/31,2031-04-11
25.10.2003,2003-10-25
15042016,2016-04-15
26-7-1994,1994-07-13
2027-1-20,2027-01-20
23th of August 2014,2014-08-23
10-7-2022,2022-07-05
May 16 09,2009-05-16
2/18/2034,2034-02-18
2-25-02,2002-02-25
ngày 25 tháng 7 năm 2012,2012-07-25
"Nov 12th, 2000",2000-11-12
Oct 3 90,1990-10-03
25/33/2000,2000-11-25
24-8-2014,2014-08-12
Aug 27 94,1994-08-27
8-2-1996,1996-02-08
ngày 21 tháng 9 năm 1990,1990-09-21
10/9/07,2007-09-10
19:5:2015,2015-05-19
"May 12th, 2035",2035-05-12
12/7-2029,2029-07-12
22/4-1996,1996-04-22
6 Au 1999,1999-08-06
8 Jul 2006,2006-07-08
15 July 2031,2031-07-15
2025/9,2025-09-26
6/24/2032,2032-06-24
10/2-2004,2004-02-10
8 Ma 2016,2016-05-08
14 July 2024,2024-07-14
2031/10/9,2031-10-09
2012-2-2,2012-02-02
15.6.2000,2000-06-15
2 tháng 8 năm 2027,2027-08-02
Dec 27 24,2024-12-27
1/10/98,1998-10-01
2024-8-1,2024-08-01
18-10-2030,2030-10-09
7/19/00,2000-07-19
27.5.1991,1991-05-27
26 April 2012,2012-04-26
15.11.2014,2014-11-15
7 Aug 2001,2001-08-07
17 Oct 2020,2020-10-17
15 October 1999,1999-10-15
12/15/18,2018-12-15
6/1/2020,2020-01-06
2028/10,2028-10-21
3 Jul 2001,2001-07-03
2033/6/20,2033-06-20
"Sep 17th, 2021",2021-09-17
19-2-2017,2017-02-19
20Jan2031,2031-01-20
21-7-2026,2026-07-21
4/5/2029,2029-04-05
1/6-2033,2033-03-01
23:6:2004,2004-06-23
21 Nov 2011,2011-11-21
21 Oc 1995,1995-10-21
2009/6/7,2009-06-07
"Sep 24th, 2002",2002-09-24
5-25-18,2018-05-25
1990-1-16,1990-01-16
1-8-2015,2015-08-01
ngày 27 tháng 8 năm 2022,2022-08-27
22/11/16,2016-11-22
2 February 2014,2014-02-02
22Dec2003,2003-12-22
28th of July 2016,2016-07-28
12/11/08,2008-11-12
14.6.2027,2027-06-14
20-6-1998,1998-06-10
3-8,2026-08-03
24/6-1999,1999-06-24
28/3-2017,2017-03-28
17 Dec 2031,2031-12-17
5th of March 2034,2034-03-05
28-8-2025,2025-08-14
6-17-96,1996-06-17
"Apr 4th, 2019",2019-04-04
2016-12-13,2016-12-13
ngày 15 tháng 9 năm 2028,2028-09-15
1999/7/3,1999-07-03
3/3/18,2018-03-03
20-11,1999-11-20
2004-12-11,2004-12-11
21/27/2005,2005-09-21
11/13/1991,1991-11-13
1994/11/27,1994-11-27
9/11-1995,1995-11-09
7/2-2023,2023-01-07
11-4,1992-04-11
5 May 2014,2014-05-05
9/6/2003,2003-09-06
ngày 4 tháng 7 năm 2004,2004-07-04
25May2020,2020-05-25
3rd of November 2000,2000-11-03
13/9-2033,2033-09-13
4:8:2006,2006-08-04
15th of August 1997,1997-08-15
11/2/2000,2000-02-11
10/11/1990,1990-10-11
11-15-10,2010-11-15
15-8-2015,2015-08-15
"September 2, 2009",2009-09-02
11:4:2023,2023-04-11
8:12:2030,2030-12-08
14042015,2015-04-14
26022023,2023-02-26
5.4.2027,2027-04-05
3/4/2011,2011-03-04
"May 6th, 2013",2013-05-06
"February 21, 2032",2032-02-21
ngày 26 tháng 5 năm 2028,2028-05-26
2025/5,2025-05-16
4-2,2024-02-04
2011/4,2011-04-25
21/1-2008,2008-01-21
25:10:2020,2020-10-25
3/22-1997,1997-11-03
7th of October 1994,1994-10-07
22-1,1995-01-22
Mar 22 20,2020-03-22
16 June 2010,2010-06-16
Aug 21 13,2013-08-21
7/8-2022,2022-08-07
"July 25, 2027",2027-07-25
20-11-2033,2033-11-10
12/3-2011,2011-03-12
2016/5/14,2016-05-14
24/15/2033,2033-05-24
25 Feb 1994,1994-02-25
25.8.2010,2010-08-25
13/4/2015,2015-04-13
6/6/2001,2001-06-06
16/1/2027,2027-01-16
6/27/2019,2019-09-06
01012019,2019-01-01
20/4-2018,2018-04-20
9-20-30,2030-09-20
2030/11,2030-11-05
12:1:2011,2011-01-12
5/6-2002,2002-06-05
3 May 2017,2017-05-03
4/8/2002,2002-04-08
ngày 11 tháng 6 năm 2020,2020-06-11
25/9/2004,2004-09-25
"Dec 8th, 2004",2004-12-08
28-8-2023,2023-08-14
Oct 5 29,2029-10-05
1:6:2006,2006-06-01
12/7-2013,2013-07-12
"Nov 22th, 2028",2028-11-22
6-19-12,2012-06-19
10-24-03,2003-10-24
22.7.2035,2035-07-22
26Nov2024,2024-11-26
24-6-2032,2032-06-12
17 May 2013,2013-05-17
19/30/2003,2003-10-19
5/5/2034,2034-05-05
"Apr 26th, 2018",2018-04-26
May 22 16,2016-05-22
6 tháng 12 năm 1994,1994-12-06
1/1-2016,2016-01-01
10-6-1997,1997-06-05
22/1/05,2005-01-22
9.9.2035,2035-09-09
15th of November 2027,2027-11-15
16/2-1993,1993-02-16
22/10-2026,2026-10-22
7Jul2002,2002-07-07
1-6-1997,1997-06-01
4th of December 1996,1996-12-04
2006/10/19,2006-10-19
23/12/92,1992-12-23
20-7-2017,2017-07-20
Dec 1 90,1990-12-01
16.9.2023,2023-09-16
"March 25, 2003",2003-03-25
15 Aug 2018,2018-08-15
2014/9/11,2014-09-11
2029/10/12,2029-10-12
2025-3-13,2025-03-13
15052010,2010-05-15
8-19-25,2025-08-19
13102001,2001-10-13
21/11/34,2034-11-21
27-2-2003,2003-02-27
12/22/2005,2005-12-22
1993-7-3,1993-07-03
24-6,2026-06-24
1/24/1999,1999-08-01
16/8/1992,1992-08-16
Jan 12 10,2010-01-12
"Oct 11th, 2012",2012-10-11
22Mar1991,1991-03-22
17th of April 2031,2031-04-17
20/5/27,2027-05-20
11 March 1998,1998-03-11
15-3-2006,2006-03-15
12/27/12,2012-12-27
9-1-01,2001-09-01
2Sep1998,1998-09-02
25/12/32,2032-12-25
8-5,2003-05-08
"January 21, 2034",2034-01-21
5/20-2027,2027-10-05
12-14-12,2012-12-14
28/7-2003,2003-07-28
21/11-1990,1990-11-21
21-8-2025,2025-08-21
1997-11-24,1997-11-24
13/2/06,2006-02-13
11/27/1992,1992-09-11
04102018,2018-10-04
11 tháng 2 năm 2002,2002-02-11
2000/2,2000-02-24
25th of October 1997,1997-10-25
13 August 2018,2018-08-13
"Nov 9th, 2009",2009-11-09
10/5-2024,2024-05-10
"May 8, 1996",1996-05-08
12 No 2034,2034-11-12
"January 1, 2004",2004-01-01
13 August 1995,1995-08-13
20:12:1990,1990-12-20
10/6-2026,2026-06-10
"Sep 6th, 2035",2035-09-06
20-8,1991-08-20
13/10/2009,2009-10-13
Jun 10 14,2014-06-10
24Sep2024,2024-09-24
22:9:1993,1993-09-22
3-10-2018,2018-10-03
10/22/1993,1993-10-22
4/3/09,2009-03-04
21 Feb 2019,2019-02-21
1-21-16,2016-01-21
"September 19, 1991",1991-09-19
6.7.2009,2009-07-06
2021-4-8,2021-04-08
15/7/34,2034-07-15
4/6-2012,2012-06-04
24/7-2034,2034-07-24
15.9.2030,2030-09-15
19 De 2017,2017-12-19
2004-3-23,2004-03-23
2Jan2035,2035-01-02
7/23/2017,2017-07-23
16/18/2026,2026-06-16
9 August 2007,2007-08-09
19/9/2022,2022-03-19
3-23-17,2017-03-23
26Jan2021,2021-01-26
23 tháng 1 năm 2025,2025-01-23
2009-5-17,2009-05-17
28.11.2025,2025-11-28
14/2/96,1996-02-14
"May 6th, 2012",2012-05-06
2002-7-19,2002-07-19
ngày 7 tháng 12 năm 1999,1999-12-07
2009/4,2009-04-19
Mar 10 27,2027-03-10
44-6-2029,2029-06-22
25/11/23,2023-11-25
8-25-20,2020-08-25
27/4-2023,2023-04-27
11/16-2020,2020-08-11
17.9.2020,2020-09-17
2003/11/24,2003-11-24
18 tháng 9 năm 2007,2007-09-18
25021996,1996-02-25
21th of July 2025,2025-07-21
26 Mar 2014,2014-03-26
4 tháng 12 năm 2017,2017-12-04
21.4.2029,2029-04-21
24Aug2010,2010-08-24
16 tháng 8 năm 2024,2024-08-16
2028/10,2028-10-17
20.2.1992,1992-02-20
May 10 35,2035-05-10
2006/10/26,2006-10-26
9/4-2032,2032-02-09
18 Nov 2010,2010-11-18
19/1/2014,2014-01-19
"November 16, 2031",2031-11-16
14/9/2031,2031-09-14
22 Aug 2008,2008-08-22
24112028,2028-11-24
"Mar 14th, 1996",1996-03-14
23/2/2031,2031-02-23
8:9:2034,2034-09-08
22/12/17,2017-12-22
2031-9-23,2031-09-23
"November 28, 2007",2007-11-28
10 tháng 8 năm 2020,2020-08-10
26/8-2002,2002-08-26
"Sep 25th, 2031",2031-09-25
14th of May 2021,2021-05-14
5/7/2028,2028-07-05
28th of April 1991,1991-04-28
25-4-2006,2006-04-25
17 Ap 2026,2026-04-17
11-4-1993,1993-04-11
26081992,1992-08-26
22 tháng 5 năm 2010,2010-05-22
26-5-1994,1994-05-13
17/4/2020,2020-04-17
15 Se 1998,1998-09-15
Aug 17 34,2034-08-17
4:4:2026,2026-04-04
19 Nov 2020,2020-11-19
10/8-1993,1993-04-10
25 Jun 2008,2008-06-25
26/8-1996,1996-04-26
4Jul2003,2003-07-04
9/12-2000,2000-06-09
2032/1/27,2032-01-27
12082009,2009-08-12
20 Oct 2021,2021-10-20
2021/12/24,2021-12-24
10/19/2018,2018-10-19
2026/1,2026-01-18
ngày 2 tháng 5 năm 2035,2035-05-02
17May2004,2004-05-17
7th of January 2034,2034-01-07
13082008,2008-08-13
21 August 2028,2028-08-21
Jun 20 08,2008-06-20
4-5-12,2012-04-05
2008/11,2008-11-14
11-6,1990-06-11
6/6-1991,1991-06-06
3/1/08,2008-01-03
5th of November 2029,2029-11-05
2031/7,2031-07-24
13Aug2022,2022-08-13
Jul 6 95,1995-07-06
1990/9/17,1990-09-17
02022027,2027-02-02
28/6-2028,2028-06-28
24/8/06,2006-08-24
26-10-2015,2015-10-13
10 tháng 12 năm 2024,2024-12-10
7/33/2003,2003-11-07
23th of April 2019,2019-04-23
10 March 2008,2008-03-10
"Jan 8th, 2031",2031-01-08
2002/3,2002-03-15
9:3:1993,1993-03-09
20/6/2000,2000-02-20
17 June 1993,1993-06-17
ngày 12 tháng 12 năm 1993,1993-12-12
2005-6-14,2005-06-14
16/9/90,1990-09-16
6/8/30,2030-08-06
7/5/2004,2004-07-05
1/14/2025,2025-01-14
9/2/18,2018-02-09
05061995,1995-06-05
6/13/35,2035-06-13
2007-8-9,2007-08-09
2029/3/6,2029-03-06
13 Feb 1997,1997-02-13
12-18-24,2024-12-18
2024/4,2024-04-08
2/2-2020,2020-01-02
3-26-12,2012-03-26
9 Dec 2018,2018-12-09
17/10-1994,1994-10-17
27/12/21,2021-12-27
2032-8-2,2032-08-02
22 tháng 5 năm 2023,2023-05-22
20.11.2032,2032-11-20
14-5-1994,1994-05-07
26 Aug 2002,2002-08-26
9/23/17,2017-09-23
3/4/1995,1995-03-04
21/5-2004,2004-05-21
5-13-11,2011-05-13
2008-4-24,2008-04-24
3/6-2023,2023-06-03
19/7-2007,2007-07-19
27:3:2001,2001-03-27
2011/11,2011-11-04
"Feb 28th, 2019",2019-02-28
25 Ja 2007,2007-01-25
27/9/01,2001-09-27
1-1-2032,2032-01-01
7/36/2011,2011-12-07
"August 26, 2027",2027-08-26
20Aug2029,2029-08-20
18.2.2017,2017-02-18
"October 27, 2016",2016-10-27
Aug 6 18,2018-08-06
28-5-2008,2008-05-28
12-12,2021-12-12
22-11-2005,2005-11-11
9 tháng 3 năm 2026,2026-03-09
24 tháng 7 năm 2002,2002-07-24
Jan 17 22,2022-01-17
26Apr2015,2015-04-26
13 Feb 2007,2007-02-13
11:12:1990,1990-12-11
1-10-2004,2004-10-01
13/3-1994,1994-03-13
27-5,1996-05-27
"November 2, 1994",1994-11-02
"January 19, 2012",2012-01-19
17/2-2016,2016-02-17
1995/12,1995-12-22
15th of November 2009,2009-11-15
2035/10,2035-10-06
2033/7,2033-07-18
23/18-2017,2017-09-23
9-12-1994,1994-12-09
5-20-08,2008-05-20
1 Ma 2011,2011-05-01
2034/9/26,2034-09-26
27 tháng 9 năm 1997,1997-09-27
1991/4/8,1991-04-08
27/16-2003,2003-08-27
"Apr 2nd, 2015",2015-04-02
3/11/25,2025-11-03
"Jul 14th, 2005",2005-07-14
22:11:2010,2010-11-22
2011/1/26,2011-01-26
ngày 18 tháng 5 năm 2013,2013-05-18
10/14/2011,2011-10-14
8/20/2026,2026-08-20
May 13 28,2028-05-13
2013-7-27,2013-07-27
3/6-2004,2004-06-03
40-3-2026,2026-03-20
ngày 4 tháng 2 năm 1996,1996-02-04
26 Apr 2021,2021-04-26
6/13/26,2026-06-13
"Jan 16th, 1995",1995-01-16
2009/8/21,2009-08-21
4/5/21,2021-05-04
Jun 25 97,1997-06-25
Oct 6 27,2027-10-06
11/3-2034,2034-03-11
May 19 15,2015-05-19
24 Apr 2029,2029-04-24
7 January 2024,2024-01-07
3 tháng 8 năm 1991,1991-08-03
1Jan2002,2002-01-01
26 No 2014,2014-11-26
11/11/14,2014-11-11
10-7,2018-07-10
2-28-33,2033-02-28
13/4/11,2011-04-13
3-4,2016-04-03
18-2-2017,2017-02-18
21/6-2012,2012-03-21
"June 5, 2012",2012-06-05
22-11-2023,2023-11-11
7/2/2030,2030-02-07
12/5/2009,2009-05-12
"Oct 25th, 2028",2028-10-25
12/9/24,2024-12-09
2011-7-19,2011-07-19
18/5-2014,2014-05-18
2025-6-24,2025-06-24
20-9-2018,2018-09-20
20th of March 1993,1993-03-20
ngày 25 tháng 10 năm 2032,2032-10-25
28 Sep 2013,2013-09-28
12/2/2014,2014-12-02
3-9-09,2009-03-09
6/12-2016,2016-12-06
24/24-2011,2011-12-24
18/2/2020,2020-02-18
10122001,2001-12-10
2/20/33,2033-02-20
2034-8-12,2034-08-12
26/10/17,2017-10-26
ngày 17 tháng 1 năm 2029,2029-01-17
2033-1-24,2033-01-24
14:3:2030,2030-03-14
1 Ma 2010,2010-03-01
11/5/26,2026-05-11
2-12-2013,2013-12-01
2-27-29,2029-02-27
22 March 1996,1996-03-22
5/19/1992,1992-05-19
ngày 9 tháng 10 năm 1995,1995-10-09
2/12-2025,2025-12-02
9/6-1990,1990-03-09
May 26 01,2001-05-26
9:7:2006,2006-07-09
4-10,1999-10-04
2025-12-5,2025-12-05
14 August 2005,2005-08-14
8.10.1997,1997-10-08
22.4.2012,2012-04-22
14/9-2003,2003-09-14
Sep 24 92,1992-09-24
2000/11,2000-11-19
11/22/2017,2017-11-22
5 tháng 7 năm 2011,2011-07-05
08072015,2015-07-08
10 December 2031,2031-12-10
ngày 11 tháng 5 năm 2005,2005-05-11
ngày 25 tháng 12 năm 2025,2025-12-25
20/27/2008,2008-09-20
1/8-2030,2030-08-01
27.11.2035,2035-11-27
"December 7, 2006",2006-12-07
20 Apr 1996,1996-04-20
27Apr2031,2031-04-27
13/12-2004,2004-06-13
5/12/2009,2009-05-12
2024/9,2024-09-04
10-2-27,2027-10-02
"October 5, 1993",1993-10-05
26 February 2013,2013-02-26
26121993,1993-12-26
"June 6, 1991",1991-06-06
19/6/28,2028-06-19
15:1:2005,2005-01-15
"Feb 11th, 2016",2016-02-11
3-10-2006,2006-10-03
16/24/2002,2002-08-16
24 Apr 2026,2026-04-24
10/5/2001,2001-10-05
8/7/20,2020-07-08
6/3/07,2007-03-06
13-3-2019,2019-03-13
50-6-1999,1999-06-25
4Dec2026,2026-12-04
2008/7/12,2008-07-12
27/12/2000,2000-12-27
12/3-1998,1998-03-12
1/21/2031,2031-07-01
"December 5, 2018",2018-12-05
28/10/28,2028-10-28
17Oct2011,2011-10-17
ngày 24 tháng 11 năm 2009,2009-11-24
9 tháng 11 năm 2028,2028-11-09
1993/6,1993-06-10
"March 13, 2015",2015-03-13
2022/9,2022-09-05
23 tháng 10 năm 2033,2033-10-23
Feb 16 96,1996-02-16
17 tháng 11 năm 1996,1996-11-17
26/33/2018,2018-11-26
25/4/26,2026-04-25
11-4-02,2002-11-04
2026/5/9,2026-05-09
16:8:2029,2029-08-16
"March 25, 2006",2006-03-25
4-4,2020-04-04
9 Se 1997,1997-09-09
2007/7,2007-07-28
2 May 1994,1994-05-02
14-4,1992-04-14
13/6/2031,2031-02-13
"Aug 23th, 2018",2018-08-23
12-10-2019,2019-10-12
2000-9-17,2000-09-17
23 Nov 2027,2027-11-23
23091990,1990-09-23
27/14-2017,2017-07-27
8:2:1990,1990-02-08
28 tháng 1 năm 2021,2021-01-28
11 tháng 4 năm 2010,2010-04-11
9/13/2001,2001-09-13
9 Se 2028,2028-09-09
8/19/2002,2002-08-19
"Jun 19th, 2010",2010-06-19
10-5-1996,1996-05-10
"January 27, 2035",2035-01-27
22/3-2007,2007-03-22
23.6.2019,2019-06-23
"February 27, 1997",1997-02-27
Jul 3 01,2001-07-03
6-28-35,2035-06-28
3/10-2011,2011-10-03
13/5/31,2031-05-13
4 Se 2027,2027-09-04
7/9/09,2009-07-09
11/6/09,2009-06-11
1992/7/12,1992-07-12
Jul 22 06,2006-07-22
17 tháng 8 năm 2033,2033-08-17
2014-2-17,2014-02-17
22-12-2033,2033-12-22
1 Ju 2027,2027-06-01
3/19/2021,2021-03-19
24/12/05,2005-12-24
7/1-2027,2027-01-07
2031/11,2031-11-22
ngày 12 tháng 4 năm 2021,2021-04-12
7/14/06,2006-07-14
20/10/11,2011-10-20
"June 26, 1993",1993-06-26
Aug 16 04,2004-08-16
16-4-1999,1999-04-08
20-1-2030,2030-01-10
28:4:2035,2035-04-28
2001/7,2001-07-06
16/6/06,2006-06-16
6/9-2035,2035-09-06
6th of January 2021,2021-01-06
28-11-2011,2011-11-28
2025/5/11,2025-05-11
"Oct 6th, 2034",2034-10-06
12-3-1991,1991-03-12
14th of March 2023,2023-03-14
2002/6/25,2002-06-25
19th of September 2027,2027-09-19
2Aug2018,2018-08-02
"November 17, 1998",1998-11-17
10-5-00,2000-10-05
22-1-2012,2012-01-22
21 Ju 1993,1993-07-21
"Jul 22th, 2023",2023-07-22
15/6/1994,1994-06-15
4/7-2020,2020-07-04
16 Oc 1997,1997-10-16
6-13-28,2028-06-13
21th of February 2034,2034-02-21
4/25/02,2002-04-25
11/11/2019,2019-11-11
"Jan 25th, 2016",2016-01-25
4.7.2019,2019-07-04
"Dec 10th, 2030",2030-12-10
Oct 6 93,1993-10-06
2032-9-26,2032-09-26
26-12-2001,2001-12-13
8 Ma 2010,2010-03-08
10-9,2025-09-10
21/7-2022,2022-07-21
2031/10,2031-10-09
2003-7-24,2003-07-24
12Feb2003,2003-02-12
4/4/29,2029-04-04
26/12-2008,2008-06-26
"Jun 23th, 1993",1993-06-23
8-4,2021-04-08
"September 19, 1996",1996-09-19
4/28/2010,2010-04-28
5/21/20,2020-05-21
1/21/1993,1993-01-21
1997/6,1997-06-06
"March 4, 2003",2003-03-04
21:7:2012,2012-07-21
ngày 4 tháng 8 năm 2007,2007-08-04
Mar 23 27,2027-03-23
28/11/2028,2028-11-28
15 May 2009,2009-05-15
12/12-2032,2032-12-12
"March 13, 2018",2018-03-13
4 Ja 2006,2006-01-04
14/2-2002,2002-02-14
17.7.2014,2014-07-17
7/1-2025,2025-01-07
10Feb2012,2012-02-10
Jan 2 90,1990-01-02
22 Au 1990,1990-08-22
17111993,1993-11-17
17/2/24,2024-02-17
09031991,1991-03-09
1990-5-13,1990-05-13
18/4/22,2022-04-18
2025-9-14,2025-09-14
2-17-29,2029-02-17
15/1/94,1994-01-15
"Nov 2nd, 2011",2011-11-02
"June 23, 2019",2019-06-23
2/2/29,2029-02-02
4 Jul 2000,2000-07-04
ngày 5 tháng 9 năm 2012,2012-09-05
11/4-1996,1996-04-11
5/20/2034,2034-05-20
1993/5/17,1993-05-17
2014/1,2014-01-12
"July 27, 2031",2031-07-27
"July 24, 1990",1990-07-24
5th of July 2023,2023-07-05
3:11:2020,2020-11-03
2026-5-17,2026-05-17
2026-9-26,2026-09-26
17 Sep 2008,2008-09-17
8 November 2001,2001-11-08
ngày 24 tháng 8 năm 2034,2034-08-24
15 Se 1992,1992-09-15
26-6-2035,2035-06-13
1/6-2024,2024-06-01
27 Se 2010,2010-09-27
11/12/34,2034-12-11
10/18/2032,2032-10-18
12Apr2035,2035-04-12
26/4/2018,2018-04-26
5/27/2023,2023-09-05
14-2,2008-02-14
22Sep2034,2034-09-22
2020/5,2020-05-26
"Jul 26th, 2016",2016-07-26
Dec 12 29,2029-12-12
11/15/2001,2001-11-15
20th of July 2006,2006-07-20
5/18-2014,2014-09-05
21 tháng 1 năm 2027,2027-01-21
23/3-2021,2021-03-23
23/8-2029,2029-08-23
19 November 1992,1992-11-19
8/28/1999,1999-08-28
14/8-2022,2022-04-14
4.5.2001,2001-05-04
2011/4/25,2011-04-25
24-7,1994-07-24
2010-11-19,2010-11-19
28/24-2016,2016-12-28
26 tháng 7 năm 2035,2035-07-26
05112029,2029-11-05
13/9-2015,2015-09-13
16/2/2003,2003-02-16
24th of October 2033,2033-10-24
Jul 1 13,2013-07-01
17-12-2021,2021-12-17
3-2,2029-02-03
ngày 21 tháng 7 năm 1996,1996-07-21
1990/11/21,1990-11-21
5-16-09,2009-05-16
4 tháng 3 năm 1999,1999-03-04
21-10-1994,1994-10-21
11-18-30,2030-11-18
3/1/06,2006-03-01
38-7-2000,2000-07-19
5-5-02,2002-05-05
4 tháng 12 năm 2025,2025-12-04
20-4-1997,1997-04-20
5-22-21,2021-05-22
1/8-2015,2015-08-01
8/24/18,2018-08-24
2025/9/27,2025-09-27
22/3/02,2002-03-22
2033/7/28,2033-07-28
9 Ju 2024,2024-07-09
12:6:2021,2021-06-12
1990-9-6,1990-09-06
16/5-2017,2017-05-16
19Jun1995,1995-06-19
9/8-2015,2015-08-09
Jun 18 34,2034-06-18
2024-12-7,2024-12-07
15/2/2009,2009-02-15
6/5/07,2007-05-06
11-23-98,1998-11-23
2026/10/8,2026-10-08
11/8/2001,2001-08-11
02112000,2000-11-02
12/5/1993,1993-12-05
34-2-1996,1996-02-17
26/6-2007,2007-03-26
22 Fe 2026,2026-02-22
1/14-2035,2035-07-01
1995-6-20,1995-06-20
10/11-2017,2017-11-10
23 De 2032,2032-12-23
18/9-2007,2007-09-18
Sep 26 00,2000-09-26
27-1-2008,2008-01-27
2035/3,2035-03-24
8 Mar 2020,2020-03-08
19112010,2010-11-19
8/16/1998,1998-08-16
"October 11, 2007",2007-10-11
23/24-2000,2000-12-23
"November 2, 2005",2005-11-02
Oct 19 01,2001-10-19
13/18-2019,2019-09-13
16/4-1995,1995-04-16
20/12/06,2006-12-20
14 Oct 2012,2012-10-14
28th of February 2003,2003-02-28
7 September 2011,2011-09-07
13th of July 2024,2024-07-13
19:1:1999,1999-01-19
2003-3-27,2003-03-27
6-4-1994,1994-04-03
12 October 2012,2012-10-12
2007-10-7,2007-10-07
27/5-2001,2001-05-27
1991-4-7,1991-04-07
15Dec2021,2021-12-15
28th of December 2009,2009-12-28
27/6-2022,2022-03-27
25:9:1999,1999-09-25
10th of July 1990,1990-07-10
26122003,2003-12-26
21/6-2018,2018-06-21
24Jul1995,1995-07-24
28th of April 2009,2009-04-28
24:2:1999,1999-02-24
19/8-1996,1996-08-19
May 26 07,2007-05-26
2024/9,2024-09-19
ngày 6 tháng 7 năm 2011,2011-07-06
4.12.2014,2014-12-04
2-5-2022,2022-05-01
7/11/09,2009-11-07
ngày 14 tháng 3 năm 2032,2032-03-14
17 Ju 1998,1998-07-17
2007/4/6,2007-04-06
2008/2/24,2008-02-24
2004-5-18,2004-05-18
24 August 1996,1996-08-24
2035/6,2035-06-16
26/2/2005,2005-02-26
4th of January 2017,2017-01-04
23/7/2009,2009-07-23
"December 26, 2011",2011-12-26
6th of February 2035,2035-02-06
9/4/14,2014-04-09
2020/11/18,2020-11-18
3.8.2006,2006-08-03
7-16-31,2031-07-16
24/1/95,1995-01-24
19 tháng 11 năm 2029,2029-11-19
Jun 28 30,2030-06-28
24-12-2008,2008-12-12
Jun 14 90,1990-06-14
20 Sep 1990,1990-09-20
28-11,2004-11-28
2005/10,2005-10-10
4:6:2028,2028-06-04
21/7/2001,2001-07-21
Sep 25 30,2030-09-25
15/6-2012,2012-03-15
9 tháng 11 năm 1997,1997-11-09
20-12-2019,2019-12-20
17/2/25,2025-02-17
56-1-2008,2008-01-28
6th of December 2008,2008-12-06
19/12-2026,2026-12-19
14/36/2030,2030-12-14
5-11,1995-11-05
21/12-2019,2019-12-21
10/10-2027,2027-10-10
ngày 16 tháng 7 năm 2015,2015-07-16
5-7-2010,2010-07-05
21th of August 2018,2018-08-21
"Apr 4th, 2019",2019-04-04
23/1/1991,1991-01-23
27 tháng 11 năm 2021,2021-11-27
8/2/29,2029-02-08
26 Nov 2011,2011-11-26
2002/7/21,2002-07-21
2020/9/5,2020-09-05
1999/11,1999-11-12
4/13/2027,2027-04-13
25:1:2004,2004-01-25
15022012,2012-02-15
2014-2-16,2014-02-16
25Oct2000,2000-10-25
16102018,2018-10-16
ngày 27 tháng 11 năm 2019,2019-11-27
3/6-1992,1992-03-03
03062021,2021-06-03
"December 2, 2018",2018-12-02
23 No 2007,2007-11-23
11 Ap 2001,2001-04-11
28-2-2003,2003-02-28
8:3:2028,2028-03-08
"October 9, 2025",2025-10-09
16/5-2021,2021-05-16
9/1/08,2008-09-01
3/10/2033,2033-03-10
2010-6-25,2010-06-25
11/12-2027,2027-06-11
5-8,1994-08-05
Dec 9 23,2023-12-09
ngày 23 tháng 6 năm 2028,2028-06-23
9/17/2015,2015-09-17
11:1:2020,2020-01-11
2-1,2024-01-02
Oct 3 92,1992-10-03
9/4-2000,2000-02-09
7-5-2008,2008-05-07
11/17/03,2003-11-17
02042018,2018-04-02
11-5-2006,2006-05-11
ngày 21 tháng 3 năm 1991,1991-03-21
17052032,2032-05-17
50-11-2021,2021-11-25
22 Apr 2015,2015-04-22
9/6/01,2001-09-06
10/2-1991,1991-02-10
8/10/2009,2009-08-10
2023-12-28,2023-12-28
2013-2-3,2013-02-03
11-4-2001,2001-04-11
5/6/96,1996-06-05
3 Feb 1990,1990-02-03
27/9/2012,2012-09-27
2Mar2020,2020-03-02
7/7-2000,2000-07-07
10 February 1993,1993-02-10
14/12-2010,2010-06-14
44-4-2003,2003-04-22
6/3/17,2017-06-03
7-10-96,1996-07-10
2032/9/25,2032-09-25
11/10/35,2035-10-11
4-20-24,2024-04-20
10-24-24,2024-10-24
6 Oct 1994,1994-10-06
2014/4/15,2014-04-15
2019/10,2019-10-08
21092029,2029-09-21
21 Ju 2017,2017-07-21
27 October 2032,2032-10-27
7 tháng 10 năm 2003,2003-10-07
5/8/2015,2015-05-08
1994/1,1994-01-24
7/21/03,2003-07-21
"August 22, 2024",2024-08-22
5/10/2028,2028-05-10
7/27/04,2004-07-27
Sep 11 21,2021-09-11
14/18/1997,1997-06-14
13052010,2010-05-13
"Aug 6th, 2016",2016-08-06
18-10-1999,1999-10-18
"November 28, 2025",2025-11-28
12-10,2007-10-12
2033-8-2,2033-08-02
1/24-2031,2031-12-01
5 No 2017,2017-11-05
6-2-2010,2010-02-03
9-20-02,2002-09-20
2/24/1992,1992-02-24
23/3-2015,2015-03-23
"December 11, 2022",2022-12-11
28/22-2018,2018-11-28
9.2.2027,2027-02-09
5/14/08,2008-05-14
3:4:1990,1990-04-03
16:5:2010,2010-05-16
ngày 10 tháng 8 năm 2034,2034-08-10
1/16-2017,2017-08-01
19/15/2022,2022-05-19
25 Oct 1995,1995-10-25
1998-3-13,1998-03-13
24 tháng 1 năm 1996,1996-01-24
2000/2/3,2000-02-03
24/27/2011,2011-09-24
"December 25, 2008",2008-12-25
4-7-2033,2033-07-02
2007-7-16,2007-07-16
7/6-2028,2028-06-07
2035/11,2035-11-16
2001/11,2001-11-17
23 Ja 1994,1994-01-23
28/8-2005,2005-04-28
25.12.2004,2004-12-25
6/22/35,2035-06-22
17-9-2033,2033-09-17
2-8-34,2034-02-08
25/36/1997,1997-12-25
2-11-24,2024-02-11
16/2/26,2026-02-16
8 Jul 2029,2029-07-08
14 Oct 2033,2033-10-14
26-6,2008-06-26
4/16/2017,2017-04-16
04031990,1990-03-04
14-2,2010-02-14
2013/4,2013-04-02
"Dec 18th, 2013",2013-12-18
5/19/1996,1996-05-19
13/9/1990,1990-03-13
2007/9/22,2007-09-22
10/9/1999,1999-03-10
10/2/2000,2000-02-10
19/2/2033,2033-02-19
6/2/07,2007-02-06
2/6-1993,1993-03-02
9/8-2016,2016-08-09
22022026,2026-02-22
7 October 2025,2025-10-07
"Nov 26th, 2015",2015-11-26
19/12/2002,2002-12-19
18/3/33,2033-03-18
11/16-2023,2023-08-11
22Jul2012,2012-07-22
23:10:2032,2032-10-23
28/1/91,1991-01-28
24/7/1998,1998-07-24
13:6:2010,2010-06-13
13112021,2021-11-13
11th of November 2013,2013-11-11
ngày 17 tháng 3 năm 2033,2033-03-17
"June 10, 2001",2001-06-10
8th of July 2002,2002-07-08
23.12.2027,2027-12-23
15/8/20,2020-08-15
20-5-2021,2021-05-20
9th of August 2013,2013-08-09
Aug 1 20,2020-08-01
5 March 2017,2017-03-05
24/7/97,1997-07-24
6 January 2015,2015-01-06
25012011,2011-01-25
4/28/2022,2022-04-28
23-4-1994,1994-04-23
18Sep2034,2034-09-18
20-11-2018,2018-11-20
11 Fe 2015,2015-02-11
1997/3,1997-03-22
2000-1-19,2000-01-19
4 tháng 7 năm 2027,2027-07-04
8-11-26,2026-08-11
27032018,2018-03-27
"March 1, 1991",1991-03-01
4:9:2031,2031-09-04
18/2/08,2008-02-18
16-11-2018,2018-11-16
16/7/05,2005-07-16
17-4,2027-04-17
3/2/1998,1998-03-02
2/3/2006,2006-03-02
11/14/2002,2002-11-14
46-3-2022,2022-03-23
22/10/28,2028-10-22
6/2-2021,2021-02-06
27 Ma 2012,2012-03-27
"Mar 4th, 2031",2031-03-04
7/4/92,1992-04-07
1998-10-10,1998-10-10
46-12-2018,2018-12-23
02112020,2020-11-02
16/30/1999,1999-10-16
2 tháng 6 năm 1993,1993-06-02
"Feb 22th, 2034",2034-02-22
1/10/25,2025-10-01
8/6/1991,1991-02-08
2000/9/10,2000-09-10
27.1.2019,2019-01-27
21/2-2007,2007-02-21
5-19-33,2033-05-19
3 March 1990,1990-03-03
15/11-2020,2020-11-15
ngày 4 tháng 12 năm 2000,2000-12-04
2001/11/21,2001-11-21
18/6/28,2028-06-18
23 Jun 2022,2022-06-23
ngày 5 tháng 2 năm 1994,1994-02-05
4 tháng 5 năm 2026,2026-05-04
2026-3-26,2026-03-26
22/20-2021,2021-10-22
"Oct 8th, 2010",2010-10-08
7 De 1997,1997-12-07
28:6:2016,2016-06-28
"Mar 14th, 2031",2031-03-14
8/7/2009,2009-08-07
6/4/90,1990-04-06
18/7/28,2028-07-18
28Aug2011,2011-08-28
13/12/1998,1998-12-13
4 tháng 8 năm 2020,2020-08-04
ngày 4 tháng 3 năm 2002,2002-03-04
"Jul 14th, 2030",2030-07-14
3/36/2016,2016-12-03
6-13-18,2018-06-13
Feb 3 95,1995-02-03
15/10-1990,1990-10-15
4-13-15,2015-04-13
25/3/14,2014-03-25
16.10.2010,2010-10-16
24 Oct 1998,1998-10-24
23.9.2019,2019-09-23
13 tháng 8 năm 1996,1996-08-13
1995/7/2,1995-07-02
27th of June 1994,1994-06-27
2-5,1991-05-02
16/2-2033,2033-01-16
2008/2/14,2008-02-14
12/9/2027,2027-12-09
11 Mar 2028,2028-03-11
12-21-06,2006-12-21
16091996,1996-09-16
1 Ju 2013,2013-06-01
52-2-2030,2030-02-26
9 Ju 2021,2021-07-09
"September 16, 2021",2021-09-16
8 December 2012,2012-12-08
"February 22, 2012",2012-02-22
17 Ju 2015,2015-07-17
9/22/2035,2035-09-22
22/5/2017,2017-05-22
19062012,2012-06-19
2/15/2013,2013-02-15
2011/8/26,2011-08-26
21 Fe 2005,2005-02-21
25:9:2016,2016-09-25
01112029,2029-11-01
24-9-1998,1998-09-12
1998-6-7,1998-06-07
13th of June 1991,1991-06-13
"October 3, 2001",2001-10-03
9-8-11,2011-09-08
2022-3-9,2022-03-09
27/9-2022,2022-09-27
12-28-12,2012-12-28
3/14-2032,2032-07-03
8.10.2032,2032-10-08
Aug 4 05,2005-08-04
2/9/22,2022-02-09
2035/9/1,2035-09-01
6/10/20,2020-10-06
7 tháng 12 năm 2009,2009-12-07
1/3-2005,2005-03-01
7/8/32,2032-08-07
09102009,2009-10-09
5/7/07,2007-07-05
13062032,2032-06-13
26.9.1996,1996-09-26
22-6,2004-06-22
9/13/2001,2001-09-13
Sep 6 34,2034-09-06
9.10.2022,2022-10-09
16.10.2034,2034-10-16
7/7/23,2023-07-07
22Jul2035,2035-07-22
27:7:2033,2033-07-27
24/9-2002,2002-09-24
5/12/2019,2019-05-12
ngày 28 tháng 11 năm 1998,1998-11-28
1992/7/3,1992-07-03
"Feb 9th, 1991",1991-02-09
25Jan2000,2000-01-25
7 Mar 2007,2007-03-07
2031/4,2031-04-18
19 tháng 12 năm 2020,2020-12-19
3/12/2000,2000-12-03
13/6-2014,2014-06-13
9/20/23,2023-09-20
26.5.2009,2009-05-26
11/26/11,2011-11-26
2027/4,2027-04-03
7/3/1992,1992-01-07
2030-6-6,2030-06-06
10:12:2023,2023-12-10
12-1,1994-01-12
19 January 2005,2005-01-19
26 September 2016,2016-09-26
9 tháng 6 năm 1990,1990-06-09
ngày 13 tháng 12 năm 2008,2008-12-13
18/22-2013,2013-11-18
2028/8/17,2028-08-17
38-8-2031,2031-08-19
10/6/27,2027-10-06
12/9-2015,2015-09-12
"April 20, 2016",2016-04-20
12/9/2006,2006-03-12
14/3-2028,2028-03-14
27.5.2023,2023-05-27
54-1-2029,2029-01-27
ngày 27 tháng 5 năm 2034,2034-05-27
10 Fe 2024,2024-02-10
27 Apr 2011,2011-04-27
9/12/20,2020-12-09
21:2:2016,2016-02-21
"September 21, 2032",2032-09-21
6/11-2012,2012-11-06
14:4:1993,1993-04-14
Apr 1 16,2016-04-01
12/36/2027,2027-12-12
4-18-12,2012-04-18
10:7:2002,2002-07-10
2 No 2001,2001-11-02
3/2/02,2002-02-03
12/22/35,2035-12-22
2-23-90,1990-02-23
4/19/2023,2023-04-19
"Jul 9th, 2003",2003-07-09
19/3-2008,2008-03-19
"November 24, 2027",2027-11-24
12/18/2021,2021-12-18
1/16/98,1998-01-16
28/11-2009,2009-11-28
ngày 12 tháng 11 năm 2028,2028-11-12
5/2-2030,2030-01-05
4-22-92,1992-04-22
26-6-2012,2012-06-13
23.6.1997,1997-06-23
15/7/15,2015-07-15
7/11/13,2013-07-11
4/12/92,1992-12-04
ngày 12 tháng 5 năm 2025,2025-05-12
9/5-2016,2016-05-09
20May2015,2015-05-20
2-21-93,1993-02-21
9/26/1992,1992-09-26
28/12-2027,2027-12-28
24 July 2020,2020-07-24
20/8-1996,1996-08-20
6.1.2016,2016-01-06
2 tháng 5 năm 2033,2033-05-02
08112030,2030-11-08
3/12/97,1997-12-03
7/33/1999,1999-11-07
26th of May 2013,2013-05-26
"Jan 2nd, 2013",2013-01-02
2032-3-17,2032-03-17
16/9-2014,2014-09-16
1994-8-8,1994-08-08
"October 10, 1998",1998-10-10
11-27-29,2029-11-27
7/14/09,2009-07-14
18/7-2009,2009-07-18
6/12/29,2029-06-12
11-9-2019,2019-09-11
5/2/2006,2006-05-02
ngày 9 tháng 7 năm 1997,1997-07-09
1990-11-16,1990-11-16
24 Nov 2009,2009-11-24
9-4-2035,2035-04-09
5-21-91,1991-05-21
17/3-2022,2022-03-17
8-2-2015,2015-02-08
ngày 26 tháng 2 năm 1997,1997-02-26
ngày 24 tháng 3 năm 2007,2007-03-24
2009-5-27,2009-05-27
20.1.1994,1994-01-20
2031-1-25,2031-01-25
7-24-07,2007-07-24
19/12/2026,2026-04-19
2-6-2013,2013-06-01
"March 1, 2006",2006-03-01
08102015,2015-10-08
6/22/07,2007-06-22
1/6/2029,2029-02-01
ngày 15 tháng 4 năm 1992,1992-04-15
1994/3,1994-03-28
03022026,2026-02-03
11 Ju 2008,2008-06-11
26/1-2033,2033-01-26
2nd of March 2031,2031-03-02
2035/3/17,2035-03-17
24-1-2028,2028-01-12
8/7/1994,1994-07-08
"Dec 20th, 2007",2007-12-20
18021995,1995-02-18
8-19-21,2021-08-19
23/9/2029,2029-03-23
7/11-2002,2002-11-07
1-5-1993,1993-05-01
12Nov2033,2033-11-12
1/1/16,2016-01-01
Oct 10 06,2006-10-10
10:12:1995,1995-12-10
5/20/2007,2007-05-20
15/8-2017,2017-04-15
2028-4-28,2028-04-28
9/4/2006,2006-09-04
21/5/96,1996-05-21
16 tháng 7 năm 2012,2012-07-16
22/2-2026,2026-01-22
4/4/1992,1992-04-04
8/2-2001,2001-02-08
14112023,2023-11-14
22052006,2006-05-22
21/2/2012,2012-02-21
2/15/2035,2035-05-02
9th of February 2034,2034-02-09
8.1.2031,2031-01-08
23 May 1995,1995-05-23
Feb 25 93,1993-02-25
8 tháng 9 năm 2022,2022-09-08
9-4,2007-04-09
23/9/2030,2030-03-23
19 Ja 2022,2022-01-19
24/9/1999,1999-03-24
2004-8-4,2004-08-04
3.5.2021,2021-05-03
6Jul2015,2015-07-06
22.9.2030,2030-09-22
2033-11-1,2033-11-01
2016/9/27,2016-09-27
10.11.1998,1998-11-10
17:6:2026,2026-06-17
May 21 91,1991-05-21
"May 19th, 2023",2023-05-19
ngày 24 tháng 5 năm 2008,2008-05-24
42-12-2025,2025-12-21
5Oct1998,1998-10-05
9:4:2019,2019-04-09
12th of January 2034,2034-01-12
ngày 18 tháng 5 năm 2035,2035-05-18
24-7,2003-07-24
4/11/97,1997-11-04
2010/4/25,2010-04-25
Jul 13 12,2012-07-13
5/2/2006,2006-02-05
4/26/18,2018-04-26
2008-7-4,2008-07-04
28/8-1997,1997-08-28
1/23/1999,1999-01-23
2031-2-22,2031-02-22
28th of May 1990,1990-05-28
"April 12, 1992",1992-04-12
11/9/1993,1993-03-11
1994/5,1994-05-05
14-12,2022-12-14
2/7-2021,2021-07-02
23/3/2008,2008-03-23
Aug 19 94,1994-08-19
10102017,2017-10-10
1st of July 2014,2014-07-01
4Feb1993,1993-02-04
22/3/23,2023-03-22
3-6,1996-06-03
12 October 2026,2026-10-12
18 Apr 2014,2014-04-18
20Jan2001,2001-01-20
25/7/05,2005-07-25
26/11/97,1997-11-26
25/1/33,2033-01-25
"Jun 11th, 2011",2011-06-11
28/3/2031,2031-01-28
"November 24, 2024",2024-11-24
19/3-2013,2013-03-19
11/8/22,2022-08-11
ngày 21 tháng 9 năm 2002,2002-09-21
5/4-2009,2009-04-05
1.11.2011,2011-11-01
13th of June 2007,2007-06-13
4-6,2029-06-04
4/10/02,2002-10-04
"Sep 1st, 1996",1996-09-01
8th of November 2013,2013-11-08
23/30/1992,1992-10-23
1999/5,1999-05-19
21.1.2031,2031-01-21
8 tháng 3 năm 2008,2008-03-08
2008/8/5,2008-08-05
8 De 1997,1997-12-08
16-7,1998-07-16
16/2-2035,2035-02-16
27Oct2000,2000-10-27
03032027,2027-03-03
15-10-2031,2031-10-15
2029-12-14,2029-12-14
1990/10,1990-10-06
46-10-2023,2023-10-23
2/25/2019,2019-02-25
2035-8-3,2035-08-03
14 De 1994,1994-12-14
16/10/96,1996-10-16
21.9.2016,2016-09-21
7-28-99,1999-07-28
2002/5/25,2002-05-25
5/2/14,2014-05-02
"May 8th, 2013",2013-05-08
11/10/28,2028-10-11
27th of August 2034,2034-08-27
4/7/18,2018-07-04
14 Nov 2007,2007-11-14
2/25/14,2014-02-25
8-10-1998,1998-10-04
08102004,2004-10-08
15-12-2000,2000-12-15
2006/9,2006-09-26
22-4-2006,2006-04-11
1/22-2009,2009-11-01
7/3/2019,2019-01-07
01122006,2006-12-01
18 February 2009,2009-02-18
2025/1,2025-01-28
7th of March 2013,2013-03-07
13 Ma 2014,2014-05-13
2002/2/14,2002-02-14
15/10/96,1996-10-15
26/12/11,2011-12-26
21/1-1990,1990-01-21
9-11-1991,1991-11-09
1994-4-19,1994-04-19
8 Jun 2022,2022-06-08
19/10-2000,2000-10-19
19/10-2012,2012-10-19
14:10:2000,2000-10-14
6/6/2014,2014-06-06
10-11-2013,2013-11-05
17-1,2006-01-17
"July 11, 1997",1997-07-11
10-6-06,2006-10-06
25/6-2021,2021-06-25
4/7-2012,2012-07-04
2016-2-4,2016-02-04
"December 11, 2025",2025-12-11
ngày 12 tháng 10 năm 2032,2032-10-12
23/3/19,2019-03-23
44-1-2034,2034-01-22
1996/2/15,1996-02-15
18/4/98,1998-04-18
22 Au 2015,2015-08-22
10/21/95,1995-10-21
2035/5,2035-05-03
2004/4,2004-04-10
"Jan 14th, 2034",2034-01-14
May 28 03,2003-05-28
22-8-1995,1995-08-22
2003/2,2003-02-24
07112017,2017-11-07
"Feb 3rd, 2002",2002-02-03
23 November 2020,2020-11-23
6May1990,1990-05-06
44-9-1994,1994-09-22
6/2-2023,2023-02-06
May 23 21,2021-05-23
"Sep 19th, 2034",2034-09-19
16 Ap 2026,2026-04-16
ngày 27 tháng 9 năm 2035,2035-09-27
24 tháng 3 năm 2019,2019-03-24
14 No 2022,2022-11-14
10-1,2031-01-10
25/6/18,2018-06-25
"January 21, 1996",1996-01-21
2019/10,2019-10-03
1990/5,1990-05-01
8/6/95,1995-06-08
"June 15, 2004",2004-06-15
16:11:2004,2004-11-16
17 July 1996,1996-07-17
"Sep 28th, 1992",1992-09-28
2-11,1997-11-02
1-20-23,2023-01-20
"Jun 10th, 2023",2023-06-10
"November 25, 1991",1991-11-25
28/6-2008,2008-03-28
23th of December 1993,1993-12-23
2/24/2027,2027-08-02
20.8.2027,2027-08-20
"May 12th, 2010",2010-05-12
ngày 8 tháng 7 năm 2029,2029-07-08
06082015,2015-08-06
Jun 8 02,2002-06-08
Oct 10 34,2034-10-10
2016/3,2016-03-05
24/6/17,2017-06-24
11-3-98,1998-11-03
22:11:1990,1990-11-22
"Apr 8th, 2015",2015-04-08
8/13/04,2004-08-13
Nov 5 27,2027-11-05
22 tháng 8 năm 1996,1996-08-22
2028/3/17,2028-03-17
6/20-2026,2026-10-06
"July 16, 2020",2020-07-16
1994/4/15,1994-04-15
"Jul 24th, 2016",2016-07-24
2000/6/15,2000-06-15
"July 24, 2008",2008-07-24
14.2.1994,1994-02-14
3 June 1991,1991-06-03
14092032,2032-09-14
13/20-2009,2009-10-13
"Aug 5th, 2013",2013-08-05
23:4:2004,2004-04-23
2021-2-26,2021-02-26
2001/3/20,2001-03-20
3/3/2011,2011-03-03
05112026,2026-11-05
2028/5,2028-05-10
21/10-2010,2010-10-21
"August 20, 1996",1996-08-20
2022-10-20,2022-10-20
46-11-2033,2033-11-23
23062026,2026-06-23
"Apr 19th, 2028",2028-04-19
25.1.2006,2006-01-25
26/7-2001,2001-07-26
Jul 16 33,2033-07-16
19Jan2012,2012-01-19
28/4-2022,2022-04-28
6 Oct 2006,2006-10-06
23/5-2007,2007-05-23
8/8-2017,2017-08-08
12062005,2005-06-12
28/11/18,2018-11-28
"Mar 10th, 2023",2023-03-10
3 May 1995,1995-05-03
28/8/25,2025-08-28
"January 21, 2023",2023-01-21
28 April 2010,2010-04-28
17/6-2022,2022-03-17
"August 8, 2004",2004-08-08
13/12/91,1991-12-13
22-2,2026-02-22
15042015,2015-04-15
12-10,2003-10-12
17 tháng 7 năm 2004,2004-07-17
17/2-1997,1997-02-17
5/30/1990,1990-10-05
2007-1-20,2007-01-20
7Feb2033,2033-02-07
"February 24, 2013",2013-02-24
2035/1/9,2035-01-09
9/2-1992,1992-02-09
8/1-1996,1996-01-08
16Mar1990,1990-03-16
28.12.2018,2018-12-28
6 July 1997,1997-07-06
2023/7,2023-07-02
11/7/92,1992-07-11
9/11/00,2000-11-09
25/7/1992,1992-07-25
"January 4, 2022",2022-01-04
16 September 2035,2035-09-16
3 May 2035,2035-05-03
23/3/2017,2017-03-23
5/12-1997,1997-12-05
6/8-2013,2013-04-06
6-8,2023-08-06
26/2-2012,2012-02-26
Jun 25 01,2001-06-25
4-12-2035,2035-12-02
21 Apr 2026,2026-04-21
"Jul 20th, 2035",2035-07-20
15 Ap 2022,2022-04-15
6 May 2014,2014-05-06
8-7-2031,2031-07-08
4:4:2031,2031-04-04
6 tháng 2 năm 2012,2012-02-06
7/18-2018,2018-09-07
5/6-2019,2019-03-05
2015/6/17,2015-06-17
28-5,2013-05-28
22/6/2001,2001-02-22
1 Ju 1992,1992-06-01
6-2-2021,2021-02-06
46-2-1996,1996-02-23
2027-7-3,2027-07-03
4-9,1992-09-04
ngày 8 tháng 2 năm 2002,2002-02-08
25/6/1997,1997-02-25
18 September 1993,1993-09-18
24.7.2016,2016-07-24
15-6-2023,2023-06-15
ngày 11 tháng 3 năm 2032,2032-03-11
9 Sep 2035,2035-09-09
4-11-2018,2018-11-04
21th of July 2011,2011-07-21
"Aug 27th, 2009",2009-08-27
Feb 22 92,1992-02-22
8-9-2015,2015-09-08
"July 22, 2020",2020-07-22
18/1/27,2027-01-18
"May 2, 2032",2032-05-02
"Jul 3rd, 1996",1996-07-03
23/15/2022,2022-05-23
18.11.2033,2033-11-18
3.12.2028,2028-12-03
25/1-1998,1998-01-25
05072021,2021-07-05
12 tháng 12 năm 2011,2011-12-12
2034-3-19,2034-03-19
21/30/2023,2023-10-21
2011/1,2011-01-10
14022030,2030-02-14
2032/2,2032-02-26
17th of February 2019,2019-02-17
11/3/06,2006-03-11
24/4-2013,2013-04-24
25/16-2006,2006-08-25
23/9-1996,1996-09-23
9/1/1994,1994-01-09
10/10-2030,2030-10-10
May 15 08,2008-05-15
1995-4-26,1995-04-26
2014/1,2014-01-16
16/8/20,2020-08-16
10 tháng 7 năm 2006,2006-07-10
9/2-1996,1996-02-09
24/8-1997,1997-08-24
10.7.2032,2032-07-10
12/10-1993,1993-10-12
4:4:2000,2000-04-04
2002-12-1,2002-12-01
8 July 1998,1998-07-08
1/27/1993,1993-01-27
7/4-2006,2006-04-07
7/6-2012,2012-06-07
"July 20, 2004",2004-07-20
25-3-2031,2031-03-25
ngày 16 tháng 5 năm 1996,1996-05-16
2030/8,2030-08-24
27/10/11,2011-10-27
2001-3-22,2001-03-22
ngày 2 tháng 2 năm 2019,2019-02-02
Feb 22 09,2009-02-22
16:1:2032,2032-01-16
23 May 2011,2011-05-23
"July 4, 2020",2020-07-04
5/7-2025,2025-07-05
6:7:2015,2015-07-06
5/24/2002,2002-05-24
11011994,1994-01-11
10:1:2002,2002-01-10
Jan 17 35,2035-01-17
25/2/05,2005-02-25
26-1-2022,2022-01-26
16.3.2005,2005-03-16
19 December 1994,1994-12-19
27-5-2027,2027-05-27
8 Feb 2025,2025-02-08
ngày 11 tháng 7 năm 2034,2034-07-11
2 Ma 2018,2018-03-02
19/12/1997,1997-12-19
27th of September 2011,2011-09-27
12-4,2016-04-12
02052027,2027-05-02
4.4.1996,1996-04-04
19/12-1998,1998-12-19
10:11:2017,2017-11-10
"May 1st, 2014",2014-05-01
18 Ju 2024,2024-06-18
Jan 5 34,2034-01-05
20/11/2020,2020-11-20
17/3-2028,2028-03-17
25 tháng 4 năm 2002,2002-04-25
28/8/2006,2006-08-28
28 tháng 12 năm 2028,2028-12-28
2006-5-9,2006-05-09
2015/6/23,2015-06-23
24/11/03,2003-11-24
9th of November 2004,2004-11-09
"September 1, 2020",2020-09-01
5-13-06,2006-05-13
ngày 8 tháng 11 năm 2015,2015-11-08
25Feb1999,1999-02-25
21/22-2008,2008-11-21
5/24-2023,2023-12-05
03112005,2005-11-03
12042030,2030-04-12
ngày 8 tháng 11 năm 2001,2001-11-08
2/22/2006,2006-02-22
2025-1-26,2025-01-26
2-12-1991,1991-12-02
11/11/19,2019-11-11
8/7/2035,2035-08-07
2024-12-23,2024-12-23
23 Ap 2012,2012-04-23
14/8/31,2031-08-14
7 Aug 2005,2005-08-07
23 October 2020,2020-10-23
16 De 2019,2019-12-16
10th of May 1994,1994-05-10
14-7-2033,2033-07-14
23/10-2011,2011-10-23
26/9-2003,2003-09-26
1-12-27,2027-01-12
"Apr 24th, 1993",1993-04-24
24/1-1996,1996-01-24
2 Oct 2014,2014-10-02
9/9-1994,1994-09-09
10Mar2021,2021-03-10
20-8-2028,2028-08-20
26/11-2017,2017-11-26
"August 20, 2002",2002-08-20
2010-6-19,2010-06-19
2012/7/20,2012-07-20
14-9,2023-09-14
14/22-1998,1998-11-14
12/24/2032,2032-12-24
14 tháng 11 năm 2027,2027-11-14
23 August 1995,1995-08-23
3/4-1991,1991-02-03
5 November 2020,2020-11-05
8-1-2031,2031-01-08
1998/9/27,1998-09-27
7 April 2030,2030-04-07
18Aug2028,2028-08-18
36-7-2017,2017-07-18
8 January 2004,2004-01-08
16/6/2013,2013-06-16
ngày 15 tháng 6 năm 2031,2031-06-15
19-1,2011-01-19
2025/8,2025-08-01
Mar 2 05,2005-03-02
"Sep 23th, 2012",2012-09-23
17 Ju 1990,1990-06-17
26th of January 2003,2003-01-26
16/3/2018,2018-01-16
22 Oc 2012,2012-10-22
27-12-2027,2027-12-27
ngày 15 tháng 5 năm 2019,2019-05-15
"March 25, 2019",2019-03-25
1994-12-16,1994-12-16
24/4/1990,1990-04-24
28 tháng 1 năm 2032,2032-01-28
"Nov 25th, 2033",2033-11-25
17 Feb 2029,2029-02-17
20/18/2009,2009-06-20
20-6-2014,2014-06-20
13/12/97,1997-12-13
15-12-2023,2023-12-15
9/5/31,2031-09-05
17/24/2034,2034-08-17
22 Nov 2018,2018-11-22
18/3/00,2000-03-18
11/4-1990,1990-04-11
20/7/00,2000-07-20
23-1,2003-01-23
Jun 12 26,2026-06-12
12/12/2034,2034-12-12
10-11,2007-11-10
"November 20, 2021",2021-11-20
4/6-2033,2033-06-04
27-7,1997-07-27
10/9-2033,2033-09-10
18072003,2003-07-18
19/3-2007,2007-03-19
16/8-2029,2029-08-16
7th of June 1999,1999-06-07
04071998,1998-07-04
8-7-14,2014-08-07
19092032,2032-09-19
7:2:2011,2011-02-07
21.10.1994,1994-10-21
7 Se 2014,2014-09-07
"August 8, 2007",2007-08-08
27/24/2019,2019-08-27
7/27/2005,2005-07-27
24Sep2024,2024-09-24
"May 4th, 2012",2012-05-04
28-2-2012,2012-02-28
Mar 14 97,1997-03-14
21042033,2033-04-21
2/27/2019,2019-09-02
5-19-18,2018-05-19
10.2.2019,2019-02-10
12-23-31,2031-12-23
25:3:2026,2026-03-25
20 September 1992,1992-09-20
42-9-2023,2023-09-21
23/5/04,2004-05-23
19/6/1990,1990-02-19
21-10,1990-10-21
16/11-2026,2026-11-16
2/15/2003,2003-02-15
24Jan2013,2013-01-24
2028-10-27,2028-10-27
14th of January 2002,2002-01-14
21 May 1995,1995-05-21
2032/10,2032-10-01
3/16/2010,2010-03-16
2014/6/16,2014-06-16
3-28-30,2030-03-28
5:11:2029,2029-11-05
16:11:2031,2031-11-16
5 May 1993,1993-05-05
25092014,2014-09-25
18-5-2034,2034-05-09
26/3/2030,2030-01-26
15/8/2032,2032-08-15
9-4,2020-04-09
46-6-2022,2022-06-23
11-24-04,2004-11-24
24-5-2025,2025-05-24
26 Ma 2026,2026-05-26
19071994,1994-07-19
4/25/13,2013-04-25
27 Jul 2020,2020-07-27
4/21/2011,2011-04-21
27 Ju 2027,2027-07-27
2Mar1996,1996-03-02
4-10-2001,2001-10-04
4/30/2028,2028-10-04
3 May 2021,2021-05-03
"May 19th, 1995",1995-05-19
16 Oc 2018,2018-10-16
27:9:1992,1992-09-27
11/3/2013,2013-01-11
5 Nov 2001,2001-11-05
3-9-2013,2013-09-03
Jan 16 24,2024-01-16
18/6-2013,2013-06-18
"June 21, 2016",2016-06-21
2/1/2011,2011-02-01
3/23/1996,1996-03-23
4/6/28,2028-04-06
6-27-14,2014-06-27
3/11-1991,1991-11-03
14th of December 2007,2007-12-14
2/2-2034,2034-02-02
17/3/2007,2007-01-17
Apr 26 33,2033-04-26
1/28/15,2015-01-28
6-1-16,2016-06-01
23/2-2025,2025-02-23
6/14/31,2031-06-14
2026-7-21,2026-07-21
38-12-2020,2020-12-19
6-7-2021,2021-07-03
Sep 1 18,2018-09-01
10-11-2008,2008-11-05
5th of December 2008,2008-12-05
18-5-1997,1997-05-18
2033/7,2033-07-21
15 Ju 2014,2014-07-15
ngày 13 tháng 11 năm 2032,2032-11-13
9/12/2008,2008-09-12
48-7-1996,1996-07-24
5-15-90,1990-05-15
ngày 28 tháng 8 năm 2001,2001-08-28
3/15/2004,2004-05-03
2007/9/25,2007-09-25
9-6-2022,2022-06-09
3/6-2021,2021-06-03
14/12/2020,2020-12-14
9 October 1995,1995-10-09
23.4.2003,2003-04-23
11/3/90,1990-11-03
12:8:1996,1996-08-12
"Jun 9th, 1991",1991-06-09
16:9:1994,1994-09-16
3/17/2031,2031-03-17
11:1:2001,2001-01-11
16 No 2001,2001-11-16
22 Oct 1995,1995-10-22
2/22/1992,1992-02-22
26/7/06,2006-07-26
01091996,1996-09-01
Mar 12 19,2019-03-12
18/12/2027,2027-12-18
22/10/09,2009-10-22
1992/9/3,1992-09-03
21/6-2022,2022-06-21
"September 11, 1991",1991-09-11
13/2-1999,1999-01-13
14/14-2033,2033-07-14
10-2-2026,2026-02-10
7/17/2024,2024-07-17
1-13-09,2009-01-13
"Aug 23th, 2012",2012-08-23
11.1.2009,2009-01-11
17/4/05,2005-04-17
10:3:1990,1990-03-10
1-10-07,2007-01-10
1Apr2019,2019-04-01
14Apr1998,1998-04-14
05072002,2002-07-05
23 Oct 1992,1992-10-23
13/4-1990,1990-04-13
27Jul2019,2019-07-27
8/4-2021,2021-04-08
12Jun2026,2026-06-12
17/18-2024,2024-09-17
19 January 1992,1992-01-19
11/26/27,2027-11-26
13.6.2027,2027-06-13
14/16-2015,2015-08-14
12-8-2021,2021-08-12
17 July 2018,2018-07-17
7/6-2028,2028-06-07
12 tháng 11 năm 2000,2000-11-12
5/11-2016,2016-11-05
11 July 2019,2019-07-11
20/12-2020,2020-12-20
1998-2-25,1998-02-25
28/10-1990,1990-10-28
9 July 2003,2003-07-09
19/7/91,1991-07-19
2001/12/15,2001-12-15
14-7-1991,1991-07-14
22/18-2004,2004-09-22
14-4,2023-04-14
18-4-2002,2002-04-09
3 Fe 1991,1991-02-03
14/4-1999,1999-04-14
3 tháng 1 năm 2022,2022-01-03
5 April 2011,2011-04-05
1/3/2006,2006-01-03
28th of October 2032,2032-10-28
Jun 16 96,1996-06-16
11:9:2025,2025-09-11
5th of May 2025,2025-05-05
ngày 23 tháng 2 năm 2005,2005-02-23
2035-10-10,2035-10-10
6/9/12,2012-09-06
14th of July 1992,1992-07-14
1 tháng 12 năm 2020,2020-12-01
Feb 1 02,2002-02-01
ngày 16 tháng 4 năm 2021,2021-04-16
20 February 2010,2010-02-20
12/13/24,2024-12-13
Feb 14 15,2015-02-14
20/22-2021,2021-11-20
1992/4,1992-04-10
ngày 18 tháng 8 năm 2021,2021-08-18
4/1/06,2006-01-04
"April 25, 2003",2003-04-25
27-12-2031,2031-12-27
2027-2-10,2027-02-10
28-5,1993-05-28
23/10/14,2014-10-23
21 July 1992,1992-07-21
10.6.2025,2025-06-10
2022/9/3,2022-09-03
14 October 2009,2009-10-14
ngày 5 tháng 2 năm 2023,2023-02-05
3/23/1997,1997-03-23
1992/3,1992-03-25
20:9:2009,2009-09-20
2031-5-3,2031-05-03
"Feb 14th, 1995",1995-02-14
3 November 2026,2026-11-03
12/3/2016,2016-01-12
25/20-1993,1993-10-25
8-10-2017,2017-10-04
2030/4/3,2030-04-03
Apr 10 93,1993-04-10
4/5/2033,2033-04-05
10/5/2002,2002-05-10
26/7-2017,2017-07-26
7 Oct 2015,2015-10-07
24.12.2022,2022-12-24
22/6-1993,1993-06-22
20 Aug 2023,2023-08-20
"Oct 7th, 2007",2007-10-07
2 Dec 2009,2009-12-02
2032/3,2032-03-27
2009/2/10,2009-02-10
23/8-2035,2035-08-23
13th of August 2024,2024-08-13
23 tháng 6 năm 2027,2027-06-23
24022015,2015-02-24
17/4/2002,2002-04-17
1 Ju 2028,2028-06-01
15th of July 1995,1995-07-15
28 Oc 2010,2010-10-28
17/22-2019,2019-11-17
15.6.2010,2010-06-15
2-10-2030,2030-10-01
12-9-2015,2015-09-06
18/7/29,2029-07-18
5/8/91,1991-08-05
21/10/33,2033-10-21
12/3/96,1996-12-03
ngày 14 tháng 10 năm 2001,2001-10-14
5/4/11,2011-04-05
15th of January 2019,2019-01-15
22.10.1998,1998-10-22
25 Jul 1999,1999-07-25
20/1/2021,2021-01-20
10:4:2033,2033-04-10
6 May 2028,2028-05-06
9/27/95,1995-09-27
9/1-2033,2033-01-09
1996/1/20,1996-01-20
4/12/1990,1990-12-04
27-11,2006-11-27
4-13-20,2020-04-13
"June 2, 2014",2014-06-02
Oct 27 99,1999-10-27
5/5/2022,2022-05-05
3/4/2004,2004-04-03
13May1995,1995-05-13
18-12-1990,1990-12-18
4.11.2032,2032-11-04
11/26/94,1994-11-26
"Apr 18th, 1996",1996-04-18
1-25-04,2004-01-25
26:2:2029,2029-02-26
"Sep 10th, 2002",2002-09-10
26th of July 2000,2000-07-26
"September 17, 2020",2020-09-17
2010/1,2010-01-25
2015/9,2015-09-26
"September 28, 1999",1999-09-28
11-14-02,2002-11-14
24-11-1997,1997-11-24
Sep 13 30,2030-09-13
26/10-2015,2015-10-26
"October 10, 2006",2006-10-10
07042026,2026-04-07
4/27/2026,2026-09-04
5/2/12,2012-05-02
26-9-2027,2027-09-26
2/14/06,2006-02-14
7/2-2021,2021-02-07
9 November 1999,1999-11-09
26/11/14,2014-11-26
"May 7, 2000",2000-05-07
ngày 5 tháng 12 năm 2014,2014-12-05
26 tháng 5 năm 2027,2027-05-26
05042017,2017-04-05
5/5/30,2030-05-05
1-12-2002,2002-12-01
04092034,2034-09-04
6/24-2021,2021-12-06
3/24/24,2024-03-24
12 tháng 6 năm 2025,2025-06-12
2028-10-20,2028-10-20
"June 1, 1992",1992-06-01
1996/2,1996-02-26
11/11-1992,1992-11-11
10/1/2007,2007-10-01
"May 20th, 2016",2016-05-20
3/20-2024,2024-10-03
14112030,2030-11-14
6.8.2027,2027-08-06
8/8/2007,2007-08-08
12/18/2024,2024-06-12
12/30/2011,2011-10-12
"November 8, 2017",2017-11-08
"August 2, 2034",2034-08-02
13/5/2007,2007-05-13
18/9-2007,2007-09-18
6/20/2025,2025-06-20
"February 14, 2004",2004-02-14
13.1.2018,2018-01-13
26 Jun 2028,2028-06-26
5-11,2007-11-05
24/18/2023,2023-06-24
14 April 2009,2009-04-14
22.3.2002,2002-03-22
7 January 1990,1990-01-07
27/3-2011,2011-03-27
16.11.2009,2009-11-16
Oct 27 01,2001-10-27
3 Aug 2011,2011-08-03
11.4.2007,2007-04-11
3-3-27,2027-03-03
11-4-1997,1997-04-11
"February 17, 2002",2002-02-17
20/6-1998,1998-06-20
19-11-2035,2035-11-19
25 May 2022,2022-05-25
13 September 2032,2032-09-13
1998/6,1998-06-15
"June 28, 2020",2020-06-28
"October 4, 2005",2005-10-04
1999/9/4,1999-09-04
18/10/2011,2011-10-18
Nov 12 93,1993-11-12
26/22-1999,1999-11-26
6/30/2021,2021-10-06
14/10-2024,2024-10-14
"March 26, 2012",2012-03-26
8-27-29,2029-08-27
3/19/17,2017-03-19
10/18/25,2025-10-18
14Jan2018,2018-01-14
24/22-1994,1994-11-24
16/9/2022,2022-03-16
14/14-1995,1995-07-14
40-6-1998,1998-06-20
23/6/2007,2007-06-23
12th of August 2017,2017-08-12
27/15/2021,2021-05-27
2/12/2028,2028-12-02
14/33/2012,2012-11-14
1995-6-8,1995-06-08
9/5/2028,2028-05-09
9 Oct 2015,2015-10-09
16/9/2002,2002-09-16
ngày 20 tháng 6 năm 2028,2028-06-20
5 Oc 2028,2028-10-05
06041991,1991-04-06
2035-5-26,2035-05-26
11.4.1994,1994-04-11
27-3-1996,1996-03-27
"July 25, 2005",2005-07-25
4 Oc 2012,2012-10-04
7/6-2011,2011-06-07
1.12.2033,2033-12-01
9 tháng 8 năm 2021,2021-08-09
19032015,2015-03-19
9/1/14,2014-01-09
6 May 2019,2019-05-06
10th of September 2034,2034-09-10
10-6,1999-06-10
"July 7, 2031",2031-07-07
26.4.2032,2032-04-26
5/2/23,2023-02-05
25/18-2022,2022-09-25
23 tháng 12 năm 2011,2011-12-23
7/20/92,1992-07-20
9/18/1995,1995-06-09
7-9,2008-09-07
22:12:2016,2016-12-22
Jun 8 34,2034-06-08
11072026,2026-07-11
1992/5,1992-05-21
16Sep1999,1999-09-16
7/2/1997,1997-02-07
20/14-1991,1991-07-20
ngày 27 tháng 12 năm 2002,2002-12-27
23th of December 2015,2015-12-23
3 June 2021,2021-06-03
8/26/13,2013-08-26
19 tháng 2 năm 2008,2008-02-19
22/4-2032,2032-02-22
20 Mar 2033,2033-03-20
Mar 20 05,2005-03-20
2004/9/13,2004-09-13
2007/2/23,2007-02-23
26 April 2021,2021-04-26
16:5:2011,2011-05-16
3/17/2022,2022-03-17
2006-9-9,2006-09-09
9-8-23,2023-09-08
12 De 2012,2012-12-12
25/22-2017,2017-11-25
ngày 20 tháng 5 năm 2035,2035-05-20
27071991,1991-07-27
2031/1/14,2031-01-14
22-7-1996,1996-07-11
1Mar2004,2004-03-01
ngày 3 tháng 6 năm 2006,2006-06-03
17-6-2031,2031-06-17
10/24/2018,2018-08-10
2011/4/8,2011-04-08
3-8,1996-08-03
18/10/13,2013-10-18
1997/1/9,1997-01-09
14th of October 2004,2004-10-14
18 Ap 2023,2023-04-18
24/11/19,2019-11-24
12/10/95,1995-10-12
15Sep2006,2006-09-15
20/2-2035,2035-02-20
28 De 1998,1998-12-28
ngày 15 tháng 10 năm 2003,2003-10-15
12-23-09,2009-12-23
7/2/31,2031-02-07
Nov 13 98,1998-11-13
2030/4,2030-04-11
22/8-2012,2012-08-22
19 January 2011,2011-01-19
16/7-2027,2027-07-16
"May 19th, 2005",2005-05-19
2034/1/10,2034-01-10
2025/6,2025-06-19
25:4:1994,1994-04-25
2/8-2025,2025-08-02
15Apr1991,1991-04-15
6/10-2032,2032-05-06
26-5,2025-05-26
7/24-2007,2007-12-07
3 August 1996,1996-08-03
10.5.2032,2032-05-10
20/12-2005,2005-12-20
Apr 21 03,2003-04-21
24/9/2002,2002-03-24
13/9/2031,2031-03-13
1 tháng 12 năm 2010,2010-12-01
27/12/21,2021-12-27
16/6/2023,2023-06-16
11/4/31,2031-11-04
5/6/2032,2032-05-06
2026/10/3,2026-10-03
20-8-1992,1992-08-20
26 tháng 4 năm 2000,2000-04-26
02081991,1991-08-02
8:11:2005,2005-11-08
26/5-1995,1995-05-26
6th of February 2026,2026-02-06
20/8-1992,1992-08-20
18:9:2000,2000-09-18
2-2-2028,2028-02-01
17 November 2022,2022-11-17
24/1/02,2002-01-24
"December 16, 2028",2028-12-16
4-4-2023,2023-04-02
28/10/17,2017-10-28
8/6-2010,2010-06-08
2/2/2026,2026-02-02
May 22 13,2013-05-22
11 Dec 2011,2011-12-11
2 Ju 2023,2023-06-02
26/10/25,2025-10-26
26/2/21,2021-02-26
26Mar2028,2028-03-26
10-2,2020-02-10
26/27/2028,2028-09-26
15-9,2035-09-15
23022025,2025-02-23
2002/2/21,2002-02-21
Jul 13 93,1993-07-13
21 Ap 2012,2012-04-21
"February 12, 2020",2020-02-12
2031/12,2031-12-09
2035/10/4,2035-10-04
2026-1-22,2026-01-22
06072022,2022-07-06
18 De 2030,2030-12-18
01121992,1992-12-01
5-27-09,2009-05-27
1998-4-16,1998-04-16
23-8-2032,2032-08-23
5/16-2001,2001-08-05
2007/2,2007-02-21
8Mar2028,2028-03-08
4Mar2020,2020-03-04
20/8-2003,2003-08-20
20-6-1991,1991-06-10
Dec 13 95,1995-12-13
13/18-2015,2015-09-13
11/24-2020,2020-12-11
14 tháng 2 năm 2004,2004-02-14
ngày 19 tháng 1 năm 2027,2027-01-19
8 tháng 2 năm 2005,2005-02-08
48-12-2029,2029-12-24
27th of October 2006,2006-10-27
2033-1-28,2033-01-28
10/19/2017,2017-10-19
25 February 2029,2029-02-25
20/9/31,2031-09-20
6/17/22,2022-06-17
11/3/2028,2028-03-11
36-4-1997,1997-04-18
23-4,2002-04-23
6/1-2015,2015-01-06
17/10-1998,1998-05-17
27/5/2012,2012-05-27
12/14/26,2026-12-14
7May2027,2027-05-07
5/1/18,2018-05-01
26:9:2027,2027-09-26
1/11/28,2028-11-01
26-5-2018,2018-05-26
2001-12-9,2001-12-09
7-23-29,2029-07-23
46-7-2024,2024-07-23
"Jan 3rd, 2001",2001-01-03
8/10-2031,2031-05-08
10/19/2010,2010-10-19
28/10-2012,2012-10-28
13/12/12,2012-12-13
"June 25, 2028",2028-06-25
26.10.2012,2012-10-26
2031/5/19,2031-05-19
3:9:2016,2016-09-03
27-4,1997-04-27
4/8/2003,2003-08-04
8/4-2030,2030-04-08
3/2/2016,2016-03-02
"December 5, 1999",1999-12-05
ngày 2 tháng 11 năm 2032,2032-11-02
7:9:2009,2009-09-07
15 Feb 2012,2012-02-15
25-4-2029,2029-04-25
12/6/2014,2014-02-12
15/2-2016,2016-02-15
5/5/00,2000-05-05
27 September 2008,2008-09-27
2/18/1992,1992-02-18
14 November 2028,2028-11-14
1997-9-22,1997-09-22
2016/11/24,2016-11-24
12/7/08,2008-07-12
"July 12, 2017",2017-07-12
"February 8, 2025",2025-02-08
12/10/2029,2029-10-12
2030/1,2030-01-17
4-12,2019-12-04
22/7-2007,2007-07-22
Aug 10 23,2023-08-10
25 Apr 1997,1997-04-25
26th of November 1993,1993-11-26
22 tháng 12 năm 1990,1990-12-22
26th of April 2017,2017-04-26
2/2-2025,2025-01-02
Feb 11 16,2016-02-11
19th of April 2026,2026-04-19
"Feb 28th, 2014",2014-02-28
May 23 29,2029-05-23
8/24-2033,2033-12-08
2 June 2001,2001-06-02
8-8,2007-08-08
30-7-2026,2026-07-15
11/2-2023,2023-01-11
12/22/1996,1996-12-22
18/11/2009,2009-11-18
7-22-22,2022-07-22
26 Ja 2029,2029-01-26
13 August 2031,2031-08-13
3/2/2031,2031-03-02
6:7:2029,2029-07-06
4:1:2026,2026-01-04
7/11/1990,1990-11-07
"Apr 12th, 2021",2021-04-12
6/14-2017,2017-07-06
8-22-17,2017-08-22
11/5/1993,1993-11-05
ngày 28 tháng 8 năm 2004,2004-08-28
2Oct1999,1999-10-02
26 tháng 12 năm 2006,2006-12-26
16/16-2018,2018-08-16
18-11-2003,2003-11-18
4 December 1998,1998-12-04
8/8/1996,1996-08-08
9/3/32,2032-03-09
9 Jan 2002,2002-01-09
23-10-2020,2020-10-23
17Dec2000,2000-12-17
ngày 26 tháng 10 năm 2002,2002-10-26
11-5-14,2014-11-05
01121993,1993-12-01
12Apr2022,2022-04-12
12-3-21,2021-12-03
2015-10-2,2015-10-02
7/1-1990,1990-01-07
12/4-2006,2006-04-12
2006-12-14,2006-12-14
2015/11/22,2015-11-22
12th of September 2022,2022-09-12
ngày 15 tháng 7 năm 2005,2005-07-15
2004-6-13,2004-06-13
2/7/28,2028-07-02
24:3:2024,2024-03-24
"April 9, 2004",2004-04-09
18/12/32,2032-12-18
6/6/03,2003-06-06
17/9/2007,2007-03-17
3-7-17,2017-03-07
18Sep2007,2007-09-18
15 Ma 2026,2026-05-15
22/20-1998,1998-10-22
5/21/2031,2031-07-05
17.2.2028,2028-02-17
1 tháng 12 năm 2032,2032-12-01
5/2/94,1994-02-05
2/11/25,2025-11-02
22/30/1996,1996-10-22
7/11/2028,2028-11-07
4:10:2015,2015-10-04
10/33/2030,2030-11-10
2/9/05,2005-09-02
25Aug2014,2014-08-25
9/8/2003,2003-09-08
4-10-2011,2011-10-04
1 June 2018,2018-06-01
16May2015,2015-05-16
24 Fe 1992,1992-02-24
"June 25, 2008",2008-06-25
22-5,2016-05-22
17 tháng 3 năm 2017,2017-03-17
25-10,1997-10-25
27061994,1994-06-27
2016/2/2,2016-02-02
16-10-2003,2003-10-16
"Feb 26th, 1993",1993-02-26
5May2007,2007-05-05
2005-7-11,2005-07-11
20 De 2025,2025-12-20
12/2/26,2026-12-02
3-5-99,1999-03-05
16-12-2027,2027-12-16
1 December 2000,2000-12-01
26/3/20,2020-03-26
14/3/2024,2024-01-14
10 September 1996,1996-09-10
2020/1/22,2020-01-22
18th of September 2017,2017-09-18
28Nov2034,2034-11-28
"Jun 27th, 1995",1995-06-27
6/11/98,1998-11-06
18 July 1998,1998-07-18
14th of June 2014,2014-06-14
Jul 11 94,1994-07-11
18/20-1995,1995-10-18
2029/7,2029-07-26
19 Ma 2029,2029-05-19
12/1/22,2022-01-12
56-7-2013,2013-07-28
16Jul2024,2024-07-16
"Jul 10th, 2035",2035-07-10
6/7/10,2010-07-06
12/23/2012,2012-12-23
11/26/26,2026-11-26
5:11:2035,2035-11-05
6/12/00,2000-12-06
1997/2,1997-02-12
15/5-2033,2033-05-15
24 tháng 12 năm 1996,1996-12-24
4-8-33,2033-04-08
Mar 5 99,1999-03-05
2-10,2013-10-02
"December 23, 2022",2022-12-23
2010/9,2010-09-02
6-6-12,2012-06-06
3/6/17,2017-03-06
5-3-1995,1995-03-05
11/5-2024,2024-05-11
5/10-2029,2029-05-05
Dec 1 15,2015-12-01
19 Jul 2022,2022-07-19
"December 26, 1991",1991-12-26
22-8-2000,2000-08-11
21/9-2002,2002-09-21
24 tháng 1 năm 2007,2007-01-24
10/10/15,2015-10-10
15032030,2030-03-15
16/1/09,2009-01-16
27/4-2016,2016-04-27
06112003,2003-11-06
5 tháng 6 năm 2007,2007-06-05
23/4/33,2033-04-23
11th of June 2030,2030-06-11
22012010,2010-01-22
19-11,2030-11-19
28/9/1995,1995-09-28
6-16-14,2014-06-16
14-9,2011-09-14
24 Jan 1992,1992-01-24
4:4:2021,2021-04-04
17 tháng 8 năm 2005,2005-08-17
ngày 22 tháng 1 năm 2028,2028-01-22
11-8,1993-08-11
10/5-1998,1998-05-10
15-1,1999-01-15
2/30/2027,2027-10-02
9May1996,1996-05-09
23/2-2002,2002-02-23
14/12/04,2004-12-14
2033/12/28,2033-12-28
2019/4,2019-04-11
1/36/2027,2027-12-01
2031/9/27,2031-09-27
20:4:2027,2027-04-20
16.2.2031,2031-02-16
12/4/09,2009-04-12
2032-1-26,2032-01-26
May 24 28,2028-05-24
24/5/17,2017-05-24
13.10.1994,1994-10-13
4 February 2010,2010-02-04
"Nov 10th, 1993",1993-11-10
15.12.1994,1994-12-15
8/24/27,2027-08-24
7.12.1993,1993-12-07
25:9:2022,2022-09-25
ngày 12 tháng 11 năm 2001,2001-11-12
19052011,2011-05-19
21 Ma 2016,2016-03-21
2 October 2025,2025-10-02
"Dec 4th, 2029",2029-12-04
2035-10-8,2035-10-08
"July 16, 2004",2004-07-16
2008-4-12,2008-04-12
16Sep1999,1999-09-16
"Mar 25th, 2021",2021-03-25
"Aug 5th, 2033",2033-08-05
2032/11,2032-11-11
2016-5-13,2016-05-13
"January 26, 2008",2008-01-26
22th of November 2013,2013-11-22
28-6-2006,2006-06-14
"March 8, 2004",2004-03-08
11-12,2016-12-11
5 Ap 2014,2014-04-05
5-7-2035,2035-07-05
18/8/27,2027-08-18
8/22-2017,2017-11-08
13 August 2023,2023-08-13
16 Ju 2035,2035-06-16
15-5,2027-05-15
10/13/19,2019-10-13
Mar 24 28,2028-03-24
8/11-2029,2029-11-08
"December 4, 2016",2016-12-04
12092013,2013-09-12
2002/4,2002-04-21
20 July 2005,2005-07-20
ngày 2 tháng 7 năm 2002,2002-07-02
10th of January 2009,2009-01-10
3/20/02,2002-03-20
3/9/1995,1995-03-09
8-5-97,1997-08-05
Apr 9 32,2032-04-09
4-1-2004,2004-01-04
18th of August 2028,2028-08-18
4/33/2013,2013-11-04
15th of September 2012,2012-09-15
2031-8-22,2031-08-22
18-1,2021-01-18
2/18/2022,2022-06-02
2031/7/23,2031-07-23
1/27/01,2001-01-27
48-5-2026,2026-05-24
16-5-1995,1995-05-16
07042020,2020-04-07
7-11-05,2005-07-11
24/10/20,2020-10-24
6/2/05,2005-02-06
28/8-1990,1990-08-28
2015/1/1,2015-01-01
3 Oct 2001,2001-10-03
7.12.2035,2035-12-07
14-6-1991,1991-06-07
2028-7-12,2028-07-12
20:7:2026,2026-07-20
19/21/2008,2008-07-19
7/12-2024,2024-06-07
11/12/2031,2031-12-11
2025/3,2025-03-23
8/6/94,1994-08-06
3/2/2000,2000-02-03
ngày 22 tháng 11 năm 2009,2009-11-22
10th of April 1997,1997-04-10
18/9/2033,2033-09-18
24 Jul 1998,1998-07-24
2/4/1996,1996-02-04
10-5-2003,2003-05-05
6 Aug 2030,2030-08-06
28-12-2022,2022-12-14
2013-10-23,2013-10-23
1999/5,1999-05-28
10-11,2011-11-10
8-4-2033,2033-04-04
Apr 5 18,2018-04-05
2/3/97,1997-02-03
6/13/2010,2010-06-13
10 Ju 1995,1995-06-10
4/1/11,2011-01-04
2004/6/12,2004-06-12
17/4-2024,2024-04-17
3 tháng 9 năm 1997,1997-09-03
12 Fe 2003,2003-02-12
12 October 2013,2013-10-12
2005/9,2005-09-01
26/9/24,2024-09-26
21Feb2017,2017-02-21
01102030,2030-10-01
14-7-2025,2025-07-14
23/3/07,2007-03-23
20/3/32,2032-03-20
12/9/2010,2010-03-12
5-5,2021-05-05
ngày 28 tháng 12 năm 2030,2030-12-28
4-25-91,1991-04-25
2014/12,2014-12-02
2030/1,2030-01-10
9-11,1998-11-09
"Nov 24th, 2005",2005-11-24
16/8/10,2010-08-16
Apr 28 92,1992-04-28
8/1/17,2017-08-01
"Apr 14th, 2005",2005-04-14
Feb 20 92,1992-02-20
16 Ma 2015,2015-03-16
50-10-2031,2031-10-25
1998-12-15,1998-12-15
24/8-2012,2012-08-24
2011/3,2011-03-20
1-6-31,2031-01-06
14/22-1993,1993-11-14
2001-6-23,2001-06-23
"February 10, 2035",2035-02-10
4/7/1993,1993-07-04
4/25/97,1997-04-25
22 Aug 2024,2024-08-22
1995-4-4,1995-04-04
08052019,2019-05-08
28/6-2012,2012-03-28
6/19/91,1991-06-19
23/7/97,1997-07-23
2029-11-2,2029-11-02
1/11-2003,2003-11-01
21 Ma 1990,1990-05-21
4/26/91,1991-04-26
21/1/1990,1990-01-21
21 tháng 11 năm 2030,2030-11-21
12/9/2015,2015-12-09
1991-10-2,1991-10-02
19Oct1992,1992-10-19
6/18-2011,2011-09-06
4/11/14,2014-04-11
18th of July 1995,1995-07-18
ngày 26 tháng 3 năm 2024,2024-03-26
27/16-1995,1995-08-27
"November 10, 2017",2017-11-10
3/11/21,2021-03-11
26 Ma 2013,2013-05-26
22/4/1992,1992-04-22
2020/5,2020-05-16
12 Fe 2002,2002-02-12
2025-6-1,2025-06-01
"August 9, 2019",2019-08-09
3 Mar 2030,2030-03-03
24:9:2030,2030-09-24
3.11.2035,2035-11-03
8 Dec 2008,2008-12-08
2/21/2006,2006-02-21
2034-12-26,2034-12-26
4/6/02,2002-06-04
4 No 2010,2010-11-04
24/6-1990,1990-06-24
21 tháng 1 năm 2024,2024-01-21
16 tháng 4 năm 2016,2016-04-16
19th of March 2007,2007-03-19
2018-5-5,2018-05-05
5.4.2017,2017-04-05
54-9-1997,1997-09-27
28/5/31,2031-05-28
22-3,2014-03-22
50-3-2006,2006-03-25
9/25/2011,2011-09-25
8/10/97,1997-10-08
9/18/2025,2025-06-09
19 tháng 11 năm 2000,2000-11-19
1-12-2017,2017-12-01
1998/6,1998-06-17
1/16/2034,2034-01-16
6/7/1999,1999-06-07
11/11/21,2021-11-11
10 March 2010,2010-03-10
19/1-2021,2021-01-19
13/12-2010,2010-12-13
27-11,2032-11-27
10-27-31,2031-10-27
2015/7,2015-07-12
28/27/2003,2003-09-28
2021/4,2021-04-07
25 June 2009,2009-06-25
"April 5, 2031",2031-04-05
9/2/2017,2017-09-02
1997/9/13,1997-09-13
27:8:2011,2011-08-27
25-8-1993,1993-08-25
20th of December 1997,1997-12-20
27 De 2030,2030-12-27
2024/7,2024-07-07
ngày 6 tháng 9 năm 2010,2010-09-06
22/4-2014,2014-04-22
2-3-30,2030-02-03
1994/11,1994-11-05
3:4:2028,2028-04-03
4-6,1998-06-04
19 Jan 1997,1997-01-19
26/33/2035,2035-11-26
6/8/1998,1998-06-08
12/3/90,1990-03-12
1996/6,1996-06-17
10/12-2029,2029-12-10
1/27/2008,2008-09-01
22-10-2011,2011-10-11
13 tháng 8 năm 2023,2023-08-13
22/7/01,2001-07-22
4/27/15,2015-04-27
"Mar 18th, 2019",2019-03-18
2016/8,2016-08-05
9/13/2008,2008-09-13
14/9/2025,2025-09-14
11/2-2017,2017-01-11
2006/7,2006-07-21
12-12-2027,2027-12-12
28-9-2004,2004-09-28
2030/7,2030-07-24
1-9,1998-09-01
6-3,2025-03-06
20/8-2021,2021-08-20
ngày 22 tháng 7 năm 1991,1991-07-22
"August 25, 1990",1990-08-25
05122028,2028-12-05
26 Oct 2028,2028-10-26
1/5-2016,2016-05-01
2 September 1996,1996-09-02
2/3/29,2029-03-02
"Dec 9th, 2008",2008-12-09
2025-3-28,2025-03-28
19/9-1990,1990-09-19
Dec 28 09,2009-12-28
"Mar 17th, 2020",2020-03-17
28 Ju 1996,1996-07-28
ngày 14 tháng 4 năm 2018,2018-04-14
2027/9/12,2027-09-12
1994/2/19,1994-02-19
9/10/27,2027-10-09
7-10-2030,2030-10-07
"Sep 21th, 2000",2000-09-21
2009/8,2009-08-08
27/9-2000,2000-09-27
8.2.2011,2011-02-08
"Nov 18th, 1999",1999-11-18
2/10/2012,2012-10-02
Sep 20 94,1994-09-20
7/6/07,2007-06-07
"Mar 28th, 2009",2009-03-28
28-2-2018,2018-02-28
25 De 2033,2033-12-25
2 Mar 1992,1992-03-02
8 Feb 2004,2004-02-08
2018/1/25,2018-01-25
21 tháng 5 năm 1997,1997-05-21
17-2-2026,2026-02-17
"May 11, 1993",1993-05-11
16 tháng 11 năm 2001,2001-11-16
25th of August 2002,2002-08-25
26 tháng 12 năm 2028,2028-12-26
1996/1/15,1996-01-15
22-1-2034,2034-01-11
16.2.2008,2008-02-16
9-2,2002-02-09
2-5,2005-05-02
26-8,1999-08-26
5-12,1995-12-05
27/10-1998,1998-10-27
3/25/97,1997-03-25
12/25/33,2033-12-25
"January 15, 2009",2009-01-15
1 January 1993,1993-01-01
"June 13, 2015",2015-06-13
20 May 2003,2003-05-20
4 Nov 1991,1991-11-04
2020/9,2020-09-16
14/11/05,2005-11-14
5/1/01,2001-01-05
7 Ma 2017,2017-05-07
9/9/2015,2015-09-09
27-8,2010-08-27
7-4-2006,2006-04-07
23.2.2013,2013-02-23
2035/6/13,2035-06-13
3/24/29,2029-03-24
14:10:2029,2029-10-14
28/4/96,1996-04-28
14102029,2029-10-14
2027-5-1,2027-05-01
28Jun2008,2008-06-28
2032/11/17,2032-11-17
1994-1-19,1994-01-19
1997/4,1997-04-04
48-3-2001,2001-03-24
12 tháng 11 năm 1993,1993-11-12
27-3-2014,2014-03-27
10.4.1995,1995-04-10
"July 9, 2007",2007-07-09
5 tháng 2 năm 1993,1993-02-05
5Feb2032,2032-02-05
9.4.2008,2008-04-09
22/5-2008,2008-05-22
25 De 2027,2027-12-25
2025-9-12,2025-09-12
2010/8,2010-08-06
11/9/2034,2034-11-09
1999/2/13,1999-02-13
Jan 21 23,2023-01-21
13/24-2011,2011-12-13
11Jun2034,2034-06-11
2017/12,2017-12-09
20th of April 2023,2023-04-20
"Apr 14th, 2007",2007-04-14
16 Nov 2024,2024-11-16
22/4/17,2017-04-22
"Aug 26th, 1999",1999-08-26
26/5/2004,2004-05-26
4 Ju 2009,2009-07-04
26-8-1994,1994-08-13
7-6-2009,2009-06-07
1990/12,1990-12-23
8 tháng 2 năm 2032,2032-02-08
13121996,1996-12-13
"Apr 21th, 2010",2010-04-21
19/7/2000,2000-07-19
12/24/2008,2008-08-12
13 October 2023,2023-10-13
54-11-1992,1992-11-27
4 tháng 4 năm 2022,2022-04-04
14-9-2022,2022-09-14
5-23-19,2019-05-23
13 March 2013,2013-03-13
18092032,2032-09-18
May 28 01,2001-05-28
12/2-2004,2004-02-12
4 No 2000,2000-11-04
5/26/25,2025-05-26
14-2,2021-02-14
18-12-1997,1997-12-09
2nd of January 1990,1990-01-02
6Aug2019,2019-08-06
7/8/20,2020-08-07
2020/6,2020-06-02
9/7/02,2002-07-09
2/23/2024,2024-02-23
2 Ju 1993,1993-06-02
10122035,2035-12-10
25/12/12,2012-12-25
8/30/2000,2000-10-08
26/12-2001,2001-06-26
2031/8,2031-08-20
2026-1-10,2026-01-10
04042008,2008-04-04
19/11/04,2004-11-19
2008/4,2008-04-24
19Jul1997,1997-07-19
17/3-2009,2009-03-17
12/8-2003,2003-04-12
25/21/1992,1992-07-25
10/5/98,1998-10-05
24 tháng 7 năm 2022,2022-07-24
22th of May 1995,1995-05-22
2011/9/25,2011-09-25
2032/12/13,2032-12-13
2008-4-21,2008-04-21
24 Jun 1995,1995-06-24
23 Jun 2001,2001-06-23
9/2/08,2008-02-09
1998-12-8,1998-12-08
25 June 2035,2035-06-25
28:6:1991,1991-06-28
6-7-1993,1993-07-03
21 tháng 1 năm 2030,2030-01-21
12-9-2025,2025-09-06
21 tháng 1 năm 2029,2029-01-21
5-12-93,1993-05-12
23/4-1998,1998-02-23
22 Dec 2020,2020-12-22
2015/10,2015-10-02
15 tháng 11 năm 2012,2012-11-15
2032-2-22,2032-02-22
Apr 1 20,2020-04-01
28th of August 2026,2026-08-28
ngày 28 tháng 8 năm 2030,2030-08-28
5/5/16,2016-05-05
26/7/90,1990-07-26
2025/1/25,2025-01-25
23-3-2028,2028-03-23
2011/8/9,2011-08-09
28-9-2006,2006-09-28
28:5:1998,1998-05-28
Jul 25 16,2016-07-25
Aug 8 26,2026-08-08
3 Oct 2028,2028-10-03
9/2-2020,2020-01-09
12/2/09,2009-12-02
23/1-2016,2016-01-23
6-1-2027,2027-01-06
8 tháng 5 năm 2013,2013-05-08
25/14-2027,2027-07-25
13 Ju 2030,2030-06-13
9Dec2033,2033-12-09
8-16-22,2022-08-16
"Feb 9th, 2027",2027-02-09
44-4-1994,1994-04-22
5-28-11,2011-05-28
2030/11,2030-11-26
ngày 2 tháng 9 năm 2008,2008-09-02
"Jan 11th, 2009",2009-01-11
Dec 27 93,1993-12-27
25/8-2015,2015-08-25
6/7/2001,2001-07-06
2019/4/2,2019-04-02
19-2-1990,1990-02-19
Sep 15 00,2000-09-15
24 November 2006,2006-11-24
17/9-2015,2015-09-17
11/6-2021,2021-03-11
2/22-2012,2012-11-02
"October 6, 2009",2009-10-06
13/8-2032,2032-08-13
23-2,2008-02-23
"Feb 23th, 2035",2035-02-23
2012/1,2012-01-11
2006/4/13,2006-04-13
"Dec 24th, 2014",2014-12-24
2016-8-17,2016-08-17
2-22-35,2035-02-22
Apr 28 13,2013-04-28
16/7/2013,2013-07-16
8/21/2019,2019-07-08
20/9/07,2007-09-20
27-2,1991-02-27
15/5/26,2026-05-15
6/13/00,2000-06-13
2027-6-7,2027-06-07
2028/5/9,2028-05-09
1/19/1999,1999-01-19
16082015,2015-08-16
11-9-2033,2033-09-11
2002/11,2002-11-13
21-2,2014-02-21
2035-3-8,2035-03-08
ngày 18 tháng 11 năm 2030,2030-11-18
5-6-00,2000-05-06
8th of January 1993,1993-01-08
17-3,1993-03-17
18081990,1990-08-18
16 September 2031,2031-09-16
2011/7/4,2011-07-04
9th of December 2021,2021-12-09
14/6-2035,2035-06-14
7Nov2013,2013-11-07
13012012,2012-01-13
19/11-2019,2019-11-19
5 Se 2005,2005-09-05
9-3-06,2006-09-03
"August 22, 2027",2027-08-22
23/30/2033,2033-10-23
2023/7,2023-07-07
15 July 2027,2027-07-15
9.6.1994,1994-06-09
18102022,2022-10-18
2-11-1999,1999-11-01
25.5.2014,2014-05-25
5/1-2006,2006-01-05
4.1.2013,2013-01-04
11/25/29,2029-11-25
14 tháng 12 năm 1990,1990-12-14
1 Apr 1992,1992-04-01
16/6-2017,2017-03-16
12/10-2022,2022-10-12
10 Sep 1993,1993-09-10
13 No 1991,1991-11-13
Jun 10 94,1994-06-10
05122014,2014-12-05
2014/1,2014-01-02
8/23/01,2001-08-23
13 Oct 2033,2033-10-13
21 Apr 2008,2008-04-21
2nd of February 1990,1990-02-02
4/3/2035,2035-03-04
3/2/03,2003-02-03
10-1-2005,2005-01-05
18Oct2009,2009-10-18
21 February 2010,2010-02-21
8-6-22,2022-08-06
22Oct2027,2027-10-22
7 tháng 12 năm 2017,2017-12-07
21 Apr 2032,2032-04-21
2027/12,2027-12-20
1-12-93,1993-01-12
18.2.2022,2022-02-18
2007/2/21,2007-02-21
40-5-2027,2027-05-20
26 May 2011,2011-05-26
6 tháng 10 năm 2007,2007-10-06
2008/8/14,2008-08-14
1996/3,1996-03-19
46-11-2008,2008-11-23
26.10.2026,2026-10-26
4/30/2002,2002-10-04
2020/5,2020-05-10
28 March 1998,1998-03-28
21/2/33,2033-02-21
26:3:2014,2014-03-26
"September 9, 2013",2013-09-09
2002-2-26,2002-02-26
24/11/05,2005-11-24
24 tháng 4 năm 2031,2031-04-24
1994/3/15,1994-03-15
11/1/30,2030-01-11
23/9/2003,2003-03-23
"December 2, 2015",2015-12-02
4-15-33,2033-04-15
Feb 23 29,2029-02-23
23/9-2026,2026-09-23
ngày 17 tháng 11 năm 2016,2016-11-17
18.3.1990,1990-03-18
12-18-15,2015-12-18
3 Ap 1999,1999-04-03
10.4.2005,2005-04-10
21/2/29,2029-02-21
1/15/2018,2018-01-15
8/10/95,1995-10-08
24/11-2019,2019-11-24
8/7-1994,1994-07-08
6/10/95,1995-10-06
28:9:2012,2012-09-28
25.2.2000,2000-02-25
27 tháng 7 năm 2002,2002-07-27
4/2/32,2032-02-04
19Oct2008,2008-10-19
17/5/33,2033-05-17
16/3/1999,1999-03-16
1/6-2022,2022-06-01
1-27-92,1992-01-27
4Dec1998,1998-12-04
2/7/14,2014-07-02
ngày 9 tháng 1 năm 2017,2017-01-09
24/6/2029,2029-02-24
2 Aug 1997,1997-08-02
Oct 12 05,2005-10-12
ngày 26 tháng 5 năm 2000,2000-05-26
2/11/23,2023-02-11
2002/4/10,2002-04-10
9/12-2025,2025-06-09
28-6-2024,2024-06-14
23/10-2031,2031-10-23
2017/12,2017-12-28
1996/7,1996-07-01
9:10:2017,2017-10-09
46-6-2015,2015-06-23
13102001,2001-10-13
3:1:2008,2008-01-03
"Apr 14th, 2023",2023-04-14
20082033,2033-08-20
2/5/17,2017-02-05
28 tháng 7 năm 2010,2010-07-28
16/9-1990,1990-09-16
5/20/90,1990-05-20
2033/9/12,2033-09-12
27/16-2013,2013-08-27
"Jun 25th, 2004",2004-06-25
10/2/18,2018-10-02
1/27/1991,1991-01-27
"November 28, 2033",2033-11-28
21-5,2004-05-21
"Nov 8th, 2035",2035-11-08
8-9-2019,2019-09-04
18.7.2030,2030-07-18
4/1/2010,2010-01-04
14Nov2016,2016-11-14
19/1/92,1992-01-19
6 Fe 2002,2002-02-06
25/3-2008,2008-03-25
17Dec1994,1994-12-17
1996-2-27,1996-02-27
11th of September 1990,1990-09-11
1 July 1999,1999-07-01
1998/4,1998-04-12
24 De 1991,1991-12-24
26th of July 2025,2025-07-26
19.2.2012,2012-02-19
20 Ma 2026,2026-03-20
27:12:2009,2009-12-27
10112021,2021-11-10
12/11/93,1993-12-11
16/3-2014,2014-03-16
5/8/23,2023-08-05
1 tháng 5 năm 2025,2025-05-01
06102018,2018-10-06
52-10-1990,1990-10-26
13th of August 2009,2009-08-13
9.6.2034,2034-06-09
"March 10, 2017",2017-03-10
10/4/2027,2027-10-04
19/6-2033,2033-03-19
10-14-04,2004-10-14
"Jul 23th, 2004",2004-07-23
22/6-2019,2019-03-22
1993-7-4,1993-07-04
"July 8, 2032",2032-07-08
3/4-2002,2002-02-03
1995-8-12,1995-08-12
"August 15, 2028",2028-08-15
ngày 2 tháng 10 năm 2033,2033-10-02
23/8/28,2028-08-23
18.10.2033,2033-10-18
6 Oct 2031,2031-10-06
1999/10,1999-10-10
1997/11/18,1997-11-18
2021/8/1,2021-08-01
27-1-1999,1999-01-27
15 Jun 1998,1998-06-15
19-5,2020-05-19
2nd of August 2009,2009-08-02
11th of August 2010,2010-08-11
9/4-2031,2031-04-09
"July 27, 2006",2006-07-27
7/21/2033,2033-07-07
2:7:2031,2031-07-02
17/5/2029,2029-05-17
12-18-10,2010-12-18
18 Ap 2035,2035-04-18
1:6:2002,2002-06-01
19/18/2015,2015-06-19
10Jul2032,2032-07-10
1.1.2017,2017-01-01
8/24/2012,2012-08-24
"June 13, 1997",1997-06-13
20/10/2003,2003-10-20
ngày 7 tháng 10 năm 2012,2012-10-07
24.4.2032,2032-04-24
54-7-2032,2032-07-27
2000-11-22,2000-11-22
26th of November 1991,1991-11-26
"Nov 4th, 1990",1990-11-04
4:6:2022,2022-06-04
19/6/2032,2032-06-19
2 No 2009,2009-11-02
20 Se 1997,1997-09-20
12-10-2022,2022-10-06
1999/4,1999-04-23
1995/9/3,1995-09-03
18/5/07,2007-05-18
23/8-2001,2001-04-23
11 Ju 2029,2029-07-11
"Aug 27th, 2035",2035-08-27
14-3-1996,1996-03-14
3/11/92,1992-11-03
12:6:2005,2005-06-12
13:4:2033,2033-04-13
4.3.1990,1990-03-04
14th of July 2029,2029-07-14
15/3/1993,1993-03-15
27 May 2032,2032-05-27
28 Dec 1991,1991-12-28
2/12-2013,2013-12-02
10 June 1994,1994-06-10
9 tháng 1 năm 1991,1991-01-09
26 Nov 2023,2023-11-26
"Mar 17th, 1994",1994-03-17
4-7,1994-07-04
22/9-2021,2021-09-22
13.9.2005,2005-09-13
8-10-08,2008-08-10
1990/6/16,1990-06-16
15 tháng 5 năm 2017,2017-05-15
1995/10,1995-10-26
12:6:2021,2021-06-12
9.9.2031,2031-09-09
5-11,2027-11-05
5/1-2012,2012-01-05
2025/9/15,2025-09-15
20/3/1994,1994-03-20
21-1,2026-01-21
ngày 24 tháng 2 năm 1997,1997-02-24
17:3:2022,2022-03-17
Nov 20 17,2017-11-20
3/20/91,1991-03-20
2030-7-23,2030-07-23
24-5-2012,2012-05-24
4-10-1995,1995-10-02
2-18-00,2000-02-18
ngày 10 tháng 8 năm 2006,2006-08-10
1/6/2028,2028-02-01
2026/7,2026-07-10
11th of April 2035,2035-04-11
18/11/2014,2014-11-18
2003/7,2003-07-24
Jul 21 32,2032-07-21
28-3,1998-03-28
10:6:2023,2023-06-10
7/21/1998,1998-07-07
1:3:2029,2029-03-01
4/11/30,2030-11-04
1Dec2032,2032-12-01
12/8/12,2012-12-08
ngày 13 tháng 9 năm 2023,2023-09-13
7/6-1992,1992-03-07
38-9-2013,2013-09-19
6/16-2010,2010-08-06
54-10-2014,2014-10-27
15/8-2001,2001-08-15
17122030,2030-12-17
4/7/15,2015-04-07
5/4/93,1993-04-05
1/1/2020,2020-01-01
2009/1,2009-01-18
4 Jan 2011,2011-01-04
"October 9, 2012",2012-10-09
ngày 2 tháng 4 năm 2009,2009-04-02
13/14-2007,2007-07-13
16-3,2007-03-16
2032/10/20,2032-10-20
11-9-09,2009-11-09
5/12/12,2012-12-05
2032/12/4,2032-12-04
8/7/96,1996-07-08
11:2:2014,2014-02-11
9-17-14,2014-09-17
14 Feb 2005,2005-02-14
2009-3-28,2009-03-28
16/4/2017,2017-04-16
27/6-1997,1997-06-27
8:8:1999,1999-08-08
1999/2,1999-02-02
Mar 5 19,2019-03-05
8-3-2022,2022-03-08
22 May 2027,2027-05-22
2010/10/11,2010-10-11
8/1-2018,2018-01-08
23/36/1995,1995-12-23
Apr 10 16,2016-04-10
2016/5,2016-05-18
24 December 1994,1994-12-24
2008/9/16,2008-09-16
2018/4,2018-04-21
20/8-2022,2022-08-20
18 Apr 2019,2019-04-18
14/4/94,1994-04-14
14 Jun 1993,1993-06-14
8/6-2024,2024-06-08
2019/10,2019-10-21
27/22-2028,2028-11-27
"July 4, 2014",2014-07-04
26/33/2011,2011-11-26
42-6-2024,2024-06-21
18/5/34,2034-05-18
11/28/1994,1994-11-28
13/11-2030,2030-11-13
27081994,1994-08-27
25/10-2019,2019-10-25
22/8/16,2016-08-22
28/15/2002,2002-05-28
22/1-2012,2012-01-22
21/27/2020,2020-09-21
24/4/13,2013-04-24
27Oct2001,2001-10-27
ngày 13 tháng 11 năm 2033,2033-11-13
28-2,1990-02-28
27/9/07,2007-09-27
23112002,2002-11-23
7-9,2024-09-07
"March 22, 2018",2018-03-22
12 Jan 2019,2019-01-12
25 tháng 2 năm 2026,2026-02-25
24/1-2028,2028-01-24
"Mar 3rd, 2034",2034-03-03
2024/4,2024-04-09
3/6/2030,2030-06-03
1/11/17,2017-11-01
26/6-2001,2001-03-26
2-2,2003-02-02
1/1/03,2003-01-01
22th of June 2032,2032-06-22
May 6 07,2007-05-06
Nov 2 28,2028-11-02
18/2/2010,2010-02-18
21 Jan 2034,2034-01-21
3/19/2030,2030-03-19
15 January 1994,1994-01-15
20-11-1998,1998-11-20
28 Jul 2017,2017-07-28
25-8,2011-08-25
9 Dec 1990,1990-12-09
5 tháng 1 năm 1993,1993-01-05
5:2:1997,1997-02-05
2029-7-7,2029-07-07
23th of March 1999,1999-03-23
Aug 4 02,2002-08-04
5/25/2026,2026-05-25
21/12/20,2020-12-21
18/10/18,2018-10-18
2/9/97,1997-09-02
"February 5, 1999",1999-02-05
25 Aug 2028,2028-08-25
9/18/31,2031-09-18
4th of June 1996,1996-06-04
25.5.2015,2015-05-25
23/11/2011,2011-11-23
28122031,2031-12-28
2-10,2027-10-02
12/19/93,1993-12-19
11/8-1996,1996-08-11
28.3.2003,2003-03-28
6-23-25,2025-06-23
13 Ma 1999,1999-03-13
6/10/26,2026-10-06
21/5/96,1996-05-21
9/1/19,2019-01-09
"Sep 28th, 2013",2013-09-28
"August 27, 2000",2000-08-27
2001/8,2001-08-23
5/1/21,2021-01-05
2013-11-10,2013-11-10
2010/3/12,2010-03-12
ngày 10 tháng 9 năm 2021,2021-09-10
21.2.2007,2007-02-21
5/2/1998,1998-05-02
12-7,2029-07-12
1994/4,1994-04-15
2/5/16,2016-05-02
19/4-2003,2003-04-19
Nov 22 28,2028-11-22
14/8/94,1994-08-14
24/8-1998,1998-08-24
18062034,2034-06-18
2021/9/13,2021-09-13
"February 2, 2000",2000-02-02
11 February 1990,1990-02-11
2-11-2005,2005-11-01
14/11-2018,2018-11-14
26/5-2019,2019-05-26
25/6-2014,2014-06-25
4/16/13,2013-04-16
3/6/20,2020-06-03
2/10-2016,2016-05-02
2/12/2012,2012-12-02
16/3/97,1997-03-16
8-11-27,2027-08-11
5/8-1996,1996-08-05
22/16-2028,2028-08-22
8 tháng 8 năm 2024,2024-08-08
23-7,2008-07-23
1996/7/3,1996-07-03
8-23-34,2034-08-23
16.11.2025,2025-11-16
14/12-2012,2012-12-14
ngày 10 tháng 3 năm 2003,2003-03-10
19.8.2008,2008-08-19
24-8,2032-08-24
11/10-2031,2031-10-11
22/11-1991,1991-11-22
ngày 1 tháng 1 năm 2004,2004-01-01
14/7-2026,2026-07-14
Nov 25 23,2023-11-25
Jul 11 12,2012-07-11
27/6/96,1996-06-27
ngày 20 tháng 4 năm 2012,2012-04-20
26032035,2035-03-26
17th of November 2034,2034-11-17
28-5-2022,2022-05-14
2/27/2029,2029-09-02
9-7-14,2014-09-07
9/20-2034,2034-10-09
2020/7,2020-07-26
10 tháng 4 năm 1993,1993-04-10
26 tháng 2 năm 2013,2013-02-26
14th of October 2028,2028-10-14
16th of September 2021,2021-09-16
2:1:1998,1998-01-02
17/11/2006,2006-11-17
Jan 5 01,2001-01-05
"Sep 24th, 2029",2029-09-24
6/6/2001,2001-06-06
11:8:2026,2026-08-11
13-10-2011,2011-10-13
20102015,2015-10-20
11051999,1999-05-11
3 Jun 2009,2009-06-03
3:1:2003,2003-01-03
3Dec2002,2002-12-03
13th of May 2012,2012-05-13
13th of October 2008,2008-10-13
13/6-2026,2026-03-13
9/6/2035,2035-06-09
4/3/1994,1994-04-03
18/7-2007,2007-07-18
18/24-2023,2023-12-18
20/6/17,2017-06-20
ngày 13 tháng 7 năm 2020,2020-07-13
25 tháng 8 năm 2001,2001-08-25
12 tháng 1 năm 1997,1997-01-12
28/12/2007,2007-12-28
26.8.2022,2022-08-26
20 April 2024,2024-04-20
28:12:2020,2020-12-28
1:11:2015,2015-11-01
6Jun2014,2014-06-06
2004/2,2004-02-11
7:1:2011,2011-01-07
2017-2-16,2017-02-16
"August 1, 2020",2020-08-01
14 Jul 2014,2014-07-14
"Mar 24th, 2011",2011-03-24
26 De 1991,1991-12-26
24/3/03,2003-03-24
Aug 20 12,2012-08-20
17/12/02,2002-12-17
8/8/05,2005-08-08
13/2-2018,2018-02-13
10/12/34,2034-10-12
23/20-2014,2014-10-23
11031991,1991-03-11
11/2-2034,2034-02-11
24-2-2025,2025-02-12
26/22-2035,2035-11-26
2024-8-27,2024-08-27
28 Aug 2017,2017-08-28
22.7.1995,1995-07-22
22Jan2017,2017-01-22
6 March 2007,2007-03-06
50-7-2019,2019-07-25
28/3/07,2007-03-28
7/8/2003,2003-08-07
1 October 2006,2006-10-01
27/2-2001,2001-01-27
2030/11/22,2030-11-22
2008/2/20,2008-02-20
21/9-2006,2006-09-21
15 Ma 2002,2002-05-15
19:9:2021,2021-09-19
ngày 3 tháng 10 năm 2023,2023-10-03
2-8-2021,2021-08-02
"Jan 10th, 2004",2004-01-10
9/12/08,2008-09-12
15 tháng 7 năm 1994,1994-07-15
"April 17, 2004",2004-04-17
5-5-2020,2020-05-05
2033/10,2033-10-25
12-8,2030-08-12
21Mar2017,2017-03-21
Dec 2 20,2020-12-02
10/7/21,2021-07-10
9 Dec 1999,1999-12-09
12/11-2022,2022-11-12
"October 14, 2011",2011-10-14
ngày 8 tháng 2 năm 2001,2001-02-08
7-18-04,2004-07-18
28-8,2031-08-28
22.1.1994,1994-01-22
28Nov2017,2017-11-28
26-5-2014,2014-05-13
2026/2,2026-02-08
14 tháng 3 năm 2031,2031-03-14
18:12:2022,2022-12-18
6/7/2008,2008-07-06
11-7-29,2029-11-07
10/24/2024,2024-10-24
4.4.2010,2010-04-04
22th of October 1998,1998-10-22
4/10/2001,2001-04-10
23042011,2011-04-23
27/1/2004,2004-01-27
21 Au 1999,1999-08-21
20/2-2029,2029-02-20
5/1/1992,1992-01-05
24/4/1999,1999-04-24
7-1-2015,2015-01-07
26.12.2031,2031-12-26
25 Au 2013,2013-08-25
19/9/1998,1998-03-19
17.2.2002,2002-02-17
27th of April 1990,1990-04-27
11th of March 2006,2006-03-11
19112032,2032-11-19
7/6/2015,2015-02-07
11012007,2007-01-11
Mar 9 13,2013-03-09
19 Aug 2033,2033-08-19
2035/5/2,2035-05-02
4-10-2009,2009-10-02
"Dec 14th, 2007",2007-12-14
2014/4/24,2014-04-24
ngày 10 tháng 4 năm 1995,1995-04-10
"April 20, 2026",2026-04-20
09052035,2035-05-09
"Feb 6th, 2026",2026-02-06
2008-11-9,2008-11-09
21:12:1990,1990-12-21
32-1-2011,2011-01-16
2022/5,2022-05-05
5 Sep 2017,2017-09-05
5:2:2017,2017-02-05
10/13/1997,1997-10-13
"September 11, 2014",2014-09-11
1995/9,1995-09-01
10 De 2011,2011-12-10
42-12-1995,1995-12-21
6.1.1993,1993-01-06
11/1-2007,2007-01-11
14/14-2016,2016-07-14
20:2:1995,1995-02-20
2009-3-21,2009-03-21
19 tháng 4 năm 1994,1994-04-19
18/9/2030,2030-09-18
13/7-2005,2005-07-13
5-7,2032-07-05
12 tháng 10 năm 2033,2033-10-12
9/11-2013,2013-11-09
15-11,2020-11-15
"October 9, 2018",2018-10-09
ngày 8 tháng 9 năm 2035,2035-09-08
3/6/05,2005-06-03
18 tháng 3 năm 2015,2015-03-18
19:7:2028,2028-07-19
25/9/2003,2003-03-25
9Oct2033,2033-10-09
15th of August 1993,1993-08-15
19/2/2010,2010-02-19
15/6-2033,2033-03-15
8/7-2010,2010-07-08
4/22-2012,2012-11-04
7-14-28,2028-07-14
2015/7,2015-07-01
6-3,2000-03-06
3rd of April 2029,2029-04-03
2029-8-17,2029-08-17
"September 3, 2021",2021-09-03
8 August 2029,2029-08-08
ngày 5 tháng 4 năm 1999,1999-04-05
14-2-2016,2016-02-07
2 May 2023,2023-05-02
2029/7,2029-07-10
10-4,2033-04-10
23:8:2017,2017-08-23
10/10/96,1996-10-10
11072013,2013-07-11
2022/4,2022-04-24
2016/3/26,2016-03-26
26 tháng 12 năm 2033,2033-12-26
3/5/2007,2007-03-05
21th of September 2015,2015-09-21
5/1/1990,1990-05-01
9 December 2022,2022-12-09
22/2-2023,2023-02-22
34-6-2009,2009-06-17
5/13/2016,2016-05-13
22/11-1992,1992-11-22
11/9/35,2035-11-09
10/1-2011,2011-01-10
Aug 18 28,2028-08-18
ngày 17 tháng 4 năm 2014,2014-04-17
7:5:1990,1990-05-07
8/7/2003,2003-08-07
13.12.2003,2003-12-13
Jul 4 99,1999-07-04
Mar 2 20,2020-03-02
11.5.2017,2017-05-11
11/21/2027,2027-07-11
8/7-2030,2030-07-08
4-28-04,2004-04-28
"Oct 13th, 1990",1990-10-13
3 Jul 2029,2029-07-03
28 February 2022,2022-02-28
52-3-2019,2019-03-26
7/25/13,2013-07-25
9/22/2004,2004-09-22
26/11/95,1995-11-26
2/22-2005,2005-11-02
2019/4/7,2019-04-07
26 April 1996,1996-04-26
2035-3-15,2035-03-15
3:7:2002,2002-07-03
1-4,2013-04-01
8.6.2024,2024-06-08
4-22-24,2024-04-22
11Feb2005,2005-02-11
6-1-04,2004-06-01
1-4-05,2005-01-04
25/7-2001,2001-07-25
8/22-2002,2002-11-08
Dec 18 97,1997-12-18
"Jun 11th, 2027",2027-06-11
4/17/35,2035-04-17
2011/12/8,2011-12-08
8 Mar 2009,2009-03-08
9/24-2030,2030-12-09
2/1/34,2034-01-02
28 De 2001,2001-12-28
27 August 2012,2012-08-27
2/6/95,1995-06-02
6-18-01,2001-06-18
9Jul2031,2031-07-09
2013/10,2013-10-07
8Sep2005,2005-09-08
28 Ma 2027,2027-05-28
18 No 2004,2004-11-18
1/12/30,2030-01-12
2026-1-20,2026-01-20
16/4/32,2032-04-16
7/8-2013,2013-04-07
17042013,2013-04-17
23/5-2015,2015-05-23
"Sep 27th, 2031",2031-09-27
15/12-2022,2022-12-15
20 Oc 1999,1999-10-20
7/21/90,1990-07-21
1990/9/12,1990-09-12
"May 4th, 2020",2020-05-04
13/8-1990,1990-08-13
2/12-2023,2023-12-02
20012024,2024-01-20
1994-5-27,1994-05-27
24-7-2016,2016-07-12
10:8:2035,2035-08-10
8/24/2021,2021-08-24
24:6:2025,2025-06-24
11-2,1998-02-11
15-6-2014,2014-06-15
28/10/1997,1997-10-28
36-1-1996,1996-01-18
18.3.1994,1994-03-18
19/10/94,1994-10-19
56-11-2001,2001-11-28
"Apr 24th, 2009",2009-04-24
14062010,2010-06-14
2004/12/21,2004-12-21
2020/9,2020-09-16
"Feb 11th, 2031",2031-02-11
5/8/09,2009-08-05
27/10-2004,2004-05-27
22-7-2032,2032-07-22
3/10/28,2028-10-03
2016-3-13,2016-03-13
19Jun1990,1990-06-19
15Dec2009,2009-12-15
14/11/2018,2018-11-14
12-8,1992-08-12
"May 2nd, 1993",1993-05-02
3/21/2001,2001-03-21
20 May 1999,1999-05-20
16/12-2027,2027-06-16
2-5-2014,2014-05-01
1994/10/15,1994-10-15
21-3-1993,1993-03-21
11:12:1998,1998-12-11
28/12/2024,2024-04-28
10/10-2034,2034-10-10
8/9/2011,2011-09-08
19/7/2001,2001-07-19
19.2.2017,2017-02-19
5-3-01,2001-05-03
3/24/1998,1998-03-24
7 tháng 9 năm 1996,1996-09-07
ngày 22 tháng 12 năm 1991,1991-12-22
22/12-2003,2003-12-22
16 tháng 12 năm 1997,1997-12-16
17/9/05,2005-09-17
2/8-1991,1991-08-02
1999/10/4,1999-10-04
2024-10-25,2024-10-25
7.11.2000,2000-11-07
27 tháng 1 năm 2016,2016-01-27
14 tháng 8 năm 2005,2005-08-14
26082014,2014-08-26
10th of November 2018,2018-11-10
12-11,2002-11-12
11 Fe 2010,2010-02-11
2014-5-12,2014-05-12
21-9,1994-09-21
ngày 24 tháng 11 năm 2000,2000-11-24
16-8-2007,2007-08-08
6/11-2004,2004-11-06
2025/11,2025-11-26
8 July 2005,2005-07-08
7/2/2004,2004-02-07
6th of February 2006,2006-02-06
24/1/1992,1992-01-24
7/4-2027,2027-04-07
6/7-2007,2007-07-06
3/26/25,2025-03-26
10/11/92,1992-11-10
14 Ju 2032,2032-07-14
8 May 1993,1993-05-08
ngày 20 tháng 9 năm 1995,1995-09-20
24/3-2029,2029-03-24
5/6-2019,2019-03-05
16/10/2008,2008-10-16
3/6/1999,1999-02-03
28/3/2006,2006-01-28
25-11-2020,2020-11-25
"Feb 26th, 1991",1991-02-26
2-11,2009-11-02
2011-1-9,2011-01-09
"Aug 18th, 1992",1992-08-18
26031993,1993-03-26
25-6,1995-06-25
28/7/24,2024-07-28
24 June 1995,1995-06-24
3 Dec 2033,2033-12-03
3 Nov 1993,1993-11-03
11 March 2006,2006-03-11
9 Ap 2004,2004-04-09
48-12-2007,2007-12-24
1991/12/5,1991-12-05
11072015,2015-07-11
14/4-2003,2003-02-14
8/3/2018,2018-03-08
Aug 4 09,2009-08-04
26/5/28,2028-05-26
9Sep2024,2024-09-09
1/9-2015,2015-09-01
1/5/93,1993-05-01
Jan 22 06,2006-01-22
11:11:1996,1996-11-11
13-1-2010,2010-01-13
3/8-1990,1990-08-03
25th of October 2027,2027-10-25
ngày 25 tháng 10 năm 2017,2017-10-25
23Apr2009,2009-04-23
10-10-2030,2030-10-10
10-8-2006,2006-08-05
17/5/35,2035-05-17
11Jul2018,2018-07-11
"Aug 25th, 1999",1999-08-25
20 Jan 2033,2033-01-20
23/7/35,2035-07-23
"June 21, 2005",2005-06-21
2017-8-8,2017-08-08
8 tháng 1 năm 1998,1998-01-08
17051996,1996-05-17
36-10-2011,2011-10-18
13-8,1994-08-13
4 tháng 8 năm 1998,1998-08-04
6/6/29,2029-06-06
2002-12-17,2002-12-17
23/10/12,2012-10-23
15th of September 2034,2034-09-15
20th of June 1991,1991-06-20
11/6/30,2030-06-11
1-17-18,2018-01-17
4/28/2027,2027-04-28
4 tháng 5 năm 2006,2006-05-04
09062023,2023-06-09
5:12:2006,2006-12-05
10/7/2024,2024-10-07
2/5/1993,1993-05-02
07062015,2015-06-07
23 Ap 2006,2006-04-23
2016-9-6,2016-09-06
9/1-1998,1998-01-09
28/4/17,2017-04-28
3 Ma 2007,2007-03-03
20/18/1991,1991-06-20
15/6-1994,1994-06-15
21th of January 1997,1997-01-21
6/15/2018,2018-05-06
8 December 1991,1991-12-08
1998/7/25,1998-07-25
8.1.1991,1991-01-08
3rd of May 2012,2012-05-03
25 July 1991,1991-07-25
2013/3,2013-03-11
19 Ma 2004,2004-05-19
24/2-2027,2027-01-24
7Jun2018,2018-06-07
8/1/2015,2015-01-08
27/10-2005,2005-10-27
2012-2-20,2012-02-20
"October 1, 2019",2019-10-01
ngày 8 tháng 4 năm 2004,2004-04-08
13102013,2013-10-13
16-7-2009,2009-07-08
18-10-2026,2026-10-09
21-4,2034-04-21
Oct 17 05,2005-10-17
6/22-2029,2029-11-06
"Dec 18th, 2025",2025-12-18
1991/4,1991-04-19
2/11/2024,2024-02-11
21/8-2017,2017-04-21
22 January 2002,2002-01-22
May 10 98,1998-05-10
10-19-33,2033-10-19
26121999,1999-12-26
9:4:2017,2017-04-09
23:7:2015,2015-07-23
21Dec1992,1992-12-21
8/5/97,1997-08-05
20/3/1997,1997-03-20
Jan 12 05,2005-01-12
19 Ja 2009,2009-01-19
6 Feb 2013,2013-02-06
2007/1,2007-01-27
11-7-2026,2026-07-11
4/15/2008,2008-05-04
"Jan 1st, 1998",1998-01-01
11-4-24,2024-11-04
3 Ma 1993,1993-03-03
5/3-2012,2012-03-05
27/2-2021,2021-02-27
25 Nov 1999,1999-11-25
12-5-2009,2009-05-06
2 Ma 2015,2015-05-02
ngày 28 tháng 11 năm 2015,2015-11-28
14 August 2004,2004-08-14
ngày 22 tháng 9 năm 2034,2034-09-22
1/3/2005,2005-03-01
10 Ma 2016,2016-03-10
6-11,2002-11-06
12/14/02,2002-12-14
1/18/02,2002-01-18
2027/8/19,2027-08-19
5/15/2001,2001-05-15
3/14/2017,2017-03-14
18 Apr 2016,2016-04-18
28/3/02,2002-03-28
2017/6/4,2017-06-04
7/4-1993,1993-04-07
ngày 3 tháng 7 năm 2034,2034-07-03
02051998,1998-05-02
14 tháng 10 năm 2021,2021-10-14
10/26/21,2021-10-26
18/20-2017,2017-10-18
4th of December 1997,1997-12-04
2 Se 1994,1994-09-02
1992/5,1992-05-08
"Feb 18th, 2031",2031-02-18
11Mar2035,2035-03-11
23.5.1990,1990-05-23
22:7:2012,2012-07-22
24/24/1990,1990-08-24
05082032,2032-08-05
18/22-2008,2008-11-18
11/24-2024,2024-12-11
2021/7/20,2021-07-20
3rd of July 2008,2008-07-03
2024/5/22,2024-05-22
ngày 27 tháng 12 năm 2033,2033-12-27
16/1-2034,2034-01-16
"May 21, 2014",2014-05-21
18/10-2014,2014-10-18
12/8/99,1999-08-12
Jun 22 93,1993-06-22
10/24-2000,2000-12-10
10-12,2008-12-10
2006-6-3,2006-06-03
"February 1, 2030",2030-02-01
"Jun 15th, 2026",2026-06-15
18/9/2035,2035-03-18
2005/8,2005-08-28
"Mar 3rd, 1995",1995-03-03
28/14-2025,2025-07-28
Jan 18 15,2015-01-18
21 June 2017,2017-06-21
6-1-2002,2002-01-03
2002-2-8,2002-02-08
6.3.2000,2000-03-06
7/2/08,2008-02-07
28 Dec 2033,2033-12-28
6-2-98,1998-06-02
"July 17, 2024",2024-07-17
32-8-2031,2031-08-16
21/3/07,2007-03-21
ngày 20 tháng 7 năm 1993,1993-07-20
20Oct2011,2011-10-20
21Jun2028,2028-06-21
1-8,2012-08-01
"Aug 19th, 1992",1992-08-19
"August 13, 2030",2030-08-13
15th of May 2032,2032-05-15
1999/2/5,1999-02-05
10/4/18,2018-10-04
14092017,2017-09-14
2008-10-13,2008-10-13
3rd of April 2007,2007-04-03
27/27/2011,2011-09-27
22/9/2019,2019-03-22
14Feb2028,2028-02-14
24 Jan 2005,2005-01-24
13-7,2007-07-13
3/11/90,1990-11-03
3-5-03,2003-03-05
28:1:2028,2028-01-28
15 August 2035,2035-08-15
27 September 2006,2006-09-27
23th of April 2034,2034-04-23
2/8/18,2018-08-02
24-8-1996,1996-08-12
24 Apr 2018,2018-04-24
"May 1st, 2009",2009-05-01
2008/10/19,2008-10-19
52-6-1998,1998-06-26
1/12/2008,2008-12-01
27.4.2013,2013-04-27
8/18/2016,2016-08-18
1-7-07,2007-01-07
2-10,2013-10-02
1995-7-21,1995-07-21
"Sep 27th, 2033",2033-09-27
16-2-2025,2025-02-08
11 Ju 2008,2008-06-11
1 tháng 6 năm 1996,1996-06-01
16 Feb 2001,2001-02-16
2024-1-10,2024-01-10
1997/3/10,1997-03-10
"Jul 3rd, 2009",2009-07-03
12-9-99,1999-12-09
19/7/32,2032-07-19
7/22/2016,2016-07-22
"Feb 1st, 1998",1998-02-01
"May 15th, 2000",2000-05-15
2018/6/2,2018-06-02
16/4/16,2016-04-16
"September 21, 2033",2033-09-21
9 Oc 2019,2019-10-09
22-6,1998-06-22
5:6:2022,2022-06-05
10/1/2010,2010-01-10
24042029,2029-04-24
19th of January 2015,2015-01-19
Jan 5 22,2022-01-05
27022031,2031-02-27
4/5/13,2013-05-04
2015/12,2015-12-24
16/3/07,2007-03-16
10/11-2031,2031-11-10
25:4:2010,2010-04-25
21032016,2016-03-21
26/12-1997,1997-12-26
21-2-1995,1995-02-21
16th of January 2001,2001-01-16
Nov 11 10,2010-11-11
3 tháng 1 năm 2013,2013-01-03
2013/7/5,2013-07-05
1:11:2031,2031-11-01
52-6-2012,2012-06-26
Mar 5 04,2004-03-05
12/20/27,2027-12-20
20 Apr 1993,1993-04-20
11/5-2034,2034-05-11
Dec 17 19,2019-12-17
8:10:2004,2004-10-08
"Jan 23th, 2024",2024-01-23
"Sep 12th, 2000",2000-09-12
14 tháng 11 năm 1994,1994-11-14
6 Ju 2018,2018-07-06
5 tháng 6 năm 2004,2004-06-05
24 February 2034,2034-02-24
15 tháng 8 năm 2034,2034-08-15
10/21/2008,2008-07-10
12/15/2030,2030-12-15
6/28/95,1995-06-28
Jun 22 93,1993-06-22
1990-2-16,1990-02-16
12/1-2030,2030-01-12
1991-10-19,1991-10-19
ngày 14 tháng 5 năm 2035,2035-05-14
1/10/95,1995-10-01
"Apr 25th, 2032",2032-04-25
20 Se 1995,1995-09-20
21/4/2032,2032-04-21
2/22/2033,2033-02-22
2025-10-24,2025-10-24
17.7.2001,2001-07-17
"November 9, 2020",2020-11-09
5/16/96,1996-05-16
3-10-09,2009-03-10
5:7:2008,2008-07-05
27/8/35,2035-08-27
27/3/1999,1999-01-27
7Jul2019,2019-07-07
27/6/2023,2023-02-27
6-4-95,1995-06-04
7/11/26,2026-07-11
21/10/23,2023-10-21
19:11:1997,1997-11-19
Dec 16 90,1990-12-16
11-5,2011-05-11
7.10.2017,2017-10-07
19-2,2011-02-19
10082021,2021-08-10
19 Sep 2007,2007-09-19
10 Oct 2013,2013-10-10
13022023,2023-02-13
18 July 2012,2012-07-18
25081991,1991-08-25
7/2-2034,2034-02-07
9:8:2026,2026-08-09
2/2/30,2030-02-02
13-9-2009,2009-09-13
3-21-97,1997-03-21
2033-11-17,2033-11-17
18 September 2022,2022-09-18
Aug 14 23,2023-08-14
"April 27, 2002",2002-04-27
2 July 2008,2008-07-02
7-23-24,2024-07-23
"September 27, 2014",2014-09-27
"July 4, 2017",2017-07-04
24-1,2022-01-24
15/18-2032,2032-09-15
7-7-03,2003-07-07
2015-1-13,2015-01-13
2024/4,2024-04-18
15 Fe 2007,2007-02-15
ngày 28 tháng 10 năm 2001,2001-10-28
2028/6,2028-06-05
12-12-2001,2001-12-06
21082033,2033-08-21
16:6:2022,2022-06-16
2032/3,2032-03-28
23/5-1990,1990-05-23
5/3/2016,2016-03-05
6-2-15,2015-06-02
"Jun 7th, 2015",2015-06-07
14/20-2005,2005-10-14
27 Mar 1998,1998-03-27
16:3:2030,2030-03-16
5:8:2022,2022-08-05
9/9/12,2012-09-09
12/18/2028,2028-06-12
11-8-2021,2021-08-11
4 March 2001,2001-03-04
16-7-2022,2022-07-08
19 Ap 2027,2027-04-19
20/7-2004,2004-07-20
24th of June 2024,2024-06-24
16 July 2029,2029-07-16
Mar 16 01,2001-03-16
19 May 2035,2035-05-19
4th of December 2029,2029-12-04
2 tháng 6 năm 2013,2013-06-02
2029/4/14,2029-04-14
2001/9,2001-09-06
15/11/94,1994-11-15
2007/1/9,2007-01-09
"May 20th, 2019",2019-05-20
2033-9-14,2033-09-14
22.7.1998,1998-07-22
19/6/91,1991-06-19
27 No 1994,1994-11-27
15th of February 2021,2021-02-15
2000-6-15,2000-06-15
4/9/24,2024-09-04
"July 1, 2032",2032-07-01
2023/2,2023-02-21
13-5,2017-05-13
2020/8/22,2020-08-22
19 Nov 1991,1991-11-19
17 Feb 2015,2015-02-17
11/7/16,2016-07-11
5/2/08,2008-02-05
20/16-2029,2029-08-20
6-5,2003-05-06
20-2-2010,2010-02-20
21-9,2023-09-21
03102010,2010-10-03
15/24-2010,2010-12-15
16/6/2035,2035-02-16
23/10/2013,2013-10-23
24.3.2003,2003-03-24
8/2/29,2029-02-08
27 Ma 1998,1998-05-27
Apr 9 17,2017-04-09
27Aug2023,2023-08-27
17102030,2030-10-17
Jun 16 90,1990-06-16
1/6-1993,1993-06-01
2007/3/10,2007-03-10
ngày 1 tháng 6 năm 2025,2025-06-01
28.6.2031,2031-06-28
11:7:2019,2019-07-11
2018/12/4,2018-12-04
ngày 5 tháng 3 năm 1990,1990-03-05
2/1-2014,2014-01-02
6-24-10,2010-06-24
4/28/17,2017-04-28
8/8/22,2022-08-08
"May 6th, 2016",2016-05-06
17 tháng 1 năm 2012,2012-01-17
ngày 11 tháng 8 năm 1993,1993-08-11
"July 3, 2029",2029-07-03
10:1:2009,2009-01-10
5/4/33,2033-04-05
4.11.2000,2000-11-04
9/11/11,2011-11-09
5/19/2006,2006-05-19
26 Feb 2019,2019-02-26
40-5-2001,2001-05-20
"May 8th, 2027",2027-05-08
4-7,1997-07-04
15 Jul 2014,2014-07-15
11 Sep 2027,2027-09-11
6-13-24,2024-06-13
01022021,2021-02-01
ngày 7 tháng 10 năm 1994,1994-10-07
28122009,2009-12-28
18 May 2006,2006-05-18
ngày 23 tháng 9 năm 1994,1994-09-23
6-10-30,2030-06-10
1 Sep 2008,2008-09-01
6/24/2030,2030-08-06
03121994,1994-12-03
12/22/2015,2015-12-22
7/10-2026,2026-05-07
1-10,2005-10-01
16/6/23,2023-06-16
1996-1-12,1996-01-12
10/36/2030,2030-12-10
11th of March 2023,2023-03-11
13th of June 2013,2013-06-13
12 tháng 4 năm 2019,2019-04-12
15th of September 2029,2029-09-15
12/5-1994,1994-05-12
21/2-2007,2007-01-21
2033/7,2033-07-14
50-2-2012,2012-02-25
19/30/2032,2032-10-19
22/10-2031,2031-10-22
8/8/19,2019-08-08
6/9/35,2035-09-06
11-9,2029-09-11
"Mar 9th, 1993",1993-03-09
6Feb2017,2017-02-06
13th of February 2007,2007-02-13
"Jul 14th, 2014",2014-07-14
6/33/2005,2005-11-06
24 Feb 2010,2010-02-24
"Feb 28th, 2022",2022-02-28
07082003,2003-08-07
3/1/07,2007-01-03
27 tháng 10 năm 2000,2000-10-27
9/22/2034,2034-09-22
23.11.2025,2025-11-23
18072031,2031-07-18
24/7/90,1990-07-24
3 Ma 2028,2028-03-03
24/9-2029,2029-09-24
2025/9,2025-09-12
2Aug2004,2004-08-02
27 March 2005,2005-03-27
28Apr2023,2023-04-28
2033/4/26,2033-04-26
23-12,2033-12-23
1/7/29,2029-01-07
2002/1/15,2002-01-15
2030-6-2,2030-06-02
6/9/2030,2030-06-09
6/23/15,2015-06-23
"September 10, 1996",1996-09-10
14 May 2004,2004-05-14
4 tháng 4 năm 2031,2031-04-04
24 Ma 2033,2033-03-24
10-24-15,2015-10-24
8/27/98,1998-08-27
10-5-2005,2005-05-10
18/27/2009,2009-09-18
5-4-2004,2004-04-05
18/7-2033,2033-07-18
4Dec2000,2000-12-04
5/4/1994,1994-05-04
3-2-20,2020-03-02
2034/10/26,2034-10-26
1/5/1993,1993-05-01
28/1/08,2008-01-28
2 Oct 2021,2021-10-02
Sep 3 30,2030-09-03
"Jan 23th, 2023",2023-01-23
27.12.2002,2002-12-27
10-6-01,2001-10-06
1:3:2010,2010-03-01
20/10-1996,1996-10-20
6-6-2029,2029-06-06
1/23/96,1996-01-23
01082004,2004-08-01
2014/8/22,2014-08-22
17111990,1990-11-17
08022031,2031-02-08
16 tháng 9 năm 2007,2007-09-16
20/1/20,2020-01-20
09071998,1998-07-09
4/24-2010,2010-12-04
10/10/2012,2012-10-10
50-7-2021,2021-07-25
Jan 23 95,1995-01-23
2013/10/6,2013-10-06
2Jan2028,2028-01-02
21-3-2004,2004-03-21
10/3/21,2021-03-10
14 April 1994,1994-04-14
Jun 13 91,1991-06-13
19/1-2019,2019-01-19
10/8/29,2029-08-10
10/1/2009,2009-10-01
12 October 2033,2033-10-12
18th of October 1991,1991-10-18
Dec 17 12,2012-12-17
1993/1/8,1993-01-08
15/4/2010,2010-04-15
18/4-2011,2011-02-18
4 July 2003,2003-07-04
"Jun 3rd, 2021",2021-06-03
17/4/13,2013-04-17
4-10-2001,2001-10-02
13/36/2003,2003-12-13
25Jan2007,2007-01-25
2035/9,2035-09-21
2007/6,2007-06-04
Feb 13 31,2031-02-13
1998/12/16,1998-12-16
5/9-2030,2030-09-05
26th of September 2014,2014-09-26
5/2/22,2022-02-05
ngày 23 tháng 1 năm 2032,2032-01-23
2021/7/14,2021-07-14
25112030,2030-11-25
3/22/1993,1993-03-22
7/3-2016,2016-03-07
11.1.2005,2005-01-11
2/4-2024,2024-04-02
10/12/14,2014-12-10
11-14-25,2025-11-14
Nov 28 03,2003-11-28
23102034,2034-10-23
17 Au 2008,2008-08-17
2025/7/10,2025-07-10
8/2/15,2015-08-02
21Sep2028,2028-09-21
11-1-2027,2027-01-11
Sep 2 93,1993-09-02
17/5/1991,1991-05-17
Sep 6 18,2018-09-06
2032-7-5,2032-07-05
8/23/97,1997-08-23
18102005,2005-10-18
20th of September 2021,2021-09-20
18/4-2019,2019-04-18
1:3:1991,1991-03-01
8/1/12,2012-01-08
20 tháng 5 năm 2011,2011-05-20
28/5/04,2004-05-28
16:1:2000,2000-01-16
5-7,2034-07-05
18/1-2019,2019-01-18
ngày 10 tháng 5 năm 2008,2008-05-10
2014/9/18,2014-09-18
14Jan2033,2033-01-14
1994-4-14,1994-04-14
2/23/07,2007-02-23
18th of December 2006,2006-12-18
17102014,2014-10-17
20-4-2007,2007-04-20
23 August 2030,2030-08-23
21 Mar 2023,2023-03-21
ngày 22 tháng 5 năm 2030,2030-05-22
4/6-2000,2000-06-04
1 October 2002,2002-10-01
4-4-2019,2019-04-04
3 November 2034,2034-11-03
13 tháng 11 năm 2002,2002-11-13
14:8:2017,2017-08-14
10/3/2034,2034-01-10
27 May 2032,2032-05-27
2 January 1990,1990-01-02
ngày 9 tháng 11 năm 2002,2002-11-09
16102010,2010-10-16
4 November 2026,2026-11-04
1-9,2032-09-01
12-17-16,2016-12-17
7/22/2008,2008-07-22
"July 22, 2005",2005-07-22
"March 20, 2009",2009-03-20
2021/6/8,2021-06-08
13/1-1999,1999-01-13
2-1-2011,2011-01-02
5/4/2013,2013-05-04
9 tháng 10 năm 2028,2028-10-09
52-10-2033,2033-10-26
24/30/2032,2032-10-24
1.12.2026,2026-12-01
11/6/2025,2025-06-11
6/4/94,1994-06-04
2018-2-13,2018-02-13
7 Ja 1999,1999-01-07
24Dec2007,2007-12-24
26/12-2009,2009-06-26
7-1,2025-01-07
Sep 2 23,2023-09-02
"Jul 24th, 1998",1998-07-24
23Jun2034,2034-06-23
20 tháng 8 năm 1998,1998-08-20
6-9-92,1992-06-09
7/1/26,2026-07-01
10/4-2015,2015-04-10
ngày 14 tháng 5 năm 2016,2016-05-14
"May 23, 2013",2013-05-23
5/16/2015,2015-05-16
17/4/2001,2001-04-17
22/33/2033,2033-11-22
25-12-2023,2023-12-25
ngày 11 tháng 12 năm 2035,2035-12-11
9 November 2027,2027-11-09
18/12-2000,2000-12-18
17 tháng 12 năm 1995,1995-12-17
4-3-1991,1991-03-02
ngày 16 tháng 10 năm 2024,2024-10-16
"Aug 22th, 2014",2014-08-22
"Dec 8th, 2003",2003-12-08
ngày 12 tháng 6 năm 1998,1998-06-12
26/1-1996,1996-01-26
8-5-1990,1990-05-08
5-4,2000-04-05
20Feb1998,1998-02-20
2020/6,2020-06-11
9Oct1996,1996-10-09
10/5/35,2035-05-10
2 December 1994,1994-12-02
27 May 2030,2030-05-27
7/6/2021,2021-02-07
26/8/2007,2007-08-26
21-2,2004-02-21
22th of September 2011,2011-09-22
Dec 20 18,2018-12-20
2001/3/3,2001-03-03
54-5-1993,1993-05-27
1990-2-15,1990-02-15
11.9.2027,2027-09-11
27 December 1991,1991-12-27
25/8-2019,2019-04-25
18/10/07,2007-10-18
11-1,2033-01-11
11Sep2021,2021-09-11
2010/1,2010-01-15
2013/5,2013-05-22
22/12/2026,2026-04-22
25-11,2020-11-25
2013-8-18,2013-08-18
1/12/2022,2022-12-01
11-8,2029-08-11
26 Aug 2034,2034-08-26
26.4.2011,2011-04-26
8 tháng 2 năm 2032,2032-02-08
ngày 18 tháng 3 năm 2031,2031-03-18
"Jan 20th, 2005",2005-01-20
Dec 5 23,2023-12-05
16/11/98,1998-11-16
8/10-1998,1998-10-08
04082035,2035-08-04
1/18/2002,2002-06-01
2035/6/17,2035-06-17
2030/5/14,2030-05-14
22 tháng 3 năm 1998,1998-03-22
32-2-2016,2016-02-16
14/12/2007,2007-12-14
6-4-2003,2003-04-06
2025/5/19,2025-05-19
24/20-2020,2020-10-24
"Feb 22th, 2012",2012-02-22
17/10-1993,1993-10-17
4Feb2033,2033-02-04
Nov 16 17,2017-11-16
20th of August 1998,1998-08-20
28/4-2005,2005-04-28
7/19/14,2014-07-19
10062002,2002-06-10
12Dec2011,2011-12-12
25.11.2027,2027-11-25
"February 17, 1999",1999-02-17
20:6:2021,2021-06-20
20/10/2025,2025-10-20
28:4:1993,1993-04-28
8/7/26,2026-07-08
13th of September 2020,2020-09-13
7Jun2021,2021-06-07
28 Mar 1996,1996-03-28
2022/12/5,2022-12-05
27 Feb 2006,2006-02-27
"May 6th, 2025",2025-05-06
7/6-2005,2005-06-07
3/27/1997,1997-09-03
10th of October 2018,2018-10-10
"Nov 17th, 2003",2003-11-17
17th of September 2023,2023-09-17
11/15/2029,2029-05-11
23Feb2001,2001-02-23
"Jun 5th, 1990",1990-06-05
08082016,2016-08-08
8/2-2000,2000-02-08
15.7.2007,2007-07-15
1:11:2019,2019-11-01
10 May 2034,2034-05-10
Oct 1 33,2033-10-01
1994/11/25,1994-11-25
2006-11-7,2006-11-07
May 28 23,2023-05-28
3 Ma 2022,2022-05-03
2010/12,2010-12-01
4-16-20,2020-04-16
5:2:1990,1990-02-05
1/21/92,1992-01-21
16 Ja 2013,2013-01-16
"Jul 12th, 2014",2014-07-12
2029/1/17,2029-01-17
22/4/15,2015-04-22
4 tháng 7 năm 2022,2022-07-04
12052015,2015-05-12
"Apr 23th, 2031",2031-04-23
"Jul 25th, 2030",2030-07-25
25 April 2003,2003-04-25
3 Ja 2026,2026-01-03
25032015,2015-03-25
27-8-2003,2003-08-27
5-17-10,2010-05-17
6 tháng 11 năm 2007,2007-11-06
19 Jul 2019,2019-07-19
11012034,2034-01-11
2Dec1998,1998-12-02
11/8/1995,1995-08-11
2011/9,2011-09-05
3 No 2006,2006-11-03
22/5/23,2023-05-22
24.3.1991,1991-03-24
22th of December 2019,2019-12-22
12th of May 2021,2021-05-12
10-28-07,2007-10-28
1/1/2031,2031-01-01
2-17-29,2029-02-17
12-16-10,2010-12-16
10/5/32,2032-05-10
ngày 16 tháng 9 năm 2011,2011-09-16
2032-12-7,2032-12-07
17/20-2001,2001-10-17
11/2-2028,2028-02-11
3/13/2001,2001-03-13
3/12/28,2028-12-03
14122034,2034-12-14
9 tháng 9 năm 2033,2033-09-09
9th of July 2021,2021-07-09
22:10:1998,1998-10-22
19-5,2015-05-19
12 Ma 1990,1990-05-12
"May 4, 2016",2016-05-04
7/1/2009,2009-07-01
20/4-2029,2029-04-20
2020-5-3,2020-05-03
1/2/30,2030-01-02
9:1:2014,2014-01-09
7/3/08,2008-03-07
11/6/2005,2005-02-11
24 Mar 1990,1990-03-24
5th of March 2016,2016-03-05
22 Jan 2029,2029-01-22
23/11/20,2020-11-23
2022/12/4,2022-12-04
2027/7/25,2027-07-25
24-2-2016,2016-02-24
11/9/20,2020-09-11
6/11/94,1994-06-11
2Jul2007,2007-07-02
2031-10-6,2031-10-06
2-8,2014-08-02
13 Ju 2007,2007-06-13
6-11-2010,2010-11-06
42-1-2025,2025-01-21
ngày 26 tháng 6 năm 2004,2004-06-26
4.12.2006,2006-12-04
11/3/2034,2034-03-11
21032035,2035-03-21
13/4-2006,2006-04-13
21-8,2015-08-21
May 6 01,2001-05-06
6-2-08,2008-06-02
25:1:1999,1999-01-25
21/12/2006,2006-12-21
5-12,2033-12-05
03032016,2016-03-03
10/9/2016,2016-10-09
8 Ju 2028,2028-06-08
23 March 2024,2024-03-23
2022/2,2022-02-07
25 No 1999,1999-11-25
13th of February 2028,2028-02-13
2:3:2002,2002-03-02
12/12-2022,2022-12-12
27 tháng 1 năm 2003,2003-01-27
12 Ap 2016,2016-04-12
13 June 2033,2033-06-13
1 Se 2035,2035-09-01
25-9,2004-09-25
2-19-35,2035-02-19
3-5,2034-05-03
"Feb 26th, 2027",2027-02-26
9/12-2021,2021-12-09
4Jul1994,1994-07-04
21:11:2021,2021-11-21
3/12/26,2026-03-12
7/9-2028,2028-09-07
20 December 1994,1994-12-20
2/9/2008,2008-02-09
10/2/2029,2029-10-02
19Apr1999,1999-04-19
12-11-30,2030-12-11
18/12-1992,1992-12-18
4-11-1996,1996-11-02
8-27-02,2002-08-27
28 tháng 12 năm 2011,2011-12-28
6/6/27,2027-06-06
"April 24, 2021",2021-04-24
4/11/2003,2003-11-04
17/22-2001,2001-11-17
13/2/02,2002-02-13
13 Fe 2013,2013-02-13
6 Jun 2012,2012-06-06
2008-12-4,2008-12-04
1-3-1991,1991-03-01
28-2-1995,1995-02-28
Oct 18 21,2021-10-18
ngày 23 tháng 2 năm 1991,1991-02-23
18-8,2018-08-18
14 tháng 1 năm 2005,2005-01-14
10/8/2033,2033-08-10
7/20/04,2004-07-20
48-4-2016,2016-04-24
ngày 22 tháng 10 năm 2012,2012-10-22
2029-1-13,2029-01-13
2034-4-20,2034-04-20
21/8/10,2010-08-21
27/12/91,1991-12-27
19/1-2032,2032-01-19
21Dec1999,1999-12-21
4/14/24,2024-04-14
11/10-2025,2025-05-11
22.11.2023,2023-11-22
11-9,2000-09-11
21/36/1997,1997-12-21
6-21-26,2026-06-21
7/12-2014,2014-12-07
2/11/2020,2020-02-11
16/2/15,2015-02-16
3 Feb 2025,2025-02-03
3 tháng 2 năm 2012,2012-02-03
2-4-2033,2033-04-02
16/9-2003,2003-09-16
1-4-2009,2009-04-01
25Jun2013,2013-06-25
"May 11th, 2023",2023-05-11
2/10/06,2006-10-02
24.4.2035,2035-04-24
5/6/90,1990-05-06
26 May 2024,2024-05-26
7/7/2002,2002-07-07
11/10-2023,2023-10-11
"Nov 18th, 2004",2004-11-18
22-3,2016-03-22
Mar 21 16,2016-03-21
"August 21, 1996",1996-08-21
14-4,2034-04-14
5 Jul 2024,2024-07-05
20-12-1994,1994-12-20
7 Oc 1998,1998-10-07
"Sep 24th, 2030",2030-09-24
8/7/92,1992-08-07
2034/6,2034-06-07
5 Ma 2022,2022-05-05
16082001,2001-08-16
21/15/2012,2012-05-21
2011/3/4,2011-03-04
Aug 20 12,2012-08-20
"Aug 6th, 2013",2013-08-06
7/13/1993,1993-07-13
21/6/2015,2015-06-21
4-12-2033,2033-12-02
2 Aug 1992,1992-08-02
4/5/08,2008-05-04
Aug 25 29,2029-08-25
19Apr1992,1992-04-19
46-5-2034,2034-05-23
2nd of August 2001,2001-08-02
15/2/33,2033-02-15
2015/6,2015-06-01
7th of October 2028,2028-10-07
12-7-2008,2008-07-06
2003/6/7,2003-06-07
20/27/2033,2033-09-20
7 tháng 1 năm 2005,2005-01-07
4-5-1994,1994-05-02
01122020,2020-12-01
1/12-2024,2024-06-01
10/24/2017,2017-08-10
8th of August 2028,2028-08-08
10101993,1993-10-10
19/5-2014,2014-05-19
2017/2/24,2017-02-24
"May 8, 1992",1992-05-08
"Jul 22th, 2019",2019-07-22
Feb 20 92,1992-02-20
9-4-1992,1992-04-09
8/1/11,2011-01-08
22 tháng 1 năm 2031,2031-01-22
7-5-2013,2013-05-07
10/26/1997,1997-10-26
1st of June 2032,2032-06-01
Jul 2 35,2035-07-02
10/22/99,1999-10-22
1/3-2031,2031-03-01
28/8-2006,2006-04-28
22-2-2022,2022-02-11
6/13/1999,1999-06-13
20/1/2021,2021-01-20
28.3.2005,2005-03-28
6-7-2012,2012-07-03
18 Mar 2014,2014-03-18
2002-1-17,2002-01-17
Oct 3 01,2001-10-03
27:7:2010,2010-07-27
3/10-2021,2021-10-03
6-1-2005,2005-01-06
3/1/31,2031-03-01
17/5-2003,2003-05-17
"January 7, 2015",2015-01-07
"May 11, 2003",2003-05-11
26 Ju 2000,2000-07-26
8 February 1992,1992-02-08
11Feb2002,2002-02-11
4/11/15,2015-11-04
2022/6/15,2022-06-15
24.3.2026,2026-03-24
16-5-2015,2015-05-08
"June 7, 1997",1997-06-07
21/12-2005,2005-06-21
26-10,2029-10-26
20 Apr 2033,2033-04-20
19082012,2012-08-19
1-1-15,2015-01-01
2/5-1996,1996-05-02
09101995,1995-10-09
5-3-27,2027-05-03
10.6.1996,1996-06-10
6 tháng 3 năm 2003,2003-03-06
20th of June 1990,1990-06-20
28-12,2032-12-28
22/9/10,2010-09-22
27Apr2016,2016-04-27
27 May 1998,1998-05-27
6-12,2032-12-06
14-1-2018,2018-01-14
"May 23, 2024",2024-05-23
25:8:2017,2017-08-25
4/9-2003,2003-09-04
34-9-2011,2011-09-17
"Jun 12th, 2015",2015-06-12
2033/1/12,2033-01-12
Jun 15 15,2015-06-15
"Mar 2nd, 1999",1999-03-02
ngày 23 tháng 4 năm 2015,2015-04-23
8 January 2007,2007-01-08
13 November 1990,1990-11-13
1995-3-18,1995-03-18
17-11-2015,2015-11-17
20 July 2005,2005-07-20
26/22-2035,2035-11-26
7-11,2025-11-07
18/6/2015,2015-02-18
19:2:2002,2002-02-19
21/3/32,2032-03-21
Oct 24 24,2024-10-24
26/24-2033,2033-12-26
11/10/1992,1992-10-11
8:8:2010,2010-08-08
22/1/34,2034-01-22
11/9-2001,2001-09-11
12/5-2018,2018-05-12
11/10/2007,2007-10-11
17th of November 2024,2024-11-17
"February 15, 2023",2023-02-15
1/4-2022,2022-02-01
7/12/00,2000-07-12
1995/8/2,1995-08-02
23-5-1991,1991-05-23
17-2-2013,2013-02-17
26-1-2006,2006-01-26
9-9,2010-09-09
1 June 1992,1992-06-01
4 Ju 2006,2006-06-04
20:2:1993,1993-02-20
Sep 28 17,2017-09-28
24.12.2016,2016-12-24
05112026,2026-11-05
"September 22, 2031",2031-09-22
28 Ju 2014,2014-06-28
24/11/14,2014-11-24
25/9/2000,2000-03-25
26 tháng 7 năm 1995,1995-07-26
7/26/2014,2014-07-26
7.2.1995,1995-02-07
5:5:2026,2026-05-05
11Sep2000,2000-09-11
26122014,2014-12-26
23th of June 2003,2003-06-23
23101998,1998-10-23
2028-11-28,2028-11-28
28/10/10,2010-10-28
16/15/1993,1993-05-16
13-7-1992,1992-07-13
2003-9-13,2003-09-13
24/9-2031,2031-09-24
7 tháng 3 năm 2001,2001-03-07
Oct 11 25,2025-10-11
18/11-2011,2011-11-18
7-8-94,1994-07-08
23th of June 2004,2004-06-23
9/27/2009,2009-09-27
16:1:2005,2005-01-16
7:11:2017,2017-11-07
27 Feb 2003,2003-02-27
01092002,2002-09-01
6/6/2003,2003-02-06
1995-12-25,1995-12-25
12 Mar 1998,1998-03-12
27 Ma 2030,2030-03-27
10/1-2026,2026-01-10
2034-12-3,2034-12-03
13/8-2015,2015-08-13
2007/9/21,2007-09-21
ngày 16 tháng 2 năm 2021,2021-02-16
13/9/1997,1997-09-13
Feb 11 13,2013-02-11
"November 19, 2026",2026-11-19
23.3.2019,2019-03-23
1998/2,1998-02-08
4-1-05,2005-04-01
"May 11th, 2016",2016-05-11
21/3-2035,2035-03-21
3/8/93,1993-08-03
10 tháng 10 năm 2013,2013-10-10
9-4-24,2024-09-04
2005/8/15,2005-08-15
21-1,2018-01-21
6 August 2020,2020-08-06
5/20/98,1998-05-20
"Feb 17th, 2024",2024-02-17
12/2-1991,1991-01-12
5/16/2026,2026-05-16
7/6/01,2001-07-06
"Apr 15th, 2017",2017-04-15
18 Ju 2034,2034-07-18
21th of July 2033,2033-07-21
12/18-1991,1991-09-12
3-1-08,2008-03-01
9/18/33,2033-09-18
56-8-2022,2022-08-28
15-7-2008,2008-07-15
9Nov2003,2003-11-09
16/6/2006,2006-02-16
3/4/2000,2000-03-04
18/4/1997,1997-04-18
10 Ma 2034,2034-05-10
2034-11-20,2034-11-20
11 December 2018,2018-12-11
5/12/22,2022-12-05
7/7/92,1992-07-07
2007/9,2007-09-09
13May1999,1999-05-13
19 January 1994,1994-01-19
21th of November 2022,2022-11-21
27/2-2014,2014-02-27
"Dec 10th, 2028",2028-12-10
5 tháng 10 năm 1999,1999-10-05
2 February 2030,2030-02-02
46-4-2029,2029-04-23
Sep 13 19,2019-09-13
"Feb 11th, 2027",2027-02-11
9/8-1996,1996-08-09
6/6-2020,2020-06-06
Apr 12 27,2027-04-12
19-12-1993,1993-12-19
2029/3,2029-03-16
28 August 2033,2033-08-28
11Mar2014,2014-03-11
"May 11, 1991",1991-05-11
6/7/23,2023-07-06
4/4/22,2022-04-04
27:9:2013,2013-09-27
2019/8/15,2019-08-15
7-4-2001,2001-04-07
6/8/24,2024-06-08
6.9.2034,2034-09-06
1995/5,1995-05-19
Jul 11 34,2034-07-11
8/18/1995,1995-08-18
28-6-2012,2012-06-28
19/6/1991,1991-02-19
Apr 19 21,2021-04-19
24 Jun 2005,2005-06-24
27/6-2011,2011-03-27
10/14/2007,2007-10-14
11/4-2019,2019-02-11
1/26/24,2024-01-26
06092021,2021-09-06
3 Ju 2025,2025-06-03
2028/6/8,2028-06-08
19.7.2013,2013-07-19
4/2-1992,1992-02-04
36-3-2017,2017-03-18
10-8-1998,1998-08-05
7:11:2019,2019-11-07
26/11/2010,2010-11-26
27/18/2026,2026-06-27
19-12,2035-12-19
1.7.1993,1993-07-01
3.1.1993,1993-01-03
2013/10/28,2013-10-28
2027/12,2027-12-28
21/5/03,2003-05-21
1995/1,1995-01-07
Mar 25 02,2002-03-25
9/7/2013,2013-09-07
9 February 2011,2011-02-09
"August 10, 2026",2026-08-10
20/6-2022,2022-03-20
10/6/07,2007-10-06
24:11:2028,2028-11-24
17/9/2006,2006-03-17
20/5/14,2014-05-20
4 Oc 1994,1994-10-04
20/9-2026,2026-09-20
23 Jun 2034,2034-06-23
23/24/2019,2019-08-23
17041991,1991-04-17
16/6/10,2010-06-16
"Jul 23th, 2004",2004-07-23
21Jun2035,2035-06-21
15 tháng 7 năm 2031,2031-07-15
27Jan2024,2024-01-27
"Dec 22th, 2021",2021-12-22
5/4-1997,1997-04-05
5/4/04,2004-04-05
14/8/2032,2032-08-14
48-12-2030,2030-12-24
18/36/2029,2029-12-18
13-4-2023,2023-04-13
5/10/95,1995-10-05
24/8-1993,1993-08-24
2024/7/13,2024-07-13
23/5-2012,2012-05-23
"September 5, 1995",1995-09-05
2-3-2034,2034-03-01
5 Fe 2006,2006-02-05
7-7-34,2034-07-07
34-5-2026,2026-05-17
25 tháng 11 năm 2029,2029-11-25
21/12-2028,2028-12-21
28.11.2007,2007-11-28
7:12:2020,2020-12-07
21/12/21,2021-12-21
3rd of February 2033,2033-02-03
24-7-2023,2023-07-24
25/18-2023,2023-09-25
3/9/06,2006-09-03
2027/9/15,2027-09-15
5/6-2027,2027-06-05
23 tháng 3 năm 1990,1990-03-23
12/2/2031,2031-12-02
5/5/21,2021-05-05
16/3/2011,2011-01-16
Sep 10 14,2014-09-10
15122009,2009-12-15
13-6,2008-06-13
11/10-2017,2017-10-11
2/6-2005,2005-06-02
24/12-1994,1994-12-24
6/7/1992,1992-06-07
1/12/06,2006-01-12
"December 14, 2010",2010-12-14
1997-2-23,1997-02-23
"Mar 15th, 1994",1994-03-15
26 Ju 2013,2013-07-26
7/11-2008,2008-11-07
4/9/34,2034-09-04
2015-8-7,2015-08-07
09102003,2003-10-09
01102002,2002-10-01
9/2-2024,2024-02-09
2014/8,2014-08-15
1999-4-6,1999-04-06
8/12-2023,2023-06-08
10 No 2028,2028-11-10
16:12:2018,2018-12-16
6/9/90,1990-09-06
04061998,1998-06-04
13:7:2031,2031-07-13
2033-1-23,2033-01-23
23-1-2035,2035-01-23
"Jun 14th, 2018",2018-06-14
06102011,2011-10-06
6/7-2008,2008-07-06
27-8,2024-08-27
"Sep 4th, 1997",1997-09-04
7/23/2024,2024-07-23
17th of February 2013,2013-02-17
10/10/99,1999-10-10
2012-6-23,2012-06-23
1.6.2029,2029-06-01
2-3-2020,2020-03-02
14 Apr 2001,2001-04-14
5 Fe 2035,2035-02-05
15/1/20,2020-01-15
19-1,2017-01-19
6/11/90,1990-11-06
2031/8,2031-08-11
2004/8,2004-08-01
9th of May 2030,2030-05-09
11-14-13,2013-11-14
2000-1-18,2000-01-18
11/13/04,2004-11-13
15/27/2029,2029-09-15
10-4-2027,2027-04-10
"July 2, 2019",2019-07-02
18/10-2021,2021-05-18
20.11.2004,2004-11-20
20 tháng 6 năm 2035,2035-06-20
5Dec1999,1999-12-05
11Feb2004,2004-02-11
7/22/2015,2015-07-22
"Oct 13th, 2012",2012-10-13
4/7-2032,2032-07-04
11-23-16,2016-11-23
22/3-2004,2004-03-22
6/12/29,2029-12-06
24/4-1991,1991-02-24
36-12-1993,1993-12-18
17/12/31,2031-12-17
Feb 3 22,2022-02-03
9/3/2007,2007-09-03
Aug 28 20,2020-08-28
8/15/1991,1991-08-15
27/3-2022,2022-03-27
2018/8,2018-08-04
17:9:1996,1996-09-17
10 August 2011,2011-08-10
23012026,2026-01-23
4/11/2017,2017-04-11
21/7-2035,2035-07-21
19/3-2012,2012-03-19
25081993,1993-08-25
3-9-2012,2012-09-03
36-4-1996,1996-04-18
25.12.1997,1997-12-25
22-5-1993,1993-05-22
2026/2/15,2026-02-15
4-11-2015,2015-11-02
ngày 13 tháng 11 năm 2009,2009-11-13
56-4-2001,2001-04-28
1-9,2033-09-01
16 tháng 9 năm 2019,2019-09-16
Jun 3 18,2018-06-03
12Oct2007,2007-10-12
22/27/2014,2014-09-22
16/11-2026,2026-11-16
24/12/09,2009-12-24
6/16/10,2010-06-16
ngày 9 tháng 1 năm 1990,1990-01-09
"Aug 27th, 2005",2005-08-27
11/10/99,1999-10-11
18-4-2030,2030-04-18
7.12.2018,2018-12-07
2023/12/28,2023-12-28
6/10/16,2016-10-06
11 Feb 2018,2018-02-11
20/11/2003,2003-11-20
21/4-2028,2028-02-21
1992/1,1992-01-07
19/10-2030,2030-10-19
22/3/30,2030-03-22
7Sep2026,2026-09-07
Jan 20 22,2022-01-20
7-1-03,2003-07-01
"September 6, 2001",2001-09-06
ngày 23 tháng 10 năm 1990,1990-10-23
14/27/2019,2019-09-14
Dec 11 07,2007-12-11
2/10-2022,2022-10-02
10/8/27,2027-10-08
14-6,2000-06-14
10.11.1998,1998-11-10
13-7,2003-07-13
14-4,1995-04-14
30-8-2014,2014-08-15
2018/5,2018-05-21
18-10,1991-10-18
Aug 16 27,2027-08-16
8-25-91,1991-08-25
1/2/20,2020-01-02
2035/11,2035-11-22
"September 28, 2030",2030-09-28
8Jun2028,2028-06-08
1/13/1998,1998-01-13
1995/1,1995-01-04
14022026,2026-02-14
2012-3-11,2012-03-11
1992/12,1992-12-05
26:4:2010,2010-04-26
2018/12,2018-12-17
8/7/2015,2015-07-08
2031/7/28,2031-07-28
1995/1,1995-01-22
24/10-2013,2013-10-24
09102018,2018-10-09
2013-6-3,2013-06-03
2-12,2005-12-02
20-4,2032-04-20
13 tháng 4 năm 1990,1990-04-13
3/12-2034,2034-12-03
ngày 27 tháng 4 năm 2011,2011-04-27
13:4:1992,1992-04-13
16Feb2012,2012-02-16
14th of July 1997,1997-07-14
1992/11/5,1992-11-05
21/12-2021,2021-12-21
7/2-1997,1997-02-07
5/8/33,2033-08-05
1996/10/21,1996-10-21
8 Oct 2017,2017-10-08
1-10-1992,1992-10-01
Feb 12 01,2001-02-12
10/3/07,2007-03-10
"Nov 1st, 2033",2033-11-01
"Aug 23th, 1992",1992-08-23
2005-12-23,2005-12-23
3/9/2014,2014-09-03
"Dec 12th, 2017",2017-12-12
9 Mar 2015,2015-03-09
8th of April 2017,2017-04-08
2016/8/14,2016-08-14
4 Dec 2000,2000-12-04
"May 4th, 2004",2004-05-04
12-21-27,2027-12-21
54-4-2005,2005-04-27
20-3-2007,2007-03-20
04072004,2004-07-04
Jan 22 13,2013-01-22
3/3/1995,1995-03-03
18-10-2031,2031-10-09
27:9:2002,2002-09-27
2014-12-13,2014-12-13
11-5-98,1998-11-05
05022002,2002-02-05
1/6-1994,1994-03-01
10 Ma 2033,2033-05-10
10-9,1990-09-10
11.12.2021,2021-12-11
Nov 16 23,2023-11-16
7/20-2014,2014-10-07
25/9-2030,2030-09-25
23 Jan 2000,2000-01-23
2004/10,2004-10-20
9-16-33,2033-09-16
26-4,1992-04-26
13Mar2021,2021-03-13
Sep 21 99,1999-09-21
18/4/94,1994-04-18
16/7-1992,1992-07-16
9/13/29,2029-09-13
06032014,2014-03-06
44-12-1990,1990-12-22
14Jul2023,2023-07-14
13/6/07,2007-06-13
15/18/1992,1992-06-15
Jan 1 90,1990-01-01
11 Fe 2017,2017-02-11
4-9,2011-09-04
24/24-2018,2018-12-24
10/27/2031,2031-10-27
"November 13, 2011",2011-11-13
6 tháng 6 năm 2025,2025-06-06
"Jan 23th, 2023",2023-01-23
23/12/2029,2029-12-23
10-8,2025-08-10
26121992,1992-12-26
22 Feb 2012,2012-02-22
13:11:2020,2020-11-13
"March 13, 1997",1997-03-13
"August 22, 1998",1998-08-22
2024/1,2024-01-01
16 De 2016,2016-12-16
21Sep2030,2030-09-21
Aug 14 12,2012-08-14
20/10/22,2022-10-20
2021/11,2021-11-13
25:11:2007,2007-11-25
18 Nov 2033,2033-11-18
11 April 2001,2001-04-11
2034/12,2034-12-06
1996-2-22,1996-02-22
2028/9,2028-09-07
07021994,1994-02-07
2030-12-21,2030-12-21
4/22-1993,1993-11-04
4/16/16,2016-04-16
7/4/29,2029-07-04
5/6/90,1990-06-05
2-8-34,2034-02-08
Jun 25 07,2007-06-25
13/5-1993,1993-05-13
19/3/1998,1998-03-19
5:4:2030,2030-04-05
28/24/2013,2013-08-28
3-16-34,2034-03-16
7/27/2004,2004-07-27
10/10-2032,2032-10-10
08041999,1999-04-08
22/1-1995,1995-01-22
7/3/2021,2021-07-03
8 August 2005,2005-08-08
28/6/03,2003-06-28
1 Ma 2019,2019-05-01
"Feb 17th, 1999",1999-02-17
3-6-1998,1998-06-03
Mar 4 20,2020-03-04
2007-8-10,2007-08-10
2/3/1996,1996-02-03
16/9-2029,2029-09-16
22/9/2026,2026-09-22
25011990,1990-01-25
4-5-11,2011-04-05
6/4/2000,2000-04-06
20/1-2001,2001-01-20
26.8.2004,2004-08-26
5/3/17,2017-05-03
2024/1,2024-01-12
12/12/2003,2003-04-12
5 tháng 6 năm 1997,1997-06-05
4:10:2031,2031-10-04
ngày 17 tháng 4 năm 2002,2002-04-17
9 tháng 4 năm 2000,2000-04-09
2009/9,2009-09-07
16122016,2016-12-16
ngày 19 tháng 3 năm 2027,2027-03-19
23 May 2017,2017-05-23
25/1-2002,2002-01-25
"January 14, 2034",2034-01-14
38-1-2025,2025-01-19
1998/2/2,1998-02-02
22-1-2011,2011-01-11
4.2.2028,2028-02-04
25 January 2031,2031-01-25
4 Ju 2032,2032-07-04
11/26/2002,2002-11-26
2/12/1999,1999-12-02
10/3/15,2015-10-03
13/6/2003,2003-02-13
9/6/2002,2002-06-09
9 August 2018,2018-08-09
2024/2/19,2024-02-19
10/8/2025,2025-10-08
12/6/2023,2023-12-06
14/1/06,2006-01-14
23 June 2035,2035-06-23
5/24/2015,2015-08-05
2May2011,2011-05-02
21/9-2030,2030-09-21
24/9/1992,1992-03-24
Nov 23 95,1995-11-23
4 De 1990,1990-12-04
23-4,2035-04-23
"Mar 23th, 2027",2027-03-23
13May2008,2008-05-13
"Feb 3rd, 2004",2004-02-03
11/8/2014,2014-08-11
28.4.1994,1994-04-28
5/7-1993,1993-07-05
20 Ma 2031,2031-05-20
6/14-2015,2015-07-06
24 April 2027,2027-04-24
12/24/04,2004-12-24
13102001,2001-10-13
5/5/35,2035-05-05
9/8-2006,2006-08-09
10th of August 2012,2012-08-10
12062032,2032-06-12
23/1-1996,1996-01-23
22.2.1992,1992-02-22
3 No 2000,2000-11-03
ngày 11 tháng 4 năm 2032,2032-04-11
ngày 4 tháng 8 năm 2025,2025-08-04
22 Au 2007,2007-08-22
2015/11,2015-11-22
"May 8, 2032",2032-05-08
1/10-2009,2009-10-01
5.5.2018,2018-05-05
26Jun2019,2019-06-26
13th of April 2028,2028-04-13
4/25/29,2029-04-25
9/22/2016,2016-09-22
14 March 2035,2035-03-14
2 Ju 2024,2024-06-02
1/18/03,2003-01-18
1997-10-26,1997-10-26
23 Ma 2014,2014-05-23
16 June 2020,2020-06-16
5/30/1998,1998-10-05
ngày 27 tháng 10 năm 1991,1991-10-27
11-24-25,2025-11-24
14Sep2014,2014-09-14
"January 2, 2031",2031-01-02
1998-3-12,1998-03-12
17-12,2013-12-17
3/2-2003,2003-02-03
12-19-14,2014-12-19
28/11/00,2000-11-28
3-16-13,2013-03-16
10 June 1992,1992-06-10
4/4/2014,2014-04-04
15 Nov 2034,2034-11-15
23-1,2026-01-23
21/4/35,2035-04-21
16Dec2010,2010-12-16
24 tháng 9 năm 1997,1997-09-24
10Jul2006,2006-07-10
28/11-2006,2006-11-28
3-4-2003,2003-04-03
10-6,2018-06-10
1/25/22,2022-01-25
16/24/2024,2024-08-16
20 Jun 2034,2034-06-20
15th of July 2016,2016-07-15
23.1.2017,2017-01-23
16-12-2013,2013-12-08
"April 26, 2011",2011-04-26
23 Ju 2021,2021-07-23
24-7-2006,2006-07-12
Sep 4 09,2009-09-04
6 De 2024,2024-12-06
1990/10,1990-10-25
23/2-2002,2002-02-23
23082024,2024-08-23
20/2/13,2013-02-20
20/9/1997,1997-03-20
28/6/06,2006-06-28
7-6,2000-06-07
12/13/16,2016-12-13
2 May 2002,2002-05-02
20 September 1990,1990-09-20
6-15-02,2002-06-15
01011993,1993-01-01
"February 15, 2015",2015-02-15
3.12.1990,1990-12-03
Dec 21 94,1994-12-21
7/28/2026,2026-07-28
10 De 2014,2014-12-10
13/7-2020,2020-07-13
21th of February 2015,2015-02-21
10-14-97,1997-10-14
2017/6,2017-06-17
3/14/2029,2029-03-14
17th of February 2027,2027-02-17
6Apr2031,2031-04-06
26/4/31,2031-04-26
3/8/30,2030-08-03
15 December 2017,2017-12-15
5th of December 2033,2033-12-05
1/23/2022,2022-01-23
9/9/2028,2028-09-09
22 tháng 5 năm 2016,2016-05-22
14 Ju 1992,1992-06-14
4/18/31,2031-04-18
10/30/2008,2008-10-10
11/7-2030,2030-07-11
07022022,2022-02-07
7/4/13,2013-07-04
7th of July 2025,2025-07-07
50-7-1991,1991-07-25
17011996,1996-01-17
"January 23, 1993",1993-01-23
1996/4,1996-04-22
2033-5-16,2033-05-16
14/6-2020,2020-03-14
5th of October 2007,2007-10-05
21-12-2006,2006-12-21
20/3/08,2008-03-20
7-1,2013-01-07
13 tháng 8 năm 1993,1993-08-13
"Jun 15th, 2009",2009-06-15
Dec 17 30,2030-12-17
"Jan 19th, 1991",1991-01-19
3-24-27,2027-03-24
10-5-13,2013-10-05
4 tháng 7 năm 2004,2004-07-04
11/9/30,2030-09-11
20:5:2007,2007-05-20
ngày 26 tháng 6 năm 2030,2030-06-26
3/6/2010,2010-02-03
21-10-2014,2014-10-21
"Jun 22th, 2027",2027-06-22
19/2/04,2004-02-19
"May 21, 1995",1995-05-21
1 Feb 2005,2005-02-01
27Jun2008,2008-06-27
ngày 2 tháng 12 năm 1992,1992-12-02
6/7-1996,1996-07-06
16-7-2007,2007-07-08
2 tháng 1 năm 2025,2025-01-02
Jun 22 34,2034-06-22
8 tháng 6 năm 2001,2001-06-08
2004-8-5,2004-08-05
10/3-2034,2034-03-10
8-12-2007,2007-12-04
1Dec1997,1997-12-01
25/20-1999,1999-10-25
"Dec 9th, 2005",2005-12-09
25May2022,2022-05-25
7-15-20,2020-07-15
2006/8,2006-08-24
27/11-1994,1994-11-27
ngày 18 tháng 6 năm 1995,1995-06-18
2015/3,2015-03-15
9-24-91,1991-09-24
6/20-2019,2019-10-06
10-12-2026,2026-12-05
27Jun2005,2005-06-27
4 tháng 11 năm 2018,2018-11-04
5/7/34,2034-05-07
Aug 27 12,2012-08-27
2 Mar 2000,2000-03-02
ngày 5 tháng 11 năm 2011,2011-11-05
5/9/35,2035-05-09
10/4-2025,2025-04-10
13 May 2018,2018-05-13
5/25/2003,2003-05-25
2009-2-22,2009-02-22
9/12-2032,2032-06-09
"July 5, 2035",2035-07-05
9/17/1998,1998-09-17
2000-7-15,2000-07-15
12th of August 2026,2026-08-12
7/1/99,1999-01-07
"Jan 10th, 2015",2015-01-10
4/33/2002,2002-11-04
2029/9/3,2029-09-03
26:4:2016,2016-04-26
"Sep 3rd, 1998",1998-09-03
10.5.2015,2015-05-10
13/2/2019,2019-02-13
26 tháng 2 năm 2026,2026-02-26
"February 7, 2000",2000-02-07
2/9/06,2006-09-02
19:3:2009,2009-03-19
28 tháng 3 năm 2019,2019-03-28
"Sep 15th, 1999",1999-09-15
28May2014,2014-05-28
10/4/29,2029-04-10
ngày 15 tháng 5 năm 2023,2023-05-15
7/1-2011,2011-01-07
42-2-1990,1990-02-21
25/5-2019,2019-05-25
Oct 5 90,1990-10-05
13Oct2024,2024-10-13
5/19/35,2035-05-19
"Dec 16th, 1991",1991-12-16
13/12/1991,1991-12-13
11/7/08,2008-07-11
11-12-08,2008-11-12
7/2-1996,1996-02-07
10/7-2006,2006-07-10
"March 4, 2021",2021-03-04
20-5-2013,2013-05-20
4-13-31,2031-04-13
10-8-16,2016-10-08
7/3/2012,2012-01-07
"December 28, 2035",2035-12-28
1999/4,1999-04-08
12.12.2029,2029-12-12
4/7-2031,2031-07-04
"April 25, 2027",2027-04-25
1/4/2026,2026-01-04
ngày 24 tháng 9 năm 2029,2029-09-24
19/4/1999,1999-04-19
18-6,2015-06-18
15 Sep 1994,1994-09-15
10/28/2003,2003-10-28
24 tháng 3 năm 1998,1998-03-24
18032032,2032-03-18
21th of January 2008,2008-01-21
6/4/17,2017-04-06
25/1-2014,2014-01-25
"January 4, 2035",2035-01-04
18/2/2034,2034-02-18
20/8/29,2029-08-20
26 tháng 3 năm 1992,1992-03-26
7:4:1999,1999-04-07
24 August 2027,2027-08-24
15th of October 2007,2007-10-15
"April 14, 2022",2022-04-14
2021-1-13,2021-01-13
1/25/2027,2027-01-25
23/6/98,1998-06-23
1/1/1997,1997-01-01
18.5.1995,1995-05-18
54-3-2021,2021-03-27
12-16-28,2028-12-16
13/3/2028,2028-03-13
27/10/90,1990-10-27
2011/9/23,2011-09-23
11 December 2028,2028-12-11
13:5:2001,2001-05-13
17 Ja 2016,2016-01-17
13/18-2009,2009-09-13
ngày 8 tháng 10 năm 1992,1992-10-08
23/20-1996,1996-10-23
1 Fe 2021,2021-02-01
13/1-2008,2008-01-13
ngày 20 tháng 9 năm 1998,1998-09-20
28/5/90,1990-05-28
11/1/95,1995-11-01
5/12/2028,2028-12-05
17041993,1993-04-17
5-2,1999-02-05
13:6:2002,2002-06-13
2001/11/3,2001-11-03
2030-6-20,2030-06-20
2020-10-3,2020-10-03
7:10:2017,2017-10-07
3.9.2009,2009-09-03
ngày 22 tháng 10 năm 1997,1997-10-22
2024-2-6,2024-02-06
Aug 10 16,2016-08-10
8-1-95,1995-08-01
19/5/20,2020-05-19
1.4.1990,1990-04-01
20102019,2019-10-20
9-5-2000,2000-05-09
11/11/2028,2028-11-11
21-2-1995,1995-02-21
17/2/97,1997-02-17
10/14/2030,2030-10-14
2013-4-28,2013-04-28
16/3/2008,2008-01-16
7/14/1993,1993-07-14
28/9-2001,2001-09-28
14-12-2007,2007-12-14
12/9/94,1994-12-09
5/26/20,2020-05-26
14 Oct 2008,2008-10-14
13.1.1995,1995-01-13
1994/8,1994-08-02
12 Ja 1991,1991-01-12
"July 2, 2011",2011-07-02
8/9/10,2010-09-08
54-3-1992,1992-03-27
"Apr 1st, 2017",2017-04-01
3/15/1998,1998-03-15
8/11-2013,2013-11-08
14:9:2002,2002-09-14
28 Nov 1999,1999-11-28
20/11/19,2019-11-20
12-17-26,2026-12-17
7/24/31,2031-07-24
19-12,1998-12-19
7th of May 1999,1999-05-07
16-7-2007,2007-07-08
48-8-2005,2005-08-24
25Jun2029,2029-06-25
26 tháng 3 năm 2031,2031-03-26
2-8-99,1999-02-08
7/12/23,2023-07-12
12:11:2035,2035-11-12
ngày 27 tháng 5 năm 2004,2004-05-27
9th of July 2029,2029-07-09
19/3/11,2011-03-19
16 tháng 2 năm 2004,2004-02-16
"July 8, 1999",1999-07-08
23102001,2001-10-23
13/7/10,2010-07-13
11/5/12,2012-05-11
28-5-2026,2026-05-28
9 Dec 1992,1992-12-09
11/6/07,2007-06-11
4 tháng 2 năm 2022,2022-02-04
18 tháng 2 năm 2032,2032-02-18
14-5-2030,2030-05-07
"March 16, 2025",2025-03-16
8-4,2018-04-08
ngày 26 tháng 12 năm 2008,2008-12-26
ngày 22 tháng 2 năm 2003,2003-02-22
18/9/1990,1990-03-18
18/7-2019,2019-07-18
"Feb 27th, 2028",2028-02-27
28/12/2014,2014-12-28
22-11-2005,2005-11-22
5/9/94,1994-09-05
12/14/1993,1993-12-14
28th of November 2008,2008-11-28
ngày 18 tháng 3 năm 1997,1997-03-18
25/20-2011,2011-10-25
3 Jan 2010,2010-01-03
12/26/2035,2035-12-26
19/6-2024,2024-06-19
2014/3/17,2014-03-17
ngày 20 tháng 8 năm 1992,1992-08-20
17/2/18,2018-02-17
21Dec2030,2030-12-21
"Mar 12th, 2024",2024-03-12
4th of August 1991,1991-08-04
1.11.1992,1992-11-01
3Jan2033,2033-01-03
18:6:2015,2015-06-18
8.10.1995,1995-10-08
Feb 2 15,2015-02-02
1995/4/3,1995-04-03
28/10/2008,2008-10-28
5/7/28,2028-07-05
5/3/32,2032-03-05
5.12.2015,2015-12-05
14.2.2026,2026-02-14
24-4-1998,1998-04-24
2008/5/19,2008-05-19
1992-1-25,1992-01-25
14072020,2020-07-14
10/27/2028,2028-09-10
10/11-2013,2013-11-10
1st of July 2016,2016-07-01
ngày 8 tháng 3 năm 2023,2023-03-08
19 May 2011,2011-05-19
4/2/21,2021-04-02
10/8/2007,2007-08-10
21/3/2006,2006-03-21
11/7/18,2018-07-11
7/24/91,1991-07-24
9/2/2034,2034-09-02
17Jul2034,2034-07-17
Oct 8 99,1999-10-08
6/7/06,2006-06-07
9/4/18,2018-04-09
"January 5, 1991",1991-01-05
21 May 1998,1998-05-21
"October 3, 2024",2024-10-03
Nov 1 92,1992-11-01
20:5:2025,2025-05-20
36-4-1997,1997-04-18
12/20-1993,1993-10-12
13 Jan 2007,2007-01-13
11/3/15,2015-03-11
12/3/2015,2015-12-03
1 Aug 1990,1990-08-01
22/4/1997,1997-04-22
12/9/22,2022-09-12
5/3-2012,2012-03-05
25112021,2021-11-25
19/12/2019,2019-04-19
21-6-1994,1994-06-21
28 Aug 2020,2020-08-28
5/8-2014,2014-08-05
2/8/2011,2011-08-02
1999/2,1999-02-19
23/3/12,2012-03-23
9/5-2014,2014-05-09
14/1-2014,2014-01-14
40-5-2035,2035-05-20
2028/5/26,2028-05-26
ngày 5 tháng 12 năm 2004,2004-12-05
12/2/97,1997-02-12
4/4-2028,2028-02-04
28011999,1999-01-28
10/3/2005,2005-03-10
Jul 22 21,2021-07-22
13-1-1995,1995-01-13
1990-11-13,1990-11-13
12-5-1995,1995-05-12
"August 24, 2012",2012-08-24
21/12/2023,2023-12-21
16/5-2009,2009-05-16
15 May 2013,2013-05-15
11-8-2017,2017-08-11
21.5.2023,2023-05-21
6-14-18,2018-06-14
7 Aug 2027,2027-08-07
30-4-2023,2023-04-15
3/4/1997,1997-03-04
12:2:2026,2026-02-12
18.8.1990,1990-08-18
18/6/99,1999-06-18
7/6/26,2026-06-07
2027/6/26,2027-06-26
4/1/94,1994-01-04
11th of December 1991,1991-12-11
10/21/2029,2029-07-10
14/1-2003,2003-01-14
8/14-1994,1994-07-08
21/11/30,2030-11-21
ngày 26 tháng 7 năm 1997,1997-07-26
2009/12/21,2009-12-21
26/8-2033,2033-04-26
ngày 7 tháng 3 năm 1998,1998-03-07
21th of March 1992,1992-03-21
21-2,2027-02-21
5/4/2032,2032-05-04
7.5.2025,2025-05-07
25th of October 2023,2023-10-25
6/11/21,2021-06-11
18/15/2023,2023-05-18
13/4/14,2014-04-13
16/1-1992,1992-01-16
15/11-2001,2001-11-15
26/3-2019,2019-03-26
1 January 2010,2010-01-01
12/23/2011,2011-12-23
14.12.2004,2004-12-14
3:8:1998,1998-08-03
26Sep2000,2000-09-26
2004-7-8,2004-07-08
2034-6-18,2034-06-18
16112032,2032-11-16
2027-2-4,2027-02-04
5-2-2011,2011-02-05
2015/10,2015-10-20
19/7/19,2019-07-19
2027/1,2027-01-17
2012-2-26,2012-02-26
11.1.2029,2029-01-11
19th of January 2022,2022-01-19
14 tháng 3 năm 1994,1994-03-14
24 June 2032,2032-06-24
12/2/2004,2004-12-02
9/1-2029,2029-01-09
Apr 23 15,2015-04-23
21012016,2016-01-21
Feb 26 96,1996-02-26
16Jan1993,1993-01-16
16:11:2017,2017-11-16
"July 7, 1994",1994-07-07
7-12,1996-12-07
"Oct 1st, 2016",2016-10-01
"Feb 10th, 2031",2031-02-10
4/2/31,2031-02-04
Jul 19 20,2020-07-19
ngày 14 tháng 5 năm 1998,1998-05-14
2022-5-10,2022-05-10
9/14-2028,2028-07-09
26-4,1993-04-26
16/1/99,1999-01-16
27 tháng 12 năm 2020,2020-12-27
"Nov 1st, 2026",2026-11-01
2022/6/5,2022-06-05
2022/5/6,2022-05-06
23/36/2016,2016-12-23
ngày 28 tháng 9 năm 2014,2014-09-28
3/11/26,2026-03-11
14/2-2019,2019-02-14
6/5/2023,2023-06-05
1996-7-13,1996-07-13
May 19 20,2020-05-19
5 July 2018,2018-07-05
2031-1-4,2031-01-04
Jul 1 34,2034-07-01
3/3/05,2005-03-03
"November 26, 2020",2020-11-26
ngày 22 tháng 8 năm 2002,2002-08-22
27/6-2026,2026-03-27
21:6:2027,2027-06-21
26/11/16,2016-11-26
8/10-1997,1997-10-08
13:4:2001,2001-04-13
15/11/91,1991-11-15
"Jan 2nd, 2011",2011-01-02
11Aug1990,1990-08-11
25-2-2027,2027-02-25
2027/1/3,2027-01-03
14/9/2009,2009-09-14
"Dec 10th, 2034",2034-12-10
2035/2/23,2035-02-23
2013-10-17,2013-10-17
2 Au 2019,2019-08-02
2014-12-17,2014-12-17
3-6,2012-06-03
23/4/1997,1997-04-23
28/6/01,2001-06-28
19/4/19,2019-04-19
"March 22, 2016",2016-03-22
27-11,1990-11-27
21/1/2012,2012-01-21
2018/5/22,2018-05-22
8:7:2005,2005-07-08
"Feb 1st, 2014",2014-02-01
11-10,2008-10-11
7/9-1999,1999-09-07
2 tháng 4 năm 2019,2019-04-02
20 Jul 2004,2004-07-20
22:4:2010,2010-04-22
27 June 1993,1993-06-27
5/5-2009,2009-05-05
4/7/23,2023-07-04
17 tháng 10 năm 2032,2032-10-17
"May 14th, 2000",2000-05-14
14.7.2020,2020-07-14
ngày 18 tháng 5 năm 2010,2010-05-18
24-11-2034,2034-11-24
2:3:2022,2022-03-02
28 Ap 2002,2002-04-28
Sep 20 08,2008-09-20
"Sep 12th, 2019",2019-09-12
11/8/96,1996-08-11
"January 23, 2008",2008-01-23
10/2/2000,2000-10-02
18/3/2019,2019-01-18
15 January 2022,2022-01-15
May 18 32,2032-05-18
27/10-2019,2019-10-27
12/12/17,2017-12-12
18-4-1995,1995-04-18
12 tháng 6 năm 2020,2020-06-12
9 November 2021,2021-11-09
"June 24, 2029",2029-06-24
9/22-1999,1999-11-09
5/2/2004,2004-02-05
18 October 2030,2030-10-18
26-3-2013,2013-03-26
4-19-09,2009-04-19
2033/4,2033-04-11
22May2022,2022-05-22
18 Ma 2035,2035-05-18
15/8/2012,2012-08-15
"September 5, 1997",1997-09-05
18-6,1990-06-18
ngày 12 tháng 2 năm 2001,2001-02-12
52-2-2014,2014-02-26
6-6,2025-06-06
2:5:2035,2035-05-02
18/1-2026,2026-01-18
9 tháng 4 năm 2034,2034-04-09
28/2-2030,2030-02-28
1995/9/10,1995-09-10
9-12,2024-12-09
27.11.2020,2020-11-27
2033/11,2033-11-14
32-2-2011,2011-02-16
28/12/20,2020-12-28
12 Aug 2015,2015-08-12
"December 28, 2008",2008-12-28
10/8/29,2029-10-08
1 tháng 11 năm 2008,2008-11-01
2 Jan 2020,2020-01-02
10.9.2016,2016-09-10
"September 14, 1993",1993-09-14
2024/2,2024-02-27
17/2-2033,2033-01-17
6-6-2023,2023-06-06
9/5/35,2035-09-05
7/4-2034,2034-04-07
2013/7,2013-07-19
13/4/21,2021-04-13
24th of November 2030,2030-11-24
10 March 2002,2002-03-10
18/12/08,2008-12-18
8Dec2011,2011-12-08
12/11-1996,1996-11-12
18-1-2025,2025-01-09
12/20/97,1997-12-20
ngày 3 tháng 2 năm 2013,2013-02-03
4:12:2029,2029-12-04
"Aug 9th, 2012",2012-08-09
6 tháng 9 năm 1997,1997-09-06
22 August 2023,2023-08-22
ngày 6 tháng 1 năm 1991,1991-01-06
18/1-1991,1991-01-18
22/6-2026,2026-06-22
1/12-2029,2029-06-01
14-5-2021,2021-05-07
12-5-1995,1995-05-12
"Jan 9th, 1992",1992-01-09
25 July 2033,2033-07-25
22-12-2003,2003-12-22
12 January 1999,1999-01-12
28/8/35,2035-08-28
5-8,2006-08-05
17/8-2008,2008-08-17
3/6/93,1993-06-03
ngày 25 tháng 10 năm 1990,1990-10-25
13 Se 2009,2009-09-13
12/2/2003,2003-12-02
4-6-2025,2025-06-04
9/24/1992,1992-08-09
27Jul2012,2012-07-27
25/4/30,2030-04-25
11 May 1993,1993-05-11
ngày 4 tháng 11 năm 1992,1992-11-04
16-11-1992,1992-11-08
27 June 2025,2025-06-27
2010/2,2010-02-14
19/8-1995,1995-08-19
15-4,2026-04-15
10 tháng 4 năm 1992,1992-04-10
11/12/2017,2017-04-11
18061996,1996-06-18
2004/9,2004-09-28
18Oct2020,2020-10-18
1Jan2013,2013-01-01
12Aug2019,2019-08-12
21Sep2025,2025-09-21
1997/5,1997-05-26
26 Apr 2014,2014-04-26
4-11-12,2012-04-11
2034-10-14,2034-10-14
13/5/35,2035-05-13
4-2-2031,2031-02-02
"June 6, 2021",2021-06-06
11/5/30,2030-05-11
5 January 1996,1996-01-05
22-5-2013,2013-05-11
7/4/01,2001-04-07
"Jan 13th, 2022",2022-01-13
14/3/22,2022-03-14
2013/8,2013-08-10
24Oct2001,2001-10-24
6/18/1993,1993-06-06
"Oct 27th, 1992",1992-10-27
2/36/1990,1990-12-02
1/10-2025,2025-10-01
2029/10/21,2029-10-21
18/21/2020,2020-07-18
48-11-1990,1990-11-24
2018/6,2018-06-04
8 tháng 10 năm 2027,2027-10-08
6:1:2014,2014-01-06
2 tháng 6 năm 2034,2034-06-02
14th of June 2020,2020-06-14
10 tháng 5 năm 2030,2030-05-10
25062023,2023-06-25
17:9:2004,2004-09-17
2032/5,2032-05-24
5/15/26,2026-05-15
28:12:2030,2030-12-28
2002/1,2002-01-13
2007/10,2007-10-03
13082032,2032-08-13
10/12/34,2034-10-12
2007-11-26,2007-11-26
8/4-1999,1999-04-08
24th of February 2020,2020-02-24
"Jan 19th, 2014",2014-01-19
1/4-2010,2010-04-01
9/4/32,2032-09-04
13/9-2024,2024-09-13
3-8-06,2006-03-08
21/24-2022,2022-12-21
18/12-2022,2022-12-18
6/26/1991,1991-06-26
01012028,2028-01-01
4/9-1996,1996-09-04
20-4,2005-04-20
11:9:2006,2006-09-11
19-5,1996-05-19
2013/9/18,2013-09-18
23/3-2011,2011-03-23
2Apr2004,2004-04-02
10/1/35,2035-01-10
"August 22, 2005",2005-08-22
9/2/19,2019-02-09
4/3/21,2021-04-03
"Nov 28th, 2007",2007-11-28
05102024,2024-10-05
15 Aug 1991,1991-08-15
8/30/2007,2007-10-08
10 November 2028,2028-11-10
2027-8-22,2027-08-22
8/9/2011,2011-08-09
17102032,2032-10-17
46-8-1994,1994-08-23
8-3-2032,2032-03-08
"February 26, 1998",1998-02-26
15/10-2023,2023-10-15
14-5-1992,1992-05-14
8-17-31,2031-08-17
"March 17, 1997",1997-03-17
13.4.2024,2024-04-13
11 Dec 1995,1995-12-11
20/10/20,2020-10-20
2035-3-20,2035-03-20
22121991,1991-12-22
11 Aug 2029,2029-08-11
26-4-2004,2004-04-13
9Jul2008,2008-07-09
13/10/06,2006-10-13
34-10-2033,2033-10-17
28 tháng 9 năm 2012,2012-09-28
11 tháng 8 năm 2031,2031-08-11
14/2-2007,2007-01-14
21 tháng 5 năm 2002,2002-05-21
27:12:2024,2024-12-27
10052023,2023-05-10
2031-11-14,2031-11-14
12/2/16,2016-02-12
5-11-13,2013-05-11
"March 19, 2008",2008-03-19
15/27/2012,2012-09-15
25 tháng 5 năm 2016,2016-05-25
7 Fe 2011,2011-02-07
13.2.2032,2032-02-13
2/6-2011,2011-03-02
5/9/22,2022-09-05
"Feb 4th, 1994",1994-02-04
10 February 2011,2011-02-10
11:4:2018,2018-04-11
3 Ma 2014,2014-03-03
9/3-2008,2008-03-09
ngày 17 tháng 8 năm 2031,2031-08-17
20 tháng 9 năm 2000,2000-09-20
3 Sep 2005,2005-09-03
2/6/02,2002-02-06
"Apr 21th, 2008",2008-04-21
2-6-21,2021-02-06
7/20/2017,2017-07-20
14/5/01,2001-05-14
4-11-98,1998-04-11
"Apr 8th, 2030",2030-04-08
2:4:2018,2018-04-02
12122019,2019-12-12
13/3-2033,2033-03-13
"Apr 27th, 2010",2010-04-27
1/18/2009,2009-01-18
ngày 1 tháng 4 năm 1993,1993-04-01
4/1/2031,2031-04-01
16/6-1997,1997-06-16
17/12/2025,2025-04-17
Apr 22 00,2000-04-22
3-1-2019,2019-01-03
"Jun 17th, 2024",2024-06-17
6-19-26,2026-06-19
1995/11/28,1995-11-28
25th of October 2003,2003-10-25
3/1/2006,2006-03-01
1994/6,1994-06-23
17 Feb 2029,2029-02-17
1990-4-16,1990-04-16
6th of September 1996,1996-09-06
27/7-2016,2016-07-27
19/6-1997,1997-06-19
1/22/10,2010-01-22
3-7,2005-07-03
2017-3-13,2017-03-13
13/3/2033,2033-01-13
21 tháng 7 năm 1990,1990-07-21
2006/8/17,2006-08-17
1/6/94,1994-06-01
28-2-2026,2026-02-28
7/27/2032,2032-09-07
1/11/90,1990-01-11
1996-1-5,1996-01-05
2032/3,2032-03-07
42-11-2015,2015-11-21
4 Dec 2018,2018-12-04
2033-12-28,2033-12-28
56-5-2023,2023-05-28
3 tháng 6 năm 1990,1990-06-03
9-3,2015-03-09
17 tháng 11 năm 2021,2021-11-17
7/6/1997,1997-06-07
Jul 8 00,2000-07-08
27 Nov 2007,2007-11-27
2030-2-21,2030-02-21
2/6-2033,2033-03-02
16/7-1999,1999-07-16
18-9-2032,2032-09-18
13:1:2034,2034-01-13
22 Au 2023,2023-08-22
2007-7-6,2007-07-06
3-22-08,2008-03-22
6 October 2019,2019-10-06
20-11-2035,2035-11-20
4/12-2023,2023-12-04
14/7/10,2010-07-14
"Mar 23th, 1993",1993-03-23
Oct 5 98,1998-10-05
11-12-24,2024-11-12
1-3-94,1994-01-03
27/12/2021,2021-04-27
2019-2-22,2019-02-22
2/11-2022,2022-11-02
10-1-17,2017-10-01
5 August 2018,2018-08-05
4-8-2012,2012-08-04
2004/12,2004-12-16
25/2-1994,1994-01-25
"July 6, 2011",2011-07-06
13/21/1994,1994-07-13
8 Ju 2030,2030-07-08
3/3/17,2017-03-03
10022031,2031-02-10
28/3-1992,1992-03-28
6/24/2000,2000-08-06
16-7-2002,2002-07-08
7-8,2018-08-07
21072022,2022-07-21
2014/11/21,2014-11-21
20.6.1991,1991-06-20
6/24/1997,1997-08-06
May 19 00,2000-05-19
19 Apr 2006,2006-04-19
26/12-2011,2011-12-26
5 December 2030,2030-12-05
10-17-10,2010-10-17
14/33/2015,2015-11-14
7/8-2004,2004-08-07
21 Au 2009,2009-08-21
20 Feb 2017,2017-02-20
ngày 18 tháng 4 năm 2010,2010-04-18
6/18/2008,2008-06-18
24/10/19,2019-10-24
14-4-1998,1998-04-14
12-9-1993,1993-09-12
Oct 8 25,2025-10-08
10-3,1996-03-10
10/11/2003,2003-10-11
15 Ju 2031,2031-06-15
2-10,2013-10-02
Jun 4 14,2014-06-04
"Jun 23th, 2030",2030-06-23
26th of September 2020,2020-09-26
18.7.1997,1997-07-18
23/4/14,2014-04-23
10.9.2020,2020-09-10
19/4-2006,2006-04-19
2020-11-16,2020-11-16
2012-1-24,2012-01-24
20-6-1995,1995-06-20
ngày 8 tháng 6 năm 2035,2035-06-08
15 Oct 2028,2028-10-15
27 August 2020,2020-08-27
26 tháng 9 năm 2012,2012-09-26
11 Mar 2017,2017-03-11
22/3-1996,1996-03-22
9-20-17,2017-09-20
9/1-2024,2024-01-09
10-17-19,2019-10-17
2005-5-1,2005-05-01
ngày 26 tháng 5 năm 2007,2007-05-26
3/6/2015,2015-06-03
19/24-2016,2016-12-19
12Jul2012,2012-07-12
36-7-1993,1993-07-18
18/8/25,2025-08-18
3-20-18,2018-03-20
2-1-2014,2014-01-02
25/2-2007,2007-01-25
24 tháng 2 năm 2031,2031-02-24
14-3-2026,2026-03-14
2007/1/23,2007-01-23
8/6/05,2005-08-06
8 Apr 2031,2031-04-08
10/15/2027,2027-10-15
5/7/99,1999-07-05
2029/9/19,2029-09-19
2 tháng 7 năm 2021,2021-07-02
Nov 19 08,2008-11-19
8-2,1996-02-08
ngày 8 tháng 5 năm 1997,1997-05-08
16th of August 2029,2029-08-16
3-22-17,2017-03-22
44-5-1998,1998-05-22
4/15/1992,1992-04-15
May 23 28,2028-05-23
23/11/35,2035-11-23
10 tháng 4 năm 1990,1990-04-10
22-9-2031,2031-09-22
1990-11-7,1990-11-07
2033/10/13,2033-10-13
ngày 28 tháng 8 năm 1998,1998-08-28
7-9-22,2022-07-09
1-20-94,1994-01-20
2000/11/9,2000-11-09
2/4-2023,2023-04-02
2/6-1991,1991-06-02
2020/5,2020-05-16
2028/2,2028-02-02
21/8/2025,2025-08-21
5Mar1992,1992-03-05
1990/2/16,1990-02-16
15/9-2014,2014-09-15
10/9/2013,2013-09-10
5-1,2025-01-05
22-12-2001,2001-12-22
8 September 1995,1995-09-08
22Dec2006,2006-12-22
"Feb 16th, 2034",2034-02-16
2008-11-24,2008-11-24
21/4-2005,2005-04-21
10/5-1996,1996-05-10
2012-3-8,2012-03-08
26/6/05,2005-06-26
13/5-2006,2006-05-13
20/6/2012,2012-02-20
52-5-2011,2011-05-26
2012-3-11,2012-03-11
10/11/29,2029-11-10
21 tháng 10 năm 2013,2013-10-21
2014/8/2,2014-08-02
20-9,2016-09-20
8/23/2027,2027-08-23
Feb 11 23,2023-02-11
8-4-99,1999-08-04
18/8-2009,2009-04-18
17/9/1990,1990-09-17
11/7/2002,2002-07-11
10/4/2015,2015-10-04
12.3.2001,2001-03-12
13012006,2006-01-13
3/10/32,2032-10-03
10-1-1996,1996-01-05
"Sep 22th, 2006",2006-09-22
13.9.2026,2026-09-13
14/4/28,2028-04-14
9/12/2027,2027-04-09
4/18/1996,1996-06-04
20/10/13,2013-10-20
27Sep2033,2033-09-27
"Aug 14th, 2025",2025-08-14
12.1.1991,1991-01-12
27 Feb 2004,2004-02-27
2034/2/11,2034-02-11
28/1/15,2015-01-28
10/2/2027,2027-10-02
52-5-1996,1996-05-26
28-5-2026,2026-05-28
2000-5-11,2000-05-11
34-7-1996,1996-07-17
13th of November 1997,1997-11-13
5/1-2035,2035-01-05
1999-9-22,1999-09-22
3-27-33,2033-03-27
6/14-1991,1991-07-06
14011992,1992-01-14
2030/10/17,2030-10-17
11 tháng 1 năm 2012,2012-01-11
"January 22, 1992",1992-01-22
"Jul 1st, 2020",2020-07-01
27 Ju 1994,1994-07-27
14.1.2008,2008-01-14
Jan 9 01,2001-01-09
18/3/17,2017-03-18
"Feb 25th, 2035",2035-02-25
27 De 2003,2003-12-27
26:7:2017,2017-07-26
5/19/32,2032-05-19
3/12/2013,2013-03-12
11/3/2008,2008-01-11
6/19/26,2026-06-19
4/9/1992,1992-03-04
14Mar2026,2026-03-14
9/8-1994,1994-04-09
28 Sep 2006,2006-09-28
"April 2, 1996",1996-04-02
2/2/98,1998-02-02
2021/6,2021-06-01
1991-11-15,1991-11-15
15/12/26,2026-12-15
"May 13, 2007",2007-05-13
18.4.2020,2020-04-18
8-10-30,2030-08-10
18 Ma 2031,2031-03-18
5-10-92,1992-05-10
9/18/1994,1994-09-18
3rd of September 2035,2035-09-03
23 tháng 8 năm 2018,2018-08-23
12012007,2007-01-12
8 tháng 6 năm 2021,2021-06-08
24 tháng 6 năm 2005,2005-06-24
23 October 2026,2026-10-23
28-12-1998,1998-12-28
"Sep 2nd, 2000",2000-09-02
11/9/09,2009-09-11
7/23/1990,1990-07-23
7-23-10,2010-07-23
ngày 21 tháng 11 năm 2010,2010-11-21
"November 21, 1992",1992-11-21
9/12/2015,2015-12-09
"January 22, 2027",2027-01-22
1 Ja 2017,2017-01-01
4 Au 2030,2030-08-04
"Feb 20th, 2007",2007-02-20
7th of April 2015,2015-04-07
2004-5-25,2004-05-25
20-4,2008-04-20
2012/8,2012-08-16
26May1992,1992-05-26
6-6-05,2005-06-06
10/16/1994,1994-10-16
12/4/2029,2029-12-04
28051999,1999-05-28
9/2-2021,2021-02-09
6 September 1990,1990-09-06
2012/10,2012-10-12
1994-6-12,1994-06-12
3/7/20,2020-07-03
1993/3,1993-03-28
23/6/2006,2006-02-23
10.6.2009,2009-06-10
1991-1-8,1991-01-08
7/7-2011,2011-07-07
7Jul1996,1996-07-07
"Jul 22th, 1999",1999-07-22
13.1.2021,2021-01-13
20 August 2022,2022-08-20
2029/3,2029-03-14
"May 6th, 2014",2014-05-06
8/12-2031,2031-12-08
22 tháng 4 năm 2002,2002-04-22
18-4,2018-04-18
4th of July 2004,2004-07-04
5/30/1995,1995-10-05
28/3-2028,2028-03-28
Jun 14 11,2011-06-14
28/7/2000,2000-07-28
"February 10, 2025",2025-02-10
1/3/1996,1996-01-03
2009/1/6,2009-01-06
"Jan 9th, 2020",2020-01-09
5.1.1999,1999-01-05
Dec 18 28,2028-12-18
4Dec2031,2031-12-04
23.1.2028,2028-01-23
Dec 14 33,2033-12-14
7/16/2013,2013-07-16
"Jun 16th, 2013",2013-06-16
Aug 21 99,1999-08-21
4 Se 2032,2032-09-04
6 tháng 4 năm 2031,2031-04-06
2019-7-10,2019-07-10
2/14-2005,2005-07-02
21 tháng 3 năm 2015,2015-03-21
8.5.2020,2020-05-08
3/4/20,2020-04-03
17:7:2028,2028-07-17
11/4/2005,2005-04-11
1999-6-1,1999-06-01
7:8:2010,2010-08-07
12-3-94,1994-12-03
2 Mar 2028,2028-03-02
3/10/18,2018-10-03
18/12/01,2001-12-18
2012/10/12,2012-10-12
4-1-1998,1998-01-02
7/13/34,2034-07-13
15:3:2011,2011-03-15
2000/12/14,2000-12-14
ngày 5 tháng 12 năm 2001,2001-12-05
13/5/30,2030-05-13
19082012,2012-08-19
1/7/95,1995-01-07
15:8:2013,2013-08-15
27 May 2001,2001-05-27
2 July 2024,2024-07-02
24/7-2017,2017-07-24
9 tháng 6 năm 1993,1993-06-09
2-3-2035,2035-03-01
1995/4,1995-04-05
22 Jun 2007,2007-06-22
10/11-2007,2007-11-10
21/5/1994,1994-05-21
19061990,1990-06-19
22 Ja 2016,2016-01-22
28-8-2008,2008-08-14
"Feb 13th, 2009",2009-02-13
6 September 1993,1993-09-06
12-6-99,1999-12-06
"February 25, 2006",2006-02-25
2013/4,2013-04-05
20 Au 2006,2006-08-20
17/9-2010,2010-09-17
6.12.2008,2008-12-06
2/15/2010,2010-05-02
18/6-2026,2026-06-18
1 tháng 9 năm 2003,2003-09-01
2032/7,2032-07-03
9-13-16,2016-09-13
2/5-2028,2028-05-02
23-10,2014-10-23
10/5/18,2018-05-10
9/5/2035,2035-09-05
11:4:2018,2018-04-11
11 tháng 8 năm 2027,2027-08-11
18/7/17,2017-07-18
16 Aug 2027,2027-08-16
4Nov1998,1998-11-04
22-3-2004,2004-03-11
4-3-30,2030-04-03
23 Jan 2012,2012-01-23
8/11-2009,2009-11-08
8/11-1996,1996-11-08
2/4/2033,2033-04-02
25Feb2023,2023-02-25
22/24-2007,2007-12-22
17Nov2001,2001-11-17
23:12:2027,2027-12-23
9/8-1991,1991-08-09
24-6-2017,2017-06-12
25/2-2026,2026-02-25
25.1.2015,2015-01-25
28/33/1993,1993-11-28
18012034,2034-01-18
24072012,2012-07-24
24/30/2024,2024-10-24
6-23-20,2020-06-23
22/6-2000,2000-06-22
"January 9, 2019",2019-01-09
27/8/2014,2014-08-27
23 tháng 12 năm 2012,2012-12-23
18/15/2010,2010-05-18
6/3/91,1991-03-06
1996-11-2,1996-11-02
4.8.2015,2015-08-04
21/10/27,2027-10-21
2031/4/14,2031-04-14
11/10/2021,2021-10-11
16:4:2035,2035-04-16
9th of January 1998,1998-01-09
1993/3/18,1993-03-18
36-4-2022,2022-04-18
18 Jan 2034,2034-01-18
22.5.2022,2022-05-22
8/8-2020,2020-08-08
13:12:2008,2008-12-13
25 No 1997,1997-11-25
25.7.2004,2004-07-25
22-12,1992-12-22
5-6,2018-06-05
1 Se 1991,1991-09-01
20/21/2023,2023-07-20
"August 18, 2010",2010-08-18
11 December 2031,2031-12-11
19:2:2032,2032-02-19
7:7:2029,2029-07-07
1996/3/11,1996-03-11
1 Ju 1994,1994-07-01
"September 11, 1996",1996-09-11
16/12-2007,2007-06-16
7/30/1999,1999-10-07
10-2-1990,1990-02-05
8/16/20,2020-08-16
20 No 2003,2003-11-20
7-5-00,2000-07-05
19/9-2015,2015-09-19
8/10/1997,1997-10-08
14/27/2031,2031-09-14
5/3/2001,2001-01-05
11/6-2030,2030-06-11
27Aug2024,2024-08-27
ngày 22 tháng 5 năm 2023,2023-05-22
10/14/2026,2026-10-14
18/8-1994,1994-04-18
Nov 15 17,2017-11-15
10-10,2020-10-10
09082017,2017-08-09
10 tháng 8 năm 2034,2034-08-10
13 Ju 1994,1994-06-13
18th of August 2009,2009-08-18
"February 13, 1994",1994-02-13
27/1/17,2017-01-27
23/12/2018,2018-04-23
5 January 2016,2016-01-05
28/11-2011,2011-11-28
11-21-93,1993-11-21
9/3/24,2024-09-03
10th of October 2020,2020-10-10
17/12/16,2016-12-17
13/12/28,2028-12-13
12Apr2006,2006-04-12
6.10.2004,2004-10-06
24052029,2029-05-24
2007-11-16,2007-11-16
17:12:1997,1997-12-17
5/27/2000,2000-09-05
17/24/1994,1994-08-17
19 Jul 2035,2035-07-19
23 Jul 2003,2003-07-23
22 Aug 2008,2008-08-22
"Feb 22th, 2003",2003-02-22
28 Ap 2030,2030-04-28
24/3-1995,1995-03-24
ngày 1 tháng 11 năm 2026,2026-11-01
"Feb 27th, 2002",2002-02-27
20/8-2003,2003-08-20
24-5-2017,2017-05-12
2015/10,2015-10-22
11/18/1993,1993-11-18
1/27/07,2007-01-27
2005/3/11,2005-03-11
2-1-2001,2001-01-01
5-22-08,2008-05-22
22-12-2028,2028-12-22
10/12/30,2030-10-12
12 Ju 2029,2029-06-12
2/14-2017,2017-07-02
18/1-2018,2018-01-18
25/4-2000,2000-04-25
12th of July 2033,2033-07-12
2012-6-9,2012-06-09
2003/12/23,2003-12-23
Aug 23 26,2026-08-23
3/3-2006,2006-03-03
2031/10/21,2031-10-21
8-6-94,1994-08-06
24 September 2014,2014-09-24
05052019,2019-05-05
1/6/13,2013-06-01
25/33/2032,2032-11-25
1.5.2006,2006-05-01
20052010,2010-05-20
6/16/23,2023-06-16
2035/9,2035-09-05
2/1/04,2004-02-01
"Jul 12th, 2011",2011-07-12
2 Aug 2015,2015-08-02
"Aug 27th, 1994",1994-08-27
ngày 20 tháng 9 năm 2014,2014-09-20
19/8-1992,1992-08-19
8Nov1993,1993-11-08
1997/4,1997-04-24
19/5/07,2007-05-19
2-5,1998-05-02
28 Se 1998,1998-09-28
3 Se 2013,2013-09-03
22-4-2011,2011-04-11
15/8-2009,2009-08-15
23/3/1999,1999-01-23
14/11/11,2011-11-14
7-14-32,2032-07-14
9.1.2020,2020-01-09
12072022,2022-07-12
54-4-1994,1994-04-27
12th of October 2021,2021-10-12
13/3/1991,1991-01-13
19/1/1994,1994-01-19
ngày 19 tháng 1 năm 2005,2005-01-19
9/18-2032,2032-09-09
19 November 2028,2028-11-19
14/6/2021,2021-02-14
17Aug1998,1998-08-17
ngày 6 tháng 3 năm 2004,2004-03-06
15/6-2009,2009-06-15
9/23/05,2005-09-23
Mar 25 02,2002-03-25
9/6-2027,2027-03-09
"April 11, 1990",1990-04-11
2/6/1994,1994-02-02
12.7.2032,2032-07-12
3/2-1990,1990-01-03
2035-6-4,2035-06-04
16 January 2033,2033-01-16
21/12/11,2011-12-21
1st of April 2001,2001-04-01
23-8-2007,2007-08-23
4:11:2011,2011-11-04
8/7/2006,2006-07-08
May 24 05,2005-05-24
2013/10/7,2013-10-07
25Nov2028,2028-11-25
2/5/99,1999-05-02
40-7-2035,2035-07-20
6/11-2006,2006-11-06
27th of August 2026,2026-08-27
19/15/2010,2010-05-19
9.5.2008,2008-05-09
4/27/04,2004-04-27
10 December 2024,2024-12-10
"Dec 21th, 2026",2026-12-21
2009/8,2009-08-05
2030/2,2030-02-16
"August 7, 1992",1992-08-07
12/12/2030,2030-12-12
10/20-2021,2021-10-10
5-19-94,1994-05-19
"September 2, 2004",2004-09-02
23/12-2031,2031-12-23
1995/7,1995-07-14
ngày 20 tháng 3 năm 2020,2020-03-20
12 Ma 2030,2030-05-12
9/2/2026,2026-09-02
1/8/2017,2017-01-08
22-1-2027,2027-01-11
"Mar 12th, 2031",2031-03-12
7/9-1990,1990-09-07
2005-2-3,2005-02-03
"October 25, 2015",2015-10-25
28 tháng 5 năm 1996,1996-05-28
25Feb1996,1996-02-25
2015/12/19,2015-12-19
13:10:1996,1996-10-13
3/4/24,2024-04-03
28/4-1998,1998-04-28
"April 19, 2027",2027-04-19
44-4-2028,2028-04-22
9Aug2027,2027-08-09
9/2-1999,1999-01-09
21 Ma 2030,2030-03-21
ngày 13 tháng 7 năm 2010,2010-07-13
2 Sep 2029,2029-09-02
24.11.2020,2020-11-24
27 Fe 2030,2030-02-27
6-4,2017-04-06
16.12.2012,2012-12-16
"March 15, 2006",2006-03-15
2nd of August 2017,2017-08-02
ngày 15 tháng 6 năm 1997,1997-06-15
12/20-2011,2011-10-12
26/12/15,2015-12-26
7-10-90,1990-07-10
"June 22, 1996",1996-06-22
1/4/15,2015-04-01
2-7,2006-07-02
1/3-2018,2018-03-01
Dec 19 06,2006-12-19
12/16/2009,2009-12-16
2019-11-19,2019-11-19
15Mar2014,2014-03-15
13/12/29,2029-12-13
21-6,2015-06-21
ngày 25 tháng 9 năm 2034,2034-09-25
11/10/92,1992-10-11
"May 11th, 2031",2031-05-11
8-12-1999,1999-12-04
2033/1/25,2033-01-25
12/11-1994,1994-11-12
4/3/1999,1999-04-03
ngày 9 tháng 1 năm 1994,1994-01-09
27Aug2014,2014-08-27
22 July 2035,2035-07-22
14:6:1994,1994-06-14
10 June 2007,2007-06-10
4-11,2023-11-04
18 April 1995,1995-04-18
"November 8, 1999",1999-11-08
11/22-2000,2000-11-11
22-9-2028,2028-09-11
3-12-2007,2007-12-03
19/16-2012,2012-08-19
15Dec1998,1998-12-15
18 tháng 3 năm 2016,2016-03-18
14 Jun 2002,2002-06-14
20-3-2002,2002-03-10
8/10/04,2004-08-10
10/26/2007,2007-10-26
Nov 28 97,1997-11-28
13042019,2019-04-13
03102007,2007-10-03
12 tháng 12 năm 2026,2026-12-12
28:10:2027,2027-10-28
17.10.2029,2029-10-17
2009/8/24,2009-08-24
18.2.2015,2015-02-18
4 Ju 2011,2011-07-04
4/11/08,2008-11-04
28/10/2012,2012-10-28
4 November 1999,1999-11-04
25/1-2032,2032-01-25
1990/2/18,1990-02-18
8/1/00,2000-01-08
"July 26, 2014",2014-07-26
6-8-1996,1996-08-06
7/8/05,2005-07-08
2021-9-11,2021-09-11
May 20 18,2018-05-20
8th of August 1993,1993-08-08
20/3/94,1994-03-20
5:2:2032,2032-02-05
17th of September 2035,2035-09-17
18/5-2009,2009-05-18
22-6,2034-06-22
2/10/96,1996-10-02
14-3,2002-03-14
9/8/2018,2018-09-08
4-14-01,2001-04-14
42-4-1996,1996-04-21
26 tháng 2 năm 2026,2026-02-26
26/4-2016,2016-04-26
1/9-2008,2008-09-01
Jul 14 23,2023-07-14
2025/1,2025-01-24
10th of March 2014,2014-03-10
9-7,2022-07-09
5-19-14,2014-05-19
1/2/2017,2017-01-02
23 Jul 1994,1994-07-23
5/25/2030,2030-05-25
9/26/2004,2004-09-26
17/9-1993,1993-09-17
17:4:2012,2012-04-17
2009-4-26,2009-04-26
6/1-1997,1997-01-06
24:10:2023,2023-10-24
6/8/2020,2020-06-08
1/8/1991,1991-01-08
5-24-11,2011-05-24
17/2/2001,2001-02-17
2020-6-8,2020-06-08
17-3-2018,2018-03-17
"August 21, 1990",1990-08-21
1992/8,1992-08-05
16-12-2032,2032-12-08
2030-1-17,2030-01-17
5/5-1996,1996-05-05
"April 13, 2006",2006-04-13
2/18/2011,2011-02-18
22 tháng 2 năm 2010,2010-02-22
13 tháng 4 năm 1995,1995-04-13
1992/9/2,1992-09-02
15-5-2034,2034-05-15
18-2-2010,2010-02-09
22Mar2034,2034-03-22
10-10-2006,2006-10-05
9-18-98,1998-09-18
10-6-2014,2014-06-10
8/12-1993,1993-12-08
7-27-04,2004-07-27
25 tháng 6 năm 2030,2030-06-25
23 December 2000,2000-12-23
1/18/2035,2035-01-18
Sep 17 02,2002-09-17
"May 24th, 1991",1991-05-24
4/9-2033,2033-09-04
5:9:2021,2021-09-05
5-8,2028-08-05
21/11/2011,2011-11-21
9 Ma 1996,1996-03-09
19 January 2026,2026-01-19
Aug 10 28,2028-08-10
11 January 2029,2029-01-11
ngày 12 tháng 5 năm 1991,1991-05-12
20 February 1995,1995-02-20
1999-12-21,1999-12-21
5th of November 2012,2012-11-05
ngày 7 tháng 2 năm 2011,2011-02-07
03042034,2034-04-03
14-6,2032-06-14
15/18-2025,2025-09-15
"August 20, 2035",2035-08-20
"Oct 22th, 2025",2025-10-22
8-20-35,2035-08-20
15/12-2020,2020-06-15
15/7-1997,1997-07-15
2/10-1994,1994-10-02
9.11.2034,2034-11-09
4/2/29,2029-04-02
18121998,1998-12-18
Feb 20 31,2031-02-20
2017/2/2,2017-02-02
7.9.1999,1999-09-07
17/10-2015,2015-05-17
17/3-1991,1991-03-17
38-3-2028,2028-03-19
28th of October 2015,2015-10-28
10-17-12,2012-10-17
"Nov 1st, 2019",2019-11-01
17-11-2030,2030-11-17
4-11-1993,1993-11-02
19/11-2025,2025-11-19
12Nov2021,2021-11-12
13 De 2003,2003-12-13
17 October 2000,2000-10-17
16:11:1998,1998-11-16
18:4:2001,2001-04-18
22:7:1997,1997-07-22
15/1-1994,1994-01-15
2003/3/7,2003-03-07
23/20-2000,2000-10-23
2005-9-5,2005-09-05
7/18/2016,2016-07-18
16:8:2010,2010-08-16
"February 1, 2035",2035-02-01
27 Se 1993,1993-09-27
Dec 21 23,2023-12-21
"December 21, 2010",2010-12-21
2015/10,2015-10-06
22 Oct 2000,2000-10-22
16/11-2008,2008-11-16
1 Apr 2003,2003-04-01
12 Au 2025,2025-08-12
2/9/00,2000-02-09
ngày 8 tháng 11 năm 2027,2027-11-08
25/2-2031,2031-02-25
5th of January 2017,2017-01-05
2024/8/13,2024-08-13
2016/6/21,2016-06-21
2006/10/13,2006-10-13
23/3/1990,1990-01-23
2005/4,2005-04-19
2006/4/4,2006-04-04
36-10-2030,2030-10-18
23.2.1990,1990-02-23
13/10/35,2035-10-13
15Mar2026,2026-03-15
1991-4-22,1991-04-22
01052022,2022-05-01
3Sep2028,2028-09-03
23/9/2022,2022-09-23
17/4-1999,1999-04-17
12-18-19,2019-12-18
8.9.2033,2033-09-08
14-7-2012,2012-07-07
22-7,1998-07-22
18th of August 2035,2035-08-18
5-5-2029,2029-05-05
7/12-2032,2032-06-07
3/17/05,2005-03-17
12.10.2021,2021-10-12
22th of February 2020,2020-02-22
1/9/2002,2002-03-01
6/22/25,2025-06-22
14th of July 2011,2011-07-14
13/6-2013,2013-06-13
"Nov 10th, 2029",2029-11-10
"Jan 20th, 2023",2023-01-20
10 tháng 9 năm 2007,2007-09-10
1/27/2004,2004-09-01
"March 9, 1995",1995-03-09
11/1/14,2014-01-11
1/15/2013,2013-05-01
15 tháng 6 năm 2008,2008-06-15
11/9-2010,2010-09-11
5 Fe 2014,2014-02-05
May 12 19,2019-05-12
7-6-2021,2021-06-07
1991/5,1991-05-11
23 No 2031,2031-11-23
10072008,2008-07-10
7-5-00,2000-07-05
18-1-2031,2031-01-18
16 Ja 2027,2027-01-16
10/11/1992,1992-11-10
2002/4,2002-04-02
28032011,2011-03-28
26.4.2013,2013-04-26
14 Oc 2027,2027-10-14
11-14-99,1999-11-14
2014-8-13,2014-08-13
6/28/21,2021-06-28
26:4:2033,2033-04-26
05101990,1990-10-05
13:1:2027,2027-01-13
28/11-2024,2024-11-28
14/4/92,1992-04-14
2/6/96,1996-02-06
ngày 17 tháng 9 năm 2028,2028-09-17
4Feb2015,2015-02-04
06082007,2007-08-06
8/11/16,2016-11-08
2035-2-11,2035-02-11
11 Feb 2025,2025-02-11
14 January 2004,2004-01-14
3Oct2022,2022-10-03
10-7,2017-07-10
12/18-2024,2024-09-12
10/2-2006,2006-02-10
3-8,2008-08-03
15:7:2010,2010-07-15
11/10/2002,2002-11-10
21:5:2016,2016-05-21
"April 13, 2014",2014-04-13
12-4,2013-04-12
27 tháng 9 năm 2008,2008-09-27
22/27/1993,1993-09-22
27/2/11,2011-02-27
4/24/1992,1992-04-24
16.10.2022,2022-10-16
8.2.1995,1995-02-08
19th of June 2032,2032-06-19
27 No 2033,2033-11-27
12/12/2005,2005-12-12
18Aug2006,2006-08-18
5/8-2002,2002-04-05
3:1:2013,2013-01-03
25-7,2001-07-25
5/3-1994,1994-03-05
11/23/35,2035-11-23
1-24-25,2025-01-24
28/30/2013,2013-10-28
6:7:2030,2030-07-06
8/3/30,2030-03-08
"February 16, 2013",2013-02-16
14:11:1994,1994-11-14
14101992,1992-10-14
5/15/1992,1992-05-05
50-3-2013,2013-03-25
8 tháng 1 năm 2000,2000-01-08
4:10:2034,2034-10-04
16/3/1994,1994-01-16
"October 12, 2004",2004-10-12
16 tháng 8 năm 2016,2016-08-16
24-7,1992-07-24
25.3.2033,2033-03-25
17/7/24,2024-07-17
6/8-2017,2017-08-06
6-20-01,2001-06-20
23/12/1998,1998-12-23
"November 15, 1990",1990-11-15
1999/10/12,1999-10-12
7/9/16,2016-07-09
44-12-2019,2019-12-22
18/2/2001,2001-02-18
6th of February 2031,2031-02-06
4/22/2022,2022-04-22
9/11-1995,1995-11-09
11/5/92,1992-05-11
"October 6, 2002",2002-10-06
21 tháng 6 năm 2026,2026-06-21
2001-6-7,2001-06-07
11/22/35,2035-11-22
10032007,2007-03-10
21 Jan 1996,1996-01-21
25-4-1993,1993-04-25
24/7-2017,2017-07-24
2004-10-22,2004-10-22
11/11/2020,2020-11-11
6-8-1995,1995-08-06
18/5/10,2010-05-18
1 March 2008,2008-03-01
3/1/2035,2035-03-01
18 Ma 2033,2033-03-18
"Aug 26th, 2024",2024-08-26
28-1-2020,2020-01-14
"Jan 16th, 2002",2002-01-16
ngày 11 tháng 2 năm 1992,1992-02-11
17/9/08,2008-09-17
2 tháng 7 năm 2032,2032-07-02
24072032,2032-07-24
4/2-1999,1999-01-04
7.9.2019,2019-09-07
24:12:1999,1999-12-24
15092028,2028-09-15
1999/5/23,1999-05-23
2012/2,2012-02-09
1/14/2029,2029-01-14
2028/4,2028-04-24
11/6/2027,2027-11-06
23/27/2032,2032-09-23
23/10/23,2023-10-23
23/2-2003,2003-01-23
2034-11-1,2034-11-01
1-7-35,2035-01-07
27 August 1994,1994-08-27
4-9-13,2013-04-09
3/12/17,2017-12-03
14/10-1994,1994-10-14
1 Sep 2006,2006-09-01
28.1.2023,2023-01-28
16 April 2006,2006-04-16
"May 21, 1993",1993-05-21
2/7-1996,1996-07-02
1990/5/12,1990-05-12
10091994,1994-09-10
2005/5/4,2005-05-04
22 tháng 8 năm 2009,2009-08-22
11/22/00,2000-11-22
8/10/2019,2019-08-10
5th of February 2008,2008-02-05
5 July 2001,2001-07-05
4-12,2000-12-04
"May 28th, 2011",2011-05-28
10Jan2026,2026-01-10
ngày 22 tháng 6 năm 2018,2018-06-22
9-23-10,2010-09-23
15.9.2030,2030-09-15
26 tháng 6 năm 1993,1993-06-26
23 May 1994,1994-05-23
"Feb 26th, 2022",2022-02-26
2035/2/21,2035-02-21
28:2:2030,2030-02-28
2028-10-14,2028-10-14
01072008,2008-07-01
7May1998,1998-05-07
2/3/02,2002-03-02
23 Aug 1990,1990-08-23
2032-7-18,2032-07-18
7/12/1992,1992-12-07
"November 10, 2013",2013-11-10
10th of May 2021,2021-05-10
1/9/24,2024-01-09
17 Jan 1990,1990-01-17
27/10/98,1998-10-27
"June 20, 2007",2007-06-20
1992-2-1,1992-02-01
19-3,2025-03-19
27 tháng 6 năm 2027,2027-06-27
17 tháng 11 năm 2026,2026-11-17
3 tháng 7 năm 2021,2021-07-03
04122013,2013-12-04
10-10-15,2015-10-10
12:4:1998,1998-04-12
4-19-95,1995-04-19
1/1/95,1995-01-01
23-11,2032-11-23
May 22 17,2017-05-22
24/9/2016,2016-09-24
26 Ma 2031,2031-03-26
8 October 2002,2002-10-08
2/4-2009,2009-04-02
10 Ju 2008,2008-06-10
3.10.1991,1991-10-03
2007/2/16,2007-02-16
17 tháng 6 năm 1993,1993-06-17
22/7/2034,2034-07-22
1 Sep 2013,2013-09-01
12-28-03,2003-12-28
28 November 2033,2033-11-28
ngày 28 tháng 5 năm 2015,2015-05-28
9-5,2034-05-09
12-1-03,2003-12-01
24-1-2001,2001-01-24
ngày 9 tháng 4 năm 2020,2020-04-09
20 tháng 9 năm 2005,2005-09-20
9:10:2002,2002-10-09
17/8-2016,2016-08-17
2020/1,2020-01-27
6/2-1991,1991-02-06
10/30/1991,1991-10-10
9-4-2018,2018-04-09
2028/2/27,2028-02-27
May 26 20,2020-05-26
2009/8,2009-08-25
8:10:2030,2030-10-08
1 July 2000,2000-07-01
18Jan2020,2020-01-18
10-5-2034,2034-05-10
24:3:2015,2015-03-24
4/6-2023,2023-06-04
1996/3/10,1996-03-10
1-12-2011,2011-12-01
2014/2/16,2014-02-16
23-6-1995,1995-06-23
24-12-2000,2000-12-24
2012/6/18,2012-06-18
13-3-1996,1996-03-13
"February 22, 2026",2026-02-22
"February 5, 1994",1994-02-05
6-3,2007-03-06
17:8:2027,2027-08-17
10/6/23,2023-06-10
ngày 17 tháng 7 năm 2007,2007-07-17
48-7-2013,2013-07-24
1/23/22,2022-01-23
21051996,1996-05-21
22 Ma 1999,1999-05-22
24 tháng 6 năm 2019,2019-06-24
17 Oc 2010,2010-10-17
2007-9-26,2007-09-26
"March 20, 2016",2016-03-20
4/2-1996,1996-01-04
12/5/2005,2005-12-05
2nd of February 1996,1996-02-02
2009/5/9,2009-05-09
3.6.2025,2025-06-03
ngày 10 tháng 2 năm 2002,2002-02-10
23 Ap 2002,2002-04-23
42-4-1997,1997-04-21
10/8/30,2030-08-10
3rd of May 2018,2018-05-03
1-10-2015,2015-10-01
24 Fe 2025,2025-02-24
10/16-2022,2022-08-10
2023/3,2023-03-10
8/5/00,2000-05-08
06022024,2024-02-06
2Jun2016,2016-06-02
23102008,2008-10-23
1998-10-13,1998-10-13
ngày 15 tháng 1 năm 2033,2033-01-15
3/6/2002,2002-02-03
17.5.2013,2013-05-17
3/24/2019,2019-03-24
10/2/27,2027-02-10
9-18-00,2000-09-18
14022025,2025-02-14
14-6-2003,2003-06-07
"Nov 20th, 2015",2015-11-20
10/7/13,2013-07-10
5 De 2033,2033-12-05
6th of January 2025,2025-01-06
9/9/01,2001-09-09
24 Dec 2016,2016-12-24
28/6/95,1995-06-28
28 Oct 2003,2003-10-28
22/11-2011,2011-11-22
22-11-1997,1997-11-11
"June 14, 2018",2018-06-14
14.7.2024,2024-07-14
2014-9-15,2014-09-15
10 May 2035,2035-05-10
16-11-2026,2026-11-16
24/10/2027,2027-10-24
11 Se 1999,1999-09-11
2 tháng 5 năm 1995,1995-05-02
14-3-2031,2031-03-14
10-2,2006-02-10
2/8/2012,2012-02-08
"May 23, 2012",2012-05-23
2021/7/8,2021-07-08
22Apr2024,2024-04-22
3/6/05,2005-06-03
2010-8-21,2010-08-21
12/5/28,2028-05-12
25/3/30,2030-03-25
26/9-1996,1996-09-26
"Jul 1st, 2009",2009-07-01
2Oct2005,2005-10-02
2/10-2009,2009-10-02
20-6,2002-06-20
26.6.2013,2013-06-26
26.8.2006,2006-08-26
5/11/20,2020-11-05
12.1.2017,2017-01-12
1/5/2001,2001-01-05
"Mar 25th, 1998",1998-03-25
13-7-2035,2035-07-13
26/1/2027,2027-01-26
"October 20, 1992",1992-10-20
20 Fe 2011,2011-02-20
26/6/2032,2032-02-26
11/16/2009,2009-11-16
26/12/92,1992-12-26
10th of February 2021,2021-02-10
2029/12,2029-12-27
4/1-2020,2020-01-04
8 February 2032,2032-02-08
9 tháng 11 năm 1999,1999-11-09
15-4-2020,2020-04-15
24/24-2018,2018-12-24
3/3/2016,2016-03-03
5:10:2029,2029-10-05
13-12-2015,2015-12-13
19-3,2010-03-19
1.9.2007,2007-09-01
"May 10th, 2035",2035-05-10
"May 5th, 2025",2025-05-05
12/27/2006,2006-12-27
2009/3,2009-03-07
23:9:2020,2020-09-23
14-2-2016,2016-02-07
26Nov2002,2002-11-26
"May 18, 2023",2023-05-18
16:6:2005,2005-06-16
2009/10/4,2009-10-04
22/9/01,2001-09-22
18 Ja 2002,2002-01-18
22-9-1990,1990-09-11
Apr 3 30,2030-04-03
4 Se 2024,2024-09-04
"Sep 4th, 2028",2028-09-04
16 tháng 6 năm 2003,2003-06-16
4:6:1998,1998-06-04
13 De 2013,2013-12-13
Jun 27 23,2023-06-27
19.1.1999,1999-01-19
11-12-2005,2005-12-11
10-5-2026,2026-05-10
ngày 12 tháng 10 năm 1991,1991-10-12
23-8,2022-08-23
12-10-16,2016-12-10
2/2/09,2009-02-02
2025/12,2025-12-24
2/25/23,2023-02-25
1/9/2026,2026-03-01
"October 23, 2005",2005-10-23
1991/11,1991-11-02
10-8-1994,1994-08-10
23:5:2013,2013-05-23
"December 3, 1990",1990-12-03
12 Ju 2012,2012-07-12
4.6.1992,1992-06-04
38-2-2019,2019-02-19
5/12-2019,2019-06-05
15-9,1993-09-15
3 July 2001,2001-07-03
9/7/17,2017-09-07
1/18/31,2031-01-18
Oct 12 31,2031-10-12
28/9-2020,2020-09-28
20:8:2021,2021-08-20
25 Jul 2027,2027-07-25
14/3/2005,2005-01-14
8/10-2003,2003-10-08
13 No 2006,2006-11-13
7/7-2015,2015-07-07
11:5:2012,2012-05-11
2006-4-25,2006-04-25
21 Oc 2018,2018-10-21
23-4,1995-04-23
4/27/2021,2021-09-04
18/9-2005,2005-09-18
6.2.2022,2022-02-06
16/9/04,2004-09-16
6/20-2035,2035-10-06
20/4-1999,1999-02-20
14/9/21,2021-09-14
15-7,2021-07-15
07082022,2022-08-07
13 De 1996,1996-12-13
24th of May 1992,1992-05-24
8/4/00,2000-04-08
15/7-2001,2001-07-15
19Jun2021,2021-06-19
16Aug2011,2011-08-16
1.6.2012,2012-06-01
Jun 27 13,2013-06-27
13/12/2000,2000-12-13
2026-11-28,2026-11-28
"July 23, 2014",2014-07-23
Apr 6 15,2015-04-06
25/4/92,1992-04-25
26.1.2010,2010-01-26
21/3-1999,1999-03-21
1992/3,1992-03-19
3-1-10,2010-03-01
"Jan 26th, 2011",2011-01-26
7/26/35,2035-07-26
23 Feb 1998,1998-02-23
28 September 2029,2029-09-28
48-6-1991,1991-06-24
28/10/04,2004-10-28
21 Oct 2012,2012-10-21
6/10/28,2028-10-06
08102022,2022-10-08
11/30/2025,2025-10-11
Feb 17 10,2010-02-17
13/8/12,2012-08-13
Jun 20 93,1993-06-20
"January 13, 2002",2002-01-13
2029/8,2029-08-24
21-2,2019-02-21
18/4-2002,2002-04-18
08072032,2032-07-08
3/7-2009,2009-07-03
4Apr2018,2018-04-04
15.12.2026,2026-12-15
23/18/2031,2031-06-23
10.11.2028,2028-11-10
22th of December 2011,2011-12-22
9/28/2028,2028-09-28
22:9:2004,2004-09-22
"Apr 9th, 1999",1999-04-09
6th of June 2035,2035-06-06
7/12/08,2008-07-12
19.11.2021,2021-11-19
ngày 3 tháng 12 năm 2012,2012-12-03
17/2-2029,2029-02-17
Aug 13 32,2032-08-13
2019/7,2019-07-01
5/33/1991,1991-11-05
4/7-2003,2003-07-04
22 Mar 1994,1994-03-22
27/10/2033,2033-10-27
18 tháng 8 năm 2027,2027-08-18
5Oct2014,2014-10-05
24:11:2000,2000-11-24
26-2-2019,2019-02-13
9/7-2014,2014-07-09
"June 1, 2013",2013-06-01
13/11/2027,2027-11-13
9 tháng 9 năm 2014,2014-09-09
2018/5/6,2018-05-06
26/8-2023,2023-08-26
9 Dec 2008,2008-12-09
18/18-2006,2006-09-18
2014/4/9,2014-04-09
19/10/2026,2026-10-19
8/20/22,2022-08-20
11-1-95,1995-11-01
18/8-2025,2025-08-18
12/6-1991,1991-06-12
8th of April 2001,2001-04-08
1/12/2023,2023-12-01
40-2-2007,2007-02-20
2020/1/25,2020-01-25
26/7-2034,2034-07-26
23/8/2029,2029-08-23
Apr 7 91,1991-04-07
3 Aug 1991,1991-08-03
21/1-2008,2008-01-21
2032-11-26,2032-11-26
18 March 2003,2003-03-18
"April 28, 2010",2010-04-28
12-5-12,2012-12-05
8/28/33,2033-08-28
3 November 1999,1999-11-03
ngày 18 tháng 10 năm 2015,2015-10-18
13Jun2016,2016-06-13
"Mar 11th, 1999",1999-03-11
7th of March 2027,2027-03-07
ngày 9 tháng 12 năm 2027,2027-12-09
"Feb 14th, 1997",1997-02-14
36-6-2030,2030-06-18
8/10/23,2023-08-10
"Dec 10th, 2033",2033-12-10
15/16-2025,2025-08-15
6/8/08,2008-06-08
28/16-2007,2007-08-28
Dec 7 29,2029-12-07
2030/8,2030-08-16
1/21/2003,2003-01-21
19/9/2028,2028-03-19
"March 19, 2005",2005-03-19
5-11-1997,1997-11-05
16112030,2030-11-16
15 March 2004,2004-03-15
2009/10,2009-10-12
26/8/97,1997-08-26
2034/9/17,2034-09-17
1 Oct 2025,2025-10-01
8.2.2004,2004-02-08
1 November 2011,2011-11-01
10-5-2026,2026-05-05
7-9,2033-09-07
5/12/2020,2020-05-12
11 Fe 2019,2019-02-11
16 tháng 5 năm 2005,2005-05-16
4-7-2006,2006-07-04
27.7.1990,1990-07-27
2000/3,2000-03-19
5Jan2008,2008-01-05
17.11.1994,1994-11-17
10/16-2016,2016-08-10
8/15/2019,2019-05-08
26 Sep 2026,2026-09-26
14/4/2009,2009-04-14
4/2/17,2017-02-04
20-7-1990,1990-07-20
10 tháng 6 năm 2032,2032-06-10
08061992,1992-06-08
2008-10-9,2008-10-09
28.6.2008,2008-06-28
20/7/2023,2023-07-20
4/6/2029,2029-04-06
ngày 9 tháng 2 năm 2032,2032-02-09
2nd of June 2005,2005-06-02
2 Jun 1994,1994-06-02
ngày 1 tháng 5 năm 2021,2021-05-01
1/3/91,1991-01-03
17.9.1990,1990-09-17
4/6/98,1998-06-04
11:12:2027,2027-12-11
28-6-2012,2012-06-28
13/2/94,1994-02-13
1997/2,1997-02-18
10/23/1991,1991-10-23
21/9/90,1990-09-21
10-9-2028,2028-09-05
24/12/2015,2015-12-24
2/18-2011,2011-09-02
17 Au 2004,2004-08-17
23/36/2019,2019-12-23
16.7.2017,2017-07-16
24 Dec 2017,2017-12-24
Apr 17 95,1995-04-17
2014/2,2014-02-04
27/8-2009,2009-04-27
Apr 20 31,2031-04-20
8/12/95,1995-12-08
3rd of October 2018,2018-10-03
13/9/35,2035-09-13
24/8/93,1993-08-24
17-12-1995,1995-12-17
21.9.2030,2030-09-21
16th of December 2020,2020-12-16
26/12-2020,2020-12-26
1/16-1993,1993-08-01
2035-11-25,2035-11-25
16-6-1991,1991-06-16
4/12/00,2000-04-12
1995-11-4,1995-11-04
11/5-1993,1993-05-11
"July 16, 2007",2007-07-16
6 Sep 1995,1995-09-06
1/13/2030,2030-01-13
6/9/2018,2018-03-06
7 February 2020,2020-02-07
5th of September 2013,2013-09-05
22 Ju 2025,2025-06-22
10/28/1998,1998-10-28
22/5/30,2030-05-22
11/10-2026,2026-05-11
25-11,2013-11-25
1993/8/6,1993-08-06
26/27/2027,2027-09-26
ngày 3 tháng 11 năm 2025,2025-11-03
9/18/2033,2033-06-09
4th of November 2029,2029-11-04
9th of November 2027,2027-11-09
ngày 9 tháng 12 năm 2030,2030-12-09
6.8.2033,2033-08-06
30-12-1990,1990-12-15
22-5,2018-05-22
3 May 2003,2003-05-03
1/5-2009,2009-05-01
28 November 2007,2007-11-28
3rd of August 2001,2001-08-03
ngày 20 tháng 9 năm 2009,2009-09-20
19072002,2002-07-19
24/3/1990,1990-03-24
9/2-2020,2020-01-09
18062009,2009-06-18
25/2-2022,2022-02-25
13/24-2004,2004-12-13
20/14-2007,2007-07-20
2nd of November 2020,2020-11-02
2030/5/1,2030-05-01
19 Sep 2025,2025-09-19
ngày 3 tháng 1 năm 2014,2014-01-03
16/11/13,2013-11-16
ngày 4 tháng 10 năm 2012,2012-10-04
10-6,1994-06-10
27th of April 1994,1994-04-27
10/26/31,2031-10-26
1st of January 2001,2001-01-01
18/11-2018,2018-11-18
Sep 26 11,2011-09-26
16th of July 1997,1997-07-16
6 May 2018,2018-05-06
22-4-2032,2032-04-22
18-6,2008-06-18
3Feb2034,2034-02-03
8-11-1990,1990-11-08
5-4-2016,2016-04-05
24 Oct 2004,2004-10-24
1/25/2000,2000-01-25
22/10-2030,2030-10-22
2033/3/21,2033-03-21
7/1/94,1994-07-01
2030/4/3,2030-04-03
ngày 24 tháng 6 năm 1992,1992-06-24
1999/12/1,1999-12-01
27/22-2035,2035-11-27
ngày 25 tháng 10 năm 2023,2023-10-25
"May 12th, 1999",1999-05-12
Nov 26 29,2029-11-26
12 Ma 2012,2012-03-12
17 April 2007,2007-04-17
28 tháng 8 năm 1990,1990-08-28
"Feb 23th, 2000",2000-02-23
2026-3-12,2026-03-12
"April 12, 2004",2004-04-12
12/1-2020,2020-01-12
11/4/94,1994-11-04
1999/2,1999-02-01
"December 7, 1995",1995-12-07
17/4-1999,1999-04-17
21 tháng 1 năm 2006,2006-01-21
24/15/2000,2000-05-24
8th of January 2010,2010-01-08
5 May 1998,1998-05-05
11/6/00,2000-06-11
"November 28, 2008",2008-11-28
7/5/16,2016-07-05
2005/11,2005-11-10
10/11/31,2031-11-10
6/15/05,2005-06-15
12 Sep 2029,2029-09-12
17/18/2004,2004-06-17
19/24/2015,2015-08-19
"August 13, 1993",1993-08-13
6-7,2022-07-06
4Mar2002,2002-03-04
2003/5/2,2003-05-02
19 tháng 9 năm 2004,2004-09-19
23/1/1997,1997-01-23
22/6-1995,1995-06-22
7/26/93,1993-07-26
24:3:2004,2004-03-24
2033/10,2033-10-08
10/22-2027,2027-11-10
22Dec2015,2015-12-22
20/14-2019,2019-07-20
1/1/99,1999-01-01
22Jul2009,2009-07-22
ngày 23 tháng 11 năm 1996,1996-11-23
25/1/1995,1995-01-25
"June 27, 2034",2034-06-27
25 May 2007,2007-05-25
ngày 17 tháng 1 năm 2026,2026-01-17
"January 22, 1995",1995-01-22
17/12-1994,1994-06-17
22082027,2027-08-22
3-25-25,2025-03-25
7 tháng 11 năm 2012,2012-11-07
28.9.2025,2025-09-28
2027/6,2027-06-23
11.4.2027,2027-04-11
3-10-2001,2001-10-03
1-11-10,2010-01-11
2032/2/3,2032-02-03
04101990,1990-10-04
19Mar1996,1996-03-19
19-7,2009-07-19
25 tháng 1 năm 2009,2009-01-25
19Jul2023,2023-07-19
1/16-2003,2003-08-01
19-6-2023,2023-06-19
ngày 7 tháng 8 năm 2022,2022-08-07
24-9-2033,2033-09-24
13/12-2005,2005-12-13
21:9:2018,2018-09-21
"Sep 28th, 1993",1993-09-28
1/22/2029,2029-01-22
"Jul 20th, 2008",2008-07-20
21/1/06,2006-01-21
"Nov 3rd, 1997",1997-11-03
ngày 18 tháng 9 năm 2001,2001-09-18
3.11.1997,1997-11-03
15:4:2035,2035-04-15
21/1-2023,2023-01-21
14:3:1998,1998-03-14
Mar 6 25,2025-03-06
2002-8-15,2002-08-15
24-11-1995,1995-11-24
2011/5,2011-05-04
2-8-03,2003-02-08
18/2/21,2021-02-18
13 tháng 2 năm 2029,2029-02-13
27/11/07,2007-11-27
2012-2-24,2012-02-24
12-3,2016-03-12
15 August 2011,2011-08-15
"Feb 27th, 2032",2032-02-27
11/2/1994,1994-02-11
11-9,2018-09-11
8 Jul 2026,2026-07-08
13-9,2019-09-13
14/1/19,2019-01-14
1992/1/25,1992-01-25
1/25/2009,2009-01-25
12032024,2024-03-12
28.2.2000,2000-02-28
26/7-2027,2027-07-26
2/7-1992,1992-07-02
13/11-2012,2012-11-13
10/15/2032,2032-10-15
20 May 2021,2021-05-20
6/6/2010,2010-02-06
2/18/2013,2013-06-02
3/5-2016,2016-05-03
18/9/26,2026-09-18
36-1-2022,2022-01-18
14th of February 2012,2012-02-14
14-10-2004,2004-10-07
2033/2/13,2033-02-13
"August 3, 2011",2011-08-03
3/3/23,2023-03-03
18Mar2032,2032-03-18
1:1:2003,2003-01-01
4.4.2019,2019-04-04
20 Mar 2035,2035-03-20
2032-9-14,2032-09-14
"July 20, 2006",2006-07-20
20 August 2001,2001-08-20
1/5/34,2034-01-05
"November 10, 2029",2029-11-10
11/19/16,2016-11-19
16 Jan 2023,2023-01-16
7-6-2018,2018-06-07
10/4/98,1998-10-04
7:10:2018,2018-10-07
12 tháng 1 năm 2008,2008-01-12
"Jun 25th, 2008",2008-06-25
15/6/2025,2025-06-15
25:2:2018,2018-02-25
22/8-2012,2012-08-22
13Jun2007,2007-06-13
15th of July 2032,2032-07-15
8-9-2017,2017-09-04
9/19/90,1990-09-19
2016-6-11,2016-06-11
19 Oc 2003,2003-10-19
12th of December 2022,2022-12-12
21/5/1995,1995-05-21
23/8/32,2032-08-23
ngày 28 tháng 1 năm 2020,2020-01-28
22/8-2026,2026-04-22
14/9-2006,2006-09-14
08072000,2000-07-08
8/36/1997,1997-12-08
7/1/28,2028-01-07
3-8-06,2006-03-08
4/10-2014,2014-10-04
"Jun 22th, 2016",2016-06-22
24/10-2034,2034-10-24
4/1-2017,2017-01-04
1/2-2027,2027-02-01
12 November 2027,2027-11-12
6-8,1992-08-06
1 tháng 5 năm 2012,2012-05-01
13 tháng 3 năm 2031,2031-03-13
24/1/09,2009-01-24
2018/8,2018-08-20
28-11,2019-11-28
50-12-1991,1991-12-25
22/2/2003,2003-02-22
24-7-2011,2011-07-12
ngày 10 tháng 12 năm 2017,2017-12-10
13 Fe 2015,2015-02-13
2/24/17,2017-02-24
20-1,2020-01-20
27/36/2006,2006-12-27
12Feb2000,2000-02-12
3/9/28,2028-09-03
23-2-2014,2014-02-23
2015/7,2015-07-10
26-7-2006,2006-07-26
01072013,2013-07-01
2035/6,2035-06-19
"Aug 26th, 1996",1996-08-26
12-1-2028,2028-01-12
2002/1/25,2002-01-25
16/9/2034,2034-09-16
2004-3-4,2004-03-04
28/2-2015,2015-01-28
"May 1st, 2026",2026-05-01
ngày 24 tháng 5 năm 1993,1993-05-24
27/2/20,2020-02-27
21-9-1995,1995-09-21
"September 25, 2000",2000-09-25
19-2-1993,1993-02-19
2017-9-7,2017-09-07
2006/7/25,2006-07-25
22-6,2007-06-22
27/1-1990,1990-01-27
9/3-2006,2006-03-09
8/4/00,2000-04-08
2003/3/28,2003-03-28
14/15/2020,2020-05-14
24-2,2034-02-24
11.5.1998,1998-05-11
11-21-20,2020-11-21
7-2-2002,2002-02-07
21 May 2026,2026-05-21
8-17-03,2003-08-17
Aug 17 92,1992-08-17
5/24/21,2021-05-24
24 Jan 2000,2000-01-24
4/14-2031,2031-07-04
1999-2-23,1999-02-23
"Jun 3rd, 2030",2030-06-03
2/5/18,2018-05-02
23-5,2030-05-23
25-1-1996,1996-01-25
13-2,1992-02-13
12/18/10,2010-12-18
17 Au 2016,2016-08-17
ngày 22 tháng 12 năm 2029,2029-12-22
10/2/01,2001-10-02
10/15/92,1992-10-15
28.5.1992,1992-05-28
3/20/18,2018-03-20
25th of May 2006,2006-05-25
4/1/35,2035-01-04
23/2/08,2008-02-23
"December 28, 2002",2002-12-28
2 December 2002,2002-12-02
6/9/2026,2026-06-09
25:12:2035,2035-12-25
26/10/28,2028-10-26
26/2-2026,2026-02-26
19/3/1990,1990-01-19
19/33/2000,2000-11-19
"Oct 24th, 2020",2020-10-24
