input_text,target_text
20040815023602015732883,2004-08-15
Sự kiện diễn ra vào 23/11/2003 6:3,2003-11-23
20140802015807,2014-08-02
Sự kiện diễn ra vào 20/2/2018 12:37,2018-02-20
1991-09-02T15:22:52.798Z,1991-09-02
2025/10/4T35221,2025-10-04
6/22-2027,2027-11-06
03.03.91,1991-03-03
The system recorded 20310401021617,2031-04-01
Ngày 6-3-2019,2019-03-06
7-6-2025,2025-06-07
2002-05-09,2002-05-09
2021-10-26T06:10:16.337841347Z,2021-10-26
27/2-2023,2023-01-27
20000320212340857358,2000-03-20
908730000,1998-10-19
8-10-1990,1990-10-08
"March 24, 2021",2021-03-24
10.3.2004T3-53-53,2004-03-10
1377277200000000000,2013-08-24
2005.12.27,2005-12-27
ngày 25 tháng 3 năm 1996,1996-03-25
1999-06-11T03:30:15.428Z,1999-06-11
29 February 1992,1992-02-29
1/12/2023 giờ 3:41:6,2023-12-01
2014-11-26T09:47:20.886727902Z,2014-11-26
1995-05-30T10:07:02,1995-05-30
25-2-2002,2002-02-25
1995/10/25T173132,1995-10-25
03-26-2026,2026-03-26
ngày 11 tháng 11 năm 1999,1999-11-11
872182800000000,1997-08-22
"19th of August, 2012",2012-08-19
26-3-1991,1991-03-26
2031-12-13T06:52:54.826953894Z,2031-12-13
2009-07-12T10:04:00.363Z,2009-07-12
2033-12-15,2033-12-15
20211214234842679,2021-12-14
2012-04-08T20:03:49Z+3,2012-04-08
2021-05-07T22:21:14.320275Z,2021-05-07
Sự kiện diễn ra vào 29/10/2002 18:31,2002-10-29
ngày 11 tháng 6 năm 1990,1990-06-11
2019-04-25T22:16:52.577705354Z,2019-04-25
1346950800000000000,2012-09-07
2032 10 03,2032-10-03
2|9|2028,2028-09-02
Ngày 22-12-2021,2021-12-22
ngày 7 tháng 7 năm 2031,2031-07-07
1999/5/11T62624,1999-05-11
ngày 2 tháng 6 năm 1996,1996-06-02
15 September 2008,2008-09-15
13 October 2025,2025-10-13
2030-07-31,2030-07-31
1328720400000,2012-02-09
2017-10-27T08:18:03Z+3,2017-10-27
Event at 2017-06-05T2:33:13,2017-06-05
14 April 2031,2031-04-14
16 1 2001,2001-01-16
1990-05-15T16:55:08Z+3,1990-05-15
21-9-2002,2002-09-21
"July 15, 2032",2032-07-15
19 April 2015,2015-04-19
1030640400000,2002-08-30
Ngày 15-8-1993,1993-08-15
2035-12-10T06:57:37.351648151Z,2035-12-10
2024-10-17T01:27:33Z+3,2024-10-17
14/09/08,2008-09-14
2017-10-03T00:35:02+2500,2017-10-03
20110827152752008421624,2011-08-27
1991-02-09T13:49:30+2500,1991-02-09
1/4-2014,2014-02-01
1688490000000,2023-07-05
1994-05-03T17:35:56.363088905Z,1994-05-03
16.10.2006T7-24-35,2006-10-16
1996-07-19T09:21:05Z+3,1996-07-19
2010/5/27T235734,2010-05-27
"7th of November, 1990",1990-11-07
25 tháng 1 năm 2024,2024-01-25
2008-01-25T01:58:30Z+3,2008-01-25
1046019600000000000,2003-02-24
19/16-1997,1997-08-19
2010|02|22,2010-02-22
2016.07.04,2016-07-04
20180412224008918270309,2018-04-12
28/1/2029 giờ 22:46:7,2029-01-28
893523600000000000,1998-04-26
1997-05-09T16:33:02+00:00,1997-05-09
Sự kiện diễn ra vào 12/10/2030 13:44,2030-10-12
1027875600000,2002-07-29
17 Mar 2022,2022-03-17
19930916095112104884,1993-09-16
ngày 12 tháng 4 năm 2007,2007-04-12
46-6-2028,2028-06-23
1990-01-10T04:25:38+2500,1990-01-10
2003-04-02T15:15:09Z+3,2003-04-02
08.21.2030,2030-08-21
2023-08-27T16:34:09-0330,2023-08-27
2017-01-25T16:34:22+2500,2017-01-25
2008-12-10T09:06:41.318072207Z,2008-12-10
29/10-2033,2033-05-29
1998-10-01T11:38:40+2500,1998-10-01
20230325191817589375,2023-03-25
01_08_2011,2011-01-08
20151128081834438074231,2015-11-28
1953565200000000000,2031-11-28
1992_09_19T2_30_42+3,1992-09-19
2014-04-13T15:18:14.817063Z,2014-04-13
1466182800,2016-06-18
The system recorded 20251214181820,2025-12-14
"January 13, 1999",1999-01-13
20210705055405741,2021-07-05
1993-01-12T03:34:15.672977Z,1993-01-12
20160510231317417,2016-05-10
5.7.2028T0-22-20,2028-07-05
2030-07-10T02:32:40+2500,2030-07-10
Sự kiện diễn ra vào 30/4/2024 13:42,2024-04-30
14-11-2009,2009-11-07
"23th of October, 2004",2004-10-23
20100222231006840265568,2010-02-22
"1st of May, 1997",1997-05-01
22/2/2019 giờ 3:46:3,2019-02-22
Ngày 13-3-1997,1997-03-13
ngày 7 tháng 5 năm 2029,2029-05-07
2010-11-15T05:59:02.919996Z,2010-11-15
20/2-1991,1991-01-20
2004_10_04T6_5_9Z+3,2004-10-04
9 Jul 1993,1993-07-09
Event at 2031-03-22T18:24:32,2031-03-22
20161126065019,2016-11-26
Ngày 6-9-2021,2021-09-06
Sự kiện diễn ra vào 12/6/2032 7:13,2032-06-12
2031-08-07T20:37:55.754Z,2031-08-07
"September 19, 2004",2004-09-19
23/3/2024 giờ 14:16:58,2024-03-23
2/6-1992,1992-03-02
20231130145100324270,2023-11-30
"18th of February, 2028",2028-02-18
ngày 29 tháng 6 năm 1995,1995-06-29
7|4|2035,2035-04-07
03_07_06,2006-07-03
1516640400,2018-01-23
18-8-1993,1993-08-09
2033-10-09,2033-10-09
"7th of May, 2001",2001-05-07
The system recorded 19920613152314,1992-06-13
2033-11-08T12:19:34.364Z,2033-11-08
20260421160421632374973,2026-04-21
Ngày 6-4-2004,2004-04-06
20/6-1999,1999-03-20
19 July 2009,2009-07-19
20231216202847,2023-12-16
1999_08_05T8_34_10Z+3,1999-08-05
20220608035620,2022-06-08
"August 24, 2031",2031-08-24
25-12-2016,2016-12-25
25-4-2034,2034-04-25
Event at 2028-04-15T8:54:37,2028-04-15
1462035600000,2016-05-01
1992-05-14T07:31:14.604Z,1992-05-14
1997-05-02T11:06:56,1997-05-02
20.10.2014,2014-10-20
20330329205905016410134,2033-03-29
40-9-2025,2025-09-20
6 Mar 2033,2033-03-06
ngày 17 tháng 5 năm 2025,2025-05-17
10 tháng 12 năm 2025,2025-12-10
22 November 1990,1990-11-22
2017_09_22T2_25_42+2500,2017-09-22
2008-04-25T14:48:31Z+3,2008-04-25
The system recorded 20110127120215,2011-01-27
639594000000,1990-04-09
16|05|04,2004-05-16
2011-03-14T09:35:03.133336155Z,2011-03-14
23 June 2014,2014-06-23
16 Apr 2007,2007-04-16
2018.07.21,2018-07-21
Event at 2003-07-27T22:41:31,2003-07-27
2028-08-22T03:59:07+0500,2028-08-22
20240321133849104938688,2024-03-21
11/18-2013,2013-09-11
"February 22, 2032",2032-02-22
2018-10-01T15:43:58+2500,2018-10-01
22.01.14,2014-01-22
Ngày 7-9-1997,1997-09-07
20120422053717904,2012-04-22
19 Dec 2032,2032-12-19
896893200000,1998-06-04
48-6-2005,2005-06-24
2004-10-28T20:22:48.036Z,2004-10-28
21-4-2003,2003-04-21
2007_04_01T15_0_45Z,2007-04-01
ngày 8 tháng 11 năm 2002,2002-11-08
20170418131942,2017-04-18
2035-10-21T09:01:19+2500,2035-10-21
2004-07-14T00:06:31-05:00,2004-07-14
20/01/90,1990-01-20
2038496400000,2034-08-07
1702054800000,2023-12-09
9 tháng 5 năm 2002,2002-05-09
2032-07-13T09:19:06-05:00,2032-07-13
1519405200000,2018-02-24
2013-02-22T16:38:20Z+3,2013-02-22
19920608000449093,1992-06-08
"March 6, 2020",2020-03-06
ngày 6 tháng 11 năm 2027,2027-11-06
24.3.2026T22-13-48,2026-03-24
Event at 1993-03-05T1:42:57,1993-03-05
"23th of January, 2013",2013-01-23
20210812122029784174595,2021-08-12
20090602162851171,2009-06-02
2027-09-24T06:18:50.188716499Z,2027-09-24
"13th of December, 2006",2006-12-13
20170514095404426417364,2017-05-14
17/20-1993,1993-10-17
2009-03-18T10:53:13.431073864Z,2009-03-18
20171101020132737888574,2017-11-01
2006-12-03T17:24:05.047Z,2006-12-03
1694797200000000,2023-09-16
2005-05-01T06:35:00.661Z,2005-05-01
2011|04|05,2011-04-05
2009-05-07T20:02:42.058152254Z,2009-05-07
4.4.2027T4-11-36,2027-04-04
Event at 1996-04-09T10:24:55,1996-04-09
20200903135512,2020-09-03
19900815121141,1990-08-15
20.11.2006T0-17-4,2006-11-20
01 11 91,1991-11-01
Ngày 14-4-2031,2031-04-14
The system recorded 20100223031703,2010-02-23
"19th of August, 2011",2011-08-19
Event at 2026-01-22T5:30:36,2026-01-22
4/5/2028 giờ 5:54:31,2028-05-04
1994-06-21T06:27:34.493410187Z,1994-06-21
28-7-1994,1994-07-28
2031/9/14T112223,2031-09-14
1027962000000000000,2002-07-30
ngày 13 tháng 4 năm 1993,1993-04-13
2023-06-16T22:16:09.442800Z,2023-06-16
1997-07-29T21:55:21.481Z,1997-07-29
11 March 2029,2029-03-11
30 Mar 2032,2032-03-30
19/5/2001,2001-05-19
2025/4/30T22261,2025-04-30
04|29|1994,1994-04-29
2-3-2026,2026-03-02
11.3.2002,2002-03-11
20200525122756917633,2020-05-25
Ngày 11-2-2004,2004-02-11
2001-05-20T19:07:56.694Z,2001-05-20
1845133200000000000,2028-06-21
"June 9, 2032",2032-06-09
5 5 2002,2002-05-05
4-5-2016,2016-05-04
21.6.1990,1990-06-21
4/20-2026,2026-10-04
26/5/1996 giờ 21:28:43,1996-05-26
20201111144524,2020-11-11
06_29_2010,2010-06-29
1230742800,2009-01-01
27.9.2005T12-58-52,2005-09-27
2023|05|04,2023-05-04
1306256400,2011-05-25
"11th of April, 2017",2017-04-11
ngày 25 tháng 7 năm 2030,2030-07-25
2035/10/30T191221,2035-10-30
31.8.2020T13-43-5,2020-08-31
29 Apr 2030,2030-04-29
20070823140123,2007-08-23
12.09.30,2030-09-12
1700154000000000,2023-11-17
2003-02-12T16:42:00.809315Z,2003-02-12
20 tháng 10 năm 2000,2000-10-20
2005.11.16,2005-11-16
15-08-33,2033-08-15
2035_05_26,2035-05-26
ngày 22 tháng 7 năm 2023,2023-07-22
8-12-2012,2012-12-04
1552064400000,2019-03-09
2020-08-17T18:38:39.466345Z,2020-08-17
2025_10_20T3_11_24Z,2025-10-20
24-9-2013,2013-09-12
2017-12-22T01:43:04,2017-12-22
30 August 2023,2023-08-30
04-26-2025,2025-04-26
19/7/2034 giờ 3:53:40,2034-07-19
11 May 2007,2007-05-11
"19th of November, 2003",2003-11-19
Ngày 11-1-1998,1998-01-11
1864054800000000000,2029-01-26
15 tháng 9 năm 1994,1994-09-15
1980954000,2032-10-10
4.3.2014T13-56-15,2014-03-04
2014-08-08T15:02:20,2014-08-08
1882544400,2029-08-28
ngày 25 tháng 7 năm 2021,2021-07-25
ngày 5 tháng 4 năm 2033,2033-04-05
29.9.2005T9-4-7,2005-09-29
1090170000000000000,2004-07-19
1994/11/1T52829,1994-11-01
ngày 15 tháng 6 năm 2028,2028-06-15
2032-01-22T04:58:00+2500,2032-01-22
The system recorded 20030501083513,2003-05-01
58-11-1993,1993-11-29
5/2-2024,2024-01-05
2032-11-25T02:14:50+0500,2032-11-25
14_3_2013,2013-03-14
ngày 29 tháng 8 năm 2023,2023-08-29
2034-10-28T06:00:30+2500,2034-10-28
19900106221525656580,1990-01-06
31 tháng 10 năm 2029,2029-10-31
2024-08-06T16:20:33.247069984Z,2024-08-06
1997/1/8T81823,1997-01-08
1999-07-27T18:52:15Z+3,1999-07-27
21.11.2008T18-9-33,2008-11-21
1327165200,2012-01-22
2031-09-24T09:24:02.961020164Z,2031-09-24
18.1.2028T9-46-34,2028-01-18
2032/11/06,2032-11-06
25 tháng 9 năm 2021,2021-09-25
30.9.2032,2032-09-30
2021-12-26T10:02:42+2500,2021-12-26
2032-04-05T09:15:25,2032-04-05
655059600,1990-10-05
2006-05-26T15:44:04Z,2006-05-26
20141016233258146725,2014-10-16
20240826214422316,2024-08-26
1722099600000000000,2024-07-28
04/11/17,2017-11-04
2034-04-17T18:48:02,2034-04-17
7 Jul 1995,1995-07-07
24 Jul 2015,2015-07-24
1-2-2021,2021-02-01
Event at 2008-07-04T19:18:51,2008-07-04
2017-05-24T18:06:31,2017-05-24
Sự kiện diễn ra vào 8/11/2011 11:30,2011-11-08
888598800000000000,1998-02-28
ngày 2 tháng 12 năm 1990,1990-12-02
Sự kiện diễn ra vào 25/8/2022 18:10,2022-08-25
2029-01-15T15:31:33,2029-01-15
22 April 2020,2020-04-22
845830800,1996-10-21
07_08_92,1992-08-07
Event at 2006-03-05T4:4:23,2006-03-05
4/8/2023,2023-08-04
Event at 2034-11-11T2:41:22,2034-11-11
2031-10-31,2031-10-31
20321205115758275,2032-12-05
2030-10-14T02:25:00.954Z,2030-10-14
2020-03-07T09:23:10+08,2020-03-07
9 tháng 11 năm 2031,2031-11-09
1 12 2014,2014-12-01
20291217154536620061,2029-12-17
2027-01-15T15:57:00Z,2027-01-15
1998-02-22T11:49:30Z+3,1998-02-22
The system recorded 20290121024844,2029-01-21
2013-08-08,2013-08-08
2011-05-27T20:23:40Z+3,2011-05-27
2010-07-20T03:52:35+00:00,2010-07-20
24-8-1992,1992-08-12
2013-02-12T10:28:02,2013-02-12
20330915071501641985647,2033-09-15
5.1.2030T10-2-52,2030-01-05
20250621143830735,2025-06-21
2020-01-27T09:49:03.671Z,2020-01-27
2000-06-29T15:17:33+2500,2000-06-29
12/20-1993,1993-10-12
1998-02-04T05:15:42Z+3,1998-02-04
2034-10-26T12:58:31+07:00,2034-10-26
10/22-2001,2001-11-10
2021-08-03T02:32:50+2500,2021-08-03
1752512400000000000,2025-07-15
2030/5/18T103617,2030-05-18
"April 3, 2003",2003-04-03
19990522204344188,1999-05-22
2003/11/13T64231,2003-11-13
44-10-2001,2001-10-22
2035.06.14,2035-06-14
2023-04-26T11:03:11+07:00,2023-04-26
"7th of April, 2035",2035-04-07
1546189200,2018-12-31
2029-09-18T08:07:40.339145512Z,2029-09-18
Ngày 30-5-2008,2008-05-30
1.6.2028T17-46-27,2028-06-01
2025-07-21T17:50:49+00:00,2025-07-21
26 December 2007,2007-12-26
05/05/1995,1995-05-05
2023-02-25T15:25:06,2023-02-25
"21th of December, 1997",1997-12-21
3 May 2035,2035-05-03
Ngày 13-8-2030,2030-08-13
1276966800,2010-06-20
20070305021336902399606,2007-03-05
9/8-2031,2031-04-09
26 August 2010,2010-08-26
25-1-2000,2000-01-25
ngày 21 tháng 6 năm 2000,2000-06-21
8.11.2023T2-33-50,2023-11-08
2029-12-08T09:38:53+2500,2029-12-08
1991-04-24T11:19:49.835Z,1991-04-24
2001-01-10T10:45:43+0500,2001-01-10
5 Oct 2019,2019-10-05
1997-03-21T06:12:13.727766348Z,1997-03-21
1323968400000000,2011-12-16
1910710800000000000,2030-07-20
14.10.2022T3-47-46,2022-10-14
09_06_21,2021-06-09
1991/10/25T153824,1991-10-25
2015-06-07T15:01:43Z+3,2015-06-07
Event at 2035-09-03T19:9:34,2035-09-03
2022-10-23T07:03:09.548940159Z,2022-10-23
1995/12/3T85412,1995-12-03
Sự kiện diễn ra vào 7/11/2015 13:16,2015-11-07
951930000000000,2000-03-02
ngày 4 tháng 12 năm 2005,2005-12-04
14/11/1993 giờ 0:22:48,1993-11-14
1165165200000000,2006-12-04
ngày 5 tháng 3 năm 2023,2023-03-05
20290201092718835045679,2029-02-01
10 tháng 4 năm 2010,2010-04-10
40-7-2030,2030-07-20
2026/11/21,2026-11-21
1991-10-02T19:29:14.376150Z,1991-10-02
52-8-2005,2005-08-26
25/2/2028 giờ 2:9:20,2028-02-25
1540486800000000,2018-10-26
16/6/2033 giờ 14:43:20,2033-06-16
22.6.1992,1992-06-22
"May 11, 2026",2026-05-11
4 Mar 2011,2011-03-04
36-12-2016,2016-12-18
2030-06-04T09:38:28,2030-06-04
19/20-2007,2007-10-19
16/8/2019 giờ 3:36:57,2019-08-16
5 January 1995,1995-01-05
20/20-2003,2003-10-20
19970118000737130341415,1997-01-18
23 tháng 8 năm 1990,1990-08-23
2031-04-29T03:52:05,2031-04-29
The system recorded 20040824082539,2004-08-24
2004-05-15T01:54:36.274Z,2004-05-15
"August 23, 2006",2006-08-23
2070810000,2035-08-16
10.6.2000T3-47-46,2000-06-10
14/16-2019,2019-08-14
755456400000000000,1993-12-10
991674000000000000,2001-06-05
2013-12-14T11:58:13.343895Z,2013-12-14
ngày 4 tháng 9 năm 2006,2006-09-04
10-20-2012,2012-10-20
19920819171626,1992-08-19
2029/2/8T202954,2029-02-08
29-9-2023,2023-09-29
2016-07-22T06:00:43+3,2016-07-22
2018/09/10,2018-09-10
20330705185930130844,2033-07-05
02-02-2034,2034-02-02
26-12-1995,1995-12-13
1768928400,2026-01-21
10.7.1995T23-16-31,1995-07-10
20341128140909176,2034-11-28
20290321144534403984714,2029-03-21
25 4 2014,2014-04-25
778870800000,1994-09-07
Event at 1991-05-17T4:15:45,1991-05-17
11 13 2021,2021-11-13
18/11/2034,2034-11-18
2055690000000,2035-02-22
"May 5, 2035",2035-05-05
20310518135957442897008,2031-05-18
2051110800000,2034-12-31
Ngày 7-1-2006,2006-01-07
"24th of August, 2014",2014-08-24
The system recorded 20070923174538,2007-09-23
24 tháng 1 năm 1992,1992-01-24
The system recorded 20220726202957,2022-07-26
2.4.2031T22-29-1,2031-04-02
2000-12-10T17:40:54.863Z,2000-12-10
1290445200000,2010-11-23
2032/6/30T52052,2032-06-30
888426000000,1998-02-26
1198602000000000000,2007-12-26
The system recorded 20330714103555,2033-07-14
19920405004111331,1992-04-05
Sự kiện diễn ra vào 25/4/1994 5:29,1994-04-25
52-4-1996,1996-04-26
20 May 2009,2009-05-20
28-11-2001,2001-11-14
2017-12-13T15:43:32,2017-12-13
"21th of June, 2027",2027-06-21
2008/10/7T3748,2008-10-07
2035-11-11,2035-11-11
26.7.1992T6-57-21,1992-07-26
7/9/2029 giờ 10:17:18,2029-09-07
2035-03-16T17:26:43.721178Z,2035-03-16
20190322200009,2019-03-22
48-4-2019,2019-04-24
2006-08-07T21:38:17+2500,2006-08-07
28.6.2007T13-42-15,2007-06-28
"December 22, 1990",1990-12-22
08|07|01,2001-07-08
1535043600,2018-08-24
2020-03-06T06:49:40Z+3,2020-03-06
8-2-2016,2016-02-08
Event at 2014-11-23T17:35:29,2014-11-23
14/5/1997 giờ 6:34:48,1997-05-14
20280508180443254,2028-05-08
20240609015758678913301,2024-06-09
ngày 10 tháng 1 năm 2027,2027-01-10
20240531222523101444,2024-05-31
14/9/2015 giờ 19:40:23,2015-09-14
19900622150138730,1990-06-22
17 tháng 7 năm 2026,2026-07-17
1990-02-23T08:15:18Z+3,1990-02-23
2000-09-21T09:50:42.934718674Z,2000-09-21
26-5-2008,2008-05-26
ngày 8 tháng 4 năm 2033,2033-04-08
50-2-2009,2009-02-25
2017/7/25T19139,2017-07-25
2007-04-21,2007-04-21
1992-02-07T08:43:02+07:00,1992-02-07
2025-10-04T21:20:08.221138574Z,2025-10-04
1387126800000,2013-12-16
2023 01 14,2023-01-14
Event at 2011-08-24T0:5:51,2011-08-24
1990_03_02T14_35_33+08,1990-03-02
1991-02-19T23:36:25+3,1991-02-19
ngày 8 tháng 4 năm 2022,2022-04-08
ngày 27 tháng 3 năm 2004,2004-03-27
6/12/2026 giờ 0:8:6,2026-12-06
17-03-24,2024-03-17
"18th of September, 1994",1994-09-18
7/7/1992 giờ 11:29:17,1992-07-07
2026-03-16T01:35:19.072Z,2026-03-16
2023-01-21T17:25:26.314015Z,2023-01-21
2013-07-03T17:45:05+2500,2013-07-03
1993/8/9T55230,1993-08-09
06_25_2002,2002-06-25
2024|10|02,2024-10-02
2012-09-15T03:27:02.688Z,2012-09-15
20221110223441679290,2022-11-10
7 Jun 2024,2024-06-07
20050303081902,2005-03-03
2009-05-16T06:17:31,2009-05-16
"17th of July, 2018",2018-07-17
1996-04-01T21:14:08.193917Z,1996-04-01
20341129073541480,2034-11-29
2008/5/11T114114,2008-05-11
2026-12-06T09:01:37Z+3,2026-12-06
4 May 1992,1992-05-04
2010-05-31T12:57:19.811161Z,2010-05-31
10-4-1995,1995-04-05
1345050000000000,2012-08-16
12-7-2029,2029-07-12
2020-07-27T05:39:08.498Z,2020-07-27
29/03/98,1998-03-29
1721667600,2024-07-23
ngày 28 tháng 8 năm 2001,2001-08-28
900003600000000,1998-07-10
Sự kiện diễn ra vào 24/12/1996 14:7,1996-12-24
19920129045101064910,1992-01-29
20301029113033586039,2030-10-29
26 Feb 2012,2012-02-26
08.14.2022,2022-08-14
ngày 7 tháng 2 năm 2006,2006-02-07
Sự kiện diễn ra vào 10/12/2004 2:43,2004-12-10
ngày 3 tháng 6 năm 1993,1993-06-03
2011-05-18T12:09:01Z+3,2011-05-18
2008-03-14T10:30:09.406863664Z,2008-03-14
1271696400000000000,2010-04-20
24-10-09,2009-10-24
1209315600000000000,2008-04-28
Event at 1992-09-29T23:45:14,1992-09-29
16|09|20,2020-09-16
8/4-1998,1998-02-08
2017-06-14T15:23:43,2017-06-14
20/12-1992,1992-06-20
27/1/2032 giờ 5:42:19,2032-01-27
632422800000000,1990-01-16
18.11.2019T5-51-41,2019-11-18
18/7/2019 giờ 11:34:25,2019-07-18
2003-03-02T01:20:57,2003-03-02
"5th of June, 2032",2032-06-05
4 tháng 11 năm 2020,2020-11-04
Ngày 10-3-1999,1999-03-10
12/4/2018 giờ 20:55:29,2018-04-12
2021_03_22T11_58_27Z,2021-03-22
19910510212733709611,1991-05-10
1818262800000,2027-08-15
1486400400000000,2017-02-07
08/28/2029,2029-08-28
2034-09-28T19:52:26+0500,2034-09-28
The system recorded 19960705040242,1996-07-05
2008_03_30T9_12_30+08,2008-03-30
Event at 1999-02-14T23:37:27,1999-02-14
784486800000000000,1994-11-11
The system recorded 20190627145001,2019-06-27
1995-03-23T05:52:01Z+3,1995-03-23
23/12/2016 giờ 6:45:41,2016-12-23
5-6-2015,2015-06-05
1999-11-20T18:19:37+2500,1999-11-20
Ngày 15-10-2008,2008-10-15
"May 21, 1998",1998-05-21
13 tháng 10 năm 2020,2020-10-13
1963760400000000,2032-03-25
1999/3/24T9430,1999-03-24
15/10-2015,2015-05-15
22_07_26,2026-07-22
2002-06-22T18:48:25+2500,2002-06-22
11|7|2002,2002-07-11
30/18-2031,2031-09-30
20150622151415274703697,2015-06-22
26 Mar 2010,2010-03-26
1092502800,2004-08-15
2022-03-08T02:56:33.085482Z,2022-03-08
776451600000,1994-08-10
2009_11_22T19_19_53+00:00,2009-11-22
2029-10-11T18:33:34,2029-10-11
20331002100600189242035,2033-10-02
20340119062029512961725,2034-01-19
2024_10_17T8_47_36+3,2024-10-17
ngày 13 tháng 11 năm 1991,1991-11-13
2005/12/29T3163,2005-12-29
"February 9, 2010",2010-02-09
2016-05-26T13:45:59,2016-05-26
Ngày 8-5-2015,2015-05-08
2022-05-02T09:02:06+2500,2022-05-02
1357664400000000,2013-01-09
Sự kiện diễn ra vào 14/1/2034 10:24,2034-01-14
"January 31, 2000",2000-01-31
ngày 20 tháng 8 năm 2017,2017-08-20
"11th of April, 2034",2034-04-11
02-07-1999,1999-02-07
15_10_2013,2013-10-15
19981223085004889661,1998-12-23
20210504002602863,2021-05-04
The system recorded 20320223155709,2032-02-23
1006102800000000,2001-11-19
3/12/2002 giờ 4:19:32,2002-12-03
30-12-2033,2033-12-15
6-12-2025,2025-12-06
9/14-2016,2016-07-09
30 March 1996,1996-03-30
2022-01-27T09:54:43-0300,2022-01-27
1-4-2001,2001-04-01
1990-07-14T05:33:25,1990-07-14
"18th of October, 2011",2011-10-18
08.01.29,2029-01-08
25 tháng 8 năm 2019,2019-08-25
Event at 2011-07-08T19:39:20,2011-07-08
The system recorded 20060902164435,2006-09-02
20291007221809286376,2029-10-07
Sự kiện diễn ra vào 19/5/2004 7:19,2004-05-19
29/4/2023 giờ 16:29:39,2023-04-29
1 Mar 2033,2033-03-01
2013-11-20T09:55:25.577Z,2013-11-20
2008/02/19,2008-02-19
16-11-2014,2014-11-16
15.8.1991T18-56-41,1991-08-15
Event at 2017-09-23T7:48:57,2017-09-23
20180726183804162791,2018-07-26
26-11-1999,1999-11-13
1995-10-15T04:41:41+2500,1995-10-15
22.11.2001,2001-11-22
2003-05-11,2003-05-11
1998-06-23T03:00:38.765Z,1998-06-23
10 01 98,1998-01-10
907088400,1998-09-30
1547053200000,2019-01-10
811789200000000,1995-09-23
2016-03-01T06:56:25+2500,2016-03-01
20230620174813,2023-06-20
1582304400000000000,2020-02-22
1848157200,2028-07-26
ngày 13 tháng 11 năm 2016,2016-11-13
2003-11-23T17:39:05,2003-11-23
Ngày 16-6-1990,1990-06-16
19/20-1992,1992-10-19
5|12|2023,2023-12-05
1999-09-17T20:49:24+00:00,1999-09-17
ngày 1 tháng 12 năm 2016,2016-12-01
855853200000000000,1997-02-14
2014-02-24T06:01:47+3,2014-02-24
17/4-2024,2024-02-17
1992-05-17T10:11:19.530741Z,1992-05-17
1991-09-23T04:14:39Z+3,1991-09-23
1190998800000000,2007-09-29
2029-08-18T03:58:35.417053339Z,2029-08-18
Ngày 4-11-2003,2003-11-04
Event at 2021-11-14T13:50:19,2021-11-14
"6th of August, 1995",1995-08-06
8 Jul 2023,2023-07-08
2021_02_10T11_34_11+07:00,2021-02-10
26-12-2013,2013-12-13
31/3/1996 giờ 22:4:25,1996-03-31
7/10/2032 giờ 21:58:29,2032-10-07
1999|06|25,1999-06-25
20210429064817,2021-04-29
13 April 2029,2029-04-13
"10th of May, 1996",1996-05-10
16 Feb 1995,1995-02-16
2034-03-14T15:27:42-0300,2034-03-14
11.5.1994T4-26-58,1994-05-11
20070628130932164403865,2007-06-28
19961103121900879,1996-11-03
Event at 2021-05-29T13:47:22,2021-05-29
4-6-1995,1995-06-02
2053098000,2035-01-23
19_11_92,1992-11-19
1991-11-03T16:53:30,1991-11-03
10/23/2005,2005-10-23
"July 15, 2013",2013-07-15
26/07/26,2026-07-26
4 tháng 12 năm 2017,2017-12-04
1993-03-26T10:09:14.112825379Z,1993-03-26
Event at 2005-11-29T20:56:45,2005-11-29
13-4-2025,2025-04-13
Sự kiện diễn ra vào 8/9/2006 21:53,2006-09-08
The system recorded 19920509134702,1992-05-09
2016-06-21T06:35:24Z+3,2016-06-21
2019-01-21T23:03:53.820521086Z,2019-01-21
02|07|32,2032-07-02
10/9/2035 giờ 4:5:23,2035-09-10
24_4_2021,2021-04-24
2032-10-14T16:29:42+2500,2032-10-14
20200407151515604304177,2020-04-07
The system recorded 20240619172906,2024-06-19
08|13|2025,2025-08-13
2001-03-11T00:15:56+2500,2001-03-11
2010/9/6T14928,2010-09-06
1996-05-01T15:06:32.896699Z,1996-05-01
1997/02/25,1997-02-25
29-12-2021,2021-12-29
Ngày 11-3-2031,2031-03-11
23/9/2026 giờ 2:34:17,2026-09-23
30-11-2009,2009-11-15
06_05_00,2000-05-06
ngày 31 tháng 10 năm 2012,2012-10-31
2021-07-28T17:38:01+2500,2021-07-28
2003-02-12T11:22:48+2500,2003-02-12
2034-06-19T15:11:02Z+3,2034-06-19
12-4-2003,2003-04-12
Ngày 29-11-1990,1990-11-29
27 tháng 10 năm 2010,2010-10-27
2031-09-12T00:45:10.785411094Z,2031-09-12
The system recorded 19900919071924,1990-09-19
19990201140743343,1999-02-01
The system recorded 20231115120158,2023-11-15
25 Dec 2020,2020-12-25
1997-12-24T21:35:38,1997-12-24
1895590800,2030-01-26
Event at 2033-02-26T22:31:6,2033-02-26
2024-01-08T12:13:00.605623Z,2024-01-08
01 07 2035,2035-01-07
9 5 1999,1999-05-09
1156870800000000000,2006-08-30
2 Dec 2002,2002-12-02
3 May 2013,2013-05-03
2006-01-13T04:46:56.771002Z,2006-01-13
2007-05-12T20:26:21.510199210Z,2007-05-12
ngày 30 tháng 1 năm 1990,1990-01-30
20280803110341410016767,2028-08-03
"20th of August, 2008",2008-08-20
27/7/1997 giờ 9:51:43,1997-07-27
23 September 2004,2004-09-23
2-3-2002,2002-03-02
07 25 2006,2006-07-25
Sự kiện diễn ra vào 17/8/2004 13:51,2004-08-17
Ngày 14-3-2000,2000-03-14
2031-09-12T01:51:03.070Z,2031-09-12
915469200000000000,1999-01-05
ngày 3 tháng 4 năm 2023,2023-04-03
20301201063344079467,2030-12-01
2008-11-28T02:07:11,2008-11-28
19.11.1994,1994-11-19
1226163600000,2008-11-09
993142800000,2001-06-22
8 Nov 2007,2007-11-08
2026918800000000,2034-03-26
1994-05-19T14:16:09+2500,1994-05-19
2009-10-25T00:27:32+2500,2009-10-25
1997-06-18T08:17:33Z+3,1997-06-18
20330709153053286886137,2033-07-09
21/8-1997,1997-04-21
2012/6/27T182713,2012-06-27
"19th of June, 2035",2035-06-19
24-05-01,2001-05-24
1991-01-07T16:58:36.515327Z,1991-01-07
1827421200000000000,2027-11-29
19901124073604072349,1990-11-24
2024-06-16T09:03:56.070524768Z,2024-06-16
09 04 06,2006-04-09
Ngày 26-4-2024,2024-04-26
"24th of December, 1991",1991-12-24
19_11_2035,2035-11-19
2030/5/30T95250,2030-05-30
"May 26, 2015",2015-05-26
2005-04-23T08:28:02-0330,2005-04-23
1167670800000000000,2007-01-02
The system recorded 19990611233700,1999-06-11
1292000400,2010-12-11
1997-02-13T02:29:30.197Z,1997-02-13
1996-12-23T01:17:39+2500,1996-12-23
2033-08-08T11:17:59+07:00,2033-08-08
28/8/2024 giờ 19:2:29,2024-08-28
Sự kiện diễn ra vào 6/1/2000 6:45,2000-01-06
1334682000000000000,2012-04-18
1996-09-10T05:07:39.310005Z,1996-09-10
2014-02-04T16:40:49Z+3,2014-02-04
2021_11_11T19_44_31-05:00,2021-11-11
1990/4/2T55426,1990-04-02
19911116003350,1991-11-16
1429290000000000000,2015-04-18
31/12/2003,2003-12-31
6 Apr 2011,2011-04-06
11 January 2020,2020-01-11
10|25|2009,2009-10-25
Sự kiện diễn ra vào 25/9/2000 7:29,2000-09-25
16 August 2026,2026-08-16
19930413172030,1993-04-13
19900606191041694590,1990-06-06
Ngày 5-12-2028,2028-12-05
1995-07-04T03:56:41.260865Z,1995-07-04
11 November 2028,2028-11-11
1650387600000000,2022-04-20
42-6-2006,2006-06-21
1999789200000000,2033-05-16
2027-11-01T11:41:24+2500,2027-11-01
18.07.21,2021-07-18
08 23 1991,1991-08-23
2032_04_04T11_42_47+0500,2032-04-04
2033-04-13T09:09:45Z+3,2033-04-13
19950727010317371,1995-07-27
18 December 2034,2034-12-18
Ngày 13-7-2005,2005-07-13
2013/5/31T35613,2013-05-31
42-9-1997,1997-09-21
1993_05_13T5_11_45+0500,1993-05-13
7/8-2009,2009-04-07
18.12.2016T16-38-49,2016-12-18
24.02.19,2019-02-24
19 Feb 2019,2019-02-19
2028-02-04,2028-02-04
1993-10-23T05:46:20,1993-10-23
2024/1/8T1328,2024-01-08
Ngày 26-10-1990,1990-10-26
2013-09-03T07:58:25.529Z,2013-09-03
20170312131555003446,2017-03-12
The system recorded 20230113163049,2023-01-13
27-11-91,1991-11-27
19_1_2035,2035-01-19
Sự kiện diễn ra vào 14/2/1998 0:8,1998-02-14
22 May 2015,2015-05-22
2031-04-11T19:10:29.474455Z,2031-04-11
Event at 1994-06-30T17:40:1,1994-06-30
2032-01-24T13:46:29+08,2032-01-24
2009-01-12T05:08:46Z,2009-01-12
1990-12-13T09:02:34Z+3,1990-12-13
The system recorded 20140925102641,2014-09-25
Ngày 13-10-2030,2030-10-13
1812214800000000000,2027-06-06
The system recorded 20310910002410,2031-09-10
1994-09-23T17:44:00+2500,1994-09-23
50-5-2019,2019-05-25
Ngày 9-3-2006,2006-03-09
2032-08-22T08:57:46.719Z,2032-08-22
20290624221331,2029-06-24
2 tháng 6 năm 1999,1999-06-02
1511456400,2017-11-24
3/24-2025,2025-12-03
19_01_95,1995-01-19
16 May 1992,1992-05-16
2030_02_19T13_51_6-0300,2030-02-19
42-9-2005,2005-09-21
28 Apr 2008,2008-04-28
2014-06-05T04:28:52,2014-06-05
1993/1/9T201114,1993-01-09
940957200000000000,1999-10-27
1860858000000000,2028-12-20
1899133200,2030-03-08
23-03-06,2006-03-23
2014-04-02T22:20:27+2500,2014-04-02
2003-03-01T03:19:33.220Z,2003-03-01
17 tháng 5 năm 2022,2022-05-17
2004_09_08T9_24_25-05:00,2004-09-08
757098000000000000,1993-12-29
19920824122927,1992-08-24
1056819600000000000,2003-06-29
9|8|1998,1998-08-09
2022 02 08,2022-02-08
ngày 23 tháng 3 năm 2005,2005-03-23
20181010171447,2018-10-10
671994000000000000,1991-04-19
20151113235418154459,2015-11-13
20350216013632300,2035-02-16
2031-04-29T18:27:31.409Z,2031-04-29
20181229045100272337380,2018-12-29
The system recorded 20271029153435,2027-10-29
20170801193830444727332,2017-08-01
2021-06-19T07:25:30.869410Z,2021-06-19
Event at 2031-10-19T3:19:51,2031-10-19
20041219142329865112608,2004-12-19
2027_09_08T17_18_5-0300,2027-09-08
21 Feb 1995,1995-02-21
23.5.2035T8-36-16,2035-05-23
25 tháng 8 năm 2034,2034-08-25
2010_12_22T5_19_37+00:00,2010-12-22
2026-08-29T02:13:27.504Z,2026-08-29
2035_06_12,2035-06-12
29/24-2019,2019-12-29
2018-08-19T16:55:25+2500,2018-08-19
2027_10_22T6_18_41-05:00,2027-10-22
2016-07-28T00:29:54.923Z,2016-07-28
26 tháng 8 năm 2033,2033-08-26
ngày 22 tháng 8 năm 1997,1997-08-22
17/22-2002,2002-11-17
20000401085819117314672,2000-04-01
2029_01_10T20_0_21+08,2029-01-10
3/7/1998 giờ 0:33:20,1998-07-03
15/4/2012 giờ 3:56:28,2012-04-15
1886605200000000,2029-10-14
2016-08-18T12:39:53,2016-08-18
"15th of December, 2002",2002-12-15
20-6-2007,2007-06-20
1660842000000,2022-08-19
2004/12/17,2004-12-17
22 September 1997,1997-09-22
644605200000,1990-06-06
1997-06-14T01:56:19.498246237Z,1997-06-14
1994-10-29T16:23:48.473Z,1994-10-29
2013/5/11T153754,2013-05-11
1933606800000000,2031-04-11
1994-01-13T21:20:19.115Z,1994-01-13
2007-10-09T15:49:29.429Z,2007-10-09
21-1-1993,1993-01-21
44-9-2032,2032-09-22
1993-12-02T05:19:02+2500,1993-12-02
2020-03-12T11:11:46+2500,2020-03-12
19980830165320074791155,1998-08-30
2018-07-14T03:44:37.103525674Z,2018-07-14
25.12.2005,2005-12-25
1991/6/16T44941,1991-06-16
2020_02_09T19_22_56Z,2020-02-09
14-3-2029,2029-03-14
The system recorded 20030924194152,2003-09-24
20330910133936020230,2033-09-10
1275670800000000,2010-06-05
ngày 28 tháng 1 năm 2009,2009-01-28
20210916104136693,2021-09-16
"December 21, 2034",2034-12-21
1014051600,2002-02-19
Event at 2028-10-23T3:33:26,2028-10-23
2030-10-26T03:41:17+2500,2030-10-26
24.08.28,2028-08-24
Sự kiện diễn ra vào 17/6/1999 12:49,1999-06-17
1208451600000000000,2008-04-18
1540486800,2018-10-26
19/22-2017,2017-11-19
9-9-2034,2034-09-09
18.10.2008T17-51-21,2008-10-18
28/18-2017,2017-09-28
24-10-2011,2011-10-24
20261207082900789555,2026-12-07
Ngày 9-2-1995,1995-02-09
2032/2/7T12328,2032-02-07
Ngày 19-12-2002,2002-12-19
19930924193150343,1993-09-24
755110800000000,1993-12-06
2016-04-11T07:43:01Z,2016-04-11
Event at 2012-12-09T2:11:3,2012-12-09
19950629085118,1995-06-29
"November 3, 2001",2001-11-03
20140829033548159992,2014-08-29
ngày 25 tháng 6 năm 2024,2024-06-25
13|06|35,2035-06-13
2023-02-01T17:02:06.837377212Z,2023-02-01
ngày 16 tháng 7 năm 2028,2028-07-16
20/6-2012,2012-03-20
Sự kiện diễn ra vào 20/9/1991 0:50,1991-09-20
8 June 2029,2029-06-08
2018_09_09T5_55_24-05:00,2018-09-09
2009-10-29T02:21:34Z,2009-10-29
17.8.2005T14-46-4,2005-08-17
2030-09-24T05:53:57.240Z,2030-09-24
2029_05_11T19_2_50Z+3,2029-05-11
Ngày 3-12-2004,2004-12-03
2015_03_27T6_17_11-0300,2015-03-27
2023-07-23T05:49:52-05:00,2023-07-23
853261200000,1997-01-15
2011-05-19T07:16:17.437490335Z,2011-05-19
2027|12|27,2027-12-27
3 tháng 12 năm 2010,2010-12-03
2035-05-01T22:38:14.366Z,2035-05-01
4.4.2031T12-3-17,2031-04-04
1.3.2006T17-2-30,2006-03-01
Sự kiện diễn ra vào 5/8/2008 6:6,2008-08-05
13/22-2002,2002-11-13
8 September 2013,2013-09-08
1563901200000,2019-07-24
Event at 2006-11-22T22:40:54,2006-11-22
840128400000000000,1996-08-16
13-4-1996,1996-04-13
"August 10, 2006",2006-08-10
"January 14, 2004",2004-01-14
2025-08-31T09:58:32.621921Z,2025-08-31
2013-02-14T20:40:27+2500,2013-02-14
20.12.2000,2000-12-20
"12th of December, 2013",2013-12-12
"2nd of July, 1994",1994-07-02
Event at 2005-09-17T16:58:9,2005-09-17
1999-08-03T23:43:24+2500,1999-08-03
7/9/1991 giờ 3:17:47,1991-09-07
2021-08-01T16:23:40Z,2021-08-01
2032/11/21T63217,2032-11-21
2006/7/29T42948,2006-07-29
20.1.2007,2007-01-20
735152400000000000,1993-04-19
2006-07-31T21:44:05Z+3,2006-07-31
05 08 2031,2031-05-08
30/4/2021 giờ 20:3:8,2021-04-30
ngày 18 tháng 10 năm 2021,2021-10-18
1791133200000000000,2026-10-05
2034-10-30T14:24:37.185Z,2034-10-30
1662138000000000,2022-09-03
2028_07_15T11_8_48-0300,2028-07-15
ngày 31 tháng 7 năm 2013,2013-07-31
6-12-2011,2011-12-06
46-11-1992,1992-11-23
17/4/2015 giờ 7:50:4,2015-04-17
1345741200000,2012-08-24
2019-03-28,2019-03-28
15.5.2024,2024-05-15
The system recorded 19940104154030,1994-01-04
2004-05-18T11:54:43.262247127Z,2004-05-18
2030|05|29,2030-05-29
ngày 18 tháng 2 năm 2003,2003-02-18
20/11/93,1993-11-20
2028-06-18T08:35:06.083517354Z,2028-06-18
20210310011351433113734,2021-03-10
1993-12-24T03:41:29Z,1993-12-24
16 February 2002,2002-02-16
2026-08-09T20:42:36.125121558Z,2026-08-09
2029|01|27,2029-01-27
2021-06-18T08:03:42Z+3,2021-06-18
"October 31, 1995",1995-10-31
19900512222932579175776,1990-05-12
2022-08-07T23:26:45+2500,2022-08-07
2032-10-05T02:19:12+2500,2032-10-05
2010/1/7T121357,2010-01-07
Sự kiện diễn ra vào 7/12/2015 6:42,2015-12-07
967482000,2000-08-29
1896714000000000,2030-02-08
21.2.2034T11-50-19,2034-02-21
1994-11-30T08:03:11.251Z,1994-11-30
2014-02-26T13:13:53Z+3,2014-02-26
2008-03-13T22:05:47+2500,2008-03-13
20081021235343,2008-10-21
1998_02_21T3_15_25-05:00,1998-02-21
11/2-2009,2009-01-11
2019_12_31T5_53_59+3,2019-12-31
20330928035723,2033-09-28
2026/3/12T193350,2026-03-12
20290320061355362,2029-03-20
2006-08-28T19:41:35.326196676Z,2006-08-28
20230901024810,2023-09-01
2000-11-11T05:18:37.936Z,2000-11-11
05 06 2015,2015-05-06
9/22-2001,2001-11-09
20050917155037421216728,2005-09-17
7/10/2005 giờ 21:14:29,2005-10-07
"May 7, 2017",2017-05-07
1994-05-10T18:26:23.645578733Z,1994-05-10
2021_08_21,2021-08-21
11 Mar 2020,2020-03-11
Event at 2019-08-11T14:24:12,2019-08-11
1962896400000,2032-03-15
1687021200000,2023-06-18
2010-06-26T13:03:47.410872876Z,2010-06-26
19930529230639,1993-05-29
1133110800,2005-11-28
19930112093604173160606,1993-01-12
2032-09-24T22:47:04,2032-09-24
11.4.2001T13-13-25,2001-04-11
ngày 21 tháng 8 năm 1990,1990-08-21
2003-06-28T10:23:55,2003-06-28
5.12.2017T21-46-30,2017-12-05
2030-02-02T13:26:23.388Z,2030-02-02
2 October 2007,2007-10-02
2.6.2004,2004-06-02
2016-04-26T07:26:08,2016-04-26
1965142800000000,2032-04-10
20270606112322292459794,2027-06-06
20191227095707280,2019-12-27
885661200000000000,1998-01-25
14 Feb 2017,2017-02-14
13-12-2026,2026-12-13
ngày 21 tháng 12 năm 2026,2026-12-21
26-10-28,2028-10-26
2020-03-27T07:00:00Z+3,2020-03-27
21_4_2030,2030-04-21
2008_06_30T8_16_56+08,2008-06-30
10.4.2033T7-52-33,2033-04-10
1460739600000,2016-04-16
19940110051724468068009,1994-01-10
Ngày 15-1-2019,2019-01-15
1555866000,2019-04-22
688842000000000,1991-10-31
10|08|1992,1992-10-08
Event at 2025-10-17T9:25:47,2025-10-17
2020-06-02T04:19:16,2020-06-02
Sự kiện diễn ra vào 2/8/2013 0:28,2013-08-02
2027_05_19T22_50_57Z,2027-05-19
20300821123401421106,2030-08-21
Event at 2028-06-24T23:27:16,2028-06-24
ngày 3 tháng 12 năm 2033,2033-12-03
ngày 6 tháng 2 năm 2005,2005-02-06
Ngày 4-3-1990,1990-03-04
2027-06-10T12:08:33.793Z,2027-06-10
2023_08_12,2023-08-12
Ngày 25-3-1998,1998-03-25
2011-01-31T10:35:44.936239894Z,2011-01-31
16 May 1991,1991-05-16
Sự kiện diễn ra vào 29/4/2018 6:9,2018-04-29
20350108165922950768,2035-01-08
15/2/2014 giờ 19:55:7,2014-02-15
8-10-2000,2000-10-08
1475600400,2016-10-05
2006-04-10T16:05:00.516Z,2006-04-10
1930582800000000,2031-03-07
1996/6/28T11844,1996-06-28
1440867600000000000,2015-08-30
20.1.2012T0-28-43,2012-01-20
2013-08-14T00:28:26.187501Z,2013-08-14
02 02 92,1992-02-02
2033/12/15T2755,2033-12-15
"September 29, 2019",2019-09-29
10-25-2023,2023-10-25
2033_01_20,2033-01-20
25-9-2021,2021-09-25
20030330065923462489119,2003-03-30
2025 05 24,2025-05-24
10/11/2004,2004-10-11
Sự kiện diễn ra vào 21/6/2007 2:46,2007-06-21
Ngày 11-6-2014,2014-06-11
1172941200000,2007-03-04
2009-03-18T15:30:13,2009-03-18
Ngày 29-5-2001,2001-05-29
"June 8, 1999",1999-06-08
2045754000000000,2034-10-30
36-10-2008,2008-10-18
2015-09-08T20:03:08.321036Z,2015-09-08
2035-01-16T17:02:58.695849654Z,2035-01-16
10 Jun 1994,1994-06-10
1541869200000000000,2018-11-11
19930721002943864,1993-07-21
ngày 16 tháng 5 năm 2017,2017-05-16
1816275600,2027-07-23
25-9-2007,2007-09-25
19931124161353450,1993-11-24
1993-11-19T09:52:05.278Z,1993-11-19
08 12 08,2008-12-08
2032-10-05T13:35:38,2032-10-05
2008-08-17T00:32:23Z+3,2008-08-17
30.7.2010T14-51-55,2010-07-30
19980925044449618,1998-09-25
769885200000,1994-05-26
20070408165029401,2007-04-08
20130823175238,2013-08-23
5 tháng 9 năm 2007,2007-09-05
760726800,1994-02-09
9.9.2006T13-11-11,2006-09-09
2020-11-25T01:51:46Z+3,2020-11-25
1995-06-24T21:30:58,1995-06-24
Ngày 8-1-2015,2015-01-08
2015-07-22T23:07:55+2500,2015-07-22
1531155600000000000,2018-07-10
The system recorded 20281112223438,2028-11-12
20191217045902783,2019-12-17
12/10/2020,2020-10-12
28-3-2010,2010-03-14
985194000000000000,2001-03-22
13.4.2022T15-46-51,2022-04-13
"November 26, 1991",1991-11-26
20240706083333867257,2024-07-06
19910521084006867,1991-05-21
24/3/2030 giờ 13:56:39,2030-03-24
2/5/2020 giờ 0:17:23,2020-05-02
ngày 27 tháng 5 năm 2003,2003-05-27
2005_08_31T8_27_59+07:00,2005-08-31
16/3/2015 giờ 18:5:13,2015-03-16
06.07.28,2028-07-06
20000225011439234695832,2000-02-25
20130917032513,2013-09-17
26.07.14,2014-07-26
7 tháng 12 năm 2013,2013-12-07
20260617045801988290231,2026-06-17
19980907025651156963,1998-09-07
Ngày 1-8-2013,2013-08-01
ngày 6 tháng 6 năm 2022,2022-06-06
2004-01-31T21:02:38+2500,2004-01-31
1993_12_15T10_4_1-0300,1993-12-15
"August 15, 2027",2027-08-15
2007-06-17T17:29:29.471540514Z,2007-06-17
28-2-2015,2015-02-28
ngày 27 tháng 12 năm 2006,2006-12-27
17 Apr 2017,2017-04-17
06|03|00,2000-03-06
2014_07_23T0_34_59Z,2014-07-23
19980626193354489,1998-06-26
20221121032650923,2022-11-21
20190514102954887169,2019-05-14
1990-12-14T13:07:54+2500,1990-12-14
22 tháng 6 năm 2024,2024-06-22
756666000000000000,1993-12-24
20220529114720272,2022-05-29
2009-11-22T10:08:36+2500,2009-11-22
4-10-2005,2005-10-04
2005_05_31T18_39_1+0500,2005-05-31
1279126800,2010-07-15
21.10.2003,2003-10-21
2027-03-28T23:22:09Z+3,2027-03-28
12.2.2027T1-46-33,2027-02-12
The system recorded 20261205071201,2026-12-05
1994-02-11T08:56:15.368Z,1994-02-11
19 February 1991,1991-02-19
1998-01-26T23:28:01.992202439Z,1998-01-26
"18th of January, 2022",2022-01-18
Sự kiện diễn ra vào 25/3/2017 8:17,2017-03-25
38-8-2032,2032-08-19
29 May 2022,2022-05-29
2034-12-09T22:56:40,2034-12-09
05 23 2015,2015-05-23
21 June 1990,1990-06-21
29 Mar 1991,1991-03-29
The system recorded 19930817151848,1993-08-17
01-16-2011,2011-01-16
20171028084654686,2017-10-28
2000-11-02T14:20:54.529Z,2000-11-02
20260516072419555133001,2026-05-16
07.12.2011,2011-07-12
20231031011456837739613,2023-10-31
2020/10/13T0514,2020-10-13
30 Mar 2016,2016-03-30
4/14-1996,1996-07-04
2030-07-25T18:37:06.325424Z,2030-07-25
2006_08_04T21_1_38+08,2006-08-04
2028-11-02T06:12:27,2028-11-02
1176310800000000,2007-04-12
22/22-2004,2004-11-22
7/4-2032,2032-02-07
2021-02-14T16:54:06+2500,2021-02-14
1995-10-17T07:14:01.729893Z,1995-10-17
2021_11_10T3_34_22+07:00,2021-11-10
21|04|34,2034-04-21
19980430133025276720,1998-04-30
01 02 27,2027-02-01
20011110095904730,2001-11-10
"6th of January, 2021",2021-01-06
2024/9/11T204332,2024-09-11
16.10.2016T7-9-18,2016-10-16
2009-07-20T11:44:27.355338Z,2009-07-20
10-4-2013,2013-04-05
14 Feb 2031,2031-02-14
2018-06-13T07:06:01,2018-06-13
22/4/2007 giờ 10:8:59,2007-04-22
1994-01-31T14:44:30,1994-01-31
30 Jul 2026,2026-07-30
1997-02-01T13:36:50.770625704Z,1997-02-01
2011-06-24T17:07:57+0500,2011-06-24
2017-03-28T12:09:17.001366729Z,2017-03-28
2035-11-16T02:21:00,2035-11-16
Ngày 4-4-2009,2009-04-04
2027-02-13T10:43:35+2500,2027-02-13
"July 27, 1999",1999-07-27
5 tháng 6 năm 2022,2022-06-05
18-7-2024,2024-07-18
1994-05-26T14:14:52+2500,1994-05-26
17-1-2023,2023-01-17
2000-03-08T00:41:10Z+3,2000-03-08
31-05-02,2002-05-31
1632243600000000000,2021-09-22
46-9-2006,2006-09-23
2011-06-25T22:56:06,2011-06-25
"9th of May, 1993",1993-05-09
38-3-2013,2013-03-19
2003-11-17T16:10:10+2500,2003-11-17
52-3-2029,2029-03-26
1992-06-06T16:27:56+2500,1992-06-06
2020-04-25T18:44:05Z+3,2020-04-25
20141120032211012553,2014-11-20
16.9.2001T8-23-37,2001-09-16
19-6-2000,2000-06-19
1652720400000000,2022-05-17
1441645200000,2015-09-08
1365094800000000,2013-04-05
Sự kiện diễn ra vào 4/11/1999 2:54,1999-11-04
24-5-2006,2006-05-24
20240724062556,2024-07-24
Sự kiện diễn ra vào 18/9/1999 18:10,1999-09-18
ngày 3 tháng 8 năm 2021,2021-08-03
2012-07-27T04:01:27.236Z,2012-07-27
6-10-2025,2025-10-03
18-7-1999,1999-07-09
9 Jun 2024,2024-06-09
2012-03-09T05:53:12,2012-03-09
1656867600000000000,2022-07-04
18 05 97,1997-05-18
19930826033802589932,1993-08-26
26.6.1994,1994-06-26
2027/1/1T7715,2027-01-01
8 Oct 1999,1999-10-08
2016-06-14T22:11:59,2016-06-14
2032-03-04T01:42:20.359842954Z,2032-03-04
1992.12.09,1992-12-09
21/14-2020,2020-07-21
01_02_2023,2023-01-02
2015-01-02T10:45:43Z+3,2015-01-02
4 Jun 2032,2032-06-04
20020419075722086889802,2002-04-19
2008/4/4T11313,2008-04-04
20300220212605002497331,2030-02-20
01 16 2019,2019-01-16
15 tháng 1 năm 2005,2005-01-15
Ngày 24-3-2012,2012-03-24
1947862800,2031-09-23
Ngày 25-9-2001,2001-09-25
1997-01-15T03:24:56.414625Z,1997-01-15
The system recorded 20311116021415,2031-11-16
1993.07.29,1993-07-29
2007-03-18T22:38:36.320684124Z,2007-03-18
1998-07-07T23:55:00,1998-07-07
5-3-1995,1995-03-05
1898701200,2030-03-03
2017-12-20T04:57:29+2500,2017-12-20
Ngày 24-2-2015,2015-02-24
26-7-2035,2035-07-26
2020-10-29T11:17:57+2500,2020-10-29
"March 25, 2018",2018-03-25
7/12-2007,2007-06-07
2030-10-07T15:10:40Z+3,2030-10-07
Ngày 12-7-2029,2029-07-12
14.9.1994T0-52-12,1994-09-14
25 September 2006,2006-09-25
13/4-2031,2031-02-13
ngày 21 tháng 5 năm 1992,1992-05-21
2009-06-17T07:46:26.648805Z,2009-06-17
Event at 1994-08-14T18:1:43,1994-08-14
2000-08-22T06:54:46.232288Z,2000-08-22
2020/11/8T11316,2020-11-08
Sự kiện diễn ra vào 19/11/2013 14:40,2013-11-19
670611600000000,1991-04-03
20240512204901833633,2024-05-12
2028-03-08T19:34:10.903532Z,2028-03-08
Sự kiện diễn ra vào 17/7/2015 1:9,2015-07-17
2000-01-20T04:48:00.044361861Z,2000-01-20
2007/02/19,2007-02-19
8/1/2020 giờ 19:27:12,2020-01-08
The system recorded 19960720195925,1996-07-20
2023 03 19,2023-03-19
20 Apr 2020,2020-04-20
2020-11-12T17:34:30.806559812Z,2020-11-12
Sự kiện diễn ra vào 18/5/1997 3:2,1997-05-18
2007-10-02T18:58:10+07:00,2007-10-02
1999_11_02T14_49_34-0330,1999-11-02
21-2-2008,2008-02-21
9 March 2031,2031-03-09
2005-01-06T20:25:11Z+3,2005-01-06
08 10 2033,2033-08-10
1040835600000000,2002-12-26
1776272400000000000,2026-04-16
1218992400000,2008-08-18
1463677200000000,2016-05-20
2030-01-19T10:24:26-0330,2030-01-19
20331006080923172,2033-10-06
7|11|2033,2033-11-07
1921770000000000,2030-11-25
2009|04|11,2009-04-11
20341122214455700221,2034-11-22
62-5-2010,2010-05-31
The system recorded 20051008190705,2005-10-08
20030718044625541135,2003-07-18
5 11 1999,1999-11-05
22/6/1997,1997-06-22
11.20.2003,2003-11-20
1996-10-08T18:39:20.756370Z,1996-10-08
The system recorded 20041004030208,2004-10-04
8/14-1995,1995-07-08
25 tháng 8 năm 2020,2020-08-25
15 June 1998,1998-06-15
32-7-1996,1996-07-16
1992-04-18T00:31:35+2500,1992-04-18
1890493200000000,2029-11-28
2026-05-04T03:14:42.509593Z,2026-05-04
1976374800000,2032-08-18
4 Jul 1998,1998-07-04
Ngày 25-5-2019,2019-05-25
4.4.2034T4-54-18,2034-04-04
1117904400000,2005-06-05
Ngày 28-7-2004,2004-07-28
20221111071451212501202,2022-11-11
2009_10_15T15_51_22+08,2009-10-15
20330324125413801,2033-03-24
5/7/2022 giờ 20:34:14,2022-07-05
7 7 2027,2027-07-07
2010-07-21T06:34:27.840860512Z,2010-07-21
6-7-1999,1999-07-06
"November 12, 2019",2019-11-12
12/10/2016 giờ 16:45:58,2016-10-12
752173200000000,1993-11-02
19980928065150317251376,1998-09-28
2030-04-22T21:07:46Z,2030-04-22
The system recorded 20240625114848,2024-06-25
11 25 1997,1997-11-25
24/4/1993 giờ 14:58:28,1993-04-24
2007_01_04T13_41_1-0330,2007-01-04
2000-04-16T02:17:16+3,2000-04-16
8 December 1999,1999-12-08
36-12-2000,2000-12-18
1391792400000,2014-02-08
12-5-2035,2035-05-06
1993_02_02T21_32_55+07:00,1993-02-02
1646326800,2022-03-04
2026-07-01T03:58:12.005850Z,2026-07-01
Ngày 18-11-2017,2017-11-18
The system recorded 20241201195536,2024-12-01
"8th of June, 2007",2007-06-08
05_11_26,2026-11-05
13 tháng 3 năm 2002,2002-03-13
19931221012953842,1993-12-21
07-09-22,2022-09-07
1289667600000000,2010-11-14
17/6-2003,2003-03-17
1995.06.19,1995-06-19
20211207063420,2021-12-07
15/7/2027 giờ 20:45:17,2027-07-15
7 tháng 5 năm 2005,2005-05-07
19 May 2004,2004-05-19
26 tháng 5 năm 2004,2004-05-26
20150119052824,2015-01-19
"December 19, 2029",2029-12-19
Ngày 24-11-1995,1995-11-24
22-1-2004,2004-01-11
Event at 2028-08-18T0:5:44,2028-08-18
18_09_03,2003-09-18
2015_06_05T8_48_21+3,2015-06-05
Sự kiện diễn ra vào 4/7/2004 16:56,2004-07-04
29.6.2023T2-13-3,2023-06-29
2023-08-02T16:56:55,2023-08-02
20171106150008445,2017-11-06
20300912221909333036,2030-09-12
20 August 1994,1994-08-20
Sự kiện diễn ra vào 14/5/1991 15:12,1991-05-14
19/12/2005,2005-12-19
2031-03-27T19:17:45.216Z,2031-03-27
1/3/2017 giờ 8:37:1,2017-03-01
"26th of July, 2032",2032-07-26
6-2-2021,2021-02-06
20160713132232614227093,2016-07-13
12/10-2023,2023-05-12
19920911093425146316294,1992-09-11
20030813211434,2003-08-13
2010-05-02T07:48:10+2500,2010-05-02
"23th of November, 2010",2010-11-23
14-11-2011,2011-11-07
2029-10-02T10:26:28+2500,2029-10-02
1990-07-19T15:55:52.140459883Z,1990-07-19
20320921062004483532,2032-09-21
20330715003139990407,2033-07-15
Ngày 4-2-2014,2014-02-04
Sự kiện diễn ra vào 6/12/2029 11:57,2029-12-06
40-5-2017,2017-05-20
1230310800000000000,2008-12-27
1999_12_07T22_25_3+2500,1999-12-07
The system recorded 20230103061526,2023-01-03
2024-07-26T10:47:06.954003242Z,2024-07-26
2004-05-09T08:21:16.660744411Z,2004-05-09
Sự kiện diễn ra vào 4/4/2023 8:50,2023-04-04
Sự kiện diễn ra vào 9/2/2028 17:55,2028-02-09
Ngày 12-11-1994,1994-11-12
11/11/2028 giờ 6:0:56,2028-11-11
22 tháng 11 năm 2012,2012-11-22
2019-06-25T22:11:26+2500,2019-06-25
2031 12 04,2031-12-04
1994-04-02T05:40:49+2500,1994-04-02
2007-03-24T20:30:47,2007-03-24
20180518042442134499,2018-05-18
1931446800,2031-03-17
1928250000000000,2031-02-08
20321229040415553998,2032-12-29
20131225120036,2013-12-25
14 Jan 1996,1996-01-14
2034_05_03T10_58_35+00:00,2034-05-03
The system recorded 20100901032405,2010-09-01
2030-07-12T06:08:59Z+3,2030-07-12
03|01|2003,2003-03-01
23 tháng 12 năm 2035,2035-12-23
2004/04/15,2004-04-15
1990-10-09T14:03:41.983768615Z,1990-10-09
1991-11-16T11:37:05.255281Z,1991-11-16
The system recorded 20040701182616,2004-07-01
20010730024052572,2001-07-30
31/10/2009,2009-10-31
2015-09-17T13:11:58Z+3,2015-09-17
2022-07-23T17:08:58+2500,2022-07-23
2019-06-01T02:29:14Z+3,2019-06-01
19930622070457,1993-06-22
2025/5/2T204340,2025-05-02
2019|05|11,2019-05-11
"November 12, 2000",2000-11-12
17.4.2009T18-46-20,2009-04-17
"8th of December, 2035",2035-12-08
12 14 2016,2016-12-14
ngày 9 tháng 8 năm 2016,2016-08-09
2028/11/17,2028-11-17
The system recorded 19960206014049,1996-02-06
12-8-1995,1995-08-06
2/11/2017 giờ 3:14:54,2017-11-02
30-1-1999,1999-01-15
6/8/1993 giờ 22:52:29,1993-08-06
31 August 2000,2000-08-31
2010-06-16T05:12:28Z+3,2010-06-16
1492880400000000000,2017-04-23
1504026000000,2017-08-30
2034-05-17T19:50:03Z+3,2034-05-17
2001_07_27T14_4_50Z+3,2001-07-27
2006_11_09T11_16_23+08,2006-11-09
2005-08-30T15:04:56,2005-08-30
Ngày 5-10-2010,2010-10-05
1611162000000000000,2021-01-21
2023-09-12T00:06:59.561Z,2023-09-12
9/9/2033 giờ 20:53:46,2033-09-09
19931123151723,1993-11-23
2028-03-12T12:38:06Z+3,2028-03-12
2021-07-16T11:47:45Z+3,2021-07-16
ngày 22 tháng 6 năm 1994,1994-06-22
04|05|2025,2025-04-05
1994-09-29T20:35:12.696300Z,1994-09-29
1724000400000000,2024-08-19
Sự kiện diễn ra vào 5/10/2004 19:39,2004-10-05
20 tháng 6 năm 2010,2010-06-20
1879261200000000000,2029-07-21
"14th of August, 2004",2004-08-14
2020-06-10T05:02:18,2020-06-10
19 Nov 2010,2010-11-19
3 tháng 8 năm 2002,2002-08-03
"3rd of January, 1995",1995-01-03
6/24-2029,2029-12-06
20231113101958740026,2023-11-13
1993-08-16T03:58:47.137167Z,1993-08-16
4-2-2024,2024-02-04
The system recorded 20130530004606,2013-05-30
Ngày 12-2-2003,2003-02-12
1554310800,2019-04-04
3-4-2006,2006-04-03
ngày 9 tháng 7 năm 2026,2026-07-09
2015-07-16T00:56:33.913987Z,2015-07-16
28 11 29,2029-11-28
22_10_24,2024-10-22
894646800,1998-05-09
2029-10-10T02:20:06Z+3,2029-10-10
2015-11-26T23:37:50,2015-11-26
2023/6/14T15724,2023-06-14
25/16-2010,2010-08-25
23.03.99,1999-03-23
ngày 7 tháng 8 năm 1994,1994-08-07
26.5.2005T2-6-21,2005-05-26
32-11-2030,2030-11-16
2008-06-10T15:09:10+2500,2008-06-10
1953997200000000,2031-12-03
20211220014303,2021-12-20
818182800,1995-12-06
13/7/2001 giờ 5:3:38,2001-07-13
2021-10-25T06:58:39Z+3,2021-10-25
ngày 30 tháng 1 năm 1990,1990-01-30
1992-05-21T05:17:40+2500,1992-05-21
1897923600,2030-02-22
28 tháng 5 năm 2029,2029-05-28
1990_06_02T23_17_39+07:00,1990-06-02
02-11-27,2027-11-02
1382547600000,2013-10-24
17/06/07,2007-06-17
18/11/2019 giờ 18:39:56,2019-11-18
ngày 7 tháng 1 năm 2024,2024-01-07
2005-06-20T06:30:07,2005-06-20
1997-09-13T07:50:20-0330,1997-09-13
2000-09-19T01:37:50.605710227Z,2000-09-19
24 tháng 2 năm 2025,2025-02-24
24_7_2002,2002-07-24
"27th of September, 1993",1993-09-27
Sự kiện diễn ra vào 5/7/2021 4:30,2021-07-05
20/18-2003,2003-09-20
2008-07-12T06:40:58+2500,2008-07-12
2003-04-10T12:30:44.831850248Z,2003-04-10
"July 23, 2012",2012-07-23
20141114060748630134999,2014-11-14
Sự kiện diễn ra vào 29/5/2034 20:34,2034-05-29
1662829200000000000,2022-09-11
20300725035718683,2030-07-25
"February 24, 2008",2008-02-24
752000400,1993-10-31
14/12/2025 giờ 6:23:31,2025-12-14
2002-04-18T17:04:50+2500,2002-04-18
20201203010421286022734,2020-12-03
21/02/97,1997-02-21
2033-08-07T13:10:57.529365656Z,2033-08-07
Ngày 21-2-2002,2002-02-21
775846800000,1994-08-03
"19th of September, 2029",2029-09-19
953485200000,2000-03-20
16/4/1997 giờ 17:19:53,1997-04-16
20070518223314210341711,2007-05-18
Sự kiện diễn ra vào 11/9/2012 18:22,2012-09-11
29 tháng 5 năm 2010,2010-05-29
03_21_2032,2032-03-21
1352566800000,2012-11-11
1991-12-13T02:45:17,1991-12-13
The system recorded 20130609014445,2013-06-09
2014-10-11T03:32:54.358Z,2014-10-11
20310429120307553,2031-04-29
12/30/2003,2003-12-30
12 tháng 12 năm 2035,2035-12-12
2006-05-30,2006-05-30
2014_06_24T0_15_46Z+3,2014-06-24
19960302225654521998437,1996-03-02
854643600000,1997-01-31
11/8-2010,2010-04-11
The system recorded 19921103132845,1992-11-03
1693501200000000000,2023-09-01
2029-07-03T15:58:25.705953028Z,2029-07-03
Ngày 11-6-1996,1996-06-11
2031_09_28T0_13_18+0500,2031-09-28
"7th of June, 2026",2026-06-07
2013-05-25T00:46:03Z+3,2013-05-25
2002/11/14T23010,2002-11-14
860518800,1997-04-09
26 Nov 2001,2001-11-26
The system recorded 20140217165728,2014-02-17
1994-04-11T03:07:49+2500,1994-04-11
20321026063013123025396,2032-10-26
"January 7, 2016",2016-01-07
19900618042643328212136,1990-06-18
1890493200000,2029-11-28
10/10-2032,2032-05-10
ngày 13 tháng 4 năm 2012,2012-04-13
2010-08-11T08:49:03,2010-08-11
20171014043240339084,2017-10-14
27.4.2000,2000-04-27
The system recorded 20241016032626,2024-10-16
1282842000,2010-08-27
2068477200000,2035-07-20
2032_03_20T4_31_41Z+3,2032-03-20
20330101184418,2033-01-01
12 August 2002,2002-08-12
23-2-1992,1992-02-23
20010324092335127959245,2001-03-24
1993_04_20T1_46_22Z,1993-04-20
2014-05-25T16:35:07Z+3,2014-05-25
2004-09-14T08:19:33.702797Z,2004-09-14
2007_08_23,2007-08-23
ngày 6 tháng 9 năm 2019,2019-09-06
1997.07.27,1997-07-27
7 Sep 2023,2023-09-07
25/3/2009 giờ 23:58:36,2009-03-25
727462800000000000,1993-01-20
60-8-2024,2024-08-30
"October 21, 2016",2016-10-21
1329757200000000000,2012-02-21
18-5-1994,1994-05-09
Event at 1990-10-17T1:30:40,1990-10-17
765565200000000000,1994-04-06
2021/06/28,2021-06-28
1990-03-08T16:39:14+08,1990-03-08
1211821200000000000,2008-05-27
2000-07-16T13:33:03.881779077Z,2000-07-16
2026-02-15T01:54:54+00:00,2026-02-15
2032/5/29T195243,2032-05-29
2009-09-06T13:05:36.946Z,2009-09-06
Ngày 25-9-2030,2030-09-25
Ngày 8-3-2032,2032-03-08
2 tháng 7 năm 2020,2020-07-02
18-9-2009,2009-09-09
11/4-2011,2011-02-11
"17th of October, 2002",2002-10-17
19910624140727,1991-06-24
1498064400000,2017-06-22
"12th of May, 2006",2006-05-12
The system recorded 19901124232429,1990-11-24
1412874000000000,2014-10-10
ngày 11 tháng 5 năm 1995,1995-05-11
8/9/2017 giờ 18:38:29,2017-09-08
8/6-2015,2015-03-08
4/4/2009 giờ 12:14:53,2009-04-04
ngày 5 tháng 5 năm 2023,2023-05-05
1790442000000,2026-09-27
"29th of March, 2034",2034-03-29
18 09 16,2016-09-18
Sự kiện diễn ra vào 5/3/2022 7:27,2022-03-05
1706115600000,2024-01-25
20.07.20,2020-07-20
"November 29, 2022",2022-11-29
2 September 1995,1995-09-02
Sự kiện diễn ra vào 10/4/2028 3:38,2028-04-10
7.1.1992T0-13-35,1992-01-07
20130829232223513189988,2013-08-29
The system recorded 20220303032526,2022-03-03
2012-09-17T07:11:32Z+3,2012-09-17
Event at 2003-09-28T19:31:56,2003-09-28
Sự kiện diễn ra vào 31/5/2013 13:51,2013-05-31
Ngày 29-6-2014,2014-06-29
2007_10_19T2_15_7+07:00,2007-10-19
2031-04-05T00:21:17.919804Z,2031-04-05
2023_11_25T20_8_49+2500,2023-11-25
14 tháng 9 năm 2011,2011-09-14
20030106192252386,2003-01-06
19990117045556046,1999-01-17
Sự kiện diễn ra vào 28/7/2012 20:25,2012-07-28
20330330204654591,2033-03-30
966877200000000000,2000-08-22
700851600000,1992-03-18
19961025224001545923,1996-10-25
1235926800000000,2009-03-02
The system recorded 19970407201716,1997-04-07
2002-08-06T23:30:27.276968200Z,2002-08-06
11/25/2003,2003-11-25
2004-09-07T18:52:29+2500,2004-09-07
1928163600,2031-02-07
20290512165147236112,2029-05-12
16 11 06,2006-11-16
22 July 2017,2017-07-22
2014-07-03T13:45:21.844Z,2014-07-03
15 tháng 3 năm 2028,2028-03-15
"June 27, 1991",1991-06-27
1613149200000,2021-02-13
2023-07-26T16:33:02+2500,2023-07-26
"14th of July, 2035",2035-07-14
2-12-2010,2010-12-02
2028-07-08T15:53:18.354Z,2028-07-08
Ngày 23-6-2027,2027-06-23
840819600000000000,1996-08-24
40-12-2034,2034-12-20
2035-02-08T21:29:02+00:00,2035-02-08
19920408094802126981539,1992-04-08
20200414171155893406,2020-04-14
1991-11-29T10:48:56.722188551Z,1991-11-29
2026-07-09T11:10:18,2026-07-09
ngày 23 tháng 6 năm 2001,2001-06-23
19 Mar 2000,2000-03-19
12_04_2016,2016-12-04
2035-06-24T14:15:40.934Z,2035-06-24
4.10.2029,2029-10-04
2013_01_21T0_45_12-0300,2013-01-21
2018-04-08T13:45:28.320872Z,2018-04-08
24.8.2013T11-30-31,2013-08-24
1929114000000,2031-02-18
"14th of August, 1998",1998-08-14
6-1-2027,2027-01-06
1178384400,2007-05-06
2029338000,2034-04-23
19990727015453995369455,1999-07-27
2007_09_30T3_54_28+00:00,2007-09-30
2028-03-04T03:55:01.630587Z,2028-03-04
16 tháng 3 năm 2010,2010-03-16
20060302230535,2006-03-02
3.6.2016T20-15-9,2016-06-03
Sự kiện diễn ra vào 22/5/1993 5:34,1993-05-22
06 24 2000,2000-06-24
1801760400000,2027-02-05
20280417012257667011653,2028-04-17
Sự kiện diễn ra vào 13/3/2018 10:58,2018-03-13
"21th of September, 2023",2023-09-21
19900704165446703,1990-07-04
31-8-1997,1997-08-31
1895331600000000,2030-01-23
2023-12-29T09:10:21Z+3,2023-12-29
2008-07-12T07:40:15.476Z,2008-07-12
4 tháng 8 năm 2013,2013-08-04
Event at 2017-01-15T14:18:40,2017-01-15
24-12-2016,2016-12-12
20070211152708441926,2007-02-11
1896627600000000000,2030-02-07
2008-07-11T00:31:57.351563Z,2008-07-11
8.1.2005T22-1-47,2005-01-08
20_10_2030,2030-10-20
29.7.1999T6-30-48,1999-07-29
809110800000000,1995-08-23
20080620222829022389976,2008-06-20
1157043600000000000,2006-09-01
1583514000000000000,2020-03-07
15 June 2000,2000-06-15
"18th of January, 2017",2017-01-18
2029-01-18T19:04:11,2029-01-18
12-10-2027,2027-10-12
19 August 1994,1994-08-19
"26th of March, 2033",2033-03-26
2025/2/25T142458,2025-02-25
11 May 2012,2012-05-11
20200301042754346805,2020-03-01
ngày 30 tháng 11 năm 1997,1997-11-30
27/5/2029 giờ 13:26:52,2029-05-27
9 1 2003,2003-01-09
7-1-1993,1993-01-07
12_01_25,2025-01-12
Sự kiện diễn ra vào 24/11/2019 22:31,2019-11-24
1998|11|29,1998-11-29
22 7 2021,2021-07-22
14|12|2002,2002-12-14
19.4.2023T21-59-34,2023-04-19
09.25.2020,2020-09-25
1653411600000000000,2022-05-25
648666000000000000,1990-07-23
1942678800,2031-07-25
2002-12-10T14:51:55,2002-12-10
802890000000,1995-06-12
1997|02|15,1997-02-15
2015-11-26T23:42:26.662353Z,2015-11-26
939661200000000000,1999-10-12
2000/08/15,2000-08-15
2024_05_07T7_39_11+2500,2024-05-07
1992-01-01T19:19:33Z+3,1992-01-01
Ngày 29-12-2025,2025-12-29
1991-05-01T19:32:19.063Z,1991-05-01
Event at 2005-07-06T18:49:18,2005-07-06
20290610134233471,2029-06-10
5/4/2034 giờ 2:21:58,2034-04-05
28.1.2019T14-44-14,2019-01-28
26-5-2031,2031-05-13
"12th of January, 2021",2021-01-12
Event at 2031-05-04T8:18:31,2031-05-04
"3rd of July, 1993",1993-07-03
20340821043518,2034-08-21
2017-02-23T14:15:00Z+3,2017-02-23
2026-07-11T15:40:04Z+3,2026-07-11
27-6-1994,1994-06-27
22 March 2020,2020-03-22
20100501004101,2010-05-01
"27th of September, 2025",2025-09-27
24-1-2031,2031-01-24
2001-05-09T15:33:04-05:00,2001-05-09
Event at 2009-06-22T13:10:3,2009-06-22
23-12-1992,1992-12-23
26 06 08,2008-06-26
1996/10/14T91345,1996-10-14
1228669200000,2008-12-08
23 tháng 12 năm 2010,2010-12-23
15 January 1999,1999-01-15
01 11 01,2001-11-01
1997-07-13,1997-07-13
1180544400000,2007-05-31
2014-09-10T04:19:33.213794697Z,2014-09-10
Ngày 5-11-2031,2031-11-05
"8th of February, 2001",2001-02-08
2030/1/20T20719,2030-01-20
2015-08-01T03:45:47.149Z,2015-08-01
1999-09-10T01:38:12+07:00,1999-09-10
"8th of September, 2018",2018-09-08
1248368400000000000,2009-07-24
2001-01-04T21:15:07+2500,2001-01-04
26-5-2035,2035-05-26
10/16-2032,2032-08-10
2031-11-19T15:24:31.122688Z,2031-11-19
2001/3/20T7430,2001-03-20
2024_10_10T9_55_48+2500,2024-10-10
11 tháng 11 năm 2000,2000-11-11
1484845200000,2017-01-20
The system recorded 20161216211136,2016-12-16
24.8.2035T6-47-2,2035-08-24
2019-11-15T01:20:03Z+3,2019-11-15
24 tháng 5 năm 2010,2010-05-24
16.10.2017T7-41-35,2017-10-16
27-10-2034,2034-10-27
1991-01-26T08:35:25.217Z,1991-01-26
ngày 9 tháng 2 năm 2023,2023-02-09
12-3-2025,2025-03-06
20280523113639337,2028-05-23
1974819600000000,2032-07-31
20101202160214332906,2010-12-02
19-7-1999,1999-07-19
20-2-2002,2002-02-20
29_01_92,1992-01-29
8.5.2034T20-35-24,2034-05-08
1999-12-10T21:07:18.948Z,1999-12-10
5/1/2024 giờ 2:25:27,2024-01-05
1 Jul 2024,2024-07-01
29-5-2006,2006-05-29
2008-04-14T12:20:56-05:00,2008-04-14
Sự kiện diễn ra vào 11/5/1990 20:36,1990-05-11
2035-10-11T23:31:49,2035-10-11
18-2-2026,2026-02-18
20.11.2017T10-6-12,2017-11-20
25 May 2027,2027-05-25
20010427235313764657699,2001-04-27
5-2-2013,2013-02-05
20011226192223,2001-12-26
1996-01-07T23:06:15.162748Z,1996-01-07
2012-10-20,2012-10-20
1506186000000000000,2017-09-24
15/12/2018,2018-12-15
1868374800000000,2029-03-17
26.05.13,2013-05-26
13-7-2002,2002-07-13
1660237200000000,2022-08-12
36-6-1994,1994-06-18
19970507083336227962,1997-05-07
30 June 2026,2026-06-30
Event at 2033-06-27T20:50:5,2033-06-27
2021-07-26T05:20:48,2021-07-26
2003_04_27T22_24_5Z,2003-04-27
"May 12, 2005",2005-05-12
2012-02-16T02:34:05-0300,2012-02-16
25-10-17,2017-10-25
9 Dec 2032,2032-12-09
Ngày 10-5-2030,2030-05-10
2027-09-01T03:26:33+2500,2027-09-01
2027/7/14T164914,2027-07-14
1992/11/3T215230,1992-11-03
1752512400000,2025-07-15
1569776400000,2019-09-30
2026-06-06T23:54:32+2500,2026-06-06
3 Jul 2026,2026-07-03
2006-06-26T16:05:16Z+3,2006-06-26
ngày 15 tháng 1 năm 2032,2032-01-15
2008-11-07T17:00:06+0500,2008-11-07
2018-04-02T13:14:46.517090597Z,2018-04-02
1675357200000000,2023-02-03
1987434000000,2032-12-24
1616346000000,2021-03-22
20300916120714122576,2030-09-16
1999/9/24T74730,1999-09-24
1361725200000,2013-02-25
2009/9/15T9454,2009-09-15
The system recorded 19921129144026,1992-11-29
2029_09_11T21_27_45+00:00,2029-09-11
2-12-2024,2024-12-02
10|05|98,1998-05-10
03 30 2004,2004-03-30
5-12-2004,2004-12-05
17/10-2005,2005-05-17
2009-02-14T20:14:54+2500,2009-02-14
15-10-2001,2001-10-15
19931025053429540,1993-10-25
20301119222039773,2030-11-19
1004806800,2001-11-04
2031-08-26T11:15:54.803Z,2031-08-26
7 June 2024,2024-06-07
22-10-2017,2017-10-22
2023-11-10T23:55:55Z+3,2023-11-10
Sự kiện diễn ra vào 25/7/2021 16:44,2021-07-25
Sự kiện diễn ra vào 16/11/2021 12:3,2021-11-16
The system recorded 20100124043214,2010-01-24
26 tháng 11 năm 2006,2006-11-26
Event at 2001-12-18T9:31:55,2001-12-18
14 05 90,1990-05-14
1599325200,2020-09-06
18-9-2026,2026-09-09
2000-03-24T18:53:16Z+3,2000-03-24
1067792400000,2003-11-03
Event at 2031-06-22T1:2:57,2031-06-22
760035600000000,1994-02-01
2034-06-13T20:24:58.584841352Z,2034-06-13
20151026014611705,2015-10-26
10.19.1997,1997-10-19
Event at 2001-08-03T12:47:47,2001-08-03
Event at 2008-03-08T23:40:21,2008-03-08
2028-04-08T04:40:56+2500,2028-04-08
21/14-2022,2022-07-21
"17th of August, 1994",1994-08-17
23-1-2029,2029-01-23
20270503142349040,2027-05-03
2001_07_29T6_26_0-0330,2001-07-29
16 Mar 2009,2009-03-16
20271029033540295,2027-10-29
20041208155225528,2004-12-08
22_6_1997,1997-06-22
"August 5, 2026",2026-08-05
9 Apr 2021,2021-04-09
Ngày 16-8-1993,1993-08-16
12 Oct 2008,2008-10-12
ngày 2 tháng 5 năm 1999,1999-05-02
ngày 19 tháng 10 năm 1994,1994-10-19
12 tháng 7 năm 2016,2016-07-12
"28th of April, 1991",1991-04-28
2030_04_16T16_28_55Z+3,2030-04-16
2004-03-19T22:37:33,2004-03-19
14/10-1998,1998-05-14
24.1.2028T17-42-30,2028-01-24
16-01-13,2013-01-16
"March 5, 2028",2028-03-05
Ngày 20-1-2033,2033-01-20
1872781200000000,2029-05-07
1552755600,2019-03-17
20250804033836814,2025-08-04
21.02.18,2018-02-21
1998-05-31T11:43:57+08,1998-05-31
1516813200,2018-01-25
Sự kiện diễn ra vào 26/2/1997 17:32,1997-02-26
2032-02-12T16:24:50.723679515Z,2032-02-12
"21th of July, 2031",2031-07-21
2027-02-17T00:26:59.693062902Z,2027-02-17
20340912112035350485470,2034-09-12
2007-01-20T15:14:53.827Z,2007-01-20
2018-06-20T07:17:44+2500,2018-06-20
11 March 1995,1995-03-11
2 May 2013,2013-05-02
2022-12-21,2022-12-21
"January 7, 1992",1992-01-07
22 tháng 11 năm 2034,2034-11-22
728758800000000,1993-02-04
2033-04-22T03:23:45+2500,2033-04-22
"5th of September, 2030",2030-09-05
Ngày 18-2-2035,2035-02-18
20100727014747,2010-07-27
20090228161034711541234,2009-02-28
21 Dec 2023,2023-12-21
11/4/2008 giờ 4:54:17,2008-04-11
23 August 2001,2001-08-23
2004-03-13T04:02:27.094155184Z,2004-03-13
1996-02-03T11:43:29Z+3,1996-02-03
1789837200000000000,2026-09-20
"October 19, 1992",1992-10-19
26/14-2030,2030-07-26
Ngày 8-6-2010,2010-06-08
1152291600,2006-07-08
1296752400000000,2011-02-04
2023_05_18T7_27_38+3,2023-05-18
20180915050339395027,2018-09-15
1 Feb 2002,2002-02-01
917715600000,1999-01-31
ngày 13 tháng 6 năm 2025,2025-06-13
ngày 3 tháng 7 năm 2024,2024-07-03
28/6/2008 giờ 12:14:7,2008-06-28
19930824081953153311356,1993-08-24
20170913123044178,2017-09-13
Ngày 10-4-2025,2025-04-10
2/24-2002,2002-12-02
2022_02_03T21_3_44Z+3,2022-02-03
2029 05 23,2029-05-23
Sự kiện diễn ra vào 29/11/2015 18:10,2015-11-29
2031_01_03T17_28_23+3,2031-01-03
2020-02-12T23:27:52Z+3,2020-02-12
1375722000,2013-08-06
Ngày 6-11-1997,1997-11-06
ngày 17 tháng 7 năm 2027,2027-07-17
824835600000,1996-02-21
2031_12_18T9_17_6Z,2031-12-18
2031-04-15T18:07:36.007966750Z,2031-04-15
2016-08-12T07:31:30.327264480Z,2016-08-12
2005-12-12T05:36:02,2005-12-12
2 August 2027,2027-08-02
ngày 3 tháng 2 năm 2014,2014-02-03
15/6-2023,2023-03-15
04-10-1990,1990-04-10
2028-05-27T05:31:13,2028-05-27
1997-05-20T11:06:24+07:00,1997-05-20
2015/3/6T184016,2015-03-06
2026-12-16T03:54:27.904Z,2026-12-16
2028-04-07T02:23:00Z+3,2028-04-07
12 May 2015,2015-05-12
1991/7/19T12940,1991-07-19
1861808400000000,2028-12-31
2010-02-01T06:16:57Z+3,2010-02-01
1937235600000,2031-05-23
20340119024033,2034-01-19
20040903152715,2004-09-03
54-1-2020,2020-01-27
1349715600000000,2012-10-09
20010220090906435487,2001-02-20
The system recorded 20070522222005,2007-05-22
26 tháng 6 năm 1997,1997-06-26
Ngày 19-6-2034,2034-06-19
20010305135942971,2001-03-05
2032-07-25T00:26:50Z+3,2032-07-25
20200130093205382751,2020-01-30
2005 03 20,2005-03-20
19 July 2002,2002-07-19
22/08/32,2032-08-22
Event at 2031-07-31T8:4:21,2031-07-31
ngày 27 tháng 6 năm 1994,1994-06-27
"July 21, 2005",2005-07-21
20270129115340884224,2027-01-29
Sự kiện diễn ra vào 30/11/2008 11:13,2008-11-30
1999270800,2033-05-10
828378000000000000,1996-04-02
20/06/96,1996-06-20
8.2.2010T9-44-23,2010-02-08
17/4-2008,2008-02-17
"12th of September, 2009",2009-09-12
1528131600000,2018-06-05
9 June 1995,1995-06-09
1990-09-04T07:19:50.378Z,1990-09-04
"November 14, 2032",2032-11-14
20161127044130466272401,2016-11-27
2031-07-21T16:16:17Z+3,2031-07-21
1994-02-06T02:15:44.017141099Z,1994-02-06
20211208105038588132,2021-12-08
20190721041939,2019-07-21
1829840400000,2027-12-27
5 tháng 2 năm 2018,2018-02-05
2011-05-01T12:44:42,2011-05-01
1998/10/4T23490,1998-10-04
2013_04_20T11_49_37Z,2013-04-20
2007-01-25T23:40:29,2007-01-25
10 December 2017,2017-12-10
20250510141327119241902,2025-05-10
20320803023838344019,2032-08-03
20330513061006736249457,2033-05-13
20081202102706256625,2008-12-02
19921212004830335,1992-12-12
16-1-2006,2006-01-16
ngày 6 tháng 8 năm 2022,2022-08-06
3.8.1995T11-41-36,1995-08-03
24 tháng 9 năm 2023,2023-09-24
10 10 2001,2001-10-10
2035-08-09T09:05:39Z+3,2035-08-09
Sự kiện diễn ra vào 11/4/2000 19:49,2000-04-11
1997-08-15T08:42:55.666038Z,1997-08-15
2015-11-14T15:02:27+08,2015-11-14
12 28 1996,1996-12-28
2023.06.29,2023-06-29
ngày 21 tháng 1 năm 1998,1998-01-21
The system recorded 20140629234700,2014-06-29
685558800000,1991-09-23
19970828092917,1997-08-28
2007_09_03T9_2_38Z,2007-09-03
ngày 8 tháng 12 năm 2015,2015-12-08
Sự kiện diễn ra vào 28/3/2009 9:3,2009-03-28
1105376400000000000,2005-01-11
1991/1/8T23359,1991-01-08
46-11-2007,2007-11-23
2027-04-13T17:39:26-0300,2027-04-13
2002122000,2033-06-12
"June 23, 2025",2025-06-23
Sự kiện diễn ra vào 24/6/2016 6:7,2016-06-24
2018/11/18T16506,2018-11-18
1548867600,2019-01-31
46-1-1992,1992-01-23
2006-08-17T19:54:34+2500,2006-08-17
19941111180822003229933,1994-11-11
28.10.2012T5-48-57,2012-10-28
2015-05-19T07:55:19.605807Z,2015-05-19
1992_06_05T8_37_29+08,1992-06-05
2022-01-26T20:41:25+2500,2022-01-26
2010-11-08T23:07:51.778899970Z,2010-11-08
26/12-2022,2022-06-26
Sự kiện diễn ra vào 13/9/2027 12:44,2027-09-13
19910329080121097888681,1991-03-29
1499360400,2017-07-07
20000202125500172033,2000-02-02
2005-12-05T10:01:06+00:00,2005-12-05
2 tháng 2 năm 2016,2016-02-02
7.7.2034T9-10-43,2034-07-07
1992/8/31T163929,1992-08-31
20200409024340982,2020-04-09
20020519132020222,2002-05-19
1999-03-31T18:27:42Z+3,1999-03-31
The system recorded 20210125153430,2021-01-25
Event at 2013-09-23T10:20:13,2013-09-23
Event at 2007-06-29T6:13:39,2007-06-29
"December 18, 2018",2018-12-18
42-5-2017,2017-05-21
1992-07-15T11:23:36.218655Z,1992-07-15
ngày 29 tháng 6 năm 2002,2002-06-29
20140518224632419765849,2014-05-18
1486486800000,2017-02-08
11-06-2019,2019-11-06
"2nd of August, 2004",2004-08-02
27/10-2028,2028-05-27
12/15/2017,2017-12-15
Event at 2015-06-30T3:50:5,2015-06-30
The system recorded 20200925194740,2020-09-25
654973200000,1990-10-04
14.12.2011T2-36-13,2011-12-14
Ngày 16-2-2010,2010-02-16
2015-02-04T06:01:25+2500,2015-02-04
710701200,1992-07-10
"September 10, 2027",2027-09-10
2004.01.22,2004-01-22
2001_08_23T6_58_56+00:00,2001-08-23
6.4.2013T16-32-32,2013-04-06
1738688400000000000,2025-02-05
Sự kiện diễn ra vào 12/8/2026 22:1,2026-08-12
29/6-1993,1993-03-29
1995-01-29T02:53:53.129669Z,1995-01-29
7.12.1993T20-14-57,1993-12-07
2025-06-03T14:53:24+2500,2025-06-03
9 tháng 5 năm 2027,2027-05-09
2018_02_18T20_57_17+00:00,2018-02-18
Sự kiện diễn ra vào 9/5/1992 19:31,1992-05-09
2000-02-24T04:35:28Z+3,2000-02-24
2008/9/2T83723,2008-09-02
1844528400,2028-06-14
Event at 2026-06-30T10:46:10,2026-06-30
"July 7, 2017",2017-07-07
1997_04_22,1997-04-22
Ngày 22-9-2008,2008-09-22
2001/8/26T163214,2001-08-26
19970602055558,1997-06-02
2031-08-24T05:50:44Z+3,2031-08-24
2011_07_05T7_25_50+07:00,2011-07-05
20320516040848,2032-05-16
"September 13, 2022",2022-09-13
15.7.2008T0-25-35,2008-07-15
20001222025045714868816,2000-12-22
1215450000000000000,2008-07-08
2005-03-12T11:40:42.840Z,2005-03-12
The system recorded 20100808075253,2010-08-08
Event at 2034-05-14T23:35:34,2034-05-14
5 tháng 8 năm 1998,1998-08-05
11|02|2001,2001-11-02
2014-05-14T17:24:00Z+3,2014-05-14
2031-05-24T09:41:08Z+3,2031-05-24
1996-02-20,1996-02-20
20041007215906,2004-10-07
15 Nov 1999,1999-11-15
3 Oct 2009,2009-10-03
1988298000000,2033-01-03
Ngày 10-1-2021,2021-01-10
25 tháng 2 năm 2016,2016-02-25
720896400,1992-11-05
28-1-1990,1990-01-28
04.13.2026,2026-04-13
1035392400,2002-10-24
15-6-2019,2019-06-15
2035_09_17,2035-09-17
24-9-2031,2031-09-24
2026-07-11T19:08:04.258Z,2026-07-11
3/8-1991,1991-04-03
2005-07-08T10:14:47.423990Z,2005-07-08
Sự kiện diễn ra vào 5/1/2030 19:10,2030-01-05
4 2 2026,2026-02-04
ngày 11 tháng 12 năm 2033,2033-12-11
02-04-2006,2006-02-04
1961686800000000,2032-03-01
"January 19, 2022",2022-01-19
1993-03-04T21:17:46.567432Z,1993-03-04
20-1-2030,2030-01-10
2001-10-01T20:44:50Z+3,2001-10-01
Sự kiện diễn ra vào 13/12/1994 22:11,1994-12-13
15-8-2029,2029-08-15
2021_06_29T0_45_25-0330,2021-06-29
"19th of October, 1995",1995-10-19
19/22-2003,2003-11-19
7 December 2018,2018-12-07
1965229200,2032-04-11
1490893200000000000,2017-03-31
21 Apr 2018,2018-04-21
13 02 19,2019-02-13
17/14-1993,1993-07-17
13 Sep 1999,1999-09-13
2003-10-01T18:30:34.438Z,2003-10-01
20090626165823,2009-06-26
1127667600000,2005-09-26
2013-01-30T00:45:02.215790Z,2013-01-30
2026|11|02,2026-11-02
1813165200000000000,2027-06-17
4-8-2018,2018-08-02
707590800000000000,1992-06-04
20000626001322,2000-06-26
15 tháng 3 năm 1992,1992-03-15
15-1-2024,2024-01-15
11 22 2023,2023-11-22
1997-06-26T12:50:39.364372Z,1997-06-26
1993-05-08T00:06:50.794Z,1993-05-08
20260804121548087,2026-08-04
26-1-2030,2030-01-13
20241031141459,2024-10-31
22/3/2023 giờ 7:16:41,2023-03-22
15 Feb 2027,2027-02-15
791312400000000000,1995-01-29
Sự kiện diễn ra vào 20/5/1999 23:12,1999-05-20
Sự kiện diễn ra vào 25/5/2017 5:54,2017-05-25
05 11 31,2031-11-05
668624400000000,1991-03-11
Ngày 29-6-2000,2000-06-29
2005-12-04T05:16:22+2500,2005-12-04
1615482000,2021-03-12
"30th of January, 2002",2002-01-30
2018-06-09T14:15:26+2500,2018-06-09
04 08 2011,2011-04-08
Event at 2003-08-09T3:4:2,2003-08-09
24 Nov 2035,2035-11-24
2026-12-11T04:44:12Z+3,2026-12-11
The system recorded 20220716093415,2022-07-16
"17th of January, 2035",2035-01-17
12-6-1992,1992-06-06
28 Apr 2017,2017-04-28
2012.08.03,2012-08-03
1991_09_06T19_3_59+00:00,1991-09-06
11.9.2000T15-53-45,2000-09-11
20211207121823076677,2021-12-07
18 tháng 2 năm 2009,2009-02-18
20310507193548,2031-05-07
12 tháng 3 năm 2021,2021-03-12
2014-12-29T10:00:01+2500,2014-12-29
20060503135620766669,2006-05-03
1997-07-11,1997-07-11
32-10-1996,1996-10-16
6.2.2000T2-19-44,2000-02-06
996685200,2001-08-02
1990-08-31T04:35:40.852166Z,1990-08-31
2013-04-02T05:52:10.311799Z,2013-04-02
2028-03-05T08:39:54+2500,2028-03-05
2035-04-11T00:25:59.604709Z,2035-04-11
4/8-2006,2006-04-04
1805821200000,2027-03-24
2008_10_21T19_2_7-05:00,2008-10-21
1999|10|01,1999-10-01
"May 31, 2023",2023-05-31
12-7-2017,2017-07-06
"8th of January, 2024",2024-01-08
2006_12_20T7_57_29-0300,2006-12-20
20050603201408,2005-06-03
2002-12-13T13:56:36+2500,2002-12-13
902682000000,1998-08-10
20220206200208443284,2022-02-06
20150901105238503545199,2015-09-01
20150216065844,2015-02-16
2011/2/10T1778,2011-02-10
4 October 2028,2028-10-04
2040656400000000000,2034-09-01
19/2/2013 giờ 22:5:9,2013-02-19
The system recorded 20120716133940,2012-07-16
12-9-2015,2015-09-06
2021.02.22,2021-02-22
27/1/2025 giờ 19:36:29,2025-01-27
27.5.2028T1-16-31,2028-05-27
14.11.2028T20-50-35,2028-11-14
666810000000,1991-02-18
2000_01_03T8_44_47+2500,2000-01-03
2026/10/05,2026-10-05
01.11.16,2016-11-01
9.2.1992T20-10-49,1992-02-09
1992-12-08T12:47:54.758Z,1992-12-08
ngày 30 tháng 9 năm 2031,2031-09-30
26/18-1991,1991-09-26
20180922053409109,2018-09-22
718822800000,1992-10-12
2019-11-24T18:54:48+08,2019-11-24
Sự kiện diễn ra vào 31/12/2002 13:21,2002-12-31
2027.05.27,2027-05-27
Ngày 28-10-1998,1998-10-28
6/4-1991,1991-02-06
1181235600000000000,2007-06-08
23-4-2017,2017-04-23
2021-08-19T18:21:02,2021-08-19
2006|12|18,2006-12-18
1990-07-10T00:22:22.568659859Z,1990-07-10
ngày 22 tháng 10 năm 2004,2004-10-22
795114000,1995-03-14
Sự kiện diễn ra vào 24/2/2028 6:57,2028-02-24
2016-06-20T22:19:38.711130876Z,2016-06-20
2010_10_28T9_53_48+2500,2010-10-28
14.2.2001T11-54-33,2001-02-14
Event at 1995-12-13T11:3:21,1995-12-13
1 tháng 7 năm 2026,2026-07-01
1868720400000000,2029-03-21
26-01-22,2022-01-26
2025/2/15T71038,2025-02-15
20060703195652,2006-07-03
2034-07-08T03:19:53.343984001Z,2034-07-08
"22th of August, 1996",1996-08-22
19-4-2002,2002-04-19
2034-07-13T00:14:15.240203071Z,2034-07-13
Sự kiện diễn ra vào 13/3/2021 0:30,2021-03-13
30/20-1999,1999-10-30
"April 4, 2000",2000-04-04
27_07_22,2022-07-27
1733677200,2024-12-09
1999-03-11T07:16:50Z+3,1999-03-11
776970000000000,1994-08-16
20300830060317865859,2030-08-30
1207587600000000,2008-04-08
20290228054226,2029-02-28
Event at 1991-01-23T6:25:50,1991-01-23
13 Apr 1998,1998-04-13
"March 29, 2023",2023-03-29
Ngày 13-8-1994,1994-08-13
52-7-2013,2013-07-26
1838048400000,2028-03-31
ngày 20 tháng 12 năm 2012,2012-12-20
1994-06-23T15:24:18+2500,1994-06-23
01 19 2015,2015-01-19
2028-11-08T21:54:39+3,2028-11-08
Event at 2021-12-21T23:43:28,2021-12-21
24 Apr 2030,2030-04-24
23 July 2016,2016-07-23
Ngày 3-4-1991,1991-04-03
2035-07-25T11:10:22,2035-07-25
"22th of March, 2032",2032-03-22
20080522105256999017514,2008-05-22
1998-05-16T10:57:06.102390Z,1998-05-16
22-9-2026,2026-09-11
2011-12-05T08:04:17Z+3,2011-12-05
15 tháng 12 năm 2007,2007-12-15
2007-10-23T16:30:00,2007-10-23
"August 16, 1992",1992-08-16
20171029231240755446755,2017-10-29
1990/5/23T125919,1990-05-23
12/4/2034,2034-04-12
20220827103315274949669,2022-08-27
20291028112055087213,2029-10-28
2011-08-30T08:41:07,2011-08-30
Event at 2005-02-18T0:24:24,2005-02-18
7 Jun 2018,2018-06-07
Ngày 5-11-2028,2028-11-05
34-1-2018,2018-01-17
1990-01-17T17:14:13.292149616Z,1990-01-17
20340716074716,2034-07-16
31.07.25,2025-07-31
2009_04_02T12_57_48+3,2009-04-02
2029-12-06T16:53:41Z+3,2029-12-06
999882000000,2001-09-08
ngày 21 tháng 6 năm 2032,2032-06-21
1998-08-06T16:25:46,1998-08-06
Sự kiện diễn ra vào 18/1/1999 10:10,1999-01-18
Sự kiện diễn ra vào 21/10/2031 17:25,2031-10-21
The system recorded 19971121062327,1997-11-21
30-1-2013,2013-01-15
4.6.2012T2-59-45,2012-06-04
19/4-2027,2027-02-19
20211022070009167471,2021-10-22
10-1-2005,2005-01-10
2033-04-17T18:14:43,2033-04-17
2017_03_09,2017-03-09
20210217095524246008751,2021-02-17
1993-10-02T20:05:11+2500,1993-10-02
1332608400000000000,2012-03-25
1.2.2003T4-12-41,2003-02-01
2025-05-04T19:08:11,2025-05-04
The system recorded 20110114232934,2011-01-14
08|31|2032,2032-08-31
2012_09_17,2012-09-17
"17th of September, 1991",1991-09-17
14 tháng 1 năm 2022,2022-01-14
1992/11/8T231713,1992-11-08
01/30/2008,2008-01-30
19/20-2001,2001-10-19
19930831054141088779422,1993-08-31
2012-02-03T07:48:02+2500,2012-02-03
19940806070335101984,1994-08-06
20280518050143,2028-05-18
Sự kiện diễn ra vào 13/3/2012 4:47,2012-03-13
03 04 25,2025-04-03
27 December 2024,2024-12-27
Ngày 3-4-2035,2035-04-03
Sự kiện diễn ra vào 12/1/2001 20:33,2001-01-12
15/10/2021 giờ 19:17:51,2021-10-15
886093200000,1998-01-30
2031-06-10T19:46:48.283052Z,2031-06-10
2009-06-02T02:50:47,2009-06-02
2027-12-23T15:18:52.063Z,2027-12-23
ngày 24 tháng 8 năm 2030,2030-08-24
22 Jun 1994,1994-06-22
1119805200000000000,2005-06-27
The system recorded 20030523202727,2003-05-23
1517504400000,2018-02-02
987613200000000,2001-04-19
"March 21, 2009",2009-03-21
20210115190000,2021-01-15
4 tháng 2 năm 2030,2030-02-04
9-8-2003,2003-08-09
1791392400,2026-10-08
24/8-1995,1995-04-24
1999-11-01T19:08:39+07:00,1999-11-01
16.5.2028,2028-05-16
1758042000,2025-09-17
06.11.2009,2009-06-11
2019-08-29T23:37:56.727250Z,2019-08-29
13 Jan 1991,1991-01-13
16 Apr 2011,2011-04-16
"January 11, 2035",2035-01-11
Ngày 11-9-2028,2028-09-11
Event at 2008-12-02T19:23:34,2008-12-02
2020-07-10T13:27:41.108572594Z,2020-07-10
15 Sep 2019,2019-09-15
The system recorded 20061001195030,2006-10-01
10/31/1991,1991-10-31
2019-06-06T19:45:03.424Z,2019-06-06
10.10.1996,1996-10-10
25/1/2011,2011-01-25
1902416400000,2030-04-15
4/8/2020 giờ 13:50:18,2020-08-04
2003_09_08T0_15_38-0330,2003-09-08
"September 19, 2016",2016-09-19
1510506000000000000,2017-11-13
"September 9, 2005",2005-09-09
8 Mar 2019,2019-03-08
800557200000,1995-05-16
2010-06-20T01:56:18,2010-06-20
2023_07_01T0_46_26+08,2023-07-01
20350912155836085015,2035-09-12
1926349200000000000,2031-01-17
29/20-2023,2023-10-29
2030/8/7T73322,2030-08-07
Event at 2027-02-13T5:29:7,2027-02-13
"February 8, 2035",2035-02-08
2014/7/13T52341,2014-07-13
2015_03_09T18_26_25+07:00,2015-03-09
2023-09-29T09:42:17+0500,2023-09-29
5 tháng 8 năm 2033,2033-08-05
24/1/2012 giờ 17:57:42,2012-01-24
747939600000,1993-09-14
ngày 20 tháng 6 năm 2011,2011-06-20
2016-06-22T03:51:34,2016-06-22
1992-12-11T02:13:32,1992-12-11
30-12-2023,2023-12-30
2-12-2017,2017-12-02
1489078800000000000,2017-03-10
"March 31, 1992",1992-03-31
17/10-2010,2010-05-17
27.4.2012T19-40-0,2012-04-27
24 October 2010,2010-10-24
23/12/2024 giờ 12:8:34,2024-12-23
1995-07-01T16:57:13Z+3,1995-07-01
2009-10-26T02:01:54+2500,2009-10-26
1356886800,2012-12-31
2010-01-13T09:57:02Z+3,2010-01-13
20230207073808568,2023-02-07
7 August 2014,2014-08-07
18-12-2033,2033-12-09
19950421211732387,1995-04-21
19911127045658,1991-11-27
21/09/31,2031-09-21
ngày 8 tháng 5 năm 2024,2024-05-08
9 Feb 2016,2016-02-09
1995/3/19T424,1995-03-19
20330924165850,2033-09-24
"July 26, 1996",1996-07-26
14 11 2023,2023-11-14
Sự kiện diễn ra vào 30/3/1996 7:57,1996-03-30
12.31.2018,2018-12-31
683139600000,1991-08-26
20-10-2021,2021-10-10
1996/1/17T12348,1996-01-17
1325696400,2012-01-05
1357750800,2013-01-10
20080312044856982581094,2008-03-12
Sự kiện diễn ra vào 12/4/1999 18:4,1999-04-12
20350414001541787272950,2035-04-14
18-6-1995,1995-06-18
22 tháng 9 năm 2023,2023-09-22
Ngày 13-2-2030,2030-02-13
Sự kiện diễn ra vào 18/7/2031 23:27,2031-07-18
09|08|98,1998-08-09
Ngày 11-12-2015,2015-12-11
The system recorded 19971106180630,1997-11-06
2059146000,2035-04-03
20340919192230655015,2034-09-19
753642000000000000,1993-11-19
2009-10-10T08:05:38.077988657Z,2009-10-10
2022-03-09T02:58:15Z+3,2022-03-09
20-8-2003,2003-08-10
54-9-1992,1992-09-27
15 November 2023,2023-11-15
1621616400000000,2021-05-22
15 November 2034,2034-11-15
1995-11-21T06:20:16+0500,1995-11-21
Sự kiện diễn ra vào 30/9/2024 17:25,2024-09-30
20270808080556978,2027-08-08
896547600000000,1998-05-31
2-2-2023,2023-02-02
31.7.1998T10-29-39,1998-07-31
2027-06-13T00:32:40.962927988Z,2027-06-13
2024-10-11T20:46:05-0330,2024-10-11
"December 23, 1999",1999-12-23
1607792400000000,2020-12-13
30-9-2005,2005-09-15
20110904200432,2011-09-04
20080924140506309002,2008-09-24
Ngày 24-6-2034,2034-06-24
2004-05-28T18:04:43.446729201Z,2004-05-28
2021-02-05T14:50:46+2500,2021-02-05
20010618183525328280554,2001-06-18
14 Oct 2027,2027-10-14
20051128092009,2005-11-28
1997_11_02T2_2_28+08,1997-11-02
"28th of March, 2014",2014-03-28
19.6.2012,2012-06-19
The system recorded 19950218220216,1995-02-18
2000-07-30T11:41:18Z+3,2000-07-30
19910126103919203524,1991-01-26
5 tháng 1 năm 2034,2034-01-05
29 tháng 4 năm 1999,1999-04-29
2013-08-26T13:53:25.125Z,2013-08-26
Ngày 12-3-2018,2018-03-12
2024_08_21,2024-08-21
"25th of May, 2033",2033-05-25
Sự kiện diễn ra vào 25/6/2024 21:22,2024-06-25
20220517101119,2022-05-17
16-05-23,2023-05-16
17-9-2001,2001-09-17
13 3 2002,2002-03-13
3 July 1992,1992-07-03
"December 31, 2007",2007-12-31
20 Aug 2030,2030-08-20
2019_09_04,2019-09-04
2035/5/11T152820,2035-05-11
60-6-2008,2008-06-30
20 tháng 8 năm 2024,2024-08-20
30/20-2000,2000-10-30
2017-10-04T20:42:39+2500,2017-10-04
3|3|1999,1999-03-03
20340418025131643346,2034-04-18
"March 3, 2007",2007-03-03
1998-01-02T05:17:05,1998-01-02
ngày 28 tháng 1 năm 2005,2005-01-28
2013-03-03T22:08:24+07:00,2013-03-03
1999/7/18T53242,1999-07-18
25.8.2014T6-32-18,2014-08-25
835290000000000,1996-06-21
31/2-1996,1996-01-31
Ngày 24-1-2021,2021-01-24
"April 10, 2027",2027-04-10
20051026061837358466,2005-10-26
19980325150510373,1998-03-25
The system recorded 20220317133535,2022-03-17
20100518185206925003018,2010-05-18
2002-04-21T17:16:39-05:00,2002-04-21
20350819140955,2035-08-19
22 09 98,1998-09-22
2004-06-15T08:19:43+2500,2004-06-15
15 Apr 1992,1992-04-15
2005-12-26T02:40:59.427181Z,2005-12-26
16 Feb 2009,2009-02-16
19980118160355643218701,1998-01-18
20-4-2032,2032-04-20
2044285200000000,2034-10-13
1269450000000,2010-03-25
1312822800000000,2011-08-09
13/6-2023,2023-03-13
2024-06-07T03:33:52,2024-06-07
15-12-2006,2006-12-15
56-12-2012,2012-12-28
06-08-10,2010-08-06
2011-09-20T22:13:07.725287280Z,2011-09-20
06 12 2023,2023-06-12
11-6-2020,2020-06-11
The system recorded 20020509205833,2002-05-09
Ngày 27-2-2023,2023-02-27
1520096400000000,2018-03-04
Sự kiện diễn ra vào 3/5/2028 19:3,2028-05-03
"9th of July, 2027",2027-07-09
2029_12_20,2029-12-20
Event at 2002-09-14T2:7:36,2002-09-14
20310122101346887059181,2031-01-22
25 March 1996,1996-03-25
16 Nov 2022,2022-11-16
ngày 18 tháng 3 năm 2007,2007-03-18
Ngày 21-7-2001,2001-07-21
770230800,1994-05-30
2012-03-28T02:15:10.551513Z,2012-03-28
Sự kiện diễn ra vào 14/7/2014 23:14,2014-07-14
2033-12-27T14:00:06.844808227Z,2033-12-27
"December 30, 1994",1994-12-30
1888074000,2029-10-31
1781370000,2026-06-14
ngày 18 tháng 1 năm 2010,2010-01-18
836845200000000000,1996-07-09
2030-04-16T03:01:01.443Z,2030-04-16
20280309081811463,2028-03-09
25.12.2023T10-29-0,2023-12-25
1378573200,2013-09-08
07.01.1995,1995-07-01
30-5-1992,1992-05-15
1996-04-23T08:35:55.933Z,1996-04-23
19930402184658882,1993-04-02
12.11.1992T4-52-21,1992-11-12
24/7/1991 giờ 22:0:53,1991-07-24
7 April 1997,1997-04-07
08_13_1993,1993-08-13
ngày 1 tháng 6 năm 2015,2015-06-01
"August 5, 2024",2024-08-05
20340830104001955,2034-08-30
1993.09.20,1993-09-20
6 Sep 2023,2023-09-06
25/07/91,1991-07-25
694544400,1992-01-05
16.4.2032,2032-04-16
"10th of February, 2014",2014-02-10
1992-11-13T02:08:46.961202Z,1992-11-13
2011-10-16T20:07:58,2011-10-16
868381200000000,1997-07-09
6 tháng 11 năm 1999,1999-11-06
1810141200000000,2027-05-13
Event at 2002-10-22T19:52:19,2002-10-22
2008/5/23T21734,2008-05-23
24-11-2023,2023-11-24
1265907600000000,2010-02-12
20080823063119772,2008-08-23
16-4-2025,2025-04-16
2034-07-01T23:09:26.314247Z,2034-07-01
1940950800000000000,2031-07-05
1933434000,2031-04-09
Sự kiện diễn ra vào 24/3/2021 19:27,2021-03-24
2007-10-12T01:46:57.187026Z,2007-10-12
2002_09_29T8_12_27+07:00,2002-09-29
2008_03_10T16_12_13-0330,2008-03-10
20/1/2013 giờ 15:40:5,2013-01-20
"July 7, 2013",2013-07-07
2023-10-07T15:56:29+2500,2023-10-07
19931113225901653,1993-11-13
2018-12-07T22:50:02Z+3,2018-12-07
Event at 2018-03-24T13:39:17,2018-03-24
10|06|2031,2031-10-06
13/12-2022,2022-06-13
20160321131000655,2016-03-21
31/1/2027 giờ 1:13:22,2027-01-31
14-8-2002,2002-08-14
20260920211207259822,2026-09-20
22-6-2007,2007-06-11
2008-06-28T06:11:26Z+3,2008-06-28
30_05_35,2035-05-30
1746118800000,2025-05-02
1-1-2032,2032-01-01
"November 6, 2015",2015-11-06
15 tháng 5 năm 1992,1992-05-15
"9th of June, 2032",2032-06-09
24-7-2028,2028-07-24
1507654800000000000,2017-10-11
1238346000000,2009-03-30
2026-12-25T10:48:18.858478406Z,2026-12-25
06/01/15,2015-01-06
1996-08-25T02:50:27.778Z,1996-08-25
2006_06_14T14_42_53Z+3,2006-06-14
10 tháng 6 năm 2022,2022-06-10
2015/6/7T171931,2015-06-07
2027-05-19T17:49:42.924Z,2027-05-19
28.3.1996,1996-03-28
20351014024305044,2035-10-14
"24th of August, 2007",2007-08-24
1433264400000000,2015-06-03
Sự kiện diễn ra vào 5/12/2023 7:55,2023-12-05
21/4/2028 giờ 20:31:41,2028-04-21
20140621070952,2014-06-21
Ngày 15-1-2034,2034-01-15
2025_01_27T21_8_5+2500,2025-01-27
21.7.2029T19-30-14,2029-07-21
2025_01_05T19_20_31+08,2025-01-05
Event at 2025-04-24T18:47:52,2025-04-24
2014/10/03,2014-10-03
1957798800000,2032-01-16
5 tháng 10 năm 2011,2011-10-05
The system recorded 20160428124936,2016-04-28
13 Dec 2025,2025-12-13
2028-10-07T00:17:44+00:00,2028-10-07
29.5.2013T11-19-57,2013-05-29
"15th of January, 2007",2007-01-15
Sự kiện diễn ra vào 11/5/2012 15:0,2012-05-11
20001013013912667,2000-10-13
2005/9/4T131943,2005-09-04
30-12-2017,2017-12-30
1659200400,2022-07-31
20080629105129,2008-06-29
20300106112957602196,2030-01-06
5 Jun 1998,1998-06-05
2016-12-16T01:13:49Z+3,2016-12-16
11 Feb 2035,2035-02-11
2029-10-26T17:47:29.498018Z,2029-10-26
ngày 21 tháng 9 năm 2011,2011-09-21
19900211001647,1990-02-11
22 Sep 2027,2027-09-22
23 June 2033,2033-06-23
10/12-2026,2026-06-10
20061123180103547000217,2006-11-23
12-12-2014,2014-12-12
"15th of September, 2030",2030-09-15
The system recorded 20160122040716,2016-01-22
1991_01_07T10_43_22+3,1991-01-07
06_28_2025,2025-06-28
2029-03-14T04:29:43Z+3,2029-03-14
14 February 2000,2000-02-14
60-6-1991,1991-06-30
2013-04-29T09:53:13Z+3,2013-04-29
11.11.2027T20-59-5,2027-11-11
8/12/2020 giờ 4:14:51,2020-12-08
2004-01-24T02:49:54.379Z,2004-01-24
15 Aug 1994,1994-08-15
18-6-2020,2020-06-09
24/18-1997,1997-09-24
21|8|1995,1995-08-21
632250000,1990-01-14
2030-01-05T06:57:51.161375Z,2030-01-05
2004-02-10T06:30:00.259844359Z,2004-02-10
2016-03-30T23:57:41.864126432Z,2016-03-30
1103907600000000,2004-12-25
2020-03-13T06:05:50+2500,2020-03-13
2027-03-07T23:02:49.629347249Z,2027-03-07
20021014043948779337,2002-10-14
29/18-2016,2016-09-29
Event at 2023-11-24T18:9:23,2023-11-24
2028-04-01T23:58:54-0300,2028-04-01
9 Jun 2015,2015-06-09
13/22-2017,2017-11-13
13 May 2002,2002-05-13
"February 9, 2011",2011-02-09
26 June 2004,2004-06-26
710355600000,1992-07-06
2005-06-28T10:27:04.388934Z,2005-06-28
19-4-2029,2029-04-19
24_9_2005,2005-09-24
Sự kiện diễn ra vào 8/11/1998 17:30,1998-11-08
2028-02-04T05:26:45+2500,2028-02-04
2032-10-28T13:10:43,2032-10-28
20090310132033,2009-03-10
27/8-2008,2008-04-27
Event at 2017-10-22T5:52:52,2017-10-22
21.5.1990T22-51-20,1990-05-21
2034-08-02T15:18:49+2500,2034-08-02
3/1/2013 giờ 22:5:51,2013-01-03
4/4/2002 giờ 22:51:33,2002-04-04
2016/1/21T24430,2016-01-21
2010-08-15T00:23:41.086Z,2010-08-15
2021-06-18T07:21:09.402Z,2021-06-18
1488474000000,2017-03-03
748544400000,1993-09-21
1880298000000,2029-08-02
2001-05-19T07:47:32+2500,2001-05-19
2031|01|08,2031-01-08
04 03 2016,2016-04-03
"January 25, 2014",2014-01-25
7/24-1991,1991-12-07
699987600,1992-03-08
2034-02-09T02:09:29.399498Z,2034-02-09
Sự kiện diễn ra vào 29/6/2008 0:25,2008-06-29
10.10.2009T21-45-21,2009-10-10
1286038800000000000,2010-10-03
01/02/2005,2005-01-02
Ngày 6-5-2009,2009-05-06
17/8-2016,2016-04-17
1996-02-12T23:05:53Z+3,1996-02-12
Sự kiện diễn ra vào 4/11/2023 23:2,2023-11-04
2001-03-19T01:05:34.641Z,2001-03-19
1995-05-28T13:01:49.735690Z,1995-05-28
The system recorded 20020109050853,2002-01-09
14/12-2028,2028-06-14
18-05-32,2032-05-18
4/12/2012 giờ 17:2:46,2012-12-04
19981111200821935,1998-11-11
20310606143028688532,2031-06-06
2000-04-23T09:48:56-0300,2000-04-23
10-05-11,2011-05-10
Sự kiện diễn ra vào 24/11/2010 13:57,2010-11-24
1614618000000000000,2021-03-02
Event at 2032-07-04T0:45:38,2032-07-04
32-11-1992,1992-11-16
8/6-2011,2011-03-08
860432400,1997-04-08
"7th of February, 2015",2015-02-07
Ngày 20-9-2009,2009-09-20
1860512400000000,2028-12-16
2010_06_25T10_29_40+3,2010-06-25
1478710800,2016-11-10
17 August 2026,2026-08-17
30 November 2024,2024-11-30
2016-11-07T14:13:51Z+3,2016-11-07
2017 12 27,2017-12-27
"May 9, 2027",2027-05-09
1 Oct 2000,2000-10-01
Ngày 3-9-2020,2020-09-03
Event at 2029-07-03T16:6:8,2029-07-03
The system recorded 20081101051616,2008-11-01
25/2/2022 giờ 13:52:58,2022-02-25
ngày 13 tháng 8 năm 2026,2026-08-13
56-11-2010,2010-11-28
2017-08-12T02:37:28,2017-08-12
"August 22, 2025",2025-08-22
ngày 16 tháng 6 năm 2014,2014-06-16
1963760400,2032-03-25
02.16.2001,2001-02-16
702320400,1992-04-04
9.11.1995T17-26-48,1995-11-09
2031-08-21T16:21:18,2031-08-21
2027-11-20T14:56:57Z+3,2027-11-20
19901109063905,1990-11-09
1999/3/30T184012,1999-03-30
20100315001829546868,2010-03-15
2003-03-01T18:55:58-0330,2003-03-01
1016384400000000000,2002-03-18
2001-08-23T02:49:57-05:00,2001-08-23
1372870800000000000,2013-07-04
1182358800000000000,2007-06-21
05-07-2032,2032-05-07
643741200,1990-05-27
06/08/2025,2025-06-08
1997-10-30T18:27:41,1997-10-30
1411664400000,2014-09-26
2017_05_02T17_5_45+3,2017-05-02
2003-12-28T06:25:06+2500,2003-12-28
2010-05-06T17:40:17,2010-05-06
30-4-1992,1992-04-15
Event at 2024-09-15T0:51:28,2024-09-15
2007_06_03,2007-06-03
ngày 29 tháng 6 năm 2000,2000-06-29
"April 11, 2001",2001-04-11
ngày 15 tháng 10 năm 2006,2006-10-15
2032-05-02T05:19:09+2500,2032-05-02
2020.12.25,2020-12-25
1548867600000000,2019-01-31
2003_04_28T11_4_22Z+3,2003-04-28
Event at 2024-08-24T8:33:21,2024-08-24
05-06-1995,1995-05-06
966186000,2000-08-14
4 August 2016,2016-08-04
24 May 1994,1994-05-24
48-9-2018,2018-09-24
Sự kiện diễn ra vào 28/8/2025 14:46,2025-08-28
28 Jun 2031,2031-06-28
The system recorded 20080907200831,2008-09-07
2006-03-21T20:26:19Z+3,2006-03-21
"22th of March, 2021",2021-03-22
02|18|2000,2000-02-18
719341200,1992-10-18
1992-06-04T12:48:21Z+3,1992-06-04
Ngày 4-5-2020,2020-05-04
1328115600000000000,2012-02-02
30|10|13,2013-10-30
2018-04-06,2018-04-06
"7th of July, 2028",2028-07-07
The system recorded 20051229231039,2005-12-29
2031930000000000,2034-05-23
2040829200000000000,2034-09-03
2012-11-25T13:14:55.530557Z,2012-11-25
"August 25, 2015",2015-08-25
1995-05-29T12:03:58.562Z,1995-05-29
2004_11_11T15_26_30-0300,2004-11-11
Event at 2008-05-13T9:58:2,2008-05-13
11 Apr 2013,2013-04-11
15-10-2017,2017-10-15
2018-07-02T11:08:42.158Z,2018-07-02
1227286800,2008-11-22
03 11 2000,2000-03-11
The system recorded 20190529075802,2019-05-29
1990-12-29T10:31:10.821847Z,1990-12-29
17 Oct 2030,2030-10-17
2008-07-19T04:41:12+2500,2008-07-19
1997-03-22T12:49:34.357167Z,1997-03-22
20150627103957054061,2015-06-27
1133888400000000000,2005-12-07
13.1.2013T9-36-51,2013-01-13
14/5/2014,2014-05-14
06|17|2001,2001-06-17
01-18-1997,1997-01-18
1121360400000000,2005-07-15
10 tháng 6 năm 2006,2006-06-10
20180708232821953340772,2018-07-08
2010-12-20T16:57:31+2500,2010-12-20
The system recorded 20220719073137,2022-07-19
1390150800000000000,2014-01-20
The system recorded 19970918100515,1997-09-18
2010_03_16T18_27_51Z,2010-03-16
22 Sep 1993,1993-09-22
08 12 10,2010-12-08
25/04/25,2025-04-25
ngày 2 tháng 2 năm 2001,2001-02-02
19930609215706,1993-06-09
2013-10-08T10:49:47,2013-10-08
20160403155620505865,2016-04-03
"September 14, 1994",1994-09-14
"July 29, 2017",2017-07-29
20|01|28,2028-01-20
19.04.04,2004-04-19
Sự kiện diễn ra vào 20/5/2013 7:46,2013-05-20
16-3-2026,2026-03-16
2031_01_19T21_36_12+08,2031-01-19
Event at 1994-12-21T16:8:40,1994-12-21
Event at 2019-02-02T12:39:30,2019-02-02
951584400,2000-02-27
2030-03-28T09:56:23.734Z,2030-03-28
"19th of September, 2029",2029-09-19
642704400000,1990-05-15
2009-08-25T14:06:54+2500,2009-08-25
52-4-2019,2019-04-26
13-6-2008,2008-06-13
04/25/2012,2012-04-25
1990-09-30T21:41:13.453Z,1990-09-30
2021-01-24T17:01:41+0500,2021-01-24
05_31_2034,2034-05-31
24-10-2032,2032-10-24
1035392400,2002-10-24
"March 5, 2003",2003-03-05
2011-11-11T20:40:31.686009Z,2011-11-11
16-12-2024,2024-12-16
10_01_20,2020-01-10
22-12-2007,2007-12-22
2028-05-24T15:56:37Z+3,2028-05-24
1090947600000,2004-07-28
1993-04-03T18:12:27+2500,1993-04-03
2027/6/9T19946,2027-06-09
21/6/1992 giờ 3:20:13,1992-06-21
1734109200000000000,2024-12-14
10-7-2010,2010-07-10
21|06|04,2004-06-21
1999-10-29T07:30:36Z+3,1999-10-29
1997_02_19T18_11_45+07:00,1997-02-19
20110101080702,2011-01-01
23.10.2031T11-18-3,2031-10-23
13 tháng 5 năm 2020,2020-05-13
20101102124828,2010-11-02
19990628043445733,1999-06-28
1081357200000000,2004-04-08
28.7.2012T5-21-0,2012-07-28
859136400000000000,1997-03-24
20000121080924893710508,2000-01-21
1257958800,2009-11-12
1771347600,2026-02-18
24 tháng 7 năm 2001,2001-07-24
"23th of January, 2007",2007-01-23
2019-01-02T17:24:59.653485365Z,2019-01-02
2020-02-09T18:03:27.039822545Z,2020-02-09
1341939600000,2012-07-11
24-4-2000,2000-04-24
38-7-2005,2005-07-19
2033_12_18,2033-12-18
Sự kiện diễn ra vào 9/2/2011 22:23,2011-02-09
04|01|2028,2028-04-01
2025-07-22T04:58:29+2500,2025-07-22
20300320041542295283,2030-03-20
1995-10-05T15:49:09.843214Z,1995-10-05
31|10|2029,2029-10-31
"January 30, 2021",2021-01-30
19 January 2014,2014-01-19
The system recorded 19910902235210,1991-09-02
11 December 2023,2023-12-11
5_1_2023,2023-01-05
20110901010344121586,2011-09-01
20141031211909842,2014-10-31
14-12-1996,1996-12-07
2002.10.10,2002-10-10
1671728400,2022-12-23
20311022131842895848,2031-10-22
2006-07-30T01:31:11Z+3,2006-07-30
20170927184658015152,2017-09-27
2014/5/16T121741,2014-05-16
2008-08-18T09:02:17.767901Z,2008-08-18
The system recorded 20281001032750,2028-10-01
"14th of March, 2024",2024-03-14
ngày 2 tháng 9 năm 2024,2024-09-02
12 25 1994,1994-12-25
18.4.2017,2017-04-18
10-10-1991,1991-10-10
2 tháng 12 năm 2015,2015-12-02
1994-03-14T22:06:11+00:00,1994-03-14
19950320163221876964,1995-03-20
1724691600000000000,2024-08-27
1995_12_26T11_26_29+08,1995-12-26
"December 4, 1994",1994-12-04
Ngày 27-11-2028,2028-11-27
2000-07-14T20:11:08+2500,2000-07-14
867603600,1997-06-30
ngày 19 tháng 10 năm 2023,2023-10-19
1995/6/13T224925,1995-06-13
2000.05.09,2000-05-09
1995_11_23T17_52_44-05:00,1995-11-23
ngày 24 tháng 3 năm 2015,2015-03-24
20130722145107594134063,2013-07-22
10.15.2028,2028-10-15
21-3-1999,1999-03-21
"18th of September, 2010",2010-09-18
ngày 4 tháng 4 năm 2032,2032-04-04
20240917210505961645,2024-09-17
20040419220120255159,2004-04-19
07_16_2026,2026-07-16
Event at 2010-08-22T22:0:0,2010-08-22
The system recorded 19930628103207,1993-06-28
2.9.2005,2005-09-02
Ngày 23-10-1997,1997-10-23
1991-08-06T12:22:36+0500,1991-08-06
03 04 2005,2005-03-04
20 Jan 2003,2003-01-20
"5th of February, 1998",1998-02-05
Ngày 27-1-2017,2017-01-27
Sự kiện diễn ra vào 18/5/1995 13:29,1995-05-18
2000-01-09T07:16:23+2500,2000-01-09
2025-08-16T07:56:28.814421443Z,2025-08-16
20081030162617948472,2008-10-30
14-8-2032,2032-08-07
2006/6/19T65224,2006-06-19
1991-09-18T06:05:58.918Z,1991-09-18
27/11/2000,2000-11-27
26 5 2007,2007-05-26
ngày 18 tháng 9 năm 2017,2017-09-18
2024-07-17T10:19:15.307285Z,2024-07-17
21/11/1999 giờ 0:26:43,1999-11-21
935427600,1999-08-24
2-5-2032,2032-05-01
840214800000,1996-08-17
06/08/27,2027-08-06
2010-09-03T15:47:52+2500,2010-09-03
"10th of December, 1997",1997-12-10
6-8-2002,2002-08-06
1848157200,2028-07-26
1823878800000,2027-10-19
20340825232312392532882,2034-08-25
1684515600000000,2023-05-20
1390410000000000,2014-01-23
"17th of July, 2018",2018-07-17
1997-11-18,1997-11-18
1409936400000,2014-09-06
The system recorded 20251022214528,2025-10-22
2017-10-16T16:10:10.117824Z,2017-10-16
1261414800000000,2009-12-22
20290507113429042,2029-05-07
1999616400000000,2033-05-14
2028-07-16T02:17:43.089944Z,2028-07-16
7.9.2010T18-48-17,2010-09-07
2024-05-28T19:19:03,2024-05-28
2000-01-11T21:37:25.207935Z,2000-01-11
1249405200000000000,2009-08-05
1993-07-13T10:56:54Z+3,1993-07-13
1996-09-12T20:17:38+3,1996-09-12
2033-09-05T16:54:58+2500,2033-09-05
23-9-2020,2020-09-23
22/18-2020,2020-09-22
1078592400000000,2004-03-07
2025|11|08,2025-11-08
9/10/2026 giờ 9:50:59,2026-10-09
1282496400,2010-08-23
20_10_2033,2033-10-20
1241024400000000,2009-04-30
ngày 31 tháng 7 năm 2003,2003-07-31
The system recorded 20240405181553,2024-04-05
2027-04-05T09:44:00.500482Z,2027-04-05
10 03 27,2027-03-10
Sự kiện diễn ra vào 11/6/2022 23:47,2022-06-11
Ngày 5-2-2000,2000-02-05
3 June 2014,2014-06-03
2027/4/27T231413,2027-04-27
31 December 2016,2016-12-31
1996-07-16T17:56:23+2500,1996-07-16
29-9-2026,2026-09-29
16.5.2001T19-56-15,2001-05-16
42-10-2029,2029-10-21
2034-05-19T13:56:11+2500,2034-05-19
25.12.2002T17-29-34,2002-12-25
17/3/2013 giờ 19:43:3,2013-03-17
10 tháng 6 năm 2015,2015-06-10
"2nd of December, 1997",1997-12-02
20060203185310963,2006-02-03
2002-06-18T04:24:18,2002-06-18
1997-11-30T22:22:00+2500,1997-11-30
2004-03-08T04:38:36-0300,2004-03-08
1761757200,2025-10-30
1991-11-23T12:10:05,1991-11-23
"December 31, 2006",2006-12-31
2027.06.03,2027-06-03
2 Jun 2008,2008-06-02
2019-08-25T07:29:26,2019-08-25
20 9 2020,2020-09-20
1728579600000,2024-10-11
1606410000000000000,2020-11-27
12 tháng 2 năm 2016,2016-02-12
20170620211505186322,2017-06-20
2019-05-14T06:43:59,2019-05-14
Ngày 4-9-2029,2029-09-04
23.04.98,1998-04-23
13.09.16,2016-09-13
2034-05-06T01:59:00+08,2034-05-06
2008-01-22T15:00:12,2008-01-22
20010620203040,2001-06-20
4-8-2018,2018-08-02
1993_06_02T17_21_34+3,1993-06-02
20290813041637883,2029-08-13
2014-09-08T16:13:13+2500,2014-09-08
18/6-2027,2027-03-18
19930709080416733095,1993-07-09
2009-06-02T01:37:12Z+3,2009-06-02
30 tháng 12 năm 2001,2001-12-30
2022-07-25T04:37:55,2022-07-25
"16th of November, 2027",2027-11-16
Event at 2020-08-14T5:24:19,2020-08-14
48-4-2009,2009-04-24
2032_09_09,2032-09-09
24.6.2024T2-21-49,2024-06-24
24_1_1992,1992-01-24
1970499600000000000,2032-06-11
2018-04-21T01:36:35.018060060Z,2018-04-21
5 tháng 12 năm 2029,2029-12-05
2000/6/18T135957,2000-06-18
20090428043834,2009-04-28
19-09-16,2016-09-19
ngày 26 tháng 10 năm 2002,2002-10-26
14 07 93,1993-07-14
20221123003039898489652,2022-11-23
Event at 2020-09-19T19:19:45,2020-09-19
2027-02-15T20:45:14.113450483Z,2027-02-15
20-4-2016,2016-04-10
2023-10-22T00:54:10.994019574Z,2023-10-22
Event at 2027-02-28T23:37:35,2027-02-28
"3rd of October, 2006",2006-10-03
20031031063645110,2003-10-31
2030-05-17T04:09:24.079491179Z,2030-05-17
2029-03-23T14:09:51Z+3,2029-03-23
20341016031249598,2034-10-16
ngày 5 tháng 10 năm 1998,1998-10-05
2029/11/23T6928,2029-11-23
2014-08-02T21:27:47.922088Z,2014-08-02
2032-11-24T11:53:56,2032-11-24
1550595600000000,2019-02-20
2001-03-19T03:22:44,2001-03-19
ngày 12 tháng 11 năm 1996,1996-11-12
7 tháng 5 năm 1992,1992-05-07
48-8-2014,2014-08-24
19980529235033990288303,1998-05-29
1989939600000000,2033-01-22
Event at 2006-12-07T22:25:25,2006-12-07
2026-05-25T23:50:59.061Z,2026-05-25
716662800,1992-09-17
20150717080409374,2015-07-17
10-20-1994,1994-10-20
19940719082825858666242,1994-07-19
2012-04-19T08:30:59.780Z,2012-04-19
1990-08-08T06:47:25+2500,1990-08-08
2027_01_23T0_0_6+00:00,2027-01-23
25-3-1998,1998-03-25
1995/1/30T234613,1995-01-30
2002-09-08T19:52:23+0500,2002-09-08
The system recorded 20020919110304,2002-09-19
"December 5, 2035",2035-12-05
The system recorded 20011027111937,2001-10-27
2012-11-14T23:09:46,2012-11-14
1496422800000000,2017-06-03
19950325031441528408,1995-03-25
ngày 23 tháng 7 năm 2007,2007-07-23
2009-09-04T12:11:25+2500,2009-09-04
2010-04-06T01:21:37.477972Z,2010-04-06
Event at 1993-01-13T10:53:18,1993-01-13
1992_04_29T22_22_29+2500,1992-04-29
28.7.2014T5-30-30,2014-07-28
1/12-2013,2013-06-01
2030-09-06T02:13:39.790796828Z,2030-09-06
"29th of July, 2032",2032-07-29
19920513113634,1992-05-13
2017-01-19T22:37:16.677311Z,2017-01-19
30.1.2006T21-19-45,2006-01-30
2024-02-26T13:55:13.463Z,2024-02-26
17 tháng 8 năm 2010,2010-08-17
1557594000000,2019-05-12
10/31/2007,2007-10-31
20330318111218961,2033-03-18
ngày 26 tháng 6 năm 1997,1997-06-26
1990-01-28T11:17:16+07:00,1990-01-28
16/2/2001 giờ 21:22:43,2001-02-16
1045328400000,2003-02-16
2053443600,2035-01-27
2027-02-16T08:21:38+0500,2027-02-16
19910319222242,1991-03-19
23/8-2022,2022-04-23
2021-01-24T11:17:28.978676624Z,2021-01-24
2020-09-09T05:24:15+2500,2020-09-09
21-8-2018,2018-08-21
03|10|2027,2027-03-10
3 June 2019,2019-06-03
"April 15, 2024",2024-04-15
1750611600000000,2025-06-23
10/22-2026,2026-11-10
10-7-2015,2015-07-10
25/18-2011,2011-09-25
2008.01.26,2008-01-26
20250218134812633202,2025-02-18
Ngày 28-8-2002,2002-08-28
8 September 2018,2018-09-08
15 Jul 2008,2008-07-15
Ngày 4-10-2027,2027-10-04
20311222021818364745,2031-12-22
2035/4/15T93323,2035-04-15
2022-06-17T17:56:03+2500,2022-06-17
20340409200839997419481,2034-04-09
2023/2/6T124149,2023-02-06
1992/5/19T174253,1992-05-19
"October 18, 2013",2013-10-18
2033-02-25T05:21:18.155030261Z,2033-02-25
2023-04-26T19:51:55+2500,2023-04-26
1992/3/11T34831,1992-03-11
2012_09_12T20_4_42-0330,2012-09-12
2028_10_07,2028-10-07
"10th of September, 2020",2020-09-10
Sự kiện diễn ra vào 29/10/2017 2:14,2017-10-29
20020324231700,2002-03-24
1/16-1991,1991-08-01
20251018015740918758,2025-10-18
Sự kiện diễn ra vào 5/6/2024 3:29,2024-06-05
20350319223618785640,2035-03-19
6 October 2024,2024-10-06
1721667600,2024-07-23
ngày 16 tháng 9 năm 1999,1999-09-16
22-12-1990,1990-12-11
1992-06-09T12:13:17+2500,1992-06-09
Ngày 23-3-2010,2010-03-23
9 Jun 2021,2021-06-09
ngày 12 tháng 10 năm 2032,2032-10-12
15/2/2031 giờ 4:24:27,2031-02-15
27|3|1993,1993-03-27
7 6 1994,1994-06-07
2001_10_27T16_4_2-0330,2001-10-27
Event at 1997-05-14T17:59:5,1997-05-14
1990-10-06T18:09:11.956Z,1990-10-06
19 tháng 8 năm 2013,2013-08-19
2022|12|05,2022-12-05
2000-09-18T23:18:30Z,2000-09-18
1006794000000000000,2001-11-27
20120428191758195500,2012-04-28
6/22-2022,2022-11-06
1999-02-04T01:37:31+0500,1999-02-04
1200934800000000000,2008-01-22
964890000000000,2000-07-30
23 July 2022,2022-07-23
1996-02-16T16:16:27.827931344Z,1996-02-16
The system recorded 19940717120333,1994-07-17
Sự kiện diễn ra vào 10/3/2032 13:15,2032-03-10
Sự kiện diễn ra vào 29/5/1994 0:30,1994-05-29
Event at 2031-04-25T16:45:6,2031-04-25
Event at 1991-05-06T12:10:32,1991-05-06
29 tháng 7 năm 2033,2033-07-29
1146589200000000000,2006-05-03
Event at 2006-10-22T9:8:44,2006-10-22
60-11-2002,2002-11-30
20010813094845249796052,2001-08-13
1999-09-10T10:59:31+2500,1999-09-10
11/11/2028 giờ 19:41:34,2028-11-11
23.9.1996T8-39-38,1996-09-23
Sự kiện diễn ra vào 30/5/2030 0:44,2030-05-30
2001-03-08T03:28:29.244651215Z,2001-03-08
2025-07-17T19:45:35.918529329Z,2025-07-17
2023-07-27T18:39:35Z+3,2023-07-27
1992-11-16T05:35:09,1992-11-16
09.02.20,2020-02-09
20010417100836,2001-04-17
2007/9/1T94127,2007-09-01
20060916120913911,2006-09-16
1149094800,2006-06-01
20120304103315368960514,2012-03-04
653072400000000,1990-09-12
2028-06-26T15:19:29Z+3,2028-06-26
2023-09-25T18:42:43Z+3,2023-09-25
678646800,1991-07-05
5 Aug 2012,2012-08-05
ngày 19 tháng 1 năm 2031,2031-01-19
2007_08_03T20_21_13-0330,2007-08-03
1 Nov 2007,2007-11-01
24-07-35,2035-07-24
9 June 2018,2018-06-09
5-9-2014,2014-09-05
1050512400000,2003-04-17
Ngày 9-1-2025,2025-01-09
2003-08-07T03:50:44,2003-08-07
16 tháng 12 năm 2008,2008-12-16
2006_06_14T20_13_4+08,2006-06-14
20020814023009986773304,2002-08-14
20280114020101201559369,2028-01-14
30 tháng 7 năm 2005,2005-07-30
1995-07-06T19:56:41.366Z,1995-07-06
19900206090437,1990-02-06
10.5.1994T19-37-28,1994-05-10
1099587600,2004-11-05
20320706060819331108334,2032-07-06
19930212135044,1993-02-12
1999-01-18T01:07:11+07:00,1999-01-18
2025-08-26T23:55:01,2025-08-26
Sự kiện diễn ra vào 24/2/2022 5:10,2022-02-24
20180122014644,2018-01-22
22/10/2014 giờ 7:3:17,2014-10-22
Ngày 8-9-2028,2028-09-08
2000/4/18T14445,2000-04-18
20010510102436,2001-05-10
1584205200000,2020-03-15
6 tháng 9 năm 2022,2022-09-06
ngày 3 tháng 1 năm 1996,1996-01-03
14.10.2031T15-35-32,2031-10-14
2003-01-13T22:51:00Z+3,2003-01-13
The system recorded 20350722071545,2035-07-22
02|07|1995,1995-02-07
28 Mar 2017,2017-03-28
16|11|1992,1992-11-16
Sự kiện diễn ra vào 26/10/1996 5:57,1996-10-26
20_11_92,1992-11-20
2005-11-09T05:22:22.943Z,2005-11-09
734374800,1993-04-10
2015-05-30T20:53:50.474730290Z,2015-05-30
6_1_2031,2031-01-06
ngày 2 tháng 3 năm 2030,2030-03-02
19930625110510,1993-06-25
2035-12-29,2035-12-29
30.06.14,2014-06-30
953485200000000000,2000-03-20
30 June 1994,1994-06-30
"25th of October, 2016",2016-10-25
22/22-2031,2031-11-22
20110815085609181008,2011-08-15
28_10_2019,2019-10-28
ngày 9 tháng 6 năm 1993,1993-06-09
21/1/2009 giờ 22:2:13,2009-01-21
2011-04-15T10:36:08.338Z,2011-04-15
15-3-1993,1993-03-15
1179334800000000000,2007-05-17
ngày 11 tháng 11 năm 1994,1994-11-11
"10th of March, 2028",2028-03-10
20-11-2000,2000-11-20
17 Jul 2020,2020-07-17
The system recorded 20081231103822,2008-12-31
Event at 2021-03-01T21:19:45,2021-03-01
2031-10-31T09:10:07Z+3,2031-10-31
2003-06-02T22:09:55Z+3,2003-06-02
2016-08-03T19:26:07,2016-08-03
2-12-2015,2015-12-02
1997/10/13T94947,1997-10-13
Event at 2002-10-15T12:6:6,2002-10-15
9 February 2007,2007-02-09
20130420045013703,2013-04-20
2021-03-08T01:12:16.070648Z,2021-03-08
2065712400,2035-06-18
Ngày 16-11-1994,1994-11-16
19/4-2013,2013-02-19
27 Apr 2033,2033-04-27
2001-01-20T03:15:57Z+3,2001-01-20
14/4-2031,2031-02-14
20190319163047565,2019-03-19
"November 1, 1990",1990-11-01
The system recorded 20080517021316,2008-05-17
Sự kiện diễn ra vào 9/5/1999 9:55,1999-05-09
2014-04-17T17:47:53Z+3,2014-04-17
20290602083917948112775,2029-06-02
2035-11-20T03:37:14+08,2035-11-20
Sự kiện diễn ra vào 18/8/2018 3:25,2018-08-18
1859130000000000000,2028-11-30
2033-12-25T16:23:24.331Z,2033-12-25
20090319105435306,2009-03-19
30 Oct 2027,2027-10-30
15/9/2026 giờ 2:17:44,2026-09-15
ngày 9 tháng 1 năm 2008,2008-01-09
31 January 2015,2015-01-31
2035-10-18T23:21:44.092Z,2035-10-18
2010-08-07T05:36:43.291886Z,2010-08-07
Event at 1994-10-25T11:47:22,1994-10-25
Event at 2008-08-01T16:3:42,2008-08-01
19930606081538719470,1993-06-06
1999-09-12T04:37:11-0330,1999-09-12
11 tháng 1 năm 2022,2022-01-11
20320406041246517615274,2032-04-06
04.02.08,2008-02-04
"June 29, 2000",2000-06-29
16-3-2021,2021-03-08
ngày 10 tháng 1 năm 2022,2022-01-10
Event at 2015-09-03T0:30:24,2015-09-03
The system recorded 20051212033358,2005-12-12
1691341200000,2023-08-07
1997-01-20T22:42:35.041387Z,1997-01-20
2015-04-24T01:41:56,2015-04-24
2020-05-13T00:11:06Z+3,2020-05-13
2014-11-15T05:43:59-05:00,2014-11-15
1991-04-08T09:33:31.955811Z,1991-04-08
1992.10.07,1992-10-07
Sự kiện diễn ra vào 27/10/2002 21:46,2002-10-27
03|19|1996,1996-03-19
Sự kiện diễn ra vào 21/12/2023 8:43,2023-12-21
2006-11-13T22:01:12Z+3,2006-11-13
2008-12-19T12:37:15.706Z,2008-12-19
20340522111833821177535,2034-05-22
20260131191535138799032,2026-01-31
20000927180104500372763,2000-09-27
2017-11-09T13:43:53Z+3,2017-11-09
2008-12-21T23:07:44.469Z,2008-12-21
2004-12-12T02:37:40Z+3,2004-12-12
4/14-2020,2020-07-04
1860339600000,2028-12-14
Event at 2016-07-05T2:39:34,2016-07-05
1787245200000000000,2026-08-21
2010-09-02T13:10:49+2500,2010-09-02
05/03/01,2001-03-05
20120603165153688861,2012-06-03
1175878800,2007-04-07
20150731163403575066,2015-07-31
995734800000000000,2001-07-22
1991-10-15T00:55:04Z+3,1991-10-15
1/7/2028 giờ 12:45:24,2028-07-01
Sự kiện diễn ra vào 30/6/2030 1:19,2030-06-30
18 Nov 2008,2008-11-18
20330519033742950002753,2033-05-19
16-11-2003,2003-11-16
20141213003324697,2014-12-13
19.11.2004T21-19-33,2004-11-19
The system recorded 19981112200416,1998-11-12
1998-08-12T17:06:06Z+3,1998-08-12
60-4-1999,1999-04-30
2020-12-13T11:27:48-0330,2020-12-13
20240624130643074058098,2024-06-24
2027-11-29T01:11:47.696568Z,2027-11-29
2032-07-09T01:10:42,2032-07-09
3|3|1991,1991-03-03
16_09_07,2007-09-16
2025-05-11T09:37:17.563685466Z,2025-05-11
"May 14, 1995",1995-05-14
12|09|24,2024-09-12
06|12|21,2021-12-06
1485018000,2017-01-22
Ngày 19-1-2035,2035-01-19
2033-04-05T03:27:35+07:00,2033-04-05
1993-07-31T05:04:14+2500,1993-07-31
5_3_2024,2024-03-05
07/13/2029,2029-07-13
2015-08-24T09:19:25Z+3,2015-08-24
20120302000351,2012-03-02
"February 11, 1997",1997-02-11
638643600000000,1990-03-29
"9th of October, 2015",2015-10-09
2024-02-25T07:51:54Z+3,2024-02-25
2010-12-29T16:01:30.643177Z,2010-12-29
16.7.2023T19-43-56,2023-07-16
12-2-2018,2018-02-12
2017-06-29T11:29:52.656Z,2017-06-29
1997/2/19T211115,1997-02-19
1997-01-22T18:36:06,1997-01-22
11.17.2007,2007-11-17
1197392400000000,2007-12-12
20280116164333986333,2028-01-16
20171129170926007132,2017-11-29
2014/10/28T73627,2014-10-28
20|02|15,2015-02-20
1847811600000,2028-07-22
"January 3, 1990",1990-01-03
1540141200000,2018-10-22
9 tháng 12 năm 2008,2008-12-09
"19th of December, 2028",2028-12-19
15|4|2018,2018-04-15
ngày 19 tháng 5 năm 1990,1990-05-19
652554000000000,1990-09-06
ngày 27 tháng 4 năm 2028,2028-04-27
20220520231519352770050,2022-05-20
1992/10/13T212640,1992-10-13
2015/2/5T34337,2015-02-05
30-4-2033,2033-04-30
Ngày 6-12-2033,2033-12-06
1161363600,2006-10-21
20340329020358,2034-03-29
Sự kiện diễn ra vào 10/12/2026 3:39,2026-12-10
23-5-2013,2013-05-23
20160512143224050462850,2016-05-12
2030-12-27T14:31:58,2030-12-27
23 September 1997,1997-09-23
1996-02-04T05:59:12+2500,1996-02-04
20190110121417474887,2019-01-10
15.6.2032T2-41-54,2032-06-15
"August 17, 2020",2020-08-17
2011_09_11T12_59_15+2500,2011-09-11
9-4-2017,2017-04-09
2031-06-04T22:05:25.602Z,2031-06-04
Ngày 7-3-2028,2028-03-07
2020-03-17T22:29:39Z+3,2020-03-17
2018-01-19T14:10:03.029082812Z,2018-01-19
1936458000000000,2031-05-14
13-12-2015,2015-12-13
09|19|2017,2017-09-19
6_5_2001,2001-05-06
1997-08-21T23:11:15.630Z,1997-08-21
22-6-2018,2018-06-11
2000-08-08T11:23:46,2000-08-08
"28th of April, 2031",2031-04-28
12-19-1995,1995-12-19
2025-07-14T18:32:45.449Z,2025-07-14
4 tháng 5 năm 2029,2029-05-04
15 tháng 1 năm 2010,2010-01-15
1992-12-08T00:18:23.667904Z,1992-12-08
"23th of February, 2006",2006-02-23
"10th of September, 2008",2008-09-10
2014-03-07T09:08:58-0300,2014-03-07
2026-10-25T01:39:15.219987030Z,2026-10-25
Event at 2016-05-29T6:2:19,2016-05-29
19980514033418719,1998-05-14
03|02|12,2012-02-03
23.11.2019T11-55-4,2019-11-23
1991_12_11T23_23_6+07:00,1991-12-11
2017-07-02T02:55:40Z,2017-07-02
The system recorded 19910626013117,1991-06-26
2014-01-14T14:48:43.296Z,2014-01-14
1137603600,2006-01-19
ngày 8 tháng 9 năm 1990,1990-09-08
2027_08_26T11_21_10+07:00,2027-08-26
1834074000000000000,2028-02-14
16 Oct 1998,1998-10-16
1997-06-09T00:17:35+08,1997-06-09
12-8-2030,2030-08-06
Event at 1990-09-10T15:37:12,1990-09-10
32-12-2012,2012-12-16
20120609151247,2012-06-09
2006-09-15T04:30:30+2500,2006-09-15
736707600000000,1993-05-07
1993-07-30T02:37:48.904248Z,1993-07-30
27.12.14,2014-12-27
Sự kiện diễn ra vào 17/2/2010 17:39,2010-02-17
2024-12-04T11:54:00Z+3,2024-12-04
Ngày 16-12-1999,1999-12-16
23 tháng 10 năm 2004,2004-10-23
2030-05-14T01:02:58.608164Z,2030-05-14
The system recorded 20201018201805,2020-10-18
21/2/2009 giờ 18:26:28,2009-02-21
20 May 2004,2004-05-20
2004-05-19T09:24:22.514334302Z,2004-05-19
Sự kiện diễn ra vào 8/3/2031 4:57,2031-03-08
963334800000000,2000-07-12
2014-09-20T18:51:51.439926846Z,2014-09-20
1998-03-28T03:54:54,1998-03-28
28/22-1990,1990-11-28
24-10-2032,2032-10-12
2017_02_12T10_1_5+2500,2017-02-12
42-9-2008,2008-09-21
20210131143652,2021-01-31
1853427600000000000,2028-09-25
2028_01_20T8_5_26+2500,2028-01-20
1997-08-18T19:10:12Z+3,1997-08-18
"24th of February, 1995",1995-02-24
14-7-2035,2035-07-07
1330362000,2012-02-28
ngày 30 tháng 5 năm 2034,2034-05-30
1999-11-11T09:41:42.393269805Z,1999-11-11
2005_11_09T22_53_35Z+3,2005-11-09
Event at 2026-02-07T7:23:17,2026-02-07
1995-02-28T11:58:27.361498Z,1995-02-28
2027-05-15T07:29:34.277366Z,2027-05-15
13-10-1996,1996-10-13
1990-04-15T01:27:28,1990-04-15
20040613070844976221,2004-06-13
1806685200000000,2027-04-03
1998-11-18T00:50:28.803643003Z,1998-11-18
2022-06-25,2022-06-25
7 Dec 2014,2014-12-07
1476032400000000000,2016-10-10
5 May 2001,2001-05-05
2005-09-18T00:42:52+07:00,2005-09-18
687286800000000000,1991-10-13
17 September 1993,1993-09-17
2008-01-05T08:37:27.643099Z,2008-01-05
2001-07-30T22:52:25+2500,2001-07-30
The system recorded 20011124084759,2001-11-24
Sự kiện diễn ra vào 2/10/1993 2:35,1993-10-02
20060513182819687,2006-05-13
06 16 2007,2007-06-16
2006/7/13T221047,2006-07-13
19950124082022033,1995-01-24
1998-10-03T09:37:36Z+3,1998-10-03
2016-08-14T19:42:41,2016-08-14
1693501200000000,2023-09-01
2026-08-08T13:47:20.046Z,2026-08-08
4/2/2013 giờ 19:12:33,2013-02-04
2033-11-23T04:00:27Z+3,2033-11-23
2023-06-11T17:09:19.676659Z,2023-06-11
Event at 1999-11-19T21:37:18,1999-11-19
26 May 2013,2013-05-26
1472749200000000000,2016-09-02
6-7-2023,2023-07-03
04.01.2026,2026-04-01
2030-04-10T18:02:49.132622Z,2030-04-10
2013-04-28T03:22:12+2500,2013-04-28
"April 10, 2012",2012-04-10
19900826000640,1990-08-26
21 June 1998,1998-06-21
1114362000000,2005-04-25
1998|03|02,1998-03-02
719686800,1992-10-22
20120911132042844789,2012-09-11
Sự kiện diễn ra vào 16/7/2015 11:32,2015-07-16
01_10_2001,2001-01-10
08.15.2022,2022-08-15
Sự kiện diễn ra vào 11/8/1991 9:45,1991-08-11
2016-06-16T12:42:22+2500,2016-06-16
15.05.23,2023-05-15
The system recorded 19950430152257,1995-04-30
31 October 2031,2031-10-31
2014.05.03,2014-05-03
2005-10-30T23:11:45Z+3,2005-10-30
1922461200000000000,2030-12-03
20160115030748,2016-01-15
22 September 2011,2011-09-22
03-07-33,2033-07-03
2013-12-31T07:56:54,2013-12-31
Sự kiện diễn ra vào 29/5/1996 18:36,1996-05-29
"May 26, 2006",2006-05-26
09|13|2015,2015-09-13
2008-09-11T14:54:55+2500,2008-09-11
1813856400000000000,2027-06-25
2001-05-21T06:48:04,2001-05-21
1092934800000000000,2004-08-20
"June 9, 2012",2012-06-09
30 Jul 2022,2022-07-30
17 Mar 1996,1996-03-17
1992-08-10T07:03:56+2500,1992-08-10
1990-12-28T07:22:27-05:00,1990-12-28
20230228010752,2023-02-28
11 Mar 2017,2017-03-11
Ngày 7-1-2015,2015-01-07
3/20-2002,2002-10-03
01|04|1995,1995-01-04
03.09.2007,2007-03-09
7/2/1990 giờ 10:29:31,1990-02-07
1107622800000000,2005-02-06
2024-07-18T23:58:04.797505Z,2024-07-18
Sự kiện diễn ra vào 25/3/1993 11:3,1993-03-25
The system recorded 20100101080318,2010-01-01
"February 19, 2021",2021-02-19
Ngày 5-12-2025,2025-12-05
987526800000,2001-04-18
"September 16, 2001",2001-09-16
28 tháng 6 năm 2014,2014-06-28
646592400000000,1990-06-29
The system recorded 20050718192608,2005-07-18
2035-09-27T19:13:41+2500,2035-09-27
1997|04|01,1997-04-01
2007_06_12,2007-06-12
833130000000,1996-05-27
1996-03-31T11:31:21,1996-03-31
13.06.25,2025-06-13
Event at 2001-06-30T23:31:14,2001-06-30
"July 6, 2003",2003-07-06
20210306022423,2021-03-06
19940101010631057,1994-01-01
20171027125434821,2017-10-27
14-10-1992,1992-10-14
27/22-2031,2031-11-27
10/8/2018 giờ 16:20:51,2018-08-10
2031-07-05T00:12:21+2500,2031-07-05
20190321135143647,2019-03-21
2019-09-02T00:08:08+00:00,2019-09-02
1921856400000,2030-11-26
2005-08-20,2005-08-20
2033-02-03T13:47:28+2500,2033-02-03
20250622204052856911579,2025-06-22
"May 2, 2023",2023-05-02
8-4-2006,2006-04-04
25-5-1999,1999-05-25
1997-04-16T18:40:28Z+3,1997-04-16
2033-09-14,2033-09-14
2035-08-17T11:27:26.615006630Z,2035-08-17
20321212043713420,2032-12-12
ngày 1 tháng 8 năm 2018,2018-08-01
Sự kiện diễn ra vào 12/12/2004 10:29,2004-12-12
1992-10-14T06:31:26.234Z,1992-10-14
25/5/1991 giờ 22:25:40,1991-05-25
13 Jul 1996,1996-07-13
Event at 2004-03-27T17:42:50,2004-03-27
15 tháng 12 năm 2011,2011-12-15
1922979600,2030-12-09
24/10-2010,2010-05-24
08 09 2008,2008-08-09
2027.09.08,2027-09-08
12.06.2030,2030-12-06
1910710800,2030-07-20
699123600000000000,1992-02-27
2032-12-08T09:52:05,2032-12-08
58-10-2029,2029-10-29
Sự kiện diễn ra vào 26/7/2019 5:55,2019-07-26
1 tháng 9 năm 2020,2020-09-01
2026-03-20T15:17:48+2500,2026-03-20
20211109151640837303,2021-11-09
1165251600000000,2006-12-05
14-4-1990,1990-04-14
14 May 2003,2003-05-14
1468515600000000,2016-07-15
1995_03_15T12_13_23-0330,1995-03-15
2015_02_18T13_20_29-05:00,2015-02-18
2005 09 15,2005-09-15
"February 4, 1994",1994-02-04
ngày 14 tháng 3 năm 2010,2010-03-14
17/3/2016 giờ 1:52:4,2016-03-17
3 Jan 2033,2033-01-03
2014-11-25T01:24:01+07:00,2014-11-25
655059600000000000,1990-10-05
"26th of August, 2012",2012-08-26
23.8.1996T5-28-33,1996-08-23
2012-01-04T05:37:46.969852Z,2012-01-04
Sự kiện diễn ra vào 9/5/2032 14:39,2032-05-09
2002_05_16,2002-05-16
5-6-2032,2032-06-05
20290601065130415073,2029-06-01
23-6-1990,1990-06-23
9-3-2007,2007-03-09
Event at 2025-05-17T3:5:9,2025-05-17
Sự kiện diễn ra vào 19/8/2006 21:35,2006-08-19
"18th of August, 1999",1999-08-18
2006-03-30T16:35:28.538248682Z,2006-03-30
8 1 1997,1997-01-08
1212253200000000000,2008-06-01
Sự kiện diễn ra vào 5/2/2025 12:33,2025-02-05
Ngày 19-11-2017,2017-11-19
Ngày 19-4-2004,2004-04-19
2035-10-14T01:39:43-0330,2035-10-14
3.12.1993,1993-12-03
"December 15, 2034",2034-12-15
7.4.2025T22-35-54,2025-04-07
The system recorded 20011223085207,2001-12-23
31/8/2029 giờ 12:48:8,2029-08-31
1998-07-11T02:12:33.813314Z,1998-07-11
2010_08_04T1_56_18+07:00,2010-08-04
The system recorded 20241023192345,2024-10-23
20311019032749580,2031-10-19
1992099600000,2033-02-16
19-8-2030,2030-08-19
1 tháng 8 năm 2025,2025-08-01
12-8-1990,1990-08-06
14.6.2029T13-32-1,2029-06-14
2020/08/27,2020-08-27
20070215175641802718434,2007-02-15
1502902800000000,2017-08-17
2019-09-05T11:24:02.608856502Z,2019-09-05
6 Aug 2022,2022-08-06
The system recorded 20011225233542,2001-12-25
2005|05|28,2005-05-28
23 September 2025,2025-09-23
06_19_2035,2035-06-19
2018_10_02T18_55_54+08,2018-10-02
2002-05-26T20:42:38.336Z,2002-05-26
19-3-2031,2031-03-19
1440090000000000000,2015-08-21
1997-01-29T18:02:32.960525Z,1997-01-29
2018-05-13T01:21:58.154519638Z,2018-05-13
The system recorded 20050727051417,2005-07-27
2001/2/18T163959,2001-02-18
1998_06_11T1_17_27+2500,1998-06-11
20100614010149,2010-06-14
10.28.2000,2000-10-28
10.29.1998,1998-10-29
18/3/1996,1996-03-18
15.5.2004T11-46-28,2004-05-15
2026_05_28T17_1_55+00:00,2026-05-28
2027/1/12T172923,2027-01-12
ngày 13 tháng 8 năm 2002,2002-08-13
Event at 2003-01-01T10:32:29,2003-01-01
2020-02-04T07:15:06.162Z,2020-02-04
25.1.2014T1-52-32,2014-01-25
5/9/2004 giờ 5:55:30,2004-09-05
12|28|2026,2026-12-28
10 Dec 2020,2020-12-10
29/4/2009 giờ 23:27:13,2009-04-29
ngày 11 tháng 1 năm 2029,2029-01-11
2010-02-16T01:06:04+2500,2010-02-16
2031-04-27T02:51:38.176519Z,2031-04-27
Sự kiện diễn ra vào 7/2/1993 0:49,1993-02-07
24.6.2018T21-25-19,2018-06-24
31-1-2001,2001-01-31
20211221134815708754,2021-12-21
21|12|2035,2035-12-21
20200502055640761546539,2020-05-02
27 Apr 2033,2033-04-27
2007-02-26T12:34:30.910042Z,2007-02-26
20211002205903,2021-10-02
28 tháng 2 năm 2022,2022-02-28
2011/10/10T1353,2011-10-10
19940115153031,1994-01-15
ngày 4 tháng 10 năm 2030,2030-10-04
4 tháng 5 năm 2009,2009-05-04
1994-09-30T21:51:27.822Z,1994-09-30
11 May 2010,2010-05-11
20150417191954189,2015-04-17
2026/3/15T94228,2026-03-15
2025/2/3T10136,2025-02-03
Event at 1992-05-05T0:32:43,1992-05-05
The system recorded 20030910023627,2003-09-10
The system recorded 19991114203016,1999-11-14
9-5-2035,2035-05-09
14 March 2002,2002-03-14
7 November 2020,2020-11-07
5/6/2015 giờ 16:21:17,2015-06-05
1993-01-15T02:47:46,1993-01-15
19941127190931813,1994-11-27
02_05_94,1994-05-02
29 July 1993,1993-07-29
2025_11_24T19_42_13+3,2025-11-24
1829149200000,2027-12-19
Event at 2002-03-05T19:29:31,2002-03-05
9/10/2029 giờ 15:26:5,2029-10-09
"September 18, 1996",1996-09-18
20300827004830392705771,2030-08-27
22.12.93,1993-12-22
The system recorded 20240627234903,2024-06-27
21.9.2016T22-43-31,2016-09-21
870800400000000,1997-08-06
2017-10-01T17:23:02-0330,2017-10-01
647629200000000,1990-07-11
ngày 21 tháng 8 năm 1993,1993-08-21
2010_12_05T12_56_54+00:00,2010-12-05
20040618061927153676,2004-06-18
"March 19, 2029",2029-03-19
2015-07-16T08:25:34.719Z,2015-07-16
20250701061451726,2025-07-01
2025/1/2T161939,2025-01-02
2006-06-25T21:17:17-0300,2006-06-25
Sự kiện diễn ra vào 23/5/2013 14:44,2013-05-23
20350706215346024788,2035-07-06
20020702100029336305248,2002-07-02
1944838800000000000,2031-08-19
29 December 2010,2010-12-29
2026-02-26T16:21:31,2026-02-26
722106000000,1992-11-19
03 28 2033,2033-03-28
12.12.2009,2009-12-12
"31th of August, 1991",1991-08-31
The system recorded 20131108115939,2013-11-08
2023-05-08T16:38:04.370456733Z,2023-05-08
23|10|13,2013-10-23
2023-10-29T22:05:18,2023-10-29
2003-04-01T01:04:24,2003-04-01
2009-09-10T10:36:42.032432Z,2009-09-10
20201106234539187161517,2020-11-06
20180411195609465,2018-04-11
2016-01-17T06:10:54+0500,2016-01-17
The system recorded 20150715174052,2015-07-15
2027-06-03T04:42:59-05:00,2027-06-03
2033_03_18T18_31_20+08,2033-03-18
2015-05-19T14:32:46Z+3,2015-05-19
"November 7, 2020",2020-11-07
1788800400000,2026-09-08
1272646800000,2010-05-01
2025-10-23T08:28:01+2500,2025-10-23
22/4/2002 giờ 0:41:53,2002-04-22
ngày 10 tháng 6 năm 2019,2019-06-10
2006-12-02T19:34:53,2006-12-02
2024-08-29T19:54:42.799284Z,2024-08-29
28.12.2033T23-35-48,2033-12-28
20120519170653169610059,2012-05-19
721069200000000,1992-11-07
20061020092700,2006-10-20
Event at 1992-08-12T6:15:45,1992-08-12
4 April 2009,2009-04-04
2035-03-04T06:05:33Z+3,2035-03-04
2012_10_12T23_10_38+2500,2012-10-12
877971600,1997-10-28
2005-11-08,2005-11-08
15 Nov 2034,2034-11-15
The system recorded 20010422124656,2001-04-22
Ngày 19-1-2002,2002-01-19
812739600000000,1995-10-04
26 Mar 2006,2006-03-26
20170602055031,2017-06-02
24 Oct 2015,2015-10-24
20.7.2002T6-28-8,2002-07-20
06 08 30,2030-08-06
17 Apr 1994,1994-04-17
22 July 2004,2004-07-22
2019_08_19T16_2_9+0500,2019-08-19
1731949200,2024-11-19
ngày 9 tháng 4 năm 2010,2010-04-09
2012_05_25,2012-05-25
9 tháng 5 năm 1994,1994-05-09
31 March 2029,2029-03-31
2027-01-21T02:43:27,2027-01-21
28 tháng 9 năm 2020,2020-09-28
13/18-1991,1991-09-13
1990-02-09T19:31:07.800Z,1990-02-09
"December 13, 2019",2019-12-13
The system recorded 20280109013723,2028-01-09
2028-06-17T09:40:55,2028-06-17
28 tháng 8 năm 1991,1991-08-28
2011/11/18T232433,2011-11-18
2022-06-26T11:48:12.570926Z,2022-06-26
15 July 2020,2020-07-15
Sự kiện diễn ra vào 4/9/2030 18:18,2030-09-04
2000_10_06T11_53_21Z,2000-10-06
06 27 2027,2027-06-27
1803056400000,2027-02-20
13/05/06,2006-05-13
1993-11-27T21:31:07.068089077Z,1993-11-27
2015-03-08T14:57:47,2015-03-08
2013_11_27T22_24_33Z,2013-11-27
2027-02-13T11:31:54Z+3,2027-02-13
1993-06-01T03:07:51,1993-06-01
ngày 19 tháng 9 năm 2001,2001-09-19
1893862800000000000,2030-01-06
19980227015646,1998-02-27
"3rd of August, 2032",2032-08-03
1917190800000000,2030-10-03
2023-02-09T16:10:26Z+3,2023-02-09
The system recorded 19901004120101,1990-10-04
2033-01-10T17:04:28.917967773Z,2033-01-10
The system recorded 20020614173000,2002-06-14
16/5/2011 giờ 5:48:47,2011-05-16
ngày 10 tháng 12 năm 2033,2033-12-10
2022-03-06T11:08:00.653Z,2022-03-06
19900918061224233273380,1990-09-18
19910906233346645064090,1991-09-06
2003-07-10T06:59:36.798Z,2003-07-10
2022/11/14T20394,2022-11-14
Event at 1991-03-12T18:17:35,1991-03-12
22/6/2028 giờ 23:30:41,2028-06-22
26/20-2019,2019-10-26
9.6.1990T3-6-43,1990-06-09
2000-06-12T04:36:04Z+3,2000-06-12
2018-05-19T08:45:51Z+3,2018-05-19
19970629141856159,1997-06-29
1582218000000000,2020-02-21
2015-06-10T10:26:16+2500,2015-06-10
23 tháng 4 năm 2031,2031-04-23
2029|10|08,2029-10-08
23 tháng 9 năm 2027,2027-09-23
The system recorded 20100319195407,2010-03-19
20250503195435713369,2025-05-03
19981009090556009929850,1998-10-09
Ngày 11-6-2019,2019-06-11
1745946000,2025-04-30
1999-11-22T09:26:23.825Z,1999-11-22
1430672400,2015-05-04
"October 22, 2002",2002-10-22
Sự kiện diễn ra vào 26/4/2012 11:54,2012-04-26
20341103210709,2034-11-03
26.2.1990T5-56-15,1990-02-26
05 19 2005,2005-05-19
2006_03_17,2006-03-17
2014-07-06T00:06:00+2500,2014-07-06
23 Sep 2031,2031-09-23
1534179600000000,2018-08-14
7-11-2007,2007-11-07
9/16-2022,2022-08-09
27-11-2018,2018-11-27
2013-02-27T08:28:39+2500,2013-02-27
2003-04-13T15:04:04+2500,2003-04-13
1995-02-16T16:40:30.844924346Z,1995-02-16
1999_10_26T9_58_5-05:00,1999-10-26
823280400000,1996-02-03
"September 28, 2031",2031-09-28
6 tháng 7 năm 2025,2025-07-06
2016_02_15T21_38_25-0330,2016-02-15
13/6-1996,1996-03-13
20190513232703002556665,2019-05-13
15/8/2024 giờ 20:19:10,2024-08-15
18-6-2016,2016-06-18
19930424205703857054,1993-04-24
2010848400,2033-09-21
2012-04-26T16:55:16.572926Z,2012-04-26
10/2/2025 giờ 0:37:7,2025-02-10
20291214100020503188,2029-12-14
1784307600000000,2026-07-18
1734368400,2024-12-17
16.05.21,2021-05-16
05|25|1990,1990-05-25
36-12-2011,2011-12-18
14 Jan 2012,2012-01-14
1110906000,2005-03-16
2002_02_09T9_30_54-05:00,2002-02-09
20240814005454,2024-08-14
23/10-2000,2000-05-23
803149200,1995-06-15
2020-06-12T04:11:27Z+3,2020-06-12
9 Dec 1998,1998-12-09
12-11-2011,2011-11-12
The system recorded 20031106114110,2003-11-06
20170606035606865014,2017-06-06
2005/10/25,2005-10-25
2005_03_21T1_49_58+3,2005-03-21
2029078800,2034-04-20
20021212160328,2002-12-12
22-7-1994,1994-07-22
50-12-2032,2032-12-25
Event at 2027-06-14T18:52:17,2027-06-14
31.12.2013,2013-12-31
32-3-2029,2029-03-16
15 June 2016,2016-06-15
"September 27, 2029",2029-09-27
10/6-1992,1992-03-10
28|10|31,2031-10-28
2031-07-17T00:45:50+00:00,2031-07-17
3-5-2031,2031-05-03
02|25|2018,2018-02-25
ngày 14 tháng 12 năm 2022,2022-12-14
"March 5, 1998",1998-03-05
"August 21, 2024",2024-08-21
2033-07-23T09:30:24Z+3,2033-07-23
17/10-2016,2016-05-17
"24th of October, 2028",2028-10-24
30/14-2035,2035-07-30
Sự kiện diễn ra vào 15/11/2007 6:22,2007-11-15
863370000000,1997-05-12
ngày 18 tháng 9 năm 2026,2026-09-18
1991_04_08T20_20_12Z+3,1991-04-08
2003-11-11T06:02:24Z+3,2003-11-11
4-9-1991,1991-09-04
1415120400000000000,2014-11-05
24 Sep 2032,2032-09-24
20211203083152295756287,2021-12-03
25 tháng 1 năm 2023,2023-01-25
ngày 23 tháng 6 năm 2009,2009-06-23
19970409052251859,1997-04-09
2005-10-08T13:45:29Z+3,2005-10-08
1996-09-20T16:36:53.042Z,1996-09-20
ngày 13 tháng 9 năm 2021,2021-09-13
3/12/2012 giờ 23:40:56,2012-12-03
27-3-2004,2004-03-27
5/22-2012,2012-11-05
The system recorded 20290915135809,2029-09-15
6/11/2007,2007-11-06
ngày 6 tháng 11 năm 2010,2010-11-06
16 Jan 2021,2021-01-16
1999/5/3T221257,1999-05-03
2020-10-17T22:45:22Z+3,2020-10-17
2035-12-01T13:58:58.905Z,2035-12-01
20140605220825,2014-06-05
"January 1, 2004",2004-01-01
2004-11-11T00:12:38,2004-11-11
03/23/2007,2007-03-23
Ngày 4-2-1996,1996-02-04
"April 6, 2015",2015-04-06
20090617221023797043,2009-06-17
"November 9, 2026",2026-11-09
2003-06-15T11:03:16.895323Z,2003-06-15
2010_08_23T7_10_21-0330,2010-08-23
20310913183537968002,2031-09-13
1993-12-18T13:37:45+2500,1993-12-18
"May 30, 2002",2002-05-30
2034-02-09T03:43:24+0500,2034-02-09
1358355600,2013-01-17
1360774800000,2013-02-14
"May 31, 2016",2016-05-31
2006-08-23T09:17:10,2006-08-23
5 tháng 9 năm 1991,1991-09-05
2028-06-18T09:49:14.448351Z,2028-06-18
28 February 2029,2029-02-28
16 3 2005,2005-03-16
09|24|2020,2020-09-24
20140521155953417581202,2014-05-21
2031-04-26T20:19:16.667748Z,2031-04-26
20090521053808227,2009-05-21
20040101092124757465,2004-01-01
18 tháng 10 năm 2025,2025-10-18
"13th of May, 1994",1994-05-13
20020622151150920213,2002-06-22
1996-09-23T09:27:40+3,1996-09-23
2028-06-16T19:39:43+2500,2028-06-16
Ngày 20-12-2005,2005-12-20
Sự kiện diễn ra vào 23/4/1993 16:18,1993-04-23
30/2-2029,2029-01-30
"29th of September, 2000",2000-09-29
28-2-2003,2003-02-14
5 February 2026,2026-02-05
4 Jun 2020,2020-06-04
50-11-2032,2032-11-25
4-1-2008,2008-01-02
5 Mar 2034,2034-03-05
17/2-2034,2034-01-17
2014-03-21T12:37:46.647826Z,2014-03-21
26/8-2013,2013-04-26
1227459600000000000,2008-11-24
2023-02-26T22:08:46,2023-02-26
13/22-2028,2028-11-13
ngày 9 tháng 6 năm 2021,2021-06-09
2027-10-23T20:59:09+2500,2027-10-23
1203354000000,2008-02-19
10 2 2019,2019-02-10
4-5-2020,2020-05-04
"July 26, 1993",1993-07-26
Sự kiện diễn ra vào 5/9/2009 9:27,2009-09-05
16/6-2021,2021-03-16
28 Sep 1998,1998-09-28
2002/3/5T181347,2002-03-05
21.7.1995T11-40-56,1995-07-21
1.6.2013T20-31-12,2013-06-01
Ngày 22-4-2025,2025-04-22
1991-08-09T07:47:06-05:00,1991-08-09
20100625091654,2010-06-25
02 11 07,2007-11-02
Sự kiện diễn ra vào 27/3/1999 10:45,1999-03-27
17.11.1991,1991-11-17
2004-01-07T14:24:53.517Z,2004-01-07
30.10.1995T4-6-23,1995-10-30
2026_09_08T10_40_54+00:00,2026-09-08
The system recorded 20340215152755,2034-02-15
2022-12-08T15:12:58+08,2022-12-08
32-8-2005,2005-08-16
14|06|29,2029-06-14
Ngày 18-4-2000,2000-04-18
Ngày 18-12-2005,2005-12-18
The system recorded 20100109081718,2010-01-09
1630083600000000000,2021-08-28
19970716164700464,1997-07-16
15.08.91,1991-08-15
2016-10-28T01:47:53.117832220Z,2016-10-28
2003/7/9T182418,2003-07-09
Event at 2001-10-24T23:1:40,2001-10-24
20 November 2004,2004-11-20
1972141200000,2032-06-30
Event at 2000-12-14T18:57:19,2000-12-14
ngày 26 tháng 1 năm 1995,1995-01-26
20081101052656449692785,2008-11-01
2021/4/11T32615,2021-04-11
19960628150420577571,1996-06-28
1398704400000000,2014-04-29
19950407020440867373,1995-04-07
19991101162230,1999-11-01
20270212073643589587806,2027-02-12
12_02_1998,1998-12-02
1 tháng 6 năm 1992,1992-06-01
58-3-2030,2030-03-29
16.11.1999T20-38-1,1999-11-16
40-11-1991,1991-11-20
2 Oct 2023,2023-10-02
The system recorded 20220902072849,2022-09-02
Event at 2005-12-29T0:25:1,2005-12-29
24/1/2024 giờ 5:23:32,2024-01-24
Ngày 12-12-2015,2015-12-12
636656400000000000,1990-03-06
2027-03-12T08:01:06+2500,2027-03-12
14-2-2005,2005-02-07
5.10.2000T23-51-6,2000-10-05
5 April 2033,2033-04-05
The system recorded 20051022010129,2005-10-22
2007/09/26,2007-09-26
27/14-2035,2035-07-27
2008/10/14T13211,2008-10-14
2010-05-13T03:10:37Z+3,2010-05-13
2027-12-16T20:17:36.772326Z,2027-12-16
2023-06-11T18:35:37,2023-06-11
20000825231024291211596,2000-08-25
2006-07-15T06:05:44.986Z,2006-07-15
22-2-2020,2020-02-22
Ngày 11-11-2035,2035-11-11
2005-10-16T06:42:02.912857Z,2005-10-16
20281201185031348,2028-12-01
1686070800000,2023-06-07
1999-11-02T21:57:49.123530Z,1999-11-02
1996-03-29T15:15:03+2500,1996-03-29
2019-02-21T09:31:59Z+3,2019-02-21
14/5/1990,1990-05-14
Event at 2018-09-20T22:40:44,2018-09-20
12 Nov 2029,2029-11-12
28.7.2004T7-30-7,2004-07-28
2010-01-14T15:20:32Z+3,2010-01-14
753037200000000000,1993-11-12
1119718800000000000,2005-06-26
03_12_98,1998-12-03
1730480400000,2024-11-02
19990504220050,1999-05-04
2025_10_11T18_12_54+08,2025-10-11
7-5-2032,2032-05-07
25 tháng 9 năm 2021,2021-09-25
19941124001952402,1994-11-24
1991-02-13T12:44:45+2500,1991-02-13
Ngày 22-3-2007,2007-03-22
20171208064318871,2017-12-08
13/2-2011,2011-01-13
1657818000,2022-07-15
2011-08-04T22:04:30.831781675Z,2011-08-04
1477587600,2016-10-28
11.11.2028T23-21-7,2028-11-11
20080409151159491,2008-04-09
8 Dec 2023,2023-12-08
Event at 1993-12-20T23:10:4,1993-12-20
19940511035542,1994-05-11
2003-05-06T14:47:15,2003-05-06
"November 10, 1990",1990-11-10
2013 03 22,2013-03-22
22 tháng 8 năm 2025,2025-08-22
1905267600000000000,2030-05-18
14-11-1999,1999-11-07
2015/4/6T43833,2015-04-06
6-12-2002,2002-12-03
06.05.31,2031-05-06
Ngày 15-5-2006,2006-05-15
04_07_13,2013-07-04
30|4|2000,2000-04-30
2005-12-02T02:01:14,2005-12-02
2008_11_15,2008-11-15
1276102800000000,2010-06-10
17/20-1991,1991-10-17
2004-06-20T05:02:36.702863Z,2004-06-20
2006-11-05T16:15:07+2500,2006-11-05
2015/9/25T9344,2015-09-25
ngày 21 tháng 2 năm 2033,2033-02-21
20340807222358415834225,2034-08-07
1991/4/24T3742,1991-04-24
Ngày 21-1-2033,2033-01-21
1266598800,2010-02-20
20260926201557678489600,2026-09-26
13/14-2003,2003-07-13
19971112134746,1997-11-12
785782800000,1994-11-26
"October 1, 1998",1998-10-01
Ngày 10-5-1993,1993-05-10
1994-08-11T17:53:33Z+3,1994-08-11
17 6 2017,2017-06-17
20000213071107929567,2000-02-13
Event at 1990-05-24T17:39:39,1990-05-24
"March 24, 2028",2028-03-24
894560400,1998-05-08
20220103182035,2022-01-03
2008-03-06T09:19:04,2008-03-06
32-6-2025,2025-06-16
19900117063657628123,1990-01-17
2025-12-12T16:34:14.254579668Z,2025-12-12
Event at 2024-08-02T2:59:28,2024-08-02
23 August 1992,1992-08-23
5 11 2002,2002-11-05
20120803172711287,2012-08-03
890758800000000,1998-03-25
9-10-2030,2030-10-09
2035/3/1T15342,2035-03-01
ngày 9 tháng 12 năm 2021,2021-12-09
2002-04-28T14:11:39Z+3,2002-04-28
The system recorded 20120719000933,2012-07-19
2001/2/20T21238,2001-02-20
Ngày 20-7-1996,1996-07-20
12_02_2022,2022-12-02
788461200000,1994-12-27
1992_05_18,1992-05-18
16-10-2000,2000-10-16
Event at 2008-09-08T7:49:57,2008-09-08
1-6-2004,2004-06-01
19 May 2001,2001-05-19
29 Jul 2015,2015-07-29
36-5-2016,2016-05-18
8 July 2032,2032-07-08
2033-08-08T10:34:34.994566325Z,2033-08-08
650134800000,1990-08-09
11_15_2014,2014-11-15
25.1.2034T12-39-35,2034-01-25
1996-09-08,1996-09-08
834858000000000000,1996-06-16
19980715195430944068516,1998-07-15
Event at 2018-06-21T20:33:20,2018-06-21
25 8 2004,2004-08-25
22/11/2002 giờ 6:19:34,2002-11-22
2032-12-18T09:11:58-0300,2032-12-18
2016-07-30T06:07:15.482Z,2016-07-30
08/07/20,2020-07-08
2016_06_27T2_48_13-0330,2016-06-27
1436115600,2015-07-06
12 July 1993,1993-07-12
Sự kiện diễn ra vào 8/6/2017 1:2,2017-06-08
2009 06 05,2009-06-05
ngày 28 tháng 6 năm 2000,2000-06-28
Sự kiện diễn ra vào 18/4/2020 6:43,2020-04-18
2030/5/13T18480,2030-05-13
924800400000,1999-04-23
1197738000000,2007-12-16
Event at 2027-05-06T16:53:30,2027-05-06
2023-05-28T19:05:18Z,2023-05-28
Ngày 20-5-2000,2000-05-20
29 Oct 2023,2023-10-29
20.2.2020,2020-02-20
Sự kiện diễn ra vào 4/7/2008 23:53,2008-07-04
2019315600000000000,2033-12-28
1610298000000000000,2021-01-11
2003.09.15,2003-09-15
Sự kiện diễn ra vào 9/4/2034 20:33,2034-04-09
2012-12-28T23:33:04Z+3,2012-12-28
5-9-2013,2013-09-05
Event at 2004-12-28T3:44:52,2004-12-28
26 tháng 10 năm 2029,2029-10-26
2033/4/3T43356,2033-04-03
17.2.2028,2028-02-17
"January 28, 2022",2022-01-28
6-8-2006,2006-08-06
Sự kiện diễn ra vào 12/11/1995 18:0,1995-11-12
2030-10-27T21:02:04+07:00,2030-10-27
ngày 27 tháng 11 năm 2023,2023-11-27
Ngày 22-10-2029,2029-10-22
15/10/2004 giờ 1:39:12,2004-10-15
2014-07-28T21:06:14.860Z,2014-07-28
19 tháng 11 năm 2021,2021-11-19
2017-09-01T10:35:48Z+3,2017-09-01
8-4-2002,2002-04-08
"August 12, 2004",2004-08-12
20050501131646,2005-05-01
1-12-2032,2032-12-01
"17th of April, 2019",2019-04-17
ngày 4 tháng 9 năm 1995,1995-09-04
2025-11-08T17:52:41,2025-11-08
03_24_1996,1996-03-24
2033/4/2T2280,2033-04-02
1274029200000000,2010-05-17
20200524211320467,2020-05-24
2003/6/19T192950,2003-06-19
1/4/2003 giờ 10:8:30,2003-04-01
2029-12-27T17:07:58Z+3,2029-12-27
20101011140312014,2010-10-11
3/24-1999,1999-12-03
12 May 1994,1994-05-12
20110518065218475,2011-05-18
1391878800000,2014-02-09
2014 09 21,2014-09-21
Sự kiện diễn ra vào 14/4/2031 9:33,2031-04-14
17 tháng 5 năm 2013,2013-05-17
40-10-1991,1991-10-20
1576342800,2019-12-15
11 08 2004,2004-11-08
2004_11_13T17_35_58+3,2004-11-13
The system recorded 19910314213145,1991-03-14
20330822101015103210,2033-08-22
1529514000000000,2018-06-21
20220202073714278097739,2022-02-02
04_07_25,2025-07-04
16.11.2015T12-10-32,2015-11-16
07_14_2022,2022-07-14
1100797200000000,2004-11-19
2019-12-26T07:47:49.680Z,2019-12-26
Event at 2030-04-15T3:34:55,2030-04-15
"3rd of September, 2030",2030-09-03
20310320180009,2031-03-20
17/6-2022,2022-03-17
19_11_22,2022-11-19
1224608400,2008-10-22
3.5.2006T10-11-40,2006-05-03
20.9.2032,2032-09-20
1492621200000000,2017-04-20
03.12.2006,2006-03-12
1119805200000000000,2005-06-27
2 tháng 8 năm 2006,2006-08-02
13 Oct 1990,1990-10-13
1904230800000000000,2030-05-06
10 Feb 1991,1991-02-10
2000-03-05T08:03:47.787Z,2000-03-05
20090630213752218188,2009-06-30
01/14/2009,2009-01-14
"December 28, 2015",2015-12-28
1992_03_26T2_7_33+07:00,1992-03-26
"July 24, 2000",2000-07-24
Sự kiện diễn ra vào 19/5/2012 19:36,2012-05-19
945968400000000,1999-12-24
12_6_1999,1999-06-12
20190501165601446352,2019-05-01
ngày 11 tháng 3 năm 2013,2013-03-11
Ngày 19-7-1992,1992-07-19
The system recorded 20331212181808,2033-12-12
642618000000,1990-05-14
13-11-2010,2010-11-13
20290309014730792604809,2029-03-09
2021-09-19T10:40:24+2500,2021-09-19
12 Oct 2009,2009-10-12
2029 12 01,2029-12-01
16_2_2034,2034-02-16
The system recorded 20290716041930,2029-07-16
2011-07-09T13:57:47Z,2011-07-09
"27th of December, 2023",2023-12-27
22/9/2001 giờ 0:32:30,2001-09-22
20351127055724644411,2035-11-27
25 2 2007,2007-02-25
20150310021036,2015-03-10
2012_05_12T9_35_32+07:00,2012-05-12
23.9.1991T8-4-27,1991-09-23
20 Jun 1994,1994-06-20
2015-02-27T02:57:29+2500,2015-02-27
1795885200000000,2026-11-29
12|07|2010,2010-12-07
2010|01|08,2010-01-08
7-6-2006,2006-06-07
The system recorded 20281205031856,2028-12-05
1107018000000000,2005-01-30
2020/11/14T6326,2020-11-14
"7th of August, 1998",1998-08-07
2031-10-07T22:16:47+2500,2031-10-07
"28th of January, 2019",2019-01-28
14/20-1996,1996-10-14
"January 23, 1997",1997-01-23
Event at 2031-11-03T8:21:58,2031-11-03
12-9-1996,1996-09-12
Sự kiện diễn ra vào 1/9/2006 8:44,2006-09-01
20140802000315251954643,2014-08-02
1236704400,2009-03-11
1990-10-18T09:03:45,1990-10-18
1991/8/27T112521,1991-08-27
874342800000,1997-09-16
8/10/2007 giờ 14:21:12,2007-10-08
20000812045913796290,2000-08-12
20241221200328118805,2024-12-21
2011_12_30T5_1_21-05:00,2011-12-30
1979053200000,2032-09-18
19991110113137,1999-11-10
2022-08-09T04:00:56.474Z,2022-08-09
1753894800,2025-07-31
20141224110515496351682,2014-12-24
19900511143858,1990-05-11
1991-08-30T12:17:19Z+3,1991-08-30
Sự kiện diễn ra vào 19/7/2033 14:13,2033-07-19
The system recorded 20340316031150,2034-03-16
19910121142532155871,1991-01-21
06|07|14,2014-07-06
2023-02-12T22:36:41.593553872Z,2023-02-12
Event at 2028-09-27T23:53:4,2028-09-27
20040906093543485130,2004-09-06
19980720012921820038008,1998-07-20
Sự kiện diễn ra vào 13/10/2013 5:49,2013-10-13
2000_04_20T7_13_1+2500,2000-04-20
29/14-2026,2026-07-29
756147600000000000,1993-12-18
"January 3, 2012",2012-01-03
1997/11/22T5618,1997-11-22
2018-01-08T09:55:52.676318Z,2018-01-08
19950714081652,1995-07-14
The system recorded 20310705031334,2031-07-05
16-4-2009,2009-04-16
971024400,2000-10-09
"February 22, 2001",2001-02-22
30/5/1993 giờ 2:26:0,1993-05-30
20200621003819297870,2020-06-21
1802451600,2027-02-13
2029-08-04T23:40:09.502Z,2029-08-04
2 tháng 3 năm 2025,2025-03-02
1002387600,2001-10-07
1405443600,2014-07-16
1998_04_14T12_32_53Z+3,1998-04-14
1998-11-12T19:08:44,1998-11-12
2019-05-29T03:46:49+2500,2019-05-29
22/2-2035,2035-01-22
1096131600000,2004-09-26
2016_04_14T8_38_48+0500,2016-04-14
2026-06-21T09:33:13.670860644Z,2026-06-21
19-8-2035,2035-08-19
2033-07-04T06:24:48.146308Z,2033-07-04
20230720014228,2023-07-20
ngày 16 tháng 5 năm 1992,1992-05-16
22 Apr 1998,1998-04-22
"September 15, 2021",2021-09-15
1334422800000000000,2012-04-15
1263747600000000,2010-01-18
18.5.1994T1-41-50,1994-05-18
6-6-1993,1993-06-03
2026-07-25T10:38:43Z,2026-07-25
24 Jun 2004,2004-06-24
2 Jul 1993,1993-07-02
1998_09_13T18_22_22Z,1998-09-13
The system recorded 20200809063448,2020-08-09
23/12-2006,2006-06-23
2010-11-06T05:06:58,2010-11-06
2005-04-14T13:05:02Z,2005-04-14
Event at 2023-12-16T20:51:8,2023-12-16
52-12-2009,2009-12-26
16-6-1999,1999-06-08
6/16-2034,2034-08-06
2008-05-22T06:16:14Z,2008-05-22
2019/3/4T135256,2019-03-04
2026/11/19T115210,2026-11-19
14-2-2010,2010-02-14
2-10-2012,2012-10-02
844016400000000,1996-09-30
2012-12-23T17:19:19.035Z,2012-12-23
19960105175051541001,1996-01-05
1998_09_07T17_44_46+0500,1998-09-07
2011-10-17T05:43:03+2500,2011-10-17
978973200000,2001-01-09
10-15-2024,2024-10-15
The system recorded 20130403045904,2013-04-03
2021-04-20T20:15:47.217810551Z,2021-04-20
2024-04-25T11:28:34.460457706Z,2024-04-25
ngày 21 tháng 8 năm 2024,2024-08-21
"November 3, 2012",2012-11-03
Event at 2019-11-04T5:55:39,2019-11-04
20071130032916602380994,2007-11-30
2007-10-18T20:41:03+2500,2007-10-18
4 tháng 11 năm 1995,1995-11-04
Sự kiện diễn ra vào 1/10/2009 12:28,2009-10-01
2029.12.10,2029-12-10
Sự kiện diễn ra vào 4/7/2010 22:22,2010-07-04
2015-12-14T06:55:14,2015-12-14
2011|03|12,2011-03-12
28/22-2031,2031-11-28
2007-01-30T22:29:30Z+3,2007-01-30
6 Dec 1994,1994-12-06
23/5/2027 giờ 6:10:53,2027-05-23
22.5.2014T4-10-43,2014-05-22
2021-05-05T13:21:35.492Z,2021-05-05
1990-02-09T04:02:05Z+3,1990-02-09
2011-03-18T23:30:29.017948Z,2011-03-18
1650992400000000,2022-04-27
1144256400,2006-04-06
21/1/2025 giờ 16:35:1,2025-01-21
9-7-2008,2008-07-09
08.04.33,2033-04-08
24/9/2010 giờ 3:3:28,2010-09-24
2 tháng 7 năm 2002,2002-07-02
30/8-2028,2028-04-30
1937062800,2031-05-21
1996-03-15T17:20:42,1996-03-15
19990714051909137934,1999-07-14
4-2-1994,1994-02-04
26/24-2020,2020-12-26
20090802092414,2009-08-02
1997-08-02T08:55:07,1997-08-02
2029/2/23T35323,2029-02-23
Event at 1993-11-20T4:45:46,1993-11-20
21-12-2034,2034-12-21
Event at 2007-03-01T23:3:48,2007-03-01
The system recorded 20261115035510,2026-11-15
Sự kiện diễn ra vào 17/6/1992 7:56,1992-06-17
1994_08_27T18_10_24+00:00,1994-08-27
2029-08-07T12:35:01Z+3,2029-08-07
Ngày 22-10-2032,2032-10-22
5 May 2015,2015-05-05
14/5/2005 giờ 3:46:19,2005-05-14
20350904124456045832904,2035-09-04
2023-07-20T04:59:18.617Z,2023-07-20
The system recorded 20051116103835,2005-11-16
20251015171746575669096,2025-10-15
Sự kiện diễn ra vào 23/1/2017 3:9,2017-01-23
Sự kiện diễn ra vào 1/5/1994 1:59,1994-05-01
20210204152929502,2021-02-04
ngày 4 tháng 10 năm 2007,2007-10-04
1329411600000000,2012-02-17
"8th of August, 1990",1990-08-08
Sự kiện diễn ra vào 30/3/2011 14:3,2011-03-30
24|10|29,2029-10-24
2013/12/11T31422,2013-12-11
16.09.92,1992-09-16
2004|04|21,2004-04-21
2064070800,2035-05-30
13.10.2021,2021-10-13
2035-09-09T03:35:37.883736533Z,2035-09-09
2-8-2022,2022-08-02
"March 18, 2015",2015-03-18
04/16/2004,2004-04-16
15 Dec 1999,1999-12-15
2034-03-28T09:46:14+2500,2034-03-28
18/4-2013,2013-02-18
1137603600000000,2006-01-19
20060419094839,2006-04-19
Event at 1996-01-24T19:19:41,1996-01-24
1 tháng 1 năm 2013,2013-01-01
The system recorded 20060709174342,2006-07-09
25-10-2025,2025-10-25
19/10-2035,2035-05-19
Ngày 15-7-2034,2034-07-15
14.7.2017,2017-07-14
14/10-1993,1993-05-14
2026-03-18T19:46:02.207670084Z,2026-03-18
Event at 1999-10-14T23:59:28,1999-10-14
Sự kiện diễn ra vào 24/8/1993 19:49,1993-08-24
16-1-2019,2019-01-16
06/13/2021,2021-06-13
14 Oct 2012,2012-10-14
Sự kiện diễn ra vào 27/4/1991 1:8,1991-04-27
ngày 19 tháng 5 năm 2022,2022-05-19
12/01/12,2012-01-12
52-1-2008,2008-01-26
20061016130550,2006-10-16
2003-04-29T10:40:30+00:00,2003-04-29
20130305204736,2013-03-05
2024-01-24T08:27:50.201438Z,2024-01-24
20080829032843,2008-08-29
The system recorded 19920701162607,1992-07-01
The system recorded 20060903233655,2006-09-03
1995/07/03,1995-07-03
13 August 2004,2004-08-13
795286800000000,1995-03-16
The system recorded 20240310094134,2024-03-10
20220115092056339,2022-01-15
17/9/2025 giờ 22:12:8,2025-09-17
2022/11/25T191741,2022-11-25
18-7-1996,1996-07-09
19 August 2016,2016-08-19
2025_05_13T21_34_0+2500,2025-05-13
1233766800000,2009-02-05
07.19.1992,1992-07-19
2020_06_13T12_37_10+2500,2020-06-13
1680368400000000000,2023-04-02
08|25|2011,2011-08-25
10 July 2000,2000-07-10
901990800000000000,1998-08-02
"9th of December, 1993",1993-12-09
26/06/22,2022-06-26
The system recorded 19940125013912,1994-01-25
20040710183828951342,2004-07-10
958842000000000000,2000-05-21
"11th of January, 2000",2000-01-11
27 tháng 9 năm 2008,2008-09-27
15 tháng 3 năm 2017,2017-03-15
12-4-2018,2018-04-06
14.7.2016,2016-07-14
2030-09-03T09:54:28Z+3,2030-09-03
Ngày 25-2-2024,2024-02-25
20041031094020189351,2004-10-31
1051290000,2003-04-26
5 Mar 2003,2003-03-05
Event at 1993-01-19T9:57:53,1993-01-19
28/11/1992,1992-11-28
1054227600000,2003-05-30
5 October 2034,2034-10-05
2007-02-09T15:24:10,2007-02-09
11.3.2035T15-16-7,2035-03-11
2019-08-26T13:04:24+07:00,2019-08-26
2029-05-04T13:09:30.498082111Z,2029-05-04
28.9.2010T2-34-23,2010-09-28
1994-02-17T09:11:20,1994-02-17
6 June 2031,2031-06-06
2011-03-10T04:40:08+2500,2011-03-10
1993-10-03,1993-10-03
1998493200000000,2033-05-01
1010163600000000000,2002-01-05
11-10-2028,2028-10-11
1-6-1992,1992-06-01
ngày 2 tháng 4 năm 2015,2015-04-02
Sự kiện diễn ra vào 10/1/2009 12:56,2009-01-10
2019-02-21T11:57:08.596Z,2019-02-21
26-7-2012,2012-07-26
1747587600000000000,2025-05-19
3-8-2021,2021-08-03
Ngày 13-8-2003,2003-08-13
Ngày 26-5-2003,2003-05-26
743965200000000000,1993-07-30
22_09_91,1991-09-22
ngày 22 tháng 11 năm 2005,2005-11-22
1906995600000000,2030-06-07
Sự kiện diễn ra vào 17/3/1996 9:27,1996-03-17
ngày 19 tháng 11 năm 1999,1999-11-19
20140927022245662,2014-09-27
24-10-95,1995-10-24
15/3/1992 giờ 0:19:19,1992-03-15
1377709200000000,2013-08-29
18 August 2035,2035-08-18
2019-11-26T04:35:21Z+3,2019-11-26
ngày 12 tháng 11 năm 2011,2011-11-12
672858000000000,1991-04-29
19910306173003165886,1991-03-06
17 tháng 2 năm 2031,2031-02-17
ngày 17 tháng 10 năm 2026,2026-10-17
2024-10-11T22:42:28Z+3,2024-10-11
1939309200000,2031-06-16
1997 09 15,1997-09-15
20190325224443374,2019-03-25
Sự kiện diễn ra vào 19/5/2021 1:4,2021-05-19
1939482000000,2031-06-18
20191030041754,2019-10-30
17 tháng 10 năm 2030,2030-10-17
03|14|2010,2010-03-14
10-20-2012,2012-10-20
2004-01-12T12:23:24.588011Z,2004-01-12
"January 20, 2031",2031-01-20
20240922011850030606420,2024-09-22
16/3/1999 giờ 21:22:28,1999-03-16
24-1-2030,2030-01-12
Sự kiện diễn ra vào 11/9/2004 4:19,2004-09-11
22/8/2008,2008-08-22
3 Jun 2005,2005-06-03
04|10|90,1990-10-04
20050118025645746535320,2005-01-18
2026/4/6T64150,2026-04-06
"April 13, 1991",1991-04-13
1994-11-02T21:39:35+08,1994-11-02
Event at 2002-10-09T17:54:42,2002-10-09
19930629185218082264,1993-06-29
29 June 2020,2020-06-29
1994-05-28T23:21:53+08,1994-05-28
20320718150918765,2032-07-18
24|01|08,2008-01-24
21/18-1992,1992-09-21
The system recorded 20060717075853,2006-07-17
1987520400,2032-12-25
1671296400000000000,2022-12-18
Ngày 20-3-2033,2033-03-20
21 7 2030,2030-07-21
670179600,1991-03-29
1047142800,2003-03-09
48-12-2006,2006-12-24
"January 6, 2010",2010-01-06
14-8-2005,2005-08-14
19970205045516360202599,1997-02-05
The system recorded 20300211063236,2030-02-11
03_07_2035,2035-03-07
24 11 2015,2015-11-24
1995/12/9T93244,1995-12-09
20060114174229029,2006-01-14
2032-08-16T16:57:14.505Z,2032-08-16
"11th of June, 2005",2005-06-11
The system recorded 19950524154118,1995-05-24
"5th of October, 2005",2005-10-05
1991-07-04T00:31:31-0300,1991-07-04
1574182800000000,2019-11-20
851360400000,1996-12-24
19900410112649401358977,1990-04-10
10 tháng 7 năm 2033,2033-07-10
ngày 31 tháng 5 năm 2000,2000-05-31
32-8-1995,1995-08-16
The system recorded 20080504055701,2008-05-04
20030429023341703,2003-04-29
The system recorded 20110131024829,2011-01-31
2027-02-16T20:59:19.852Z,2027-02-16
Ngày 19-2-2027,2027-02-19
2024-08-22T14:27:50+00:00,2024-08-22
25.8.1998T0-51-1,1998-08-25
22 tháng 3 năm 2033,2033-03-22
20300611041425956892,2030-06-11
6 Jun 1995,1995-06-06
1077814800000000000,2004-02-27
2002_05_25T22_1_16-0330,2002-05-25
1994_12_22T13_25_40+0500,1994-12-22
22 May 1993,1993-05-22
20350629100130093914490,2035-06-29
"30th of January, 2009",2009-01-30
2015-05-26T08:44:10+0500,2015-05-26
882118800000000,1997-12-15
2018-06-26T13:24:41.751923Z,2018-06-26
2035/04/16,2035-04-16
27 Jun 1996,1996-06-27
Sự kiện diễn ra vào 15/9/1999 2:6,1999-09-15
17.12.2028T20-29-46,2028-12-17
2009|08|12,2009-08-12
2034-11-22T11:28:26.431Z,2034-11-22
11 February 2020,2020-02-11
20031002105211976,2003-10-02
2012-10-13T20:01:15.543448Z,2012-10-13
Event at 1991-08-30T11:28:9,1991-08-30
2013.01.22,2013-01-22
19950907130819514,1995-09-07
2005_01_10,2005-01-10
11.4.2016T0-43-59,2016-04-11
11/3/2022 giờ 14:59:44,2022-03-11
2014-01-11T01:40:26Z+3,2014-01-11
21 8 2029,2029-08-21
ngày 25 tháng 2 năm 2008,2008-02-25
2032-10-12T14:59:39+2500,2032-10-12
1747155600000000,2025-05-14
2000_01_18T22_16_0+0500,2000-01-18
9-7-2001,2001-07-09
The system recorded 20290915074524,2029-09-15
19 May 1992,1992-05-19
2035-04-20T22:47:10.944180350Z,2035-04-20
5/6/2011 giờ 9:23:28,2011-06-05
20170727134731,2017-07-27
20/14-2034,2034-07-20
15.06.26,2026-06-15
Ngày 8-11-2004,2004-11-08
2033-09-08T00:33:04.486Z,2033-09-08
20/12/2025,2025-12-20
2002-02-01T10:05:45+00:00,2002-02-01
20 Oct 2005,2005-10-20
The system recorded 20100904131022,2010-09-04
20041011184907474093392,2004-10-11
1935507600000,2031-05-03
06 27 2009,2009-06-27
22|7|1997,1997-07-22
2002-11-08T10:58:05.565640255Z,2002-11-08
"January 21, 2035",2035-01-21
1992-06-17T19:03:10.195Z,1992-06-17
42-4-2032,2032-04-21
9/2/1998 giờ 9:49:1,1998-02-09
14-11-2023,2023-11-14
2027|06|01,2027-06-01
"1st of September, 2027",2027-09-01
Event at 2032-06-30T21:7:43,2032-06-30
1993/6/7T185041,1993-06-07
17.1.2003T3-29-46,2003-01-17
2015-03-27T20:47:51,2015-03-27
"6th of December, 2033",2033-12-06
1950195600000,2031-10-20
1992-05-28T15:15:19.540060Z,1992-05-28
1329066000,2012-02-13
2031-07-26T21:19:20+2500,2031-07-26
19910110164623670009525,1991-01-10
19_04_30,2030-04-19
20221101121758712,2022-11-01
ngày 6 tháng 3 năm 1995,1995-03-06
"5th of July, 1997",1997-07-05
890326800,1998-03-20
26 07 27,2027-07-26
1527008400000000000,2018-05-23
2015-01-06T16:55:59Z+3,2015-01-06
Sự kiện diễn ra vào 20/6/1997 16:27,1997-06-20
2022-05-02T13:56:35Z+3,2022-05-02
2008-10-15T16:15:20.029999646Z,2008-10-15
1994-12-20T02:24:42+2500,1994-12-20
10-10-16,2016-10-10
16 tháng 9 năm 2000,2000-09-16
12/10/2021 giờ 20:26:4,2021-10-12
Event at 2019-03-25T23:12:27,2019-03-25
2003_09_21,2003-09-21
2031-02-10T06:27:59.002648Z,2031-02-10
17-5-1991,1991-05-17
11.3.2023,2023-03-11
60-9-2003,2003-09-30
1504026000000,2017-08-30
The system recorded 19930626072511,1993-06-26
26 January 2004,2004-01-26
19-5-1995,1995-05-19
2018-10-10T20:15:28.736Z,2018-10-10
2004_03_22T9_13_56+00:00,2004-03-22
2027-07-31T15:39:47.504951172Z,2027-07-31
1270486800000000000,2010-04-06
"December 28, 2012",2012-12-28
11/11/15,2015-11-11
2014-04-27T23:01:04.412253Z,2014-04-27
1395939600000,2014-03-28
20200515095452967,2020-05-15
16 February 2035,2035-02-16
19971015102536,1997-10-15
11/14-2024,2024-07-11
2006/12/10T9410,2006-12-10
2007-08-02T15:26:50Z+3,2007-08-02
26 tháng 12 năm 2028,2028-12-26
2001-11-03T15:35:26.861709140Z,2001-11-03
Sự kiện diễn ra vào 3/12/2020 7:43,2020-12-03
1998-06-07T22:41:06+2500,1998-06-07
1425402000000000000,2015-03-04
2023-04-09T17:23:30+2500,2023-04-09
2018-09-12T18:51:28.097635Z,2018-09-12
Event at 2002-11-01T19:16:58,2002-11-01
20120725001037104,2012-07-25
1993-08-01T21:24:18+2500,1993-08-01
1777395600000000000,2026-04-29
1998-04-30T23:26:57+0500,1998-04-30
1812474000000000000,2027-06-09
20170915192023492960182,2017-09-15
660243600,1990-12-04
"9th of November, 2035",2035-11-09
19921017155915486743539,1992-10-17
The system recorded 20010818144117,2001-08-18
2022-10-11T15:05:14Z+3,2022-10-11
08-05-2003,2003-08-05
7 9 2005,2005-09-07
2028-04-07T03:44:36.620Z,2028-04-07
20120823045411632992,2012-08-23
1653843600000000,2022-05-30
1311958800,2011-07-30
7-7-2025,2025-07-07
38-4-2003,2003-04-19
Event at 1994-08-14T23:11:0,1994-08-14
20020301155113447,2002-03-01
23 tháng 2 năm 2000,2000-02-23
21|02|00,2000-02-21
20/16-2033,2033-08-20
17 tháng 3 năm 1995,1995-03-17
7|11|1997,1997-11-07
6 Oct 2030,2030-10-06
Event at 2024-10-20T9:53:5,2024-10-20
Event at 2022-03-28T10:10:57,2022-03-28
26/8/2024 giờ 0:7:29,2024-08-26
Ngày 7-8-2006,2006-08-07
2001-05-19T02:15:35+2500,2001-05-19
2023-01-17T22:30:35-05:00,2023-01-17
20280410033439120365799,2028-04-10
Ngày 25-6-2029,2029-06-25
2012-07-31T01:46:21Z+3,2012-07-31
05 14 2014,2014-05-14
20020917102345782529,2002-09-17
06_01_10,2010-01-06
1965920400,2032-04-19
52-11-2017,2017-11-26
1930064400,2031-03-01
"18th of January, 2000",2000-01-18
2026_09_14,2026-09-14
31 Aug 2020,2020-08-31
2037286800000,2034-07-24
Sự kiện diễn ra vào 27/5/2012 3:12,2012-05-27
2028-12-31T17:26:05Z+3,2028-12-31
Event at 2007-05-23T7:59:23,2007-05-23
1994-01-05T21:30:12.984156Z,1994-01-05
19951219015052512782,1995-12-19
7 tháng 9 năm 1993,1993-09-07
745347600000000,1993-08-15
2006355600000000,2033-07-31
2026.04.22,2026-04-22
"9th of August, 2025",2025-08-09
20321014064158660966594,2032-10-14
984502800,2001-03-14
27-09-05,2005-09-27
08|09|2019,2019-08-09
Sự kiện diễn ra vào 11/2/2003 14:31,2003-02-11
23.11.2032,2032-11-23
2016-07-28T23:45:44.619Z,2016-07-28
2022-10-28T06:05:09,2022-10-28
7-10-2015,2015-10-07
19 tháng 6 năm 1997,1997-06-19
27 Sep 2028,2028-09-27
27/7/2004 giờ 14:59:1,2004-07-27
10/7/2030 giờ 21:24:16,2030-07-10
2002-03-19T11:20:30.448011Z,2002-03-19
721501200000000,1992-11-12
20300702065653178,2030-07-02
2012.05.24,2012-05-24
2027/12/18T20399,2027-12-18
1673024400,2023-01-07
24/4-2026,2026-02-24
"26th of September, 2015",2015-09-26
14 September 2005,2005-09-14
13.10.2035T10-23-11,2035-10-13
20320306192601317231,2032-03-06
2019-05-04T11:02:47+2500,2019-05-04
Ngày 28-8-2011,2011-08-28
19/9/2012 giờ 5:59:23,2012-09-19
23/4/1995 giờ 13:22:14,1995-04-23
"15th of June, 2016",2016-06-15
27|3|2020,2020-03-27
11 Mar 2033,2033-03-11
959965200,2000-06-03
2008-07-27T03:04:56Z+3,2008-07-27
2021_05_16T8_19_46-05:00,2021-05-16
9.6.2005,2005-06-09
1401037200000000000,2014-05-26
2008-03-13T01:48:41Z+3,2008-03-13
2032_01_08,2032-01-08
"January 1, 2004",2004-01-01
715280400,1992-09-01
1821459600,2027-09-21
2008170000000000000,2033-08-21
1004461200,2001-10-31
Sự kiện diễn ra vào 23/3/2009 18:24,2009-03-23
14-7-1999,1999-07-14
17.1.2032T8-35-50,2032-01-17
20021112062235699974,2002-11-12
2014-03-13T13:11:05+2500,2014-03-13
24|6|2001,2001-06-24
"August 11, 2001",2001-08-11
"24th of January, 1991",1991-01-24
20140728001946,2014-07-28
2004-09-09T05:03:57.633059833Z,2004-09-09
29 Oct 2022,2022-10-29
02/20/2023,2023-02-20
20120114011955203081,2012-01-14
01_13_2007,2007-01-13
2007-03-16T15:47:29Z+3,2007-03-16
23 July 2017,2017-07-23
The system recorded 20340104115306,2034-01-04
Event at 2028-09-12T18:50:5,2028-09-12
18-8-2032,2032-08-09
13 tháng 8 năm 2032,2032-08-13
"March 19, 2011",2011-03-19
2027_12_01,2027-12-01
1650301200000,2022-04-19
20030121142356775090327,2003-01-21
2030-10-23T10:36:52.487236Z,2030-10-23
The system recorded 20150414172729,2015-04-14
6/12/1996 giờ 15:14:53,1996-12-06
2005-09-06T21:34:09,2005-09-06
14/4-2016,2016-02-14
1707757200000000000,2024-02-13
4 March 2018,2018-03-04
1214672400,2008-06-29
2013/8/23T20597,2013-08-23
"24th of April, 2024",2024-04-24
19910326172404017,1991-03-26
29.4.2023T8-37-44,2023-04-29
2002-03-13T03:04:52+2500,2002-03-13
2003/4/2T32910,2003-04-02
20171027183315450,2017-10-27
1996-10-06T11:21:36.900Z,1996-10-06
7_3_1998,1998-03-07
1996-11-06T01:44:43.422Z,1996-11-06
2024-04-05T19:02:20,2024-04-05
2018-06-11T15:41:36.756882694Z,2018-06-11
1998-06-06T00:21:51+07:00,1998-06-06
2017-12-20T03:40:25+2500,2017-12-20
19950621231637,1995-06-21
25/3/2008 giờ 3:15:3,2008-03-25
5/16-2031,2031-08-05
Event at 2022-12-20T1:12:7,2022-12-20
Ngày 14-2-2012,2012-02-14
7.11.2034T15-39-6,2034-11-07
17/10/2004 giờ 4:26:19,2004-10-17
9/6/2035,2035-06-09
4 Sep 2025,2025-09-04
20350227072912618157735,2035-02-27
20030909034755,2003-09-09
22 Dec 2019,2019-12-22
20150109044820676865462,2015-01-09
2002-08-27T05:08:03Z+3,2002-08-27
1992/6/18T91519,1992-06-18
27.11.2005T5-43-58,2005-11-27
04 24 2006,2006-04-24
The system recorded 20010524163955,2001-05-24
11 29 2027,2027-11-29
Ngày 8-9-2002,2002-09-08
20 tháng 8 năm 2012,2012-08-20
20090122041651467,2009-01-22
03 21 2014,2014-03-21
8/4/2028 giờ 5:0:17,2028-04-08
1223312400,2008-10-07
1754240400,2025-08-04
13 Nov 1993,1993-11-13
29/14-2028,2028-07-29
20171119163523649152672,2017-11-19
"March 11, 2011",2011-03-11
5/2-2006,2006-01-05
16 tháng 11 năm 1998,1998-11-16
2019-11-01T12:52:21.836254197Z,2019-11-01
The system recorded 20320218070327,2032-02-18
07_18_2026,2026-07-18
4 Feb 2013,2013-02-04
2011-08-08T13:04:53+08,2011-08-08
1845046800,2028-06-20
2020-09-24T18:03:26.465384Z,2020-09-24
1.3.2003T17-23-37,2003-03-01
20090508123053949127,2009-05-08
Ngày 12-3-2006,2006-03-12
The system recorded 20340108015708,2034-01-08
17-05-13,2013-05-17
ngày 31 tháng 1 năm 2025,2025-01-31
26-8-2026,2026-08-26
24 2 2027,2027-02-24
2003-11-16T06:19:26.883887Z,2003-11-16
2023_07_09T4_5_27+08,2023-07-09
28.3.2033T6-19-38,2033-03-28
2000-10-27T08:38:35,2000-10-27
2012-03-28T05:39:31Z+3,2012-03-28
16/04/08,2008-04-16
1317661200000,2011-10-04
2003-02-18T18:03:42+08,2003-02-18
2019-01-15T06:48:54+2500,2019-01-15
2002-07-22T03:25:09-05:00,2002-07-22
2023_04_28T6_3_8+2500,2023-04-28
18 Aug 2008,2008-08-18
The system recorded 20100104184616,2010-01-04
20051222214826750902564,2005-12-22
2024-11-17T01:22:43.756Z,2024-11-17
11/22-2005,2005-11-11
1475773200,2016-10-07
872096400,1997-08-21
The system recorded 20210105062321,2021-01-05
11-30-1993,1993-11-30
Ngày 20-1-2022,2022-01-20
19990911001517,1999-09-11
1990-12-27,1990-12-27
ngày 21 tháng 6 năm 2003,2003-06-21
2010-11-20T20:32:45Z+3,2010-11-20
Ngày 7-12-1992,1992-12-07
20 Jan 2021,2021-01-20
ngày 24 tháng 12 năm 2025,2025-12-24
1029603600000000,2002-08-18
2006-09-29T08:23:05+2500,2006-09-29
2020-06-09T05:56:09Z+3,2020-06-09
Ngày 7-9-1999,1999-09-07
2011-03-18T15:23:34.323Z,2011-03-18
1.8.2002T23-17-43,2002-08-01
ngày 26 tháng 11 năm 2009,2009-11-26
20271023153657843076,2027-10-23
09.08.34,2034-08-09
2014_03_01T11_11_59-05:00,2014-03-01
2027/9/14T82234,2027-09-14
2011-04-14T14:25:11+00:00,2011-04-14
2003-11-17T17:47:07.347307244Z,2003-11-17
2011-09-22T20:31:14+3,2011-09-22
995562000000000,2001-07-20
27.6.1992T20-18-47,1992-06-27
17 Jul 2005,2005-07-17
"July 1, 2017",2017-07-01
1992/3/26T133324,1992-03-26
20260614154938166926,2026-06-14
10|11|06,2006-11-10
1638205200000,2021-11-30
1510851600000000,2017-11-17
733338000000000000,1993-03-29
20041224183106270700895,2004-12-24
671994000000000,1991-04-19
20030814155622,2003-08-14
20070402172755,2007-04-02
2035299600000000,2034-07-01
18/2/2021 giờ 10:7:26,2021-02-18
2028_01_25T3_48_24-05:00,2028-01-25
5/2-2021,2021-01-05
2024-01-10T16:04:00.177955845Z,2024-01-10
The system recorded 20210421023821,2021-04-21
4-12-1990,1990-12-04
ngày 27 tháng 3 năm 2011,2011-03-27
1102870800000000,2004-12-13
2007_11_30T17_22_38+08,2007-11-30
ngày 20 tháng 11 năm 2006,2006-11-20
14|12|1997,1997-12-14
2007-01-03T03:47:22+2500,2007-01-03
1992-07-30T23:57:20Z+3,1992-07-30
2032-12-05T18:15:25+2500,2032-12-05
"July 21, 2019",2019-07-21
20040509191454409812726,2004-05-09
1051981200000000,2003-05-04
2/2/2024 giờ 3:41:40,2024-02-02
Event at 1997-10-14T11:16:40,1997-10-14
21 tháng 9 năm 2006,2006-09-21
"March 22, 2027",2027-03-22
1305910800000000,2011-05-21
20051220182013594,2005-12-20
5_12_2011,2011-12-05
Sự kiện diễn ra vào 27/9/1996 19:33,1996-09-27
2013-01-04T14:31:01.998812689Z,2013-01-04
20321101192919124861,2032-11-01
1/4/2027 giờ 3:25:36,2027-04-01
6-1-2000,2000-01-06
20201011233815,2020-10-11
19951127051341491234,1995-11-27
27 tháng 2 năm 2031,2031-02-27
Event at 2000-02-12T21:56:24,2000-02-12
13/20-2013,2013-10-13
ngày 19 tháng 10 năm 2016,2016-10-19
Sự kiện diễn ra vào 7/4/1998 22:22,1998-04-07
16 July 2031,2031-07-16
6 tháng 1 năm 2011,2011-01-06
Event at 2023-02-12T2:0:55,2023-02-12
17/16-2005,2005-08-17
20280409093437889,2028-04-09
11/8/2000,2000-08-11
2024-03-28T01:07:36.115689514Z,2024-03-28
ngày 27 tháng 6 năm 2035,2035-06-27
1548522000000000000,2019-01-27
2035-07-09T17:37:00.573221984Z,2035-07-09
19/4/2005 giờ 14:32:46,2005-04-19
20291025230113762481,2029-10-25
19910616090428,1991-06-16
2019-11-14T19:31:04Z+3,2019-11-14
1975942800,2032-08-13
4.8.2000T14-8-38,2000-08-04
1961427600000000000,2032-02-27
28/12/1998 giờ 14:29:24,1998-12-28
Event at 1992-04-11T15:21:30,1992-04-11
1997-10-10T05:08:42+2500,1997-10-10
930502800,1999-06-28
2028-05-15T23:49:01,2028-05-15
1867424400,2029-03-06
Sự kiện diễn ra vào 19/3/2014 23:59,2014-03-19
22.1.2005T1-43-54,2005-01-22
1991-06-09T21:50:55.569807282Z,1991-06-09
19940601092014847748,1994-06-01
2018-04-15T23:44:16-0330,2018-04-15
2000-01-24T21:54:57-0330,2000-01-24
29/2-1997,1997-01-29
3 Jul 2001,2001-07-03
"20th of May, 2021",2021-05-20
25 December 2030,2030-12-25
19/24-2022,2022-12-19
2007-04-02T09:47:56Z+3,2007-04-02
8 tháng 7 năm 2028,2028-07-08
Ngày 10-6-2024,2024-06-10
20250222182424099318,2025-02-22
2-7-2001,2001-07-02
2 July 2030,2030-07-02
1994-06-04T14:36:40Z+3,1994-06-04
"29th of June, 2003",2003-06-29
15-10-1991,1991-10-15
11_10_27,2027-10-11
1993-10-03T19:10:08,1993-10-03
ngày 29 tháng 6 năm 2018,2018-06-29
10/4/2007 giờ 13:41:21,2007-04-10
20060731042000138327,2006-07-31
19921029154542678297047,1992-10-29
19910824232911246359659,1991-08-24
31 Jul 2024,2024-07-31
1006275600000000,2001-11-21
2023-11-24T16:29:13.332Z,2023-11-24
2032-06-30T17:12:56-0300,2032-06-30
2010-08-27T22:48:21.967781462Z,2010-08-27
14-12-2022,2022-12-14
Ngày 3-5-2006,2006-05-03
2031-08-12T20:57:48+2500,2031-08-12
1079456400000000,2004-03-17
"12th of March, 2011",2011-03-12
2018365200000000,2033-12-17
2032-11-15T06:36:49.970146424Z,2032-11-15
Ngày 27-5-2032,2032-05-27
20000918081029,2000-09-18
2030/03/02,2030-03-02
31/7/1993 giờ 22:44:32,1993-07-31
2009-03-19T11:26:06,2009-03-19
19970524170226260584711,1997-05-24
The system recorded 20251013050016,2025-10-13
19910607051757,1991-06-07
19 tháng 4 năm 2019,2019-04-19
2025-08-02T12:23:48,2025-08-02
2023/12/26T233859,2023-12-26
15.10.2016T3-4-59,2016-10-15
29.4.2015T21-44-26,2015-04-29
20000915074700547667076,2000-09-15
20121029102406,2012-10-29
The system recorded 20040531135249,2004-05-31
1994-04-24T08:39:16+2500,1994-04-24
11-03-24,2024-03-11
2017_01_05,2017-01-05
"October 13, 1992",1992-10-13
Sự kiện diễn ra vào 22/1/2001 13:59,2001-01-22
20010320225223078,2001-03-20
19920621022333208335,1992-06-21
2034-08-11T05:01:56+2500,2034-08-11
15 tháng 9 năm 2013,2013-09-15
58-1-2023,2023-01-29
1071507600000000000,2003-12-16
"26th of December, 2027",2027-12-26
10.12.07,2007-12-10
2030-05-28T22:50:38.508746Z,2030-05-28
28/6-2021,2021-03-28
2005-11-21T11:09:19+2500,2005-11-21
ngày 8 tháng 6 năm 2024,2024-06-08
ngày 22 tháng 9 năm 2011,2011-09-22
Sự kiện diễn ra vào 2/4/2035 19:26,2035-04-02
1745427600,2025-04-24
22 tháng 5 năm 2007,2007-05-22
Ngày 10-9-1992,1992-09-10
20000422071414932939,2000-04-22
28 tháng 3 năm 2000,2000-03-28
2023-01-05T06:13:51.701623Z,2023-01-05
21.2.2028T8-52-39,2028-02-21
2010-04-08T01:46:00,2010-04-08
Event at 2008-03-20T19:27:13,2008-03-20
26-11-2004,2004-11-13
19920923130811615,1992-09-23
2018-08-08T20:14:47+2500,2018-08-08
919357200000000,1999-02-19
1497891600,2017-06-20
20-12-2033,2033-12-20
19 tháng 1 năm 2013,2013-01-19
21-12-1994,1994-12-21
"10th of February, 2012",2012-02-10
Sự kiện diễn ra vào 23/3/1993 16:47,1993-03-23
865530000,1997-06-06
24-3-2011,2011-03-12
2007_03_30T15_0_55+07:00,2007-03-30
2005-12-07T09:27:03.622461449Z,2005-12-07
"6th of September, 2019",2019-09-06
9 Jul 2006,2006-07-09
Sự kiện diễn ra vào 10/3/2018 13:49,2018-03-10
2024-09-24T04:14:04Z+3,2024-09-24
2013-10-29,2013-10-29
28_07_29,2029-07-28
2025-06-06T23:59:41.586552098Z,2025-06-06
11/12-2025,2025-06-11
2015-07-10T11:09:56.229793537Z,2015-07-10
The system recorded 20351005180230,2035-10-05
17/11/2023,2023-11-17
3 Nov 2006,2006-11-03
11.25.2015,2015-11-25
2030-11-10T04:48:37+2500,2030-11-10
"5th of July, 2012",2012-07-05
2021-03-11T22:10:58.207862Z,2021-03-11
25/18-2002,2002-09-25
20270219094452085547184,2027-02-19
20291102150125361,2029-11-02
1 tháng 10 năm 2011,2011-10-01
7.9.2009T13-15-54,2009-09-07
2014|12|07,2014-12-07
2011-01-10T04:52:23Z+3,2011-01-10
1812992400000000,2027-06-15
02.08.98,1998-08-02
16 Jan 2021,2021-01-16
Ngày 8-9-2011,2011-09-08
1664125200,2022-09-26
Sự kiện diễn ra vào 14/11/2017 3:26,2017-11-14
2012/08/29,2012-08-29
The system recorded 20330208231251,2033-02-08
20000802091350712,2000-08-02
17_09_24,2024-09-17
2020-04-12T17:52:37+0500,2020-04-12
Event at 1994-12-15T18:43:0,1994-12-15
22 October 2020,2020-10-22
20150128060722868,2015-01-28
07-24-2006,2006-07-24
"23th of December, 2017",2017-12-23
Ngày 2-8-2022,2022-08-02
2004-11-02T07:09:42.591879746Z,2004-11-02
2011/5/26T213533,2011-05-26
20 Sep 2034,2034-09-20
ngày 17 tháng 5 năm 2002,2002-05-17
1991-11-28T05:03:07.270Z,1991-11-28
19 12 31,2031-12-19
1415293200000000,2014-11-07
855766800000000,1997-02-13
2005-07-31T19:54:48.314047541Z,2005-07-31
58-12-2010,2010-12-29
2062342800000000000,2035-05-10
1377709200000,2013-08-29
16_1_2020,2020-01-16
6-12-2005,2005-12-06
The system recorded 19970106220957,1997-01-06
06|01|2025,2025-06-01
20110406045943,2011-04-06
2020/1/8T181557,2020-01-08
4|9|2009,2009-09-04
22.12.2016T6-6-36,2016-12-22
16-5-2018,2018-05-16
02_01_90,1990-01-02
2031-09-25T19:55:32+2500,2031-09-25
1763053200000000000,2025-11-14
Event at 2005-10-28T8:52:27,2005-10-28
Ngày 8-10-2032,2032-10-08
Event at 2026-11-30T7:2:54,2026-11-30
"24th of February, 2021",2021-02-24
"May 31, 1992",1992-05-31
2014-10-23T05:29:41.246681Z,2014-10-23
1992-10-24T22:37:21Z+3,1992-10-24
2029-06-22T01:18:06Z+3,2029-06-22
1990/6/8T201143,1990-06-08
28-12-2007,2007-12-14
"11th of March, 2034",2034-03-11
1994-05-29T17:00:57,1994-05-29
2026-03-31T18:56:16.819Z,2026-03-31
20090203003548289625318,2009-02-03
13 January 2009,2009-01-13
Sự kiện diễn ra vào 13/12/2008 16:51,2008-12-13
7.7.1999T19-0-34,1999-07-07
2030-09-01T08:27:48.261Z,2030-09-01
25 tháng 6 năm 2027,2027-06-25
2025-03-04T19:48:27+2500,2025-03-04
Sự kiện diễn ra vào 17/9/2022 13:7,2022-09-17
19950112050110413,1995-01-12
"January 18, 2027",2027-01-18
10.3.1997T17-58-40,1997-03-10
2001-08-20T19:46:54+2500,2001-08-20
1193331600000000000,2007-10-26
44-6-2035,2035-06-22
Event at 2015-11-20T17:51:59,2015-11-20
1995-01-14T15:38:48,1995-01-14
13 tháng 2 năm 2033,2033-02-13
Ngày 20-7-2033,2033-07-20
1998/2/16T0235,1998-02-16
20151111162731,2015-11-11
2016_05_27,2016-05-27
2030|09|29,2030-09-29
1357232400000000000,2013-01-04
2033/02/10,2033-02-10
20261229113322233711,2026-12-29
1995/08/19,1995-08-19
25 April 2014,2014-04-25
Ngày 19-4-1998,1998-04-19
Event at 2034-03-20T1:45:6,2034-03-20
5/2/2030 giờ 23:51:5,2030-02-05
1576602000000000000,2019-12-18
"29th of August, 2017",2017-08-29
15 tháng 10 năm 2015,2015-10-15
25/18-2029,2029-09-25
1990_12_05,1990-12-05
27 tháng 3 năm 2019,2019-03-27
2015 06 16,2015-06-16
2017_11_24T9_56_26+08,2017-11-24
12_4_2001,2001-04-12
19900920062751666924,1990-09-20
1289926800000000,2010-11-17
19930130035707204,1993-01-30
19980630102546424330,1998-06-30
1995-10-29T08:20:35Z+3,1995-10-29
2033-01-12T10:29:45.283Z,2033-01-12
1998-10-12T23:49:01.791645Z,1998-10-12
"10th of July, 1995",1995-07-10
Event at 2029-01-12T10:49:41,2029-01-12
12 May 2028,2028-05-12
19941124044251829,1994-11-24
2011-06-23T07:08:01+2500,2011-06-23
13/7/2018 giờ 17:44:25,2018-07-13
4 Jan 2019,2019-01-04
2005-12-22T13:28:28.237495006Z,2005-12-22
Sự kiện diễn ra vào 3/9/2003 6:17,2003-09-03
"May 9, 2004",2004-05-09
11/18-2007,2007-09-11
2031-09-16T21:04:02+3,2031-09-16
"16th of June, 2017",2017-06-16
8 tháng 6 năm 1998,1998-06-08
2017-03-02T20:48:07.659480289Z,2017-03-02
1195750800000,2007-11-23
11_16_1999,1999-11-16
1100106000,2004-11-11
18 tháng 5 năm 2005,2005-05-18
1 March 2021,2021-03-01
2027-11-29T09:04:45+2500,2027-11-29
18 November 2024,2024-11-18
2026-12-27T05:45:44+07:00,2026-12-27
"14th of March, 2029",2029-03-14
19.7.1992T1-52-39,1992-07-19
2001/1/6T122011,2001-01-06
21-1-2028,2028-01-21
Sự kiện diễn ra vào 7/4/1993 20:34,1993-04-07
Event at 2017-04-19T17:41:2,2017-04-19
23/9/1994 giờ 5:40:32,1994-09-23
"March 22, 2009",2009-03-22
03_03_06,2006-03-03
2013 11 04,2013-11-04
20290331174320489326,2029-03-31
2034-01-14T21:01:31,2034-01-14
Sự kiện diễn ra vào 2/7/1999 16:19,1999-07-02
2024_11_08T14_49_15-0330,2024-11-08
23.8.2016T8-24-42,2016-08-23
1121965200000000,2005-07-22
20040529225115,2004-05-29
2026-11-27T15:57:58Z+3,2026-11-27
19901028233352668165787,1990-10-28
9 tháng 11 năm 2005,2005-11-09
12/9/1996 giờ 13:34:30,1996-09-12
20150404060113431,2015-04-04
ngày 9 tháng 9 năm 2001,2001-09-09
"January 13, 2033",2033-01-13
1222102800000,2008-09-23
19930130084025812,1993-01-30
30-04-32,2032-04-30
803494800000000,1995-06-19
2019-11-05T08:24:41Z+3,2019-11-05
1340989200000,2012-06-30
4 7 2024,2024-07-04
23.3.2011T18-23-19,2011-03-23
2016-04-17T08:32:16Z+3,2016-04-17
20020913203128,2002-09-13
1290272400000000000,2010-11-21
19910106180157,1991-01-06
20070820015845743,2007-08-20
20110607020143023230,2011-06-07
02-07-08,2008-07-02
2/20-1990,1990-10-02
28 October 2024,2024-10-28
04_10_2001,2001-04-10
2024-08-06T21:29:08,2024-08-06
"December 23, 1995",1995-12-23
29 tháng 7 năm 2000,2000-07-29
1998_12_27,1998-12-27
2019/3/26T153041,2019-03-26
20290110113931650851768,2029-01-10
23/8/2019 giờ 16:48:10,2019-08-23
1017334800,2002-03-29
The system recorded 20350610195033,2035-06-10
26/5/1990 giờ 4:26:9,1990-05-26
2030-07-24T16:25:54,2030-07-24
2010_09_27,2010-09-27
20111023070028162485,2011-10-23
1996-07-13T17:46:48,1996-07-13
19930705081350,1993-07-05
Sự kiện diễn ra vào 25/11/2003 5:32,2003-11-25
1998-03-12T20:57:11+2500,1998-03-12
20320512105226453,2032-05-12
25/8-1990,1990-04-25
20020924013644284,2002-09-24
2002-12-31T10:11:20Z+3,2002-12-31
08|12|12,2012-12-08
2028/8/10T154439,2028-08-10
ngày 26 tháng 5 năm 2026,2026-05-26
"December 20, 2025",2025-12-20
2004_09_30T10_8_5Z+3,2004-09-30
2011-06-12T13:42:09,2011-06-12
"May 7, 2034",2034-05-07
1996-05-07T03:16:21.270268463Z,1996-05-07
14/8-2021,2021-04-14
2027-12-15T02:50:49.668673Z,2027-12-15
ngày 9 tháng 1 năm 2017,2017-01-09
1036429200,2002-11-05
19931213212205496,1993-12-13
09|13|2029,2029-09-13
Ngày 9-9-1991,1991-09-09
16/1/2019 giờ 5:35:49,2019-01-16
4-3-1994,1994-03-04
The system recorded 20130605191900,2013-06-05
2010_12_24T8_29_17+3,2010-12-24
The system recorded 20250819101955,2025-08-19
20041208154135924,2004-12-08
2024-11-03T10:55:18+2500,2024-11-03
877280400,1997-10-20
20180204080520229,2018-02-04
Sự kiện diễn ra vào 13/1/2020 19:6,2020-01-13
24|03|26,2026-03-24
1819299600000000,2027-08-27
20010601220629,2001-06-01
Sự kiện diễn ra vào 20/4/2034 19:43,2034-04-20
20150213134941,2015-02-13
639334800,1990-04-06
1232902800000,2009-01-26
2030-08-31T06:17:21+2500,2030-08-31
1491152400,2017-04-03
Event at 2035-03-16T9:51:32,2035-03-16
1996-10-29T11:57:31+2500,1996-10-29
20090503162857279951,2009-05-03
The system recorded 19921025063648,1992-10-25
2025_05_31T19_44_26+07:00,2025-05-31
1994-07-24T01:59:02.258684Z,1994-07-24
1501174800000000,2017-07-28
Event at 2030-11-03T19:52:3,2030-11-03
1995-04-10T05:01:05.298003Z,1995-04-10
28-5-1993,1993-05-14
"October 20, 2022",2022-10-20
32-2-2020,2020-02-16
2034-07-30T21:40:13,2034-07-30
Sự kiện diễn ra vào 13/9/2022 1:5,2022-09-13
766602000000,1994-04-18
2012-02-22T21:51:59.383616Z,2012-02-22
ngày 23 tháng 1 năm 2024,2024-01-23
1475514000,2016-10-04
1990-05-14T12:17:07Z+3,1990-05-14
ngày 16 tháng 4 năm 2023,2023-04-16
29/12/2025 giờ 21:41:21,2025-12-29
27/10/21,2021-10-27
1620925200,2021-05-14
2005_06_28T17_20_51+00:00,2005-06-28
2009-11-29T07:49:08-05:00,2009-11-29
2001-11-28T14:51:27.433294632Z,2001-11-28
2 Jul 2023,2023-07-02
2011-03-11T01:01:51.804675Z,2011-03-11
20340402234245996,2034-04-02
09 25 2004,2004-09-25
19940624234126288,1994-06-24
2010_03_13T10_57_31+00:00,2010-03-13
4.9.2007T2-36-30,2007-09-04
1996-07-30T13:05:15Z+3,1996-07-30
"3rd of June, 2025",2025-06-03
8/11/2010 giờ 22:53:49,2010-11-08
2002-05-13T04:09:16.338Z,2002-05-13
1834592400000000000,2028-02-20
2027-03-07T16:15:30.740Z,2027-03-07
2033/8/4T225510,2033-08-04
2029-02-21T10:03:51.048Z,2029-02-21
Event at 2023-12-17T22:2:10,2023-12-17
ngày 6 tháng 7 năm 2003,2003-07-06
2023-05-28T22:09:21.012Z,2023-05-28
2033-04-07T08:09:04,2033-04-07
02|17|2027,2027-02-17
1618160400000000000,2021-04-12
9 April 2000,2000-04-09
20241126073648319555073,2024-11-26
2007-07-24T22:50:19.852Z,2007-07-24
The system recorded 20300525111220,2030-05-25
17/12-2020,2020-06-17
19960517045017,1996-05-17
11_12_2007,2007-12-11
Event at 2013-05-27T14:13:46,2013-05-27
2014736400000,2033-11-05
ngày 16 tháng 3 năm 1990,1990-03-16
2017-07-02T02:12:29+2500,2017-07-02
26-5-1992,1992-05-26
3 May 2008,2008-05-03
ngày 7 tháng 9 năm 2031,2031-09-07
"27th of February, 2003",2003-02-27
Sự kiện diễn ra vào 30/11/2032 13:44,2032-11-30
1894208400000,2030-01-10
20290201113052539,2029-02-01
20051217173229154420973,2005-12-17
4 tháng 10 năm 1997,1997-10-04
1105462800000000000,2005-01-12
16 Dec 1998,1998-12-16
13-3-2026,2026-03-13
ngày 28 tháng 3 năm 2035,2035-03-28
2005-12-13T01:38:18-05:00,2005-12-13
14.10.2029T6-10-8,2029-10-14
"16th of November, 1994",1994-11-16
30/5/2028 giờ 10:24:51,2028-05-30
2021|10|02,2021-10-02
17/4/2018,2018-04-17
09_28_2019,2019-09-28
2.2.2033T6-15-59,2033-02-02
1012323600000000,2002-01-30
659552400000000,1990-11-26
1998-11-23T09:10:44.288Z,1998-11-23
"3rd of July, 2023",2023-07-03
03 17 2034,2034-03-17
The system recorded 20150916154439,2015-09-16
Sự kiện diễn ra vào 14/6/1999 23:29,1999-06-14
4-6-2005,2005-06-02
2024-06-18T07:30:42+2500,2024-06-18
1 tháng 2 năm 2023,2023-02-01
23 August 1996,1996-08-23
1657731600000000000,2022-07-14
17.12.2011T17-4-21,2011-12-17
20320312130703122660,2032-03-12
The system recorded 20090325161810,2009-03-25
17 January 1991,1991-01-17
1664989200000,2022-10-06
2020-06-20T02:29:30.249802552Z,2020-06-20
1990-09-09T09:09:59.216935Z,1990-09-09
Ngày 6-3-2032,2032-03-06
19970727172037354,1997-07-27
23/24-1992,1992-12-23
28/12-2002,2002-06-28
19910228121821200,1991-02-28
34-2-2011,2011-02-17
2012-02-24T12:22:09.186967761Z,2012-02-24
1590685200000,2020-05-29
4/8/2026 giờ 3:1:27,2026-08-04
07 07 2016,2016-07-07
1419613200000000000,2014-12-27
Sự kiện diễn ra vào 4/6/1993 2:56,1993-06-04
Ngày 21-9-2019,2019-09-21
2002_04_20T20_43_19-0300,2002-04-20
1044810000,2003-02-10
836586000000000000,1996-07-06
2033917200000000000,2034-06-15
2021-02-27T18:09:26Z+3,2021-02-27
25 tháng 5 năm 2035,2035-05-25
Ngày 10-6-2028,2028-06-10
36-3-2001,2001-03-18
Ngày 24-10-2014,2014-10-24
07|18|1990,1990-07-18
1630083600000,2021-08-28
2012/4/2T91739,2012-04-02
2003/1/28T14577,2003-01-28
20200120041607,2020-01-20
Sự kiện diễn ra vào 15/5/2022 9:2,2022-05-15
1722358800000,2024-07-31
2012-05-27T17:50:00Z+3,2012-05-27
Event at 2012-08-09T6:33:32,2012-08-09
27-11-2004,2004-11-27
6.6.2023T11-3-28,2023-06-06
29 April 1997,1997-04-29
27.5.2018T4-11-45,2018-05-27
1992-06-28T22:01:46Z+3,1992-06-28
Event at 2002-08-04T2:40:59,2002-08-04
1761411600000,2025-10-26
2022-05-13T19:57:55,2022-05-13
8-10-1997,1997-10-04
15 December 2030,2030-12-15
2019_08_10T15_30_8+3,2019-08-10
19950524223755,1995-05-24
1292000400,2010-12-11
2033-03-05T01:33:10Z+3,2033-03-05
20241120060613260294,2024-11-20
2.2.1994,1994-02-02
20280629142151585457,2028-06-29
1664902800000000,2022-10-05
20211016172628557277,2021-10-16
"March 4, 2028",2028-03-04
Ngày 23-3-1990,1990-03-23
"October 28, 2024",2024-10-28
2023_06_14T5_21_33+00:00,2023-06-14
18/9/2001 giờ 2:12:33,2001-09-18
Ngày 13-12-2015,2015-12-13
20320628093022107508136,2032-06-28
20280114172145634,2028-01-14
20310419180520194910664,2031-04-19
2003418000,2033-06-27
13/4-2023,2023-02-13
20071101115231,2007-11-01
20170106040657797,2017-01-06
15 Feb 2032,2032-02-15
2029/7/23T14237,2029-07-23
22.7.1998T11-40-14,1998-07-22
1996-01-06T11:23:50Z+3,1996-01-06
2023-12-04T18:13:32Z+3,2023-12-04
Ngày 6-2-2004,2004-02-06
28 Feb 2003,2003-02-28
20021106141856077407,2002-11-06
1478883600000,2016-11-12
2032-10-26T07:03:35.858485770Z,2032-10-26
2024-05-11T04:43:06,2024-05-11
20001022030134004820,2000-10-22
17.5.2004T8-36-1,2004-05-17
1148058000000,2006-05-20
2021_06_26T1_12_20Z,2021-06-26
20090628183310551,2009-06-28
2015-03-27T03:59:10.109Z,2015-03-27
1798736400000000000,2027-01-01
2023-05-30T12:54:19+2500,2023-05-30
Event at 2012-07-20T13:4:28,2012-07-20
17 Jul 1999,1999-07-17
1317229200000000000,2011-09-29
Sự kiện diễn ra vào 7/7/1991 20:57,1991-07-07
"7th of January, 2003",2003-01-07
9.1.2035T13-2-9,2035-01-09
945795600000000000,1999-12-22
1992-01-10T17:16:25-0300,1992-01-10
1691859600000000000,2023-08-13
15 February 2017,2017-02-15
21-12-2030,2030-12-21
10 Sep 2014,2014-09-10
930330000000000000,1999-06-26
12|27|2030,2030-12-27
2012-09-12T02:30:11+2500,2012-09-12
17-9-2019,2019-09-17
The system recorded 19930403193007,1993-04-03
1532538000000,2018-07-26
20201109102351163040,2020-11-09
2004-03-21T02:00:25.188453Z,2004-03-21
2029-09-08T02:10:34.817Z,2029-09-08
19901219200946745656,1990-12-19
2020-06-27T05:10:50.623002136Z,2020-06-27
2029-07-30T01:11:58.055176Z,2029-07-30
14-12-2012,2012-12-07
5/2-1990,1990-01-05
ngày 29 tháng 12 năm 2022,2022-12-29
20240612110742610758893,2024-06-12
19980811080104173885,1998-08-11
Sự kiện diễn ra vào 21/8/2028 14:0,2028-08-21
1132246800000,2005-11-18
1763571600,2025-11-20
2012|09|16,2012-09-16
19960810094548294391,1996-08-10
2 Feb 2010,2010-02-02
1025110800000,2002-06-27
2034-09-29T14:53:15,2034-09-29
2007-11-23T04:58:56Z+3,2007-11-23
17 9 2002,2002-09-17
1305824400000000,2011-05-20
2032_06_13T16_40_20+07:00,2032-06-13
30/8/2032,2032-08-30
16-7-2014,2014-07-16
2005-07-25T00:23:32+2500,2005-07-25
"October 3, 2012",2012-10-03
2004-12-16T02:12:25.646892Z,2004-12-16
1613322000000000000,2021-02-15
01_07_09,2009-07-01
04-14-1992,1992-04-14
2032-11-29T02:41:02.822068584Z,2032-11-29
2027/8/21T18319,2027-08-21
1296406800000,2011-01-31
7/8-2019,2019-04-07
2005-12-22T16:26:15,2005-12-22
9-11-2021,2021-11-09
18 Jan 1997,1997-01-18
ngày 15 tháng 4 năm 2011,2011-04-15
7 September 2009,2009-09-07
30.1.2025T0-30-16,2025-01-30
20211112004815,2021-11-12
17.1.2027T11-57-53,2027-01-17
1575824400000000,2019-12-09
06|19|1995,1995-06-19
06-29-2021,2021-06-29
11|19|2019,2019-11-19
52-3-1997,1997-03-26
1999-02-04T13:35:15Z+3,1999-02-04
20210717102205616,2021-07-17
Sự kiện diễn ra vào 22/4/2031 0:51,2031-04-22
15/12-2032,2032-06-15
7-1-2022,2022-01-07
19970928094733447244768,1997-09-28
20280124224723,2028-01-24
2027-08-01T03:29:13Z+3,2027-08-01
1993222800,2033-03-01
ngày 6 tháng 4 năm 1994,1994-04-06
Ngày 25-7-2033,2033-07-25
2032-01-14T21:47:59.682863Z,2032-01-14
"22th of May, 1999",1999-05-22
20201104033849507,2020-11-04
6 Apr 2027,2027-04-06
2003-02-20T06:01:11+08,2003-02-20
1766768400000000,2025-12-27
18.2.2022T19-32-11,2022-02-18
Sự kiện diễn ra vào 4/5/2025 7:11,2025-05-04
2014-10-11T06:52:26.123Z,2014-10-11
1345568400000000,2012-08-22
2005/1/10T72227,2005-01-10
10 Aug 2033,2033-08-10
6.1.2022T13-41-52,2022-01-06
12_14_2029,2029-12-14
12-12-1994,1994-12-12
1642784400000000,2022-01-22
1.7.2018T22-16-49,2018-07-01
"January 28, 2031",2031-01-28
The system recorded 20010715125339,2001-07-15
1999-02-09T04:52:56.982569702Z,1999-02-09
2030-07-17T19:52:57Z+3,2030-07-17
20301229063736050919,2030-12-29
2013-02-25T00:47:10,2013-02-25
2001/2/25T92526,2001-02-25
20280219004248134013,2028-02-19
30-7-2014,2014-07-15
2000-09-19T13:17:15,2000-09-19
1814029200,2027-06-27
9|12|1994,1994-12-09
54-7-2013,2013-07-27
19990605045719911416,1999-06-05
"January 7, 2028",2028-01-07
2003-01-05T03:02:57+2500,2003-01-05
2023-12-23T18:01:39.306621573Z,2023-12-23
2035-01-22,2035-01-22
20020607022555,2002-06-07
9.3.1990T22-28-11,1990-03-09
2025-02-10T14:05:51.874912290Z,2025-02-10
2022|06|19,2022-06-19
12/05/92,1992-05-12
11-12-1990,1990-12-11
31 July 2001,2001-07-31
2021-07-04T08:37:05.480244790Z,2021-07-04
24/1/2033 giờ 18:17:17,2033-01-24
27 8 2001,2001-08-27
20181208153623518,2018-12-08
2027-07-11T14:31:11,2027-07-11
04/19/2007,2007-04-19
1181322000000000,2007-06-09
2002-12-05T05:05:37Z+3,2002-12-05
The system recorded 19940807035243,1994-08-07
"June 2, 2032",2032-06-02
20180423183851894989,2018-04-23
1624986000,2021-06-30
19910610113249924,1991-06-10
1997_05_28T10_50_46+07:00,1997-05-28
17.5.2004T15-53-2,2004-05-17
Event at 2017-09-24T2:38:46,2017-09-24
20140818091139161025321,2014-08-18
20070310000821,2007-03-10
23.10.2001T3-13-19,2001-10-23
20201015034957207216,2020-10-15
The system recorded 19940613070538,1994-06-13
2005-11-19T06:23:29,2005-11-19
1863968400000000000,2029-01-25
Event at 1997-03-05T6:35:6,1997-03-05
21/10/2006 giờ 9:40:52,2006-10-21
40-6-2026,2026-06-20
2024/10/6T14167,2024-10-06
15_09_90,1990-09-15
03|10|2033,2033-03-10
1114534800,2005-04-27
22 tháng 6 năm 1992,1992-06-22
13 8 1992,1992-08-13
1675530000000000,2023-02-05
22 tháng 6 năm 2027,2027-06-22
6/3/2008 giờ 0:13:28,2008-03-06
17 December 2012,2012-12-17
9 Jun 2027,2027-06-09
2003-10-06T17:32:42Z+3,2003-10-06
2009.09.20,2009-09-20
1054573200,2003-06-03
24 December 2019,2019-12-24
14 May 1993,1993-05-14
5.2.2013T4-29-48,2013-02-05
"July 26, 2034",2034-07-26
20050911131318,2005-09-11
27-10-2014,2014-10-27
2032-01-26T18:16:58+2500,2032-01-26
2032-11-08T06:01:43Z+3,2032-11-08
2017/8/6T192759,2017-08-06
05/03/2017,2017-05-03
2014-04-07T20:51:24,2014-04-07
1994-11-21T10:28:53Z+3,1994-11-21
1-10-2027,2027-10-01
8-6-2015,2015-06-04
44-9-2015,2015-09-22
20181127200103,2018-11-27
Event at 2022-09-20T14:13:26,2022-09-20
2021-12-04T22:56:18.037030Z,2021-12-04
9 Feb 2010,2010-02-09
42-8-2031,2031-08-21
923331600000000,1999-04-06
1997-02-07T13:52:06.361Z,1997-02-07
2025-09-17T11:28:20.165Z,2025-09-17
1720112400000,2024-07-05
1991_08_12T19_26_23-05:00,1991-08-12
7/6/2029 giờ 1:22:57,2029-06-07
20190518163110463092074,2019-05-18
"October 19, 2006",2006-10-19
2005-10-03T20:45:56.828Z,2005-10-03
9 tháng 6 năm 2030,2030-06-09
The system recorded 20180123004720,2018-01-23
2014-08-08T01:40:52+2500,2014-08-08
10/5/2000,2000-05-10
2016-07-05T22:51:33.630Z,2016-07-05
19980710003959,1998-07-10
1993-10-18T18:11:13.469005959Z,1993-10-18
21 January 2006,2006-01-21
2011/4/21T21953,2011-04-21
1213030800,2008-06-10
20181126014609,2018-11-26
ngày 5 tháng 11 năm 2005,2005-11-05
1419613200000000,2014-12-27
2022 07 15,2022-07-15
2012_01_24T1_56_15+08,2012-01-24
7 tháng 10 năm 2014,2014-10-07
17/9/1994 giờ 6:9:17,1994-09-17
1917104400000000000,2030-10-02
20320120152620312675059,2032-01-20
1/2/1998 giờ 10:36:43,1998-02-01
27-11-2017,2017-11-27
1997-03-28T23:55:53+2500,1997-03-28
Event at 2023-03-22T10:47:58,2023-03-22
1993-01-10T00:54:31.554051503Z,1993-01-10
"21th of January, 2030",2030-01-21
Event at 2017-04-27T16:35:36,2017-04-27
1354986000000000,2012-12-09
20270113164511142259,2027-01-13
2022-12-14T01:44:51,2022-12-14
2-2-2020,2020-02-01
20010622114633717,2001-06-22
2009/7/27T17934,2009-07-27
30 tháng 5 năm 2003,2003-05-30
ngày 13 tháng 9 năm 2028,2028-09-13
1138813200000000000,2006-02-02
54-7-2017,2017-07-27
2028-12-07,2028-12-07
19 Nov 2033,2033-11-19
20151129214931834597310,2015-11-29
The system recorded 20220810204235,2022-08-10
25/12/2027 giờ 10:26:18,2027-12-25
The system recorded 20280111214716,2028-01-11
9/4-2010,2010-02-09
18-12-2015,2015-12-09
20-5-1990,1990-05-20
19901109123930423151,1990-11-09
20020702044512059520881,2002-07-02
2016-04-27T10:42:08.469936Z,2016-04-27
5 tháng 3 năm 2032,2032-03-05
2027-11-01T22:22:42,2027-11-01
Event at 1992-04-30T1:14:58,1992-04-30
The system recorded 20130207072824,2013-02-07
2000/5/18T21231,2000-05-18
965322000,2000-08-04
19960619044612838667355,1996-06-19
20030131024859042341974,2003-01-31
2 Apr 2000,2000-04-02
2010-01-20T05:26:33.497184051Z,2010-01-20
ngày 18 tháng 6 năm 2014,2014-06-18
2002-08-06T05:01:23Z+3,2002-08-06
ngày 23 tháng 4 năm 2017,2017-04-23
1754672400000000000,2025-08-09
2030-12-04T21:00:47+2500,2030-12-04
20330321074721,2033-03-21
9/18-2010,2010-09-09
44-12-2030,2030-12-22
1595696400,2020-07-26
20220101142059652,2022-01-01
10/8/2016 giờ 0:18:48,2016-08-10
19990624181138,1999-06-24
1991-09-12T01:47:14.685297Z,1991-09-12
"6th of May, 2027",2027-05-06
14.5.2029T22-15-19,2029-05-14
ngày 31 tháng 10 năm 2019,2019-10-31
2.1.2023T17-10-22,2023-01-02
2014_06_16T7_20_46+3,2014-06-16
11/27/2002,2002-11-27
2023-03-06T09:45:49,2023-03-06
2021/1/8T19244,2021-01-08
9 Jun 2001,2001-06-09
15/22-2021,2021-11-15
12 3 2005,2005-03-12
20070220214630617319,2007-02-20
The system recorded 20231106035909,2023-11-06
854730000000000000,1997-02-01
"30th of July, 1994",1994-07-30
1/2/2021 giờ 8:25:48,2021-02-01
18/18-1998,1998-09-18
20050301163228300715,2005-03-01
10-5-2000,2000-05-05
20280814213428,2028-08-14
Ngày 28-4-2026,2026-04-28
1808154000000000000,2027-04-20
16 May 1990,1990-05-16
20 tháng 8 năm 2029,2029-08-20
2021-06-05T06:04:19Z+3,2021-06-05
08_12_2001,2001-08-12
20320723124727,2032-07-23
2024-06-30T22:31:07.834748061Z,2024-06-30
"February 17, 1996",1996-02-17
2015-03-06T13:13:50,2015-03-06
29 tháng 6 năm 2021,2021-06-29
Ngày 12-10-2005,2005-10-12
20160730174956,2016-07-30
19931116040015070501,1993-11-16
"September 27, 2002",2002-09-27
1950195600000,2031-10-20
29_07_17,2017-07-29
1513270800000000000,2017-12-15
5 tháng 6 năm 2021,2021-06-05
"June 29, 2008",2008-06-29
Sự kiện diễn ra vào 31/1/1999 1:20,1999-01-31
Sự kiện diễn ra vào 7/10/1996 14:24,1996-10-07
878662800000000000,1997-11-05
760726800000,1994-02-09
2034_11_18T11_9_55Z+3,2034-11-18
8-2-2017,2017-02-08
Sự kiện diễn ra vào 17/3/2021 21:3,2021-03-17
2018-05-17T10:45:13+2500,2018-05-17
2027-02-08T20:05:24.629Z,2027-02-08
7.9.2005T4-20-31,2005-09-07
2010-04-01T05:23:40.450609Z,2010-04-01
"17th of December, 2028",2028-12-17
1996-01-19T22:32:45.253Z,1996-01-19
27 04 24,2024-04-27
2006_01_17T0_18_59+2500,2006-01-17
20321129195941396007,2032-11-29
24|12|32,2032-12-24
2010-07-15T00:13:10+2500,2010-07-15
Event at 1990-10-03T2:3:52,1990-10-03
848250000,1996-11-18
2034_07_22T9_47_11-0300,2034-07-22
"26th of March, 1999",1999-03-26
1998-12-10T09:39:12.087516Z,1998-12-10
19980910212814,1998-09-10
20 December 2009,2009-12-20
1992-03-04T22:40:01.810161Z,1992-03-04
20130313132843823341416,2013-03-13
"5th of November, 2026",2026-11-05
2034-11-03T07:12:55,2034-11-03
30 Apr 2025,2025-04-30
2023-10-06T18:35:27Z+3,2023-10-06
2027 03 18,2027-03-18
8 Jul 2005,2005-07-08
2014-09-14T18:01:19+2500,2014-09-14
2030-04-07T21:56:02+0500,2030-04-07
2001_10_14T1_22_11+00:00,2001-10-14
2035_09_02T7_7_46+07:00,2035-09-02
54-12-1999,1999-12-27
1349715600000000000,2012-10-09
07 23 2000,2000-07-23
1723741200000000,2024-08-16
2005-07-19T23:23:02.284Z,2005-07-19
1997-04-29T07:35:35,1997-04-29
Event at 2018-11-03T10:26:56,2018-11-03
24 05 00,2000-05-24
Event at 2018-05-21T7:3:28,2018-05-21
23_7_1992,1992-07-23
13/11/03,2003-11-13
20070421150936032,2007-04-21
1991|09|22,1991-09-22
2030-12-21T19:37:56Z+3,2030-12-21
1964278800000000000,2032-03-31
20050522064919794,2005-05-22
19 August 2007,2007-08-19
ngày 7 tháng 4 năm 2034,2034-04-07
1/14-1993,1993-07-01
2015-05-20T23:50:53.783651Z,2015-05-20
ngày 13 tháng 7 năm 2031,2031-07-13
20240103082251630669,2024-01-03
Ngày 6-10-2005,2005-10-06
2024-07-19T16:29:00.829Z,2024-07-19
1998-06-08T08:54:35-0330,1998-06-08
ngày 17 tháng 9 năm 2031,2031-09-17
1903626000,2030-04-29
17 Dec 2015,2015-12-17
"10th of March, 2014",2014-03-10
1631379600000000000,2021-09-12
"25th of December, 2032",2032-12-25
2019.06.24,2019-06-24
Ngày 23-6-2022,2022-06-23
Event at 2020-04-17T19:42:22,2020-04-17
742842000000000,1993-07-17
29/12/2030 giờ 18:9:38,2030-12-29
2031-07-05T06:17:36.446288437Z,2031-07-05
The system recorded 19920722230921,1992-07-22
"August 24, 2016",2016-08-24
24-8-2019,2019-08-12
16-6-1993,1993-06-08
28/2/2004 giờ 17:40:36,2004-02-28
ngày 5 tháng 3 năm 2022,2022-03-05
923331600000000,1999-04-06
2010-11-14T18:50:31,2010-11-14
"1st of February, 2018",2018-02-01
11/2-2015,2015-01-11
2011-02-15T13:05:45.000183482Z,2011-02-15
21 tháng 7 năm 2007,2007-07-21
1996-04-09T06:42:20.720047693Z,1996-04-09
"7th of September, 2031",2031-09-07
7 Feb 2034,2034-02-07
29 tháng 12 năm 1993,1993-12-29
2024-03-05T16:48:37.603855209Z,2024-03-05
2028-08-12T14:26:05+2500,2028-08-12
11 tháng 4 năm 2011,2011-04-11
"27th of November, 1991",1991-11-27
20100602190924363,2010-06-02
2011-09-28T20:28:52.435577Z,2011-09-28
2028-02-05T04:36:01+2500,2028-02-05
"July 28, 1996",1996-07-28
2028733200000000000,2034-04-16
20120419014919795426067,2012-04-19
07/08/1999,1999-07-08
30 tháng 6 năm 1999,1999-06-30
"8th of March, 2010",2010-03-08
25-8-2018,2018-08-25
2031-02-11T12:58:40.027Z,2031-02-11
2011-11-01T22:42:58.945755Z,2011-11-01
2000-05-21T18:07:27+2500,2000-05-21
26 May 2011,2011-05-26
2014-01-21T06:03:02.663009Z,2014-01-21
2013.04.04,2013-04-04
2 tháng 1 năm 2019,2019-01-02
20160824214735690,2016-08-24
2010/11/2T75435,2010-11-02
2032-02-05T07:14:00,2032-02-05
24/6/2026,2026-06-24
20011226104357536079875,2001-12-26
4 Apr 1990,1990-04-04
20240522070212238588,2024-05-22
2026-11-01T06:08:45,2026-11-01
Ngày 13-3-2025,2025-03-13
22 Jun 2004,2004-06-22
3/22-2022,2022-11-03
"November 28, 2022",2022-11-28
Event at 2035-07-14T15:14:47,2035-07-14
26/6-2028,2028-03-26
2023-05-15T03:12:22,2023-05-15
20-11-2024,2024-11-20
30 3 2025,2025-03-30
14 tháng 6 năm 2011,2011-06-14
20150625091819013497,2015-06-25
2022_03_14T22_18_33+0500,2022-03-14
Ngày 24-9-2035,2035-09-24
ngày 6 tháng 5 năm 2020,2020-05-06
13-3-1998,1998-03-13
1414947600000,2014-11-03
Event at 2033-04-26T14:27:52,2033-04-26
"April 1, 2009",2009-04-01
1163610000000000000,2006-11-16
1995-08-09T04:10:53.633Z,1995-08-09
11/03/2023,2023-11-03
1768496400000000000,2026-01-16
ngày 12 tháng 9 năm 2022,2022-09-12
2027091600000000000,2034-03-28
1996-07-29T04:24:50,1996-07-29
09|04|95,1995-04-09
18.11.2030T15-22-39,2030-11-18
2014-07-07T13:31:48.121967037Z,2014-07-07
28/24-2007,2007-12-28
16/12/2003 giờ 0:3:52,2003-12-16
2029-04-02T04:02:31Z+3,2029-04-02
Ngày 9-8-2016,2016-08-09
7/4-2004,2004-02-07
1992-04-03T07:56:13.679680Z,1992-04-03
20180423222831417695966,2018-04-23
2017-02-13T03:11:58.895871Z,2017-02-13
20000823011131,2000-08-23
15-7-1999,1999-07-15
ngày 27 tháng 3 năm 2003,2003-03-27
2015-10-16T08:07:36.784495334Z,2015-10-16
Ngày 19-6-1997,1997-06-19
ngày 15 tháng 5 năm 2000,2000-05-15
812998800000000000,1995-10-07
19930713095544718615,1993-07-13
52-1-2019,2019-01-26
870022800000000,1997-07-28
2018/10/27T05459,2018-10-27
15 tháng 4 năm 1993,1993-04-15
1999-07-16T23:03:15.147Z,1999-07-16
2014_06_17T15_40_53+08,2014-06-17
28-4-2012,2012-04-28
14-3-2027,2027-03-14
20150111083941986,2015-01-11
2033_11_26T21_58_29Z,2033-11-26
16.12.91,1991-12-16
19920516151537871,1992-05-16
12-1-2020,2020-01-06
1991/4/8T103439,1991-04-08
1996/3/26T1266,1996-03-26
3/6/2026 giờ 16:44:43,2026-06-03
20070726171627,2007-07-26
1993|05|29,1993-05-29
30-7-2033,2033-07-15
25 10 22,2022-10-25
Event at 2015-04-27T19:50:27,2015-04-27
2016_02_15T4_23_0+07:00,2016-02-15
The system recorded 20190415161252,2019-04-15
1991-07-13T22:49:47.493226Z,1991-07-13
2008-02-02T17:02:00+2500,2008-02-02
"December 2, 2009",2009-12-02
9/6/2030 giờ 3:9:50,2030-06-09
The system recorded 20080414031804,2008-04-14
1976893200000000,2032-08-24
2035-02-19T03:08:55,2035-02-19
The system recorded 19910126113707,1991-01-26
3/16-2004,2004-08-03
20090918115934,2009-09-18
2011-07-20T05:04:17+2500,2011-07-20
17 Feb 2000,2000-02-17
1675530000,2023-02-05
1609866000000000,2021-01-06
Ngày 27-11-2001,2001-11-27
1994/1/4T71514,1994-01-04
Ngày 30-9-2023,2023-09-30
26 tháng 5 năm 1999,1999-05-26
10.24.2024,2024-10-24
10.5.2027T5-20-47,2027-05-10
13-9-1991,1991-09-13
3/12/2001,2001-12-03
27.9.2022,2022-09-27
2025-12-10T22:46:27.426040Z,2025-12-10
841424400000,1996-08-31
2033-12-06T20:50:59.866Z,2033-12-06
1973437200000,2032-07-15
1990-03-14T02:11:02,1990-03-14
Sự kiện diễn ra vào 27/9/2007 15:51,2007-09-27
Event at 2019-03-22T4:28:55,2019-03-22
"11th of February, 2000",2000-02-11
"September 15, 2019",2019-09-15
2006-11-23T10:40:33Z+3,2006-11-23
2014-04-07T03:28:31.252533Z,2014-04-07
1536858000,2018-09-14
21 07 22,2022-07-21
8 tháng 6 năm 2010,2010-06-08
14/7/2026 giờ 7:29:38,2026-07-14
1999-02-08T23:59:17+2500,1999-02-08
1858957200,2028-11-28
16-9-1996,1996-09-16
1991-07-31T19:40:39+3,1991-07-31
8-8-2010,2010-08-08
26-3-2003,2003-03-13
30 Aug 2021,2021-08-30
13 tháng 3 năm 2011,2011-03-13
2 May 2014,2014-05-02
"October 21, 2006",2006-10-21
1528304400000000,2018-06-07
17_6_2021,2021-06-17
27|03|01,2001-03-27
1997.08.24,1997-08-24
1030554000000000000,2002-08-29
5|12|2014,2014-12-05
ngày 27 tháng 3 năm 2005,2005-03-27
2024-07-15T00:15:55Z+3,2024-07-15
2014-12-03T22:15:44.283Z,2014-12-03
2 Nov 2020,2020-11-02
20200724033519599753132,2020-07-24
30/10/2010 giờ 5:17:46,2010-10-30
ngày 10 tháng 8 năm 1993,1993-08-10
30.01.25,2025-01-30
"9th of June, 2006",2006-06-09
1997/4/10T234822,1997-04-10
Ngày 7-8-2019,2019-08-07
20190812154542217521,2019-08-12
09/29/2011,2011-09-29
1995|02|25,1995-02-25
"11th of July, 2032",2032-07-11
1999-09-25T12:05:56,1999-09-25
2_4_2026,2026-04-02
2034/11/24T18356,2034-11-24
2042211600000,2034-09-19
The system recorded 20200915163043,2020-09-15
26 tháng 10 năm 2035,2035-10-26
2017-02-08T19:17:32.908578432Z,2017-02-08
1680886800000,2023-04-08
2000|07|16,2000-07-16
1016211600000000,2002-03-16
2033_08_14T3_14_35+3,2033-08-14
2012-05-09T03:41:21-0300,2012-05-09
1904403600000000,2030-05-08
20170408084505446765,2017-04-08
2016-11-16T20:36:07.584039Z,2016-11-16
2031-11-08T08:28:20.199Z,2031-11-08
11 May 2000,2000-05-11
Ngày 27-1-2032,2032-01-27
2005-12-23T20:48:15.226273Z,2005-12-23
1913216400000,2030-08-18
2034-12-04T14:55:45.181Z,2034-12-04
1878310800000000000,2029-07-10
680720400000,1991-07-29
2029-10-07T04:51:08Z+3,2029-10-07
16/2/2022 giờ 8:27:24,2022-02-16
1232557200000000,2009-01-22
1868374800000000,2029-03-17
12_08_2001,2001-12-08
2010-04-10T09:19:29Z+3,2010-04-10
09_23_2018,2018-09-23
The system recorded 20220221193533,2022-02-21
08_01_28,2028-01-08
Event at 1999-04-30T14:27:14,1999-04-30
22.3.1998T20-36-3,1998-03-22
2002-11-01T07:12:12Z+3,2002-11-01
2013-09-10T14:44:30.052682Z,2013-09-10
1944061200,2031-08-10
23/9/2025 giờ 20:14:34,2025-09-23
2006-10-31T16:25:15-05:00,2006-10-31
1017594000,2002-04-01
ngày 12 tháng 9 năm 1998,1998-09-12
12/7/1994 giờ 20:12:49,1994-07-12
20131016233356435,2013-10-16
2028-07-23T09:06:29Z+3,2028-07-23
Sự kiện diễn ra vào 13/12/2011 14:25,2011-12-13
2006_09_18T19_25_43Z+3,2006-09-18
Sự kiện diễn ra vào 4/5/2026 19:39,2026-05-04
The system recorded 20181003165329,2018-10-03
20250206071256,2025-02-06
2012_12_11T13_45_56-0330,2012-12-11
20250110021131527141738,2025-01-10
2004_11_24T7_20_5+3,2004-11-24
960915600,2000-06-14
1991-06-06T14:36:14+00:00,1991-06-06
22 August 2026,2026-08-22
The system recorded 19930819030357,1993-08-19
1993-11-15T23:59:38.240126616Z,1993-11-15
2029-01-08T08:17:06.439060Z,2029-01-08
7-12-1991,1991-12-07
2016-08-03T01:00:21+2500,2016-08-03
6/3/2003 giờ 18:14:20,2003-03-06
2003-10-09T20:05:43+2500,2003-10-09
1453568400000000,2016-01-24
20070514165419957,2007-05-14
3 May 2027,2027-05-03
12_03_02,2002-03-12
20210519075502,2021-05-19
2035-12-03T08:34:20.733Z,2035-12-03
Ngày 5-5-2009,2009-05-05
1995-03-31T22:50:33Z+3,1995-03-31
20330928145514729,2033-09-28
720637200000000,1992-11-02
05_08_30,2030-08-05
28/2-1995,1995-01-28
20130413101045190132,2013-04-13
ngày 31 tháng 1 năm 2012,2012-01-31
2028-12-21T01:37:32+3,2028-12-21
2033_10_02T18_59_44+0500,2033-10-02
15-9-1990,1990-09-15
2041088400000000000,2034-09-06
1997-06-02T11:20:48.819869425Z,1997-06-02
1990-12-06T02:06:37+2500,1990-12-06
2019-09-07T05:44:56.255656Z,2019-09-07
Ngày 11-4-2031,2031-04-11
1762275600000000000,2025-11-05
1623171600000000,2021-06-09
19970528220500197,1997-05-28
19900430080717271,1990-04-30
4-5-2027,2027-05-02
1003942800000000,2001-10-25
1997-09-01T05:34:14.044691912Z,1997-09-01
Sự kiện diễn ra vào 25/12/2031 10:2,2031-12-25
20070323221019766961,2007-03-23
8-10-2026,2026-10-04
20330523065206,2033-05-23
829242000,1996-04-12
1999-10-03T22:53:10+2500,1999-10-03
Event at 1993-01-27T15:44:51,1993-01-27
20150331113405811670900,2015-03-31
1597251600000000,2020-08-13
The system recorded 20061002074320,2006-10-02
"21th of October, 2006",2006-10-21
1995-01-10T22:42:04Z+3,1995-01-10
2017 04 11,2017-04-11
4.2.2026T14-7-56,2026-02-04
1992-09-23T14:19:01.201604469Z,1992-09-23
2010-02-09T02:33:35Z+3,2010-02-09
2017-12-23T09:56:32.519580Z,2017-12-23
Sự kiện diễn ra vào 25/2/2020 12:59,2020-02-25
"December 24, 2005",2005-12-24
1/10/1997 giờ 20:42:29,1997-10-01
1346259600000000,2012-08-30
9/12/2015 giờ 13:33:22,2015-12-09
19920106013335318536860,1992-01-06
2035/3/8T65610,2035-03-08
Sự kiện diễn ra vào 17/12/1999 19:17,1999-12-17
"August 22, 2017",2017-08-22
13_3_2004,2004-03-13
20111026031733921,2011-10-26
Sự kiện diễn ra vào 28/7/1998 2:42,1998-07-28
ngày 3 tháng 5 năm 2028,2028-05-03
6 August 2022,2022-08-06
Ngày 19-10-1991,1991-10-19
12-31-1999,1999-12-31
2007 07 25,2007-07-25
10 October 2022,2022-10-10
2028-11-16T18:38:35.869855972Z,2028-11-16
40-11-2031,2031-11-20
3.4.2016T12-6-19,2016-04-03
Sự kiện diễn ra vào 17/1/2010 0:36,2010-01-17
4.7.2017T19-22-8,2017-07-04
"January 20, 2007",2007-01-20
Sự kiện diễn ra vào 17/10/2011 21:31,2011-10-17
06/04/98,1998-04-06
20110904044840030834968,2011-09-04
2000-03-28T02:54:10,2000-03-28
20300717100937625767271,2030-07-17
661280400000000,1990-12-16
14 Dec 2002,2002-12-14
2000-11-24T02:44:15+2500,2000-11-24
2021-09-01T02:43:55,2021-09-01
17/4/1997 giờ 16:33:37,1997-04-17
"10th of July, 2008",2008-07-10
Ngày 9-2-2015,2015-02-09
2003-05-20T06:28:07+2500,2003-05-20
Event at 2017-11-01T19:10:39,2017-11-01
Ngày 30-5-1997,1997-05-30
3/12-2030,2030-06-03
669920400,1991-03-26
Event at 2002-11-02T1:4:36,2002-11-02
1625504400000000,2021-07-06
2005-01-07T08:33:56Z+3,2005-01-07
2006-07-16T23:37:26Z+3,2006-07-16
20140629100617021,2014-06-29
2027-12-09T21:13:30,2027-12-09
20171224101748086,2017-12-24
1395334800,2014-03-21
19980705113823575,1998-07-05
31 tháng 8 năm 1993,1993-08-31
20260914031113,2026-09-14
5-1-2006,2006-01-05
812480400,1995-10-01
Sự kiện diễn ra vào 14/1/2027 0:0,2027-01-14
2023_03_15T20_30_41Z,2023-03-15
31-1-2002,2002-01-31
20131116162018268095,2013-11-16
The system recorded 20030829063411,2003-08-29
23-3-1998,1998-03-23
1181235600000000,2007-06-08
The system recorded 20151221094704,2015-12-21
The system recorded 20330318143922,2033-03-18
2007-04-26T18:25:54.031857213Z,2007-04-26
1211389200000,2008-05-22
30/10-2016,2016-05-30
16.5.2002T6-39-0,2002-05-16
2028/2/5T234527,2028-02-05
20240422230319,2024-04-22
2034.03.31,2034-03-31
19931023232325155,1993-10-23
7|12|1996,1996-12-07
2000-04-11T11:26:31.389369883Z,2000-04-11
22-9-2000,2000-09-11
20031029160424668,2003-10-29
Ngày 1-11-2005,2005-11-01
2-1-2032,2032-01-02
18-8-2018,2018-08-09
2031/04/05,2031-04-05
29/8-2014,2014-04-29
2018-05-21T14:34:18.793553Z,2018-05-21
20341008034051144,2034-10-08
2000-08-30T01:28:51.836830Z,2000-08-30
Ngày 2-1-2002,2002-01-02
23-1-2002,2002-01-23
2023-04-10T03:12:18.971Z,2023-04-10
20200221172622281,2020-02-21
07 02 29,2029-02-07
The system recorded 20190203171210,2019-02-03
ngày 10 tháng 1 năm 2018,2018-01-10
2010-04-23T13:54:32-05:00,2010-04-23
Event at 1992-07-01T17:18:26,1992-07-01
19931106065554,1993-11-06
12_26_2002,2002-12-26
1993-05-15T22:48:49+08,1993-05-15
20270531204359142,2027-05-31
03/15/2021,2021-03-15
1952096400000000000,2031-11-11
"30th of May, 2011",2011-05-30
ngày 29 tháng 4 năm 2028,2028-04-29
1422982800000,2015-02-04
12 20 2017,2017-12-20
2019-07-27T15:22:03.629312853Z,2019-07-27
"25th of June, 2004",2004-06-25
Ngày 27-9-2032,2032-09-27
2019-09-14T20:41:54.714Z,2019-09-14
24/4-1994,1994-02-24
7|3|1993,1993-03-07
18-9-1991,1991-09-18
20080112141007440911,2008-01-12
30 Jun 2033,2033-06-30
24.5.2022,2022-05-24
1995-06-05T00:39:32.930Z,1995-06-05
20050413044002081144,2005-04-13
1999-08-27T21:29:07.497789Z,1999-08-27
ngày 29 tháng 4 năm 2008,2008-04-29
Event at 2012-07-09T4:17:37,2012-07-09
"November 8, 2000",2000-11-08
The system recorded 20020617105352,2002-06-17
2020-04-04T18:05:11.467835Z,2020-04-04
2004-03-10T20:15:13.670422Z,2004-03-10
20031209053743539,2003-12-09
1426525200000000,2015-03-17
1172682000000,2007-03-01
26 July 2020,2020-07-26
2001-11-13T04:53:53+07:00,2001-11-13
797014800000000000,1995-04-05
The system recorded 19991103175245,1999-11-03
2026_10_17T12_42_56-0300,2026-10-17
19 tháng 9 năm 2028,2028-09-19
ngày 8 tháng 6 năm 2025,2025-06-08
11.10.2029T20-34-19,2029-10-11
20110415134645914259210,2011-04-15
2027|07|02,2027-07-02
2001-05-16,2001-05-16
"July 16, 2034",2034-07-16
2023-09-04T12:02:35.411543403Z,2023-09-04
20290807171043164446748,2029-08-07
23-1-1998,1998-01-23
1156525200,2006-08-26
26|11|19,2019-11-26
21/1/1996,1996-01-21
1999-11-05T06:19:26.806589Z,1999-11-05
1549386000000,2019-02-06
15/5/2017,2017-05-15
ngày 3 tháng 5 năm 2014,2014-05-03
30-11-2009,2009-11-30
20300829011719,2030-08-29
12 10 1990,1990-10-12
1998-04-12T04:50:14.455Z,1998-04-12
19970318192438,1997-03-18
18-10-97,1997-10-18
1991/5/14T205616,1991-05-14
12.03.2031,2031-12-03
"January 16, 2009",2009-01-16
20090618194808056187862,2009-06-18
"21th of November, 2016",2016-11-21
2009-06-14T14:32:24.281967645Z,2009-06-14
9 Jun 2027,2027-06-09
10 Apr 2010,2010-04-10
"18th of September, 2023",2023-09-18
27/9/2034 giờ 9:11:30,2034-09-27
1930323600000000,2031-03-04
20050509123021,2005-05-09
"15th of December, 2022",2022-12-15
Sự kiện diễn ra vào 23/10/2001 5:6,2001-10-23
46-8-2006,2006-08-23
21.8.2014T2-51-8,2014-08-21
20170726103411310,2017-07-26
2031/7/17T17146,2031-07-17
2009-08-06T02:18:10,2009-08-06
ngày 16 tháng 7 năm 2022,2022-07-16
1/24-2016,2016-12-01
2008-10-01T21:08:20,2008-10-01
The system recorded 20290819095755,2029-08-19
31 March 2014,2014-03-31
2006/5/31T212836,2006-05-31
"September 17, 2015",2015-09-17
20011127003055623361,2001-11-27
2007-09-24T19:03:53.166Z,2007-09-24
2017-04-10T06:10:35.473Z,2017-04-10
2005-06-08T06:01:53+2500,2005-06-08
1993/12/5T104543,1993-12-05
1043514000000000000,2003-01-26
"5th of June, 2035",2035-06-05
14.2.2001T10-59-6,2001-02-14
09.08.07,2007-08-09
2024/6/2T54028,2024-06-02
20210414174156492128957,2021-04-14
16/12-1993,1993-06-16
903027600000000,1998-08-14
5.9.2030T20-56-49,2030-09-05
1841245200,2028-05-07
2011-02-20T18:53:35.829694Z,2011-02-20
ngày 15 tháng 4 năm 1999,1999-04-15
Ngày 28-4-2027,2027-04-28
20290529010115,2029-05-29
The system recorded 20031118203704,2003-11-18
5-12-1997,1997-12-05
44-11-1995,1995-11-22
1048179600000000000,2003-03-21
18/7/2003 giờ 4:15:0,2003-07-18
ngày 10 tháng 6 năm 2013,2013-06-10
1999-09-20T13:27:04+2500,1999-09-20
26.8.2011T16-11-28,2011-08-26
1995|11|21,1995-11-21
750963600000,1993-10-19
2004-01-09T02:24:30.507Z,2004-01-09
19950712082144,1995-07-12
1115226000,2005-05-05
2029 08 15,2029-08-15
12-5-1994,1994-05-12
2005/5/21T42417,2005-05-21
The system recorded 19940828185241,1994-08-28
04-02-2031,2031-04-02
16-6-2021,2021-06-16
1266598800000000000,2010-02-20
08|09|02,2002-09-08
2 March 2018,2018-03-02
24 tháng 7 năm 2023,2023-07-24
The system recorded 20250526031856,2025-05-26
1991-01-20T22:12:43+0500,1991-01-20
2002/4/9T15733,2002-04-09
1944925200000,2031-08-20
1995-12-16T04:11:02.731Z,1995-12-16
20050408210438054,2005-04-08
Sự kiện diễn ra vào 2/5/2012 11:52,2012-05-02
2003-05-19T17:36:15.359Z,2003-05-19
"6th of October, 1998",1998-10-06
1068483600000000000,2003-11-11
2000/9/12T181150,2000-09-12
2018/8/29T184112,2018-08-29
20191207051518891,2019-12-07
1998|10|02,1998-10-02
1992-11-24T02:13:34.617320Z,1992-11-24
25-09-10,2010-09-25
1-9-2021,2021-09-01
2013-11-04T02:27:59+00:00,2013-11-04
30 Aug 1999,1999-08-30
24-1-2019,2019-01-24
"April 9, 2006",2006-04-09
Event at 1995-02-06T1:35:6,1995-02-06
1543683600000000000,2018-12-02
2025_08_29T16_15_4Z,2025-08-29
20050920213709419079325,2005-09-20
Event at 2003-03-14T9:58:49,2003-03-14
2006/12/27T13242,2006-12-27
"20th of October, 2009",2009-10-20
7-5-2032,2032-05-07
52-12-2002,2002-12-26
20200127154714118976312,2020-01-27
40-1-2022,2022-01-20
5 Apr 1995,1995-04-05
27 tháng 5 năm 2026,2026-05-27
Ngày 9-8-2033,2033-08-09
1519750800000,2018-02-28
2001-12-10T09:29:08.486Z,2001-12-10
2031-10-23T18:32:01-0300,2031-10-23
2006-10-02,2006-10-02
20050413124947,2005-04-13
2031-09-04T09:16:58.508Z,2031-09-04
2014/7/29T151913,2014-07-29
"October 19, 1993",1993-10-19
2033/4/30T135147,2033-04-30
2007-08-05T08:22:30+2500,2007-08-05
2033-10-18T02:04:34+2500,2033-10-18
30/11/2023 giờ 7:9:43,2023-11-30
2019/7/16T2336,2019-07-16
"23th of December, 1993",1993-12-23
4 Jun 2005,2005-06-04
1246035600000000,2009-06-27
The system recorded 20181226024041,2018-12-26
"June 23, 2017",2017-06-23
20250507210559471975357,2025-05-07
20250515092127043365,2025-05-15
2006/3/19T11414,2006-03-19
2054221200000000000,2035-02-05
2026-12-05T21:40:10.822Z,2026-12-05
Sự kiện diễn ra vào 8/8/2005 2:52,2005-08-08
"7th of February, 2005",2005-02-07
6.3.2017T13-0-3,2017-03-06
20040520145300980141,2004-05-20
Sự kiện diễn ra vào 15/7/2027 10:49,2027-07-15
2014-01-01T22:56:01.501Z,2014-01-01
"March 31, 2026",2026-03-31
14 tháng 5 năm 2018,2018-05-14
Sự kiện diễn ra vào 5/12/2015 15:19,2015-12-05
Ngày 8-6-2028,2028-06-08
"October 27, 2009",2009-10-27
2001_09_16T19_21_13+2500,2001-09-16
ngày 1 tháng 4 năm 1992,1992-04-01
8 September 2026,2026-09-08
2010.08.03,2010-08-03
12.8.2007T10-14-37,2007-08-12
1685552400000000,2023-06-01
1783616400000000,2026-07-10
1091466000000,2004-08-03
1791133200,2026-10-05
20220413233612092957498,2022-04-13
698864400000,1992-02-24
2006-12-16T16:18:37.862751064Z,2006-12-16
2016-06-26T03:50:23+2500,2016-06-26
"9th of April, 2013",2013-04-09
20040907135422,2004-09-07
20180609051534435,2018-06-09
20081125221753292,2008-11-25
17.08.91,1991-08-17
2014-10-28T03:33:26.339Z,2014-10-28
20020423145305392529885,2002-04-23
1700499600000000,2023-11-21
2013-03-20T02:18:38Z+3,2013-03-20
10 Jan 2018,2018-01-10
20100910111212,2010-09-10
19940328150606204092835,1994-03-28
2011-06-16T10:35:29,2011-06-16
Sự kiện diễn ra vào 12/5/2005 19:15,2005-05-12
2003-08-06T00:13:56.428726Z,2003-08-06
20140810024917287,2014-08-10
The system recorded 20100703091059,2010-07-03
1866301200000000000,2029-02-21
Sự kiện diễn ra vào 4/1/2011 6:29,2011-01-04
710701200000000000,1992-07-10
Sự kiện diễn ra vào 4/9/2023 13:20,2023-09-04
ngày 18 tháng 4 năm 2010,2010-04-18
19-9-2019,2019-09-19
02|10|2000,2000-02-10
2030-05-30T01:09:52.005418Z,2030-05-30
1434301200000000000,2015-06-15
2032-03-02T06:37:38,2032-03-02
2016-07-25T08:08:12,2016-07-25
2020-01-27T19:50:09.681Z,2020-01-27
2026/10/17T19026,2026-10-17
27-2-1997,1997-02-27
22-1-2002,2002-01-22
2013-10-03T06:21:21+2500,2013-10-03
08/23/2006,2006-08-23
06/24/1994,1994-06-24
15 tháng 8 năm 2003,2003-08-15
2032-10-14T14:35:49,2032-10-14
1766250000,2025-12-21
ngày 18 tháng 8 năm 2010,2010-08-18
20130203205758446733597,2013-02-03
20320503001641,2032-05-03
2/5/2000 giờ 8:40:33,2000-05-02
38-2-1990,1990-02-19
1459616400000,2016-04-03
1 October 2017,2017-10-01
2015-02-09T18:24:03+2500,2015-02-09
1997-12-20T04:13:44.684724Z,1997-12-20
The system recorded 20080805035502,2008-08-05
1129741200000,2005-10-20
1995_11_26,1995-11-26
2011/12/9T215024,2011-12-09
1993-05-03T01:28:21.997535Z,1993-05-03
20150328002046,2015-03-28
19981228020747557010,1998-12-28
2053270800000000000,2035-01-25
2024_02_28T20_37_3+08,2024-02-28
1615395600000000,2021-03-11
ngày 24 tháng 11 năm 1992,1992-11-24
9 December 2012,2012-12-09
Ngày 27-3-2018,2018-03-27
38-10-2009,2009-10-19
2025-01-23T08:28:39+2500,2025-01-23
1996_09_17T15_55_54Z+3,1996-09-17
Ngày 17-2-2027,2027-02-17
1439744400000000000,2015-08-17
34-10-1994,1994-10-17
5 May 1994,1994-05-05
6/16-2033,2033-08-06
9/5/2006 giờ 2:10:5,2006-05-09
Event at 2018-10-01T11:15:32,2018-10-01
2022-08-24T15:03:49.960799Z,2022-08-24
9 September 2011,2011-09-09
20290426093809513391,2029-04-26
2035-02-23T06:43:10.652093Z,2035-02-23
2032-12-20T03:22:57+0500,2032-12-20
2019_11_24T3_45_43+2500,2019-11-24
1408294800,2014-08-18
19-5-2013,2013-05-19
ngày 14 tháng 5 năm 2000,2000-05-14
20080708111130218647,2008-07-08
17 3 2013,2013-03-17
796755600000000,1995-04-02
699814800000,1992-03-06
"December 27, 1997",1997-12-27
20201011085630,2020-10-11
2007/3/13T234510,2007-03-13
ngày 25 tháng 5 năm 2020,2020-05-25
1249578000000000,2009-08-07
20091009144806737107,2009-10-09
1142269200,2006-03-14
20040322215122532146,2004-03-22
Event at 2028-12-31T22:37:57,2028-12-31
20340819013850816642,2034-08-19
ngày 30 tháng 11 năm 2033,2033-11-30
30/08/26,2026-08-30
1042995600000000,2003-01-20
Sự kiện diễn ra vào 26/12/2023 11:52,2023-12-26
15/06/13,2013-06-15
2008-07-03T20:16:02,2008-07-03
12 Jul 2027,2027-07-12
7/10-2022,2022-05-07
2026|05|15,2026-05-15
20150812095336,2015-08-12
5 7 2034,2034-07-05
2001-01-29T10:59:39.459Z,2001-01-29
20210306054040762,2021-03-06
16/10-2000,2000-05-16
23/12/1995 giờ 0:43:14,1995-12-23
10/8-2002,2002-04-10
29_05_07,2007-05-29
2001/9/9T73130,2001-09-09
3/10/1996 giờ 23:56:35,1996-10-03
20030430131719150704,2003-04-30
"6th of November, 2012",2012-11-06
27 Feb 1998,1998-02-27
The system recorded 20000304181624,2000-03-04
2006-11-05T11:04:58.453Z,2006-11-05
42-7-2010,2010-07-21
19980220173502515,1998-02-20
15-1-1998,1998-01-15
20080124031712711,2008-01-24
2021 04 09,2021-04-09
1918054800,2030-10-13
Ngày 4-3-1995,1995-03-04
Sự kiện diễn ra vào 27/12/2028 10:6,2028-12-27
1321722000000000000,2011-11-20
1997-10-06T05:26:58,1997-10-06
Ngày 3-11-2030,2030-11-03
2028-04-28T11:35:37.446076495Z,2028-04-28
1995-08-15T13:55:24.313Z,1995-08-15
25.9.2031T6-12-10,2031-09-25
ngày 31 tháng 5 năm 2001,2001-05-31
09_15_2008,2008-09-15
742150800000000000,1993-07-09
2001-07-31T08:33:57.256887Z,2001-07-31
1019754000000000000,2002-04-26
20230601171113921877646,2023-06-01
Ngày 17-3-2029,2029-03-17
Ngày 16-8-2033,2033-08-16
20310215025630446802,2031-02-15
19951017021115071,1995-10-17
28 tháng 3 năm 2008,2008-03-28
Event at 2027-03-16T19:46:32,2027-03-16
27 tháng 10 năm 2016,2016-10-27
2002-05-11T10:50:47-0330,2002-05-11
Ngày 16-4-2019,2019-04-16
1369069200000000000,2013-05-21
8 Apr 1995,1995-04-08
"August 25, 1998",1998-08-25
13/22-2019,2019-11-13
The system recorded 20240921223642,2024-09-21
1745600400000000000,2025-04-26
20351030162724904664386,2035-10-30
ngày 5 tháng 6 năm 2011,2011-06-05
"6th of August, 2018",2018-08-06
2008_08_12T20_46_12+2500,2008-08-12
2007-07-08T06:50:22.966753Z,2007-07-08
24-10-2003,2003-10-12
2020/12/15T94627,2020-12-15
1227459600000000,2008-11-24
"April 25, 2014",2014-04-25
Ngày 23-1-2030,2030-01-23
"26th of September, 1998",1998-09-26
2026-11-12T11:35:38.382119Z,2026-11-12
20090320120932,2009-03-20
4-11-1994,1994-11-04
20030428211616,2003-04-28
20120728000559414,2012-07-28
2035-01-26T07:18:39Z+3,2035-01-26
32-9-2007,2007-09-16
916765200000000000,1999-01-20
2011-05-12T21:22:22+2500,2011-05-12
2016-10-17T15:24:46,2016-10-17
20111019120729149,2011-10-19
Sự kiện diễn ra vào 29/1/2010 11:14,2010-01-29
2017-02-10T01:53:48.625583Z,2017-02-10
2006/09/19,2006-09-19
04_20_1992,1992-04-20
1590858000000000,2020-05-31
20121006024254758,2012-10-06
Sự kiện diễn ra vào 10/3/2015 13:5,2015-03-10
1996/11/26T171214,1996-11-26
2009-03-26T03:10:42.859192Z,2009-03-26
ngày 9 tháng 2 năm 2002,2002-02-09
2005-12-11T00:37:31.881201Z,2005-12-11
24 tháng 8 năm 2028,2028-08-24
"August 17, 2013",2013-08-17
The system recorded 20000825062115,2000-08-25
"August 8, 2015",2015-08-08
20070113214435450937975,2007-01-13
2031_03_18T23_9_26+2500,2031-03-18
20291219131149111499653,2029-12-19
2011-01-29T07:31:00.105608094Z,2011-01-29
Sự kiện diễn ra vào 1/6/2017 11:39,2017-06-01
42-10-2002,2002-10-21
Event at 2014-04-11T18:24:11,2014-04-11
23/18-2023,2023-09-23
19980422213730016281959,1998-04-22
1366131600,2013-04-17
888858000,1998-03-03
2014/1/23T14947,2014-01-23
2070723600000000,2035-08-15
23 tháng 10 năm 2011,2011-10-23
"May 30, 2006",2006-05-30
28-05-27,2027-05-28
50-1-1991,1991-01-25
1189098000000000000,2007-09-07
20130920072148,2013-09-20
"2nd of February, 1994",1994-02-02
2014/2/15T173146,2014-02-15
12-24-1997,1997-12-24
20341213151231556,2034-12-13
2005-06-19T21:38:59,2005-06-19
2013-05-05T15:20:32+08,2013-05-05
2000-09-21T04:33:18.659147785Z,2000-09-21
16-10-2035,2035-10-08
1994-06-13T02:48:08Z+3,1994-06-13
1102870800000000000,2004-12-13
2026-05-07T01:12:38.021018280Z,2026-05-07
20 tháng 2 năm 2001,2001-02-20
The system recorded 20030107115535,2003-01-07
29 tháng 7 năm 1990,1990-07-29
2031-01-16T18:17:35Z,2031-01-16
1231952400000,2009-01-15
1047488400000000,2003-03-13
2038755600000000000,2034-08-10
13/5/2011 giờ 8:13:22,2011-05-13
2002-05-16T23:15:07Z+3,2002-05-16
2012-02-14T18:46:20,2012-02-14
15 Sep 2006,2006-09-15
20240826095743194,2024-08-26
2017-10-25T12:16:49.095502Z,2017-10-25
2015_06_05T15_20_11-05:00,2015-06-05
4.9.2023T0-45-0,2023-09-04
7/11/2027,2027-11-07
19941206161433410,1994-12-06
Ngày 13-1-2034,2034-01-13
2012-10-19T11:00:25,2012-10-19
2010.12.23,2010-12-23
1499187600000000,2017-07-05
3-7-2016,2016-07-03
20060326091807802738251,2006-03-26
20/11/2031 giờ 3:6:58,2031-11-20
2026_06_24T5_13_34+3,2026-06-24
2009-01-13T00:13:39+2500,2009-01-13
1986397200000000,2032-12-12
2020-11-17T20:48:44,2020-11-17
2 Mar 2016,2016-03-02
Sự kiện diễn ra vào 15/1/2028 5:59,2028-01-15
20220331065255,2022-03-31
17-7-2002,2002-07-17
15 tháng 5 năm 2003,2003-05-15
1622998800000000,2021-06-07
"16th of January, 2029",2029-01-16
2031/8/4T104715,2031-08-04
2026-09-10T00:53:36+2500,2026-09-10
8/4-2025,2025-02-08
1866301200000000000,2029-02-21
2027-01-05T03:56:51+2500,2027-01-05
10 tháng 7 năm 1997,1997-07-10
17/24-2005,2005-12-17
2002-11-09T03:07:50,2002-11-09
8-12-2020,2020-12-04
1993_02_13T4_52_25+2500,1993-02-13
"March 29, 1992",1992-03-29
Event at 2001-07-28T13:41:22,2001-07-28
"26th of March, 1990",1990-03-26
895942800000,1998-05-24
30 Sep 2021,2021-09-30
1375635600000000000,2013-08-05
"26th of January, 1998",1998-01-26
1996-02-20T16:21:00.333173Z,1996-02-20
1756486800000,2025-08-30
2027-10-10T15:02:49.879714Z,2027-10-10
2001-11-05T18:30:04,2001-11-05
1990 08 07,1990-08-07
20340729092335897,2034-07-29
Event at 2014-08-12T21:0:31,2014-08-12
34-5-2018,2018-05-17
1991-12-21T11:09:25.371Z,1991-12-21
1991-08-12T20:48:49.076Z,1991-08-12
28-6-1998,1998-06-14
2023-10-31T23:57:44.246188895Z,2023-10-31
2034-01-16T08:37:28.907226Z,2034-01-16
1193418000,2007-10-27
2035/01/19,2035-01-19
Sự kiện diễn ra vào 5/5/2026 3:19,2026-05-05
9 December 2020,2020-12-09
12-05-25,2025-05-12
2008-10-09T22:10:56+0500,2008-10-09
20300128084627138317860,2030-01-28
20250217174222860,2025-02-17
20050306151244875825355,2005-03-06
2007/9/4T111649,2007-09-04
1801242000,2027-01-30
Event at 2016-02-03T0:9:33,2016-02-03
1638464400000000000,2021-12-03
991933200000000,2001-06-08
2035-03-01T02:33:43.127890Z,2035-03-01
1824138000000,2027-10-22
2000-07-26T22:36:23.388663Z,2000-07-26
2031-06-15T19:26:11,2031-06-15
1308416400000000,2011-06-19
2025.10.25,2025-10-25
969642000,2000-09-23
19960830033107667,1996-08-30
44-6-1997,1997-06-22
2014-06-01T16:24:26+00:00,2014-06-01
20 Nov 2026,2026-11-20
Ngày 4-6-2033,2033-06-04
10/4/2027 giờ 19:32:35,2027-04-10
44-2-2011,2011-02-22
Event at 2010-05-13T4:32:12,2010-05-13
12/20-1991,1991-10-12
Ngày 31-8-1999,1999-08-31
20280131133517162176,2028-01-31
Event at 2004-10-05T22:6:25,2004-10-05
1393952400,2014-03-05
20350626033538425154781,2035-06-26
31-3-2012,2012-03-31
1990-09-13T17:56:35.028252Z,1990-09-13
17_07_05,2005-07-17
21/14-2021,2021-07-21
679424400000,1991-07-14
17/18-2024,2024-09-17
26-3-2000,2000-03-26
2003.09.30,2003-09-30
03/17/2007,2007-03-17
2021-08-03T10:42:00.030258Z,2021-08-03
8/12/2019 giờ 4:30:0,2019-12-08
13/4-2016,2016-02-13
23|7|1999,1999-07-23
2000-01-06T19:51:14+3,2000-01-06
2029-05-25T02:44:25,2029-05-25
2030-09-16T06:32:16,2030-09-16
54-8-2027,2027-08-27
2010-08-19T21:50:50.389361Z,2010-08-19
2007-04-04T12:25:01+07:00,2007-04-04
652122000000,1990-09-01
"May 2, 1992",1992-05-02
"February 20, 1996",1996-02-20
08|21|2026,2026-08-21
"2nd of January, 2030",2030-01-02
03_10_29,2029-10-03
1702573200,2023-12-15
Ngày 5-9-2015,2015-09-05
20331106161323178,2033-11-06
896720400000000,1998-06-02
1996-05-28T20:10:55.415Z,1996-05-28
18/6/2013 giờ 2:32:31,2013-06-18
2016-02-17,2016-02-17
1259082000000000,2009-11-25
2004-01-03T21:48:51,2004-01-03
25|05|01,2001-05-25
12/8/1994 giờ 12:50:40,1994-08-12
Event at 2022-03-13T11:53:49,2022-03-13
2 Dec 2023,2023-12-02
14.9.2007T17-40-47,2007-09-14
19990530183939191,1999-05-30
12 January 2018,2018-01-12
6-12-2006,2006-12-06
11_25_2008,2008-11-25
"21th of September, 2004",2004-09-21
05.09.11,2011-09-05
The system recorded 20310221212350,2031-02-21
25 tháng 5 năm 2031,2031-05-25
4 tháng 7 năm 2013,2013-07-04
60-7-1990,1990-07-30
31|10|30,2030-10-31
Sự kiện diễn ra vào 9/3/2032 0:0,2032-03-09
1598547600000000,2020-08-28
20.12.2021T7-55-50,2021-12-20
2012.09.07,2012-09-07
2023_01_09T22_18_9+08,2023-01-09
2003-06-20T06:40:03+2500,2003-06-20
20250529132311,2025-05-29
2006-11-04T08:56:25,2006-11-04
"11th of April, 2002",2002-04-11
27-01-16,2016-01-27
2007_10_01T16_23_12+0500,2007-10-01
The system recorded 20061213193833,2006-12-13
894214800,1998-05-04
20240217010220222,2024-02-17
2030/6/22T194627,2030-06-22
09|30|2009,2009-09-30
Sự kiện diễn ra vào 14/12/2000 2:28,2000-12-14
22|01|12,2012-01-22
Event at 2012-02-11T14:18:17,2012-02-11
2007-12-18T20:07:36Z+3,2007-12-18
2012-04-03T05:19:51Z+3,2012-04-03
The system recorded 20090923045446,2009-09-23
28/11/2024 giờ 20:20:26,2024-11-28
2028_04_26T4_14_50+08,2028-04-26
2024-09-13T08:09:24.430291288Z,2024-09-13
20140722033532302541,2014-07-22
"August 28, 2011",2011-08-28
The system recorded 20111005235832,2011-10-05
19960730045420,1996-07-30
19 tháng 9 năm 2033,2033-09-19
1637859600,2021-11-26
2034_06_21T18_11_37Z,2034-06-21
25.12.2022T22-46-18,2022-12-25
ngày 13 tháng 6 năm 1991,1991-06-13
1708189200000000000,2024-02-18
1936976400000,2031-05-20
02|21|1990,1990-02-21
19/22-1991,1991-11-19
6.9.1995T23-31-37,1995-09-06
16/6-1990,1990-03-16
ngày 20 tháng 9 năm 2023,2023-09-20
936637200000,1999-09-07
2018 01 15,2018-01-15
29 tháng 11 năm 2007,2007-11-29
22 June 2026,2026-06-22
20250704093312900789265,2025-07-04
29.5.1995,1995-05-29
20050320180520067944,2005-03-20
794336400,1995-03-05
1609520400000,2021-01-02
2021_11_23T4_29_3+00:00,2021-11-23
"August 27, 2035",2035-08-27
Sự kiện diễn ra vào 10/10/1996 11:49,1996-10-10
9 tháng 8 năm 2006,2006-08-09
2008_12_24T16_2_19+08,2008-12-24
"March 31, 2023",2023-03-31
ngày 26 tháng 11 năm 2014,2014-11-26
Sự kiện diễn ra vào 1/9/1995 6:39,1995-09-01
21 tháng 5 năm 2021,2021-05-21
Sự kiện diễn ra vào 30/5/2018 18:11,2018-05-30
19901231234227620807664,1990-12-31
Event at 2018-11-16T22:38:24,2018-11-16
19941206130953389,1994-12-06
"9th of May, 1996",1996-05-09
13.9.1994T14-17-51,1994-09-13
Event at 2018-02-18T3:38:11,2018-02-18
2020-05-10T03:40:49.986Z,2020-05-10
The system recorded 20090802025812,2009-08-02
"July 21, 2027",2027-07-21
34-9-2009,2009-09-17
16.12.2028T6-48-55,2028-12-16
ngày 10 tháng 3 năm 1997,1997-03-10
5 tháng 7 năm 1992,1992-07-05
24.12.1998T19-31-31,1998-12-24
1990-02-17T19:44:48+2500,1990-02-17
1107968400,2005-02-10
2009/2/12T192159,2009-02-12
1991-09-26T12:26:14,1991-09-26
20230417063932413,2023-04-17
1994-08-08T13:19:08.430351094Z,1994-08-08
52-4-1996,1996-04-26
10|22|2002,2002-10-22
20111121002533099,2011-11-21
2008-02-17T18:03:06.857Z,2008-02-17
The system recorded 20190212073032,2019-02-12
9 February 2003,2003-02-09
20180216040457,2018-02-16
1995/3/6T14165,1995-03-06
1197738000000000,2007-12-16
10|02|06,2006-02-10
22/10/2015 giờ 3:23:27,2015-10-22
2006-03-02T13:07:29.595777Z,2006-03-02
03/05/2009,2009-03-05
08-07-1994,1994-08-07
The system recorded 20081005214027,2008-10-05
Sự kiện diễn ra vào 18/4/1991 7:26,1991-04-18
2033.03.17,2033-03-17
2021-10-13T13:55:47,2021-10-13
20201018030340,2020-10-18
2023_12_28T3_29_20+2500,2023-12-28
1355504400000000000,2012-12-15
20280119205731430635966,2028-01-19
2011-09-18T18:01:28.031929452Z,2011-09-18
20200427084356550829,2020-04-27
10/22-2029,2029-11-10
873651600000,1997-09-08
23/7/1992 giờ 21:38:44,1992-07-23
3 Aug 2019,2019-08-03
2011-01-20T18:19:11.839197Z,2011-01-20
1990026000000,2033-01-23
20100614110752671974986,2010-06-14
1990-08-24T03:10:32Z+3,1990-08-24
1997/10/16T145935,1997-10-16
2015-11-23T11:30:13.900349595Z,2015-11-23
29/10/2028 giờ 19:0:40,2028-10-29
1999/7/24T103256,1999-07-24
1993-11-27T22:57:04+00:00,1993-11-27
58-12-2015,2015-12-29
764787600000,1994-03-28
1990-01-09T01:29:39.282Z,1990-01-09
20010706172830131,2001-07-06
2009-07-27T18:46:59Z+3,2009-07-27
Event at 2029-05-17T18:56:29,2029-05-17
2012 07 15,2012-07-15
The system recorded 20170820081841,2017-08-20
20220302011815,2022-03-02
29 tháng 12 năm 1992,1992-12-29
20 tháng 8 năm 2005,2005-08-20
1993_04_12,1993-04-12
19921120155427390315,1992-11-20
"May 4, 2022",2022-05-04
20130223142507,2013-02-23
16 Apr 2005,2005-04-16
2007-09-09T16:51:46.224685Z,2007-09-09
2011-12-02T20:12:57.257066Z,2011-12-02
2031-03-21T18:49:35.427090911Z,2031-03-21
"21th of May, 2020",2020-05-21
1.11.1991T23-25-54,1991-11-01
2020-07-02T23:45:14+00:00,2020-07-02
19911221064714287618177,1991-12-21
"8th of August, 1999",1999-08-08
2005 01 30,2005-01-30
The system recorded 20261006201736,2026-10-06
"November 27, 2035",2035-11-27
804618000000000,1995-07-02
Sự kiện diễn ra vào 4/11/2003 14:47,2003-11-04
The system recorded 20301023162115,2030-10-23
23/10/12,2012-10-23
26|02|16,2016-02-26
Sự kiện diễn ra vào 17/4/2005 8:13,2005-04-17
22-7-2023,2023-07-22
29-10-1993,1993-10-29
2005_04_09T5_30_49-05:00,2005-04-09
Event at 2006-04-02T7:13:6,2006-04-02
2021-04-11,2021-04-11
ngày 28 tháng 4 năm 2028,2028-04-28
2000_04_07T16_45_20+3,2000-04-07
2007-05-05T09:26:28Z+3,2007-05-05
10 September 2020,2020-09-10
5 Feb 1990,1990-02-05
2003-10-07T12:26:56.503Z,2003-10-07
1459184400000000,2016-03-29
2023|03|10,2023-03-10
1 Jan 2031,2031-01-01
19920425085045030,1992-04-25
13/10-2014,2014-05-13
Ngày 21-2-1994,1994-02-21
1231088400000000000,2009-01-05
29/8-1991,1991-04-29
ngày 10 tháng 8 năm 2017,2017-08-10
2003-02-14T05:32:21-05:00,2003-02-14
Sự kiện diễn ra vào 18/4/2010 15:35,2010-04-18
20050807013230,2005-08-07
Sự kiện diễn ra vào 11/8/1995 8:37,1995-08-11
"18th of May, 2006",2006-05-18
1998-01-12T20:11:10,1998-01-12
2006_04_10T21_42_34Z,2006-04-10
"13th of June, 2016",2016-06-13
7 June 2026,2026-06-07
2009/12/16T18284,2009-12-16
25.03.28,2028-03-25
8|9|2022,2022-09-08
2-10-2028,2028-10-02
"3rd of August, 2017",2017-08-03
2012-02-16T15:38:29.962331463Z,2012-02-16
20 tháng 12 năm 2000,2000-12-20
2027_10_06T8_37_13+00:00,2027-10-06
19950919130031185469,1995-09-19
24/2/2014 giờ 18:0:38,2014-02-24
24-12-1997,1997-12-24
17 Sep 1990,1990-09-17
15-9-2035,2035-09-15
29-5-1991,1991-05-29
"15th of January, 2023",2023-01-15
Ngày 5-1-2011,2011-01-05
The system recorded 20330331000045,2033-03-31
1998 05 20,1998-05-20
"5th of July, 2014",2014-07-05
1996-01-31T23:48:49+2500,1996-01-31
14 tháng 8 năm 2001,2001-08-14
2032-11-08,2032-11-08
20110722171910649724,2011-07-22
19-11-1993,1993-11-19
1997-09-03T23:43:10+08,1997-09-03
19 May 2015,2015-05-19
Event at 2012-05-15T21:18:27,2012-05-15
14/1/2022 giờ 10:51:55,2022-01-14
2 tháng 8 năm 1994,1994-08-02
2022_08_20T20_36_32+0500,2022-08-20
678387600000000,1991-07-02
15/03/06,2006-03-15
2002-11-25T15:30:37.864583Z,2002-11-25
The system recorded 20190816083810,2019-08-16
1/14-2013,2013-07-01
1 Oct 2022,2022-10-01
2013_03_13T6_28_39-0300,2013-03-13
"December 26, 2004",2004-12-26
4 June 1992,1992-06-04
2000-08-30T14:28:20,2000-08-30
2001/01/02,2001-01-02
9 tháng 9 năm 1996,1996-09-09
20181209230727329832,2018-12-09
The system recorded 20271213063407,2027-12-13
2025-08-21,2025-08-21
2000_12_30T23_54_11+07:00,2000-12-30
2032-10-18T12:31:15+08,2032-10-18
"January 20, 2029",2029-01-20
ngày 21 tháng 7 năm 2009,2009-07-21
2017_09_12,2017-09-12
19 April 2007,2007-04-19
2027-01-26,2027-01-26
2001-06-20T03:05:43+08,2001-06-20
20181109034026631027,2018-11-09
20020526054737640820665,2002-05-26
ngày 17 tháng 10 năm 2004,2004-10-17
13 tháng 8 năm 2020,2020-08-13
ngày 18 tháng 8 năm 2033,2033-08-18
2002-08-25T19:41:03+2500,2002-08-25
1697130000000000000,2023-10-13
29/12-2009,2009-06-29
"13th of July, 2015",2015-07-13
14-8-1997,1997-08-07
14/7/2028,2028-07-14
48-1-2002,2002-01-24
1998/10/8T13738,1998-10-08
16.05.28,2028-05-16
ngày 28 tháng 1 năm 2016,2016-01-28
2008-01-29T00:06:30.626541918Z,2008-01-29
"22th of May, 2007",2007-05-22
25.4.1999,1999-04-25
"27th of April, 2007",2007-04-27
52-7-2027,2027-07-26
2019-09-21T09:06:47.624886Z,2019-09-21
30 June 2033,2033-06-30
2028-05-24T09:52:46.213Z,2028-05-24
2018_09_01T9_59_24+2500,2018-09-01
1924621200000000,2030-12-28
1991-06-24T20:38:27+2500,1991-06-24
3-1-2020,2020-01-03
Event at 2021-05-15T8:12:42,2021-05-15
15 November 2027,2027-11-15
979837200000000,2001-01-19
17 July 2021,2021-07-17
20/18-2023,2023-09-20
20301111025905825147469,2030-11-11
Ngày 29-7-2035,2035-07-29
1668013200000000000,2022-11-10
12/20-1990,1990-10-12
"29th of October, 2020",2020-10-29
24-5-2011,2011-05-24
14 December 2029,2029-12-14
54-5-2034,2034-05-27
2017.01.03,2017-01-03
Sự kiện diễn ra vào 11/12/1997 13:37,1997-12-11
"April 29, 2013",2013-04-29
1994-05-24T14:47:22Z+3,1994-05-24
30-9-2025,2025-09-30
24-10-2029,2029-10-24
Event at 2003-09-04T7:33:1,2003-09-04
Event at 2001-07-11T15:34:17,2001-07-11
2035-12-08T22:38:25.654Z,2035-12-08
714934800000000,1992-08-28
2024-08-29T22:28:11+2500,2024-08-29
8.10.2023T18-0-17,2023-10-08
1990-07-14T01:56:40.065729Z,1990-07-14
1999-10-13T08:31:37,1999-10-13
20 tháng 6 năm 2005,2005-06-20
2031-03-02T08:01:49Z+3,2031-03-02
1610902800,2021-01-18
2009-10-10T02:12:05.124603755Z,2009-10-10
Event at 1997-11-13T3:0:42,1997-11-13
2001-01-15T03:18:34+2500,2001-01-15
825958800000000000,1996-03-05
"16th of December, 2035",2035-12-16
20 tháng 2 năm 2023,2023-02-20
Sự kiện diễn ra vào 14/11/2003 0:24,2003-11-14
2000-05-25T09:13:49.781Z,2000-05-25
20310630203214,2031-06-30
1676566800,2023-02-17
ngày 22 tháng 10 năm 2021,2021-10-22
7.5.2030T11-19-30,2030-05-07
2034/6/16T13222,2034-06-16
2018-12-12T10:20:10Z+3,2018-12-12
04|14|2012,2012-04-14
2032_06_12,2032-06-12
2030-12-14T12:18:50,2030-12-14
10-7-2030,2030-07-05
1327770000000000000,2012-01-29
29-10-1996,1996-10-29
2024.09.21,2024-09-21
10 April 2015,2015-04-10
06-07-16,2016-07-06
03.06.93,1993-06-03
25/9/2031 giờ 7:37:38,2031-09-25
08|18|2010,2010-08-18
15 Oct 2034,2034-10-15
2003/7/17T14518,2003-07-17
The system recorded 20350213015307,2035-02-13
4/2/2017 giờ 23:11:27,2017-02-04
46-12-2035,2035-12-23
Ngày 24-7-2012,2012-07-24
2023-01-31T19:32:07.579227965Z,2023-01-31
19951117141908,1995-11-17
2021-04-07,2021-04-07
1999-12-07T03:26:17+2500,1999-12-07
4.8.1996T1-35-35,1996-08-04
2031_03_08T11_19_16+08,2031-03-08
2004-11-18T04:48:54.205Z,2004-11-18
6-10-2018,2018-10-06
15 September 2012,2012-09-15
Sự kiện diễn ra vào 8/3/2033 17:32,2033-03-08
20.9.1993,1993-09-20
1999-11-10T05:55:05-05:00,1999-11-10
1990-04-19T23:34:24+2500,1990-04-19
1997-05-29T03:41:56+2500,1997-05-29
Event at 2019-07-16T8:31:15,2019-07-16
1991-09-27T16:40:24Z+3,1991-09-27
"September 12, 1994",1994-09-12
15_12_2023,2023-12-15
2020.03.28,2020-03-28
2028-10-23T00:50:25.751853668Z,2028-10-23
25 tháng 6 năm 2008,2008-06-25
12|9|1993,1993-09-12
1165683600,2006-12-10
09|12|35,2035-12-09
The system recorded 19910325085754,1991-03-25
2010-10-09T01:21:02+2500,2010-10-09
"16th of February, 2021",2021-02-16
23/12/1999 giờ 0:23:27,1999-12-23
"18th of January, 2030",2030-01-18
50-4-2021,2021-04-25
Sự kiện diễn ra vào 28/9/2018 0:59,2018-09-28
1/1/1996 giờ 12:38:34,1996-01-01
Sự kiện diễn ra vào 8/10/2015 7:5,2015-10-08
19920206063237,1992-02-06
58-5-2015,2015-05-29
2000-11-19T06:00:41.479Z,2000-11-19
20120609230741813,2012-06-09
"15th of December, 2003",2003-12-15
1990-10-06T10:30:02Z+3,1990-10-06
1995/10/18T115626,1995-10-18
681584400,1991-08-08
"30th of November, 2002",2002-11-30
Sự kiện diễn ra vào 2/6/2022 21:48,2022-06-02
1997_05_04T3_56_3-05:00,1997-05-04
30 tháng 8 năm 2030,2030-08-30
24-08-12,2012-08-24
02.11.2016,2016-02-11
31.7.1998,1998-07-31
Event at 1992-06-21T11:28:37,1992-06-21
Sự kiện diễn ra vào 10/8/1996 22:11,1996-08-10
10 tháng 10 năm 2009,2009-10-10
Ngày 1-10-2021,2021-10-01
Sự kiện diễn ra vào 8/10/1992 0:22,1992-10-08
28-3-2012,2012-03-28
5/5/2015,2015-05-05
20310910180633,2031-09-10
2015-03-16T11:19:17.339Z,2015-03-16
2018-05-28T15:47:50.977305Z,2018-05-28
02-01-2018,2018-02-01
20190803183354199393,2019-08-03
728931600,1993-02-06
9/8-2035,2035-04-09
2029.10.11,2029-10-11
1991-10-30T21:14:09Z+3,1991-10-30
30 Mar 2006,2006-03-30
06_08_16,2016-08-06
27-3-2006,2006-03-27
8_12_1995,1995-12-08
2020-04-01T06:24:40.491Z,2020-04-01
29 Apr 1998,1998-04-29
2022-06-11T07:30:19Z+3,2022-06-11
2046272400000000000,2034-11-05
2033/7/21T8266,2033-07-21
15 Apr 2005,2005-04-15
04-27-1992,1992-04-27
6-11-2014,2014-11-03
"24th of April, 1994",1994-04-24
9.11.2027T14-12-52,2027-11-09
25/6/2007 giờ 1:25:36,2007-06-25
"19th of January, 2009",2009-01-19
The system recorded 19960213232304,1996-02-13
1998_02_12T9_20_54-0300,1998-02-12
Sự kiện diễn ra vào 12/4/2004 15:9,2004-04-12
01/16/2002,2002-01-16
18 Sep 2017,2017-09-18
2024/8/13T203238,2024-08-13
3 Feb 2023,2023-02-03
2016-06-14T01:00:30,2016-06-14
9/14-1998,1998-07-09
20030902002245715,2003-09-02
"24th of September, 2010",2010-09-24
1993-06-07T19:57:19.823680508Z,1993-06-07
Ngày 6-9-1999,1999-09-06
10.7.2022,2022-07-10
20/24-2019,2019-12-20
2028-02-21T01:43:06Z+3,2028-02-21
14 tháng 2 năm 2031,2031-02-14
46-3-1998,1998-03-23
1993-01-16T21:46:17+3,1993-01-16
7.7.1992,1992-07-07
20101028151800414,2010-10-28
2019-03-27T20:25:21.330210199Z,2019-03-27
19980427172900,1998-04-27
762800400000,1994-03-05
2014_07_29T21_10_22Z+3,2014-07-29
2017-04-01T11:05:02.947Z,2017-04-01
19/10/2003 giờ 3:59:31,2003-10-19
24 tháng 8 năm 2023,2023-08-24
2031-04-24T07:39:21.129730366Z,2031-04-24
ngày 7 tháng 11 năm 1994,1994-11-07
The system recorded 20040521022451,2004-05-21
2010-10-30T20:42:02+2500,2010-10-30
11/20-1998,1998-10-11
1999-06-24T16:17:21,1999-06-24
2006/8/5T35159,2006-08-05
1522688400,2018-04-03
2030-02-26T14:48:44Z+3,2030-02-26
908816400000,1998-10-20
The system recorded 20301205230921,2030-12-05
1919437200000000,2030-10-29
761850000000,1994-02-22
24 February 2031,2031-02-24
771526800,1994-06-14
6/12/2004,2004-12-06
ngày 15 tháng 7 năm 1992,1992-07-15
"September 10, 2003",2003-09-10
ngày 25 tháng 3 năm 1996,1996-03-25
19930712012622651,1993-07-12
1207328400000000000,2008-04-05
22 07 96,1996-07-22
5 tháng 3 năm 1994,1994-03-05
28-07-28,2028-07-28
9|2|2021,2021-02-09
2061133200,2035-04-26
20280324165301880,2028-03-24
2027-02-18T14:45:03,2027-02-18
Sự kiện diễn ra vào 31/3/1999 14:41,1999-03-31
25-3-2013,2013-03-25
2074784400000000,2035-10-01
"24th of December, 2015",2015-12-24
Sự kiện diễn ra vào 15/3/2003 6:26,2003-03-15
1808758800,2027-04-27
"10th of April, 2030",2030-04-10
Ngày 11-1-2009,2009-01-11
Ngày 26-4-2022,2022-04-26
951152400000000,2000-02-22
31-3-2008,2008-03-31
2 Nov 2012,2012-11-02
21 March 2011,2011-03-21
Event at 2022-05-05T5:12:12,2022-05-05
19 August 2014,2014-08-19
2026-07-16T04:40:33.885244721Z,2026-07-16
2005-11-25T10:36:20+0500,2005-11-25
04/06/33,2033-06-04
"February 26, 2030",2030-02-26
4.6.2019T15-38-53,2019-06-04
20331126114328665,2033-11-26
2034/2/7T82542,2034-02-07
"February 13, 2012",2012-02-13
20050913084621116104107,2005-09-13
20200924071105337,2020-09-24
24 October 2017,2017-10-24
Ngày 26-7-2026,2026-07-26
10.17.2028,2028-10-17
1432314000,2015-05-23
21 tháng 1 năm 2004,2004-01-21
Event at 2001-06-15T8:20:12,2001-06-15
04-16-2002,2002-04-16
29/6-2023,2023-03-29
09.26.2015,2015-09-26
"October 12, 2007",2007-10-12
11 6 2019,2019-06-11
18-3-2030,2030-03-18
"14th of November, 2030",2030-11-14
2008-04-21T15:06:35+3,2008-04-21
19990308154312481099001,1999-03-08
795114000000000,1995-03-14
The system recorded 20041021235220,2004-10-21
967136400000000000,2000-08-25
18-1-2020,2020-01-18
1998-07-09T15:39:37.616659Z,1998-07-09
Sự kiện diễn ra vào 25/2/1990 9:31,1990-02-25
9-12-2011,2011-12-09
1994-08-18T03:13:05.617969525Z,1994-08-18
22-08-26,2026-08-22
2022-01-12T03:26:43.898430077Z,2022-01-12
14 July 2021,2021-07-14
24 October 2032,2032-10-24
1562605200000,2019-07-09
14.11.2013,2013-11-14
50-11-1999,1999-11-25
2019/12/5T135242,2019-12-05
20020304162146289822,2002-03-04
1692896400000,2023-08-25
1373562000,2013-07-12
10-6-2025,2025-06-10
Ngày 21-11-1996,1996-11-21
1 May 1994,1994-05-01
2028-12-27,2028-12-27
"8th of December, 2030",2030-12-08
2046618000000,2034-11-09
7 October 2024,2024-10-07
2013-04-23T10:55:26.816370Z,2013-04-23
03_27_1996,1996-03-27
2010-03-26T18:38:11-0300,2010-03-26
11/03/31,2031-03-11
ngày 12 tháng 3 năm 2019,2019-03-12
1851008400000,2028-08-28
19991017033038,1999-10-17
17-1-2011,2011-01-17
22 tháng 4 năm 1999,1999-04-22
ngày 17 tháng 5 năm 2002,2002-05-17
05/01/10,2010-01-05
13/2/1990 giờ 0:35:12,1990-02-13
2007-06-13T06:33:49-05:00,2007-06-13
Event at 2005-03-10T8:55:8,2005-03-10
31/7/2030 giờ 1:15:26,2030-07-31
The system recorded 20281206001829,2028-12-06
2029-01-09T16:03:37Z+3,2029-01-09
1320339600000000,2011-11-04
22.12.2022T4-59-8,2022-12-22
2021-06-09T18:47:11Z+3,2021-06-09
Sự kiện diễn ra vào 23/2/2024 13:50,2024-02-23
1994-01-03T12:19:46+2500,1994-01-03
20280827192725815149,2028-08-27
1990-08-23T04:49:09.258Z,1990-08-23
Sự kiện diễn ra vào 17/3/2021 10:8,2021-03-17
2020/10/15T234225,2020-10-15
2003-12-23T02:23:54+3,2003-12-23
15 1 2023,2023-01-15
20 Feb 1991,1991-02-20
1996-07-14T23:30:45.249142542Z,1996-07-14
13-01-27,2027-01-13
6.6.1998T4-26-17,1998-06-06
2007/11/18T23850,2007-11-18
2023/11/28T7479,2023-11-28
1993-04-19T17:45:56.581881677Z,1993-04-19
20260209092350,2026-02-09
23/12/2008,2008-12-23
"13th of June, 2019",2019-06-13
20 December 2029,2029-12-20
12.3.2013T6-1-38,2013-03-12
Ngày 13-3-2000,2000-03-13
2012-09-16T15:44:06.540Z,2012-09-16
2006-11-14T12:28:53,2006-11-14
ngày 11 tháng 10 năm 2004,2004-10-11
2002_11_05T4_30_55+07:00,2002-11-05
23/11/2022,2022-11-23
2026-06-06T21:51:04.369Z,2026-06-06
2020-07-02T00:31:47+3,2020-07-02
2030-01-26T11:20:34.357Z,2030-01-26
2-8-2019,2019-08-01
2009_05_16T16_34_20+3,2009-05-16
01/03/00,2000-03-01
2009-08-05T16:58:37.305010Z,2009-08-05
"27th of April, 2031",2031-04-27
867171600000000,1997-06-25
23|8|2011,2011-08-23
ngày 17 tháng 4 năm 2013,2013-04-17
Ngày 18-6-2004,2004-06-18
2030/8/31T235225,2030-08-31
4.1.1994T4-4-47,1994-01-04
23_5_1998,1998-05-23
"6th of February, 2035",2035-02-06
23/11/1999 giờ 8:46:0,1999-11-23
ngày 23 tháng 3 năm 2014,2014-03-23
12 09 2010,2010-12-09
680634000000,1991-07-28
20 tháng 3 năm 2024,2024-03-20
1997_09_24,1997-09-24
"February 8, 2023",2023-02-08
"3rd of March, 2012",2012-03-03
26/12/1990 giờ 13:17:15,1990-12-26
ngày 30 tháng 1 năm 1993,1993-01-30
1762362000,2025-11-06
"4th of December, 1994",1994-12-04
30-9-1993,1993-09-15
20280730111026,2028-07-30
2001/10/07,2001-10-07
2012/8/10T54549,2012-08-10
2021-05-02T14:21:04+08,2021-05-02
2027/08/17,2027-08-17
19-03-30,2030-03-19
2016-10-21T05:05:12+2500,2016-10-21
2002/7/8T44554,2002-07-08
ngày 22 tháng 10 năm 2029,2029-10-22
10/6-1995,1995-03-10
2005-12-07T13:11:14.288Z,2005-12-07
Ngày 15-10-2003,2003-10-15
"18th of September, 1996",1996-09-18
Ngày 26-7-1991,1991-07-26
22.7.2027T4-25-16,2027-07-22
ngày 29 tháng 9 năm 2016,2016-09-29
2026/10/23T17824,2026-10-23
1974733200,2032-07-30
2024-06-19T03:17:52,2024-06-19
1997_10_31T17_52_46-0300,1997-10-31
3 September 2031,2031-09-03
15-2-2011,2011-02-15
"5th of October, 2009",2009-10-05
44-7-2010,2010-07-22
2003504400000,2033-06-28
The system recorded 19951207183909,1995-12-07
26/06/17,2017-06-26
Ngày 12-10-2030,2030-10-12
1997-01-30T15:21:09Z+3,1997-01-30
3-1-2032,2032-01-03
50-9-2035,2035-09-25
2005-10-30T05:16:50.750212757Z,2005-10-30
18-3-2033,2033-03-09
2034-04-16T19:38:44.695031237Z,2034-04-16
2035/12/2T203214,2035-12-02
1990-09-10T22:33:56.849Z,1990-09-10
14/20-2022,2022-10-14
20320924182404,2032-09-24
Event at 2027-04-29T20:49:25,2027-04-29
2023-07-16T15:11:47Z+3,2023-07-16
The system recorded 20330607035455,2033-06-07
Sự kiện diễn ra vào 25/7/2001 3:27,2001-07-25
9.9.2017T23-59-52,2017-09-09
Ngày 30-12-2017,2017-12-30
1767373200000,2026-01-03
2016-03-03T13:19:28.130515068Z,2016-03-03
28-1-2035,2035-01-14
2022-09-12T01:17:11Z+3,2022-09-12
2021-07-08T16:01:10-05:00,2021-07-08
17-7-2030,2030-07-17
1348592400000,2012-09-26
"19th of September, 2031",2031-09-19
Sự kiện diễn ra vào 14/1/1996 17:57,1996-01-14
34-4-2005,2005-04-17
2029-01-02T22:27:14,2029-01-02
28 Dec 2035,2035-12-28
2010-12-10T06:03:05+2500,2010-12-10
771354000,1994-06-12
10|09|2005,2005-10-09
Event at 2006-10-18T0:18:50,2006-10-18
20301004075610,2030-10-04
The system recorded 20190712155147,2019-07-12
6-11-2006,2006-11-06
2/6-2008,2008-03-02
20051024035745,2005-10-24
1982336400000000000,2032-10-26
2007.05.12,2007-05-12
2022/7/1T135124,2022-07-01
Sự kiện diễn ra vào 3/12/1991 11:33,1991-12-03
1751821200,2025-07-07
19980924092448,1998-09-24
14|09|17,2017-09-14
1990-06-09T02:57:32.720608Z,1990-06-09
18_8_1995,1995-08-18
14-2-2016,2016-02-07
6/8/1997 giờ 2:38:58,1997-08-06
The system recorded 20150325053517,2015-03-25
07|03|07,2007-03-07
1285606800000000,2010-09-28
2010/5/26T6507,2010-05-26
2027-03-07T08:10:35.788395Z,2027-03-07
1992-09-04T12:22:03+07:00,1992-09-04
"3rd of September, 2026",2026-09-03
22 8 2019,2019-08-22
16/2/2016 giờ 17:15:12,2016-02-16
25 Jun 2006,2006-06-25
2025-02-21T15:09:16,2025-02-21
5/2-2016,2016-01-05
"June 28, 2018",2018-06-28
25 Apr 2016,2016-04-25
30/5/2005 giờ 10:4:8,2005-05-30
Ngày 23-9-1993,1993-09-23
20320514212440807853,2032-05-14
20060916201459,2006-09-16
04 25 2024,2024-04-25
4 tháng 12 năm 2001,2001-12-04
"15th of September, 2026",2026-09-15
"11th of January, 2001",2001-01-11
21 June 2025,2025-06-21
1736787600000,2025-01-14
20020818211743534140,2002-08-18
2033-03-24T10:04:10,2033-03-24
The system recorded 20170104152830,2017-01-04
3/16-2004,2004-08-03
22/9/2026 giờ 2:56:28,2026-09-22
15 tháng 10 năm 2008,2008-10-15
2021-05-11T17:39:52Z+3,2021-05-11
2005-11-29T12:29:27Z+3,2005-11-29
16 tháng 3 năm 2026,2026-03-16
19921126084132,1992-11-26
20/14-2026,2026-07-20
2014_09_16T15_43_43Z+3,2014-09-16
1995_06_14T20_38_52+08,1995-06-14
24 Mar 2010,2010-03-24
1996-10-28T12:48:16.908Z,1996-10-28
2033/2/20T3018,2033-02-20
2026-08-02T19:31:08,2026-08-02
"July 2, 1998",1998-07-02
2004-05-25T16:59:56.016Z,2004-05-25
2020-12-17T15:30:10.027084191Z,2020-12-17
"May 1, 2002",2002-05-01
2006-10-07T14:14:58.914374383Z,2006-10-07
2 tháng 2 năm 2024,2024-02-02
Event at 2014-08-31T8:15:12,2014-08-31
18 Oct 2024,2024-10-18
19901216020759735709310,1990-12-16
1995 10 07,1995-10-07
1324573200000,2011-12-23
2019-07-23T13:02:11-0300,2019-07-23
Ngày 25-3-2025,2025-03-25
2024/12/24T81958,2024-12-24
2014-03-25T05:32:41+2500,2014-03-25
18/06/13,2013-06-18
Ngày 14-1-2025,2025-01-14
11 December 2031,2031-12-11
"November 5, 2012",2012-11-05
Sự kiện diễn ra vào 9/11/2010 23:47,2010-11-09
20340724174804,2034-07-24
Sự kiện diễn ra vào 4/6/2029 1:5,2029-06-04
1153674000000,2006-07-24
The system recorded 20340902020217,2034-09-02
20 Jul 2032,2032-07-20
2015/9/3T52658,2015-09-03
2002-10-18T12:59:48+2500,2002-10-18
2024/9/29T221115,2024-09-29
20030614171756848489,2003-06-14
11/6/1993 giờ 17:30:34,1993-06-11
ngày 6 tháng 4 năm 2024,2024-04-06
2034-02-20T13:22:13.885542656Z,2034-02-20
20 Jun 2031,2031-06-20
20260206110721,2026-02-06
2017/11/17T14216,2017-11-17
14 tháng 11 năm 2016,2016-11-14
1597597200000000,2020-08-17
9-4-2013,2013-04-09
"3rd of June, 1996",1996-06-03
2034-06-03T10:43:14.882222298Z,2034-06-03
2067613200,2035-07-10
2007-03-09T12:29:46-0330,2007-03-09
31-10-99,1999-10-31
2000 12 17,2000-12-17
20100214012015,2010-02-14
20 June 2015,2015-06-20
7 tháng 5 năm 1997,1997-05-07
The system recorded 20040426132428,2004-04-26
1993-05-05T01:55:49Z+3,1993-05-05
1548694800,2019-01-29
19950402071344060482639,1995-04-02
8-11-1996,1996-11-04
798829200000000,1995-04-26
13-9-1997,1997-09-13
06|18|2002,2002-06-18
08|03|2021,2021-08-03
ngày 18 tháng 10 năm 1998,1998-10-18
2013-12-16T18:06:58Z+3,2013-12-16
20250528022233858997042,2025-05-28
48-8-2032,2032-08-24
7/11/2007 giờ 13:13:18,2007-11-07
1118682000000000000,2005-06-14
Ngày 16-10-2018,2018-10-16
2024-06-28T08:04:08.772627739Z,2024-06-28
The system recorded 20160306130040,2016-03-06
19920602115953,1992-06-02
2021/8/1T83812,2021-08-01
"March 8, 2004",2004-03-08
"25th of February, 2002",2002-02-25
"13th of February, 2016",2016-02-13
20320215203532083,2032-02-15
12.11.2030T6-17-28,2030-11-12
4-6-2004,2004-06-02
2010-04-21T06:25:05+00:00,2010-04-21
16 tháng 2 năm 2019,2019-02-16
16 Apr 2031,2031-04-16
21-1-2022,2022-01-21
The system recorded 20061107074825,2006-11-07
2024-05-26T22:59:43.011171614Z,2024-05-26
2032|03|02,2032-03-02
2011-02-13T23:33:36.527482Z,2011-02-13
21 tháng 5 năm 2001,2001-05-21
1014829200000000000,2002-02-28
20270501012212451882,2027-05-01
Sự kiện diễn ra vào 18/12/1998 18:31,1998-12-18
826304400000000,1996-03-09
25 August 2028,2028-08-25
20050613055730869,2005-06-13
11-11-2033,2033-11-11
2018 07 19,2018-07-19
16-11-2019,2019-11-16
24 tháng 9 năm 2035,2035-09-24
1996-01-27T19:23:04.096Z,1996-01-27
2011-07-23T14:10:55+2500,2011-07-23
2033/6/30T224134,2033-06-30
6-6-2032,2032-06-06
2006 09 08,2006-09-08
2023808400,2034-02-18
2067181200000000,2035-07-05
1990-07-11T09:25:25Z+3,1990-07-11
2008-06-19T18:23:50+2500,2008-06-19
28 11 03,2003-11-28
1996 12 29,1996-12-29
1909846800,2030-07-10
20231120204532432293828,2023-11-20
1994-05-10T13:15:07.390446365Z,1994-05-10
20290223120440599698,2029-02-23
15-4-2000,2000-04-15
22.7.2010,2010-07-22
13 tháng 4 năm 2004,2004-04-13
2015-10-17T13:54:02.243604Z,2015-10-17
1992-03-25T09:40:19,1992-03-25
The system recorded 19950529224343,1995-05-29
1993-10-10T22:01:24.691869092Z,1993-10-10
28/14-1992,1992-07-28
60-6-1995,1995-06-30
ngày 6 tháng 11 năm 2025,2025-11-06
2029-11-19T01:03:44.168Z,2029-11-19
13 tháng 8 năm 1994,1994-08-13
20021204025014,2002-12-04
12 Apr 2012,2012-04-12
2000-04-04T23:42:24,2000-04-04
2007-07-22T01:11:38Z+3,2007-07-22
2022/02/28,2022-02-28
2000_01_02T6_29_52+3,2000-01-02
Sự kiện diễn ra vào 15/9/2028 3:21,2028-09-15
6/11/2030 giờ 8:4:45,2030-11-06
2007_06_02,2007-06-02
20061127150637411,2006-11-27
2030-09-14T06:09:26+2500,2030-09-14
18_01_29,2029-01-18
2007-06-14T23:26:18+2500,2007-06-14
14/12-2009,2009-06-14
2012-03-20T21:35:38+2500,2012-03-20
7/3/2010 giờ 2:51:13,2010-03-07
10.10.93,1993-10-10
42-3-2016,2016-03-21
20-8-2026,2026-08-10
5 tháng 1 năm 2006,2006-01-05
5/9/2012 giờ 7:54:31,2012-09-05
19990711113100283962,1999-07-11
ngày 9 tháng 2 năm 2005,2005-02-09
Sự kiện diễn ra vào 20/11/2029 11:2,2029-11-20
1990-11-25T11:06:20.740624809Z,1990-11-25
12/16-1993,1993-08-12
11-4-2019,2019-04-11
1997-02-21T18:09:45.396572258Z,1997-02-21
5/14-1990,1990-07-05
2002-07-20T18:57:34.855335Z,2002-07-20
"5th of May, 2007",2007-05-05
1222189200000,2008-09-24
27 Jan 2011,2011-01-27
2013-03-15T08:15:09.392Z,2013-03-15
2014-03-02T19:19:52.826720Z,2014-03-02
2003-01-22T14:22:09+2500,2003-01-22
7 June 2031,2031-06-07
8 July 2026,2026-07-08
19961022175720353299389,1996-10-22
4.5.2032T6-57-52,2032-05-04
2017-01-05T18:19:44Z+3,2017-01-05
"August 4, 2035",2035-08-04
18/9/2009 giờ 9:23:12,2009-09-18
2014-06-17T05:59:18,2014-06-17
Ngày 13-5-1996,1996-05-13
27 tháng 5 năm 2025,2025-05-27
20300802024746950155,2030-08-02
52-8-2020,2020-08-26
"March 31, 2033",2033-03-31
15.12.2020T3-45-36,2020-12-15
1995-11-14T19:15:21+2500,1995-11-14
31 5 2005,2005-05-31
2016-07-30T21:48:28+2500,2016-07-30
20 tháng 7 năm 2018,2018-07-20
2018_10_02T9_9_4-05:00,2018-10-02
16.3.1995,1995-03-16
"29th of March, 2016",2016-03-29
1918659600000000,2030-10-20
8-5-2003,2003-05-04
27/5/2032 giờ 15:34:15,2032-05-27
2013-09-30T01:40:03Z+3,2013-09-30
24 May 2032,2032-05-24
27|02|01,2001-02-27
18/3/2006 giờ 3:58:51,2006-03-18
20 3 1992,1992-03-20
2028-02-28T18:44:03.722964Z,2028-02-28
2005/2/7T232036,2005-02-07
19980520222225545428,1998-05-20
1 Jul 2003,2003-07-01
8-6-2000,2000-06-04
1929718800000,2031-02-25
"August 27, 2028",2028-08-27
2017-03-23T18:23:14+2500,2017-03-23
Sự kiện diễn ra vào 26/8/2001 0:21,2001-08-26
20041031024150,2004-10-31
13/2/2032 giờ 8:52:18,2032-02-13
1090083600000000000,2004-07-18
1336582800000,2012-05-10
1558803600,2019-05-26
20161005121718477,2016-10-05
"March 23, 2018",2018-03-23
1690650000000,2023-07-30
"2nd of October, 1993",1993-10-02
2031-10-26T12:19:37.223534116Z,2031-10-26
Sự kiện diễn ra vào 10/2/2035 13:47,2035-02-10
20300404231505007876294,2030-04-04
19961128051616350536504,1996-11-28
1994-12-28T16:28:17,1994-12-28
15/2-2009,2009-01-15
20060120030551198878,2006-01-20
2004-09-17,2004-09-17
27/24-2017,2017-12-27
29.1.2006T23-50-52,2006-01-29
10 November 2004,2004-11-10
8 tháng 11 năm 1996,1996-11-08
2022-04-20T03:50:45.266992Z,2022-04-20
1004115600000000,2001-10-27
21 November 2024,2024-11-21
19920110140559965537383,1992-01-10
12-9-2022,2022-09-06
5 Jan 2018,2018-01-05
2 tháng 1 năm 2021,2021-01-02
"28th of August, 2016",2016-08-28
2026-12-23T07:08:44.594Z,2026-12-23
1837270800,2028-03-22
1994-08-24T22:43:01+00:00,1994-08-24
2029-06-14T04:26:25+0500,2029-06-14
20090220050108,2009-02-20
28 May 2009,2009-05-28
2011/12/23T6148,2011-12-23
1993-11-15T16:53:31Z+3,1993-11-15
12/24-2008,2008-12-12
02 01 2030,2030-02-01
2004-05-01T16:07:54.800496Z,2004-05-01
1999/4/2T32251,1999-04-02
"6th of November, 2031",2031-11-06
Sự kiện diễn ra vào 5/12/2013 19:14,2013-12-05
634928400000000,1990-02-14
1215622800000000000,2008-07-10
21-5-2017,2017-05-21
2014-03-17T09:00:41.759Z,2014-03-17
"6th of September, 2030",2030-09-06
11-1-2011,2011-01-11
ngày 6 tháng 6 năm 1994,1994-06-06
2006-10-18T18:01:50Z+3,2006-10-18
Sự kiện diễn ra vào 31/3/2003 8:26,2003-03-31
Event at 2020-11-04T1:8:29,2020-11-04
20120607074437,2012-06-07
2004-04-06T23:16:19+2500,2004-04-06
20340516030006097,2034-05-16
2027/03/30,2027-03-30
2033744400000,2034-06-13
2002-12-16T17:45:29.376350591Z,2002-12-16
25 Jul 2021,2021-07-25
1089392400000000,2004-07-10
07|13|2024,2024-07-13
20110523211804516,2011-05-23
2021-10-05T02:56:31,2021-10-05
1401642000000,2014-06-02
1992/04/20,1992-04-20
28/4/2011 giờ 21:56:2,2011-04-28
Ngày 25-7-2002,2002-07-25
2-1-2035,2035-01-01
2029-01-29T12:09:08.312562Z,2029-01-29
21 May 2014,2014-05-21
"May 10, 2030",2030-05-10
711824400,1992-07-23
2007/03/02,2007-03-02
The system recorded 20330422231358,2033-04-22
2033-02-05T02:41:52.892Z,2033-02-05
2002-02-13T22:03:05.481Z,2002-02-13
Event at 2016-02-15T11:54:52,2016-02-15
12|28|2029,2029-12-28
1956675600,2032-01-03
Sự kiện diễn ra vào 20/7/1994 19:27,1994-07-20
ngày 11 tháng 4 năm 2033,2033-04-11
26.6.2024T17-37-17,2024-06-26
Sự kiện diễn ra vào 23/2/1997 1:6,1997-02-23
2004_04_03T19_45_35+07:00,2004-04-03
2024-10-03T06:55:41Z+3,2024-10-03
1030467600000000000,2002-08-28
20250824103608943,2025-08-24
2010-04-23T02:58:11Z+3,2010-04-23
2032-01-05T03:13:56.013918721Z,2032-01-05
Ngày 17-12-2024,2024-12-17
Sự kiện diễn ra vào 7/7/2003 15:25,2003-07-07
20080606020514709263,2008-06-06
"18th of January, 2033",2033-01-18
2023_05_09T22_14_57-0330,2023-05-09
2007-11-10T05:38:14+2500,2007-11-10
29 Sep 2001,2001-09-29
1787245200,2026-08-21
19990627155027,1999-06-27
18/10/2023 giờ 23:30:6,2023-10-18
24 07 97,1997-07-24
2012_03_08T18_27_48+2500,2012-03-08
2009_10_13,2009-10-13
20171007145401378,2017-10-07
1991/12/3T1527,1991-12-03
20280701145057,2028-07-01
2014/6/22T201445,2014-06-22
The system recorded 20000725182302,2000-07-25
25-8-1990,1990-08-25
44-12-2007,2007-12-22
1991-02-26T14:17:16.080Z,1991-02-26
19961201053053,1996-12-01
1819040400,2027-08-24
ngày 17 tháng 2 năm 2019,2019-02-17
2021-10-04T18:41:19.683824660Z,2021-10-04
11/08/2008,2008-11-08
30-9-1997,1997-09-30
2034_10_26T18_41_53-0330,2034-10-26
Event at 2006-06-24T4:33:45,2006-06-24
"April 24, 2008",2008-04-24
20261223235005249908,2026-12-23
"January 1, 2002",2002-01-01
21-10-2032,2032-10-21
12 tháng 12 năm 2014,2014-12-12
2002-11-19T03:23:01.296Z,2002-11-19
"January 7, 2017",2017-01-07
18 tháng 5 năm 2001,2001-05-18
27/5/2017,2017-05-27
Event at 2028-07-08T7:18:5,2028-07-08
1595955600000000000,2020-07-29
30/10-2008,2008-05-30
2028_09_01T19_45_8+08,2028-09-01
20020122031758212085,2002-01-22
707850000,1992-06-07
1-5-1996,1996-05-01
2017_04_23T9_1_51+00:00,2017-04-23
08 20 1999,1999-08-20
20200605143515916,2020-06-05
38-3-2010,2010-03-19
"28th of July, 2009",2009-07-28
09 01 1993,1993-09-01
"21th of November, 2001",2001-11-21
2024-12-22T14:56:43.180150989Z,2024-12-22
Sự kiện diễn ra vào 1/6/2032 17:32,2032-06-01
14|10|22,2022-10-14
20050505190610275358365,2005-05-05
24 tháng 4 năm 2035,2035-04-24
2003-11-02T15:54:59.561768569Z,2003-11-02
The system recorded 20240228223035,2024-02-28
2011-01-07T10:43:12.310185239Z,2011-01-07
Sự kiện diễn ra vào 7/6/2024 15:5,2024-06-07
"27th of March, 2035",2035-03-27
18/8/2029 giờ 15:52:11,2029-08-18
19921005075223605237113,1992-10-05
The system recorded 20121203160307,2012-12-03
2024-06-20T09:46:14+2500,2024-06-20
20211212041213,2021-12-12
20311004001613156,2031-10-04
25/20-1992,1992-10-25
1128445200,2005-10-05
26.11.2017T3-1-51,2017-11-26
20350905202447,2035-09-05
Sự kiện diễn ra vào 4/6/1991 17:58,1991-06-04
2011-04-18T23:24:20.173Z,2011-04-18
31 October 2021,2021-10-31
2022_06_15T3_11_14+00:00,2022-06-15
1992|09|12,1992-09-12
Ngày 12-1-2027,2027-01-12
4 tháng 6 năm 1990,1990-06-04
9 March 2019,2019-03-09
29.4.1995T6-12-33,1995-04-29
ngày 4 tháng 1 năm 2034,2034-01-04
"29th of June, 2011",2011-06-29
2016_12_23,2016-12-23
2014-09-03T20:41:58.148855933Z,2014-09-03
1999-02-08T10:28:03.528411326Z,1999-02-08
19950826042945328,1995-08-26
1758819600000,2025-09-26
9.10.2010T11-18-31,2010-10-09
2006-07-09T10:01:51.060007206Z,2006-07-09
20190218114021474246,2019-02-18
2013-08-22T01:41:26.171192Z,2013-08-22
2025-12-06T23:30:00+2500,2025-12-06
"August 30, 2035",2035-08-30
2026-03-15T02:34:06Z+3,2026-03-15
29-7-2024,2024-07-29
20|9|2023,2023-09-20
917629200000000000,1999-01-30
Sự kiện diễn ra vào 31/12/2000 1:24,2000-12-31
1852304400,2028-09-12
1100797200,2004-11-19
19940603143908709,1994-06-03
5.4.2033,2033-04-05
2059923600000,2035-04-12
27/10-2016,2016-05-27
18 04 25,2025-04-18
957286800000,2000-05-03
"December 25, 1994",1994-12-25
03-06-2004,2004-03-06
20000728004859635988,2000-07-28
2031-10-04T21:14:03,2031-10-04
2022-01-30T20:52:28Z+3,2022-01-30
27-4-1992,1992-04-27
2012-03-02T19:15:14.694Z,2012-03-02
"13th of October, 2019",2019-10-13
19980812222330038,1998-08-12
2017_08_22T14_0_4-0300,2017-08-22
19911119162932141703,1991-11-19
2082387600000000000,2035-12-28
"September 16, 2029",2029-09-16
20200206062353,2020-02-06
906051600000000,1998-09-18
2076598800000000,2035-10-22
Ngày 6-2-2006,2006-02-06
20-3-2028,2028-03-20
"November 7, 2000",2000-11-07
Ngày 26-7-1999,1999-07-26
Ngày 12-3-2004,2004-03-12
20050816231418160240,2005-08-16
ngày 24 tháng 2 năm 2008,2008-02-24
1/12/2001 giờ 13:49:57,2001-12-01
16/8-2000,2000-04-16
1452790800000000,2016-01-15
2022.12.21,2022-12-21
2020-12-13T17:17:00Z+3,2020-12-13
2022-01-18T18:08:47.228Z,2022-01-18
18-8-2013,2013-08-18
1997-06-23T21:40:50+2500,1997-06-23
2002/1/12T15212,2002-01-12
31/1/2017 giờ 17:48:40,2017-01-31
"September 13, 2020",2020-09-13
1546966800000000,2019-01-09
11 January 1990,1990-01-11
Ngày 27-2-2031,2031-02-27
Ngày 10-3-2019,2019-03-10
13-4-1991,1991-04-13
2012-08-20T17:52:43.725537Z,2012-08-20
1535648400,2018-08-31
20040710220409,2004-07-10
Ngày 13-3-2004,2004-03-13
1999-04-23T15:55:36.624211259Z,1999-04-23
2003-12-05T04:21:46+2500,2003-12-05
1999-09-24T02:53:38Z+3,1999-09-24
1998-11-15T16:20:11.864Z,1998-11-15
1873558800000000,2029-05-16
20181002005814,2018-10-02
11 tháng 10 năm 2002,2002-10-11
Ngày 5-10-2026,2026-10-05
09|24|2022,2022-09-24
2027-06-20T10:26:59+2500,2027-06-20
24-3-2034,2034-03-12
29/6-2016,2016-03-29
"29th of January, 2017",2017-01-29
22/8-2017,2017-04-22
1277485200,2010-06-26
"21th of April, 2003",2003-04-21
"August 27, 1996",1996-08-27
14-1-2004,2004-01-07
22 Jul 2019,2019-07-22
24.3.2019T19-46-52,2019-03-24
1990-12-28T12:06:23.662Z,1990-12-28
2000-06-11T13:57:42,2000-06-11
1204995600,2008-03-09
Sự kiện diễn ra vào 17/1/2012 12:57,2012-01-17
12 Jul 2033,2033-07-12
2029-01-29T18:57:41.913680078Z,2029-01-29
"8th of October, 2034",2034-10-08
2031-05-21T06:14:53Z+3,2031-05-21
20340702112420605595006,2034-07-02
1190653200000,2007-09-25
25 Oct 2028,2028-10-25
"16th of May, 1996",1996-05-16
30-10-2014,2014-10-30
19-10-2033,2033-10-19
18-10-1993,1993-10-09
20151007140401850833,2015-10-07
1992/3/2T94933,1992-03-02
17/7/1991,1991-07-17
1544893200,2018-12-16
1998-01-17T09:59:10.265614Z,1998-01-17
Ngày 15-5-2025,2025-05-15
2016-03-22T09:43:44.349127Z,2016-03-22
The system recorded 20130626182823,2013-06-26
856717200000000,1997-02-24
Event at 1999-05-13T19:18:48,1999-05-13
ngày 8 tháng 6 năm 2031,2031-06-08
08_21_2018,2018-08-21
2004-06-16T07:03:53-0330,2004-06-16
"27th of April, 2031",2031-04-27
1994/3/11T33247,1994-03-11
1574701200000000,2019-11-26
20130226043813901938,2013-02-26
Ngày 12-9-2032,2032-09-12
"May 26, 2016",2016-05-26
27 May 2002,2002-05-27
20330514025227440906,2033-05-14
1596560400000,2020-08-05
Event at 1995-03-02T17:59:28,1995-03-02
5.11.1999T9-7-9,1999-11-05
9 tháng 12 năm 2031,2031-12-09
06_07_1993,1993-06-07
6-8-2030,2030-08-06
882205200000000000,1997-12-16
2002-05-19T02:11:25.330Z,2002-05-19
2030-11-30T22:21:34.787189501Z,2030-11-30
11/10-2031,2031-05-11
2020525200000000,2034-01-11
2032-06-19T05:02:18.634415842Z,2032-06-19
23-07-29,2029-07-23
Sự kiện diễn ra vào 19/10/2012 22:41,2012-10-19
19-12-34,2034-12-19
"18th of October, 2026",2026-10-18
1996_01_12T8_0_33Z+3,1996-01-12
04_02_2001,2001-04-02
54-9-2007,2007-09-27
2020/11/11T161651,2020-11-11
ngày 30 tháng 8 năm 2009,2009-08-30
"24th of November, 2004",2004-11-24
ngày 5 tháng 1 năm 2005,2005-01-05
2023_02_17T23_14_34+0500,2023-02-17
ngày 22 tháng 12 năm 2035,2035-12-22
2 Oct 1993,1993-10-02
5.6.2005T6-19-28,2005-06-05
915123600000,1999-01-01
12/11/2016 giờ 2:40:47,2016-11-12
2003-02-12T09:43:33Z+3,2003-02-12
Sự kiện diễn ra vào 9/1/1991 1:4,1991-01-09
22-12-2005,2005-12-22
ngày 21 tháng 9 năm 2005,2005-09-21
2006-03-09T03:52:22+2500,2006-03-09
2-4-2028,2028-04-02
747853200000000000,1993-09-13
5.6.1995T17-30-11,1995-06-05
"February 5, 2021",2021-02-05
2033-01-25T05:47:58.396410405Z,2033-01-25
21.9.2003,2003-09-21
8/20-2031,2031-10-08
2000-02-06T14:33:05.786Z,2000-02-06
2000566800,2033-05-25
1224522000,2008-10-21
2013.11.18,2013-11-18
12_01_2019,2019-12-01
20|2|2021,2021-02-20
Ngày 5-1-2004,2004-01-05
Ngày 11-5-2022,2022-05-11
932576400000000000,1999-07-22
Event at 2019-03-07T21:32:17,2019-03-07
2012-10-18T08:23:54+2500,2012-10-18
Event at 2001-09-20T5:7:54,2001-09-20
27 01 92,1992-01-27
825094800000000,1996-02-24
The system recorded 20040625035400,2004-06-25
2011-11-28T23:21:52.838Z,2011-11-28
2018-06-22T15:25:16+2500,2018-06-22
20280115122709,2028-01-15
20320406001306725665,2032-04-06
21/01/09,2009-01-21
12 December 2031,2031-12-12
20140619233059674311,2014-06-19
2012_07_17,2012-07-17
ngày 28 tháng 6 năm 1991,1991-06-28
1.7.2000T2-17-38,2000-07-01
20091027225611808118408,2009-10-27
1999_12_04T0_1_40+08,1999-12-04
1457370000000,2016-03-08
2016-06-20T04:26:52+3,2016-06-20
2017-08-11T07:53:15+3,2017-08-11
2/6-2035,2035-03-02
18.01.26,2026-01-18
2019-06-24,2019-06-24
56-6-2004,2004-06-28
5-11-2033,2033-11-05
722624400000000000,1992-11-25
Sự kiện diễn ra vào 26/7/1994 4:44,1994-07-26
25/16-2007,2007-08-25
2016-01-04T21:22:56-05:00,2016-01-04
20270203190311161539,2027-02-03
1993-09-25T03:28:59.707Z,1993-09-25
34-7-2014,2014-07-17
08 20 2003,2003-08-20
9/11/2006 giờ 19:35:12,2006-11-09
1357578000000000000,2013-01-08
21-5-2031,2031-05-21
1/9/1997 giờ 9:55:24,1997-09-01
1993-01-21T08:48:41.661Z,1993-01-21
16/8/2000 giờ 5:6:53,2000-08-16
Event at 2006-01-08T0:59:40,2006-01-08
20180216033602914209882,2018-02-16
1|3|2003,2003-03-01
8/18-2028,2028-09-08
20040209074232,2004-02-09
14 November 2021,2021-11-14
20171123030134888747649,2017-11-23
2020-06-20T12:29:06.716Z,2020-06-20
1788973200000000000,2026-09-10
2023-06-18T00:11:59+2500,2023-06-18
26 tháng 8 năm 2001,2001-08-26
24_07_23,2023-07-24
24.8.1991T18-28-26,1991-08-24
2007-01-31T06:01:13.568224446Z,2007-01-31
Sự kiện diễn ra vào 15/8/2016 20:20,2016-08-15
Sự kiện diễn ra vào 5/9/2016 11:43,2016-09-05
2013-10-19T11:21:46+2500,2013-10-19
2028 01 28,2028-01-28
2012.08.09,2012-08-09
2027/9/1T17476,2027-09-01
897670800000000000,1998-06-13
ngày 9 tháng 6 năm 2001,2001-06-09
2018-04-06T04:01:01.639106Z,2018-04-06
1069520400000,2003-11-23
5 tháng 1 năm 2034,2034-01-05
22.3.2021T11-10-56,2021-03-22
2017-10-26,2017-10-26
2.2.2024,2024-02-02
2011-09-03T13:30:08.650631566Z,2011-09-03
2000-02-18T14:05:33Z,2000-02-18
The system recorded 20200301063626,2020-03-01
"January 29, 2010",2010-01-29
2015-03-01T22:19:30.354181Z,2015-03-01
1774803600000,2026-03-30
The system recorded 19921217001145,1992-12-17
18/10-2017,2017-05-18
Ngày 16-10-2004,2004-10-16
"8th of October, 2009",2009-10-08
8/10-2011,2011-05-08
2-11-2033,2033-11-02
The system recorded 20021118185030,2002-11-18
18-3-2003,2003-03-09
Sự kiện diễn ra vào 25/2/2017 5:15,2017-02-25
2033-01-05T07:16:44-0330,2033-01-05
1669222800000000000,2022-11-24
5-4-2011,2011-04-05
2023-05-06T15:07:59Z,2023-05-06
21/2-2024,2024-01-21
2025-11-29T01:12:19.672Z,2025-11-29
20201005014200546967013,2020-10-05
Ngày 22-2-1998,1998-02-22
2010/3/23T114345,2010-03-23
24.1.1996T1-31-20,1996-01-24
2010-01-30T00:45:20.854080746Z,2010-01-30
1316019600000,2011-09-15
ngày 8 tháng 1 năm 2024,2024-01-08
3/2/1997 giờ 11:24:2,1997-02-03
20111129001933537,2011-11-29
20170927064903266,2017-09-27
3 Aug 2022,2022-08-03
19960129160843,1996-01-29
22 tháng 2 năm 1999,1999-02-22
2021_10_17T7_29_43+3,2021-10-17
2015-05-14T08:56:28Z+3,2015-05-14
20 March 1995,1995-03-20
20111112071513769,2011-11-12
1990-06-15T10:46:47Z,1990-06-15
1992-10-10T16:49:13.319843Z,1992-10-10
20321103070148462538272,2032-11-03
"May 8, 2008",2008-05-08
2009-09-11T09:28:11.211199584Z,2009-09-11
25 Mar 1997,1997-03-25
20/08/00,2000-08-20
20000425061249,2000-04-25
5 February 2015,2015-02-05
Ngày 14-11-2008,2008-11-14
Event at 1993-01-06T13:34:12,1993-01-06
2071933200000000000,2035-08-29
20260104061042180,2026-01-04
Event at 2021-08-15T21:5:20,2021-08-15
"January 26, 1993",1993-01-26
20201227231309,2020-12-27
2012-07-05T19:21:37,2012-07-05
9.5.1994T2-49-57,1994-05-09
26 June 2024,2024-06-26
2011-07-03T07:06:28.495727123Z,2011-07-03
959533200,2000-05-29
03|01|2027,2027-03-01
2018_05_01T1_27_13-05:00,2018-05-01
20.8.2018T19-44-33,2018-08-20
"16th of March, 2017",2017-03-16
2026-04-28T12:52:17,2026-04-28
3 Jul 2033,2033-07-03
20210301215850799,2021-03-01
The system recorded 20160207034833,2016-02-07
1995-05-31T11:38:59.543674249Z,1995-05-31
20170412215146924567781,2017-04-12
1998/7/13T18512,1998-07-13
891882000,1998-04-07
1999-09-01T02:42:51Z+3,1999-09-01
"April 7, 2029",2029-04-07
Event at 2010-02-22T4:49:47,2010-02-22
28 tháng 2 năm 2016,2016-02-28
05.24.2027,2027-05-24
"May 3, 2011",2011-05-03
2000_08_26T19_26_58-05:00,2000-08-26
2004-09-08T21:51:33.441919119Z,2004-09-08
28 April 2003,2003-04-28
The system recorded 20270105095354,2027-01-05
2034/2/4T101651,2034-02-04
1 Jun 1996,1996-06-01
4-1-2010,2010-01-02
"February 10, 1996",1996-02-10
18 Feb 2013,2013-02-18
19940115133515,1994-01-15
Event at 1990-04-03T5:21:14,1990-04-03
Sự kiện diễn ra vào 10/7/2029 9:1,2029-07-10
Sự kiện diễn ra vào 22/10/2035 2:31,2035-10-22
19951127020327568921,1995-11-27
2028-06-18T08:58:00+2500,2028-06-18
861987600000000,1997-04-26
20341128074607454150,2034-11-28
24 Apr 1993,1993-04-24
Ngày 5-4-2031,2031-04-05
8-9-1996,1996-09-04
1543856400000,2018-12-04
Ngày 4-2-1994,1994-02-04
917715600,1999-01-31
"April 15, 2023",2023-04-15
19950508194918036456,1995-05-08
1711731600,2024-03-30
ngày 17 tháng 5 năm 2034,2034-05-17
34-5-2018,2018-05-17
2017_10_17,2017-10-17
25/2/1999 giờ 0:33:2,1999-02-25
19.6.2001T15-19-9,2001-06-19
2035-06-27T17:14:48,2035-06-27
1993-05-14T21:18:58.824823019Z,1993-05-14
Event at 1998-06-14T13:44:27,1998-06-14
891536400000000000,1998-04-03
The system recorded 20050429061944,2005-04-29
20010228125736614,2001-02-28
1995/08/11,1995-08-11
2023-04-12T03:43:12+07:00,2023-04-12
2026-09-24T04:43:21-0300,2026-09-24
1456074000000,2016-02-22
19980321002132706,1998-03-21
20351109030707554,2035-11-09
2015_10_13T2_58_19Z,2015-10-13
20040219102425188,2004-02-19
The system recorded 19990913023915,1999-09-13
2031-10-07T20:53:56+00:00,2031-10-07
20250523132311,2025-05-23
2025/1/26T203426,2025-01-26
20230415232224,2023-04-15
15/11/2032 giờ 4:50:5,2032-11-15
791917200,1995-02-05
20020106212446165134,2002-01-06
27/10/2000 giờ 8:16:1,2000-10-27
3 tháng 3 năm 2012,2012-03-03
"30th of March, 2029",2029-03-30
"3rd of March, 1991",1991-03-03
Event at 1992-10-26T11:47:47,1992-10-26
6.2.2025T2-30-11,2025-02-06
ngày 9 tháng 6 năm 1997,1997-06-09
Sự kiện diễn ra vào 28/1/2012 12:27,2012-01-28
26 November 2026,2026-11-26
15 tháng 11 năm 2005,2005-11-15
1-5-2020,2020-05-01
The system recorded 20270422112957,2027-04-22
19940818150551003974379,1994-08-18
06_10_32,2032-10-06
2011_11_27T1_1_7Z,2011-11-27
54-1-1996,1996-01-27
2000-10-29T20:52:21,2000-10-29
17|04|31,2031-04-17
863974800000,1997-05-19
Event at 2013-06-18T3:24:47,2013-06-18
1995-06-28T04:42:00Z+3,1995-06-28
20030413203148113,2003-04-13
20211009233611870687,2021-10-09
The system recorded 20310526020609,2031-05-26
21.10.2029,2029-10-21
716662800000,1992-09-17
03_05_2033,2033-03-05
2009-01-29T12:20:40Z+3,2009-01-29
12.2.1996T20-52-41,1996-02-12
2026/4/1T215810,2026-04-01
2030-04-14T21:23:05-05:00,2030-04-14
2012-05-12T16:20:20,2012-05-12
23/14-2035,2035-07-23
1999/4/14T20159,1999-04-14
2033-08-21,2033-08-21
14/12/2001 giờ 16:58:28,2001-12-14
2018/01/28,2018-01-28
01.20.2005,2005-01-20
1994_06_27T8_42_17Z+3,1994-06-27
20131212030116189846,2013-12-12
07 18 2033,2033-07-18
24_9_2026,2026-09-24
7.5.2026T7-13-15,2026-05-07
The system recorded 19970513162721,1997-05-13
52-11-2013,2013-11-26
2057331600000000,2035-03-13
ngày 3 tháng 2 năm 2018,2018-02-03
1380042000000000000,2013-09-25
20300805044126259809049,2030-08-05
16/06/10,2010-06-16
30 August 2035,2035-08-30
9 tháng 9 năm 2006,2006-09-09
19910108193302,1991-01-08
1966525200000,2032-04-26
ngày 19 tháng 7 năm 2014,2014-07-19
Ngày 14-9-1995,1995-09-14
1892394000000000,2029-12-20
2025_12_22T15_10_53+08,2025-12-22
15 Feb 2013,2013-02-15
23 June 1990,1990-06-23
Event at 2001-10-04T1:42:27,2001-10-04
ngày 9 tháng 12 năm 2027,2027-12-09
2009_11_08,2009-11-08
"25th of December, 1992",1992-12-25
2019-12-18T06:51:53.670912Z,2019-12-18
20350928023912187670285,2035-09-28
Sự kiện diễn ra vào 19/4/2004 7:58,2004-04-19
1175101200,2007-03-29
2027-10-23T18:09:00.101783Z,2027-10-23
2017-10-04T18:29:20Z+3,2017-10-04
06 04 2002,2002-06-04
20271007005708693002,2027-10-07
Event at 2027-11-29T22:8:16,2027-11-29
22.1.2027,2027-01-22
1995-04-06T09:11:43Z+3,1995-04-06
08.27.2029,2029-08-27
16.11.2022T15-5-28,2022-11-16
1826470800000000000,2027-11-18
10-13-2005,2005-10-13
Sự kiện diễn ra vào 20/7/1997 18:30,1997-07-20
2023-11-11T07:54:54.717333965Z,2023-11-11
1785171600000,2026-07-28
"27th of May, 2027",2027-05-27
2022 08 28,2022-08-28
2028/12/21T95659,2028-12-21
29.5.2003T21-8-6,2003-05-29
20030923131015224382094,2003-09-23
24.05.96,1996-05-24
17 tháng 11 năm 2018,2018-11-17
2029-02-04T23:20:37Z+3,2029-02-04
12-06-02,2002-06-12
20051212183216628,2005-12-12
1307898000000000,2011-06-13
21.10.2007,2007-10-21
15 tháng 1 năm 2011,2011-01-15
20201229125933004190,2020-12-29
Event at 2000-11-15T19:24:14,2000-11-15
2025-12-28T13:50:00.795051Z,2025-12-28
2010-01-30,2010-01-30
1672678800000,2023-01-03
780166800,1994-09-22
"26th of November, 2013",2013-11-26
2003-05-03T04:15:33+2500,2003-05-03
27 October 2035,2035-10-27
07.28.2023,2023-07-28
19940628120804767,1994-06-28
Event at 2026-07-08T20:6:32,2026-07-08
1337533200,2012-05-21
13 November 2021,2021-11-13
"October 6, 2013",2013-10-06
1540400400000000,2018-10-25
1838912400,2028-04-10
The system recorded 20290804040155,2029-08-04
2025-11-10T00:40:03.120670997Z,2025-11-10
2004-04-25T12:54:32+2500,2004-04-25
1998-02-20T22:08:31+2500,1998-02-20
2032-08-05T09:10:40.207680872Z,2032-08-05
2012-12-09T00:10:34.330448Z,2012-12-09
8-8-2030,2030-08-08
Sự kiện diễn ra vào 22/8/2000 19:0,2000-08-22
15 Nov 2025,2025-11-15
2034-10-04T09:33:23+0500,2034-10-04
Ngày 13-6-2005,2005-06-13
28/3/2029 giờ 19:51:35,2029-03-28
2014/7/28T374,2014-07-28
Sự kiện diễn ra vào 17/10/2016 16:6,2016-10-17
48-3-2002,2002-03-24
1159030800,2006-09-24
1998-09-14T12:06:40.418064Z,1998-09-14
2006-05-21T10:10:18.175Z,2006-05-21
1583686800,2020-03-09
20191028134352055688,2019-10-28
ngày 3 tháng 7 năm 2019,2019-07-03
06|08|91,1991-08-06
20080404001717910471044,2008-04-04
20240922052434289509611,2024-09-22
Ngày 10-7-2013,2013-07-10
04_02_2032,2032-04-02
22-2-2006,2006-02-11
19911026192835,1991-10-26
24 Sep 2030,2030-09-24
1998-03-30T00:15:45,1998-03-30
Event at 2002-09-18T0:0:23,2002-09-18
1 tháng 4 năm 1997,1997-04-01
9 Nov 2022,2022-11-09
2004-07-15T01:46:37.851Z,2004-07-15
1416762000,2014-11-24
"June 20, 2035",2035-06-20
2006-10-09T21:06:41,2006-10-09
20030823224244383416,2003-08-23
26-5-2017,2017-05-26
1791306000,2026-10-07
1998-09-18T01:07:07.819176626Z,1998-09-18
Event at 2010-01-19T0:17:11,2010-01-19
21 April 1992,1992-04-21
03|05|2014,2014-03-05
1990/1/14T62041,1990-01-14
"April 18, 2024",2024-04-18
1670605200000,2022-12-10
ngày 1 tháng 3 năm 2006,2006-03-01
1398618000000000000,2014-04-28
19-9-2020,2020-09-19
2035/8/7T14817,2035-08-07
"4th of July, 2021",2021-07-04
2025-02-04,2025-02-04
The system recorded 20130507220931,2013-05-07
2027-04-16T23:20:02+2500,2027-04-16
867085200,1997-06-24
2070291600000000,2035-08-10
2025-03-26T19:07:42+08,2025-03-26
16 tháng 9 năm 2015,2015-09-16
14 Sep 1997,1997-09-14
29-7-2029,2029-07-29
"30th of January, 2027",2027-01-30
2021043600000,2034-01-17
2010/4/25T112156,2010-04-25
1941555600000000,2031-07-12
2005-02-24T15:47:56Z,2005-02-24
2005-11-29T16:37:14,2005-11-29
21/09/04,2004-09-21
2029-06-09T04:08:28.613517804Z,2029-06-09
6/24-1995,1995-12-06
Sự kiện diễn ra vào 5/12/1991 14:46,1991-12-05
27-8-2027,2027-08-27
ngày 29 tháng 1 năm 2005,2005-01-29
702320400000000,1992-04-04
32-10-2031,2031-10-16
1796490000000,2026-12-06
19910526013147578,1991-05-26
20340911202409220474281,2034-09-11
24 January 1998,1998-01-24
"December 31, 1998",1998-12-31
2034-01-13T04:24:16.624Z,2034-01-13
20290522022436016,2029-05-22
3/10-1996,1996-05-03
2033-07-25T20:49:33.893873090Z,2033-07-25
20230412214027,2023-04-12
22 January 1999,1999-01-22
2009-04-24T11:29:30Z+3,2009-04-24
Ngày 14-11-2010,2010-11-14
2011-10-03T04:11:31.140720Z,2011-10-03
1995037200000,2033-03-22
16|7|2012,2012-07-16
09_15_2009,2009-09-15
The system recorded 19960909221324,1996-09-09
11/11/2028 giờ 15:50:53,2028-11-11
2032-04-02T10:39:41+2500,2032-04-02
2004-04-01T17:56:48.601980704Z,2004-04-01
"February 8, 2029",2029-02-08
2032-01-13T11:57:53+2500,2032-01-13
1-1-2015,2015-01-01
11 December 2021,2021-12-11
6.11.2019T21-31-47,2019-11-06
10 8 2028,2028-08-10
1858438800000,2028-11-22
Ngày 14-8-2022,2022-08-14
25 tháng 11 năm 2010,2010-11-25
10-12-2021,2021-12-05
13/12-1992,1992-06-13
19/10/2009 giờ 2:13:28,2009-10-19
1454346000,2016-02-02
30 June 2032,2032-06-30
ngày 6 tháng 12 năm 2018,2018-12-06
2018-12-30T17:37:55.050700720Z,2018-12-30
1990-07-27T08:05:25+2500,1990-07-27
09-04-1990,1990-09-04
1804352400,2027-03-07
Event at 1994-08-14T9:4:12,1994-08-14
1652029200000000000,2022-05-09
2.3.1992T20-16-36,1992-03-02
2026-03-04T20:17:15.735Z,2026-03-04
19911104185744290091,1991-11-04
"10th of October, 2016",2016-10-10
2013-06-03T06:26:27.130585560Z,2013-06-03
1068742800000000,2003-11-14
ngày 15 tháng 8 năm 1994,1994-08-15
The system recorded 19951124151258,1995-11-24
22 Jun 1990,1990-06-22
20320517085903269093,2032-05-17
7/16-2005,2005-08-07
1.8.2027T19-36-12,2027-08-01
20240903214515873,2024-09-03
2029-06-07T05:59:23,2029-06-07
21 tháng 10 năm 2032,2032-10-21
1447693200000000000,2015-11-17
1827507600,2027-11-30
4 tháng 10 năm 2033,2033-10-04
2007-03-17T09:54:16+07:00,2007-03-17
20061025115508978,2006-10-25
Sự kiện diễn ra vào 20/1/2011 8:2,2011-01-20
20280125023924582338,2028-01-25
1821632400,2027-09-23
820688400,1996-01-04
"February 6, 2015",2015-02-06
8/10/1999 giờ 15:12:43,1999-10-08
14_12_24,2024-12-14
2017-01-04T12:51:18.401419105Z,2017-01-04
2027-04-15T17:08:30.913861Z,2027-04-15
2011/05/01,2011-05-01
The system recorded 20201010134936,2020-10-10
Ngày 29-8-2001,2001-08-29
ngày 7 tháng 7 năm 2010,2010-07-07
54-1-1990,1990-01-27
3-5-1990,1990-05-03
"June 27, 2020",2020-06-27
4 October 2000,2000-10-04
"24th of May, 2005",2005-05-24
Ngày 2-3-2032,2032-03-02
2019-09-14T16:42:11Z+3,2019-09-14
2005-07-26T08:01:39Z+3,2005-07-26
1991-12-17T11:29:34Z+3,1991-12-17
26/6-2018,2018-03-26
20151001212239,2015-10-01
2033-09-13T18:43:41.624Z,2033-09-13
2008-08-18T03:24:54+2500,2008-08-18
30-4-2031,2031-04-30
The system recorded 20180227185805,2018-02-27
20140212181815239,2014-02-12
1278435600000000,2010-07-07
1995-10-12T22:59:51.650Z,1995-10-12
1222362000000000,2008-09-26
30/18-1993,1993-09-30
11 tháng 9 năm 2003,2003-09-11
19900615111728,1990-06-15
1217091600000,2008-07-27
19940404222301939298580,1994-04-04
20070621025232514857425,2007-06-21
20221110030036,2022-11-10
The system recorded 20281007064830,2028-10-07
21.7.2014,2014-07-21
2030-03-01T14:53:02+2500,2030-03-01
"15th of May, 2023",2023-05-15
2001-11-15T15:50:10.733Z,2001-11-15
The system recorded 20030301212427,2003-03-01
2029-02-17T05:47:38-0330,2029-02-17
3 Aug 2003,2003-08-03
2016-09-07T05:21:57.166588Z,2016-09-07
1216141200000,2008-07-16
10.04.96,1996-04-10
"February 13, 2009",2009-02-13
6-11-1993,1993-11-06
20130217205534222856,2013-02-17
2013-08-30T19:12:12.004621292Z,2013-08-30
Sự kiện diễn ra vào 13/2/2009 0:25,2009-02-13
1996/6/1T23223,1996-06-01
2004-04-27T23:45:08+2500,2004-04-27
1992-03-14T15:34:37.128Z,1992-03-14
22 February 1999,1999-02-22
ngày 5 tháng 1 năm 2018,2018-01-05
20340413160841,2034-04-13
1290445200,2010-11-23
10-10-2014,2014-10-05
2004-12-04T22:29:44Z+3,2004-12-04
6-10-2021,2021-10-06
"February 26, 2008",2008-02-26
13-8-1998,1998-08-13
20110307013829892258592,2011-03-07
9 Sep 2003,2003-09-09
"3rd of October, 1991",1991-10-03
20321125201222616294,2032-11-25
2001_04_25T9_32_40+00:00,2001-04-25
20320721014544884443,2032-07-21
Ngày 11-11-2008,2008-11-11
2035-01-19T13:20:28.314096859Z,2035-01-19
20181221142807337826,2018-12-21
2031-05-03T14:36:51Z+3,2031-05-03
1992-04-26T13:05:12Z,1992-04-26
1311094800,2011-07-20
23 February 2005,2005-02-23
Sự kiện diễn ra vào 29/5/1999 2:5,1999-05-29
1942160400000000,2031-07-19
2004-05-11T15:09:18+2500,2004-05-11
19981018182632227,1998-10-18
Event at 2015-02-05T12:6:26,2015-02-05
4-12-2025,2025-12-02
2023-12-25T09:37:02Z+3,2023-12-25
2016-09-15T20:09:03.315864Z,2016-09-15
2021_05_12T14_33_38Z,2021-05-12
2024/2/8T42630,2024-02-08
1325955600,2012-01-08
20020901164733711,2002-09-01
1621616400000000,2021-05-22
2 tháng 5 năm 2029,2029-05-02
The system recorded 19940113204237,1994-01-13
2002-12-25T00:40:33Z+3,2002-12-25
791571600000000000,1995-02-01
2004-10-29T17:44:31.685033988Z,2004-10-29
27/14-2032,2032-07-27
1109264400000000000,2005-02-25
1998-09-20T11:16:39,1998-09-20
12/11/2009 giờ 10:35:33,2009-11-12
1995-06-22T16:26:59.503Z,1995-06-22
2027-04-03T18:21:16.720999Z,2027-04-03
2002-12-29T11:21:00+2500,2002-12-29
1034355600000000000,2002-10-12
14 tháng 5 năm 2024,2024-05-14
1/8-1995,1995-04-01
3/6-2027,2027-03-03
ngày 24 tháng 12 năm 2022,2022-12-24
ngày 24 tháng 9 năm 2019,2019-09-24
19921012023009384223,1992-10-12
1098378000000000,2004-10-22
8 Aug 2011,2011-08-08
20060704105300,2006-07-04
13 tháng 3 năm 1999,1999-03-13
The system recorded 20140918032411,2014-09-18
1685206800000,2023-05-28
Sự kiện diễn ra vào 9/9/2018 6:12,2018-09-09
2018_04_27T19_52_44+07:00,2018-04-27
2025-02-15T14:35:51+2500,2025-02-15
19981205155336186523,1998-12-05
19990222134716027239,1999-02-22
1995-03-19T07:40:38Z+3,1995-03-19
20000207125202918,2000-02-07
02.28.1994,1994-02-28
The system recorded 20010224184328,2001-02-24
1149354000000000,2006-06-04
1415898000000000,2014-11-14
2008-09-30T20:46:01Z+3,2008-09-30
2011_06_16T10_57_49+2500,2011-06-16
2022_11_23,2022-11-23
2027_04_20T15_41_40-0330,2027-04-20
20290121023809760392797,2029-01-21
2023-09-16T16:50:33.157430061Z,2023-09-16
1532106000000000,2018-07-21
Event at 2034-01-07T16:23:37,2034-01-07
The system recorded 19900320162529,1990-03-20
2029_05_15T11_3_43+3,2029-05-15
2014-09-04T14:44:07.006Z,2014-09-04
22 tháng 4 năm 2008,2008-04-22
1611939600000,2021-01-30
1201626000000000,2008-01-30
The system recorded 20080722014416,2008-07-22
1900861200,2030-03-28
29.6.2014T16-54-16,2014-06-29
ngày 2 tháng 5 năm 2016,2016-05-02
2016-12-15T18:51:35.941Z,2016-12-15
10-08-2011,2011-10-08
1890493200,2029-11-28
Sự kiện diễn ra vào 29/5/1998 15:30,1998-05-29
19900207135628962899,1990-02-07
36-8-1992,1992-08-18
19910307050225549696039,1991-03-07
Event at 2031-03-19T0:55:27,2031-03-19
2013-10-28T22:07:46,2013-10-28
2009-08-11T17:28:03.660795Z,2009-08-11
1531501200000,2018-07-14
Event at 2034-01-26T19:32:13,2034-01-26
Sự kiện diễn ra vào 18/1/2000 17:53,2000-01-18
2029-10-29T10:35:22.060Z,2029-10-29
19.1.2024T17-1-26,2024-01-19
The system recorded 19930427042726,1993-04-27
04 05 93,1993-05-04
"August 26, 1990",1990-08-26
2018-05-25T03:37:39+3,2018-05-25
16/8/2010 giờ 15:4:29,2010-08-16
3 tháng 6 năm 1998,1998-06-03
1335805200000000000,2012-05-01
29 tháng 9 năm 1999,1999-09-29
22-12-2002,2002-12-22
1996-05-16T23:35:36.355572168Z,1996-05-16
12 Mar 2007,2007-03-12
12/7/2031 giờ 1:11:14,2031-07-12
02_08_91,1991-08-02
"29th of March, 1994",1994-03-29
2020-11-17T10:05:01.899Z,2020-11-17
1836838800000000,2028-03-17
1757523600000000000,2025-09-11
2026-06-17T01:05:22.565Z,2026-06-17
Sự kiện diễn ra vào 7/9/1991 15:13,1991-09-07
2059923600000000000,2035-04-12
1097946000000000000,2004-10-17
20260302115914597,2026-03-02
2032-09-11T03:08:41+2500,2032-09-11
1 tháng 9 năm 2030,2030-09-01
2006-01-02T21:32:03.082Z,2006-01-02
16_11_2018,2018-11-16
07 05 2015,2015-07-05
30.08.04,2004-08-30
12-1-2003,2003-01-06
1514221200000,2017-12-26
1996-05-29T10:52:56.681934Z,1996-05-29
2034-06-18T23:28:43Z+3,2034-06-18
Ngày 21-12-2006,2006-12-21
20140927040432528,2014-09-27
"21th of October, 2027",2027-10-21
Sự kiện diễn ra vào 26/9/2003 23:5,2003-09-26
20330502171234,2033-05-02
2001/2/16T225326,2001-02-16
"10th of June, 2033",2033-06-10
2010-01-06T15:10:07,2010-01-06
16/16-2018,2018-08-16
Sự kiện diễn ra vào 14/8/2001 10:43,2001-08-14
26 Jan 2022,2022-01-26
17-2-1992,1992-02-17
The system recorded 20050501120129,2005-05-01
1998-11-25T11:36:21+07:00,1998-11-25
1111251600,2005-03-20
2009-03-04T12:39:44.604240961Z,2009-03-04
2027_09_17T11_54_58+0500,2027-09-17
1631206800000000,2021-09-10
Ngày 11-1-2016,2016-01-11
Ngày 13-6-2023,2023-06-13
20080909201752,2008-09-09
2024-02-28T16:43:10.060594Z,2024-02-28
7-3-2009,2009-03-07
26.9.2003,2003-09-26
"January 6, 2032",2032-01-06
2029-04-16T13:26:21.961053Z,2029-04-16
1991-11-24T01:07:33,1991-11-24
ngày 19 tháng 6 năm 2006,2006-06-19
24/20-2014,2014-10-24
Sự kiện diễn ra vào 24/5/2019 9:31,2019-05-24
"December 13, 2017",2017-12-13
673203600000000,1991-05-03
The system recorded 19960529013838,1996-05-29
12-2-2002,2002-02-06
1318698000000000000,2011-10-16
10_20_2034,2034-10-20
The system recorded 20160321070023,2016-03-21
2019-11-04T08:17:37Z+3,2019-11-04
1587315600,2020-04-20
28/8/2008 giờ 23:49:2,2008-08-28
2027-11-18T18:03:49.323422359Z,2027-11-18
1998-04-28T23:19:59.487Z,1998-04-28
686422800000,1991-10-03
2033-07-06T23:34:20.812Z,2033-07-06
20/10/94,1994-10-20
22/8/2013 giờ 13:49:47,2013-08-22
01.23.1992,1992-01-23
821638800,1996-01-15
721414800000000,1992-11-11
1995-07-17T12:52:33.994400Z,1995-07-17
14 Mar 2011,2011-03-14
1994-01-06T16:35:19.955396799Z,1994-01-06
731523600000000,1993-03-08
2026-11-02T04:21:42Z,2026-11-02
The system recorded 20030427202008,2003-04-27
13 tháng 2 năm 2023,2023-02-13
14-2-2028,2028-02-14
2010.05.21,2010-05-21
"October 29, 2035",2035-10-29
Event at 1990-05-03T20:21:52,1990-05-03
2023-01-24T19:05:12.250Z,2023-01-24
31/24-2014,2014-12-31
2018-04-05T05:10:13.731278145Z,2018-04-05
31 tháng 8 năm 2031,2031-08-31
Ngày 29-10-2026,2026-10-29
24-5-2016,2016-05-12
1999-10-15T19:59:21.188092610Z,1999-10-15
12 16 2031,2031-12-16
22 Jan 2033,2033-01-22
1032195600000,2002-09-17
2020-08-15T05:03:53+2500,2020-08-15
3 Oct 2025,2025-10-03
2032-11-24T23:39:37+2500,2032-11-24
9 tháng 11 năm 2014,2014-11-09
Ngày 28-9-2005,2005-09-28
3 August 2019,2019-08-03
6 Jun 2032,2032-06-06
19920222132245286583,1992-02-22
8 August 2016,2016-08-08
09-12-10,2010-12-09
2020-03-21T09:34:08+2500,2020-03-21
20280517110953848094728,2028-05-17
ngày 2 tháng 3 năm 2007,2007-03-02
2011-01-13T22:17:12.195926891Z,2011-01-13
Event at 2034-12-19T6:4:5,2034-12-19
2010/8/10T35951,2010-08-10
1818608400000000,2027-08-19
09_16_2022,2022-09-16
30-11-2031,2031-11-15
1301504400000000000,2011-03-31
27.9.2017,2017-09-27
The system recorded 20310822063356,2031-08-22
11.5.2000T22-12-0,2000-05-11
2009-04-05T09:48:42+2500,2009-04-05
16 March 2018,2018-03-16
19/7/2018,2018-07-19
Event at 1994-10-03T10:14:50,1994-10-03
2014-10-09T18:37:26Z+3,2014-10-09
20050505200632,2005-05-05
1089565200,2004-07-12
2029-07-01T20:49:10Z,2029-07-01
02_02_30,2030-02-02
"1st of February, 2019",2019-02-01
20111127200819216514,2011-11-27
20091108035001,2009-11-08
685731600000000,1991-09-25
22 07 91,1991-07-22
2003_07_19T11_7_59+00:00,2003-07-19
"February 13, 2023",2023-02-13
27.1.2035T15-19-4,2035-01-27
5.1.2019T10-33-47,2019-01-05
42-10-2003,2003-10-21
2003-03-20T06:41:50.579Z,2003-03-20
23/18-2009,2009-09-23
2003-05-12T01:34:19+2500,2003-05-12
1996-09-17T11:18:19.762Z,1996-09-17
2034.01.30,2034-01-30
2014/7/16T17342,2014-07-16
"10th of June, 2035",2035-06-10
2013_05_20T12_0_49+2500,2013-05-20
2009-09-13T10:23:16Z+3,2009-09-13
29/4/2014 giờ 21:48:50,2014-04-29
1173718800000000000,2007-03-13
Event at 1998-10-26T4:8:11,1998-10-26
1906563600000000,2030-06-02
Event at 2018-04-07T4:48:56,2018-04-07
"11th of August, 2018",2018-08-11
Event at 2014-03-12T20:8:35,2014-03-12
8|1|1994,1994-01-08
16.08.22,2022-08-16
797446800000,1995-04-10
6-10-2024,2024-10-06
1998 10 01,1998-10-01
20351215055049,2035-12-15
2031-01-23T07:19:52,2031-01-23
7/2-2001,2001-01-07
28 tháng 3 năm 1990,1990-03-28
Event at 1999-07-18T20:46:20,1999-07-18
2000-03-17T06:56:44Z+3,2000-03-17
Event at 1998-01-14T15:29:57,1998-01-14
20340429144700394067,2034-04-29
1992-10-13T06:25:05.683Z,1992-10-13
14/8/2032,2032-08-14
Sự kiện diễn ra vào 9/6/2015 19:31,2015-06-09
2015-04-09T18:59:39Z+3,2015-04-09
1991-07-06T21:51:01,1991-07-06
The system recorded 20160511172624,2016-05-11
"July 15, 2000",2000-07-15
4 October 1993,1993-10-04
1415725200000000000,2014-11-12
1075136400000000000,2004-01-27
20041117113058521,2004-11-17
"August 5, 2022",2022-08-05
1991-01-19T12:36:06.351624058Z,1991-01-19
810493200000,1995-09-08
1523725200000000,2018-04-15
13 Jan 2023,2023-01-13
Event at 2032-10-01T19:42:51,2032-10-01
18.7.2005T3-10-9,2005-07-18
10-9-2023,2023-09-05
The system recorded 20311104202500,2031-11-04
2021-04-24T02:01:41.093Z,2021-04-24
8-1-2031,2031-01-04
1711472400000000000,2024-03-27
31-1-2024,2024-01-31
54-6-2005,2005-06-27
20010727011659760,2001-07-27
2010|02|08,2010-02-08
2032-07-07T04:04:33Z+3,2032-07-07
5.1.2033T16-28-55,2033-01-05
"January 19, 2002",2002-01-19
"29th of March, 1990",1990-03-29
05/25/2012,2012-05-25
2028-03-21T21:38:38.965546Z,2028-03-21
1674234000000000,2023-01-21
"7th of November, 2026",2026-11-07
22.4.2027T22-50-37,2027-04-22
26.7.2030T13-29-51,2030-07-26
Sự kiện diễn ra vào 12/3/2007 9:1,2007-03-12
2034-10-20T14:13:58.037064Z,2034-10-20
11 March 2030,2030-03-11
"22th of July, 2006",2006-07-22
"17th of May, 1992",1992-05-17
1990-06-16T15:50:27.174348220Z,1990-06-16
19_04_93,1993-04-19
2030-05-10T21:47:38+2500,2030-05-10
6-6-1990,1990-06-03
13_4_2034,2034-04-13
2007-09-01T14:41:21.255Z,2007-09-01
ngày 9 tháng 9 năm 2015,2015-09-09
20030805223718478,2003-08-05
1991-11-11T02:23:39.676457895Z,1991-11-11
2009-12-09T09:40:22,2009-12-09
26-2-2034,2034-02-26
Ngày 19-1-2003,2003-01-19
Sự kiện diễn ra vào 2/8/1992 7:33,1992-08-02
2024_03_26T22_57_38-0300,2024-03-26
28.10.1997T5-24-36,1997-10-28
The system recorded 19990308060542,1999-03-08
08/13/2031,2031-08-13
2012-09-23T01:02:40-0300,2012-09-23
20161013080715,2016-10-13
1334163600000,2012-04-12
3.4.2005T12-55-27,2005-04-03
3/2-1994,1994-01-03
1/18-2001,2001-09-01
1681923600000000,2023-04-20
19980620122552385,1998-06-20
1644426000000,2022-02-10
22/24-2030,2030-12-22
"14th of May, 2015",2015-05-14
1227200400000,2008-11-21
06/18/1999,1999-06-18
1992|12|29,1992-12-29
1999-12-02T05:04:22,1999-12-02
26 tháng 12 năm 2016,2016-12-26
4.8.2025T4-43-0,2025-08-04
20191103170756,2019-11-03
Ngày 1-3-2015,2015-03-01
2031-06-09T04:17:51Z+3,2031-06-09
Event at 1994-04-04T22:25:28,1994-04-04
28 tháng 6 năm 2004,2004-06-28
Sự kiện diễn ra vào 20/9/2026 8:58,2026-09-20
1990-08-09T18:39:45.998445Z,1990-08-09
2025-02-23T05:36:24.125Z,2025-02-23
1000659600000000000,2001-09-17
2021|03|15,2021-03-15
2016-07-16T08:41:26Z+3,2016-07-16
2013/12/25T121019,2013-12-25
1720803600,2024-07-13
05|13|2005,2005-05-13
"April 12, 2013",2013-04-12
26 Nov 2013,2013-11-26
1998-01-24T09:46:24Z+3,1998-01-24
27 tháng 5 năm 2030,2030-05-27
Sự kiện diễn ra vào 16/12/2006 16:45,2006-12-16
9 tháng 11 năm 1991,1991-11-09
19980811071358276516751,1998-08-11
1991-08-30T20:01:03.992927540Z,1991-08-30
ngày 21 tháng 7 năm 2029,2029-07-21
2009-01-14T23:09:31Z+3,2009-01-14
2009-12-13T00:36:03Z+3,2009-12-13
656614800000000,1990-10-23
1992013200000000,2033-02-15
1569949200,2019-10-02
15|4|1993,1993-04-15
29 Apr 2004,2004-04-29
Event at 2019-12-23T1:17:26,2019-12-23
9.4.2017T17-53-34,2017-04-09
Sự kiện diễn ra vào 17/3/1990 19:51,1990-03-17
20211019153642,2021-10-19
The system recorded 20300131092316,2030-01-31
2012-05-17T07:49:28+0500,2012-05-17
The system recorded 20160423095656,2016-04-23
1079802000,2004-03-21
2013-03-19T12:06:20.156369Z,2013-03-19
2003-03-25T13:09:05.473977644Z,2003-03-25
13 January 2021,2021-01-13
1996-12-02T03:05:50+00:00,1996-12-02
7 Oct 2001,2001-10-07
19920712151032,1992-07-12
11.1.1999T23-30-12,1999-01-11
Ngày 17-4-2011,2011-04-17
04-21-2017,2017-04-21
"February 4, 2020",2020-02-04
11 Aug 2021,2021-08-11
ngày 5 tháng 5 năm 2009,2009-05-05
2020-07-12T05:53:07+2500,2020-07-12
2|7|2010,2010-07-02
Sự kiện diễn ra vào 4/10/2029 0:48,2029-10-04
2022-07-31T10:00:16-05:00,2022-07-31
2019-05-04T01:03:11.722Z,2019-05-04
1590771600000,2020-05-30
20150419132738513,2015-04-19
20130129004111,2013-01-29
20111111161519,2011-11-11
1990-10-03T23:38:37.096Z,1990-10-03
ngày 4 tháng 10 năm 2020,2020-10-04
2008-01-13T01:44:32Z+3,2008-01-13
21 tháng 4 năm 2031,2031-04-21
"15th of December, 1999",1999-12-15
20160102204211643866741,2016-01-02
1994-02-04T07:28:49.721875497Z,1994-02-04
2033-05-05T23:45:05.806188209Z,2033-05-05
6-3-2011,2011-03-06
2035-10-06,2035-10-06
20160715032430438859635,2016-07-15
2013/12/28T205132,2013-12-28
"14th of July, 2022",2022-07-14
2012/8/31T23425,2012-08-31
05|03|10,2010-03-05
10 January 2029,2029-01-10
1995901200,2033-04-01
1991-05-04T19:29:59-05:00,1991-05-04
1996-04-07T19:48:09.529164Z,1996-04-07
1990.05.09,1990-05-09
19-2-1993,1993-02-19
1/4/1997 giờ 12:9:2,1997-04-01
28 tháng 8 năm 2031,2031-08-28
"18th of May, 2017",2017-05-18
16 Nov 1992,1992-11-16
1990-01-03T02:42:41.880104Z,1990-01-03
1456160400000000,2016-02-23
2019-05-10T22:40:42Z+3,2019-05-10
20240802210313793128658,2024-08-02
2029-03-11T06:02:40Z+3,2029-03-11
1 tháng 1 năm 1993,1993-01-01
05_22_1998,1998-05-22
731696400,1993-03-10
19911104144708073,1991-11-04
20010606182948286167834,2001-06-06
1998-01-08T14:34:36.619Z,1998-01-08
Ngày 5-4-2016,2016-04-05
2010-05-02T12:47:12+2500,2010-05-02
20141006220700,2014-10-06
26.01.05,2005-01-26
ngày 13 tháng 6 năm 2005,2005-06-13
25 tháng 11 năm 1994,1994-11-25
18.1.1998T10-25-30,1998-01-18
20070702071527018457177,2007-07-02
30-10-2030,2030-10-15
19/14-2006,2006-07-19
17-3-2034,2034-03-17
"November 18, 2032",2032-11-18
21.4.2031T22-14-6,2031-04-21
2.3.2005T9-16-17,2005-03-02
21/22-2001,2001-11-21
Event at 2034-11-08T16:7:43,2034-11-08
2017-02-03T02:44:14Z+3,2017-02-03
11/6-2012,2012-03-11
"March 6, 1997",1997-03-06
22/16-2024,2024-08-22
1992-04-19T16:47:56,1992-04-19
1421686800,2015-01-20
"25th of December, 1992",1992-12-25
1997-09-14T04:56:53Z+3,1997-09-14
09 03 2005,2005-09-03
26-12-1993,1993-12-26
1-2-2013,2013-02-01
2038064400,2034-08-02
1993/8/25T23518,1993-08-25
20280324205212,2028-03-24
13 May 2014,2014-05-13
20310514115024298446094,2031-05-14
1274547600000000000,2010-05-23
859222800000000000,1997-03-25
Ngày 12-4-2024,2024-04-12
12/2/1993 giờ 3:36:0,1993-02-12
9-10-2015,2015-10-09
26.1.2029T0-41-50,2029-01-26
ngày 29 tháng 8 năm 1993,1993-08-29
1994/6/8T1181,1994-06-08
2035/04/20,2035-04-20
Sự kiện diễn ra vào 8/6/2012 17:37,2012-06-08
28 tháng 10 năm 2009,2009-10-28
1999_11_15T6_21_23-05:00,1999-11-15
22-12-2031,2031-12-22
2016/8/16T232447,2016-08-16
2025/1/4T19318,2025-01-04
2033_06_23,2033-06-23
ngày 6 tháng 2 năm 2033,2033-02-06
20220328204816892089067,2022-03-28
Event at 1997-03-02T23:58:31,1997-03-02
38-12-2022,2022-12-19
2000-05-23T23:24:47,2000-05-23
Ngày 31-10-2023,2023-10-31
1821459600,2027-09-21
The system recorded 20110730094220,2011-07-30
2000-09-23T21:10:52,2000-09-23
2025_10_22,2025-10-22
The system recorded 20001209233403,2000-12-09
"17th of October, 2010",2010-10-17
1/5/2013 giờ 14:5:17,2013-05-01
Event at 2023-05-22T16:38:9,2023-05-22
1 Jun 2002,2002-06-01
06_07_2011,2011-06-07
1995-06-24T03:34:43+2500,1995-06-24
1993/5/18T11534,1993-05-18
07_04_2034,2034-07-04
2033-02-14T18:02:24Z+3,2033-02-14
2035-03-15T07:27:06.709Z,2035-03-15
Ngày 10-8-2028,2028-08-10
1998_11_03T19_38_19-05:00,1998-11-03
2006-12-27T12:54:19.890Z,2006-12-27
1526835600000000000,2018-05-21
20141228135701421,2014-12-28
2017-11-03T22:27:39.688095740Z,2017-11-03
"18th of December, 2012",2012-12-18
29 Aug 1991,1991-08-29
20061111011637817775753,2006-11-11
20100826130057207600435,2010-08-26
Sự kiện diễn ra vào 21/6/2016 12:16,2016-06-21
Sự kiện diễn ra vào 3/7/2019 21:24,2019-07-03
1554397200,2019-04-05
2018-05-21T19:26:34.322863Z,2018-05-21
1158080400000000000,2006-09-13
The system recorded 20010910161142,2001-09-10
13-3-2015,2015-03-13
1415379600000000000,2014-11-08
1046278800,2003-02-27
20/09/20,2020-09-20
"October 24, 1998",1998-10-24
"June 13, 2012",2012-06-13
06|08|2035,2035-06-08
1992-11-19T08:39:01.760527Z,1992-11-19
1994-04-16T04:52:40+0500,1994-04-16
21/1/1995 giờ 20:10:59,1995-01-21
19930811114230222,1993-08-11
1875546000000000,2029-06-08
1998 07 16,1998-07-16
24 tháng 7 năm 2018,2018-07-24
2003/8/29T172626,2003-08-29
2007-03-15T21:07:08.474440Z,2007-03-15
20190203154659345321,2019-02-03
Ngày 9-7-2033,2033-07-09
20270315032328227530,2027-03-15
20-1-2035,2035-01-10
62-5-2006,2006-05-31
13.8.2012,2012-08-13
01.01.2013,2013-01-01
2016/12/17T34311,2016-12-17
22-6-2034,2034-06-22
6 tháng 9 năm 2028,2028-09-06
"January 26, 2013",2013-01-26
Ngày 3-11-2035,2035-11-03
2024/3/31T2059,2024-03-31
1994-07-23T15:23:50.120044243Z,1994-07-23
The system recorded 20000731221846,2000-07-31
933699600000000,1999-08-04
62-7-1993,1993-07-31
20170223094123756591,2017-02-23
23.5.2017,2017-05-23
1270054800000000,2010-04-01
Event at 2030-11-26T19:27:37,2030-11-26
01.24.2034,2034-01-24
2030-07-12T11:54:51.136787908Z,2030-07-12
1165338000000000,2006-12-06
9.12.2014,2014-12-09
19/10/1992 giờ 21:38:7,1992-10-19
2007_07_02T21_26_19+00:00,2007-07-02
24/12-1991,1991-06-24
2029|05|21,2029-05-21
1603990800000000,2020-10-30
20101207132818,2010-12-07
6.9.2021,2021-09-06
36-4-1998,1998-04-18
13|11|1995,1995-11-13
20040127130244242123,2004-01-27
ngày 16 tháng 4 năm 2005,2005-04-16
2021-11-14T02:36:33.187431Z,2021-11-14
643222800000,1990-05-21
1990/5/12T205911,1990-05-12
710355600000000000,1992-07-06
Ngày 8-10-2033,2033-10-08
20261010100615885,2026-10-10
The system recorded 20071231063312,2007-12-31
20160414084056574,2016-04-14
23/6/2033 giờ 20:33:17,2033-06-23
1992-02-08T16:13:11,1992-02-08
20200222013346,2020-02-22
2033-05-26T12:16:48.711605Z,2033-05-26
20121125161059434664,2012-11-25
04-30-2013,2013-04-30
2012-10-22T09:54:11,2012-10-22
"March 15, 1993",1993-03-15
1636736400,2021-11-13
2002-11-03T05:31:29Z+3,2002-11-03
1092762000000000,2004-08-18
The system recorded 20200902152441,2020-09-02
772477200000000,1994-06-25
27-10-2005,2005-10-27
Event at 2019-06-13T16:43:55,2019-06-13
2006-01-08T14:09:50+2500,2006-01-08
2023-01-08T18:25:33.454039Z,2023-01-08
1992-03-15T05:59:22+07:00,1992-03-15
42-12-1999,1999-12-21
20011102062932785236,2001-11-02
9/22-2012,2012-11-09
2034/2/2T102835,2034-02-02
11/25/2017,2017-11-25
ngày 10 tháng 9 năm 2015,2015-09-10
"April 21, 2034",2034-04-21
10-6-2005,2005-06-05
13/10/2016 giờ 13:52:52,2016-10-13
1912352400,2030-08-08
16 11 04,2004-11-16
644346000000000,1990-06-03
"20th of July, 2028",2028-07-20
The system recorded 20040816131945,2004-08-16
19910418132425817079602,1991-04-18
2022-04-25T15:15:04.491418Z,2022-04-25
2028-01-19T02:07:54+2500,2028-01-19
ngày 17 tháng 6 năm 2033,2033-06-17
2030/12/07,2030-12-07
20220312101951067,2022-03-12
1997-06-06T22:27:44+2500,1997-06-06
2014-05-01T09:11:40Z+3,2014-05-01
4 tháng 12 năm 2020,2020-12-04
07 01 2008,2008-07-01
15 Mar 2027,2027-03-15
2022/5/20T82651,2022-05-20
2 February 2030,2030-02-02
2018_10_30T9_14_29Z,2018-10-30
2020-09-06T09:34:23,2020-09-06
2010-02-13T12:43:23.374Z,2010-02-13
20021110004304406363,2002-11-10
2029-10-15T00:02:48.174313792Z,2029-10-15
20180503045357200974,2018-05-03
"9th of March, 1993",1993-03-09
2026 12 28,2026-12-28
ngày 21 tháng 2 năm 1998,1998-02-21
26/9/1994 giờ 6:38:39,1994-09-26
2032/02/09,2032-02-09
03.30.2019,2019-03-30
2003-07-01T19:19:04+2500,2003-07-01
Sự kiện diễn ra vào 27/11/1996 18:31,1996-11-27
ngày 25 tháng 4 năm 2020,2020-04-25
1315846800000000,2011-09-13
21.7.2034T22-20-48,2034-07-21
07.24.2008,2008-07-24
16 Apr 2010,2010-04-16
20130426032409104637810,2013-04-26
1996-08-04T09:40:13Z+3,1996-08-04
Ngày 31-1-2019,2019-01-31
2028 04 04,2028-04-04
3 tháng 7 năm 1993,1993-07-03
20020606220407200704112,2002-06-06
The system recorded 20350709111731,2035-07-09
Sự kiện diễn ra vào 5/8/2023 14:55,2023-08-05
2009/7/25T191710,2009-07-25
52-11-2016,2016-11-26
18 Sep 2034,2034-09-18
Ngày 12-12-2012,2012-12-12
2003-11-30T14:20:45Z+3,2003-11-30
"March 26, 2028",2028-03-26
ngày 30 tháng 6 năm 2006,2006-06-30
20251005114126859522458,2025-10-05
1995/06/25,1995-06-25
The system recorded 19990704124344,1999-07-04
1992/9/24T105432,1992-09-24
20311224001046,2031-12-24
2010934800000,2033-09-22
20091102170919781791056,2009-11-02
11-10-2011,2011-10-11
21/4-2027,2027-02-21
1992-06-20T05:53:31.870Z,1992-06-20
15 February 2011,2011-02-15
Event at 2021-10-08T21:37:55,2021-10-08
"June 18, 2013",2013-06-18
23 Jan 2018,2018-01-23
19910221203744705,1991-02-21
ngày 15 tháng 12 năm 2027,2027-12-15
2031_07_11T5_51_37-0300,2031-07-11
2016/5/30T20466,2016-05-30
16.7.1991T19-20-49,1991-07-16
1994-07-05T21:08:42Z+3,1994-07-05
"25th of July, 2024",2024-07-25
07|01|91,1991-01-07
2000/4/13T33918,2000-04-13
25 2 2006,2006-02-25
20191113131829838,2019-11-13
976813200000000000,2000-12-15
1637254800000000000,2021-11-19
"May 29, 2012",2012-05-29
16-3-2021,2021-03-16
Sự kiện diễn ra vào 10/7/2035 23:12,2035-07-10
Event at 2034-01-01T10:13:9,2034-01-01
1997-07-29T18:26:55.864195Z,1997-07-29
2017-09-16T07:24:13Z+3,2017-09-16
1996-08-10T02:36:16.797Z,1996-08-10
30.10.1999,1999-10-30
1842627600000000,2028-05-23
30 Mar 1990,1990-03-30
Ngày 15-7-1994,1994-07-15
The system recorded 20330202081716,2033-02-02
2029-12-16T17:43:06.394878Z,2029-12-16
"July 3, 2015",2015-07-03
30/3/2013,2013-03-30
2-3-2015,2015-03-01
20320324080618131,2032-03-24
2007.03.06,2007-03-06
14 tháng 2 năm 2017,2017-02-14
693421200,1991-12-23
20040202080924358369610,2004-02-02
8/3/2024 giờ 2:45:30,2024-03-08
Sự kiện diễn ra vào 14/3/2001 3:52,2001-03-14
Event at 2031-10-28T23:5:57,2031-10-28
20160331150700471458947,2016-03-31
2032-03-12T12:31:52.178Z,2032-03-12
2013_10_13T1_53_59-0330,2013-10-13
2013-02-02T22:34:45Z+3,2013-02-02
22 tháng 7 năm 1999,1999-07-22
Ngày 21-3-2011,2011-03-21
1404925200000,2014-07-10
2023-04-23T02:06:41.584151670Z,2023-04-23
26.8.1994T14-28-14,1994-08-26
11_01_2003,2003-11-01
1816966800,2027-07-31
01-04-1990,1990-01-04
2001_06_22T2_17_17+00:00,2001-06-22
20301201180648955893873,2030-12-01
7-7-2017,2017-07-07
2016-03-25T12:19:32Z+3,2016-03-25
The system recorded 20350827045544,2035-08-27
998326800000000000,2001-08-21
20030109095802216,2003-01-09
25-3-2019,2019-03-25
Ngày 29-9-2002,2002-09-29
18/9/2022 giờ 8:18:17,2022-09-18
20020224090709124927,2002-02-24
7-3-2001,2001-03-07
20000624191607,2000-06-24
1994-07-09T17:04:32.792758Z,1994-07-09
Event at 1999-05-13T19:12:25,1999-05-13
19941109180047415,1994-11-09
989859600000000000,2001-05-15
1994-11-19T18:00:37+00:00,1994-11-19
1996-10-15T08:10:56,1996-10-15
2034-08-23T18:19:22+2500,2034-08-23
1 October 1991,1991-10-01
The system recorded 19930517181038,1993-05-17
2004627600,2033-07-11
2026-01-28T18:07:11,2026-01-28
Ngày 16-4-2003,2003-04-16
2018-09-05T01:40:21,2018-09-05
2030-01-15T00:04:38.674316988Z,2030-01-15
14.2.2011T5-1-50,2011-02-14
1999_08_19T7_11_52Z,1999-08-19
1457110800000,2016-03-05
1580144400000,2020-01-28
2006-09-25T21:36:01,2006-09-25
9/4-2018,2018-02-09
"December 27, 2002",2002-12-27
The system recorded 20111105074526,2011-11-05
25/3/2006 giờ 1:32:17,2006-03-25
2007-10-06T19:43:44.659975682Z,2007-10-06
2012-12-12T15:59:02+2500,2012-12-12
20280815034926970827495,2028-08-15
2004-01-18T18:15:59-0300,2004-01-18
2009898000,2033-09-10
1995-07-10T20:37:21Z+3,1995-07-10
20000125170029957646332,2000-01-25
Ngày 24-2-2031,2031-02-24
2034_07_23T8_54_30Z+3,2034-07-23
20220714142117756525,2022-07-14
1268845200000000,2010-03-18
15 tháng 8 năm 2001,2001-08-15
1993-03-27T23:43:31.136562844Z,1993-03-27
1996-03-25T13:43:20+2500,1996-03-25
2031-01-23T21:28:20.254630590Z,2031-01-23
16-3-2034,2034-03-08
895338000000,1998-05-17
2020/12/26T34324,2020-12-26
06|10|2032,2032-06-10
Event at 1997-01-16T7:14:10,1997-01-16
"March 28, 1993",1993-03-28
839264400000,1996-08-06
2007-08-31T03:41:40Z+3,2007-08-31
Event at 2008-03-19T3:38:46,2008-03-19
1561395600000,2019-06-25
"10th of June, 2009",2009-06-10
648579600000000,1990-07-22
"July 24, 2011",2011-07-24
Ngày 30-12-2028,2028-12-30
2000 09 27,2000-09-27
2023/11/14T203557,2023-11-14
20290714182435169706,2029-07-14
11-8-2022,2022-08-11
Event at 2022-09-09T22:32:39,2022-09-09
25 Sep 2033,2033-09-25
2012_05_19,2012-05-19
1 Feb 2026,2026-02-01
06 01 25,2025-01-06
Ngày 6-5-2002,2002-05-06
ngày 17 tháng 7 năm 2000,2000-07-17
The system recorded 19920524071751,1992-05-24
1276880400,2010-06-19
The system recorded 20030318171334,2003-03-18
2005/10/24T125420,2005-10-24
Sự kiện diễn ra vào 8/12/1992 10:45,1992-12-08
23 Dec 2018,2018-12-23
1652634000000000,2022-05-16
10 May 2029,2029-05-10
02.09.2028,2028-02-09
26.12.1990T6-20-18,1990-12-26
1992-02-08T23:26:10,1992-02-08
20130731023311,2013-07-31
2 tháng 7 năm 2016,2016-07-02
20/04/12,2012-04-20
1664298000,2022-09-28
1994-10-12T13:11:25+2500,1994-10-12
1316710800000000,2011-09-23
2029/5/5T2493,2029-05-05
2012-08-15T07:28:41.355Z,2012-08-15
11.11.31,2031-11-11
56-7-2008,2008-07-28
02-24-2034,2034-02-24
1994-10-24T12:31:41,1994-10-24
6 Oct 2027,2027-10-06
20310619080332208777258,2031-06-19
1890406800000000000,2029-11-27
23/5/2010 giờ 7:56:26,2010-05-23
19950113163130,1995-01-13
1194368400000000,2007-11-07
875552400000000,1997-09-30
2029/10/22T4521,2029-10-22
1731517200000000000,2024-11-14
29/14-2006,2006-07-29
09_19_2024,2024-09-19
924714000000000,1999-04-22
"19th of June, 1994",1994-06-19
20210206045532,2021-02-06
1994-03-30T13:22:01+07:00,1994-03-30
1292000400000000000,2010-12-11
02|05|91,1991-05-02
8 May 2024,2024-05-08
36-9-2026,2026-09-18
1719594000000000000,2024-06-29
2-12-2035,2035-12-02
2030-11-23T23:23:03-05:00,2030-11-23
Sự kiện diễn ra vào 20/1/2001 18:39,2001-01-20
13-3-2020,2020-03-13
05.31.2000,2000-05-31
7-7-2030,2030-07-07
10 22 2003,2003-10-22
1996-06-16T07:12:44+2500,1996-06-16
"21th of May, 2008",2008-05-21
19 Oct 2026,2026-10-19
20110801123415,2011-08-01
The system recorded 20140107075852,2014-01-07
12/07/2025,2025-12-07
23.4.2018,2018-04-23
1860598800000,2028-12-17
2029-06-26T12:17:39,2029-06-26
2001-08-29T14:05:16Z+3,2001-08-29
15 Jun 1996,1996-06-15
11 20 2020,2020-11-20
Ngày 18-12-1997,1997-12-18
Ngày 7-10-2012,2012-10-07
Sự kiện diễn ra vào 27/8/2028 10:26,2028-08-27
11-5-1999,1999-05-11
The system recorded 19970425065603,1997-04-25
1322672400000,2011-12-01
2002-06-21T23:20:04.157341424Z,2002-06-21
26-4-2015,2015-04-26
20050203195608239882,2005-02-03
2018-06-27T22:47:12Z+3,2018-06-27
2.5.2035T23-21-45,2035-05-02
"5th of April, 2021",2021-04-05
1460826000000,2016-04-17
2000-09-27T17:13:09Z+3,2000-09-27
19980204050838579,1998-02-04
16-5-2002,2002-05-08
2034-04-29T07:57:19.882632Z,2034-04-29
1536858000000000,2018-09-14
936464400000000,1999-09-05
"12th of November, 1994",1994-11-12
2002-11-12T03:40:34.563312Z,2002-11-12
"23th of May, 2031",2031-05-23
2022-08-17T11:32:50.576037327Z,2022-08-17
16-3-2027,2027-03-08
2001-12-26T21:10:09-05:00,2001-12-26
01 06 03,2003-06-01
6-9-2019,2019-09-06
19941021143036,1994-10-21
2013-04-23T19:23:57,2013-04-23
22/1/2007 giờ 17:54:42,2007-01-22
4 tháng 11 năm 2021,2021-11-04
20040330142430,2004-03-30
12.2.2029T9-18-41,2029-02-12
1661187600000000000,2022-08-23
2020-10-02T01:42:19+2500,2020-10-02
Event at 2030-10-01T10:37:12,2030-10-01
956077200000000,2000-04-19
The system recorded 19990106171505,1999-01-06
20 tháng 10 năm 1996,1996-10-20
19991127165753,1999-11-27
03|10|27,2027-10-03
Ngày 19-4-2025,2025-04-19
The system recorded 20310422060130,2031-04-22
25/12/2033 giờ 17:21:22,2033-12-25
915642000000,1999-01-07
"May 3, 2029",2029-05-03
19971214154903,1997-12-14
19990912105255158685347,1999-09-12
1-9-1999,1999-09-01
19930423191657,1993-04-23
2008_06_10T2_32_32+0500,2008-06-10
21/14-1996,1996-07-21
04 28 2002,2002-04-28
19 September 2031,2031-09-19
17 tháng 8 năm 2025,2025-08-17
Sự kiện diễn ra vào 1/10/1999 0:35,1999-10-01
1658595600000,2022-07-24
19 tháng 12 năm 2029,2029-12-19
Event at 1996-06-10T22:27:18,1996-06-10
2 July 2026,2026-07-02
30-1-2006,2006-01-30
2001-07-22T00:05:59.302925Z,2001-07-22
9 Feb 2002,2002-02-09
16-3-2026,2026-03-08
2031-08-21T03:39:39.734392087Z,2031-08-21
30/24-1996,1996-12-30
2031/10/5T193033,2031-10-05
20-8-1990,1990-08-20
2023-07-10T13:31:26Z+3,2023-07-10
Sự kiện diễn ra vào 28/8/2016 16:6,2016-08-28
Ngày 29-9-1997,1997-09-29
2010-08-31T03:56:48.586751030Z,2010-08-31
21 Jan 2003,2003-01-21
2008/7/25T123615,2008-07-25
01_19_2020,2020-01-19
11/12-2022,2022-06-11
Event at 1999-07-27T4:39:20,1999-07-27
ngày 7 tháng 9 năm 2021,2021-09-07
2015_04_22T1_35_12-05:00,2015-04-22
21-1-2033,2033-01-21
1996/2/13T22235,1996-02-13
20171028005130,2017-10-28
8 October 2028,2028-10-08
14-3-2033,2033-03-14
19950818212717,1995-08-18
ngày 15 tháng 12 năm 2024,2024-12-15
11.29.2012,2012-11-29
970246800,2000-09-30
2001-02-16T22:20:42.939Z,2001-02-16
Ngày 12-11-2007,2007-11-12
2015-05-15T17:55:41.298509699Z,2015-05-15
10/5/2009,2009-05-10
1995-01-31T19:16:47.249355Z,1995-01-31
2031/5/22T75216,2031-05-22
2021-09-27T20:33:45Z+3,2021-09-27
783104400000000,1994-10-26
1999-03-03T01:56:17Z+3,1999-03-03
Sự kiện diễn ra vào 2/11/1999 11:19,1999-11-02
12/10-2005,2005-05-12
20151130063204276,2015-11-30
58-1-1990,1990-01-29
1983546000000000,2032-11-09
2022-08-01T17:27:41.276720473Z,2022-08-01
Sự kiện diễn ra vào 14/3/2035 7:2,2035-03-14
1559408400000000,2019-06-02
2019-02-06T16:20:55.767220Z,2019-02-06
1993/2/4T105436,1993-02-04
828291600000,1996-04-01
12-28-2008,2008-12-28
2012-05-13T17:51:22Z+3,2012-05-13
"8th of July, 2021",2021-07-08
2007-09-12T12:07:12Z+3,2007-09-12
"28th of May, 2019",2019-05-28
07|10|14,2014-10-07
"19th of April, 2025",2025-04-19
07 17 2003,2003-07-17
1663693200,2022-09-21
23-2-2008,2008-02-23
19941219115246806682,1994-12-19
2032-05-21T15:59:53.178121640Z,2032-05-21
ngày 18 tháng 3 năm 2035,2035-03-18
ngày 11 tháng 2 năm 2017,2017-02-11
1872954000000000,2029-05-09
2026-06-18T05:11:20+08,2026-06-18
1605718800000,2020-11-19
Sự kiện diễn ra vào 12/11/2021 13:36,2021-11-12
28/22-2015,2015-11-28
1707411600000,2024-02-09
60-10-2022,2022-10-30
1129136400000,2005-10-13
19960622143635239431,1996-06-22
20070314135401130,2007-03-14
19970225063718,1997-02-25
1577120400000000,2019-12-24
20130629014426,2013-06-29
1823619600000000,2027-10-16
2011.05.05,2011-05-05
27 June 1998,1998-06-27
2010-06-26T13:13:23+2500,2010-06-26
22 5 1991,1991-05-22
20200221100514803922,2020-02-21
14.11.1990,1990-11-14
8 tháng 1 năm 2017,2017-01-08
20060623150319583430266,2006-06-23
Sự kiện diễn ra vào 26/4/2025 22:58,2025-04-26
20300618165834982312543,2030-06-18
20270407142851568046,2027-04-07
Sự kiện diễn ra vào 6/9/2022 17:50,2022-09-06
20261007053820195370,2026-10-07
19970616150329742686,1997-06-16
The system recorded 19900101155845,1990-01-01
"5th of March, 2034",2034-03-05
2031-09-25T18:53:01,2031-09-25
1992-09-01T09:55:46.866781607Z,1992-09-01
1995-03-04T05:08:25+2500,1995-03-04
20071116022401,2007-11-16
1559667600000,2019-06-05
20040527160641421,2004-05-27
"2nd of March, 1997",1997-03-02
21/2-2010,2010-01-21
Event at 1997-10-06T5:52:43,1997-10-06
2003-08-28T22:20:35.901062300Z,2003-08-28
2028_02_04T5_6_6-0330,2028-02-04
"7th of February, 2002",2002-02-07
1499446800000000,2017-07-08
2015-07-19T22:46:02.128125Z,2015-07-19
2028/09/14,2028-09-14
ngày 30 tháng 1 năm 2026,2026-01-30
873738000,1997-09-09
2010-08-02T08:47:24,2010-08-02
62-1-2029,2029-01-31
12.5.1996T23-15-36,1996-05-12
09/23/2021,2021-09-23
20220417075609,2022-04-17
ngày 20 tháng 7 năm 2033,2033-07-20
20050130203234,2005-01-30
03-02-12,2012-02-03
2019-08-12T04:04:30+2500,2019-08-12
Sự kiện diễn ra vào 25/2/1991 13:40,1991-02-25
Sự kiện diễn ra vào 27/12/2026 13:55,2026-12-27
16-5-1992,1992-05-08
1911315600,2030-07-27
996512400000000,2001-07-31
4 Feb 1997,1997-02-04
"January 20, 2026",2026-01-20
2021-09-15T19:43:55.142211Z,2021-09-15
2025_02_11T14_47_13-0330,2025-02-11
Event at 2004-06-03T17:16:4,2004-06-03
21.5.1997T16-26-42,1997-05-21
23.10.94,1994-10-23
Sự kiện diễn ra vào 30/5/2002 21:33,2002-05-30
Event at 2001-03-12T21:31:22,2001-03-12
2021.04.26,2021-04-26
5 12 2000,2000-12-05
Sự kiện diễn ra vào 7/1/2035 23:22,2035-01-07
58-7-2011,2011-07-29
28 6 2028,2028-06-28
2034_09_10T1_27_3-0330,2034-09-10
2030|12|02,2030-12-02
6/10-2014,2014-05-06
"August 23, 2003",2003-08-23
6 September 2032,2032-09-06
2017/07/02,2017-07-02
11/4/2030 giờ 15:47:9,2030-04-11
1773162000000000000,2026-03-11
Ngày 26-11-2011,2011-11-26
2031-04-07T21:25:28.489022771Z,2031-04-07
4.8.2010T8-6-38,2010-08-04
20040220143912964,2004-02-20
2034-06-04T15:41:14,2034-06-04
1990-06-18T04:15:14.796175Z,1990-06-18
"August 17, 1994",1994-08-17
19 tháng 6 năm 2008,2008-06-19
2005/11/25T235215,2005-11-25
19 July 2006,2006-07-19
2030/10/3T151529,2030-10-03
2003_03_27T4_4_30-0330,2003-03-27
2032-02-21T09:09:03+2500,2032-02-21
ngày 18 tháng 7 năm 1996,1996-07-18
ngày 7 tháng 8 năm 2022,2022-08-07
07-08-23,2023-08-07
20030219182414938079847,2003-02-19
05|19|1998,1998-05-19
976467600,2000-12-11
1-4-2027,2027-04-01
2033-08-07T18:29:10,2033-08-07
10/20/2032,2032-10-20
Ngày 11-7-2014,2014-07-11
2029-10-25T04:38:34.185056Z,2029-10-25
"September 7, 2003",2003-09-07
850323600,1996-12-12
The system recorded 20060115001543,2006-01-15
"March 25, 2021",2021-03-25
2008-03-09T02:53:52+2500,2008-03-09
12|10|21,2021-10-12
2032-11-03T00:14:00.388478Z,2032-11-03
20220825042915659546904,2022-08-25
18 tháng 7 năm 2034,2034-07-18
20120915002358640483,2012-09-15
976726800,2000-12-14
2026_03_23T7_6_41+2500,2026-03-23
2019-02-15T23:56:29,2019-02-15
"2nd of May, 2011",2011-05-02
Event at 2007-06-29T3:51:48,2007-06-29
Ngày 11-12-2027,2027-12-11
30 Jan 2007,2007-01-30
The system recorded 20260708000302,2026-07-08
2009-12-04T16:54:15-05:00,2009-12-04
The system recorded 20100501113357,2010-05-01
2007-06-12T23:14:19.885032089Z,2007-06-12
14-2-2007,2007-02-14
20190605031008346,2019-06-05
34-12-2003,2003-12-17
19920420080522061355,1992-04-20
29-12-1996,1996-12-29
29.6.2008T4-40-20,2008-06-29
1522774800000000000,2018-04-04
4/10-2019,2019-05-04
2003_10_09T8_30_16+07:00,2003-10-09
05-26-2032,2032-05-26
9.1.1996T5-13-31,1996-01-09
23|06|18,2018-06-23
"19th of December, 2009",2009-12-19
29 tháng 10 năm 2004,2004-10-29
1652029200000000000,2022-05-09
1198170000000,2007-12-21
"January 2, 2021",2021-01-02
Ngày 27-4-2032,2032-04-27
17/4/1993 giờ 0:34:24,1993-04-17
Sự kiện diễn ra vào 16/6/2025 23:30,2025-06-16
07/18/2028,2028-07-18
24/24-2005,2005-12-24
2033/7/27T03441,2033-07-27
13/12-2003,2003-06-13
28/4/2019,2019-04-28
1.8.2001T0-15-31,2001-08-01
Sự kiện diễn ra vào 20/5/2031 16:25,2031-05-20
6-5-2013,2013-05-06
2035-10-13T11:34:55+2500,2035-10-13
19960113232816672,1996-01-13
1868115600,2029-03-14
2026-03-05T05:15:37.442044Z,2026-03-05
1489683600,2017-03-17
1997-05-13T07:08:23.664218Z,1997-05-13
941302800000000,1999-10-31
3-12-2000,2000-12-03
20100222165534,2010-02-22
2018-11-10T23:45:20-05:00,2018-11-10
20280805214633635548,2028-08-05
"26th of December, 1995",1995-12-26
19930105051037475403030,1993-01-05
20310615042651949606047,2031-06-15
28 tháng 6 năm 1990,1990-06-28
764787600000000000,1994-03-28
14/20-2029,2029-10-14
1584032400000000,2020-03-13
"22th of October, 2027",2027-10-22
2026-02-23T13:42:51-05:00,2026-02-23
19961231224922369672301,1996-12-31
28-6-1992,1992-06-28
26/6/2026,2026-06-26
16.2.2034T11-2-56,2034-02-16
12/8-2000,2000-04-12
25|11|1993,1993-11-25
1990|01|16,1990-01-16
The system recorded 19950125073708,1995-01-25
06.05.17,2017-05-06
Event at 1991-08-27T20:56:16,1991-08-27
2005-07-17T12:28:58.856Z,2005-07-17
1110128400000000,2005-03-07
20271008060815854185624,2027-10-08
15/05/14,2014-05-15
1993-03-03T23:17:37+00:00,1993-03-03
4.4.1997T23-59-55,1997-04-04
2026-03-18T07:40:55.898Z,2026-03-18
4/2-2015,2015-01-04
62-7-2032,2032-07-31
2026-12-15T23:01:21.983290Z,2026-12-15
2009_02_21T22_8_44-0330,2009-02-21
1241456400,2009-05-05
2032_12_05T14_18_40+3,2032-12-05
1277398800,2010-06-25
"July 28, 2030",2030-07-28
2034 02 07,2034-02-07
1282669200000,2010-08-25
1994-02-27T22:54:09.984138030Z,1994-02-27
1392483600,2014-02-16
2016_01_06T2_14_54-05:00,2016-01-06
2045149200000,2034-10-23
27-10-2022,2022-10-27
05|27|2021,2021-05-27
Sự kiện diễn ra vào 4/11/1993 15:21,1993-11-04
9 tháng 3 năm 2023,2023-03-09
12.05.2012,2012-12-05
The system recorded 20160223203453,2016-02-23
1999-08-30T22:22:21.608773Z,1999-08-30
10 September 2013,2013-09-10
1998-08-09T05:03:46,1998-08-09
20341110221023109,2034-11-10
1176829200000000000,2007-04-18
5 Nov 1998,1998-11-05
19950523190737,1995-05-23
16-2-2020,2020-02-16
4 Feb 2022,2022-02-04
20221208052243,2022-12-08
1986829200,2032-12-17
54-6-1991,1991-06-27
"August 20, 2005",2005-08-20
ngày 17 tháng 12 năm 2031,2031-12-17
"March 19, 2002",2002-03-19
2024_01_08T14_17_50-05:00,2024-01-08
2026/5/27T64838,2026-05-27
1993-10-21T05:27:17.672Z,1993-10-21
20120314215045338,2012-03-14
Event at 2006-05-03T1:2:40,2006-05-03
2024_02_02,2024-02-02
20280807121058948460,2028-08-07
27 Dec 2035,2035-12-27
20181204154503283,2018-12-04
1957280400,2032-01-10
2009-04-27T16:06:29,2009-04-27
06 01 2035,2035-06-01
1906131600000000,2030-05-28
28-6-2022,2022-06-14
20051219162241293906,2005-12-19
3 4 1990,1990-04-03
ngày 22 tháng 1 năm 1999,1999-01-22
1/4-2024,2024-02-01
2002-05-22T13:43:03+08,2002-05-22
20341223170514,2034-12-23
20070626094013,2007-06-26
"14th of April, 2027",2027-04-14
Sự kiện diễn ra vào 14/1/2022 18:0,2022-01-14
30.5.2006T4-6-15,2006-05-30
1997_04_17T19_41_49+0500,1997-04-17
7/10-2024,2024-05-07
2033-04-03T20:01:27-0330,2033-04-03
1998/6/7T151346,1998-06-07
24-1-2028,2028-01-24
1408208400000,2014-08-17
2005-07-12T23:05:35.760334987Z,2005-07-12
1996-01-25T11:44:33.517773Z,1996-01-25
15 December 2023,2023-12-15
766083600000000000,1994-04-12
20010424124923,2001-04-24
Ngày 17-8-2035,2035-08-17
1116176400000000,2005-05-16
2025-07-26T18:38:02,2025-07-26
The system recorded 19961102050825,1996-11-02
46-12-1994,1994-12-23
2020/7/9T35159,2020-07-09
The system recorded 20221207214441,2022-12-07
3/2/2018 giờ 12:18:36,2018-02-03
20080301055418123316043,2008-03-01
2035-12-27T22:04:36+2500,2035-12-27
2023/10/8T4230,2023-10-08
2019_09_16T9_4_22Z+3,2019-09-16
12_11_32,2032-11-12
1-5-1990,1990-05-01
2016-11-05T02:53:05.169549Z,2016-11-05
2032-09-13T09:01:01.641341Z,2032-09-13
2027-08-26T03:40:37,2027-08-26
6 Apr 2026,2026-04-06
02_06_01,2001-06-02
Ngày 23-7-1996,1996-07-23
2030-02-04T12:13:03+2500,2030-02-04
10/18-2035,2035-09-10
14/18-2033,2033-09-14
36-5-2027,2027-05-18
2032-01-16T19:52:41.735766979Z,2032-01-16
2017/12/8T83322,2017-12-08
34-10-1994,1994-10-17
2021-02-01T05:24:23.592366266Z,2021-02-01
1482944400000000000,2016-12-29
2025.07.03,2025-07-03
31 tháng 10 năm 1999,1999-10-31
2000/01/14,2000-01-14
14-10-2035,2035-10-07
2005/12/5T73757,2005-12-05
1214413200,2008-06-26
2028-05-07T03:24:41.686Z,2028-05-07
8/1/2002 giờ 6:9:15,2002-01-08
"May 27, 1999",1999-05-27
19960627002959,1996-06-27
Ngày 14-7-1996,1996-07-14
2034-09-28T10:41:31-05:00,2034-09-28
1788886800000000,2026-09-09
44-9-2031,2031-09-22
"July 22, 1995",1995-07-22
2025-12-25T04:15:07Z+3,2025-12-25
14/12-1994,1994-06-14
2005_04_01T5_46_2-0330,2005-04-01
1786554000,2026-08-13
12.07.1993,1993-12-07
19960522165925356061,1996-05-22
22-8-2025,2025-08-22
2016-07-28T10:41:42.634940Z,2016-07-28
20150831001744716,2015-08-31
914346000000000,1998-12-23
2018_08_28,2018-08-28
2027-08-07T09:29:03,2027-08-07
30 tháng 8 năm 2023,2023-08-30
20310917183737693,2031-09-17
2035/01/09,2035-01-09
2019-09-21T13:38:17Z+3,2019-09-21
2005-05-26T10:10:06.065Z,2005-05-26
"August 20, 1996",1996-08-20
20|12|2020,2020-12-20
752000400000,1993-10-31
9/11/2031 giờ 5:7:19,2031-11-09
20130106070402064429460,2013-01-06
2012-02-27T22:59:43.079Z,2012-02-27
19900211075227291037978,1990-02-11
"14th of May, 2019",2019-05-14
Sự kiện diễn ra vào 27/6/1993 21:44,1993-06-27
17 07 17,2017-07-17
2011-04-05T23:40:58Z+3,2011-04-05
Event at 2032-10-08T20:22:2,2032-10-08
06/27/2002,2002-06-27
13/20-2018,2018-10-13
2011-08-11T00:35:14+08,2011-08-11
11 Sep 2005,2005-09-11
20080516232056614,2008-05-16
02|22|2009,2009-02-22
20020312050244949057956,2002-03-12
26.08.97,1997-08-26
01_11_1992,1992-01-11
7/4-1996,1996-02-07
18.12.2022T15-5-22,2022-12-18
Event at 2005-01-24T18:51:56,2005-01-24
"September 1, 2024",2024-09-01
2023_02_20T22_56_10Z+3,2023-02-20
2035-11-02T21:52:32,2035-11-02
19930921211622833,1993-09-21
1828198800000000,2027-12-08
1562950800,2019-07-13
2031-01-25T16:58:24.614038Z,2031-01-25
2034-12-21T02:22:59,2034-12-21
2002-10-01T21:20:37.193Z,2002-10-01
The system recorded 20320228044435,2032-02-28
46-6-2003,2003-06-23
1997-09-17T09:44:06,1997-09-17
Sự kiện diễn ra vào 7/9/2031 7:7,2031-09-07
1992/11/27T75541,1992-11-27
20121001210858401510304,2012-10-01
2025-04-30T19:16:55.775217Z,2025-04-30
2003-09-14T04:16:17,2003-09-14
20140508224955,2014-05-08
"January 25, 2013",2013-01-25
1996-07-01T23:02:00,1996-07-01
2008-03-16T02:00:39+2500,2008-03-16
14.3.2030T23-22-31,2030-03-14
1587920400000,2020-04-27
8/2-1997,1997-01-08
04.06.2028,2028-04-06
2023-10-05T02:34:30.257061Z,2023-10-05
11/8/2017,2017-08-11
1861894800000000,2029-01-01
2007-11-20T23:27:16+0500,2007-11-20
29 Aug 2021,2021-08-29
Sự kiện diễn ra vào 27/10/2006 11:39,2006-10-27
9 tháng 9 năm 2015,2015-09-09
19930625173307703370856,1993-06-25
1993-07-30T19:46:57,1993-07-30
17/7/1998,1998-07-17
20331030121544464754992,2033-10-30
2024-04-01T23:03:02Z,2024-04-01
1992-06-13T09:14:42,1992-06-13
20050218180321535253,2005-02-18
"15th of November, 2004",2004-11-15
2007-10-19T04:04:01.791377379Z,2007-10-19
2033-08-13T03:44:44.625545167Z,2033-08-13
The system recorded 20010602111904,2001-06-02
1996 08 14,1996-08-14
2016-10-05T16:56:44+2500,2016-10-05
2000-03-29T16:11:12.934799444Z,2000-03-29
2010-08-05T00:01:31.298306Z,2010-08-05
1969981200000000,2032-06-05
1171386000000000000,2007-02-14
2023-08-13T21:49:32-05:00,2023-08-13
26|2|1999,1999-02-26
2016-03-20T20:29:29.084977241Z,2016-03-20
Ngày 7-12-1995,1995-12-07
2027-04-02T03:17:46+2500,2027-04-02
2006/6/11T234545,2006-06-11
12 August 2030,2030-08-12
703875600000000000,1992-04-22
2019-04-14T19:18:27.669594Z,2019-04-14
21-11-1991,1991-11-21
2034/4/6T135949,2034-04-06
1060362000000,2003-08-09
Ngày 3-11-2021,2021-11-03
20120621045723745670,2012-06-21
20180216235753772229,2018-02-16
13/10/27,2027-10-13
20260901122502972271,2026-09-01
2035/3/31T214526,2035-03-31
9_11_2020,2020-11-09
1997-06-21T20:37:36.736Z,1997-06-21
6/5/2021,2021-05-06
2|8|2016,2016-08-02
Event at 2012-05-07T12:47:1,2012-05-07
2017.06.01,2017-06-01
20/8/2025 giờ 8:10:21,2025-08-20
01.03.00,2000-03-01
Ngày 7-9-2012,2012-09-07
31 January 2018,2018-01-31
62-7-2029,2029-07-31
20221116063640,2022-11-16
Sự kiện diễn ra vào 10/10/1996 0:10,1996-10-10
2017-04-04T10:36:14+2500,2017-04-04
1998_10_03T19_40_40-0330,1998-10-03
5 tháng 2 năm 2024,2024-02-05
2029-10-02T03:34:38.766414932Z,2029-10-02
2022/8/13T32918,2022-08-13
Sự kiện diễn ra vào 31/1/2028 2:9,2028-01-31
2016-02-08T02:46:11.436179908Z,2016-02-08
2.8.2001T23-47-20,2001-08-02
908643600000000000,1998-10-18
22 tháng 11 năm 2015,2015-11-22
20050411221210554485635,2005-04-11
The system recorded 20010810212945,2001-08-10
2011-04-03T00:15:11Z+3,2011-04-03
30-1-2009,2009-01-15
3 tháng 10 năm 2002,2002-10-03
12 06 2008,2008-12-06
Event at 2010-09-28T10:22:43,2010-09-28
2035-02-05T02:22:03.139Z,2035-02-05
2028-05-03T20:30:54+00:00,2028-05-03
28-6-2030,2030-06-28
2006-09-18T03:09:19.410264Z,2006-09-18
Event at 2000-02-17T21:10:8,2000-02-17
28 Jun 2009,2009-06-28
20 Nov 1990,1990-11-20
2027-06-24T06:59:53,2027-06-24
19/4-2027,2027-02-19
1996-08-17T11:10:11Z+3,1996-08-17
2033-09-03T08:57:13.731Z,2033-09-03
23.3.2033T5-1-47,2033-03-23
Event at 1991-02-06T2:53:45,1991-02-06
07_20_2027,2027-07-20
2010/10/09,2010-10-09
1999-05-26T20:31:12.625042957Z,1999-05-26
2031-01-28T22:04:53.469655Z,2031-01-28
"March 16, 1990",1990-03-16
Ngày 3-5-1999,1999-05-03
19970328135417486517645,1997-03-28
2002_12_01T20_38_4+00:00,2002-12-01
18_7_1990,1990-07-18
03_03_2009,2009-03-03
20170517062241,2017-05-17
ngày 29 tháng 9 năm 2008,2008-09-29
20041013180649012353835,2004-10-13
"29th of May, 1990",1990-05-29
The system recorded 20280921071331,2028-09-21
2008-05-05T13:57:58,2008-05-05
ngày 29 tháng 1 năm 1995,1995-01-29
3 November 2021,2021-11-03
2002_10_02T9_2_4+0500,2002-10-02
02.02.2003,2003-02-02
2031/12/21T19931,2031-12-21
2008-10-08T20:27:51Z+3,2008-10-08
2067181200000000000,2035-07-05
16 Mar 1993,1993-03-16
7-3-2018,2018-03-07
1990-02-07T09:31:07.284Z,1990-02-07
1996-04-11T21:29:23Z+3,1996-04-11
2003-07-19T12:48:28Z+3,2003-07-19
2005_01_12,2005-01-12
2008_05_27T5_5_3-0300,2008-05-27
1194627600000,2007-11-10
20330218092527241916,2033-02-18
25-10-2022,2022-10-25
2022-09-28T03:16:51.059Z,2022-09-28
"20th of March, 2007",2007-03-20
2015/12/16T20649,2015-12-16
2005-05-18T18:42:59.420032Z,2005-05-18
19921107000030,1992-11-07
2000/2/24T101452,2000-02-24
44-7-2014,2014-07-22
19930401141318953288707,1993-04-01
28-11-1994,1994-11-28
"July 29, 2030",2030-07-29
20250922004708,2025-09-22
12/24-2029,2029-12-12
26/5/2003 giờ 11:53:23,2003-05-26
20000610124152607014218,2000-06-10
1-9-2000,2000-09-01
2014-08-21T06:18:15,2014-08-21
The system recorded 20070501020030,2007-05-01
Sự kiện diễn ra vào 9/2/2019 17:2,2019-02-09
"23th of November, 2005",2005-11-23
20321006222042947152,2032-10-06
17 May 2033,2033-05-17
2013/12/1T152610,2013-12-01
1998-04-01T02:41:45.013734689Z,1998-04-01
2/1/2026 giờ 23:36:13,2026-01-02
21 Oct 2029,2029-10-21
6 January 2003,2003-01-06
2/2/1995 giờ 5:19:53,1995-02-02
21.9.2011,2011-09-21
Event at 2021-11-11T15:46:57,2021-11-11
06_24_2003,2003-06-24
2001-07-24T12:53:20,2001-07-24
Sự kiện diễn ra vào 3/9/1993 16:29,1993-09-03
9 8 2004,2004-08-09
2000_12_09T1_26_1+2500,2000-12-09
2027-01-17T17:19:14.435Z,2027-01-17
12/05/14,2014-05-12
"October 25, 2030",2030-10-25
1069866000000000,2003-11-27
2003-09-29T16:26:21,2003-09-29
2011_11_05T22_17_8Z,2011-11-05
30 tháng 6 năm 2016,2016-06-30
The system recorded 19900708134626,1990-07-08
13 May 1990,1990-05-13
20210921103952053277,2021-09-21
Sự kiện diễn ra vào 23/5/2022 6:40,2022-05-23
"9th of November, 2034",2034-11-09
20330411181301584829,2033-04-11
48-6-2011,2011-06-24
Ngày 23-5-2005,2005-05-23
25 tháng 6 năm 2007,2007-06-25
2023-10-12T06:21:06Z,2023-10-12
7.1.2035T11-57-42,2035-01-07
2033-03-20T14:31:03.199Z,2033-03-20
1993-02-18T01:03:19,1993-02-18
2011-12-31T10:56:19+2500,2011-12-31
32-11-2033,2033-11-16
Ngày 9-11-2019,2019-11-09
19910101063606040810,1991-01-01
2005-05-15T04:38:38+2500,2005-05-15
1998-05-17T09:55:44.758Z,1998-05-17
18/6-1992,1992-03-18
20160108232509567661114,2016-01-08
2028-02-25T21:39:44.788508913Z,2028-02-25
20070327103440,2007-03-27
2017/4/23T046,2017-04-23
"27th of May, 1990",1990-05-27
1994-01-22T01:40:04,1994-01-22
2/9/2007,2007-09-02
10/27/2004,2004-10-27
1997 03 14,1997-03-14
2 tháng 3 năm 1992,1992-03-02
24.9.2032T2-14-10,2032-09-24
20080316193239532652769,2008-03-16
1/16-2011,2011-08-01
2007-07-25T11:27:56,2007-07-25
09/07/2006,2006-09-07
16-10-2028,2028-10-16
"4th of February, 2000",2000-02-04
"21th of October, 2003",2003-10-21
2016-08-20T18:20:34.191150518Z,2016-08-20
8 June 2032,2032-06-08
1475859600000,2016-10-08
20060401165347,2006-04-01
2017-04-10T22:22:35.890461683Z,2017-04-10
05 27 2032,2032-05-27
1994-01-17T02:01:29+00:00,1994-01-17
1100106000000000000,2004-11-11
12.03.2020,2020-12-03
2010-01-16T07:46:25,2010-01-16
1813251600000,2027-06-18
ngày 19 tháng 12 năm 2023,2023-12-19
Event at 2011-05-20T0:33:42,2011-05-20
Sự kiện diễn ra vào 30/1/2006 16:14,2006-01-30
"April 26, 2028",2028-04-26
9.4.1997T2-21-15,1997-04-09
11|04|2001,2001-11-04
645382800000000000,1990-06-15
2025-08-08T05:59:14+2500,2025-08-08
ngày 12 tháng 9 năm 2015,2015-09-12
2032-05-03T13:35:42.172100Z,2032-05-03
15-6-2013,2013-06-15
06|23|1999,1999-06-23
1918314000,2030-10-16
20260208181030208542484,2026-02-08
20211002002546012657,2021-10-02
2013-03-07T00:45:47+2500,2013-03-07
13 Jun 1996,1996-06-13
1998/11/2T17516,1998-11-02
1|3|2002,2002-03-01
752086800000,1993-11-01
20/12-2010,2010-06-20
4/20-1993,1993-10-04
1353603600,2012-11-23
847990800,1996-11-15
32-6-2020,2020-06-16
944326800000000000,1999-12-05
1994-11-24T06:47:28+0500,1994-11-24
20060102174350,2006-01-02
2010-11-17T19:32:01.631056Z,2010-11-17
20331228202758,2033-12-28
ngày 29 tháng 7 năm 1998,1998-07-29
20290123190542742043,2029-01-23
2029 08 11,2029-08-11
2025-06-14T04:01:39.531477568Z,2025-06-14
19951228172215939608801,1995-12-28
751482000000000000,1993-10-25
15/11/1993 giờ 15:22:39,1993-11-15
29 May 2007,2007-05-29
13 Dec 2020,2020-12-13
13-4-2014,2014-04-13
1991-05-28T03:10:09Z+3,1991-05-28
25/24-2028,2028-12-25
13 tháng 3 năm 2027,2027-03-13
Ngày 31-12-2022,2022-12-31
2026/8/14T192215,2026-08-14
Ngày 2-7-1999,1999-07-02
20121025124442,2012-10-25
25-7-2024,2024-07-25
20000906012653500007132,2000-09-06
22-05-26,2026-05-22
24 04 90,1990-04-24
3/6-2000,2000-03-03
2019-05-03T07:36:12.772140560Z,2019-05-03
The system recorded 20010430113517,2001-04-30
Sự kiện diễn ra vào 26/6/2017 4:30,2017-06-26
1282150800000,2010-08-19
31/3/2013 giờ 22:59:37,2013-03-31
1796058000000000000,2026-12-01
2022-07-07T19:44:22+2500,2022-07-07
26 Apr 2033,2033-04-26
2015-08-11T07:43:53,2015-08-11
19/10/2023 giờ 13:3:26,2023-10-19
945450000,1999-12-18
01.13.2016,2016-01-13
2006-05-08,2006-05-08
56-4-1998,1998-04-28
Sự kiện diễn ra vào 10/12/2000 12:8,2000-12-10
2006-12-03T04:43:30.161Z,2006-12-03
Sự kiện diễn ra vào 18/8/1997 4:10,1997-08-18
31.12.2005T15-29-28,2005-12-31
20090411141925661198,2009-04-11
"June 9, 1996",1996-06-09
1004374800000000000,2001-10-30
14-4-2013,2013-04-14
13_12_16,2016-12-13
"August 25, 1990",1990-08-25
2034-01-14T09:25:27.060235000Z,2034-01-14
17 tháng 11 năm 2032,2032-11-17
2006-01-19T07:45:59+2500,2006-01-19
1992-10-07T23:51:54+00:00,1992-10-07
20200821164109072,2020-08-21
"April 28, 2019",2019-04-28
Ngày 21-1-2031,2031-01-21
20151017095327,2015-10-17
Ngày 24-12-2008,2008-12-24
24|7|2030,2030-07-24
17 January 1997,1997-01-17
25/12-2009,2009-06-25
15-5-2015,2015-05-15
ngày 4 tháng 8 năm 2001,2001-08-04
1102698000000,2004-12-11
Ngày 26-9-2018,2018-09-26
1766077200000000000,2025-12-19
2034_12_04T0_34_33+3,2034-12-04
7/22-2028,2028-11-07
20180206094122,2018-02-06
Sự kiện diễn ra vào 30/1/2031 19:12,2031-01-30
17 tháng 2 năm 2024,2024-02-17
2010-03-27T23:09:14+2500,2010-03-27
48-5-2014,2014-05-24
1996-08-30T04:48:50+2500,1996-08-30
2025-05-12T21:40:48.423711262Z,2025-05-12
18 Jan 2028,2028-01-18
1477328400000000,2016-10-25
19931127235745771,1993-11-27
5/8/2026 giờ 2:53:0,2026-08-05
2007-09-04T08:02:30Z+3,2007-09-04
1412528400000000,2014-10-06
2022-02-10T22:23:43+0500,2022-02-10
3_3_2003,2003-03-03
2015-01-16T09:07:04.560027516Z,2015-01-16
2006-10-26T11:39:49Z+3,2006-10-26
22/5/2000 giờ 1:2:29,2000-05-22
26-1-2031,2031-01-13
40-11-1992,1992-11-20
2012_06_18,2012-06-18
3 Feb 2005,2005-02-03
16-10-2028,2028-10-08
20-5-2028,2028-05-20
20190421031654997679,2019-04-21
13 tháng 10 năm 2033,2033-10-13
1573750800000000,2019-11-15
2007-10-13T05:07:21-0330,2007-10-13
09-29-2009,2009-09-29
20011121064246221,2001-11-21
2012_05_22T17_18_19+0500,2012-05-22
20040918162104629269650,2004-09-18
20260418024450300706,2026-04-18
807037200,1995-07-30
22/3/2024 giờ 23:15:12,2024-03-22
931280400000000,1999-07-07
07 16 2006,2006-07-16
2030-07-30T13:18:51.389779883Z,2030-07-30
"9th of December, 2015",2015-12-09
2000-11-13T21:33:28+2500,2000-11-13
713811600000000000,1992-08-15
20070511123733971402,2007-05-11
20080817194026357072,2008-08-17
Ngày 25-1-2001,2001-01-25
"17th of June, 2007",2007-06-17
1239987600000000,2009-04-18
703357200000,1992-04-16
2016-10-24T13:12:57Z+3,2016-10-24
Event at 1999-06-15T5:54:43,1999-06-15
2003-12-14T11:51:29Z+3,2003-12-14
2006-10-28T00:37:00+2500,2006-10-28
1473613200000,2016-09-12
14 October 2015,2015-10-14
15.2.2022T21-47-26,2022-02-15
2016-05-26T00:35:24.916692747Z,2016-05-26
Sự kiện diễn ra vào 6/6/1992 1:37,1992-06-06
"1st of November, 2018",2018-11-01
2031-10-14T05:10:14,2031-10-14
06.02.2009,2009-06-02
13/8/2032 giờ 0:3:34,2032-08-13
20181217144221871,2018-12-17
2025018000000000,2034-03-04
22.10.03,2003-10-22
12/31/2010,2010-12-31
9/22-2027,2027-11-09
22|03|31,2031-03-22
3/3/2001,2001-03-03
2023-01-17T09:43:27+2500,2023-01-17
21 2 2014,2014-02-21
20.8.2012T18-0-28,2012-08-20
2021|03|04,2021-03-04
20141120072233182553,2014-11-20
24.5.2001T7-17-16,2001-05-24
2077462800,2035-11-01
The system recorded 20050120230823,2005-01-20
20011119200650219711503,2001-11-19
2031/06/02,2031-06-02
Ngày 10-5-2005,2005-05-10
2003_01_05T13_24_22Z,2003-01-05
20310320105056127632923,2031-03-20
2000-09-13T15:40:48+2500,2000-09-13
Event at 2022-05-06T22:45:6,2022-05-06
07 27 2008,2008-07-27
"13th of October, 2002",2002-10-13
Ngày 7-4-1997,1997-04-07
688928400000,1991-11-01
20120731184921230225800,2012-07-31
3 Oct 2005,2005-10-03
14.3.1990T2-51-44,1990-03-14
1485536400000,2017-01-28
20010408165950068492,2001-04-08
19921016101128458239971,1992-10-16
40-2-2034,2034-02-20
2035_08_05T20_4_1+2500,2035-08-05
6 January 2025,2025-01-06
17_02_93,1993-02-17
1999-10-16T09:40:45,1999-10-16
743101200000,1993-07-20
1996-10-17T02:07:53+07:00,1996-10-17
2016-04-18T00:54:26+2500,2016-04-18
Event at 2026-05-18T13:23:34,2026-05-18
04_01_1990,1990-04-01
2025.08.27,2025-08-27
1625331600000000000,2021-07-04
8-11-1995,1995-11-04
2024 09 30,2024-09-30
19 Jun 1997,1997-06-19
Event at 2028-03-22T16:14:15,2028-03-22
Sự kiện diễn ra vào 31/8/1998 9:8,1998-08-31
1997_09_28T17_19_54+08,1997-09-28
4-9-2033,2033-09-02
03.09.2016,2016-03-09
ngày 22 tháng 6 năm 2033,2033-06-22
19961228022813148135456,1996-12-28
2007-05-11T00:05:57Z+3,2007-05-11
20170703011329190086,2017-07-03
1133197200,2005-11-29
12 May 1996,1996-05-12
ngày 4 tháng 5 năm 2003,2003-05-04
2002-02-02T02:01:12Z+3,2002-02-02
5 Oct 2011,2011-10-05
1 tháng 6 năm 2028,2028-06-01
8 May 2011,2011-05-08
20071005021704099789345,2007-10-05
Event at 2032-04-01T9:11:42,2032-04-01
25/18-2017,2017-09-25
18-2-1993,1993-02-09
The system recorded 20320118155842,2032-01-18
19961105001412432,1996-11-05
30 June 2003,2003-06-30
24/18-1992,1992-09-24
ngày 26 tháng 4 năm 2021,2021-04-26
2011-07-11T17:03:00.365770Z,2011-07-11
1788368400,2026-09-03
31/5/1993,1993-05-31
2008/11/26T21943,2008-11-26
1992-05-18T03:47:54.798Z,1992-05-18
2014/5/8T61111,2014-05-08
2018-03-11T14:21:04+2500,2018-03-11
"3rd of January, 2012",2012-01-03
18-7-1993,1993-07-18
770058000000000,1994-05-28
2001-03-26T16:14:24,2001-03-26
2002/9/14T172013,2002-09-14
1323882000000000,2011-12-15
2027-01-25T11:38:37,2027-01-25
1992-07-21T01:44:14+2500,1992-07-21
2032_01_11T6_30_11+3,2032-01-11
The system recorded 20080121173145,2008-01-21
Ngày 6-2-2020,2020-02-06
2022-01-06T12:14:21Z+3,2022-01-06
ngày 20 tháng 4 năm 1993,1993-04-20
Ngày 25-10-1992,1992-10-25
46-5-2016,2016-05-23
1997-05-05T23:10:46.555071Z,1997-05-05
12_13_2030,2030-12-13
1990-09-25T14:59:18+2500,1990-09-25
"October 15, 2020",2020-10-15
19950609192859774802,1995-06-09
44-9-2015,2015-09-22
20330518124730620,2033-05-18
30 October 2000,2000-10-30
2013-04-24T02:16:14+08,2013-04-24
19981102004132,1998-11-02
12-1-2006,2006-01-12
25 Sep 2011,2011-09-25
19930529153453,1993-05-29
17-4-2014,2014-04-17
5 Oct 1994,1994-10-05
"March 28, 1999",1999-03-28
"14th of December, 2032",2032-12-14
2011-03-03T17:39:59+3,2011-03-03
20310302091429,2031-03-02
2/3/1992 giờ 6:57:38,1992-03-02
1990-08-11T20:51:50.057475581Z,1990-08-11
2013-11-18T00:05:48.147461Z,2013-11-18
40-8-2023,2023-08-20
743619600000,1993-07-26
2001_04_19,2001-04-19
5-6-2018,2018-06-05
The system recorded 20200306165910,2020-03-06
2018-11-02T01:45:05.992878Z,2018-11-02
1473699600000000,2016-09-13
13/8/1995 giờ 9:34:22,1995-08-13
1993-07-28T20:35:25.080497045Z,1993-07-28
1480784400000000,2016-12-04
Sự kiện diễn ra vào 19/10/2012 5:56,2012-10-19
20270813161246303396414,2027-08-13
3.10.2015T17-1-30,2015-10-03
2018-02-25T09:27:45.349657410Z,2018-02-25
2019-08-22T09:24:08,2019-08-22
The system recorded 20010425010941,2001-04-25
20221114150314948222578,2022-11-14
The system recorded 19910413145703,1991-04-13
22 Nov 1991,1991-11-22
17/4/1999 giờ 14:25:0,1999-04-17
Sự kiện diễn ra vào 19/12/2028 10:17,2028-12-19
907002000,1998-09-29
2011-05-21T15:53:25.899845Z,2011-05-21
The system recorded 20070903173202,2007-09-03
2035/10/26T11921,2035-10-26
1670605200,2022-12-10
2018106000000000000,2033-12-14
2015/10/1T151428,2015-10-01
20|6|2016,2016-06-20
Event at 2024-03-17T8:17:9,2024-03-17
2006-01-01T22:02:07,2006-01-01
2006-01-29T16:46:57+2500,2006-01-29
2026-01-30T08:54:19.636Z,2026-01-30
20030524220819558682,2003-05-24
2009-06-02T22:56:10.164Z,2009-06-02
Ngày 7-5-1994,1994-05-07
20300319055857769,2030-03-19
2007/7/20T154540,2007-07-20
34-1-2001,2001-01-17
31_12_95,1995-12-31
829846800000000000,1996-04-19
20020704080620,2002-07-04
19980820030511807,1998-08-20
2003-08-26T20:59:43.072Z,2003-08-26
ngày 11 tháng 2 năm 2014,2014-02-11
2014-08-01T14:49:05,2014-08-01
2008-11-05T11:50:29.468545055Z,2008-11-05
2005_10_02T9_18_47-0300,2005-10-02
24 February 1997,1997-02-24
Sự kiện diễn ra vào 1/3/1997 11:22,1997-03-01
20090621172120869,2009-06-21
2025-07-17T12:16:49+2500,2025-07-17
Ngày 15-12-2029,2029-12-15
Sự kiện diễn ra vào 26/10/1995 10:33,1995-10-26
2029/9/6T21437,2029-09-06
Ngày 28-10-2001,2001-10-28
Ngày 4-5-1995,1995-05-04
2031-01-26T23:52:09.588519Z,2031-01-26
2005-12-17T04:24:39.142156Z,2005-12-17
18/12-1999,1999-06-18
18-11-2022,2022-11-09
1996-11-12T20:40:35+2500,1996-11-12
2019/1/9T195432,2019-01-09
27.2.1999T10-19-3,1999-02-27
23|3|1992,1992-03-23
862074000000,1997-04-27
Ngày 28-1-2002,2002-01-28
Event at 1999-04-12T14:1:33,1999-04-12
Ngày 20-12-2000,2000-12-20
"28th of January, 2011",2011-01-28
The system recorded 19900729220045,1990-07-29
28 Oct 2001,2001-10-28
2013_03_01,2013-03-01
Sự kiện diễn ra vào 7/6/2024 18:57,2024-06-07
1843232400,2028-05-30
"October 25, 1994",1994-10-25
The system recorded 20030320103713,2003-03-20
20/14-2005,2005-07-20
20040904125958964672,2004-09-04
12-3-1990,1990-03-06
ngày 15 tháng 6 năm 2031,2031-06-15
20060901041027019978,2006-09-01
31 Mar 1993,1993-03-31
Event at 2008-08-14T1:38:30,2008-08-14
27 August 2027,2027-08-27
11-3-2027,2027-03-11
2010-03-16T14:09:14+3,2010-03-16
12 January 2018,2018-01-12
38-12-2006,2006-12-19
15 tháng 9 năm 2017,2017-09-15
ngày 8 tháng 10 năm 2013,2013-10-08
2021_06_07T23_33_43+08,2021-06-07
2002_03_11T1_53_32Z+3,2002-03-11
Ngày 11-10-2001,2001-10-11
30 01 15,2015-01-30
2000_07_02T21_12_48-05:00,2000-07-02
1586106000000000,2020-04-06
Event at 2006-07-29T6:42:55,2006-07-29
2032-12-11T03:21:22Z+3,2032-12-11
25/9/2021 giờ 15:17:50,2021-09-25
2023_12_20T22_44_2+00:00,2023-12-20
2003/9/3T12275,2003-09-03
2030-12-18T05:30:26.191822Z,2030-12-18
2030_07_17T22_15_47+3,2030-07-17
13.4.2015T10-4-44,2015-04-13
11 tháng 8 năm 2033,2033-08-11
09 04 29,2029-04-09
17-5-2032,2032-05-17
2018-02-05T16:00:21.303Z,2018-02-05
ngày 20 tháng 6 năm 1995,1995-06-20
2032-05-25T06:46:35Z+3,2032-05-25
837968400000000,1996-07-22
2029-03-03T01:02:51+2500,2029-03-03
2019_08_08,2019-08-08
1948813200000,2031-10-04
1685638800000000,2023-06-02
1999-10-31T20:36:57.704Z,1999-10-31
2000-09-17T01:42:15+2500,2000-09-17
05-09-09,2009-09-05
Sự kiện diễn ra vào 23/1/2014 19:5,2014-01-23
2014-06-02T23:20:15.728Z,2014-06-02
2020-04-22T14:06:08Z+3,2020-04-22
2015-09-13T10:44:37.184203867Z,2015-09-13
2031-04-08T17:51:17.346Z,2031-04-08
07 29 2028,2028-07-29
1412874000000000000,2014-10-10
The system recorded 20331018100325,2033-10-18
1347987600,2012-09-19
Sự kiện diễn ra vào 24/6/2019 16:27,2019-06-24
1997.12.18,1997-12-18
2012/8/15T234955,2012-08-15
1995-11-19T15:12:04Z+3,1995-11-19
1348160400000000000,2012-09-21
03/18/2003,2003-03-18
2019-09-06T11:45:31+2500,2019-09-06
09-29-2024,2024-09-29
20.1.2010T22-45-2,2010-01-20
17 tháng 3 năm 2024,2024-03-17
20200731051846549,2020-07-31
2018-01-06T12:15:42.722928Z,2018-01-06
642618000000000000,1990-05-14
Event at 2022-08-31T23:28:15,2022-08-31
2030-02-22T15:22:57+3,2030-02-22
20201002035209058682124,2020-10-02
1993/7/26T23418,1993-07-26
2009-06-29T19:05:37.715Z,2009-06-29
24-8-2027,2027-08-24
2012-06-05T12:48:14-0300,2012-06-05
21.1.2007T8-34-7,2007-01-21
The system recorded 20100326080312,2010-03-26
1429203600000000,2015-04-17
2011-12-28T23:12:38+2500,2011-12-28
22/9/2016 giờ 13:44:3,2016-09-22
2012-04-18T02:54:55Z+3,2012-04-18
2012-08-30T21:11:52.302Z,2012-08-30
20110529153933,2011-05-29
20310720070427669,2031-07-20
09-04-2013,2013-09-04
"29th of October, 2024",2024-10-29
2008|11|10,2008-11-10
"October 23, 2009",2009-10-23
2022-11-27T09:41:43+2500,2022-11-27
1116522000,2005-05-20
"23th of September, 2019",2019-09-23
2033-10-30T18:27:50Z+3,2033-10-30
20170209013218527291700,2017-02-09
Ngày 18-6-2020,2020-06-18
"December 13, 1999",1999-12-13
1586278800000000000,2020-04-08
1990-10-19T20:28:31+07:00,1990-10-19
21 Apr 1997,1997-04-21
Event at 2006-06-29T7:40:49,2006-06-29
2026_01_07T12_16_44Z,2026-01-07
2015-03-20,2015-03-20
1999-03-13,1999-03-13
25.9.1992T9-23-31,1992-09-25
2007-08-29T18:16:17Z+3,2007-08-29
16 May 2033,2033-05-16
1998-05-25T11:41:16+2500,1998-05-25
6/8-2009,2009-04-06
19991229125426821971269,1999-12-29
2 tháng 5 năm 2000,2000-05-02
ngày 5 tháng 10 năm 1993,1993-10-05
2008-06-17T11:34:51.761871Z,2008-06-17
20200731210128,2020-07-31
10 tháng 5 năm 1999,1999-05-10
2021/3/30T193120,2021-03-30
The system recorded 20180525102237,2018-05-25
19910124184926,1991-01-24
02-06-31,2031-06-02
866307600000000,1997-06-15
710442000000000,1992-07-07
2020-06-09T13:25:32,2020-06-09
25_3_1990,1990-03-25
20050531125923373626401,2005-05-31
27/1/2001 giờ 2:6:56,2001-01-27
775328400000,1994-07-28
21/7/2014 giờ 17:19:40,2014-07-21
20250415065152493311,2025-04-15
1449853200,2015-12-12
2028-03-07T22:15:25.134191Z,2028-03-07
1992/12/28T205135,1992-12-28
Ngày 10-7-2020,2020-07-10
2009/11/21T145224,2009-11-21
20130524053211838996166,2013-05-24
14.05.34,2034-05-14
2-8-2023,2023-08-02
2017-02-15T00:42:05+07:00,2017-02-15
1997-03-25T01:52:57.210141Z,1997-03-25
"9th of March, 2021",2021-03-09
2015/2/17T34539,2015-02-17
The system recorded 20301231212800,2030-12-31
2032-10-10T16:55:16.224947Z,2032-10-10
"7th of June, 1991",1991-06-07
1753981200,2025-08-01
The system recorded 20091210145550,2009-12-10
21.1.2019T20-13-19,2019-01-21
24 December 2025,2025-12-24
Event at 2002-07-30T1:59:57,2002-07-30
2031-05-26T17:20:22,2031-05-26
1965142800,2032-04-10
1997-07-09T07:37:51.783Z,1997-07-09
1803402000000000000,2027-02-24
22/4-1994,1994-02-22
2023-03-15T07:13:38.096060Z,2023-03-15
The system recorded 20010901024540,2001-09-01
07|09|07,2007-09-07
2014-10-05T11:33:21Z+3,2014-10-05
30 Jun 2023,2023-06-30
24 May 2026,2026-05-24
5.2.2007T15-7-51,2007-02-05
20071128181923,2007-11-28
2017/9/29T1524,2017-09-29
6 Nov 2021,2021-11-06
16.12.2020T13-40-1,2020-12-16
"22th of May, 2018",2018-05-22
20060601064744686,2006-06-01
2006-08-10,2006-08-10
2007-11-10T09:46:03Z+3,2007-11-10
2016-03-24T14:25:51.875153734Z,2016-03-24
8-8-2034,2034-08-08
22/12-2011,2011-06-22
2006-03-25T18:52:36.406596337Z,2006-03-25
07|14|2005,2005-07-14
12/6/1991 giờ 4:51:4,1991-06-12
08.04.04,2004-04-08
The system recorded 19900531191057,1990-05-31
2029-05-05T16:50:49.118Z,2029-05-05
1991/1/27T17150,1991-01-27
2022-01-03T14:07:33-0330,2022-01-03
2000_05_20T11_27_53-0300,2000-05-20
7/3/2013 giờ 5:11:53,2013-03-07
2014-03-30T20:32:40.963981076Z,2014-03-30
15 tháng 12 năm 2002,2002-12-15
20050122005054367431,2005-01-22
Sự kiện diễn ra vào 24/10/2003 23:27,2003-10-24
17.11.1990T18-36-14,1990-11-17
The system recorded 20030909105205,2003-09-09
12 February 2000,2000-02-12
26 Jun 2011,2011-06-26
28 tháng 1 năm 1997,1997-01-28
20351231234728343,2035-12-31
20 Mar 2031,2031-03-20
2023-10-08T08:09:42Z+3,2023-10-08
1997_01_05T22_16_54+08,1997-01-05
1989075600000000,2033-01-12
17|12|16,2016-12-17
1679331600,2023-03-21
2030-02-04T13:15:47.773103479Z,2030-02-04
2021-11-15T08:00:53.516495030Z,2021-11-15
1358010000,2013-01-13
2019-03-22T12:54:00Z+3,2019-03-22
2020-02-09T03:06:46.526Z,2020-02-09
2005491600000000000,2033-07-21
1653670800000000000,2022-05-28
2029_03_18T6_2_10Z+3,2029-03-18
2010_08_11T15_5_14-0330,2010-08-11
894992400000000000,1998-05-13
1733590800000000,2024-12-08
Sự kiện diễn ra vào 16/12/2001 3:36,2001-12-16
2018-06-11T12:23:20.522Z,2018-06-11
2022_12_11T21_13_42+0500,2022-12-11
2009-10-27T22:33:55.051751294Z,2009-10-27
1365699600,2013-04-12
2021-03-25T03:17:52Z+3,2021-03-25
2003-06-06T11:43:17+2500,2003-06-06
ngày 12 tháng 4 năm 2026,2026-04-12
1862931600000000000,2029-01-13
"August 3, 2013",2013-08-03
20291106140100,2029-11-06
27-03-32,2032-03-27
The system recorded 20031018044502,2003-10-18
2015/10/27T10917,2015-10-27
"June 22, 2014",2014-06-22
2016 09 20,2016-09-20
30.05.08,2008-05-30
23 Sep 2024,2024-09-23
20141109033523446022,2014-11-09
10 Mar 1993,1993-03-10
1411837200000000000,2014-09-28
02|06|1994,1994-02-06
2-7-2013,2013-07-01
2011-08-12T15:19:52+2500,2011-08-12
20111012171334,2011-10-12
"December 21, 1999",1999-12-21
28/11/2003 giờ 5:31:57,2003-11-28
01/06/2021,2021-01-06
2012-10-07T10:32:56.023299Z,2012-10-07
20121217210840790904939,2012-12-17
23/3/2005 giờ 18:50:38,2005-03-23
28 tháng 3 năm 2006,2006-03-28
20090802143425013857,2009-08-02
04-06-94,1994-06-04
2028-05-21T20:20:29+2500,2028-05-21
2028-08-05,2028-08-05
Event at 2010-07-15T3:54:32,2010-07-15
11.7.2002T10-2-28,2002-07-11
2030_09_10T15_20_15+3,2030-09-10
Event at 2004-10-07T21:44:10,2004-10-07
2018-11-11T00:22:44+2500,2018-11-11
2002/1/3T95425,2002-01-03
Ngày 15-7-1998,1998-07-15
6 May 2020,2020-05-06
27-1-1990,1990-01-27
1790960400000,2026-10-03
18-12-2013,2013-12-09
20240820094825459450988,2024-08-20
1606669200,2020-11-30
2006-08-24T13:03:19+3,2006-08-24
2025-02-27T08:19:06.569118Z,2025-02-27
"30th of March, 2030",2030-03-30
11/1/1996 giờ 12:45:38,1996-01-11
20040910183650,2004-09-10
25.12.2023T13-27-15,2023-12-25
"April 17, 2012",2012-04-17
22/9/2012 giờ 5:41:7,2012-09-22
20120928171657510646480,2012-09-28
2016-07-06T17:35:49.014777771Z,2016-07-06
7 December 2027,2027-12-07
20130711015115,2013-07-11
22 tháng 11 năm 2006,2006-11-22
17/5/2022,2022-05-17
27|1|2033,2033-01-27
2006-12-02T09:05:06+2500,2006-12-02
20261124203824965,2026-11-24
Event at 2023-06-22T15:5:36,2023-06-22
896634000000000000,1998-06-01
1991_01_29T19_27_24-0330,1991-01-29
20070501220738488,2007-05-01
05_31_1999,1999-05-31
2021-08-26T00:55:49Z+3,2021-08-26
20320115094209877,2032-01-15
20240525003110,2024-05-25
20340626020738906204,2034-06-26
ngày 20 tháng 4 năm 2031,2031-04-20
2030-10-27T02:08:44,2030-10-27
The system recorded 20320705073145,2032-07-05
25 tháng 9 năm 2028,2028-09-25
22.6.2028T12-43-32,2028-06-22
2014-09-11T12:14:53.637632897Z,2014-09-11
1343754000000000,2012-08-01
2032/3/22T12280,2032-03-22
12-08-01,2001-08-12
1990-01-15T10:45:58.223035061Z,1990-01-15
2004-09-07T09:53:49+08,2004-09-07
20260908150457005422421,2026-09-08
1216573200,2008-07-21
1997|09|09,1997-09-09
"14th of June, 2030",2030-06-14
Ngày 2-1-2004,2004-01-02
20340616141708,2034-06-16
2030-09-17T15:11:56+2500,2030-09-17
20310505091314857,2031-05-05
1154278800,2006-07-31
2006-03-13T16:08:48.850759Z,2006-03-13
20300417040458636774,2030-04-17
2019|12|16,2019-12-16
28|05|90,1990-05-28
2030-06-01T23:41:09.085155Z,2030-06-01
20220610013407123863,2022-06-10
2035-10-31T23:53:41+2500,2035-10-31
9 November 1991,1991-11-09
The system recorded 20220910134045,2022-09-10
2017_04_10T14_6_39+0500,2017-04-10
1991-11-23T18:35:23.923Z,1991-11-23
1480266000000000000,2016-11-28
1421946000,2015-01-23
14-4-1999,1999-04-14
20141226022037592045432,2014-12-26
12|22|2014,2014-12-22
20040619193303592825428,2004-06-19
24 March 2011,2011-03-24
10-9-2008,2008-09-10
The system recorded 20110925091428,2011-09-25
736275600,1993-05-02
2010-05-25T02:41:30.314553297Z,2010-05-25
1249232400000000,2009-08-03
2007-08-19T01:25:28+2500,2007-08-19
11-3-1998,1998-03-11
748803600000000,1993-09-24
20-6-2014,2014-06-10
20301112232437271267830,2030-11-12
1458234000000000000,2016-03-18
10/14-2017,2017-07-10
19930302030148007448,1993-03-02
2003-02-20T19:11:37Z+3,2003-02-20
20131008181819497974268,2013-10-08
29/7/1991 giờ 7:22:51,1991-07-29
Ngày 6-6-2004,2004-06-06
"April 9, 2031",2031-04-09
20230917194009,2023-09-17
2015-11-09T09:42:06+0500,2015-11-09
1117990800000000000,2005-06-06
The system recorded 20130323145435,2013-03-23
26-11-2007,2007-11-26
12 Aug 2022,2022-08-12
"9th of March, 2012",2012-03-09
Sự kiện diễn ra vào 16/10/2033 6:27,2033-10-16
11 Nov 1990,1990-11-11
"17th of December, 2023",2023-12-17
"21th of September, 1995",1995-09-21
20/20-2010,2010-10-20
799261200,1995-05-01
1957366800000,2032-01-11
14/14-1995,1995-07-14
60-8-2017,2017-08-30
5.12.2014T20-30-58,2014-12-05
"May 8, 1995",1995-05-08
18/8-2030,2030-04-18
731264400000000000,1993-03-05
2030-08-08T01:45:43.078378Z,2030-08-08
28.7.2031,2031-07-28
2028-02-06,2028-02-06
Sự kiện diễn ra vào 2/4/2033 16:13,2033-04-02
8/3/2009 giờ 10:9:27,2009-03-08
1993-07-01T01:10:37Z+3,1993-07-01
20-3-2025,2025-03-10
1995-03-02T04:53:09Z,1995-03-02
2 tháng 1 năm 2001,2001-01-02
1960822800000000000,2032-02-20
13 tháng 1 năm 2015,2015-01-13
The system recorded 20130217094709,2013-02-17
Event at 2012-05-10T8:12:26,2012-05-10
Sự kiện diễn ra vào 15/7/2022 7:32,2022-07-15
20280424045509018,2028-04-24
"July 23, 1991",1991-07-23
26-9-2018,2018-09-13
20101021043004502306572,2010-10-21
Event at 2011-01-23T5:42:11,2011-01-23
22/10/2005 giờ 0:10:3,2005-10-22
19991112052158000163724,1999-11-12
19960311184732900472453,1996-03-11
19990729174457,1999-07-29
10/12/2020,2020-12-10
2017-08-30T07:37:43.580439Z,2017-08-30
22-6-2028,2028-06-22
2010.04.13,2010-04-13
3 Nov 2003,2003-11-03
2027-02-04T08:58:55.532Z,2027-02-04
21/9/1990,1990-09-21
2026-11-09T16:08:03+2500,2026-11-09
2025-05-11T23:09:25.429749Z,2025-05-11
ngày 24 tháng 5 năm 2007,2007-05-24
28.7.2010T0-37-47,2010-07-28
1996-04-03T01:46:55Z+3,1996-04-03
2039965200000000,2034-08-24
18-5-2021,2021-05-18
07.05.1993,1993-07-05
20150729054747233,2015-07-29
28-7-2035,2035-07-14
5-7-2007,2007-07-05
29-10-2006,2006-10-29
20341115181037879938420,2034-11-15
2014_03_12T3_19_38-05:00,2014-03-12
1/20-1998,1998-10-01
2004-05-09T13:26:46,2004-05-09
20240719202451665,2024-07-19
19911003010634547728677,1991-10-03
16/1/1992 giờ 22:42:0,1992-01-16
8 Jun 2023,2023-06-08
16 tháng 2 năm 2005,2005-02-16
2006-06-12T13:33:22.279748Z,2006-06-12
1407690000,2014-08-11
34-2-2032,2032-02-17
3 tháng 8 năm 2018,2018-08-03
2028_03_23T11_19_51-0330,2028-03-23
3 Jul 2020,2020-07-03
18.2.2021T6-41-31,2021-02-18
10.08.2011,2011-10-08
7 July 1992,1992-07-07
The system recorded 20300714101422,2030-07-14
02.05.2028,2028-02-05
19940429014316,1994-04-29
20230226131501493074081,2023-02-26
Ngày 6-5-2030,2030-05-06
19920715175551822927661,1992-07-15
2029/2/12T33658,2029-02-12
8 Feb 2034,2034-02-08
ngày 25 tháng 1 năm 1990,1990-01-25
3 tháng 4 năm 2022,2022-04-03
20310501195244238826085,2031-05-01
1999-08-25T08:57:27Z+3,1999-08-25
"1st of February, 2000",2000-02-01
1506618000,2017-09-29
"November 22, 2007",2007-11-22
1341853200000000000,2012-07-10
10 Jan 2033,2033-01-10
20031130114624,2003-11-30
10.12.2005T1-7-36,2005-12-10
"14th of August, 1990",1990-08-14
1039366800,2002-12-09
"22th of May, 1995",1995-05-22
The system recorded 20190421030312,2019-04-21
Ngày 2-6-2027,2027-06-02
The system recorded 19950107070621,1995-01-07
997549200000000000,2001-08-12
2012-11-14T18:14:28-0300,2012-11-14
2020-01-26T09:26:08,2020-01-26
16 November 2018,2018-11-16
2023/10/22T213810,2023-10-22
29-7-2009,2009-07-29
25 8 2011,2011-08-25
"October 6, 1997",1997-10-06
2029-03-31T17:45:21Z+3,2029-03-31
ngày 21 tháng 3 năm 2032,2032-03-21
15-5-1990,1990-05-15
20280121161700186,2028-01-21
20330504161552565345987,2033-05-04
2032-08-07T01:08:23.738886Z,2032-08-07
20020721155716189,2002-07-21
20340429015816596,2034-04-29
1991-12-01T22:44:43.450Z,1991-12-01
2012-07-11T05:22:34,2012-07-11
2004-12-19T20:23:57.733Z,2004-12-19
2025-02-12T07:39:26.577Z,2025-02-12
16 Sep 2030,2030-09-16
16/2-2023,2023-01-16
Event at 2008-04-12T22:26:51,2008-04-12
09/14/2026,2026-09-14
20110308104738418003,2011-03-08
2020_10_28,2020-10-28
The system recorded 20291103081704,2029-11-03
1730221200,2024-10-30
1574787600000000000,2019-11-27
1994_08_10T8_55_22-0330,1994-08-10
11 Sep 2006,2006-09-11
6 Sep 2013,2013-09-06
2002-04-06T02:23:17.864Z,2002-04-06
2026-03-27T06:55:52.661031Z,2026-03-27
2020-12-03T17:28:29.144545969Z,2020-12-03
2024-10-03T20:54:42,2024-10-03
03/23/2007,2007-03-23
1375549200000000,2013-08-04
1990-06-01T04:11:24.858Z,1990-06-01
2001-04-13T18:07:57.569Z,2001-04-13
The system recorded 20130528072210,2013-05-28
4 May 1992,1992-05-04
20220819021247225,2022-08-19
3 tháng 4 năm 2021,2021-04-03
ngày 19 tháng 11 năm 2028,2028-11-19
Event at 2030-12-25T2:49:25,2030-12-25
2013_05_11T23_23_59-0330,2013-05-11
2025-02-17T09:29:20.284425980Z,2025-02-17
20290206152911,2029-02-06
19991020063246063,1999-10-20
13/12-2024,2024-06-13
2023_10_23,2023-10-23
1485018000000000,2017-01-22
2020-02-04T11:31:00.716Z,2020-02-04
2018-09-15T20:28:15+2500,2018-09-15
13-5-1997,1997-05-13
2032-07-21T23:52:48.985963Z,2032-07-21
21.2.2023T6-31-51,2023-02-21
Event at 2001-04-05T19:27:11,2001-04-05
2023-03-11T13:12:09.788087Z,2023-03-11
2032-06-08T10:16:18.029155Z,2032-06-08
20330613134438073,2033-06-13
"July 20, 2027",2027-07-20
"6th of August, 2004",2004-08-06
19901101073006467962031,1990-11-01
2002-02-18T04:10:18.645893Z,2002-02-18
1988470800000,2033-01-05
20230911063024,2023-09-11
11_23_1997,1997-11-23
46-4-1995,1995-04-23
2023 04 29,2023-04-29
12 tháng 11 năm 2027,2027-11-12
"September 3, 2004",2004-09-03
4 tháng 4 năm 1998,1998-04-04
Ngày 8-5-2016,2016-05-08
20171021084658088627444,2017-10-21
Ngày 3-5-2017,2017-05-03
ngày 22 tháng 5 năm 2001,2001-05-22
54-1-1999,1999-01-27
20.9.2027T15-42-57,2027-09-20
1993/5/3T03825,1993-05-03
2031-09-04T03:16:16.757041Z,2031-09-04
7 tháng 2 năm 1993,1993-02-07
2003_11_04,2003-11-04
11.6.2005T8-50-30,2005-06-11
"5th of August, 2026",2026-08-05
1854118800000000000,2028-10-03
9/5/1992 giờ 4:14:54,1992-05-09
1990285200000,2033-01-26
2001_11_11T5_48_42Z+3,2001-11-11
2 tháng 10 năm 2007,2007-10-02
11|19|2009,2009-11-19
26-08-06,2006-08-26
20180222024046466396360,2018-02-22
2008/8/1T18428,2008-08-01
22.12.2006T16-20-58,2006-12-22
1994-03-18T01:32:52.952Z,1994-03-18
12.08.2026,2026-12-08
Event at 2005-01-29T23:51:11,2005-01-29
Ngày 22-3-2012,2012-03-22
2003-12-28T02:44:41+2500,2003-12-28
ngày 22 tháng 1 năm 2001,2001-01-22
2024-06-12T20:15:33-0330,2024-06-12
8.8.2009T8-7-30,2009-08-08
21.6.2027T1-24-56,2027-06-21
1889542800,2029-11-17
07|04|09,2009-04-07
2020-12-22T08:00:16.174812068Z,2020-12-22
Sự kiện diễn ra vào 22/11/2021 16:33,2021-11-22
19910610140323644313932,1991-06-10
2013_12_25T20_30_44+08,2013-12-25
2034-12-30T15:53:50.340800Z,2034-12-30
20220305161410514755,2022-03-05
2033-06-29T12:11:16+3,2033-06-29
Ngày 9-11-2005,2005-11-09
20071120223120350140400,2007-11-20
26_9_2006,2006-09-26
20070912133714,2007-09-12
23.5.2029T11-29-11,2029-05-23
19900211203950072,1990-02-11
2021/11/30T25622,2021-11-30
"14th of April, 2001",2001-04-14
1994-07-11T21:00:31.705Z,1994-07-11
The system recorded 20311129061434,2031-11-29
1001523600,2001-09-27
24 Apr 2010,2010-04-24
2028-06-25T19:38:59+2500,2028-06-25
Event at 1994-05-14T10:54:44,1994-05-14
2010-06-08T02:21:04,2010-06-08
20130915230231009986,2013-09-15
8 tháng 3 năm 2005,2005-03-08
20040313105442321912312,2004-03-13
08_06_2031,2031-08-06
Event at 2012-03-02T16:35:21,2012-03-02
ngày 24 tháng 7 năm 2006,2006-07-24
"10th of August, 2009",2009-08-10
ngày 14 tháng 11 năm 2023,2023-11-14
22-12-1990,1990-12-11
Event at 2017-07-10T11:45:37,2017-07-10
"17th of August, 2004",2004-08-17
2006-03-06T07:59:55,2006-03-06
Ngày 7-11-2028,2028-11-07
20/20-2003,2003-10-20
12 Feb 2032,2032-02-12
ngày 5 tháng 2 năm 2001,2001-02-05
09_16_2010,2010-09-16
Ngày 3-10-1995,1995-10-03
1990-08-25T05:45:16.932Z,1990-08-25
Sự kiện diễn ra vào 2/2/2032 19:58,2032-02-02
7/14-2021,2021-07-07
2 August 2013,2013-08-02
2-12-2034,2034-12-01
The system recorded 20121009234605,2012-10-09
18/5/1999 giờ 17:26:19,1999-05-18
2001-05-17T16:17:52+2500,2001-05-17
1448125200000,2015-11-22
15/16-2006,2006-08-15
Ngày 15-9-2035,2035-09-15
26/16-1999,1999-08-26
ngày 16 tháng 2 năm 2016,2016-02-16
24-1-1992,1992-01-12
1076518800000,2004-02-12
1995_04_12T5_6_11+0500,1995-04-12
16/4-2024,2024-02-16
19920330053207254,1992-03-30
1992-06-08T08:39:47.811804Z,1992-06-08
19 Oct 2014,2014-10-19
2001-06-14T12:06:53Z+3,2001-06-14
25/12-2012,2012-06-25
2015_11_16T15_40_19+00:00,2015-11-16
2006-03-12T13:40:53.188Z,2006-03-12
19-7-2001,2001-07-19
25-10-1994,1994-10-25
1432573200000000,2015-05-26
2024-07-07T21:48:57,2024-07-07
1996-02-16T22:02:19Z+3,1996-02-16
18 Sep 2002,2002-09-18
Ngày 26-12-2011,2011-12-26
Event at 2010-09-12T7:5:53,2010-09-12
Event at 2021-07-11T13:59:59,2021-07-11
19960229015858560624,1996-02-29
1414429200000000,2014-10-28
20231011204900875,2023-10-11
1276794000,2010-06-18
20280817145710,2028-08-17
2032/2/10T152031,2032-02-10
2033_12_17T19_28_59+00:00,2033-12-17
28 tháng 6 năm 2004,2004-06-28
6-3-2015,2015-03-06
2009_10_26T0_0_0Z+3,2009-10-26
11.3.2006T14-36-49,2006-03-11
Sự kiện diễn ra vào 18/8/2026 0:37,2026-08-18
12 March 2023,2023-03-12
1994-07-25T21:06:22Z,1994-07-25
4 tháng 11 năm 2032,2032-11-04
"December 21, 2011",2011-12-21
2031/10/24T19440,2031-10-24
2029|06|20,2029-06-20
2023-12-15T01:52:44.961956Z,2023-12-15
26-10-2028,2028-10-26
ngày 17 tháng 4 năm 2022,2022-04-17
1956934800000000000,2032-01-06
2035-09-26,2035-09-26
Event at 2010-04-12T14:24:37,2010-04-12
26.1.2001T0-29-17,2001-01-26
2006/12/15,2006-12-15
The system recorded 20100107032453,2010-01-07
"November 6, 1994",1994-11-06
8-2-2007,2007-02-08
1995/10/30T93026,1995-10-30
2010_08_14T9_10_0+07:00,2010-08-14
The system recorded 20320129160008,2032-01-29
Sự kiện diễn ra vào 5/4/2011 21:26,2011-04-05
2031-01-28T17:36:25Z+3,2031-01-28
2/3/2015 giờ 23:50:8,2015-03-02
09_11_07,2007-11-09
10 Mar 2011,2011-03-10
24/3/1995,1995-03-24
1063472400000,2003-09-14
20060615055804,2006-06-15
15/16-1993,1993-08-15
"July 30, 2004",2004-07-30
"December 9, 2005",2005-12-09
20210823211126610476058,2021-08-23
20300812183705,2030-08-12
17 Aug 2019,2019-08-17
14 October 2017,2017-10-14
20061023125932839855644,2006-10-23
926010000,1999-05-07
670266000000000,1991-03-30
ngày 28 tháng 9 năm 2023,2023-09-28
08 28 1997,1997-08-28
2012-06-03T16:58:58+2500,2012-06-03
23 12 2002,2002-12-23
8/1/2004,2004-01-08
2003-08-24T18:59:27+08,2003-08-24
5 Jun 2029,2029-06-05
Ngày 20-11-2010,2010-11-20
The system recorded 19990704154221,1999-07-04
14.10.2032T22-17-59,2032-10-14
1687194000000000000,2023-06-20
6-6-2014,2014-06-06
01_24_1999,1999-01-24
1998-07-29T16:58:49.115Z,1998-07-29
20330602080100592677420,2033-06-02
20240309071522244717396,2024-03-09
7.3.2006T0-34-54,2006-03-07
2030-01-25T05:12:05.981314389Z,2030-01-25
20161213000646782817377,2016-12-13
1-2-1999,1999-02-01
2014-01-14T02:04:09,2014-01-14
05|23|2026,2026-05-23
1994-07-31T12:14:23.799556Z,1994-07-31
2023_04_20T20_19_45Z+3,2023-04-20
Ngày 12-1-2017,2017-01-12
2000-08-08T15:33:02+00:00,2000-08-08
08/09/2009,2009-08-09
1150995600000000000,2006-06-23
22-4-2014,2014-04-22
1046538000000000000,2003-03-02
19 tháng 7 năm 2009,2009-07-19
2011-03-03,2011-03-03
29.5.1993T16-10-9,1993-05-29
09.01.24,2024-01-09
20210809230808,2021-08-09
3 Jul 1999,1999-07-03
1994-04-03T19:04:07.830936603Z,1994-04-03
1991-02-11T08:12:06-05:00,1991-02-11
27/5/1999 giờ 3:11:0,1999-05-27
The system recorded 19941107071104,1994-11-07
28/11/1991,1991-11-28
20211228074046,2021-12-28
07.03.2010,2010-07-03
20070415174318980548,2007-04-15
Event at 2031-09-17T4:1:44,2031-09-17
27.7.2013T16-38-23,2013-07-27
20301116195446131733,2030-11-16
1851958800000,2028-09-08
30-4-1999,1999-04-30
1791565200000000000,2026-10-10
1424970000000000,2015-02-27
20091008100049273129391,2009-10-08
30/5/2030 giờ 14:47:27,2030-05-30
ngày 14 tháng 8 năm 2028,2028-08-14
2020-05-05T04:39:21-0300,2020-05-05
2015-08-10T20:12:23,2015-08-10
4-9-1995,1995-09-04
"August 8, 2030",2030-08-08
Event at 2023-07-06T10:56:56,2023-07-06
2000_01_21T2_1_49+3,2000-01-21
7-8-2005,2005-08-07
2-11-2005,2005-11-02
11.6.2013T19-25-45,2013-06-11
30/20-1999,1999-10-30
2014-10-27,2014-10-27
2023-11-10T02:39:31.110447237Z,2023-11-10
1018976400,2002-04-17
2016-12-03T10:49:32+3,2016-12-03
ngày 29 tháng 4 năm 1999,1999-04-29
2 Aug 2005,2005-08-02
23/1/2013 giờ 23:52:5,2013-01-23
30/2-2035,2035-01-30
1396717200,2014-04-06
15 Aug 1994,1994-08-15
2023-08-08T09:07:28.586790561Z,2023-08-08
2034-07-22T12:17:34.884207Z,2034-07-22
2009/4/23T174722,2009-04-23
14-12-2025,2025-12-07
09|05|01,2001-05-09
"June 24, 2003",2003-06-24
29.12.2028T3-46-14,2028-12-29
07/28/2033,2033-07-28
"12th of February, 2019",2019-02-12
"21th of January, 1997",1997-01-21
07.07.2009,2009-07-07
28/3/2001 giờ 4:15:24,2001-03-28
964112400000,2000-07-21
46-5-2035,2035-05-23
Sự kiện diễn ra vào 7/10/1997 17:55,1997-10-07
Event at 2031-08-29T20:12:16,2031-08-29
21-09-34,2034-09-21
19941006010647,1994-10-06
1744563600000000,2025-04-14
2021-02-25T18:14:07+2500,2021-02-25
16 7 1997,1997-07-16
02_03_07,2007-03-02
712602000000000,1992-08-01
783363600000000000,1994-10-29
18.10.1998T1-25-11,1998-10-18
7/6/2031,2031-06-07
Sự kiện diễn ra vào 28/11/2005 9:8,2005-11-28
17 tháng 10 năm 2020,2020-10-17
04 06 10,2010-06-04
2034-12-03T23:57:08,2034-12-03
19960702033602,1996-07-02
23|7|2020,2020-07-23
2007-06-17T11:29:41,2007-06-17
"27th of June, 2014",2014-06-27
2025_01_07,2025-01-07
Sự kiện diễn ra vào 26/3/1995 8:32,1995-03-26
2|3|2014,2014-03-02
2020-05-13T22:41:52.673015838Z,2020-05-13
1597770000000000,2020-08-19
1933693200,2031-04-12
10_01_12,2012-01-10
ngày 23 tháng 9 năm 2007,2007-09-23
Ngày 17-1-1995,1995-01-17
2023-12-02T06:16:55,2023-12-02
2030-09-27T01:31:49.546753886Z,2030-09-27
20140222183937,2014-02-22
1513875600000000000,2017-12-22
20120324202638,2012-03-24
8.8.2023T5-28-24,2023-08-08
ngày 18 tháng 11 năm 1995,1995-11-18
Sự kiện diễn ra vào 17/6/2009 13:45,2009-06-17
1994259600,2033-03-13
2010-06-03T12:46:17,2010-06-03
07 17 2023,2023-07-17
Sự kiện diễn ra vào 30/11/2003 15:45,2003-11-30
19931109073840347036,1993-11-09
20090401015018193,2009-04-01
1999-11-12T22:59:02.332228070Z,1999-11-12
Event at 2018-03-30T18:54:3,2018-03-30
1998-06-16T19:06:08,1998-06-16
1300640400000000,2011-03-21
25 Feb 2010,2010-02-25
Event at 2002-01-20T11:5:29,2002-01-20
20-7-2020,2020-07-20
01.19.1995,1995-01-19
29|5|1991,1991-05-29
09_08_2030,2030-09-08
Event at 2023-05-26T6:22:14,2023-05-26
Event at 1992-06-13T7:16:39,1992-06-13
19930218171844,1993-02-18
19|1|2026,2026-01-19
1658682000000000,2022-07-25
22 tháng 8 năm 2022,2022-08-22
The system recorded 20291220093539,2029-12-20
20.4.2034T10-26-32,2034-04-20
20351226175733139862,2035-12-26
50-4-2034,2034-04-25
"2nd of October, 2012",2012-10-02
2018-06-14T18:31:54+2500,2018-06-14
2029/11/9T24244,2029-11-09
22 Jan 2003,2003-01-22
16/7/2022 giờ 13:24:50,2022-07-16
30-6-1994,1994-06-30
2003-09-12T12:42:15+2500,2003-09-12
"January 8, 2028",2028-01-08
20.4.2014T11-50-2,2014-04-20
"March 20, 2022",2022-03-20
20001108111633305187,2000-11-08
1897318800,2030-02-15
1994_04_02T8_3_25+3,1994-04-02
2031 06 15,2031-06-15
Event at 2008-06-11T13:31:2,2008-06-11
20101202194319,2010-12-02
17.8.1998T23-20-31,1998-08-17
2007/4/29T21470,2007-04-29
Event at 2005-09-24T9:31:24,2005-09-24
2012-01-03T02:39:56.130Z,2012-01-03
1696352400,2023-10-04
13 Oct 2004,2004-10-13
2027_09_11T23_44_22Z,2027-09-11
22/24-2021,2021-12-22
2003245200000,2033-06-25
7 December 2011,2011-12-07
2006-11-03T05:50:04+2500,2006-11-03
2010-05-31T18:53:28Z+3,2010-05-31
11.5.1992,1992-05-11
19950629203347,1995-06-29
3-12-1993,1993-12-03
19910205134937040089390,1991-02-05
15 June 2029,2029-06-15
20290201170057025,2029-02-01
20010722182659515393,2001-07-22
2027-11-03T21:56:55Z+3,2027-11-03
2006_03_11T7_25_13-0330,2006-03-11
2003-10-31T08:50:45.220748Z,2003-10-31
1874941200000000000,2029-06-01
"December 5, 2013",2013-12-05
"17th of March, 2030",2030-03-17
2031_08_17T11_31_5+00:00,2031-08-17
The system recorded 20090928150457,2009-09-28
1991-12-22T05:41:48.440576Z,1991-12-22
2030-02-10T20:09:16+2500,2030-02-10
2017 04 07,2017-04-07
20080723215138852280,2008-07-23
Event at 2004-09-30T8:41:52,2004-09-30
30 tháng 8 năm 2024,2024-08-30
2028-11-10T18:31:10+2500,2028-11-10
18 4 1993,1993-04-18
2004-06-18T02:34:34.760607Z,2004-06-18
12/10/03,2003-10-12
2023_11_20,2023-11-20
17.7.2022T18-47-0,2022-07-17
20141110061627977457288,2014-11-10
1997-12-22T06:21:02.260962Z,1997-12-22
2012-03-30T15:56:50.098541Z,2012-03-30
2012-02-17T19:05:55+2500,2012-02-17
19990704180802995908631,1999-07-04
1176742800000000000,2007-04-17
20330820221145635196885,2033-08-20
757357200000000000,1994-01-01
2007-04-04T18:47:29+2500,2007-04-04
"8th of June, 2021",2021-06-08
1765040400000000000,2025-12-07
1995 11 26,1995-11-26
2013-06-09T00:05:34.334836Z,2013-06-09
26/10/2023 giờ 5:23:3,2023-10-26
20091112074517002,2009-11-12
2/14-1991,1991-07-02
20191019124534500262744,2019-10-19
1993-04-15T21:23:50Z+3,1993-04-15
2051802000000000,2035-01-08
Sự kiện diễn ra vào 8/10/2003 12:56,2003-10-08
20181227163518,2018-12-27
Ngày 26-7-1995,1995-07-26
1996_01_03T18_15_0-0300,1996-01-03
2034-12-05T08:22:22.551Z,2034-12-05
"31th of October, 1995",1995-10-31
14-3-2008,2008-03-14
20141027180314742604560,2014-10-27
2031-12-16T10:35:34Z+3,2031-12-16
12.10.1998T12-31-43,1998-10-12
2030-12-24T20:02:08.429170Z,2030-12-24
2-1-2030,2030-01-01
Sự kiện diễn ra vào 7/2/2024 19:44,2024-02-07
12-10-2009,2009-10-06
2 July 2034,2034-07-02
1630083600000000,2021-08-28
7 May 2006,2006-05-07
ngày 2 tháng 2 năm 2005,2005-02-02
2018_08_19T2_54_54-0300,2018-08-19
"10th of August, 2019",2019-08-10
2010-08-17T00:25:14.602Z,2010-08-17
2020-08-23T23:17:25.251506Z,2020-08-23
2005-12-22T03:20:35.109532Z,2005-12-22
"November 26, 2005",2005-11-26
23 tháng 8 năm 1996,1996-08-23
2001/07/29,2001-07-29
18/11/1998 giờ 1:14:8,1998-11-18
12/8-2010,2010-04-12
1080406800000,2004-03-28
01/31/2022,2022-01-31
1558630800000,2019-05-24
20280128072610146348,2028-01-28
Event at 2003-08-01T16:27:43,2003-08-01
1590080400000,2020-05-22
28-4-1999,1999-04-28
19940705051425359417700,1994-07-05
1996/1/25T6636,1996-01-25
2018-08-17T18:32:16.713936898Z,2018-08-17
19 January 2005,2005-01-19
10.06.1999,1999-10-06
1576774800,2019-12-20
19910509155511,1991-05-09
Ngày 13-3-2007,2007-03-13
1586365200000000,2020-04-09
1766682000000000000,2025-12-26
2019-06-14T10:59:35.788558Z,2019-06-14
ngày 5 tháng 3 năm 2023,2023-03-05
21-9-1991,1991-09-21
1990-01-05T12:27:16.799340065Z,1990-01-05
The system recorded 20010510222249,2001-05-10
The system recorded 20031204030431,2003-12-04
2008/2/17T125813,2008-02-17
Sự kiện diễn ra vào 10/3/2022 4:49,2022-03-10
27.1.2017,2017-01-27
"December 12, 1993",1993-12-12
16-12-2016,2016-12-16
1356022800,2012-12-21
1752598800000,2025-07-16
2030 12 02,2030-12-02
"October 31, 1995",1995-10-31
"July 8, 1992",1992-07-08
19.3.1991,1991-03-19
13.7.2004T18-28-10,2004-07-13
2015-10-03T23:57:55+2500,2015-10-03
1571418000000000,2019-10-19
20-8-2030,2030-08-20
1992_08_28T20_1_1Z+3,1992-08-28
8/18-2008,2008-09-08
3 December 2000,2000-12-03
1204218000000,2008-02-29
1991-01-29T01:50:34.985310Z,1991-01-29
2024-11-18T09:55:53,2024-11-18
Ngày 21-7-2000,2000-07-21
19980918155855833552,1998-09-18
27/3/1993 giờ 12:11:41,1993-03-27
Event at 2028-10-03T16:21:55,2028-10-03
Sự kiện diễn ra vào 27/5/2016 12:58,2016-05-27
2003/9/11T22112,2003-09-11
2008-02-11T13:05:38-0330,2008-02-11
2006-12-13T23:25:45.762798366Z,2006-12-13
02_15_2035,2035-02-15
23.3.2023T20-57-44,2023-03-23
Event at 2026-12-07T15:46:16,2026-12-07
7.7.2015T14-18-42,2015-07-07
1424106000000,2015-02-17
2027/6/30T183916,2027-06-30
2011-08-21T04:12:22,2011-08-21
20210522184115690289594,2021-05-22
The system recorded 20290518091600,2029-05-18
9-5-2010,2010-05-09
2017-04-08T08:47:25+00:00,2017-04-08
20290114224510,2029-01-14
1956589200000000000,2032-01-02
10 October 2011,2011-10-10
12 12 2019,2019-12-12
1999/3/20T5529,1999-03-20
19 11 2008,2008-11-19
ngày 19 tháng 2 năm 1994,1994-02-19
20211215164142713474633,2021-12-15
2032/8/10T9637,2032-08-10
2004-02-17T12:38:23.977708Z,2004-02-17
20060604135556,2006-06-04
6/6/2021 giờ 22:28:3,2021-06-06
2013-10-25T10:11:49Z+3,2013-10-25
2033-09-01T01:02:45Z+3,2033-09-01
03|07|2010,2010-03-07
"April 10, 2002",2002-04-10
1996_07_11T15_4_48+3,1996-07-11
11 December 2034,2034-12-11
16/8/2027 giờ 8:1:29,2027-08-16
2011-08-31T02:38:20+00:00,2011-08-31
26/11/2021 giờ 19:12:42,2021-11-26
28.10.2000T12-32-39,2000-10-28
801075600000000000,1995-05-22
ngày 9 tháng 3 năm 1998,1998-03-09
11/13/1998,1998-11-13
2004_01_05T16_34_17+3,2004-01-05
09 21 2005,2005-09-21
5|3|2015,2015-03-05
Ngày 4-8-2000,2000-08-04
23 tháng 3 năm 2000,2000-03-23
2001/10/02,2001-10-02
21 tháng 1 năm 1996,1996-01-21
930848400,1999-07-02
ngày 28 tháng 2 năm 2006,2006-02-28
29.3.2006T9-6-44,2006-03-29
1668963600000000000,2022-11-21
1990-03-13T23:18:15.103Z,1990-03-13
20281211204831582899,2028-12-11
The system recorded 20050720125556,2005-07-20
29.05.26,2026-05-29
19910113092906918078063,1991-01-13
1229360400000000,2008-12-16
Event at 2021-11-17T21:44:13,2021-11-17
10-06-04,2004-06-10
Ngày 4-6-2004,2004-06-04
2000-03-05T19:57:16,2000-03-05
20140120204521,2014-01-20
"July 17, 2032",2032-07-17
12 tháng 4 năm 2018,2018-04-12
1380733200000000000,2013-10-03
2027_02_14T23_34_37-05:00,2027-02-14
2017-08-31T14:39:16+2500,2017-08-31
29 Apr 1994,1994-04-29
"24th of May, 2019",2019-05-24
Event at 2019-12-14T13:17:50,2019-12-14
"January 9, 2005",2005-01-09
The system recorded 20020501083634,2002-05-01
58-8-2025,2025-08-29
"10th of March, 2016",2016-03-10
"31th of October, 2033",2033-10-31
7 tháng 11 năm 1997,1997-11-07
27.6.2011T1-16-12,2011-06-27
The system recorded 20310216021718,2031-02-16
963594000000000,2000-07-15
1994-09-12T14:57:40.129231Z,1994-09-12
03-24-2003,2003-03-24
20190701052225286564,2019-07-01
1991-01-17T06:44:10.841025Z,1991-01-17
07_30_2027,2027-07-30
8-1-2016,2016-01-08
2022-04-04T05:14:10+2500,2022-04-04
2032-03-07T02:49:58Z,2032-03-07
"October 2, 2030",2030-10-02
12 June 1991,1991-06-12
1320858000000000,2011-11-10
1995-01-08T03:20:52.319761381Z,1995-01-08
"June 8, 2026",2026-06-08
Ngày 7-11-1990,1990-11-07
2077549200000000000,2035-11-02
1237395600,2009-03-19
29 May 2004,2004-05-29
18|01|92,1992-01-18
2012-07-23T01:17:22Z+3,2012-07-23
Sự kiện diễn ra vào 6/4/1993 0:39,1993-04-06
21 Jan 2033,2033-01-21
06|10|2021,2021-06-10
Ngày 25-12-2025,2025-12-25
2020-05-25T12:03:06Z,2020-05-25
"18th of February, 2013",2013-02-18
23 November 2026,2026-11-23
23.10.2019T21-13-41,2019-10-23
20110201225117808885476,2011-02-01
2013-07-25T16:14:53.467863775Z,2013-07-25
2031-02-19T21:30:35,2031-02-19
716403600000,1992-09-14
832957200000000,1996-05-25
2027-01-16T15:18:32.882750Z,2027-01-16
904669200000000000,1998-09-02
16.3.1998T2-10-2,1998-03-16
1997-01-21T22:03:52.850800255Z,1997-01-21
1048006800000,2003-03-19
2008-05-07T22:38:50.158Z,2008-05-07
Ngày 16-8-2023,2023-08-16
"13th of December, 1996",1996-12-13
Ngày 30-9-2030,2030-09-30
2000-08-13T02:53:06+2500,2000-08-13
1994-08-16T14:07:28-0300,1994-08-16
20/22-2027,2027-11-20
36-8-2005,2005-08-18
1993-06-01T12:52:20.864455Z,1993-06-01
1999-03-23T09:34:34.590137Z,1999-03-23
ngày 2 tháng 9 năm 2008,2008-09-02
20170908190010759,2017-09-08
20110109012227,2011-01-09
6 tháng 11 năm 2004,2004-11-06
10 tháng 3 năm 1998,1998-03-10
07-15-2035,2035-07-15
Event at 2026-08-10T10:39:7,2026-08-10
2033/10/4T213459,2033-10-04
09_02_2002,2002-09-02
9 February 1992,1992-02-09
21/16-2015,2015-08-21
30 Jun 2012,2012-06-30
20020103143047649496,2002-01-03
9/6-2013,2013-03-09
Event at 2033-05-05T3:9:24,2033-05-05
1747760400000000000,2025-05-21
2004-04-18T11:41:18.493Z,2004-04-18
22-4-2032,2032-04-11
"10th of May, 1996",1996-05-10
2002/2/12T41520,2002-02-12
Ngày 14-9-2011,2011-09-14
2009_11_01T9_40_43-0300,2009-11-01
19960701014826,1996-07-01
2012/03/30,2012-03-30
1990/02/15,1990-02-15
1996|08|14,1996-08-14
27-8-2031,2031-08-27
Event at 2026-03-01T13:18:27,2026-03-01
2004-12-20T03:23:14+2500,2004-12-20
"November 26, 2023",2023-11-26
"6th of May, 1991",1991-05-06
08|06|2023,2023-08-06
13/11/2001 giờ 9:41:55,2001-11-13
2 8 1991,1991-08-02
12/6/2022 giờ 10:51:3,2022-06-12
20110201102256706842212,2011-02-01
2027-12-27T05:34:56Z+3,2027-12-27
26_1_2025,2025-01-26
12-2-2012,2012-02-06
10 April 2018,2018-04-10
15 Jun 2016,2016-06-15
7-11-2000,2000-11-07
1991 03 19,1991-03-19
2028-02-03T10:30:40Z+3,2028-02-03
"May 3, 2007",2007-05-03
2021-04-15T01:17:10,2021-04-15
21 July 2004,2004-07-21
19940619134625645303493,1994-06-19
03|29|2000,2000-03-29
1991-01-17,1991-01-17
Event at 2034-08-31T4:58:33,2034-08-31
2016/9/5T121447,2016-09-05
"June 13, 2035",2035-06-13
29 October 2012,2012-10-29
Sự kiện diễn ra vào 24/5/2026 4:38,2026-05-24
1994-01-21T06:22:56,1994-01-21
2004-02-10T23:34:34Z+3,2004-02-10
Event at 2035-03-06T9:58:17,2035-03-06
11/3/2016 giờ 6:48:27,2016-03-11
2007-02-14T23:21:58.066527744Z,2007-02-14
ngày 18 tháng 9 năm 2005,2005-09-18
Event at 2033-04-25T11:34:15,2033-04-25
2015-07-01T08:37:07.916879987Z,2015-07-01
The system recorded 19940628033644,1994-06-28
2012-06-04T23:05:37Z+3,2012-06-04
2010-09-24T05:52:36.573Z,2010-09-24
2035-03-08T04:57:32.794Z,2035-03-08
2004-08-19T15:04:05+07:00,2004-08-19
Event at 2035-03-06T9:47:9,2035-03-06
20330627190021481090229,2033-06-27
16/24-2008,2008-12-16
12.11.2021,2021-12-11
20_2_2017,2017-02-20
ngày 12 tháng 4 năm 2021,2021-04-12
27.12.2022T19-55-0,2022-12-27
13 March 2028,2028-03-13
20140519175455705,2014-05-19
23/4/2011,2011-04-23
Event at 2017-07-18T3:22:50,2017-07-18
20190510163023,2019-05-10
2023-01-09T05:47:28Z+3,2023-01-09
19 July 2024,2024-07-19
2004_01_19T17_7_40-05:00,2004-01-19
2005/5/16T21103,2005-05-16
2018-02-16T02:28:04.360919Z,2018-02-16
ngày 10 tháng 5 năm 1997,1997-05-10
"18th of June, 1990",1990-06-18
1523638800,2018-04-14
20091027035557963,2009-10-27
2029-08-11T23:19:43.964224011Z,2029-08-11
1616605200000000,2021-03-25
2034_06_15T20_23_3+2500,2034-06-15
12-2-2015,2015-02-06
6 May 2005,2005-05-06
2006-08-23T22:35:54-0300,2006-08-23
20310204153730450,2031-02-04
24/07/25,2025-07-24
2012-06-29T11:46:44.656187Z,2012-06-29
13-10-1999,1999-10-13
12 Mar 1998,1998-03-12
2017-06-08T07:31:10,2017-06-08
20020508121849,2002-05-08
6.9.2012T4-29-54,2012-09-06
2010/9/19T14230,2010-09-19
28 September 1999,1999-09-28
27/12-2027,2027-06-27
1438707600000,2015-08-05
26 October 2030,2030-10-26
ngày 30 tháng 4 năm 1999,1999-04-30
Ngày 3-2-2030,2030-02-03
Sự kiện diễn ra vào 15/6/2025 4:9,2025-06-15
1952269200,2031-11-13
15/12/1994 giờ 17:11:15,1994-12-15
1990-07-19T17:45:38.712668Z,1990-07-19
20340826034427648,2034-08-26
2025/05/31,2025-05-31
1 April 2002,2002-04-01
2007_09_24,2007-09-24
29-01-04,2004-01-29
28 Dec 1996,1996-12-28
2024-04-02T06:37:05+3,2024-04-02
2005_12_03,2005-12-03
2003-03-10T15:05:03+2500,2003-03-10
"31th of July, 1998",1998-07-31
2004-05-15T11:04:43+2500,2004-05-15
20050712082528,2005-07-12
2032-11-16T01:28:29+00:00,2032-11-16
6.1.1998T13-6-9,1998-01-06
20170307200826,2017-03-07
Event at 1991-07-14T13:4:44,1991-07-14
1708362000000000,2024-02-20
1763658000000000000,2025-11-21
2022-10-12T04:12:44.056622655Z,2022-10-12
19900803064546,1990-08-03
1999/2/14T235656,1999-02-14
1993-11-12T11:35:25Z+3,1993-11-12
2 Apr 1990,1990-04-02
20/01/03,2003-01-20
03|10|92,1992-10-03
2032-06-29T06:50:04+2500,2032-06-29
20310907225337355360196,2031-09-07
11_8_2008,2008-08-11
31 Jul 2019,2019-07-31
1996-10-22T22:42:43,1996-10-22
2020-06-20T08:40:16.299138399Z,2020-06-20
"October 6, 2030",2030-10-06
21 Nov 2010,2010-11-21
02/07/26,2026-07-02
1237136400000000,2009-03-16
1321722000000,2011-11-20
2014-02-27T22:20:20-0300,2014-02-27
9.1.2010T18-44-23,2010-01-09
The system recorded 20320114203932,2032-01-14
5 October 2026,2026-10-05
Sự kiện diễn ra vào 19/1/2018 17:18,2018-01-19
2010/2/13T21347,2010-02-13
The system recorded 20240304134318,2024-03-04
Ngày 12-2-2032,2032-02-12
Event at 2015-04-14T1:37:40,2015-04-14
1090170000,2004-07-19
12 tháng 9 năm 2027,2027-09-12
2026-10-02T16:08:26-05:00,2026-10-02
1999-01-23T06:19:46.272623247Z,1999-01-23
The system recorded 19921128221847,1992-11-28
20000310134526205,2000-03-10
"25th of January, 2022",2022-01-25
23/10-1995,1995-05-23
Event at 2014-06-15T19:30:28,2014-06-15
Sự kiện diễn ra vào 28/11/2024 1:34,2024-11-28
2000-06-21T20:25:39Z+3,2000-06-21
Sự kiện diễn ra vào 7/12/2024 2:45,2024-12-07
20151129052822413,2015-11-29
20080905050117429790,2008-09-05
18-3-2007,2007-03-09
Event at 2013-05-23T18:35:19,2013-05-23
The system recorded 20020216001735,2002-02-16
19940402114707711,1994-04-02
20010312021826984,2001-03-12
ngày 21 tháng 10 năm 2005,2005-10-21
2002/7/29T95410,2002-07-29
7-10-2034,2034-10-07
The system recorded 20300702145255,2030-07-02
16-3-2021,2021-03-08
20020606080253443,2002-06-06
Ngày 18-7-2032,2032-07-18
08_26_2007,2007-08-26
2030-01-06,2030-01-06
11 February 1994,1994-02-11
7.10.1999T2-55-53,1999-10-07
2031-04-11T23:53:23Z+3,2031-04-11
19931120141319570445193,1993-11-20
The system recorded 19970916031451,1997-09-16
08/14/2028,2028-08-14
"February 27, 2014",2014-02-27
Sự kiện diễn ra vào 27/6/2011 13:53,2011-06-27
Event at 2018-04-19T11:25:35,2018-04-19
2005_03_18T11_21_9+07:00,2005-03-18
25.10.2000T10-5-10,2000-10-25
12 03 2017,2017-12-03
25 Sep 2031,2031-09-25
20080727020330,2008-07-27
Ngày 20-2-2013,2013-02-20
2000-10-27T20:06:59.205914Z,2000-10-27
26_2_2025,2025-02-26
2033-07-15T07:49:56.319732Z,2033-07-15
1611853200000,2021-01-29
2021-03-10T12:57:43Z+3,2021-03-10
1463418000,2016-05-17
26/3/2009,2009-03-26
1797958800000,2026-12-23
2006-02-28T10:10:47+2500,2006-02-28
19940510015745753890399,1994-05-10
ngày 30 tháng 7 năm 2007,2007-07-30
2017-01-28T01:30:35.753884746Z,2017-01-28
2035-09-25T04:09:36.387921Z,2035-09-25
1991-03-16T14:26:52.113857Z,1991-03-16
2 tháng 11 năm 2007,2007-11-02
21 05 28,2028-05-21
2005-03-24T01:35:09+2500,2005-03-24
2005/8/30T18224,2005-08-30
19960124145814286,1996-01-24
Event at 2001-04-14T16:31:19,2001-04-14
27-9-1998,1998-09-27
5/20-1994,1994-10-05
Ngày 12-6-2006,2006-06-12
2024-04-21T12:12:20.406Z,2024-04-21
1755277200,2025-08-16
1544115600000000,2018-12-07
25 2 1990,1990-02-25
20/6-2030,2030-03-20
2018_04_04,2018-04-04
1984496400000,2032-11-20
20260211212641,2026-02-11
20320525100337571226,2032-05-25
17-1-2006,2006-01-17
The system recorded 20311103222054,2031-11-03
1605546000000000,2020-11-17
2007738000000000,2033-08-16
1 tháng 2 năm 2018,2018-02-01
6-7-2030,2030-07-03
2/20-2016,2016-10-02
2027-12-07T01:50:11Z+3,2027-12-07
2017-05-16T03:19:57.535844163Z,2017-05-16
4/12/2020,2020-12-04
The system recorded 19900901211622,1990-09-01
1993-07-31T07:57:48,1993-07-31
2071328400,2035-08-22
Event at 1997-06-12T11:10:28,1997-06-12
20000617225712,2000-06-17
Event at 2012-07-11T9:18:44,2012-07-11
2006-02-21T15:54:59Z+3,2006-02-21
3/1/1998 giờ 17:25:54,1998-01-03
20230405163425665,2023-04-05
17-7-2022,2022-07-17
Sự kiện diễn ra vào 26/5/2035 14:30,2035-05-26
1995_04_28T12_17_19+08,1995-04-28
20121209080927665592787,2012-12-09
11 October 2019,2019-10-11
20010510113048993,2001-05-10
21 Jan 1990,1990-01-21
15/6/2011 giờ 16:54:8,2011-06-15
16/4-2023,2023-02-16
1992/1/30T163523,1992-01-30
Ngày 2-1-1992,1992-01-02
2011-03-03T18:46:59Z+3,2011-03-03
2029-08-17T04:53:20+08,2029-08-17
2028/1/7T233134,2028-01-07
2017_08_29T16_18_7-0330,2017-08-29
1998/9/18T183348,1998-09-18
1997.07.06,1997-07-06
2012_02_14T11_33_28+00:00,2012-02-14
05_24_2020,2020-05-24
Event at 2011-08-24T19:16:54,2011-08-24
2030/6/16T11512,2030-06-16
1994-01-05T00:02:57.376Z,1994-01-05
3.8.2021T0-29-27,2021-08-03
2010|02|16,2010-02-16
34-5-2024,2024-05-17
13 02 08,2008-02-13
20131206184531802142,2013-12-06
1991-06-04T02:53:38.047Z,1991-06-04
24 June 2019,2019-06-24
Ngày 23-11-1999,1999-11-23
Ngày 3-5-2015,2015-05-03
26.8.2007T22-33-53,2007-08-26
"10th of November, 2002",2002-11-10
12 Sep 2028,2028-09-12
1995_12_14T2_32_36-0300,1995-12-14
2024-12-03T17:36:15Z+3,2024-12-03
2029-02-09T02:54:55.770Z,2029-02-09
1730048400,2024-10-28
1093453200,2004-08-26
"31th of December, 2002",2002-12-31
"18th of July, 2012",2012-07-18
2017_01_12T18_53_4+0500,2017-01-12
ngày 25 tháng 5 năm 2030,2030-05-25
29/2/1996 giờ 8:22:39,1996-02-29
2010-10-31T21:59:32,2010-10-31
1612717200000,2021-02-08
2029-10-22T09:34:18Z+3,2029-10-22
20240602215002230,2024-06-02
2005-02-15T23:19:43+2500,2005-02-15
2011 02 18,2011-02-18
20130210182351353266390,2013-02-10
8 February 2025,2025-02-08
15 tháng 10 năm 2010,2010-10-15
"October 26, 2006",2006-10-26
"August 10, 2007",2007-08-10
Event at 2021-02-10T21:58:30,2021-02-10
20050423234701551,2005-04-23
28.09.18,2018-09-28
04.15.2034,2034-04-15
20330316164947840888009,2033-03-16
11.8.2030T11-15-21,2030-08-11
2020-12-25T20:12:21.857Z,2020-12-25
13 tháng 4 năm 2021,2021-04-13
2006/6/14T152638,2006-06-14
Sự kiện diễn ra vào 8/11/1990 9:41,1990-11-08
17/18-2000,2000-09-17
2009-11-13T16:11:40,2009-11-13
1990-11-18T18:44:06.193718Z,1990-11-18
2024|04|27,2024-04-27
1316624400000,2011-09-22
20031128083053395775,2003-11-28
1994-02-16T15:24:54Z+3,1994-02-16
876675600,1997-10-13
2.8.1990T20-42-50,1990-08-02
"November 21, 2011",2011-11-21
2032-03-22T12:33:41.841445379Z,2032-03-22
20350715235620,2035-07-15
3 tháng 8 năm 2022,2022-08-03
20120212000408771965290,2012-02-12
6 December 1992,1992-12-06
2012_05_05T21_34_33-0330,2012-05-05
6 1 2008,2008-01-06
8 May 2031,2031-05-08
2003-07-18T14:37:11Z+3,2003-07-18
2025-03-15T00:36:39Z+3,2025-03-15
1999-05-22T13:24:53.267379Z,1999-05-22
2021/1/14T44718,2021-01-14
1995-12-28T22:10:34Z+3,1995-12-28
25/4/2027,2027-04-25
4/16-2000,2000-08-04
29.3.2015T2-1-2,2015-03-29
19961205041649139,1996-12-05
16 09 99,1999-09-16
2002-11-25T23:44:58.494851Z,2002-11-25
2018-06-29T09:38:52.593765244Z,2018-06-29
24|6|2021,2021-06-24
20330311162113702310004,2033-03-11
1991/10/28T72311,1991-10-28
1992-03-21T11:35:41+08,1992-03-21
1283360400000,2010-09-02
27 Jun 2030,2030-06-27
52-5-2015,2015-05-26
3 1 1990,1990-01-03
8/2-1992,1992-01-08
24.02.31,2031-02-24
23.9.2013,2013-09-23
20251216085131302323549,2025-12-16
1747587600000000,2025-05-19
1990-12-26T21:38:22.584364Z,1990-12-26
17/8/2008 giờ 3:26:43,2008-08-17
19970117222138473135169,1997-01-17
2000-02-24,2000-02-24
04 15 2012,2012-04-15
23_10_06,2006-10-23
2011-12-18T06:15:51.957Z,2011-12-18
3.5.2008,2008-05-03
2014-09-14T05:45:41.807831286Z,2014-09-14
"March 3, 2025",2025-03-03
1730566800000,2024-11-03
Sự kiện diễn ra vào 7/7/2032 1:29,2032-07-07
2021-11-03T09:21:38.854Z,2021-11-03
10_25_1997,1997-10-25
23.8.2027T19-22-3,2027-08-23
ngày 11 tháng 9 năm 2034,2034-09-11
25.4.2018T10-51-52,2018-04-25
05_03_90,1990-03-05
Ngày 26-6-2035,2035-06-26
2013-12-21T18:37:00+2500,2013-12-21
The system recorded 20241029210421,2024-10-29
1690477200,2023-07-28
1995210000000000,2033-03-24
Ngày 8-3-1995,1995-03-08
"18th of April, 2035",2035-04-18
2 Dec 2026,2026-12-02
2024-07-28T22:40:08+0500,2024-07-28
Ngày 2-12-2017,2017-12-02
19/8-1994,1994-04-19
2029-12-14T08:24:52Z+3,2029-12-14
Sự kiện diễn ra vào 16/11/1990 9:0,1990-11-16
2016-02-26T14:53:53.914869Z,2016-02-26
2003_07_15T1_17_47-0330,2003-07-15
1991-09-14T05:18:51.965157231Z,1991-09-14
2000-08-02T20:11:44-0300,2000-08-02
54-3-2028,2028-03-27
662749200000000000,1991-01-02
Event at 1999-06-07T7:34:55,1999-06-07
1991-10-18T20:57:24.903Z,1991-10-18
2033-11-19T13:02:13.893Z,2033-11-19
20020223220435952442063,2002-02-23
1990-07-12T22:11:42+07:00,1990-07-12
2021-12-30T01:09:18,2021-12-30
20150901042758436,2015-09-01
Sự kiện diễn ra vào 4/10/2004 16:46,2004-10-04
15 January 2016,2016-01-15
10/20-2012,2012-10-10
19910802185143473,1991-08-02
1293987600000000,2011-01-03
29.12.2021T1-33-17,2021-12-29
21.1.1995T16-53-16,1995-01-21
2024/5/5T14252,2024-05-05
2/2/2024 giờ 11:6:7,2024-02-02
18/6/2016 giờ 12:26:27,2016-06-18
22 Aug 2031,2031-08-22
1495731600000000000,2017-05-26
1 August 2004,2004-08-01
2026/8/16T15030,2026-08-16
1993-12-04T17:01:41-05:00,1993-12-04
20201229040106,2020-12-29
"September 20, 2024",2024-09-20
2032-09-21T05:52:27,2032-09-21
2079882000,2035-11-29
12/8-2003,2003-04-12
01 22 1995,1995-01-22
Ngày 5-2-2016,2016-02-05
2014/3/22T8310,2014-03-22
5 tháng 4 năm 2035,2035-04-05
Ngày 12-11-2032,2032-11-12
"2nd of November, 2006",2006-11-02
20060424192302,2006-04-24
2025.04.18,2025-04-18
1990-11-29T23:18:34,1990-11-29
2018-02-11T01:07:56.198Z,2018-02-11
13.11.2019T2-42-18,2019-11-13
20351112204444168,2035-11-12
2010/9/13T2470,2010-09-13
890326800,1998-03-20
"January 5, 2018",2018-01-05
6_11_2008,2008-11-06
2000_01_12T3_29_3+0500,2000-01-12
1992_09_01T1_43_17-0300,1992-09-01
21.10.2014T4-14-8,2014-10-21
13.8.2035T20-23-24,2035-08-13
ngày 15 tháng 12 năm 2029,2029-12-15
20190917145555166622,2019-09-17
2031-10-22T20:22:24.990561Z,2031-10-22
1345741200,2012-08-24
20 June 2024,2024-06-20
03-08-2008,2008-03-08
2007-05-26T10:57:36.881Z,2007-05-26
20210124203535511308443,2021-01-24
1307984400,2011-06-14
Ngày 23-8-2025,2025-08-23
21.7.2015T16-41-38,2015-07-21
1825347600000000,2027-11-05
24-10-2033,2033-10-24
1999-05-29T06:59:13.228Z,1999-05-29
20051019043200967258,2005-10-19
20040319202454,2004-03-19
Event at 2027-07-12T3:36:56,2027-07-12
2033-11-07T05:52:44.664163038Z,2033-11-07
Event at 2019-02-15T13:10:53,2019-02-15
27_2_2007,2007-02-27
48-2-2028,2028-02-24
"May 30, 2017",2017-05-30
The system recorded 20050327000318,2005-03-27
2006-06-27T16:01:22.567691302Z,2006-06-27
687373200000000,1991-10-14
24 March 2002,2002-03-24
Ngày 2-3-2017,2017-03-02
Ngày 18-4-2031,2031-04-18
20190720074714,2019-07-20
20170524155341,2017-05-24
1908464400,2030-06-24
"April 8, 2002",2002-04-08
2016-02-11T22:41:43-05:00,2016-02-11
2002-04-03T03:34:39.598922Z,2002-04-03
"8th of May, 1991",1991-05-08
1899910800000,2030-03-17
Sự kiện diễn ra vào 23/6/2004 6:7,2004-06-23
"October 29, 2034",2034-10-29
"February 8, 2029",2029-02-08
836672400000000000,1996-07-07
1359738000000000000,2013-02-02
24 August 2012,2012-08-24
Event at 2025-03-17T17:28:20,2025-03-17
2020-05-15T22:12:17,2020-05-15
9.12.2019T16-38-0,2019-12-09
12/10/2016 giờ 0:37:33,2016-10-12
1999-06-09T04:09:56+3,1999-06-09
Event at 2007-02-11T2:7:45,2007-02-11
20|01|99,1999-01-20
20050318022537431100,2005-03-18
2033_07_23T8_56_33+0500,2033-07-23
Sự kiện diễn ra vào 5/3/2002 16:23,2002-03-05
The system recorded 20290306080930,2029-03-06
ngày 19 tháng 1 năm 2024,2024-01-19
1999-07-17T07:47:00Z+3,1999-07-17
8/2-2017,2017-01-08
2031-07-15T05:44:22.624Z,2031-07-15
679165200000000,1991-07-11
Event at 2010-07-06T9:9:35,2010-07-06
2034-02-03T22:39:17Z+3,2034-02-03
20261001180956555416,2026-10-01
785610000,1994-11-24
2019_06_12T10_46_20+08,2019-06-12
15 tháng 1 năm 2004,2004-01-15
712688400000,1992-08-02
20180312101417166943,2018-03-12
20180303065742,2018-03-03
8/8/2024,2024-08-08
1927645200000000,2031-02-01
736794000000,1993-05-08
08-09-16,2016-09-08
20191105112917727657,2019-11-05
20040125103528596991617,2004-01-25
20220512203423,2022-05-12
2031-07-04T17:27:44+2500,2031-07-04
2005_09_05T11_26_49+2500,2005-09-05
1882371600000000,2029-08-26
The system recorded 20181002053201,2018-10-02
14 tháng 5 năm 1991,1991-05-14
4/7/2013 giờ 10:57:55,2013-07-04
21/12-2034,2034-06-21
698778000000000000,1992-02-23
29 Jan 2002,2002-01-29
31/12/1990 giờ 22:52:52,1990-12-31
The system recorded 20051219170737,2005-12-19
24.8.2000T18-44-37,2000-08-24
10/7/2034 giờ 8:44:1,2034-07-10
1728061200000000000,2024-10-05
29 5 1992,1992-05-29
2027-12-29T19:16:32Z+3,2027-12-29
14 tháng 5 năm 2029,2029-05-14
2024-10-12T13:12:55+2500,2024-10-12
Event at 2002-06-10T15:30:51,2002-06-10
01.06.20,2020-06-01
2031-08-20T09:35:31-0300,2031-08-20
1811091600000,2027-05-24
Sự kiện diễn ra vào 24/7/1999 2:46,1999-07-24
2029-11-24,2029-11-24
20010409224149882719193,2001-04-09
2014|09|01,2014-09-01
The system recorded 20080203104606,2008-02-03
2040570000000,2034-08-31
10-10-2018,2018-10-10
4/5/2014 giờ 2:53:50,2014-05-04
2012-04-13T10:09:06,2012-04-13
1 Jan 2014,2014-01-01
ngày 6 tháng 2 năm 2008,2008-02-06
28_07_30,2030-07-28
1728320400,2024-10-08
31|10|97,1997-10-31
2030/8/23T185625,2030-08-23
2017_01_28T15_25_24+3,2017-01-28
2004/10/6T22321,2004-10-06
2004-06-17T07:26:35.003755Z,2004-06-17
19 March 2002,2002-03-19
2011-03-01T01:07:14.186500Z,2011-03-01
20350613183528797,2035-06-13
17 9 2026,2026-09-17
10/15/2004,2004-10-15
18 Jan 2007,2007-01-18
ngày 16 tháng 8 năm 2026,2026-08-16
20011019085349,2001-10-19
1171472400000000000,2007-02-15
1996-12-30T07:13:25.364116Z,1996-12-30
2002-03-03T13:36:49.796158Z,2002-03-03
2013-05-28T10:05:14+2500,2013-05-28
839091600000000000,1996-08-04
2004-01-14T16:25:57+00:00,2004-01-14
2015-06-06T19:13:16-0300,2015-06-06
Ngày 10-9-2018,2018-09-10
2029-10-01T08:08:01.438242865Z,2029-10-01
2004 12 12,2004-12-12
18-1-2027,2027-01-18
The system recorded 20131014115559,2013-10-14
1996-03-29T14:15:01Z+3,1996-03-29
23.03.21,2021-03-23
22/6/2018 giờ 18:51:2,2018-06-22
12|02|29,2029-02-12
36-3-2017,2017-03-18
Sự kiện diễn ra vào 21/3/2006 2:59,2006-03-21
ngày 6 tháng 7 năm 2019,2019-07-06
20150223120040445416514,2015-02-23
"August 21, 1990",1990-08-21
2012-11-08T13:47:21.232Z,2012-11-08
2035-03-23T05:21:27Z+3,2035-03-23
Sự kiện diễn ra vào 19/3/1995 20:18,1995-03-19
The system recorded 20110226194827,2011-02-26
1777222800000000000,2026-04-27
19 Dec 2005,2005-12-19
The system recorded 19990603155057,1999-06-03
Ngày 17-4-1993,1993-04-17
2/11/2019 giờ 17:27:59,2019-11-02
10.6.2009T3-17-41,2009-06-10
3-5-2015,2015-05-03
Ngày 23-9-2030,2030-09-23
1815066000,2027-07-09
2003.05.27,2003-05-27
ngày 8 tháng 1 năm 2030,2030-01-08
2004-01-08T10:54:42.057Z,2004-01-08
ngày 13 tháng 11 năm 1992,1992-11-13
665254800000000,1991-01-31
24 September 2014,2014-09-24
Ngày 15-6-2029,2029-06-15
1484413200000,2017-01-15
The system recorded 20110503064059,2011-05-03
Event at 2001-03-12T23:38:58,2001-03-12
"3rd of March, 1996",1996-03-03
2031/11/25T82417,2031-11-25
1996-09-09T02:04:58.821700Z,1996-09-09
20351230182947893313230,2035-12-30
The system recorded 20321126014532,2032-11-26
ngày 25 tháng 10 năm 2025,2025-10-25
2025|05|08,2025-05-08
2017 08 27,2017-08-27
2025450000,2034-03-09
20130705041207256,2013-07-05
2026-04-13T12:02:35+08,2026-04-13
2030 07 26,2030-07-26
26-5-2015,2015-05-13
20300815231726513752,2030-08-15
20210123150238,2021-01-23
2012-02-28T15:12:09.576783Z,2012-02-28
Sự kiện diễn ra vào 1/7/2016 0:50,2016-07-01
2005-07-15T09:27:39Z+3,2005-07-15
Event at 2018-11-22T15:30:6,2018-11-22
1992-07-31T05:21:34.969138854Z,1992-07-31
2001-07-08T02:44:36-0300,2001-07-08
Ngày 2-11-2027,2027-11-02
07/23/2004,2004-07-23
1280854800,2010-08-04
10.3.2006T4-24-36,2006-03-10
25 tháng 11 năm 2027,2027-11-25
11-4-2015,2015-04-11
6 tháng 1 năm 2030,2030-01-06
30-5-2024,2024-05-15
2029-10-03T07:33:42.720380296Z,2029-10-03
Sự kiện diễn ra vào 1/9/1994 1:27,1994-09-01
2016-06-28T18:56:29-05:00,2016-06-28
Event at 2029-02-22T15:28:33,2029-02-22
14.2.1991T2-57-32,1991-02-14
"June 13, 2033",2033-06-13
07_04_06,2006-04-07
Sự kiện diễn ra vào 22/1/2019 13:18,2019-01-22
2013-07-03T10:08:32.590Z,2013-07-03
19911118033314,1991-11-18
05/11/06,2006-11-05
Ngày 13-7-2023,2023-07-13
29 tháng 1 năm 2001,2001-01-29
6.3.1990T20-39-23,1990-03-06
2/24-2032,2032-12-02
1992_01_02T13_22_23+2500,1992-01-02
19920914022652,1992-09-14
17-1-2017,2017-01-17
20140305090432218,2014-03-05
10/02/2015,2015-10-02
2032-04-24T04:27:52.104Z,2032-04-24
"August 13, 2003",2003-08-13
2019-03-24,2019-03-24
1997/12/3T113826,1997-12-03
972925200000000000,2000-10-31
1992-12-27T21:55:34,1992-12-27
1325696400000000000,2012-01-05
25 tháng 9 năm 1998,1998-09-25
20070824223007,2007-08-24
Sự kiện diễn ra vào 22/8/2031 23:22,2031-08-22
2010_12_14T21_6_55+00:00,2010-12-14
7 November 2027,2027-11-07
1998-12-14T06:41:22.671Z,1998-12-14
2019-08-28T02:56:01+0500,2019-08-28
26-7-1994,1994-07-26
1849626000,2028-08-12
"14th of July, 2012",2012-07-14
9/5/2031 giờ 18:56:10,2031-05-09
2028/9/27T21039,2028-09-27
09 06 2011,2011-09-06
23 January 1993,1993-01-23
Event at 2003-06-22T14:1:31,2003-06-22
7/12/2031 giờ 3:12:57,2031-12-07
2014|01|21,2014-01-21
915037200000000,1998-12-31
15/3/1992,1992-03-15
2027-04-20T18:19:57.534310966Z,2027-04-20
17 tháng 11 năm 1999,1999-11-17
8-9-1995,1995-09-04
"17th of March, 2025",2025-03-17
26 April 1993,1993-04-26
20060429223458132,2006-04-29
2005-04-11T00:19:52+2500,2005-04-11
1 Nov 1997,1997-11-01
Ngày 17-4-2029,2029-04-17
2019-09-14T02:03:44+00:00,2019-09-14
2032-02-19T22:17:27Z+3,2032-02-19
ngày 11 tháng 6 năm 1992,1992-06-11
25-11-1998,1998-11-25
1992/07/29,1992-07-29
2014_04_18T21_29_57-0300,2014-04-18
20241121032245289,2024-11-21
16/16-2021,2021-08-16
Event at 2019-01-21T3:42:13,2019-01-21
20120104201519423387837,2012-01-04
2017-10-01T11:35:03Z+3,2017-10-01
12/2/2007 giờ 11:41:50,2007-02-12
20311109024118170168166,2031-11-09
7.9.2033T7-45-30,2033-09-07
20150501214428250363422,2015-05-01
23/6-2017,2017-03-23
19931109134344,1993-11-09
20200915170648,2020-09-15
18 Apr 2034,2034-04-18
941130000000000,1999-10-29
6.2.2032T20-50-54,2032-02-06
2010/1/18T152031,2010-01-18
20271008101638834050669,2027-10-08
1430586000000000000,2015-05-03
20060213203048,2006-02-13
31 May 1991,1991-05-31
2010-04-23T14:47:41+2500,2010-04-23
31/14-1992,1992-07-31
25-5-2019,2019-05-25
17-8-2032,2032-08-17
1151600400000,2006-06-30
ngày 22 tháng 2 năm 2035,2035-02-22
1990 12 27,1990-12-27
The system recorded 20110723143832,2011-07-23
The system recorded 20051026092944,2005-10-26
1994-01-23T15:10:21-0300,1994-01-23
05_28_2027,2027-05-28
2007-06-09T10:19:03,2007-06-09
20280506144210,2028-05-06
16/2/2028 giờ 23:20:17,2028-02-16
The system recorded 19940218181437,1994-02-18
54-4-2029,2029-04-27
Ngày 11-6-2006,2006-06-11
20120507110242742,2012-05-07
1164646800000000,2006-11-28
13 tháng 6 năm 2033,2033-06-13
2015/02/18,2015-02-18
2024-11-03T09:01:14+2500,2024-11-03
2020_11_26T11_18_28+00:00,2020-11-26
20220228022823131,2022-02-28
2015-11-13T10:47:07.820900835Z,2015-11-13
The system recorded 20180227192803,2018-02-27
12.1.2026,2026-01-12
8-7-1992,1992-07-08
1998-04-22T19:37:24+2500,1998-04-22
2018_01_10T2_33_59-05:00,2018-01-10
1998-01-28T00:00:29+2500,1998-01-28
27_04_06,2006-04-27
ngày 14 tháng 2 năm 2020,2020-02-14
10 Jul 2014,2014-07-10
"April 17, 1993",1993-04-17
2017-10-17T16:36:16+07:00,2017-10-17
12/12-2007,2007-06-12
1972227600000,2032-07-01
1999-06-30T22:38:38+2500,1999-06-30
3 October 2010,2010-10-03
920307600000000,1999-03-02
1690390800000,2023-07-27
1608138000000000000,2020-12-17
46-10-2035,2035-10-23
"November 22, 2035",2035-11-22
13 Mar 2026,2026-03-13
2027-06-04T02:05:14.111567Z,2027-06-04
Sự kiện diễn ra vào 7/3/1998 2:4,1998-03-07
5-6-2020,2020-06-05
7/8-2001,2001-04-07
2027/9/15T81130,2027-09-15
Ngày 18-4-2014,2014-04-18
18 September 1996,1996-09-18
16-4-2022,2022-04-16
2000-10-09T04:45:10.246Z,2000-10-09
30/24-2009,2009-12-30
2024-09-09T03:54:42+07:00,2024-09-09
11.08.07,2007-08-11
7_6_2032,2032-06-07
2032/10/6T125313,2032-10-06
Ngày 18-1-2022,2022-01-18
2008-02-23T05:11:00Z+3,2008-02-23
2032-05-03T18:19:11.044Z,2032-05-03
27/4-1997,1997-02-27
20300323072704957,2030-03-23
1173718800000,2007-03-13
24/2-2028,2028-01-24
20-11-2015,2015-11-10
20261004195034358740229,2026-10-04
20250625050300,2025-06-25
5/24-2035,2035-12-05
1996-01-14T17:51:17+2500,1996-01-14
Sự kiện diễn ra vào 16/8/1997 0:3,1997-08-16
1631120400000000000,2021-09-09
1996-07-13T14:59:45+2500,1996-07-13
ngày 5 tháng 5 năm 2031,2031-05-05
18 Jan 2003,2003-01-18
"7th of September, 2026",2026-09-07
The system recorded 20220507150814,2022-05-07
The system recorded 20040802092455,2004-08-02
2008947600000000000,2033-08-30
1993-11-23T12:55:14+2500,1993-11-23
2/1/2022 giờ 21:57:45,2022-01-02
The system recorded 20130515230417,2013-05-15
2033-08-12T19:45:26.126545416Z,2033-08-12
2005_12_02T10_8_50+08,2005-12-02
1/4/2014 giờ 2:15:27,2014-04-01
1995-03-19T01:11:59.830Z,1995-03-19
20101024234547534,2010-10-24
20000624174333,2000-06-24
6-6-2010,2010-06-03
14/12/2015 giờ 18:2:23,2015-12-14
13_03_35,2035-03-13
Ngày 11-1-2003,2003-01-11
2010_11_18T19_44_54+2500,2010-11-18
20001227035519090161018,2000-12-27
2007/1/8T152931,2007-01-08
18 Oct 2020,2020-10-18
1990-03-22T01:19:13.327882Z,1990-03-22
31 Aug 2025,2025-08-31
2013-08-29T04:55:32,2013-08-29
2002-06-21T09:49:25-0330,2002-06-21
2000-10-29T17:34:51.273Z,2000-10-29
23 tháng 6 năm 1993,1993-06-23
13-10-1998,1998-10-13
1/12/2024 giờ 10:14:3,2024-12-01
2008-09-30T23:31:46.750775724Z,2008-09-30
Sự kiện diễn ra vào 24/10/2000 18:7,2000-10-24
11/7/2019 giờ 4:35:30,2019-07-11
2021-09-05T10:25:42Z+3,2021-09-05
2017-01-10T08:53:03.159955036Z,2017-01-10
1900861200,2030-03-28
"5th of July, 2032",2032-07-05
20050719043627532,2005-07-19
1829235600000,2027-12-20
10.11.07,2007-11-10
2033_08_29T10_22_2-05:00,2033-08-29
21.7.2012T14-49-12,2012-07-21
4 October 2025,2025-10-04
11/17/2015,2015-11-17
24-8-2023,2023-08-24
01.26.2018,2018-01-26
2009_11_08T2_11_5+2500,2009-11-08
977936400,2000-12-28
19990104163749,1999-01-04
The system recorded 20040708004118,2004-07-08
The system recorded 19921102124757,1992-11-02
"December 15, 2002",2002-12-15
2021-03-16T21:12:45-0330,2021-03-16
2/2/2003 giờ 0:4:17,2003-02-02
20340609035527079291,2034-06-09
32-9-1992,1992-09-16
4 September 2025,2025-09-04
845744400000000000,1996-10-20
2007.08.19,2007-08-19
Ngày 30-10-1993,1993-10-30
Sự kiện diễn ra vào 2/4/2014 5:34,2014-04-02
14-10-1998,1998-10-07
27 Oct 2031,2031-10-27
14 Aug 2030,2030-08-14
20260923145250365737,2026-09-23
12/2/2019 giờ 21:30:39,2019-02-12
"December 28, 2024",2024-12-28
20081216041322732118442,2008-12-16
1526490000000,2018-05-17
11-10-2023,2023-10-11
1897491600000000,2030-02-17
2018-02-26T06:47:05+00:00,2018-02-26
The system recorded 19920306000656,1992-03-06
2034-10-09T23:38:37+2500,2034-10-09
20030611123103067470914,2003-06-11
26|12|1993,1993-12-26
31.7.1995T1-14-8,1995-07-31
2031-01-17T05:34:54.974161547Z,2031-01-17
2013267600,2033-10-19
ngày 18 tháng 11 năm 2009,2009-11-18
2014-09-14T03:39:30Z+3,2014-09-14
2017_04_08T18_4_18-05:00,2017-04-08
17_2_2022,2022-02-17
ngày 17 tháng 7 năm 2024,2024-07-17
Event at 2019-04-06T20:17:44,2019-04-06
2007/10/19T134522,2007-10-19
The system recorded 20331020032815,2033-10-20
25/3/1997 giờ 4:43:51,1997-03-25
Sự kiện diễn ra vào 14/3/2030 11:4,2030-03-14
19931213070203107967,1993-12-13
1359651600000000000,2013-02-01
30 tháng 9 năm 2012,2012-09-30
1999/11/13T4123,1999-11-13
ngày 3 tháng 3 năm 1999,1999-03-03
"January 10, 2009",2009-01-10
ngày 12 tháng 9 năm 2006,2006-09-12
2001-01-13T07:45:15,2001-01-13
Sự kiện diễn ra vào 8/6/1990 11:59,1990-06-08
7-12-2000,2000-12-07
6/22-2012,2012-11-06
25/20-1998,1998-10-25
2013-08-08T15:55:45Z,2013-08-08
2033-02-25T14:10:59.301Z,2033-02-25
26_11_27,2027-11-26
ngày 11 tháng 1 năm 2029,2029-01-11
20011221122805850009,2001-12-21
2028-09-19T17:37:15-0300,2028-09-19
1361552400000000,2013-02-23
Sự kiện diễn ra vào 4/3/2024 15:39,2024-03-04
19930329135804,1993-03-29
The system recorded 20130820014154,2013-08-20
12-4-1992,1992-04-12
The system recorded 20120408204629,2012-04-08
Ngày 4-12-2010,2010-12-04
2029-01-06T12:16:12.902348Z,2029-01-06
03.22.2005,2005-03-22
1999/2/25T12825,1999-02-25
1415725200,2014-11-12
29 Jan 2029,2029-01-29
"28th of March, 2034",2034-03-28
12 tháng 2 năm 1992,1992-02-12
16/14-1997,1997-07-16
29 tháng 6 năm 1993,1993-06-29
26 January 2035,2035-01-26
Event at 2003-01-05T22:58:49,2003-01-05
Ngày 23-6-2007,2007-06-23
22.05.01,2001-05-22
Sự kiện diễn ra vào 5/6/1998 2:44,1998-06-05
The system recorded 20050823032703,2005-08-23
2019/6/12T145954,2019-06-12
9 tháng 1 năm 1995,1995-01-09
04/23/1995,1995-04-23
2003-12-26T01:20:27+07:00,2003-12-26
2003-04-23T21:48:45,2003-04-23
2021-12-29,2021-12-29
16-11-98,1998-11-16
Event at 1992-06-15T11:54:31,1992-06-15
23.1.1998T7-35-15,1998-01-23
20180314065351349,2018-03-14
1512579600000000,2017-12-07
5 January 2000,2000-01-05
20140410015225112,2014-04-10
Event at 2026-04-15T23:55:35,2026-04-15
1274979600,2010-05-28
1054746000000000,2003-06-05
Sự kiện diễn ra vào 5/10/2026 4:18,2026-10-05
2001517200000000,2033-06-05
16/22-2030,2030-11-16
20031204073921225,2003-12-04
1987088400000,2032-12-20
The system recorded 20191230185104,2019-12-30
20060627092131521424346,2006-06-27
28.11.2006,2006-11-28
Ngày 1-5-2011,2011-05-01
2032_04_30T19_38_23+00:00,2032-04-30
36-11-2008,2008-11-18
14/05/04,2004-05-14
1999_07_30T2_2_40+07:00,1999-07-30
04/08/91,1991-08-04
2014-08-08T19:15:06.649076858Z,2014-08-08
20150930182318,2015-09-30
1872090000000000000,2029-04-29
1 Oct 2004,2004-10-01
20330621003225739,2033-06-21
12 22 1998,1998-12-22
28 Jun 2033,2033-06-28
54-2-2002,2002-02-27
03/05/1993,1993-03-05
1997 08 12,1997-08-12
Ngày 12-11-2011,2011-11-12
19960719073640,1996-07-19
Event at 2010-08-22T22:33:12,2010-08-22
1659286800000000000,2022-08-01
1356282000,2012-12-24
1526922000,2018-05-22
05-04-2004,2004-05-04
2016_09_03T15_0_6Z+3,2016-09-03
1992_12_18T7_25_14+3,1992-12-18
6 tháng 10 năm 2008,2008-10-06
20050530043852,2005-05-30
The system recorded 19970810072206,1997-08-10
19910602222158965,1991-06-02
2032-10-13T19:29:33Z+3,2032-10-13
2008-04-22T08:42:30.407Z,2008-04-22
20160224035406864038280,2016-02-24
ngày 25 tháng 9 năm 2014,2014-09-25
ngày 12 tháng 4 năm 1997,1997-04-12
20150730055005557757119,2015-07-30
06_09_1994,1994-06-09
Event at 2021-05-30T18:26:21,2021-05-30
20110203010221117166,2011-02-03
20240417060321701147844,2024-04-17
2016-08-21T03:40:18.585720Z,2016-08-21
19950515074433220800689,1995-05-15
2005-10-10T11:30:23+2500,2005-10-10
2032-09-22T02:16:13.363870Z,2032-09-22
2011-11-25T21:01:39.286708958Z,2011-11-25
2024.08.28,2024-08-28
"18th of December, 2018",2018-12-18
9-3-2012,2012-03-09
20 April 2011,2011-04-20
02/06/1993,1993-02-06
17/20-1994,1994-10-17
2033-04-11T15:48:18,2033-04-11
14 April 2004,2004-04-14
2007-07-06T02:14:13,2007-07-06
20331212105006164664477,2033-12-12
1998-12-06T22:50:19+2500,1998-12-06
1994/10/17T93632,1994-10-17
1990-12-12T08:51:59.089249Z,1990-12-12
25/1/2018 giờ 18:49:21,2018-01-25
25/18-2034,2034-09-25
1994-08-15T02:51:10.078598Z,1994-08-15
13 Feb 2020,2020-02-13
"22th of April, 2028",2028-04-22
20001106234002631204472,2000-11-06
1206896400000000,2008-03-31
20270823011931707891,2027-08-23
Event at 2000-10-10T17:44:17,2000-10-10
"29th of June, 2023",2023-06-29
2029-07-04T22:40:40,2029-07-04
2017/7/23T231939,2017-07-23
1832432400000000000,2028-01-26
2016-02-03T05:37:56+08,2016-02-03
6/12/2010 giờ 7:24:37,2010-12-06
ngày 2 tháng 11 năm 2031,2031-11-02
1 October 2011,2011-10-01
Event at 2002-01-15T8:13:27,2002-01-15
12_14_2035,2035-12-14
25.10.2031T21-2-18,2031-10-25
2029-09-23T23:46:52.511Z,2029-09-23
The system recorded 19970223020539,1997-02-23
22 Dec 1991,1991-12-22
ngày 13 tháng 8 năm 2035,2035-08-13
Event at 2031-07-25T14:34:53,2031-07-25
1999-12-06T11:38:10+2500,1999-12-06
2027-03-26T18:48:08.096632079Z,2027-03-26
07_02_2019,2019-07-02
2004|09|18,2004-09-18
05-16-2009,2009-05-16
1998_12_22T15_39_2+0500,1998-12-22
2014-09-21T01:31:06+2500,2014-09-21
1449680400000000,2015-12-10
1993-02-13T15:37:42.577176Z,1993-02-13
20000124052032112,2000-01-24
ngày 8 tháng 10 năm 2012,2012-10-08
1994-05-21T09:06:00,1994-05-21
2027/8/24T123933,2027-08-24
18.2.2005T18-3-7,2005-02-18
6.8.1995T20-55-59,1995-08-06
2015-02-10T04:41:41Z+3,2015-02-10
"November 24, 2028",2028-11-24
20160509135318466,2016-05-09
19 Jan 2029,2029-01-19
The system recorded 20320915171205,2032-09-15
2015_12_31T22_32_32+00:00,2015-12-31
"June 10, 2016",2016-06-10
1692550800,2023-08-21
06-07-24,2024-07-06
20140619172347,2014-06-19
2/12/2004 giờ 2:58:39,2004-12-02
"September 15, 2014",2014-09-15
19930113182238,1993-01-13
08|18|2022,2022-08-18
"January 7, 1999",1999-01-07
1995_06_16T20_22_21+2500,1995-06-16
31 August 2001,2001-08-31
2035/3/9T235140,2035-03-09
2003-11-25T06:40:17Z,2003-11-25
2003-03-08T08:35:03.047238243Z,2003-03-08
2033-03-28T20:09:01.976485Z,2033-03-28
1258390800,2009-11-17
1739293200000,2025-02-12
1990/6/30T224939,1990-06-30
Sự kiện diễn ra vào 20/10/2006 0:58,2006-10-20
2015_02_05T23_56_41-0300,2015-02-05
27_12_2007,2007-12-27
1996-11-22T02:21:40+2500,1996-11-22
1724778000000,2024-08-28
15.05.13,2013-05-15
Ngày 7-3-2029,2029-03-07
1997/9/11T14541,1997-09-11
14 July 2013,2013-07-14
6/2-2011,2011-01-06
1803488400000000,2027-02-25
20000327023453962,2000-03-27
1132592400000000,2005-11-22
40-3-2010,2010-03-20
20180406045752,2018-04-06
2016-05-07T13:56:03,2016-05-07
2000-12-09T04:36:31+2500,2000-12-09
2026-03-28T15:46:57Z+3,2026-03-28
20010920121607430423,2001-09-20
2033/7/2T42427,2033-07-02
2009/10/4T1224,2009-10-04
24 tháng 10 năm 2027,2027-10-24
46-9-2000,2000-09-23
20011226125721385026039,2001-12-26
1997-11-18T19:14:36Z+3,1997-11-18
20330323032631977,2033-03-23
2014_10_01T20_54_16-05:00,2014-10-01
Ngày 26-5-2011,2011-05-26
2022-12-28T21:27:15+3,2022-12-28
20111230153019554,2011-12-30
20271022180921220,2027-10-22
16/01/32,2032-01-16
23.8.1994,1994-08-23
1729702800000,2024-10-24
"5th of October, 2030",2030-10-05
22 tháng 10 năm 1998,1998-10-22
1342630800,2012-07-19
Event at 2010-03-11T0:39:47,2010-03-11
20100722154634280,2010-07-22
901126800,1998-07-23
13/6/1992 giờ 16:49:59,1992-06-13
2/7/2014 giờ 12:58:45,2014-07-02
2001_08_26T23_51_45+2500,2001-08-26
27.03.24,2024-03-27
7 tháng 7 năm 2027,2027-07-07
1526403600000000,2018-05-16
"February 4, 2020",2020-02-04
2009 03 23,2009-03-23
1202403600,2008-02-08
8 September 1990,1990-09-08
2013-08-02T14:30:32,2013-08-02
1618333200000,2021-04-14
2033_10_14T13_49_30+0500,2033-10-14
30 tháng 8 năm 2027,2027-08-30
2028-07-23T19:19:26.834886Z,2028-07-23
1991/10/23T232341,1991-10-23
2010-05-15T19:01:20,2010-05-15
20230526200332,2023-05-26
1982854800000000000,2032-11-01
2006/2/3T19532,2006-02-03
25.4.2018,2018-04-25
1772211600,2026-02-28
20290116205321750357988,2029-01-16
07_16_1991,1991-07-16
28 May 2019,2019-05-28
The system recorded 20170615035032,2017-06-15
"15th of December, 2005",2005-12-15
2035-09-18T09:49:20+3,2035-09-18
2008-09-06T20:51:17.582781636Z,2008-09-06
2032_11_26T20_42_21Z,2032-11-26
31.8.2012T10-38-34,2012-08-31
2032-02-12T17:46:29.481289179Z,2032-02-12
2031-05-24T06:34:31.187425109Z,2031-05-24
Event at 2013-05-16T4:39:43,2013-05-16
Event at 2029-04-08T0:16:36,2029-04-08
2004-10-24,2004-10-24
2019-09-17T09:17:09Z+3,2019-09-17
1876237200000000,2029-06-16
The system recorded 20080704184634,2008-07-04
20290410121530,2029-04-10
01.24.1995,1995-01-24
19941003000733381622,1994-10-03
Event at 2000-10-13T6:3:27,2000-10-13
15/10-2025,2025-05-15
2005-03-21T18:18:03.325Z,2005-03-21
20260926043718415362454,2026-09-26
6 August 2032,2032-08-06
Event at 2027-04-05T16:37:56,2027-04-05
Ngày 6-7-2033,2033-07-06
1992-04-13T05:49:19.344968Z,1992-04-13
09|11|13,2013-11-09
7/8/2012 giờ 1:30:16,2012-08-07
2008-10-30T15:06:44.921355851Z,2008-10-30
21/16-2015,2015-08-21
1119373200000000,2005-06-22
Event at 2032-08-21T4:57:9,2032-08-21
20040317021406,2004-03-17
12 tháng 4 năm 1994,1994-04-12
13 Jul 2031,2031-07-13
2033-07-07T11:33:40+2500,2033-07-07
2020-02-08T22:21:55+2500,2020-02-08
31 August 2033,2033-08-31
19970509075513611134,1997-05-09
1993-09-05T16:17:03.774484Z,1993-09-05
"December 7, 1994",1994-12-07
Event at 2001-11-03T7:54:35,2001-11-03
19/6-2003,2003-03-19
779994000000000000,1994-09-20
Ngày 28-7-1995,1995-07-28
Sự kiện diễn ra vào 6/6/2022 22:41,2022-06-06
19 tháng 7 năm 2008,2008-07-19
20170623031232,2017-06-23
1994|03|29,1994-03-29
2015-01-13T00:27:58Z+3,2015-01-13
1996-05-16T17:44:20,1996-05-16
2-3-2033,2033-03-01
The system recorded 20071122111021,2007-11-22
28-2-2031,2031-02-28
24 Apr 2020,2020-04-24
2006-07-05T01:13:26,2006-07-05
20300804000841893,2030-08-04
17 Oct 2021,2021-10-17
24.4.2003T20-47-31,2003-04-24
8 4 1995,1995-04-08
25 tháng 11 năm 2000,2000-11-25
2029-01-22T06:15:15Z+3,2029-01-22
19971123164550853,1997-11-23
2010-03-10T00:15:45+2500,2010-03-10
1943370000,2031-08-02
20040303012231571,2004-03-03
Sự kiện diễn ra vào 12/8/1996 11:59,1996-08-12
2013/10/20T10285,2013-10-20
03/22/2018,2018-03-22
24 Mar 2021,2021-03-24
19920323112011539709,1992-03-23
27.02.94,1994-02-27
2017242000000,2033-12-04
19950527213807780,1995-05-27
2073402000,2035-09-15
1993-05-13T18:26:20,1993-05-13
25-7-1994,1994-07-25
2019/12/22T2398,2019-12-22
10/16-2033,2033-08-10
7-10-2023,2023-10-07
15/8/2016 giờ 5:10:6,2016-08-15
2000-10-17T19:18:58Z,2000-10-17
6.7.2019T7-16-7,2019-07-06
21.9.2027T3-30-19,2027-09-21
28.2.2014T8-43-32,2014-02-28
20350930163534534293466,2035-09-30
16/22-2007,2007-11-16
13 Mar 1994,1994-03-13
Ngày 8-9-1995,1995-09-08
07 14 2003,2003-07-14
1079024400000000000,2004-03-12
12/20-2009,2009-10-12
08/02/31,2031-02-08
38-9-1996,1996-09-19
26 tháng 6 năm 2006,2006-06-26
1845651600000000,2028-06-27
"26th of May, 1994",1994-05-26
700678800000,1992-03-16
Sự kiện diễn ra vào 17/5/2010 5:8,2010-05-17
2018-12-18T04:06:51.337742Z,2018-12-18
20270704004916,2027-07-04
6-7-2030,2030-07-03
2000-12-16T00:41:38,2000-12-16
2032|06|14,2032-06-14
20270420003019820,2027-04-20
24-6-2001,2001-06-24
29-08-03,2003-08-29
2027-02-18T14:00:41+2500,2027-02-18
11.11.1990T6-34-44,1990-11-11
Event at 1991-11-25T8:1:5,1991-11-25
20200325171615245513,2020-03-25
Ngày 4-2-2025,2025-02-04
2/8/2001 giờ 11:47:11,2001-08-02
2001-06-09T20:57:34-0300,2001-06-09
23/20-2013,2013-10-23
20230625204123,2023-06-25
29 tháng 8 năm 2015,2015-08-29
1995_05_26T9_0_52-0330,1995-05-26
03_24_1992,1992-03-24
14-5-2026,2026-05-07
"October 4, 2016",2016-10-04
5/20-2025,2025-10-05
19.10.2034T5-45-42,2034-10-19
6/16-2014,2014-08-06
1993-08-06T08:46:33.832389924Z,1993-08-06
18.1.2015T5-43-22,2015-01-18
ngày 6 tháng 7 năm 2034,2034-07-06
20280428152028728,2028-04-28
1568480400000000,2019-09-15
2032-03-11T09:43:37-0330,2032-03-11
1421686800000000000,2015-01-20
The system recorded 20331208030735,2033-12-08
29.9.2030,2030-09-29
891795600000,1998-04-06
08 02 2016,2016-08-02
04.09.26,2026-09-04
2023/3/14T5422,2023-03-14
20320119225613,2032-01-19
15/16-2008,2008-08-15
1389286800000000,2014-01-10
Sự kiện diễn ra vào 9/4/2026 20:7,2026-04-09
Ngày 11-4-2013,2013-04-11
1485190800,2017-01-24
2022-08-23T23:08:47.362Z,2022-08-23
2031|09|26,2031-09-26
"20th of April, 2007",2007-04-20
4 tháng 4 năm 2031,2031-04-04
20070118001848,2007-01-18
12-4-1997,1997-04-12
2025-02-11T11:23:35.893273Z,2025-02-11
"August 3, 2026",2026-08-03
7 tháng 10 năm 2008,2008-10-07
26.4.2023T8-7-22,2023-04-26
2034-04-18T14:35:04Z+3,2034-04-18
20211112230649066,2021-11-12
02|12|94,1994-12-02
ngày 22 tháng 10 năm 2016,2016-10-22
23 tháng 7 năm 2026,2026-07-23
2004-08-08T01:34:36Z+3,2004-08-08
06_03_25,2025-03-06
07_09_08,2008-09-07
1762362000000000000,2025-11-06
Ngày 25-12-2008,2008-12-25
20260215114453331592088,2026-02-15
1753981200,2025-08-01
2024-08-17T12:00:17+2500,2024-08-17
1995-04-01T10:13:04Z+3,1995-04-01
2010-07-23T22:15:11+08,2010-07-23
ngày 2 tháng 2 năm 2032,2032-02-02
2004-09-16T14:37:11.303Z,2004-09-16
1992-08-06T08:35:25+2500,1992-08-06
2024-02-24T22:25:30.216570Z,2024-02-24
"October 2, 1996",1996-10-02
2009 12 10,2009-12-10
2018-03-24T17:14:55.901Z,2018-03-24
2020-10-28T16:02:12Z+3,2020-10-28
2035-02-26T16:34:46Z+3,2035-02-26
The system recorded 20350829160155,2035-08-29
23 September 1994,1994-09-23
1354208400,2012-11-30
4/12/2030 giờ 3:0:23,2030-12-04
1/18-1993,1993-09-01
Event at 2022-12-25T7:24:17,2022-12-25
The system recorded 20110207182809,2011-02-07
2033/8/5T3345,2033-08-05
2027-09-20T03:54:25Z+3,2027-09-20
"September 12, 1995",1995-09-12
2006-12-19T03:35:21Z,2006-12-19
20250622203718568131602,2025-06-22
1755018000000000,2025-08-13
12 tháng 11 năm 2006,2006-11-12
1990-10-15T09:58:42,1990-10-15
2027-03-08T18:33:31+2500,2027-03-08
19 September 2001,2001-09-19
1/14-1999,1999-07-01
The system recorded 20261222190259,2026-12-22
Event at 2017-10-27T5:4:50,2017-10-27
1828026000000,2027-12-06
2004-09-09T05:14:49.727453191Z,2004-09-09
Event at 1990-03-05T23:55:14,1990-03-05
20171102165321,2017-11-02
20221127112552530285891,2022-11-27
1168448400000000000,2007-01-11
ngày 3 tháng 12 năm 2013,2013-12-03
2000_05_17T13_34_8+00:00,2000-05-17
2016-05-04T07:26:22,2016-05-04
20020914005746423358,2002-09-14
12/10/2004 giờ 12:51:36,2004-10-12
20090215200245717,2009-02-15
22-06-06,2006-06-22
"May 12, 1992",1992-05-12
Sự kiện diễn ra vào 12/1/2020 14:13,2020-01-12
2020-01-19T06:53:04Z+3,2020-01-19
4 January 2029,2029-01-04
7 tháng 2 năm 2024,2024-02-07
2024-07-25T06:33:20Z+3,2024-07-25
2008-04-17T20:47:52.747268150Z,2008-04-17
19960309185249073,1996-03-09
Event at 2031-04-03T16:38:35,2031-04-03
1993-06-10T02:43:40.275649772Z,1993-06-10
ngày 8 tháng 8 năm 1996,1996-08-08
20260218044047,2026-02-18
1994-04-06T09:23:27Z+3,1994-04-06
22/24-2032,2032-12-22
2020_05_31T20_26_33+07:00,2020-05-31
Sự kiện diễn ra vào 1/6/2021 8:44,2021-06-01
30 tháng 4 năm 2003,2003-04-30
"August 19, 1993",1993-08-19
"December 12, 2020",2020-12-12
01|12|04,2004-12-01
2021-08-07T14:43:37.853407Z,2021-08-07
2028/12/28T34327,2028-12-28
1999 12 06,1999-12-06
26 January 2027,2027-01-26
02|19|2008,2008-02-19
15 April 1995,1995-04-15
Event at 2020-09-09T3:51:9,2020-09-09
2026-09-29T10:30:46.479597017Z,2026-09-29
Ngày 9-8-2014,2014-08-09
The system recorded 20180319233208,2018-03-19
21.10.1996T5-55-8,1996-10-21
2013-03-05T07:31:00+2500,2013-03-05
1435856400000000000,2015-07-03
30/2-1995,1995-01-30
18/6-1998,1998-03-18
"January 15, 2021",2021-01-15
"26th of April, 2028",2028-04-26
1704992400000000000,2024-01-12
2015-03-07T09:20:57+2500,2015-03-07
1999_05_22,1999-05-22
15/2/2026,2026-02-15
Sự kiện diễn ra vào 5/9/2017 17:14,2017-09-05
2008/10/20T25658,2008-10-20
The system recorded 19981112033030,1998-11-12
1/12-2024,2024-06-01
The system recorded 20220503180835,2022-05-03
1017680400000000,2002-04-02
2041174800000000000,2034-09-07
20081225145231298516402,2008-12-25
1990-12-12T06:53:36+2500,1990-12-12
17/11/2018 giờ 19:56:19,2018-11-17
2014_07_13,2014-07-13
1405270800000000000,2014-07-14
1021050000000,2002-05-11
10 May 2031,2031-05-10
1991_11_14T1_34_44+2500,1991-11-14
22 tháng 6 năm 2006,2006-06-22
ngày 15 tháng 10 năm 1991,1991-10-15
"July 26, 2020",2020-07-26
864579600000,1997-05-26
1198947600000000,2007-12-30
ngày 27 tháng 6 năm 2011,2011-06-27
1236358800000,2009-03-07
26-12-1997,1997-12-26
3 Dec 1998,1998-12-03
1078506000000000000,2004-03-06
2009-01-25T16:26:39Z+3,2009-01-25
2030-07-15T07:45:33.148Z,2030-07-15
12.04.96,1996-04-12
2033-09-25T06:39:04.801Z,2033-09-25
Sự kiện diễn ra vào 28/11/2023 23:1,2023-11-28
2007-05-22T00:08:24.406Z,2007-05-22
769798800000,1994-05-25
20240829112337161,2024-08-29
Ngày 24-9-1997,1997-09-24
1568826000000000000,2019-09-19
"November 1, 2005",2005-11-01
07-14-2005,2005-07-14
"23th of April, 2030",2030-04-23
1997/04/16,1997-04-16
1997-09-23,1997-09-23
2012-01-19T20:54:35,2012-01-19
20150625120206749,2015-06-25
1996-02-09T18:07:39.575Z,1996-02-09
1256662800000000,2009-10-28
Ngày 6-12-2001,2001-12-06
2003-05-20T18:24:04+2500,2003-05-20
1998-09-27T08:25:02,1998-09-27
ngày 20 tháng 6 năm 1998,1998-06-20
2013 03 26,2013-03-26
04/21/2013,2013-04-21
6/7/2005 giờ 14:47:57,2005-07-06
1000314000000,2001-09-13
"24th of December, 2023",2023-12-24
2025-06-07T10:19:22,2025-06-07
18/3/2015 giờ 10:45:51,2015-03-18
20150330101638172,2015-03-30
Ngày 9-11-2021,2021-11-09
2021-03-27T12:35:44.342650Z,2021-03-27
ngày 17 tháng 9 năm 2031,2031-09-17
2033-08-09T08:26:06+2500,2033-08-09
2018.04.18,2018-04-18
2015-05-16T18:12:41.129653Z,2015-05-16
2008-05-27T00:34:21.946Z,2008-05-27
12.22.2035,2035-12-22
1315242000000,2011-09-06
1994-01-19T03:37:32+3,1994-01-19
20200505133046662641801,2020-05-05
Ngày 30-8-2000,2000-08-30
1684947600000,2023-05-25
30 tháng 9 năm 2014,2014-09-30
26-7-1990,1990-07-13
21/5/2012,2012-05-21
25 January 2000,2000-01-25
The system recorded 20031029092213,2003-10-29
2025_11_20T20_17_41-0330,2025-11-20
22/4/2001 giờ 11:10:27,2001-04-22
Event at 2028-08-29T23:36:16,2028-08-29
3 tháng 8 năm 2022,2022-08-03
12-2-2034,2034-02-06
20340609092708555972626,2034-06-09
8 tháng 9 năm 1994,1994-09-08
1890061200,2029-11-23
22_2_1996,1996-02-22
2016_10_28T12_42_30-0330,2016-10-28
5/8-2014,2014-04-05
09_21_2008,2008-09-21
2031-10-14T19:45:25Z+3,2031-10-14
13.1.2012T6-29-17,2012-01-13
21 tháng 9 năm 2025,2025-09-21
04.01.15,2015-01-04
Ngày 22-11-1991,1991-11-22
2004-12-14T06:52:20Z+3,2004-12-14
11-6-2009,2009-06-11
2000-10-03T01:35:13Z+3,2000-10-03
Ngày 16-7-2033,2033-07-16
1009299600,2001-12-26
13 3 1993,1993-03-13
20040222082709070,2004-02-22
1066496400000000000,2003-10-19
20230717122027,2023-07-17
Sự kiện diễn ra vào 19/11/1991 0:38,1991-11-19
2007-10-26T10:19:32Z+3,2007-10-26
09/18/1996,1996-09-18
22-10-2033,2033-10-22
1326992400000000000,2012-01-20
Sự kiện diễn ra vào 16/2/2025 11:29,2025-02-16
9.2.1991T19-49-32,1991-02-09
30.10.2025T4-18-58,2025-10-30
"10th of December, 2032",2032-12-10
1992-06-30T10:31:08.551143Z,1992-06-30
2011-08-26T23:22:11Z+3,2011-08-26
20341113124630483954,2034-11-13
2019-02-14T08:03:59+0500,2019-02-14
1992-03-21T18:03:41.998702452Z,1992-03-21
17_02_16,2016-02-17
Ngày 24-2-2018,2018-02-24
27 Jan 2012,2012-01-27
2025-02-13T06:18:12+2500,2025-02-13
60-6-2006,2006-06-30
2031-05-20T20:55:26+07:00,2031-05-20
1137603600000,2006-01-19
12 Sep 2030,2030-09-12
30-3-2009,2009-03-15
2007_11_04T3_14_10+2500,2007-11-04
9.7.2031T17-20-43,2031-07-09
1 Nov 2019,2019-11-01
2009-05-10T20:25:08.579414Z,2009-05-10
25 tháng 2 năm 2022,2022-02-25
"October 28, 2002",2002-10-28
Ngày 22-7-2008,2008-07-22
2002-06-06T05:07:44.171524Z,2002-06-06
2022-07-20T05:54:38+2500,2022-07-20
1657558800000000000,2022-07-12
1995-06-05T20:03:27.268Z,1995-06-05
2001-02-01T15:51:07.089230036Z,2001-02-01
The system recorded 20210526071203,2021-05-26
The system recorded 20071129204804,2007-11-29
The system recorded 20100326222259,2010-03-26
17 February 2003,2003-02-17
28 tháng 9 năm 2026,2026-09-28
4-12-2008,2008-12-04
2019-04-13T19:29:42-05:00,2019-04-13
2012-04-15T04:50:07+2500,2012-04-15
Event at 2031-01-13T1:18:15,2031-01-13
1192554000000000,2007-10-17
1996-12-06T13:56:17Z+3,1996-12-06
19911231151020737,1991-12-31
1998-09-30T04:06:14-0330,1998-09-30
20/8/2022 giờ 18:27:20,2022-08-20
2030-08-18T22:30:44+00:00,2030-08-18
Ngày 14-1-2010,2010-01-14
12.6.2022T20-44-50,2022-06-12
1770915600,2026-02-13
2030_08_25,2030-08-25
22-10-2010,2010-10-11
2015-03-14T18:14:49.778421766Z,2015-03-14
28.2.2012T3-32-22,2012-02-28
19930704091956,1993-07-04
Event at 1996-08-01T13:32:19,1996-08-01
14.08.00,2000-08-14
1997-08-05T10:57:15.938100Z,1997-08-05
2035.07.09,2035-07-09
2002-02-03T02:49:42Z+3,2002-02-03
8 tháng 8 năm 2034,2034-08-08
2018-11-02T10:54:44.990Z,2018-11-02
2004-03-24,2004-03-24
1993_05_08T12_27_53-05:00,1993-05-08
19970908024622417,1997-09-08
Ngày 23-10-2017,2017-10-23
19980322145826121072428,1998-03-22
19/5/1997 giờ 7:15:20,1997-05-19
8 Jul 1997,1997-07-08
20281119015825438,2028-11-19
2014-06-13T13:32:03.517460Z,2014-06-13
2014 09 16,2014-09-16
Ngày 5-6-2030,2030-06-05
19920904042016840026,1992-09-04
7 tháng 1 năm 2003,2003-01-07
20230707232525602,2023-07-07
54-1-1995,1995-01-27
2012_10_24T23_37_48+00:00,2012-10-24
2009-11-01T10:12:31+2500,2009-11-01
2002-02-05T07:29:28,2002-02-05
2020-03-31T00:35:59+2500,2020-03-31
19980412021827407531449,1998-04-12
20 July 2007,2007-07-20
11 Apr 1996,1996-04-11
9 Sep 1992,1992-09-09
2029-02-10,2029-02-10
16 Sep 2002,2002-09-16
Ngày 19-12-2026,2026-12-19
19921228224807,1992-12-28
ngày 16 tháng 1 năm 2008,2008-01-16
1785517200,2026-08-01
2009.08.27,2009-08-27
Event at 2031-07-10T6:21:24,2031-07-10
19940216061117506285,1994-02-16
1366909200000,2013-04-26
"17th of May, 2027",2027-05-17
20150827221444,2015-08-27
11.11.2025,2025-11-11
19970213021100942276552,1997-02-13
20250724145512751001446,2025-07-24
"24th of January, 2029",2029-01-24
1997-07-16T15:51:01,1997-07-16
10.14.2004,2004-10-14
25_10_2013,2013-10-25
2026-03-14T14:55:41.984Z,2026-03-14
1997-06-14T00:47:17.739578898Z,1997-06-14
The system recorded 19980429194618,1998-04-29
The system recorded 20180508004337,2018-05-08
ngày 12 tháng 2 năm 2021,2021-02-12
1155834000000000000,2006-08-18
20251214081017197951112,2025-12-14
2029-06-30T19:58:00+2500,2029-06-30
20140513094251071419965,2014-05-13
The system recorded 19921020012948,1992-10-20
8-2-2004,2004-02-04
10 December 2005,2005-12-10
27|10|15,2015-10-27
2027/01/22,2027-01-22
1159462800000000000,2006-09-29
2010_03_26T11_2_30Z,2010-03-26
1295110800000,2011-01-16
1 December 2010,2010-12-01
15 June 2008,2008-06-15
2001-03-09T18:43:34Z+3,2001-03-09
1985014800,2032-11-26
2007-02-02T13:50:39+2500,2007-02-02
20010910030811430212937,2001-09-10
54-1-2011,2011-01-27
Event at 2003-10-08T2:20:25,2003-10-08
2020_10_20T22_3_23+08,2020-10-20
20050822231050,2005-08-22
The system recorded 20340411165114,2034-04-11
1575392400000000,2019-12-04
22 tháng 9 năm 2009,2009-09-22
2019-11-07T11:14:42Z+3,2019-11-07
2023-02-20T08:07:30.474080Z,2023-02-20
"15th of December, 1994",1994-12-15
20120717101453175850,2012-07-17
736966800000000,1993-05-10
04|06|2030,2030-04-06
Event at 2000-12-24T9:53:6,2000-12-24
2024-01-20T10:39:54.873637Z,2024-01-20
20230708162216,2023-07-08
2002-03-26T11:58:08+2500,2002-03-26
20160707064438109934,2016-07-07
1998/2/8T54645,1998-02-08
2029-06-15T10:16:41+0500,2029-06-15
23 Jan 2000,2000-01-23
20130424151201270351,2013-04-24
"2nd of March, 2025",2025-03-02
24 tháng 9 năm 2018,2018-09-24
20170830153955286866164,2017-08-30
1992-12-13T09:56:41.708309189Z,1992-12-13
19 Oct 2033,2033-10-19
Event at 2000-09-07T10:19:51,2000-09-07
2032-08-24T03:49:42.899787803Z,2032-08-24
2003-12-14T05:16:04.556879795Z,2003-12-14
22 December 2013,2013-12-22
ngày 30 tháng 10 năm 2004,2004-10-30
"27th of September, 2034",2034-09-27
2025-10-18T02:00:48,2025-10-18
Sự kiện diễn ra vào 21/10/2019 23:14,2019-10-21
19900301065235474651359,1990-03-01
"22th of February, 2020",2020-02-22
Ngày 20-8-2002,2002-08-20
Event at 2033-09-24T6:59:34,2033-09-24
1292173200000,2010-12-13
1639674000,2021-12-17
20000417143144779,2000-04-17
Event at 2003-04-06T17:48:10,2003-04-06
20.3.2029T16-52-14,2029-03-20
29.2.2016T3-16-48,2016-02-29
18 September 2028,2028-09-18
20111222055739141,2011-12-22
3.9.2003T19-7-8,2003-09-03
1996-05-02T06:53:31Z+3,1996-05-02
17-12-1993,1993-12-17
The system recorded 20221004013738,2022-10-04
20050515202803639193,2005-05-15
2020-06-16T07:18:50Z+3,2020-06-16
The system recorded 19920908155629,1992-09-08
The system recorded 20051007163512,2005-10-07
2001-06-21T06:31:27+2500,2001-06-21
29/11/1993 giờ 18:52:8,1993-11-29
20170910071945486643,2017-09-10
20120916022031792146,2012-09-16
27/2-2013,2013-01-27
Ngày 17-10-2001,2001-10-17
2016-05-18T01:13:47.365Z,2016-05-18
14 tháng 5 năm 2004,2004-05-14
The system recorded 20150607155923,2015-06-07
3 tháng 10 năm 2032,2032-10-03
1999-06-10T04:47:14,1999-06-10
2010-02-11T01:58:38-05:00,2010-02-11
20141031051312,2014-10-31
20090628045400261275,2009-06-28
2033-06-27T10:12:14.273Z,2033-06-27
4.11.1998T19-31-39,1998-11-04
1998_01_26T22_55_15+08,1998-01-26
18-1-2025,2025-01-18
ngày 15 tháng 6 năm 1995,1995-06-15
8-12-2026,2026-12-08
58-6-2022,2022-06-29
2-1-2033,2033-01-02
832525200,1996-05-20
1557594000000000,2019-05-12
20131231114516888,2013-12-31
Ngày 25-1-2016,2016-01-25
1441731600000000,2015-09-09
44-2-2020,2020-02-22
2023/12/03,2023-12-03
2010-11-08T00:01:13Z+3,2010-11-08
11.20.2020,2020-11-20
The system recorded 20180318083152,2018-03-18
13.8.2013T18-19-26,2013-08-13
11 07 2016,2016-11-07
31 tháng 1 năm 1990,1990-01-31
10 Feb 2030,2030-02-10
729018000000,1993-02-07
1999-11-30T03:07:55+2500,1999-11-30
20200606224146119,2020-06-06
Ngày 20-3-2012,2012-03-20
1435597200000,2015-06-30
2 Oct 2018,2018-10-02
08_12_24,2024-12-08
ngày 12 tháng 7 năm 2021,2021-07-12
842202000,1996-09-09
28.5.2013T15-12-51,2013-05-28
23 tháng 5 năm 2028,2028-05-23
Ngày 27-10-1991,1991-10-27
2001-06-25T11:48:48+2500,2001-06-25
1 tháng 2 năm 2006,2006-02-01
26 tháng 8 năm 2015,2015-08-26
20070829222946,2007-08-29
1993|12|07,1993-12-07
20280824202947577624716,2028-08-24
2017-03-23T02:18:09.405749Z,2017-03-23
8 tháng 4 năm 2018,2018-04-08
9_8_2013,2013-08-09
The system recorded 20350911225957,2035-09-11
1993_08_29T2_14_57-05:00,1993-08-29
38-1-2017,2017-01-19
20180330193637256290772,2018-03-30
20280905024110,2028-09-05
1707757200,2024-02-13
20111229215358120,2011-12-29
28/7/1999,1999-07-28
884797200000,1998-01-15
2000/5/15T133513,2000-05-15
ngày 27 tháng 5 năm 2014,2014-05-27
2027-05-13T19:12:46.425437621Z,2027-05-13
1051549200000,2003-04-29
2014_01_14T2_31_38+0500,2014-01-14
21 1 2025,2025-01-21
16/2-2008,2008-01-16
"12th of August, 1994",1994-08-12
2001-12-13T04:33:12,2001-12-13
14_12_2018,2018-12-14
ngày 16 tháng 9 năm 2013,2013-09-16
2012 06 22,2012-06-22
"18th of December, 2025",2025-12-18
2029-01-25T15:36:46+07:00,2029-01-25
20051002090723,2005-10-02
44-6-2017,2017-06-22
Ngày 25-1-2027,2027-01-25
20230922124424,2023-09-22
7-6-2019,2019-06-07
1887123600000000,2029-10-20
2008-09-19T03:32:13.626Z,2008-09-19
19900113081946,1990-01-13
Event at 1994-03-26T21:7:57,1994-03-26
653677200000000,1990-09-19
07-10-1998,1998-07-10
3.2.2001T1-12-3,2001-02-03
2012-06-25T20:59:47-0330,2012-06-25
1762016400000000,2025-11-02
1394730000000000000,2014-03-14
Event at 2025-02-06T1:25:6,2025-02-06
ngày 1 tháng 10 năm 2006,2006-10-01
2026-02-20T04:39:57Z+3,2026-02-20
2002/1/22T53630,2002-01-22
2/12/2004 giờ 16:3:53,2004-12-02
21 Jan 1996,1996-01-21
"November 5, 2028",2028-11-05
"21th of January, 2002",2002-01-21
26/10-2007,2007-05-26
09|12|2013,2013-09-12
Ngày 19-6-1998,1998-06-19
2005/2/20T4344,2005-02-20
19941207183249783,1994-12-07
Event at 2006-11-11T23:32:16,2006-11-11
20011119192141,2001-11-19
16_09_12,2012-09-16
2007/11/23T31718,2007-11-23
25-09-29,2029-09-25
"5th of September, 2016",2016-09-05
13.10.2027T16-20-38,2027-10-13
10.10.2033T0-31-34,2033-10-10
Ngày 19-2-2030,2030-02-19
2004-01-04T08:40:39+2500,2004-01-04
22 October 2022,2022-10-22
31|8|2020,2020-08-31
Ngày 7-8-2017,2017-08-07
12 tháng 2 năm 2008,2008-02-12
31/24-2026,2026-12-31
21 tháng 9 năm 2032,2032-09-21
20320304111059570,2032-03-04
2006-08-05T03:14:04,2006-08-05
2007-11-15T01:05:52Z+3,2007-11-15
28/12-2018,2018-06-28
1996_03_07T22_6_11+07:00,1996-03-07
898966800000,1998-06-28
20340909110524630873,2034-09-09
2025-07-18T03:07:13.024682Z,2025-07-18
Sự kiện diễn ra vào 25/6/2019 6:13,2019-06-25
"May 5, 2000",2000-05-05
1-5-2001,2001-05-01
48-12-2020,2020-12-24
1992-12-04T12:48:32,1992-12-04
2024/7/13T25811,2024-07-13
2009/8/20T12272,2009-08-20
2015/1/4T55654,2015-01-04
2014-02-20T09:17:30.506275179Z,2014-02-20
1347382800,2012-09-12
2025-02-25T10:16:05,2025-02-25
Ngày 8-6-2032,2032-06-08
11/14-2032,2032-07-11
31.1.2024T18-29-56,2024-01-31
9|5|2013,2013-05-09
2027/2/28T53231,2027-02-28
2017-04-01T23:51:50Z+3,2017-04-01
Sự kiện diễn ra vào 14/1/2011 23:32,2011-01-14
1021654800,2002-05-18
ngày 6 tháng 5 năm 1992,1992-05-06
22.9.2030T12-10-7,2030-09-22
2015-03-08T13:58:06Z+3,2015-03-08
"20th of May, 1992",1992-05-20
2003_01_11T9_26_2-0300,2003-01-11
07|10|1995,1995-07-10
20081101081827042058,2008-11-01
2005_04_11T18_4_38+07:00,2005-04-11
ngày 24 tháng 2 năm 2021,2021-02-24
ngày 23 tháng 4 năm 2008,2008-04-23
Event at 2015-06-06T15:8:3,2015-06-06
4/6-2027,2027-03-04
2029/3/23T13015,2029-03-23
20101225185528147120,2010-12-25
7.1.2001T8-43-55,2001-01-07
12-6-2001,2001-06-06
10 Jan 2030,2030-01-10
2021562000000,2034-01-23
19920620044244453735,1992-06-20
2035-12-02T18:41:36.201329929Z,2035-12-02
20331010201318,2033-10-10
2004-05-22T05:52:41.419Z,2004-05-22
2033/9/17T7373,2033-09-17
The system recorded 20321022175300,2032-10-22
25-6-2020,2020-06-25
30.5.2028T23-29-13,2028-05-30
24-2-2004,2004-02-24
24.12.2025T20-41-2,2025-12-24
2021/3/27T75534,2021-03-27
2007-12-10T21:53:34+3,2007-12-10
30 October 2012,2012-10-30
11-11-2028,2028-11-11
Sự kiện diễn ra vào 25/2/2004 10:17,2004-02-25
13.5.2025T1-23-56,2025-05-13
2035-11-01T05:22:49Z+3,2035-11-01
19930801073150361,1993-08-01
11/28/2018,2018-11-28
1067101200000000,2003-10-26
4-11-2011,2011-11-04
The system recorded 19960506224839,1996-05-06
10-12-2019,2019-12-05
Sự kiện diễn ra vào 19/1/2007 6:38,2007-01-19
Event at 1992-07-10T6:43:43,1992-07-10
"October 20, 2025",2025-10-20
"19th of September, 2033",2033-09-19
Sự kiện diễn ra vào 13/6/2009 4:24,2009-06-13
ngày 14 tháng 2 năm 2025,2025-02-14
2018_02_06,2018-02-06
"30th of April, 2021",2021-04-30
Ngày 4-3-1994,1994-03-04
1994-01-02T06:10:17.593295567Z,1994-01-02
28 April 2006,2006-04-28
2026/2/15T161121,2026-02-15
Event at 1993-09-14T1:0:18,1993-09-14
2017_08_30T8_5_7+2500,2017-08-30
20120504202357218944,2012-05-04
8-9-2010,2010-09-04
20160212084430,2016-02-12
"16th of July, 1994",1994-07-16
14-6-2000,2000-06-14
993229200000000,2001-06-23
2031-12-17T22:52:26Z+3,2031-12-17
Ngày 7-10-2031,2031-10-07
20251016203341,2025-10-16
Ngày 27-1-2009,2009-01-27
2015-06-19T01:07:12.350Z,2015-06-19
3/1/2005 giờ 15:15:45,2005-01-03
"14th of October, 2016",2016-10-14
17.6.2028T2-49-12,2028-06-17
19900224122655446971956,1990-02-24
1991-02-16T11:47:14.369873Z,1991-02-16
2026-12-13T11:16:28+2500,2026-12-13
ngày 6 tháng 5 năm 2005,2005-05-06
"July 17, 1994",1994-07-17
56-6-1990,1990-06-28
757530000000000000,1994-01-03
26 10 1992,1992-10-26
2009_10_27T21_5_15+2500,2009-10-27
2005_09_27T20_15_29Z,2005-09-27
2020-08-30T22:32:10Z,2020-08-30
1994-01-16T21:58:09+0500,1994-01-16
10-9-1997,1997-09-10
12 Feb 2006,2006-02-12
Event at 2007-12-06T8:54:23,2007-12-06
18 Oct 2014,2014-10-18
09 02 96,1996-02-09
09.27.2018,2018-09-27
24 tháng 1 năm 1998,1998-01-24
1209142800,2008-04-26
2006-08-13T22:56:43+00:00,2006-08-13
1990-08-24T13:00:07.300575376Z,1990-08-24
14.09.09,2009-09-14
2034-03-06T15:33:31+2500,2034-03-06
1998/02/04,1998-02-04
27 April 2029,2029-04-27
1993/3/7T15269,1993-03-07
Sự kiện diễn ra vào 12/1/2027 14:58,2027-01-12
2012-09-26T05:49:05.621168184Z,2012-09-26
2032.12.08,2032-12-08
2003-11-21,2003-11-21
2020-10-20T13:48:04Z+3,2020-10-20
20240229220904415,2024-02-29
10-11-1990,1990-11-05
"28th of July, 2017",2017-07-28
2034-06-01T20:03:50+2500,2034-06-01
1992/11/5T13659,1992-11-05
961174800000,2000-06-17
2019-03-10T11:23:45.932Z,2019-03-10
20200121043551346229489,2020-01-21
2018-10-24T03:28:49.021Z,2018-10-24
Event at 1998-02-04T14:21:24,1998-02-04
Ngày 8-7-2010,2010-07-08
Event at 1991-04-16T17:29:49,1991-04-16
20-6-2028,2028-06-20
20120411101655431519852,2012-04-11
17 Dec 2003,2003-12-17
20300516092054335,2030-05-16
2019_10_04T4_50_44+3,2019-10-04
ngày 8 tháng 8 năm 2023,2023-08-08
1031418000000,2002-09-08
1224522000000,2008-10-21
2 tháng 3 năm 2020,2020-03-02
7/8/1998 giờ 15:34:24,1998-08-07
2024-10-03T03:32:50.174879Z,2024-10-03
2025-08-23T22:03:58.255645440Z,2025-08-23
26/12-1999,1999-06-26
2001 09 22,2001-09-22
8-12-2021,2021-12-04
20080811023610803,2008-08-11
4 Jun 2024,2024-06-04
27 November 2029,2029-11-27
Sự kiện diễn ra vào 16/2/2025 3:23,2025-02-16
28-9-1991,1991-09-14
2004.05.10,2004-05-10
12-4-2022,2022-04-06
12/07/2001,2001-12-07
2019-07-07T08:08:08.994611Z,2019-07-07
7-11-2017,2017-11-07
1859907600000000,2028-12-09
2001-10-18T05:43:35.629Z,2001-10-18
19970807054340817561677,1997-08-07
8 tháng 10 năm 2024,2024-10-08
19/10-2020,2020-05-19
03 15 2028,2028-03-15
2023-12-15T23:18:56,2023-12-15
ngày 8 tháng 6 năm 1992,1992-06-08
04/24/1992,1992-04-24
50-9-2007,2007-09-25
20221112213556931393,2022-11-12
1995/1/22T122612,1995-01-22
2011-02-08T07:45:32.316Z,2011-02-08
Event at 1993-04-22T21:22:52,1993-04-22
ngày 23 tháng 8 năm 2033,2033-08-23
2008-10-23T07:35:56Z+3,2008-10-23
15.1.2012,2012-01-15
13 tháng 8 năm 2031,2031-08-13
20000824164507139130054,2000-08-24
8 tháng 6 năm 2027,2027-06-08
Event at 2029-02-11T17:21:51,2029-02-11
20260829104515,2026-08-29
"April 24, 2007",2007-04-24
1433264400000,2015-06-03
17 May 2007,2007-05-17
2/24-2024,2024-12-02
ngày 16 tháng 3 năm 2034,2034-03-16
3 Aug 1990,1990-08-03
20250429090807486030,2025-04-29
"4th of December, 2018",2018-12-04
23 11 91,1991-11-23
"27th of June, 1992",1992-06-27
2028-12-18T08:11:20-0330,2028-12-18
1996_06_03T15_33_18+07:00,1996-06-03
"May 12, 1997",1997-05-12
20260721141046552290782,2026-07-21
Event at 2012-02-21T3:2:15,2012-02-21
7/16-2011,2011-08-07
2025-12-15T17:13:53,2025-12-15
24.9.2028,2028-09-24
1833210000,2028-02-04
Ngày 5-2-2018,2018-02-05
2011-05-14T02:12:24Z+3,2011-05-14
"21th of December, 2023",2023-12-21
30-7-2016,2016-07-30
Event at 2020-01-15T6:16:30,2020-01-15
20190818090427229268913,2019-08-18
1993-05-29T15:13:44-0300,1993-05-29
2011-02-19T15:26:03Z+3,2011-02-19
27.10.1996T5-5-32,1996-10-27
2014/3/7T145618,2014-03-07
Sự kiện diễn ra vào 1/3/2003 19:20,2003-03-01
ngày 1 tháng 7 năm 2001,2001-07-01
637779600000,1990-03-19
2006-12-11T09:16:10.131Z,2006-12-11
Ngày 25-12-2030,2030-12-25
"December 26, 1992",1992-12-26
1/12-2010,2010-06-01
2015-01-06T02:38:11+3,2015-01-06
06 02 1993,1993-06-02
1994-01-12T02:20:00,1994-01-12
The system recorded 20080815165709,2008-08-15
1671382800000000000,2022-12-19
Event at 2015-09-19T3:2:3,2015-09-19
Event at 1991-11-28T20:32:0,1991-11-28
1557162000,2019-05-07
2030/6/5T104731,2030-06-05
23_02_98,1998-02-23
ngày 14 tháng 9 năm 2001,2001-09-14
The system recorded 20170916080608,2017-09-16
"7th of December, 2005",2005-12-07
Ngày 26-9-2008,2008-09-26
2021-11-15T23:50:20Z,2021-11-15
5/3/2012,2012-03-05
2004_08_11T14_13_31+0500,2004-08-11
18.9.1996T17-18-24,1996-09-18
Event at 2006-03-09T7:27:44,2006-03-09
2061651600,2035-05-02
20000830073112,2000-08-30
1/5/2013 giờ 3:45:31,2013-05-01
20020914181850438668529,2002-09-14
Event at 2001-12-24T16:5:34,2001-12-24
12-9-2021,2021-09-06
11/7/2015 giờ 17:46:27,2015-07-11
The system recorded 19950929213732,1995-09-29
29/5/2024 giờ 21:58:8,2024-05-29
1797267600000000000,2026-12-15
2033/7/26T162534,2033-07-26
2013|06|05,2013-06-05
18 July 1993,1993-07-18
1393520400000000000,2014-02-28
2 April 2030,2030-04-02
20170619165335426179,2017-06-19
1491670800,2017-04-09
58-12-2013,2013-12-29
2001-09-11T17:39:52.304Z,2001-09-11
22/10-1992,1992-05-22
19 March 1991,1991-03-19
2011-02-28T04:18:24Z+3,2011-02-28
807728400000,1995-08-07
2024-03-05T14:35:00,2024-03-05
2033-10-18T20:05:05.163654Z,2033-10-18
58-6-2030,2030-06-29
14 June 2018,2018-06-14
4 Aug 2025,2025-08-04
15 tháng 2 năm 1996,1996-02-15
13 Dec 1993,1993-12-13
The system recorded 19950728074822,1995-07-28
17 tháng 2 năm 2022,2022-02-17
ngày 25 tháng 2 năm 1997,1997-02-25
8.5.2029T11-54-51,2029-05-08
2027-08-05T12:42:53.283699Z,2027-08-05
1996-12-20T21:02:46Z+3,1996-12-20
Ngày 5-7-1990,1990-07-05
6.1.2030T15-25-2,2030-01-06
12 Nov 1996,1996-11-12
2021-04-16T09:11:55+2500,2021-04-16
25 tháng 1 năm 2014,2014-01-25
2011-08-07T10:59:03+0500,2011-08-07
20290415031258004,2029-04-15
20191127042037181254005,2019-11-27
Event at 2013-12-08T4:21:9,2013-12-08
20021022133000863670377,2002-10-22
26/2/2026,2026-02-26
5 Jul 1996,1996-07-05
20-11-2009,2009-11-20
1788541200000000000,2026-09-05
19950107164115588,1995-01-07
20131105011239,2013-11-05
"10th of October, 2023",2023-10-10
1368810000000,2013-05-18
30 tháng 4 năm 2001,2001-04-30
Event at 2033-10-05T12:24:47,2033-10-05
28/18-1990,1990-09-28
23-8-1990,1990-08-23
18-10-2003,2003-10-09
1997-10-19T16:06:06Z+3,1997-10-19
20110604162620815621,2011-06-04
2014-06-24T04:22:38+2500,2014-06-24
2020_09_02T8_39_4+08,2020-09-02
913654800,1998-12-15
12/6-1990,1990-03-12
"26th of November, 2034",2034-11-26
Ngày 14-5-2023,2023-05-14
20190909084955571375714,2019-09-09
The system recorded 20080415191256,2008-04-15
19931124215748,1993-11-24
Ngày 5-10-2000,2000-10-05
9 Dec 2019,2019-12-09
2020-04-12T14:46:51.736218903Z,2020-04-12
ngày 27 tháng 6 năm 2021,2021-06-27
20-12-2017,2017-12-10
16-2-1996,1996-02-08
Sự kiện diễn ra vào 21/12/1998 19:57,1998-12-21
24.04.34,2034-04-24
22-7-2008,2008-07-22
2022-02-19T12:09:01,2022-02-19
ngày 9 tháng 11 năm 2033,2033-11-09
"December 19, 2017",2017-12-19
2010-11-17T07:25:25Z+3,2010-11-17
4/11/2009 giờ 11:27:52,2009-11-04
12_12_2006,2006-12-12
2029683600000,2034-04-27
ngày 7 tháng 3 năm 2020,2020-03-07
19950110191123760429622,1995-01-10
The system recorded 20330315061709,2033-03-15
Ngày 13-11-1993,1993-11-13
Sự kiện diễn ra vào 9/7/2010 7:31,2010-07-09
24 tháng 7 năm 1996,1996-07-24
9 Mar 2033,2033-03-09
1999-12-15T23:46:24Z+3,1999-12-15
14-1-2010,2010-01-14
Event at 2008-02-12T10:8:21,2008-02-12
7 tháng 7 năm 2013,2013-07-07
Ngày 9-4-2002,2002-04-09
2024-02-05T12:20:07Z+3,2024-02-05
2023_12_25T22_23_3Z+3,2023-12-25
Ngày 6-8-2004,2004-08-06
7 August 1991,1991-08-07
1991-12-04T08:08:23.500460Z,1991-12-04
54-1-2000,2000-01-27
2034_10_10T22_35_14+2500,2034-10-10
1215450000000000,2008-07-08
2029-12-31T17:14:13,2029-12-31
2008.01.29,2008-01-29
20330831201252720952031,2033-08-31
19920301153843776,1992-03-01
23/8/2028 giờ 17:0:32,2028-08-23
1037984400000000,2002-11-23
"4th of December, 2032",2032-12-04
2011-09-21T23:55:21Z+3,2011-09-21
1990-07-24T13:56:58+08,1990-07-24
12 tháng 11 năm 2032,2032-11-12
21 March 2022,2022-03-21
38-1-2028,2028-01-19
2019-04-29T21:56:52Z+3,2019-04-29
15/5/1991 giờ 9:56:3,1991-05-15
16/12-2006,2006-06-16
2019_12_04T1_30_52+07:00,2019-12-04
1832778000000,2028-01-30
22 tháng 9 năm 2033,2033-09-22
2005_09_21,2005-09-21
20350916220717100135469,2035-09-16
30-11-2030,2030-11-15
2033-06-13T04:17:07,2033-06-13
"June 22, 2013",2013-06-22
02|01|2008,2008-02-01
29 July 2035,2035-07-29
"May 30, 1993",1993-05-30
ngày 23 tháng 1 năm 1992,1992-01-23
Event at 2017-11-15T7:30:57,2017-11-15
ngày 8 tháng 11 năm 1990,1990-11-08
17 tháng 11 năm 2018,2018-11-17
1998-08-17T15:42:08.760219374Z,1998-08-17
6 April 2025,2025-04-06
2012-03-01T01:06:13+2500,2012-03-01
Ngày 28-3-2001,2001-03-28
"March 28, 2016",2016-03-28
2007-05-20T12:14:17+00:00,2007-05-20
2001-10-25T00:58:32.266411615Z,2001-10-25
17 12 14,2014-12-17
"19th of June, 2027",2027-06-19
09|06|2027,2027-09-06
3/3/2032 giờ 16:48:55,2032-03-03
1341680400000,2012-07-08
30-11-1999,1999-11-15
1992-11-27T03:06:26.326448Z,1992-11-27
2016-04-03T14:23:14.358657419Z,2016-04-03
21/10/1990 giờ 4:6:55,1990-10-21
20180507113113283165,2018-05-07
Event at 2009-04-16T17:56:41,2009-04-16
904669200000000000,1998-09-02
21-7-2012,2012-07-21
2006-05-19T00:08:39.511877483Z,2006-05-19
6 December 1993,1993-12-06
1469811600000000,2016-07-30
Event at 2015-01-31T5:56:56,2015-01-31
2026-11-10T07:52:25,2026-11-10
The system recorded 20170519035154,2017-05-19
22-4-2009,2009-04-11
12-12-2018,2018-12-12
2005-05-05T10:29:25Z+3,2005-05-05
5-11-2028,2028-11-05
2004_06_13T9_23_26-0330,2004-06-13
Event at 2008-03-30T17:14:12,2008-03-30
20221219193244,2022-12-19
21/4-1994,1994-02-21
Ngày 9-10-1991,1991-10-09
993488400000,2001-06-26
2008_08_20T11_3_58Z+3,2008-08-20
2024-03-24T20:17:58+2500,2024-03-24
12.4.2032T14-59-4,2032-04-12
20250609130314869,2025-06-09
19980422120126,1998-04-22
26 October 2034,2034-10-26
20140818094653,2014-08-18
"May 31, 2019",2019-05-31
08.15.2006,2006-08-15
2032-11-13T17:49:12+00:00,2032-11-13
2034-10-20T14:06:32+3,2034-10-20
23.3.2010T0-53-1,2010-03-23
2005-08-16T10:43:08Z+3,2005-08-16
Sự kiện diễn ra vào 18/5/2003 0:22,2003-05-18
30 March 1998,1998-03-30
19950202064503,1995-02-02
19 Feb 2033,2033-02-19
ngày 18 tháng 7 năm 1995,1995-07-18
2018-05-17T20:51:03+3,2018-05-17
ngày 19 tháng 6 năm 1993,1993-06-19
2020-11-01T20:15:18.617564Z,2020-11-01
2001-09-18T23:33:38,2001-09-18
3/3/2002 giờ 17:51:50,2002-03-03
1090515600000,2004-07-23
20261015053642106399,2026-10-15
20051101045827,2005-11-01
26 Apr 2001,2001-04-26
2005_08_24T22_28_7+2500,2005-08-24
24.11.2034T16-51-15,2034-11-24
2014-08-15T07:40:28.405Z,2014-08-15
1472662800000000000,2016-09-01
Sự kiện diễn ra vào 19/12/2016 14:48,2016-12-19
16/10/2033 giờ 14:22:7,2033-10-16
20031115211147,2003-11-15
20070611032726628129,2007-06-11
17 Oct 2008,2008-10-17
Event at 2015-03-13T20:0:52,2015-03-13
2 Oct 2012,2012-10-02
1998-07-07T12:43:54,1998-07-07
2026-08-14T11:03:40,2026-08-14
2/18-2024,2024-09-02
753814800000000,1993-11-21
1937926800000000,2031-05-31
2008-10-04T22:57:40.146350213Z,2008-10-04
2004/4/25T1206,2004-04-25
21 tháng 9 năm 2006,2006-09-21
28.11.2001T6-23-53,2001-11-28
1477501200000000000,2016-10-27
2019-02-20T18:11:21.911624Z,2019-02-20
05-17-1991,1991-05-17
"31th of October, 2013",2013-10-31
The system recorded 20110410183912,2011-04-10
988563600000000000,2001-04-30
20041205095041694058415,2004-12-05
"13th of January, 2010",2010-01-13
ngày 13 tháng 9 năm 2022,2022-09-13
1996-04-09T10:02:38.949Z,1996-04-09
19940926090757191675179,1994-09-26
2023/1/23T81326,2023-01-23
10_25_1996,1996-10-25
20250501122504253928882,2025-05-01
2012/12/7T234426,2012-12-07
Sự kiện diễn ra vào 30/12/2010 6:1,2010-12-30
Sự kiện diễn ra vào 29/8/2006 2:11,2006-08-29
1994-12-27T12:29:52.426Z,1994-12-27
20040617215619010,2004-06-17
6.11.1991T1-14-56,1991-11-06
13/4/1993 giờ 8:33:9,1993-04-13
19990820094713,1999-08-20
Ngày 25-10-1994,1994-10-25
1999-03-18T04:57:49Z+3,1999-03-18
20050627100628,2005-06-27
1995/1/7T182212,1995-01-07
2006_12_15T15_9_5Z,2006-12-15
3/6/2029 giờ 9:32:1,2029-06-03
1993-03-06T22:43:26.717912Z,1993-03-06
Sự kiện diễn ra vào 12/9/2019 19:52,2019-09-12
28-7-2024,2024-07-28
9 September 2019,2019-09-09
Sự kiện diễn ra vào 30/8/1994 20:53,1994-08-30
1234630800000,2009-02-15
Ngày 19-9-2001,2001-09-19
Event at 2012-03-06T13:54:57,2012-03-06
1710003600000,2024-03-10
20320502052233206,2032-05-02
1171558800000000,2007-02-16
1991-06-07T08:00:11.997277999Z,1991-06-07
17-3-2007,2007-03-17
1994-04-24T11:32:53.924455Z,1994-04-24
1923757200000000000,2030-12-18
5 tháng 6 năm 2019,2019-06-05
28 February 2020,2020-02-28
"19th of November, 1990",1990-11-19
Sự kiện diễn ra vào 31/1/2016 2:8,2016-01-31
The system recorded 20310906163253,2031-09-06
2026.05.24,2026-05-24
5 June 2002,2002-06-05
10-08-28,2028-08-10
17/6/2000 giờ 19:59:14,2000-06-17
911667600,1998-11-22
2015.02.28,2015-02-28
The system recorded 19911222164305,1991-12-22
Ngày 25-11-2001,2001-11-25
23 3 1997,1997-03-23
1992-01-13T03:14:43Z+3,1992-01-13
2011-02-27T11:45:11,2011-02-27
1568566800,2019-09-16
1993.08.18,1993-08-18
2007/9/29T1545,2007-09-29
1093453200,2004-08-26
2015082000000000000,2033-11-09
2028-07-29T21:46:34.361828Z,2028-07-29
2027-01-09T18:03:23+2500,2027-01-09
2029-03-25T10:39:47Z+3,2029-03-25
23/16-2019,2019-08-23
ngày 15 tháng 5 năm 2024,2024-05-15
2021-08-03T11:17:12-0330,2021-08-03
1109696400,2005-03-02
1218214800000,2008-08-09
1992_09_15T7_8_18+00:00,1992-09-15
"9th of April, 2026",2026-04-09
29/5/2024 giờ 23:59:43,2024-05-29
"October 8, 2017",2017-10-08
2001-08-28T22:22:53.145524630Z,2001-08-28
20 Mar 2009,2009-03-20
20070809053603601681447,2007-08-09
5/4-2030,2030-02-05
2017_11_12T6_19_40+0500,2017-11-12
2013 11 16,2013-11-16
1454086800000,2016-01-30
1236618000,2009-03-10
694458000000000000,1992-01-04
31 8 1995,1995-08-31
"15th of February, 1992",1992-02-15
09/30/1992,1992-09-30
"September 1, 2035",2035-09-01
17.9.2032T16-31-11,2032-09-17
1998-09-10T18:27:19.727401Z,1998-09-10
The system recorded 20050712222938,2005-07-12
2027_04_01T5_47_50+3,2027-04-01
1203267600000000,2008-02-18
2009-12-11T22:12:01.169Z,2009-12-11
25 tháng 4 năm 2005,2005-04-25
"24th of March, 2022",2022-03-24
827946000000000000,1996-03-28
20320428013559646,2032-04-28
2021-12-22T09:27:59Z+3,2021-12-22
1465405200000000000,2016-06-09
24-5-1998,1998-05-24
1807030800000000000,2027-04-07
13.12.2000T11-33-59,2000-12-13
2019-10-18T09:09:57.985810Z,2019-10-18
27/24-2027,2027-12-27
ngày 4 tháng 7 năm 1993,1993-07-04
1994-03-02T15:36:12.392Z,1994-03-02
2030_03_08,2030-03-08
21/20-2020,2020-10-21
1422464400000000,2015-01-29
Event at 1997-05-04T3:15:57,1997-05-04
2035/10/22T162319,2035-10-22
2016/9/13T61446,2016-09-13
07/10/14,2014-10-07
8.2.2021T21-27-7,2021-02-08
2014-03-23T13:36:12,2014-03-23
2022-05-04T21:24:56.634Z,2022-05-04
2023-12-09T23:48:25+2500,2023-12-09
2028-01-10T17:06:42+2500,2028-01-10
28.8.2014T8-40-20,2014-08-28
"November 7, 2032",2032-11-07
19960706150216451278,1996-07-06
"11th of September, 2012",2012-09-11
2025_11_20T3_40_9+2500,2025-11-20
16/12/32,2032-12-16
2033|09|30,2033-09-30
20170705094322,2017-07-05
20330208235952627756,2033-02-08
2032/9/15T125958,2032-09-15
2028_06_28T1_30_16+07:00,2028-06-28
20011211125716645,2001-12-11
1857574800000,2028-11-12
2026-12-13T13:55:25.165408Z,2026-12-13
7-2-2002,2002-02-07
16 Dec 2032,2032-12-16
2028/12/02,2028-12-02
1 Apr 2035,2035-04-01
1311094800000000,2011-07-20
"11th of February, 1994",1994-02-11
07 28 2009,2009-07-28
25/14-2026,2026-07-25
2012-12-11T21:32:45.659Z,2012-12-11
2005-07-30T05:53:09.669929557Z,2005-07-30
31-8-2031,2031-08-31
Ngày 13-8-2032,2032-08-13
ngày 18 tháng 9 năm 2018,2018-09-18
"31th of December, 2032",2032-12-31
6 tháng 12 năm 2007,2007-12-06
Sự kiện diễn ra vào 24/10/2004 18:22,2004-10-24
19 tháng 10 năm 2014,2014-10-19
30 3 2020,2020-03-30
1015174800000000000,2002-03-04
26/10-2012,2012-05-26
The system recorded 20111028090800,2011-10-28
50-10-2024,2024-10-25
18/11/2002 giờ 16:17:29,2002-11-18
8 tháng 3 năm 2025,2025-03-08
1-3-2015,2015-03-01
2031/6/5T213957,2031-06-05
1998-11-18T05:45:04+2500,1998-11-18
Ngày 16-1-1997,1997-01-16
1629392400000000000,2021-08-20
07_07_00,2000-07-07
1999-07-08T22:58:49+00:00,1999-07-08
18 February 2002,2002-02-18
25 Feb 2019,2019-02-25
Sự kiện diễn ra vào 8/6/2010 16:40,2010-06-08
2008-11-14T19:14:26Z+3,2008-11-14
2023/9/6T61544,2023-09-06
The system recorded 20070909214540,2007-09-09
1993-10-20T21:52:49.919516Z,1993-10-20
20250505130732565187780,2025-05-05
13-11-2014,2014-11-13
30 September 2016,2016-09-30
Event at 2023-05-29T12:58:19,2023-05-29
2003-04-21T05:52:32+2500,2003-04-21
17/10-2008,2008-05-17
1993-05-13T21:41:05.729145Z,1993-05-13
1980608400000000,2032-10-06
2000-04-07T21:39:17Z,2000-04-07
Sự kiện diễn ra vào 12/7/2014 2:19,2014-07-12
Event at 2034-02-20T14:10:39,2034-02-20
19/9/2018 giờ 10:6:55,2018-09-19
1999_04_12T21_37_23-05:00,1999-04-12
20090209203544885349,2009-02-09
14-4-2004,2004-04-14
1998-04-13T17:03:57.144187740Z,1998-04-13
15/4-2024,2024-02-15
25-4-1994,1994-04-25
The system recorded 20111201230652,2011-12-01
2031/2/28T13348,2031-02-28
05/06/11,2011-06-05
"June 6, 2016",2016-06-06
1491411600000000,2017-04-06
Sự kiện diễn ra vào 7/2/1997 11:55,1997-02-07
1447693200,2015-11-17
1152723600,2006-07-13
10 Jul 2013,2013-07-10
1161709200000000000,2006-10-25
2023-03-17T04:27:36,2023-03-17
Sự kiện diễn ra vào 11/12/2034 21:9,2034-12-11
2008_02_18,2008-02-18
1993_05_02T10_10_55-0330,1993-05-02
"25th of September, 2022",2022-09-25
2021-03-05T08:20:01.792Z,2021-03-05
1846602000,2028-07-08
Ngày 2-9-1992,1992-09-02
2011-01-13T02:43:05,2011-01-13
Sự kiện diễn ra vào 4/6/2002 8:27,2002-06-04
1998-04-26T10:09:59+2500,1998-04-26
2007-04-23T00:14:00.748004256Z,2007-04-23
1997|10|15,1997-10-15
2022-07-24T05:03:04Z+3,2022-07-24
The system recorded 20230521200344,2023-05-21
2008-08-02T10:20:21.872Z,2008-08-02
18/8/2006 giờ 11:2:55,2006-08-18
16 October 2004,2004-10-16
ngày 12 tháng 1 năm 2014,2014-01-12
21-10-2029,2029-10-21
04 10 99,1999-10-04
1771261200,2026-02-17
8/24-1999,1999-12-08
Ngày 2-8-2024,2024-08-02
1/4-1992,1992-02-01
19911001031020070818533,1991-10-01
19970513022624,1997-05-13
ngày 18 tháng 8 năm 2028,2028-08-18
Event at 2032-03-12T11:2:4,2032-03-12
1308243600,2011-06-17
2007-10-14T23:19:21.003122267Z,2007-10-14
Event at 1994-01-17T16:18:8,1994-01-17
2026-07-03T13:45:25-05:00,2026-07-03
2030-09-23T03:32:10.950Z,2030-09-23
2000-01-13T11:45:40.495Z,2000-01-13
2.9.2032T12-52-53,2032-09-02
20181122042352813773924,2018-11-22
20290905162550510075,2029-09-05
15_08_10,2010-08-15
1565629200000000000,2019-08-13
2021-05-25T10:15:11Z+3,2021-05-25
8 tháng 2 năm 2029,2029-02-08
20331103034050199106966,2033-11-03
2005-08-12T14:30:38Z+3,2005-08-12
19 10 13,2013-10-19
4/5/1998 giờ 19:58:6,1998-05-04
1087578000,2004-06-19
2005-06-30T08:45:37Z+3,2005-06-30
20140520075317,2014-05-20
ngày 12 tháng 8 năm 2029,2029-08-12
20190605082007666346682,2019-06-05
2028-07-30T06:40:16.282548Z,2028-07-30
2005/12/24T21451,2005-12-24
4 tháng 2 năm 2001,2001-02-04
"5th of August, 2024",2024-08-05
20.04.32,2032-04-20
Event at 2022-02-23T16:49:47,2022-02-23
2026-09-18T22:23:33.106450987Z,2026-09-18
02 03 2015,2015-02-03
1997/4/3T202123,1997-04-03
1996-01-31T06:02:03+2500,1996-01-31
704394000,1992-04-28
09 09 2003,2003-09-09
ngày 13 tháng 7 năm 2020,2020-07-13
10-10-2008,2008-10-05
20090630082312718639814,2009-06-30
2022-09-26,2022-09-26
02/19/2023,2023-02-19
28-1-2027,2027-01-14
15/10-2001,2001-05-15
2009-05-12T14:55:13,2009-05-12
1993 05 21,1993-05-21
2024-06-29T19:00:07.470077Z,2024-06-29
2003-06-07T23:19:50.649780012Z,2003-06-07
30-12-11,2011-12-30
24-1-2023,2023-01-24
779302800000,1994-09-12
2016-06-09T03:26:17.459641Z,2016-06-09
1992-12-09T19:49:11.944Z,1992-12-09
Ngày 23-10-1996,1996-10-23
2020-05-02T08:52:36-0330,2020-05-02
20100905225232816510,2010-09-05
3/1/2012 giờ 10:11:41,2012-01-03
2035-05-28T13:33:26+2500,2035-05-28
2029-06-19T00:42:10.472404Z,2029-06-19
2009-09-28T17:32:21Z+3,2009-09-28
2024-08-31T00:53:51.761317Z,2024-08-31
20170225085550420231699,2017-02-25
"28th of April, 2025",2025-04-28
1345309200000,2012-08-19
"February 23, 2008",2008-02-23
2000-05-03T18:05:57.765Z,2000-05-03
2021-08-03T13:00:30,2021-08-03
20121001181812353,2012-10-01
20110203055938304,2011-02-03
4/6/1999,1999-06-04
20150101055619894,2015-01-01
5 June 2018,2018-06-05
1991-09-17T09:04:41.137725374Z,1991-09-17
ngày 18 tháng 2 năm 1999,1999-02-18
2005-04-19T12:07:36,2005-04-19
16/8/2000 giờ 13:50:50,2000-08-16
36-3-2026,2026-03-18
Sự kiện diễn ra vào 10/4/1997 10:33,1997-04-10
20/5/1998 giờ 11:24:43,1998-05-20
The system recorded 20120507224148,2012-05-07
1999-09-05T10:37:51.127670Z,1999-09-05
2025/3/23T21243,2025-03-23
1315587600,2011-09-10
975344400000,2000-11-28
20161202020232918345908,2016-12-02
662058000000,1990-12-25
Sự kiện diễn ra vào 6/8/2023 10:1,2023-08-06
"November 3, 1992",1992-11-03
16/4/2016,2016-04-16
The system recorded 20340726165819,2034-07-26
18-1-2030,2030-01-09
03/25/2022,2022-03-25
20090924023911284535,2009-09-24
15 7 2015,2015-07-15
15 Feb 2005,2005-02-15
31/12/2009 giờ 22:52:10,2009-12-31
ngày 7 tháng 9 năm 1995,1995-09-07
2033/5/5T102642,2033-05-05
Sự kiện diễn ra vào 9/9/2003 5:4,2003-09-09
17 7 2022,2022-07-17
1991_03_28T3_51_32+00:00,1991-03-28
31/16-2030,2030-08-31
26 Nov 2020,2020-11-26
10|12|2010,2010-12-10
1997-04-08T18:27:12+2500,1997-04-08
2033-01-11T04:50:08.921Z,2033-01-11
"May 1, 2030",2030-05-01
6|11|2025,2025-11-06
2005-04-02T18:00:20-0300,2005-04-02
28/7/2002 giờ 20:2:9,2002-07-28
7.6.1996T0-32-10,1996-06-07
27.2.1991T19-44-38,1991-02-27
The system recorded 19940122022514,1994-01-22
Sự kiện diễn ra vào 7/5/1990 2:14,1990-05-07
2007-07-04T18:13:17.934Z,2007-07-04
Ngày 6-12-2008,2008-12-06
2014-06-10T20:04:22.059694Z,2014-06-10
2021/2/12T123459,2021-02-12
ngày 9 tháng 8 năm 2001,2001-08-09
24|2|2013,2013-02-24
2013-08-10T23:20:34+2500,2013-08-10
1994_10_17,1994-10-17
20130225073108,2013-02-25
929120400000000,1999-06-12
12-7-2024,2024-07-12
2017-11-02T19:56:54Z+3,2017-11-02
1994-05-17T08:24:36.991848Z,1994-05-17
20240826223217620,2024-08-26
2005-10-30T14:03:12Z+3,2005-10-30
"22th of August, 1995",1995-08-22
1990/2/4T11342,1990-02-04
19 Nov 1990,1990-11-19
10 Jul 2027,2027-07-10
50-1-1990,1990-01-25
1555088400000,2019-04-13
10-6-2017,2017-06-05
1109091600000,2005-02-23
4/20-1995,1995-10-04
25 August 1997,1997-08-25
2/11/2014 giờ 3:2:51,2014-11-02
950806800000000,2000-02-18
12|3|1991,1991-03-12
20050205092804564921,2005-02-05
2032-08-29T12:52:50.746372614Z,2032-08-29
21 Feb 2013,2013-02-21
2015-12-26T08:03:35.697172096Z,2015-12-26
2032/7/13T22557,2032-07-13
20280418233005246,2028-04-18
2022-09-19T16:52:20,2022-09-19
2019-04-21T23:37:24+2500,2019-04-21
Sự kiện diễn ra vào 14/10/2012 16:17,2012-10-14
12 Aug 1993,1993-08-12
2007-02-07,2007-02-07
01_21_1993,1993-01-21
19990913100737754365,1999-09-13
"May 27, 2013",2013-05-27
2031-07-25T09:55:20+2500,2031-07-25
2031-08-08T12:06:44+00:00,2031-08-08
2005-03-02T06:21:26Z+3,2005-03-02
11.10.2004T3-46-34,2004-10-11
1998-07-30T22:48:46Z+3,1998-07-30
2003-11-22T20:44:10Z+3,2003-11-22
30-11-2024,2024-11-15
2034954000,2034-06-27
20220220123541,2022-02-20
12/4/2022 giờ 18:38:48,2022-04-12
974394000,2000-11-17
2020|12|09,2020-12-09
Event at 2033-07-02T9:37:8,2033-07-02
20030301010103472715287,2003-03-01
2033-01-23T02:31:15.897001207Z,2033-01-23
1996-05-24T18:58:35+2500,1996-05-24
20181218043017547112293,2018-12-18
8 November 1993,1993-11-08
14-7-2031,2031-07-07
1-3-2026,2026-03-01
Ngày 9-5-2014,2014-05-09
06.04.2020,2020-06-04
ngày 1 tháng 9 năm 2034,2034-09-01
The system recorded 19971121131715,1997-11-21
2021-11-03,2021-11-03
1992|03|03,1992-03-03
2016-06-18T09:45:38.122948Z,2016-06-18
1707930000000000,2024-02-15
24-1-2016,2016-01-12
988304400,2001-04-27
20/22-2002,2002-11-20
16.12.1991T6-31-29,1991-12-16
2011-10-03T20:56:54.298605918Z,2011-10-03
842461200000000,1996-09-12
1993-11-10T04:57:07+2500,1993-11-10
The system recorded 20300701165226,2030-07-01
2030-12-09T21:29:53Z,2030-12-09
20 October 1991,1991-10-20
2005-08-19T04:32:33.837Z,2005-08-19
20350223150604304322021,2035-02-23
2014/07/09,2014-07-09
2030115600000,2034-05-02
The system recorded 20100928101455,2010-09-28
Event at 2019-06-24T15:51:55,2019-06-24
Ngày 5-3-2005,2005-03-05
20160716135436540,2016-07-16
1991-08-02T10:00:00.585Z,1991-08-02
24-1-2005,2005-01-24
2003-08-08T16:00:17+07:00,2003-08-08
19941124203333448070,1994-11-24
ngày 17 tháng 9 năm 2004,2004-09-17
09|26|2034,2034-09-26
"July 15, 2011",2011-07-15
1551978000000,2019-03-08
07_03_33,2033-03-07
2004-06-09T06:23:06.180580533Z,2004-06-09
Ngày 14-12-1997,1997-12-14
2034-10-14T21:50:34Z+3,2034-10-14
20080908174325,2008-09-08
46-6-2001,2001-06-23
1780160400000000,2026-05-31
1997/12/3T45743,1997-12-03
2005-04-13T02:45:30.396897538Z,2005-04-13
2024_10_30T18_44_31+0500,2024-10-30
1945789200000,2031-08-30
2008-02-15T20:06:43+2500,2008-02-15
12.8.2023T13-53-17,2023-08-12
12-4-2034,2034-04-12
"October 30, 2021",2021-10-30
1198256400000000000,2007-12-22
2034-01-15T02:16:25.348732Z,2034-01-15
19980615181739755859,1998-06-15
"March 18, 2006",2006-03-18
1437325200000000000,2015-07-20
21/7/2020 giờ 4:48:8,2020-07-21
Sự kiện diễn ra vào 10/5/1990 8:45,1990-05-10
07_04_26,2026-04-07
The system recorded 20341026121032,2034-10-26
6 Apr 2027,2027-04-06
18 January 2024,2024-01-18
2021-02-21T18:09:30.110Z,2021-02-21
21.12.2021T15-29-27,2021-12-21
20260807123520,2026-08-07
30 Sep 2018,2018-09-30
6-2-1991,1991-02-06
2011/2/24T22390,2011-02-24
21.5.2015T8-20-54,2015-05-21
27_11_1995,1995-11-27
24 3 2001,2001-03-24
19960411004114,1996-04-11
6 April 2027,2027-04-06
2034_01_05T10_25_7-0330,2034-01-05
Ngày 2-4-2000,2000-04-02
2000-02-05T13:28:12.057558Z,2000-02-05
14 Jan 2011,2011-01-14
"16th of January, 2023",2023-01-16
2065971600000,2035-06-21
1994/4/11T22544,1994-04-11
21 April 1999,1999-04-21
"December 17, 2007",2007-12-17
20130206095441116,2013-02-06
2024-08-27T17:42:33.770439245Z,2024-08-27
2.3.1996T1-35-2,1996-03-02
20251223043159831869,2025-12-23
29-12-1994,1994-12-29
17-1-2010,2010-01-17
1296838800000,2011-02-05
05_11_30,2030-11-05
20331207201802181260993,2033-12-07
"6th of July, 2017",2017-07-06
2022/12/12T84519,2022-12-12
Event at 2017-12-10T19:11:31,2017-12-10
30/6-2004,2004-03-30
863110800000,1997-05-09
Ngày 15-2-2012,2012-02-15
2002-10-05T04:37:04Z+3,2002-10-05
14 May 2022,2022-05-14
2013-11-29T19:57:16,2013-11-29
20 May 2021,2021-05-20
Event at 1994-09-22T3:15:41,1994-09-22
6/8/1996 giờ 11:4:24,1996-08-06
"30th of April, 2032",2032-04-30
2031-06-01T17:10:29+2500,2031-06-01
01 10 2000,2000-01-10
2025-02-20T23:00:06+2500,2025-02-20
2030/4/21T34437,2030-04-21
"October 28, 2034",2034-10-28
5/3/2017 giờ 8:13:23,2017-03-05
22 July 1995,1995-07-22
The system recorded 20251117053157,2025-11-17
2028-03-16T06:44:51.067Z,2028-03-16
17/09/21,2021-09-17
20211027215204658,2021-10-27
19930126082401187955909,1993-01-26
1823619600000000,2027-10-16
2019_10_06T12_8_12-05:00,2019-10-06
03.12.1992,1992-03-12
30/18-1997,1997-09-30
6/3/1993 giờ 22:10:59,1993-03-06
2-12-2006,2006-12-02
"18th of July, 2005",2005-07-18
23/10-2020,2020-05-23
2001/8/30T233050,2001-08-30
Event at 2005-09-01T17:42:17,2005-09-01
2013_08_09T18_55_38+07:00,2013-08-09
2013-03-20T19:40:52Z+3,2013-03-20
14/8-2003,2003-04-14
1411923600000000,2014-09-29
"12th of November, 1992",1992-11-12
6-10-2005,2005-10-06
2016/7/25T18451,2016-07-25
60-1-1993,1993-01-30
13/10/1994 giờ 0:18:37,1994-10-13
Sự kiện diễn ra vào 10/7/2001 6:35,2001-07-10
8-8-2007,2007-08-04
"23th of September, 2016",2016-09-23
2024-01-04T02:50:26-0330,2024-01-04
20350609215336693337918,2035-06-09
11 September 2012,2012-09-11
3 January 2014,2014-01-03
20130307064749,2013-03-07
2015-11-08T15:12:03.452Z,2015-11-08
"June 10, 1994",1994-06-10
2019-07-26T11:40:47Z+3,2019-07-26
1.6.2033,2033-06-01
2027-08-31T22:19:50.040765353Z,2027-08-31
1463072400000,2016-05-13
The system recorded 20081207030650,2008-12-07
01 15 1993,1993-01-15
07.08.2008,2008-07-08
20031208101824,2003-12-08
2002_12_24T22_8_8-0300,2002-12-24
697309200000000,1992-02-06
20050706000103624,2005-07-06
1741453200000000,2025-03-09
Ngày 7-11-2035,2035-11-07
21 tháng 12 năm 2011,2011-12-21
Event at 2017-10-05T16:28:0,2017-10-05
"February 14, 1996",1996-02-14
ngày 17 tháng 9 năm 2031,2031-09-17
05.22.2034,2034-05-22
ngày 27 tháng 3 năm 2008,2008-03-27
2012-06-28T06:44:42+0500,2012-06-28
15-06-02,2002-06-15
2019-01-18T05:19:24Z+3,2019-01-18
2026-04-20T06:14:07.915Z,2026-04-20
20030927010859099,2003-09-27
31/7/2009 giờ 17:18:4,2009-07-31
1518195600000,2018-02-10
34-10-2010,2010-10-17
2009 09 21,2009-09-21
11 October 2030,2030-10-11
18/10-2021,2021-05-18
1997/1/27T213017,1997-01-27
2022-08-11,2022-08-11
1991-12-20T10:57:26,1991-12-20
20230709122555,2023-07-09
20290713113112747076765,2029-07-13
The system recorded 20061128115941,2006-11-28
10 06 2001,2001-10-06
2025-05-23,2025-05-23
1996_05_06T6_43_8-0300,1996-05-06
2007 07 20,2007-07-20
20270805003105392033930,2027-08-05
02.19.2027,2027-02-19
1420909200,2015-01-11
Sự kiện diễn ra vào 31/12/2007 21:11,2007-12-31
20200819115345189,2020-08-19
Sự kiện diễn ra vào 25/12/2002 0:55,2002-12-25
2002 03 28,2002-03-28
19970710182055,1997-07-10
1995-04-26T07:58:16.254Z,1995-04-26
17 April 2029,2029-04-17
2029-05-10T19:44:30.978710575Z,2029-05-10
2034-03-06T21:31:17Z,2034-03-06
"22th of August, 2025",2025-08-22
ngày 9 tháng 2 năm 2012,2012-02-09
15/20-2030,2030-10-15
ngày 24 tháng 3 năm 1991,1991-03-24
1998-09-26T21:04:16Z+3,1998-09-26
20020223064457,2002-02-23
1995-05-23T15:15:43+2500,1995-05-23
1996-04-27T05:14:46Z+3,1996-04-27
2020_10_25T12_2_22+00:00,2020-10-25
20170425022723264,2017-04-25
11 September 2014,2014-09-11
20|5|2023,2023-05-20
17 November 2013,2013-11-17
27 tháng 6 năm 2031,2031-06-27
10 Feb 2012,2012-02-10
38-3-2023,2023-03-19
15|8|2021,2021-08-15
1994-08-27T19:04:03+00:00,1994-08-27
25/11/1991 giờ 22:13:25,1991-11-25
2028-09-17T02:36:17Z+3,2028-09-17
1185037200,2007-07-22
1439744400000000000,2015-08-17
20330813082830,2033-08-13
2015_05_18T22_43_13+00:00,2015-05-18
26 10 1998,1998-10-26
2000-08-14T03:55:58Z+3,2000-08-14
2031-10-10T07:54:29.446579Z,2031-10-10
24/4/2032 giờ 9:43:48,2032-04-24
ngày 25 tháng 7 năm 2004,2004-07-25
1993-11-18T13:41:13-0300,1993-11-18
2026-12-20T20:42:53+2500,2026-12-20
24/6-2027,2027-03-24
ngày 10 tháng 9 năm 2034,2034-09-10
29.10.2004T3-35-25,2004-10-29
2022-11-13T05:41:35.815026972Z,2022-11-13
2025-09-13T00:02:09.506Z,2025-09-13
2021-08-14T11:17:03.196353Z,2021-08-14
23/24-2009,2009-12-23
1997-05-13T23:20:53.457Z,1997-05-13
2011-11-03T13:22:08,2011-11-03
Ngày 28-4-2008,2008-04-28
ngày 27 tháng 5 năm 2011,2011-05-27
2-1-2028,2028-01-02
671907600,1991-04-18
20241012175731796599911,2024-10-12
1839258000,2028-04-14
704307600000,1992-04-27
1990-02-15T06:57:14,1990-02-15
5/2-2031,2031-01-05
09-16-2027,2027-09-16
2018|09|19,2018-09-19
30/10/2012,2012-10-30
6-2-1999,1999-02-03
8/8/2007 giờ 18:25:3,2007-08-08
"12th of March, 2015",2015-03-12
"February 4, 2000",2000-02-04
20020901124412372248,2002-09-01
60-11-2010,2010-11-30
1998-07-23T12:03:19Z+3,1998-07-23
2033-11-02T16:24:24.145825959Z,2033-11-02
Sự kiện diễn ra vào 2/5/2013 23:36,2013-05-02
48-9-2010,2010-09-24
22-11-2016,2016-11-22
2022/6/29T142425,2022-06-29
21/12-2019,2019-06-21
20241016094845788942489,2024-10-16
2008/2/4T95653,2008-02-04
07.02.2026,2026-07-02
2010_12_16T8_21_9+07:00,2010-12-16
26 September 2004,2004-09-26
1386176400000,2013-12-05
2020-03-16,2020-03-16
"23th of April, 2006",2006-04-23
6 Oct 2006,2006-10-06
20010827235315,2001-08-27
765392400000000000,1994-04-04
1202490000000,2008-02-09
2006-06-06T21:27:45.386343Z,2006-06-06
2009_04_27T14_28_26+0500,2009-04-27
1996-02-16T00:57:04+2500,1996-02-16
24-7-1997,1997-07-12
09.30.2022,2022-09-30
"June 16, 1993",1993-06-16
2020-02-19T16:24:57,2020-02-19
ngày 30 tháng 5 năm 1996,1996-05-30
2010-10-27T07:54:10.686837769Z,2010-10-27
20240410085642280701,2024-04-10
27 Jun 1990,1990-06-27
4-1-2024,2024-01-02
2028_06_26T2_36_47+00:00,2028-06-26
"December 26, 2016",2016-12-26
2024_07_22T21_29_52+00:00,2024-07-22
Event at 2031-05-30T1:2:54,2031-05-30
2017-10-14T17:42:26,2017-10-14
2020.07.31,2020-07-31
2015-05-02T03:32:00-0300,2015-05-02
2027-05-30T15:37:16Z+3,2027-05-30
1996_01_27T10_59_42+08,1996-01-27
2012-11-16T19:04:47Z+3,2012-11-16
24_08_15,2015-08-24
2010-04-05T09:31:10.469Z,2010-04-05
2000/1/28T232747,2000-01-28
07|03|34,2034-03-07
2030-10-04T23:29:00.716445409Z,2030-10-04
ngày 30 tháng 10 năm 2031,2031-10-30
5-4-2018,2018-04-05
1508432400000000,2017-10-20
1090342800000000,2004-07-21
20310406001604528646,2031-04-06
1997-01-18T06:39:59,1997-01-18
1881075600000000000,2029-08-11
1995-10-24T03:34:58.631Z,1995-10-24
2023-11-29T20:01:35Z+3,2023-11-29
1913994000000000000,2030-08-27
1080320400,2004-03-27
13/11/1997 giờ 20:22:22,1997-11-13
1993-12-31T12:44:17+07:00,1993-12-31
1990-11-18T02:35:12Z+3,1990-11-18
48-11-2030,2030-11-24
11 November 2018,2018-11-11
20110111044825585,2011-01-11
1840381200000000000,2028-04-27
2033-11-04T05:42:26,2033-11-04
19950703174254436147,1995-07-03
1676998800,2023-02-22
ngày 31 tháng 10 năm 2027,2027-10-31
ngày 18 tháng 12 năm 1995,1995-12-18
2 tháng 4 năm 1996,1996-04-02
824576400000000,1996-02-18
10/15/2016,2016-10-15
08/26/2008,2008-08-26
1277571600,2010-06-27
The system recorded 19950321105249,1995-03-21
20000214113407957787907,2000-02-14
Ngày 6-8-2003,2003-08-06
9 7 2005,2005-07-09
1713373200000000000,2024-04-18
20281216133415186236629,2028-12-16
Ngày 2-3-1991,1991-03-02
2013/3/5T185225,2013-03-05
15 April 2010,2010-04-15
1999_10_03T19_54_56+3,1999-10-03
8/6/1991 giờ 11:15:26,1991-06-08
1456765200000000,2016-03-01
1994-08-28T00:49:06.697937Z,1994-08-28
20040805075005,2004-08-05
60-3-2028,2028-03-30
1992-06-16T04:36:00.309Z,1992-06-16
1607533200000000000,2020-12-10
"June 24, 2002",2002-06-24
5 Feb 2031,2031-02-05
20261215212111161154183,2026-12-15
20330109181639,2033-01-09
2017-01-22T20:04:46Z+3,2017-01-22
"July 3, 2020",2020-07-03
2004-05-05T15:33:50.953126489Z,2004-05-05
2004-09-07T05:19:54Z+3,2004-09-07
40-6-1998,1998-06-20
951843600000,2000-03-01
1689613200000000,2023-07-18
1738429200000000,2025-02-02
23/3/2010 giờ 21:10:19,2010-03-23
Sự kiện diễn ra vào 16/9/1998 6:42,1998-09-16
14 tháng 4 năm 2004,2004-04-14
The system recorded 20250215124323,2025-02-15
20270226171102506803671,2027-02-26
2023-09-23T21:26:04.898Z,2023-09-23
17 tháng 4 năm 2016,2016-04-17
1994 01 21,1994-01-21
23 tháng 11 năm 2013,2013-11-23
1055869200000000,2003-06-18
2-10-2001,2001-10-01
"December 31, 2029",2029-12-31
1894122000000,2030-01-09
2031-07-02T15:16:27+2500,2031-07-02
2005-07-23T04:38:00.641765130Z,2005-07-23
2015-05-19T10:53:26.953Z,2015-05-19
2029-02-07T15:20:19.001Z,2029-02-07
23.5.2011,2011-05-23
ngày 6 tháng 10 năm 2002,2002-10-06
20160910141051934565363,2016-09-10
2012-02-02T03:09:40Z+3,2012-02-02
18/12/2022,2022-12-18
2002-10-12T03:11:29Z+3,2002-10-12
24-05-32,2032-05-24
05.28.2016,2016-05-28
697395600,1992-02-07
20130914015933908,2013-09-14
2001/11/30T151555,2001-11-30
2022-03-29T08:13:03-0300,2022-03-29
3/3/2024 giờ 10:56:32,2024-03-03
The system recorded 19970225133341,1997-02-25
21 Feb 2018,2018-02-21
8 tháng 11 năm 2009,2009-11-08
20140606155347134916287,2014-06-06
Ngày 4-9-1997,1997-09-04
04-20-2014,2014-04-20
8/8/2010 giờ 12:54:24,2010-08-08
2010-07-06T21:14:00.264Z,2010-07-06
2007-03-05T09:43:49Z+3,2007-03-05
2031-08-02T17:40:29+2500,2031-08-02
13-9-2022,2022-09-13
"August 20, 2011",2011-08-20
02|01|12,2012-01-02
2019-10-05T16:56:01-0330,2019-10-05
2021-10-29T17:14:05.732Z,2021-10-29
767206800,1994-04-25
01/21/1997,1997-01-21
20250811081718898654723,2025-08-11
2027-11-24T23:53:16+2500,2027-11-24
1928768400000000000,2031-02-14
1574614800000000,2019-11-25
1121360400000,2005-07-15
28|03|99,1999-03-28
ngày 6 tháng 12 năm 2016,2016-12-06
19 tháng 2 năm 2034,2034-02-19
30/10/1993 giờ 10:49:32,1993-10-30
28 August 2017,2017-08-28
Sự kiện diễn ra vào 31/3/2002 4:16,2002-03-31
2014 02 03,2014-02-03
2002-10-21T16:11:03Z+3,2002-10-21
2006-09-14T11:10:48Z+3,2006-09-14
23 2 1990,1990-02-23
Event at 2024-04-27T13:4:38,2024-04-27
1997-06-07T11:26:38.166631939Z,1997-06-07
8 tháng 10 năm 2027,2027-10-08
06/07/2029,2029-06-07
21.6.2001T10-2-8,2001-06-21
2000-09-15T04:41:37.226Z,2000-09-15
2001/10/5T155959,2001-10-05
7/8/1999 giờ 7:4:31,1999-08-07
12-11-1992,1992-11-12
1991-07-27T14:54:44+0500,1991-07-27
13 Oct 2033,2033-10-13
20331021073923859,2033-10-21
1557421200000000,2019-05-10
743965200,1993-07-30
2028-12-06T05:49:51.335766Z,2028-12-06
The system recorded 20340621032651,2034-06-21
1673370000,2023-01-11
20140817073046947520022,2014-08-17
7/6/2017,2017-06-07
2002-11-23T08:15:21+2500,2002-11-23
20011027135736294819,2001-10-27
28-03-35,2035-03-28
Ngày 4-8-1991,1991-08-04
13-1-2018,2018-01-13
2003_03_26,2003-03-26
Ngày 7-5-2033,2033-05-07
Event at 2015-12-20T15:42:28,2015-12-20
"5th of December, 2007",2007-12-05
2032-11-09T23:37:30.226Z,2032-11-09
09_22_2027,2027-09-22
2007-06-12T21:52:24.226Z,2007-06-12
2032-05-21T21:02:56,2032-05-21
19-3-2018,2018-03-19
21/4-1997,1997-02-21
27_11_13,2013-11-27
15 May 2012,2012-05-15
1427130000000000,2015-03-24
20350213194702411,2035-02-13
7 Jan 1993,1993-01-07
1996-05-28T01:28:36.944Z,1996-05-28
30.7.2035T5-49-31,2035-07-30
2034-06-21T21:10:22+0500,2034-06-21
The system recorded 19920528234432,1992-05-28
1266771600000000,2010-02-22
The system recorded 20060807111731,2006-08-07
15.2.1998,1998-02-15
2029|01|15,2029-01-15
2023-09-06T05:37:56.605Z,2023-09-06
2019-04-25T23:57:23.788807091Z,2019-04-25
ngày 14 tháng 5 năm 2021,2021-05-14
6.1.2028T1-16-2,2028-01-06
Sự kiện diễn ra vào 25/5/2013 11:58,2013-05-25
The system recorded 20231113183438,2023-11-13
2021/5/31T19129,2021-05-31
Sự kiện diễn ra vào 1/1/2011 15:42,2011-01-01
815504400,1995-11-05
12_5_2010,2010-05-12
10 Jun 1996,1996-06-10
2007-11-25T03:07:23.652875Z,2007-11-25
20030427211430,2003-04-27
13 11 2009,2009-11-13
9/5/1991 giờ 23:46:47,1991-05-09
1990-01-30T11:33:51-0300,1990-01-30
2008-07-31T16:26:09,2008-07-31
2028-03-06T01:05:38.298555Z,2028-03-06
10.12.14,2014-12-10
19910515181833306591413,1991-05-15
20221003012409,2022-10-03
01-18-2001,2001-01-18
4-2-2017,2017-02-02
2026-01-08T03:38:43+2500,2026-01-08
02.10.22,2022-10-02
14/5/2014 giờ 3:47:2,2014-05-14
Sự kiện diễn ra vào 10/8/2012 19:18,2012-08-10
2016-10-17T09:30:52+2500,2016-10-17
1999-03-04T05:07:01+2500,1999-03-04
1897578000,2030-02-18
The system recorded 20180630210933,2018-06-30
2010-11-04T19:05:56.286774Z,2010-11-04
23_2_2010,2010-02-23
4 September 2016,2016-09-04
2004-03-18T08:25:34.185401715Z,2004-03-18
1993/7/21T114038,1993-07-21
7 tháng 1 năm 1998,1998-01-07
"23th of March, 2029",2029-03-23
1 tháng 10 năm 2003,2003-10-01
20070609053823946,2007-06-09
"February 5, 1999",1999-02-05
20020614151212599459,2002-06-14
1992-03-01T15:14:06.192923Z,1992-03-01
Ngày 26-3-2018,2018-03-26
1993-01-04T23:16:09Z+3,1993-01-04
8|8|1994,1994-08-08
Event at 2031-06-04T0:49:3,2031-06-04
19950601133447391,1995-06-01
12.2.2010T6-12-4,2010-02-12
62-5-1991,1991-05-31
2020-09-28T09:53:33,2020-09-28
2024/6/19T164235,2024-06-19
06.06.2013,2013-06-06
"11th of May, 2029",2029-05-11
2026-01-28T10:10:59.899023Z,2026-01-28
20350519030209818496493,2035-05-19
6.12.2034T21-58-7,2034-12-06
10/14-2025,2025-07-10
"September 19, 2013",2013-09-19
10 tháng 6 năm 2033,2033-06-10
2030-05-13T00:40:21.628397Z,2030-05-13
20120816160119749627,2012-08-16
ngày 30 tháng 11 năm 1994,1994-11-30
2003-04-13T05:26:27,2003-04-13
6.1.2031T18-18-30,2031-01-06
2032-08-27T04:41:26+2500,2032-08-27
2001-02-27T21:06:18Z+3,2001-02-27
20100910090416075934,2010-09-10
Event at 1999-10-24T8:12:40,1999-10-24
"6th of September, 1994",1994-09-06
15.01.22,2022-01-15
2031/7/8T9928,2031-07-08
2019-04-16T18:58:24.645420Z,2019-04-16
20211102214905876071,2021-11-02
ngày 21 tháng 3 năm 1994,1994-03-21
20200221221214416,2020-02-21
16 October 2010,2010-10-16
7-10-2033,2033-10-07
09.11.1995,1995-09-11
2000-12-02T19:36:03Z+3,2000-12-02
22-3-2025,2025-03-22
5/1/2024 giờ 0:57:42,2024-01-05
2001/08/15,2001-08-15
8-2-1995,1995-02-04
19990212203308356,1999-02-12
20210616211537432168315,2021-06-16
30 Apr 2005,2005-04-30
6-4-2014,2014-04-03
Sự kiện diễn ra vào 16/4/1992 23:35,1992-04-16
18.2.2016,2016-02-18
Sự kiện diễn ra vào 10/8/2017 9:42,2017-08-10
Ngày 30-9-1990,1990-09-30
2021/2/3T3200,2021-02-03
6-1-2024,2024-01-03
1990/1/19T223531,1990-01-19
2017-10-02T20:08:10+2500,2017-10-02
20160402011501740,2016-04-02
2020_09_19,2020-09-19
Ngày 20-8-2030,2030-08-20
29 tháng 11 năm 2012,2012-11-29
2009-01-01T15:22:30.059845151Z,2009-01-01
2019-03-27T00:19:51,2019-03-27
857235600000000,1997-03-02
2022-06-03T10:39:14.328768Z,2022-06-03
24/7/2006 giờ 6:57:40,2006-07-24
20070521184706,2007-05-21
1706979600000000000,2024-02-04
12 Aug 2017,2017-08-12
20000316034449,2000-03-16
Event at 2001-01-06T19:23:31,2001-01-06
01-10-20,2020-10-01
2016.02.20,2016-02-20
56-2-2004,2004-02-28
01_23_2005,2005-01-23
2012_11_10T16_5_58Z,2012-11-10
01|24|2019,2019-01-24
Ngày 25-2-2010,2010-02-25
Sự kiện diễn ra vào 7/2/2009 17:2,2009-02-07
4-1-1993,1993-01-02
12/18-2012,2012-09-12
2030-09-18T08:17:20-0300,2030-09-18
20051229171621483324459,2005-12-29
20180223185708853019,2018-02-23
20001205211523584565084,2000-12-05
16/8-1991,1991-04-16
1874768400,2029-05-30
20090716233640644048,2009-07-16
30.1.2017T3-42-56,2017-01-30
2026-03-25T20:59:56+2500,2026-03-25
20251023234609,2025-10-23
917197200000,1999-01-25
23-12-2021,2021-12-23
2022-10-25T14:37:35.475099887Z,2022-10-25
1-4-2013,2013-04-01
19960303000259019744114,1996-03-03
17 May 2015,2015-05-17
2003-03-08T22:47:27+3,2003-03-08
2000-03-23T19:47:49,2000-03-23
20 December 2004,2004-12-20
2024-02-23T12:16:09,2024-02-23
50-7-2018,2018-07-25
1998-03-18T20:41:26+2500,1998-03-18
4-3-1997,1997-03-02
2013-10-09T02:58:37,2013-10-09
19_11_08,2008-11-19
1993-04-29T16:33:19.780995Z,1993-04-29
2032-10-30T12:38:26+00:00,2032-10-30
24-12-19,2019-12-24
07_01_92,1992-01-07
2012-07-24T23:15:23.523145Z,2012-07-24
Event at 2016-04-26T18:51:33,2016-04-26
6-5-2018,2018-05-03
1995-11-15T23:34:07+00:00,1995-11-15
22/24-2027,2027-12-22
1219856400,2008-08-28
28/1/2035 giờ 14:2:26,2035-01-28
19.1.2029T14-57-27,2029-01-19
2004-08-24T23:47:37,2004-08-24
"April 18, 2032",2032-04-18
20190420022010225,2019-04-20
Ngày 30-7-2031,2031-07-30
09_30_1991,1991-09-30
2019-04-24T09:14:32+07:00,2019-04-24
ngày 22 tháng 11 năm 2031,2031-11-22
1581872400,2020-02-17
20050903152251693967,2005-09-03
20020627024142293352,2002-06-27
20340202191638983380379,2034-02-02
30-12-2006,2006-12-30
21/11/2004 giờ 23:48:36,2004-11-21
"November 3, 2014",2014-11-03
19910918200518715,1991-09-18
2001/7/1T173920,2001-07-01
2031/12/20T141542,2031-12-20
The system recorded 20330922013823,2033-09-22
22/5/2004 giờ 15:40:37,2004-05-22
27 tháng 5 năm 2022,2022-05-27
8-8-2007,2007-08-08
4.5.2001T19-32-2,2001-05-04
The system recorded 20240621215216,2024-06-21
1164128400000000,2006-11-22
1455901200,2016-02-20
Sự kiện diễn ra vào 12/6/2025 17:46,2025-06-12
Sự kiện diễn ra vào 8/10/1990 13:11,1990-10-08
19961122200539732597,1996-11-22
18.10.15,2015-10-18
"September 6, 2027",2027-09-06
Ngày 17-1-2005,2005-01-17
19970415160550,1997-04-15
2029-05-09T13:28:16.875Z,2029-05-09
04/14/2024,2024-04-14
"21th of September, 1991",1991-09-21
19 October 2026,2026-10-19
1976202000,2032-08-16
26.10.1997,1997-10-26
"April 27, 2012",2012-04-27
24/11/2008 giờ 6:35:23,2008-11-24
"November 2, 2022",2022-11-02
2006-03-07T23:33:55+2500,2006-03-07
20350708200952157,2035-07-08
Ngày 12-8-2020,2020-08-12
20-10-05,2005-10-20
2032-09-28T23:58:29+2500,2032-09-28
18 December 2020,2020-12-18
Ngày 6-3-2028,2028-03-06
1995-08-14T00:18:00.072Z,1995-08-14
723574800000000,1992-12-06
21 May 2030,2030-05-21
1543683600000000,2018-12-02
19950422220834634,1995-04-22
1820941200000000,2027-09-15
Sự kiện diễn ra vào 18/2/2024 8:2,2024-02-18
Event at 2022-02-14T10:54:21,2022-02-14
Event at 1990-10-07T12:32:59,1990-10-07
18.7.2021T10-27-11,2021-07-18
"6th of June, 2020",2020-06-06
29 Sep 2024,2024-09-29
05_03_2022,2022-05-03
1164560400000,2006-11-27
2012-03-06T05:42:05,2012-03-06
Event at 2017-10-04T9:57:18,2017-10-04
19950330123134184270,1995-03-30
2030-11-27T07:52:24+2500,2030-11-27
28-3-2000,2000-03-28
10 August 2031,2031-08-10
1994-12-12T06:23:52Z+3,1994-12-12
2000_09_23T0_0_1+0500,2000-09-23
2015-12-28T19:07:05,2015-12-28
29|4|2018,2018-04-29
28/20-1995,1995-10-28
The system recorded 20020814140311,2002-08-14
20160720204930890517442,2016-07-20
2027/12/7T193922,2027-12-07
20250416020342,2025-04-16
19970613013445331,1997-06-13
2010-03-03T22:46:47.568Z,2010-03-03
11.12.1998T17-56-3,1998-12-11
1133542800000000000,2005-12-03
20-8-2013,2013-08-10
1131469200,2005-11-09
2004-10-25T13:24:20Z+3,2004-10-25
1995-12-02T00:02:58.497962962Z,1995-12-02
Sự kiện diễn ra vào 13/6/2013 19:51,2013-06-13
ngày 2 tháng 6 năm 1997,1997-06-02
1999-03-26T12:00:49.757080Z,1999-03-26
2004-05-05T17:03:42.762884Z,2004-05-05
2002_03_25T0_31_13Z,2002-03-25
20260907125456974980,2026-09-07
2032-11-23T09:37:43,2032-11-23
2012-01-23T09:09:15+2500,2012-01-23
20250918222017898,2025-09-18
"7th of May, 1996",1996-05-07
2002-11-19T00:48:08.411418Z,2002-11-19
20100916022435467245,2010-09-16
13 March 2023,2023-03-13
01|12|15,2015-12-01
2034_08_26T4_26_37+3,2034-08-26
17-6-1999,1999-06-17
2006-03-15T16:06:35.341401Z,2006-03-15
1994-06-07T17:06:16Z+3,1994-06-07
1088269200,2004-06-27
20050814153527299996,2005-08-14
1995-04-10T13:21:40.340663403Z,1995-04-10
1991-08-05T19:46:06Z+3,1991-08-05
24 Oct 2026,2026-10-24
1997-02-25T02:59:06.318960832Z,1997-02-25
2-1-2022,2022-01-02
Event at 2010-04-21T14:20:23,2010-04-21
2/8/1998 giờ 10:50:2,1998-08-02
"24th of April, 2021",2021-04-24
Sự kiện diễn ra vào 19/1/1995 20:41,1995-01-19
24-11-09,2009-11-24
18-3-2013,2013-03-09
1115571600,2005-05-09
28-8-2003,2003-08-28
2021-09-18T03:10:46.464515369Z,2021-09-18
20090129054350332320,2009-01-29
2027/2/26T85834,2027-02-26
2028-04-06T22:46:42,2028-04-06
20040212042645,2004-02-12
15.8.2016T0-0-24,2016-08-15
ngày 2 tháng 9 năm 2013,2013-09-02
20220419191410279206,2022-04-19
Event at 2017-10-16T4:30:35,2017-10-16
The system recorded 20120811004027,2012-08-11
Ngày 11-5-2032,2032-05-11
"3rd of December, 2001",2001-12-03
2007-07-23T09:51:02.863Z,2007-07-23
701802000000000,1992-03-29
2010-11-04T23:39:48.199592311Z,2010-11-04
Sự kiện diễn ra vào 26/5/2003 9:4,2003-05-26
Sự kiện diễn ra vào 21/3/2020 22:38,2020-03-21
Sự kiện diễn ra vào 8/2/2017 4:53,2017-02-08
2017155600,2033-12-03
30/18-1997,1997-09-30
2034-09-23T00:31:19+2500,2034-09-23
2026-09-03T21:48:23,2026-09-03
Sự kiện diễn ra vào 6/4/1991 17:7,1991-04-06
20150131183200,2015-01-31
1085763600000000,2004-05-29
The system recorded 20180228205013,2018-02-28
12/08/1990,1990-12-08
2018-08-15T21:11:51,2018-08-15
20301129204504546836927,2030-11-29
941734800000000000,1999-11-05
8_3_2032,2032-03-08
2003-02-28T02:00:58.657922854Z,2003-02-28
1992-08-23T00:47:46.000590976Z,1992-08-23
2033-07-16T03:29:18Z+3,2033-07-16
ngày 19 tháng 12 năm 2002,2002-12-19
1667926800000,2022-11-09
2000|10|08,2000-10-08
19-8-2018,2018-08-19
897066000000000000,1998-06-06
22.6.2008,2008-06-22
2009-02-18T18:12:17,2009-02-18
21/22-2015,2015-11-21
14 Jan 2022,2022-01-14
"28th of June, 2025",2025-06-28
2012-06-10T00:20:09+08,2012-06-10
2008-02-19T07:26:46.636009177Z,2008-02-19
1993_01_26T13_27_33+0500,1993-01-26
32-12-2030,2030-12-16
02/06/11,2011-06-02
2006-06-22T09:01:43.107Z,2006-06-22
The system recorded 20130924034317,2013-09-24
1993_04_07T16_35_43-0300,1993-04-07
20110225174341,2011-02-25
20150213193247859737208,2015-02-13
"13th of June, 2003",2003-06-13
2001/4/11T231252,2001-04-11
"9th of September, 2005",2005-09-09
18-01-13,2013-01-18
20 02 20,2020-02-20
20281104141257242130665,2028-11-04
10/1/2027 giờ 2:56:58,2027-01-10
1998-03-14T12:51:14.671254Z,1998-03-14
19980323051838923774,1998-03-23
27.7.2012T12-45-20,2012-07-27
20351123012620,2035-11-23
16-6-2020,2020-06-08
20231104040026004847,2023-11-04
20290721062412684923,2029-07-21
11 Jul 1997,1997-07-11
1589302800000,2020-05-13
778525200000000000,1994-09-03
20310123183317326469948,2031-01-23
Sự kiện diễn ra vào 21/9/2031 6:30,2031-09-21
1997-10-12T19:20:21-0330,1997-10-12
10/5/2032 giờ 15:51:22,2032-05-10
1994-08-13T23:33:19.594896Z,1994-08-13
Ngày 13-9-1998,1998-09-13
1238691600000,2009-04-03
10-6-1992,1992-06-05
15/14-2013,2013-07-15
2002-02-26T08:08:57.364428561Z,2002-02-26
20 02 03,2003-02-20
8-6-1995,1995-06-04
4-4-2032,2032-04-02
28/8/2017 giờ 20:42:26,2017-08-28
2000/5/26T203442,2000-05-26
12/13/2003,2003-12-13
26 4 2009,2009-04-26
18 tháng 4 năm 2021,2021-04-18
2025-10-14T07:32:04-05:00,2025-10-14
2014-08-27T22:55:36,2014-08-27
20041127141158129624,2004-11-27
20171030225011,2017-10-30
24-12-2007,2007-12-12
1997/1/20T64015,1997-01-20
5/5/2000 giờ 12:52:43,2000-05-05
1732294800000,2024-11-23
2020 05 29,2020-05-29
7|5|2033,2033-05-07
The system recorded 19921223024235,1992-12-23
2022/5/12T6033,2022-05-12
"28th of November, 2012",2012-11-28
14 tháng 9 năm 2028,2028-09-14
2032-04-10T12:19:21Z+3,2032-04-10
2022-07-02T02:26:21.229678Z,2022-07-02
4-9-2002,2002-09-02
01|21|2008,2008-01-21
44-5-2025,2025-05-22
1991.08.29,1991-08-29
6-6-2023,2023-06-06
2012-08-03T16:30:56.133Z,2012-08-03
16 1 2010,2010-01-16
30.8.1998T6-31-54,1998-08-30
2014-11-19T04:31:27+2500,2014-11-19
962902800000000,2000-07-07
"6th of February, 1992",1992-02-06
2029-02-17T12:13:33,2029-02-17
05_18_2008,2008-05-18
1748970000000000,2025-06-04
19910514065745955083176,1991-05-14
Event at 1991-03-08T12:49:24,1991-03-08
36-12-2034,2034-12-18
2001_07_26,2001-07-26
20-7-2032,2032-07-20
42-6-2012,2012-06-21
2004-08-19,2004-08-19
The system recorded 20220713223510,2022-07-13
29-2-2028,2028-02-29
ngày 2 tháng 8 năm 2031,2031-08-02
Sự kiện diễn ra vào 23/7/2003 1:26,2003-07-23
1999-07-20T03:52:32,1999-07-20
Sự kiện diễn ra vào 13/8/2035 4:36,2035-08-13
800557200000000000,1995-05-16
2008/5/5T1091,2008-05-05
8.6.2002T11-20-4,2002-06-08
20160130230305,2016-01-30
2032-12-09T17:53:07+08,2032-12-09
17 tháng 10 năm 2024,2024-10-17
10/2-2002,2002-01-10
07|14|1992,1992-07-14
1647622800,2022-03-19
1994-02-21T09:47:34.966489775Z,1994-02-21
2021/9/8T10219,2021-09-08
12.23.2009,2009-12-23
28 Dec 1996,1996-12-28
"20th of March, 1999",1999-03-20
19950508064610,1995-05-08
20050225063410821,2005-02-25
"November 18, 2035",2035-11-18
18-7-2010,2010-07-18
24-5-2027,2027-05-12
22 tháng 12 năm 2024,2024-12-22
2023-04-17T12:13:59.278Z,2023-04-17
2030/4/6T83655,2030-04-06
13 March 2019,2019-03-13
20061216115212,2006-12-16
The system recorded 20230913162216,2023-09-13
2034-02-09T16:45:54.499296Z,2034-02-09
1990-09-05T02:37:48.364767280Z,1990-09-05
2003-05-27T04:14:48Z+3,2003-05-27
12/14/2001,2001-12-14
4/8/2028,2028-08-04
1992-01-18T01:13:57-0300,1992-01-18
2008-01-23T16:03:21+2500,2008-01-23
60-6-2018,2018-06-30
2031-04-19T11:53:41.944Z,2031-04-19
06_06_1993,1993-06-06
27_8_2025,2025-08-27
The system recorded 20160814071854,2016-08-14
26 Apr 2020,2020-04-26
1707498000000000000,2024-02-10
26/10-1998,1998-05-26
2022-12-28T03:54:32.881943Z,2022-12-28
2014-09-18,2014-09-18
2000.03.22,2000-03-22
20110219081325106,2011-02-19
11 7 1998,1998-07-11
959446800000000000,2000-05-28
Sự kiện diễn ra vào 10/4/2006 8:54,2006-04-10
The system recorded 20120326001657,2012-03-26
28-04-15,2015-04-28
28 tháng 4 năm 2002,2002-04-28
Event at 2025-04-28T23:13:46,2025-04-28
6 December 1999,1999-12-06
50-12-2033,2033-12-25
2034-01-19T23:42:26.992368Z,2034-01-19
979664400000,2001-01-17
1236963600000000,2009-03-14
"14th of May, 2003",2003-05-14
1993-12-31T22:51:52Z+3,1993-12-31
7 Dec 2022,2022-12-07
"7th of August, 2012",2012-08-07
24-11-26,2026-11-24
"5th of June, 2007",2007-06-05
11 Aug 1994,1994-08-11
The system recorded 20021106035137,2002-11-06
The system recorded 19911130024912,1991-11-30
28.8.1992T5-28-40,1992-08-28
28-7-1996,1996-07-14
"6th of October, 2014",2014-10-06
20101125210450708402667,2010-11-25
25-7-2002,2002-07-25
ngày 25 tháng 4 năm 1990,1990-04-25
20270825213616256014,2027-08-25
31 Oct 2030,2030-10-31
20030417113707583317,2003-04-17
20280716163600302,2028-07-16
19_12_30,2030-12-19
Ngày 3-8-2018,2018-08-03
1607706000000000000,2020-12-12
1789837200000000000,2026-09-20
1991/7/1T11348,1991-07-01
03.08.23,2023-08-03
1 tháng 11 năm 2035,2035-11-01
2025-05-14T10:01:12,2025-05-14
1219770000000,2008-08-27
20280627020411610318,2028-06-27
Ngày 17-6-2034,2034-06-17
29 August 2034,2034-08-29
25.7.1991T8-24-45,1991-07-25
14 Aug 1994,1994-08-14
1040576400000,2002-12-23
19 October 2018,2018-10-19
12_12_30,2030-12-12
9 April 2027,2027-04-09
1999-01-19T03:50:52,1999-01-19
"December 4, 2018",2018-12-04
20|03|14,2014-03-20
14 August 2009,2009-08-14
Sự kiện diễn ra vào 20/6/2003 17:17,2003-06-20
7 Jan 2025,2025-01-07
2024-06-17T09:11:39.485Z,2024-06-17
20020317081531985,2002-03-17
"March 11, 2035",2035-03-11
23 Nov 2021,2021-11-23
1205427600,2008-03-14
1998-09-21T09:26:43.757Z,1998-09-21
1257267600000000,2009-11-04
20280715010107927706,2028-07-15
08-31-2018,2018-08-31
2017-12-04T00:50:51.575592695Z,2017-12-04
11 Jul 2004,2004-07-11
2008-03-06T08:12:14Z+3,2008-03-06
2013-10-04T05:12:52+0500,2013-10-04
2020-01-14T01:39:48,2020-01-14
2007/11/2T65447,2007-11-02
"21th of January, 2011",2011-01-21
2025/6/14T51512,2025-06-14
Ngày 3-7-2022,2022-07-03
2013-12-03T07:56:28+2500,2013-12-03
1029690000000,2002-08-19
26 Jan 1999,1999-01-26
14/5/2031 giờ 18:57:29,2031-05-14
11 Aug 2012,2012-08-11
1995-05-01T16:18:57+2500,1995-05-01
The system recorded 20060830141317,2006-08-30
"March 25, 2022",2022-03-25
20051219221655,2005-12-19
7 tháng 4 năm 2012,2012-04-07
29.10.2002T6-0-17,2002-10-29
20190813081656913990,2019-08-13
Ngày 28-6-1993,1993-06-28
1333990800,2012-04-10
2019 09 01,2019-09-01
2002/3/24T15955,2002-03-24
752346000000000,1993-11-04
Ngày 26-7-2032,2032-07-26
6-11-1993,1993-11-06
Ngày 6-5-2001,2001-05-06
2017-11-26T06:44:46-0330,2017-11-26
20030325174511010956192,2003-03-25
02_02_2020,2020-02-02
Sự kiện diễn ra vào 13/4/2003 17:40,2003-04-13
The system recorded 19910105035334,1991-01-05
2016-02-21T02:00:23+2500,2016-02-21
"3rd of January, 1991",1991-01-03
1007139600,2001-12-01
1755363600000,2025-08-17
27 Jan 1993,1993-01-27
20240328082537180622,2024-03-28
20060501155430737143,2006-05-01
2030-05-09T10:31:26-05:00,2030-05-09
1198861200000000,2007-12-29
20100721051135481,2010-07-21
2021-12-06T16:25:44.859Z,2021-12-06
01 13 2000,2000-01-13
20180212233645307,2018-02-12
2019-10-05T23:23:49-05:00,2019-10-05
20160116064844141875,2016-01-16
19930403200425,1993-04-03
19980604044255090113989,1998-06-04
1992-10-12T00:37:04.068336Z,1992-10-12
2011/11/12,2011-11-12
13-10-2019,2019-10-13
2 tháng 2 năm 2015,2015-02-02
20200518215843754671,2020-05-18
Event at 2032-01-14T10:7:53,2032-01-14
2031/4/9T2137,2031-04-09
8/2/2020 giờ 13:31:9,2020-02-08
1998-01-30T19:29:51Z,1998-01-30
1998-09-13T10:44:46Z+3,1998-09-13
19|1|2021,2021-01-19
11 May 1992,1992-05-11
20 tháng 3 năm 2023,2023-03-20
1742749200,2025-03-24
05-28-2024,2024-05-28
1968858000,2032-05-23
"10th of October, 2012",2012-10-10
2006-01-20T21:49:57-05:00,2006-01-20
23-04-17,2017-04-23
2002-07-11T17:38:48Z+3,2002-07-11
2024/5/11T22852,2024-05-11
1184000400000,2007-07-10
20-6-2034,2034-06-20
8 February 2028,2028-02-08
15 January 2035,2035-01-15
21 tháng 10 năm 1997,1997-10-21
24 March 2005,2005-03-24
Event at 2028-03-28T2:9:24,2028-03-28
The system recorded 20300727024958,2030-07-27
20000401171445446351,2000-04-01
Ngày 21-12-1998,1998-12-21
20320824105308828421246,2032-08-24
The system recorded 19950419180638,1995-04-19
20350529114839624329,2035-05-29
18|08|30,2030-08-18
19970902231948041094595,1997-09-02
14 tháng 3 năm 2025,2025-03-14
18.11.2028T14-33-8,2028-11-18
2024_06_24T18_42_11+00:00,2024-06-24
Sự kiện diễn ra vào 24/7/2020 5:39,2020-07-24
23 August 2005,2005-08-23
28 October 1997,1997-10-28
2016-12-13T22:52:06Z+3,2016-12-13
2026/5/16T133020,2026-05-16
22/12-2002,2002-06-22
4.3.2029T21-19-36,2029-03-04
2034-03-25T22:13:20.227577Z,2034-03-25
2007-05-02T19:12:44.339941357Z,2007-05-02
2021-05-07T12:05:29.299514102Z,2021-05-07
2031-04-25T11:15:29,2031-04-25
2007-09-13T09:49:50Z+3,2007-09-13
2026-07-22T11:16:12+07:00,2026-07-22
Ngày 10-11-2007,2007-11-10
20240924212727050,2024-09-24
19980329000545024,1998-03-29
1204218000000000000,2008-02-29
20330806163656127105094,2033-08-06
7.2.2011T9-44-7,2011-02-07
2035-04-05T18:59:35+00:00,2035-04-05
1162746000000,2006-11-06
20070326111536569820,2007-03-26
ngày 14 tháng 4 năm 2016,2016-04-14
"August 31, 1997",1997-08-31
1-2-2012,2012-02-01
2031066000000,2034-05-13
2007-11-12T22:28:42.735543Z,2007-11-12
698259600000,1992-02-17
19940625054230621,1994-06-25
1992790800000000000,2033-02-24
30-7-1999,1999-07-15
09.09.2008,2008-09-09
Event at 1993-10-21T4:17:13,1993-10-21
1991-02-12T21:35:35+2500,1991-02-12
5-4-2009,2009-04-05
20290325035149412608177,2029-03-25
2002/2/18T73635,2002-02-18
30 Mar 2016,2016-03-30
20-2-2001,2001-02-10
19921004224059,1992-10-04
The system recorded 20140927234910,2014-09-27
20011127052756,2001-11-27
1911056400,2030-07-24
20300210031116892103,2030-02-10
19981029154559,1998-10-29
25 Mar 2023,2023-03-25
Ngày 19-1-2011,2011-01-19
02.08.2029,2029-02-08
2032_06_05T23_28_39+08,2032-06-05
Event at 2020-08-19T7:55:26,2020-08-19
17 Jun 2007,2007-06-17
2009-11-14,2009-11-14
1990-10-31T09:00:51+2500,1990-10-31
20 August 1993,1993-08-20
23 February 2006,2006-02-23
18/6-1999,1999-03-18
20110903231237821420,2011-09-03
14 tháng 1 năm 2011,2011-01-14
20/2-2023,2023-01-20
ngày 14 tháng 10 năm 2033,2033-10-14
"January 10, 1993",1993-01-10
The system recorded 19930303183251,1993-03-03
1329757200000,2012-02-21
20161029045103134666,2016-10-29
2000-07-24T18:44:06+07:00,2000-07-24
1999-12-18T11:51:52.156342420Z,1999-12-18
1846688400000,2028-07-09
20121015072134787538088,2012-10-15
1991-05-13T21:56:47+2500,1991-05-13
The system recorded 20320730052836,2032-07-30
1998/03/28,1998-03-28
2016-04-06T12:49:19+2500,2016-04-06
2011-06-17T10:35:57.111923Z,2011-06-17
Sự kiện diễn ra vào 29/4/1998 14:1,1998-04-29
19910930200651512,1991-09-30
10 05 10,2010-05-10
1182877200000,2007-06-27
"June 21, 2023",2023-06-21
1-12-1996,1996-12-01
26 August 2004,2004-08-26
2034-06-10T20:08:22+2500,2034-06-10
19 December 1994,1994-12-19
06 16 2009,2009-06-16
1994-12-05T07:11:19.118584015Z,1994-12-05
2003-11-07T15:40:43.961015Z,2003-11-07
12 November 2012,2012-11-12
2009/5/3T185745,2009-05-03
977936400000000,2000-12-28
10.11.1996,1996-10-11
2/3/2028 giờ 22:13:27,2028-03-02
1999-12-21T20:33:12+07:00,1999-12-21
ngày 22 tháng 12 năm 1996,1996-12-22
The system recorded 19910124070016,1991-01-24
28.2.2035T9-53-29,2035-02-28
21 Feb 2020,2020-02-21
2013-12-22T19:55:16.738923165Z,2013-12-22
2024-06-12T04:32:16,2024-06-12
23_01_10,2010-01-23
2029/3/13T12310,2029-03-13
2030_08_12T18_53_13+07:00,2030-08-12
2016_09_11T4_8_16+0500,2016-09-11
06_06_2030,2030-06-06
2025536400000000000,2034-03-10
Ngày 6-6-2010,2010-06-06
Event at 2010-04-12T15:3:52,2010-04-12
23|02|09,2009-02-23
The system recorded 20051121135042,2005-11-21
2027/9/7T101843,2027-09-07
2035-10-13T23:27:32.246509Z,2035-10-13
Ngày 10-2-2029,2029-02-10
2031_09_17T9_57_37+07:00,2031-09-17
1-5-2016,2016-05-01
2013-06-12,2013-06-12
The system recorded 20070614202918,2007-06-14
30/7/2022 giờ 16:32:54,2022-07-30
2024-05-10T02:45:28.432802Z,2024-05-10
2008-05-22T21:22:49+2500,2008-05-22
2013-01-21T05:35:48-0300,2013-01-21
"October 31, 1990",1990-10-31
"January 27, 2018",2018-01-27
687546000000,1991-10-16
2014-03-22T21:13:42+08,2014-03-22
670698000000000000,1991-04-04
19970810064253225420707,1997-08-10
19970129012401162,1997-01-29
20230212053116158,2023-02-12
2016_04_11T13_25_42+08,2016-04-11
1993/11/30,1993-11-30
1999-07-15T12:08:39+2500,1999-07-15
Sự kiện diễn ra vào 13/10/2012 23:12,2012-10-13
Ngày 6-1-2003,2003-01-06
12_08_2035,2035-12-08
20.10.1995T11-16-32,1995-10-20
The system recorded 20060801230355,2006-08-01
The system recorded 19980301082113,1998-03-01
1252515600,2009-09-10
2034-09-17T22:06:14+2500,2034-09-17
Ngày 22-12-1999,1999-12-22
Ngày 11-5-1991,1991-05-11
1994-06-15T03:41:48+2500,1994-06-15
Event at 2021-07-10T0:1:0,2021-07-10
Sự kiện diễn ra vào 1/12/2007 9:11,2007-12-01
20060330202234875,2006-03-30
8/2/2034 giờ 7:7:23,2034-02-08
2034_05_01T21_26_53+00:00,2034-05-01
2006-06-20T17:11:24.014923Z,2006-06-20
2003-05-15T05:59:14.962240892Z,2003-05-15
60-5-2027,2027-05-30
16.4.2001T19-30-15,2001-04-16
"January 26, 2016",2016-01-26
27 Jun 1992,1992-06-27
Ngày 19-12-1998,1998-12-19
31 tháng 3 năm 2032,2032-03-31
The system recorded 20101204223030,2010-12-04
20270315083207,2027-03-15
2012-01-08T23:29:48.970571492Z,2012-01-08
26.9.2001T8-0-3,2001-09-26
2015-11-20T19:05:32,2015-11-20
2006-08-25T03:30:40+2500,2006-08-25
19940602092501725671306,1994-06-02
1660410000,2022-08-14
2007-01-18T21:23:43.520Z,2007-01-18
20140518092141370,2014-05-18
"August 26, 2026",2026-08-26
The system recorded 20271204214131,2027-12-04
20120706042053,2012-07-06
22/12-2027,2027-06-22
945190800000000,1999-12-15
Ngày 23-9-2009,2009-09-23
18.6.2025T8-58-16,2025-06-18
1071766800000,2003-12-19
"November 9, 1992",1992-11-09
10|8|2018,2018-08-10
"April 9, 2027",2027-04-09
"10th of May, 2012",2012-05-10
2034-02-19T15:49:25.650Z,2034-02-19
2014-07-04T01:18:36.594680680Z,2014-07-04
20020927105332845925812,2002-09-27
2034_08_12T23_9_18-05:00,2034-08-12
4/6/2034 giờ 7:42:52,2034-06-04
Event at 2026-10-14T21:2:34,2026-10-14
19970505002015419658,1997-05-05
1768842000000000000,2026-01-20
2003-12-28T20:41:38.911Z,2003-12-28
"October 25, 1998",1998-10-25
5 Apr 2024,2024-04-05
Ngày 25-5-2022,2022-05-25
1991-03-22T14:12:34.691Z,1991-03-22
26-3-2017,2017-03-13
29 10 34,2034-10-29
12.12.2027,2027-12-12
22.1.2009T23-16-35,2009-01-22
2026-08-28T00:29:04.909127214Z,2026-08-28
Event at 2021-09-22T13:34:9,2021-09-22
20170119180301823,2017-01-19
10/05/2034,2034-10-05
2018-07-26T19:22:27+00:00,2018-07-26
2012_02_06T21_56_48-0330,2012-02-06
2016-06-12T05:00:28.736806Z,2016-06-12
The system recorded 20250111214743,2025-01-11
Event at 2035-05-26T1:3:37,2035-05-26
ngày 31 tháng 10 năm 2002,2002-10-31
1115226000000000,2005-05-05
Event at 1996-01-16T23:17:46,1996-01-16
8-8-2030,2030-08-08
1998_02_24,1998-02-24
24-5-2003,2003-05-24
Sự kiện diễn ra vào 28/4/2000 1:13,2000-04-28
2007-04-23T10:37:19.207Z,2007-04-23
Sự kiện diễn ra vào 7/10/2010 1:53,2010-10-07
19930505123856666345,1993-05-05
27_09_34,2034-09-27
Ngày 15-11-1995,1995-11-15
27/11/2005,2005-11-27
2034-07-16T19:50:44Z+3,2034-07-16
1537722000,2018-09-24
1993_10_30T7_54_31+07:00,1993-10-30
29 Oct 2014,2014-10-29
Event at 1996-12-19T14:37:42,1996-12-19
2001-07-16T16:43:45Z+3,2001-07-16
20270823030723538538222,2027-08-23
30.12.2001T13-0-7,2001-12-30
2029/9/26T11426,2029-09-26
1621789200000000,2021-05-24
2016-11-25T17:36:26+2500,2016-11-25
20020904131040460873847,2002-09-04
1873386000000000000,2029-05-14
2021 12 14,2021-12-14
"August 23, 1997",1997-08-23
20_3_2013,2013-03-20
12.9.2032T15-2-31,2032-09-12
2/7/2026 giờ 8:56:17,2026-07-02
20021016202702034914317,2002-10-16
28 tháng 12 năm 2031,2031-12-28
26 tháng 11 năm 2007,2007-11-26
"December 5, 2025",2025-12-05
23.8.2004T19-2-7,2004-08-23
996253200000000,2001-07-28
20200327002226,2020-03-27
Ngày 5-6-2010,2010-06-05
The system recorded 20261105090738,2026-11-05
2027-11-21T05:47:53.353840Z,2027-11-21
"23th of February, 2029",2029-02-23
2033-02-26T22:35:30,2033-02-26
19.3.2009T21-14-34,2009-03-19
1705338000000000000,2024-01-16
02 11 93,1993-11-02
20 July 2000,2000-07-20
ngày 12 tháng 1 năm 2026,2026-01-12
Event at 2012-11-25T13:18:31,2012-11-25
Event at 2032-09-09T3:38:1,2032-09-09
1948813200,2031-10-04
13/16-1993,1993-08-13
1999-11-06T05:43:14Z+3,1999-11-06
01-05-94,1994-05-01
Ngày 20-3-2023,2023-03-20
04-10-2035,2035-04-10
2029/7/24T11733,2029-07-24
20190927094424473936528,2019-09-27
846262800000000000,1996-10-26
The system recorded 20290808085324,2029-08-08
17 June 2035,2035-06-17
18-12-2026,2026-12-18
2011-03-19T08:34:30.943211Z,2011-03-19
20150210165204877536,2015-02-10
The system recorded 20080808153750,2008-08-08
1113670800,2005-04-17
15/24-1995,1995-12-15
1499619600000,2017-07-10
2017-05-07T10:01:43+2500,2017-05-07
22-8-1996,1996-08-11
27 Oct 2026,2026-10-27
14.11.2012T10-5-16,2012-11-14
2031/7/21T7564,2031-07-21
2032-06-17T14:55:37.498277Z,2032-06-17
983638800000,2001-03-04
26-8-2030,2030-08-13
1995-08-05T11:46:28Z+3,1995-08-05
2018_08_26T17_2_19+3,2018-08-26
2004.08.12,2004-08-12
20300823170524277934,2030-08-23
20251021153226453332,2025-10-21
"31th of December, 2005",2005-12-31
ngày 30 tháng 10 năm 1993,1993-10-30
48-11-2000,2000-11-24
42-12-2005,2005-12-21
742323600,1993-07-11
10 11 01,2001-11-10
06/25/2017,2017-06-25
2000-01-07T01:40:19+2500,2000-01-07
2017/1/21T6237,2017-01-21
13 Jun 2014,2014-06-13
10-1-2023,2023-01-05
10.10.2024,2024-10-10
Ngày 7-5-2014,2014-05-07
1994-09-05T00:25:36,1994-09-05
2035-05-17T19:13:21+2500,2035-05-17
1996-02-28T01:44:39.318Z,1996-02-28
21-02-04,2004-02-21
22 Jun 1993,1993-06-22
28 Sep 2032,2032-09-28
1995_07_10T6_47_7+3,1995-07-10
1-3-2033,2033-03-01
18/6/1997 giờ 22:30:33,1997-06-18
28-7-2030,2030-07-28
938019600000,1999-09-23
21/12/2003 giờ 8:27:1,2003-12-21
"October 27, 2019",2019-10-27
"September 26, 2019",2019-09-26
22 April 2019,2019-04-22
1235926800000000,2009-03-02
802630800,1995-06-09
Ngày 7-11-1990,1990-11-07
The system recorded 20260325005419,2026-03-25
27|05|12,2012-05-27
"June 30, 1992",1992-06-30
17 11 90,1990-11-17
660157200000000,1990-12-03
20190424103237282244,2019-04-24
2022-01-25T09:13:58.143383211Z,2022-01-25
"March 29, 2012",2012-03-29
Ngày 28-4-1994,1994-04-28
2029-10-26T16:12:34.426Z,2029-10-26
2048950800000,2034-12-06
31/12/2016 giờ 7:7:16,2016-12-31
The system recorded 20350717055047,2035-07-17
10-6-2034,2034-06-05
2001-05-20T04:54:17.301776955Z,2001-05-20
12-7-2003,2003-07-12
20041006082018762,2004-10-06
1994-05-27T08:47:18.446138Z,1994-05-27
06.22.2034,2034-06-22
12|04|2028,2028-12-04
1-9-2014,2014-09-01
The system recorded 20100706180641,2010-07-06
ngày 7 tháng 5 năm 2005,2005-05-07
36-7-2008,2008-07-18
Event at 2013-09-11T23:39:46,2013-09-11
2003-07-16T19:50:16+2500,2003-07-16
16-11-2002,2002-11-08
"30th of April, 2001",2001-04-30
05-08-10,2010-08-05
28-4-2021,2021-04-28
1998_07_09T6_53_35Z,1998-07-09
Ngày 20-10-1992,1992-10-20
6-2-2013,2013-02-06
20230402182209727425076,2023-04-02
1-1-1995,1995-01-01
8 October 2002,2002-10-08
Event at 1993-06-19T14:35:50,1993-06-19
11|06|2007,2007-11-06
"July 9, 2006",2006-07-09
19950903105423883,1995-09-03
19990404073039734957221,1999-04-04
1151514000,2006-06-29
1686330000,2023-06-10
Event at 2000-08-22T15:53:23,2000-08-22
15/1/2032 giờ 7:57:4,2032-01-15
2025/3/18T64443,2025-03-18
13/01/15,2015-01-13
11|2|2028,2028-02-11
25 Aug 2022,2022-08-25
25 Apr 2002,2002-04-25
04 24 2032,2032-04-24
05 17 2020,2020-05-17
2007-06-12T16:21:32.120684556Z,2007-06-12
26/10/2012 giờ 16:38:33,2012-10-26
2003-09-06T01:19:35,2003-09-06
2028-07-04T18:59:04,2028-07-04
2011-11-17T13:44:35.458604387Z,2011-11-17
27 Mar 1991,1991-03-27
01/25/2023,2023-01-25
6 August 1993,1993-08-06
22.11.2033T5-51-10,2033-11-22
26_4_2033,2033-04-26
20080606193445,2008-06-06
"November 17, 2005",2005-11-17
2020-10-31T15:25:03Z+3,2020-10-31
2002-02-19T22:09:26Z+3,2002-02-19
ngày 19 tháng 10 năm 2015,2015-10-19
Event at 1990-10-14T2:51:14,1990-10-14
12.17.1993,1993-12-17
10 Sep 2022,2022-09-10
Ngày 9-5-1996,1996-05-09
27 tháng 3 năm 2034,2034-03-27
2031/10/31T113314,2031-10-31
21 tháng 4 năm 2018,2018-04-21
1991-10-24T12:02:34.215768405Z,1991-10-24
The system recorded 19930628025828,1993-06-28
17-7-2034,2034-07-17
28/08/96,1996-08-28
The system recorded 19951123045809,1995-11-23
1058634000000000,2003-07-20
07.08.20,2020-08-07
ngày 12 tháng 12 năm 2018,2018-12-12
Sự kiện diễn ra vào 2/11/2026 11:5,2026-11-02
2022-06-09T09:35:59,2022-06-09
3 January 2012,2012-01-03
"June 24, 2020",2020-06-24
2014-04-02T04:03:09Z+3,2014-04-02
22 June 1991,1991-06-22
19/9/2032 giờ 9:18:43,2032-09-19
2017-04-27T15:37:40.785550Z,2017-04-27
5/16-2000,2000-08-05
2024-03-05T19:43:42Z+3,2024-03-05
29/10/2001,2001-10-29
5 5 2013,2013-05-05
46-10-2008,2008-10-23
ngày 13 tháng 4 năm 2013,2013-04-13
20/5/2004 giờ 7:10:9,2004-05-20
727030800000,1993-01-15
1997-09-07T11:46:22+00:00,1997-09-07
Event at 2016-08-07T21:3:14,2016-08-07
2023-06-27T01:07:13.294674Z,2023-06-27
9 Aug 2024,2024-08-09
18 tháng 4 năm 1993,1993-04-18
18/11/2013 giờ 13:27:50,2013-11-18
20340913023251848883,2034-09-13
2028-02-04T16:19:02.749925383Z,2028-02-04
20.9.2021T15-30-48,2021-09-20
Event at 1994-03-10T23:6:1,1994-03-10
The system recorded 19981219101004,1998-12-19
20150519162100157,2015-05-19
Ngày 10-1-2019,2019-01-10
20080326025610735341688,2008-03-26
2020-06-02T15:18:55.857Z,2020-06-02
Sự kiện diễn ra vào 15/5/2008 18:37,2008-05-15
"January 12, 2031",2031-01-12
2000-10-16T19:28:14.087313Z,2000-10-16
01 16 2010,2010-01-16
11 May 2028,2028-05-11
1993_01_19T6_15_55+00:00,1993-01-19
2030/08/04,2030-08-04
30 Dec 2000,2000-12-30
20220828061658279371,2022-08-28
17-4-2035,2035-04-17
1150650000000000000,2006-06-19
28_07_25,2025-07-28
2019/6/13T8171,2019-06-13
Event at 2003-11-29T10:17:37,2003-11-29
24 tháng 11 năm 2023,2023-11-24
2012-03-30T01:37:00.767Z,2012-03-30
889117200,1998-03-06
ngày 26 tháng 1 năm 2020,2020-01-26
50-8-2000,2000-08-25
2002-10-28T17:35:29.481929Z,2002-10-28
12-10-31,2031-10-12
27/16-2024,2024-08-27
Event at 2019-04-26T23:39:32,2019-04-26
ngày 24 tháng 8 năm 2022,2022-08-24
"January 15, 2021",2021-01-15
The system recorded 20140627050107,2014-06-27
19950722073216,1995-07-22
1993-02-03T16:30:14+3,1993-02-03
20220630235722565,2022-06-30
2006/7/24T114322,2006-07-24
3/22-2001,2001-11-03
Event at 2031-07-19T8:15:42,2031-07-19
2012/7/14T02334,2012-07-14
17.2.1991T16-13-1,1991-02-17
2005.06.16,2005-06-16
1992/11/1T14534,1992-11-01
1583773200000,2020-03-10
2006-09-09T18:30:49.501Z,2006-09-09
28-1-2030,2030-01-28
2009-05-02T02:06:55,2009-05-02
27/3/2018 giờ 5:2:27,2018-03-27
ngày 28 tháng 3 năm 2026,2026-03-28
1457802000000,2016-03-13
Ngày 8-8-2024,2024-08-08
4/16-2035,2035-08-04
9 October 2004,2004-10-09
"19th of October, 2026",2026-10-19
20100920235943,2010-09-20
20/24-2020,2020-12-20
2002-04-02T23:16:55+2500,2002-04-02
2029-01-03,2029-01-03
Event at 2028-09-03T14:58:11,2028-09-03
18-4-2008,2008-04-09
2001-01-26T13:51:50+2500,2001-01-26
6 tháng 5 năm 2017,2017-05-06
750445200000,1993-10-13
20070430233316389,2007-04-30
2032_03_04T5_50_34+3,2032-03-04
16-12-1994,1994-12-16
27/16-2021,2021-08-27
1034355600,2002-10-12
08/05/92,1992-05-08
2025-12-10T18:26:16.975065126Z,2025-12-10
2009_12_22T18_25_22+0500,2009-12-22
1 tháng 4 năm 2014,2014-04-01
2030_09_21T9_43_39+0500,2030-09-21
3/5/1996 giờ 22:34:48,1996-05-03
1481734800000,2016-12-15
"11th of May, 2012",2012-05-11
Sự kiện diễn ra vào 12/6/2028 4:55,2028-06-12
ngày 19 tháng 9 năm 1990,1990-09-19
08/11/1996,1996-08-11
20030912164155450028801,2003-09-12
648061200000,1990-07-16
2028-09-24T20:23:23,2028-09-24
10/6-2005,2005-03-10
2012-08-18T17:59:59.007Z,2012-08-18
20310303202314835279,2031-03-03
11/12-1994,1994-06-11
30/12-2034,2034-06-30
18-2-2024,2024-02-09
"30th of January, 2025",2025-01-30
01.16.2026,2026-01-16
Event at 2030-01-06T8:14:36,2030-01-06
8 tháng 6 năm 2007,2007-06-08
20280922112311882,2028-09-22
2073574800,2035-09-17
20040208210643881,2004-02-08
2019/1/9T44424,2019-01-09
20250129023952125,2025-01-29
Sự kiện diễn ra vào 7/2/2028 16:11,2028-02-07
5.3.2011T13-8-12,2011-03-05
20010611184648,2001-06-11
Sự kiện diễn ra vào 14/3/2004 11:7,2004-03-14
19901113030924660445516,1990-11-13
Sự kiện diễn ra vào 8/12/2021 2:2,2021-12-08
1995-02-15T23:35:29.557Z,1995-02-15
2035_09_10T5_42_49+08,2035-09-10
Ngày 8-11-2034,2034-11-08
12/4/2023 giờ 11:36:4,2023-04-12
The system recorded 19990904164045,1999-09-04
12/8-2030,2030-04-12
ngày 17 tháng 1 năm 2017,2017-01-17
Event at 2017-01-24T23:53:5,2017-01-24
20040323015302408,2004-03-23
1619974800000,2021-05-03
2-1-2002,2002-01-02
22/20-2004,2004-10-22
26/16-2014,2014-08-26
2035-08-11T03:06:42.145291Z,2035-08-11
1499187600000000000,2017-07-05
2023-12-24T07:29:34.587Z,2023-12-24
The system recorded 20280907203616,2028-09-07
"30th of May, 2013",2013-05-30
21_09_29,2029-09-21
The system recorded 20170529142856,2017-05-29
25-9-2013,2013-09-25
2000_04_19T21_3_27+07:00,2000-04-19
20231107201345343,2023-11-07
1998_09_11T16_53_43-05:00,1998-09-11
1608829200000,2020-12-25
780166800,1994-09-22
10 tháng 8 năm 1998,1998-08-10
Event at 2000-06-10T22:45:53,2000-06-10
Ngày 14-5-2019,2019-05-14
"30th of September, 2014",2014-09-30
931107600000000000,1999-07-05
The system recorded 20081207141230,2008-12-07
Sự kiện diễn ra vào 10/4/2015 16:33,2015-04-10
2008-06-23T09:32:32.383Z,2008-06-23
2003-06-27,2003-06-27
2010-09-29T21:58:43+2500,2010-09-29
2012_12_09T11_20_8Z,2012-12-09
ngày 26 tháng 9 năm 2003,2003-09-26
Event at 2000-05-25T13:2:42,2000-05-25
2022/6/22T143612,2022-06-22
Event at 1990-02-27T1:57:43,1990-02-27
20000815140719,2000-08-15
20150317201211704,2015-03-17
8 Dec 2019,2019-12-08
1918832400000000000,2030-10-22
17.1.1995T22-53-52,1995-01-17
23|4|2010,2010-04-23
Sự kiện diễn ra vào 2/1/2003 4:16,2003-01-02
20150915015151445288665,2015-09-15
2018-02-20T04:50:22.848390Z,2018-02-20
2026/3/13T182742,2026-03-13
1990-02-23T12:12:59Z+3,1990-02-23
9 March 2003,2003-03-09
30 06 20,2020-06-30
16 Jun 1993,1993-06-16
ngày 16 tháng 1 năm 1990,1990-01-16
20000423100834710,2000-04-23
2020_10_11T6_51_10+2500,2020-10-11
1995-09-27T23:15:34.528Z,1995-09-27
20350608235338638,2035-06-08
26 December 1993,1993-12-26
2007_04_01T17_0_31+3,2007-04-01
"13th of February, 1993",1993-02-13
20150916102818737,2015-09-16
Sự kiện diễn ra vào 8/12/1995 16:23,1995-12-08
ngày 30 tháng 7 năm 2016,2016-07-30
17 Jun 2000,2000-06-17
2012_08_10,2012-08-10
5 June 2010,2010-06-05
21.11.2020T5-17-1,2020-11-21
26-5-2022,2022-05-26
20330115132224355,2033-01-15
15.1.1998T13-25-17,1998-01-15
34-8-2018,2018-08-17
17 Aug 2007,2007-08-17
2034-08-26T03:00:36-0330,2034-08-26
14 Nov 2009,2009-11-14
1995-07-15T23:05:07.482561Z,1995-07-15
1844614800000,2028-06-15
1981818000000000000,2032-10-20
18 Sep 2001,2001-09-18
2008/7/28T134827,2008-07-28
2019/8/5T102757,2019-08-05
11_1_2001,2001-01-11
10/14-2011,2011-07-10
22 December 2027,2027-12-22
1001264400,2001-09-24
2000.06.07,2000-06-07
06.12.2031,2031-06-12
23-2-2015,2015-02-23
930416400,1999-06-27
20321001201710622,2032-10-01
1990_02_20T4_3_3+3,1990-02-20
13/11/2023,2023-11-13
3 tháng 11 năm 2021,2021-11-03
19 May 2017,2017-05-19
14-9-2013,2013-09-14
30/12/2012,2012-12-30
Sự kiện diễn ra vào 14/2/2017 8:45,2017-02-14
2041866000000000,2034-09-15
Ngày 9-5-2023,2023-05-09
12/3/2028 giờ 14:0:26,2028-03-12
2008_03_13T18_14_55+2500,2008-03-13
2009-12-18T19:11:27Z+3,2009-12-18
29 July 2017,2017-07-29
2030_09_13T3_52_25-0300,2030-09-13
1.11.2031T22-16-46,2031-11-01
1120842000000000000,2005-07-09
2028-06-06T11:43:07+2500,2028-06-06
20300305105740928,2030-03-05
16 tháng 4 năm 2003,2003-04-16
24.3.2024,2024-03-24
27-5-1993,1993-05-27
ngày 8 tháng 3 năm 2033,2033-03-08
Event at 2005-06-19T4:21:38,2005-06-19
Event at 2006-11-24T22:51:52,2006-11-24
4/6/1990 giờ 7:1:3,1990-06-04
6-8-1998,1998-08-03
14/10-2032,2032-05-14
05|09|2034,2034-05-09
1730826000000000000,2024-11-06
19910130232658566003097,1991-01-30
19941030150652,1994-10-30
2016/5/2T21216,2016-05-02
8 Mar 2013,2013-03-08
1777050000,2026-04-25
2003-02-22T00:09:27+2500,2003-02-22
Ngày 20-4-2002,2002-04-20
08|07|2000,2000-08-07
20/14-2015,2015-07-20
20140825210502598328849,2014-08-25
1873645200000000,2029-05-17
2018-01-01T11:37:08+3,2018-01-01
1563382800000000,2019-07-18
1/1/2024 giờ 4:17:46,2024-01-01
2020-09-25T16:43:38Z+3,2020-09-25
Sự kiện diễn ra vào 28/4/2035 20:28,2035-04-28
19900211150646156,1990-02-11
26.8.2019T15-46-24,2019-08-26
Event at 2027-02-20T15:30:44,2027-02-20
The system recorded 20061028181702,2006-10-28
5|4|1993,1993-04-05
08 25 2008,2008-08-25
18 May 2001,2001-05-18
Event at 2002-08-12T17:58:25,2002-08-12
27.9.2019T14-9-43,2019-09-27
The system recorded 20270127234655,2027-01-27
2035-10-31T02:11:15.067Z,2035-10-31
56-9-1994,1994-09-28
2003_12_11T15_32_20Z+3,2003-12-11
"May 30, 2032",2032-05-30
20270501184700945639,2027-05-01
1685206800000000000,2023-05-28
2015_09_17T7_39_30-0300,2015-09-17
1292259600000000,2010-12-14
2011-09-22T23:35:22+3,2011-09-22
19/22-2012,2012-11-19
Event at 2027-12-29T1:43:5,2027-12-29
15 tháng 12 năm 2012,2012-12-15
2024-07-02T13:22:05.381Z,2024-07-02
2000-04-03T04:37:51+2500,2000-04-03
2023_01_05T6_51_37-0330,2023-01-05
5/2/1999 giờ 4:52:15,1999-02-05
ngày 25 tháng 2 năm 2016,2016-02-25
Event at 2024-09-27T3:11:53,2024-09-27
20170116040726938,2017-01-16
20230411201638244,2023-04-11
16.6.1995T0-54-56,1995-06-16
20331231020918,2033-12-31
The system recorded 19921012112305,1992-10-12
1/18-1996,1996-09-01
9/11/2023 giờ 13:44:57,2023-11-09
2012|01|11,2012-01-11
20000803162635492532,2000-08-03
2012_08_20T15_58_47+3,2012-08-20
Event at 2018-09-22T6:48:55,2018-09-22
2032-02-07T08:36:27+2500,2032-02-07
The system recorded 19960309130343,1996-03-09
2031|10|04,2031-10-04
46-1-2007,2007-01-23
12.11.1992T5-21-6,1992-11-12
2005-04-09T11:22:12.311891710Z,2005-04-09
2008-10-01T21:52:11.500Z,2008-10-01
887130000000000,1998-02-11
04-11-2000,2000-04-11
2020-10-09T07:21:48+2500,2020-10-09
2029-06-17T05:25:53.990336347Z,2029-06-17
9/1/2012 giờ 11:25:31,2012-01-09
1505322000000,2017-09-14
07/07/2005,2005-07-07
1363194000,2013-03-14
7 Apr 2035,2035-04-07
17/16-2027,2027-08-17
2018-05-02T09:40:00.436791Z,2018-05-02
20160220194637969268559,2016-02-20
20320725234850104,2032-07-25
2022-09-06T19:12:57.400Z,2022-09-06
Sự kiện diễn ra vào 5/11/2031 23:40,2031-11-05
2020_01_10T3_12_30-0300,2020-01-10
2035-01-17T15:04:08Z+3,2035-01-17
952275600000000,2000-03-06
2028-09-20T02:04:26+0500,2028-09-20
20350205175029036354750,2035-02-05
2029/03/17,2029-03-17
19901010223907019829342,1990-10-10
2008-12-24T20:42:23.641541Z,2008-12-24
2007/02/22,2007-02-22
2002-12-17T12:24:50.269966629Z,2002-12-17
1124125200000000000,2005-08-16
5/9/2009 giờ 18:29:37,2009-09-05
28-6-1992,1992-06-14
1238778000000,2009-04-04
"November 7, 1996",1996-11-07
1.6.2020,2020-06-01
794595600000,1995-03-08
3/12/2027 giờ 21:26:30,2027-12-03
"December 25, 2011",2011-12-25
20251203210025,2025-12-03
"31th of March, 2002",2002-03-31
19931221185458869,1993-12-21
06|11|2015,2015-06-11
1306774800000000000,2011-05-31
Ngày 1-7-2015,2015-07-01
16 tháng 11 năm 2002,2002-11-16
"August 6, 2034",2034-08-06
15 Dec 2024,2024-12-15
2005-07-30T20:01:19.035827726Z,2005-07-30
2010 09 02,2010-09-02
20060311224138687964,2006-03-11
2004/2/22T14428,2004-02-22
2014-04-27T14:45:41Z+3,2014-04-27
25/7/1991 giờ 3:48:27,1991-07-25
ngày 10 tháng 12 năm 2004,2004-12-10
08.06.2028,2028-08-06
Event at 2009-06-13T22:43:53,2009-06-13
22/12/2025 giờ 9:11:44,2025-12-22
2023722000000000000,2034-02-17
20240220064946,2024-02-20
2023-06-05T11:16:50.559Z,2023-06-05
2020-12-23T13:53:34Z+3,2020-12-23
20010109103823398191,2001-01-09
1990-03-05T00:13:57,1990-03-05
ngày 12 tháng 1 năm 2012,2012-01-12
6 tháng 10 năm 1994,1994-10-06
9/6-2016,2016-03-09
1995-05-02T19:04:53+3,1995-05-02
1 Dec 2021,2021-12-01
2004.03.12,2004-03-12
1465750800000000,2016-06-13
749149200000000,1993-09-28
19|9|2013,2013-09-19
Ngày 22-1-2020,2020-01-22
Event at 2000-03-05T1:29:32,2000-03-05
2020-07-07T04:45:44.996476Z,2020-07-07
1700758800,2023-11-24
Ngày 21-7-2008,2008-07-21
19980330014002267,1998-03-30
2006-01-17T10:05:15+2500,2006-01-17
27 tháng 12 năm 2030,2030-12-27
2019-10-04T10:26:39.573Z,2019-10-04
1448384400000000,2015-11-25
1995-12-17T21:25:53.711293Z,1995-12-17
2022-05-31T11:38:38Z+3,2022-05-31
2026-11-16T08:13:33-05:00,2026-11-16
2000-02-23T11:41:47+2500,2000-02-23
20270221085235,2027-02-21
24.12.20,2020-12-24
1990-11-27T18:15:17+2500,1990-11-27
18 September 2017,2017-09-18
9 Nov 2023,2023-11-09
"29th of December, 2026",2026-12-29
2005-01-16T09:21:19Z+3,2005-01-16
5 Jun 1993,1993-06-05
1995-05-02T02:32:25.366Z,1995-05-02
2033-01-18T21:08:03+2500,2033-01-18
19940719165524094,1994-07-19
14 tháng 8 năm 2032,2032-08-14
08-18-2020,2020-08-18
2031_09_23,2031-09-23
2024-02-01T00:37:46.728Z,2024-02-01
Event at 2000-10-18T11:24:5,2000-10-18
Sự kiện diễn ra vào 10/5/2006 21:26,2006-05-10
Ngày 31-10-1997,1997-10-31
2012-01-17T08:43:04.240241Z,2012-01-17
Ngày 30-1-2033,2033-01-30
11-6-2000,2000-06-11
1999-01-24T02:55:18.698Z,1999-01-24
"August 24, 1996",1996-08-24
20100925002501806,2010-09-25
926960400000,1999-05-18
1999-05-14T08:52:46.849873Z,1999-05-14
20270815161305547,2027-08-15
2007-12-17T14:05:37.032Z,2007-12-17
29 tháng 11 năm 2013,2013-11-29
1406912400000,2014-08-02
960483600000,2000-06-09
"2nd of April, 1993",1993-04-02
802371600000000000,1995-06-06
20110910143752610260,2011-09-10
28/12-2014,2014-06-28
2025-04-18T15:10:13+2500,2025-04-18
Ngày 13-11-2002,2002-11-13
1116694800000,2005-05-22
"18th of June, 2019",2019-06-18
ngày 28 tháng 2 năm 2022,2022-02-28
20140525162448,2014-05-25
2030-04-27T10:25:20,2030-04-27
20190207054032,2019-02-07
Sự kiện diễn ra vào 1/3/1999 23:50,1999-03-01
2012/4/4T11357,2012-04-04
2014-03-25T23:38:46.183399Z,2014-03-25
21 Jan 2016,2016-01-21
5 tháng 7 năm 2008,2008-07-05
36-2-2019,2019-02-18
5 12 2012,2012-12-05
2008/9/18T02449,2008-09-18
Ngày 28-11-2018,2018-11-28
20171019183128741036,2017-10-19
19970406224611466964580,1997-04-06
2 Dec 2011,2011-12-02
20170812122150382794333,2017-08-12
1011632400000,2002-01-22
20271214212524132217,2027-12-14
11|09|2026,2026-11-09
"November 4, 2013",2013-11-04
2012-01-26T18:02:54+08,2012-01-26
1993-04-18T13:34:54Z+3,1993-04-18
2030-03-28T21:08:31,2030-03-28
2020525200000,2034-01-11
The system recorded 20290601051039,2029-06-01
20-2-2011,2011-02-20
30-10-2024,2024-10-30
10 04 2035,2035-10-04
The system recorded 20220619005342,2022-06-19
"5th of November, 1993",1993-11-05
2002.10.16,2002-10-16
2023-10-05T05:18:43.163Z,2023-10-05
22 09 06,2006-09-22
20310528095416457897269,2031-05-28
2034/12/4T31515,2034-12-04
15-9-2019,2019-09-15
2034-01-05T00:32:00,2034-01-05
1994-08-19T02:16:54+2500,1994-08-19
21 January 1992,1992-01-21
4 July 1995,1995-07-04
1992_01_05T14_32_53-0330,1992-01-05
19.4.2017T2-59-10,2017-04-19
Ngày 1-7-2017,2017-07-01
23.02.27,2027-02-23
Sự kiện diễn ra vào 22/3/2026 23:10,2026-03-22
ngày 29 tháng 3 năm 2010,2010-03-29
1769101200,2026-01-23
15 January 2020,2020-01-15
2024-09-30T08:11:27-0300,2024-09-30
08.28.2006,2006-08-28
2.12.1992T9-43-38,1992-12-02
1999-04-29T10:58:41.923Z,1999-04-29
2018-02-21T06:44:49Z+3,2018-02-21
30/18-1998,1998-09-30
21/08/01,2001-08-21
6-7-2004,2004-07-06
1136739600000,2006-01-09
2011-12-01T09:03:09.870729Z,2011-12-01
2019|08|31,2019-08-31
1991-11-12T00:46:39.258240319Z,1991-11-12
4-2-2019,2019-02-02
"August 15, 2034",2034-08-15
18/6-2025,2025-03-18
2005-07-17T01:55:58.176Z,2005-07-17
1406826000000000000,2014-08-01
12-3-2027,2027-03-12
2029-06-22T11:53:32.045904070Z,2029-06-22
4/6-2021,2021-03-04
15_5_2007,2007-05-15
25/18-1994,1994-09-25
1496077200000,2017-05-30
2030-04-24,2030-04-24
18.5.2004T10-37-16,2004-05-18
20.7.1999,1999-07-20
The system recorded 20170224223507,2017-02-24
1/8-1992,1992-04-01
2031-02-20T07:36:28,2031-02-20
10/4-2020,2020-02-10
2019-11-29T22:19:32.650Z,2019-11-29
1994-06-11T17:47:35Z+3,1994-06-11
19940218155207936,1994-02-18
Ngày 20-1-2027,2027-01-20
Event at 2003-08-08T11:18:9,2003-08-08
3 tháng 8 năm 2025,2025-08-03
21 Mar 2019,2019-03-21
1405962000,2014-07-22
2003-08-29T15:57:07,2003-08-29
27/7/2007 giờ 17:20:39,2007-07-27
21 Dec 2020,2020-12-21
20320614213540313,2032-06-14
22/14-2028,2028-07-22
2024|08|08,2024-08-08
"December 26, 2004",2004-12-26
1937062800000000,2031-05-21
1996-08-04T18:07:24+00:00,1996-08-04
9 tháng 9 năm 2029,2029-09-09
2-5-2019,2019-05-02
01 08 2010,2010-01-08
26 tháng 2 năm 2033,2033-02-26
26 January 2033,2033-01-26
Event at 2021-03-21T17:53:25,2021-03-21
20201019180043,2020-10-19
2020-10-03T23:11:45Z+3,2020-10-03
7_2_2019,2019-02-07
1993-08-26T15:06:43.016622746Z,1993-08-26
2026-09-09T20:09:56,2026-09-09
1997_01_10,1997-01-10
1 Dec 2029,2029-12-01
20310501100253300,2031-05-01
Event at 2013-05-08T7:7:44,2013-05-08
2013-01-29T16:54:24Z+3,2013-01-29
1991_11_19T1_7_15Z,1991-11-19
30.08.24,2024-08-30
2013 10 14,2013-10-14
23_1_2029,2029-01-23
2000-04-07T16:47:49.566797315Z,2000-04-07
2033_01_21T19_51_38-0330,2033-01-21
2020-02-18T22:11:55Z+3,2020-02-18
19910628184455620,1991-06-28
17/2-2021,2021-01-17
28 March 1997,1997-03-28
1643734800000,2022-02-02
2000/2/23T213151,2000-02-23
27/11/06,2006-11-27
2-11-2016,2016-11-02
10.10.2030T22-5-2,2030-10-10
1992-05-03T10:50:46.184238Z,1992-05-03
22-1-2033,2033-01-11
2019/12/1T105925,2019-12-01
3/4/2013,2013-04-03
"10th of October, 2019",2019-10-10
The system recorded 20010316053452,2001-03-16
29/20-2018,2018-10-29
16-6-2033,2033-06-08
20071214011410,2007-12-14
20090825020124623,2009-08-25
747766800,1993-09-12
18-12-2033,2033-12-18
Ngày 19-1-1995,1995-01-19
20330911042849,2033-09-11
995734800000000000,2001-07-22
27.4.2031T7-46-16,2031-04-27
2020-06-19T06:21:50+2500,2020-06-19
12.4.2006T6-55-48,2006-04-12
20170615031007,2017-06-15
20101214134945,2010-12-14
1123261200000000,2005-08-06
7-12-2001,2001-12-07
20250413215845391,2025-04-13
27|02|98,1998-02-27
20310330003157630,2031-03-30
1993-05-01T08:47:01+2500,1993-05-01
19990921193059787757164,1999-09-21
Ngày 10-4-2011,2011-04-10
1/5/2004,2004-05-01
ngày 23 tháng 12 năm 2033,2033-12-23
20110709185559,2011-07-09
1620838800000000,2021-05-13
02_13_2006,2006-02-13
15/6/2035 giờ 1:53:7,2035-06-15
20210720233136038506827,2021-07-20
646938000000000000,1990-07-03
1999/3/13T4547,1999-03-13
The system recorded 20050724220201,2005-07-24
2000-07-13T03:03:32Z+3,2000-07-13
15/3/2007 giờ 12:40:23,2007-03-15
2008-05-28T11:18:38.997931Z,2008-05-28
26/10-2016,2016-05-26
2015_07_31T3_13_36Z,2015-07-31
2004.06.26,2004-06-26
The system recorded 20020923063705,2002-09-23
